id,created_at,text
1259262813752692700,Sat May 09 23:23:45 +0000 2020,With respect, this is the opposite of the truth.  Iran is restarting dangerous elements of its nuclear program that… https://t.co/ZIdRsz6UMI
1259236662741172200,Sat May 09 21:39:50 +0000 2020,Worthy of your time:  Americans should actually give a damn about the rest of the world | TheHill https://t.co/TnQqEaB3cr
1259199179659849700,Sat May 09 19:10:53 +0000 2020,Opposites... https://t.co/rx2VVWNjtS
1259116529901277200,Sat May 09 13:42:28 +0000 2020,If you read one thing this weekend: Other countries are winning against the virus. We are quitting. - The Washingto… https://t.co/AogVwzzS2J
1258038509073563600,Wed May 06 14:18:48 +0000 2020,This is genius: https://t.co/m6fsBYsxn5
1257885224136032300,Wed May 06 04:09:42 +0000 2020,@KurtLMeyer Thank you!
1257884099487977500,Wed May 06 04:05:14 +0000 2020,Moment of zen... https://t.co/xfnBcERmPL
1257731756230422500,Tue May 05 17:59:52 +0000 2020,This speaks volumes... https://t.co/EB9gungbW0
1257416732307832800,Mon May 04 21:08:05 +0000 2020,Pleased to join the News Hour on PBS tonight to talk about COVID 19, China and President Trump. Thanks to Rebecca H… https://t.co/pCiBO9hlIJ
1256227246123225000,Fri May 01 14:21:29 +0000 2020,April is truly the cruelest month this year. It didn’t have to be... https://t.co/Q1KXh531Me
1251885884401737700,Sun Apr 19 14:50:28 +0000 2020,@ron_fournier @marcthiessen Adding our prayers as well.  Every good vibration.
1251885327507169300,Sun Apr 19 14:48:15 +0000 2020,Exactly: https://t.co/4E4fpwrsK4
1251884857447325700,Sun Apr 19 14:46:23 +0000 2020,RT @JoeNBC: This is the most devastating political ad I’ve seen in years. It reveals the truth about Trump and China, and that truth is ugl…
1251722813972648000,Sun Apr 19 04:02:29 +0000 2020,As requested: https://t.co/Hwrk9Etuv4 https://t.co/8PVfLT2Zxs
1250765348326051800,Thu Apr 16 12:37:51 +0000 2020,With respect he did not.  He called the Muslim ban xenophobia.  Not the travel restrictions on China, which came af… https://t.co/G4EdvJhpd2
1250505995660464000,Wed Apr 15 19:27:17 +0000 2020,Pretty much anything by Aimee Mann. https://t.co/T21O9IjR94
1250505588762644500,Wed Apr 15 19:25:40 +0000 2020,What a wonderful endorsement.... https://t.co/Zx7aLZeGrJ
1249886180893753300,Tue Apr 14 02:24:21 +0000 2020,If you read one thing today... An amazing thread. https://t.co/pFdg2ZVk5X
1249356361449844700,Sun Apr 12 15:19:03 +0000 2020,For your Sunday reading... Opinion | Joe Biden: My Plan to Reopen America After the Coronavirus - The New York Times https://t.co/nAFajjshPA
1248967294375649300,Sat Apr 11 13:33:02 +0000 2020,An important piece to help us think about America’s role in the post-COVID 19 world. https://t.co/uEKCjwoiq8
1248962849180876800,Sat Apr 11 13:15:22 +0000 2020,In times of national trial there is no greater source of inspiration than Lincoln. Ted Widmer’s On the Verge is the… https://t.co/WG9gwzkQFR
1248824897066893300,Sat Apr 11 04:07:12 +0000 2020,Keep the faith.. https://t.co/0x4w8390Mc
1248823951016501200,Sat Apr 11 04:03:26 +0000 2020,Projection: a defence mechanism in which the ego defends itself against unconscious impulses by denying their exist… https://t.co/FaB0WVQodA
1247616009491681300,Tue Apr 07 20:03:30 +0000 2020,RT @davidaxelrod: And as you listen to him denigrate reporters, remember what @realDonaldTrump told Lesley Stahl in 2016 about why he attac…
1247534543201906700,Tue Apr 07 14:39:47 +0000 2020,It was predictable... and predicted. https://t.co/8ToPWAQGPw
1247189447269126100,Mon Apr 06 15:48:30 +0000 2020,The choice is clear... https://t.co/enSWfXTcbQ
1246825060813463600,Sun Apr 05 15:40:34 +0000 2020,If you need a little uplift... https://t.co/BlhzXRJY7r
1246816858310836200,Sun Apr 05 15:07:58 +0000 2020,Thank you Dr. Rosenberg — and all the docs,nurses and first responders putting their lives on the line to save othe… https://t.co/leOsKVzJI4
1246279582971498500,Sat Apr 04 03:33:01 +0000 2020,President Trump said no one could have predicted the Coronavirus.  Maybe he should not have eliminated a program li… https://t.co/fU4ioi9n3G
1246118789026021400,Fri Apr 03 16:54:05 +0000 2020,Thank you Bill Withers for bringing so much beauty into the world — and for so many lovely days graced by your music.
1246112389189251000,Fri Apr 03 16:28:39 +0000 2020,Worth your time: How Tea Party Budget Battles Left the National Emergency Medical Stockpile Unprepared for Coronavi… https://t.co/tRMq8Qostv
1246060269455003600,Fri Apr 03 13:01:33 +0000 2020,The outsized role immigrants play in keeping us going.... Thank you — you truly make America great.  https://t.co/CqmLpDR4Fr
1245543715747356700,Thu Apr 02 02:48:57 +0000 2020,And this: “One example of a major Democrat who took this seriously would be Joe Biden...Biden wrote an op-ed on Jan… https://t.co/g6rXs5gMy1
1245338750911119400,Wed Apr 01 13:14:30 +0000 2020,And yet: won’t get fooled again? https://t.co/kqlMnp4gds
1245174763703742500,Wed Apr 01 02:22:52 +0000 2020,Please take a moment to watch this — and share it. https://t.co/bQipAPL5UT
1244315139312095200,Sun Mar 29 17:27:02 +0000 2020,Thank you Mr. Woolsey and all the truckers who keep us going.  via @NYTimes https://t.co/IbvENIwh7P
1244256328245284900,Sun Mar 29 13:33:20 +0000 2020,RT @AmbassadorRice: Please. Read. This. Thread👇🏽
1243706362032459800,Sat Mar 28 01:07:58 +0000 2020,Irony lives! Coronavirus: Mexicans demand crackdown on Americans crossing the border - BBC News https://t.co/OkH1smuiOr
1243566698252337200,Fri Mar 27 15:52:59 +0000 2020,Sometimes humor is the best “antidote”. With apologies for the language this cuts to the heart of things: https://t.co/PSIMlJOdUr
1242637111397924900,Wed Mar 25 02:19:09 +0000 2020,@smokestacklite @aarondmiller2 Also check out a wrung out, pained but beautiful take on the live EC Was Here.
1242603368612352000,Wed Mar 25 00:05:04 +0000 2020,A global crisis demands a global response — and the US should be leading not AWOL. https://t.co/EYlUw98cn4
1242467497036710000,Tue Mar 24 15:05:09 +0000 2020,Team Biden very pleased to have this endorsement from a dynamic, nonpartisan group of foreign policy leaders. https://t.co/x4ChvzV5jt
1242128999414935600,Mon Mar 23 16:40:05 +0000 2020,This on January 27: https://t.co/WAtOsS0iwP
1241423551036559400,Sat Mar 21 17:56:53 +0000 2020,THIS is must-see t.v.  Please give it a view and share it. https://t.co/FZuKil5Gdv
1241365376484683800,Sat Mar 21 14:05:43 +0000 2020,RT @RichardMNephew: Winner of today's understatement award: "Some American officials now admit that the killing of General Suleimani has no…
1241052136793878500,Fri Mar 20 17:21:01 +0000 2020,Apparently there is an even bigger shortage of empathy than there is of tests and protective equipment. At least we… https://t.co/5975p30nAm
1240771216404893700,Thu Mar 19 22:44:45 +0000 2020,RT @natsecaction: Trump failed to prepare America for the coronavirus pandemic, failed to inform the public, and failed to adequately respo…
1240354861910241300,Wed Mar 18 19:10:18 +0000 2020,With respect, please take a few minutes to read Joe Biden’s platform (@joebiden.com) which would make him the most… https://t.co/YewrDyFQ3X
1240345924301357000,Wed Mar 18 18:34:47 +0000 2020,In these challenging times here’s a moment of beauty and joy. Thank you, Mimumiu. https://t.co/AvNShMDRoq
1239369051052408800,Mon Mar 16 01:53:02 +0000 2020,David — how about a little credit to the VP for a commanding performance. Just saying... https://t.co/Ynv5FoePsE
1239275608611459000,Sun Mar 15 19:41:44 +0000 2020,Our first president could not tell a lie. Our current president cannot tell the truth - about anything. https://t.co/R3NviPiGEz
1238610659782414300,Fri Mar 13 23:39:28 +0000 2020,“I take no responsibility...” https://t.co/TRyBDMk1F4
1238584691009245200,Fri Mar 13 21:56:16 +0000 2020,“I don't take responsibility at all," President Trump said, when asked if he took responsibility for the United Sta… https://t.co/F0pO5kUDlO
1238268802959380500,Fri Mar 13 01:01:03 +0000 2020,Gotta love this: https://t.co/LInbivB8DZ
1238115284860522500,Thu Mar 12 14:51:01 +0000 2020,President Trump called the Coronavirus outbreak an unforeseeable event.  He is wrong. Some did foresee the likeliho… https://t.co/uatsUtxEIN
1237946225544003600,Thu Mar 12 03:39:14 +0000 2020,.... and then blames the “other” (in this case Europe!) instead of his own incompetence.  Always takes credit (for… https://t.co/2FcRdmTziM
1237935421134430200,Thu Mar 12 02:56:18 +0000 2020,Seems, alas, like the right time to retweet this: https://t.co/K0itUsnMMN
1237106122915549200,Mon Mar 09 20:00:58 +0000 2020,January 2019: “No administration in modern memory has been less prepared to deal with a crisis than this one”… https://t.co/RFfE6xQrNf
1235928359735091200,Fri Mar 06 14:00:58 +0000 2020,With respect — and I write this as a senior advisor to the Biden campaign — Sen. Warren attracted a remarkable grou… https://t.co/P8kvqfS0z5
1235048932276764700,Wed Mar 04 03:46:26 +0000 2020,This: https://t.co/gMTBOvDonU
1235022118779142100,Wed Mar 04 01:59:53 +0000 2020,RT @joelockhart: The Democratic "establishment" is not delivering wins for Biden tonight -- Democratic voters are doing it.  Blacks, Latino…
1234578623769784300,Mon Mar 02 20:37:35 +0000 2020,So pleased and proud to have my friend of 25 years, comrade-in-arms (and former boss!) on Team Joe. No one is tough… https://t.co/5u38d0CRFT
1234290540843237400,Mon Mar 02 01:32:51 +0000 2020,RT @samstein: Joe Biden can now run as the youngest male candidate left in the field.
1234143793991082000,Sun Mar 01 15:49:44 +0000 2020,RT @JoeBiden: Yesterday this campaign raised $5M online, including from tens of thousands of new supporters. You did that. Together, we wil…
1233961064016072700,Sun Mar 01 03:43:38 +0000 2020,RT @thematthill: .@AndrewYang: "If Bernie represents anger and revolution, Bloomberg represents wealth and managerial competence ... I feel…
1233862298902651000,Sat Feb 29 21:11:10 +0000 2020,Not surprising if you believe the Corona virus is caused by drinking Mexican beer.  Or is that a hoax? https://t.co/fU9Hf1FPMf
1233816660009791500,Sat Feb 29 18:09:49 +0000 2020,I agree! https://t.co/9OeasoKTEB https://t.co/yZ4X6AeMe2
1232850881734946800,Thu Feb 27 02:12:10 +0000 2020,A powerful example of leading with strength, vulnerability  and empathy, not by bluster and division. https://t.co/zUXEDHRvly
1232523857308856300,Wed Feb 26 04:32:41 +0000 2020,“There’s such a fine line between clever and stupid” Nigel Tufnel. https://t.co/EXPt7Rm1ur
1232450789584425000,Tue Feb 25 23:42:20 +0000 2020,As Joe Biden said a few weeks ago at the outset of the coronavirus: Especially in times of crisis a president’s cre… https://t.co/kIhQUWLZQU
1231656372774850600,Sun Feb 23 19:05:36 +0000 2020,RT @SimonWDC: So Trump apparently did more than just Tweet Sanders on - he dropped a big negative Spanish language buy on Biden in Nevada’s…
1231453237871509500,Sun Feb 23 05:38:25 +0000 2020,Alternative hypothesis? If S. Carolina had been first Biden would have won easily.  The entire  dynamic would have… https://t.co/niJJ0OOTak
1231363008095555600,Sat Feb 22 23:39:53 +0000 2020,RT @HotlineJosh: The only moderate candidate that will have any credible chance against Sanders is one who’s running competitively with non…
1231098122111275000,Sat Feb 22 06:07:19 +0000 2020,Latino support for Sen. Sanders is hard to square with his immigration record — backing the anti-immigrant vigilant… https://t.co/ULLj0PuppY
1230914865931473000,Fri Feb 21 17:59:07 +0000 2020,Joe Biden did just that.  The only one to raise gun violence in the debate — in Nevada, site of the worst mass shoo… https://t.co/ZhOQCqGah8
1230653020934770700,Fri Feb 21 00:38:39 +0000 2020,RT @latinovictoryus: BREAKING: Today we're proud to announce our endorsement of VP @JoeBiden for President of the United States.   VP Biden…
1230590218333352000,Thu Feb 20 20:29:05 +0000 2020,RT @RonaldKlain: For the 200th time, if beating Trump matters, @JoeBiden is your candidate.
1230572184877158400,Thu Feb 20 19:17:26 +0000 2020,Before he was a candidate Joe Biden led the Trans Atlantic Commission on Election Integrity and drafted a pledge fo… https://t.co/USTs6yJWJC
1230566732546240500,Thu Feb 20 18:55:46 +0000 2020,RT @KBeds: All the money in the world can’t explain why Mayor Bloomberg didn’t have President Obama’s back in 2008 or why he called ObamaCa…
1230348793549189000,Thu Feb 20 04:29:45 +0000 2020,If memory serves there were 46 votes for cloture, Ds controlled both houses  &amp; President Bush was in favor — so thi… https://t.co/liDtGJBeYN
1230342756767133700,Thu Feb 20 04:05:46 +0000 2020,RT @shannonrwatts: .@JoeBiden makes the first reference to gun violence - a crisis that kills over 100 Americans every day and injures many…
1230341874512097300,Thu Feb 20 04:02:16 +0000 2020,RT @JRubinBlogger: Biden very tough tonight and focused. Maybe his best debate.
1230331881985462300,Thu Feb 20 03:22:33 +0000 2020,RT @EJDionne: Amazing how different this #DemDebate is from New Hampshire. In that one, Klobuchar was dominant. This time, Klobuchar has fa…
1230329100981522400,Thu Feb 20 03:11:30 +0000 2020,RT @robertwolf32: This has been @JoeBiden ‘s best debate  He’s been the adult on stage
1230325484199612400,Thu Feb 20 02:57:08 +0000 2020,RT @jeffzeleny: Lost in all of this yelling is the fact that @JoeBiden is also having a strong debate tonight.
1230170974731063300,Wed Feb 19 16:43:10 +0000 2020,And while we’re at it:  Sasha and Matt are both class acts, great colleagues and real thought leaders.  As Aretha s… https://t.co/WVV3wllwyT
1229894119494946800,Tue Feb 18 22:23:03 +0000 2020,Please share.... https://t.co/l66oK9vBMn
1229550327474643000,Mon Feb 17 23:36:56 +0000 2020,Believe! https://t.co/6dOPUDadJj
1229440538321051600,Mon Feb 17 16:20:40 +0000 2020,Our first president could not tell a lie. Our current president cannot tell the truth — about anything. https://t.co/fpk2TuGRMs
1229438296411050000,Mon Feb 17 16:11:46 +0000 2020,President Obama also entrusted Vice President Biden with leading the effort.  Together President Obama and Vice Pre… https://t.co/41ktakukgO
1229153677811888000,Sun Feb 16 21:20:48 +0000 2020,Important clarification.... https://t.co/fQm1lnbVoY
1228701579643150300,Sat Feb 15 15:24:19 +0000 2020,RT @TomJawetz: .@JoeBiden had a great, nuanced, passionate interview with @jorgeramosnews tonight.  Biden spoke with real appreciation for…
1228424975780061200,Fri Feb 14 21:05:11 +0000 2020,And on to South Carolina... https://t.co/1qndUWqWqs
1228008203490820000,Thu Feb 13 17:29:05 +0000 2020,And it’s on to Nevada! https://t.co/VsPIcTEn0z
1227418537167401000,Wed Feb 12 02:25:58 +0000 2020,Only two  numbers matter tonight: 99.9 and 99.8. That’s the percentage of African American and Latino voters, respe… https://t.co/jAds8B2aLa
1227246429711851500,Tue Feb 11 15:02:04 +0000 2020,We know who President Trump fears the most. He got himself impeached trying to stop his candidacy.... https://t.co/d03zXwPVgf
1226883179623145500,Mon Feb 10 14:58:39 +0000 2020,Thought experiment: imagine if South Carolina or some other state actually representative of the democratic elector… https://t.co/lec5RS88ju
1226652367195721700,Sun Feb 09 23:41:29 +0000 2020,This is important. 39 of the 41 House seats we flipped in 2018 were in moderate districts.  If we want to hold the… https://t.co/DHdosjq7ur
1226644151057428500,Sun Feb 09 23:08:50 +0000 2020,RT @ktumulty: Here in Hampton @JoeBiden is as compelling as I have heard him in this entire campaign. He’s talking to people about their li…
1225984413793648600,Sat Feb 08 03:27:16 +0000 2020,RT @jmpalmieri: .@JoeBiden has had a good night. Have to believe this will help keep some support that might otherwise got to @PeteButtigie…
1225971320506212400,Sat Feb 08 02:35:14 +0000 2020,RT @JRubinBlogger: Biden with his back against the wall is having an excellent debate. He's strong on foreign policy and playing the experi…
1225970495494987800,Sat Feb 08 02:31:58 +0000 2020,Really bringing it! https://t.co/IcG0tsiVAU
1225968632452219000,Sat Feb 08 02:24:34 +0000 2020,RT @thematthill: Tonight there's one candidate on that stage who has taken on the gun lobby twice and won: @JoeBiden.   ✅ Lead on the Brady…
1225967155218468900,Sat Feb 08 02:18:41 +0000 2020,RT @KlandriganUL: .@JoeBiden on U.S. soldiers hurt by Iran air strikes. "Here’s what happened; they received traumatic brain injury. What d…
1224669777240739800,Tue Feb 04 12:23:22 +0000 2020,“At this moment for our fragile democracy Joe Biden is the President we need.”  Caroline Kennedy. Joe Biden for pre… https://t.co/MoohrNBd0L
1224492550377046000,Tue Feb 04 00:39:08 +0000 2020,RT @JoeBiden: Iowa — if you’re in line at your caucus location by 7 PM CT, you can caucus! https://t.co/oQ2918WP95
1224422366622703600,Mon Feb 03 20:00:15 +0000 2020,Adam Schiff’s closing argument is one of the most stirring, eloquent, powerful and persuasive arguments I’ve ever h… https://t.co/Fgbp3Slzl3
1224387009122357200,Mon Feb 03 17:39:45 +0000 2020,Thank you Mirnes! It starts today with the wonderful Bosnian American community here in Iowa. https://t.co/lSvWjPaE1A
1224383695609614300,Mon Feb 03 17:26:35 +0000 2020,If you’re looking for the antithesis of President Trump.... https://t.co/CT8J6Iqywh via ⁦@nytopinion⁩
1224069106166575000,Sun Feb 02 20:36:31 +0000 2020,RT @ReufBajrovic: .@ABlinken campaigning for @JoeBiden in Des Moines among the Bosnian Americans. Big enthusiasm for Biden because of his r…
1224057820624101400,Sun Feb 02 19:51:40 +0000 2020,Great conversation with leaders of Bosnian American and Muslim American communities in Des Moines - and gratified t… https://t.co/aifxAySq6V
1223834915365703700,Sun Feb 02 05:05:56 +0000 2020,Grateful for the hospitality of Iowan friends.  Including leaders of the Syrian American community this evening in… https://t.co/wHwqIBJXlN
1223663373109334000,Sat Feb 01 17:44:17 +0000 2020,For a serious moment of levity: a brilliantly funny and eerily prescient column by the great Dave McKenna from 20 y… https://t.co/q95oYB8RYC
1223645576111280000,Sat Feb 01 16:33:34 +0000 2020,Please consider sharing this with friends in Iowa and anyone who cares about our farmers. https://t.co/OFF05JCkI1
1223411976312893400,Sat Feb 01 01:05:19 +0000 2020,“What does it profit a man to win the world but lose his soul?” https://t.co/NKAm8qK7lo
1223356317525512200,Fri Jan 31 21:24:09 +0000 2020,Character matters... more than ever. https://t.co/CtZDdgoTN2
1223283141177233400,Fri Jan 31 16:33:23 +0000 2020,The “new” wall is “virtually impenetrable” — President Trump. BBC News - Trump's wall: Winds blow over section of U… https://t.co/VKKKPgqw0K
1222623240465547300,Wed Jan 29 20:51:10 +0000 2020,For the record Joe Biden helped draft such a pledge a year + ago as member of Transatlantic Commission on Election… https://t.co/bbHvyOJgL9
1222182277096013800,Tue Jan 28 15:38:56 +0000 2020,It bears constant repeating:  Joe Biden led the bi-partisan,  international fight against corruption in Ukraine to… https://t.co/BYSncmffHG
1221854784380133400,Mon Jan 27 17:57:36 +0000 2020,As Diana Ross might say: Ain’t No Wall High Enough...Joe Biden: Trump is worst possible leader to deal with coronav… https://t.co/HMLuBmkHKj
1220780997932933000,Fri Jan 24 18:50:45 +0000 2020,So proud of and thankful for this amazing group of Fellows from across the country and the many great volunteers fr… https://t.co/qUU37qwie4
1220350512886841300,Thu Jan 23 14:20:09 +0000 2020,Joe Biden on a post-Trump foreign policy.  https://t.co/sradQ1pUri
1220122356993097700,Wed Jan 22 23:13:33 +0000 2020,She has perfected the art of the steal. https://t.co/mNK1jHsuOu
1219775184187555800,Wed Jan 22 00:14:00 +0000 2020,No, my bad. I guess President Trump’s itchy twitter finger is contagious. https://t.co/9o2g29Y52a
1219769690903470000,Tue Jan 21 23:52:11 +0000 2020,Loren — my ire was aimed at the article... never you! https://t.co/Nat4GxKoiQ
1219765480010940400,Tue Jan 21 23:35:27 +0000 2020,What’s depressing is this totally upside down hit on Biden who has been  lambasting President Trump for ditching th… https://t.co/6dQvgy0IKA
1219758252499591200,Tue Jan 21 23:06:44 +0000 2020,If you only watch one video this week.... https://t.co/ptfXeEntMK
1219302716184432600,Mon Jan 20 16:56:35 +0000 2020,RT @jonathanvswan: Certainly a better reflection of how Dem voters feel about the candidates
1218768928312320000,Sun Jan 19 05:35:30 +0000 2020,This: https://t.co/UZvBCpkyAU via ⁦@nytopinion⁩
1218306980466524200,Fri Jan 17 22:59:53 +0000 2020,RT @JoeBiden: We need a president who respects our troops — and who will restore honor and integrity to the Oval Office. https://t.co/q9o1d…
1218306916763545600,Fri Jan 17 22:59:38 +0000 2020,RT @JoeBiden: Donald Trump says he prefers war heroes who "weren't captured." He attacks Gold Star families. Now he calls our generals “los…
1217292985462919200,Wed Jan 15 03:50:38 +0000 2020,The antithesis of our current president... https://t.co/p0KwXQH49F
1217291492622045200,Wed Jan 15 03:44:42 +0000 2020,Brad — at long last, have you no sense of decency? https://t.co/2lOtXZ8dHh
1217280470028902400,Wed Jan 15 03:00:54 +0000 2020,RT @AndrewBatesNC: Who do Democratic primary voters trust the most to be commander-in-chief? Joe Biden - by a longshot. https://t.co/0NkwA8…
1217252051874467800,Wed Jan 15 01:07:59 +0000 2020,A must watch: how President Trump’s disastrous decision to walk away from the Iran nuclear deal brought us to the b… https://t.co/j6dQpwIF8T
1217190848661786600,Tue Jan 14 21:04:47 +0000 2020,So keep on playing those mind games, forever... https://t.co/OInTNKOdHp
1216831933981888500,Mon Jan 13 21:18:35 +0000 2020,Not to mention the equally offensive suggestion democrats support terrorists.  Like bin Laden? https://t.co/dXD9jFA45p
1215826715865440300,Sat Jan 11 02:44:12 +0000 2020,RT @JoeBiden: Make no mistake: the situation with Iran is a crisis of Donald Trump's own making. He brought us to the brink of war with no…
1215076433753727000,Thu Jan 09 01:02:51 +0000 2020,Especially in matters of war and peace, a president’s credibility is his or her most valuable asset. Here too, Pres… https://t.co/npwRmN4dxu
1214746820540280800,Wed Jan 08 03:13:05 +0000 2020,With respect, please take a few minutes to listen to Joe Biden’s talk from earlier today —before the missile attack… https://t.co/Nd6zGoZaZo
1213670091222667300,Sun Jan 05 03:54:33 +0000 2020,How will President Trump handle an actual foreign policy crisis? Seems like a good time to recirculate this piece f… https://t.co/48LtDCddjV
1212959794186858500,Fri Jan 03 04:52:05 +0000 2020,RT @JoeBiden: My statement on the killing of Qassem Soleimani. https://t.co/4Q9tlLAYFB
1209502845931790300,Tue Dec 24 15:55:24 +0000 2019,The bottom line: Joe Biden led the fight against corruption in Ukraine to advance our national interest.  President… https://t.co/tuZpNgUdff
1209287176455966700,Tue Dec 24 01:38:24 +0000 2019,A fitting, vibrant tribute to one of the greatest rock albums of all time.  Almost 50 years old and still gut wrenc… https://t.co/fcbXFqZ2C8
1207882991374086100,Fri Dec 20 04:38:41 +0000 2019,RT @thematthill: "@JoeBiden tonight looked like a frontrunner, he fought like a frontrunner, he sounded like a frontrunner, and he deserves…
1207871448334897200,Fri Dec 20 03:52:49 +0000 2019,Smart, experienced, profoundly decent.  Great for the Department — and the country. https://t.co/TNyzEFR5Ww
1202404354164179000,Thu Dec 05 01:48:32 +0000 2019,Welcome home... https://t.co/ojZFXlTlBQ
1202216235242590200,Wed Dec 04 13:21:01 +0000 2019,RT @RonaldKlain: As many of us have long argued, the Wall's "state of the art" 13th century technology is easily defeated by the 14th's cen…
1197912776800395300,Fri Nov 22 16:20:36 +0000 2019,If you have time to read one piece this weekend please consider this.  It’s moving and revelatory and whatever your… https://t.co/BIYH2IvIin
1197373061265268700,Thu Nov 21 04:35:58 +0000 2019,David — ok I’m biased but Joe Biden’s strong answers on  M4A, prosecuting Trump, North Korea and Saudi Arabia among… https://t.co/uchGZRm1Te
1197346307804979200,Thu Nov 21 02:49:40 +0000 2019,RT @EJDionne: Very good, quick on his feet response by @JoeBiden to @maddow question about whether he’d prosecute #Trump. Biden says it sho…
1197346174094790700,Thu Nov 21 02:49:08 +0000 2019,RT @cenkuygur: Really good answer by @JoeBiden on prosecuting Trump - Justice Department needs to make an independent decision on that. #De…
1197340887455555600,Thu Nov 21 02:28:07 +0000 2019,RT @adrienneelrod: .@JoeBiden saying what defenders of Obama-era policies hoped he'd say in the previous debate: providing a succinct artic…
1197173761595891700,Wed Nov 20 15:24:01 +0000 2019,In sum so far: Joe Biden led the fight against corruption in Ukraine to advance the national interest. President Tr… https://t.co/7e2cpVTWil
1190253134867767300,Fri Nov 01 13:03:55 +0000 2019,This is the truth.... https://t.co/ByXLCCdQuB
1189699372738654200,Thu Oct 31 00:23:28 +0000 2019,Great conversation with the always thoughtful and insightful David Rothkopf. And one tidbit of historical trivia hi… https://t.co/zehkDXFCP0
1189344254189023200,Wed Oct 30 00:52:21 +0000 2019,Ready on day one.... https://t.co/4CV4JD7AIn
1188247184409596000,Sun Oct 27 00:12:59 +0000 2019,A man/woman’s best friend.... https://t.co/59GlEdTF69
1188147108815212500,Sat Oct 26 17:35:20 +0000 2019,Please share with any friends in Iowa who support the VP... https://t.co/8FttOkyct6
