id,created_at,text
694629980660240400,Tue Feb 02 21:14:27 +0000 2016,RT @UnitedforUkr: This is a clear sign of the enduring commitment by US to European security- @jensstoltenberg https://t.co/fjzok0Nff1 http…
694177394945585200,Mon Feb 01 15:16:02 +0000 2016,RT @adamlashinsky: What the State Department hopes to learn from Silicon Valley via @FortuneMagazine https://t.co/zEnDYv8ikl
693280028038029300,Sat Jan 30 03:50:13 +0000 2016,I've worked w/ @KimDarroch often over the last few years, enough to know he will be excellent ambassador &amp; advocate for #SpecialRelationship
693279016095129600,Sat Jan 30 03:46:12 +0000 2016,Grateful for work @UNRefugeeAgency's Hive is doing to help coordinate, including tracking some of today's ideas: https://t.co/SYurUXRG8w
693271659835306000,Sat Jan 30 03:16:58 +0000 2016,Challenge this immense, this historic, this urgent will not be solved without leadership of an entire generation—this innovation generation.
693271365294534700,Sat Jan 30 03:15:48 +0000 2016,Need even more of these game-changing new ideas—like classrooms on wheels, lessons on podcast— &amp; need new partnerships to spark them.
693270745003077600,Sat Jan 30 03:13:20 +0000 2016,Mapping apps, transport. sharing, employment nets.: some of great ideas sparked by refugee ed tech workshop today. https://t.co/XEdAOvIXzM
693264086067388400,Sat Jan 30 02:46:52 +0000 2016,I always try to meet w/ @exchangealumni on trips abroad. Really enjoyed discussion w/ those currently studying here. https://t.co/IesLbND1jh
693261859680493600,Sat Jan 30 02:38:02 +0000 2016,Modernizing arms control; digital currencies; advances in robotics &amp; AI: examples of issues around the curve w/ massive policy implications.
693261031036981200,Sat Jan 30 02:34:44 +0000 2016,Discussed shared, global need for better bridges b/w innovators &amp; policymakers w/ foreign tech offices &amp; @1776. https://t.co/mp8arKE8Ui
693129665444089900,Fri Jan 29 17:52:44 +0000 2016,Kicking off day-long workshop on education for Syrian refugee children @Stanford w/ range of great problem solvers. https://t.co/qPSyasHvlE
692900170715963400,Fri Jan 29 02:40:48 +0000 2016,Checked out some impressive data visualization efforts @google, including on migration flows from the MIddle East. https://t.co/5yBlkZKSgr
692899375631061000,Fri Jan 29 02:37:39 +0000 2016,Met with some of the hard working Googlers giving their time to find creative solutions for Syrian refugees. https://t.co/gockM8DwRR
692895585355960300,Fri Jan 29 02:22:35 +0000 2016,Dropped by @Stanford this morning for office hours chat on the global landscape with @CondoleezzaRice. https://t.co/BidPaLbaJw
692895233307050000,Fri Jan 29 02:21:11 +0000 2016,RT @USAsiaPacific: Australian Ambassador-designate to the United States @JoeHockey presents his official credentials to @ABlinken. https://…
692425544504315900,Wed Jan 27 19:14:49 +0000 2016,RT @VP: On #HolocaustMemorialDay, we honor the memories of those lost. We pay tribute to survivors. And we recommit to these words: Never a…
690557179699564500,Fri Jan 22 15:30:36 +0000 2016,Welcome release of some Burmese political prisoners. Urge government continue releases &amp; reforms during transition. https://t.co/15lAvnUsXa
689729892783669200,Wed Jan 20 08:43:15 +0000 2016,RT @USEmbassySeoul: Deputy Secretary @ABlinken visited @mofa_kr to discuss a range of bilateral issues. https://t.co/HZKwAimkXD
689728703446814700,Wed Jan 20 08:38:32 +0000 2016,Paik was a family friend, innovative artist, &amp; great Korean-American. An example of the creativity our ppl share. https://t.co/fLNAKleuMX
689728596831780900,Wed Jan 20 08:38:06 +0000 2016,In between meetings on my 3rd trip to Seoul, shared lunch and a laugh with good friend Amb. @mwlippert. https://t.co/vfBGw7znUL
689663519994675200,Wed Jan 20 04:19:31 +0000 2016,RT @USEmbassySeoul: Deputy Secretary @ABlinken  and @ROK_MND Minister Han Min-koo met in Seoul and discussed our close coordination. https:…
689298968019382300,Tue Jan 19 04:10:55 +0000 2016,Good mtgs y'day at critical moment of opportunity for Burma. Look fwd to political transition &amp; continued reforms. https://t.co/F3dC7zQLxM
689297643718201300,Tue Jan 19 04:05:39 +0000 2016,RT @Malinowski: W/ @ABlinken in #Burma welcoming historic dem transition. Called for release of pol prisoners &amp; progress on #Rakhine https:…
688765807602450400,Sun Jan 17 16:52:19 +0000 2016,RT @Denis44: .@BrettMcGurk among finest public servants, tireless patriot. Tirelessly led effort 2 bring our people home. Thanks, Brett.
688580230588559400,Sun Jan 17 04:34:54 +0000 2016,Many thanks to @usembassytokyo for another wonderful visit. Was glad to be in such great company. https://t.co/uHfc0GFToR
688542668239016000,Sun Jan 17 02:05:39 +0000 2016,RT @JohnKerry: Each of the pathways #Iran had toward enough fissile material for a nuclear weapon has been verifiably closed down.
688542646172799000,Sun Jan 17 02:05:34 +0000 2016,RT @JohnKerry: Today marks the moment the #IranDeal has transitioned from ambitious promises on paper to measurable actions in practice.
688542631526289400,Sun Jan 17 02:05:30 +0000 2016,RT @JohnKerry: We welcome @IAEA's report verifying #Iran has completed JCPOA nuclear-related steps. We've reached #ImplementationDay.
688516706151587800,Sun Jan 17 00:22:29 +0000 2016,At the same time, fostering more cooperation on climate change, building global health security, countering violent extremism &amp; more.
688515901742837800,Sun Jan 17 00:19:17 +0000 2016,Top challenge: destabilizing provocations from #DPRK. Risk to our security &amp; rules based int'l order we share interest in upholding.
688515125670768600,Sun Jan 17 00:16:12 +0000 2016,Positive, productive, &amp; practical discussion at US-JPN-ROK trilat on host of transnational challenges that we face. https://t.co/0bjjMyJxtb
688512401797464000,Sun Jan 17 00:05:23 +0000 2016,Amb. @CarolineKennedy &amp; I met w/ Japan VFM Saiki ahead of US-JPN-ROK trilat y'day. A great host, partner, &amp; ally. https://t.co/hAZtaTXFL4
688237478193434600,Sat Jan 16 05:52:56 +0000 2016,Glad @CarolineKennedy guilted me into walking back from lunch - enjoyed seeing some of Tokyo on a beautiful day. https://t.co/YPZxL9FatM
688213806934196200,Sat Jan 16 04:18:52 +0000 2016,ROK VFM Lim graciously hosted our 1st meeting today to continue discussions on unified response to #DPRK nuke test. https://t.co/9aybeJHHDg
687942563983134700,Fri Jan 15 10:21:03 +0000 2016,I also expressed my condolences and sympathies to FM Kishida and the people of Japan for their terrible loss in today's tragic bus accident.
687942318012395500,Fri Jan 15 10:20:04 +0000 2016,Strong solidarity in face of DPRK provocation in mtg tonight in Tokyo w/ Japan FM Kishida, VFM Saiki, &amp; ROK VFM Lim. https://t.co/j3IqrcZzct
687639348620177400,Thu Jan 14 14:16:11 +0000 2016,Enjoyed teaming up with @hhigginbottom for #BigBlockofCheeseDay yesterday. Wouldn’t have wanted to do it provo-lone. https://t.co/4JaUghI6R0
687425856617234400,Thu Jan 14 00:07:50 +0000 2016,RT @AmbassadorPower: To those who welcome refugees like the ones who joined me at @SetonHall, we say thank you. Everyone can play a role: h…
687394210354442200,Wed Jan 13 22:02:05 +0000 2016,Gouda questions. Thanks for the grilling. Wish our time wasn’t so brie-f. #BigBlockOfCheeseDay
687392803463249900,Wed Jan 13 21:56:30 +0000 2016,US, China share interest in regional stability; DPRK greatest source of instability. In Beijing next wk to discuss. https://t.co/ijYCGbxbwq
687389462351982600,Wed Jan 13 21:43:13 +0000 2016,Only Congress can end, but as @POTUS said last night, would consolidate our leadership/credibility in hemisphere. https://t.co/kybBzVvLm2
687388884397895700,Wed Jan 13 21:40:55 +0000 2016,Working closely w/ Afghan &amp; intl. partners at @ResoluteSupport to ensure no safe haven for terrorists.  https://t.co/ejNcgjXKNB
687388364505493500,Wed Jan 13 21:38:51 +0000 2016,2015 agreement w/ China shows promise of cooperation on climate. SE Asia feels strong impact, critical to diplomacy. https://t.co/t6JseebicA
687387775776206800,Wed Jan 13 21:36:31 +0000 2016,W/o refugees, no Google (Sergey Brin). Maybe not next Steve Jobs (Syrian father). Strict screening process.  https://t.co/dKzV2KQekC
687386878564266000,Wed Jan 13 21:32:57 +0000 2016,I'm here and ready to take your questions. #BigBlockOfCheeseDay  https://t.co/d2vuWhKCbD
687365065541038100,Wed Jan 13 20:06:16 +0000 2016,We Americans come from different places, but we work together to give back—that is the great strength of this country.
687364914839683100,Wed Jan 13 20:05:40 +0000 2016,Inspired by his courage despite all he endured. “I believe in the American heart,” he told me. “From the start, I wanted to give back.”
687364671339393000,Wed Jan 13 20:04:42 +0000 2016,Honored to meet Dr. Hamo ahead of #SOTU &amp; welcome him to America. Followed his story @humansofny w great admiration. https://t.co/DlpzdNyMV0
687306191249223700,Wed Jan 13 16:12:20 +0000 2016,RT @DHSgov: We can accept #refugees, and at the same time, ensure our nation’s collective security. #refugeeswelcome #DHSinDearborn
687301428109537300,Wed Jan 13 15:53:24 +0000 2016,Don’t let it slip pasteurize: join @hhigginbottom &amp; I from 4-5 today for foreign policy Q&amp;A on #BigBlockOfCheeseDay. https://t.co/jQYWBgGAld
687273103228022800,Wed Jan 13 14:00:51 +0000 2016,RT @JohnKerry: Peaceful and efficient resolution of this issue is a testament to the critical role diplomacy plays in keeping our country s…
687273076837478400,Wed Jan 13 14:00:45 +0000 2016,RT @JohnKerry: Very pleased that our Sailors have been safely returned to U.S. hands. https://t.co/o6KLh0OzY4
686901846892503000,Tue Jan 12 13:25:36 +0000 2016,In face of unprecedented regional threats, affirmed ironclad US support for Isr. security w/ @IsraelMFA DG Dore Gold https://t.co/fIvXlO7mQb
686695013405847600,Mon Jan 11 23:43:44 +0000 2016,Looking fwd to #BigBlockOfCheeseDay Wednesday w/ @hhigginbottom. Any way you slice it, will be muenster of a day. https://t.co/4vDEFZtkIo
685590927604330500,Fri Jan 08 22:36:29 +0000 2016,RT @statedeptspox: .@StateDept improving efforts to counter violent extremism. CSCC is now the Global Engagement Center. Read more here:htt…
685590642924347400,Fri Jan 08 22:35:21 +0000 2016,Thanks to Silicon Valley leaders for important conversation today on combating violent extremism. https://t.co/WV4vBXaijm
685581412771180500,Fri Jan 08 21:58:40 +0000 2016,Tremendously grateful to whole @StateDept team, working on these issues &amp; so many more every day. As @JohnKerry is fond of saying: onwards.
685581224992194600,Fri Jan 08 21:57:56 +0000 2016,Know new challenges/opportunities will pop up, but important to sustain proactive efforts to provide a more secure/prosperous future.
685580993235914800,Fri Jan 08 21:57:00 +0000 2016,Continue push for Russia/Separatists to fulfill Minsk obligations, support Ukraine’s further reform progress as it pursues European future.
685580850424115200,Fri Jan 08 21:56:26 +0000 2016,Redouble efforts to degrade &amp; defeat #ISIL/#Daesh in Iraq &amp; Syria, take away platform/capacity for vicious attacks.
685580603132145700,Fri Jan 08 21:55:27 +0000 2016,Standing up Innovation Forum @StateDept to build bridge b/w innovators &amp; policymakers to inform foreign policy &amp; spark/accelerate new ideas.
685580456105013200,Fri Jan 08 21:54:52 +0000 2016,Doing more to help solve both root causes &amp; immediate needs of global refugee crisis, esp. youth/education to ensure #nolostgeneration.
685580364522336300,Fri Jan 08 21:54:31 +0000 2016,Continuing to cement progress on Asia rebalance. #DPRK nuke test reinforces importance of strong US presence in Pacific for regional stab.
685580108866928600,Fri Jan 08 21:53:30 +0000 2016,Tomorrow marks 1 yr back @StateDept, 1 yr on Twitter. But for yr ahead, here are a few things I’ll be focusing on (in no particular order):
685269044879061000,Fri Jan 08 01:17:26 +0000 2016,DC dip corps losing two of its finest. @PeterWestmacott and Susie added special flair to special relationship.   https://t.co/OESGaVc0Id
684844813385117700,Wed Jan 06 21:11:41 +0000 2016,RT @JohnKerry: The United States and nations around the world unequivocally condemn North Korea’s latest nuclear test.
684844775200178200,Wed Jan 06 21:11:32 +0000 2016,RT @JohnKerry: US reaffirms our steadfast commitment to allies in the region. Working closely w/partners on UNSC, 6 Party Talks to take app…
684413313254604800,Tue Jan 05 16:37:04 +0000 2016,RT @statedeptspox: #HumanTrafficking breeds corruption, assaults human rights, destabilizes markets. It undermines our foreign policy goals…
682252052702064600,Wed Dec 30 17:28:59 +0000 2015,RT @USUN: .@AmbassadorPower &amp; her family welcome the Al Teibawi family for dinner: https://t.co/J4ulJw1JZM #RefugeesWelcome https://t.co/oN…
681508090911408100,Mon Dec 28 16:12:45 +0000 2015,A lot of work to do together in the region &amp; around the world. Have hope that our cooperation will continue to grow stronger as a result.
681507724836782100,Mon Dec 28 16:11:18 +0000 2015,Encouraged by agreement b/w #Japan &amp; #ROK, two of our most important allies, to heal wounds of the past, build on existing collaboration.
677941447702798300,Fri Dec 18 20:00:11 +0000 2015,Imagine the bravery it takes to leave all you know &amp; start again. We can help: https://t.co/XVd8iYp0lM #refugeeswelcome
677941172493504500,Fri Dec 18 19:59:05 +0000 2015,Tremendous admiration for their courage &amp; strength - traits that have made US exceptional country it is today. https://t.co/rDFAlJ5fJq
677940925151240200,Fri Dec 18 19:58:06 +0000 2015,Greatly honored to spend #IMD2015 w/ immigrants recently resettled in VA from around the world. #iamamigrant https://t.co/hsqiwuO0L8
677900197259817000,Fri Dec 18 17:16:16 +0000 2015,RT @StateDept: .@JohnKerry: On #IMD2015, we pay tribute to those who venture abroad in search of safety, dignity, a better life.  https://t…
677867403624099800,Fri Dec 18 15:05:57 +0000 2015,RT @MiroslavLajcak: Great mtng @StateDept w/@ABlinken,appreciated bilat.cooperation,talked #energy security W/Balkans #Ukraine #refugees ht…
677848093413515300,Fri Dec 18 13:49:13 +0000 2015,RT @USEmbassySK: Reaffirming strong ties between our countries @StateDept Deputy Secretary @ABlinken meets Minister @MiroslavLajcak https:/…
677324333145063400,Thu Dec 17 03:07:59 +0000 2015,Our @State_DRL team rocks hard every day, but really turned it up to 11 today. Happy to join the band for few songs. https://t.co/FnHanbT25i
677267521846845400,Wed Dec 16 23:22:14 +0000 2015,Greatly value partnership w/ Estonia, as I did convo on NATO, Ukraine, counter-ISIL, more w/ FM @MarinaKaljurand. https://t.co/e9DGFXNojO
677216420543995900,Wed Dec 16 19:59:11 +0000 2015,RT @AmbassadorPower: On way to chair historic #UNSC mtg on human trafficking. Will hear powerful accts underscoring need to #EndSlavery: ht…
677194590072516600,Wed Dec 16 18:32:26 +0000 2015,RT @robmalley44: Adam Szubin, (A) U/S of Treasury for Terrorism, discussed financial efforts against ISIL today @WhiteHouse https://t.co/R6…
676399977980149800,Mon Dec 14 13:54:56 +0000 2015,Exchange program alums I met give me great hope, not just for future but today. Already leaders in various fields. https://t.co/dQoY73WQNi
676399367792799700,Mon Dec 14 13:52:30 +0000 2015,2016 will be a critical year for Afghanistan. Terrorist attacks on Spanish Embassy in Kabul on Friday a stark reminder of the high stakes.
676399126184132600,Mon Dec 14 13:51:33 +0000 2015,Followed up on #HeartofAsia convos on reconciliation &amp; development in Kabul w/ @ashrafghani &amp; @DrAAbdullah last wk. https://t.co/EMKkxfIHpt
676189738278236200,Sun Dec 13 23:59:31 +0000 2015,RT @ECA_AS: We mourn Evelyn Lieberman. She was remarkable. The wisest woman I knew and a mentor to so many, including me. I will miss her d…
676054588697550800,Sun Dec 13 15:02:29 +0000 2015,Honored to receive British diplomat Lord Grantham of #DowntonAbbey &amp; delegation to discuss special relationship. https://t.co/lW7dJOVCar
675829462362169300,Sun Dec 13 00:07:54 +0000 2015,Responsibility now on rest of us to implement &amp; fulfill its promise.
675829424193978400,Sun Dec 13 00:07:45 +0000 2015,Congrats to @JohnKerry &amp; other ministers for historic #ParisAgreement reached at #COP21 today.
674964680289468400,Thu Dec 10 14:51:34 +0000 2015,Every day, ties that bind our nations enriched by these students whose numbers continue to grow. Now more than 15k Pakistan exchange alumni.
674963759857799200,Thu Dec 10 14:47:55 +0000 2015,Conversations w/ young people a highlight of every trip I take. Town hall on ed. in Pakistan today no exception. https://t.co/ms0Ax36E3H
674939444038864900,Thu Dec 10 13:11:17 +0000 2015,Esp. impressed w/ women I met who are quite literally building their country: from construction to transportation. https://t.co/uxgFyouQJU
674938904940830700,Thu Dec 10 13:09:09 +0000 2015,Sat down w/ innovative, entrepreneurial exchange alums in Islamabad. Building businesses &amp; bridges b/w our countries https://t.co/wJxotYjYMA
674918948832419800,Thu Dec 10 11:49:51 +0000 2015,RT @pmln_org: American delegation headed by Tony blinken meets with Prime Minister Muhammad Nawaz Sharif. https://t.co/T2KJkCio2N
674463682756218900,Wed Dec 09 05:40:47 +0000 2015,RT @HelgaSchmid_EU: Trilateral meeting AFG-EU-US with FM Rabbani &amp; Dep Sec @ABlinken to prepare 2016 Warsaw and Brussels conf on AFG https:…
674457087959789600,Wed Dec 09 05:14:35 +0000 2015,Strong Afghan ownership and robust international pledges are both critical to sustainable security and stability in Afghanistan.
674456850465730600,Wed Dec 09 05:13:38 +0000 2015,Discussed Afghan reform &amp; governance agenda ahead of 2016 Warsaw &amp; Brussels Confs. w/ @HelgaSchmid_EU &amp; FM Rabbani. https://t.co/EleovbCcRj
674217759736205300,Tue Dec 08 13:23:34 +0000 2015,Thank you for hosting &amp; sharing your insights on how we can better connect policy w/ innovation both in US &amp; India. https://t.co/u2aA10vqQC
674209532042739700,Tue Dec 08 12:50:53 +0000 2015,RT @USAndIndia: Awesome innovations! Thank you, @91springboard Gurgaon, for hosting U.S.-India entrepreneurs and @ABlinken https://t.co/QcG…
674155040563576800,Tue Dec 08 09:14:21 +0000 2015,RT @USAndIndia: .@ablinken &amp; @arvindsubraman explore opportunities for expanded India-U.S. cooperation this morning https://t.co/rrPy2STv0g
674069356519624700,Tue Dec 08 03:33:52 +0000 2015,RT @USAmbIndia: India as a Leading Power: @ABlinken &amp; FS Jaishankar review growing #USIndia coop to safeguard the global commons. https://t…
674026014599569400,Tue Dec 08 00:41:39 +0000 2015,Enjoyed discussions last night on important &amp; increasingly global US-India relationship w/ Foreign Sec. Jaishankar. https://t.co/LWuUHTafWb
673897776992804900,Mon Dec 07 16:12:05 +0000 2015,RT @MEAIndia: Engaging America. Foreign Secretary Jaishankar meets US Deputy Secretary of State Antony Blinken in New Delhi https://t.co/Wm…
672433096613081100,Thu Dec 03 15:11:58 +0000 2015,RT @hhigginbottom: Former national security officials agree, refugees make America stronger and safer https://t.co/6T7HASSmdL #RefugeesWelc…
672379804226863100,Thu Dec 03 11:40:12 +0000 2015,Large cracks in foundation of Daesh "caliphate." Moving forward w/ comprehensive strategy to degrade &amp; defeat them. https://t.co/UeS13iDctj
672059814625861600,Wed Dec 02 14:28:40 +0000 2015,Mourn the passing of Sandy Berger --- father, husband, mentor, friend, leader and great patriot. RIP SRB.
671484600154267600,Tue Dec 01 00:22:58 +0000 2015,RT @JohnKerry: As @BillGates made clear at #COP21, #climatechange not only a challenge, but also opportunity for innovators to build clean …
671472205298016300,Mon Nov 30 23:33:43 +0000 2015,Congrats, Gayle Smith! Strong @USAID critical to nearly every facet of US leadership worldwide. Look fwd to working closely together again.
669599807430918100,Wed Nov 25 19:33:29 +0000 2015,RT @hhigginbottom: Give back while giving thanks. For info on ways you can help #aidrefugees this Thanksgiving at https://t.co/2NsImp6B1y
669264995994218500,Tue Nov 24 21:23:04 +0000 2015,RT @DHSgov: Secretary Johnson explains the process of screening Syrian refugees. WATCH: https://t.co/tb7vHF88q5
669128477191348200,Tue Nov 24 12:20:35 +0000 2015,Important we not lose sight of many chased from homes &amp; lives by Daesh in Iraq. Talked w/ displaced families y'day. https://t.co/A1h2ljAGGK
668913222859247600,Mon Nov 23 22:05:14 +0000 2015,RT @BrookingsInst: .@drydenpeterson explains why education is vital for refugee children in the midst of instability &amp; uncertainty: https:/…
668481507653255200,Sun Nov 22 17:29:45 +0000 2015,RT @IraqiPMO: PM @HaiderAlAbadi received the US Deputy Secretary of State Mr.@ABlinken  and his accompanying delegation. https://t.co/9Xfq9…
668165212349009900,Sat Nov 21 20:32:55 +0000 2015,In Istanbul, heroic Syrian teachers had pwrful reminder: refugee children who teach us abt meaning of humanity. https://t.co/CybjUq7cra
667750742627852300,Fri Nov 20 17:05:57 +0000 2015,Thanked dedicated TU &amp; US servicemen/women fighting Daesh from Incirlik AB for their service to our countries. https://t.co/1REyhqYlWc
667689497291857900,Fri Nov 20 13:02:35 +0000 2015,RT @AtlanticCouncil: WATCH from #Istanbul today—@ABlinken arriving from #Syria border to discuss US Foreign &amp; Energy priorities #ACsummit h…
667464035093364700,Thu Nov 19 22:06:41 +0000 2015,These children still full of hope. Even 8 yr olds I met, who know little but war, look forward to future as doctors back home.
667461125911507000,Thu Nov 19 21:55:07 +0000 2015,Honored to be joined by Gov. Buyuk &amp; other officials to highlight importance of local solutions to this problem. https://t.co/Bm81ztdWs6
667460411919310800,Thu Nov 19 21:52:17 +0000 2015,Saw both challenges for refugee students seeking education &amp; great generosity of the local community trying to make it work.
667459703283273700,Thu Nov 19 21:49:28 +0000 2015,In Adana, Turkey visiting students and staff at a 2nd shift school, which offers young refugees chance to learn. https://t.co/DgIToPZ8Z7
667387308539297800,Thu Nov 19 17:01:48 +0000 2015,All hope to return home someday. Reminder that as we work for peace today, must continue focus on future generation. https://t.co/S5BJtXV3Ax
667386139733553200,Thu Nov 19 16:57:09 +0000 2015,These children are incredibly smart. Can be doctors, poets, singers, next Steve Jobs. But life given them greater challenge to reach dreams.
667385764494360600,Thu Nov 19 16:55:40 +0000 2015,Visited USG-supported Makani Center in Jordan, where Jord., Syrian, Iraqi children getting critical education. https://t.co/3yAzvsMMN8
667371630910439400,Thu Nov 19 15:59:30 +0000 2015,RT @rhodes44: Children and women are most vulnerable victims. They’re the ones we need to and will help. https://t.co/5WKdMV5cPz https://t.…
667371428862406700,Thu Nov 19 15:58:42 +0000 2015,RT @rhodes44: Omar's family and new life in OH: "I feel happy, excited &amp; at peace inside" https://t.co/lK6BWhpAXP #RefugeesWelcome https://…
667353551899902000,Thu Nov 19 14:47:40 +0000 2015,Had coffee late y'day w/ @ECAatState alumni in Jordan, inspired by their dedication to work in and improve their community, US-Jordan ties.
667119015215669200,Wed Nov 18 23:15:42 +0000 2015,Picture book market nonexistent, so Rania started it. Her innovation now helping children learn to love books. https://t.co/gHHC2NwiVf
667118739339522000,Wed Nov 18 23:14:36 +0000 2015,New $365k US grant will support clean energy tech, healthcare, design; target women, youth, underpriv. communities. https://t.co/A67bll9kTT
667118548968427500,Wed Nov 18 23:13:51 +0000 2015,Visited the impressive @Oasis_500 training center in Amman today. First incubator hub of its kind in Jordan. https://t.co/TDWo3Ldwit
666722846496989200,Tue Nov 17 21:01:28 +0000 2015,Final mtg at #APEC2015 w/ China FM Wang Yi. Candid discussion on Syria, maritime sec., &amp; climate prep for #COP21. https://t.co/UV02GMjkEb
666718271589081100,Tue Nov 17 20:43:17 +0000 2015,Sat down w/ AP's @JimSGomez in Manila to talk about #APEC2015, US-Phil. ties, maritime security, and Paris attacks. https://t.co/FklLHm7Rmx
666429782624636900,Tue Nov 17 01:36:56 +0000 2015,Caught up this AM at #APEC2015 w/ great partner &amp; Twitter role model @JulieBishopMP on 🇺🇸/🇦🇺, 🌊 security, CVE. https://t.co/f40e01r4KO
666381965042409500,Mon Nov 16 22:26:55 +0000 2015,RT @StateDept: .@HHigginbottom speaks about bridging the education gap in #Turkey for #refugee children from #Syria and elsewhere. https://…
666101001586257900,Mon Nov 16 03:50:28 +0000 2015,RT @USAsiaPacific: .@ABlinken &amp; #Singapore Snr. Min of State Maliki on sidelines of #APEC. Great partner on security, CVE, rule-of-law. htt…
666071283155759100,Mon Nov 16 01:52:23 +0000 2015,RT @USAsiaPacific: Deputy Secretary @ABlinken will travel to the #Philippines to represent @StateDept at the #APEC Ministerial Meeting http…
665323588895928300,Sat Nov 14 00:21:19 +0000 2015,Aujourd'hui, nous sommes tous Français. En face de la terreur et la haine, nous sommes en solidarité avec le peuple et le gouv. français.
665322759203872800,Sat Nov 14 00:18:01 +0000 2015,Today, we are all French. In the face of terror and hatred, we stand in solidarity with the French people and government. We will prevail.
664107194779099100,Tue Nov 10 15:47:48 +0000 2015,RT @hhigginbottom: Happy Bday &amp; Semper Fi to all Leathernecks who go into harm’s way and guard our embassies/consulates around the world #U…
663837885519499300,Mon Nov 09 21:57:40 +0000 2015,RT @FLOTUS: Raghad is a Syrian refugee going to school in Jordan. Ghusun is her best friend.  Watch their story. #LetGirlsLearn https://t.c…
