id,created_at,text
944070200483295200,Fri Dec 22 05:00:50 +0000 2017,RT @ColinKahl: &lt;THREAD&gt; This is a season of peace, but we need to pause for a minute to talk about war. The greatest security threat in the…
943566396205797400,Wed Dec 20 19:38:54 +0000 2017,Wonderful news, perfect choice: https://t.co/VIV67mbQhB
943292611934281700,Wed Dec 20 01:30:58 +0000 2017,Essential reading from Sally Yates: https://t.co/bnY8hqSVTd
943182232495317000,Tue Dec 19 18:12:22 +0000 2017,Very smart take on the meaning of Alabama:  https://t.co/220mpqzyBT
943134057248018400,Tue Dec 19 15:00:56 +0000 2017,A reminder we’re capable of the best, too. “19 Acts of Heroism in 2017” via @NYTimes https://t.co/ll6ILF5cof
941696339364270100,Fri Dec 15 15:47:57 +0000 2017,Look forward to joining #CNN Wolf Blitzer in the Situation Room at 1pm EST to talk Russia and North Korea and whate… https://t.co/SEOA0L59BS
940946951306137600,Wed Dec 13 14:10:09 +0000 2017,Must read Erlanger/NYT piece: ‘Fake News,’ Trump’s Obsession, Is Now a Cudgel for Strongmen via @NYTimes https://t.co/4kqnEWIQl8
940789176265592800,Wed Dec 13 03:43:13 +0000 2017,Sweet home Alabama https://t.co/UAXEWlos4S
939896679926558700,Sun Dec 10 16:36:45 +0000 2017,RT @PennBiden: Today, we celebrate #HumanRightsDay &amp; the inalienable rights affirmed in the Universal Declaration of Human Rights.   "My da…
939889812961718300,Sun Dec 10 16:09:28 +0000 2017,And as to Merry Christmas: https://t.co/uAp2tGFzV4 https://t.co/V0QVEx3WRs
938070163366252500,Tue Dec 05 15:38:50 +0000 2017,RT @PennBiden: Out today! #PBC's leader @JoeBiden and our Senior Director @mikercarpenter have a powerful piece in the new issue of @Foreig…
936385742598819800,Fri Dec 01 00:05:32 +0000 2017,Some thoughts on Rexit:  How Rex Tillerson Did So Much Damage in So Little Time via @NYTimes https://t.co/QX2wRIXkvx
935988645835747300,Wed Nov 29 21:47:37 +0000 2017,RT @humanrights1st: .@realDonaldTrump continues to place the blame on refugees and immigrants for violent acts. And again, he could not be…
934894702993772500,Sun Nov 26 21:20:41 +0000 2017,And while you’re at it stand up to Putin, stand strong with NATO and support the EU.  And then count to five before… https://t.co/B3A6RqNcCI
934569476636463100,Sat Nov 25 23:48:21 +0000 2017,RT @davidfrum: Inside the US, CNN’s reporting is protected by the First Amendment and the courts. Outside the US, US-affiliated journalists…
932818431581261800,Tue Nov 21 03:50:19 +0000 2017,Happy Birthday, Mr. Vice President. It’s been a great honor to fly along side you.  https://t.co/XzOvW4u8qY:
932804717272543200,Tue Nov 21 02:55:49 +0000 2017,“America’s standing in the world has never been stronger than it is right now .” President Trump 11/15/17. https://t.co/WPb0aqxrp2
931400953936224300,Fri Nov 17 05:57:46 +0000 2017,RT @HumaneSociety: We cannot let this reckless &amp; cruel decision stand.   Sign your name, spread the word, and tell @Interior that you do NO…
930851918712361000,Wed Nov 15 17:36:06 +0000 2017,The best of the best. https://t.co/1Iet5t90Gv
929377292329025500,Sat Nov 11 15:56:28 +0000 2017,#WhatIFoughtFor documents the profound connections of veterans and refugees from @Vets4AmerIdeals https://t.co/EE1vaqBn1c
929037545031196700,Fri Nov 10 17:26:26 +0000 2017,But not values like democracy, human rights, freedom of speech/assembly or progressive norms like protections for w… https://t.co/EHria4Ny4q
929033879209443300,Fri Nov 10 17:11:52 +0000 2017,Actually I said China is asserting itself as leader of world order — but an ILLIBERAL one of its making — in the fa… https://t.co/GWO5hQxXWO
928474236414394400,Thu Nov 09 04:08:02 +0000 2017,Some thoughts on POTUS and Xi: Trump Is Ceding Global Leadership to China via @NYTOpinion https://t.co/Kn5bA5oXYe
927839402876907500,Tue Nov 07 10:05:26 +0000 2017,Timely trip to Beijing on eve of POTUS visit. Great to catch up w/friend and former colleague Zhang Yesui, China’s vice foreign minister.
925524498589405200,Wed Nov 01 00:46:50 +0000 2017,RT @SamanthaJPower: Amid the pain &amp; horror of another monstrous attack, messages of solidarity from friends around the world remind us: we…
924652751782588400,Sun Oct 29 15:02:49 +0000 2017,Nobel is long overdue. https://t.co/SNTDrWNrtS
922952892402847700,Tue Oct 24 22:28:11 +0000 2017,A huge loss for basic decency.  Even when we disagreed it was an honor to work with this man of honor and integrity. https://t.co/0sRfiVvjow
922552268494397400,Mon Oct 23 19:56:15 +0000 2017,A nice reminder of America at its best. https://t.co/DzDri5vxc3
922164069821448200,Sun Oct 22 18:13:41 +0000 2017,Somehow this seems very appropriate to the moment: https://t.co/lGYhvQ3LAz
921077282747363300,Thu Oct 19 18:15:11 +0000 2017,Good read: former President George W. Bush’s remarks at today’s spirit of liberty event in NYC.  https://t.co/A1cOjobqjY
921033769875886100,Thu Oct 19 15:22:17 +0000 2017,Pleased Penn Biden Center partnering w/Bush Institute &amp; Freedom House to build support for democratic principles. https://t.co/zneFS40ZnZ
921032678765486100,Thu Oct 19 15:17:57 +0000 2017,Great conversations today at George W. Bush institute event in NY about challenges to democracy at home &amp; abroad. https://t.co/lzeJOtuBzL
920333777599115300,Tue Oct 17 17:00:46 +0000 2017,RT @CedricLeighton: Joining @wolfblitzer on @CNN w/@barbarastarrcnn &amp; @ABlinken at 1 pm ET to discuss latest on #ISIS Fall of #Raqqa &amp; more…
920262420651790300,Tue Oct 17 12:17:13 +0000 2017,RT @AlyssaMastro44: 18th Chairman of the Joint Chiefs of Staff 👇🏼👇🏼 https://t.co/HoJK5yOwhr
920081298709975000,Tue Oct 17 00:17:30 +0000 2017,Tell that to Osama bin Laden.  Oh wait... https://t.co/nseRV1ABnx
918986428826181600,Fri Oct 13 23:46:53 +0000 2017,Some thoughts on “Trump’s False Narrative on Iran” via @NYTimes https://t.co/1x8L7XN9yT
918951106029539300,Fri Oct 13 21:26:31 +0000 2017,More from Iran convo on CNN’s The Situation Room.  Thanks to Mark Dubowitz for being classy sparring partner.  https://t.co/M6slt0LR7e
918950517224673300,Fri Oct 13 21:24:11 +0000 2017,POTUS decision on Iran nuclear deal risks  playing with fire — and fueling it.  Good convo w/CNN Wolf Blitzer.   https://t.co/1I3vCD4MNe
918877821606465500,Fri Oct 13 16:35:19 +0000 2017,Look forward to joining #CNN Wolf Blitzer at 1 pm EST to talk about POTUS announcement on Iran nuke deal.
918595459026997200,Thu Oct 12 21:53:18 +0000 2017,Known, worked w/Tom 25 yrs.  Great candidate in swing district. Will be strong advocate for district and democracy.  https://t.co/oeI0hH1J8r
918593650178822100,Thu Oct 12 21:46:07 +0000 2017,Kudos to DepSec Sullivan for carrying forward productive trilateral partnership among US, Japan, Korea. https://t.co/9mylL1GpRx
918539038973448200,Thu Oct 12 18:09:07 +0000 2017,RT @brhodes: Another useful reminder that if Trump says Iran isn't complying with the Iran Deal he will be lying https://t.co/VtvFAqwkYB
918293371583717400,Thu Oct 12 01:52:55 +0000 2017,@NBCNews Look forward to joining #CNN Don Lemon at 10pm EST.
917760692748419100,Tue Oct 10 14:36:14 +0000 2017,Look forward to joining #CNN Kate Bolduan in the 11 am hour to talk Iran, North Korea &amp; POTUS.
917561879194689500,Tue Oct 10 01:26:14 +0000 2017,RT @RNicholasBurns: Agree. Ambassador Wendy Sherman shreds President Trump's irresponsible position on the Iran Nuclear Deal. https://t.co/…
916337925431939100,Fri Oct 06 16:22:40 +0000 2017,As the leading consumer &amp; purveyor of fake news, the President  should subject himself to any investigation startin… https://t.co/Puwae4UvgJ
915708232756277200,Wed Oct 04 22:40:30 +0000 2017,Time for the Trump Administration to Arm Ukraine via @NYTimes https://t.co/tJvQqjksu8
915236109273174000,Tue Oct 03 15:24:27 +0000 2017,As Paul McCartney might put it, listen to what the man said: https://t.co/HLBWQW92gS
914523439205093400,Sun Oct 01 16:12:33 +0000 2017,Not good cop/bad cop but rogue cop.  See What the President Really Meant to Say https://t.co/bvpMIb6vqp https://t.co/sHPV9gPZvG
912065570148950000,Sun Sep 24 21:25:51 +0000 2017,RT @PennBiden: The inaugural Penn Biden Leaders Dialogue will feature former VP @JoeBiden &amp; former President of Mexico @FelipeCalderon (Pho…
910871011284914200,Thu Sep 21 14:19:06 +0000 2017,Must read by Bill Burns &amp; Jake Sullivan:  The Smart Way to Get Tough With Iran - https://t.co/cKAVkjO9Ku https://t.co/oJqdiIkQ18
910274932306796500,Tue Sep 19 22:50:30 +0000 2017,Pleased to join Elisha Wiesel for #TalksatGS.  Thanks for great conversation. https://t.co/9wyYdgezy6
909787129819123700,Mon Sep 18 14:32:09 +0000 2017,Look fwd. to joining #CNN Kate Bolduan at 11 am EST to talk POTUS at UNGA.
908858603943157800,Sat Sep 16 01:02:31 +0000 2017,RT @michikokakutani: Since 2000, 31 of the 78 American Nobel Prizes were won by immigrants. via @WSJ https://t.co/G7C1fuvMRp via @WSJ
907990893420056600,Wed Sep 13 15:34:33 +0000 2017,RT @DarylGKimball: 80+ "Arms Control Experts Urge Trump to Honor Iran Nuclear Deal" via @nytimes https://t.co/kyuQCidZWA #IranDeal See http…
906351171471859700,Sat Sep 09 02:58:53 +0000 2017,He don't lie: Clapton brings his blues power to MSG.  Still the one after all these years. https://t.co/s3ymsNTsXT
905246131105521700,Wed Sep 06 01:47:50 +0000 2017,Truth: https://t.co/pcjWyOYMoc
905244813456535600,Wed Sep 06 01:42:36 +0000 2017,More smart analysis from Colin Kahl: https://t.co/wkIccKaH7m
904792279151497200,Mon Sep 04 19:44:24 +0000 2017,Look fwd. to helping kick off academic year tomorrow. https://t.co/AEvJxLaMFN
904776923619971100,Mon Sep 04 18:43:23 +0000 2017,Charles Blow gets to heart of matter. Read it, keep it. Corroding our democracy In Defense of the Truth via @NYTimes https://t.co/fF2pflJWmh
904486711702454300,Sun Sep 03 23:30:11 +0000 2017,Important thread here from Colin Kahl: https://t.co/C0gEICJcGI
904323299278278700,Sun Sep 03 12:40:50 +0000 2017,Exactly right: https://t.co/8E4bPRTVFe
903239984458629100,Thu Aug 31 12:56:08 +0000 2017,The downside of POTUS' itchy twitter finger. "What the President Really Meant to Say" via @NYTimes https://t.co/bvpMIb6vqp
902899837997338600,Wed Aug 30 14:24:31 +0000 2017,RT @AmbassadorRice: Way to put this ill-advised policy directive on the "ho-de-do train", Mr. Secretary https://t.co/XoyrN4As4M
902683491015553000,Wed Aug 30 00:04:49 +0000 2017,Please consider:  Where to Donate to Harvey Victims (and How to Avoid Scams) - https://t.co/cKAVkjO9Ku https://t.co/MnlReiQcRn
902197545732071400,Mon Aug 28 15:53:51 +0000 2017,"We are living through a battle for the soul of this nation." @JoeBiden writes on Charlottesville and its aftermath: https://t.co/2rtsKjFQig
900514598788444200,Thu Aug 24 00:26:25 +0000 2017,One of the best. Privileged to work with him these past 25 years. https://t.co/N0MI5YmDej
898952652419104800,Sat Aug 19 16:59:48 +0000 2017,A voice of decency &amp; reason. Jeff Flake: We Need Immigrants With Skills. But Working Hard Is a Skill. via @NYTimes https://t.co/b5dJuAQ3T7
898193311848058900,Thu Aug 17 14:42:27 +0000 2017,Honored to have worked closely w/Susan at State. A great public servant. Good to see SecState stand by her. https://t.co/lmIKO65DYV
896477344218697700,Sat Aug 12 21:03:49 +0000 2017,A powerful counterpoint to President Trump's pathetic and disgraceful response to bigotry, hatred and racism. We ar… https://t.co/NRVIygquZM
895344879781515300,Wed Aug 09 18:03:48 +0000 2017,Important primer on how POTUS could unintentionally bombast us into war. https://t.co/yn6rlAbQhC
893501166419664900,Fri Aug 04 15:57:33 +0000 2017,Smart &amp; important piece from former CIA deputy director. https://t.co/hB45wNqG5H
892789349334622200,Wed Aug 02 16:49:02 +0000 2017,Here's the argument on #CNN w/Kate Bolduan. https://t.co/zulACh5YVN https://t.co/jr5ZUb8T3k
892777972826034200,Wed Aug 02 16:03:50 +0000 2017,Thanks Bill.  POTUS plan to Curb LEGAL immigration is counter-productive, misguided and un-American. https://t.co/1G9jOmQfWU
892769454236545000,Wed Aug 02 15:29:59 +0000 2017,Great to catch up w/friend and former Obama colleague TVietor and hats off to the rest of the brilliant Pod cast. https://t.co/w2DtmgspCw
892427005668544500,Tue Aug 01 16:49:13 +0000 2017,Urgent US, region hold regime accountable for their safety: Venezuela Opposition Leaders Taken to Prison @NYTimes https://t.co/myigCyub6J
892022256297287700,Mon Jul 31 14:00:53 +0000 2017,Look forward to joining Poppy Harlow #CNN at 1015 am EST to talk NKorea, Russia, more...
890670573742956500,Thu Jul 27 20:29:47 +0000 2017,Smart piece by Fred Kaplan on POTUS plan: Trump may soon try to kill the Iran deal. https://t.co/QjxHoeRB9W
888782874639511600,Sat Jul 22 15:28:44 +0000 2017,So is American diplomacy, development aid and global engagement -- which alas is being "deconstructed". https://t.co/qXxIdkmUtq
888426292240015400,Fri Jul 21 15:51:48 +0000 2017,Look forward to talking about the Iran nuclear deal -- past, present, future. https://t.co/WFz4bvFFsy
887838195672633300,Thu Jul 20 00:54:55 +0000 2017,A beautiful, powerfully human statement from a daughter about her father.  Tks for reminding us of our common human… https://t.co/Gv5c7fuJ32
887760913092280300,Wed Jul 19 19:47:50 +0000 2017,RT @ColinKahl: U.S. Vice Chairman of the Joint Chiefs of Staff: Tehran Has Complied With Iran Dea https://t.co/freZXpxvSq
885266223889621000,Wed Jul 12 22:34:49 +0000 2017,Thanks to Strobe Talbott and Brookings team for partnering w/PBC and to great group of participants. https://t.co/kmcubnx19d
885265443048628200,Wed Jul 12 22:31:43 +0000 2017,RT @Diplomacy_Works: Letter to @POTUS from 38 retired mil officers: #IranDeal is working &amp; #diplomacy is a vital tool for mitigating risk.h…
884603896236318700,Tue Jul 11 02:42:58 +0000 2017,Brett has been brilliant diplomatic field general behind this success. A great public servant. https://t.co/Rp9agLyK9M
884444495303069700,Mon Jul 10 16:09:34 +0000 2017,Thanks Al! https://t.co/Zt8CEbRufT
884395308356186100,Mon Jul 10 12:54:07 +0000 2017,Good string here: hats off to Lise Grande &amp; UN re. Mosul humanitarian challenge. https://t.co/YVfaUKIswn
884120779822182400,Sun Jul 09 18:43:14 +0000 2017,After Mosul, how to prevent Daesh 2.0. "The Islamic State Is Not Dead Yet", via @nytimes https://t.co/5yGBpGr2tT
883279064538243100,Fri Jul 07 10:58:34 +0000 2017,Look forward to joining #CNN New Day at 7 and 8 EST to talk POTUS-Putin meeting.
883057916261126100,Thu Jul 06 20:19:48 +0000 2017,RT @McFaul: Pundit Alert! Please stop saying that Obama pulled missile defenses out of Poland &amp; Trump now restored them. Its not true. Goog…
882993538677563400,Thu Jul 06 16:03:59 +0000 2017,Obama no longer POTUS. Key issue now: what is current president doing to prevent recurrence in 2018, 2020, etc. 8/8
882993434700775400,Thu Jul 06 16:03:34 +0000 2017,IC only conclude after 11/8 RUS goal to elect Trump. Fair to argue didn't do enough; wrong to say took next to no action/played politics 7/
882993208132870100,Thu Jul 06 16:02:40 +0000 2017,Punished Russia after elections, shutting down compounds, kicking out “diplomats”, levying sanctions. 6/
882993043531542500,Thu Jul 06 16:02:01 +0000 2017,Issued unprecedented joint public statement by DNI &amp; DHS, but drowned out by “Access Hollywood” tapes same day. 5/
882992934597144600,Thu Jul 06 16:01:35 +0000 2017,Sought Congressional support for united front against threat; amazingly, leadership accused CIA of playing politics, wouldn’t sign on. 4/
882992803697102800,Thu Jul 06 16:01:04 +0000 2017,Obama confronts Putin directly @ Sept. G20, threatened repercussions. Believe RUS efforts halt, but too late b/c data already exfiltrated 3/
882992649627676700,Thu Jul 06 16:00:27 +0000 2017,Then assessed RUS aim: sow public doubt on elect legitimacy, not direct disrupt. Playing up publicly would add doubt, play into RUS hands 2/
882992501082255400,Thu Jul 06 15:59:52 +0000 2017,My friend Ian usually spot on but this is wrong. 1st believed RUS trying to disrupt elect. systems; Obama acted fas… https://t.co/1fQMjAiNO8
882977798964604900,Thu Jul 06 15:01:26 +0000 2017,In fact Obama deployed more effective wider range missile defense, led sanctions vs. Russia for Ukraine, increased… https://t.co/qlW4jKJc5c
882956936668479500,Thu Jul 06 13:38:32 +0000 2017,Refreshing a piece from March:  Will Rex Tillerson Pass North Korea’s Nuclear Test?, via @nytimes https://t.co/Xav7goWUGN
882947167937323000,Thu Jul 06 12:59:43 +0000 2017,Smart piece by Jake Sullivan &amp; Victor Cha: The right way to play the China card on North Korea - The Washington Post https://t.co/s7bhdJfvlx
882790862102691800,Thu Jul 06 02:38:37 +0000 2017,Voice of reason and experience on most urgent challenge. https://t.co/aduu7EalvQ
882781571195052000,Thu Jul 06 02:01:42 +0000 2017,Look forward to joining #CNN Don Lemon at 11 pm EST tonight to talk POTUS trip &amp; North Korea.
882771234932629500,Thu Jul 06 01:20:38 +0000 2017,A good man doing a great job: "Tillerson's new deputy quietly wins over State Department staffers" - POLITICO https://t.co/yeYXkFIcJ7
880558106295631900,Thu Jun 29 22:46:27 +0000 2017,Great to be at Press Club for launch of #NYT Peter Baker new book Obama: The Call of History. https://t.co/GO5bAkbkQ8
879479145498984400,Mon Jun 26 23:19:02 +0000 2017,Look forward to joining Anderson Cooper #AC360 on CNN at 8:30 pm EST to talk Russia meddling in elections.
878965583924138000,Sun Jun 25 13:18:20 +0000 2017,And you are boasting about this? This is not who we are and the opposite of what makes America great.  Another abdi… https://t.co/S4ZzzxjIir
878307168805630000,Fri Jun 23 17:42:01 +0000 2017,This: https://t.co/iCl46iN0TV
878304360752709600,Fri Jun 23 17:30:52 +0000 2017,Some good news today: https://t.co/8LxU8tGZX0
877249208675442700,Tue Jun 20 19:38:04 +0000 2017,RT @PennBiden: On #WorldRefugeeDay, revisit @ABlinken's powerful story of his family's journey &amp; what America represents to so many https:/…
876782936493895700,Mon Jun 19 12:45:16 +0000 2017,Some thoughts on why President Trump’s Arab Alliance Is a Mirage, via @nytimes https://t.co/AhL5UYRWAz
876195523874762800,Sat Jun 17 21:51:06 +0000 2017,Read this.  Brilliant and compelling. Only Mass Deportation Can Save America, via @nytimes https://t.co/A9VhnyMNjv
875778016051433500,Fri Jun 16 18:12:04 +0000 2017,Trump's Cuba Policy Will Fail - The Atlantic. Must read by Ben Rhodes on misguided wall Trump building w/Cuba.  https://t.co/ACoI9NNjnl
875640392510611500,Fri Jun 16 09:05:12 +0000 2017,Good convo w/Dan Patterson of TechRepublic on cyber threats at Global Cyber Security Summit in Kiev.  https://t.co/vnbGRIZYK5
874982133571440600,Wed Jun 14 13:29:31 +0000 2017,Talked about threats to human &amp; physical infrastructure at #GCS2017 in Kiev.  Need better defense, norms &amp; deterren… https://t.co/Ko5u3GP1Df
874928884009115600,Wed Jun 14 09:57:55 +0000 2017,Thanks!. Great to address Kiev Global Cyber Security Summit. Most of my speeches induce head nodding only in one di… https://t.co/IUHmSb9Yn4
874535344464699400,Tue Jun 13 07:54:08 +0000 2017,Landing in Kiev to address Global Cyber Security Summit on Wednesday. Critical issue at critical time. Good to be back in Ukraine.
874240019480932400,Mon Jun 12 12:20:37 +0000 2017,RT @BFriedmanDC: Alex Jones says 20 dead kids at Sandy Hook were actors. @NBC and @megynkelly to give him a platform on FATHER'S DAY. https…
873895842792558600,Sun Jun 11 13:32:59 +0000 2017,Harmony + Funeral for a Friend/Loves Lies Bleeding + Tiny Dancer + Country Comfort + .... so many more. https://t.co/YEB4D5S3Mu
872454050041786400,Wed Jun 07 14:03:49 +0000 2017,Hats off to Amb. Haley for reasserting US human rights leadership. US more effective in not out of Human Rights Cou… https://t.co/JECeG5o0WX
872448145552277500,Wed Jun 07 13:40:21 +0000 2017,RT @JoeBiden: Great to be with @PennBiden in Athens. A Europe whole, free, &amp; at peace remains vital to U.S. security–as it has been for the…
871847083191521300,Mon Jun 05 21:51:57 +0000 2017,My take on what's really behind the travel ban. What We Lose by Barring Refugees, via @nytimes https://t.co/aPVBd4Adw4
871101962929950700,Sat Jun 03 20:31:06 +0000 2017,From the new leader of the liberal democratic world: https://t.co/7MMdMc2AoJ
870366241940054000,Thu Jun 01 19:47:37 +0000 2017,Obama: leadership on climate now up to mayors, governors, private sector.  Do the right thing. https://t.co/ELYl2kUcZ8
870365238838743000,Thu Jun 01 19:43:38 +0000 2017,Indeed it's not leadership when no one is following. https://t.co/HfqQ9SwrQs
870364889667190800,Thu Jun 01 19:42:14 +0000 2017,An abdication of US leadership, responsibility &amp; opportunity. A mistake of historic proportions that will long outl… https://t.co/bXiLA2sHoG
869197239402418200,Mon May 29 14:22:25 +0000 2017,Hilite serving @ NSC &amp; State 16 years: wkg. w/armed forces from Sit Room to Baghdad, Kabul, NATO, Korea DMZ. Their sacrifice, our freedom.
868968154411683800,Sun May 28 23:12:07 +0000 2017,Smart, insightful piece by a great writer. https://t.co/Ly5tjff4Sg
868555347761389600,Sat May 27 19:51:46 +0000 2017,We've lost an amazing voice. https://t.co/hg4asikYWA
868453020996128800,Sat May 27 13:05:09 +0000 2017,23 year old pop star shows more wisdom, grace and dignity than some of our leaders. https://t.co/OsGgNxANKb
868447557885866000,Sat May 27 12:43:27 +0000 2017,It's Putin not Trump https://t.co/pPS8i3yru6
868291887039488000,Sat May 27 02:24:52 +0000 2017,RIP Zbig -- great man, great mind. https://t.co/KzTUVajsek
868055068981047300,Fri May 26 10:43:50 +0000 2017,From our former ambassador to NATO: https://t.co/oWEinw3U1M
867828656827248600,Thu May 25 19:44:09 +0000 2017,EC's annual dust up at Royal Albert always brilliant.  Sad to have missed but so glad to have been at MSG shows. https://t.co/2pi20q3y8M
867490065152344000,Wed May 24 21:18:43 +0000 2017,Congrats John Sullivan confirmed as Deputy Secretary of State.  From a foreign service family, he now leads great group of public servants.
867424502912864300,Wed May 24 16:58:12 +0000 2017,RT @ColinKahl: Trump's DIA chief confirms prediction Obama officials made ahead of Iran deal. https://t.co/bIZ1FG2mVR
867005494338220000,Tue May 23 13:13:12 +0000 2017,No additional comment needed. https://t.co/DM0UaLtscj
866359958924873700,Sun May 21 18:28:05 +0000 2017,Must read Kristof column on real world impact of bad policy. Read &amp; weep. Trump vs. Women’s Health, via @nytimes https://t.co/N4PkzLLxKP
865707885698965500,Fri May 19 23:16:58 +0000 2017,President Trump's trip and the Iran nuclear deal.  https://t.co/5zU70RcFBb
865222673592442900,Thu May 18 15:08:55 +0000 2017,As good as Aimee is on record, even better live.  Don't miss best singer-songwriter of this generation. https://t.co/QPiE2NZKsb
865189642114670600,Thu May 18 12:57:39 +0000 2017,RT @AshleyAlese: Says the man who claimed for years President Obama wasn't born in the United States. https://t.co/1r4VtRvZWW
864830261862727700,Wed May 17 13:09:36 +0000 2017,Putin's week keeps getting better: "Putin Offers Congress ‘Record’ of Trump’s Disclosures to Envoys," via @nytimes https://t.co/qpdlV1LcnZ
864823891776204800,Wed May 17 12:44:18 +0000 2017,RT @PennBiden: On Intl Day Against Homophobia, Transphobia and Biphobia, @JoeBiden has a strong message for global #LGBT rights  https://t.…
863380633669820400,Sat May 13 13:09:18 +0000 2017,Some thoughts on the real winner of the Comey debacle. "Trump Fires Comey and Putin Smiles" https://t.co/qsw6y7ootR
863171847290073100,Fri May 12 23:19:40 +0000 2017,Best analysis of critical challenge. https://t.co/uf5n8GShrU
863159004511580200,Fri May 12 22:28:38 +0000 2017,Some thoughts on the real winner of the Comey debacle.  "Trump Fires Comey and Putin Smiles" https://t.co/qsw6y7ootR
863013359867899900,Fri May 12 12:49:53 +0000 2017,Yes, but it has an 18 day gap. https://t.co/tdANAJ4YIM
862426415865761800,Wed May 10 21:57:35 +0000 2017,Look forward to moderating great group tomorrow on future of liberalism in Europe post French elections. https://t.co/ZgRDvaTMkD
862395813036777500,Wed May 10 19:55:59 +0000 2017,Need break from Watergate 2.0? Read smart, important piece by senators Corker &amp; Coons on food aid.  https://t.co/Pu8loWidKA
862304076494721000,Wed May 10 13:51:27 +0000 2017,Russia goal: undermine confidence in dem. institutions. Comey firing does Russia's work. Independent inquiry vital to restore public trust.
862150551395602400,Wed May 10 03:41:24 +0000 2017,Wrote below in wake of Nunes fiasco. Now with Comey firing vital there be independent prosecutor to restore confide… https://t.co/02wIwNIwZZ
861976114624962600,Tue May 09 16:08:15 +0000 2017,Well said. https://t.co/R4wXoyCVSL
861946944737988600,Tue May 09 14:12:20 +0000 2017,Good to catch up, compare notes w/Slovak FM, next UNGA prez @MiroslavLajcak. https://t.co/As1CFCjYOX
861715460085207000,Mon May 08 22:52:30 +0000 2017,RT @shebacrocker: House Dems urge @POTUS to nominate Ass't Sec'y for Diplomatic Security @StateDept asap; cite risks to US diplomats. https…
861287657825087500,Sun May 07 18:32:34 +0000 2017,Yes. Le Pen playing long game, setting herself and FN as legitimate opposition.  Open/closed battle raging, burden… https://t.co/pBCvNGWFbj
861279720805216300,Sun May 07 18:01:01 +0000 2017,Vive la France. Macron's challenge: answer Bill Mckay's question -- what do we do now? Tall order for new champion… https://t.co/Xyos3fQ1bD
861236482236874800,Sun May 07 15:09:13 +0000 2017,French interior ministry: Macron 60 percent as of 3 pm.   Last minute gambit by Putin, fellow travelers to disrupt democracy falling short.
860128764759613400,Thu May 04 13:47:32 +0000 2017,Human Rights First informed "No Asylum Here’: Some Say U.S. Border Agents Rejected Them, via @nytimes.  https://t.co/n6Xv9rZTAG
