id,created_at,text
1258618846543396900,Fri May 08 04:44:51 +0000 2020,Three #MothersDay brunch recipes to make this Sunday. 🍓 https://t.co/wVIqrNvj9I https://t.co/j4YGoYBhLR
1258617034708889600,Fri May 08 04:37:39 +0000 2020,RT @christophergia: Thank you @jasonrball for having me on @KTLApodcasts #TheNewsDirectorsOffice to discuss the future of print and our mom…
1258616946989252600,Fri May 08 04:37:18 +0000 2020,RT @jasonrball: Our friends at @AngelenoMag are putting out a #Hope issue.  Publisher @christophergia joins us in #TheNewsDirectorsOffice t…
1258350314777796600,Thu May 07 10:57:48 +0000 2020,RT @christophergia: Love this.... The @BevHillsHotel changed its iconic sign for the first time in seventy years to read, “Thank You Health…
1255719711381221400,Thu Apr 30 04:44:43 +0000 2020,RT @christophergia: Good memories  with our @AngelenoMag cover star @MattBomer !
1255691219784458200,Thu Apr 30 02:51:31 +0000 2020,RT @BHRC_LosAngeles: BHRC is honored to be named as "The Top 5 Health And Wellness Spaces In Los Angeles"! Thank you @AngelenoMag for recog…
1255690125238956000,Thu Apr 30 02:47:10 +0000 2020,@MellyKham Of course Melly. We are happy to support.
1255499501269385200,Wed Apr 29 14:09:41 +0000 2020,We are taking the #five4ALZ challenge today. @AlzheimersLA is providing critics services and support during COVID-1… https://t.co/vqgpsaBaiY
1255462378520658000,Wed Apr 29 11:42:11 +0000 2020,RT @BHRC_NewportBch: BHRC is honored to be named as "The Top 5 Health And Wellness Spaces In Los Angeles"! Thank you @AngelenoMag for recog…
1249559861861314600,Mon Apr 13 04:47:41 +0000 2020,RT @christophergia: The @AngelenoMag and @rivieramagoc #TheHopeIssue coming out in May. We will be celebrating the extraordinary individual…
1248475202742136800,Fri Apr 10 04:57:38 +0000 2020,Coming next month..... @AngelenoMag presents #TheHopeIssue.  Please DM for more information about how you can give… https://t.co/y31LdrwfhG
1248195831141789700,Thu Apr 09 10:27:31 +0000 2020,.@BillyMagnussen is on the verge of having one colossal year, including a star turn in No Time to Die—the latest… https://t.co/qiSe3OiaaA
1248043504569213000,Thu Apr 09 00:22:13 +0000 2020,RT @christophergia: For more information in telling your story, getting your message out,  or getting our digital edition👉 shoot me a DM to…
1246136817138782200,Fri Apr 03 18:05:43 +0000 2020,A little style inspo to take your mind off everything -- Read about one of Angeleno's Men Of Style &amp; founder of Sig… https://t.co/7wRpI3YYUr
1245794036994187300,Thu Apr 02 19:23:38 +0000 2020,6 Ways Los Angeles Is Giving Back During The Pandemic -- Focus on the positive with these tales of Angelenos giving… https://t.co/55nNwpk8aV
1239977569803526100,Tue Mar 17 18:11:04 +0000 2020,Keep calm and self-care on✨We rounded up a few pieces that will bring zen during during these zany times. Check it… https://t.co/fOsoRNapPI
1239649162704179200,Mon Mar 16 20:26:06 +0000 2020,Built for Speed! 🏎 @Dior teams up with @Modern_Luxury to showcase their new men's line! via @themensbook    Check i… https://t.co/ruQnHSdYq0
1235345220184703000,Wed Mar 04 23:23:46 +0000 2020,Find out how the Ladies of London star, Marissa Hermer spends her typical day. Check out the #LinkInBio to learn mo… https://t.co/BHKoUovazw
1233425629984559000,Fri Feb 28 16:16:00 +0000 2020,Friday feels ✨ A revolutionary look at Spring fashion is the new modern  #FashionFriday #SpringFashion… https://t.co/0nu6rroV6T
1232006271802519600,Mon Feb 24 18:15:59 +0000 2020,Whether it’s a leading role as a heroic Disney queen, the fearless Dolores Abernathy in @WestworldHBO  or an unflin… https://t.co/TlHaA3pTh2
1230571822225281000,Thu Feb 20 19:15:59 +0000 2020,Last night in Milan @moncler revealed their Genius partnerships to the fashion world. Our March issue features an e… https://t.co/hDNBlf6rmn
1228394908270153700,Fri Feb 14 19:05:43 +0000 2020,That’s a wrap on another #nyfw and our fashion director @jamesastyle was there for it all. Thanks to… https://t.co/rSCA1fyYa7
1228016475614699500,Thu Feb 13 18:01:57 +0000 2020,British Design Firm is bringing wow to walls. Check out the link below to learn more 🌸  https://t.co/hBwFv6eUuL  📸:… https://t.co/D8QL0KY1Xh
1222244451168542700,Tue Jan 28 19:46:00 +0000 2020,The 2020 LA Art Show kicks off with an Opening Night Premiere Party celebrating the 25th Anniversary, Wednesday, Fe… https://t.co/MkGPmLhb7E
1220073988044611600,Wed Jan 22 20:01:21 +0000 2020,@SkinByLovely Santa Monica is officially open at their NEW location at 2811 Wilshire Blvd., Suite 900!  Visit them… https://t.co/shMS5tuEso
1219749441831407600,Tue Jan 21 22:31:43 +0000 2020,#EditorPickOfTheWeek // “With award shows serving plant-based menus, eating vegan is more popular than ever. I stop… https://t.co/saC3YvxdvT
1212463803197198300,Wed Jan 01 20:01:11 +0000 2020,"Never underestimate the power you have to take your life in a new direction." - Germany Kent  #2020 #newyear… https://t.co/i8RCyEXFUf
1212101457002016800,Tue Dec 31 20:01:21 +0000 2019,But first, champagne 🥂  📸: Nora Schlesinger  #nye #2020 #happynewyear #newyearseve #newyear https://t.co/AGP9fjpX4M
1209927101555626000,Wed Dec 25 20:01:15 +0000 2019,Happy Holidays! 🥂🎄🎁How are you spending your week? We're getting into the hosting spirit with this stunning tablesc… https://t.co/KIv6UJFkzQ
1200837379461984300,Sat Nov 30 18:01:56 +0000 2019,This legendary $15 million @houdiniestate  landmark can be all yours for a short-term rental. Enjoy a historic hous… https://t.co/IIvESERXBu
1199025295434670000,Mon Nov 25 18:01:21 +0000 2019,Trade snowflakes for sandcastles. Celebrate a tropical holiday with your o’hana (family) in the sun at Fairmont Kea… https://t.co/VZZgzkFqUq
1197575730223362000,Thu Nov 21 18:01:18 +0000 2019,We Need You, Neighbor! You Can make the difference ensuring that no child goes hungry this holiday season.  Now thr… https://t.co/52F9xcuua9
1197213368622485500,Wed Nov 20 18:01:24 +0000 2019,This on-trend Hermes mini Kelly II is big enough to hold your 18kt rose gold rainbow Rolex Yachtmaster &amp; more… https://t.co/FuEx9kg9f9
1195401444175876000,Fri Nov 15 18:01:28 +0000 2019,For every new patient that starts treatment at Beverly Hills Orthodontics in November, BHO will treat an underprivi… https://t.co/8iz4hyoDWU
1194314213625340000,Tue Nov 12 18:01:12 +0000 2019,Embark on a holiday journey with your loved ones to La Baja and stay at the iconic Solaz resort, where the ocean me… https://t.co/fXyjNdOod1
1190026022869225500,Thu Oct 31 22:01:28 +0000 2019,Immerse yourself in a truly indigenous experience at Solaz, a Luxury Collection Resort and enjoy the unique Mexican… https://t.co/AhW9KqaCMu
1189237352515997700,Tue Oct 29 17:47:34 +0000 2019,Get even closer to dramatic desert landscapes by booking your trip to The Oasis at Death Valley today. Learn more:… https://t.co/9EGXo4gwym
1188141826827382800,Sat Oct 26 17:14:20 +0000 2019,RT @PhilinBHills: My first billboard photo @AngelenoMag https://t.co/RDUHMs3VcY
1186491028187910100,Tue Oct 22 03:54:39 +0000 2019,Surf &amp; Sand Resort has been voted one of the Top Resorts in Southern California (#11) by the readers of Condé Nast… https://t.co/UuuuoNIlM8
1185526105240944600,Sat Oct 19 12:00:24 +0000 2019,Summer might be over...but we're still reminiscing on our 17th Annual Live &amp; Dine event this past August in Los Ang… https://t.co/41ETrwqWil
1184996482522341400,Fri Oct 18 00:55:52 +0000 2019,Celebrate the Holidays at The Del with Skating by the Sea®, Frostbite Lounge and a season full of holiday feasts an… https://t.co/MD16bPtH6J
1184801331086856200,Thu Oct 17 12:00:24 +0000 2019,How STUNNING did Margot Robbie look as the cover star of our January 2014 issue? Nearly six years later she continu… https://t.co/WGS5Xglp0P
1184594315437314000,Wed Oct 16 22:17:48 +0000 2019,This is one vacation you can’t miss. Watch #reneefleming and #dovecameron take the @LAOpera stage for #LAOPiazza, N… https://t.co/9PPVzigyEY
1182514491717607400,Fri Oct 11 04:33:19 +0000 2019,@christophergia @ModernLuxury @lacmagazine ❤️❤️
1182514098728099800,Fri Oct 11 04:31:45 +0000 2019,Thank you @PhilinBHills !! https://t.co/bdLaj7bj71
1181425814874677200,Tue Oct 08 04:27:18 +0000 2019,Congrats @VeuveClicquot on The 10th Anniversary of the Veuve Clicquot Polo Classic! #VCPC10 #VCPoloClassic https://t.co/IoA0CXRAIT
1179989463289626600,Fri Oct 04 05:19:45 +0000 2019,Join us for @NightsoftheJack all month long. Get your tickets at https://t.co/FSQfD70PYT #halloween #halloweentown… https://t.co/XNNFTwVR4M
1175870529753903000,Sun Sep 22 20:32:35 +0000 2019,RT @christophergia: #EMMYS with the best of the best 👉Thank you @Audi, #thecollectiveyou and 📸 #dennisgocer for these amazing shots. Great…
1175635414972915700,Sun Sep 22 04:58:19 +0000 2019,RT @christophergia: #Emmys weekend is here - Cheers to these @Modern_Luxury cover stars on their nominees: #michellewilliams @TheMandyMoore…
1175274517314171000,Sat Sep 21 05:04:15 +0000 2019,@PoutyScouty @LauraDern You are welcome!
1175274311910744000,Sat Sep 21 05:03:26 +0000 2019,RT @christophergia: 3 years ago Tonight  with these two cool peeps  👉 @johnlegend and @chrissyteigen for @AngelenoMag when Chrissy graced o…
1175274229903716400,Sat Sep 21 05:03:06 +0000 2019,RT @christophergia: The iconic, beautifully talented actress and mom @LauraDern! Thank you for gracing our 20th Anniversary cover of @Angel…
1175274178666057700,Sat Sep 21 05:02:54 +0000 2019,RT @christophergia: Please follow @themensbook 👉@modernluxury’s first-ever national site dedicated to men and the things that matter to the…
1174743157453406200,Thu Sep 19 17:52:49 +0000 2019,Join @PS_ARTS at Express Yourself for family-friendly art activities &amp; yummy treats from our favorite L.A. eateries… https://t.co/u3xeqVsRtq
1170299670167310300,Sat Sep 07 11:35:59 +0000 2019,How is it possible @heidiklum looks THE SAME today as she did on our January 2008 cover.  Story by @heyhochman, pho… https://t.co/HJfyvIv3Q4
1170297166910251000,Sat Sep 07 11:26:02 +0000 2019,RT @AngelenoMag: Our @LauraDern cover story with @sarituschmanLA is LIVE!!!! It's truly a must-read.  https://t.co/nOGGkGgfB8 #modernluxury
1167656059885871000,Sat Aug 31 04:31:13 +0000 2019,@KentMoyer Thank you!
1167197131934822400,Thu Aug 29 22:07:36 +0000 2019,Our @LauraDern cover story with @sarituschmanLA is LIVE!!!! It's truly a must-read.  https://t.co/nOGGkGgfB8 #modernluxury
1166397535990112300,Tue Aug 27 17:10:17 +0000 2019,Everyone loves rosé, but do they know its history? #promotion  https://t.co/I8ZYDOMcSg
1165230563596177400,Sat Aug 24 11:53:09 +0000 2019,RT @christophergia: Calling all GENTS  https://t.co/57ZZUcIEyD  THE NEW MEN’S LUXURY LIFESTYLE DESTINATION FROM THE EDITORS OF @MODERNLUXUR…
1165230522068418600,Sat Aug 24 11:53:00 +0000 2019,@itsedwardoz @christophergia ❤️
1164938851028103200,Fri Aug 23 16:34:00 +0000 2019,Neal Fraser of Redbird, Vibiana and Fritzi Coop is headed to the Greek Theatre.  https://t.co/0N6xNEocBa
1164575959850336300,Thu Aug 22 16:32:00 +0000 2019,Gucci's expanding from your closet to your beauty cabinet.  https://t.co/uX8ErxPQds
1164213068739612700,Wed Aug 21 16:30:00 +0000 2019,For the ultimate food porn, follow these Angelenos:   https://t.co/vJjy571a8Q
1163844186161868800,Tue Aug 20 16:04:11 +0000 2019,We (well, @sarituschmanLA) sat down with @MatthewKenney_ to discuss where the famous vegan cheftrepreneur loves to… https://t.co/dCb96O4F8C
1161699454707089400,Wed Aug 14 18:01:47 +0000 2019,Who needs a hump day treat?   https://t.co/gaCGuAeUZw
1161343736032325600,Tue Aug 13 18:28:18 +0000 2019,"The opening of Âme at Westfield Century City is setting a new standard in fine jewelry shopping." - EIC Laura Ecks… https://t.co/tfq7KpYHqQ
1161062828838547500,Mon Aug 12 23:52:04 +0000 2019,Only a few weeks left til it's back to school--check out our list for some fun ideas to while away the final days o… https://t.co/CpD5X0j0HO
1160784316688810000,Mon Aug 12 05:25:22 +0000 2019,RT @christophergia: Throwing it back to our dinner party with our 2017 cover star @priyankachopra #angeleno20years #angelenomagazine #moder…
1160783719340232700,Mon Aug 12 05:22:59 +0000 2019,RT @Elex_Michaelson: I ❤️ kids interested in politics!   13 year old Luke started @govlearn, a non-profit that helps teach kids about gover…
1159660562613063700,Fri Aug 09 02:59:58 +0000 2019,RT @christophergia: Watching some @netflix #NoGoodNick tonight. Proud of my amazing exec producers/ showrunner pals @DavidHSteinberg + @Kee…
1159660545030492200,Fri Aug 09 02:59:54 +0000 2019,RT @christophergia: Ready to take the challenge! Wanna try a plant based diet?  Meet my pal  @marleyficalora 👉 the founder of “The Produce…
1159247764628185000,Wed Aug 07 23:39:39 +0000 2019,"Size inclusivity isn’t a trend, it’s a revolution." - @sarituschmanLA   https://t.co/3vat7EvrVy
1158827780663988200,Tue Aug 06 19:50:47 +0000 2019,"[This] new crop of products boasting the benefits of avocado, basil and cucumber will have your face looking as fr… https://t.co/v7aoNWHok7
1158492246242541600,Mon Aug 05 21:37:29 +0000 2019,Experience the best of Maui &amp; discover what all their fans are raving about when you book your 2019… https://t.co/xRwWXlJu6v
1156356816369905700,Wed Jul 31 00:12:03 +0000 2019,Here’s a Beverly Hills summer secret! Join @CrustaceanBH for RED HOUR every Wed. 4-7PM for LIVE MUSIC &amp; HAPPY HOUR… https://t.co/VKZSX9xYa5
1153718349429268500,Tue Jul 23 17:27:44 +0000 2019,So thrilled @Chateauhanare is featured in our July/August FEAST issue &amp; they'll be blessing us with their de.lic.io… https://t.co/zYEo9W11ev
1153051858342011000,Sun Jul 21 21:19:20 +0000 2019,Happy brunch day! What are y'all sipping on?! If your liver needs a break, check out our story about sumptuous sobe… https://t.co/n9EcqQjfYZ
1151671220439359500,Thu Jul 18 01:53:10 +0000 2019,All about Angeleno, #WorldEmojiDay edition:  🥂🌴💅🏽💎👩🏻‍🍳🍾🧘‍♀️🌅  #modernluxury
1151287822956945400,Wed Jul 17 00:29:41 +0000 2019,RT @lacmagazine: Congratulations to all the LAC Impact Award honorees &amp; presenters who are nominated for Emmys! Rooting for all of you!!✨…
1151195118256345100,Tue Jul 16 18:21:19 +0000 2019,It’s travel trip Tuesday and we found the coolest destination of the summer! Traveler Surf Club is SoCal’s new hang… https://t.co/11ZWJIYDph
1150490468112715800,Sun Jul 14 19:41:17 +0000 2019,Some Sunday motivation before we head back into the week, courtesy of @joejonas. #modernluxury #quotestoliveby… https://t.co/GSALOWUuZl
1150193863182565400,Sun Jul 14 00:02:41 +0000 2019,Hitting the beach this weekend? We’ve been loving @maxmara Beachwear! Comfort + Sun Protection? What more could you… https://t.co/VIrd916Mbo
1149733403383590900,Fri Jul 12 17:32:59 +0000 2019,@omegawatches' iconic Speedmaster has gone to the moon &amp; back as part of all 6 lunar missions. Discover the univers… https://t.co/vxC406K4IA
1148673617946800100,Tue Jul 09 19:21:46 +0000 2019,“I am obsessed with all of Daniela Villegas' jewelry. The Porcupine Collection is made from quills my father collec… https://t.co/OHuFqp63ID
1148338242267185200,Mon Jul 08 21:09:06 +0000 2019,It might be the Monday after a holiday week but we are already planning our next staycation: Manhattan Beach! Thank… https://t.co/LZTDo5hqng
1147963399663280100,Sun Jul 07 20:19:37 +0000 2019,FUSS &amp; FEATHERS at Hatchet Hall in Culver City has captured our hearts. This pop-up’s private dining room is the ar… https://t.co/vn0skW4uA0
1147557941832110100,Sat Jul 06 17:28:28 +0000 2019,Major date night vibes at @KassRestaurant; check out our story on Chef Émé’s hot new spot on La Brea.… https://t.co/RmYghV5Iz5
1146890745237782500,Thu Jul 04 21:17:16 +0000 2019,We wish you &amp; yours a fun, safe, &amp; fabulous 4th of July. #4thofJuly #fireworks #independenceday #america #usa… https://t.co/y7HlDwdhwn
1146110213172420600,Tue Jul 02 17:35:43 +0000 2019,Full boss vibes at @the_wing in We.Ho; check out @sarituschmanLA's piece on LA’s latest executive hangs:… https://t.co/AHmlhPQunQ
1145829096330387500,Mon Jul 01 22:58:39 +0000 2019,Experience the best of Maui &amp; discover what everyone's raving about when you book your 2019 @FairmontKeaLani beach… https://t.co/ltRAbQImfF
1145735198228615200,Mon Jul 01 16:45:32 +0000 2019,Summer is in full swing &amp; at Angeleno, that means 1 thing: our annual FEAST issue! To kick-off our July/Aug culinar… https://t.co/1s9EZT8zOK
1144668198064668700,Fri Jun 28 18:05:39 +0000 2019,Check out the fab new @markdsikes collection for @annieselke along with other new interior collections we're excite… https://t.co/jYd8g34Sk2
1144400522243235800,Fri Jun 28 00:22:01 +0000 2019,Experience an enhanced, guided, sunset yoga class this summer at @SurfSandLaguna. Cleanse &amp; restore while you charg… https://t.co/CkEPTHQcM1
1144341385484484600,Thu Jun 27 20:27:01 +0000 2019,@NaomieHarris just gave us the first look for #blackandbluemovie &amp; we cannot wait! After grabbing our attention in… https://t.co/GRsGkAnCnU
1143574384071733200,Tue Jun 25 17:39:14 +0000 2019,This #traveltuesday, check out our latest dispatch from the Caribbean, "An Insider's Guide To The Red-Snapper Cevic… https://t.co/F9BFRf8tfc
1143217282207719400,Mon Jun 24 18:00:14 +0000 2019,In honor of our annual FEAST issue, we've been eating good across the country. Check out our faves! https://t.co/PrG9Nw6mSC
1142509155258753000,Sat Jun 22 19:06:24 +0000 2019,Ice cream or sculpture?! Check out our summer obsession @ColdRolledCream 🤤😍   https://t.co/IUwaYiJ94L  #modernluxury #icecreamrolls
1141441999154712600,Wed Jun 19 20:25:54 +0000 2019,Thanks for the mention, @hellomag! We loved Lily James' @burberry look at the @yesterdaymovie premiere, too! https://t.co/x8Fl8r8AVn
1141134356229976000,Wed Jun 19 00:03:26 +0000 2019,Casual cotton candy vibes 💕#modernluxury #jewels #diamonds  model: Julia Riethof, styled by James Aguiar, 📷:… https://t.co/wOBHfJOukd
1138523419811516400,Tue Jun 11 19:08:30 +0000 2019,Stumped on spots to celebrate yours Pops this Sunday? Check out our #FathersDay dinner guide:  https://t.co/3Gl8xFhKvY
1136076847559483400,Wed Jun 05 01:06:42 +0000 2019,“I never feel like a beauty icon. It’s sort of bizarre to me to even associate myself with that.” — Lily James, our… https://t.co/63dClkpGOW
1135665227192602600,Mon Jun 03 21:51:04 +0000 2019,"Art and love are the same thing: It's the process of seeing yourself in things that are not you." - Chuck Klosterm… https://t.co/Pa6QOKNY6A
1135310715437273100,Sun Jun 02 22:22:22 +0000 2019,Happy self-care Sunday! How are you treating yourself today? In case you feel like reading, check out some of our l… https://t.co/wLi3UkUDcP
1134959031074771000,Sat Jun 01 23:04:54 +0000 2019,Quick dispatch from Vegas on this gray day in L.A. 😍 #modernluxury #getaway #vegas https://t.co/MZyxhQSien
1134167250095620100,Thu May 30 18:38:38 +0000 2019,It would be a BIG LIE if we said we weren’t excited to see our June 2014 cover star @shailenewoodley back for… https://t.co/E7n8SUQA4u
1133839788874686500,Wed May 29 20:57:26 +0000 2019,When our writer @sarituschmanLA met our cover star (&amp; #wcw) Anne Hathaway, she was told to call the Oscar-winning a… https://t.co/ByrwmyRp6T
1133453051212075000,Tue May 28 19:20:40 +0000 2019,For this #traveltuesday, we're daydreaming about the unfinished church at St. George's in @Bermuda. So stunning, so… https://t.co/JpOSnyeWOX
1133017693911564300,Mon May 27 14:30:43 +0000 2019,This Memorial Day, and every day, we honor the sacrifices made to help protect our freedom.  . . . photo credit ren… https://t.co/Ywoj8VoIay
1132776001728012300,Sun May 26 22:30:19 +0000 2019,This cozy, rainy day is perfect to curl up with a favorite magazine (or 7!). 📷: @jenaceret #modernluxury #cozy… https://t.co/TBvp08fDox
1131698749791584300,Thu May 23 23:09:42 +0000 2019,We have your Memorial Day Weekend plans covered! 25+ wineries + live music + waterfront views … we’ll see you at… https://t.co/yPT7iSbOeK
1131627330135253000,Thu May 23 18:25:54 +0000 2019,Once upon a time #margotrobbie graced the cover of our January 2014 issue. Congrats on the @OnceInHollywood premier… https://t.co/hpmCdLQbYP
1131279475801333800,Wed May 22 19:23:39 +0000 2019,Awestruck &amp; full of wanderlust. Who else wishes they were window-shopping in Milan right now? 😍 Courtesy of… https://t.co/MXnWZkDpGf
1130525625431629800,Mon May 20 17:28:07 +0000 2019,“If I am to be a role model to young girls, I want it to be something healthy because I worry about a level of self… https://t.co/WrXkVr60JT
1130176336285163500,Sun May 19 18:20:10 +0000 2019,Any predictions for tonight's finale? 👑 #gameofthrones #GOTFinale #modernluxury #jaimelannister https://t.co/IKcbVs8sbK
1129821663665639400,Sat May 18 18:50:50 +0000 2019,Need weekend plans? Check out our interview with Dede Lagree of Lagree Fitness Studio and Toned LA on her top #LA s… https://t.co/q7XXP4ppu6
1129491483453558800,Fri May 17 20:58:49 +0000 2019,In honor of Friday date night, here's our interview with lovebirds and mutual-muses clothing designer Louiza Babour… https://t.co/MrzxLGRJjf
1129076514161455100,Thu May 16 17:29:52 +0000 2019,Beyond ready for @jaggedmusical! In honor of our favorite break-up album heading to Broadway, today's #tbt is… https://t.co/0MsrgW79MK
1128774765773086700,Wed May 15 21:30:50 +0000 2019,😍 Fully in love with this 70s A-frame home revamped by @assembledge and Dobkin Construction. Photo by Simon Berlyn,… https://t.co/M0C1yygk8Y
1128055960361062400,Mon May 13 21:54:33 +0000 2019,"If I’m feeling really tired, I’ll go outside and sit in the sun for a minute. The vitamin D infusion helps wake me… https://t.co/lvxjX68S2c
1127656203356500000,Sun May 12 19:26:04 +0000 2019,Happy Mother's Day to all the mothers and motherly figures out there who helps us blossom and grow and shine so vib… https://t.co/gUzr4TAQyZ
1127396113537880000,Sun May 12 02:12:34 +0000 2019,Still thinking about this top. 🕺🏻 📷: @mirandapennturin #modernluxury #angeleno20years #christianbale #tbt… https://t.co/xCiM1ms61g
1126987601372536800,Fri May 10 23:09:17 +0000 2019,How fab did @Caradelevingne look in this @Dior look at #MetGala2019 this week?! Truly beyond. #modernluxury https://t.co/dszMi8wUs0
1126547941454278700,Thu May 09 18:02:14 +0000 2019,The May 2000 issue feat. Christian Bale, fresh off American Psycho(!!), well before he became Batman or Dick Cheney… https://t.co/tBNx8RZ26k
1126218934884036600,Wed May 08 20:14:52 +0000 2019,#editorpickoftheweek "We're so lucky that esteemed florist/artist @nicolaibergmann chose L.A. for his 1st U.S. bout… https://t.co/49MhBNpJnR
1125836503450447900,Tue May 07 18:55:14 +0000 2019,"I'm so inspired by the collective voice and energy that's happening right now. I'm happy to look around &amp;, where I… https://t.co/Pdf6jMCLFL
1125465675349127200,Mon May 06 18:21:41 +0000 2019,Are you keto curious? Check out our interview with Ben Knox and Brandon Mackie on their shared love for the ketogen… https://t.co/oECT1mWa3C
1124425320151404500,Fri May 03 21:27:41 +0000 2019,Shhhh, I'll tell you my fashion secret: It's all @Dior. 😍  photographed: Carlos Ruiz styled: James Aguiar models: R… https://t.co/cQE0CedQ4t
1124089950495023100,Thu May 02 23:15:03 +0000 2019,Dana Jackson of @BeneathYourMask filled us in on her wellness *musts* &amp; we're all the better for it! Hot tip, two w… https://t.co/BLsEW0t008
1123659011956432900,Wed May 01 18:42:39 +0000 2019,Treat all of the amazing mothers in your life to a fabulous Champagne Brunch on Mother’s Day at @delcoronado! Delig… https://t.co/xQBfHm5VDk
1123292505909280800,Tue Apr 30 18:26:17 +0000 2019,LA's great &amp; all, but...🤤  #travel #tuesday #wanderlust #modernluxury #hawaii https://t.co/Lm0u9nMehZ
1122959622917124100,Mon Apr 29 20:23:32 +0000 2019,May is our Wellness Issue, and we're kicking things off early with this fab interview with @lekfit founder Lauren K… https://t.co/fZsjjP0hCZ
1121572220419985400,Fri Apr 26 00:30:29 +0000 2019,Sun's going down, so bottoms up! #cheers #modernluxury #thirstythursday https://t.co/hHFklsRBlF
1121562628784934900,Thu Apr 25 23:52:22 +0000 2019,Just in time for spring, Anne Hathaway looks ethereal among the flowers for our #May #healthandwellness issue. She… https://t.co/wIMrjgbu8M
1120731855039283200,Tue Apr 23 16:51:11 +0000 2019,@MonarchBResort offers AAA Five Diamond luxury for your special day. Choose from ideal, elegant venues for the day… https://t.co/JABPsxOmDY
1120427914896584700,Mon Apr 22 20:43:26 +0000 2019,"You can discover more about a person in an hour of play than in a year of conversation." -- Plato… https://t.co/IZPxXwuWgk
1120086946737479700,Sun Apr 21 22:08:32 +0000 2019,Happy Easter &amp; Happy Passover from our superbloom to yours 🌿🌼🌸🌾 #modernluxury #superbloom #spring https://t.co/Ykwhz1hiZ7
1118972680705912800,Thu Apr 18 20:20:51 +0000 2019,Love these perfect spring pastels 💕 #modernluxury  models: @biancagittens with @suprememgmt &amp; @loicmabanza with@sou… https://t.co/DafAcbsy5V
1116832597559013400,Fri Apr 12 22:36:55 +0000 2019,#tfw you can't...wait...much...longer...FOR GAME OF THRONES!!!! Who else is ready for Sunday?! ✨ photography by sim… https://t.co/DNJ0YqOZPP
1116414236740034600,Thu Apr 11 18:54:30 +0000 2019,Fashionable golden retriever Cashmere The Golden is living the suite life on #nationalpetday w/ owners… https://t.co/5qnYPOKeEl
