id,created_at,text
1259842821827309600,Mon May 11 13:48:30 +0000 2020,Here's a link to the research paper:  https://t.co/G0RGzij2NY
1259842711961682000,Mon May 11 13:48:03 +0000 2020,The second is a collage of photos using visible wavelengths, UV, infrared and multiwavelength composite. It turns o… https://t.co/YQrOdxPh5c
1259842710183317500,Mon May 11 13:48:03 +0000 2020,Sailor Moon is SHAKING! 💫 These new photos of JUPITER are some of the highest resolution images of the planet ever… https://t.co/5Vzpi8twm4
1259839799864811500,Mon May 11 13:36:29 +0000 2020,@hankgreen 😔 RIP
1259556486541381600,Sun May 10 18:50:42 +0000 2020,THE QUEEN!!! https://t.co/AvcVZkrzgf
1259533077627404300,Sun May 10 17:17:41 +0000 2020,Thank you @RealDoctorMike for doing the work you do, and for the time and thought you put into everything. Days ago… https://t.co/ntbgoNfswm
1258888272199192600,Fri May 08 22:35:27 +0000 2020,Compared to other apes, the main reason we walk so efficiently is our thicc thicc ass
1258803591625801700,Fri May 08 16:58:58 +0000 2020,With all these dang conspiracy theories popping up, here is a video explaining how and why these theories can trick… https://t.co/YnEWdVexus
1258471828143644700,Thu May 07 19:00:39 +0000 2020,@thephysicsgirl DO IT  Also, out next video is 15 min so...ready for the name police to hit us next 😂
1258187946940870700,Thu May 07 00:12:37 +0000 2020,This is how you pronounce X Æ A-12 Musk https://t.co/96NxzU7NEt
1258084814063906800,Wed May 06 17:22:48 +0000 2020,Our new video is for the science students stuck at home. Here is your project, MEMORIZE ALL YOUR TEETH! Watch it he… https://t.co/PJWeA6UWoR
1258083556338917400,Wed May 06 17:17:48 +0000 2020,We released a new music video from quarantine about your teeth, with @Sensodyne_US - one thing you do have control… https://t.co/UnRHObE8r1
1257811885157691400,Tue May 05 23:18:17 +0000 2020,AS IF @ladygaga IS TWEETING A PIC WITH OUR NAME ON IT 😭 *Pinches self*  Our little gay hearts are gonna explode 💗 https://t.co/gOcMTFqvpc
1257811300064821200,Tue May 05 23:15:57 +0000 2020,Sooo being part of a lineup that includes the Obama's, Gaga, BTS and these others miiiight be a bit of a moment for… https://t.co/9QIGOZJ1O5
1255973849654612000,Thu Apr 30 21:34:35 +0000 2020,RT @heysciencesam: If you want to learn more about vaccine development for #COVID19, check out this incredibly illustrated feature in Natur…
1255709381766848500,Thu Apr 30 04:03:41 +0000 2020,RT @MKBHD: If we do what we should, it’ll feel like we overreacted. Please do it anyway. https://t.co/M60Zrqam0C
1255579082651316200,Wed Apr 29 19:25:55 +0000 2020,From a physiological perspective new experiences slow down your perception of time. When doing something new your b… https://t.co/ir14wL2FDZ
1254585289353375700,Mon Apr 27 01:36:56 +0000 2020,If a massive flood, hurricane or wildfire happens during a global pandemic it is going to complicate physical dista… https://t.co/k2Zaovvcwu
1254497952422379500,Sun Apr 26 19:49:53 +0000 2020,A new pre-print says loss of smell IS a symptom of Coronavirus. Known as ‘anosmia’, losing the sense of smell was r… https://t.co/ofnWCUBeoL
1254493091639287800,Sun Apr 26 19:30:35 +0000 2020,Rihanna should rerelease ANTI but call it ANTIMATTER and make every song explain how a difference in symmetry betwe… https://t.co/8Zfi8ELpwR
1253020510222516200,Wed Apr 22 17:59:04 +0000 2020,RT @nwahs086: It's a wee bit ironic, he's in scrubs and she's hanging out the passenger side of her best friend's ride trying to holler htt…
1252252089008431000,Mon Apr 20 15:05:38 +0000 2020,In the distance you hear "pew pew pew".   Like, if you think lazers from Star Wars.  Retweet, if you think non-part… https://t.co/ZNem3TbFcr
1251946086006218800,Sun Apr 19 18:49:41 +0000 2020,Thought we'd join the #MeAt20 challenge 😂 How time flies! https://t.co/xHCfECd6nT
1250428012790595600,Wed Apr 15 14:17:24 +0000 2020,RT @uThat_Guy977: @AsapSCIENCE Hey, just wanted to let you know that your lab rules song is pretty much official learning material where I…
1249757648838410200,Mon Apr 13 17:53:37 +0000 2020,Having a science degree means you care less about grammar, but still obsess over the difference between a calorie and Calorie.
1249756006860669000,Mon Apr 13 17:47:06 +0000 2020,Even tho we're queer, at a certain point we have to suck it up, and accept that we derive our nutrition from other… https://t.co/2XPzPcSjfK
1249115605380333600,Sat Apr 11 23:22:22 +0000 2020,These cycle never ends. There is no final point. So when money is used as a motivational tool, your thirst will never be quenched 🤷
1249115604495335400,Sat Apr 11 23:22:22 +0000 2020,Of course, what OTHER people make has an impact too. People's job satisfaction decreases as other people's income a… https://t.co/CMSrSbLKjr
1249115603597758500,Sat Apr 11 23:22:22 +0000 2020,For every amount your actual income goes up $1.00, your required income to be satisfied goes up $1.40. This happens… https://t.co/puSSY2cUDW
1249115602654056400,Sat Apr 11 23:22:21 +0000 2020,Our idea of a good income is always *relative* to how much we make. Of course there are legitimate baselines for ho… https://t.co/zX4F57dREf
1249115601597018000,Sat Apr 11 23:22:21 +0000 2020,A lot of people find motivation in money. But I'm here to tell you that, that hunt never ends with satisfaction. Wh… https://t.co/s5R7H865UT
1249110652414648300,Sat Apr 11 23:02:41 +0000 2020,@MKBHD THANK YOU! Just saved us from making a video about this 😂
1249000562802204700,Sat Apr 11 15:45:14 +0000 2020,As the COVID19 pandemic continues and a lot of young people become restless with isolation, we need to remember thi… https://t.co/0Eheqgolfm
1248747196679368700,Fri Apr 10 22:58:26 +0000 2020,RT @dooleynoted___: Everyone should take a few minutes out of their day to watch this educational video from @AsapSCIENCE Love you boys 🧬 🧪…
1248747150076493800,Fri Apr 10 22:58:15 +0000 2020,RT @MacManX: "Even though your odds of dying from COVID-19 may not be high, it's important to stay home and stay away from people, to keep…
1248653300200857600,Fri Apr 10 16:45:20 +0000 2020,RT @macbethdc: Love this idea: Medics tape photos of themselves smiling on their PPE so patients can see a reassuring &amp; friendly face. Huma…
1248652071097774000,Fri Apr 10 16:40:27 +0000 2020,The cases of young people being hospitalized with COVID-19 is increasing, what happened?  Watch our new video here:… https://t.co/U16b6pf8wu
1248374166887100400,Thu Apr 09 22:16:09 +0000 2020,RT @brkthroughprize: Young science lovers - tell us a story! Watch @karliekloss @khanacademy @BillNye astronauts @StationCDRKelly + @Astro_…
1248366650417721300,Thu Apr 09 21:46:17 +0000 2020,RT @gracehelbig: I LOVED recording this podcast! It was so nice to commiserate about pressure and death! No joke!👇🏻
1248312651937087500,Thu Apr 09 18:11:43 +0000 2020,Our new podcast w/ @gracehelbig is out! We chat YouTube, tips for starting a YouTube channel and DEATH. YAYYYYYYYYY… https://t.co/GeocBjcHPM
1247639503507992600,Tue Apr 07 21:36:52 +0000 2020,RT @wendyzuk: When you go to the supermarket - how careful do you need to be? New #COVID19 @sciencevs with special guest, the very cautious…
1247594308351537200,Tue Apr 07 18:37:16 +0000 2020,Also, @smartereveryday drop the skin care routine. YOU ARE LOOKIN' FRESH
1247590995975422000,Tue Apr 07 18:24:07 +0000 2020,So, @smartereveryday and his beautiful wife @DestinsBride are constant inspirations to us, but this video blew us A… https://t.co/dfhtEGLYkp
1247581418714280000,Tue Apr 07 17:46:03 +0000 2020,RT @smartereveryday: I’m getting a lot of questions about how to set up an operation to help Doctors and Nurses.   We made a video so other…
1247563870966866000,Tue Apr 07 16:36:20 +0000 2020,@DrJoeHanson YES!!!
1247563824888234000,Tue Apr 07 16:36:09 +0000 2020,RT @jeremyfaust: LISTEN UP🔊  Patients with lupus, arthritis, other conditions are *already* on hydroxychloroquine.  And we are diagnosing t…
1247563803757289500,Tue Apr 07 16:36:04 +0000 2020,RT @DrJoeHanson: It's important to realize that lots of people already take this supposed COVID-19 miracle drug for other conditions. And t…
1247560964716802000,Tue Apr 07 16:24:47 +0000 2020,This is fascinating! As we look at scientific studies on quarantine, art is always impacted, but there isn't much r… https://t.co/eDm2rnqpsv
1247560038597701600,Tue Apr 07 16:21:06 +0000 2020,https://t.co/SRJF7dxGNH
1247560008239374300,Tue Apr 07 16:20:59 +0000 2020,Studies have found that it is easier to handle quarantine when thinking of it as an altruistic act. IT IS!!! So, fo… https://t.co/QmMRePAJCm
1247289359533060000,Mon Apr 06 22:25:31 +0000 2020,@smartereveryday Okay, seriously we are always in awe of you but HOW DID YOU DO THIS? My (Greg) sister is a respira… https://t.co/Ovm6fczv4c
1247288632672686000,Mon Apr 06 22:22:38 +0000 2020,RT @smartereveryday: I’m working on a team manufacturing emergency protective equipment for doctors and nurses. I need stuff built fast.  T…
1247165875196747800,Mon Apr 06 14:14:50 +0000 2020,Donald Trump tried to decrease funding for the NIH three years in a row. Do not forget that. In order for effective… https://t.co/ZjiSYJdeew
1247165172524945400,Mon Apr 06 14:12:02 +0000 2020,The National Institute of Health in America or the Canadian Institute of Health Research in Canada are government f… https://t.co/jrNwiFYmqy
1247164741992288300,Mon Apr 06 14:10:20 +0000 2020,Relying on the private sector / pharma co. to have drugs ready for novel pathogens isn't going to work. Antivirals… https://t.co/mORUHLyuGX
1247164050020106200,Mon Apr 06 14:07:35 +0000 2020,Researching our new video on antiviral medication made it extremely clear, WE NEED TO FUND AND SUPPORT NON-COMMERCI… https://t.co/ArNXyGisij
1246851938622288000,Sun Apr 05 17:27:22 +0000 2020,Trump is addressing the public AGAIN about hydroxychloroquine. ‘What do you have to lose? Take it.’     Find out in… https://t.co/wQ1bafcL4t
1246545239357231000,Sat Apr 04 21:08:39 +0000 2020,DNA glycosylase cleaning up mutations in your genome https://t.co/OO4NAOZbOy
1246183135022329900,Fri Apr 03 21:09:47 +0000 2020,This is a fascinating visual look at the SARS-CoV-2 virus. It has depictions of proteins along with genomic informa… https://t.co/YWo2SMZlIT
1245894784990040000,Fri Apr 03 02:03:59 +0000 2020,In quarantine watching our plants go through photosynthesis like: https://t.co/pYkKYe3E1W
1245858476930109400,Thu Apr 02 23:39:42 +0000 2020,The South African black rain frog predicted 2020 https://t.co/6uYgOmgvnu
1245830461676544000,Thu Apr 02 21:48:23 +0000 2020,Today, like any other day we are thinking about the doctors, nurses, RTs and frontline workers who are at hospitals… https://t.co/GQnzx1PMwW
1245775804698701800,Thu Apr 02 18:11:11 +0000 2020,Does anyone have info on how to make face shields?
1245739972608565200,Thu Apr 02 15:48:48 +0000 2020,RT @little_cuchara: The ONE and only time I decide to wash dishes whilst listening to Sidenote pod @Whalewatchmeplz has to call me out for…
1245732485239058400,Thu Apr 02 15:19:03 +0000 2020,It was 👎🏽 that Trump tweeted about ‘HYDROXYCHLOROQUINE &amp; AZITHROMYCIN’ because your doctor will understand symptoms… https://t.co/BBavV481PI
1245731764460494800,Thu Apr 02 15:16:11 +0000 2020,In this video you learn how antivirals affect the complex cellular biology of your body. It helps us understand the… https://t.co/Tq27m701I8
1245729856375185400,Thu Apr 02 15:08:36 +0000 2020,Our new video is about antiviral medication and curing COVID19! There are record breaking clinical trials happening… https://t.co/Zya2GVaz0g
1245687428142301200,Thu Apr 02 12:20:01 +0000 2020,If you're curious about how COVID19 antiviral drugs like chloroquine and remdesivir actually function (and if they… https://t.co/tgYG3TDRTj
1245597275700650000,Thu Apr 02 06:21:47 +0000 2020,As COVID-19 continues to spread, focus has now shifted to antiviral medication. How do they work? When can we expec… https://t.co/x0OVcNgi2s
1245540069856903200,Thu Apr 02 02:34:28 +0000 2020,RT @karenlambaa: #sidenotepodcast is the most consistent thing in my life rn, and helps me remember another week has passed &amp; we at Wednesd…
1245539998130221000,Thu Apr 02 02:34:11 +0000 2020,@wilisme_ FUCK BOIS LOL, but also FUCK BORIS
1245539929628819500,Thu Apr 02 02:33:54 +0000 2020,@wilisme_ Ribosomes are fuck Boris
1245539855582597000,Thu Apr 02 02:33:37 +0000 2020,@guo_lab Exact we want it reading DNA ONLY HUN
1245528412095221800,Thu Apr 02 01:48:08 +0000 2020,Shout out to RNA Polymerase for working around the clock to keep us alive *clap clap clap*
1245469053499650000,Wed Apr 01 21:52:16 +0000 2020,RT @abbeyhowe: Highly recommend the podcast Sidenote by @AsapSCIENCE if you’re looking for calm and simple information about COVID. Plus, t…
1244732163867771000,Mon Mar 30 21:04:08 +0000 2020,A really incredible vid by @minutephysics about the projected futures of COVID19. Can we see a light at the end of… https://t.co/PQhPt1RqAL
1244697826824683500,Mon Mar 30 18:47:41 +0000 2020,RT @RealDoctorMike: @AsapSCIENCE @PhillyD I talked about it on @abcWNN but it got cut in the edit :( He’s 1000% taking the wrong approach p…
1244692606975643600,Mon Mar 30 18:26:57 +0000 2020,@DrJoeHanson @okaytobesmart OBVZZZZZZZZZZZZZZZZZZZZZZZZZZZZZZ (short but also long for obviously)
1244647146051326000,Mon Mar 30 15:26:18 +0000 2020,@PhillyD Plz talk about how scary it is that Trump questioned whether medical professionals were hoarding masks thi… https://t.co/rYSL5rpEox
1244646419262210000,Mon Mar 30 15:23:25 +0000 2020,Healthcare workers are risking their lives and working under immense pressure only to be questioned by the ‘preside… https://t.co/731rftqxa0
1244328210780827600,Sun Mar 29 18:18:58 +0000 2020,The novel Coronavirus makes it hard to have novel experiences. New experiences neurologically slow down your percep… https://t.co/zLxVH2NGAz
1243639893055746000,Fri Mar 27 20:43:50 +0000 2020,RT @mitchellmoffit: Hi! It's my quarantine BDAY 🥳🎈Definitely not a typical birthday, but I'm sure I won't forget it - and I'm happy to help…
1243616532887978000,Fri Mar 27 19:11:01 +0000 2020,RT @NaomiAKlein: Monsters: "EPA suspends enforcement of environmental laws amid coronavirus" - indefinitely.  Had "been under pressure from…
1243352558602682400,Fri Mar 27 01:42:05 +0000 2020,America, don’t forget that Amazon, and the other 59 wealthiest corporations didn’t pay federal corporate tax in 201… https://t.co/EMZBdH3VLu
1243232050003554300,Thu Mar 26 17:43:13 +0000 2020,RT @RespectableLaw: He did it. Bernie just saved millions of people. https://t.co/NNOdsx8j9v
1242976839901098000,Thu Mar 26 00:49:06 +0000 2020,During quarantine which baby goat are you? Brown or black? https://t.co/yrYVucB79R
1242884929127690200,Wed Mar 25 18:43:53 +0000 2020,My LAWD WE LOVE YOU DESTIN!!!!! https://t.co/zPCdKWzAsg
1242861098161844200,Wed Mar 25 17:09:11 +0000 2020,NEW POD out on the Coronavirus vaccine! We chat how it’s made, timeline and if the current pandemic will abolish th… https://t.co/sxVFSfLtqa
1242822036289990700,Wed Mar 25 14:33:58 +0000 2020,RT @WonderWorksORL: Looking for fun and engaging content to share with your kids while they're home from school? We recommend the YouTube c…
1242821996230193200,Wed Mar 25 14:33:49 +0000 2020,RT @nannitym: @mssnzero I like listening to ASAP Science podcast called Sidenote! @AsapSCIENCE
1242607442283966500,Wed Mar 25 00:21:15 +0000 2020,Quarantine has us acting like a Bowerbird: https://t.co/sPAING2qLL
1242588127237193700,Tue Mar 24 23:04:30 +0000 2020,Quarantine benefits social media influencers but hinders grocery store clerks, healthcare professionals and caregiv… https://t.co/KCHdtkhx8B
1242587216867725300,Tue Mar 24 23:00:53 +0000 2020,RT @aljwhite: This is the best and clearest explanation of why people need to stay at home you could ever wish to see https://t.co/49Mgadlc…
1242507471429779500,Tue Mar 24 17:44:00 +0000 2020,RT @Whalewatchmeplz: Quarantine is good for FOMO because now if you see friends hanging without you it means they might die
1242133674025463800,Mon Mar 23 16:58:40 +0000 2020,RT @VanessaCarlton: Don't go downtown.
1242133585357869000,Mon Mar 23 16:58:19 +0000 2020,RT @Whalewatchmeplz: Here we are again having to deal with the danger of @JoeRogan speaking as if he's a scientist to millions. In his rece…
1242090790609920000,Mon Mar 23 14:08:16 +0000 2020,RT @neiltyson: This month, the US stock market lost two trillion dollars in market-cap due to a problem that science R&amp;D could have preempt…
1241806629303091200,Sun Mar 22 19:19:06 +0000 2020,A look at the uptick in published articles about Coronavirus since January 2020. While you are physical distancing,… https://t.co/InYZ71ZsB2
1241777630392848400,Sun Mar 22 17:23:52 +0000 2020,This warmed our bloodstreams https://t.co/1hqVCYUFvA
1241777506644000800,Sun Mar 22 17:23:23 +0000 2020,Children are just as likely to get infected by SARS-CoV-2 as adults. The fact that they aren’t getting as sick led… https://t.co/o36xpkd8qF
1241382875146092500,Sat Mar 21 15:15:15 +0000 2020,@mametown I thot it said a ‘month’ flew out and I was like WE DOOMED
1241382593775505400,Sat Mar 21 15:14:08 +0000 2020,RT @EdselSalvana: Please don't take hydroxychloroquine (Plaquenil) plus Azithromycin for #COVID19 UNLESS your doctor prescribes it. Both dr…
1241382509792964600,Sat Mar 21 15:13:48 +0000 2020,This is a dangerous, exaggerated and horrifying denial of proper science. LISTEN TO HEALTHCARE PROFESSIONALS DO NOT… https://t.co/BaQTbjogSD
1241375592009924600,Sat Mar 21 14:46:19 +0000 2020,RT @abeard07: Another banger video from @AsapSCIENCE at a time when we need clear, simple knowledge transfer and well explained science mos…
1241375391048175600,Sat Mar 21 14:45:31 +0000 2020,RT @Whalewatchmeplz: When you realize forces of nature acting on atoms is what creates your ability to conceptualize the idea of a ‘virus’:…
1241374470960484400,Sat Mar 21 14:41:52 +0000 2020,RT @smartereveryday: A wonderful video about the effort to creat a vaccine by @AsapSCIENCE   https://t.co/Q8BN4U0mSU
1241214797691195400,Sat Mar 21 04:07:23 +0000 2020,Wow, I just found MY OWN mailing list email in my SPAM BOX. 2020 keeps on going
1241207404978675700,Sat Mar 21 03:38:00 +0000 2020,As COVID-19 spreads we're all doing our part by self-isolating. But as the virus and disease progress, one big ques… https://t.co/NrkWL7pVvK
1241179405386473500,Sat Mar 21 01:46:44 +0000 2020,If banks get a bailout they need to stop funding fossil fuel projects. If we have to save you, you have to save us
1241121814966911000,Fri Mar 20 21:57:54 +0000 2020,THIS IS SOY GOOD https://t.co/5q5603RmZZ
1241115065329373200,Fri Mar 20 21:31:05 +0000 2020,RT @stevenstrogatz: My friend Zameer just taught me the first 100 digits of pi -- by singing them to me! He learned them from this video: h…
1241093993015935000,Fri Mar 20 20:07:21 +0000 2020,RT @Whalewatchmeplz: My early bio textbook showed white blood cells fighting a virus as a bunch of muscle men fighting naked and ever since…
1241093869326008300,Fri Mar 20 20:06:51 +0000 2020,@thephysicsgirl Put this in the MoMA
1241079825131069400,Fri Mar 20 19:11:03 +0000 2020,@moomoozain Dang! I'm hoping to just get the digital copy tonight!
1241073648787751000,Fri Mar 20 18:46:30 +0000 2020,Trying to finish up a new video so I can finally play Animal Crossing!  Who's already started??
1241056581908926500,Fri Mar 20 17:38:41 +0000 2020,Love this!!! Try these experiments with your kids at home while you're all cooped up. You're the best… https://t.co/HGCO5q1Zfs
1240792243306401800,Fri Mar 20 00:08:18 +0000 2020,Okay, we’re literally crying https://t.co/p9pQQMBpmv
1240731152027181000,Thu Mar 19 20:05:32 +0000 2020,The Spanish Flu likely originated in America (one of the most prominent theories) and is only named the Spanish Flu… https://t.co/Hx9TkLBNNY
1240728545736917000,Thu Mar 19 19:55:11 +0000 2020,THE BESTEST https://t.co/dTIcfaKfng
1240419236419379200,Wed Mar 18 23:26:06 +0000 2020,Hope you’re learning lotsy!!!!! XOXOXOXO https://t.co/b68wqhCigr
1240297687620214800,Wed Mar 18 15:23:07 +0000 2020,RT @MarkRober: This is anti-science and damaging. Because of this I’ve had to spend so much time over the past week trying to convince my D…
1240297632620298200,Wed Mar 18 15:22:53 +0000 2020,RT @DrJoeHanson: Out now on @okaytobesmart: A close look at what this curve really means for #COVID19   I hope this helps people learn why…
1239981285520654300,Tue Mar 17 18:25:50 +0000 2020,RT @GretaThunberg: Solidarity, science and common sense will get us through any crisis. Let's keep that in mind. #COVID19
1239939764612104200,Tue Mar 17 15:40:51 +0000 2020,RT @BradyHaran: Twitter’s default text nailed it! https://t.co/Wgaxo5OERs
1239939438576308200,Tue Mar 17 15:39:33 +0000 2020,His claim to fame is being an effective scam artist, lying is his specialty. https://t.co/Lc2r4nBlxs
1239938313202684000,Tue Mar 17 15:35:05 +0000 2020,Well, we all self-isolating rn but maybe post that! :) https://t.co/Qud9NoID1S
1239728182615572500,Tue Mar 17 01:40:06 +0000 2020,RT @DrJoeHanson: Lives have been lost and put in danger over the last several weeks due to science denial. We will have a long reckoning wh…
1239627350943416300,Mon Mar 16 18:59:26 +0000 2020,So important to be reminded that you can exhibit no symptoms and still have the virus/be a carrier.   Thanks for sh… https://t.co/Gk0CWTIZJo
1239611330484678700,Mon Mar 16 17:55:46 +0000 2020,Grocery store clerks deserve a raise!
1239611276315242500,Mon Mar 16 17:55:33 +0000 2020,Healthcare workers deserve a raise!
1239599414831992800,Mon Mar 16 17:08:25 +0000 2020,We love you @RealDoctorMike - #ALERTNOTANXIOUS DADDY! We appreciate all you do. https://t.co/acTMDD1Ziv
1239598967291330600,Mon Mar 16 17:06:39 +0000 2020,RT @OnlyOnePreeti: I JUST watched this video released on Jan 30 by the amazing  @AsapSCIENCE  - I LOVE their channel and the work they do a…
1239247880868835300,Sun Mar 15 17:51:33 +0000 2020,We’re playing Just Dance and based on these scores we’re Jennifer Lopez backup dancers  How are you staying active while social distancing?
1239245938763477000,Sun Mar 15 17:43:50 +0000 2020,RT @Whalewatchmeplz: I’m not going to the gym right now in order to flatten my curves
1239212934217244700,Sun Mar 15 15:32:41 +0000 2020,RT @mitchellmoffit: Ok but why are we just like 'NO BIG DEAL if 3% of people die' 🤷‍♂️? Such a selfish perspective.   If you know 300 peopl…
1239016302334939100,Sun Mar 15 02:31:20 +0000 2020,RT @tina_nguyen: I have a very close friend who’s a researcher studying public health at a major NGO, and he told me that this was THE week…
1239003729464090600,Sun Mar 15 01:41:23 +0000 2020,One more time for the people in the back: LISTEN TO HEALTHCARE PROFESSIONALS!!!  It is time to socially distance. D… https://t.co/iYT8kRVgKO
1239002686797811700,Sun Mar 15 01:37:14 +0000 2020,RT @AOC: To everyone in NYC but ESPECIALLY healthy people &amp; people under 40 (bc from what I’m observing that’s who needs to hear this again…
1238824616774078500,Sat Mar 14 13:49:39 +0000 2020,RT @Whalewatchmeplz: No one:  Every science communicator: IT’S PI DAY! OMG NOT PIE BUT PI! HAPPY PI DAY 3.14 WHO NOW? WOOP WOOP PIPIPIPIPIP…
1238822311567876000,Sat Mar 14 13:40:29 +0000 2020,@shojium All done now! Lol 😂
1238819571227742200,Sat Mar 14 13:29:36 +0000 2020,HAPPY PI DAY! Time to memorize 100 digits of pi #piday #PiDay2020 https://t.co/gVeDySaikQ
1238817277765537800,Sat Mar 14 13:20:29 +0000 2020,8
1238817276888899600,Sat Mar 14 13:20:29 +0000 2020,3
1238817275865477000,Sat Mar 14 13:20:29 +0000 2020,3
1238817274930192400,Sat Mar 14 13:20:29 +0000 2020,4
1238817273986465800,Sat Mar 14 13:20:28 +0000 2020,6
1238817273135026200,Sat Mar 14 13:20:28 +0000 2020,2
1238817272161919000,Sat Mar 14 13:20:28 +0000 2020,6
1238817271323095000,Sat Mar 14 13:20:28 +0000 2020,4
1238817270513582000,Sat Mar 14 13:20:28 +0000 2020,8
1238817269666287600,Sat Mar 14 13:20:27 +0000 2020,3
1238817268324130800,Sat Mar 14 13:20:27 +0000 2020,2
1238817267527192600,Sat Mar 14 13:20:27 +0000 2020,3
1238817266688385000,Sat Mar 14 13:20:27 +0000 2020,9
1238817265853722600,Sat Mar 14 13:20:26 +0000 2020,7
1238817264956084200,Sat Mar 14 13:20:26 +0000 2020,9
1238817264121442300,Sat Mar 14 13:20:26 +0000 2020,8
1238817263324508200,Sat Mar 14 13:20:26 +0000 2020,5
1238817262535970800,Sat Mar 14 13:20:26 +0000 2020,3
1238817261739069400,Sat Mar 14 13:20:25 +0000 2020,5
1238817261009264600,Sat Mar 14 13:20:25 +0000 2020,6
1238817260233298000,Sat Mar 14 13:20:25 +0000 2020,2
1238817259340079000,Sat Mar 14 13:20:25 +0000 2020,9
1238817258513633300,Sat Mar 14 13:20:25 +0000 2020,5
1238817255489585200,Sat Mar 14 13:20:24 +0000 2020,1
1238817254839468000,Sat Mar 14 13:20:24 +0000 2020,Happy Pi Day!  3.14
1238814335998148600,Sat Mar 14 13:08:48 +0000 2020,While quarantined, why not learn every digit of Pi? #PiDay #PiDay2020 https://t.co/PO59G5APC0
1238580028440375300,Fri Mar 13 21:37:45 +0000 2020,There is amazing research about anti-viral medication, isolating the SARS-CoV-2 virus and other current breakthroug… https://t.co/SodSfFcpYR
1238552821298937900,Fri Mar 13 19:49:38 +0000 2020,This isn't a virus, but still amazing to see! https://t.co/9rdFHtLwwX
1238528404330295300,Fri Mar 13 18:12:36 +0000 2020,RT @Whalewatchmeplz: Excited to study the epidemiological uptick in carpel tunnel from people ferociously tapping out their hot takes from…
1238526580097507300,Fri Mar 13 18:05:22 +0000 2020,RT @ieknot: 6) Explore amazing science communication over on @Youtube. Start with exploring @Kurz_Gesagt, @veritasium, @TED_ED, @SciShow an…
