id,created_at,text
1141709506327588900,Thu Jun 20 14:08:52 +0000 2019,I feel like wherever you two are the sun is always shining. Do we need to move? Or is it pathetic fallacy? https://t.co/DCoPqDtuXJ
1141708804494647300,Thu Jun 20 14:06:05 +0000 2019,A new study found that 76% of high school students surveyed want to be a YouTuber. Little do they know that it mean… https://t.co/uw5zvpHDIl
1141554889157427200,Thu Jun 20 03:54:29 +0000 2019,Even though we are YouTubers in many ways we suck at YouTube and JUST watched @SimoneGiertz new MASTERPIECE! #TRUCKLA ELON MUSK WISHES
1140598434342326300,Mon Jun 17 12:33:52 +0000 2019,It’s hard to get mainstream culture to love science. Do you think it would help if we renamed adenosine triphosphate to energy drink?
1140435853313019900,Mon Jun 17 01:47:50 +0000 2019,RT @weird_sci: Why don't you hear a pterodactyl go to the bathroom?  The P is silent.
1140352524878274600,Sun Jun 16 20:16:43 +0000 2019,Here is a scientific breakdown of personal space.  INTIMATE SPACE: 18 inches. For family, friends + consensual love… https://t.co/Mx5tJslZVU
1140112555991588900,Sun Jun 16 04:23:10 +0000 2019,Also this!!! What an epic pride month 🌈 https://t.co/8O2iWxbBC3
1140111855341527000,Sun Jun 16 04:20:23 +0000 2019,This was so stunning and spoke so many words. Proud of you  Xo https://t.co/M1EbZ8zDvD
1139912165912121300,Sat Jun 15 15:06:53 +0000 2019,RT @Whalewatchmeplz: The only good thing kids can take away from this measles outbreak is that it adds some new high stakes to the game of…
1139614871681740800,Fri Jun 14 19:25:33 +0000 2019,Tik Tok! ⏰Your body is a clock!  Even your liver knows what time it is.  Scientists disconnected the central clock… https://t.co/LwAIBEq3Ac
1139569990460485600,Fri Jun 14 16:27:12 +0000 2019,Okay @Drake - GOOD JOB HELPING THE RAPTORS - we love you. Okay next on the list is ... CLIMATE CHANGE. Let’s do this bruv, DROP A TRACK
1139561420545306600,Fri Jun 14 15:53:09 +0000 2019,@sarcoughagus LOLLLL. Yep! Edison was a jerk.
1139561206455447600,Fri Jun 14 15:52:18 +0000 2019,Bioluminescent algae is STUNNING 💅 but also DEADLY 💀  Over the past 2 decades these microorganism are becoming more… https://t.co/dPEveytQYq
1139540352531087400,Fri Jun 14 14:29:26 +0000 2019,Say hello to the world's strongest magnet 🧲"Little Big Coil 3"🧲  This magnet creates 45.5 tesla (fyi tesla is not j… https://t.co/gtAHZiKUF1
1139219346973175800,Thu Jun 13 17:13:52 +0000 2019,It is estimated that by 2050 there will be more plastic than fish in the ocean by biomass :(  Learn more trash fact… https://t.co/A4jEnIyE3x
1139216944882749400,Thu Jun 13 17:04:19 +0000 2019,Swimming in a bunch balls ... now THIS is Pride content we are here for. @veritasium   🌈 🍒 😉   https://t.co/mrWcpgkveD
1139171624605933600,Thu Jun 13 14:04:14 +0000 2019,RT @senelersin: What if we burned all trash on Earth? by @AsapSCIENCE https://t.co/OnZLlRAdbI
1139157242735992800,Thu Jun 13 13:07:05 +0000 2019,Our new obsession is MANGROVES.  These trees and shrubs live in water 100X saltier than most plants could handle.… https://t.co/SIfYkRheFN
1138955820878708700,Wed Jun 12 23:46:43 +0000 2019,Um, @thephysicsgirl we never want your eye balls to pop out of your face  https://t.co/J6L8qeODKp
1138790424276066300,Wed Jun 12 12:49:29 +0000 2019,Playing certain sounds for mustard plants increased survival in the face of simulated drought. Mung beans and rice… https://t.co/jaVJ0Mizmc
1138598728158367700,Wed Jun 12 00:07:45 +0000 2019,We always thought burning trash was a bad thing, but what if it’s the solution to our waste problems?   Watch our N… https://t.co/FLlxktq9uV
1138494621036810200,Tue Jun 11 17:14:04 +0000 2019,What do aliens, skiiers, and fish have in common? New video out TONIGHT at 8PM EST! Can you guess what it’s about? https://t.co/b6naq1rAqS
1138191204775014400,Mon Jun 10 21:08:24 +0000 2019,RT @Whalewatchmeplz: Me when someone denies climate change https://t.co/uHRrWZ6imQ
1138082898257600500,Mon Jun 10 13:58:02 +0000 2019,The evolution of life is a complex concept.  Some see it as a solution to a problem.   Some see it as a variety of… https://t.co/B04Hrt4Ofx
1137745758558609400,Sun Jun 09 15:38:21 +0000 2019,A new study used mathematicians and IMDB to find that most actors have one year where they are successful before it… https://t.co/NW5BNlg9bA
1137099848157716500,Fri Jun 07 20:51:44 +0000 2019,RT @Whalewatchmeplz: Nature: peoples lungs will have a super thin membrane designed to easily allow oxygen to pass through into the bloodst…
1137066111713861600,Fri Jun 07 18:37:41 +0000 2019,Yikes! A new study finds the average person eats at least 50,000 particles of microplastic a year!   This picture s… https://t.co/3woGFnkbNp
1136711616513368000,Thu Jun 06 19:09:03 +0000 2019,#tbt to the @breakthrough Prize last year! Wait, R U BETWEEN 13-18 YRS OLD? You could come to the next one just by… https://t.co/MrrfFcgt2G
1136702258119417900,Thu Jun 06 18:31:51 +0000 2019,GOOD NEWS! The Great Barrier Reef can bounce back!     A recent study found the reef has survived five near death e… https://t.co/WYkg7bmJOs
1136666558988783600,Thu Jun 06 16:10:00 +0000 2019,The Secret Life of CATS! https://t.co/UgHm6pvabJ
1136652088992313300,Thu Jun 06 15:12:30 +0000 2019,@bowenyang We’re up here hoping for her! Remember you can always come back 🇨🇦 xo
1136651620668858400,Thu Jun 06 15:10:38 +0000 2019,LISTEN UP! We reached a NEW RECORD 🔔 💥   In all the 61 years of observation the month of May 2019 now goes down in… https://t.co/TciTUW3uJL
1136647920797847600,Thu Jun 06 14:55:56 +0000 2019,This Lilac-breasted Roller is the new face of Pride. Your bank endorsement has NOTHING on this evolved piece of NAT… https://t.co/V0PXTUyOoj
1136342764961054700,Wed Jun 05 18:43:22 +0000 2019,No THIS is fashion! 💅🏻 YAY DIANNA + ALSO GOOD JOB @TeenVogue https://t.co/7TLS8PKB77
1136334079790592000,Wed Jun 05 18:08:51 +0000 2019,The EPA’s most recent census of waste found that in 2015 each person in America produced 4.5 pounds of waste per da… https://t.co/75HO8Uvgxg
1136283857647546400,Wed Jun 05 14:49:17 +0000 2019,Just wanted to say we're so glad @Hbomberguy exists. Thank you for this masterpiece    https://t.co/pLna5DzK1o
1136260822299291600,Wed Jun 05 13:17:45 +0000 2019,RT @Whalewatchmeplz: Gym rat: do you even lift, bro?  Science rat: do you even have contraction occur when calcium ions excite one type of…
1136246763545870300,Wed Jun 05 12:21:53 +0000 2019,A new report finds that 215 of the largest corporations will lose around $1 trillion in the coming decades due to c… https://t.co/NZNxe0Dw0Y
1135900547284983800,Tue Jun 04 13:26:09 +0000 2019,RT @GretaThunberg: Some of my speaches have been released as a book by Penguin Random House. It’s out now. All of my earnings will go to ch…
1135900425616592900,Tue Jun 04 13:25:40 +0000 2019,@MagistersGM OMG *raises hands off of keyboard and says 'wow'*
1135900306431254500,Tue Jun 04 13:25:11 +0000 2019,@Exollent2 LOL
1135900053896405000,Tue Jun 04 13:24:11 +0000 2019,@allitos13 https://t.co/pm4MwGgOkT  It is a complex equation. They tried to make the answer simple for impact but h… https://t.co/lV6F7lPHWS
1135899901009768400,Tue Jun 04 13:23:35 +0000 2019,@ElliotGovier it was a complicated calculation so the study averaged a thickness of sea ice
1135899800656912400,Tue Jun 04 13:23:11 +0000 2019,@DonnaMorgan8 yep, the study tried to make an average using a general thickness of sea ice!
1135897783813247000,Tue Jun 04 13:15:10 +0000 2019,There are now 971 confirmed US measles cases in 2019. That is the highest level in 25 years.  For anyone trying to… https://t.co/DVQD7A0TTv
1135894823712542700,Tue Jun 04 13:03:24 +0000 2019,There is a growing anti-flying movement in Scandinavia. Would you ever commit to this?
1135894437865955300,Tue Jun 04 13:01:52 +0000 2019,One passenger on one flight from New York to LA releases enough emissions to melt 32 square feet of Arctic Sea Ice. 😱
1135591006919958500,Mon Jun 03 16:56:08 +0000 2019,If a pregnant mother ever feels a kick the fetus isn’t awake as they sleep 24/7. SLEEPING 24/7!?!? It’s like ummmmm plz take me back
1135579429088874500,Mon Jun 03 16:10:08 +0000 2019,Don’t stay stationary bae https://t.co/JsYc84fHzJ
1135548357542330400,Mon Jun 03 14:06:40 +0000 2019,Okay, the Highveld Mole Ray can’t feel pain from wasabi #goalsaf  The chemical compound that causes the pain is all… https://t.co/efJAO61Ndc
1135539018089676800,Mon Jun 03 13:29:33 +0000 2019,This vid is INSANE! SpaceX just launched 60 satellites but astronomers are MAD AF because they are too bright and d… https://t.co/EjO6jV3AKe
1134642955359273000,Sat Jun 01 02:08:55 +0000 2019,Sleep Tip! Take a hot shower before bed   A hot shower or bath actually drops your core body temperature faster, tr… https://t.co/wQPxMUFbwF
1134488608084299800,Fri May 31 15:55:36 +0000 2019,If possible what would you metamorphose into? We would become a butterfly so we can drink other peoples salty tears… https://t.co/i14yRfsbe5
1134105083879333900,Thu May 30 14:31:37 +0000 2019,Me:  Climate change denier: But Earth goes through NATURAL CYCLES of heating and cooling!!  Scientists: "New study… https://t.co/tlxdrlWCAr
1134085434873667600,Thu May 30 13:13:32 +0000 2019,@rebekastaffordx Aw, this made our day!
1133914562250641400,Thu May 30 01:54:33 +0000 2019,Can't sleep? Go watch our NEW video ‘How To Fall Asleep In 2 Minutes’ on our YouTube channel for more tips that wil… https://t.co/1lmOJ4Kh4r
1133904520315134000,Thu May 30 01:14:39 +0000 2019,@GeoffdBarrett just following our salt and peppa' daddy of science
1133903097502326800,Thu May 30 01:09:00 +0000 2019,We're responding to comments on our new YouTube video NOW! Come join us 😎
1133902700364652500,Thu May 30 01:07:25 +0000 2019,@GeoffdBarrett You know it 😉
1133901426223132700,Thu May 30 01:02:21 +0000 2019,Anybody else head to bed totally exhausted only to lay awake forever? Our new video on YouTube explores how to fall… https://t.co/gslURRV0lc
1133899358485827600,Thu May 30 00:54:08 +0000 2019,@Anthony59493214 https://t.co/XA4Xb58Bgf
1133899104973742100,Thu May 30 00:53:08 +0000 2019,NEW VIDEO OUT IN 10 MINUTES 😁🥳 Who's ready???
1133885382985211900,Wed May 29 23:58:36 +0000 2019,@AlyKattt16 I mean, basically all our videos involve dopamine in one way or another 😂
1133885253154725900,Wed May 29 23:58:05 +0000 2019,@Curtisa01843074 Can't live without this one, actually!
1133885098519121900,Wed May 29 23:57:28 +0000 2019,@TriupLauro Some might jokingly consider it an addiction!! It's definitely something you need tho...
1133842868328648700,Wed May 29 21:09:40 +0000 2019,@sarcoughagus OMG YOU'RE HIRED
1133842818714222600,Wed May 29 21:09:28 +0000 2019,@diyuu24 hang tight bb we in the worx
1133842745938853900,Wed May 29 21:09:11 +0000 2019,@Semprum3 this is such a great idea, theeeenk yeeeeew
1133770415820742700,Wed May 29 16:21:46 +0000 2019,New video out TONIGHT at 9PM! Can you guess what it's about? https://t.co/TbO0DQWHoU
1133751808881512400,Wed May 29 15:07:49 +0000 2019,🍑 &gt; 🌱 https://t.co/GXg0lYrRtL
1133733939288444900,Wed May 29 13:56:49 +0000 2019,Due to a shift in cultural trends by 2035 79.1% of Americans will opt to be cremated.  It is better for the environ… https://t.co/sqdaNbAqsU
1133725458263093200,Wed May 29 13:23:07 +0000 2019,Seabirds have special organs above their eyes that take the excess salt in their bloodstream and excrete it through… https://t.co/pwSPcNH2WS
1133724776109883400,Wed May 29 13:20:24 +0000 2019,Wanna hear something BO$$?  Fungi eat rocks.  🍄 = 💪🏼
1133393634303328300,Tue May 28 15:24:34 +0000 2019,Place your finger between your eyes.  Now move it up your forehead two inches.  Close your eyes.   This is where yo… https://t.co/NJT9gIKIU1
1133355466975776800,Tue May 28 12:52:54 +0000 2019,Having trouble with procrastination? WE FEEL YOU  This new study found that mindfulness (paying close attention to… https://t.co/dqzte6UIsu
1133115265435275300,Mon May 27 20:58:26 +0000 2019,Read and share this article. American politicians are trying to deny climate science, open up debate around the ver… https://t.co/u4b8SAKvn0
1133059704077332500,Mon May 27 17:17:39 +0000 2019,@amanbasssi Exaccccccctly!!!
1133058649138573300,Mon May 27 17:13:27 +0000 2019,The NIH grants to scientists under the age of 36 fell from 5.6% in 1980 to 1.5% in 2017. If you want cutting edge s… https://t.co/k5tgrNRqmt
1133055404878049300,Mon May 27 17:00:34 +0000 2019,@emmachamberlain Collabo? LOLZZZZzzzzz. In short it is the temperature of the water NOT the fact that water is a li… https://t.co/Pn383jIEQv
1132402353376825300,Sat May 25 21:45:34 +0000 2019,@HopeToMakeSense @Kurz_Gesagt @DrJoeHanson @smartereveryday @MarkRober @PaulShe59515563 @MrBeastYT OMG YES!
1132348100952113200,Sat May 25 18:09:59 +0000 2019,THIS IS ... ugh this* 🤦🏽‍♂️
1132341480104845300,Sat May 25 17:43:41 +0000 2019,If anyone ever makes you feel stupid remember the human brain contains roughly 85 billion neurons each connected to… https://t.co/aRPhpl6r6u
1131979842352758800,Fri May 24 17:46:40 +0000 2019,#FridaysForFuture these children are inspiring AF https://t.co/BuuawExgQV
1131979348616077300,Fri May 24 17:44:42 +0000 2019,YAAAAS KWEEEENS! #FridaysForFuture https://t.co/SUjUFjkdW7
1131979103207399400,Fri May 24 17:43:44 +0000 2019,We out here @GretaThunberg !!! #FridaysForFuture https://t.co/KrjO8cC8Gv
1131954338874761200,Fri May 24 16:05:19 +0000 2019,@DrJoeHanson @smartereveryday @MarkRober @PaulShe59515563 @MrBeastYT Get some girl science power in here too 😎… https://t.co/cEyDdKqKAY
1131926085694832600,Fri May 24 14:13:03 +0000 2019,RT @Whalewatchmeplz: Any students in Toronto who want to skip school and come to #FridaysForFuture w/ me and @mitchellmoffit we will be at…
1131912198186577900,Fri May 24 13:17:52 +0000 2019,@Kurz_Gesagt @DrJoeHanson @smartereveryday @MarkRober @PaulShe59515563 @MrBeastYT Same! We're in. This could be tur… https://t.co/PtUhKOhwqJ
1131697012028706800,Thu May 23 23:02:48 +0000 2019,We’ll be at Nathan’s Phillip’s Square in support for #FridaysForFuture tomorrow. Come be on our Instagram we wanna… https://t.co/VXbY9dnutS
1131696294093893600,Thu May 23 22:59:57 +0000 2019,The anthropocene is not looking cute rn
1131552746258292700,Thu May 23 13:29:32 +0000 2019,Retweet these 3 ways to decrease driving emissions:  1) Drive smoothly. Fast acceleration and rapid braking uses mo… https://t.co/ZQ3L6n3esC
1131550092215894000,Thu May 23 13:18:59 +0000 2019,Wolves know how to serve face 💅  Wolves have a sophisticated social structure which involves communication via faci… https://t.co/V60oL0BXgw
1130857610029092900,Tue May 21 15:27:19 +0000 2019,Your body gets around 3 billion heartbeats.  Make em’ count ❤️
1130334244541272000,Mon May 20 04:47:39 +0000 2019,This was amaze. Our next video is going to be 34 minutes long and called ‘Spending 48 days trapped in a tiny little… https://t.co/2M2hULEbmN
1130150154126975000,Sun May 19 16:36:08 +0000 2019,RT @GretaThunberg: May 24th. Global strike for the climate. Activism works. So act. Join us!  Find or register your local strike on https:/…
1130129656747831300,Sun May 19 15:14:41 +0000 2019,If anyone burns you just remember they are only a bunch of atoms knocking into one another under the influence of g… https://t.co/yGq86wIH9F
1129749627228627000,Sat May 18 14:04:35 +0000 2019,RT @Whalewatchmeplz: I’m extremely passionate about the functionality of biological processes which is why I never hold in a fart
1129104401338196000,Thu May 16 19:20:41 +0000 2019,RT @rihanna: take a look. these are the idiots making decisions for WOMEN in America.  Governor Kay Ivey...SHAME ON YOU!!!! https://t.co/Wu…
1129101660733804500,Thu May 16 19:09:48 +0000 2019,Laws that limit a women’s access to abortion do not reduce the number of abortions. Countries where abortions are i… https://t.co/15TkjbnQZQ
1129100652779638800,Thu May 16 19:05:47 +0000 2019,This is such an important video right now. Please share as the laws in Alabama have not passed yet, but people need… https://t.co/yiCRu6Yiv7
1129095396574281700,Thu May 16 18:44:54 +0000 2019,@Annakegel2 YUP
1129079139049312300,Thu May 16 17:40:18 +0000 2019,Retweet if you’re wearing headphones RN! 🎧   Our new vid explains the science of headphones and your hearing. Watch… https://t.co/8qQSjISENP
1128331985234071600,Tue May 14 16:11:23 +0000 2019,How bad are AirPods and other headphones for your ears???   Find out in our new vid here: https://t.co/gIRGSOP6eY https://t.co/xKjTs7lzmG
1128301350998224900,Tue May 14 14:09:39 +0000 2019,Human: Our genome contains 3 BILLION nucleotides. The complexity of which is astonishingly beautiful and allows us… https://t.co/KBUL2OpNYU
1128102174314119200,Tue May 14 00:58:12 +0000 2019,RNA over DNA  Don’t @ us
1128035456560631800,Mon May 13 20:33:05 +0000 2019,This was kinda hot...   Daddy of science speaking the truth! @BillNye  https://t.co/a1Iea77rB3
1128011698558984200,Mon May 13 18:58:41 +0000 2019,@Richard37633703 We’re working on it now! Will be in a few weeks as we prep to make it better than everrrr
1127940723054186500,Mon May 13 14:16:39 +0000 2019,RT @Whalewatchmeplz: *sigh* Spring is in the air.   Nothing is better than that fuzzy feeling you get when lying in bed listening to the bi…
1127939346265456600,Mon May 13 14:11:10 +0000 2019,This new study predicts where the next measles outbreak in America will be based on proximity to airports and numbe… https://t.co/zF60RQZIFV
1127926915275292700,Mon May 13 13:21:47 +0000 2019,Let’s not stop saying this.  Direct human activity like fishing or farming and indirect activity like burning of fo… https://t.co/Y2fQ9InglD
1127559723958587400,Sun May 12 13:02:41 +0000 2019,Similar! The advent of LED blue spectrum lightning has been shown to have the greatest impact, but any light source… https://t.co/0xFqgYM1FM
1127559368839397400,Sun May 12 13:01:17 +0000 2019,@itsmac_twt Try reading something that doesn't emit light, like a book, magazine, etc!
1127559189797244900,Sun May 12 13:00:34 +0000 2019,@rxtno Lol yes some nights I'll feel so proud for not having used my phone and then panic when I realize I need to open it to set my alarm 😆
1127558994338488300,Sun May 12 12:59:47 +0000 2019,Sleep scientists suggest 1-2 hours before bed you avoid blue-light devices (like phones) but even standard lighting… https://t.co/3B5yDr4cyz
1127557239244513300,Sun May 12 12:52:49 +0000 2019,DIGITAL HANGOVERS are a thing!  Using your phone or tablet in the hours before bed suppresses melatonin levels by a… https://t.co/XLaKA2AaMJ
1126982475027243000,Fri May 10 22:48:55 +0000 2019,RT @Whalewatchmeplz: Current humans: Ew, I can’t eat insects to help save the enviro  Our ancestors: https://t.co/ns614Py4YP
1126935040078876700,Fri May 10 19:40:25 +0000 2019,This frog is Friday afternoon in a nutshell. https://t.co/U7pZCKpDLq
1126921206916112400,Fri May 10 18:45:27 +0000 2019,@mrmattsimmons I totally agree, I hope this isn't just a bandaid so he can PEACE OUT
1126921089609760800,Fri May 10 18:44:59 +0000 2019,Henry Cavill is using his boddy oddy to promote No1. Rosemary water. It claims to increase memory function. Reading… https://t.co/sILO6PpDoj
1126911564060266500,Fri May 10 18:07:08 +0000 2019,@rmaraj810 Totally, like would America control this 'world'?
1126909713843724300,Fri May 10 17:59:47 +0000 2019,Jeff Bezos unveiled a plan to go to space in a presentation that looks like an Ariana Grande concert. He pictures a… https://t.co/p7s0QwPQuI
1126863132964589600,Fri May 10 14:54:41 +0000 2019,Greg’s favourite animal but make it fashion. What is your fave animal? https://t.co/3dTe0R39TC
1126831405340745700,Fri May 10 12:48:37 +0000 2019,RT @P4F_Hamburg: This is #FridaysForFuture in Hamburg today fighting for climate protection.  @GretaThunberg   #ActNOWforFuture https://t.c…
1126495174207651800,Thu May 09 14:32:33 +0000 2019,RT @Whalewatchmeplz: The gay uncle hypothesis is a scientific theory using epigenetics to explain that the more sons a mom has the more lik…
1126490105223491600,Thu May 09 14:12:24 +0000 2019,Wild that we are all made of matter but nothing matters 😂
1126314219304046600,Thu May 09 02:33:30 +0000 2019,This newly found homo denisova jaw bone gives evidence that they’d adapted well to breath at high altitudes. But it… https://t.co/VPx2E7Mt20
1126281063683248100,Thu May 09 00:21:45 +0000 2019,@2uullo I think things are too complex for me to believe in it right now, but maybe in the future when we know more it would make sense.
1126149716289499100,Wed May 08 15:39:49 +0000 2019,RT @DrJoeHanson: If we made fossil fuels cost what they actually should cost, instead of spending &gt;6% of global GDP to keep their prices ar…
1126144448981884900,Wed May 08 15:18:54 +0000 2019,RT @BBC: A very happy 93rd birthday to Sir #DavidAttenborough!  🎂 As good a day as any to remember when he was upstaged by a bird... 😂🐦 htt…
1126135244393013200,Wed May 08 14:42:19 +0000 2019,Also - if you want more incredible info on quantum computers watch the new @minutephysics video here:… https://t.co/iIkavaclrn
1126134587535577100,Wed May 08 14:39:42 +0000 2019,In BIG NEWS that sounds like SMALL NEWS a team of quantum physicists used a computer algorithm to get a simulated p… https://t.co/azM7c1UG7L
1125951968889974800,Wed May 08 02:34:03 +0000 2019,Jair Bolsonaro is attacking indigenous people in Brazil. He is doing this to increase mining and deforestation on i… https://t.co/mcqvkb4dl3
1125875599535431700,Tue May 07 21:30:35 +0000 2019,Research finds that "13 Reasons Why” was associated with a 28.9% increase in suicide rates among U.S. youth ages 10… https://t.co/vPCcog7egq
1125379905691242500,Mon May 06 12:40:52 +0000 2019,RT @Whalewatchmeplz: This is an important study that EVERYONE needs to read about the decline of nature due to human impact. But we need mo…
1125378620745244700,Mon May 06 12:35:46 +0000 2019,A new UN report came out on the same day as the Met Gala let’s not let it get over shadowed. It found we are produc… https://t.co/uI9NJiR0Ip
1125377109625585700,Mon May 06 12:29:46 +0000 2019,The new UN report found that the decline of wild bees and other insects that help pollinate fruits and vegetables i… https://t.co/SblEEwv5kX
1125375782145204200,Mon May 06 12:24:29 +0000 2019,A new UN report based on thousands of scientific studies found that the average abundance of plant and animal life… https://t.co/RFjQ6fUySg
1125041482698825700,Sun May 05 14:16:06 +0000 2019,The US just weakened the safety rules for offshore drilling. This is what we like to call STEPPING BACKWARDS! https://t.co/5nr6mqbULV
1124738876604604400,Sat May 04 18:13:39 +0000 2019,There is a specific odor that if you tell someone it is vomit they are grossed out but if you tell them it is Parme… https://t.co/p9nCpkPM0w
1124738294414286800,Sat May 04 18:11:20 +0000 2019,2-ethylfenchol is a chemical present in beets that stinks like dirt to some while others can’t even smell it. A new… https://t.co/egMySgaE4u
1124697315372089300,Sat May 04 15:28:30 +0000 2019,When you’re doing research and find out new studies link headphone use to excessive hearing loss. https://t.co/jJwAFiisFX
1124695512886710300,Sat May 04 15:21:20 +0000 2019,RT @Whalewatchmeplz: *It’s Oh So Quiet by Bjork plays* https://t.co/PRxmm4HFlz
1124679405744345100,Sat May 04 14:17:20 +0000 2019,Canada listen up, climate change means less maple syrup. Warmer temps and loss of snowpack makes trees produce less… https://t.co/1DQ3ydcFCq
1124390422711865300,Fri May 03 19:09:01 +0000 2019,Conspiracy theories are nothing new!  Watch our latest video to find out more! https://t.co/nPUsmOTQg8 https://t.co/aG4LouGMev
1124342150534258700,Fri May 03 15:57:12 +0000 2019,There is always a 50/50 chance of heads or tails. BUT some are more prone to the ‘illusory pattern perception’ a co… https://t.co/867fPWd1sZ
1124040869332516900,Thu May 02 20:00:01 +0000 2019,https://t.co/nPUsmOTQg8
1124032438525677600,Thu May 02 19:26:31 +0000 2019,Over 50% of Americans believe in at least one conspiracy theory. https://t.co/dTCMeiGc69
1124020234967507000,Thu May 02 18:38:01 +0000 2019,Okkkk SO our channel is part of a conspiracy theory… LOL! Do you believe it? To find more on why conspiracy theorie… https://t.co/gyJzPCUBVY
1123996136447066100,Thu May 02 17:02:16 +0000 2019,We dive deep in our NEW VIDEO on why we fall for conspiracy theories!  https://t.co/nPUsmOTQg8 https://t.co/L2ltTeDfeJ
1123637507504128000,Wed May 01 17:17:12 +0000 2019,Today pain researchers found a molecular antidote that blocks the deadly box jellyfish sting if applied to skin wit… https://t.co/ma97AqsclY
1123633195717541900,Wed May 01 17:00:04 +0000 2019,Aquatic animals are exposed to all kinds of micropollutants, including... cocaine!?  A UK study found traces of coc… https://t.co/iS4JT1kGyJ
1123626652456706000,Wed May 01 16:34:04 +0000 2019,Retweet if you want to eat more kelp. https://t.co/9t7r8KdjF1
1123622061782523900,Wed May 01 16:15:50 +0000 2019,We are starting to become interested in poetic naturalism. What are ways that you rectify scientific information wi… https://t.co/6vJgJr2AGN
1123621763642949600,Wed May 01 16:14:38 +0000 2019,RT @Whalewatchmeplz: Algal blooms getting ready to obliterate our oceans https://t.co/Dpga4AWMHK
1123253071641886700,Tue Apr 30 15:49:35 +0000 2019,RT @Whalewatchmeplz: The world can feel stressful but since the universe is expanding and everything is heading towards entropy, technicall…
