id,created_at,text
1130628106295885800,Tue May 21 00:15:21 +0000 2019,If Mueller had actually made a straightforward judgment on obstruction, I do think there would be a different conve… https://t.co/4Ax5jcUcgZ
1130621441257480200,Mon May 20 23:48:52 +0000 2019,@normative Or maybe they do get it...
1130531883073384400,Mon May 20 17:52:59 +0000 2019,You get Koch money and this is the slogan you come up with? https://t.co/bdTMBZT8CS https://t.co/vqGGDaUDSC
1128381456462635000,Tue May 14 19:27:58 +0000 2019,Alice Rivlin was the first director of the Congressional Budget Office and defined what became CBO's culture.… https://t.co/5u29StEKcb
1128335870338138100,Tue May 14 16:26:49 +0000 2019,@JesseLehrich https://t.co/hlNfYDvNI3
1127771973831012400,Mon May 13 03:06:06 +0000 2019,My 2016 take: https://t.co/Zxb31QpNH7 https://t.co/0hEEwnyQxo
1127647818976358400,Sun May 12 18:52:45 +0000 2019,I had a dream that this would be the ending of Game of Thrones. I hope they come up with something better than this… https://t.co/H8hXq4UKad
1126578689431482400,Thu May 09 20:04:25 +0000 2019,George R. R. Martin is excited about Biden's candidacy, calls his announcement speech "kickass"… https://t.co/ZovfKNftj0
1126561304196583400,Thu May 09 18:55:20 +0000 2019,Small brain: Don't hire disloyal people who disagree with your objectives  Galaxy brain: Make John Bolton your Nati… https://t.co/dJUtkDWbxw
1126560269117919200,Thu May 09 18:51:13 +0000 2019,Hm https://t.co/gJ2YcUuTwp
1126550200091279400,Thu May 09 18:11:12 +0000 2019,Quite rare to get a window into a major politician's honest (albeit 30 years old) inner thoughts like this   https://t.co/DaTO47F7kc
1126539788004331500,Thu May 09 17:29:50 +0000 2019,It's over, case closed, nothing to see here, pay no attention to that man behind the curtain https://t.co/Ahkw2EWwEv
1126244416178540500,Wed May 08 21:56:08 +0000 2019,Extremely New Jersey situation and quotes here https://t.co/84NKkoYR1P
1126241388524392400,Wed May 08 21:44:06 +0000 2019,A "person close to" Don Jr. tells @rebeccaballhaus that @SenatorBurr is "a so-called 'Republican' Senator too cowar… https://t.co/DuVcz0wG6Q
1126235520466595800,Wed May 08 21:20:47 +0000 2019,This "highly respected" committee chair has now approved a subpoena of Donald Trump Jr. https://t.co/3cbKSOtauZ
1126222988502798300,Wed May 08 20:30:59 +0000 2019,@senecatrust @packerpoppa Not Graham's committee!
1126219069655593000,Wed May 08 20:15:25 +0000 2019,Wow, interesting that it's "to answer questions about his previous testimony" to Senate committees   https://t.co/YD1JahBpAf
1121420578752204800,Thu Apr 25 14:27:55 +0000 2019,Finally, for most of Mueller's long list of Trump associate / Russian contacts, there's no evidence presented of Tr… https://t.co/ndmUvQlMwH
1121419753300664300,Thu Apr 25 14:24:38 +0000 2019,For Don Jr.'s Trump Tower meeting, Mueller provides some accounts that there was talk of it beforehand.  But Muelle… https://t.co/aWo7JifG2f
1121418415804244000,Thu Apr 25 14:19:19 +0000 2019,I thought it useful to separate out Mueller's findings about what Trump himself did in 2016.  -Kept checking on Tru… https://t.co/WNJ7P8JylV
1121118386719686700,Wed Apr 24 18:27:07 +0000 2019,@dylanmatt Paths of Glory
1121113966703468500,Wed Apr 24 18:09:33 +0000 2019,@davidciani Yes but the trial is scheduled for November so we could be waiting a while...
1121111861317992400,Wed Apr 24 18:01:11 +0000 2019,@Schwartzesque But I guess it depends on who footnote 1278 is referring to. Not clear from what we know that Stone… https://t.co/YqKIyq5TfZ
1121111337487228900,Wed Apr 24 17:59:06 +0000 2019,@Schwartzesque Yes, I should have written "charges against Stone re: WikiLeaks or hacked material."
1121109079416606700,Wed Apr 24 17:50:08 +0000 2019,This is probably a section Barr referred to at his press conference, about how publication of hacked materials woul… https://t.co/y28tqPUQ4i
1121108454972842000,Wed Apr 24 17:47:39 +0000 2019,If I could have any pages unredacted in this report it would be p. 176-178 of Volume I.  It's in the "Russian hacki… https://t.co/I4ace9xWJ5
1121085044892815400,Wed Apr 24 16:14:38 +0000 2019,Normal https://t.co/KscES2Iz0B https://t.co/nPUgflfKiv
1120883335289557000,Wed Apr 24 02:53:06 +0000 2019,Leaks and infighting already, solid start to this campaign https://t.co/6QYmfoTq8R
1120880106862522400,Wed Apr 24 02:40:17 +0000 2019,RT @jennifernvictor: And the award for the best title of a 2019 podcast goes to...The Weeds!  "What to obstruct when you’re obstructing'" b…
1120666146137681900,Tue Apr 23 12:30:04 +0000 2019,(This is Vol. II, p. 157.)
1120666094333775900,Tue Apr 23 12:29:52 +0000 2019,In the report, lots about the Trump campaign and WikiLeaks is redacted.  But here Mueller writes that Trump may hav… https://t.co/ue8dXcx6hj
1120503636474368000,Tue Apr 23 01:44:19 +0000 2019,Underappreciated line:  "Cohen recalled telling Trump he wished the Trump Organization had assistants who were as c… https://t.co/sGY7xQ6u1i
1120487516732383200,Tue Apr 23 00:40:16 +0000 2019,"Don't have to tell us, just take [a] look." -Trump, to Sessions in private, re: investigating Hillary Clinton  Do… https://t.co/1uJ8ZZAUaT
1120412062440677400,Mon Apr 22 19:40:26 +0000 2019,Jared Kushner, Hope Hicks, Corey Lewandowski, Stephen Miller, Steve Bannon, and Paul Manafort were all questioned b… https://t.co/0UFGs1tlf5
1120370119014789100,Mon Apr 22 16:53:46 +0000 2019,1. Biggest Bernie lead in NH so far this year  2. Buttigieg in third place, slightly behind Biden, 10 points ahead… https://t.co/x63d5hBuNB
1119707510045155300,Sat Apr 20 21:00:48 +0000 2019,@nycsouthpaw Wonder if this is under the grand jury redactions in this part: https://t.co/C80TQVET2O
1119697106191577100,Sat Apr 20 20:19:27 +0000 2019,I'd guess they reached out to Christie because of his book, where he described these conversations with Trump https://t.co/ukSPXhd8ng
1119337063130615800,Fri Apr 19 20:28:46 +0000 2019,Not new, HPSCI report mentioned that CI investigation of Flynn predated Kislyak calls.   https://t.co/hzE00md8J2
1119297526824226800,Fri Apr 19 17:51:40 +0000 2019,"Immediately." Love that hustle. https://t.co/Mixiqtu8nL
1119288304740868100,Fri Apr 19 17:15:01 +0000 2019,At least in the Russian oligarch "all-hands" with Putin you can hide in the crowd https://t.co/gFMTugpT8A
1119247148644585500,Fri Apr 19 14:31:29 +0000 2019,Speaking for myself, I am glad I don't have a one-on-one quarterly performance review meeting with Putin. Seems str… https://t.co/633DRBit5V
1119032123036508200,Fri Apr 19 00:17:03 +0000 2019,Mueller: I decided not to say whether it was obstruction.  But if it wasn't obstruction, I'd tell you.  And I'm not… https://t.co/qWqliDS2Aw
1118970719025672200,Thu Apr 18 20:13:03 +0000 2019,The referrals are listed alphabetically by subject... so what are the two between CO- and CR- ? https://t.co/PxQZjzaOjY
1118963768426487800,Thu Apr 18 19:45:26 +0000 2019,The weirdness of the obstruction volume https://t.co/WHCUS1rlsf
1118963151888891900,Thu Apr 18 19:42:59 +0000 2019,"Manafort told Gates it was stupid to plead, saying that he had been in touch with the President's personal counsel… https://t.co/au0xvSYFyp
1118948990161236000,Thu Apr 18 18:46:42 +0000 2019,The reference to the "biggest black caviar jar" in Manafort's emails referred to a literal jar of black caviar (giv… https://t.co/i5ftrfMT6M
1118909705563377700,Thu Apr 18 16:10:36 +0000 2019,Trump repeatedly asked people affiliated with his campaign to find Hillary Clinton's emails, and Flynn went out and… https://t.co/Qdl2yaR86y
1118907204034281500,Thu Apr 18 16:00:40 +0000 2019,So, Ted Malloch talked, and told investigators that Corsi (and likely Stone under this redaction) knew Assange had… https://t.co/gAEcOwT428
1118905076188438500,Thu Apr 18 15:52:13 +0000 2019,Compare the language: Investigation has "not identified evidence" that Trump people knew IRA contacts were from for… https://t.co/PpFbReylq8
1118890663578349600,Thu Apr 18 14:54:56 +0000 2019,Leaving aside whether it’s a crime — whether Trump associates were involved in disseminating the hacked emails is a… https://t.co/IzrqaMtVbB
1118881547921313800,Thu Apr 18 14:18:43 +0000 2019,One problem: We might not get much more clarity on this today, if the Roger Stone material in the report is redacte… https://t.co/vucqSyzPiV
1118878580295991300,Thu Apr 18 14:06:55 +0000 2019,Note the contrasting phrasing: -"No evidence" of any Trump campaign collusion with the Russian hacking -No finding… https://t.co/JNaYVOmHvu
1118876567810248700,Thu Apr 18 13:58:56 +0000 2019,Barr: -Publication of the hacked emails wouldn't be illegal -No one associated with Trump campaign involved with "i… https://t.co/CjFir8Krvh
1118872165913440300,Thu Apr 18 13:41:26 +0000 2019,Just gonna leave this here https://t.co/ugUjj3b8mz
1118854247758606300,Thu Apr 18 12:30:14 +0000 2019,How did Trump's team cut 100 pages from their 140-page counterreport? 1. Delete key 2. Printed it out, then physica… https://t.co/ZtkLY5govF
1118849180225757200,Thu Apr 18 12:10:06 +0000 2019,Counterreport is out. Lots to mull over here: https://t.co/E0RBwnoDB4
1118847787708354600,Thu Apr 18 12:04:34 +0000 2019,Tired: The Mueller Report Wired: The Cohen-Davis Report https://t.co/gKRcTtkSCi
1118721378633617400,Thu Apr 18 03:42:16 +0000 2019,Gonna be a lot of dunks, owns, and burns on this website tomorrow. Stay safe, everyone.
1118671608032497700,Thu Apr 18 00:24:29 +0000 2019,The name “Don McGahn” seems to be coming up a lot all of a sudden   https://t.co/YXFegdHgVk
1118627330094784500,Wed Apr 17 21:28:33 +0000 2019,So, my guess is the version of the Mueller report we get tomorrow won't have much about Stone unredacted.  That's n… https://t.co/bdsk7Q43wX
1118626900014800900,Wed Apr 17 21:26:50 +0000 2019,Prosecutors say they are redacting some material related to Stone so it wouldn't pose a "substantial likelihood of… https://t.co/YbyZmJl3o8
1118626542882570200,Wed Apr 17 21:25:25 +0000 2019,Here's prosecutors' new filing in the Roger Stone case, re: the Mueller report.   https://t.co/VXj25b7FoA
1118620901363286000,Wed Apr 17 21:03:00 +0000 2019,"I do not believe it would be in the public's interest for me to attempt to summarize the full report" -Bill Barr,… https://t.co/gNiGr8iY40
1118617070005039100,Wed Apr 17 20:47:47 +0000 2019,Purpose of this presser seems to be not to let reporters ask informed questions but rather to get TV footage of Bar… https://t.co/3OP2C1RCYh
1118556453571375100,Wed Apr 17 16:46:54 +0000 2019,Tips for tweeting about the Mueller Report:  -Make clear as quickly as possible that it reaffirms all of your preex… https://t.co/wyqM5Kv7LU
1118171783973220400,Tue Apr 16 15:18:22 +0000 2019,@stephenrodrick It's not my style either, but it's not exactly unheard of...
1118170190917853200,Tue Apr 16 15:12:02 +0000 2019,"Cold-calling your subject's relative and letting them talk" is a time-tested reportorial technique.   "Source remo… https://t.co/wqljoXi1pa
1117993105624531000,Tue Apr 16 03:28:22 +0000 2019,There's been much talk of Elizabeth Warren's fundraising woes, but a hefty transfer from her Senate campaign means… https://t.co/r6r5cFR6Cq
1117908690982465500,Mon Apr 15 21:52:56 +0000 2019,Bernie swamps this with $15.2M in small dollar contributions: https://t.co/Cqr7zvcQVQ https://t.co/7HFnNZaGsr
1117903143931482100,Mon Apr 15 21:30:53 +0000 2019,Buttigieg and Harris raised about the same amount in small dollar contributions. $4.5M to $4.4M
1117863169211244500,Mon Apr 15 18:52:03 +0000 2019,@davelevinthal @TheDemocrats Good point, he seems better positioned in polls than the other 1 percenters but still… https://t.co/XVcjy8XZD5
1117857004368875500,Mon Apr 15 18:27:33 +0000 2019,I believe Castro has already qualified by poll numbers — he's gotten 1% in a bunch, which is what he needs https://t.co/stNkaEJylc
1117840503796580400,Mon Apr 15 17:21:59 +0000 2019,@derekwillis Well, there's the ProPublica Itemizer...
1117838273987121200,Mon Apr 15 17:13:07 +0000 2019,@derekwillis I believe in the potential for human progress.
1117837332479082500,Mon Apr 15 17:09:23 +0000 2019,A zillion presidential candidates and only two get an FEC filing up before 1 PM? C'mon.
1117823510582263800,Mon Apr 15 16:14:27 +0000 2019,Thursday morning timing for Mueller report's release places it about when discussion of the last GOT episode is dyi… https://t.co/4QHFHFRtgt
1117793358653603800,Mon Apr 15 14:14:38 +0000 2019,A pretty consistent top 6 in national and early state polls of late:   Biden / Bernie at top, then Buttigieg / Harr… https://t.co/mMaUI697cA
1116802718016970800,Fri Apr 12 20:38:11 +0000 2019,As early as “any moment,” if not earlier https://t.co/um6RsAv0mb
1116763652475031600,Fri Apr 12 18:02:57 +0000 2019,Buttigieg movement from zero to the tier behind Biden/Bernie seems like the only noteworthy change in Dem primary p… https://t.co/PvZU20m7jm
1116728740149637100,Fri Apr 12 15:44:14 +0000 2019,@EricColumbus @RDEliason @emptywheel @NatashaBertrand @McDeereUSA @jedshug I did the 20. (But Corallo wasn't an Adm… https://t.co/xxXcGoWBfy
1116724891124928500,Fri Apr 12 15:28:56 +0000 2019,False statements charges, serious for thee but not for me https://t.co/CCW7mmm45P
1116702953446842400,Fri Apr 12 14:01:46 +0000 2019,It was just an RT? https://t.co/bt5JfEPVrr
1116385295644209200,Thu Apr 11 16:59:30 +0000 2019,As Greg Craig was headed out of the Obama Admin, Obama offered him a judgeship — but he declined it, per… https://t.co/bxcYWAPrEh
1116364197011644400,Thu Apr 11 15:35:40 +0000 2019,So the latest polls of both IA and NH have Pete Buttigieg hitting double digits and in third place https://t.co/3n29D9ZRGe
1116360037897855000,Thu Apr 11 15:19:08 +0000 2019,@DLind @CrimeADay Could be some exposure for @IAM_SHAKESPEARE on that
1116359491593879600,Thu Apr 11 15:16:58 +0000 2019,cc @CrimeADay https://t.co/Qy2UHfVAaW
1116353165669097500,Thu Apr 11 14:51:50 +0000 2019,Is this bad? https://t.co/ZsXPK4ZQ4f https://t.co/ZNEjuRecxp
1116335646237499400,Thu Apr 11 13:42:13 +0000 2019,A sign that other charges against Assange may be coming? Manning was jailed last month for refusing to testify to a… https://t.co/ia86PMGnF0
1116328923506335700,Thu Apr 11 13:15:30 +0000 2019,Of course other charges could come later, but this one is narrow. Seems designed to avoid the "New York Times" prob… https://t.co/tcexsVHyVU
1116328296587956200,Thu Apr 11 13:13:00 +0000 2019,This is what the charge is about: that Assange allegedly "agreed to assist Manning in cracking a password" that wou… https://t.co/mxoaeBNscw
1116326720141918200,Thu Apr 11 13:06:45 +0000 2019,Assange charge. Dated March 6, 2018 https://t.co/IL4x8CQ52Y https://t.co/1JKBXPJHUY
1116142896825106400,Thu Apr 11 00:56:18 +0000 2019,Greg Craig has friends. https://t.co/9UbnioujFr https://t.co/FuoadxAbsu
1116132469831606300,Thu Apr 11 00:14:52 +0000 2019,Another Amy Berman Jackson case? https://t.co/r1qxlB6XPx
1116129860571807700,Thu Apr 11 00:04:30 +0000 2019,@HarrySandick I think he may have been as shocked as Captain Renault.
1116115443834601500,Wed Apr 10 23:07:12 +0000 2019,"And you, National Enquirer — I think I'll miss you most of all."
1116114397208961000,Wed Apr 10 23:03:03 +0000 2019,Trump's presidency has been rough on many close to him. -Trump's campaign chair: Incarcerated -Trump's lawyer: Soon… https://t.co/ou1rceQ0B9
1116110811846578200,Wed Apr 10 22:48:48 +0000 2019,Says they're still reviewing it, consulting with DOJ, Mnuchin says he will supervise the matter https://t.co/QqeaMMQaBh
1116104373661315100,Wed Apr 10 22:23:13 +0000 2019,"The decision to sell came after the hedge fund manager whose firm controls AMI became “disgusted” with the Enquire… https://t.co/wxbyzdKj80
1116078156346216400,Wed Apr 10 20:39:02 +0000 2019,Since the day Barr released his letter on Mueller's findings, Trump's approval has gone from 42.1% to 42.0%. Game c… https://t.co/opK3pPzYNd
1116059751585067000,Wed Apr 10 19:25:54 +0000 2019,Lisa Page testified that "herculean efforts" were taken to try to prove or disprove Steele's claims.  Hope the repo… https://t.co/ImwZGdctrz
1116057918812692500,Wed Apr 10 19:18:37 +0000 2019,@nycsouthpaw @codytfenwick Steele made specific claims of criminal Russia-related wrongdoing by Carter Page and Mic… https://t.co/JAxFwU39ib
1116055385285308400,Wed Apr 10 19:08:33 +0000 2019,It will be interesting to see whether the Mueller report addresses / debunks the Steele dossier claims directly.
1116051478559494100,Wed Apr 10 18:53:02 +0000 2019,Campaign finance lingo: A "burn rate" refers to the amount of money a candidate throws into a giant bonfire, divide… https://t.co/4hY6jvMQfj
1116044640199880700,Wed Apr 10 18:25:51 +0000 2019,July 3, 2007: "Pressed for Money, McCain Cuts Campaign Staff"  https://t.co/fKVEAcUnma https://t.co/ZXfOWurhrw
1116036116774379500,Wed Apr 10 17:51:59 +0000 2019,Mueller report release coming as early as "hopefully next week," if not before https://t.co/ZgvZXhmAjj
1115994504039927800,Wed Apr 10 15:06:38 +0000 2019,Barr distinctly declined to voice full-throated support for the FBI/DOJ handling of the Russia investigation, as Ro… https://t.co/yA1SY9HQH8
1115992918425309200,Wed Apr 10 15:00:20 +0000 2019,But he then said he has "questions about it" and "concerns about various aspects of it."  https://t.co/SjyvIw0D6y
1115990233588338700,Wed Apr 10 14:49:40 +0000 2019,LEAHY: Did he express any interest in leaving the obstruction decision to Congress?  BARR: He didn’t say that to me… https://t.co/1jafU06dv6
1115988420067844100,Wed Apr 10 14:42:28 +0000 2019,Here's Barr's comments on "spying" and reviewing the origins of the Trump/Russia probe https://t.co/fCoZx4QyGE
1115986340221542400,Wed Apr 10 14:34:12 +0000 2019,Barr: “I think there was probably a failure among a group of leaders there at the upper echelon” at the FBI, re: "s… https://t.co/RRPd8Hr1uw
1115984322262126600,Wed Apr 10 14:26:11 +0000 2019,Barr says grand jury info is "the most inflexible" category of redactions.   "But even there, once the redactions a… https://t.co/yW7JzRTajj
1115980555932319700,Wed Apr 10 14:11:13 +0000 2019,An advance look at the redacted Mueller report: https://t.co/rnWSyrWzrY
1115627607599480800,Tue Apr 09 14:48:43 +0000 2019,Barr: “Any claim of executive privilege would have to be asserted by the president.” Restates that, as letter said,… https://t.co/5iGqLHm2m7
1115617899157307400,Tue Apr 09 14:10:08 +0000 2019,May seem minor but it's good to know that the redactions will be categorized. Will be much easier to make sense of… https://t.co/wnYUnvn5r0
1115616899356872700,Tue Apr 09 14:06:10 +0000 2019,Lowey asks Barr whether the White House has seen the report.  Barr, who has been answering report questions so far,… https://t.co/Y1htE1K0hX
1115615904862224400,Tue Apr 09 14:02:13 +0000 2019,Rep. Aderholt: “Now that President Trump has been exonerated of Russian collusion,” is use of Steele dossier being… https://t.co/dEAA2r1flo
1115614325211897900,Tue Apr 09 13:55:56 +0000 2019,Barr says Mueller report should be ready for release "within a week." Initial timeline stands
1115614179589787600,Tue Apr 09 13:55:22 +0000 2019,Barr: “We will color-code the [redaction] decisions from the report and we will provide explanatory notes describin… https://t.co/g7fVxAXvhy
1115613950421405700,Tue Apr 09 13:54:27 +0000 2019,Barr: “The special counsel did spin off a number of cases that are still being pursued.”
1115613704446521300,Tue Apr 09 13:53:28 +0000 2019,Barr says he gave Mueller team an opportunity to review his initial letter to Congress on their findings, but they "declined" that
1115391223894822900,Mon Apr 08 23:09:25 +0000 2019,I know we're expecting the first ever black hole pictures Wednesday, but any chance of an actual black hole showing… https://t.co/OINx5mhI52
1115328718979915800,Mon Apr 08 19:01:03 +0000 2019,This NYT piece mostly portrays the Secret Service director's ouster as connected to Trump's immigration agenda.  Bu… https://t.co/ZmNg0MD8x4
1115252939470331900,Mon Apr 08 13:59:55 +0000 2019,Right after I finish my jury service (we acquitted) they raise juror pay... https://t.co/wIXm1rneOw
1115252545868521500,Mon Apr 08 13:58:21 +0000 2019,Probably not great that every digital media company sale lately is for an undisclosed price.
1113960280059465700,Fri Apr 05 00:23:21 +0000 2019,I want a pony https://t.co/mdsdbiW834
1113958031866441700,Fri Apr 05 00:14:25 +0000 2019,(I'm sure he has looked back wistfully at those December 2016 choices for DOJ and wondered what might have been...)
1113957746313977900,Fri Apr 05 00:13:17 +0000 2019,Is Trump getting better at proactively appointing people who will help him do cover-ups?  https://t.co/Yda7CErba5
1113908839924027400,Thu Apr 04 20:58:57 +0000 2019,@brianroconnor Not so far as we know
1113892124699840500,Thu Apr 04 19:52:32 +0000 2019,Barr should just pull a Don Jr. and tweet out the report
1113890094434476000,Thu Apr 04 19:44:28 +0000 2019,RT @chrisgeidner: This is embarrassing. https://t.co/GL4RS0hzZb
1113883515677020200,Thu Apr 04 19:18:19 +0000 2019,Trump could also be deposed later this year in a defamation lawsuit related to a sexual assault allegation against… https://t.co/8KD8HpY20h
1113874604580274200,Thu Apr 04 18:42:55 +0000 2019,In addition to the allegations we've known about since the campaign, Trump was sued this year by a campaign worker… https://t.co/LNBa0x2zSF
1113808063910248400,Thu Apr 04 14:18:30 +0000 2019,First sign of dissent re: Barr's Russia summary. However this would be consistent with no (knowing) conspiracy https://t.co/mA4X4ZCZDI
1113804460176957400,Thu Apr 04 14:04:11 +0000 2019,Word of the day: "Acute."   cc @merriamwebster https://t.co/3IqyOMJE2U https://t.co/aMl6WRYVf7
1113626752448901100,Thu Apr 04 02:18:02 +0000 2019,More scientists need to announce their discoveries this way. Also, journalists should publish their scoops like thi… https://t.co/oE5S55o84p
1113602324692336600,Thu Apr 04 00:40:58 +0000 2019,(c) could be accurate but it's not what the piece says. NYT says they don't know what the complaints are about.  https://t.co/31ifiDOuBM
1113587878892834800,Wed Apr 03 23:43:34 +0000 2019,Note: Mueller team members did not necessarily talk to the NYT. The sources are "government officials and others fa… https://t.co/I2BWBbdf0m
1113568242709221400,Wed Apr 03 22:25:32 +0000 2019,Throwback to when Ted Cruz said he thought there was a "bombshell" in Trump's tax returns, and even speculated they… https://t.co/jiGYjfGPJy
1113199264031756300,Tue Apr 02 21:59:21 +0000 2019,RT @KlasfeldReports: Journalists who believe the U.S. media should have downplayed a criminal probe that convicted the president’s former p…
1113184757226012700,Tue Apr 02 21:01:42 +0000 2019,A nice thing about California moving its primary so early (March 2020) is that that means they'll probably be done… https://t.co/jBEGCyNFLE
1113147125460856800,Tue Apr 02 18:32:10 +0000 2019,Tom Coburn had the birther publication publish his book and now feels they weren't "honest" (with his money)… https://t.co/fW9EXqKQEr
1113101850985795600,Tue Apr 02 15:32:16 +0000 2019,Honestly think it would be smart for Trump to just rip off the Band-Aid now so Mueller report fades from memory by… https://t.co/42zRA1aG4g
1113069791273717800,Tue Apr 02 13:24:52 +0000 2019,This is the future that liberals want https://t.co/1eGvH1EX8o
1112827142788743200,Mon Apr 01 21:20:40 +0000 2019,If Barr were really clever he'd find a way to delay the Mueller report release till the day of the Game of Thrones… https://t.co/9wmXbjijvl
1112798953630822400,Mon Apr 01 19:28:40 +0000 2019,To these good points by @kpolantz I would add that Mueller's practice was often to bring people in for voluntary in… https://t.co/Pw5cQYBnla
1112751426596413400,Mon Apr 01 16:19:48 +0000 2019,@Wilson__Valdez His article that started the whole conversation (linked at top of Vox piece): https://t.co/8X1b93LgIS
1112749334381117400,Mon Apr 01 16:11:29 +0000 2019,@ByronYork Key bit from last Friday's Barr letter, re: executive privilege. Worth keeping an eye on whether this ch… https://t.co/9XHMttDozI
1112749035587289100,Mon Apr 01 16:10:18 +0000 2019,Ex-Trump lawyer John Dowd says on @ByronYork podcast he thinks WH will assert executive privilege to withhold lots… https://t.co/hmHvtrXfgf
1112727615285137400,Mon Apr 01 14:45:11 +0000 2019,Seems to me that if in fact Russian intelligence officers did hack the emails and documents from a leading politica… https://t.co/irTbvZCJqE
1112727073590857700,Mon Apr 01 14:43:02 +0000 2019,But the fact that he doesn't like to talk about Mueller's extremely detailed indictment alleging that several named… https://t.co/pr1tKzUJWU
1112726528922734600,Mon Apr 01 14:40:52 +0000 2019,Taibbi hints he's doesn't believe Russia hacked the DNC, but tries to dodge by saying he's "gone out of his way not… https://t.co/nFJQUTxfer
