id,created_at,text
1192171688328343600,Wed Nov 06 20:07:34 +0000 2019,Now presenting a July 29, 2016 email from Stone to Manafort. They are setting up a call, and Stone tells Manafort,… https://t.co/qEQwwmO5ZZ
1192170007955939300,Wed Nov 06 20:00:54 +0000 2019,Prosecutor shows two Guccifer blog posts, the second is this one dated June 30: https://t.co/XtfYOtuv9v  Says Stone… https://t.co/jptiIGJifI
1192168937712226300,Wed Nov 06 19:56:38 +0000 2019,Now going into Stone's phone calls with Trump, all after 9 PM Eastern on the evening the WaPo article on DNC/Russia… https://t.co/B9wZlG7c4P
1192168429786206200,Wed Nov 06 19:54:37 +0000 2019,Former FBI case agent Michelle Taylor, who worked with Mueller's team, now on the stand.   Prosecutors have shown a… https://t.co/IEm2CZ7MRc
1192165813438029800,Wed Nov 06 19:44:13 +0000 2019,Reminiscent of Stone's previous argument that, when he told Credico "Prepare to die," he was speaking of Credico's… https://t.co/ytn3XL4SDr
1192164955547668500,Wed Nov 06 19:40:49 +0000 2019,Rogow apparently laying the groundwork to argue that when Stone told Credico "do a Frank Pentangeli," he was referr… https://t.co/SR67jL1DS1
1192163993273720800,Wed Nov 06 19:36:59 +0000 2019,Rogow moves on to what he describes as the second part of the case, the witness tampering charge re: Credico.  Says… https://t.co/zMN3eFEmyl
1192162175693021200,Wed Nov 06 19:29:46 +0000 2019,Rogow adds: Stone was also “playing others himself,” by “creating that notion that he had some kind of direct conta… https://t.co/oifoRnMbPZ
1192161878727909400,Wed Nov 06 19:28:35 +0000 2019,Rogow now saying Stone in fact had no intermediary with WikiLeaks. Corsi claimed to have info, but he was just "pla… https://t.co/QS8c5U1VoM
1192160279527874600,Wed Nov 06 19:22:14 +0000 2019,Rogow is presenting various excerpts from Stone's House Intelligence Committee testimony (which we've never seen be… https://t.co/UHFiPXegEl
1192157641033826300,Wed Nov 06 19:11:45 +0000 2019,Rogow making what will apparently be Stone's main defense against the false statements charges — a claim he thought… https://t.co/rz3GVWu0Pu
1192156137279443000,Wed Nov 06 19:05:46 +0000 2019,Stone defense lawyer Bruce Rogow begins his opening statement.  He says that the prosecutor is right that the evide… https://t.co/yFg1wP7fKf
1192140600944087000,Wed Nov 06 18:04:02 +0000 2019,The new information revealed was about Stone's contacts with the Trump campaign — ominous emails to Manafort and Ba… https://t.co/hxrYeYmw42
1192140113851146200,Wed Nov 06 18:02:06 +0000 2019,One thing we did not get in the opening statement was new info about what Stone knew about WikiLeaks / Podesta emai… https://t.co/h5cThlBuZr
1192139000628334600,Wed Nov 06 17:57:41 +0000 2019,Prosecutors' opening statement has concluded. Breaking for lunch now, defense will give their opening at 2 PM.  Zel… https://t.co/WRmTxWbasH
1192137532600979500,Wed Nov 06 17:51:51 +0000 2019,Zelinsky confirms Bannon will testify: "You're gonna hear from Steve Bannon."
1192136163592691700,Wed Nov 06 17:46:24 +0000 2019,Now a lengthy discussion of the witness tampering charge.  Zelinsky says Stone pressured Credico to take the Fifth… https://t.co/BXSOm4A1Px
1192133086269624300,Wed Nov 06 17:34:11 +0000 2019,Zelinsky: "Just as Roger Stone promised, on October 7, 2016, WikiLeaks began releasing a massive amount of hacked e… https://t.co/PR548ioiDb
1192131751126225000,Wed Nov 06 17:28:52 +0000 2019,Now Erik Prince is mentioned. He is IDed as the Trump campaign supporter mentioned here in the indictment, chatting… https://t.co/GhKk3NywyV
1192131408564801500,Wed Nov 06 17:27:31 +0000 2019,Zelinsky: “You’ll hear that he [Stone] and Bannon had actually been talking about WikiLeaks, about Julian Assange,… https://t.co/3tkwEIEHpF
1192129724119703600,Wed Nov 06 17:20:49 +0000 2019,Zelinsky: “If you are looking for someone to pin something on, Randy Credico is a pretty good person to pick.” Says… https://t.co/eC9nUd7U7u
1192129161751650300,Wed Nov 06 17:18:35 +0000 2019,Prosecutor Aaron Zelinsky refers again to these two emails - to Manafort about wanting “to save Trump’s ass,” and t… https://t.co/8QP3ecMyqi
1192127226101354500,Wed Nov 06 17:10:54 +0000 2019,@lrozen Deleted to fix typo — here's new one https://t.co/WNmeY6me9P
1192127044244693000,Wed Nov 06 17:10:10 +0000 2019,Prosecutor: Stone also emailed Bannon saying he knew how to win this, but "it ain't pretty"
1192126950036390000,Wed Nov 06 17:09:48 +0000 2019,Prosecutor: After getting message from Corsi on Assange’s plans, Roger Stone emailed chairman of the Trump campaign… https://t.co/U30SMQxEpL
1192125973082325000,Wed Nov 06 17:05:55 +0000 2019,Zelinsky: Stone called Trump again on July 31. They spoke for about ten minutes. About an hour later, Stone emailed… https://t.co/jXWJFEQLOl
1192125395606364200,Wed Nov 06 17:03:37 +0000 2019,NEW: Zelinsky says that just after the Democratic National Committee announced it had been hacked by the Russian go… https://t.co/q037tBrs2P
1192125395606364200,Wed Nov 06 17:03:37 +0000 2019,NEW: Zelinsky says that just after the Democratic National Committee announced it had been hacked by the Russian go… https://t.co/q037tBrs2P
1192124661536108500,Wed Nov 06 17:00:42 +0000 2019,Zelinsky: "The evidence will show that Roger Stone lied to the House Intelligence Committee because the truth looke… https://t.co/ZiKmncGG5n
1192124494162399200,Wed Nov 06 17:00:02 +0000 2019,“You will hear that Roger Stone discussed what he was learning with the senior levels of the Trump campaign, both i… https://t.co/usJjPUCcxV
1192123829692317700,Wed Nov 06 16:57:24 +0000 2019,"You will hear that Roger Stone tried to cover up that Jerome Corsi was his backchannel (to WikiLeaks), and that he… https://t.co/XlJMerKLT1
1192123103117217800,Wed Nov 06 16:54:31 +0000 2019,Zelinsky refers to Donald Trump as "the defendant’s longtime friend and associate."  "You will hear that, over and… https://t.co/8t1gYnCSCO
1192122900964352000,Wed Nov 06 16:53:42 +0000 2019,Opening statement from prosecutor Aaron Zelinsky:   "In a critical investigation of national importance, the defend… https://t.co/OpdL3mhxmO
1192118779389599700,Wed Nov 06 16:37:20 +0000 2019,Apparently referring to this. "Fortunately," Judge Jackson said, the info circulating online was "riddled with inac… https://t.co/BGqvmWDCaS
1192116942179569700,Wed Nov 06 16:30:02 +0000 2019,The Roger Stone trial is ready to get started in earnest.  Judge Amy Berman Jackson warns spectators to behave. "At… https://t.co/SBZAWZE6Kr
1192092310596735000,Wed Nov 06 14:52:09 +0000 2019,Tired: Finding the pee tape Wired: Finding the possible Rudy Giuliani Fraud Guarantee infomercial tapes… https://t.co/0cbQxU0SMD
1191921505942360000,Wed Nov 06 03:33:26 +0000 2019,Most people would be happy to have their criminal trial in large part overshadowed by the impeachment inquiry, but… https://t.co/i3mHsyc6aT
1191913143364137000,Wed Nov 06 03:00:12 +0000 2019,RT @pbump: One important new detail from Volker/Sondland transcripts: On 7/25, likely after talking to Trump, Sondland asked Volker to call…
1191900977730932700,Wed Nov 06 02:11:52 +0000 2019,Amazing to see pages and pages of texts where Bill Taylor, Kurt Volker, and Gordon Sondland are desperately working… https://t.co/to1mUVkDzB
1191845297451864000,Tue Nov 05 22:30:36 +0000 2019,Rudy not jumping at the opportunity to tell his side of the story under oath  https://t.co/kCUQURKsqo
1191844596562768000,Tue Nov 05 22:27:49 +0000 2019,What I've always enjoyed was the sourcing for this (largely-ignored at the time) bombshell: "We're reliably told"… https://t.co/cNYpalNtoM
1191833497905848300,Tue Nov 05 21:43:43 +0000 2019,Sondland's cleanup statement only admits to *some* (not all) of what's become indisputable already from other witne… https://t.co/irukTYuVwZ
1191830096371474400,Tue Nov 05 21:30:12 +0000 2019,@pbump Saying it came from Mulvaney was new to me, but I may have missed it.  (Certainly makes the Bolton "drug deal" comments make sense.)
1191829324950900700,Tue Nov 05 21:27:08 +0000 2019,More on this — Dems seem to think Sondland said at the July 10 NSC meeting that he had an agreement with Mulvaney —… https://t.co/01TLgRYzbi
1191827730029056000,Tue Nov 05 21:20:48 +0000 2019,Yeah, Sondland says he simply never heard of the Burisma/Biden connection until... well, he can't recall *when* he… https://t.co/ZjYeaAoAgG
1191826594643484700,Tue Nov 05 21:16:17 +0000 2019,Graham has learned his lesson. No more "if President Trump did this, that would be bad" statements. (Because he did… https://t.co/e7nm8Kveuz
1191822667646722000,Tue Nov 05 21:00:41 +0000 2019,"Can anyone hope to succeed with the Giuliani-Biden issue swirling for the next 18 months?" Taylor wrote to Volker… https://t.co/bRyvmfygd0
1191820634298429400,Tue Nov 05 20:52:36 +0000 2019,Interesting bit here. Dems suggesting another witness testified the first quid pro quo — investigations for WH meet… https://t.co/R6G4jRxtcY
1191816660761616400,Tue Nov 05 20:36:49 +0000 2019,Should a juror be struck for knowing about Roger Stone's Richard Nixon back tattoo? https://t.co/D96W8WVLG4
1191814918749720600,Tue Nov 05 20:29:54 +0000 2019,Brutal. Mulvaney's press conference admitting the aid quid pro quo happened while Sondland was testifying   Schiff… https://t.co/KQkqDRhWQS
1191809952119230500,Tue Nov 05 20:10:10 +0000 2019,Everyone is now in agreement — Gordon Sondland told a top aide to Zelensky on Sept 1 that "resumption of US aid wou… https://t.co/CZytv8deQN
1191799583606792200,Tue Nov 05 19:28:57 +0000 2019,It may seem like a minor detail, whether Sondland talked to Trump on just 9/9 (as he claimed) or on both 9/7 and 9/… https://t.co/I6qplTiYYz
1191798612709298200,Tue Nov 05 19:25:06 +0000 2019,Try as he might, Sondland still can't "recall" the September 7 phone call he told Tim Morrison he had with Trump (w… https://t.co/vRIim0C3PW
1191797803904831500,Tue Nov 05 19:21:53 +0000 2019,Sondland 1.0: "Never" thought there was a precondition for the aid to Ukraine  Sondland 2.0: I "presumed" aid was l… https://t.co/k8GakyQ3JC
1191788639983943700,Tue Nov 05 18:45:28 +0000 2019,Happily they have now delivered, here's Sondland: https://t.co/UGXuzNKmPS
1191787127140442000,Tue Nov 05 18:39:28 +0000 2019,This is like when journalists call a major correction an "update"  https://t.co/bKT5IxWPzG
1191786643243581400,Tue Nov 05 18:37:32 +0000 2019,Yesterday Dems posted excerpts of impeachment testimony together with the full transcripts.  Today they're posting… https://t.co/ZoC69NAXJP
1191783210553954300,Tue Nov 05 18:23:54 +0000 2019,They've already used "Pence doesn't even know her." Is the next move to call her a "Never Pencer?"
1191782951853400000,Tue Nov 05 18:22:52 +0000 2019,They don't sound happy she's testifying... https://t.co/OHIKMELcU6
1191731206615916500,Tue Nov 05 14:57:15 +0000 2019,Maybe they can play a Godfather Part III clip at the trial to explain this reference. (Or the Sopranos one?) https://t.co/TiPOhDjYsi
1191506705651323000,Tue Nov 05 00:05:10 +0000 2019,Feels Cohen-y.  Shakedown attempt on Trump? Desperate plea for relevance? Or legit cooperation?… https://t.co/09x05CkpKx
1191481644785512400,Mon Nov 04 22:25:35 +0000 2019,@Delavegalaw Per Reuters story it's @josephabondy  https://t.co/RVfWzJWAPu
1191481191544819700,Mon Nov 04 22:23:47 +0000 2019,@Delavegalaw Maybe the "documents" he provides are just all about Hunter Biden
1191480498004070400,Mon Nov 04 22:21:02 +0000 2019,Whoa if serious https://t.co/kvFlj5gQXJ
1191479369593737200,Mon Nov 04 22:16:32 +0000 2019,@nycsouthpaw "Hey, our algorithm says you're interested in legal issues, got some good follows for you..."
1191479137233449000,Mon Nov 04 22:15:37 +0000 2019,Again and again, State officials explained their actions to Yovanovitch by saying they were afraid of a tweet from… https://t.co/jaqRIa0elk
1191476889745014800,Mon Nov 04 22:06:41 +0000 2019,Here's my longer writeup of Yovanovitch's testimony — remarkably revealing of how the State Department functions (o… https://t.co/qdBQ1rNBVq
1191471268777906200,Mon Nov 04 21:44:21 +0000 2019,"The reason they pulled me back is that they were worried that if I wasn't, you know, physically out of Ukraine, th… https://t.co/tkIcHjDd8X
1191470714244751400,Mon Nov 04 21:42:09 +0000 2019,Earlier this year, State officials told Yovanovitch she was suddenly removed from her post at the direct order of t… https://t.co/eRXwOPhqpg
1191429768501252000,Mon Nov 04 18:59:27 +0000 2019,A list of potential witnesses or people who may be discussed at Stone's trial is out (from the jury questionnaire).… https://t.co/InFJyFvbC5
1191421490488651800,Mon Nov 04 18:26:33 +0000 2019,Here's more on the (unconfirmed) rumor that Trump phoned in to one of Rudy's calls with prosecutor general Lutsenko. https://t.co/Ww092ZgKee
1191420800420794400,Mon Nov 04 18:23:49 +0000 2019,Giuliani blamed Yovanovitch for blocking a US tourist visa for former prosecutor general Shokin.  Yovanovitch says… https://t.co/q2o8uuisKn
1191417033101103000,Mon Nov 04 18:08:50 +0000 2019,Yovanovitch: After learning that Trump said she was going to "go through some things," and about the dossier of mat… https://t.co/kssuVzXv4Z
1191413642648010800,Mon Nov 04 17:55:22 +0000 2019,"There was a rumor in Kyiv that during the meeting between Mr. Mayor Giuliani and Mr. Lutsenko in January that the… https://t.co/gFcaqBmtl9
1191413151738318800,Mon Nov 04 17:53:25 +0000 2019,Later explanation for her hasty departure order:  "They were worried that if I wasn't, you know, physically out of… https://t.co/Fe5gPUVDXa
1191412644080734200,Mon Nov 04 17:51:24 +0000 2019,Yovanovitch got a call 1AM Ukraine time from a State official, said she had to leave right away, take the next plan… https://t.co/esql8xWQlB
1191411417091596300,Mon Nov 04 17:46:31 +0000 2019,At some point, Yovanovitch was told that Pompeo or someone on his behalf called Sean Hannity, to ask why Hannity ke… https://t.co/U5liTXULxj
1191407710702579700,Mon Nov 04 17:31:48 +0000 2019,State Dept communicated to Yovanovitch that Pompeo wouldn't issue a statement supporting her due to concern it coul… https://t.co/qSIE7W829I
1191407351598899200,Mon Nov 04 17:30:22 +0000 2019,Yovanovitch was concerned by Don Jr.'s tweet criticizing her. Asked for statement of support from Pompeo, never got… https://t.co/JTSXP4O3la
1191405259484254200,Mon Nov 04 17:22:03 +0000 2019,A senior Ukrainian official told her in February that she needed to watch her back, because "two individuals from F… https://t.co/8VLRZBUwM1
1191404800514105300,Mon Nov 04 17:20:14 +0000 2019,Yovanovitch: "I couldn't imagine all of the things that have happened over the last 6 or 7 months. I just couldn't… https://t.co/Tt02F7Nxq9
1191403053016113200,Mon Nov 04 17:13:17 +0000 2019,Impeachment inquiry transcript of former Ambassador to Ukraine Marie Yovanovitch is posted.   Says was told in late… https://t.co/HqmtEVepuw
1191392695010377700,Mon Nov 04 16:32:08 +0000 2019,And that's it for the Roger Stone pretrial conference.   Tomorrow is the official beginning of the trial, with jury… https://t.co/KWEVdvU8Fr
1191391585386344400,Mon Nov 04 16:27:43 +0000 2019,Stone's team also wants to introduce parts of Corsi's book.  ABJ says, "*If* Mr. Corsi testifies and *if* he says s… https://t.co/29SAbuDdoC
1191391128593059800,Mon Nov 04 16:25:54 +0000 2019,Rogow signals that he wants to argue that Stone's denials of relevant docs, knowledge were because he understood th… https://t.co/rJYCcqdqs5
1191390521081696300,Mon Nov 04 16:23:29 +0000 2019,ABJ is "skeptical" of the relevance of the Steele stuff but will look it over.  Stone's team now saying they want t… https://t.co/jwI0almcV0
1191380277303623700,Mon Nov 04 15:42:47 +0000 2019,From there we moved on to Stone's team wanting to introduce parts of Appendix G to the House Intel Committee's Russ… https://t.co/mQ6qou2wTg
1191378255917568000,Mon Nov 04 15:34:45 +0000 2019,In the end ABJ didn't think the motion was relevant, said the witness can only be asked about matters brought up on… https://t.co/vHg7ecGvFX
1191377244763103200,Mon Nov 04 15:30:44 +0000 2019,The discussion was difficult to grok because both sides avoided specifics due to the witness's name being sealed (t… https://t.co/KNPrWiiTdu
1191375838291406800,Mon Nov 04 15:25:09 +0000 2019,Stone lawyer Bruce Rogow is being vague about what he wants to do, but says there are issues with the "credibility"… https://t.co/esrRZL1sy6
1191375309297377300,Mon Nov 04 15:23:03 +0000 2019,At the Stone pretrial conference. Currently a discussion where the government is trying to limit the scope of event… https://t.co/OGuzhgyUQy
1191052446304481300,Sun Nov 03 18:00:06 +0000 2019,@HelenKennedy Yep, Bolton exit also quite interestingly timed here
1191051895609217000,Sun Nov 03 17:57:55 +0000 2019,Obviously, it's widely surmised that Trump only let the aid through because the heat was on (IG telling the House,… https://t.co/SKZCDupI8C
1191049588448383000,Sun Nov 03 17:48:45 +0000 2019,What's kind of funny about this is that, told to "get the emails" by Trump, Flynn was too incompetent to actually l… https://t.co/MsHCJLnFBq
1191049247518535700,Sun Nov 03 17:47:23 +0000 2019,A good line of questioning from Wallace.  We actually have no testimony or documents yet explaining why Trump did s… https://t.co/ehhT6ObDwc
1191046327414804500,Sun Nov 03 17:35:47 +0000 2019,Voters who didn’t vote for Trump? https://t.co/7LQBy5l5xh
1190438369148448800,Sat Nov 02 01:19:59 +0000 2019,Morrison said he really hoped Sondland was acting on his own.  NARRATOR VOICE: He wasn’t. https://t.co/U21y9mN6Um
1190434573026504700,Sat Nov 02 01:04:54 +0000 2019,RT @emptywheel: So far, people inside the White House have referred to the Ukraine operation using metaphors of cancer, grenades, and drug…
1190317817540821000,Fri Nov 01 17:20:57 +0000 2019,If there's one thing we know about Donald Trump, it's that he has a deep and longstanding passion for reforming the… https://t.co/Wl82kzdG7y
1190297046063947800,Fri Nov 01 15:58:25 +0000 2019,The Mueller report has a section called "Trump Campaign and the Dissemination of Hacked Materials" that was very he… https://t.co/yDuy7nstnz
1190244322161176600,Fri Nov 01 12:28:54 +0000 2019,Morrison didn’t want to be seen as part of the Resistance but he confirmed damning facts.  In contrast, Sondland cl… https://t.co/vPUGIK07i9
1190089427873386500,Fri Nov 01 02:13:25 +0000 2019,@JohnSHausman @MarcACaputo You joke, but nonzero chance Rudy will get there.
1190086889795182600,Fri Nov 01 02:03:19 +0000 2019,@MarcACaputo This is funny though. Graham snubbing Gaetz.   (Why would Michael Horowitz have anything to do with Hu… https://t.co/40ksH71uI5
1190085827025657900,Fri Nov 01 01:59:06 +0000 2019,That didn't take long. @MarcACaputo now reports "Republicans are trying to have Hunter Biden called as a witness in… https://t.co/j3KVVOW9RY
1190007158190030800,Thu Oct 31 20:46:30 +0000 2019,So if Bolton wants to wait for this decision, he's out of the picture for testimony for the foreseeable future  https://t.co/meWrsSjgwh
1189988381880664000,Thu Oct 31 19:31:53 +0000 2019,Rudy here appears to be claiming that whenever SDNY starts investigating someone, they have to tell that person? In… https://t.co/APXxMBBtAq
1189987352141336600,Thu Oct 31 19:27:48 +0000 2019,Morrison says that Taylor's testimony regarding conversations the two had was accurate, except for two specific det… https://t.co/7MKHHSIZX6
1189982991986176000,Thu Oct 31 19:10:28 +0000 2019,When Morrison was told that Rudy was super-interested in "Burisma," he quickly googled it, like a normal person, an… https://t.co/RlBYm3lWne
1189982242745004000,Thu Oct 31 19:07:30 +0000 2019,It's clear Morrison didn't really want to join the Resistance. He did not go out of his way to make Trump look bad.… https://t.co/DeVWIpevQN
1189978140338245600,Thu Oct 31 18:51:12 +0000 2019,The other discrepancy with Taylor's recollection Morrison mentions is that... he met a Ukrainian official in a *hot… https://t.co/IDR9FRFisK
1189976551221268500,Thu Oct 31 18:44:53 +0000 2019,Here's the bit from Morrison's opening statement (posted by CBS)   He confirms Taylor's account — that Sondland tol… https://t.co/Zmo9BN3bRo
1189972746345865200,Thu Oct 31 18:29:46 +0000 2019,This is being spun in an odd way. There's a focus on a discrepancy over whether Sondland demanded *Zelensky* or the… https://t.co/L2OOKC4R82
1189971662688665600,Thu Oct 31 18:25:27 +0000 2019,Tim Morrison confirms that Sondland told Ukraine they needed to investigate Burisma — or else they wouldn't get the… https://t.co/QkwNn66BXr
1189970547444265000,Thu Oct 31 18:21:01 +0000 2019,This for instance seems like a rather minor distinction. In both Taylor and Morrison's recollections, Sondland told… https://t.co/77arxlxQS1
1189970109684695000,Thu Oct 31 18:19:17 +0000 2019,And in a sense, they're right. It is good news for them that Morrison seems not to have roasted Trump in his testim… https://t.co/snx2QLi5Fl
1189969043077374000,Thu Oct 31 18:15:03 +0000 2019,An official testifying that he didn't personally think Trump's demand Ukraine investigate Biden was *illegal* is no… https://t.co/6UlXbDsfcp
1189913561604206600,Thu Oct 31 14:34:35 +0000 2019,Next company: Campaign Finance Crimes Assurance https://t.co/cs536yuN44
1189718706399699000,Thu Oct 31 01:40:18 +0000 2019,Occasionally I remember that, amidst all this, the guy who was Donald Trump's political adviser on and off over thr… https://t.co/h9aJRYwieK
1189682964118020000,Wed Oct 30 23:18:16 +0000 2019,They've been subpoenaing everyone so this isn't really an obstacle. https://t.co/MucX28Q9qL
1189652321325723600,Wed Oct 30 21:16:30 +0000 2019,So... sounds like he will say some stuff tomorrow. https://t.co/GgkNT8Z9nR
1189629125276962800,Wed Oct 30 19:44:20 +0000 2019,Eisenberg and Ellis are NSC lawyers. You know who Bolton is. Unclear if any of these three will show up.  https://t.co/6F8b7YvIbu
1189569758989078500,Wed Oct 30 15:48:26 +0000 2019,Here's why there are ellipses in the call summary, according to an untrustworthy White House official https://t.co/BQZqZzS1Q7
1189558897910124500,Wed Oct 30 15:05:16 +0000 2019,Some "confusion" may also stem from President Trump claiming it is "an exact word-for-word transcript"… https://t.co/FiUgytpJ58
1189302474806612000,Tue Oct 29 22:06:20 +0000 2019,Straightforward from here: 1. Papadopoulos wins the seat 2. Republicans retake the House 3. Papadopoulos becomes Sp… https://t.co/XmkosJP8Dv
1189269547712483300,Tue Oct 29 19:55:30 +0000 2019,Now, Trump's allies are twisting an NYT report that Vindman was doing the exact same thing as Volker — responding t… https://t.co/p9CK9i2t6m
1189268599199940600,Tue Oct 29 19:51:44 +0000 2019,Kurt Volker also testified that he provided "advice" to Ukrainian officials, because they were asking him how to ha… https://t.co/p7MQBxpTqd
1189263158847983600,Tue Oct 29 19:30:07 +0000 2019,Either Schiff's assent or a vote of the full (Dem-controlled) Intel Committee would be necessary for Republicans to… https://t.co/maR9Z60HQZ
1189260986022318000,Tue Oct 29 19:21:29 +0000 2019,(Waiting for the inevitable GOP demand for Hunter Biden's testimony. You know it will happen.)
1189257658693570600,Tue Oct 29 19:08:15 +0000 2019,Dem resolution says that if Republicans want to call witnesses, they need to give a "detailed written justification… https://t.co/JBYS7WQEFG
1189239447310753800,Tue Oct 29 17:55:53 +0000 2019,The silver lining for Biden is that if this congeals as conventional wisdom, he could "beat expectations" by coming… https://t.co/amxd7urUCS
1189233078985732000,Tue Oct 29 17:30:35 +0000 2019,@nycsouthpaw They played poker like a dog!
1189222904099197000,Tue Oct 29 16:50:09 +0000 2019,Republican Party 2019 Platform: Snitches Get Stitches  https://t.co/WdGFEGw5AF  https://t.co/7F1xWFgr4z
1189192816875974700,Tue Oct 29 14:50:36 +0000 2019,This suggests they just want to go after Obama appointees rather than finding witnesses who will be helpful to Trum… https://t.co/UEweuxAyBW
1189191902827970600,Tue Oct 29 14:46:58 +0000 2019,Very brief filing from Flynn prosecutors saying that his request for Mifsud phone info is completely irrelevant to… https://t.co/s5MUAciyRM
1189024595942224000,Tue Oct 29 03:42:09 +0000 2019,Has there ever been a less successful Trump talking point than his criticism of Schiff’s paraphrase?   Even Republi… https://t.co/Zc1XnOxRKS
1189012571396944000,Tue Oct 29 02:54:22 +0000 2019,Graham a few weeks from now (predicting): "These open hearings from Democrats are clearly partisan stunts designed… https://t.co/7wfZkV6ikz
1189011548683026400,Tue Oct 29 02:50:18 +0000 2019,Relevant again today https://t.co/HBY80f7fjQ
1188994486237651000,Tue Oct 29 01:42:30 +0000 2019,The NYT's @dannyhakim just reported that Vindman drafted a memo urging Trump to restart the Ukraine military aid, b… https://t.co/qQW9CKaMOs
1188994107592577000,Tue Oct 29 01:41:00 +0000 2019,Vindman says he has never had direct communication with Trump (apart from listening to him on some of those calls).… https://t.co/q2kFqipJdj
1188993188834545700,Tue Oct 29 01:37:21 +0000 2019,Contra some speculation, Vindman appears to think there was nothing inappropriate about Trump's election night call… https://t.co/WtzPW3ED6q
1188992969023639600,Tue Oct 29 01:36:28 +0000 2019,Second key bit: Vindman was concerned by Trump's 7/25 call with Zelensky and again reported those concerns to NSC's… https://t.co/OH9f2KgZ1w
1188992627120758800,Tue Oct 29 01:35:07 +0000 2019,Politico has posted the full statement from NSC aide / Lt. Col. Alex Vindman.   First key bit: At 7/10 meeting, he… https://t.co/jGVy31aHXs
