id,created_at,text
1245771573514178600,Thu Apr 02 17:54:23 +0000 2020,Interesting piece exploring why young doctors may be getting so sick.  Argument is that it's not just *whether* you… https://t.co/PRvT2lGKrW
1243941899960008700,Sat Mar 28 16:43:54 +0000 2020,Obama Admin, 2009: We'll send out the money through withholding changes, broken up, so people don't even notice the… https://t.co/NJMACuJcgF
1243304900223795200,Thu Mar 26 22:32:42 +0000 2020,@MattZeitlin Make yourself feel better with a reminder that people were also miserable in non-pandemic times.  (Lou… https://t.co/IMCGZOHsEs
1242816992639402000,Wed Mar 25 14:13:56 +0000 2020,Background on the Swiss situation — next to northern Italy, reliant on cross-border workers, doing tons of testing: https://t.co/8G0wqRIabw
1242815996454371300,Wed Mar 25 14:09:58 +0000 2020,Switzerland has tested about 1% of its population (~80K people).   https://t.co/xelglLVZvI https://t.co/inKvBEsfa8
1242290899817808000,Tue Mar 24 03:23:25 +0000 2020,Me, continuing my Abbas Kiarostami watch, seeing the end of TASTE OF CHERRY: https://t.co/F9WZE5zLXu
1241362068571381800,Sat Mar 21 13:52:35 +0000 2020,I mean... this is a thing that happened days before Super Tuesday 2016. https://t.co/yEG6C7xsMn
1241360622853460000,Sat Mar 21 13:46:50 +0000 2020,I would not call "the candidates polling in 5th and 6th place nationally drop out" the "most unprecedented event in… https://t.co/tVk8EomJje
1240442459219538000,Thu Mar 19 00:58:23 +0000 2020,The @COVID19Tracking state-by-state testing numbers are very useful, but they should consider adding a row for "NBA… https://t.co/84CkJRSl3z
1240383467491332000,Wed Mar 18 21:03:58 +0000 2020,@mattyglesias Trump Hotels will accept payment in toilet paper
1240381411569344500,Wed Mar 18 20:55:48 +0000 2020,Can’t wait for the argument about whether the Emergency Toilet Paper Provisions Program (Brown New Deal) should be means-tested
1240348202374779000,Wed Mar 18 18:43:50 +0000 2020,And note: as horrible as those absolute numbers are, this is actually the smallest *percentage* increase compared t… https://t.co/xo2hvy4p0f
1240345676724174800,Wed Mar 18 18:33:48 +0000 2020,Over the past week Italy went from 12K to 35K reported cases https://t.co/0EEGpEGdgT
1240272596660301800,Wed Mar 18 13:43:24 +0000 2020,Tired: Will Bernie win every primary?  Wired: Will Bernie ever win another primary?  Inspired: Will we ever have another primary?
1240061791604035600,Tue Mar 17 23:45:45 +0000 2020,@dylanlscott He posted today that he's working on it "in a remote isolated location"   https://t.co/lH5pZbP1kJ https://t.co/z9MCmd3hMJ
1240020583791853600,Tue Mar 17 21:02:00 +0000 2020,Recently watched AND LIFE GOES ON… (1992), an incredible Abbas Kiarostami film with resonances for our current mome… https://t.co/ylCF9CcCfQ
1239666105251238000,Mon Mar 16 21:33:26 +0000 2020,I’m not really good at eyeballing “six feet” (for distance) so I instinctively picture myself laying on the ground.… https://t.co/a2oft7yamH
1239583051170091000,Mon Mar 16 16:03:24 +0000 2020,My proudest covid-19 lifehack so far has been buying a pair of gloves because earlier online reviewers complained a… https://t.co/M4U6BRRXn4
1238966102228680700,Sat Mar 14 23:11:52 +0000 2020,Do experts think the US death count from coronavirus is significantly understated, like the infection count? Or is… https://t.co/jITQSFutrT
1238453953521688600,Fri Mar 13 13:16:46 +0000 2020,Trump is like the "this is fine" dog except for saying "Obama was bad."
1238175352817623000,Thu Mar 12 18:49:42 +0000 2020,There are many presidential responsibilities Trump is ill-suited for, but disaster/pandemic response may be the one… https://t.co/T9zkDEbxX2
1238168063318659000,Thu Mar 12 18:20:45 +0000 2020,Maybe if you know nothing about Brazilian media and don't speak the language, don't spread random stuff you see fly… https://t.co/U0OQzJpvkS
1238142560914288600,Thu Mar 12 16:39:24 +0000 2020,"In every business I enter (whether that’s a restaurant, supermarket, or retailer), someone takes my temperature an… https://t.co/dcOlUQYWzD
1237790559726710800,Wed Mar 11 17:20:41 +0000 2020,Makes sense to me for Bernie to stay in now given the state of the delegate count.   But if Tuesday of next week go… https://t.co/CoxOmceEXC
1237787114881900500,Wed Mar 11 17:06:59 +0000 2020,Bernie says he's losing the delegate count, but he's winning in support for the progressive agenda and winning amon… https://t.co/2NFQb1SRwV
1237785738579566600,Wed Mar 11 17:01:31 +0000 2020,Bernie opens with: "Let me begin by reiterating what I have said from day one of this campaign, and that is that Do… https://t.co/QgOw5x6C2W
1237572254466101200,Wed Mar 11 02:53:13 +0000 2020,They should call it "Operation How Do You Do, Fellow Kids?" https://t.co/7uckZtDjQ3
1237571072137900000,Wed Mar 11 02:48:31 +0000 2020,Clinton beat Sanders in Missouri by 0.25 of a percentage point.  Biden is beating Sanders there by 28 percentage po… https://t.co/9lQLVP7COe
1237528073429385200,Tue Mar 10 23:57:39 +0000 2020,I'm reminded of when Don Jr. suddenly took an interest in the US ambassador to Ukraine.  Turned out Lev Parnas, aft… https://t.co/5jr8AnroVe
1237464662662414300,Tue Mar 10 19:45:41 +0000 2020,They were higher in states that had a lot of votes come in before they dropped out (mail or absentee), naturally.… https://t.co/9mM8cspqmW
1237463809268355000,Tue Mar 10 19:42:17 +0000 2020,In current vote counts, Buttigieg and Klobuchar together are at 12% in UT, 8% in CA.  5-7% in TN, NC, TX, AR, MN.… https://t.co/YQsiZy3HUD
1237456930731364400,Tue Mar 10 19:14:57 +0000 2020,Sanders and Warren supporters spending all their time sniping at each other because nobody they interact with suppo… https://t.co/oIotIoIZaN
1237413424545632300,Tue Mar 10 16:22:05 +0000 2020,@nycsouthpaw It's based on (A) how many districts each is above 15% in:, (B) different confidence levels at "callin… https://t.co/kvXF1gSava
1237384170109886500,Tue Mar 10 14:25:50 +0000 2020,This entire @ByronYork column is basically this XKCD comic https://t.co/oQnQIggSfl  https://t.co/ahx9sXRZWa https://t.co/awqXQ2asRr
1237096063678525400,Mon Mar 09 19:21:00 +0000 2020,Just saying... https://t.co/OFLYonAQgm
1237071150229999600,Mon Mar 09 17:42:00 +0000 2020,"Been thinking about life and mortality today..." https://t.co/bmvT76E0US
1237024478883954700,Mon Mar 09 14:36:33 +0000 2020,@dylanlscott And then you can go on to watch the other films in the "Max von Sydow Death and Spiritual Despair Cine… https://t.co/rDCJFvYm43
1236686576236802000,Sun Mar 08 16:13:50 +0000 2020,In retrospect NH was a bellwether of what we'd see in MA/ME on Super Tuesday (much weaker Bernie support in the reg… https://t.co/ubAonfgAg8
1236684437410189300,Sun Mar 08 16:05:21 +0000 2020,Who was it that added up the Biden+Buttigieg+Klobuchar vote in NH to show it was more than Bernie's and got mercile… https://t.co/UP9JgDgdba
1236675258444402700,Sun Mar 08 15:28:52 +0000 2020,@sellthekids Trump Twitter Archive — a very useful resource https://t.co/hkVGwPBmVB
1236674005542854700,Sun Mar 08 15:23:53 +0000 2020,@MollyJongFast I expect it would be something like this: https://t.co/o0fbTIXJZD
1236650955933995000,Sun Mar 08 13:52:18 +0000 2020,Since I wrote this on Friday, Biden's delegate lead over Bernie has expanded further as more votes are counted:… https://t.co/likR4O8GHM
1236488271208886300,Sun Mar 08 03:05:51 +0000 2020,Trump appears to have been under the misimpression that he could bluff and spin his way through this outbreak like… https://t.co/ZQ8Xl0rNoH
1236485002738700300,Sun Mar 08 02:52:52 +0000 2020,Washington state was *the* single best state for Bernie in terms of net delegates in 2016.  That advantage was alre… https://t.co/sFelNWToI5
1236100913019920400,Sat Mar 07 01:26:37 +0000 2020,He waited a bit longer (till today) https://t.co/yko4Wx8HBX
1236010671244021800,Fri Mar 06 19:28:02 +0000 2020,More info on why that is here: https://t.co/IpvHTCKxeQ https://t.co/hIYN496RxC
1236010376866775000,Fri Mar 06 19:26:52 +0000 2020,Not like in 2016 — a narrow win like 2016's will mean nothing for the delegate count. Bernie needs landslide wins i… https://t.co/lcl4Mj4lKP
1235990170006143000,Fri Mar 06 18:06:34 +0000 2020,@RichardLStoper .@FHQ says it looks like it would be a wash https://t.co/cWvMBXhM6Y
1235987775729660000,Fri Mar 06 17:57:03 +0000 2020,Delegate math explainer!  Biden's landslide wins in VA, AL, and NC were extremely important at building his lead.… https://t.co/sgWWOxX7uc
1235976418619789300,Fri Mar 06 17:11:56 +0000 2020,@notcapnamerica Well, Biden also said that shouldn't necessarily happen...
1235959427179720700,Fri Mar 06 16:04:25 +0000 2020,Around this point in the 2008 and 2016 Democratic contests, the race stabilized and the outcomes in states became f… https://t.co/VFw8TMvaLs
1235730229135650800,Fri Mar 06 00:53:40 +0000 2020,The early mail ballots (where Biden did much worse and Bloomberg much better) are a remarkable look into an alterna… https://t.co/kgLqYpfYHs
1235691959190200300,Thu Mar 05 22:21:35 +0000 2020,@davidrlurie It definitely helps. Was near-impossible to clinch pre-June in 2016, due to CA. Now Biden *can* do tha… https://t.co/NFzeyWhZuJ
1235688767840796700,Thu Mar 05 22:08:54 +0000 2020,This is what I wrote about the delegate math on March 15, 2016. Clear then that Clinton's lead was near-insurmounta… https://t.co/Lz41XvSFe6
1235684292203774000,Thu Mar 05 21:51:07 +0000 2020,People are responding by pointing to Florida.   That doesn't accelerate things as much as you might think. Let's sa… https://t.co/Np7yKN4PhG
1235682405660405800,Thu Mar 05 21:43:38 +0000 2020,@DemFromCT Maybe Bernie will quit before Biden gets to the magic number, but that certainly wasn't his approach in 2016.
1235681492623388700,Thu Mar 05 21:40:00 +0000 2020,If Biden wins 55% of pledged delegates going forward, he wouldn't clinch a majority till June.  If Biden wins 60% o… https://t.co/h9lvimpG1Q
1235626483307159600,Thu Mar 05 18:01:25 +0000 2020,It seems increasingly unlikely that the Democratic primary will end with no one getting a majority of pledged deleg… https://t.co/FNh5VpIpPM
1235605012841185300,Thu Mar 05 16:36:06 +0000 2020,And many pointed to Bernie's high favorability ratings among Dem voters as evidence that they'd flock to him after… https://t.co/tIBM99OZnr
1235603124259303400,Thu Mar 05 16:28:35 +0000 2020,For 2012 Rs and 2020 Ds, "discovery, scrutiny, and decline" happened again and again and again.  Makes Trump's immu… https://t.co/eb1SElzaCr
1235579916755832800,Thu Mar 05 14:56:22 +0000 2020,@pml_tray To cancel out a Florida delegate disaster of that magnitude, he'd need landslide wins of similar magnitud… https://t.co/hASNHfcN1t
1235578316695974000,Thu Mar 05 14:50:01 +0000 2020,Hard to see how Bernie could possibly come back from the delegate disaster that would mean in the country's 3rd mos… https://t.co/ptNuGfGrnn
1235408871583142000,Thu Mar 05 03:36:42 +0000 2020,For comparison — it's far too early to get an accurate picture of what the CA delegate count will end up being, but… https://t.co/X3uuh1rw3q
1235408209562808300,Thu Mar 05 03:34:04 +0000 2020,(By "net" I mean how many delegates more than Bernie that Biden got there. It's a useful way to track how a candida… https://t.co/cOX4w0UIyq
1235406806182236200,Thu Mar 05 03:28:29 +0000 2020,Biden's landslides in AL, VA, and NC look to be really important for his delegate lead. He'll net around 90 delegat… https://t.co/qXuk1sIP5E
1235308437766107100,Wed Mar 04 20:57:37 +0000 2020,@HayesBrown Is it because you realized how much great content over the past 10 days you must have missed out on?
1235289554988544000,Wed Mar 04 19:42:35 +0000 2020,Bernie, asked if he still believes the plurality delegate winner should be the nominee, gives a lengthy answer that… https://t.co/5YaM2AmOBn
1235248163616850000,Wed Mar 04 16:58:06 +0000 2020,Dean did pioneer the online fundraising model and was the fundraising leader in the field. But yes, many difference… https://t.co/rzUH0gkjHt
1235246040955203600,Wed Mar 04 16:49:40 +0000 2020,It was Iowa that effectively elevated Kerry and sent him surging nationally (and sunk Dean) in '04. This time aroun… https://t.co/UsYDJtE0uZ
1235245298160734200,Wed Mar 04 16:46:43 +0000 2020,Good thread and also a relevant comparison re: 2004 may be Dean/Bernie.  Dean surged into first place in a divided… https://t.co/p7wxvF709d
1235244290625990700,Wed Mar 04 16:42:43 +0000 2020,Highest vote shares for candidates in Super Tuesday states (per current count):  Biden: AL (63%), VA (53%), NC (43%… https://t.co/nrIAFTdeDI
1235236388662128600,Wed Mar 04 16:11:19 +0000 2020,@intersquid @watertigernyc I actually downplayed the results at the time.  I've also argued that the obsession with… https://t.co/Nn40vwG9my
1235232610198130700,Wed Mar 04 15:56:18 +0000 2020,If Biden wins the nomination, he will have performed by far the worst in IA+NH (4th and 5th) of any nominee since t… https://t.co/0E0r7hs8Z5
1235231211364192300,Wed Mar 04 15:50:44 +0000 2020,If Biden wins and this is the turning point, it's also basically a more extreme version of the "frontrunner survivi… https://t.co/FB8QIaCV0d
1235228647327510500,Wed Mar 04 15:40:33 +0000 2020,Always good to have more historical examples than "the last thing that happened!"  Recollection of 2004 for instanc… https://t.co/d6UaGSLjoQ
1235222143618756600,Wed Mar 04 15:14:43 +0000 2020,Rubio only winning MN, DC, and Puerto Rico was very funny, but Bloomberg only winning American Samoa is way funnier.
1235219848394944500,Wed Mar 04 15:05:35 +0000 2020,Looking like Biden will emerge from Super Tuesday with a significant but not enormous delegate lead.  The catch is:… https://t.co/zZqb3OsZML
1235217445675249700,Wed Mar 04 14:56:02 +0000 2020,A Sanders+Warren combo would have changed the outcome in two states: MA and ME. But that would hardly matter for th… https://t.co/N2DSToF5BV
1235216710124306400,Wed Mar 04 14:53:07 +0000 2020,These assumptions of course are unrealistic. (I'd guess Biden is likely to pick up a larger share of Bloomberg vote… https://t.co/LEMPLBSPtG
1235215974862860300,Wed Mar 04 14:50:12 +0000 2020,Okay, let's say Biden+Bloomberg was one candidate, and Sanders+Warren is another. Here are current Super Tuesday ma… https://t.co/sz9yG43myM
1235214365210669000,Wed Mar 04 14:43:48 +0000 2020,Life is more complicated than this, voters won't all go one way, etc.
1235214169126981600,Wed Mar 04 14:43:01 +0000 2020,And… current Sanders+Warren totals in Super Tuesday states: VT: 63% CO: 53% UT: 50% MA: 49% ME: 49% CA: 46% MN: 45%… https://t.co/uQbkcSLHbP
1235214102013915100,Wed Mar 04 14:42:45 +0000 2020,Just for fun... current Biden+Bloomberg totals in Super Tuesday states: AL: 75% VA: 63% AR: 57% NC: 57% TN: 57% OK:… https://t.co/KO2pm0Csrk
1235053436132966400,Wed Mar 04 04:04:20 +0000 2020,Just retweeting this for no apparent reason https://t.co/iuL6L26dif
1235034419062345700,Wed Mar 04 02:48:45 +0000 2020,Obviously subject to change (especially bc CA vote not in), but NYT is currently projecting Biden emerges from all… https://t.co/s6xsnTNDJt
1235002090872766500,Wed Mar 04 00:40:18 +0000 2020,Curious whether margins in VA (which has very little early vote, and Biden is winning huge) differ from margins in… https://t.co/UOJgOyfY6P
1234925657852928000,Tue Mar 03 19:36:35 +0000 2020,@DKarol Bloomberg is actually the candidate who got the most (unweighted) endorsements in 538 tracker in February 2… https://t.co/jF5MziPWPb
1234922384953663500,Tue Mar 03 19:23:34 +0000 2020,@DKarol Seems to me that party elites doubt their ability to anoint/elevate one candidate in large field. Doubts ab… https://t.co/ZeFpYNLYd4
1234919984574484500,Tue Mar 03 19:14:02 +0000 2020,@RDEliason Sure but we gotta talk about something until we have results!  (More seriously, the last two days were i… https://t.co/7s1B0cm51p
1234918125944156200,Tue Mar 03 19:06:39 +0000 2020,@rainmar7 The Census Bureau says yes, though I acknowledge people have different views on that question (like the q… https://t.co/umZ3Th9Sww
1234895100414742500,Tue Mar 03 17:35:09 +0000 2020,The early state momentum bounce giveth, and the early state momentum bounce taketh away  https://t.co/X0hCUPb9rp
1234886411205124000,Tue Mar 03 17:00:38 +0000 2020,For fun, I tweaked the 2016 delegate numbers so that: -Clinton's delegate advantage in the South is cut in half -Be… https://t.co/o9R6RVxGeL
1234871645510230000,Tue Mar 03 16:01:57 +0000 2020,RT @liszhou: why super tuesday is so ~* super *~, by @awprokop  https://t.co/2gs7IRKYLz
1234867374819598300,Tue Mar 03 15:44:59 +0000 2020,Gonna be a fun roller coaster news cycle as we get in most Super Tuesday states, then CA day-of vote, then graduall… https://t.co/GqDDirEPuT
1234862326333034500,Tue Mar 03 15:24:55 +0000 2020,For instance, take TX. Clinton won it by 32 points in 2016. Netted 72 delegates there. That represented about 1/5 o… https://t.co/npLBOBRvY7
1234859274838380500,Tue Mar 03 15:12:48 +0000 2020,Obviously the trends here are good for Biden. And yet, these polls show him winning every Southern state (usually b… https://t.co/bf2ADIn1t4
1234851844083593200,Tue Mar 03 14:43:16 +0000 2020,Just because Trump won with pluralities against a divided field, that didn't mean Bernie will.  But also: just beca… https://t.co/OUmzEG4aXx
1234818189374214100,Tue Mar 03 12:29:32 +0000 2020,@KatieStamp81 @today_explained Depends on the state - in some, only registered Democratic voters can participate. I… https://t.co/G2pbFUc3kn
1234670276119384000,Tue Mar 03 02:41:47 +0000 2020,In 2008, Obama ended up getting just 127 more pledged delegates than Clinton. He finished with about 51% of total p… https://t.co/Zzziq2hDh6
1234667362839752700,Tue Mar 03 02:30:12 +0000 2020,@theositther @today_explained @DemsAbroad Dems Abroad voting is 3/03-3/10 so not really a Super Tuesday contest.
1234596518176358400,Mon Mar 02 21:48:42 +0000 2020,Difference is: Dems have no winner-take-all states waiting later in the calendar to help someone off track for a majority get back on track.
1234596137740439600,Mon Mar 02 21:47:11 +0000 2020,Dem field now the same size as the 2016 GOP Super Tuesday field: 4 candidates with a shot at getting some delegates… https://t.co/s1GmLXRzDd
1234584623704936400,Mon Mar 02 21:01:26 +0000 2020,Theoretically very cool but not theoretically very legal https://t.co/hPRGDrf1Bu
1234579076624588800,Mon Mar 02 20:39:23 +0000 2020,@jbview These are the endorsements Biden got between NV and SC... https://t.co/MnVz9dRLCL
1234577296654205000,Mon Mar 02 20:32:19 +0000 2020,Since Parties Deciding is in the conversation, here's what I wrote in 2015.  Seems to describe what is happening th… https://t.co/NvTECX5pT4
1234566912622964700,Mon Mar 02 19:51:03 +0000 2020,With Bloomberg at 15% nationally and Warren at 14%, dropouts of the other candidates could be very helpful for thei… https://t.co/Pxj9mn76Px
1234565497565438000,Mon Mar 02 19:45:26 +0000 2020,(Undecided is not explicitly listed here, but the candidates don't add up to 100%)
1234564961017516000,Mon Mar 02 19:43:18 +0000 2020,Together, Buttigieg, Klobuchar, Steyer and undecided voters combine for over 20% nationally (per RCP).… https://t.co/9UPflVS7Y7
1234550746256941000,Mon Mar 02 18:46:49 +0000 2020,What this seems to have (probably, depending on early voting) averted is the outcome where Bernie wins massive dele… https://t.co/sGSGCLFNpK
1234549806300835800,Mon Mar 02 18:43:05 +0000 2020,Weirdly a 3- or 4-way Super Tuesday vote split can be more likely to produce a delegate split than a more crowded 6… https://t.co/28kiNYMJhr
1234546621389693000,Mon Mar 02 18:30:25 +0000 2020,Seems like there is literally no one who has less standing to complain about the politicization of an outbreak than… https://t.co/4Pw9fsaRMy
1234523906083557400,Mon Mar 02 17:00:10 +0000 2020,"No one" has soared in the 538 forecast but under the hood is the projection that Bloomberg is likely to end up wit… https://t.co/XdJkMUxhH6
1234216669402345500,Sun Mar 01 20:39:19 +0000 2020,Update: Bernie has surged — to 15.76% in SC's 6th congressional district, barely above the threshold. 94% of counti… https://t.co/ydERlr3PcI
1234157659231805400,Sun Mar 01 16:44:50 +0000 2020,Count is not final. Bernie's viable in every other district, but that's the one where he's currently short.
1234156595975774200,Sun Mar 01 16:40:36 +0000 2020,Bernie has fallen below 15% in Clyburn's district (the 6th), meaning Biden would get all 8 delegates there, per The… https://t.co/bQrGmEahn6
1233448785277280300,Fri Feb 28 17:48:01 +0000 2020,If CA results are 35-14-13-12 like this poll, Bernie gets 100% of statewide delegates.  If CA results are barely di… https://t.co/CKucXEcJ0p
1233442788412469200,Fri Feb 28 17:24:11 +0000 2020,There's such a thin line between "Bernie builds a near-insurmountable delegate lead" and "well this thing is going… https://t.co/3v0NhB160N
1233435837657907200,Fri Feb 28 16:56:34 +0000 2020,A fun scenario:  -Candidate A gets a Super Tuesday delegate lead in a split field.  -Then there’s winnowing, and Ca… https://t.co/Wq6xEwdURD
1233427634933129200,Fri Feb 28 16:23:58 +0000 2020,@abbenme Good point, didn't mean for it to be read that way, but I can tweak the language to make it clearer.
1233406830841340000,Fri Feb 28 15:01:18 +0000 2020,Is this: A.) Trump trying to boost Steyer in SC to hurt Biden? B.) Trump just doesn't like Steyer, there's no strat… https://t.co/TiDgNtFacD
1233157243144675300,Thu Feb 27 22:29:32 +0000 2020,I doubt any particular contested-ish convention outright caused any of these candidates to lose (none of them ended… https://t.co/BrvSPIYquo
1233140530676207600,Thu Feb 27 21:23:07 +0000 2020,I wrote this in 2016 re: contested conventions. Basically, 1972D, 1976R, and 1980D were all "contested-ish." But al… https://t.co/xctEOx3uGB
1233097944368394200,Thu Feb 27 18:33:54 +0000 2020,"In Hoffa's Shadow" was excellent. @jacklgoldsmith's personal connection is of course quite something, but the rese… https://t.co/F7pHjY5dCR
1233070856206770200,Thu Feb 27 16:46:16 +0000 2020,@NateSilver538 Yeah maybe it's less about a technical path to victory and more about — are you winning at least som… https://t.co/S8s2DDjVsu
1233065964272603100,Thu Feb 27 16:26:49 +0000 2020,@NateSilver538 Early on and for the no-hopers, sure. I was more thinking of, the more serious contenders, once voting begins.
1233063125773058000,Thu Feb 27 16:15:33 +0000 2020,Whether candidates drop out usually depends on these factors:  1. Are they winning at least some delegates? 2. Does… https://t.co/FMbqhLqaZv
1233056823772696600,Thu Feb 27 15:50:30 +0000 2020,Biden led national polls and polls in most states till he lost IA/NH. If he wins SC big, does he regain that ground… https://t.co/mYfZyxt2N1
1233043572166971400,Thu Feb 27 14:57:51 +0000 2020,@pbump Must credit
1233042891175596000,Thu Feb 27 14:55:08 +0000 2020,Breaking: Candidates are adopting the rhetorical and process arguments they think will best help win them the nomination.
1232769565366640600,Wed Feb 26 20:49:02 +0000 2020,@ShredyBettyMTB 415 total pledged delegates. But about 2/3 are allotted according to the results in congressional d… https://t.co/ScCt12rlaP
1232766348293476400,Wed Feb 26 20:36:15 +0000 2020,@zackbeauchamp It's also anti-Surrealistic https://t.co/rLrv1YwJCj
1232750208649433000,Wed Feb 26 19:32:07 +0000 2020,I mocked up these rough estimates to show just how dramatically Sanders's statewide delegate haul in California can… https://t.co/gK0gX9EjbT
1232730977962774500,Wed Feb 26 18:15:42 +0000 2020,As important as the 15% threshold for California's statewide delegates is (it's very important!), here is your dail… https://t.co/1bwDgsZiCC
1232683841845940200,Wed Feb 26 15:08:24 +0000 2020,(If the results looked exactly like the Point Blank poll he'd get *all* the statewide delegates, of course. I think… https://t.co/abfeCsbTj9
1232683556146745300,Wed Feb 26 15:07:16 +0000 2020,If the CA results look anything like these it would be incredible for Bernie. He'd get the vast majority of statewi… https://t.co/cpXGLrx6P9
1232675547588833300,Wed Feb 26 14:35:27 +0000 2020,I wanna talk to the voters whose first choice is Bloomberg and second choice is Bernie. https://t.co/33vf1LOg4D
1232659545224339500,Wed Feb 26 13:31:51 +0000 2020,On the whole Bernie would probably prefer Warren to get delegates than Bloomberg to, right?
1232658718946406400,Wed Feb 26 13:28:34 +0000 2020,I see people saying this is great for Bernie. But it means a three way delegate split in both situations... https://t.co/TP3LMYIfoy
1232394459578499000,Tue Feb 25 19:58:30 +0000 2020,SCENARIO 4: Three or more candidates split the Super Tuesday delegates, with no one close to being on track for a m… https://t.co/6NvGSDRCfg
1232394067822219300,Tue Feb 25 19:56:57 +0000 2020,SCENARIO 3: Two candidates get the vast majority of the Super Tuesday delegates.  This would effectively set up a h… https://t.co/ShtMGdzPIV
1232393543525838800,Tue Feb 25 19:54:52 +0000 2020,SCENARIO 2: One candidate emerges with a large delegate plurality in a split field, but is not on track for a major… https://t.co/v1hbiQKgXg
1232393105384624000,Tue Feb 25 19:53:07 +0000 2020,Seems to me there are four broad possible (non-candidate specific) outcomes from Super Tuesday in a split field.  S… https://t.co/g8OxbYCwln
1232070101572169700,Mon Feb 24 22:29:37 +0000 2020,Imagine the (very unlikely) nightmare scenario where this ends up mattering.  "Yes, I know you have 1990 pledged de… https://t.co/b2b1LEMKNG
