id,created_at,text
1212494731516792800,Wed Jan 01 22:04:05 +0000 2020,Tired: The 18 and 1/2 minute gap  Wired: The 18 torn-out pages of John Wilkes Booth's diary https://t.co/DFOlkll71o
1211486056035414000,Mon Dec 30 03:15:58 +0000 2019,Great thread. #2 and #7 are particularly underappreciated points. https://t.co/WiP9vyLBeP
1209843475375628300,Wed Dec 25 14:28:56 +0000 2019,By making those comments, McConnell was trying to knock down reports of disagreements between his and Trump’s team.… https://t.co/u5QBp1ou6R
1209842902907658200,Wed Dec 25 14:26:40 +0000 2019,People think everything McConnell does is strategically brilliant, but I’ve been wondering if his Fox News comments… https://t.co/ZprxIC2Xka
1209560901696839700,Tue Dec 24 19:46:06 +0000 2019,Is it a counterintuitive take now to say that actually, watching movies spanning a century of cinema history is bet… https://t.co/PTYvK5vxkr
1209553248161599500,Tue Dec 24 19:15:41 +0000 2019,I was offline yesterday but I see the news cycle was about McConnell not ruling out witnesses at the impeachment tr… https://t.co/UtH1RPnBYt
1208097367037272000,Fri Dec 20 18:50:32 +0000 2019,Small brain: A wine cave fundraiser sounds bad Medium brain: Actually wine caves are humble local agriculture, stop… https://t.co/ubFW4acL0v
1208087717986414600,Fri Dec 20 18:12:11 +0000 2019,Should have been addressed to: "To Whom It May Concern (Donald Trump or Michael Pence)"  https://t.co/MIb9cKDCm1
1208049473793994800,Fri Dec 20 15:40:13 +0000 2019,Ah, this change seems to mean Klobuchar is in too.  https://t.co/ybmFZAcGRo
1207827731246911500,Fri Dec 20 00:59:06 +0000 2019,It's noteworthy that, just one week after McConnell declared there would be no difference between his position and… https://t.co/uFTNzKK310
1207826176846319600,Fri Dec 20 00:52:55 +0000 2019,Full disclosure: holding back the articles of impeachment seemed silly and pointless to me, and unlikely to achieve… https://t.co/nckV2WJall
1207772900431990800,Thu Dec 19 21:21:13 +0000 2019,The Senate wasn't going to take it up until January anyway, so seems reasonable enough https://t.co/wgcoTcGbrh
1207741403134136300,Thu Dec 19 19:16:03 +0000 2019,Lindsey Graham finally finds some extortion he's concerned about https://t.co/WyDSKZRjUq
1207702055479058400,Thu Dec 19 16:39:42 +0000 2019,Minutes after Trump tweets that the Senate should hurry up and have the trial, McConnell says he's in fact in no ru… https://t.co/r0keR5qLWE
1207694917331570700,Thu Dec 19 16:11:20 +0000 2019,Trump wants this over with. Suggests McConnell set a date for the trial with or without Pelosi turning over the imp… https://t.co/DEXPuTWuUA
1207693202297380900,Thu Dec 19 16:04:31 +0000 2019,Pelosi says there's precedent for this in the Clinton trial. Stresses the Senate unanimously agreed on a plan for t… https://t.co/G7oFU5QJME
1207692766580486100,Thu Dec 19 16:02:48 +0000 2019,Pelosi says again, "The next thing for us will be when we see the process that is set forth in the Senate, then we’… https://t.co/dBVbWUwiOk
1207689175312539600,Thu Dec 19 15:48:31 +0000 2019,@MattZeitlin When he's bad, his badness can be properly managed.
1207685767138553900,Thu Dec 19 15:34:59 +0000 2019,Yes, and I'd add that even retiring House Rs backed him. It's not 2016 anymore, when they were holding their noses.… https://t.co/OrcSftpFfa
1207678991773122600,Thu Dec 19 15:08:03 +0000 2019,McConnell closes his speech without giving any further details on timing or the specifics of the trial. But reitera… https://t.co/Gs7aHdMO6u
1207678350787039200,Thu Dec 19 15:05:31 +0000 2019,McConnell says the Senate should make legal judgments but also consider "questions about what outcome best serves t… https://t.co/BQshiw7nYI
1207677788649590800,Thu Dec 19 15:03:17 +0000 2019,McConnell says "unprecedented" approximately a zillion times, to describe the impeachment effort.  (Again, he doesn… https://t.co/TvIDSHdErH
1207677019632349200,Thu Dec 19 15:00:13 +0000 2019,"If the Speaker ever gets her house in order, that mess will be dumped in the Senate’s lap," McConnell says.  (Seem… https://t.co/zxuxkWAWSq
1207676205945802800,Thu Dec 19 14:56:59 +0000 2019,McConnell now giving the obvious response to Pelosi's suggestion that she'll withhold transmitting the impeachment… https://t.co/E71eHZF7vW
1207675315864125400,Thu Dec 19 14:53:27 +0000 2019,Note: When McConnell talks to "Mr. President" he is not addressing Trump. This is just Senate-floor-speak (remarks… https://t.co/xgTEqDhdbI
1207674665184960500,Thu Dec 19 14:50:52 +0000 2019,McConnell is not particularly interested in the precedent of past presidents not pressuring foreign governments to… https://t.co/kz9tF5VAlK
1207673816274677800,Thu Dec 19 14:47:29 +0000 2019,McConnell now speaking along these lines. "History matters, and precedent matters."  (The precedent that's useful t… https://t.co/nrxKq9MzV0
1207668525915148300,Thu Dec 19 14:26:28 +0000 2019,This allows him to pursue his true objective — preventing any witness testimony — by means that appear reasonable t… https://t.co/pQD1F4Fgx2
1207667857359806500,Thu Dec 19 14:23:49 +0000 2019,In the 1999 Clinton trial, the Senate approved the House's proposal to get depositions from three witnesses.  But o… https://t.co/iDbJ8ibKbt
1207667203581108200,Thu Dec 19 14:21:13 +0000 2019,But we're already seeing it at play with McConnell's claims that he'll follow the "tried-and-true 1999 model" for t… https://t.co/L55I4kbzxY
1207666690894581800,Thu Dec 19 14:19:11 +0000 2019,Most infamous example of this is when "the Senate doesn't fill Supreme Court vacancies that appear during an electi… https://t.co/Z5RdPLCHfA
1207666287180157000,Thu Dec 19 14:17:34 +0000 2019,The thing to understand about Mitch McConnell is that he'll talk a lot about precedent, but he construes those prec… https://t.co/GOgMNIWYE4
1207664905094094800,Thu Dec 19 14:12:05 +0000 2019,I wonder what the decision will be?  https://t.co/diOK1kJBoP
1207525654926942200,Thu Dec 19 04:58:45 +0000 2019,I didn't think Pelosi would go for the "withholding the impeachment articles" thing: https://t.co/cWtP9IIl4o  Reali… https://t.co/DoTZIYBu0W
1207524215194296300,Thu Dec 19 04:53:02 +0000 2019,@Christin210 It was an accident: https://t.co/KXDUcdmSbn
1207522206181408800,Thu Dec 19 04:45:03 +0000 2019,Question is if the swing state or Trump-critical Senate Rs start to get annoyed at McConnell repeatedly suggesting… https://t.co/5Wh2LGZZTF
1207521167126478800,Thu Dec 19 04:40:55 +0000 2019,If you're keeping track, Dingell is the *second* member of Congress who feuded with Trump, who died during Trump's… https://t.co/grZlXDER9K
1207480845679902700,Thu Dec 19 02:00:42 +0000 2019,Trump has found his rebuttal: calling Adam Schiff ugly.   A preview of his team's case in the Senate?  https://t.co/J62LcF3c2C
1207479131614728200,Thu Dec 19 01:53:53 +0000 2019,The two articles of impeachment against Trump pass with 230 votes and 229 votes, respectively.  That tops Clinton's… https://t.co/oqyBR5RBhV
1207474354197540900,Thu Dec 19 01:34:54 +0000 2019,Tulsi Gabbard votes "present" on Article I.  Coincidentally or no, Steve Bannon recently said that if Gabbard wants… https://t.co/xTiU3hvkuB
1207463172019564500,Thu Dec 19 00:50:28 +0000 2019,Kevin McCarthy: We're doing this "just hours before Christmas."  Me: (nervously looks at calendar)
1207445844976455700,Wed Dec 18 23:41:37 +0000 2019,@brianbeutler @whstancil @qjurecic What would a broader inquiry have changed, in your view?  (From my perspective,… https://t.co/y9rMBcZTSN
1207440713409060900,Wed Dec 18 23:21:13 +0000 2019,@qjurecic I think it's more that the endgame for impeachment is in sight and some people are unhappy about it's goi… https://t.co/jpRfZw7P8p
1207437177841488000,Wed Dec 18 23:07:10 +0000 2019,So here are the arguments being presented for the idea that the House shouldn't send the articles of impeachment to… https://t.co/am9Y7jjQ3c
1207436998337802200,Wed Dec 18 23:06:28 +0000 2019,Did he also claim he had a very nice bridge for sale at a very reasonable price? https://t.co/8ZW9tBFZ9g
1207416775027175400,Wed Dec 18 21:46:06 +0000 2019,Gabbard has not participated in any of the procedural votes on impeachment so far today. And no floor speech. But t… https://t.co/FV81gg0HvU
1207408913114640400,Wed Dec 18 21:14:52 +0000 2019,Rep. Bill Johnson (R-OH) does not take my advice, uses his time for a "moment of silence" for the 63 million suppos… https://t.co/DiaYAHRWol
1207406351569313800,Wed Dec 18 21:04:41 +0000 2019,Some people who probably *would* be thrilled if House Ds withheld the impeachment articles, er, forever:   Kyrsten… https://t.co/3DGsoNVKoX
1207402169466536000,Wed Dec 18 20:48:04 +0000 2019,RT @CrisLeeMaza: I asked Rudy Giuliani if he flew to Vienna on December 6 in a plane owned by billionaire Alexander Rovt and he responded:…
1207400880477278200,Wed Dec 18 20:42:56 +0000 2019,Straightforward from here: 1. House Democrats withhold impeachment articles from the Senate  2. McConnell and Repub… https://t.co/lpwN9lRUDb
1207398991555641300,Wed Dec 18 20:35:26 +0000 2019,Wish Republicans would drop the "63 million people voted for Trump" talking point and flat out embrace the electora… https://t.co/aCWFhR4NYG
1207391854460907500,Wed Dec 18 20:07:05 +0000 2019,The only actual way Dems can get leverage over how the trial is conducted is by winning over 4 Senate Republicans r… https://t.co/h5oAoRtyFV
1207390248784806000,Wed Dec 18 20:00:42 +0000 2019,@Michaelander45 I expect he'll claim vindication and say Democrats are afraid to make their case. Don't think he'd… https://t.co/CpnUur58ee
1207387995260772400,Wed Dec 18 19:51:44 +0000 2019,McConnell will laugh at this effort to "force Senate concessions" and just confirm 300 more judges  https://t.co/jVHmRQhHdg
1207384784240021500,Wed Dec 18 19:38:59 +0000 2019,@KevinMKruse @MattZeitlin @nycsouthpaw Not talking just Kennedy or just academic history, but rather how the Johnso… https://t.co/e8pENT3mDb
1207381598557147100,Wed Dec 18 19:26:19 +0000 2019,Gabbard is not running for reelection and her future in Democratic politics is cloudy after her controversial presi… https://t.co/DRTZei5fc4
1207381190799433700,Wed Dec 18 19:24:42 +0000 2019,The only votes in the House that still appear to be in question are Ron Kind (D-WI) and Tulsi Gabbard (D-HI).  Kind… https://t.co/WXTqRgebAD
1207378609729687600,Wed Dec 18 19:14:27 +0000 2019,@MattZeitlin @nycsouthpaw @KevinMKruse Time Magazine, 1998: "History has sided with Ross and his fellow defectors."… https://t.co/Fw72WDgUUz
1207374993946038300,Wed Dec 18 19:00:05 +0000 2019,Choose your own adventure, but each adventure starts with "I'm looking for a way to defend Trump" and ends with "an… https://t.co/9gg4WkUCkH
1207368680591495200,Wed Dec 18 18:34:59 +0000 2019,This is projection. House Republicans are basing their votes solely on the political imperative to defend Trump. So… https://t.co/7WFHDyb1iB
1207367924668874800,Wed Dec 18 18:31:59 +0000 2019,After *weeks* of House Republicans accusing Democrats of basing impeachment on polls... here are Senate Republican… https://t.co/hJzZSsEtwZ
1207359505010450400,Wed Dec 18 17:58:32 +0000 2019,Now speaking in defense of Trump: Rep. Ross Spano (R-FL), who is being investigated by the Justice Department for c… https://t.co/ldVarvmO97
1207322871128871000,Wed Dec 18 15:32:58 +0000 2019,And Gabbard https://t.co/TjLbSzYISF
1207309481031413800,Wed Dec 18 14:39:45 +0000 2019,Would have been a great day to tweet "...and it's not even lunchtime!"  https://t.co/zlW4Peyq83
1207174939331219500,Wed Dec 18 05:45:08 +0000 2019,Attempt at typing Pelosi on my phone autocorrected to “Peloton.”
1207059749713457200,Tue Dec 17 22:07:25 +0000 2019,A classic moderate move. Believe he’s the only House member who’s announced plans to do this so far https://t.co/CdioVKfON4
1207051795945738200,Tue Dec 17 21:35:48 +0000 2019,Ah yes, perfectly normal and above-board, nothing to see here   https://t.co/V9gJFc5zxg
1207040813747855400,Tue Dec 17 20:52:10 +0000 2019,Is Van Drew just staying in the party till after the vote? So he'll be recorded as a Democratic no rather than a Re… https://t.co/3hTVIcNgkh
1207014614912917500,Tue Dec 17 19:08:04 +0000 2019,His firm, unsurprisingly, touts its extradition work.  (Firtash has been in Austria, fighting a US extradition requ… https://t.co/gO1kKIeBKX
1207014228810457000,Tue Dec 17 19:06:32 +0000 2019,Here's the name of the Firtash attorney who sent the payment https://t.co/zlbyXGhXO8
1207012239426904000,Tue Dec 17 18:58:37 +0000 2019,Reminiscent of Manafort telling Mueller's team three conflicting stories to try and explain a mysterious payment du… https://t.co/vtVGroLqmg
1207007152352714800,Tue Dec 17 18:38:24 +0000 2019,This $1M, prosecutors earlier said, was separate from the $200K Parnas got for Firtash "translation" work, through… https://t.co/TFJBsiXhTq
1207005037421088800,Tue Dec 17 18:30:00 +0000 2019,Prosecutors now saying the $1M payment that went to Parnas from a Russian account was in fact from Firtash. Per Reu… https://t.co/Havx6LePxZ
1206996842019532800,Tue Dec 17 17:57:26 +0000 2019,Giuliani was not on Schumer's list of four requested witnesses either. https://t.co/SED5FWQtkw
1206985477003366400,Tue Dec 17 17:12:17 +0000 2019,We're still waiting on Jared Golden, maybe Ron Kind. I don't know, Tulsi?  But Peterson as the only Dem defection (… https://t.co/DFBLgAKx1v
1206982921783009300,Tue Dec 17 17:02:07 +0000 2019,tbh Ingmar Bergman is totally unqualified to criticize the Marvel movies. He hasn't even seen them! (Due to having… https://t.co/dw2YaXkRCI
1206982564050821000,Tue Dec 17 17:00:42 +0000 2019,@DKarol Sentencing newly set for Jan 28, so hopefully the sun will still be intact then.  Wouldn't expect a large s… https://t.co/C5e3566XpY
1206980302809313300,Tue Dec 17 16:51:43 +0000 2019,Gates was hoping for probation. But he did do a lot of crimes.   Sounds like ABJ didn't want to give him a total ge… https://t.co/1e1ToGM80w
1206973019022921700,Tue Dec 17 16:22:46 +0000 2019,It has of course been reported that McConnell wants to have no witnesses. And he may anticipate this procedure will… https://t.co/QEgcTtW4el
1206972338593575000,Tue Dec 17 16:20:04 +0000 2019,Reupping — it's being misreported that McConnell ruled out witnesses at the impeachment trial. He did not. He said… https://t.co/Vxrijoe8MI
1206964620306632700,Tue Dec 17 15:49:24 +0000 2019,McConnell said the Senate should "follow the 1999 model" in which there were two resolutions. The first set the bas… https://t.co/xMf8gJYoIl
1206964355713110000,Tue Dec 17 15:48:21 +0000 2019,He's also saying it's not senators' job to request witnesses at the trial. "Presumably it will be the House prosecu… https://t.co/gmBwUalU0U
1206963952040718300,Tue Dec 17 15:46:45 +0000 2019,McConnell's full remarks on the Senate floor are more complicated than the bits flying around Twitter.  He's not ru… https://t.co/HSLKL5zM9D
1206687678701428700,Mon Dec 16 21:28:56 +0000 2019,Though, the Yovanovitch situation is not actually mentioned in the articles of impeachment...  https://t.co/sfsTSw6QLo
1206680585030254600,Mon Dec 16 21:00:45 +0000 2019,Short version: Dems thought accusing Trump of bribery would strengthen their impeachment case, but then changed the… https://t.co/CjAqi6xmuv
1206677304170164200,Mon Dec 16 20:47:42 +0000 2019,Don't let anyone say Judge Emmet Sullivan is in the tank for prosecutors — he says they have to file their new sent… https://t.co/gUFrPAWX8t
1206674139962073000,Mon Dec 16 20:35:08 +0000 2019,@DKarol I may have hallucinated this, but I think I saw an argument on here this weekend that Bloomberg's master pl… https://t.co/iqrtJnzYF3
1206671843349938200,Mon Dec 16 20:26:00 +0000 2019,I took a crack at explaining Democrats' back-and-forth over whether to accuse Trump of bribery here.  https://t.co/L4MvOsCt3J
1206667847214207000,Mon Dec 16 20:10:08 +0000 2019,Judge Sullivan was really smart to get Flynn to reaffirm his guilty plea at the sentencing hearing last year before… https://t.co/56J87q8Lsp
1206666665653612500,Mon Dec 16 20:05:26 +0000 2019,Flynn made 50 requests for Brady material. Judge Sullivan divides them into six categories.  The first? "Informatio… https://t.co/DP9Wsrl1QS
1206662764745429000,Mon Dec 16 19:49:56 +0000 2019,It's been amazing to see the Flynn people get their hopes up *again* that Judge Sullivan would save him. One year a… https://t.co/8r16vyWBZq
1206656321929564200,Mon Dec 16 19:24:20 +0000 2019,Andrew Johnson will continue to hold the record for most lopsided presidential impeachment vote (he was impeached 1… https://t.co/lIIZxGW9NR
1206655462780915700,Mon Dec 16 19:20:55 +0000 2019,Only three House Democrats represent Trumpier districts than Cunningham.   https://t.co/UB6M2kKTbj
1206627746388070400,Mon Dec 16 17:30:47 +0000 2019,@JoshNH4H Van Drew's switch technically isn't official yet.
1206624265686175700,Mon Dec 16 17:16:57 +0000 2019,Overall though it does not appear the impeachment margin will be razor-thin.  Several Ds in Trumpy districts — Rose… https://t.co/tGKUucxsRU
1206623854988267500,Mon Dec 16 17:15:19 +0000 2019,Will Trump get more votes for impeachment than Clinton did?  For Clinton, one article of impeachment passed with 22… https://t.co/8on2RiriMs
1206620247949754400,Mon Dec 16 17:00:59 +0000 2019,@qjurecic Kind of surprised Trump hasn't gone for that tbh. Seems very him
1206618142685962200,Mon Dec 16 16:52:37 +0000 2019,Meanwhile, it's Democrats who clearly want to get impeachment over with. Which is why this "one weird trick" won't… https://t.co/X1rStgTP3k
1206607336040796200,Mon Dec 16 16:09:41 +0000 2019,Back in 1999, it was Democrats, seeking a way out of Clinton's impeachment, who were arguing that senators shouldn'… https://t.co/sh3ofdFoic
1206605008432746500,Mon Dec 16 16:00:26 +0000 2019,Yes, ordinary jurors don't make decisions about how the trial should be run. But the Senate does.  https://t.co/VJxrzl1N0J
1206583652357943300,Mon Dec 16 14:35:34 +0000 2019,Outrageous — Mark Antony said that Brutus is an honorable man! Can you believe this guy? https://t.co/e70EPvfCOC
1206576063784075300,Mon Dec 16 14:05:25 +0000 2019,Has been notable that those who go against their party on impeachment then tend to make a dramatic career change.… https://t.co/xako65wxmZ
1206394747985768400,Mon Dec 16 02:04:56 +0000 2019,@mattyglesias But if "Disapprove" actually ran he wouldn't have those age and Hunter-related weaknesses
1206394316660379600,Mon Dec 16 02:03:13 +0000 2019,1. Rep. Justin Amash (R-MI) backs impeachment over Mueller report, then leaves Republican Party 2. Rep. Francis Roo… https://t.co/GqxauyWMP3
1206392986235494400,Mon Dec 16 01:57:56 +0000 2019,Unfortunately for Democrats, "Disapprove" is not running in the primary https://t.co/kJkKFTlO2p
1206389215442944000,Mon Dec 16 01:42:57 +0000 2019,Van Drew is a sort of exception that proves the rule for how things now work in this polarized Congress.  It felt m… https://t.co/Q40ndP8YDW
1206372086727528400,Mon Dec 16 00:34:53 +0000 2019,The other two are Rob Blair (WH) and Michael Duffey (OMB), who handled the military aid hold.  They really should t… https://t.co/SSAEPPWHCt
1206284993502285800,Sun Dec 15 18:48:48 +0000 2019,His tweets make clear he'd be quite good at it.  Issue would be, lots of Dems would like to be impeachment managers… https://t.co/D79UlLbOZy
1205360017391661000,Fri Dec 13 05:33:17 +0000 2019,"They held the vote in the dead of night! Outrageous!"   (Someone passes over a piece of paper)  "They delayed the… https://t.co/I3SjrN6GlZ
1205348172022853600,Fri Dec 13 04:46:13 +0000 2019,Collins has pushed the envelope *a lot* during this process with various stunts and nonsense.  And if you do that f… https://t.co/8t4rQTiSt5
1205344815413678000,Fri Dec 13 04:32:52 +0000 2019,If you followed this advice today, you'd have died of alcohol poisoning long ago.  But right now would make it extr… https://t.co/fzJ7L0eldG
1205343417968005000,Fri Dec 13 04:27:19 +0000 2019,A markup in name only. The language of this was set and approved by Dem leadership, and was not truly up for debate… https://t.co/fVaXKYXaW7
1205342018827903000,Fri Dec 13 04:21:46 +0000 2019,Didn't want to take a vote "in the dead of night?" https://t.co/qtRieJwuGX
1205336691315282000,Fri Dec 13 04:00:35 +0000 2019,Me, when I like the results of a foreign election: "There are many lessons here."  Me, when I dislike them: "You re… https://t.co/kKjIa4g6gr
1205253124094603300,Thu Dec 12 22:28:31 +0000 2019,I'm old enough to remember when people said this about 2016 https://t.co/CR6FYls75g
1205246239564017700,Thu Dec 12 22:01:10 +0000 2019,10/15/19: Lev Parnas tells pretrial services he earned $50K from law firm (DiGenova &amp; Toensing)  10/29/19: In new a… https://t.co/0SzhP48k72
1205210356391563300,Thu Dec 12 19:38:35 +0000 2019,With his presidency (not really) in jeopardy, it's time to tweet like he's never tweeted before  https://t.co/j46uk8vaII
1205208345776459800,Thu Dec 12 19:30:35 +0000 2019,@pwnallthethings Context for this is the @ktbenner report that Bill Barr intervened late in the process to approve… https://t.co/EPe36OgmTn
1205207641213096000,Thu Dec 12 19:27:47 +0000 2019,@pwnallthethings More side-by-side. This person likely being Sergei Millian is no secret (that's been reported sinc… https://t.co/lEF78TV9vG
1205206684265787400,Thu Dec 12 19:23:59 +0000 2019,So there was a very late decision by DOJ to unredact IG report info that a key Steele sub-source (believed to be Se… https://t.co/tnS63Fw3vN
1205205130846576600,Thu Dec 12 19:17:49 +0000 2019,@pwnallthethings Here's the updated explanation. So it was a deliberate choice to unredact this info related to Per… https://t.co/YaAbeIE6GM
1205204410567217200,Thu Dec 12 19:14:57 +0000 2019,@pwnallthethings They actually seem to have released the less redacted one later. Just checked the website and the… https://t.co/vUopHOiOQb
1205203033195503600,Thu Dec 12 19:09:29 +0000 2019,@pwnallthethings Weird, that last part (about the counterintelligence investigation) is redacted in my copy... https://t.co/nMSNOMGy7v
1205191790627868700,Thu Dec 12 18:24:48 +0000 2019,@EliLake @RadioFreeTom @AdamSerwer Think you are misremembering the 25th Amendment thing. Accounts say that Rosenst… https://t.co/dMvWdPoGk1
1205176487684522000,Thu Dec 12 17:24:00 +0000 2019,Who's to say whether Rep. Gaetz was ever arrested for a DUI?   https://t.co/lfSsHFvjh5
1205151851328548900,Thu Dec 12 15:46:06 +0000 2019,At the impeachment hearing, Rep. Eric Swalwell just tried to introduce this article by me on all the indictments an… https://t.co/ooxljf0JBJ
1205148307120676900,Thu Dec 12 15:32:01 +0000 2019,This conflates "a Russian bank account" with "Russia" (the government).  That is not the only possibility. Parnas's… https://t.co/jXy4US43ht
1205138629590442000,Thu Dec 12 14:53:34 +0000 2019,But to say there was nothing suspicious and worthy of investigation here... that the Trump campaign was obviously i… https://t.co/xfkJz5hhQt
1205138007117959200,Thu Dec 12 14:51:05 +0000 2019,In the end, Mueller did not find there was any conspiracy.  -Don Jr.'s meeting went nowhere -Efforts to "find" the… https://t.co/clWxKSQHpN
1205137486680395800,Thu Dec 12 14:49:01 +0000 2019,Meanwhile, the Trump Organization was secretly in talks for a potentially very lucrative real estate deal: the Trum… https://t.co/cFbmDrPfI5
1205136917127413800,Thu Dec 12 14:46:46 +0000 2019,Meanwhile, the chair of the Trump campaign, Paul Manafort, was handing over Trump campaign polling data to Konstant… https://t.co/PSReN3kY2d
1205136109354782700,Thu Dec 12 14:43:33 +0000 2019,Meanwhile, Trump's longtime political adviser Roger Stone was trying to reach out to WikiLeaks to get ahold of new… https://t.co/26dfGxinEN
1205135472038678500,Thu Dec 12 14:41:01 +0000 2019,For another, Donald Trump "repeatedly" told members of his campaign to "find" Hillary Clinton's deleted emails. Thi… https://t.co/RlC358q3SL
1205134934588952600,Thu Dec 12 14:38:53 +0000 2019,There’s some maddening revisionist history going on that the FBI should have known all along there was no Trump/Rus… https://t.co/K2w5K0aq8z
1205132053232132000,Thu Dec 12 14:27:26 +0000 2019,For whatever reason these Collins performances come off as more blatantly phony than those of his colleagues. Somet… https://t.co/rs7c7PppCD
1205131234747261000,Thu Dec 12 14:24:11 +0000 2019,Game change! https://t.co/SsZZkQpzNz
1204947385773805600,Thu Dec 12 02:13:38 +0000 2019,Hard to be genuinely surprised by any story about Trump at this point but this one did it for me  https://t.co/rD0THpUUeo
1204917002176999400,Thu Dec 12 00:12:54 +0000 2019,For Clinton’s Senate had to decide whether to approve witnesses requested by the House. (Clinton didn’t want any.)… https://t.co/ugW0HvdEog
1204827617834217500,Wed Dec 11 18:17:43 +0000 2019,Using the words "hearsay," "word of mouth," "just talk," "jest," "grain of salt," and "zero" corroboration.… https://t.co/xJxFnN7WcK
1204806569638187000,Wed Dec 11 16:54:05 +0000 2019,Full Horowitz answer on the Durham statement https://t.co/o5Bxo94W9E
1204804545928405000,Wed Dec 11 16:46:02 +0000 2019,Horowitz discusses the different between a preliminary and a full investigation in the report. https://t.co/FKQH0HU1bz
1204803892866879500,Wed Dec 11 16:43:26 +0000 2019,Horowitz says he met with Durham in Nov., presented him with the report.   "He said he did not necessarily agree wi… https://t.co/4K4hnMLYvz
1204803631981174800,Wed Dec 11 16:42:24 +0000 2019,Horowitz: "I was surprised by the [Durham] statement, I didn't necessarily know it was gonna be released on Monday."
