id,created_at,text
1258059806465720300,Wed May 06 15:43:26 +0000 2020,RE: Silk's "Freak Me," imagining the awkwardness of someone having to say "okay stop. stop! you have licked me up and down for long enough"
1257733627531735000,Tue May 05 18:07:19 +0000 2020,Adding pro wrestling flair to my pandemic-era trips to the public restroom by executing a powerful elbow drop to flush the urinal
1254797520963846100,Mon Apr 27 15:40:16 +0000 2020,tense at the grocery store. people seem impatient, aghast just because i understandably have to take the caps off d… https://t.co/NHsyO5hLlv
1124378603024724000,Fri May 03 18:22:03 +0000 2019,@asterios i am glad of your accomplishments but i mostly liked this due to the word GUMROAD, which is funny to me a… https://t.co/y03IjLYXMD
1124333171846406100,Fri May 03 15:21:31 +0000 2019,Excited that @pen15show was renewed! Hope it keeps moving forward one year per season on a Simpsons scale, so we'll… https://t.co/zfFYJFNQ72
1124002046292701200,Thu May 02 17:25:45 +0000 2019,There's not much of a "surprise element" left in late-night comedy, but there's still some suspense in wondering ho… https://t.co/HWoEDSrsM4
1123960284006297600,Thu May 02 14:39:48 +0000 2019,One perk of winning the Game of Thrones (GOT) is that then you only need an Emmy to complete the coveted cycle.
1122965723851182100,Mon Apr 29 20:47:46 +0000 2019,Pulling up at an intersection near a high school blasting "Harlem Shake." "Damn," kids in nearby cars are surely th… https://t.co/JnPOIF5ZmF
1120379327621869600,Mon Apr 22 17:30:22 +0000 2019,Can appreciate all the recent grieving about lost and damaged architectural marvels -- I mourn Metcalf South at least 6 times a week
1119644636803366900,Sat Apr 20 16:50:58 +0000 2019,I respect that it can make some people happy, but personally, I can't stand any music that could be described as "i… https://t.co/TEydOsig3o
1118933756788846600,Thu Apr 18 17:46:11 +0000 2019,Just got on the elevator after a guy who whistled "Que Sera Sera" so loudly I could hear it clearly as he descended… https://t.co/kHHiyAAOoW
1118556730122698800,Wed Apr 17 16:48:00 +0000 2019,Least favorite types of TV show: broad+tawdry ("broadry") and broad+maudlin ("broadlin")
1116716039742611500,Fri Apr 12 14:53:46 +0000 2019,Two songs running through my head at all times: Bluegrass version of paula abdul's "blowing kisses in the wind" and… https://t.co/CrxGwXUSTO
1116716039742611500,Fri Apr 12 14:53:46 +0000 2019,Two songs running through my head at all times: Bluegrass version of paula abdul's "blowing kisses in the wind" and… https://t.co/CrxGwXUSTO
