id,created_at,text
1087485172558319600,Mon Jan 21 23:00:44 +0000 2019,Happy Martin Luther King Day everyone! If you want to see more of the great man’s life on screen, there is plenty o… https://t.co/IUMMPrInXU
1087137785776128000,Mon Jan 21 00:00:20 +0000 2019,With #influencer marketing on track to be worth between $5-$10 billion by 2020, children are a growing part of Inst… https://t.co/lh0PSGlIdj
1087122701800689700,Sun Jan 20 23:00:24 +0000 2019,Which were the best performing brands on #YouTube in 2018? Brandboost conducted a study looking at the areas of med… https://t.co/hOCXLtcDmo
1087107612733251600,Sun Jan 20 22:00:27 +0000 2019,Who saw the #Twitch Holiday Spectacular? They revealed that they now average 3 million streamers per month — up fro… https://t.co/QWPMYQ5UPf
1087098420429553700,Sun Jan 20 21:23:55 +0000 2019,RT @Variety: All the winners from last night's #PGAAwards https://t.co/uCSFcgm3l5 https://t.co/5A52QRUzOz
1087062391370797000,Sun Jan 20 19:00:45 +0000 2019,2018 was a big year for original scripted series, it was estimated that 495 original shows aired in 2018, up from 2… https://t.co/F1iiQd9REA
1086897779031658500,Sun Jan 20 08:06:38 +0000 2019,RT @THR: .@producersguild nominees share notes at annual breakfast: "Protect the film at any cost" https://t.co/K6jkc9xJbT https://t.co/ZBd…
1086897758831816700,Sun Jan 20 08:06:33 +0000 2019,RT @producersguild: Photo selects from this morning's #PGAwards Nominees Breakfast: https://t.co/Wu6DHvlB5z  📸 @THR https://t.co/IYxtOB1Y4l
1086790484587171800,Sun Jan 20 01:00:17 +0000 2019,Read this blog in @ANAmarketers to learn more from our CEO, Ricky Ray Butler, on how #AI can be used to increase th… https://t.co/Nj2WTekUrn
1086775385180827600,Sun Jan 20 00:00:17 +0000 2019,The latest celebrity to launch their own YouTube channel is #JackBlack, and it’s already a huge hit. His new gaming… https://t.co/rvsAz3DThV
1086760328954826800,Sat Jan 19 23:00:28 +0000 2019,Artificial intelligence is influencing the nature of marketing at the very core. With a wide range of improvements… https://t.co/WjLskapnUR
1086730183724449800,Sat Jan 19 21:00:40 +0000 2019,It's the Producers Guild Awards tonight, from our partners and friends @producersguild. A key event in the awards s… https://t.co/oQXF1QHUNH
1086717355508428800,Sat Jan 19 20:09:42 +0000 2019,That’s a wrap! The the @producersguild nominees breakfast was a hit. It was a full house at the Skirball Cultural C… https://t.co/cDjYB9RpuK
1086707491969339400,Sat Jan 19 19:30:30 +0000 2019,RT @LoriMcCreary: #PGAwards Nominees Breakfast! Here are the producers from the 10 nominated films. @producersguild https://t.co/ILZMAKcOg5
1086696679040942100,Sat Jan 19 18:47:32 +0000 2019,From under a year to decades of creation, these producers worked on films that have moved mountains and hearts this… https://t.co/vCKGExuyLL
1086683681593294800,Sat Jan 19 17:55:53 +0000 2019,We couldn’t be more excited for this truly memorable event hosted by our partners @producersguild #contentisking… https://t.co/1btjDsuEZn
1086680678014636000,Sat Jan 19 17:43:57 +0000 2019,RT @producersguild: Waiting for the start of the @producersguild annual Nominee Breakfast. @Skirball_LA, Los Angeles.  #PGAwards https://t.…
1086669223974355000,Sat Jan 19 16:58:26 +0000 2019,Its Nominees breakfast time! #PGAwards #PGAAwards https://t.co/c4K4YGvUyi
1086428175931002900,Sat Jan 19 01:00:36 +0000 2019,We’re not really surprised by these numbers. Twitch viewers watched 226.85 million hours of #Ninja last year, makin… https://t.co/kuf2ss5xDk
1086413063203549200,Sat Jan 19 00:00:33 +0000 2019,As #AI continues to dominate the marketing conversation, it's essential that marketers understand how they can use… https://t.co/3m2BklJFf8
1086398046114644000,Fri Jan 18 23:00:53 +0000 2019,Esports was the phenomenon of 2018, in particular the juggernaut that is Fortnite. But what will 2019 bring? With g… https://t.co/Sn8mQnNk4r
1086382925648678900,Fri Jan 18 22:00:48 +0000 2019,Have you ever spotted all of the #brandintegrations that appeared in the sitcom F.R.I.E.N.D.S? @BrandtheChange take… https://t.co/Y62hlESSZz
1086362844831060000,Fri Jan 18 20:41:00 +0000 2019,RT @AwardStage: It's the Producers Guild Awards tomorrow night, nominees Include ‘Black Panther,’ ‘A Star Is Born,’ ‘Handmaid’s Tale’, whic…
1086362584947834900,Fri Jan 18 20:39:58 +0000 2019,RT @CastAndCrewNews: Congratulations to the creator of @MaiselTV Amy Sherman-Palladino who is this year's recipient of the @producersguild’…
1086362071737032700,Fri Jan 18 20:37:56 +0000 2019,RT @THR: Three weeks after releasing the stand-alone #BlackMirror interactive film #Bandersnatch, @Netflix is sharing some data around how…
1086020536428310500,Thu Jan 17 22:00:47 +0000 2019,Taking a strategic approach to each platform remains vital to create successful #influencer programs. Senior Accoun… https://t.co/0aZ9hGA0Gq
1086005510820765700,Thu Jan 17 21:01:05 +0000 2019,#TBT to the amazing time we had last week at #CES2019. It was a pleasure to share the stage with @derraleves and… https://t.co/qPjvVcxAVC
1085994018931163100,Thu Jan 17 20:15:25 +0000 2019,RT @THR: #LegoMovie2 hits theaters on Feb. 8, exactly four years after the first 'Lego Movie' transformed into a box-office sensation – ope…
1085988078320214000,Thu Jan 17 19:51:49 +0000 2019,TV viewing has changed &amp; binge-watching is at an all-time high. Viewers desire easily digestible content in snack s… https://t.co/fpyKMmedat
1085975386222149600,Thu Jan 17 19:01:23 +0000 2019,Esports BAR takes place next month, and as expected the likes of Ubisoft, Twitch, and ESL will be attending. But th… https://t.co/H4XhFFoO32
1085960317274869800,Thu Jan 17 18:01:30 +0000 2019,What are the six marketing trends facing #influencers in 2019? @tubefilter have pulled together this list including… https://t.co/WrsXlm1L2I
1085935003647774700,Thu Jan 17 16:20:55 +0000 2019,Only a few days to go now till the #PGAwards! https://t.co/JQiVduiwV7
1085688287250079700,Thu Jan 17 00:00:33 +0000 2019,YouTube will once again be the exclusive live-streaming partner for #Coachella, but for the first time they will al… https://t.co/tqvgSbUInG
1085664614434639900,Wed Jan 16 22:26:29 +0000 2019,RT @seewhatsnext: #GraceAndFrankie has been renewed for a sixth season! Season 5 premieres Friday https://t.co/XShXaCiD8P
1085664551130071000,Wed Jan 16 22:26:14 +0000 2019,RT @Janefonda: Season 5 Trailer! #GraceAndFrankie https://t.co/rvDMhDyT5f
1085664476173688800,Wed Jan 16 22:25:56 +0000 2019,New season starts on Friday! #GraceandFrankie #BeMoreGrace #BeMoreFrankie https://t.co/8yMtBtgWW8
1085658165604012000,Wed Jan 16 22:00:51 +0000 2019,Check out this list of 20 outstanding series in 2018 from @TheVerge. “They were all chosen for their originality, f… https://t.co/xcdIPchPqb
1085628136124022800,Wed Jan 16 20:01:32 +0000 2019,IBM Watson Marketing have released their 2019 Marketing Trends Report, highlighting trends in the industry. As IBM… https://t.co/kkM307ZBxp
1085599237457526800,Wed Jan 16 18:06:42 +0000 2019,RT @THR: Two competing docs about the disastrous Fyre Festival — one for Netflix, the other for Hulu — make an "irresistible, provocative p…
1085597912787234800,Wed Jan 16 18:01:26 +0000 2019,Hear from industry experts in DMN's 'Under the Tree for 2019: AI Edition'. Our CEO, Ricky Ray Butler shares insight… https://t.co/wPYhcvq3IW
1085341008928346100,Wed Jan 16 01:00:35 +0000 2019,#Influencers were big news in 2018, but particularly within the beauty industry. @Fashionista_com take a look at th… https://t.co/kVjKXg0XVI
1085325892040249300,Wed Jan 16 00:00:31 +0000 2019,#Netflix are getting ready to adapt the John Green holiday novel #LetItSnow into a film. Green’s novels also includ… https://t.co/ehnYclRcbt
1085317432993038300,Tue Jan 15 23:26:54 +0000 2019,RT @Variety: Snap CFO Tim Stone to Leave Company https://t.co/fRK9bjrwXS
1085310927912779800,Tue Jan 15 23:01:03 +0000 2019,What will the key trends in #influencer marketing be in 2019? @Forbes take a look at which five they think will sha… https://t.co/bvtli7mSbl
1085115194135711700,Tue Jan 15 10:03:17 +0000 2019,The #PGAwards are this week and we could not be more excited! #PGAAwards https://t.co/LtCSDcIBWd
1084918270833147900,Mon Jan 14 21:00:47 +0000 2019,Hear from our CEO @RickyRayButler, on understanding China’s unique social platforms and how they operate and why th… https://t.co/5WnyCMOs2l
