id,created_at,text
1128395800235642900,Tue May 14 20:24:58 +0000 2019,RT @Adweek: Mixed-ish, originally set as a standalone episode of Black-ish, will join ABC's lineup this fall. https://t.co/5Ax4FvAJgg
1128389744864505900,Tue May 14 20:00:54 +0000 2019,With more content out there than ever before, deep learning #AI is essential to sort through the clutter, understan… https://t.co/oA5gRADSbf
1128314298474823700,Tue May 14 15:01:06 +0000 2019,AI is transforming businesses across industries – Soon it will be an integral part of every corporate strategy.… https://t.co/lv0SFu4X3L
1128046055910727700,Mon May 13 21:15:12 +0000 2019,RT @bristei: NBCUniversal won't launch its streaming-video service til mid 2020. But it wants ads for it today!  https://t.co/0QHjJsZ8yy
1128027352313794600,Mon May 13 20:00:53 +0000 2019,At the #NewFronts #Hulu announced several new approaches to advertising for the future. Their strategy centers arou… https://t.co/tvNGaJ5ANh
1127982232667398100,Mon May 13 17:01:35 +0000 2019,In Q1 Netflix added 9.6 million new subscribers. They will also begin to test Top 10 lists of the most popular cont… https://t.co/r4M1U4JAcm
1127712743891583000,Sun May 12 23:10:44 +0000 2019,RT @Variety: ‘Killing Eve’ Triumphs at BAFTA TV Awards https://t.co/RP7iTFK0Hq
1127664892515950600,Sun May 12 20:00:36 +0000 2019,#TaylorSwift’s music video “Me!” earned 65.2m views in its 1st day, making it YouTube’s most-viewed female &amp; solo 2… https://t.co/6SxPQDSUNv
1127649842313011200,Sun May 12 19:00:47 +0000 2019,Another big name is embracing YouTube. #JenniferLopez is increasing the amount of personal content she shares on he… https://t.co/wFRgwecgN8
1127634752687738900,Sun May 12 18:00:50 +0000 2019,Amid a reorganization ahead of the launch of its own video platform at WarnerMedia, AT&amp;T has sold its stake in… https://t.co/i7jJuad4Gn
1127619711699750900,Sun May 12 17:01:04 +0000 2019,If you’re celebrating #MothersDay and looking for a great movie with some amazing female actors, this list shares 3… https://t.co/A5BQS9VpFQ
1127408083154686000,Sun May 12 03:00:07 +0000 2019,Amazon #PrimeVideo have 4 new original series and 2 new original movies to look forward to this month, including th… https://t.co/I3u8KMF19R
1127377923776884700,Sun May 12 01:00:17 +0000 2019,There are more and more opportunities for brands to immerse themselves into the world of #esports through sponsorsh… https://t.co/vkFTY813km
1127347746057392100,Sat May 11 23:00:22 +0000 2019,According to these 2018 figures a quarter of 18-to-34-year-olds made a big purchase after seeing the item endorsed… https://t.co/XixFQyBBQS
1127317554236665900,Sat May 11 21:00:24 +0000 2019,Exciting news to come out of the 1st #Snapchat partner summit, with the launch of Snap Games, their new gaming plat… https://t.co/FnDIjtwPEX
1127251195595194400,Sat May 11 16:36:43 +0000 2019,Cannot wait for season 2! #BigLittLies https://t.co/kXfdmHBWAA
1127000479945371600,Sat May 11 00:00:27 +0000 2019,Did you know that the “UK leads all European nations with $7.2B invested in AI &amp; machine learning company acquisiti… https://t.co/ogYGXb7XJJ
1126970411571384300,Fri May 10 22:00:58 +0000 2019,We just had our most successful quarter ever with an 83% Q1 revenue increase over 2018 &amp; 99% over 2017! We've also… https://t.co/yso0zBlPeS
1126940233239597000,Fri May 10 20:01:03 +0000 2019,#YouTube are making some changes to their original programming with the announcement they have cancelled 4 of their… https://t.co/UHKc2IdCgX
1126904028582092800,Fri May 10 17:37:11 +0000 2019,RT @Adweek: Folks, @jasonlynch is back with another update: Three @shondarhimes-produced shows have been renewed and one has been canceled.…
1126623051276324900,Thu May 09 23:00:41 +0000 2019,In the business of streaming the likes of Apple and Disney are starting to reveal more details about their services… https://t.co/a4vMRNzcNS
1126607982886891500,Thu May 09 22:00:49 +0000 2019,“The ability to predict a customer’s needs, and get it right, is pure gold for marketers,” this is where #AI and de… https://t.co/lQLcqMRBoL
1126592911838273500,Thu May 09 21:00:55 +0000 2019,Brands are increasingly collaborating with #influencers. Fashion brand, TRULY, have launched their 1st co-created c… https://t.co/s28v8EAL95
1126577857042501600,Thu May 09 20:01:06 +0000 2019,At the NewFronts #Hulu’s head of ad platforms Jeremy Helfand told The Drum that Hulu’s viewer 1st strategy centers… https://t.co/KQ3pWJnOGo
1126260721996783600,Wed May 08 23:00:55 +0000 2019,#ArtificialIntelligence offers marketers the ability to filter content, track engagement, &amp; deliver ROI on their in… https://t.co/hdmY0tGyE8
1126245613157457900,Wed May 08 22:00:53 +0000 2019,What does AI have in store for marketers in 2019? @ClickZ take a closer look at the impact of AI on three specific… https://t.co/DSeLzD8y96
1126230503059873800,Wed May 08 21:00:50 +0000 2019,Fascinating data from @BoF on micro-influencers. In a recent survey, 64% of marketers said they would prefer to wor… https://t.co/lQawYylXI4
1125898246482747400,Tue May 07 23:00:34 +0000 2019,BEN’s SVP of Insights and Marketing, Aaron Frank, explains how historical and campaign data make our AI unique and… https://t.co/zwJiFhg2t3
1125883212591509500,Tue May 07 22:00:50 +0000 2019,Have you listened to #CreativeDisruption yet? It’s the podcast hosted by CEO Ricky Ray Butler and YouTube Certified… https://t.co/iAmgPclM2e
1125881423464992800,Tue May 07 21:53:43 +0000 2019,RT @Adweek: The Office, Friends and Grey’s Anatomy were Netflix’s most streamed shows last year: https://t.co/IsTP2JMmQl https://t.co/2TEd3…
1125868149281361900,Tue May 07 21:00:59 +0000 2019,During Q1 Netflix added 9.6 million new subscribers. They will also begin to test Top 10 lists of the most popular… https://t.co/0kIqUbGPW0
1125520802647093200,Mon May 06 22:00:45 +0000 2019,After the success of the #Beyonce documentary #Homecoming on Netflix it’s not surprising to hear they have apparent… https://t.co/rnVt4CHBdB
1125515145332101100,Mon May 06 21:38:16 +0000 2019,RT @producersguild: Less than 2 weeks before the next registration deadline. Discounts available to Industry and International partners and…
1125490581722017800,Mon May 06 20:00:39 +0000 2019,With more content out there than ever before, deep learning AI is essential to sort through the clutter, understand… https://t.co/u37qUgUBB1
1125430590151503900,Mon May 06 16:02:16 +0000 2019,Q1 of 2019 was significant for both #Twitch &amp; #YouTube Live as the services gained 2.7bn hours of content watched i… https://t.co/Lyup2uRPNB
1125188500842786800,Mon May 06 00:00:18 +0000 2019,Another big name is embracing YouTube. #JenniferLopez has announced she will be increasing the amount of personal c… https://t.co/jg53JZ4FCt
1125173402795434000,Sun May 05 23:00:18 +0000 2019,Did you know that the “UK leads all European nations with $7.2B invested in AI and machine learning company acquisi… https://t.co/9EPbVrpJb6
1125158312901795800,Sun May 05 22:00:20 +0000 2019,Brands are increasingly collaborating with #influencers. Fashion brand, TRULY, just launched their first co-created… https://t.co/aaLlEzQFhD
1125143236350304300,Sun May 05 21:00:26 +0000 2019,Amazon Prime Video have four new original series and two new original movies to look forward to this month, includi… https://t.co/kL5yPJOqg9
1125132483627036700,Sun May 05 20:17:42 +0000 2019,RT @Variety: #AvengersEndgame is now the no. 2 movie of all time. Can it beat 'Avatar'? https://t.co/uZ5K2frFqc https://t.co/KhzWrJ9WMf
1124841179005190100,Sun May 05 01:00:10 +0000 2019,In the business of streaming the likes of Apple and Disney are starting to reveal more details about their services… https://t.co/sOE90YJeHu
1124811016779587600,Sat May 04 23:00:19 +0000 2019,#YouTube are making some changes to their original programming with the announcement they have cancelled 4 more ori… https://t.co/IdfnRWTfdA
1124780851143827500,Sat May 04 21:00:26 +0000 2019,“The ability to predict a customer’s needs, and get it right, is pure gold for marketers,” this is where #AI and de… https://t.co/nauHolVmo8
1124750757071392800,Sat May 04 19:00:52 +0000 2019,#ArtificialIntelligence offers marketers the ability to filter content, track engagement, and deliver ROI on their… https://t.co/LNKAMdFJFX
1124463771907493900,Sat May 04 00:00:29 +0000 2019,SVP of Insights and Marketing, Aaron Frank, explains how historical and campaign data make BEN’s AI unique and acti… https://t.co/fz4L2IyfPZ
1124444398492835800,Fri May 03 22:43:30 +0000 2019,RT @Campaignmag: YouTube ditches paywall to make Originals content free https://t.co/1k4Z6xqQag https://t.co/b8N4LDo7E0
1124433618145820700,Fri May 03 22:00:40 +0000 2019,Amid a reorganization ahead of the launch of its own video platform at WarnerMedia, AT&amp;T has sold its stake in… https://t.co/jWFpIYXPNu
1124403497884094500,Fri May 03 20:00:58 +0000 2019,"Marketers are now using #AI to predict what will work best for their specific products, &amp; to more accurately measu… https://t.co/GHsSbsAYI1
1124358309434335200,Fri May 03 17:01:25 +0000 2019,What does AI have in store for marketers in 2019? @ClickZ take a closer look at the impact of AI on three specific… https://t.co/oUOabFStgb
1124197832263655400,Fri May 03 06:23:44 +0000 2019,RT @derraleves: Loved learning about @FBE  processes and systems! @MarcHustvedt and @rafifine  @RickyRayButler https://t.co/4C8KsEQxtB http…
1124101394414354400,Fri May 03 00:00:31 +0000 2019,According to Parrot Analytics’ 2018 Global Television Demand Report, #Netflix controls 71% of the global SVOD marke… https://t.co/J711C2NMle
1124086314977112000,Thu May 02 23:00:36 +0000 2019,The 1st quarter of 2019 was significant for both #Twitch &amp; #YouTube Live as the services gained 2.7bn hours of cont… https://t.co/efXcZCPmrz
1124071226383769600,Thu May 02 22:00:39 +0000 2019,The @HarvardBiz conducted research on ways that brands can work with #influencers. This included in-depth interview… https://t.co/t3DX6UsGfA
1124060114464452600,Thu May 02 21:16:29 +0000 2019,RT @THR: Marvel's #AvengersEndgame now sits as the sixth highest grossing movie, with $1.6 billion at the global box office, after eight da…
1124056142685122600,Thu May 02 21:00:43 +0000 2019,There are growing opportunities for brands to immerse themselves into the world of #esports through sponsorship and… https://t.co/EyYfvz3Bzd
1123883934155194400,Thu May 02 09:36:25 +0000 2019,RT @elliott_112: Alex from @Grubhub is sharing some great insights around the metrics of #growthmarketing. @GrowCo  Thanks for so many wond…
1123799305951879200,Thu May 02 04:00:08 +0000 2019,Interesting announcements from the #Netflix Q1 earnings release. During the quarter, the company added 9.6 million… https://t.co/F51Bv8MqTU
1123739004225167400,Thu May 02 00:00:31 +0000 2019,Since the launch of #FacebookWatch in 2017, it’s amassed 400 million monthly &amp; 75 million daily viewers globally! T… https://t.co/9axsbJYgxj
1123707915448324100,Wed May 01 21:56:59 +0000 2019,RT @producersguild: Two entertainment industry legends. Real stories from the acting, directing and producing trenches. A session you'll no…
1123678763387097100,Wed May 01 20:01:08 +0000 2019,If you’re attending at @Cannes_Lions  this year, mark your calendars for June 21st - It's going to be an exciting s… https://t.co/kinOPNrq8T
1123610558400532500,Wed May 01 15:30:07 +0000 2019,With more content out there than ever before, deep learning AI is essential to sort through the clutter, understand… https://t.co/TTtXqBnklH
1123362190654832600,Tue Apr 30 23:03:11 +0000 2019,RT @netflix: .@QueerEye's Fab Five worked their magic on a rescued puppy trying to find her forever home in honor of National Adopt a Shelt…
1123361527812243500,Tue Apr 30 23:00:33 +0000 2019,After the success of the Beyonce documentary Homecoming on Netflix it’s not surprising to hear they have apparently… https://t.co/a9GXlppIfP
1123316349487452200,Tue Apr 30 20:01:02 +0000 2019,Fascinating data from @BoF relating to micro-influencers. In a survey, 64% of marketers said they would prefer to w… https://t.co/8QtODfQ3kj
1123256113900806100,Tue Apr 30 16:01:41 +0000 2019,We’re excited to announce that #CreativeDisruption, a podcast hosted by CEO Ricky Ray Butler and YouTube Certified… https://t.co/IstrPM27Do
1122999109084905500,Mon Apr 29 23:00:26 +0000 2019,BEN’s EVP of Global Client Services, Erin Schmidt, tells us about deep learning #AI and how it is helping brands se… https://t.co/mMCOfTq5O4
1122984087176843300,Mon Apr 29 22:00:45 +0000 2019,Exciting news to come out of the 1st #Snapchat partner summit, with the launch of Snap Games, their new gaming plat… https://t.co/ywQTqQyImm
1122968979595829200,Mon Apr 29 21:00:43 +0000 2019,We just had our most successful quarter ever with an 83% Q1 revenue increase over 2018 &amp; 99% over 2017! We've also… https://t.co/DgtIdrp3mn
1122958751001186300,Mon Apr 29 20:20:04 +0000 2019,RT @Variety: Octavia Spencer Forms Production Company, Signs Deal With 20th Fox TV https://t.co/5cF7g0VrKg
1122681948248379400,Mon Apr 29 02:00:09 +0000 2019,A look at the #AdWeekEurope session on influencers from @CampaignMag. Key takeaways were; #influencers can be used… https://t.co/MkTbsMp1HH
1122666868765073400,Mon Apr 29 01:00:14 +0000 2019,The global #AI market was worth $7.35 billion in 2018 &amp; is expected to soar to $89.84 billion by 2025! AI offers co… https://t.co/6PABjNmRw4
1122651776669319200,Mon Apr 29 00:00:16 +0000 2019,Adweek spoke to the industry’s top thought leaders &amp; @Adweek Elevate speakers, including our CEO Ricky Ray Butler,… https://t.co/2c7ocHwNJO
1122636692693966800,Sun Apr 28 23:00:19 +0000 2019,#YouTube are making some changes to their original programming, with the announcement they have cancelled 4 more or… https://t.co/1e05cGrj4w
1122611228994613200,Sun Apr 28 21:19:08 +0000 2019,RT @adage: Amazon spent $1.7 billion on video and music in Q1 https://t.co/NnClQjMRzD https://t.co/aTrPW5wn9q
1122273232235712500,Sat Apr 27 22:56:04 +0000 2019,RT @Variety: Netflix will be releasing “Rolling Thunder Revue: A Bob Dylan Story by Martin Scorsese” in June https://t.co/PrNUlqRgNn
1122245297575473200,Sat Apr 27 21:05:03 +0000 2019,According to Parrot Analytics’ 2018 Global Television Demand Report, #Netflix controls 71% of the global SVOD marke… https://t.co/4AjR2uLPGR
1122230201654624300,Sat Apr 27 20:05:04 +0000 2019,Who’s watched the Netflix Beyonce documentary? #Homecoming features footage of Beyoncé's 2018 Coachella performance… https://t.co/RSWLW8NqeU
1122214000140410900,Sat Apr 27 19:00:42 +0000 2019,#Netflix has announced its 1st series with new signing #RyanMurphy. #ThePolitician premiering on Sept 27th, starrin… https://t.co/xcCXjSJAut
1122198915875520500,Sat Apr 27 18:00:45 +0000 2019,Amid a reorganization ahead of the launch of its own video platform at WarnerMedia, AT&amp;T has sold its stake in Hulu… https://t.co/9SAy4ZqGgo
1121957196294709200,Sat Apr 27 02:00:15 +0000 2019,Another big name is embracing #YouTube. #JenniferLopez has announced she’ll be increasing the amount of personal co… https://t.co/SjGtTIpqdG
1121927061021626400,Sat Apr 27 00:00:30 +0000 2019,We're thrilled to share that we will be speaking at @Cannes_Lions! Mark your calendars for June 21st - It's going t… https://t.co/BfuRp4riDP
1121896904563015700,Fri Apr 26 22:00:40 +0000 2019,NBC’s “Tonight Show” shot an episode using a Samsung Galaxy smartphone! NBCUniversal anticipates an increasing dema… https://t.co/2TJKHkRrSm
1121866790764798000,Fri Apr 26 20:01:00 +0000 2019,Did you know that the “UK leads all European nations with $7.2B invested in AI and machine learning company acquisi… https://t.co/0oHAPvm1D3
1121662387273158700,Fri Apr 26 06:28:47 +0000 2019,RT @derraleves: Do you love #KarateKid and #CobraKai? @RickyRayButler and I were able to talk to one of the producers Caleeb Pinkett. We al…
1121549785125793800,Thu Apr 25 23:01:20 +0000 2019,BEN’s EVP of Global Client Services, Erin Schmidt, tells us how deep learning #AI is helping brands select and inve… https://t.co/2Se5OCgnQ9
1121539370467647500,Thu Apr 25 22:19:57 +0000 2019,RT @RickyRayButler: Honored to be included on this list. https://t.co/BxDedRaw0X
1121534540571344900,Thu Apr 25 22:00:46 +0000 2019,Fascinating data from @BoF about micro-influencers. In a recent survey, 64% of marketers said they would prefer to… https://t.co/IINplG1C8w
1121520712953389000,Thu Apr 25 21:05:49 +0000 2019,Large crowd for Amy Pascal &amp; @DeVonFranklin! Powerful session about the journey of mentorship and pursuing your pas… https://t.co/f8QLTmcKbA
1121519438854074400,Thu Apr 25 21:00:45 +0000 2019,More brands are collaborating with #influencers rather than just having them promote a product. Fashion brand TRULY… https://t.co/LNZTZAkRm9
1121504410058805200,Thu Apr 25 20:01:02 +0000 2019,Since the launch of #FacebookWatch in 2017, it’s amassed 400 million monthly and 75 million daily viewers globally!… https://t.co/NuUK3MoUlA
1121483705782943700,Thu Apr 25 18:38:46 +0000 2019,Learning about building your “toolbox” for confidence and success! #BECon2019 @TheWrapWomen @TheWrap #BENincludes… https://t.co/5VUg0yf6d2
1121482725569908700,Thu Apr 25 18:34:52 +0000 2019,RT @TheWrapWomen: “You should walk around being your own number one fan.” — @JessMarieGarcia at #BECon2019 ✨ #WrapWomen
1121482381033005000,Thu Apr 25 18:33:30 +0000 2019,The BEN Includes team is a proud sponsor of the #BECon2019! WrapWomen aims to leverage the power of media and enter… https://t.co/tJJNtLvtuR
1121217353025454100,Thu Apr 25 01:00:22 +0000 2019,“The ability to predict a customer’s needs, and get it right, is pure gold for marketers,” and this is where #AI an… https://t.co/AhMMJEo9bB
1121202252222533600,Thu Apr 25 00:00:22 +0000 2019,Alex McFadyen, SVP of Technology, discusses structured and unstructured data in BEN's AI work.… https://t.co/T2RUSQMS2U
1121187232138891300,Wed Apr 24 23:00:41 +0000 2019,There are growing opportunities for brands to immerse themselves into the world of #esports through sponsorship and… https://t.co/vnnc3s4Vjy
1121180516999417900,Wed Apr 24 22:34:00 +0000 2019,RT @THR: Watch Meryl Streep confront @ReeseW in the first look at #BigLittleLies season 2 https://t.co/pVg7b8cjAd https://t.co/gPMi9KFSK7
1121081676589826000,Wed Apr 24 16:01:15 +0000 2019,Artificial Intelligence offers marketers the ability to filter, track, and deliver ROI on their influencer campaign… https://t.co/lDfLPfS9Wq
1120839910804607000,Wed Apr 24 00:00:33 +0000 2019,Facebook’s #RedTableTalk hosted by #JadaPinkettSmith was just nominated for a 2019 Daytime Emmy. The show which has… https://t.co/qrPIJvyi5s
1120809747349934100,Tue Apr 23 22:00:42 +0000 2019,Announcing our most successful quarter ever, a 83% Q1 revenue increase over 2018 &amp; 99% over 2017! We've also made i… https://t.co/Zf1dTRRZkw
1120779618741571600,Tue Apr 23 20:00:58 +0000 2019,Exciting news to come out of the 1st ever #Snapchat partner summit, with the launch of Snap Games, their new gaming… https://t.co/pcIsNrRSds
1120732703626801200,Tue Apr 23 16:54:33 +0000 2019,RT @adage: 50 percent of the viewing is live demand, and we’re finding that people have no problem shifting between the two. @prnaylor @hul…
1120462421708156900,Mon Apr 22 23:00:33 +0000 2019,The @HarvardBiz conducted research on how brands can work with #influencers. This included in-depth interviews with… https://t.co/HxPotuppb9
1120432262871437300,Mon Apr 22 21:00:42 +0000 2019,"Marketers are now using #AI to predict what will work best for their specific products, and to more accurately mea… https://t.co/PeYqGc7fnp
1120426414589792300,Mon Apr 22 20:37:28 +0000 2019,RT @Variety: ‘Fortnite’ Teases Upcoming ‘Avengers’ Tie-In Event https://t.co/qQMXLGb4RP
1120402191464976400,Mon Apr 22 19:01:13 +0000 2019,What have you been watching in April (apart from #GameofThrones)? Netflix have released original movies ‘Someone Gr… https://t.co/fTOgJViYSj
1120372014521442300,Mon Apr 22 17:01:18 +0000 2019,Some interesting announcements from the #Netflix Q1 earnings. During the quarter, the company added 9.6m new subscr… https://t.co/yz6DEBMICZ
1120074876172341200,Sun Apr 21 21:20:35 +0000 2019,RT @adage: What the end of 'Game of Thrones' means for OTT https://t.co/vzzP9xfNow https://t.co/Y0ts2fiMWM
1120039660053585900,Sun Apr 21 19:00:38 +0000 2019,Another big name is embracing #YouTube. Jennifer Lopez has announced she’ll be increasing the amount of personal co… https://t.co/WNK2lNUky8
1120024600732217300,Sun Apr 21 18:00:48 +0000 2019,According to Parrot Analytics’ 2018 Global Television Demand Report, #Netflix controls 71% of the global SVOD marke… https://t.co/A5T1BR8V26
1120009530988007400,Sun Apr 21 17:00:55 +0000 2019,Last year UK TV ad revenue was £5.11bn! “TV is a trusted high-quality environment for brands, and we are seeing sig… https://t.co/8MR7huG7pT
1119994551966556200,Sun Apr 21 16:01:24 +0000 2019,Happy Easter! If you’re looking for a movie to stream today, there are some great suggestions on this list of the ‘… https://t.co/yKfTFBnQaq
1119752694380539900,Sun Apr 21 00:00:20 +0000 2019,Since Facebook Watch launched in 2017, it’s amassed 400 million monthly and 75 million daily viewers globally! The… https://t.co/9YHaPvcqsX
1119722512571621400,Sat Apr 20 22:00:25 +0000 2019,Adweek spoke to the industry’s top thought leaders &amp; @Adweek Elevate speakers, including CEO Ricky Ray Butler, abou… https://t.co/YjZxDtNOvp
1119692366980501500,Sat Apr 20 20:00:37 +0000 2019,Netflix are releasing more interactive content after the success of #BlackMirror: Bandersnatch. Their first is an i… https://t.co/rev1l1Rk2C
1119676370685186000,Sat Apr 20 18:57:04 +0000 2019,RT @Variety: Beyonce’s Netflix deal is worth a staggering $60 Million (EXCLUSIVE) https://t.co/v4KKebaCX7
1119662228645580800,Sat Apr 20 18:00:52 +0000 2019,More brands are collaborating with #influencers rather than having them promote a product. Fashion brand #TRULY jus… https://t.co/EIGinq6IwI
1119375274083328000,Fri Apr 19 23:00:36 +0000 2019,The global #AI market was worth $7.35 billion in 2018 &amp; is expected to soar to $89.84 billion by 2025! AI offers co… https://t.co/C2Igbxp643
1119345116962021400,Fri Apr 19 21:00:46 +0000 2019,“The ability to predict a customer’s needs, and get it right, is pure gold for marketers,” and this is where AI and… https://t.co/LzXGDozl3F
1119330075843936300,Fri Apr 19 20:01:00 +0000 2019,Did you know up to December 2018, 51% of the content on #Netflix were originals? With new streaming platforms from… https://t.co/nc7CSb0Jje
1119269583666462700,Fri Apr 19 16:00:38 +0000 2019,Alex McFadyen, SVP of Technology, discusses structured and unstructured data in BEN's #AI work. #WeAreBEN… https://t.co/Yod9NaHU6Y
1119027988186767400,Fri Apr 19 00:00:37 +0000 2019,#TBT to BEN CEO Ricky Ray Butler speaking at @Adweek Elevate: AI, explaining how brands can transform AI hype into… https://t.co/Rn8ZSfBDSS
1119012901333946400,Thu Apr 18 23:00:40 +0000 2019,There are growing opportunities for brands to immerse themselves in the world of #esports through sponsorship &amp; int… https://t.co/TQ2wnqgUoS
1119005196590485500,Thu Apr 18 22:30:03 +0000 2019,RT @Variety: Netflix to Open Production Hub in New York City Encompassing 100,000 Square Feet https://t.co/6W0Gs60SPR
1118997845045071900,Thu Apr 18 22:00:50 +0000 2019,#Netflix has announced its 1st series with new signing #RyanMurphy. #ThePolitician premiering on Sept 27th, will st… https://t.co/xl2POO7yyc
1118991077849960400,Thu Apr 18 21:33:57 +0000 2019,RT @derraleves: Geeking out over #YouTubeAlgorithms, #Ai, #MachineLearning and clickbait with my friends @MatPatGT @CordyPatrick and @Ricky…
1118990855556087800,Thu Apr 18 21:33:04 +0000 2019,RT @CordyPatrick: Thanks for  having us, @derraleves!  The most shocking thing about this podcast was the fact that we managed to stay on t…
1118990706394030100,Thu Apr 18 21:32:28 +0000 2019,We’re excited to announce that Creative Disruption, a podcast hosted by CEO @RickyRayButler and YouTube Certified E… https://t.co/9GDeRqcLi2
