id,created_at,text
1259980322445209600,Mon May 11 22:54:52 +0000 2020,How was Lizzo holding a bag of Cheetos in a music video viewed by more than 19 million people on YouTube? Learn how… https://t.co/btevQUu1ej
1259977869507338200,Mon May 11 22:45:08 +0000 2020,Our new report on the streaming industry shows who's on top and how to get your brand inside the content your audie… https://t.co/NbbR4xKsto
1259974174904213500,Mon May 11 22:30:27 +0000 2020,AI helps navigate the massive array of content and influencers to choose the moments and people to connect your bra… https://t.co/3OUhXDJiiY
1259871521662779400,Mon May 11 15:42:32 +0000 2020,When times get tough, your marketing spend needs to get tougher. Here's how to make the most of your marketing budg… https://t.co/6VxAUKjmf6
1259582744419602400,Sun May 10 20:35:02 +0000 2020,As Twitch engagement surges, the platform launches a new esports directory to vastly enhance the user experience. R… https://t.co/RYwSbH9uTg
1259170034569617400,Sat May 09 17:15:05 +0000 2020,Have you watched Quibi yet? However and wherever you decide to get your Quibi on, here’s our list of the best shows: https://t.co/ViBotpbVXc
1258791305611817000,Fri May 08 16:10:09 +0000 2020,How can AI enrich the humanity of the customer experience? Here's why adopting AI expands the human potential: https://t.co/Tzkxr6GBEg
1258548434342011000,Fri May 08 00:05:04 +0000 2020,What if you could predict the top shows your audience will be watching and then put your brand inside the content t… https://t.co/grZuByCf1T
1258492029954392000,Thu May 07 20:20:56 +0000 2020,Here are our picks for best documentaries to watch right now so you can learn and get inspired while being entertai… https://t.co/wKnz99PorK
1258418937013981200,Thu May 07 15:30:29 +0000 2020,Get to know Video AI, the technology that's informing and reshaping the entertainment industry and influencer marke… https://t.co/efFvLSagAR
1258169013286441000,Wed May 06 22:57:23 +0000 2020,"Content creators should be creating more now than ever before, even if they are making less money. The creators th… https://t.co/bgDimu50YC
1258082680304001000,Wed May 06 17:14:19 +0000 2020,It's a great time to integrate your brand into influencer content, with booming platform TikTok recently surpassing… https://t.co/TUSmTvMwLa
1257327916070908000,Mon May 04 15:15:09 +0000 2020,There's so much streaming content out there, it's hard to choose where to place your brand for the best results. No… https://t.co/hq1iZXHai5
1256335139799359500,Fri May 01 21:30:13 +0000 2020,It's easier than ever to break through the noise and reach your audience where they're watching—streaming TV shows.… https://t.co/bC0Ka0ki0e
1255609714152558600,Wed Apr 29 21:27:38 +0000 2020,With an upcoming TV-casting feature (finally!) and star-studded cast of quality shows, Quibi has lots to offer. Her… https://t.co/mRKQtKx8dl
1255240450295902200,Tue Apr 28 21:00:19 +0000 2020,Video AI is changing the way content is processed and created. Get to know the technology and its impact on the ind… https://t.co/iEJEcO11iB
1255231582224494600,Tue Apr 28 20:25:04 +0000 2020,It's great that our AI predicts success on streaming and broadcast TV with extreme accuracy, but what's even better… https://t.co/wcrPCV8tIi
1255169131055210500,Tue Apr 28 16:16:55 +0000 2020,Here are 3 ways to help creators deliver the content audiences need in the strange new world of entertainment:… https://t.co/OZc6eEE24a
1254583574919106600,Mon Apr 27 01:30:07 +0000 2020,Baby Einstein wanted to maximize awareness around their brand positioning, a belief in curiosity. BEN designed a st… https://t.co/0S9hbBVaJA
1254193483780436000,Sat Apr 25 23:40:02 +0000 2020,Unable to tour, artists have created a surge of music live streams to connect with fans. We’ve curated a list of th… https://t.co/8GuOAYZCnz
1254148189629943800,Sat Apr 25 20:40:04 +0000 2020,Marketers are seeking new solutions. "A lot of brands are going to learn that being inside the content needs to be… https://t.co/T84n6zyhE5
1254117990406160400,Sat Apr 25 18:40:03 +0000 2020,Who will win the streaming wars? AI will be essential for predicting the next big hits—and the best opportunities f… https://t.co/Ni8l44Ouig
1254072690438295600,Sat Apr 25 15:40:03 +0000 2020,As more players enter the streaming game, we looked at the current state of affairs and pulled insights that matter… https://t.co/I5EbQUCvLq
1253831100000022500,Fri Apr 24 23:40:03 +0000 2020,How can you get your brand in front of the people you care about most? Streaming TV. We let the data speak for itse… https://t.co/AhbYP03r56
1253800896556826600,Fri Apr 24 21:40:02 +0000 2020,Telltale Games wanted to create a campaign to promote the episodic release of Minecraft: Story Mode. BEN worked wit… https://t.co/o4WkqXkBCJ
1253770702207017000,Fri Apr 24 19:40:03 +0000 2020,Our guide on what to watch with your kids (of every age) right now—because sometimes you just need to hit play and… https://t.co/LdU4qTW7oJ
1253730762110746600,Fri Apr 24 17:01:21 +0000 2020,What is the difference between IGTV and Instagram stories? @RickyRayButler, @derraleves and @EveryVowel discuss in… https://t.co/zxZqYOtsdE
1253483814304743400,Fri Apr 24 00:40:04 +0000 2020,Goldenvoice turned to BEN for one-stop music solutions and licensing for the YouTube Original "Coachella: 20 Years… https://t.co/zHvhQVnDIC
1253447322656260000,Thu Apr 23 22:15:04 +0000 2020,In the current climate, brands are leaning heavy into influencer partnerships to reach their audiences. Read more h… https://t.co/Uu4Vv0RKQ7
1253423413873406000,Thu Apr 23 20:40:04 +0000 2020,We're continuing to bring in the best talent to supercharge our work with digital creators and provide unmatched re… https://t.co/IJqeXnXDtf
1253356743830253600,Thu Apr 23 16:15:08 +0000 2020,With an eye toward empathy, companies should consider all the ways they can continue to move forward:… https://t.co/JKOTr8eOk3
1253115135058686000,Thu Apr 23 00:15:04 +0000 2020,As streaming services grow in dominance, take a look at who's leading the pack—and how to reach these engaged audie… https://t.co/IWK01DlEWL
1253069837699596300,Wed Apr 22 21:15:04 +0000 2020,With everyone staying home, streaming platforms are more popular than ever. New arrival Disney+ entered the space w… https://t.co/rBZuSijva0
1253064286110453800,Wed Apr 22 20:53:01 +0000 2020,Exciting news! BEN has been named a @TheDrum Marketing Awards finalist for Marketing Agency of the Year! Read more:… https://t.co/vgQFDTy58g
1252980505500409900,Wed Apr 22 15:20:06 +0000 2020,We've trained our AI to not only accurately predict the top shows in streaming, but to use that data to help market… https://t.co/72Ld4TxIl6
1252741456185393200,Tue Apr 21 23:30:12 +0000 2020,Our AI predicted 10/10 of the top overall broadcast TV shows and 4/5 of the top streaming shows in 2019. These pred… https://t.co/TUZrbSuysA
1252696169043701800,Tue Apr 21 20:30:15 +0000 2020,Take a look at the campaign we developed for Proximo. We used a variety of platforms to promote different brands in… https://t.co/fLuxJcHPtM
1252653513806688300,Tue Apr 21 17:40:45 +0000 2020,We're passionate about employee satisfaction, and great family leave policies mean happier employees. Thrilled to h… https://t.co/FaSoJzyuel
1252650892870013000,Tue Apr 21 17:30:20 +0000 2020,Running out of inspiration for what to watch while you’re at home? These are our recommendations of the best in TV,… https://t.co/UEtTrAVIVD
1252371633571946500,Mon Apr 20 23:00:40 +0000 2020,With millions of videos on YouTube, copyright can be a tricky area. @RickyRayButler, @derraleves, and Devin Stone f… https://t.co/GcFhzSsv7b
1252352433289695200,Mon Apr 20 21:44:22 +0000 2020,From binge-worthy classics to stand-up specials and more, here's our guide on the most laughable content to watch r… https://t.co/53daEWRSUM
1252274490643366000,Mon Apr 20 16:34:39 +0000 2020,RT @Adweek: We're looking forward to hearing from @RickyRayButler, @lgranatstein, Janna Ritzcovan Synovec, Anya Ware and Danny Wright.  And…
1252274472322646000,Mon Apr 20 16:34:34 +0000 2020,RT @Adweek: Join us TODAY at 3pm ET for our live virtual event, #ElevateAI, with two actionable live presentations, each followed by an int…
1252266318604177400,Mon Apr 20 16:02:10 +0000 2020,Today we join @Adweek #ElevateAI as they go virtual. Our CEO @RickyRayButler will speak on ‘Entertainment in the Ag… https://t.co/obr1di0CIN
1252001555429064700,Sun Apr 19 22:30:06 +0000 2020,Wondering what to watch? Here are the very best of the best in TV, film, and music worth streaming during your time… https://t.co/xOqSBGoGo3
1251941198903890000,Sun Apr 19 18:30:16 +0000 2020,With millions of people affected by the cancelation of in-person sporting events, there are now record-breaking num… https://t.co/1UTbkom21Z
1251665586322657300,Sun Apr 19 00:15:05 +0000 2020,Three ways brands are leveraging #AI to change the sales and marketing experience: https://t.co/PSGNeaePBk
1251620288330162200,Sat Apr 18 21:15:05 +0000 2020,As more players enter the streaming game, we looked at the current state of affairs and pulled insights that matter… https://t.co/vLjeIEVMbc
1251559892005068800,Sat Apr 18 17:15:05 +0000 2020,The world is in need of a pick-me-up. Here are the subscribe-worthy channels and videos to watch as you turn to soc… https://t.co/l8bdD8Gvgn
1251291887237042200,Fri Apr 17 23:30:08 +0000 2020,Unable to tour, artists have created a surge of music livestreams to connect with fans. We’ve curated a list of the… https://t.co/WWCBRr3x3r
1251246600111915000,Fri Apr 17 20:30:11 +0000 2020,Is #influencermarketing moving away from celebrities? With more brands choosing to work with micro-influencers inst… https://t.co/WoarMHOj5M
1251211865494937600,Fri Apr 17 18:12:09 +0000 2020,Artists are more interested than ever in partnering with brands to create meaningful, feel-good content and to prov… https://t.co/eyaqd96yVJ
1251203733377163300,Fri Apr 17 17:39:50 +0000 2020,With millions of videos on YouTube, copyright can be a tricky area. @RickyRayButler, @derraleves, and Devin Stone f… https://t.co/WC7redG8ou
1250955902116642800,Fri Apr 17 01:15:03 +0000 2020,Frito-Lay wanted to reach young consumers through one of their biggest passion points. BEN integrated the brand's p… https://t.co/GrnrBqH8gQ
1250895512921944000,Thu Apr 16 21:15:05 +0000 2020,Our guide on what to watch with your kids (of every age) right now—because sometimes you just need to hit play and… https://t.co/jQIhLnKdUs
1250852731629310000,Thu Apr 16 18:25:05 +0000 2020,How can you get your brand in front of the people you care about most? Streaming TV. We let the data speak for itse… https://t.co/jju6Nwag7B
1250533118060236800,Wed Apr 15 21:15:03 +0000 2020,Running out of inspiration for what to watch while you’re at home? These are our recommendations of the best in TV,… https://t.co/3XKNQFTzRg
1250501325596450800,Wed Apr 15 19:08:43 +0000 2020,RT @MarTechSeries: BEN Announces Expansion of AI and Influencer Teams and Improved Capabilities https://t.co/yp9RDnEOGc @BrandEntNet #Marte…
1250501253471203300,Wed Apr 15 19:08:26 +0000 2020,RT @thejohncarle: Tune in to see me chat esports representing @BrandEntNet  with @brandstorytv alongside @KamBrothers &amp; @ConnectedRealm - h…
1250472736411041800,Wed Apr 15 17:15:07 +0000 2020,Telltale Games wanted to create a campaign to promote the episodic release of Minecraft: Story Mode. BEN worked wit… https://t.co/zcpDLjnYAJ
1250467822674772000,Wed Apr 15 16:55:36 +0000 2020,We're continuing to bring in the best talent to supercharge our work with digital creators and provide unmatched re… https://t.co/8YSR22Jib5
1250457010874781700,Wed Apr 15 16:12:38 +0000 2020,Adweek's #ElevateAI is now virtual. Join us Mon. April 20 at 12pm PT as CEO @RickyRayButler details the growing rol… https://t.co/2NWJbBMtF2
1250210992467906600,Tue Apr 14 23:55:03 +0000 2020,Baby Einstein wanted to maximize awareness around their brand positioning, a belief in curiosity. BEN designed a st… https://t.co/LGHed1YlbE
1250185530882441200,Tue Apr 14 22:13:52 +0000 2020,Lunch plans tomorrow? Catch @thejohncarle, BEN’s VP of Strategy &amp; Business Development, on @brandstorytv's Live Str… https://t.co/eWKoh5uGFM
1250184487809343500,Tue Apr 14 22:09:43 +0000 2020,RT @tubefilter: Branded Content Agency @BrandEntNet Appoints 2 Influencer-Focused Execs Amid Hiring Spree https://t.co/n5ibm8uFoR
1250165704768344000,Tue Apr 14 20:55:05 +0000 2020,Marketers are seeking new solutions. "A lot of brands are going to learn that being inside the content needs to be… https://t.co/5IFZvmtfDG
1250150352965505000,Tue Apr 14 19:54:05 +0000 2020,BEN achieved a record number of client bookings and integrations across influencer platforms and brought in new tal… https://t.co/J9juH5oK6y
1250092732447670300,Tue Apr 14 16:05:07 +0000 2020,Our AI predicted 10/10 of the top overall broadcast TV shows and 4/5 of the top streaming shows in 2019. These pred… https://t.co/a5ZmXTX122
1249819837980950500,Mon Apr 13 22:00:44 +0000 2020,With everyone at home, streaming platforms are more popular than ever. New arrival Disney+ entered the space with s… https://t.co/GiFOf9o9WE
1249804834951364600,Mon Apr 13 21:01:07 +0000 2020,As streaming services grow in dominance, take a look at who's leading the pack—and how to reach these engaged audie… https://t.co/fLuQnnTtQn
1249652318548738000,Mon Apr 13 10:55:04 +0000 2020,How Instagram won the battle with Snapchat by catering to the content creator with a simple swipe. @RickyRayButler,… https://t.co/Bxf29c2Xr4
1249462311405981700,Sun Apr 12 22:20:03 +0000 2020,With the growth of #esports and the opportunities the industry presents to brands and advertisers, take an in-depth… https://t.co/FzioUDoQZ4
1249386814294634500,Sun Apr 12 17:20:03 +0000 2020,We’re thrilled to rank among Business Insider's top #influencermarketing companies. A big thanks for our clients wh… https://t.co/kvShVjwQKn
1249084821143519200,Sat Apr 11 21:20:02 +0000 2020,Frito-Lay wanted to reach young consumers through one of their biggest passion points. BEN integrated the brand's p… https://t.co/b1XRBbRq00
1249039522664534000,Sat Apr 11 18:20:02 +0000 2020,According to Nielsen analysis, video streaming increases 61% on average when consumers are forced to stay indoors d… https://t.co/msLBeyPuam
1248752637178187800,Fri Apr 10 23:20:04 +0000 2020,Three ways brands are leveraging #AI to change the sales and marketing experience: https://t.co/PSGNeaePBk — via @Inc
1248717791592689700,Fri Apr 10 21:01:36 +0000 2020,Goldenvoice turned to BEN for one-stop music solutions and licensing for the YouTube Original "Coachella: 20 Years… https://t.co/AR1Nd1YbLj
1248651342320742400,Fri Apr 10 16:37:33 +0000 2020,How Instagram won the battle with Snapchat by catering to the content creator with a simple swipe. @RickyRayButler,… https://t.co/HxMXlqaR4g
1248363819589685200,Thu Apr 09 21:35:02 +0000 2020,Baby Einstein wanted to maximize awareness around their brand positioning, a belief in curiosity. BEN designed a st… https://t.co/f37kdqSzV4
1248303431120564200,Thu Apr 09 17:35:04 +0000 2020,Is #influencermarketing moving away from celebrities? With more brands choosing to work with micro-influencers inst… https://t.co/fEioFORVDO
1247992860152037400,Wed Apr 08 21:00:59 +0000 2020,Creators are using their platforms to spread important information from the World Health Organization about hand hy… https://t.co/bYETNRTJv6
1247932525298757600,Wed Apr 08 17:01:14 +0000 2020,What to watch? Here are the best of the best in TV, film, and music worth #streaming during your time at home: https://t.co/RsYFqU0wZy
1247683097170186200,Wed Apr 08 00:30:05 +0000 2020,Unable to tour, artists have created a surge of music livestreams to connect with fans. Our music team has curated… https://t.co/ngw7CvXve4
1247626464717148200,Tue Apr 07 20:45:03 +0000 2020,The world is in need of a pick-me-up. Here are the subscribe-worthy channels and best videos to watch as you turn t… https://t.co/J9G3Af2sT4
1247303082544857000,Mon Apr 06 23:20:03 +0000 2020,With millions of people affected by the cancelation of in-person sporting events, there are now record-breaking num… https://t.co/qnHSYYFHxc
