id,created_at,text
1182000341849645000,Wed Oct 09 18:30:16 +0000 2019,Discussing the increasing impact of #AI on marketing strategy, @Forbes dive into the ways that marketers are not on… https://t.co/f1nbYxhBdv
1181945017990037500,Wed Oct 09 14:50:26 +0000 2019,Nancy Drew actress, @maddisonjaizani thinks streaming TV is both more diverse and more accessible to a broader audi… https://t.co/s5aNg4P4pU
1181737313782702000,Wed Oct 09 01:05:05 +0000 2019,#Facebook has announced updates to its video products. Amongst them will be an option to edit the beginning &amp; end o… https://t.co/9hZABaSzxD
1181707104710791200,Tue Oct 08 23:05:03 +0000 2019,Takeaways from the #Dmexco conference include the huge growth in #eSports; with predictions that the global eSports… https://t.co/C2PLNwDiOc
1181684415295934500,Tue Oct 08 21:34:53 +0000 2019,RT @LBBOnline: .@BrandEntNet releases 'The Future of Influencer Marketing' guide. https://t.co/fwthVgcuqs https://t.co/At2ZeQdwlO
1181662325281104000,Tue Oct 08 20:07:07 +0000 2019,RT @Variety: ‘All American’ Season 2 Scores Three Additional Episodes at CW https://t.co/MjjvjJdDsV
1181662059580276700,Tue Oct 08 20:06:03 +0000 2019,#MichaelEvansBehling, actor from #AllAmerican, thinks we can only expect more streaming services, as he talks about… https://t.co/d4OkV3AAgo
1181631950097768400,Tue Oct 08 18:06:25 +0000 2019,Rather than disrupting an experience, brands that get inside the content reach loyal, engaged viewers.  CEO… https://t.co/JGZbdkDNYB
1181384987892953000,Tue Oct 08 01:45:04 +0000 2019,Music is an integral part of any TV show, but how do music supervisors choose &amp; clear the perfect tracks?… https://t.co/xvpk4KGYQU
1181354785892647000,Mon Oct 07 23:45:04 +0000 2019,The #SundayTimes recently released their ‘Top 100 Influencers’ list, but @talkinginfluence thinks they’ve got it al… https://t.co/FNFdGBj5DY
1181315780706799600,Mon Oct 07 21:10:04 +0000 2019,Brands are changing how they work with #influencers #SeatGeek talk to @Digiday about the creative freedom they give… https://t.co/zsnzHmY9wD
1181249105655414800,Mon Oct 07 16:45:07 +0000 2019,"There’s been a steady uptick in client interest in streaming service integration over the last 6 years," said Erin… https://t.co/W3JTuAAeQH
1181051533435314200,Mon Oct 07 03:40:03 +0000 2019,NBCUniversal’s streaming service launches next year and as well as hosting a variety of classic TV shows they’re al… https://t.co/AXAQoMJ1Oj
1181006235677728800,Mon Oct 07 00:40:03 +0000 2019,ESPN has just reached a new deal with Facebook, to distribute exclusive digital shows on Facebook Watch. They’ll al… https://t.co/vNBC3YWGzC
1180960936976420900,Sun Oct 06 21:40:03 +0000 2019,#YouTube has launched a dedicated Fashion vertical, where they will be bringing all things fashion and beauty toget… https://t.co/MnPc5E8Oy1
1180915638375714800,Sun Oct 06 18:40:03 +0000 2019,Reality-based TV known as #varietyshows are popular in China. In 2018 advertiser spending on variety shows reported… https://t.co/AaQTNQdsTD
1180888194985926700,Sun Oct 06 16:51:00 +0000 2019,#KatherineMcNamara, actress from CW’s #Arrow, tells us how she uses social media to connect with her fans and why d… https://t.co/G58DSgWiLO
1180674042866610200,Sun Oct 06 02:40:02 +0000 2019,#TikTok continues to expand its reach with the news that they have entered into a multi-year partnership with the… https://t.co/BFdRggYHHc
1180613649049821200,Sat Oct 05 22:40:03 +0000 2019,An in-depth article from @Drapers delves into the multitude of ways that fashion brands are reaching their audience… https://t.co/V5P57LzlDV
1180583448215347200,Sat Oct 05 20:40:02 +0000 2019,What would be the one piece of advice an #influencer would give to brands about working with YouTube stars? Accordi… https://t.co/Sh6h3IOEXy
1180538149296050200,Sat Oct 05 17:40:02 +0000 2019,After the success of Black-ish &amp; Grown-ish another spin off has debuted on ABC; Mixed-ish. Co-creator Peter Saji sp… https://t.co/Yc8KnxyzXV
1180256449219436500,Fri Oct 04 23:00:40 +0000 2019,Facebook has announced updates to its video products. Amongst them will be an option to edit the beginning &amp; end of… https://t.co/WTfUAV6QVq
1180226309110325200,Fri Oct 04 21:00:54 +0000 2019,China Film Insider spoke with BEN’s CEO Ricky Ray Butler &amp; Nancy Lewis, Manager of Client Services and Strategic Pa… https://t.co/XanEzdyJPc
1180214193175220200,Fri Oct 04 20:12:45 +0000 2019,Brands and #influencers need to embrace transparency in the form of information sharing and the use of innovative t… https://t.co/ozuoTxgjV1
1180151150995267600,Fri Oct 04 16:02:15 +0000 2019,Discussing the increasing impact of AI on marketing strategy, @Forbes dive into the ways that marketers are not onl… https://t.co/znWFsfpqeM
1180144501719015400,Fri Oct 04 15:35:49 +0000 2019,Critics have deemed it the golden age of television. #BreZ from #AllAmerican says TV has to progress in order to ac… https://t.co/QpraEHODPB
1179931669299650600,Fri Oct 04 01:30:06 +0000 2019,Due to be rolling out soon, #YouTube will be making all Premium programming free, and to celebrate they have announ… https://t.co/RlJaonE3Nq
1179901481501253600,Thu Oct 03 23:30:09 +0000 2019,A recent survey report stated that the 3 most significant emerging trends in #marketing are personalization, AI, &amp;… https://t.co/USMtIV7y5z
1179871289202413600,Thu Oct 03 21:30:10 +0000 2019,Takeaways from the Dmexco conference include the huge growth in #eSports; with predictions that the global eSports… https://t.co/kqZ5NLJWGL
1179844152286224400,Thu Oct 03 19:42:21 +0000 2019,“Every once in a while things need to be tore down in order to be built up.”  In our continuing series… https://t.co/T1BvMV612J
1179828701199884300,Thu Oct 03 18:40:57 +0000 2019,Influencer marketing is breaking down borders with the latest Saudi Arabia Travel campaign but it also has its pros… https://t.co/y8ETDii4P6
1179810939589288000,Thu Oct 03 17:30:22 +0000 2019,#TBT to Last week’s #BIsummit, thanks for having us @Brand_Innovator! #AWNewYork https://t.co/g6UG98DKzT
1179531670116065300,Wed Oct 02 23:00:39 +0000 2019,#Target are making strides in the #influencermarketing space as 7 diverse influencers have taken to social media wi… https://t.co/ykfLBlnVeY
1179501515586887700,Wed Oct 02 21:00:50 +0000 2019,In examining how artificial intelligence will transform marketing in 2020 @MarTechAdvisor attempt to answer the que… https://t.co/koWN1CMOR8
1179456267884077000,Wed Oct 02 18:01:02 +0000 2019,Music is an integral part of any TV show, but how do the music supervisors choose the perfect tracks?… https://t.co/GZqGVlWeED
1179392732034453500,Wed Oct 02 13:48:34 +0000 2019,#AllAmerican actor, @MichaelEvansB05 thinks we can only expect more streaming services, as he talks about how his s… https://t.co/uFPUvAx1bF
1179370072822947800,Wed Oct 02 12:18:31 +0000 2019,On the latest episode of the #CreativeDisruption Podcast, Ricky Ray Butler &amp; Derral Eves chat with #WillandGrace pr… https://t.co/zVEFf634ss
1179176694978154500,Tue Oct 01 23:30:06 +0000 2019,#FacebookWatch are further expanding their slate of shows, with the news that they have signed video partnerships w… https://t.co/b231ci6P8S
1179131407723040800,Tue Oct 01 20:30:09 +0000 2019,Procter &amp; Gamble will be funding a new show on Nat Geog called #Activate a 6-part season focusing on extreme povert… https://t.co/yRzLP2CqWk
1179105483107393500,Tue Oct 01 18:47:08 +0000 2019,"There’s been a steady uptick in client interest in streaming service integration over the last 6 years," said Erin… https://t.co/Bvl7poNKUg
1179065960227049500,Tue Oct 01 16:10:05 +0000 2019,The Sunday Times recently released their ‘Top 100 Influencers’ list, but @talkinfluence thinks they’ve got it all w… https://t.co/SCtqoxL19T
1178477067530379300,Mon Sep 30 01:10:02 +0000 2019,Facebook has announced several new updates to it’s video products. There will soon be an option to edit the beginni… https://t.co/UXQzTvpK0z
1178446882739298300,Sun Sep 29 23:10:05 +0000 2019,#TikTok continues to expand its reach with the news that they have entered into a multi-year partnership with the… https://t.co/OlGeUxDdlt
1178416671180103700,Sun Sep 29 21:10:02 +0000 2019,Due to be rolling out soon, #YouTube will be making all Premium programming free, and to celebrate they have announ… https://t.co/3DGuQjfZyl
1178395389210312700,Sun Sep 29 19:45:28 +0000 2019,RT @MaiselTV: We almost did a spittake when we heard the news! Congratulations to The Marvelous #MrsMaisel cast and crew on winning 8 #Emmy…
1178356279431110700,Sun Sep 29 17:10:04 +0000 2019,Reality-based TV known as #varietyshows are popular in China. In 2018 advertiser spending on variety shows reported… https://t.co/XG8LbN2juU
1178129786557866000,Sun Sep 29 02:10:04 +0000 2019,A recent survey report stated that the 3 most significant emerging trends in #marketing are personalization, AI, an… https://t.co/CKFgPWxExa
1178099582640758800,Sun Sep 29 00:10:03 +0000 2019,#YouTube has launched a dedicated Fashion vertical, where they will be bringing all things fashion and beauty toget… https://t.co/nenWxx9j0J
1178069387389083600,Sat Sep 28 22:10:04 +0000 2019,What is the key to a successful #influencer campaign? @socialmedia2day look at what it means to involve influencers… https://t.co/rGYyolL1ol
1178020316385353700,Sat Sep 28 18:55:04 +0000 2019,Music is an integral part of any TV show but how do #musicsupervisors choose &amp; clear the perfect tracks?… https://t.co/ONP7CMTngI
1177708259093950500,Fri Sep 27 22:15:04 +0000 2019,Executive Producer Randall Winston (“Mixed-ish” &amp; "Grace &amp; Frankie") &amp; BEN's SVP of Global Content &amp; Integration, S… https://t.co/hyYbHeGs2K
1177678059547349000,Fri Sep 27 20:15:04 +0000 2019,Traditionally #brandambassadors have been athletes, actors and models, but with the rise of #esports, brands are ke… https://t.co/jfcpiQ95TG
1177671000500117500,Fri Sep 27 19:47:01 +0000 2019,RT @awbrandshare: How AI will change your approach to influencer marketing via @BrandEntNet   https://t.co/yPnOxfg4di https://t.co/MwTSaHrF…
1177668865142263800,Fri Sep 27 19:38:32 +0000 2019,“Every once in a while things need to be tore down in order to be built up.”  In our continuing series… https://t.co/MBcC4RmPfE
1177632766793568300,Fri Sep 27 17:15:05 +0000 2019,In examining how #artificialintelligence will transform marketing in 2020 @MarTechAdvisor attempt to answer the que… https://t.co/mpKajshAMq
1177389908740247600,Fri Sep 27 01:10:03 +0000 2019,Influencer spend is on the up, #EstéeLauder recently shared that 75% of their investments are now in digital social… https://t.co/SO9E294fel
1177344609502019600,Thu Sep 26 22:10:03 +0000 2019,Brands are changing how they work with influencers. SeatGeek talk to @Digiday about the creative freedom they give… https://t.co/8PRTUT02ey
1177314411415031800,Thu Sep 26 20:10:03 +0000 2019,An in-depth article from @Drapers delves into the many ways that fashion brands are reaching their audiences. From… https://t.co/Gqtg3QaG0q
1177189462322962400,Thu Sep 26 11:53:33 +0000 2019,On the latest episode of the #CreativeDisruption Podcast, Ricky Ray Butler &amp; Derral Eves chat with #WillandGrace pr… https://t.co/hVDbe90dq0
1177017465274024000,Thu Sep 26 00:30:06 +0000 2019,#FacebookWatch are further expanding their slate of shows with the news that they have signed video partnerships wi… https://t.co/qxfKfghwvT
1176987276234186800,Wed Sep 25 22:30:08 +0000 2019,What would be the one piece of advice an #influencer would give to brands about working with YouTube stars? Accordi… https://t.co/iNgiB4wVoo
1176957082018439200,Wed Sep 25 20:30:09 +0000 2019,As AI becomes more popular, the misconceptions about AI in marketing continue to grow. Check out the 3 most common… https://t.co/2Ev9EAX537
1176809494346707000,Wed Sep 25 10:43:42 +0000 2019,Critics have deemed it the golden age of television.  @BREZOFFICIAL from #AllAmerican says TV has to progress in or… https://t.co/EjzNCXFrID
1176689036427219000,Wed Sep 25 02:45:02 +0000 2019,China Film Insider spoke with BEN’s CEO Ricky Ray Butler &amp; Nancy Lewis, Manager of Client Services and Strategic Pa… https://t.co/yAeW8O08gd
1176658841955643400,Wed Sep 25 00:45:03 +0000 2019,#Target are making strides in the #influencer marketing space as 7 diverse influencers have taken to social media w… https://t.co/dnwI4I9LrG
1176628642765561900,Tue Sep 24 22:45:03 +0000 2019,It’s predicted that business spending on #AI will grow from $12 billion in 2017 to $57.6 billion by 2021! To add to… https://t.co/OSxUx5V1Qw
1176532685361221600,Tue Sep 24 16:23:45 +0000 2019,“Bots are now acting like humans. You have to use AI to battle the AI.” @RickyRayButler #BISummit #AWNewYork
1176532169306644500,Tue Sep 24 16:21:42 +0000 2019,RT @TheBriGuy83: #BISummit "Every brands need to worry about conversions" @BrandEntNet spitting hot fire at @Brand_Innovator
1176532058488889300,Tue Sep 24 16:21:16 +0000 2019,RT @getlibris: “You need to stop thinking about massive reach, you need to be thinking about loyal reach.” - Branded Entertainment Network…
1176530796892557300,Tue Sep 24 16:16:15 +0000 2019,“Stop thinking about massive reach and start thinking about loyal reach.” @RickyRayButler #BISummit #AWNewYork
1176530305794158600,Tue Sep 24 16:14:18 +0000 2019,“We’re seeing the tip of the iceberg...content is going to be more decentralized...it’s time to adapt the tactics.”… https://t.co/h4fu0dpTwL
1176524139160621000,Tue Sep 24 15:49:48 +0000 2019,We’re here at the #BISummit! Catch CEO @RickyRayButler up on stage in about 30 minutes. @Brand_Innovator https://t.co/veW57zPRy2
1176460605160599600,Tue Sep 24 11:37:20 +0000 2019,Today’s that day! BEN will be at Advertising Week New York. CEO @RickyRayButler will be speaking on "AI in an Ad-Fr… https://t.co/uaIMgafKGP
1176272549820469200,Mon Sep 23 23:10:04 +0000 2019,Procter &amp; Gamble will be funding a new show on Nat Geog called #Activate a six-part season focusing on extreme pove… https://t.co/SPSHAhTzdF
1176227259809763300,Mon Sep 23 20:10:06 +0000 2019,A new award at the #Emmys is ‘Outstanding Music Supervision’. Nominated for a 2nd time #musicsupervisor for ‘Better… https://t.co/LLNlmt1ppI
1176224530077016000,Mon Sep 23 19:59:15 +0000 2019,Hello #awnewyork! CEO @ Ricky Ray Butler will be speaking on "AI in an Ad-Free World" at 12pm tomorrow (Tuesday, Se… https://t.co/A92RCFBWt0
1176151018419175400,Mon Sep 23 15:07:09 +0000 2019,#KatherineMcNamara, actress from CW’s #Arrow, tells us how she uses social media to connect with her fans and why d… https://t.co/MHE33tWJvT
1175925255883362300,Mon Sep 23 00:10:03 +0000 2019,Due to be rolling out soon, #YouTube will be making all Premium programming free, and to celebrate they have announ… https://t.co/8rxKOQrLHh
1175895057318240300,Sun Sep 22 22:10:03 +0000 2019,A recent survey report stated that the 3 most significant emerging trends in marketing are personalization, AI, and… https://t.co/a835OCVWpN
1175849759795552300,Sun Sep 22 19:10:03 +0000 2019,#Snapchat are launching a 3rd generation of their snapchat spectacles. The new version will be limited edition and… https://t.co/3oNkiwaXpf
1175819562803171300,Sun Sep 22 17:10:04 +0000 2019,#FacebookWatch are further expanding their slate of shows with the news that they have signed video partnerships wi… https://t.co/8vNtdb2qxM
1175623268591710200,Sun Sep 22 04:10:03 +0000 2019,Brands are increasingly embracing #brandedmerchandise &amp; seeing the benefits. Artisan ice cream maker,… https://t.co/Qcskvxrg0X
1175593066994045000,Sun Sep 22 02:10:03 +0000 2019,BEN is leading the entertainment AI space with another record breaking half year and the announcement of opening an… https://t.co/SqM1UC6Yqw
1175539745394479000,Sat Sep 21 22:38:10 +0000 2019,RT @ranwins: We have a premiere date! #mixedish premieres Tuesday September 24 on ABC! https://t.co/1olenBlw83
1175539690293923800,Sat Sep 21 22:37:57 +0000 2019,RT @adage: Ad spend is increasing at a faster rate than previously forecast https://t.co/3VQNhCpQY1 https://t.co/C9yy3sBghr
1175532673349169200,Sat Sep 21 22:10:04 +0000 2019,What would be the one piece of advice an influencer would give to brands about working with YouTube stars? Accordin… https://t.co/7BsDomJEqo
1175472274054533000,Sat Sep 21 18:10:04 +0000 2019,Traditionally #brandambassadors have been athletes, actors and models, but with the rise of esports, brands are kee… https://t.co/9bjrdKP54V
1175185379936395300,Fri Sep 20 23:10:03 +0000 2019,As AI becomes more popular, the misconceptions about AI in marketing continue to grow. Check out the three most com… https://t.co/21Ojr8YiTg
1175155182394630100,Fri Sep 20 21:10:03 +0000 2019,An in-depth article from @Drapers delves into the multitude of ways that fashion brands are reaching their audience… https://t.co/e7cDbWpSGi
1175124996764700700,Fri Sep 20 19:10:06 +0000 2019,#TikTok continues to expand its reach with the news that they have entered into a multi-year partnership with the N… https://t.co/O34af7oqhL
1175124359930773500,Fri Sep 20 19:07:34 +0000 2019,RT @Brand_Innovator: #BossLadies, represent 💃💃💃💃 Inspired to hear from these fearless marketers @BlazePizza @mitsucars @sweetgreen @caressa…
1175120735624237000,Fri Sep 20 18:53:10 +0000 2019,“Rise of technology is not only convenient but it’s for you...Content is king, but only when it’s personalized to y… https://t.co/SwyWlFqr7b
1175116356255019000,Fri Sep 20 18:35:46 +0000 2019,“The rise of video, the rise of AI..anything that takes something that’s difficult for marketers and makes it easy.… https://t.co/D8N3sFTMdt
1175114928572657700,Fri Sep 20 18:30:06 +0000 2019,Kicked off our two-part discussion on “Women in Marketing: Leadership, Innovation &amp; Trends” with powerful insights… https://t.co/BQUMlXSB33
1175106787659460600,Fri Sep 20 17:57:45 +0000 2019,RT @Cybelesays: @BrandEntNet’s own @caressa_douglas kicks off the first panel on Women in Marketing: Leadership, Innovation &amp; Trends. #BISu…
1175106709951602700,Fri Sep 20 17:57:26 +0000 2019,RT @elliott_112: One of my favorite mentors at work, @caressa_douglas, moderating an incredible panel! #bisummit @BrandEntNet @Brand_Innova…
1175094718931189800,Fri Sep 20 17:09:47 +0000 2019,“I wanted it to be for the people and I knew that #PepsiCo could make that happen.” Chakra Earthsong, Founder of @KeVitaDrinks #BISummit
1175090673634070500,Fri Sep 20 16:53:43 +0000 2019,Inspiring story from @KeVitaDrinks at @Brand_Innovator! #BISummit https://t.co/tw1g97yHcW
1175090400891039700,Fri Sep 20 16:52:38 +0000 2019,RT @Cybelesays: Day 3! #bisummit @BrandEntNet https://t.co/4mD2foZtI3
1175065371801464800,Fri Sep 20 15:13:10 +0000 2019,“Every once in a while things need to be tore down in order to be built up.”  In our continuing series… https://t.co/vePhiL6DZP
1174890382817034200,Fri Sep 20 03:37:50 +0000 2019,RT @Brand_Innovator: "Start with your employees: invest in talent, and give them opportunities to stretch." @lionsgate's @amandakozlowski i…
1174890300935794700,Fri Sep 20 03:37:30 +0000 2019,RT @Aerocles: Packed house for today’s Brand Innovators future of media LA #bisummit at @Hulu HQ https://t.co/N2feeW6KRu
1174885742792757200,Fri Sep 20 03:19:24 +0000 2019,RT @Cybelesays: “The average household is subscribed to 3.5 streaming services” @BrandEntNet #bisummit https://t.co/vh7Ulwu3y0
1174799085049700400,Thu Sep 19 21:35:03 +0000 2019,Procter &amp; Gamble will be funding a new show on Nat Geo called “Activate,” a six-part season focusing on extreme pov… https://t.co/bASXTETC2H
1174768885280755700,Thu Sep 19 19:35:03 +0000 2019,YouTube has launched a dedicated Fashion vertical, where they will be bringing all things fashion and beauty togeth… https://t.co/C3Kz04ly6W
1174759887877890000,Thu Sep 19 18:59:17 +0000 2019,RT @Variety: #Emmys: Who will win at this year's ceremony? https://t.co/FsasCdUrHz
1174738689014018000,Thu Sep 19 17:35:03 +0000 2019,Reality-based TV known as “variety shows” are very popular in China. In 2018 ad spend on variety shows reportedly i… https://t.co/PSru6aGZmi
1174648084476944400,Thu Sep 19 11:35:01 +0000 2019,Executive Producer @ranwins (“Mixed-ish” &amp; "Grace &amp; Frankie") &amp; BEN's SVP of Global Content &amp; Integration, Stephani… https://t.co/Y1KIC5YaWU
1174497091458162700,Thu Sep 19 01:35:02 +0000 2019,It’s predicted that business spending on AI will grow from $12 billion in 2017 to $57.6 billion by 2021! To add to… https://t.co/b3PtXTPeAS
1174436694852083700,Wed Sep 18 21:35:02 +0000 2019,As marketing evolves at a rapid pace @Forbes examine 5 marketing trends that say a lot about today’s audience. Numb… https://t.co/ldq8tuvFqI
1174368918275862500,Wed Sep 18 17:05:43 +0000 2019,RT @Cybelesays: #today! Learning all about how to market to the next generation at #BISummit @BrandEntNet #marketing https://t.co/78X9xSuor8
1174360018696777700,Wed Sep 18 16:30:21 +0000 2019,What is the key to a successful #influencer campaign? @socialmedia2day look at what it means to involve influencers… https://t.co/J0E22QP24q
1174358468364423200,Wed Sep 18 16:24:12 +0000 2019,Day 1 of BrandFest LA kicks off today! Excited to be back at another #BISummit @Brand_Innovator https://t.co/sGXQKxEDeU
1174303212616245200,Wed Sep 18 12:44:38 +0000 2019,Katherine McNamara, actress from CW’s #Arrow, tells us how she uses social media to connect with her fans and why d… https://t.co/WTYFeFpyep
1174109539827966000,Tue Sep 17 23:55:02 +0000 2019,With emerging technologies becoming widely adopted there is a misconception that AI will replace human creativity.… https://t.co/U4Cji4GFm6
1174079350116892700,Tue Sep 17 21:55:05 +0000 2019,In a poll of 600 U.S. consumers (who have at least 1 social media account), 70% said they trusted the opinions of… https://t.co/3td8bGeC90
1174034050341884000,Tue Sep 17 18:55:04 +0000 2019,Influencer spend is on the up, Estée Lauder recently shared that 75% of their investments are now in digital social… https://t.co/Wu4g1Rzl2O
1173740877442900000,Mon Sep 16 23:30:06 +0000 2019,China Film Insider spoke with BEN’s CEO Ricky Ray Butler and Nancy Lewis, Manager of Client Services and Strategic… https://t.co/fG8xEM322O
1173711183523631000,Mon Sep 16 21:32:07 +0000 2019,On the latest episode of the #CreativeDisruption Podcast, @RickyRayButler and @derraleves chat with Will &amp; Grace pr… https://t.co/SU1meCEK0B
1173698839385182200,Mon Sep 16 20:43:04 +0000 2019,RT @advertisingweek: Only 1 week until #AWNewYork! Don't miss our incredible line up of speakers including Trevor Noah, Laverne Cox, Joseph…
1173695595753693200,Mon Sep 16 20:30:10 +0000 2019,With over 14 million subscribers on her YouTube channel #LillySingh is a global star &amp; she’s about to move to her o… https://t.co/c1c6guBeCR
1173678771330674700,Mon Sep 16 19:23:19 +0000 2019,BEN will be at @advertisingweek New York! CEO @RickyRayButler will be speaking at the @Brand_Innovator Summit on Tu… https://t.co/ykjCXOvO0u
1173665414825619500,Mon Sep 16 18:30:15 +0000 2019,A recent addition to the #EmmyAwards is ‘Outstanding Music Supervision’. Nominated for a second time this year… https://t.co/hVbCzNgUwI
1173652888570212400,Mon Sep 16 17:40:28 +0000 2019,RT @Adweek: JUST IN | It’s the first time that all 180 episodes of Seinfeld will be on one service worldwide. https://t.co/4X7fjZbMU8
1173628893514948600,Mon Sep 16 16:05:07 +0000 2019,Target are making strides in the #influencermarketing space as 7 diverse influencers have taken to social media wit… https://t.co/S7x4A09QAS
1173408692169035800,Mon Sep 16 01:30:07 +0000 2019,Due to roll out soon, #YouTube will be making all Premium programming free, and to celebrate they have announced a… https://t.co/zxr2C09Afq
1173363386874286000,Sun Sep 15 22:30:06 +0000 2019,Thanks to #artificialintelligence, marketers are able to demonstrate direct ROI. Read more about this huge internal… https://t.co/fSppAMQRxz
1173347305136767000,Sun Sep 15 21:26:11 +0000 2019,RT @enews: Creative Arts Emmys 2019: Complete List of Winners https://t.co/K2sbQPLCAL
1173333193723977700,Sun Sep 15 20:30:07 +0000 2019,Brands are increasingly embracing #brandedmerchandise &amp; seeing the benefits. Artisan ice cream maker,… https://t.co/2AOLLTziK1
1173303015148855300,Sun Sep 15 18:30:12 +0000 2019,#TikTok continues to expand its reach with the news that they have entered into a multi-year partnership with the N… https://t.co/71qyMroaRp
1173136611489566700,Sun Sep 15 07:28:58 +0000 2019,RT @TelevisionAcad: Five fabulous personalities, one fashionable photo-op with @QueerEye! #Emmys https://t.co/yI9bx20QYf
1173136593433104400,Sun Sep 15 07:28:54 +0000 2019,RT @TelevisionAcad: And the #Emmy winner for Outstanding Original Music And Lyrics is… Adam Schlesinger, @Racheldoesstuff and @jackdolgen f…
1173136477217316900,Sun Sep 15 07:28:26 +0000 2019,RT @TelevisionAcad: Yasss, yasss, yasss! Congrats to @Netflix’s @QueerEye - winner of Outstanding Structured Reality Program! #Emmys https:…
1173061388765401000,Sun Sep 15 02:30:04 +0000 2019,Amazon Prime Video have increased their advertising spending by 300%! With much of it going towards the heavy promo… https://t.co/qJzo7EnErS
1173016099174133800,Sat Sep 14 23:30:06 +0000 2019,As marketing evolves at a fast pace @Forbes detail 5 marketing trends that say a lot about today’s audience Number… https://t.co/ladzgAV197
1172985910977355800,Sat Sep 14 21:30:08 +0000 2019,Reality TV known as “variety shows” are very popular in China. In 2018 advertiser spending on variety shows reporte… https://t.co/9EvH1y1TEM
