id,created_at,text
1240651876023947300,Thu Mar 19 14:50:32 +0000 2020,NEW FEC F2 Jared Lyle Anderson (DEM) #UT03 (R-Curtis)  https://t.co/u2h7UoY1YI https://t.co/n0o0Lo666F
1240643077254963200,Thu Mar 19 14:15:34 +0000 2020,NEW HOUSE CAND FINANCIAL DISCLOSURE CANDIDATE REPORT Stephanie S. Rimmer #AZ06 https://t.co/OLNn8oX3Wl https://t.co/h8eCbWFfDT
1240643021177106400,Thu Mar 19 14:15:20 +0000 2020,NEW HOUSE CAND FINANCIAL DISCLOSURE CANDIDATE REPORT Stephanie S. Rimmer #AZ06 https://t.co/UWRUpTEQTi https://t.co/upCswun34o
1240642965695017000,Thu Mar 19 14:15:07 +0000 2020,NEW HOUSE CAND FINANCIAL DISCLOSURE CANDIDATE REPORT Richard Parnell Habersham #NY13 https://t.co/HtwSoAqwkO https://t.co/WletZFderp
1240640625411674000,Thu Mar 19 14:05:49 +0000 2020,FEC MAJOR CONTRIBUTOR ($100K+) CARPENTERS LEGISLATIVE IMPROVEMENT COMMITTEE UN... https://t.co/ciRdYDZuJW https://t.co/d3NK9m0sYB
1240640565168861200,Thu Mar 19 14:05:35 +0000 2020,NEW FEC F3X CARPENTERS LEGISLATIVE IMPROVEMENT COMMITTEE UN... RCPT $114,979 EXPN $355,000 COH $1,050,952… https://t.co/Hv1COiZWuK
1240640512685518800,Thu Mar 19 14:05:22 +0000 2020,FEC MAJOR CONTRIBUTOR ($100K+) NEW YORK LIFE INSURANCE COMPANY POLITICAL ACTIO... https://t.co/Do7WlREgd3 https://t.co/AxnHTZSaFy
1240640456565739500,Thu Mar 19 14:05:09 +0000 2020,NEW FEC F3X NEW YORK LIFE INSURANCE COMPANY POLITICAL ACTIO... RCPT $114,604 EXPN $186,550 COH $794,149… https://t.co/It9n1nRLu8
1240548634678055000,Thu Mar 19 08:00:17 +0000 2020,NEW DNS REGISTRATIONS - 2020-03-19 https://t.co/gvLaCn6dl3
1240474421644558300,Thu Mar 19 03:05:23 +0000 2020,FEC MAJOR CONTRIBUTOR ($100K+) T-MOBILE USA, INC.  POLITICAL ACTION COMMITTEE ... https://t.co/XvO3dDo5bg https://t.co/MeKmKbSRpW
1240474362630701000,Thu Mar 19 03:05:09 +0000 2020,NEW FEC F3X T-MOBILE USA, INC.  POLITICAL ACTION COMMITTEE ... RCPT $64,906 EXPN $129,000 COH $388,961… https://t.co/0UKClqcU4s
1240437926581817300,Thu Mar 19 00:40:22 +0000 2020,FEC MAJOR CONTRIBUTOR ($100K+) CHEVRON EMPLOYEES POLITICAL ACTION COMMITTEE - ... https://t.co/ynWbwflr5F https://t.co/swQFNPBSZ4
1240437873674838000,Thu Mar 19 00:40:09 +0000 2020,NEW FEC F3X CHEVRON EMPLOYEES POLITICAL ACTION COMMITTEE - ... RCPT $54,188 EXPN $124,500 COH $200,326… https://t.co/TmbbKOxIug
1240429119134785500,Thu Mar 19 00:05:22 +0000 2020,FEC MAJOR CONTRIBUTOR ($100K+) NATIONAL ASSOCIATION OF BROADCASTERS POLITICAL ... https://t.co/o9c2GNn4Yo https://t.co/4V1E7GMSZE
1240429062935310300,Thu Mar 19 00:05:09 +0000 2020,NEW FEC F3X NATIONAL ASSOCIATION OF BROADCASTERS POLITICAL ... RCPT $232,749 EXPN $304,700 COH $330,438… https://t.co/U7WbZXB9Fm
1240395077236727800,Wed Mar 18 21:50:06 +0000 2020,NEW FEC F1 The https://t.co/uubACshV1q PAC  https://t.co/l5anIdKY95 https://t.co/bnX77UyXyO
1240392638068666400,Wed Mar 18 21:40:24 +0000 2020,FEC MAJOR CONTRIBUTOR ($100K+) AIR LINE PILOTS ASSOCIATION PAC https://t.co/jDHTSaWwhT https://t.co/YeDitgKBdN
1240392574940184600,Wed Mar 18 21:40:09 +0000 2020,NEW FEC F3X AIR LINE PILOTS ASSOCIATION PAC RCPT $246,246 EXPN $818,384 COH $1,479,841 https://t.co/jDHTSaWwhT https://t.co/YGumSo27kK
1240387532854120400,Wed Mar 18 21:20:07 +0000 2020,LOGGED NEW SENATE VOTE (00076) A bill making emergency supplemental appropriations for ... https://t.co/7MD69TYDo2 https://t.co/QSR4DTqqaO
1240385002283487200,Wed Mar 18 21:10:04 +0000 2020,NEW FEC F3 EMARD, BENJAMIN (DEM) #CA06  RCPT $1,605 EXPN $5,732 COH $0 https://t.co/QujkBD5shU https://t.co/q7seoMbpBq
1240381234947043300,Wed Mar 18 20:55:06 +0000 2020,NEW F497 California Republican Party - State $47,800 From 11 Transactions https://t.co/iltMHtFN21 https://t.co/WGnizdBbVg
1240380027620823000,Wed Mar 18 20:50:18 +0000 2020,NEW FEC F24 SMP $133,184-&gt; #IASEN https://t.co/MIppZbh2kF https://t.co/fCrmnxaiEz
1240379983576457200,Wed Mar 18 20:50:07 +0000 2020,NEW FEC F24 HOOSIER HEARTLAND FUND $40,000-&gt; #IN05 https://t.co/EzL5dPATjc https://t.co/T9t4yLpZDy
1240377535747121200,Wed Mar 18 20:40:24 +0000 2020,FEC MAJOR CONTRIBUTOR ($100K+) TRUCKING POLITICAL ACTION COMMITTEE OF THE AMER... https://t.co/N3Yn9pbvPw https://t.co/YIT9zjW3V9
1240377477857337300,Wed Mar 18 20:40:10 +0000 2020,NEW FEC F3X TRUCKING POLITICAL ACTION COMMITTEE OF THE AMER... RCPT $99,671 EXPN $151,000 COH $508,015… https://t.co/VANuCJ79zW
1240372433183322000,Wed Mar 18 20:20:07 +0000 2020,LOGGED NEW SENATE VOTE (00075) To strike Federally mandated sick pay and paid family le... https://t.co/fTpOuKMuxO https://t.co/PaX1tamlmr
1240368730032328700,Wed Mar 18 20:05:24 +0000 2020,FEC MAJOR CONTRIBUTOR ($100K+) D.R.I.V.E. - DEMOCRAT, REPUBLICAN, INDEPENDENT ... https://t.co/IFRmQdb2SE https://t.co/Y1XLCc5yAg
1240368670355812400,Wed Mar 18 20:05:10 +0000 2020,NEW FEC F3X D.R.I.V.E. - DEMOCRAT, REPUBLICAN, INDEPENDENT ... RCPT $637,543 EXPN $748,573 COH $3,522,949… https://t.co/Ku8oyH6Pts
1240366139214950400,Wed Mar 18 19:55:07 +0000 2020,NEW FEC F24 THE LINCOLN PROJECT https://t.co/1XSaucLevt https://t.co/hndKe0kdPA
1240362836586451000,Wed Mar 18 19:41:59 +0000 2020,NEW CAL-ACCESS CMTE BECERRA; RAN ACTION FUND COMMITTEE TO RECALL XAVIER https://t.co/aRTqYcFe8B https://t.co/VDNFMTUb35
1240362367189319700,Wed Mar 18 19:40:07 +0000 2020,LOGGED NEW SENATE VOTE (00074) To provide Americans with paid sick time and paid leave ... https://t.co/85RCz6isV6 https://t.co/LyBaCm0rdB
1240357394997108700,Wed Mar 18 19:20:22 +0000 2020,FEC MAJOR CONTRIBUTOR ($100K+) NEXTERA ENERGY, INC. POLITICAL ACTION COMMITTEE https://t.co/mOlRSBZJhW https://t.co/cYddA2kD2b
1240357342807392300,Wed Mar 18 19:20:09 +0000 2020,NEW FEC F3X NEXTERA ENERGY, INC. POLITICAL ACTION COMMITTEE RCPT $93,990 EXPN $221,500 COH $953,669… https://t.co/GDt02NDI57
1240355069259681800,Wed Mar 18 19:11:07 +0000 2020,NEW FEC F24 PRIORITIES USA ACTION $485,840-&gt; #POTUS https://t.co/5VLzcPG9PR https://t.co/7sGtk6xIry
1240355015799140400,Wed Mar 18 19:10:55 +0000 2020,NEW FEC $100K+ CONTRIBUTIONS WOMEN VOTE! https://t.co/pERWsSD4DV https://t.co/atejKrmIbH
1240354979635839000,Wed Mar 18 19:10:46 +0000 2020,FEC MAJOR CONTRIBUTOR ($100K+) WOMEN VOTE! https://t.co/pERWsSD4DV https://t.co/q0gGVr4UD2
1240354934194724900,Wed Mar 18 19:10:35 +0000 2020,NEW FEC F3X WOMEN VOTE! RCPT $2,542,400 EXPN $1,927,090 COH $1,038,327 https://t.co/pERWsSD4DV https://t.co/S9ugLTl0sj
1240354884014104600,Wed Mar 18 19:10:23 +0000 2020,FEC MAJOR CONTRIBUTOR ($100K+) AMERICAN ASSOCIATION OF NURSE ANESTHETISTS SEPA... https://t.co/H65SEMb3k7 https://t.co/go4QK9pO98
1240354832805851100,Wed Mar 18 19:10:11 +0000 2020,NEW FEC F3X AMERICAN ASSOCIATION OF NURSE ANESTHETISTS SEPA... RCPT $60,498 EXPN $127,000 COH $1,469,927… https://t.co/FZiXK63yyC
1240352429142499300,Wed Mar 18 19:00:38 +0000 2020,FEC MAJOR CONTRIBUTOR ($100K+) HEALTH CARE SERVICE CORPORATION EMPLOYEES' POLI... https://t.co/3hQ9XB5gC6 https://t.co/jIM1LrqXwD
1240352327258669000,Wed Mar 18 19:00:14 +0000 2020,NEW FEC F3X HEALTH CARE SERVICE CORPORATION EMPLOYEES' POLI... RCPT $30,883 EXPN $102,500 COH $371,008… https://t.co/QNS5pZsL3Y
1240348633272160300,Wed Mar 18 18:45:33 +0000 2020,FEC MAJOR CONTRIBUTOR ($100K+) CHARTER COMMUNICATIONS INC. POLITICAL ACTION CO... https://t.co/70yomUdrsF https://t.co/axfFMszI5X
1240348581355110400,Wed Mar 18 18:45:21 +0000 2020,NEW FEC F3X CHARTER COMMUNICATIONS INC. POLITICAL ACTION CO... RCPT $113,698 EXPN $274,500 COH $1,007,363… https://t.co/df9ZRsl1iR
1240348531845550000,Wed Mar 18 18:45:09 +0000 2020,NEW FEC F3X PROGRESSIVE TURNOUT PROJECT RCPT $1,977,104 EXPN $1,256,449 COH $7,662,340 https://t.co/k4nGsTEmOm https://t.co/7gM20KpVAl
1240344979668471800,Wed Mar 18 18:31:02 +0000 2020,FEC MAJOR CONTRIBUTOR ($100K+) LOCKHEED MARTIN CORPORATION EMPLOYEES' POLITICA... https://t.co/jRggKihezf https://t.co/WrWKZ4VwrY
1240344915457925000,Wed Mar 18 18:30:46 +0000 2020,NEW FEC F3X LOCKHEED MARTIN CORPORATION EMPLOYEES' POLITICA... RCPT $187,925 EXPN $170,000 COH $2,200,111… https://t.co/tVaH1ypVP4
1240344861770825700,Wed Mar 18 18:30:34 +0000 2020,FEC MAJOR CONTRIBUTOR ($100K+) PG&amp;E CORPORATION EMPLOYEES ENERGYPAC https://t.co/MLWh6h26eD https://t.co/4dOLYqbSh3
1240344809413300200,Wed Mar 18 18:30:21 +0000 2020,NEW FEC F3X PG&amp;E CORPORATION EMPLOYEES ENERGYPAC RCPT $33,524 EXPN $111,480 COH $525,001 https://t.co/MLWh6h26eD https://t.co/V5HVytE2bj
1240344759559831600,Wed Mar 18 18:30:09 +0000 2020,NEW FEC F3P CHAFEE, LINCOLN DAVENPORT MR. (LIB) #POTUS  RCPT $678 EXPN $15,970 COH $12,427 https://t.co/fMC1WdJATa https://t.co/m86vawgmqO
1240323120533139500,Wed Mar 18 17:04:10 +0000 2020,NEW CAL-ACCESS CMTE NO ON THE GAMBLING POWER GRAB: A COMMITTEE OF LOCAL COMMUNITY LEADERS, LICENSED CARD CLUBS AND… https://t.co/mOvwXXDgxi
1240319648244981800,Wed Mar 18 16:50:22 +0000 2020,FEC MAJOR CONTRIBUTOR ($100K+) DOMINION ENERGY, INC. POLITICAL ACTION COMMITTE... https://t.co/XRmWJZ4tqE https://t.co/nRtig7ZN7L
1240319595568742400,Wed Mar 18 16:50:10 +0000 2020,NEW FEC F3X DOMINION ENERGY, INC. POLITICAL ACTION COMMITTE... RCPT $61,651 EXPN $107,307 COH $1,083,649… https://t.co/bfZuwA7jqd
1240315819629768700,Wed Mar 18 16:35:10 +0000 2020,NEW FEC F3P WELD, WILLIAM FLOYD (BILL) (REP) #POTUS  RCPT $155,286 EXPN $119,388 COH $54,088 https://t.co/BRkxbxDbfy https://t.co/xX9kFlUE5A
1240285748063961000,Wed Mar 18 14:35:40 +0000 2020,NEW FEC F24 CONCERNED CONSERVATIVES, INC. $16,182-&gt; #FL19 https://t.co/Pg478QnXGy https://t.co/ShV4r6C4gR
1240285707463057400,Wed Mar 18 14:35:30 +0000 2020,NEW FEC F2 Poet Tribble (W) #KY02 (R-Guthrie)  https://t.co/gODh5dCUzk https://t.co/vL7SYhUX5J
1240281897982296000,Wed Mar 18 14:20:22 +0000 2020,FEC MAJOR CONTRIBUTOR ($100K+) THE COUNCIL OF INSURANCE AGENTS &amp; BROKERS POLIT... https://t.co/v0h3PXxohU https://t.co/yPbEfx2vIY
1240281845398270000,Wed Mar 18 14:20:09 +0000 2020,NEW FEC F3X THE COUNCIL OF INSURANCE AGENTS &amp; BROKERS POLIT... RCPT $268,223 EXPN $304,087 COH $1,074,941… https://t.co/v4LImyRxIo
1240280632246194200,Wed Mar 18 14:15:20 +0000 2020,NEW FEC F3X NATIONAL ASSOCIATION OF REALTORS CONGRESSIONAL ... RCPT $1,938 EXPN $1,938 COH $215,623… https://t.co/VALX5ub2rb
1240280582166208500,Wed Mar 18 14:15:08 +0000 2020,NEW FEC F24 BETTER FUTURE MI FUND $999,914-&gt; #MISEN https://t.co/cMQGKZdHBF https://t.co/YNL4cQ9LBp
1240280573370708000,Wed Mar 18 14:15:06 +0000 2020,NEW HOUSE CAND FINANCIAL DISCLOSURE CANDIDATE REPORT Evelyn Farkas #NY17 https://t.co/YClbgkSGhu https://t.co/9aSetI2w3k
1240270704919998500,Wed Mar 18 13:35:53 +0000 2020,FEC MAJOR CONTRIBUTOR ($100K+) NATIONAL AIR TRAFFIC CONTROLLERS ASSOCIATION PAC https://t.co/ekWvroeM5W https://t.co/9qJ4juhg5v
1240270625085640700,Wed Mar 18 13:35:34 +0000 2020,NEW FEC F3X NATIONAL AIR TRAFFIC CONTROLLERS ASSOCIATION PAC RCPT $363,826 EXPN $289,575 COH $1,847,252… https://t.co/jdz7MZCzZE
1240270571364962300,Wed Mar 18 13:35:21 +0000 2020,FEC MAJOR CONTRIBUTOR ($100K+) FMR LLC POLITICAL ACTION COMMITTEE - FEDERAL (F... https://t.co/GjEdCsnhEi https://t.co/KCO8alTfJH
1240270515538808800,Wed Mar 18 13:35:08 +0000 2020,NEW FEC F3X FMR LLC POLITICAL ACTION COMMITTEE - FEDERAL (F... RCPT $40,965 EXPN $109,000 COH $106,065… https://t.co/Ea30BoqrZf
1240250448675668000,Wed Mar 18 12:15:24 +0000 2020,FEC MAJOR CONTRIBUTOR ($100K+) RAYTHEON COMPANY POLITICAL ACTION COMMITTTEE https://t.co/22jFuMmm5X https://t.co/fTpJuJI39u
1240250388118261800,Wed Mar 18 12:15:09 +0000 2020,NEW FEC F3X RAYTHEON COMPANY POLITICAL ACTION COMMITTTEE RCPT $153,926 EXPN $299,500 COH $1,478,685… https://t.co/ID4w5bPWNm
1240221545135362000,Wed Mar 18 10:20:33 +0000 2020,NEW FEC F2 Lindsay Dozier Holliday (DEM) #GA08 (R-Scott)  https://t.co/n8blsocBNe https://t.co/hLbYFxX9UN
1240215254090444800,Wed Mar 18 09:55:33 +0000 2020,NEW FEC F2 Sheldon (Shelli) Elizabeth Landon (REP) #OK05 (D-Horn) '20 @NRCC target  https://t.co/FNNOLALlt2 https://t.co/VX69jkrmoO
1240164912581599200,Wed Mar 18 06:35:30 +0000 2020,NEW FEC F2 Mark Cavener (REP) #AZSEN   https://t.co/FH8j8MW80T https://t.co/HY5ybY0Gtx
1240147191697719300,Wed Mar 18 05:25:05 +0000 2020,NEW F497 Schools and Communities First sponsored by a Coa... $2,500,000 From SEIU California State Council (nonpr..… https://t.co/7p1oJDx1mU
1240134612954894300,Wed Mar 18 04:35:06 +0000 2020,NEW F497 California Republican Party - State $17,400 To 4 Recipients https://t.co/bxkbeZniXP https://t.co/hcXuLIEWiL
1240125832707870700,Wed Mar 18 04:00:13 +0000 2020,NEW DNS REGISTRATIONS - 2020-03-18 https://t.co/VZV5fph5RE
1240075472928559000,Wed Mar 18 00:40:06 +0000 2020,NEW FEC F24 COMMITTEE TO PROTECT MEDICARE PAC $34,682-&gt; #POTUS https://t.co/RHwaPFmehE https://t.co/BjZHO5Q96s
1240074379330908200,Wed Mar 18 00:35:46 +0000 2020,NEW FEC F5 AMERICANS FOR CONSTITUTIONAL LIBERTY DBA THE CO... $174,580 -&gt; #POTUS https://t.co/b1fQxaubCs https://t.co/0Tc25ggZCl
1240074330500821000,Wed Mar 18 00:35:34 +0000 2020,NEW FEC F5 AMERICANS FOR CONSTITUTIONAL LIBERTY DBA THE CO... $46,718 -&gt; #POTUS https://t.co/auvZuJh5bH https://t.co/KlkzYexnii
1240074284359286800,Wed Mar 18 00:35:23 +0000 2020,FEC MAJOR CONTRIBUTOR ($100K+) NATIONAL MULTIFAMILY HOUSING COUNCIL POLITICAL ... https://t.co/wFTZLisLxn https://t.co/60h642hWJ7
1240074224988901400,Wed Mar 18 00:35:09 +0000 2020,NEW FEC F3X NATIONAL MULTIFAMILY HOUSING COUNCIL POLITICAL ... RCPT $112,891 EXPN $190,000 COH $1,114,640… https://t.co/UIhAq6stwD
1240057130062733300,Tue Mar 17 23:27:13 +0000 2020,#CD43 Update https://t.co/gcq2bRpaSE
1240040236756783000,Tue Mar 17 22:20:05 +0000 2020,NEW FEC F1 Pandemic PAC  https://t.co/HoQFoRauXc https://t.co/Gm1dXO2GzJ
1240037791322353700,Tue Mar 17 22:10:22 +0000 2020,FEC MAJOR CONTRIBUTOR ($100K+) UNITED PARCEL SERVICE INC. PAC https://t.co/D2C1AH866R https://t.co/TnSaCHBppt
1240037735882035200,Tue Mar 17 22:10:09 +0000 2020,NEW FEC F3X UNITED PARCEL SERVICE INC. PAC RCPT $153,604 EXPN $166,311 COH $1,585,497 https://t.co/D2C1AH866R https://t.co/CcgovMEn9X
1240031499191087000,Tue Mar 17 21:45:22 +0000 2020,FEC MAJOR CONTRIBUTOR ($100K+) ZENECA. INC. POLITICAL ACTION COMMITTEE (AZPAC) https://t.co/46DQjaUQjZ https://t.co/1vxL2SPtbp
1240031446791630800,Tue Mar 17 21:45:10 +0000 2020,NEW FEC F3X ZENECA. INC. POLITICAL ACTION COMMITTEE (AZPAC) RCPT $42,058 EXPN $119,000 COH $284,507… https://t.co/kqDZTsv4pt
1240023986953572400,Tue Mar 17 21:15:31 +0000 2020,FEC MAJOR CONTRIBUTOR ($100K+) BNSF RAILWAY COMPANY RAILPAC (BNSF RAILPAC) https://t.co/hFuE9sw5at https://t.co/fZXjZHAcrI
1240023935233613800,Tue Mar 17 21:15:19 +0000 2020,NEW FEC F3X BNSF RAILWAY COMPANY RAILPAC (BNSF RAILPAC) RCPT $129,400 EXPN $130,294 COH $551,513… https://t.co/2RzncTG5CI
1240023886235746300,Tue Mar 17 21:15:07 +0000 2020,NEW FEC F24 SECURITY IS STRENGTH PAC $287,690-&gt; #SCSEN https://t.co/WPhpPtmuxc https://t.co/qklsB3O996
1240013811563675600,Tue Mar 17 20:35:05 +0000 2020,NEW F497 CALIFORNIANS FOR STEM CELL RESEARCH, TREATMENTS ... $571,553 From ROBERT N. KLEIN II AND AFFILIATED EN...… https://t.co/JxAtDhcOEa
1240010040892780500,Tue Mar 17 20:20:06 +0000 2020,NEW FEC $100K+ CONTRIBUTIONS ONE VOTE AT A TIME https://t.co/L8DcNs3Ure https://t.co/k0CfF3tmCO
1240006344083529700,Tue Mar 17 20:05:25 +0000 2020,FEC MAJOR CONTRIBUTOR ($100K+) INVESTMENT COMPANY INSTITUTE POLITICAL ACTION C... https://t.co/YbPM7PpKJa https://t.co/btSEpmA1xA
1240006280971833300,Tue Mar 17 20:05:10 +0000 2020,NEW FEC F3X INVESTMENT COMPANY INSTITUTE POLITICAL ACTION C... RCPT $30,980 EXPN $231,921 COH $351,697… https://t.co/bdGoBmXAUh
1239997552704946200,Tue Mar 17 19:30:29 +0000 2020,FEC MAJOR CONTRIBUTOR ($100K+) INTERNATIONAL PAPER POLITICAL ACTION COMMITTEE ... https://t.co/iCUZE10imf https://t.co/zz9kyEZvZs
1239997494718681000,Tue Mar 17 19:30:15 +0000 2020,NEW FEC F3X INTERNATIONAL PAPER POLITICAL ACTION COMMITTEE ... RCPT $60,183 EXPN $217,300 COH $43,107… https://t.co/YLF7hudwfo
1239993753722482700,Tue Mar 17 19:15:23 +0000 2020,FEC MAJOR CONTRIBUTOR ($100K+) INTERNATIONAL UNION OF PAINTERS AND ALLIED TRAD... https://t.co/09xUdl818s https://t.co/2qfIhyqcf4
1239993698349277200,Tue Mar 17 19:15:10 +0000 2020,NEW FEC F3X INTERNATIONAL UNION OF PAINTERS AND ALLIED TRAD... RCPT $251,632 EXPN $147,775 COH $2,410,903… https://t.co/ztpBOtJB5t
1239988789654634500,Tue Mar 17 18:55:39 +0000 2020,NEW FEC F1 Get America Right: Community in Action - GARCIA...  https://t.co/0GpHhY24Mr https://t.co/lXg4jgZtn9
1239988749313798100,Tue Mar 17 18:55:30 +0000 2020,NEW FEC F2 April Nesbit (IND) #OKSEN (R-Inhofe)  https://t.co/8uAycoNEcG https://t.co/ogroP5H3kK
1239981100606181400,Tue Mar 17 18:25:06 +0000 2020,NEW FEC F24 CLUB FOR GROWTH ACTION $20,294-&gt; #AL01 https://t.co/baOEQhXZu8 https://t.co/Ua6V5rkxSN
1239977512190406700,Tue Mar 17 18:10:51 +0000 2020,FEC MAJOR CONTRIBUTOR ($100K+) AMERICAN HOSPITAL ASSOCIATION PAC https://t.co/wmIgkwxBHR https://t.co/q6oB9GMtFs
1239977443710001200,Tue Mar 17 18:10:34 +0000 2020,NEW FEC F3X AMERICAN HOSPITAL ASSOCIATION PAC RCPT $171,501 EXPN $124,729 COH $4,544,017 https://t.co/wmIgkwxBHR https://t.co/cBA1WpZSKp
1239977393688739800,Tue Mar 17 18:10:22 +0000 2020,FEC MAJOR CONTRIBUTOR ($100K+) GENERAL ATOMICS POLITICAL ACTION COMMITTEE https://t.co/m2AjJiikWp https://t.co/seIyM7cXSB
1239977340068696000,Tue Mar 17 18:10:10 +0000 2020,NEW FEC F3X GENERAL ATOMICS POLITICAL ACTION COMMITTEE RCPT $56,436 EXPN $111,500 COH $129,712… https://t.co/K0sYf7HWhd
1239976205480120300,Tue Mar 17 18:05:39 +0000 2020,NEW FEC F24 CLUB FOR GROWTH ACTION $34,600-&gt; #KSSEN https://t.co/2Z81gEY7J9 https://t.co/ldtWQSQ3EE
1239976153563025400,Tue Mar 17 18:05:27 +0000 2020,FEC MAJOR CONTRIBUTOR ($100K+) THE NATIONAL RURAL ELECTRIC COOPERATIVE ASSOCIA... https://t.co/JFgMnBagSd https://t.co/pVSYRKUEup
1239976081865621500,Tue Mar 17 18:05:10 +0000 2020,NEW FEC F3X THE NATIONAL RURAL ELECTRIC COOPERATIVE ASSOCIA... RCPT $297,135 EXPN $228,215 COH $1,095,303… https://t.co/BRD5TRMYjB
1239963607141503000,Tue Mar 17 17:15:36 +0000 2020,NEW FEC F2 Darren J Hamilton (LBU) #TX24 (R-Marchant) '20 @DCCC target  https://t.co/poyCWegsqa https://t.co/liIPCMbhoC
1239954754265952300,Tue Mar 17 16:40:25 +0000 2020,FEC MAJOR CONTRIBUTOR ($100K+) COMCAST CORPORATION &amp; NBCUNIVERSAL POLITICAL AC... https://t.co/5vupqa9qXX https://t.co/i6BHJ7xvNj
1239954692567756800,Tue Mar 17 16:40:10 +0000 2020,NEW FEC F3X COMCAST CORPORATION &amp; NBCUNIVERSAL POLITICAL AC... RCPT $269,173 EXPN $252,664 COH $1,660,693… https://t.co/sz2v4w945j
1239948483227816000,Tue Mar 17 16:15:30 +0000 2020,NEW FEC F2 Erika Marie Cashin (REP) #MN02 (D-Craig) '20 @NRCC target  https://t.co/Y3czzlSC2O https://t.co/twQ64sB0R4
1239933352955662300,Tue Mar 17 15:15:22 +0000 2020,FEC MAJOR CONTRIBUTOR ($100K+) HUNTINGTON BANCSHARES INC. POLITICAL ACTION COM... https://t.co/zbLUqQk0Jq https://t.co/bG2u69LwPY
1239933296789749800,Tue Mar 17 15:15:09 +0000 2020,NEW FEC F3X HUNTINGTON BANCSHARES INC. POLITICAL ACTION COM... RCPT $39,008 EXPN $197,500 COH $19,084… https://t.co/r3zvzr0LkP
1239928249297199000,Tue Mar 17 14:55:06 +0000 2020,NEW F497 DELOITTE LLP $15,000 To 3 Recipients https://t.co/H2XhKQRYw2 https://t.co/ZsXeXh1yP7
1239918177888260000,Tue Mar 17 14:15:04 +0000 2020,NEW HOUSE CAND FINANCIAL DISCLOSURE CANDIDATE REPORT Nick J. Freitas #VA07 https://t.co/IlMmGNhlFe https://t.co/HJsagjaT7f
1239913145994334200,Tue Mar 17 13:55:05 +0000 2020,NEW F497 Visa Inc. $55,000 To 2 Recipients https://t.co/4I8MSXHYL4 https://t.co/Zn7XpbwBUe
1239900644942569500,Tue Mar 17 13:05:24 +0000 2020,FEC MAJOR CONTRIBUTOR ($100K+) AMERICAN CRYSTAL SUGAR COMPANY POLITICAL ACTION... https://t.co/2lgPEh9yX0 https://t.co/5E4Qr9G4nJ
1239900583621877800,Tue Mar 17 13:05:10 +0000 2020,NEW FEC F3X AMERICAN CRYSTAL SUGAR COMPANY POLITICAL ACTION... RCPT $78,361 EXPN $313,765 COH $1,371,188… https://t.co/j12NAfuJ2Z
1239777363853860900,Tue Mar 17 04:55:32 +0000 2020,NEW FEC F2 Jacob Kristopher Anders (DEM) #TN04 (R-DesJarlais)  https://t.co/mvW6KH5iFm https://t.co/XJjnbhST0j
1239770963954167800,Tue Mar 17 04:30:06 +0000 2020,NEW FPPC F460 #AD25 Natasha S Gupta (D) https://t.co/1Gsb7jCsf4 https://t.co/ZpRZaxomI7
1239748337139507200,Tue Mar 17 03:00:11 +0000 2020,NEW DNS REGISTRATIONS - 2020-03-17 https://t.co/7yu8nfg77Z
1239725723352326100,Tue Mar 17 01:30:20 +0000 2020,NEW FEC F24 END CITIZENS UNITED https://t.co/azIdfuQsBH https://t.co/IFlIoQzEp0
1239725679416991700,Tue Mar 17 01:30:09 +0000 2020,NEW FEC F24 END CITIZENS UNITED $15,140-&gt; #KYSEN https://t.co/H3fDWokwqB https://t.co/Ta77v4dCVE
1239715611447406600,Tue Mar 17 00:50:09 +0000 2020,NEW FEC F24 END CITIZENS UNITED $46,140-&gt; #AZSEN https://t.co/dJ9cA3NWjo https://t.co/wXCzez7fOr
1239711975858266000,Tue Mar 17 00:35:42 +0000 2020,NEW FEC F24 END CITIZENS UNITED $81,140-&gt; #CA45 https://t.co/da56G1JDIq https://t.co/dPL3nXfVuP
1239711930551394300,Tue Mar 17 00:35:31 +0000 2020,NEW FEC F2 Daniel R Miller (REP) #WA02 (D-Larsen)  https://t.co/eO57tYatBQ https://t.co/MmfQjSs5GI
1239697981730771000,Mon Mar 16 23:40:05 +0000 2020,NEW F497 Charter Communications, Inc. $38,800 To California Republican Party Sacramen... https://t.co/WEh2enLQYg https://t.co/WGLWzpnOEm
1239694223235932200,Mon Mar 16 23:25:09 +0000 2020,NEW F497 Newsom for California Governor 2022 $30,000 From 3 Transactions https://t.co/fUaGUDeWnw https://t.co/4IJ7VoJ3a8
1239684144147255300,Mon Mar 16 22:45:06 +0000 2020,NEW F497 Newsom for California Governor 2022 $60,000 From 4 Transactions https://t.co/IOJcwWk15P https://t.co/v6NjwSZdvu
1239676603732332500,Mon Mar 16 22:15:09 +0000 2020,NEW FEC F5 AMERICANS FOR CONSTITUTIONAL LIBERTY DBA THE CO... $15,633 -&gt; #POTUS https://t.co/Usw2iTbT2f https://t.co/IYTy1U1Oww
1239671654013227000,Mon Mar 16 21:55:28 +0000 2020,NEW F497 Re-Elect Tony Thurmond for Superintendent of Pub... $15,000 From 3 Transactions https://t.co/WPugocaVdY https://t.co/o9LZa6kmfk
1239671591614607400,Mon Mar 16 21:55:14 +0000 2020,NEW F497 California Democratic Party $431,100 From 11 Transactions https://t.co/j28u6u3A8N https://t.co/EPpoJ1qPjp
1239656471610003500,Mon Mar 16 20:55:09 +0000 2020,NEW FEC F3X E-PAC RCPT $21,813 EXPN $141,497 COH $56,754 https://t.co/XvLvuyRBJm https://t.co/oMF1b7V0ew
1239643975549505500,Mon Mar 16 20:05:29 +0000 2020,NEW FEC F2 James McGannon (DEM) #CO04 (R-Buck)  https://t.co/cJLB1xa5Kh https://t.co/WuqfN1Y04E
1239631381614841900,Mon Mar 16 19:15:27 +0000 2020,NEW FEC F24 INDIVISIBLE ACTION $20,000-&gt; #IL03 https://t.co/6vnGWDfuQc https://t.co/PHD4MEfmba
1239631335964037000,Mon Mar 16 19:15:16 +0000 2020,NEW FEC F24 INDIVISIBLE ACTION $17,250-&gt; #TXSEN https://t.co/gwePSCApQG https://t.co/tHAMYVHEHr
1239628890240217000,Mon Mar 16 19:05:33 +0000 2020,NEW FEC F2 Gregory Kempton (DEM) #NV04 (D-Horsford) '20 @NRCC target  https://t.co/VLvpfstbtd https://t.co/P31FHsNW4k
1239612496815636500,Mon Mar 16 18:00:24 +0000 2020,FEC MAJOR CONTRIBUTOR ($100K+) AMERICAN COUNCIL OF LIFE INSURERS POLITICAL ACT... https://t.co/vpkXEHcTy9 https://t.co/7eGmpSnAQq
1239612439047487500,Mon Mar 16 18:00:11 +0000 2020,NEW FEC F3X AMERICAN COUNCIL OF LIFE INSURERS POLITICAL ACT... RCPT $22,320 EXPN $109,000 COH $196,199… https://t.co/9VltZKopGJ
1239601163911061500,Mon Mar 16 17:15:22 +0000 2020,FEC MAJOR CONTRIBUTOR ($100K+) NATIONAL BEER WHOLESALERS ASSOCIATION POLITICAL... https://t.co/GvyKtJKCOV https://t.co/kyZIXflgzc
1239601107342508000,Mon Mar 16 17:15:09 +0000 2020,NEW FEC F3X NATIONAL BEER WHOLESALERS ASSOCIATION POLITICAL... RCPT $290,707 EXPN $134,000 COH $579,384… https://t.co/JdNpVYLd21
1239578515680284700,Mon Mar 16 15:45:23 +0000 2020,FEC MAJOR CONTRIBUTOR ($100K+) DELOITTE POLITICAL ACTION COMMITTEE https://t.co/4qG96g11Zt https://t.co/xAaWAGjlU7
1239578515680284700,Mon Mar 16 15:45:23 +0000 2020,FEC MAJOR CONTRIBUTOR ($100K+) DELOITTE POLITICAL ACTION COMMITTEE https://t.co/4qG96g11Zt https://t.co/xAaWAGjlU7
1239578459669581800,Mon Mar 16 15:45:09 +0000 2020,NEW FEC F3X DELOITTE POLITICAL ACTION COMMITTEE RCPT $2,215 EXPN $216,260 COH $820,713 https://t.co/4qG96g11Zt https://t.co/QETH4IffAA
1239568491331510300,Mon Mar 16 15:05:33 +0000 2020,NEW FEC F2 SCOTT FRANKLIN (REP) #FL15 (R-Spano) '20 @DCCC target  https://t.co/gXFOXQ5MpK https://t.co/TqF351wlSz
1239564745033703400,Mon Mar 16 14:50:39 +0000 2020,NEW FEC F3X GREAT AMERICA PAC RCPT $411,462 EXPN $334,265 COH $1,345,454 https://t.co/oeSNfp05IQ https://t.co/kdYc4aIkCM
1239564690344120300,Mon Mar 16 14:50:26 +0000 2020,FEC MAJOR CONTRIBUTOR ($100K+) GENERAL DYNAMICS CORPORATION POLITICAL ACTION C... https://t.co/xIwSSSRzju https://t.co/PfzQMs7XtZ
1239564623193374700,Mon Mar 16 14:50:10 +0000 2020,NEW FEC F3X GENERAL DYNAMICS CORPORATION POLITICAL ACTION C... RCPT $100,450 EXPN $156,500 COH $986,496… https://t.co/Fh9ihJE9zJ
1239555848747151400,Mon Mar 16 14:15:18 +0000 2020,NEW HOUSE CAND FINANCIAL DISCLOSURE CAMPAIGN NOTICE Aja Smith #CA41 https://t.co/PyTbohCtNn https://t.co/deszH2L9aA
1239555819445747700,Mon Mar 16 14:15:11 +0000 2020,NEW HOUSE CAND FINANCIAL DISCLOSURE CAMPAIGN NOTICE Courtney Lackey #CA25 https://t.co/zyGKOPggfh https://t.co/dqLlDPzwAh
1239555789573861400,Mon Mar 16 14:15:04 +0000 2020,NEW HOUSE CAND FINANCIAL DISCLOSURE WITHDRAWAL OF CANDIDACY Jo Jorgensen # https://t.co/waxRvjbrNU https://t.co/JztYW25XjA
1239552106098348000,Mon Mar 16 14:00:26 +0000 2020,FEC MAJOR CONTRIBUTOR ($100K+) INDEPENDENT INSURANCE AGENTS &amp; BROKERS OF AMERI... https://t.co/RDKSfrg1bi https://t.co/kti7HJGqWf
1239552045947818000,Mon Mar 16 14:00:12 +0000 2020,NEW FEC F3X INDEPENDENT INSURANCE AGENTS &amp; BROKERS OF AMERI... RCPT $67,304 EXPN $111,420 COH $491,957… https://t.co/oTzbtbkZwv
1239548318964842500,Mon Mar 16 13:45:23 +0000 2020,FEC MAJOR CONTRIBUTOR ($100K+) PFIZER INC. PAC https://t.co/vGlkx4St2G https://t.co/brb7hi4HLs
1239548259510571000,Mon Mar 16 13:45:09 +0000 2020,NEW FEC F3X PFIZER INC. PAC RCPT $125,992 EXPN $206,495 COH $561,244 https://t.co/vGlkx4St2G https://t.co/pzZ9Zqn1LO
