id,created_at,text
1261144314693824500,Fri May 15 04:00:10 +0000 2020,NEW DNS REGISTRATIONS - 2020-05-15 https://t.co/OoK23iSJNm
1261131716967542800,Fri May 15 03:10:06 +0000 2020,NEW FEC F24 UNITED WE CAN $32,225-&gt; #POTUS https://t.co/yKBHBkMqGX https://t.co/Lv2TTpWwGp
1261129206559203300,Fri May 15 03:00:08 +0000 2020,NEW FEC F24 SEIU COPE (SERVICE EMPLOYEES INTERNATIONAL UNIO... $22,725-&gt; #POTUS https://t.co/clYLnvK9Is https://t.co/jI8ZdPPDGs
1261114103650676700,Fri May 15 02:00:07 +0000 2020,NEW FEC F24 MAKE NEW MEXICO GREAT PAC $16,461-&gt; #NM02 https://t.co/HMCKcijqcj https://t.co/Yg29OJ4lNg
1261092714675728400,Fri May 15 00:35:07 +0000 2020,NEW FEC F24 GUILLORY, ELBERT (REP-Open) #LA04  https://t.co/JoL7wmM0p4 https://t.co/CN9MYZjX7s
1261065033854795800,Thu May 14 22:45:08 +0000 2020,NEW FEC F24 SAVE AMERICA FUND $130,247-&gt; #KYSEN https://t.co/YKZOalQ51F https://t.co/xZJg0lTmiw
1261057472892002300,Thu May 14 22:15:05 +0000 2020,NEW FEC F24 UNITE THE COUNTRY $1,713,350-&gt; #POTUS https://t.co/FleafIfo7u https://t.co/KQfhhIBnCf
1261044896296657000,Thu May 14 21:25:07 +0000 2020,NEW FEC F1 #CASEN Vena allianceTriplanetorium Religious planet Ju...  https://t.co/iZ4FNLph1G https://t.co/Oxp94EvLxA
1261041127269863400,Thu May 14 21:10:08 +0000 2020,NEW FEC F24 NATIONAL RIFLE ASSOCIATION OF AMERICA POLITICAL... https://t.co/Y4rRCZ5JPY https://t.co/9lcIBNY7jY
1261039959277895700,Thu May 14 21:05:29 +0000 2020,NEW FEC F2 Trace Johannesen (REP) #TX04 (R-Ratcliffe)  https://t.co/d3UFN3uAVb https://t.co/ipWnEUczjU
1261037341117829000,Thu May 14 20:55:05 +0000 2020,NEW FEC F24 IOWA FOUR $12,023-&gt; #IA04 https://t.co/AnzGkrFckx https://t.co/ZKE0DXms50
1261032310159184000,Thu May 14 20:35:06 +0000 2020,NEW FEC F24 OREGON RIGHT TO LIFE VICTORY PAC $14,309-&gt; #OR02 https://t.co/oFZ4JgF5am https://t.co/eeZA1rumMK
1261028537554755600,Thu May 14 20:20:06 +0000 2020,NEW FEC F24 CITIZENS FOR A UNITED NEW MEXICO $100,000-&gt; #NM02 https://t.co/bF5FGxmTzV https://t.co/GpECv4kmJz
1261019725817016300,Thu May 14 19:45:05 +0000 2020,NEW FEC F24 WOMEN VOTE! $44,510-&gt; #NM03 https://t.co/CnJajuUvB9 https://t.co/qZGj69V0AJ
1261013439155069000,Thu May 14 19:20:07 +0000 2020,LOGGED NEW SENATE VOTE (00092) A bill to amend the Foreign Intelligence Surveillance Ac... https://t.co/EMkoWqKHuc https://t.co/BBPmdc1PX5
1261010923499565000,Thu May 14 19:10:07 +0000 2020,NEW FEC F24 THE LINCOLN PROJECT $316,730-&gt; #POTUS https://t.co/htVaDkCgoP https://t.co/MBmnoKTuMb
1260993319657541600,Thu May 14 18:00:10 +0000 2020,LOGGED NEW SENATE VOTE (00091) To amend the Foreign Intelligence Surveillance Act of 19... https://t.co/zpqsc5XCop https://t.co/sULflOteaZ
1260970669040234500,Thu May 14 16:30:09 +0000 2020,NEW FEC F3X NATIONAL DEMOCRATIC TRAINING COMMITTEE PAC RCPT $1,300,781 EXPN $635,754 COH $2,291,750… https://t.co/yszrC3OTCI
1260969413416595500,Thu May 14 16:25:10 +0000 2020,NEW FEC F24 END CITIZENS UNITED $115,286-&gt; #CA45 #AZSEN #KYSEN #MTSEN #MESEN https://t.co/NnmZXzjtUW https://t.co/k6clILopEr
1260951783091794000,Thu May 14 15:15:07 +0000 2020,NEW FEC F24 DEMOCRATIC PROGRESS $65,000-&gt; #IN01 https://t.co/lM1VUJQHEk https://t.co/4SSXTYEmSz
1260946754846908400,Thu May 14 14:55:08 +0000 2020,NEW FEC F3X THE COMMITTEE TO DEFEND THE PRESIDENT RCPT $728,439 EXPN $461,152 COH $2,173,205 https://t.co/M1Hz1BgO4k https://t.co/ucgmzzETg5
1260945526352035800,Thu May 14 14:50:15 +0000 2020,NEW FEC F24 PROTECT FREEDOM POLITICAL ACTION COMMITTEE $160,570-&gt; #NC11 https://t.co/k05tRqn8aU https://t.co/dNlVjNWQIq
1260945488322261000,Thu May 14 14:50:06 +0000 2020,NEW FEC F24 PROTECT FREEDOM POLITICAL ACTION COMMITTEE $64,662-&gt; #ME02 https://t.co/440pLGIJBg https://t.co/wVE1b4af4D
1260936676613845000,Thu May 14 14:15:05 +0000 2020,NEW FEC $100K+ CONTRIBUTIONS PROTECT FREEDOM POLITICAL ACTION COMMITTEE https://t.co/zb1AgrsN7b https://t.co/dD94kO8n2S
1260909011521597400,Thu May 14 12:25:09 +0000 2020,NEW FEC F3X UA UNION PLUMBERS &amp; PIPEFITTERS VOTE! PAC (UNIT... RCPT $326,941 EXPN $0 COH $10,068,223… https://t.co/rNnZtZhdJY
1260893906331263000,Thu May 14 11:25:08 +0000 2020,NEW FEC F3 BERINA, COURTNEY JAMES (DEM) #CA30  RCPT $2,697 EXPN $4,102 COH $-1,405 https://t.co/MjKUXNqGl6 https://t.co/s5zWTKBV7T
1260827232563597300,Thu May 14 07:00:11 +0000 2020,NEW DNS REGISTRATIONS - 2020-05-14 https://t.co/fO8vjULyr8
1260765548511506400,Thu May 14 02:55:05 +0000 2020,NEW FEC F24 UNDIVIDED PURPOSE $10,000-&gt; #GASEN https://t.co/ZdVSXkyM51 https://t.co/yUGRxEBniA
1260729164463657000,Thu May 14 00:30:30 +0000 2020,NEW FEC F2 David Tadashi Ishii (DEM) #WA07 (D-Jayapal)  https://t.co/8YXaBm4B7O https://t.co/qRsJgh5ZeY
1260708014954123300,Wed May 13 23:06:28 +0000 2020,#CA25 Update https://t.co/WQMnVOXk42
1260696348271054800,Wed May 13 22:20:06 +0000 2020,LOGGED NEW SENATE VOTE (00090) To improve the amicus provisions and require the disclos... https://t.co/6gje3PcjhD https://t.co/5OJexZqcoO
1260683770815864800,Wed May 13 21:30:07 +0000 2020,NEW FEC F24 NATIONAL RIFLE ASSOCIATION OF AMERICA POLITICAL... https://t.co/zUmCWq5ybU https://t.co/CCVyEZNZpU
1260674299200856000,Wed May 13 20:52:29 +0000 2020,NEW FEC F1 WE WANT JESSE  https://t.co/TufNJHq37z https://t.co/O6tCMg0luD
1260673699088183300,Wed May 13 20:50:06 +0000 2020,NEW FEC F24 CLUB FOR GROWTH ACTION $14,066-&gt; #OR02 https://t.co/PCN6fWelUl https://t.co/5N1J71Swm1
1260671187283112000,Wed May 13 20:40:07 +0000 2020,NEW FEC F5 AMERICANS FOR CONSTITUTIONAL LIBERTY DBA THE CO... $57,327 -&gt; #POTUS https://t.co/Ff7MJUg0Em https://t.co/9oeWi1s4zz
1260669923698737200,Wed May 13 20:35:06 +0000 2020,NEW FEC F24 CLUB FOR GROWTH ACTION https://t.co/aQZNllgqKf https://t.co/aBCHsF7jCh
1260666143024402400,Wed May 13 20:20:05 +0000 2020,NEW FEC $100K+ CONTRIBUTIONS USW WORKS https://t.co/yUF1pbDNYZ https://t.co/Y9xKEg6gYa
1260663634348277800,Wed May 13 20:10:07 +0000 2020,NEW FEC F24 CLUB FOR GROWTH ACTION $10,236-&gt; #IN05 https://t.co/soEW2nNRIa https://t.co/HEtzl6rOYN
1260659862972665900,Wed May 13 19:55:07 +0000 2020,NEW FEC F24 CLUB FOR GROWTH ACTION $19,019-&gt; #GA07 https://t.co/6I2ENfCNLg https://t.co/1Fjxlg0XGd
1260658294688899000,Wed May 13 19:48:54 +0000 2020,NEW FEC F24 PRIORITIES USA ACTION $1,114,653-&gt; #POTUS https://t.co/LxbJjSWAJw https://t.co/Ei5E3j7opp
1260658226980204500,Wed May 13 19:48:37 +0000 2020,NEW FEC F1 https://t.co/ab6UuVJqoA  https://t.co/bYWJB1T7Lj https://t.co/DWO9KxgQp3
1260647312444887000,Wed May 13 19:05:15 +0000 2020,NEW FEC F24 SENATE CONSERVATIVES FUND $16,013-&gt; #MISEN https://t.co/tXD0JEs7A1 https://t.co/SG4J3haJR8
1260647272481616000,Wed May 13 19:05:06 +0000 2020,NEW FEC F24 SENATE CONSERVATIVES FUND $15,988-&gt; #NHSEN https://t.co/Nq08z7LqSG https://t.co/RJM8V1FoqP
1260646031881994200,Wed May 13 19:00:10 +0000 2020,NEW FEC F24 AMERICAS PAC $893,679-&gt; #MISEN https://t.co/YK9is6FS2G https://t.co/03tCOfs3Jg
1260642237219664000,Wed May 13 18:45:05 +0000 2020,NEW FEC F24 CENTER FORWARD COMMITTEE $16,541-&gt; #OR05 https://t.co/tRYy4KKQY2 https://t.co/n9wNsFIWeC
1260639723686514700,Wed May 13 18:35:06 +0000 2020,NEW FEC F24 THE COMMITTEE TO DEFEND THE PRESIDENT https://t.co/aFMEa3haT6 https://t.co/lkfD5eaJ2m
1260638480654233600,Wed May 13 18:30:09 +0000 2020,NEW FEC F24 AMERICAS PAC $1,326,512-&gt; #IASEN https://t.co/gyeEwdUOE5 https://t.co/J3q15UUJUy
1260629756682203100,Wed May 13 17:55:30 +0000 2020,NEW FEC F2 Jean-Paul Bangila Kalonji (DEM) #IN03 (R-Banks)  https://t.co/C9szOiP3Qe https://t.co/GQNXQg2yJg
1260625886191079400,Wed May 13 17:40:07 +0000 2020,LOGGED NEW SENATE VOTE (00089) To remove internet website browsing information and sear... https://t.co/tDmyjTQ5RZ https://t.co/UnIsG7wYNA
1260591911200415700,Wed May 13 15:25:06 +0000 2020,NEW FEC F24 DEMOCRATIC PROGRESS $112,480-&gt; #IN01 https://t.co/CfKaOqdQdu https://t.co/Y1YnXgIIkF
1260584363802099700,Wed May 13 14:55:07 +0000 2020,NEW FEC F24 UA UNION PLUMBERS &amp; PIPEFITTERS VOTE! PAC (UNIT... $148,200-&gt; #IL03 https://t.co/f8W4knL6Q9 https://t.co/ddcdqRw7QT
1260574348123033600,Wed May 13 14:15:19 +0000 2020,NEW HOUSE CAND FINANCIAL DISCLOSURE WITHDRAWAL OF CANDIDACY Ron Kelly #CA43 https://t.co/UQ4BR3pGk3 https://t.co/Nxx6qLVEO0
1260574318515359700,Wed May 13 14:15:12 +0000 2020,NEW HOUSE CAND FINANCIAL DISCLOSURE CAMPAIGN NOTICE Ron Kelly #CA43 https://t.co/qoYVSZvJlP https://t.co/qdfwpZfZB1
1260574288324759600,Wed May 13 14:15:05 +0000 2020,NEW HOUSE CAND FINANCIAL DISCLOSURE CANDIDATE REPORT Kat Cammack #FL03 https://t.co/qOP2c2oKFO https://t.co/Zl0punVhkn
1260565501169725400,Wed May 13 13:40:10 +0000 2020,NEW FEC F24 WITH HONOR FUND, INC. https://t.co/ZShgTOyalK https://t.co/Q2Wl9YBU8P
1260554161382256600,Wed May 13 12:55:06 +0000 2020,NEW FEC F24 ELECT HONEST LEADERSHIP PAC $51,066-&gt; #IN01 https://t.co/mcmVGd4xDd https://t.co/TRjNiMZGPg
1260474823978950700,Wed May 13 07:39:51 +0000 2020,#CA25 Update https://t.co/GEDPlAZ2dh
1260448816756592600,Wed May 13 05:56:30 +0000 2020,#CA25 Update https://t.co/NnHTpHax2f
1260422041729208300,Wed May 13 04:10:06 +0000 2020,NEW FEC F24 NATIONAL RIFLE ASSOCIATION OF AMERICA POLITICAL... https://t.co/PZKd6Dte7b https://t.co/d0e15UAnQM
1260419539038122000,Wed May 13 04:00:10 +0000 2020,NEW DNS REGISTRATIONS - 2020-05-13 https://t.co/hF7Ah6ZC7h
1260417756073058300,Wed May 13 03:53:05 +0000 2020,#CA25 Update https://t.co/mHPl3Q3uLw
1260413453421834200,Wed May 13 03:35:59 +0000 2020,#SD28 Update https://t.co/nwCyStMkgR
1260408090626683000,Wed May 13 03:14:40 +0000 2020,#CA25 Update https://t.co/6gclbXzSQr
1260406135086960600,Wed May 13 03:06:54 +0000 2020,#CA25 Update https://t.co/QimngHkBR0
1260381864621039600,Wed May 13 01:30:27 +0000 2020,NEW FEC F2 Christopher Charles Cumings (NON) #AKSEN (R-Sullivan)  https://t.co/AhkncTBHxg https://t.co/Zb76Ve5PaC
1260336478086770700,Tue May 12 22:30:06 +0000 2020,NEW FEC F24 314 ACTION FUND $110,080-&gt; #NY01 https://t.co/BiMhhyZOX7 https://t.co/ENB66NBZXK
1260335310124146700,Tue May 12 22:25:28 +0000 2020,NEW FEC F2 Nicholas Betts (DEM) #VA06 (R-Cline)  https://t.co/VsjHtLIPRt https://t.co/5WIFJxzCFi
1260333960250327000,Tue May 12 22:20:06 +0000 2020,LOGGED NEW SENATE VOTE (00088) Troy D. Edgar, of California, to be Chief Financial Offi... https://t.co/EZzQPdGX3l https://t.co/C6JiSP6svz
1260329029879558100,Tue May 12 22:00:31 +0000 2020,NEW FEC F2 Elise Hatsuko Kaneshiro (REP) #HI02 (D-Gabbard)  https://t.co/V80o5BnXrv https://t.co/vnBKfQKg1x
1260323890129035300,Tue May 12 21:40:05 +0000 2020,NEW FEC F24 GREAT AMERICA PAC $100,000-&gt; #POTUS https://t.co/9XegzUh0rb https://t.co/02FGm9UYab
1260316349517054000,Tue May 12 21:10:07 +0000 2020,NEW FEC F24 HUMAN RIGHTS CAMPAIGN EQUALITY VOTES $14,764-&gt; #POTUS https://t.co/Nbg9xvxvLb https://t.co/O7j5Ic3MbZ
1260315185035702300,Tue May 12 21:05:30 +0000 2020,NEW FEC F2 Neil J Mavis (REP) #OKSEN (R-Inhofe)  https://t.co/31pUDD9vZu https://t.co/7sbAUADlTZ
1260308884033433600,Tue May 12 20:40:28 +0000 2020,NEW FEC F2 Shawn Begin (REP) #CTSEN   https://t.co/hwGI9fg9DW https://t.co/n91m2y5M2U
1260302505126187000,Tue May 12 20:15:07 +0000 2020,NEW FEC F24 RIGHT TO LIFE/OREGON PAC $30,514-&gt; #OR02 https://t.co/oTPsDP5fP3 https://t.co/yXLLb5OpwT
1260293705673478100,Tue May 12 19:40:09 +0000 2020,LOGGED NEW SENATE VOTE (00087) Troy D. Edgar, of California, to be Chief Financial Offi... https://t.co/HEIudCPYkU https://t.co/L6MtRAQlRh
1260291175568699400,Tue May 12 19:30:05 +0000 2020,NEW FEC F24 HOLD THE HOUSE PAC $10,947-&gt; #CA45 https://t.co/DcmYVnosQJ https://t.co/PLiY3R9bdj
1260273574834667500,Tue May 12 18:20:09 +0000 2020,LOGGED NEW SENATE VOTE (00086) Brian D. Montgomery, of Texas, to be Deputy Secretary of... https://t.co/nbT4Yghdwf https://t.co/RRoUA2w7HK
1260272301775319000,Tue May 12 18:15:06 +0000 2020,NEW FEC F24 COMMITTEE TO PROTECT MEDICARE PAC $24,223-&gt; #POTUS https://t.co/NZSHH8M2Ks https://t.co/SRpKfDOa6T
1260248464937504800,Tue May 12 16:40:22 +0000 2020,NEW FEC F24 DITCH FUND $27,002-&gt; #KYSEN https://t.co/4HXv73gZhJ https://t.co/Wk9ZNV9pEV
1260247236203606000,Tue May 12 16:35:30 +0000 2020,NEW FEC F2 Jeffrey L. Fortenberry (REP) #NE01 (R-Fortenberry)  https://t.co/jWdEuvIqIT https://t.co/tWVv2HHk6r
1260235864220725200,Tue May 12 15:50:18 +0000 2020,NEW FEC F5  $250,750 -&gt; #NM03 https://t.co/LlMdIK8Omd https://t.co/sWJ7mpu4vL
1260235825536626700,Tue May 12 15:50:09 +0000 2020,NEW FEC F3X NATIONAL ASSOCIATION OF REALTORS CONGRESSIONAL ... RCPT $1,712 EXPN $1,712 COH $221,123… https://t.co/wMBPbGA7kz
1260211991278305300,Tue May 12 14:15:26 +0000 2020,NEW HOUSE CAND FINANCIAL DISCLOSURE CANDIDATE REPORT Eugene Lacy Watson #WV03 https://t.co/pNwLWEAGdL https://t.co/4qZnNju5gC
1260211958524948500,Tue May 12 14:15:19 +0000 2020,NEW HOUSE CAND FINANCIAL DISCLOSURE  Amanda Makki #FL13 https://t.co/w5uper7xb7 https://t.co/KDv7oKsvX8
1260211913775964200,Tue May 12 14:15:08 +0000 2020,NEW HOUSE CAND FINANCIAL DISCLOSURE  Bill Clifford #KS01 https://t.co/psSdA4wTeY https://t.co/mqHgyXXtlP
1260191775391543300,Tue May 12 12:55:07 +0000 2020,NEW FEC F1 Remove That Idiot  https://t.co/jHp2Yds9UX https://t.co/stz4ne0Pqe
1260042052332474400,Tue May 12 03:00:10 +0000 2020,NEW DNS REGISTRATIONS - 2020-05-12 https://t.co/8BlKhLeI6d
1260038271272288300,Tue May 12 02:45:08 +0000 2020,NEW FEC F5 AMERICANS FOR CONSTITUTIONAL LIBERTY DBA THE CO... $14,513 -&gt; #POTUS https://t.co/a6bDRK2nnj https://t.co/DKLFRiFzDo
1260013093377110000,Tue May 12 01:05:06 +0000 2020,NEW FEC F1 Hold Your Nose and Vote  https://t.co/7DRAvH2WMW https://t.co/ySzmVvh4s2
1259991705735950300,Mon May 11 23:40:06 +0000 2020,LOGGED NEW SENATE VOTE (00085) Brian D. Montgomery, of Texas, to be Deputy Secretary of... https://t.co/zR60uxo2dk https://t.co/ufY14KMhme
1259956486345650200,Mon May 11 21:20:09 +0000 2020,NEW FEC F24 SIERRA CLUB INDEPENDENT ACTION $21,762-&gt; #POTUS https://t.co/Y9KRNoXpnA https://t.co/YX6yPCXYgX
1259938868670771200,Mon May 11 20:10:09 +0000 2020,NEW FEC F24 NATIONAL RIFLE ASSOCIATION OF AMERICA POLITICAL... $10,635-&gt; #POTUS #NCSEN https://t.co/HDJp1iHalW https://t.co/4pppcIkSzO
1259914947791696000,Mon May 11 18:35:06 +0000 2020,NEW FEC F24 CHC BOLD PAC $424,953-&gt; #NM03 https://t.co/0yYd4weiGl https://t.co/HeVgOvlLrV
1259904878513549300,Mon May 11 17:55:05 +0000 2020,NEW FEC F24 WOMEN VOTE! $44,510-&gt; #NM03 https://t.co/hJa5bPoaqu https://t.co/tFnYVsPw89
1259899844618944500,Mon May 11 17:35:05 +0000 2020,NEW FEC F24 GRIT PAC $87,963-&gt; #ALSEN https://t.co/kQK5uybI1v https://t.co/O9McNCgrcE
1259896075147792400,Mon May 11 17:20:06 +0000 2020,NEW FEC F1 Harris Victory Fund  https://t.co/kmz2cj72yQ https://t.co/VRryR7LUPW
1259875945797705700,Mon May 11 16:00:07 +0000 2020,NEW FEC F24 THE COMMITTEE TO DEFEND THE PRESIDENT $32,574-&gt; #POTUS https://t.co/3K28LNFAcv https://t.co/VPaSvR4P8u
1259855915739689000,Mon May 11 14:40:31 +0000 2020,NEW FEC F2 Laura Lombard (DEM) #KS04 (R-Estes)  https://t.co/yCA8e67DRR https://t.co/0DRjxogpQN
1259849512606204000,Mon May 11 14:15:05 +0000 2020,NEW HOUSE CAND FINANCIAL DISCLOSURE CANDIDATE REPORT Chip Winter Coldiron #IN03 https://t.co/WhXldTLjGk https://t.co/zAp8jvDgK5
1259835781801115600,Mon May 11 13:20:31 +0000 2020,NEW FEC F2 ARTICIA BOMER (REP) #MI13 (D-Tlaib)  https://t.co/sfDGqLmKqT https://t.co/sKlGQ78Ip4
1259821838659551200,Mon May 11 12:25:07 +0000 2020,NEW FEC F24 1820 PAC $1,001,997-&gt; #MESEN https://t.co/XOfa4udtD5 https://t.co/tMwLcymDd9
1259694762581389300,Mon May 11 04:00:10 +0000 2020,NEW DNS REGISTRATIONS - 2020-05-11 https://t.co/Ap3HJmnxgi
1259653215269707800,Mon May 11 01:15:04 +0000 2020,NEW FEC F6 BUEHLER, KNUTE (REP-Open) #OR02  https://t.co/d4MSpVtdgC https://t.co/Ow82pAAGTJ
1259599120492163000,Sun May 10 21:40:07 +0000 2020,NEW FEC F1 #GASEN Friends of Candidate committee  https://t.co/VGs4tODPLu https://t.co/krKS1XabtC
1259597987333849000,Sun May 10 21:35:37 +0000 2020,NEW FEC F2 Tricia Carpenter McCracken (DEM) #GASEN (R-Perdue)  https://t.co/nhBuARFrLo https://t.co/kzZPaZeSwP
1259332373449068500,Sun May 10 04:00:09 +0000 2020,NEW DNS REGISTRATIONS - 2020-05-10 https://t.co/Wn0XuVHSQN
1259305935580696600,Sun May 10 02:15:06 +0000 2020,NEW FEC F24 AMERICA FIRST ACTION, INC. $606,105-&gt; #POTUS https://t.co/OJxXSBOfJ4 https://t.co/hlPRFqP8EB
1259260638146072600,Sat May 09 23:15:06 +0000 2020,NEW FEC F24 SMP $136,345-&gt; #MESEN https://t.co/9azzT7vukN https://t.co/AddCJ39GHn
1259239246457475000,Sat May 09 21:50:06 +0000 2020,NEW FEC F24 UNITE THE COUNTRY $21,689-&gt; #POTUS https://t.co/QjKhgEvC9e https://t.co/poSMv5e1b3
1259216597597606000,Sat May 09 20:20:06 +0000 2020,NEW FEC F24 CONGRESSIONAL LEADERSHIP FUND https://t.co/vJOLu2Qst8 https://t.co/ljmfiBxN0h
1259197718125088800,Sat May 09 19:05:05 +0000 2020,NEW FEC F24 PROTECT FREEDOM POLITICAL ACTION COMMITTEE $25,000-&gt; #KY04 https://t.co/GCRlbuXTDv https://t.co/STtaxnDJGf
1259158718966464500,Sat May 09 16:30:07 +0000 2020,NEW FEC F24 THE LINCOLN PROJECT $131,460-&gt; #AZSEN https://t.co/8VyLJQ2HHI https://t.co/UXNZmnXL3e
1259143740322545700,Sat May 09 15:30:36 +0000 2020,NEW FEC F2 ANNE KERNER (DEM) #DE00 (D-Blunt Rochester)  https://t.co/cWt3M3a34O https://t.co/WCGpnzmkrz
1258969989471629300,Sat May 09 04:00:10 +0000 2020,NEW DNS REGISTRATIONS - 2020-05-09 https://t.co/byUghVfl1s
1258946164860190700,Sat May 09 02:25:30 +0000 2020,NEW FEC F2 Mark J. Powell (DEM) #IN09 (R-Hollingsworth)  https://t.co/K5UCsXkvsM https://t.co/MakGrA4kaM
1258937256846356500,Sat May 09 01:50:06 +0000 2020,NEW FEC F24 CONGRESSIONAL LEADERSHIP FUND https://t.co/3hox0iRaxc https://t.co/Ir6eN9TBCB
1258929807917609000,Sat May 09 01:20:30 +0000 2020,NEW FEC F2 Albert Oram (NPA) #FL01 (R-Gaetz)  https://t.co/cGaBehp3Lw https://t.co/gFdb3doSou
1258915866931937300,Sat May 09 00:25:06 +0000 2020,NEW FEC F24 COURAGE CAMPAIGN SUPER PAC https://t.co/hnVtpDeVNz https://t.co/h4c5m2vWTR
1258900767546634200,Fri May 08 23:25:06 +0000 2020,NEW FEC F24 OREGON RIGHT TO LIFE VICTORY PAC $31,748-&gt; #OR02 https://t.co/2fk7vhAUNV https://t.co/cud4yqasEi
1258881892264239000,Fri May 08 22:10:06 +0000 2020,NEW FEC F24 ALLIANCE FOR A BETTER MINNESOTA FEDERAL PAC $344,307-&gt; #POTUS https://t.co/Ru1Aokonll https://t.co/wibhiPasWu
1258880631586427000,Fri May 08 22:05:06 +0000 2020,NEW FEC F24 SOMOS PAC $30,000-&gt; #AZSEN #POTUS https://t.co/8wokwSkd6M https://t.co/pPgxjK2xl2
1258876967471861800,Fri May 08 21:50:32 +0000 2020,NEW FEC F2 Tiffany Ann Watson (DEM) #NV03 (D-Lee) '20 @NRCC target  https://t.co/HdkJNtjLzj https://t.co/nPckaYOkFH
1258875599780589600,Fri May 08 21:45:06 +0000 2020,NEW FEC F24 NATIONAL RIFLE ASSOCIATION OF AMERICA POLITICAL... https://t.co/O1J9IwBshU https://t.co/XEH3uU9VFN
1258865538207367200,Fri May 08 21:05:07 +0000 2020,NEW FEC F24 RESTORATION PAC $123,500-&gt; #POTUS https://t.co/8OIdemHaTy https://t.co/t8Utu6I19M
1258850557558579200,Fri May 08 20:05:35 +0000 2020,NEW FEC F2 JOSH EISEN (IND) #NY17 (D-Lowey)  https://t.co/tPeCTeiAlI https://t.co/7DPMbWLFnT
1258844244141195300,Fri May 08 19:40:30 +0000 2020,NEW FEC F2 Jason Ross (REP) #TX04 (R-Ratcliffe)  https://t.co/DUyObVAhgh https://t.co/3Ac11df7Zd
1258840474950852600,Fri May 08 19:25:32 +0000 2020,NEW FEC F2 Philip MacRuari (UN) #NY02 (R-King) '20 @DCCC target  https://t.co/dTn6gbYsDY https://t.co/tmYTMW4fgA
1258835347414237200,Fri May 08 19:05:09 +0000 2020,NEW FEC F24 https://t.co/7Ej2jMYjnw POLITICAL ACTION $13,003-&gt; #POTUS https://t.co/AtmWI0QNYr https://t.co/go6VMWb80b
1258832812267864000,Fri May 08 18:55:05 +0000 2020,NEW FEC F24 SECURE THE BORDER SUPERPAC https://t.co/DtlnD2B1kG https://t.co/snJ8OIxBOg
1258831568694505500,Fri May 08 18:50:08 +0000 2020,NEW FEC F3X COALITION FOR AMERICAN VETERANS POLITICAL ACTIO... RCPT $222,608 EXPN $229,109 COH $140,645… https://t.co/gW7yEGxmal
1258816459297288200,Fri May 08 17:50:06 +0000 2020,NEW FEC F24 CLUB FOR GROWTH ACTION $11,066-&gt; #OR02 https://t.co/acHAlCYfmW https://t.co/D6t646jmHJ
1258812681345044500,Fri May 08 17:35:05 +0000 2020,NEW FEC F5  $50,000 -&gt; #NM03 https://t.co/wpZCAqzBQi https://t.co/NrRodwKQna
1258808962721263600,Fri May 08 17:20:18 +0000 2020,NEW FEC F24 NEW JOURNEY PAC, INC. $41,284-&gt; #POTUS https://t.co/M4o92TdEiM https://t.co/U8ezPDtFID
1258808924448256000,Fri May 08 17:20:09 +0000 2020,NEW FEC F24 REPUBLICAN LEADERSHIP FOR OREGON $162,497-&gt; #OR02 https://t.co/zvDdZQad34 https://t.co/D0niFoqGIU
1258805132881391600,Fri May 08 17:05:05 +0000 2020,NEW FEC F24 WOMEN VOTE! $42,391-&gt; #NM03 https://t.co/30upQlYoKg https://t.co/ygJ630UcO5
1258799505769590800,Fri May 08 16:42:44 +0000 2020,NEW FEC F1 #POTUS Amash for America Exploratory Committee  https://t.co/NxjeBDWU7i https://t.co/9PfnRVhp37
1258799463478390800,Fri May 08 16:42:34 +0000 2020,NEW FEC F2 Justin Amash (LIB) #POTUS (REP-TRUMP)  https://t.co/tLGRBNylz5 https://t.co/Ssp7kMwJ7l
1258791348766818300,Fri May 08 16:10:19 +0000 2020,NEW FEC F24 SENATE CONSERVATIVES FUND $11,134-&gt; #WYSEN https://t.co/e0PZfVPAVX https://t.co/YN8vVlap11
1258791300532285400,Fri May 08 16:10:07 +0000 2020,NEW FEC F24 SENATE CONSERVATIVES FUND $11,223-&gt; #NHSEN https://t.co/um2MM2sLYd https://t.co/dotDZkQ5h5
1258788790371405800,Fri May 08 16:00:09 +0000 2020,NEW FEC F24 SENATE CONSERVATIVES FUND $11,526-&gt; #MTSEN https://t.co/IYl6wJwa4O https://t.co/RTuTEXdXDj
1258787523297345500,Fri May 08 15:55:07 +0000 2020,NEW FEC F24 SENATE CONSERVATIVES FUND $11,128-&gt; #MISEN https://t.co/GZJAfyZwhd https://t.co/H7gXTS2Dzx
1258783776190029800,Fri May 08 15:40:13 +0000 2020,NEW FEC F24 HOUSE FREEDOM FUND $10,288-&gt; #IL06 https://t.co/HuBKyWjQVZ https://t.co/XwvtvZg0VD
1258782650505941000,Fri May 08 15:35:45 +0000 2020,NEW FEC F2 Nicholas Jones (REP) #ID01 (R-Fulcher)  https://t.co/ogDdKH686Y https://t.co/7SquOxohQa
1258782509367615500,Fri May 08 15:35:11 +0000 2020,NEW FEC F24 HOUSE FREEDOM FUND $10,233-&gt; #GA07 https://t.co/kE6p2qBW6v https://t.co/oM41DvjUbg
1258781254201139200,Fri May 08 15:30:12 +0000 2020,NEW FEC F24 HOUSE FREEDOM FUND $10,151-&gt; #AL02 https://t.co/Gd2Mm3NcAQ https://t.co/55gq6DC6dO
1258778719331553300,Fri May 08 15:20:08 +0000 2020,NEW FEC F24 HOUSE FREEDOM ACTION $232,692-&gt; #NM02 https://t.co/jJCZiR97IW https://t.co/iax7GO37FK
1258777483970613200,Fri May 08 15:15:13 +0000 2020,NEW HOUSE CAND FINANCIAL DISCLOSURE CANDIDATE REPORT Jamie Byers #CA04 https://t.co/lPeULEbn3x https://t.co/jc3mtiR0cF
1258777452521812000,Fri May 08 15:15:06 +0000 2020,NEW HOUSE CAND FINANCIAL DISCLOSURE  Amanda Adkins #KS03 https://t.co/Xfi38vrKge https://t.co/BeLOLiwlUo
1258601295025299500,Fri May 08 03:35:07 +0000 2020,NEW FEC F24 NATIONAL RIFLE ASSOCIATION OF AMERICA POLITICAL... https://t.co/NoQ3njWBeT https://t.co/c7kRGnK2W6
1258592506704347100,Fri May 08 03:00:11 +0000 2020,NEW DNS REGISTRATIONS - 2020-05-08 https://t.co/dNu5jFBY9s
1258559769029173200,Fri May 08 00:50:06 +0000 2020,NEW FEC F24 NATIONAL RIGHT TO LIFE VICTORY FUND https://t.co/poUmSX5ICc https://t.co/fx28p0SS1P
1258552216488603600,Fri May 08 00:20:05 +0000 2020,NEW FEC F24 CONGRESSIONAL LEADERSHIP FUND $18,407-&gt; #CA25 https://t.co/2kMX8cbOeS https://t.co/oSwCPYSsO8
1258545931588268000,Thu May 07 23:55:07 +0000 2020,NEW FEC F24 CHC BOLD PAC $169,084-&gt; #IN01 https://t.co/X9DYwHzeMq https://t.co/nTj1GvLexL
1258514474157269000,Thu May 07 21:50:07 +0000 2020,NEW FEC F24 SMP $717,297-&gt; #MESEN #MISEN https://t.co/Hvkoz3Okgh https://t.co/e8HojqwYjd
1258509467273973800,Thu May 07 21:30:13 +0000 2020,NEW FEC F24 SIERRA CLUB INDEPENDENT ACTION $42,031-&gt; #POTUS https://t.co/xvB0rATU3i https://t.co/3WTaKnIF97
1258491831400034300,Thu May 07 20:20:08 +0000 2020,NEW FEC F5 AMERICANS FOR CONSTITUTIONAL LIBERTY DBA THE CO... $35,985 -&gt; #POTUS https://t.co/mHRmmUfD3Q https://t.co/Us7l4gxTAF
1258476719670849500,Thu May 07 19:20:05 +0000 2020,LOGGED NEW SENATE VOTE (00084) A joint resolution to direct the removal of United State... https://t.co/a9rbiHMkjo https://t.co/e1bovFWipr
1258470425291485200,Thu May 07 18:55:05 +0000 2020,NEW FEC F24 PAC FOR A CHANGE $25,000-&gt; #CA25 https://t.co/2VTbUhq39h https://t.co/98hn1OyD99
1258441534732550100,Thu May 07 17:00:17 +0000 2020,NEW FEC F24 PRIORITIES USA ACTION $1,899,701-&gt; #POTUS https://t.co/aaZREpxCdC https://t.co/QKpkfuRpFX
1258432680120578000,Thu May 07 16:25:06 +0000 2020,NEW FEC F24 COMMITTEE FOR STRONGER RURAL COMMUNITIES, INC. $46,849-&gt; #MN07 https://t.co/3OVWwflbgf https://t.co/4JaoFIbzgu
1258430161042550800,Thu May 07 16:15:05 +0000 2020,NEW FEC F24 THE LINCOLN PROJECT $21,850-&gt; #POTUS https://t.co/u9ao23GR6W https://t.co/evXd498jKq
1258418838422446000,Thu May 07 15:30:06 +0000 2020,NEW FEC F24 KEEP KANSAS GREAT PAC $23,238-&gt; #KSSEN https://t.co/MQUVQgUcwR https://t.co/e1E4qHWQt9
1258415075464933400,Thu May 07 15:15:08 +0000 2020,NEW FEC F3X THE CAPITAL GROUP COMPANIES INC POLITICAL ACTIO... RCPT $610,500 EXPN $0 COH $909,600… https://t.co/QdAvMInoNf
1258400016864952300,Thu May 07 14:15:18 +0000 2020,NEW HOUSE CAND FINANCIAL DISCLOSURE WITHDRAWAL OF CANDIDACY Kenneth F. Morgan #OH06 https://t.co/v4McYKd93T https://t.co/asOuCx0CTj
1258399987827794000,Thu May 07 14:15:11 +0000 2020,NEW HOUSE CAND FINANCIAL DISCLOSURE WITHDRAWAL OF CANDIDACY John J. Flora #NJ10 https://t.co/DVOcCRuAzr https://t.co/VuedC3HBKY
1258399951404425200,Thu May 07 14:15:03 +0000 2020,NEW HOUSE CAND FINANCIAL DISCLOSURE WITHDRAWAL OF CANDIDACY Angela Cunningham #WI01 https://t.co/CxjK5Pt9x5 https://t.co/y2YGrMRR7D
1258397452954038300,Thu May 07 14:05:07 +0000 2020,NEW FEC F24 CLUB FOR GROWTH ACTION $10,436-&gt; #IN05 https://t.co/9nLSy0Yv6x https://t.co/qzlD6sOTjy
1258394973373751300,Thu May 07 13:55:16 +0000 2020,NEW FEC F24 REPUBLICAN LEADERSHIP FOR OREGON $14,223-&gt; #OR02 https://t.co/QNb0EPqnBQ https://t.co/n64sXgoARD
1258394933146210300,Thu May 07 13:55:06 +0000 2020,NEW FEC F24 REPUBLICAN LEADERSHIP FOR OREGON $13,957-&gt; #OR02 https://t.co/hwWLEouhYW https://t.co/c4lOu52MG2
