id,created_at,text
1250474161375334400,Wed Apr 15 17:20:47 +0000 2020,NEW FEC F3 FARLEY, CHELE CHIAVACCI (REP) #NY18  RCPT $101,904 EXPN $85,631 COH $258,391 https://t.co/2a3Wj9U5Sw https://t.co/yFe4bHpV6O
1250474107562410000,Wed Apr 15 17:20:34 +0000 2020,NEW FEC F3 LEVIN, MIKE (DEM-Inc) #CA49  RCPT $375,480 EXPN $186,958 COH $1,479,811 https://t.co/JlOLyrFlDs https://t.co/qF9ALyJzeM
1250474057499209700,Wed Apr 15 17:20:22 +0000 2020,NEW FEC F3 COOKINGHAM, KEVIN (REP) #CA16  RCPT $10,962 EXPN $18,203 COH $6,003 https://t.co/LVOXnUFwca https://t.co/1Sk9b1wCGU
1250474004583821300,Wed Apr 15 17:20:10 +0000 2020,NEW FEC F3X RED TO BLUE CA RCPT $42,639 EXPN $28,320 COH $79,327 https://t.co/bs8z6E907n https://t.co/pFHsqz2R8s
1250472998311612400,Wed Apr 15 17:16:10 +0000 2020,NEW FEC F3 RAMON CABALLERO, JOSE IIII (DEM-Open) #CA53  RCPT $404 EXPN $643 COH $1,203 https://t.co/dw5IvpTLUf https://t.co/lixp0YKcP3
1250472948630057000,Wed Apr 15 17:15:58 +0000 2020,NEW FEC F3 SCHWEIKERT, DAVID S. (REP-Inc) #AZ06  RCPT $220,820 EXPN $272,991 COH $226,287 https://t.co/uO3bbgjLZw https://t.co/3qaiIs2b0S
1250472898571067400,Wed Apr 15 17:15:46 +0000 2020,NEW FEC F3 CORNYN, JOHN SEN (REP-Inc) #TXSEN  RCPT $1,529,689 EXPN $652,490 COH $12,885,497 https://t.co/nouIqFxVGw https://t.co/lqzf9fO85e
1250472848415588400,Wed Apr 15 17:15:34 +0000 2020,NEW FEC F3 MARKEY, EDWARD J. SEN. (DEM-Inc) #MASEN  RCPT $1,185,858 EXPN $1,307,207 COH $4,429,102… https://t.co/8o2kVCEeP0
1250472797781889000,Wed Apr 15 17:15:22 +0000 2020,NEW FEC F3 NAPOLITANO, GRACE (DEM-Inc) #CA32  RCPT $42,912 EXPN $20,817 COH $482,089 https://t.co/SP62sBpIt7 https://t.co/HbLjSwh0Nz
1250472745688633300,Wed Apr 15 17:15:09 +0000 2020,NEW FEC F3 LONDRIGAN, BETSY DIRKSEN (DEM) #IL13  RCPT $314,547 EXPN $46,905 COH $1,600,582 https://t.co/JvB1iDqDqq https://t.co/sZkDNzUAEi
1250471645661163500,Wed Apr 15 17:10:47 +0000 2020,NEW FEC F3 DEBELLO, JAMES (REP) #CA52  RCPT $6,605 EXPN $7,361 COH $238,112 https://t.co/DPYSGP98Uu https://t.co/vjsMjnIwu0
1250471592401854500,Wed Apr 15 17:10:34 +0000 2020,NEW FEC F3 SPARTZ, VICTORIA (REP-Open) #IN05  RCPT $759,705 EXPN $213,042 COH $546,663 https://t.co/f8bBbGOzYQ https://t.co/5loe53eyFb
1250471542326046700,Wed Apr 15 17:10:22 +0000 2020,NEW FEC F3 MOTIWALLA, FRANCES YASMEEN (DEM) #CA34  RCPT $5,276 EXPN $22,734 COH $9,717 https://t.co/hGc2eDTeHM https://t.co/3iqiHxhM4E
1250471486428594200,Wed Apr 15 17:10:09 +0000 2020,NEW FEC F3 BARRAGAN, NANETTE (DEM-Inc) #CA44  RCPT $88,076 EXPN $43,661 COH $843,969 https://t.co/scXiIOPf9m https://t.co/7mzc5MWFVZ
1250470536590659600,Wed Apr 15 17:06:23 +0000 2020,NEW FEC F3 GROSS, AL DR. (IND) #AKSEN  RCPT $1,015,612 EXPN $424,349 COH $2,009,403 https://t.co/G5BMgdqNch https://t.co/7SP1TdbZ05
1250470486493950000,Wed Apr 15 17:06:11 +0000 2020,NEW FEC F3 O'MARA, WILLIAM EDWARD DR IV (DEM) #CA42  RCPT $7,576 EXPN $7,801 COH $13,451 https://t.co/XE1RwPq1Wr https://t.co/LaBV4lQGz5
1250470436640415700,Wed Apr 15 17:05:59 +0000 2020,NEW FEC F3 MENG, GRACE (DEM-Inc) #NY06  RCPT $287,851 EXPN $151,743 COH $1,197,711 https://t.co/VnxeYTYagT https://t.co/O5iuMixPx5
1250470385910345700,Wed Apr 15 17:05:47 +0000 2020,FEC MAJOR CONTRIBUTOR ($100K+) MCDONALDS CORPORATION POLITICAL ACTION COMMITTEE https://t.co/urwHOO3M33 https://t.co/j70fpx2Aup
1250470329715011600,Wed Apr 15 17:05:33 +0000 2020,NEW FEC F3X MCDONALDS CORPORATION POLITICAL ACTION COMMITTEE RCPT $12,687 EXPN $161,857 COH $78,366… https://t.co/MR5uXRIlbL
1250470278737481700,Wed Apr 15 17:05:21 +0000 2020,NEW FEC F3X WE ARE GREAT AGAIN PAC RCPT $778,471 EXPN $772,443 COH $126,265 https://t.co/pTmZK8iTnd https://t.co/nWnRr3WZNO
1250470228355510300,Wed Apr 15 17:05:09 +0000 2020,NEW FEC F3 KEEP THE SENATE RED RCPT $1,359,589 EXPN $1,770,971 COH $16,979 https://t.co/FkawKMt3RG https://t.co/aL79KbjZaT
1250467826004971500,Wed Apr 15 16:55:36 +0000 2020,NEW FEC F3 KENNEDY, BRYNNE (DEM) #CA04  RCPT $243,641 EXPN $221,418 COH $228,785 https://t.co/pmmS09RFgC https://t.co/oYNpg2SbK1
1250467773932695600,Wed Apr 15 16:55:24 +0000 2020,NEW FEC F3 GARAMENDI, JOHN (DEM-Inc) #CA03  RCPT $93,210 EXPN $136,068 COH $922,864 https://t.co/IPVLmIfBVl https://t.co/eERlmJCcVg
1250467721952628700,Wed Apr 15 16:55:12 +0000 2020,NEW FEC F3 CONSERVATIVE SQUAD RCPT $3,059 EXPN $6,169 COH $48 https://t.co/07kASVCj2Q https://t.co/73NMyXRfEi
1250466600559333400,Wed Apr 15 16:50:44 +0000 2020,NEW FEC F3 BURDICK, JEFF (DEM) #CA07  RCPT $12,574 EXPN $13,682 COH $0 https://t.co/zKfb1IZOLS https://t.co/MXBYDXE5if
1250466548600279000,Wed Apr 15 16:50:32 +0000 2020,NEW FEC F2 angela stanton king (REP) #GA05 (D-Lewis)  https://t.co/gqp5H5OH5q https://t.co/y1zWXf2r3B
1250464087277842400,Wed Apr 15 16:40:45 +0000 2020,NEW FEC F3 PETERS, SCOTT (DEM-Inc) #CA52  RCPT $227,804 EXPN $145,782 COH $1,960,596 https://t.co/Eq8S9XA0PH https://t.co/VNMvj2ZCCd
1250464037755707400,Wed Apr 15 16:40:33 +0000 2020,NEW FEC F3 LOOMER, LAURA (REP) #FL21  RCPT $204,786 EXPN $193,410 COH $126,710 https://t.co/mmEYRrocKn https://t.co/VeNAFhildA
1250463988338454500,Wed Apr 15 16:40:21 +0000 2020,NEW FEC F3 IVES, JEANNE (REP) #IL06  RCPT $202,199 EXPN $211,654 COH $366,221 https://t.co/vG9JIGLa6j https://t.co/fdjs55ojf0
1250463938581389300,Wed Apr 15 16:40:10 +0000 2020,NEW FEC F3 SWALWELL, ERIC MICHAEL (DEM-Inc) #CA15  RCPT $157,971 EXPN $112,707 COH $243,186 https://t.co/vgaerTz8fO https://t.co/OIwFj2fOga
1250462774737514500,Wed Apr 15 16:35:32 +0000 2020,NEW FEC F3 JONES, GINA ORTIZ (DEM-Open) #TX23  RCPT $603,262 EXPN $234,128 COH $2,377,836 https://t.co/GVrirPtXxf https://t.co/NUpc86oQM6
1250462725064413200,Wed Apr 15 16:35:20 +0000 2020,NEW FEC $100K+ CONTRIBUTIONS DOWNTOWN FOR DEMOCRACY INDEPENDENT EXPENDITURE ... https://t.co/75UFrbaFnX https://t.co/jxL5CkbXcr
1250462676238532600,Wed Apr 15 16:35:09 +0000 2020,NEW FEC F3X DOWNTOWN FOR DEMOCRACY INDEPENDENT EXPENDITURE ... RCPT $593,040 EXPN $561,790 COH $344,365… https://t.co/N2hzs360QJ
1250461620205023200,Wed Apr 15 16:30:57 +0000 2020,NEW FEC F3 KATKO, JOHN M (REP-Inc) #NY24  RCPT $313,296 EXPN $182,541 COH $1,191,524 https://t.co/kgWH2uMgUx https://t.co/SEFh9kyRaF
1250461571098136600,Wed Apr 15 16:30:45 +0000 2020,NEW FEC F3 REZIN, SUE (REP) #IL14  RCPT $180,995 EXPN $262,387 COH $3,462 https://t.co/TAHc34HK3I https://t.co/qVGCOYLlKd
1250461521185919000,Wed Apr 15 16:30:33 +0000 2020,NEW FEC F3 RASHID, QASIM (DEM) #VA01  RCPT $271,857 EXPN $145,890 COH $125,968 https://t.co/gIsB3q2gzM https://t.co/iGu2y6qZsf
1250461470451585000,Wed Apr 15 16:30:21 +0000 2020,NEW FEC F3 DONALDS, BYRON (REP-Open) #FL19  RCPT $338,163 EXPN $116,862 COH $221,302 https://t.co/W88sxmGi33 https://t.co/kqkfxAkQjh
1250461420048674800,Wed Apr 15 16:30:09 +0000 2020,NEW FEC F3 WALL, KATHALEEN (REP-Open) #TX22  RCPT $1,233,291 EXPN $1,206,347 COH $65,390 https://t.co/kAEleUMQyw https://t.co/SoM2Qqjwz2
1250460513915396000,Wed Apr 15 16:26:33 +0000 2020,NEW FEC F3 COTTON, THOMAS (REP-Inc) #ARSEN  RCPT $546,725 EXPN $175,400 COH $4,878,235 https://t.co/p3x4CVf1T7 https://t.co/8jdsErIb0M
1250460463202070500,Wed Apr 15 16:26:21 +0000 2020,NEW FEC F3 MCNERNEY, GERALD MARK (DEM-Inc) #CA09  RCPT $106,538 EXPN $47,100 COH $435,095 https://t.co/SH7m0f7YQI https://t.co/3lCL7fIEdl
1250460414036463600,Wed Apr 15 16:26:09 +0000 2020,NEW FEC F3 MURPHY, STEPHANIE (DEM-Inc) #FL07  RCPT $320,168 EXPN $107,942 COH $1,317,096 https://t.co/yN5rLVjYdn https://t.co/kVA6hDJLRr
1250460364875001900,Wed Apr 15 16:25:58 +0000 2020,NEW FEC F3 YOUNG, DONALD E (REP-Inc) #AK00  RCPT $212,530 EXPN $82,067 COH $803,576 https://t.co/zYPmWcy4fX https://t.co/0AILYdTqXD
1250460315235405800,Wed Apr 15 16:25:46 +0000 2020,NEW FEC F3 STEVENS, HALEY (DEM-Inc) #MI11  RCPT $583,199 EXPN $209,066 COH $2,447,866 https://t.co/052nFmZUbb https://t.co/AtIXol9uGK
1250460264597602300,Wed Apr 15 16:25:34 +0000 2020,NEW FEC F3 MAURO, EDDIE J (DEM) #IASEN  RCPT $499,151 EXPN $1,896,393 COH $17,181 https://t.co/cSyR7cZAaA https://t.co/3aLGYcqxLO
1250460214026891300,Wed Apr 15 16:25:22 +0000 2020,NEW FEC F3 COOK, PAUL (REP-Inc) #CA08  RCPT $0 EXPN $13,877 COH $46,190 https://t.co/9LMiKc8Zd6 https://t.co/tjfZSSa1wH
1250460162931867600,Wed Apr 15 16:25:09 +0000 2020,NEW FEC F3X STOP REPUBLICANS RCPT $7,988,512 EXPN $9,317,454 COH $774,099 https://t.co/qj70N1qpfr https://t.co/h8VxjillkS
1250457746945626000,Wed Apr 15 16:15:33 +0000 2020,NEW FEC F3 DAVIS, WENDY (DEM) #TX21  RCPT $861,701 EXPN $221,989 COH $1,953,756 https://t.co/Ec3soZ86P5 https://t.co/lil70QGTFZ
1250457697486422000,Wed Apr 15 16:15:22 +0000 2020,NEW FEC F3 RUBIO, MARCO (REP-Inc) #FLSEN  RCPT $208,952 EXPN $47,472 COH $1,042,003 https://t.co/RHzWsVQjIX https://t.co/rHDbDr3EEs
1250457647431598000,Wed Apr 15 16:15:10 +0000 2020,NEW FEC F3 BUSTOS, CHERI (DEM-Inc) #IL17  RCPT $222,815 EXPN $108,366 COH $3,310,245 https://t.co/XfF6vK49jM https://t.co/93eNoqRAG3
1250456388096032800,Wed Apr 15 16:10:09 +0000 2020,NEW FEC F3X INT'L ASSOCIATION OF BRIDGE, STRUCTURAL, ORNAME... RCPT $144,856 EXPN $68,025 COH $1,596,921… https://t.co/b3TzpbCSib
1250455127422451700,Wed Apr 15 16:05:09 +0000 2020,NEW FEC F3X SPECIAL OPERATIONS FOR AMERICA RCPT $390,585 EXPN $356,533 COH $80,818 https://t.co/erFZ1XtkTO https://t.co/bJZvRBecVu
1250452615164379100,Wed Apr 15 15:55:10 +0000 2020,NEW FEC F3 MCCLINTOCK, THOMAS (REP-Inc) #CA04  RCPT $160,685 EXPN $92,117 COH $595,709 https://t.co/1qDT1xSNdL https://t.co/8yRCHp6olC
1250451468898848800,Wed Apr 15 15:50:37 +0000 2020,NEW FEC F3 LAMALFA, DOUG (REP-Inc) #CA01  RCPT $91,788 EXPN $19,582 COH $529,559 https://t.co/tU1Rl58FsV https://t.co/to0I74Ub3S
1250451417254342700,Wed Apr 15 15:50:24 +0000 2020,NEW FEC $100K+ CONTRIBUTIONS AMERICAS PAC https://t.co/tvGnbG9VpE https://t.co/poFC0MlJHk
1250451357900787700,Wed Apr 15 15:50:10 +0000 2020,NEW FEC F3X AMERICAS PAC RCPT $3,002,553 EXPN $2,723,711 COH $351,443 https://t.co/tvGnbG9VpE https://t.co/oHPPfUR6nh
1250450100918161400,Wed Apr 15 15:45:10 +0000 2020,NEW FEC F3 JONES, DOUG (DEM-Inc) #ALSEN  RCPT $1,667,875 EXPN $828,628 COH $8,262,067 https://t.co/jE15JSU3y3 https://t.co/OrM66IGnzd
1250449061569679400,Wed Apr 15 15:41:03 +0000 2020,NEW FEC F3 TIPTON, SCOTT R. (REP-Inc) #CO03  RCPT $235,701 EXPN $138,680 COH $625,938 https://t.co/lpqNSDgUzR https://t.co/Eb1iWpCQcp
1250448941260271600,Wed Apr 15 15:40:34 +0000 2020,NEW FEC F2 Garland Dean Hill (IND) #TNSEN (R-Alexander)  https://t.co/dDL1C5rHeT https://t.co/9oZGPgrG9p
1250446399327457300,Wed Apr 15 15:30:28 +0000 2020,NEW FEC F3 HAALAND, DEBRA (DEM-Inc) #NM01  RCPT $250,375 EXPN $187,722 COH $326,611 https://t.co/c4ZtPxVS4a https://t.co/KhyaxzQfNo
1250446347263570000,Wed Apr 15 15:30:16 +0000 2020,NEW FEC F3 JACOBS, CHRISTOPHER L. (REP) #NY27  RCPT $189,197 EXPN $456,239 COH $520,921 https://t.co/jRQlumGZcd https://t.co/j76fdiLIpK
1250445164918657000,Wed Apr 15 15:25:34 +0000 2020,NEW FEC F3 MUCARSEL-POWELL, DEBBIE (DEM-Inc) #FL26  RCPT $742,155 EXPN $221,512 COH $2,195,442… https://t.co/swblagcCRk
1250445115635560400,Wed Apr 15 15:25:22 +0000 2020,NEW FEC F3 CRAIG, ANGELA DAWN (DEM-Inc) #MN02  RCPT $735,224 EXPN $231,241 COH $2,021,710 https://t.co/IHrSKssAeG https://t.co/LoWKEHxDBM
1250445063529697300,Wed Apr 15 15:25:09 +0000 2020,NEW FEC F3 ARENHOLZ, ASHLEY HINSON (REP) #IA01  RCPT $551,588 EXPN $305,960 COH $980,399 https://t.co/syRdL6yeyu https://t.co/5EywycmFVs
1250443914336596000,Wed Apr 15 15:20:35 +0000 2020,NEW FEC F3 JORDAN, JAMES D. (REP-Inc) #OH04  RCPT $733,758 EXPN $452,588 COH $2,650,484 https://t.co/c4HhXm39wc https://t.co/Mung9XX7OX
1250443862532706300,Wed Apr 15 15:20:23 +0000 2020,NEW FEC F3 PELOSI, NANCY (DEM-Inc) #CA12  RCPT $1,768,756 EXPN $982,280 COH $3,534,911 https://t.co/H4tqidVCBM https://t.co/czgHO3aoLd
1250443810670170000,Wed Apr 15 15:20:11 +0000 2020,NEW FEC F3X TOGETHER WE THRIVE RCPT $76,888 EXPN $76,688 COH $200 https://t.co/kA2LMiAnSX https://t.co/SoxZ9U3xGq
1250441396651098000,Wed Apr 15 15:10:35 +0000 2020,NEW FEC F3 STEFANIK, ELISE M. (REP-Inc) #NY21  RCPT $1,559,043 EXPN $914,443 COH $4,002,000 https://t.co/s8JvN0N4KQ https://t.co/XHYIqTgA9F
1250441343828017200,Wed Apr 15 15:10:23 +0000 2020,NEW FEC F3X LAW &amp; JUSTICE PAC RCPT $691,543 EXPN $684,085 COH $7,458 https://t.co/3KaDrqBA3Z https://t.co/X4bcgDgIyg
1250441290434498600,Wed Apr 15 15:10:10 +0000 2020,NEW FEC F3X REASON TO BELIEVE PAC RCPT $2,757,500 EXPN $2,414,348 COH $343,253 https://t.co/x6ZOMu5jBD https://t.co/EgN0BUd3aD
1250440143451738000,Wed Apr 15 15:05:36 +0000 2020,NEW FEC F3 DAVIS, SUSAN A. (DEM-Inc) #CA53  RCPT $46 EXPN $31,839 COH $136,066 https://t.co/1ke5BO8yfl https://t.co/QLvVSlvecU
1250440090414768000,Wed Apr 15 15:05:24 +0000 2020,NEW FEC F3 CASSIDY, WILLIAM M. (REP-Inc) #LASEN  RCPT $920,786 EXPN $369,048 COH $5,872,699 https://t.co/TvxXwukzc9 https://t.co/xaOxkcjndp
1250440032126550000,Wed Apr 15 15:05:10 +0000 2020,NEW FEC F3X CHC BOLD PAC RCPT $785,320 EXPN $326,917 COH $2,276,738 https://t.co/hlfAcZ8DJF https://t.co/2IiOFw8kwq
1250437632758177800,Wed Apr 15 14:55:38 +0000 2020,NEW FEC F3 BASS, KAREN (DEM-Inc) #CA37  RCPT $158,761 EXPN $69,612 COH $813,315 https://t.co/CfOWDhXp3p https://t.co/PTrpam64as
1250437582288064500,Wed Apr 15 14:55:26 +0000 2020,NEW FEC F3 AGUILAR, PETE (DEM-Inc) #CA31  RCPT $267,728 EXPN $145,154 COH $1,643,533 https://t.co/eb0PePsjqa https://t.co/vCw0BcSHa5
1250437523211350000,Wed Apr 15 14:55:12 +0000 2020,NEW FEC F3 JOHNSON, LACY (REP) #MN05  RCPT $655,850 EXPN $687,612 COH $65,608 https://t.co/fFmeBvNkmL https://t.co/8VuLKem6l4
1250435087084093400,Wed Apr 15 14:45:31 +0000 2020,NEW FEC $100K+ CONTRIBUTIONS AMERICAN FREEDOM FUND https://t.co/68mHfN54Re https://t.co/LRKqNqzFfR
1250435051742834700,Wed Apr 15 14:45:22 +0000 2020,NEW FEC $100K+ CONTRIBUTIONS BETTER FUTURE MI FUND https://t.co/oi1K4dlgQc https://t.co/3G7rpTWuWg
1250435001499316200,Wed Apr 15 14:45:10 +0000 2020,NEW FEC F3X POLICE OFFICERS SUPPORT FUND PAC RCPT $183,069 EXPN $184,383 COH $4,524 https://t.co/XMvtDYhevm https://t.co/9tqrsPhL1c
1250431411330224000,Wed Apr 15 14:30:55 +0000 2020,NEW FEC F3 WARNER, MARK ROBERT (DEM-Inc) #VASEN  RCPT $1,805,725 EXPN $800,472 COH $8,465,139… https://t.co/7CWXzxe0lP
1250431307684786200,Wed Apr 15 14:30:30 +0000 2020,FEC MAJOR CONTRIBUTOR ($100K+) EQUALITY PAC https://t.co/tzI0jEQdYv https://t.co/NeVcGEfhyo
1250431249396592600,Wed Apr 15 14:30:16 +0000 2020,NEW FEC F3X EQUALITY PAC RCPT $646,823 EXPN $635,934 COH $606,121 https://t.co/tzI0jEQdYv https://t.co/ldptTkvf6N
1250431204949545000,Wed Apr 15 14:30:05 +0000 2020,NEW HOUSE CAND FINANCIAL DISCLOSURE CANDIDATE REPORT Johnny Ray Salling #MD02 https://t.co/12LU5fB2L0 https://t.co/8rm60BzlhG
1250428707501559800,Wed Apr 15 14:20:10 +0000 2020,NEW FEC F3X WARNER VICTORY FUND RCPT $538,260 EXPN $517,738 COH $21,251 https://t.co/lrB60kwUtx https://t.co/bwgClVmjBl
1250426183268749300,Wed Apr 15 14:10:08 +0000 2020,NEW FEC F24 PROTECT FREEDOM POLITICAL ACTION COMMITTEE $30,003-&gt; #GA09 https://t.co/lvJcwUb8yB https://t.co/PFPmv2Nck0
1250425213063270400,Wed Apr 15 14:06:17 +0000 2020,NEW FEC F3 HOYER, STENY (DEM-Inc) #MD05  RCPT $553,395 EXPN $424,131 COH $1,604,802 https://t.co/qE1L4mvwlx https://t.co/40vErY7J99
1250425159996956700,Wed Apr 15 14:06:04 +0000 2020,NEW FEC $100K+ CONTRIBUTIONS KEEP KANSAS GREAT PAC https://t.co/ivXvu7xgPT https://t.co/sAPGSVP3np
1250425125976981500,Wed Apr 15 14:05:56 +0000 2020,NEW FEC $100K+ CONTRIBUTIONS NRSC TARGETED STATE VICTORY https://t.co/7kSOihWp1v https://t.co/gFGppiBOaK
1250425073069985800,Wed Apr 15 14:05:43 +0000 2020,NEW FEC F3X NRSC TARGETED STATE VICTORY RCPT $1,875,800 EXPN $2,105,047 COH $726,753 https://t.co/7kSOihWp1v https://t.co/fev6FVeVkc
1250425021920448500,Wed Apr 15 14:05:31 +0000 2020,NEW FEC F2 Steven Skelton (LIB) #WA01 (D-DelBene)  https://t.co/d0avazJEJn https://t.co/S8QLJOYy8K
1250421169896820700,Wed Apr 15 13:50:13 +0000 2020,NEW FEC F3X UNITED FOR PROGRESS PAC RCPT $500,000 EXPN $30,083 COH $503,900 https://t.co/2vUYCsPGxf https://t.co/NozWXCG5xc
1250411261864493000,Wed Apr 15 13:10:51 +0000 2020,FEC MAJOR CONTRIBUTOR ($100K+) NATIONAL EMERGENCY MEDICINE POLITICAL ACTION CO... https://t.co/CnjZk3D6mi https://t.co/5npPU94TQk
1250411195112145000,Wed Apr 15 13:10:35 +0000 2020,NEW FEC F3X NATIONAL EMERGENCY MEDICINE POLITICAL ACTION CO... RCPT $125,002 EXPN $255,450 COH $232,368… https://t.co/1JuB1LJE2t
1250411143681593300,Wed Apr 15 13:10:22 +0000 2020,FEC MAJOR CONTRIBUTOR ($100K+) WINDEM https://t.co/db5OPDYe9u https://t.co/DUm3QyArjR
1250411094629167000,Wed Apr 15 13:10:11 +0000 2020,NEW FEC F3X WINDEM RCPT $124,000 EXPN $124,000 COH $392 https://t.co/db5OPDYe9u https://t.co/WqrRyJ9Egn
1250406168737902600,Wed Apr 15 12:50:36 +0000 2020,FEC MAJOR CONTRIBUTOR ($100K+) IHEARTMEDIA INC. PAC https://t.co/baUXXscn13 https://t.co/EaW6Snhdgd
1250406117252821000,Wed Apr 15 12:50:24 +0000 2020,NEW FEC F3X IHEARTMEDIA INC. PAC RCPT $35,417 EXPN $137,529 COH $49,213 https://t.co/baUXXscn13 https://t.co/ESbW2bS3oT
1250406064220033000,Wed Apr 15 12:50:11 +0000 2020,NEW FEC F3X RGA RIGHT DIRECTION PAC RCPT $500,000 EXPN $223,489 COH $366,622 https://t.co/nl2KRNPH6U https://t.co/GT3NPE1hcA
1250404802527256600,Wed Apr 15 12:45:10 +0000 2020,NEW FEC F3 SPANBERGER, ABIGAIL (DEM-Inc) #VA07  RCPT $1,107,947 EXPN $174,184 COH $3,109,926 https://t.co/yqIZOgub91 https://t.co/jgdIkhegGH
1250402288864092200,Wed Apr 15 12:35:11 +0000 2020,NEW FEC F3 DESAULNIER, MARK (DEM-Inc) #CA11  RCPT $68,907 EXPN $65,097 COH $461,998 https://t.co/CSIgNoGByL https://t.co/QqQ8fI2J95
1250397245796577300,Wed Apr 15 12:15:09 +0000 2020,NEW FEC F3 HOUSE VICTORY PROJECT 2020 RCPT $2,527,450 EXPN $2,334,474 COH $221,582 https://t.co/4TgmXbAjCV https://t.co/LY9oHoNUCO
1250394730828947500,Wed Apr 15 12:05:09 +0000 2020,NEW FEC F3 2020 SENATE IMPACT RCPT $599,575 EXPN $595,541 COH $29,237 https://t.co/Xn4NLTyLs7 https://t.co/2o2XcWvAU2
1250390940373508000,Wed Apr 15 11:50:05 +0000 2020,NEW FEC $100K+ CONTRIBUTIONS NO LABELS ACTION, INC. https://t.co/WPLGMKgN9H https://t.co/OTosaIRCAP
1250388442678096000,Wed Apr 15 11:40:10 +0000 2020,NEW FEC F3X LOCAL 32BJ SERVICE EMPLOYEES INTERNATIONAL UNIO... RCPT $920,209 EXPN $1,366,282 COH $1,953,842… https://t.co/E9MoooxBwZ
1250353217273131000,Wed Apr 15 09:20:12 +0000 2020,NEW FEC F3 OCASIO-CORTEZ, ALEXANDRIA (DEM-Inc) #NY14  RCPT $2,730,854 EXPN $2,120,705 COH $3,511,850… https://t.co/e0nQ50mTrp
1250326784618291200,Wed Apr 15 07:35:10 +0000 2020,NEW FEC F3 BARKLEY, MICHAEL JAMES MR. (DEM) #CA10  RCPT $11 EXPN $11 COH $453 https://t.co/YltSUznfR0 https://t.co/acdFo8YP0q
1250314350667001900,Wed Apr 15 06:45:45 +0000 2020,NEW FEC F3 WILSKE, LARRY A MR. (REP-Open) #CA50  RCPT $5,171 EXPN $16,877 COH $3,159 https://t.co/o3RD82twb9 https://t.co/KbmwAuVNnp
1250314300985499600,Wed Apr 15 06:45:33 +0000 2020,NEW FEC F2 Lauren Allison Levy (DEM) #FL21 (D-Frankel)  https://t.co/CBRASfk5zz https://t.co/UNKKUIj365
1250292809141125000,Wed Apr 15 05:20:09 +0000 2020,NEW FEC F3X MCCONNELL VICTORY COMMITTEE RCPT $969,472 EXPN $887,447 COH $154,213 https://t.co/xiNlpqyRgb https://t.co/82duhbRVV4
1250287788739580000,Wed Apr 15 05:00:12 +0000 2020,NEW DNS REGISTRATIONS - 2020-04-15 https://t.co/zFJiQ9RbnU
1250278970710306800,Wed Apr 15 04:25:10 +0000 2020,NEW FEC F3 LOFGREN, ZOE (DEM-Inc) #CA19  RCPT $170,082 EXPN $250,745 COH $1,168,944 https://t.co/QRNUDtdos9 https://t.co/H5ioD5Y0LN
1250270163867283500,Wed Apr 15 03:50:10 +0000 2020,NEW FEC F3X JOHN BOLTON SUPER PAC RCPT $35,221 EXPN $192,176 COH $2,164,158 https://t.co/aUwZ7I9tD6 https://t.co/etEpcVAGI9
1250266370601676800,Wed Apr 15 03:35:06 +0000 2020,NEW FEC $100K+ CONTRIBUTIONS RURAL ARIZONA PAC https://t.co/7NhllQx685 https://t.co/wONfFay3ly
1250262678523842600,Wed Apr 15 03:20:25 +0000 2020,FEC MAJOR CONTRIBUTOR ($100K+) INTERNATIONAL BROTHERHOOD OF ELECTRICAL WORKERS... https://t.co/b7VC1fPC1E https://t.co/9Fb5YZ61Xg
1250262615890092000,Wed Apr 15 03:20:11 +0000 2020,NEW FEC F3X INTERNATIONAL BROTHERHOOD OF ELECTRICAL WORKERS... RCPT $458,021 EXPN $776,258 COH $1,002,684… https://t.co/nKm7yRZegG
1250261339085222000,Wed Apr 15 03:15:06 +0000 2020,NEW FEC $100K+ CONTRIBUTIONS DEFEND US PAC https://t.co/juuoiK2czA https://t.co/NwEwmGrZJX
1250252547090026500,Wed Apr 15 02:40:10 +0000 2020,NEW FEC F3 SESSIONS, JEFFERSON B (REP) #ALSEN  RCPT $749,273 EXPN $1,898,681 COH $749,236 https://t.co/GWZGMRSWRP https://t.co/LWBgxI24uM
1250251285183504400,Wed Apr 15 02:35:09 +0000 2020,NEW FEC F3X PROGRESSIVE TAKEOVER RCPT $571,370 EXPN $1,070,541 COH $121,138 https://t.co/MT4l9pEn4D https://t.co/eFvI7x3A90
1250247504987181000,Wed Apr 15 02:20:08 +0000 2020,NEW FEC F24 THE COMMITTEE TO DEFEND THE PRESIDENT https://t.co/qk1CMfjwj8 https://t.co/SXkEXh2P3H
1250242483440586800,Wed Apr 15 02:00:11 +0000 2020,NEW FEC F3 DRISKELL, GRETCHEN (DEM) #MI07  RCPT $250,563 EXPN $124,207 COH $280,277 https://t.co/wxQYFvi9y0 https://t.co/TBKlulelfO
1250239966057132000,Wed Apr 15 01:50:10 +0000 2020,NEW FEC F3 PLAME, VALERIE (DEM-Open) #NM03  RCPT $580,957 EXPN $477,331 COH $690,165 https://t.co/q4YJvnnfhV https://t.co/stNt6ZLRPL
1250237538465267700,Wed Apr 15 01:40:32 +0000 2020,NEW FEC F2 Rayla Campbell (REP) #MA07 (D-Pressley)  https://t.co/C4aOsuLkWd https://t.co/egt5s3qLsC
1250235049728856000,Wed Apr 15 01:30:38 +0000 2020,NEW FEC F3 DOVE, JEFFERY ANTHONY MR. JR. (REP) #VA10  RCPT $153,261 EXPN $125,182 COH $57,310… https://t.co/kirpo4OXXt
1250235000034902000,Wed Apr 15 01:30:26 +0000 2020,NEW FEC $100K+ CONTRIBUTIONS WIN MINNESOTA FEDERAL PAC https://t.co/eMBTzua3FN https://t.co/42nMNKpnSZ
1250234951536009200,Wed Apr 15 01:30:15 +0000 2020,NEW FEC F3X WIN MINNESOTA FEDERAL PAC RCPT $1,903,701 EXPN $1,903,717 COH $10,124 https://t.co/eMBTztSshd https://t.co/xuYd7BHuud
1250228637527228400,Wed Apr 15 01:05:09 +0000 2020,NEW FEC F3 MCCAUL, MICHAEL (REP-Inc) #TX10  RCPT $254,848 EXPN $132,291 COH $1,015,436 https://t.co/ko3aFyVbJ2 https://t.co/3WhgrJqfrM
1250217363753980000,Wed Apr 15 00:20:22 +0000 2020,NEW FEC F3 WEXTON, JENNIFER (DEM-Inc) #VA10  RCPT $481,403 EXPN $187,360 COH $1,782,474 https://t.co/FPtvoP3wwb https://t.co/3yY0geBmJd
1250217312180936700,Wed Apr 15 00:20:09 +0000 2020,NEW FEC F3 TARRIO, ENRIQUE (REP) #FL27  RCPT $8,158 EXPN $4,947 COH $3,236 https://t.co/PqtXuUrCZs https://t.co/mn8yQwCmXV
1250212286565773300,Wed Apr 15 00:00:11 +0000 2020,NEW FEC F3X COALITION FOR AMERICAN VETERANS POLITICAL ACTIO... RCPT $696,398 EXPN $687,889 COH $147,146… https://t.co/ph5KIqWKZL
1250209765931679700,Tue Apr 14 23:50:10 +0000 2020,NEW FEC F3 DEMAIO, CARL (REP-Open) #CA50  RCPT $357,015 EXPN $962,486 COH $119,494 https://t.co/TZbTeqGFWm https://t.co/JXyRKzyC8K
1250208488468254700,Tue Apr 14 23:45:06 +0000 2020,NEW FEC $100K+ CONTRIBUTIONS GOLDEN STATE LEADERSHIP FUND PAC https://t.co/Yjj8OmMVLM https://t.co/yIv8e3vxsX
1250205971768438800,Tue Apr 14 23:35:06 +0000 2020,NEW F497 Californians for Consumer Privacy $257,506 From 2 Transactions https://t.co/Cpz1IJcPBN https://t.co/uIxibxNmPb
1250204770708500500,Tue Apr 14 23:30:19 +0000 2020,NEW FEC F3 WU, BRIANNA (DEM-Open) #MA08  RCPT $55,257 EXPN $49,240 COH $30,809 https://t.co/9R76CSbRRe https://t.co/XPRBqRLiGQ
1250204716279009300,Tue Apr 14 23:30:06 +0000 2020,NEW FEC $100K+ CONTRIBUTIONS EDF ACTION VOTES https://t.co/zgK6DZBbDl https://t.co/I9NiLp6qZR
1250203453760077800,Tue Apr 14 23:25:05 +0000 2020,NEW F497 Service Employees International Union Local 1000... $250,000 To California Democratic Party Sacramen...… https://t.co/3SIM4fMcOY
1250202217329524700,Tue Apr 14 23:20:10 +0000 2020,NEW FEC F3X VOICE OF TEACHERS FOR EDUC/CMTE ON POL EDUC OF ... RCPT $1,875,479 EXPN $559,160 COH $5,459,833… https://t.co/BLMjnL41Ba
1250193502022987800,Tue Apr 14 22:45:33 +0000 2020,NEW FEC $100K+ CONTRIBUTIONS TRANSPORT WORKERS UNION VOICE https://t.co/7XPA6noNn4 https://t.co/cx0Fn9GFAu
1250193454128234500,Tue Apr 14 22:45:21 +0000 2020,NEW FEC F3 WELLS, WILLIAM DANIEL (REP-Open) #CA50  RCPT $0 EXPN $0 COH $8,582 https://t.co/b6YbQafSNa https://t.co/29taNjqk9l
1250193404182417400,Tue Apr 14 22:45:09 +0000 2020,NEW FEC F3X THE GUARDIAN FUND RCPT $593,603 EXPN $596,994 COH $228,395 https://t.co/TqZlxb0rIt https://t.co/83smoZS0ZH
1250190943598162000,Tue Apr 14 22:35:23 +0000 2020,NEW FEC F3 GARCIA, ERIC (NPA) #CA22  RCPT $70 EXPN $518 COH $0 https://t.co/Ajg4N6T6K4 https://t.co/PsfTNI2YAi
1250190889554608000,Tue Apr 14 22:35:10 +0000 2020,NEW FEC F3 SCOTT, JOSHUA (REP) #CA32  RCPT $1,175 EXPN $3,340 COH $1,131 https://t.co/3ocHjwC16h https://t.co/41iTPVMEh5
1250184592859922400,Tue Apr 14 22:10:08 +0000 2020,NEW FEC F24 GREAT AMERICA PAC $76,991-&gt; #POTUS https://t.co/TyvtGKMKxQ https://t.co/QDw3FTE6zP
1250180867030278100,Tue Apr 14 21:55:20 +0000 2020,NEW F497 Newsom for California Governor 2022 $25,000 From 3 Transactions https://t.co/tRVVJcETnn https://t.co/ljyxQwDXbC
1250180828421689300,Tue Apr 14 21:55:11 +0000 2020,NEW F497 Committee to Innovate for California's Future, E... $15,000 From Anheuser Busch Companies Sacramento, CA… https://t.co/GNjs1PBo5E
1250179597766811600,Tue Apr 14 21:50:17 +0000 2020,NEW FEC F3 LOZANO, DAVID (REP) #CA25  RCPT $110 EXPN $1,236 COH $1,914 https://t.co/oz7OgjzZGS https://t.co/TsbBuu0lR1
1250177051069280300,Tue Apr 14 21:40:10 +0000 2020,NEW FEC F3 FORDE, BRIAN (DEM) #CA45  RCPT $0 EXPN $0 COH $223,073 https://t.co/UHNcDcdWBu https://t.co/ocZ4MYSBM8
1250175790370549800,Tue Apr 14 21:35:10 +0000 2020,NEW FEC F3 MCCARTHY, DANIEL (REP) #AZSEN  RCPT $69,244 EXPN $92,329 COH $11,798 https://t.co/DwPulqTqR1 https://t.co/qUe5Jgqlf0
1250173256604106800,Tue Apr 14 21:25:06 +0000 2020,NEW FEC F1 ZERO TRADE WITH CHINA PAC  https://t.co/7i5YjormR9 https://t.co/Mn0Zj0aomz
1250172017560539100,Tue Apr 14 21:20:10 +0000 2020,NEW FEC F3 MEEHAN, PATRICK L. MR (REP-Inc) #PA07  RCPT $600,000 EXPN $0 COH $600,000 https://t.co/jH7Xa9Hu2t https://t.co/Ek3R9GAstt
