id,created_at,text
1257364111236759600,Mon May 04 17:38:59 +0000 2020,RT @CGTNEurope: "@WHO has not received any data or specific evidence from the US government relating to the purported origin of the virus,"…
1257363056646029300,Mon May 04 17:34:48 +0000 2020,#BREAKING WHO says received no evidence from US on 'speculative' Wuhan lab virus claims https://t.co/t6qtlSgD4z
1257362200026648600,Mon May 04 17:31:23 +0000 2020,#France will provide 500 million euros (about 547 million U.S. dollars) for global search for #COVID19 treatment an… https://t.co/RPqDYVTMDC
1257361466371592200,Mon May 04 17:28:28 +0000 2020,Turkey's President Erdogan on easing Covid-19 measures   - Lifting intercity travel restrictions for seven province… https://t.co/ZOMYUOXVNV
1257360281342222300,Mon May 04 17:23:46 +0000 2020,#COVID19 France records 306 deaths in 24 hours as hospitalizations continue to fall https://t.co/TGixm72eqS
1257357985086660600,Mon May 04 17:14:38 +0000 2020,Six US service members have been awarded Purple Hearts for injuries they sustained in an Iranian missile attack in Iraq in January (CNN)
1257356125583954000,Mon May 04 17:07:15 +0000 2020,RT @CGTNEurope: Global Business Daily: Ferrari fires up, airline lifelines, Huawei shipments up -- read this and much more here https://t.c…
1257356103937114000,Mon May 04 17:07:10 +0000 2020,RT @CGTNEurope: @MattHancock Professor Jonathan Van-Tam says the overwhelming majority of patients who have had COVID-19 have gained antibo…
1257355913352155100,Mon May 04 17:06:24 +0000 2020,Kenya’s tea production expands in March https://t.co/HeUiiBQ6sU
1257354433379422200,Mon May 04 17:00:32 +0000 2020,#Latest on #coronavirus outbreak in #Italy, according to Civil Protection Department: -211,938 cumulative cases, 1,… https://t.co/YxuSjCiynB
1257348857165492200,Mon May 04 16:38:22 +0000 2020,#BREAKING Billions raised for virus vaccine 'powerful' show of 'global solidarity': WHO chief https://t.co/2iC9QmJ9xf
1257346270076850200,Mon May 04 16:28:05 +0000 2020,GE is cutting up to 13,000 jobs in its jet engine business because of the devastation to the aerospace industry bro… https://t.co/Ux6Yhq1KAg
1257345268577644500,Mon May 04 16:24:07 +0000 2020,U.S. factory orders took a more than 10% drop in March as COVID-19 started to shut down parts of the economy. https://t.co/gajbkGzTG9
1257344345734332400,Mon May 04 16:20:27 +0000 2020,Zimbabweans face arrest for flouting face mask regulation  https://t.co/PslMU6C6fe
1257343708401451000,Mon May 04 16:17:55 +0000 2020,RT @CGTNEurope: WATCH LIVE: @WHO holds briefing to update on the coronavirus outbreak https://t.co/ROtgD4UypR
1257341371465244700,Mon May 04 16:08:37 +0000 2020,Health Secretary Matt Hancock says a further 288 people have died in all settings after testing positive for… https://t.co/jpvVI2196f
1257340706148028400,Mon May 04 16:05:59 +0000 2020,RT @CGTNEurope: WATCH LIVE: UK govt. officials briefing on the coronavirus outbreak https://t.co/l1AEis2F1p
1257340632487641000,Mon May 04 16:05:41 +0000 2020,Nigeria reopens main cities Lagos and Abuja as lockdowns phased out https://t.co/CJqKtVzS66
1257335579810967600,Mon May 04 15:45:37 +0000 2020,Breaking News: The Trump administration is privately projecting that daily coronavirus deaths in the U.S. will near… https://t.co/Z9w1e0LCb4
1257333091884040200,Mon May 04 15:35:43 +0000 2020,HEAT PODCAST: What is the emotional toll for doctors and frontline workers battling #COVID19?  Dr Qanta Ahmed… https://t.co/XQkGjNPqhZ
1257332233939169300,Mon May 04 15:32:19 +0000 2020,BREAKING: US FDA tightens regulations on antibody tests for COVID-19 amid concerns over fraudulent tests. https://t.co/Gl1PdtmRtl
1257331777187860500,Mon May 04 15:30:30 +0000 2020,May 4 is known as #StarWars Day to many fans of the movie.   Some officials in the Philippine capital, Manila, have… https://t.co/JkTaAaqiXA
1257331267084988400,Mon May 04 15:28:28 +0000 2020,RT @cgtnafrica: #Egypt’s parliament approves state of emergency extension by 3 months due to security and health conditions  https://t.co/V…
1257330593404248000,Mon May 04 15:25:48 +0000 2020,#Latest on #COVID19 outbreak on #African continent, according to #Africa Center for Disease Control and Prevention… https://t.co/7KFQgV8Jze
1257330396624289800,Mon May 04 15:25:01 +0000 2020,RT @cgtnafrica: #Sudan reports 86 new #COVID19 cases bring the total to 678 confirmed patients.   https://t.co/W7mXcSpHTA https://t.co/YFdg…
1257324925674643500,Mon May 04 15:03:16 +0000 2020,World leaders call for alliance in creating low-cost #COVID19 vaccine, treatment for all   #OneWorldOneFight… https://t.co/1W8ApcCLAt
1257324102072758300,Mon May 04 15:00:00 +0000 2020,#Beijing bans disposable tableware at restaurants; woman fails to donate part of her liver to her son; and more.… https://t.co/os1NbV3oGm
1257319067737702400,Mon May 04 14:40:00 +0000 2020,Opinion: The U.S. anti-China infowar is driven by its "Economic Prosperity Network" plans #CGTNOpinion https://t.co/owLQggAtZB
1257314034702971000,Mon May 04 14:20:00 +0000 2020,#Tanzanian president calls for probe after non-human samples test positive for #COVID19 https://t.co/2PpPr9aphT
1257309002641346600,Mon May 04 14:00:00 +0000 2020,#HongKong International Airport is applying new disinfection technologies, including autonomous cleaning robots, to… https://t.co/9fzbAhvIdH
1257303968549503000,Mon May 04 13:40:00 +0000 2020,Burundi's Ambassador to China Martin Mbazumutima thanked the Chinese government for supporting #Africa during the g… https://t.co/dFmF3iFI4J
1257301151575273500,Mon May 04 13:28:48 +0000 2020,EU to mobilize 1 billion euros for global response to the #coronavirus, European Commission chief says https://t.co/XJlJKbGkpy
1257298934927470600,Mon May 04 13:20:00 +0000 2020,CGTN visits a young medical team in Wuhan whose job of collecting swabs for #COVID19 testing keeps them at risk of… https://t.co/yfmLG3K62v
1257297288004636700,Mon May 04 13:13:27 +0000 2020,Wuhan grade 12 students to be tested for #COVID19 before class resumption  https://t.co/agvXR1y2ZC
1257293906124963800,Mon May 04 13:00:01 +0000 2020,U.S. President Donald Trump has said he believes that a #vaccine for the #coronavirus could be available by the end… https://t.co/MZvRS24t93
1257288868639805400,Mon May 04 12:40:00 +0000 2020,#FactsTell: Who is Brett O'Donnell, Washington's top hand in GOP playbook? https://t.co/kCDL8Q9eUS
1257287372124729300,Mon May 04 12:34:03 +0000 2020,China's State Council sends group to #Wuhan for further prevention work   #COVID19 #coronavirus https://t.co/D95yhffrU4
1257283835475062800,Mon May 04 12:20:00 +0000 2020,Drive-in theaters: A way out in pandemic-besieged world? #COVID19 https://t.co/h0TAgTSalL
1257281584790560800,Mon May 04 12:11:03 +0000 2020,Live: China's top respiratory expert Zhong Nanshan answers questions about COVID-19 #Covid19Frontline https://t.co/qkXsqHWooj
1257278805514780700,Mon May 04 12:00:01 +0000 2020,Chinese medical experts arrive in Djibouti for #COVID19 fight https://t.co/8zI8kEjAJ7
1257278640359796700,Mon May 04 11:59:21 +0000 2020,Live: Cases doubled after Ghana reopened; #COVID19Frontline workers discuss concerns with Chinese counterparts https://t.co/7D5emsgcM6
1257276689694052400,Mon May 04 11:51:36 +0000 2020,RT @CGTNEurope: WATCH LIVE: A view of London as the UK marks six weeks under lockdown  https://t.co/JdkjMu4YSm
1257276123865481200,Mon May 04 11:49:21 +0000 2020,RT @thouse_opinions: The U.S., for fundamental economic reasons, can't produce the types of products it gets from #China. The #coronavirus…
1257273769225142300,Mon May 04 11:40:00 +0000 2020,Last #COVID19 patients leave makeshift #Madrid hospital https://t.co/Dk6e3ewf08
1257268736093896700,Mon May 04 11:20:00 +0000 2020,#Malaysia reopens almost all its economic sectors; the country had imposed a movement control order on March 18 ove… https://t.co/WF1Ed0m8D0
1257266886577778700,Mon May 04 11:12:39 +0000 2020,Iranian parliament approves a bill to change the national currency from the rial to the toman.  One toman will be e… https://t.co/oQcCSud61t
1257263705991057400,Mon May 04 11:00:00 +0000 2020,Story of Fighting #COVID19: “Many turning to drugs as pandemic drags on” https://t.co/0PrUZsDqgP
1257261986900893700,Mon May 04 10:53:11 +0000 2020,#HongKong economy shrinks most on record due to #COVID19 pandemic https://t.co/h9HGTMXsOE https://t.co/T63FaLbfU7
1257260461742936000,Mon May 04 10:47:07 +0000 2020,UK PM readies plan to ease lockdown with new office guidance #COVID19 https://t.co/0YnFdHbpBx
1257258669550342100,Mon May 04 10:40:00 +0000 2020,The famous Christ the Redeemer statue in #Brazil's Rio de Janeiro donned a mask to highlight the importance of the… https://t.co/g5ukNobI7m
1257253636335427600,Mon May 04 10:20:00 +0000 2020,Chasing spring in #Beijing parks: Hongluosi  more: https://t.co/gul2odTgC8 https://t.co/so2dcSFStP
1257249410041499600,Mon May 04 10:03:12 +0000 2020,RT @CGTNEurope: WATCH LIVE: View of Rome as Italy slightly relaxes coronavirus lockdown  https://t.co/D3k7iwzydt
1257248606102253600,Mon May 04 10:00:00 +0000 2020,😷Disposable masks are now a necessity thanks to the #coronavirus pandemic – but if white and blue are not your colo… https://t.co/KfgHicuHTx
1257245136708239400,Mon May 04 09:46:13 +0000 2020,#Spain now has 218,011 #COVID19 cases and 25,428 fatalities after 545 new infections and 164 more deaths were repor… https://t.co/sasIzcATvO
1257243570215325700,Mon May 04 09:40:00 +0000 2020,🇮🇹Life gradually goes back to normal in #Italy as a staged end to a nationwide lockdown began on Monday.  In early… https://t.co/plG0sqwLZv
1257238536950026200,Mon May 04 09:20:00 +0000 2020,More than 450 Pakistani medical personnel have tested positive for #COVID19 https://t.co/cYSum7txIs
1257236026839330800,Mon May 04 09:10:01 +0000 2020,A 21-year-old man pleaded guilty to rioting in Admiralty in #HongKong on Monday, becoming the first person to do so… https://t.co/Ohg5f8r7Yn
1257235058454220800,Mon May 04 09:06:10 +0000 2020,#COVID19 situation in #Hubei Province as of Sunday:  - The province hasn't reported any new cases for 30 straight d… https://t.co/63n0tFk2Fn
1257233506071048200,Mon May 04 09:00:00 +0000 2020,Pompeo: Sunday gunfire exchange at Korean DMZ likely "accidental" https://t.co/UFulH7pBOS
1257231071302676500,Mon May 04 08:50:20 +0000 2020,The majority of government employees in the #HongKong SAR returned to their offices on Monday when multiple city se… https://t.co/PyouOOt4l7
1257228470616121300,Mon May 04 08:40:00 +0000 2020,#COVID19 Isolation brings out the creativity of Gazans https://t.co/XMnth3TwxB
1257224695654408200,Mon May 04 08:25:00 +0000 2020,#Russia reported 10,581 new #COVID19 infections and 76 more deaths in the past 24 hours, bringing the nationwide ca… https://t.co/eHWdwgm6VY
1257223437585531000,Mon May 04 08:20:00 +0000 2020,🐱 A cat-themed block has become a new selfie-worthy spot in Nanjing, east China's Jiangsu Province, attracting many… https://t.co/tGs7VaB5WQ
1257220585492344800,Mon May 04 08:08:40 +0000 2020,#BREAKING Japan announces extension of state of emergency to May 31 https://t.co/GT6sle1LiD
1257218899516379100,Mon May 04 08:01:58 +0000 2020,Live: Hubei officials on latest measures to prepare for reopening of high schools in #Wuhan #coronavirus https://t.co/Q7HgU2AKpg
1257218404143915000,Mon May 04 08:00:00 +0000 2020,Indian military salutes virus workers with petals, flypasts, flares #COVID19 #coronavirus https://t.co/jdcKzi0C3r
1257213371209756700,Mon May 04 07:40:00 +0000 2020,Robots assist in global #COVID19 prevention efforts https://t.co/g0QuSo6Jgx
1257211702057132000,Mon May 04 07:33:22 +0000 2020,China's National Health Commission on #COVID19: - As of Sunday, existing cases fewer than 500, lowest since Jan. 23… https://t.co/I3qeRQf0j8
1257208337990422500,Mon May 04 07:20:00 +0000 2020,One of the traditional Shaolin fists: Changhuxinyimen fist https://t.co/Lg6ycQ3gZC
1257203692832354300,Mon May 04 07:01:32 +0000 2020,Live: Principals from the transshipment and medical aid teams brief on #COVID19 containment #coronavirus https://t.co/VFqfeh9W9a
1257203305010380800,Mon May 04 07:00:00 +0000 2020,Amazing fireworks and a "metal shower" are seen in #China's Changsha ancient town during May Day holiday.   "Metal… https://t.co/NwqkfzQajG
1257199043983192000,Mon May 04 06:43:04 +0000 2020,#Japan set to extend #coronavirus state of emergency to May 31 https://t.co/2vCW9FDsjJ
1257193484718465000,Mon May 04 06:20:58 +0000 2020,Two Chinese crew aboard quarantined #German cruiser show symptoms https://t.co/GJdlRHxAjD
1257193238345273300,Mon May 04 06:20:00 +0000 2020,China saw nearly 85 million domestic tourist trips in the first three days of its five-day May Day holiday which st… https://t.co/te5embGgju
1257188900256137200,Mon May 04 06:02:45 +0000 2020,#Africa recorded 3,000 new #COVID19 cases in the past 24 hours, bringing the total to 43,029 infections, 1,761 deat… https://t.co/UJnVkWyktq
1257188205390160000,Mon May 04 06:00:00 +0000 2020,As the #Tokyo2020 Olympic Games have been postponed to July 23 next year, and with gyms shut down as a result of th… https://t.co/JEmLyBIBMi
1257183288088617000,Mon May 04 05:40:27 +0000 2020,#Germany's #COVID19 cases rose by 679 in the past 24 hours to 163,175, a record low daily rise since mid-March, acc… https://t.co/ssStEwcN9r
1257183172124504000,Mon May 04 05:40:00 +0000 2020,30 Turkish military vehicles enter Syria's Idlib https://t.co/DvArK4ZIsF
1257178138884182000,Mon May 04 05:20:00 +0000 2020,May 4 marks China's Youth Day, in memory of a patriotic campaign by young Chinese to fight imperialism and feudalis… https://t.co/uHG9KEzbTR
1257173106956722200,Mon May 04 05:00:00 +0000 2020,Answer Bank: Which vaccines should not be postponed amid #coronavirus? https://t.co/JgoeKKhNpk https://t.co/9AAY3LYPLr
1257168072567390200,Mon May 04 04:40:00 +0000 2020,French #coronavirus quarantine to spare travelers from Schengen area and UK https://t.co/FQu195i5YU
1257163039469641700,Mon May 04 04:20:00 +0000 2020,#Tesla to build 4,000 Model 3s per week in Shanghai by mid-2020 https://t.co/VDh1ZofrKk
1257158007105835000,Mon May 04 04:00:00 +0000 2020,Opinion: The global supply chain will hold firm #COVID19 #CGTNOpinion  more: https://t.co/XsG53iKiMm https://t.co/oRtEKOMJJj
1257155998847885300,Mon May 04 03:52:01 +0000 2020,Magnitude 5.2 earthquake hits 297 km southeast of Hachijo-jima, #Japan at 0303 GMT on Monday, the U.S. Geological S… https://t.co/R7r7vufnBf
1257152973031047200,Mon May 04 03:40:00 +0000 2020,DPRK leader expresses thanks to "model" political lecturers: report https://t.co/bkxEkQ4zcy
1257151878393032700,Mon May 04 03:35:39 +0000 2020,Just 100 kilometers southwest of China's Beijing, in the Xiong'an New Area, a group of skilled artists are keeping… https://t.co/2PX9xNPQx5
1257147939971104800,Mon May 04 03:20:00 +0000 2020,#Pence says he should have worn face mask at Mayo Clinic #coronavirus https://t.co/L4KpKg3gKg
1257137873561759700,Mon May 04 02:40:00 +0000 2020,#NewZealand recorded no new #COVID19 cases nor deaths in the past 24 hours for the first time over the past six wee… https://t.co/cD7hyDrWBi
1257132840359166000,Mon May 04 02:20:00 +0000 2020,#China's livestreaming service users reach 560 mln: report https://t.co/GxEE5Iou5O
1257127808050004000,Mon May 04 02:00:00 +0000 2020,"Game of Thrones" actor Hafthor Bjornsson breaks deadlifting world record https://t.co/WP2oI9GSvP
1257124978559836200,Mon May 04 01:48:45 +0000 2020,Live: How is China's hotel industry doing during the pandemic? #COVID19 #coronavirus https://t.co/FaAbHCJ3fw
1257123537216655400,Mon May 04 01:43:02 +0000 2020,Starting from May 8, passengers taking #China Airlines flights from #Moscow to #Beijing will be required to provide… https://t.co/09K62zW6wZ
1257120782305521700,Mon May 04 01:32:05 +0000 2020,Though the #coronavirus has waned in #China, the famous Tumbler show in Xi'an was canceled during the May Day holid… https://t.co/iYkjLJ4bVG
1257112707712548900,Mon May 04 01:00:00 +0000 2020,Trump says U.S. to have #coronavirus vaccine by end of year https://t.co/cfCxMEcp28 https://t.co/4tNBfm45Rx
1257110591019180000,Mon May 04 00:51:35 +0000 2020,RT @thouse_opinions: #COVID19 is a 'gray rhino' rather than 'black swan' event for Europe. It had the opportunity to learn from #China's ex…
1257107674614947800,Mon May 04 00:40:00 +0000 2020,First #coronavirus case in #France appeared in December: expert https://t.co/4oIYOY2ygA
1257106279148826600,Mon May 04 00:34:27 +0000 2020,On Sunday, the Chinese mainland reported:   - Three imported #COVID19 cases - No new deaths - 13 new asymptomatic c… https://t.co/NHgUiVE5X6
1257102828616552400,Mon May 04 00:20:44 +0000 2020,#France's #COVID19 tracing app expected to enter testing in week of May 11 https://t.co/By9T2mhEd2
1257097421944807400,Sun May 03 23:59:15 +0000 2020,#Brazil #COVID19 cases top 100,000, making it the worst-hit Latin American country, with the highest numbers of cas… https://t.co/TGK6tVlgAr
1257087542244946000,Sun May 03 23:20:00 +0000 2020,Video: Over 80,000 medical workers on duty in #Wuhan during May Day holiday https://t.co/laHJkFIBku
1257085865345466400,Sun May 03 23:13:20 +0000 2020,RT @cgtnamerica: Nursing homes nationwide in the U.S. are making sweeping lobbyist efforts to seek protection from lawsuits, as 20,000 care…
1257084759844384800,Sun May 03 23:08:56 +0000 2020,Confirmed global #COVID19 cases topped 3.5 million, reaching 3,502,126 as of 2300 GMT, according to Johns Hopkins U… https://t.co/fvO1y7TAqE
1257083794529546200,Sun May 03 23:05:06 +0000 2020,The total COVID-19 cases globally have surpassed 3.5 million, according to Johns Hopkins data. https://t.co/nZPlyRJ0N1
1257082509785006000,Sun May 03 23:00:00 +0000 2020,In #Paris, even statues wear #masks during lockdown https://t.co/cZGCPKPJCU
1257081456574304300,Sun May 03 22:55:49 +0000 2020,As of Sunday afternoon, worldwide confirmed COVID-19 cases nearly 3.5 million, Johns Hopkins University (Photo by R… https://t.co/zvwa5QHRrb
1257074862650200000,Sun May 03 22:29:37 +0000 2020,Confirmed COVID-19 cases in the U.S. surged past 1.15 million, Johns Hopkins University (Photo by Reuters). https://t.co/GXpBc6uoFS
1257068454957514800,Sun May 03 22:04:09 +0000 2020,RT @cgtnamerica: The world’s highest mountain — Mount Qomolangma is finally connected to 5G network. Check out the newly built tower and wh…
1257060794199691300,Sun May 03 21:33:43 +0000 2020,RT @cgtnamerica: Many TV stations around the world are coping with staff working from home. Check out how CGTN journalists carry on with co…
1257050517550829600,Sun May 03 20:52:52 +0000 2020,In a major new series, The Pandemic Playbook, @CGTNEurope looks at what strategies have been used to battle pandemi… https://t.co/7LWrhsAsBT
1257049990364528600,Sun May 03 20:50:47 +0000 2020,How will people change their perspective on personal space after #COVID19 and the social distancing rules? Professo… https://t.co/OF0bbQuSho
1257049899453091800,Sun May 03 20:50:25 +0000 2020,After weeks of shock and grief, Italy - still the country with the highest number of #COVID19 deaths in Europe - is… https://t.co/oMT9zEByEk
1257049147691204600,Sun May 03 20:47:26 +0000 2020,As institutions expect an 80-90% drop in foreign students enrolling next year, UK universities fear the loss of inc… https://t.co/i05AOQqpLy
1257048922607976400,Sun May 03 20:46:32 +0000 2020,There is still no vaccine approved to cure #COVID19. The Agenda with Stephen Cole (@cole_stephen ) takes you throug… https://t.co/lw05bbysJw
1257048567933436000,Sun May 03 20:45:08 +0000 2020,In a major new series, The Pandemic Playbook, @CGTNEurope looks at what strategies have been used to battle pandemi… https://t.co/s4kyxQ0YSD
1257035727327555600,Sun May 03 19:54:06 +0000 2020,RT @cgtnamerica: As the dreaded fire season approaching in California, authorities fear the COVID-19 pandemic will threaten firefighting ef…
1257035197305852000,Sun May 03 19:52:00 +0000 2020,RT @cgtnamerica: Crocodiles are in danger of extinction. One man in Jamaica has devoted more than a decade to raising and caring for Jamaic…
1257032760138403800,Sun May 03 19:42:19 +0000 2020,RT @cgtnamerica: The northern triangle of Central America is suffering the devastating consequences of both, COVID-19 and climate change. F…
1257032025644523500,Sun May 03 19:39:24 +0000 2020,RT @cgtnamerica: Amazon rainforest in Brazil is at risk of being destroyed by farming, logging and climate change. How can we save this wor…
1257029858556817400,Sun May 03 19:30:47 +0000 2020,RT @cgtnamerica: To minimize the risk of a second wave of COVID-19 infection, Britain intends to test a new coronavirus contact tracing pro…
1257029084326105000,Sun May 03 19:27:42 +0000 2020,RT @CGTNEurope: German Yoga teacher spreads joy on World Laughter Day  #worldlaughterday #laugh #laughoutloud #laughtertherapy #feelgood ht…
1257029069138464800,Sun May 03 19:27:39 +0000 2020,RT @CGTNEurope: Italy is set to ease a stringent two-month lockdown imposed in the wake of the #COVID19 pandemic. https://t.co/WY8FUYvvg8
1257029048288641000,Sun May 03 19:27:34 +0000 2020,RT @CGTNEurope: Conspiracy theories are making it harder to deal with the coronavirus outbreak: @TheLancet editor @richardhorton1 says that…
1257028961441284000,Sun May 03 19:27:13 +0000 2020,RT @CGTNEurope: Video Graphic: How many #COVID19 deaths across Europe? https://t.co/euan0JOsVD
1257028945867944000,Sun May 03 19:27:09 +0000 2020,RT @CGTNEurope: Graphic: Europe starts easing restrictions https://t.co/jtaMFjHa48
1257025995351175200,Sun May 03 19:15:26 +0000 2020,RT @CGTNEurope: French public slams government over virus response, according to opinion poll Read more: https://t.co/Ogb252WEVs https://t.…
1257025969812058000,Sun May 03 19:15:20 +0000 2020,RT @CGTNEurope: Austria and Germany had the highest approval ratings with well over half of the public feeling positive about their governm…
1257025943438348300,Sun May 03 19:15:13 +0000 2020,RT @CGTNEurope: French firm turning cotton buds into #COVID19 testing swabs Read more: https://t.co/Ogb252WEVs https://t.co/4skdcRIXQ5
1257025876677611500,Sun May 03 19:14:58 +0000 2020,RT @CGTNEurope: After almost two months of lockdown, France will start easing its #COVID19 restrictions on 11 May. https://t.co/37LmRSavt8
1257020394860679200,Sun May 03 18:53:11 +0000 2020,The head of the maker of remdesivir, an anti-viral shown to reduce recovery times in COVID-19 patients, said Sunday… https://t.co/XSl6LPMYGl
1257019055170617300,Sun May 03 18:47:51 +0000 2020,RT @CGTNEurope: 🇩🇪Germany reopens churches；  🇪🇸Spain confirm lowest death rate since March  Here is your COVID-19 daily bulletin https://t.…
1257015594563653600,Sun May 03 18:34:06 +0000 2020,AbCellera Biologics is getting $125 million from the Canadian government to accelerate its research on COVID-19 antibodies. (Bloomberg)
1257015196486455300,Sun May 03 18:32:31 +0000 2020,The Kenya Red Cross says 1,800 families are homeless after heavy rainfall caused flooding and landslides in the western part of the country.
1257012974465810400,Sun May 03 18:23:41 +0000 2020,France’s state-supported “StopCOVID” contact-tracing app should enter its testing phase in the week of May 11 when… https://t.co/aez380mtww
1257010419547414500,Sun May 03 18:13:32 +0000 2020,Greece will move hundreds of migrants from a camp on the island of Lesbos to mainland facilities on Sunday as part… https://t.co/GST4YKlFdn
1257007689693122600,Sun May 03 18:02:41 +0000 2020,South African Airways’ administrators extended a deadline for workers to agree to severance packages (Bloomberg)
1256997020100890600,Sun May 03 17:20:18 +0000 2020,US Secretary of State Pompeo says initial reports on shots fired from DPRK into South Korea this morning indicate t… https://t.co/wIFA2ndc0W
1256995309177180200,Sun May 03 17:13:30 +0000 2020,Singapore confirmed 657 new coronavirus infections on Sunday, the vast majority of them foreign workers living in d… https://t.co/6pZaXBhjPK
1256992856444551200,Sun May 03 17:03:45 +0000 2020,India expects bad debts at its banks could double after the coronavirus crisis brought the economy to a sudden halt… https://t.co/ePaeeCahy2
1256991044736090000,Sun May 03 16:56:33 +0000 2020,Sunny days and warm weather are proving to be as challenging to manage as restaurants, hair salons and other busine… https://t.co/HNyhwacrJh
1256989754454876200,Sun May 03 16:51:25 +0000 2020,The Met Police says detectives investigating a shooting incident in East London in which a child was injured have m… https://t.co/ay1xOil45S
1256986976076644400,Sun May 03 16:40:23 +0000 2020,RT @cgtnamerica: Governor Andrew Cuomo of New York state said on Sunday's press conference that 280 new deaths were confirmed, a slight dro…
1256986793209139200,Sun May 03 16:39:39 +0000 2020,HEAT PODCAST: What is the emotional toll for doctors and frontline workers battling #COVID19?  Dr Qanta Ahmed… https://t.co/PUc2jmKi3t
1256982342536695800,Sun May 03 16:21:58 +0000 2020,The U.K. and the U.S. will start work this week on a free trade agreement that will benefit both countries in the g… https://t.co/SDeD5WwjJl
1256980861985095700,Sun May 03 16:16:05 +0000 2020,RT @cgtnamerica: Italy reports 174 deaths, lowest since first day of lockdown via @AFP
1256980099511070700,Sun May 03 16:13:03 +0000 2020,"It's good news, and represents the benefits of complying with social distancing." @NHSEnglandNMD says "on a seven-… https://t.co/5b4vPc1b6L
1256978077420322800,Sun May 03 16:05:01 +0000 2020,96,559 COVID-19 cases have been reported with 6,750 deaths as of Saturday, the health ministry in Brazil reported.… https://t.co/M9JUopzkcO
