id,created_at,text
1260986025117192200,Thu May 14 17:31:11 +0000 2020,Moscow will begin free mass coronavirus antibody tests on Friday in a program that Mayor Sergei Sobyanin said could… https://t.co/KrXTtUPmCt
1260984922178596900,Thu May 14 17:26:48 +0000 2020,RT @cgtnamerica: A Palestinian was shot dead in the occupied West Bank after ramming a car into Israeli soldiers, according to the Israeli…
1260983001648857000,Thu May 14 17:19:10 +0000 2020,A team of Chinese medical experts on Thursday arrived in Algiers, capital of Algeria, to help the North African cou… https://t.co/7FaFH46rx3
1260981332974473200,Thu May 14 17:12:32 +0000 2020,The planned inauguration on Thursday of an Israeli unity government headed by Prime Minister Benjamin Netanyahu has… https://t.co/LjyI0h2WHK
1260980457249869800,Thu May 14 17:09:03 +0000 2020,A Palestinian rammed a car into Israeli soldiers in the occupied West Bank before being shot dead, the Israeli army said. (AFP)
1260976528369700900,Thu May 14 16:53:26 +0000 2020,President Vladimir Putin said on Thursday Russia's education minister had caught the new coronavirus, making him at… https://t.co/uO9xfpi6Rv
1260973543304675300,Thu May 14 16:41:35 +0000 2020,France on Thursday announced measures worth 18 billion euros ($19 billion) to support its tourism sector, which has… https://t.co/vRFEk7lOVj
1260972516950126600,Thu May 14 16:37:30 +0000 2020,U.S. coronavirus whistleblower Rick Bright says 12-18 months of timeline for vaccine "aggressive schedule". (Xinhua) https://t.co/7PBsMDfQ1B
1260971982478348300,Thu May 14 16:35:23 +0000 2020,RT @cgtnafrica: #ThroughTheLens Kibera neighbourhood in Kenya is known as one of Africa's largest urban slums. But it is also home to some…
1260971077464973300,Thu May 14 16:31:47 +0000 2020,Minnesota's stay-at-home order will be lifted on Monday, allowing retail stores and malls to open with 50% capacity… https://t.co/BsKbrJv1dY
1260968347916734500,Thu May 14 16:20:56 +0000 2020,Sen. Richard Burr will step down as chairman of the Senate Intelligence Committee amid an FBI probe of Burr’s stock… https://t.co/EkMXPZu7u0
1260966267860799500,Thu May 14 16:12:40 +0000 2020,RT @CGTNEurope: As lockdowns ease across Europe, countries are looking into introducing contact tracing apps to avoid a spike of new infect…
1260966078521450500,Thu May 14 16:11:55 +0000 2020,Whistleblower warns of 'darkest winter' if U.S. doesn't plan against coronavirus https://t.co/MLD19AWHE0
1260965622575440000,Thu May 14 16:10:06 +0000 2020,New episode of our Podcast! Do men and women use dating apps differently? HAVE A LISTEN:  https://t.co/ddewIvXeVr https://t.co/NWgCnlG8UG
1260965242735116300,Thu May 14 16:08:36 +0000 2020,RT @CGTNEurope: The EU insisted that any vaccine against coronavirus must be available fairly to all countries, after French drug giant San…
1260964145110888400,Thu May 14 16:04:14 +0000 2020,RT @CGTNEurope: WATCH LIVE: UK govt. officials briefing on the coronavirus outbreak  https://t.co/HZQSOt71T1
1260963461460361200,Thu May 14 16:01:31 +0000 2020,The U.S. lacks a plan to produce and fairly distribute a coronavirus vaccine when it becomes available, says Dr. Ri… https://t.co/sApjMTjpIY
1260956179984941000,Thu May 14 15:32:35 +0000 2020,EU's top court rules Hungary's detention of asylum seekers in border zones illegal. (BBC) https://t.co/niB2pMSOHG
1260955790606774300,Thu May 14 15:31:02 +0000 2020,Dr. Rick Bright, who filed a whistleblower complaint last week, tells House members "Americans deserve the truth,"… https://t.co/twmQQ5Kkyz
1260955188870942700,Thu May 14 15:28:39 +0000 2020,China firmly opposes a proposal made by a few countries including Swaziland to the World Health Organization (WHO)… https://t.co/LjiJs96DVO
1260954838810189800,Thu May 14 15:27:15 +0000 2020,UN Secretary-General Antonio Guterres has called for attention to mental health problems caused by the COVID-19 pan… https://t.co/64zKinK6dU
1260954660606705700,Thu May 14 15:26:33 +0000 2020,U.S. company SILK EV LLC set up a joint innovation center in China and Italy Wednesday, to develop a super sports m… https://t.co/gC0tqaPd22
1260954000909795300,Thu May 14 15:23:55 +0000 2020,WTO Director-General Roberto Azevedo says he will step down at the end of August this year, before the end of his t… https://t.co/BXFGIHV5MU
1260953594104250400,Thu May 14 15:22:18 +0000 2020,Nearly 3 million more workers in the U.S. applied for jobless benefits last week even as the economy started to re-… https://t.co/HPPaxCj2oH
1260953370711535600,Thu May 14 15:21:25 +0000 2020,Delta Air Lines, with more than 14,000 pilots on its roster, expects to have 7,000 more than it needs in the fall a… https://t.co/l2OevCwODU
1260953193690927000,Thu May 14 15:20:43 +0000 2020,The Wisconsin Supreme Court has overturned Democratic Gov. Tony Evers' stay-at-home order to combat the coronavirus… https://t.co/nILOl2Gru3
1260953090624274400,Thu May 14 15:20:18 +0000 2020,It could take up to 5 years before the coronavirus pandemic is under control, the WHO warns.(CNBC) https://t.co/rQgXxVfMHg
1260952942393335800,Thu May 14 15:19:43 +0000 2020,Private jet company Clay Lacy Aviation, founded by a donor to President Trump, received nearly $27 million in coron… https://t.co/FFdPu9hMxu
1260951553395044400,Thu May 14 15:14:12 +0000 2020,RT @CGTNEurope: Iceland has suffered just 10 deaths during the pandemic and has revealed three new testing rules for tourists ✈️  https://t…
1260951440643838000,Thu May 14 15:13:45 +0000 2020,RT @CGTNEurope: EU travel plan might be too late for summer. New scheme would allow people to travel to countries with a similar coronaviru…
1260948304701030400,Thu May 14 15:01:17 +0000 2020,RT @CGTNEurope: NEW EPISODE. How to save the planet: the Razor podcast investigates two of the most exciting new green technologies. LISTEN…
1260947979692728300,Thu May 14 15:00:00 +0000 2020,#Pakistani senate passes resolution to thank China for support in #COVID19 fight https://t.co/R3CBkbs1da
1260947270373179400,Thu May 14 14:57:11 +0000 2020,RT @CGTNEurope: GDP in Germany expected to shrink by 6.3 percent this year, there will be major challenges across almost all sectors of Eur…
1260945949402128400,Thu May 14 14:51:56 +0000 2020,Trump pushes CDC to lower #coronavirus death counts  more: https://t.co/Md8l5wqAgk https://t.co/q6OfyMgScB
1260945901964660700,Thu May 14 14:51:44 +0000 2020,RT @CGTNEurope: Schools that can’t comply with the new measures imposed by the French government remain closed in the villages of the Drôme…
1260942946666340400,Thu May 14 14:40:00 +0000 2020,A pinkish-red salt lake gleams under the desert sun in northern #China's Inner Mongolia Autonomous Region.   Behind… https://t.co/iNQcmyRuNH
1260940283023409200,Thu May 14 14:29:25 +0000 2020,RT @CGTNEurope: Testing, tracing, isolating, quarantining, locking down – what different countries did to fight back  https://t.co/o7DC8XiO…
1260940084838359000,Thu May 14 14:28:38 +0000 2020,RT @CGTNEurope: WHO says the coronavirus could stick around forever, the UK is in talks with a drug manufacturer for 100% accurate COVID-19…
1260939337987833900,Thu May 14 14:25:39 +0000 2020,President #XiJinping urges continued vigilance against #COVID19 outbreak during CPC leadership meeting… https://t.co/2sXDj9Mbzw
1260937913337909200,Thu May 14 14:20:00 +0000 2020,Three years of Macron: A presidency of reform, protest and renewal   more: https://t.co/8g3TEyrkiU https://t.co/QfZzZvq6Jc
1260932886686863400,Thu May 14 14:00:01 +0000 2020,U.S. President Donald Trump and his #coronavirus task force are collectively pressuring the country's CDC to revise… https://t.co/iPp4O38T5M
1260930551973728300,Thu May 14 13:50:45 +0000 2020,HEAT PODCAST: Will reopening the U.S. economy cost a further loss of livelihood - and life - down the road?  John Q… https://t.co/F3e4i2y7jf
1260928231902855200,Thu May 14 13:41:32 +0000 2020,10 killed, 15 injured in construction site collapse in southern #Vietnam https://t.co/nBP3S2Kh7S
1260927846794571800,Thu May 14 13:40:00 +0000 2020,About 4.4 percent of French population infected by #coronavirus: Pasteur Institute https://t.co/kPYpfqatW0
1260922813797539800,Thu May 14 13:20:00 +0000 2020,Headline Chinese ep. 1: Wear a mask (戴口罩 dài kǒu zhào)  Wearing a mask in public has become a compulsive policy in… https://t.co/HR7EvH1ctq
1260917782750924800,Thu May 14 13:00:00 +0000 2020,EU insists #coronavirus vaccine be available to all https://t.co/sEEKnvMZux
1260916491714564000,Thu May 14 12:54:52 +0000 2020,In January, a pregnant woman surnamed Weng died of an unusual pneumonia in Wuhan. 200,000 yuan of medical bills fel… https://t.co/oO6fk7eldl
1260912747635671000,Thu May 14 12:40:00 +0000 2020,Chinese Foreign Ministry bashed #Pompeo's comments: "Lies are lies" https://t.co/h9FqtRxV3r
1260911670567637000,Thu May 14 12:35:43 +0000 2020,#BREAKING Another 2.98 million U.S. workers filed for unemployment as of May 9, according to the U.S. Department of… https://t.co/Cvuv0W3pLq
1260907714227646500,Thu May 14 12:20:00 +0000 2020,How do China's five-year plans address governance? https://t.co/HL2ioi1UoM
1260904833294323700,Thu May 14 12:08:33 +0000 2020,Chinese President #XiJinping chairs leadership meeting on epidemic control https://t.co/umxK46DEA3 https://t.co/mpHytZnshY
1260902681520070700,Thu May 14 12:00:00 +0000 2020,❌China's initial cover-up and delayed release of information resulted in the spread of the coronavirus.  ✅China beg… https://t.co/bJQUdp9K20
1260902681486467000,Thu May 14 12:00:00 +0000 2020,.@WHO: #coronavirus may "never go away" but countries should stay positive https://t.co/4sl2x4Dmkn
1260897647784865800,Thu May 14 11:40:00 +0000 2020,Route built for Qomolangma re-measurement reaches altitude of 8,600m https://t.co/fPHMyGdb6f
1260892614800236500,Thu May 14 11:20:00 +0000 2020,How is China spurring on foreign trade via its Five-Year Plans?   more: https://t.co/BikhDukvbx https://t.co/uLOIIQcL8W
1260887581828558800,Thu May 14 11:00:00 +0000 2020,.@WHO has published updated advisories of measures that can be adopted by schools to prevent a #COVID19 outbreak af… https://t.co/Cj3RbCUa6M
1260882548168683500,Thu May 14 10:40:00 +0000 2020,Opinion: The pandemic made the path for better China-U.S. ties harder #CGTNFirstVoice https://t.co/wh2SbWRqat
1260877515083657200,Thu May 14 10:20:00 +0000 2020,UN warns of locust comeback in East Africa https://t.co/Nd1Ut9cxF6 https://t.co/T6N0tCnKLG
1260876309728649200,Thu May 14 10:15:12 +0000 2020,In the latest #Covid19Frontline livestream session, medics from the West China Hospital of Sichuan University will… https://t.co/YOVFMdPfWp
1260872483537924000,Thu May 14 10:00:00 +0000 2020,Students from Xuguang Middle school in Wuhan City, once the epicenter of the coronavirus outbreak, wrote a letter t… https://t.co/vA2mf5dRYw
1260871799631306800,Thu May 14 09:57:17 +0000 2020,Live: Health workers in Spain hold 2-minute silence to pay tribute to colleagues who died of #COVID19 #coronavirus https://t.co/MrKBLwV64Q
1260867448640848000,Thu May 14 09:40:00 +0000 2020,How do China's five year plans set goals, missions for national defense?   more: https://t.co/d2or7gwpH3 https://t.co/HNdfFuMB7B
1260862415648034800,Thu May 14 09:20:00 +0000 2020,Listen to the former U.S. ambassador to #China discuss their current relationship   more: https://t.co/Vhw0QWZhjQ https://t.co/qpLLMf48vn
1260858493403164700,Thu May 14 09:04:25 +0000 2020,#BREAKING Thirty-nine out of Japan's 47 prefectures will lift their state of emergency, Japanese Prime Minister Shi… https://t.co/NscjwC3F7n
1260857387142922200,Thu May 14 09:00:01 +0000 2020,Watch out for stonefish as you walk in the ocean – a sting from this animal's venom-filled dorsal spines could lead… https://t.co/25uTH0S688
1260852349167374300,Thu May 14 08:40:00 +0000 2020,Elderly UK woman knits hospital to raise money for NHS https://t.co/HJAknolzSZ
1260847316069683200,Thu May 14 08:20:00 +0000 2020,Wild giant panda spotted in SW #China's closed mining area  more: https://t.co/ABeSKAkVbh https://t.co/HL09pOL2qv
1260842285660430300,Thu May 14 08:00:00 +0000 2020,At least six people were killed during #COVID19 related demonstrations on Tuesday in the Coyah, Dubreka and Kamsar… https://t.co/vC16J3tggb
1260840937397186600,Thu May 14 07:54:39 +0000 2020,Russia has over 250,000 #coronavirus cases, the second highest worldwide, after 9,974 new cases were confirmed in t… https://t.co/bIGebASOIW
1260837249974849500,Thu May 14 07:40:00 +0000 2020,#Wuhan to test 11 million people for #COVID19 in 10 days https://t.co/1CFiUUB0cZ
1260836452348256300,Thu May 14 07:36:50 +0000 2020,Asymptomatic #COVID19 cases in the Chinese mainland dropped by 22 percent in the last 10 days, a National Health Co… https://t.co/lvzT0RnNE1
1260832216680030200,Thu May 14 07:20:00 +0000 2020,#Canada zoo to send pandas home after bamboo shortage #COVID19 #coronavirus https://t.co/hxj0F8QvzW
1260827734495776800,Thu May 14 07:02:11 +0000 2020,Live: The role of 'Fang Cang' shelter hospitals in treatment and containment of #COVID-19 https://t.co/E7nyMqgw1Y
1260827184354062300,Thu May 14 07:00:00 +0000 2020,❌China expelled U.S. journalists to hide the truth about #COVID19  ✅China's measure was a response to long-term opp… https://t.co/Du26bb1ZnG
1260822150144905200,Thu May 14 06:40:00 +0000 2020,A Chinese medical team of 20 experts from #Chongqing and #Macao SAR, the largest of its kind from China to help com… https://t.co/rOUSmbLF7E
1260817117332439000,Thu May 14 06:20:00 +0000 2020,#StoryofFightingCOVID19: Fighting bulls fall prey to lockdown  #COVID19 #coronavirus https://t.co/aYLNPqGzJR
1260812084834635800,Thu May 14 06:00:00 +0000 2020,After seeing reports of tigers and lions at a New York City zoo testing positive for #COVID19, officials at Sichuan… https://t.co/MBdlkLZKAI
1260807050793119700,Thu May 14 05:40:00 +0000 2020,Mountains get seasonal cleaning in #Tibet  more: https://t.co/WhlO8tQRlX https://t.co/zIEdsfehvg
1260802017523613700,Thu May 14 05:20:00 +0000 2020,#AnswerBank: Are contact lens wearers more at risk of catching #COVID19 than glasses wearers?  more:… https://t.co/SP9b293KQM
1260797825081737200,Thu May 14 05:03:20 +0000 2020,Live: Explore the Tsering Chey Nga Snow Mountain Museum in China's Lhasa, #Tibet Autonomous Region #Tibetan https://t.co/URg06WOOxU
1260796986246250500,Thu May 14 05:00:00 +0000 2020,A #Moscow hospital discharged a 100-year-old woman after she recovered from #COVID19 https://t.co/OjvW4XHjp4
1260791951302881300,Thu May 14 04:40:00 +0000 2020,Water lilies embrace the summer in SW #China pond  more: https://t.co/TyHSAwrDk1 https://t.co/pG2smBv3Jx
1260789435194622000,Thu May 14 04:30:00 +0000 2020,#Chile capital #Santiago to go under total lockdown after #COVID19 spike  more: https://t.co/XEccMh6DBh https://t.co/L2Es804ySo
1260786918129913900,Thu May 14 04:20:00 +0000 2020,#Italy approves 55 billion euro stimulus package in #coronavirus fight https://t.co/A7NnzFwy90
1260781888492298200,Thu May 14 04:00:01 +0000 2020,A rare white roe deer was spotted hunting for food in NE China recently, the Northeast Tiger and Leopard National P… https://t.co/XchUkL40J9
1260776851791806500,Thu May 14 03:40:00 +0000 2020,Ride-hailing companies require drivers, riders to wear masks worldwide #COVID19 #coronavirus https://t.co/In4TGfXBj7
1260774163830145000,Thu May 14 03:29:19 +0000 2020,RT @cgtnamerica: Listen to the former U.S. ambassador to China on how the relationship got so bad.  The trade war and coronavirus are parti…
1260771818979364900,Thu May 14 03:20:00 +0000 2020,.@WHO Representative in #China Gauden Galea @gauden has written back to a student from #Wuhan in a four-page letter… https://t.co/wvXk5xDFUh
1260770353552318500,Thu May 14 03:14:10 +0000 2020,Changdao Series: The line between two seas  more: https://t.co/DGryqIqu9I https://t.co/P8yWep1eRH
1260761752276516900,Thu May 14 02:40:00 +0000 2020,#Australia's seasonally adjusted jobless rate has soared to 6.2 percent, with 594,300 jobs lost in April, according… https://t.co/LRF84k19sE
1260757538699530200,Thu May 14 02:23:15 +0000 2020,Chinese firefighters put up statue for hero dog in #Wenchuan earthquake https://t.co/aVnYe07r9A
1260751686919839700,Thu May 14 02:00:00 +0000 2020,China's top economic planner announced on Wednesday that it will take actions to fuel the transformation of small a… https://t.co/8okllb2LjV
1260746652710768600,Thu May 14 01:40:00 +0000 2020,🇨🇳🇩🇿 Chinese medical team departs for #Algeria to help fight #COVID19 https://t.co/Z3GvwA76fC
1260741619524857900,Thu May 14 01:20:00 +0000 2020,.@WHO: #Coronavirus may “never go away” but countries should stay positive https://t.co/4sl2x4UXbV
1260739764862386200,Thu May 14 01:12:38 +0000 2020,The Director-General of the World Trade Organization (WTO) Roberto Azevedo intends to step down before his term end… https://t.co/qOUe3fH2Jy
1260736587677274000,Thu May 14 01:00:00 +0000 2020,❌China controls and bribes the #WHO.  ✅China has never attempted to manipulate the WHO. In WHO's 21-member leadersh… https://t.co/J6w2ihfTlH
1260733611185078300,Thu May 14 00:48:10 +0000 2020,On Wednesday, the Chinese mainland reported:    - Three new domestic #COVID19 cases, two in Liaoning and one in Jil… https://t.co/S6O7Yyovl7
1260730295097020400,Thu May 14 00:35:00 +0000 2020,#Brazil reports 11,385 new #COVID19 cases and 749 more deaths, taking nationwide infection tally to 188,974 and dea… https://t.co/Pl6cQuM6zu
1260727567994114000,Thu May 14 00:24:10 +0000 2020,#COVID19 updates in the U.S.:  - 1,388,936 cases and 84,059 deaths as of 10:32 p.m. GMT Wednesday, according to Joh… https://t.co/9U0HVbRLRW
1260723121104937000,Thu May 14 00:06:29 +0000 2020,Expert: U.S. has not prevailed over outbreak #COVID19 #coronavirus https://t.co/4GOHi2gzdc
1260716453944275000,Wed May 13 23:40:00 +0000 2020,Large-scale nucleic acid tests should be carried out for high-risk groups and communities, such as Dongxihu Distric… https://t.co/qGLkKyBPGx
1260713782378201000,Wed May 13 23:29:23 +0000 2020,RT @cgtnamerica: See what it's like for a nurse working on the coronavirus frontlines in Turkey.  https://t.co/p2iuQN9jKp https://t.co/kQck…
1260711420704014300,Wed May 13 23:20:00 +0000 2020,Earthquake rescue drill uses 5G technology for the first time https://t.co/NCGHjQzQJQ
1260709800309997600,Wed May 13 23:13:33 +0000 2020,RT @cgtnamerica: American protestors are marching in Ahmaud Arbery’s final footsteps, demanding justice for this 25-year-old black man shot…
1260707518801744000,Wed May 13 23:04:29 +0000 2020,RT @cgtnamerica: CGTN's Zou Yue offers commentary on how China should respond to accusations and criticism from others.  https://t.co/UTNsl…
1260706887504408600,Wed May 13 23:01:59 +0000 2020,RT @cgtnamerica: A nurse working in New York says that black and latino #coronavirus patients are being "murdered" due to "gross negligence…
1260706412201750500,Wed May 13 23:00:06 +0000 2020,Rick Bright, the fired director of the office responsible for developing medical countermeasures against the… https://t.co/m0T0YFb93J
1260706388860219400,Wed May 13 23:00:00 +0000 2020,❎#COVID19 was caused by an accidental leak from the Wuhan Institute of Virology.  ✅As a China-France cooperation pr… https://t.co/vEgX26vEpn
1260706387430043600,Wed May 13 23:00:00 +0000 2020,China's Wuhan prepares for risks despite the flattened #COVID19 curve https://t.co/A9zUXk8tRb
1260704560894619600,Wed May 13 22:52:44 +0000 2020,RT @cgtnamerica: As more business reopen across the United States, many worry about an increase in new cases. See the latest. #covid19 #cor…
1260704543618338800,Wed May 13 22:52:40 +0000 2020,RT @cgtnamerica: More than 20 clowns were arrested in Peru for violating #coronavirus restrictions this week. See the clowns were sent in t…
1260701924699050000,Wed May 13 22:42:16 +0000 2020,RT @cgtnamerica: “This virus may never go away,” WHO says. https://t.co/Lx3g1SqHnz
1260701568397123600,Wed May 13 22:40:51 +0000 2020,Wisconsin's Supreme Court declares that Gov. Tony Evers' administration exceeded its authority by extending a stay-… https://t.co/4ZYn8595g4
1260701510423457800,Wed May 13 22:40:37 +0000 2020,HEAT PODCAST: Will reopening the U.S. economy cost a further loss of livelihood - and life - down the road?  John Q… https://t.co/P9TgG1Ksab
1260701384606974000,Wed May 13 22:40:07 +0000 2020,RT @cgtnamerica: New York Governor Andrew Cuomo said antibodies testing in the state showed frontline workers, including health care worker…
1260697786732994600,Wed May 13 22:25:49 +0000 2020,A rapid #coronavirus test touted by President Donald Trump and used to test White House officials produces false ne… https://t.co/jvxkxIYXNx
1260696212107415600,Wed May 13 22:19:34 +0000 2020,U.S. President Donald Trump said he “totally disagrees” with Dr. Anthony Fauci on reopening schools. Fauci testifie… https://t.co/hFM4OfJPZA
1260694189442060300,Wed May 13 22:11:31 +0000 2020,RT @cgtnamerica: They've been given a horrible name, but is the #murderhornet really that dangerous? Find how why it's not and how its been…
1260686506471153700,Wed May 13 21:41:00 +0000 2020,The U.S. @NatlParkService says national parks @YellowstoneNPS and @GrandCanyonNPS will partially reopen as the… https://t.co/I7ONU1Qx3P
1260683762242707500,Wed May 13 21:30:05 +0000 2020,RT @cgtnamerica: U.S. Secretary of State Mike Pompeo met with Israel's Benjamin Netanyahu in Jerusalem today. They discussed Israel's plans…
1260683270146138000,Wed May 13 21:28:08 +0000 2020,RT @cgtnamerica: Washington D.C. saw a protest of busses today as bus drivers staged a #rollingrally to ask the government to pass a $15 bi…
1260681805104963600,Wed May 13 21:22:19 +0000 2020,RT @cgtnamerica: As Brazil’s COVID-19 cases continue to rise, Maracana Stadium in Rio de Janeiro has been converted into a 400-bed field ho…
1260680887718408200,Wed May 13 21:18:40 +0000 2020,RT @cgtnamerica: West Virginia is now allowing restaurants to cautiously reopen. Some customers shared their dining experience after the re…
1260677208500252700,Wed May 13 21:04:03 +0000 2020,RT @cgtnamerica: A Syrian-Canadian used her resources in the fashion industry to buy and send #ppe from China to aid in the #covid19 pandem…
1260675349710585900,Wed May 13 20:56:40 +0000 2020,RT @cgtnamerica: Zimbabwe President Emmerson Mnangagwa said Tuesday that his country could learn from China's experience in dealing with th…
1260674246025580500,Wed May 13 20:52:17 +0000 2020,Immunologist Rick Bright says the U.S. faces the “darkest winter in modern history” unless leaders prevent a reboun… https://t.co/SNlcGVLZh7
1260673095519568000,Wed May 13 20:47:42 +0000 2020,RT @cgtnamerica: “China is not going to go back to normal until the rest of the world has come back to normal”  Read where top economists t…
1260672399588147200,Wed May 13 20:44:56 +0000 2020,RT @cgtnamerica: International relations analyst Tom Fowdy shares offers commentary on Donald Trump's anti-China rhetoric and the implicati…
1260666144391942100,Wed May 13 20:20:05 +0000 2020,RT @CGTNEurope: Could a four-year-old Belgian llama called Winter hold the key to an effective antiviral treatment against COVID-19? A grou…
1260664860708397000,Wed May 13 20:14:59 +0000 2020,RT @cgtnamerica: Children with #covid19 often can't see their parents for months, see how nurses in Wuhan, China stepped in as "temporary p…
1260663870001238000,Wed May 13 20:11:03 +0000 2020,U.S stocks continue to fall as states are reopening. Dow drops 516 points or 2.1%. S&amp;P closes 1.8% lower. Nasdaq fa… https://t.co/cYXVauyQUA
1260658048336445400,Wed May 13 19:47:55 +0000 2020,RT @cgtnamerica: Prague-based U.S. journalist Bradley Blankenship shares his views on U.S. President Donald Trump's recent actions and atta…
1260656509232361500,Wed May 13 19:41:48 +0000 2020,RT @cgtnamerica: See how one restaurant in West Virginia is re-opening during the #coronavirus pandemic. Staff at the #rabbithole must wear…
1260656491792457700,Wed May 13 19:41:44 +0000 2020,RT @cgtnamerica: When the world scientists are racing against time to develop vaccines, a Chinese firm announced they have built the world'…
1260652654369202200,Wed May 13 19:26:29 +0000 2020,RT @cgtnamerica: A Swedish couple have opened a one table,one chair, dining experience. And they are booked through the summer.  #COVID19…
1260650847974813700,Wed May 13 19:19:18 +0000 2020,RT @cgtnamerica: Some U.S. businesses are attempting to reopen after stay-at-home orders were issued months ago. Health Tech may make envir…
1260646978003718100,Wed May 13 19:03:55 +0000 2020,RT @cgtnamerica: See what Trump said to Chinese-American journalist @Weijia Jiang this week when she asked him why he was treating the numb…
1260645614137692200,Wed May 13 18:58:30 +0000 2020,#BREAKING: Sen. Rand Paul: "Vice President Biden and more than a dozen Obama administration officials requested and… https://t.co/iiEtfj6T37
1260642611481776000,Wed May 13 18:46:34 +0000 2020,Brazil airline Gol Linhas Aereas Inteligentes said on Wednesday it will receive 2.4 billion reais ($412 million) fr… https://t.co/vlPh0QvRFU
1260641180175474700,Wed May 13 18:40:53 +0000 2020,Grenell releases list of officials who sought to 'unmask' Flynn: Biden, Comey, Obama intel chiefs among them (Fox News)
1260640477642137600,Wed May 13 18:38:06 +0000 2020,Yellowstone National Park will begin to reopen on a limited basis on May 18, almost two months after it closed to v… https://t.co/bFU0LtS7Q1
1260636754756997000,Wed May 13 18:23:18 +0000 2020,There are at least 1,379,756 cases of coronavirus in the US and at least 83,150 people have died, according to John… https://t.co/v7QDQlrcmj
