id,created_at,text
409152653495517200,Sat Dec 07 02:49:28 +0000 2013,Lots of people working hard to get ready for San Diego Mini Maker Faire on Saturday.  #makerfaire http://t.co/tbXs7Qj7Cu
409119866323341300,Sat Dec 07 00:39:11 +0000 2013,LEO The Maker Prince, a new book by Carla Diana.  Let's Talk 3D Printing with Children. http://t.co/NcziKiHAZe
409112378005930000,Sat Dec 07 00:09:26 +0000 2013,I met with Paul Eichen, the founder of Rockenbok, a construction playset that is perfect for young makers. http://t.co/kWVt2Wt0Qm
409101777565270000,Fri Dec 06 23:27:19 +0000 2013,Two NorCal Wal-Marts doing 3D printing demos this weekend.  Chance to get MAKE's Ultimate Guide to 3D Printer issue. http://t.co/MjKT8evRD3
408658734441693200,Thu Dec 05 18:06:49 +0000 2013,Citizen Exploration: An Amateur Revolution from David Lang http://t.co/KIpaPPAtSC via @make
407945376847519740,Tue Dec 03 18:52:11 +0000 2013,Try again with URL: MakerBot CEO Bre Pettis weighs in on Stratasys suit, patents, and more with @ptorrone. http://t.co/kB98MEka83  @make
407944699383529500,Tue Dec 03 18:49:30 +0000 2013,@GreeterDan Oops.  Bre Pettis interview link: http://t.co/kB98MEka83
407944081365413900,Tue Dec 03 18:47:02 +0000 2013,MakerBot CEO Bre Pettis weighs in on Stratasys suit, patents, and more in interview with @ptorrone. @make
407759634980552700,Tue Dec 03 06:34:07 +0000 2013,Santiago Mini Maker Faire : Oculus Rifting &amp; DIY Instrument Band: http://t.co/rNDd4Evsqz via @make
407245322008535040,Sun Dec 01 20:30:25 +0000 2013,Good thoughts.  “Timeless Advice to Young Men and Women in Science from Edward.O.Wilson” by @DesktopDiaries https://t.co/zKLUJp3lA8
406873222580154400,Sat Nov 30 19:51:50 +0000 2013,New kids' book LEO the Maker Prince, features a 3D printing robot and cool objects you can download and make http:/www.leothemakerprince.com
406548871683141600,Fri Nov 29 22:22:58 +0000 2013,Sew What? iFixit and Patagonia Turn Black Friday on its Head: http://t.co/H26UCD4myd via @make
405951150626598900,Thu Nov 28 06:47:51 +0000 2013,@willbradley @makerfaire can you give me more context in an email?
405883338608492540,Thu Nov 28 02:18:23 +0000 2013,Happy Thanksgiving 2013 http://t.co/OUCjYMutlr
405856316218171400,Thu Nov 28 00:31:00 +0000 2013,Thankful for Fall Colors - We were in Mendocino County last Sunday and stopped by a roadside farmstand. I saw thes... http://t.co/t6CqEbewyL
405495023287795700,Wed Nov 27 00:35:21 +0000 2013,Late Concord Grapes - There were still some Concord Grapes on the vine last week. It is a little late in the seaso... http://t.co/UtT6NYRjbG
405426364133568500,Tue Nov 26 20:02:32 +0000 2013,Bring your maker mindset to the workplace.  "When Making Meets Working" by Chris Curran: http://t.co/Cmx1UqkPnS via @make
405401666792345600,Tue Nov 26 18:24:24 +0000 2013,The Maker Movement Loses its Datamancer: a tribute from Gareth Branwyn http://t.co/oSRacwIZlD via @make
404034960169779200,Fri Nov 22 23:53:35 +0000 2013,Remaking the ways kids learn @globeandmail article about Toronto's @Maker_Kids! http://t.co/wQNsGWqoTZ by @Dave_McGinn @make
403956609602170900,Fri Nov 22 18:42:15 +0000 2013,Massimo Banzi on his recent trip to China: http://t.co/SDLzDh1csM via @make
403658048964542460,Thu Nov 21 22:55:53 +0000 2013,Turning a pile of old t-shirts into a keepsake quilt, Project Repat. Talked to co-founder Nathan Rothstein today http://t.co/S2evtzZoQa.
403194343550222340,Wed Nov 20 16:13:17 +0000 2013,Internet of Things means Internet of Customers and their interactions.  Benioff's vision of connection http://t.co/lLs6ztKxCG via @sfgate
402962342087884800,Wed Nov 20 00:51:23 +0000 2013,RT @DavidBrin: #Bitcoin and the Three Laws of Robotics  http://t.co/6EkH0uzuHJ
402678794063863800,Tue Nov 19 06:04:40 +0000 2013,RT @t: The Homebrew Computer Club 38th Reunion: Inspiration To Try A Variant: http://t.co/zmQnXEHWeS
402528549145301000,Mon Nov 18 20:07:39 +0000 2013,Using Scooters and Go-Karts to Disrupt Engineering Education: http://t.co/Rg24YUAWsz via @make
401408218762862600,Fri Nov 15 17:55:51 +0000 2013,Jane Werner: I'm sure that because I can sew is connected to why I am a museum director today.   Wonderful.
401407776188301300,Fri Nov 15 17:54:06 +0000 2013,Jane Werner of Pitts Children Museum: I  sew.  I learned to do it when I was twelve.  I sewed the dress I'm wearing.
401404362783993860,Fri Nov 15 17:40:32 +0000 2013,RT @GDBDMiguel: @dalepd The entries for the Technofunding Innovation Awards (TIA2013) are now open.Get more info at http://t.co/faedV8z1VD …
401403946469982200,Fri Nov 15 17:38:53 +0000 2013,RT @mauramarx: @andreakalinka on incredible success of @US_IMLS -funded makerspace at @chipublib  - almost 18,000 visitors since July
401403664881180700,Fri Nov 15 17:37:46 +0000 2013,I presented at IMLS (libraries and museums) meeting in Birmingham AL. Andrea Saenz of Chicago Public Library followed to talk on maker lab.
401402757531582460,Fri Nov 15 17:34:09 +0000 2013,I was Exploratorium's Tinkering Studio for launch of the book, The Art of Tinkering, by Karen W. and Mike Petrich. http://t.co/iJ5TyejVft
401097229034741760,Thu Nov 14 21:20:06 +0000 2013,Don't Ask.  Permissionless Innovation On the Internet (and beyond). http://t.co/Rr0p46VpIs
401015644537106400,Thu Nov 14 15:55:54 +0000 2013,RT @ProtoExchange: #3dprinting #news Leapfrog launches Xeed 3D printer with on-board tablet interface http://t.co/RTd5QVvFg3
400785247052496900,Thu Nov 14 00:40:23 +0000 2013,New Meat - Ben and Sarah raised a herd of angus-cross cattle this year. The first two went to the butcher several ... http://t.co/ef8ryZtgD8
400490470570070000,Wed Nov 13 05:09:03 +0000 2013,Rube Goldberg's marvelous machines - Boing Boing http://t.co/Mtp5Tfhke9
400443850444910600,Wed Nov 13 02:03:48 +0000 2013,The new MAKE Ultimate Guide to 3D Printing 2014. 23 Printers reviewed + tutorials! on newsstands and @makershed http://t.co/xuE8U09R6w
399629165239877600,Sun Nov 10 20:06:32 +0000 2013,RT @marcprecipice: Parents of NYC: Brooklyn Robot Foundry (@robotfoundry) is awesome for kid parties. See also: http://t.co/ECADouzup3
399195086937796600,Sat Nov 09 15:21:40 +0000 2013,Shannon O'Hare featured. Vallejo sees influx of artists from pricier areas http://t.co/FcVkvoe1ta via @sfgate
398895747522785300,Fri Nov 08 19:32:12 +0000 2013,RT @makerbridge: Travis Good speaks to the importance of maker ecosystems, institutions working together to create maker cities, #litaforum
398621011098075140,Fri Nov 08 01:20:29 +0000 2013,Maker Pro Newsletter: You’re not putting goo in your machine, you’re putting in chemistry. #3dprinting #3dscanning http://t.co/ItGET74qxK
398576945824141300,Thu Nov 07 22:25:23 +0000 2013,RT @arduinogirl: I'm thrilled that my grad student's work with architectural photogrammetry will be in @make 's January drone issue! Thanks…
398489164468858900,Thu Nov 07 16:36:35 +0000 2013,Bad news: Internet Archive's S.F. office damaged in fire http://t.co/Nj5xxu5e2i via @sfgate
397517950904590340,Tue Nov 05 00:17:19 +0000 2013,RT @johannes_mono: RT @_nothingtohide_: NSA scandal, 1970 edition. http://t.co/0m1izgUDGX
397060869487476740,Sun Nov 03 18:01:02 +0000 2013,RT @fabbing: 3D Printed Horseshoes Opens Up Human Possibilities http://t.co/2XwTsXqLr0 #3dprinting #fabbing
397027992875962400,Sun Nov 03 15:50:24 +0000 2013,Heath Ceramics: New owners mold revamped firm from same classic clay http://t.co/A7cjhEon1C via @sfgate
396727063987490800,Sat Nov 02 19:54:37 +0000 2013,RT @davidtlang: . Dr. Marcia McNutt, EIC of Science, talking about the importance of citizen explorers. cc: @planetlabs @3DRobotics http://…
396684129015574500,Sat Nov 02 17:04:01 +0000 2013,Museums curate the past, Fairs celebrate the future. 1893 World's Fair in Chicago re-considered. @nytimes http://t.co/hnuvecc4rh
396487444146581500,Sat Nov 02 04:02:27 +0000 2013,Thanks to Mill Valley City Librarian Anji Brenner who made her t-shirt and 300 people who came to my talk. http://t.co/1BtdFBp4JE
396443181090222100,Sat Nov 02 01:06:34 +0000 2013,I'm at Mill Valley Public Library for a talk tonight. http://t.co/9gD6ntRHDb
395723990440095740,Thu Oct 31 01:28:46 +0000 2013,Merchant House Ghost Tour in NYC with Glenda, Nancy, Kelsey and Kendall. http://t.co/KK3YDiabEL
395260289035550700,Tue Oct 29 18:46:11 +0000 2013,@ricetopher I leave tomorrow but I met John Nash who knows you.  @jnash
395231814388052000,Tue Oct 29 16:53:02 +0000 2013,@ricetopher are you at the Innovate to Learn Conference in Lexington?
395222037217943550,Tue Oct 29 16:14:11 +0000 2013,I am speaking today at the Innovate to Learn Conference organized by UK College of Education in Lexington KY.
394986634157912060,Tue Oct 29 00:38:46 +0000 2013,Southern Smart and Friendly: Atlanta's Maker Faire: http://t.co/ljVMKnURNx via @make
394534926160527360,Sun Oct 27 18:43:51 +0000 2013,Ride on Curlin finished 3rd.  Pretty grey/roan horse named Coastline won. https://t.co/pCQ4Xn1mpe
394532354519072800,Sun Oct 27 18:33:38 +0000 2013,Brother Dan's horse, Ride on Curlin, running in the fifth race at Churchill Downs. http://t.co/wHs729OO06
394529775785893900,Sun Oct 27 18:23:23 +0000 2013,In the paddock at Churchill Downs with Ride on Curlin, and my brother Dan and his family. https://t.co/ZbTEZH84a1
394312361970245600,Sun Oct 27 03:59:27 +0000 2013,Kimberly Varney, lead organizer of the Atlanta Mini Maker Faire, found a moment to reflect on the event. #ammf http://t.co/aqYwyqHbJZ
394307749007589400,Sun Oct 27 03:41:07 +0000 2013,Check out @kojote #TheDanielProject - printing Prosthetics for Kids in Africa
394302006388457500,Sun Oct 27 03:18:18 +0000 2013,Mobile Makerspace for education called Ste(a)m Truck from Community Guilds in Atlanta at #ammf. http://t.co/7Y6p91lH85
394206290513100800,Sat Oct 26 20:57:58 +0000 2013,Breck from Brooklyn Aerodrome is here flying.  #ammf http://t.co/Gbp3mVH1xm
394205881313026050,Sat Oct 26 20:56:20 +0000 2013,Awesome escapades of Art bikes from http://t.co/Y0AHFJtUII.  #AMMF #makerfaire https://t.co/m6TXtIB7TE
394204641316991000,Sat Oct 26 20:51:25 +0000 2013,Steamsaucer by Dan Rascak at #ammf #makerfaire http://t.co/uEaELaPPqx
394203569261658100,Sat Oct 26 20:47:09 +0000 2013,Skeleton theremin for Halloween from Decatur Makers. . #makerfaire #AMMF https://t.co/fM3MfBT0wj
394177703709900800,Sat Oct 26 19:04:22 +0000 2013,Tim from @hello_robo and his 3d printed humanoid robot.  He is a student at SCAD. #ammf #makerfaire http://t.co/ST6ujYhL7p
394176623349878800,Sat Oct 26 19:00:05 +0000 2013,Wonderful Kinetic sculpture made from typewriter parts by #makerfaire #AMMF Maker Joe. https://t.co/D4WsS6fOxv
394171437222621200,Sat Oct 26 18:39:28 +0000 2013,Colorful mural by Katie Bush in progress.  #ammf #makerfaire http://t.co/4R5QNuHFPf
394169144976764900,Sat Oct 26 18:30:22 +0000 2013,Smart Jars, an organizing system for pegboards.  On kickstarter.   #ammf http://t.co/rwcD5psFWx
394168425188446200,Sat Oct 26 18:27:30 +0000 2013,JD Warren's Lawnbot in motion #AMMF #makerfaire https://t.co/RkaCYzzWo3
394168041140785150,Sat Oct 26 18:25:58 +0000 2013,JD Warren from Birmingham with a pair of Lawnbots and a segbot.  Was on cover of Make in 2010 @make http://t.co/CerADBd2vH
394165770613440500,Sat Oct 26 18:16:57 +0000 2013,Steve Pritchard, wood turner.  #AMMF #makerfaire https://t.co/YKEySAEzKR
394164810256228350,Sat Oct 26 18:13:08 +0000 2013,Pedal powered fridge door opener #makerfaire #AMMF https://t.co/CLp3WabWia
394164346034462700,Sat Oct 26 18:11:17 +0000 2013,Atlanta Mini Maker Faire  is going strong on Georgia Tech Campus.  #AMMF @make http://t.co/itImP8NgLe
394163627093000200,Sat Oct 26 18:08:26 +0000 2013,Nerdy Derby track in service at #AMMF. http://t.co/yG5Wq5L3cM
394159316376498200,Sat Oct 26 17:51:18 +0000 2013,@NishantMehta hi. I leave ATL in morning.  I'm at the Faire all day.
394158711721435140,Sat Oct 26 17:48:54 +0000 2013,RT @StephenFleming: Atlanta: Bundle up and visit the Maker Faire today! Free @georgiatech. http://t.co/7KVHrXnwdx cc @atlmakerfaire #AMMF13
394156070308171800,Sat Oct 26 17:38:24 +0000 2013,Wendy Tremayne says makers are revolutionaries in an age when everything is for sale.  The Good Life Lab.  #makerfaire #atlanta. @make
394114086721822700,Sat Oct 26 14:51:35 +0000 2013,Atlanta debut of "If You Build It", a doc film about Emily Pilloton's efforts to create design/build shop in a rural county. #ifyoubuildit.
393890171072303100,Sat Oct 26 00:01:49 +0000 2013,The organizers of the Atlanta Mini Maker Faire and me at the Georgia Tech Invention Studio.  #makerfaire. @make http://t.co/3BhsxBinrN
393501224164540400,Thu Oct 24 22:16:17 +0000 2013,Remaking the chemistry set for a new generation:  a $50K Challenge.  http://t.co/cXaHHlXjYI via @make
392799619609948160,Tue Oct 22 23:48:21 +0000 2013,@mpetricone we have been talking about doing Maker Faire in DC.   Want to help make it happen?
392734711585316860,Tue Oct 22 19:30:26 +0000 2013,RT @CEA: Anyone can design or develop a product, which I think can be pretty disruptive - @dalepd #IndustryForum
392138688454348800,Mon Oct 21 04:02:03 +0000 2013,@Luziadell @MyrabellaWP 1955.
392138556740599800,Mon Oct 21 04:01:32 +0000 2013,@johnrlyman Terrific.  Glad you were there with your daughter.
392091388977754100,Mon Oct 21 00:54:06 +0000 2013,Congrats to @EBMakerFaire team, Park Day School and @sannmer on charming "fall festival" vibe for today's East Bay Mini Maker Faire.
392070344397185000,Sun Oct 20 23:30:29 +0000 2013,Oakland Makers and Steve Young representing at EB #makerfaire. http://t.co/6rp7Ac5NjA
392068090046865400,Sun Oct 20 23:21:31 +0000 2013,The Riveropolis floating island is beautiful.  EB. #makerfaire http://t.co/N88JRkROcJ
392067579071987700,Sun Oct 20 23:19:29 +0000 2013,Riveropolis is one the the great play areas at EB #makerfaire https://t.co/9yfEEfQORw
392066412380168200,Sun Oct 20 23:14:51 +0000 2013,Crate stacking contest at East Bay Maker Faire.  15 crates so far. Reached 17.  Day's record is 24. https://t.co/FzIo6kBGvm
392062745593790460,Sun Oct 20 23:00:17 +0000 2013,Remote control Tilt-o-whirl from NIMBY.  #makerfaire https://t.co/DTAFTBadLi
392029317959782400,Sun Oct 20 20:47:27 +0000 2013,People powered ride at East Bay Maker Faire.  Beautiful day.  #Makerfaire https://t.co/LGuuJtAQyx
391603010310135800,Sat Oct 19 16:33:27 +0000 2013,I have visited Buffalo Trace distillery.  Kentucky’s Case of the Missing Bourbon, via @nytimes http://t.co/NIlHWUeMHJ
390978083190108160,Thu Oct 17 23:10:13 +0000 2013,Excellent article.   "Blessed Are the Makers: The Rise and Fall of 3rd Ward" http://t.co/me2SMSLL99 via @hyperallergic
390181175488045060,Tue Oct 15 18:23:36 +0000 2013,I set up a new Orion Delta-style 3D printer from SeeMeCNC.   I'm printing out first sample.  It's mesmerizing. @make http://t.co/j0mBPZ79ma
389114704859529200,Sat Oct 12 19:45:49 +0000 2013,@MiniCut2d thank you.  We just got to Paris.  Good luck.
389011765755138050,Sat Oct 12 12:56:47 +0000 2013,Making liquid nitrogen ice cream, and serving samples.  #Makerfairestm https://t.co/7V96tuxlm2
389001961456287740,Sat Oct 12 12:17:49 +0000 2013,Made with a hot wire cutter from MiniCut2D at #makerfaireSTM.  A 2- person 2D cutter company. http://t.co/yYnzkUwleG
388953280665354240,Sat Oct 12 09:04:23 +0000 2013,RT @aallan: A warm welcome to @MakerFaireSTM as @dalepd is made a "Sailor of Saint Malo" by the Mayor. #make #makerfaire http://t.co/hmNdgY…
388687073710178300,Fri Oct 11 15:26:34 +0000 2013,Bertier's horse.
388662179073114100,Fri Oct 11 13:47:39 +0000 2013,RT @pammoran: Maker kids getting their boomerang station ready for charlottesville maker faire -#producttest @make http://t.co/Jmj6rPl6d4
388661808854474750,Fri Oct 11 13:46:10 +0000 2013,RT @gidgev: The Maker Faire team actually get to solder for the first time ever  @MakerFaireSTM http://t.co/MUZ310hFS5
388638931220434940,Fri Oct 11 12:15:16 +0000 2013,Learn to solder -- the Ronan pirate badge during Education Day.  #makerfairestm
388630198255894500,Fri Oct 11 11:40:34 +0000 2013,Robotic hand project by students at Lycée Maupertuis (high school) #Makerfairestm https://t.co/EWqpPqCv2A
388627404157354000,Fri Oct 11 11:29:28 +0000 2013,Using paper-making technique to create patterns from seaweed.  Rock Paper Scissors. #makerfairestm
388622993175642100,Fri Oct 11 11:11:56 +0000 2013,St Malo - home of the French Corsairs, early entrepreneurs/pirates.  #makerfairestm mascot is Ronan, a Piratebot. http://t.co/Y2vp9WHb3T
388621044673548300,Fri Oct 11 11:04:11 +0000 2013,Kevin, Sylvie and Tatiana of Le Fabshop in St Malo.  #makerfairestm http://t.co/ActfASexAs
388618610304094200,Fri Oct 11 10:54:31 +0000 2013,RT @Reblogga: @dalepd @lmbritton :) Low Tech, High Gains: Starting a Maker Program Is Easier Than You Think http://t.co/CWijJG6oni
388596692662366200,Fri Oct 11 09:27:25 +0000 2013,Great job, Joey. “@MakerFaireRome: #MakerFaireRome: @Joey_Hudy's Favorites! His first post on @make mag http://t.co/J7R7opYa9N Awesome!!”
388594995655372800,Fri Oct 11 09:20:41 +0000 2013,@skap5 I hope so.  A's are an amazing story.
388594453424132100,Fri Oct 11 09:18:32 +0000 2013,RT @krismuir21: I hacked my classroom learning space with a makeshift prototyping center | #WALearns #BrightSpot #dtk12 http://t.co/TiZbFbx…
388594304434044900,Fri Oct 11 09:17:56 +0000 2013,RT @WiredUK: An Italian startup is using Bare Conductive ink to create educational musical instruments that you can draw and play http://t.…
388327600202219500,Thu Oct 10 15:38:09 +0000 2013,RT @SketchUp: Our @makerfaire project  -- a collaboration with @ShopBotTools, @WikiHouse, and @open_desk -- in two minutes: http://t.co/yCn…
388327449836412900,Thu Oct 10 15:37:33 +0000 2013,@CamilleBosque you are welcome.  Im in St. Malo for first Maker Faire.  Are you coming from Paris?
388326658950066200,Thu Oct 10 15:34:25 +0000 2013,RT @noraa: Get Stitching! I'll teach you how to knit in this @skillshare class http://t.co/4QDXzsCZmr
388324849246298100,Thu Oct 10 15:27:13 +0000 2013,@edd @strataconf i am jealous.  How did you get him?   Always thought  James Burke should see Maker Faire.
388322981082308600,Thu Oct 10 15:19:48 +0000 2013,RT @CamilleBosque: MakerFaire1/3 "Our duty is to make that world happen, and it will not happen by itself beacuse we are NOT bacterias." ht…
388232583756386300,Thu Oct 10 09:20:35 +0000 2013,RT @Doc_Beepo: St-Malo organise sa @makerfaire le 11-12/10  av/ @MakerFaireSTM  @LeFabShop @dalepd: http://t.co/X3xo1O9sdn #makerfaire #DIY…
387914406115684350,Wed Oct 09 12:16:16 +0000 2013,Just arrived in London for a couple meetings, exploring a Maker Faire here in the future.  @SherryHuss
387510475807670300,Tue Oct 08 09:31:11 +0000 2013,Drones Are Helping Make Delicious Wine http://t.co/vyeIccNwbi via @popsci
387507484048785400,Tue Oct 08 09:19:18 +0000 2013,RT @Atmel: What do @chr1sa's drones, banana-powered @Arduino + @MAKE projects have in common? http://t.co/fgZSflDVN2 #SimplyAVR http://t.co…
387255522573172740,Mon Oct 07 16:38:06 +0000 2013,We are at H-Farm, a venture startup "farm" outside  of Venice.  Beautiful space. http://t.co/NLhS7KvIR2
386990182572236800,Sun Oct 06 23:03:44 +0000 2013,RT @NocoMakerFaire: Onwards! http://t.co/l5IvUMhWfZ
386989963231117300,Sun Oct 06 23:02:51 +0000 2013,RT @zuph: Congrats, @MakerFaireLou #makelou ! http://t.co/261pmskRYk
386917042420744200,Sun Oct 06 18:13:06 +0000 2013,Forgot pic -- Even the robots are sad to be leaving #makerfairerome but proud to wear blue ribbons home. http://t.co/okyz29Z7eG
386916589733691400,Sun Oct 06 18:11:18 +0000 2013,RT @La_brus: 30.000!! Complimenti #MakerFaireRome!! Soprattutto per aver fatto dire a @dalepd che "il movimento dei #Maker parla decisament…
386915812961165300,Sun Oct 06 18:08:13 +0000 2013,RT @NocoMakerFaire: So much fun to be had at the NoCo Mini Maker Faire! Sing in the SoundPuddle? Play pinball? Run around with Robots?  Wha…
386912985199165440,Sun Oct 06 17:56:58 +0000 2013,Even the robots are sad to be leaving #makerfairerome but proud to wear blue ribbons home.
386904871842349060,Sun Oct 06 17:24:44 +0000 2013,@TheHomeworkDog I think it LEF 12 from Roland. It is an LED UV printer.  Pretty cool.
386903604738932740,Sun Oct 06 17:19:42 +0000 2013,Maker Faire Rome was an astounding success.  Makers are moving onward and upward.  @riccardowired #MakerFaireRome http://t.co/DNYrPmOjxu
386903476498096100,Sun Oct 06 17:19:11 +0000 2013,Maker Faire Rome takeaway: there is a healthy 3d printing ecosystem in Europe distinct from America. Ultimaker is the one player in both.
386882167403712500,Sun Oct 06 15:54:31 +0000 2013,Electronic printed signs. #makerfairerome https://t.co/RutAVvnWlL
386870428079120400,Sun Oct 06 15:07:52 +0000 2013,"We print with marble dust."  50% marble, 50% resin.  Custom 3d printer. #makerfairerome http://t.co/BEfgkQD5AZ
386843962805596160,Sun Oct 06 13:22:42 +0000 2013,Bubble making machine is lots of fun at #makerfairerome https://t.co/37NbsLy0UK
386843005841178600,Sun Oct 06 13:18:54 +0000 2013,Nutella printer from Fab Lab Maastricht. #makerfairerome http://t.co/AcuBas8wkn
386842628425125900,Sun Oct 06 13:17:24 +0000 2013,LED Skull as handle on Hackerbot printer from Fab Lab Pisa.  #makerfairerome http://t.co/e0VNhLusPs
386842291475709950,Sun Oct 06 13:16:04 +0000 2013,Salvatore of Fab Lab Pisa demos Hackerbot, their own open source 3d printer.  #makerfairerome http://t.co/XB6ieMRoM1
386841711600623600,Sun Oct 06 13:13:45 +0000 2013,"We All MAEK Mistakes" - best t-shirt at #makerfairerome. http://t.co/w8XongbUoS
386839917692612600,Sun Oct 06 13:06:38 +0000 2013,Wifi Balloon at #makerfairerome more than just hot air. http://t.co/BLw7tozUFj
386820917110005760,Sun Oct 06 11:51:08 +0000 2013,RT @MakerFaireRome: Now! Cerimonia di chiusura della #MakerFaireRome: sul palco @dalepd @riccardowired @mbanzi @SherryHuss http://t.co/5WvG…
386820725178642400,Sun Oct 06 11:50:22 +0000 2013,RT @intel_jim: The love of R2D2 &amp; robots in general is universal, especially for kids! (Big kids too!) #makerfairerome http://t.co/ZjT8XaF7…
386800254831837200,Sun Oct 06 10:29:01 +0000 2013,RT @tooteko: @tooteko at @MakerFaireRome with Dale Dougherty @dalepd @make #startup #innovation #designforall #social http://t.co/Ad6OZSRrDd
386561824579407900,Sat Oct 05 18:41:35 +0000 2013,RT @GiuseppeTurrisi: #MakerFaireRome  Future is here!  @romacapitaleTW #Roma @QuartiereEur http://t.co/XQJU2NFkZc
386534022895382500,Sat Oct 05 16:51:07 +0000 2013,Are you stuck?  Fun flip project from Treviso Arduino User Group.  #makerfairero https://t.co/043cDGi4gM
386530710859046900,Sat Oct 05 16:37:57 +0000 2013,Today's turnout in Rome demonstrates that Maker Faire belongs in every city in the world.  Every city is a city of makers. #MakerFaireRome
386524403720130560,Sat Oct 05 16:12:53 +0000 2013,R2D2 popular at #makerfairerome.  Its fabricator is friend of Bay Area's Chris James. http://t.co/nZegDTdCbd
386514150140031000,Sat Oct 05 15:32:09 +0000 2013,Tommaso Olivieri of Make Tank from Florence, winner of the TechGarage award yesterday. A new marketplace. http://t.co/lbAvKWB5Uz
386494957579534340,Sat Oct 05 14:15:53 +0000 2013,Light Enigma, an Ardino based version of the Enigma cryptographic machine. #makerfairerome http://t.co/dPlBsUFlno
386493827441119200,Sat Oct 05 14:11:23 +0000 2013,Rapiro, a Raspberry Pi robot from Kiluck.  At Switch Science booth. #makerfairerome http://t.co/ywQrymCyjX
386489996330663940,Sat Oct 05 13:56:10 +0000 2013,Lilytronica at #MakerFaireRome  - cloth-based interfaces using Lilypad Arduino. http://t.co/FPAEH9BSdH
386488820558221300,Sat Oct 05 13:51:30 +0000 2013,RT @MakerFaireRome: {Look&amp;Enjoy} #Lego and #children: a Big Love! #makerfairome http://t.co/4oZeHVglMI
386485017343692800,Sat Oct 05 13:36:23 +0000 2013,RT @ShiverTweet: Definitely :) RT @RMagnifico: #MakerFaireRome. This place is mind blowing! @ Maker Faire Europe http://t.co/o3BsDLqgWW
386453264671473660,Sat Oct 05 11:30:12 +0000 2013,Rain let up but not the makers. “@ziopaolo: It's raining Makers  #makerfaire #makerfairerome #roma http://t.co/VRNYFvyFZn”
386452310509232100,Sat Oct 05 11:26:25 +0000 2013,Meet @costantino, one of the organizers of. #MakerFaireRome.  He is very happy with how things are going. http://t.co/DoNkUtSsuP
386439639055466500,Sat Oct 05 10:36:04 +0000 2013,Open source indoor greenhouse.  #yMEG #MakerFaireRome http://t.co/D4lRjb1FxF
386438419989401600,Sat Oct 05 10:31:13 +0000 2013,DIY Bio-based electronics from Michka Melo of La Paillasse in Paris.  Replace minerals with bio materials
386438416835285000,Sat Oct 05 10:31:12 +0000 2013,Massimo Banzi of Arduino is much in demand at #makerfairerome
386426877659054100,Sat Oct 05 09:45:21 +0000 2013,I'm here at a bustling #MakerFaireRome. The organizers are delighted by the turnout and makers are busy showing and telling.
386426261155102700,Sat Oct 05 09:42:54 +0000 2013,RT @riccardowired: Come dice @dalepd, oggi c'è la #MakerFaireRome, comes rain or comes shine (oggi rain direi)
386426113704362000,Sat Oct 05 09:42:19 +0000 2013,RT @OpenElectronics: Recap From @MakerFaireRome “The Business Of Making” http://t.co/njjajfceO9 @riccardowired @dalepd @stefanomicelli @mat…
386266673893748740,Fri Oct 04 23:08:46 +0000 2013,Watch @MensJournal’s profile on David Lang and Eric Stackpole, robot makers and marine explorers: http://t.co/YYVO1XmfNL #mensjournal @make
386153122957381600,Fri Oct 04 15:37:33 +0000 2013,Jim Quinn of QTechKnow on stage at Maker Faire Rome : Lessons from a 12 yr old CEO.  Terrific.  Q got started with @Make and #MakerFaire.
386143217370296300,Fri Oct 04 14:58:11 +0000 2013,RT @MakeTankItaly: @dalepd : 1. Idea 2. Energy 3. Belief to become a real #maker #makerfairerome http://t.co/8hH2KhTL5S
386143154950639600,Fri Oct 04 14:57:57 +0000 2013,RT @VincentGirardin: Everybody can design a product : fundamental change in our culture and business ! #makers @dalepd #makerfairerome http…
