id,created_at,text
740622220167237600,Wed Jun 08 19:11:12 +0000 2016,“You Can’t Learn Everything from YouTube” by Howard Tullman of 1871 in Chicago. @tullman https://t.co/oYVEvOwptK @make
739908740032274400,Mon Jun 06 19:56:05 +0000 2016,James Fallows: Why the Maker Movement Matters: Part 1, the Tools Revolution https://t.co/4sNL3yCGM7
738716628192485400,Fri Jun 03 12:59:03 +0000 2016,Marque Cornblatt of Aerial Sports League warns "Drone Sports and Education Are Under Attack in California" https://t.co/Hh57gbLfto  @make
738460484194598900,Thu Jun 02 20:01:14 +0000 2016,How Maker Faire Celebrates the Maker Community https://t.co/hHT62tbvud @make @EUmakerweek #MakerFaire
738450352580755500,Thu Jun 02 19:20:58 +0000 2016,RT @prem91sagar: Thanks @dalepd for starting @makerfaire We are #excited to have #Delhi First Mini #MakerFaire @dmmf2016 @BanaaoNow #makerm…
738363231853502500,Thu Jun 02 13:34:47 +0000 2016,Rokenbok introduced Arduino robotics to their design and engineering system with a Kickstarter campaign: https://t.co/roHjU2i9Sv @make
738132516159164400,Wed Jun 01 22:18:00 +0000 2016,Hansen Tepaha came to National Maker Faire in 2015 as part of group from Navajo Technical University.  https://t.co/45xZlU2By6 #MakerFaire
738041070190264300,Wed Jun 01 16:14:37 +0000 2016,My story: Hundreds of Makers in Hannover https://t.co/0KS0f1q40D #mfh16 #MakerFaire @make
738010883050377200,Wed Jun 01 14:14:40 +0000 2016,I'm in Miami to present on Maker movement at KIN - Kellogg Innovation Network conference.
737470890821210100,Tue May 31 02:28:56 +0000 2016,What Did Educators Learn at Maker Faire? https://t.co/WYK22VHBlr #edtech via @EdSurge
737247436683382800,Mon May 30 11:41:00 +0000 2016,RT @arduino: .@mbanzi and @dalepd are all smiles in Brussels — it’s #EMWeek16! https://t.co/QEDctGU7KL
737185565527924700,Mon May 30 07:35:09 +0000 2016,Phillip Steffan of MF Hannover and Giedrius K. from Vilnius MMF at European Maker Week event.   #EMWeek16 https://t.co/vcQn5qoQgo
737052093463175200,Sun May 29 22:44:47 +0000 2016,@McGrawBridget @BBC @makerfaire @Microsoft yes.  At Maker Faire Bay Area, I met with Microsoft about Microbit
737001698942554100,Sun May 29 19:24:32 +0000 2016,@spacehurricanes That you are silly is worthy of praise.
736943940503375900,Sun May 29 15:35:01 +0000 2016,Self-serving student Maker project -- a cocktail machine.  Makers Malte, Fabian &amp; Dennis from Bielefeld. #mfh16 https://t.co/BDbJ8QcD1H
736942557054173200,Sun May 29 15:29:31 +0000 2016,Molekular Küche at Maker Faire Hannover. #mfh16 https://t.co/z5vZV8ByAM
736942036398411800,Sun May 29 15:27:27 +0000 2016,Colorful yarn bikes at Maker Faire Hannover. #mfh16 https://t.co/gTubvGGtjB
736931589939068900,Sun May 29 14:45:57 +0000 2016,Melina, Alina &amp; Tabea, students working on Green Wind Technology, harnessing wind to create energy.  #mfh16 https://t.co/1MD5yN7Od0
736929186846150700,Sun May 29 14:36:24 +0000 2016,"Real communication makes noise."  Telex will be big.  Newsfeed meets automatic typewriter.  #mfh16 #MakerFaire https://t.co/oAlz6oQvKw
736926937298276400,Sun May 29 14:27:27 +0000 2016,Sweet sound of hammers tapping metal.  The One Ring Workshop at MF Hannover. #mfh16 #MakerFaire https://t.co/fEXL8990qH
736925150650630100,Sun May 29 14:20:21 +0000 2016,Young girl busy soldering during blinkenlights workshop. #mfh16 #MakerFaire https://t.co/tMJaHWT60x
736924616371753000,Sun May 29 14:18:14 +0000 2016,Can't get enough of tiefseefische at Maker Faire Hannover.  #mfh16 #makerfaire https://t.co/tAs8HDSEaC
736895125293432800,Sun May 29 12:21:03 +0000 2016,Cool edu project - digital projection on 3d-printed topographic map.  Learning geo thru begreifen at fasw.de. #mfh16 https://t.co/ARHksY74KC
736893157166587900,Sun May 29 12:13:14 +0000 2016,Father introducing daughter to 3d printing.  #mfh16 #MakerFaire https://t.co/AaCGokm4dI
736892922000375800,Sun May 29 12:12:18 +0000 2016,Control a pick-and-place machine from Small SMT. #mfh16 #MakerFaire https://t.co/4wC91VUP0x
736866099912953900,Sun May 29 10:25:43 +0000 2016,Really like the small Uninstall lathes at Maker Faire Hannover. #mfh16 #MakerFaire https://t.co/iQeJxYJCUZ
736865168584540200,Sun May 29 10:22:01 +0000 2016,Lina Wassong demos her wearables projects including an Equalizer Skirt that responds to ambient sound. #mfh16 https://t.co/EZ1WmApEZb
736605121623121900,Sat May 28 17:08:41 +0000 2016,OpenExposer is an open source resin 3d printer ($200 kit) by Mario Lukas and Christoph Emonds from Aachen. #mfh16 https://t.co/1jkpIClCuB
736592586555592700,Sat May 28 16:18:52 +0000 2016,Willo and Daniel of Zoobotic with Zuri, their paper robot product line, which will soon be on Kickstarter. #mfh16 https://t.co/Pm9N8WXXDm
736567338615459800,Sat May 28 14:38:32 +0000 2016,Kids are loving the pi-top, a Raspberry Pi laptop from the UK.  https://t.co/9kflHh0Pgi.  #mfh16 #MakerFaire https://t.co/M8F7abLTBG
736533137484742700,Sat May 28 12:22:38 +0000 2016,@Pascal_r2 @MakerFaireNTE yes.  Me too.  I will connect them.
736527538785161200,Sat May 28 12:00:23 +0000 2016,The rolling Metal Fish and a cast of sea creatures gets people to stop and wonder. #mfh16 #MakerFaire https://t.co/i7XGQFUrIu
736522019286614000,Sat May 28 11:38:27 +0000 2016,This creative cosplayer is sixty-year old math teacher, Rudolph Arnold, as Hatsone Miku. #mfh16 #MakerFaire https://t.co/Jo869V8G2t
736509717401370600,Sat May 28 10:49:34 +0000 2016,POV globe project featured in next issue of Make: in Germany.  Great project. https://t.co/QsJujIPjIL
736508769111138300,Sat May 28 10:45:48 +0000 2016,Nixie clock by Friedhelm Bruegmann.  #mfh16 #MakerFaire https://t.co/XLvSh5EN1i
736507171907592200,Sat May 28 10:39:28 +0000 2016,Uwe of Power-bikes.de demos his large custom electric bikes. #mfh16 #MakerFaire https://t.co/LZvuhabonz
736506330429558800,Sat May 28 10:36:07 +0000 2016,Makey mascot here at Maker Faire Hannover.   #mfh16 #MakerFaire https://t.co/cGFveqPs6F
736268529461125100,Fri May 27 18:51:11 +0000 2016,RT @boris_tweets: Super échange avec le pape du making @dalepd ! On est bien français, on lui a demandé sa visée politique. 😉 https://t.co/…
736268403929817100,Fri May 27 18:50:41 +0000 2016,"Creativity is intelligence having fun." Seen outside #coworkshop in Paris. https://t.co/lkQKBlWssr
736118027041660900,Fri May 27 08:53:08 +0000 2016,Met with Quentin Billey of DRAFT, a makerspace and co-working shop in Halle Pajol in Paris 18th. https://t.co/J6ysEeU8hS
735762817295355900,Thu May 26 09:21:40 +0000 2016,Jack Kerouac quote in Paris airport: "The Road is Life."  Paris-Hannover-Brussels-Miami-Philly.  That's life on this trip after #MakerFaire
735559557280190500,Wed May 25 19:53:59 +0000 2016,@artcontraptions thank you for your amazing work.
735559353919377400,Wed May 25 19:53:10 +0000 2016,RT @arduino: 450 events.  28 countries.  7 days.  1 community.   Join us in celebrating #EMWeek16! https://t.co/VLmirPanbZ https://t.co/IJm…
734772509308911600,Mon May 23 15:46:32 +0000 2016,RT @natlmakerfaire: Calling all Makers &amp; Tinkerers: Get your entries in to the #NatlMakerFaire  Call for Makers by Friday, 5/27! https://t.…
734462008263774200,Sun May 22 19:12:43 +0000 2016,Sunday morning sermon for Makers from Adam Savage and his mount is the electric Giraffe.  #MakerFaire https://t.co/PpySpfS93g
734460554534916100,Sun May 22 19:06:56 +0000 2016,Adam Savage speaking to all about making.  Really exciting to have him back this year.  #MakerFaire https://t.co/cK1pWhW2Xv
734441607395561500,Sun May 22 17:51:39 +0000 2016,Ben and JJ from LA's Crashspace are here at #makerfaire. https://t.co/CIILcarxie
734440690625609700,Sun May 22 17:48:00 +0000 2016,DIY Exoskeletons by students from school in American Canyon.  #MakerFaire https://t.co/NmVOmDx1Zq
734194029089325000,Sun May 22 01:27:51 +0000 2016,The simplest things you see at #makerfaire.  Hide under a parachute parasol and spin around. https://t.co/PfGitUZF1Y
734186275150778400,Sun May 22 00:57:03 +0000 2016,Dream Catcher by James Peterson at #MakerFaire https://t.co/knXk1JBUT2
734179350430416900,Sun May 22 00:29:32 +0000 2016,Behind the scenes of drone racing.   Aerial Sports League at #MakerFaire https://t.co/9BrisFjkIy
734174161589833700,Sun May 22 00:08:55 +0000 2016,Theo Jansen speaking about his work -- Strandbeest - to a full house at Maker Faire.  #MakerFaire https://t.co/xRBV5lbCFG
734169100906172400,Sat May 21 23:48:48 +0000 2016,A dragon's tale at Maker Faire.  #makerfaire https://t.co/Gn7rPBj2lr
734100338425270300,Sat May 21 19:15:34 +0000 2016,Zachery Wong's solar-powered mobile 3d printing studio. "Make me famous," he said to me.   #MakerFaire https://t.co/6Pk8XPbtoE
734037862937559000,Sat May 21 15:07:18 +0000 2016,Get your safety glasses on for Maker Faire.  Enthusiastic school kids at Friday's opening.  #MakerFaire https://t.co/KE6Tc7tRLQ
733753955210166300,Fri May 20 20:19:10 +0000 2016,Cosmic Dance's levitating dancers.  Video for @phoenixperry https://t.co/K7UAAmmQ4w
733752742636740600,Fri May 20 20:14:20 +0000 2016,Cosmic Dance by Nick Dong, a conceptual metalsmith. Just beautiful. In darkroom at #makerfaire https://t.co/BTVsQOi3MM
733737844385140700,Fri May 20 19:15:08 +0000 2016,Cool kinetic sculpture.  A portrait of resonance and chaos by Joel Dream. #MakerFaire https://t.co/6AMTnbT8ei
733736316706283500,Fri May 20 19:09:04 +0000 2016,Love Power Tool Drag Races! https://t.co/rtvtWlC9GC
733735843261599700,Fri May 20 19:07:11 +0000 2016,RT @CharlieCurve: Side projects are the best way to challenge yourself, learn a new skill or satiate your inner "someday, I'll...":  https:…
733734614158561300,Fri May 20 19:02:18 +0000 2016,@msjlura @makeredorg Agreed but getting a makerspace is a big step towards that goal of transforming the experience of school for children.
733675156262903800,Fri May 20 15:06:02 +0000 2016,Tulsi, Premika, &amp; Manisha from U Illinois- Champaign with #Makergirl, sharing how to create with tech. #makerfaire https://t.co/V9y6rQh6yl
733525736191971300,Fri May 20 05:12:18 +0000 2016,Come See Theo Jansen's Strandbeest at Maker Faire! https://t.co/auMvdUO2ws
733459713103302700,Fri May 20 00:49:57 +0000 2016,Russell the Giraffe is here for the 11th year.  New and improved, his head moves gently side to side.  @makerfaire https://t.co/EQ81gkP0cV
733456075903500300,Fri May 20 00:35:30 +0000 2016,Tapagami Make exhibit.   Fun seeing the Makers setting up today.  @makerfaire https://t.co/g93ZmAeNL7
733061154717634600,Wed May 18 22:26:13 +0000 2016,RT @MakerNurse: Proud of our co-founder @annakyoung for being announced as #FCMostCreative for 2016 https://t.co/58Pm9qJyYh 💡🎉🏆 https://t.c…
732986769554083800,Wed May 18 17:30:38 +0000 2016,Excited to have U.S. Department of Energy and National Labs at Maker Faire this weekend.  https://t.co/8NoDbn6qRW @makerfaire
732712902654840800,Tue May 17 23:22:23 +0000 2016,Kickstarter at the 2016 Bay Area Maker Faire https://t.co/zUYsp25K7h via @kickstarter
732697163658977300,Tue May 17 22:19:51 +0000 2016,RT @GoCaltrain: Headed to #MakerFaire this Fri-Sat-Sun? Take Caltrain &amp; catch the  @makerfaire shuttle from Millbrae Caltrain. https://t.co…
732697104213139500,Tue May 17 22:19:37 +0000 2016,@quinnnorton How about troff (Unix typesetting language)?
732685508434747400,Tue May 17 21:33:32 +0000 2016,Robbie the robot sends a selfie, demanding late entry to Maker Faire Bay Area.  I must obey Robbie.  @makerfaire https://t.co/RIGHhE1XTV
732617971844026400,Tue May 17 17:05:10 +0000 2016,Just days away from Maker Faire Bay Area.  Anticipation is growing.  https://t.co/9svHutpEjv #makerfaire
731737007580307500,Sun May 15 06:44:32 +0000 2016,Mike Greenberg: How I Found Myself Organizing the Palm Beach Mini Maker Faire https://t.co/G7qSGIzckU
730906213269921800,Thu May 12 23:43:15 +0000 2016,How to Make a School Maker Faire, a workshop on Friday May 20th at Maker Faire Bay Area in San Mateo. #makerfaire  https://t.co/AnAYuhVkHh
730502995683708900,Wed May 11 21:01:00 +0000 2016,RT @xmanufacturing: "The perfect situation is when you can have a maker community inside the organization connected to the outside ecosyste…
730433688039772200,Wed May 11 16:25:36 +0000 2016,Ed Baafi has launched a Kickstarter for Modkit.io, a new language and IDE bridging Arduino and Scratch. https://t.co/C0Ocj2rawx @make
730402922236919800,Wed May 11 14:23:21 +0000 2016,I'm speaking today on makers and collaborative production at Exponential Manufacturing conference.  https://t.co/5HQzc7tM3s @make
729354130334965800,Sun May 08 16:55:50 +0000 2016,Bay Area Students Will Get a Field Trip @MakerFaire.  Thanks to LinkedIn and other funders. #makerfaire https://t.co/gKiWfMNgo1
728619844619272200,Fri May 06 16:18:02 +0000 2016,Student Megan Gage writes about the value and values of the Wachusett High School MakerSpace https://t.co/Jt7TNXK2ej
726417468697227300,Sat Apr 30 14:26:35 +0000 2016,@TheMakerStation @makerfaire @make At Ponce City Market, a former Sears and Roebuck building, some of the old equipment is on display.
726156168888995800,Fri Apr 29 21:08:16 +0000 2016,Met with Christy and Tanya of Southeast Makers Alliance, organizers of Maker Faire in Atlanta.  @makerfaire @make https://t.co/cfyIozerz0
724767678418690000,Tue Apr 26 01:10:54 +0000 2016,Met with Bram and Richard from London-based https://t.co/l8GUey5I2S, a site for building a community around a developing project. @make
723633365467934700,Fri Apr 22 22:03:33 +0000 2016,Fixers Collective in NYC. Choosing to Skip the Upgrade and Care for the Gadget You’ve Got https://t.co/V3wQfegCIw
723209917113483300,Thu Apr 21 18:00:55 +0000 2016,Baltimore's Open Works: Outfitting Your Makerspace with Tools and Furniture https://t.co/UUgvcGkh42 @make #makerspace
723181634627997700,Thu Apr 21 16:08:32 +0000 2016,Steven Wolfram doing live demonstration of Wolfram Language. Fascinating. At IgniteSTEM conf at Columbia.  @make https://t.co/Roros2c0qt
720624339024879600,Thu Apr 14 14:46:45 +0000 2016,These Middle Schoolers Built a Custom Arduino Board Game to Explore Ancient Egypt https://t.co/6aX5KZw0H6
720415482478616600,Thu Apr 14 00:56:50 +0000 2016,Maker Faires this weekend in Goteberg Sweden, 1st in Vienna, Santa Cruz &amp; Benicia in CA, and Tyler TX.  https://t.co/9svHutpEjv @makerfaire
720385017378005000,Wed Apr 13 22:55:46 +0000 2016,@DianaLRendina would you want to write something about how you use donorschoose to restock your supplies.  Love to share with others.
720360605786329100,Wed Apr 13 21:18:46 +0000 2016,RT @Vocademy: We had a very special visitor today! @Dalepd of @Make: &amp; @MakerFaire flew out to see our #makerspace. #ThankYou! https://t.co…
719600977897074700,Mon Apr 11 19:00:17 +0000 2016,“Young Makers on the Rise in Egypt”, my story from Maker Faire Cairo.  https://t.co/IoPzCv1m4I @make @makerfaire #makerfairecairo
718503046859198500,Fri Apr 08 18:17:30 +0000 2016,Tom Igoe: Stop Teaching Programming, Start Teaching Computational Thinking https://t.co/Ye8KYcS3OI
714569223624745000,Mon Mar 28 21:45:53 +0000 2016,I so enjoyed #makerfairecairo last weekend and visiting Fab Labe Egypt.   For any of the participating Makers,... https://t.co/iEVjtITqzt
714102874129563600,Sun Mar 27 14:52:47 +0000 2016,@therealfitz I'm sorry about that.  I didn't realize that would happen by uploading an album.
714093770053058600,Sun Mar 27 14:16:36 +0000 2016,@zebulonj Sorry. .  I didn't know that publishing an album on Facebook would trigger these empty tweets.  Happy Easter.
714070560800682000,Sun Mar 27 12:44:23 +0000 2016,I posted a new photo to Facebook https://t.co/0OEii9dMim
714070560079278100,Sun Mar 27 12:44:22 +0000 2016,I posted a new photo to Facebook https://t.co/aAijqj6O7d
714070560003735600,Sun Mar 27 12:44:22 +0000 2016,I posted a new photo to Facebook https://t.co/qWjWBycMMP
714070557013241900,Sun Mar 27 12:44:22 +0000 2016,I posted a new photo to Facebook https://t.co/5G1hDs2fcM
714070546103869400,Sun Mar 27 12:44:19 +0000 2016,I posted a new photo to Facebook https://t.co/DIgQ6iEo6q
714070544635789300,Sun Mar 27 12:44:19 +0000 2016,I posted a new photo to Facebook https://t.co/yZMHzHmcBJ
714070544178655200,Sun Mar 27 12:44:19 +0000 2016,I posted a new photo to Facebook https://t.co/gvfd1185OO
714070542349893600,Sun Mar 27 12:44:18 +0000 2016,I posted a new photo to Facebook https://t.co/bCRa6R5yXj
714070542328979500,Sun Mar 27 12:44:18 +0000 2016,I posted a new photo to Facebook https://t.co/fA8r58DJJ6
714070529808986100,Sun Mar 27 12:44:15 +0000 2016,I posted a new photo to Facebook https://t.co/KnKFRZSWqY
714070526713544700,Sun Mar 27 12:44:15 +0000 2016,I posted a new photo to Facebook https://t.co/kjJrcjNtkX
714070526235381800,Sun Mar 27 12:44:14 +0000 2016,I posted a new photo to Facebook https://t.co/7FsqJEYa9q
714070525321019400,Sun Mar 27 12:44:14 +0000 2016,I posted a new photo to Facebook https://t.co/KHGSkcFuVS
714070525132292100,Sun Mar 27 12:44:14 +0000 2016,I posted a new photo to Facebook https://t.co/DYwMsQgKc9
714070511676956700,Sun Mar 27 12:44:11 +0000 2016,I posted a new photo to Facebook https://t.co/hq1WQjYhkK
714070511102345200,Sun Mar 27 12:44:11 +0000 2016,I posted a new photo to Facebook https://t.co/3G0AwJljty
714070510590681100,Sun Mar 27 12:44:11 +0000 2016,I posted a new photo to Facebook https://t.co/CLNyFxzjr1
714070510255087600,Sun Mar 27 12:44:11 +0000 2016,I posted a new photo to Facebook https://t.co/dfFrkHYRZh
714070509080744000,Sun Mar 27 12:44:10 +0000 2016,I posted a new photo to Facebook https://t.co/xEpLssnFvb
714070497617715200,Sun Mar 27 12:44:08 +0000 2016,I posted a new photo to Facebook https://t.co/QpUfZqryHm
714070497013669900,Sun Mar 27 12:44:07 +0000 2016,I posted a new photo to Facebook https://t.co/Wq3hET0grv
714070495352774700,Sun Mar 27 12:44:07 +0000 2016,I posted a new photo to Facebook https://t.co/8bctzP1776
714070495310823400,Sun Mar 27 12:44:07 +0000 2016,I posted a new photo to Facebook https://t.co/lRMlJQTRUh
714070494736158700,Sun Mar 27 12:44:07 +0000 2016,I posted a new photo to Facebook https://t.co/LHPCGkPFV8
713858801275969500,Sat Mar 26 22:42:55 +0000 2016,@tentacled_cat @makerfaire @make  there were many women there too.   The men pushed forward to be in the photo.  Look at other photos.
713858437592047600,Sat Mar 26 22:41:29 +0000 2016,@johnnycannuk @makerfaire @make I wouldn't say that.  Plenty of women in the audience but the men pushed forward to be in the photo.
713847014921015300,Sat Mar 26 21:56:05 +0000 2016,https://t.co/AOeWtue28Y
713483003926876200,Fri Mar 25 21:49:38 +0000 2016,Cairo tour including Fab Lab Egypt visit.
713473459028828200,Fri Mar 25 21:11:42 +0000 2016,https://t.co/IWBKPQhcAE
712817805607854100,Thu Mar 24 01:46:23 +0000 2016,@timoreilly thanks.  Nancy is with me so it's even better.
712801819530027000,Thu Mar 24 00:42:51 +0000 2016,Road to Cairo: Wednesday SF-&gt;Chicago-&gt;Amman-&gt;Cairo Thursday.  Looking forward to Maker Faire Cairo on Sat.... https://t.co/4szenTFza2
712801772255838200,Thu Mar 24 00:42:40 +0000 2016,Road to Cairo: Wednesday SF-&gt;Chicago-&gt;Amman-&gt;Cairo Thursday.  Looking forward to Maker Faire Cairo on Sat. https://t.co/pfoqrC2uyW @make
712800809361100800,Thu Mar 24 00:38:50 +0000 2016,@peterparnes We won’t have MakerCon this year in the Bay Area before Maker Faire, I’m sorry to say.
712668604022427600,Wed Mar 23 15:53:30 +0000 2016,Library Makerspaces: Bringing Access to Knowledge in a Whole New Way https://t.co/2xl7Qgaswb @make
709443275287998500,Mon Mar 14 18:17:12 +0000 2016,“Want to learn Go (the game)? And, is it still worth it?” (yes!) @marcprecipice https://t.co/T5yGhfIJtB
708380494434447400,Fri Mar 11 19:54:05 +0000 2016,At UC Merced today visiting CITRIS group, meeting students and faculty. This is Science and Engineering building https://t.co/kr72KTeIOg
708098349799317500,Fri Mar 11 01:12:57 +0000 2016,How the maker movement is revitalizing industry in American cities: https://t.co/6tTWA3eg7W by @BrooksRainwater via @FastCoExist /
708054711056748500,Thu Mar 10 22:19:32 +0000 2016,SXSWedu: Education finds new ways to reach kids through maker movement. https://t.co/CbULYsRU58
707668829770350600,Wed Mar 09 20:46:11 +0000 2016,RT @SherryHuss: White House Backs National Week of Making, Building High School Makerspaces https://t.co/b2ROr5MNTj @NationOfMakers @natlma…
707658643467010000,Wed Mar 09 20:05:42 +0000 2016,Get your school to join.  @MakerEdOrg &amp; @DigitalPromise are launching Maker Promise! https://t.co/2mdChuaHhT... https://t.co/sPsmtx2wNJ
707658611246260200,Wed Mar 09 20:05:35 +0000 2016,Get your school to join.  @MakerEdOrg &amp; @DigitalPromise are launching Maker Promise! https://t.co/2mdChuaHhT #makerspace #makerEd #SXSWedu
707627938724753400,Wed Mar 09 18:03:42 +0000 2016,EdSurge’s excellent Special Report on the State of EdTech.  Like that learning models are seen as most important. https://t.co/FkbP42uDUq
707621962751680500,Wed Mar 09 17:39:57 +0000 2016,Re-invent shop! $200K #CTEMakeover Challenge to inspire high schools to design new #makerspaces.  https://t.co/rrmK8uSR3G @make #makered
707620848501297200,Wed Mar 09 17:35:31 +0000 2016,Makers of Change, written in support of White House’s National Week of Making 2016 and National #MakerFaire. https://t.co/dBj0OweGXe @make
707366080579133400,Wed Mar 09 00:43:10 +0000 2016,Gueßt s0eaker tonight at #SXSWedu for Allen Distinguished Educators.   Here are the awards. #makered https://t.co/GiVIQYNXDr
707328496356319200,Tue Mar 08 22:13:49 +0000 2016,Marina Gorbis of IFTF leads a panel on Extreme Learners, wildly curious and self-directed kids.  #makered @make https://t.co/vPHfnYwUId
707255119411224600,Tue Mar 08 17:22:15 +0000 2016,At #sxswedu, Ayah Bdeir of #LittleBits launches STEAM student set.  Inspire kids to explore and invent. @make https://t.co/pjREhktL0I
706595250660216800,Sun Mar 06 21:40:10 +0000 2016,Why Toyota made an electric concept car out of wood https://t.co/Hha5tRXmO7 @make
706291965701156900,Sun Mar 06 01:35:01 +0000 2016,Robert Rauschenberg Foundation Brings Copyright Law Into 21st Century https://t.co/k64kXKnPCK
705628671780884500,Fri Mar 04 05:39:19 +0000 2016,Limor Fried’s Artful Electronics https://t.co/D9Q6iG6Uke via @nicolatwilley
704841572358053900,Wed Mar 02 01:31:40 +0000 2016,Sebastopol Entrepreneurs Project opens a co-working space in the old Make space on the O'Reilly campus. https://t.co/S9St4tJ95p
704490002554691600,Tue Mar 01 02:14:40 +0000 2016,@MerrileeIAm @make Yes!
704379884634837000,Mon Feb 29 18:57:05 +0000 2016,I'm excited to return as CEO of Make: https://t.co/jXraYbnA1o @make @makerfaire
703692065910050800,Sat Feb 27 21:23:57 +0000 2016,Speaking this afternoon about Maker movement for the Chinese Institute of Engineers, USA at the Computer History Museum.  @make @makerfaire
703396658835431400,Sat Feb 27 01:50:06 +0000 2016,Visited @hax_co in SF.  Met with Cyril and great folks from https://t.co/0hJwqDzdNI and Carbon Robotics. Cool mural. https://t.co/mS2QoNx6Ct
701587976376070100,Mon Feb 22 02:03:03 +0000 2016,At #edfoo, I met Kristen Haring, author of this study of Ham Radio culture.   I've ordered the book and look... https://t.co/ncjWpQs3Dy
701529517563613200,Sun Feb 21 22:10:45 +0000 2016,Michelle Carlson wrote to tell me about a makerspace opening up in a juvenile detention center in Tehama County,... https://t.co/eHwk5tW8VO
700909279000137700,Sat Feb 20 05:06:09 +0000 2016,RT @AllenEducators: Join us in celebrating the 2016 Allen Distinguished Educators: https://t.co/U4MoCElJ8j #SXSWedu #2016ADE https://t.co/C…
700903919036158000,Sat Feb 20 04:44:51 +0000 2016,I'm at #edfoo at Google this weekend, an informal gathering of good folks in and around education.  Lots of familiar #makered folks.
700734280306073600,Fri Feb 19 17:30:46 +0000 2016,At Moore Foundation in Palo Alto for MakerEd's workshop for Open Portfolio Project.  #makered
700528417272254500,Fri Feb 19 03:52:44 +0000 2016,@FutureDevGroup @TurtleBayPark where is that?
700364907062014000,Thu Feb 18 17:03:00 +0000 2016,I used a pressure cooker to make a chicken curry.
700090265500061700,Wed Feb 17 22:51:41 +0000 2016,“Growth is impact. Growth means improving our local communities…” — @sexandstartups https://t.co/6N1KfZS4U8... https://t.co/UTfi48Ppim
700090247187664900,Wed Feb 17 22:51:36 +0000 2016,“Growth is impact. Growth means improving our local communities…” — @sexandstartups https://t.co/6N1KfZS4U8 https://t.co/R8v8KBZpd1
699425278402035700,Tue Feb 16 02:49:15 +0000 2016,I cooked my first sous-vide meal -- chicken thighs.  Overall, it was a successful first try.   Thanks to Lisa Q. Fetterman and Nomiku.
699304755139489800,Mon Feb 15 18:50:20 +0000 2016,Local Project Make program a national model for hands-on learning.  Congrats to teacher Casey Shea. @makered https://t.co/wKbP7yMBkU
699004430520221700,Sun Feb 14 22:56:57 +0000 2016,@SmallBatchA @nova_labs @BobCoggeshall I enjoyed seeing you and your workspace.
698600613601529900,Sat Feb 13 20:12:20 +0000 2016,Jared Wilkins of Questacon in Australia talks about the Maker Project for schools. https://t.co/uLUTuYQMWH
698593686742048800,Sat Feb 13 19:44:48 +0000 2016,Aki Kawana of FabCafe in Japan talks about engaging people in creative serendipity. https://t.co/Ik8FAIyZgK
698588165884547100,Sat Feb 13 19:22:52 +0000 2016,Maker timeline in China presented by Prof Jeff Ding from Fablab-Shanghai. https://t.co/eFPauXuq5G
698582658356551700,Sat Feb 13 19:00:59 +0000 2016,Dr Kim on the K-maker movement and Maker Faire at local and national levels.  #makerfaire https://t.co/l3GBWusvb2
698579095442034700,Sat Feb 13 18:46:49 +0000 2016,Maker Movement and Creative Culture in Korea by Dr Seunghwan Kim of KOPAC.   Long history of making in Korea. https://t.co/Jur9wWcMAt
