id,created_at,text
969325163186675700,Thu Mar 01 21:35:02 +0000 2018,★ Max Krieger’s Twitter Threads on Design: https://t.co/SrnX9sjKIZ
968904895586762800,Wed Feb 28 17:45:03 +0000 2018,Online Publisher Dependent Upon Facebook Shuts Down, Blaming Algorithm Change: https://t.co/6Ut8Q9yb3J
968698533149925400,Wed Feb 28 04:05:02 +0000 2018,WatchKit Is a Sweet Solution That Will Only Ever Give Us Baby Apps: https://t.co/PR2KxdPLgP
968649458648059900,Wed Feb 28 00:50:02 +0000 2018,Apple Launching Medical Clinics for Employees: https://t.co/AZfLyN1TDm
968648203129311200,Wed Feb 28 00:45:02 +0000 2018,If You Were Wondering Which Android Handset Maker Would Be the First to Shamelessly Copy the iPhone X’s Notch, We… https://t.co/z5iNZYF4SQ
968639394272989200,Wed Feb 28 00:10:02 +0000 2018,Amazon to Acquire Ring for ‘More Than $1 Billion’: https://t.co/gvj5LblzJi
968274487568461800,Tue Feb 27 00:00:02 +0000 2018,Apple Park Visitor Center’s Accessibility: https://t.co/gjFGWUWygK
968265682939973600,Mon Feb 26 23:25:02 +0000 2018,[Sponsor] Build Your Dream Career With Skillshare: https://t.co/IGmoaeebc0
968261907080720400,Mon Feb 26 23:10:02 +0000 2018,‘You’re Probably Underestimating What You Can Do With Your iPhone Home Screen’: https://t.co/cIYl9lWMBl
968249323099172900,Mon Feb 26 22:20:02 +0000 2018,Timers, Reminders, and Alarms on Apple Devices: https://t.co/Is3IQ4OLDF
968243031513161700,Mon Feb 26 21:55:02 +0000 2018,Putting Your Phone in Grayscale Mode to Reduce the Urge to Use It: https://t.co/qSjYP5PUZq
968217865060016100,Mon Feb 26 20:15:02 +0000 2018,Berkshire Hathaway’s 2017 Annual Report (PDF): https://t.co/NwbnSinN4D
968017534086729700,Mon Feb 26 06:58:59 +0000 2018,@kometen Click the star.
967876867972911100,Sun Feb 25 21:40:02 +0000 2018,Jamf Now: https://t.co/EKPSnb9b3c
967184810266546200,Fri Feb 23 23:50:02 +0000 2018,Drexel Sets Men’s Division 1 Record for Comeback Win by Overcoming 34-Point Deficit to Beat Delaware: https://t.co/nd9jBmpgjG
967158386377752600,Fri Feb 23 22:05:02 +0000 2018,Frank Bruni: ‘Am I Going Blind?’: https://t.co/s692PB2xSD
967147060582547500,Fri Feb 23 21:20:02 +0000 2018,Why Can Everyone Spot Fake News but the Tech Companies?: https://t.co/EXKUTi198h
966876528096182300,Fri Feb 23 03:25:02 +0000 2018,Aura: https://t.co/11sE4eljxt
966870235193147400,Fri Feb 23 03:00:02 +0000 2018,The Children Who Mine Cobalt: https://t.co/3MFoD8JJdj
966867721400045600,Fri Feb 23 02:50:02 +0000 2018,‘Unsane’ — New Steven Soderbergh Film Shot Entirely on iPhone: https://t.co/LybEKn693o
966866461837938700,Fri Feb 23 02:45:02 +0000 2018,Why Facebook Won’t Ever Change: https://t.co/5ezum92grm
966851361496121300,Fri Feb 23 01:45:02 +0000 2018,‘Gun Rights, “Positive Good”, and the Evolution of Mutually Assured Massacre’: https://t.co/BKfI5KvO82
966837519072612400,Fri Feb 23 00:50:02 +0000 2018,Things’s New Custom URL Scheme for Automation: https://t.co/xZEWICCsQ8
966828713450065900,Fri Feb 23 00:15:02 +0000 2018,The AR-15 Is Different: https://t.co/ihfRwq4aJs
966772090820087800,Thu Feb 22 20:30:02 +0000 2018,Picking the Latter: https://t.co/ipoVHyPOBt
966745665538838500,Thu Feb 22 18:45:02 +0000 2018,The Life and Death of Twitter for Mac: https://t.co/B8KKQJalqj
966423543935221800,Wed Feb 21 21:25:02 +0000 2018,Bloomberg: ‘Apple in Talks to Buy Cobalt Directly From Miners’: https://t.co/2lwfEyglQA
966404668804001800,Wed Feb 21 20:10:02 +0000 2018,Inside the Federal Bureau of Way Too Many Guns: https://t.co/UAxreykdS7
966390826598363100,Wed Feb 21 19:15:02 +0000 2018,Why the Second Amendment Does Not Stymie Gun Control: https://t.co/sXYwrZGV0t
966385796306620400,Wed Feb 21 18:55:03 +0000 2018,‘I’ve only had good years.’: https://t.co/0d9H7EVV8Y
966370696107647000,Wed Feb 21 17:55:02 +0000 2018,Apple Maps vs. Google Maps vs. Waze (in the Bay Area): https://t.co/1yNPX0su2u
966153009335062500,Wed Feb 21 03:30:02 +0000 2018,Switzerland Considers the Lobster: https://t.co/Elkp2Se9yP
966151753803685900,Wed Feb 21 03:25:02 +0000 2018,The Hill: ‘New Gingrich Says Arming Teachers Only Long-Term Solution to School Shootings’: https://t.co/YtfNvIXAWy
966090094082961400,Tue Feb 20 23:20:02 +0000 2018,★ iOS Messages and Smart Punctuation: https://t.co/czsJMeiWq6
966037246527852500,Tue Feb 20 19:50:02 +0000 2018,Microsoft’s Azure Services in China Are Contracted to a Chinese Company, Too: https://t.co/BN8uF80cyr
966034732621402100,Tue Feb 20 19:40:02 +0000 2018,[Sponsor] Jamf Now: https://t.co/rcniH9sxTv
966033472723832800,Tue Feb 20 19:35:02 +0000 2018,Nikkei Asian Review’s Irresistible Verb: https://t.co/46ZpukpEvl
965701282404163600,Mon Feb 19 21:35:02 +0000 2018,Apple’s Upcoming Handover of Chinese iCloud Data to a State-Owned Company: https://t.co/gtwUe5TWc7
965375387885850600,Mon Feb 19 00:00:02 +0000 2018,https://t.co/YsVvZkQpmt: ‘Selling Shit You Don’t Want for So Cheap That You Buy It Anyway’: https://t.co/J4yRmFSMYs
965369094315892700,Sun Feb 18 23:35:02 +0000 2018,The Talk Show: ‘The “Press Real Hard” Era’: https://t.co/32WamCtjx1
964643059735646200,Fri Feb 16 23:30:02 +0000 2018,Twitter Abolishes Native Mac Client: https://t.co/1NCU5SO29B
964636771408629800,Fri Feb 16 23:05:03 +0000 2018,DFW: ‘Roger Federer as Religious Experience’: https://t.co/4iCbEf4zTQ
964622926212366300,Fri Feb 16 22:10:02 +0000 2018,Lauren Goode vs. Lauren Goode: iPhone X vs. Pixel 2: https://t.co/7Hfw107dgE
964621670509088800,Fri Feb 16 22:05:02 +0000 2018,How the NRA Rewrote the Second Amendment: https://t.co/UkMq1LznE3
964612861581516800,Fri Feb 16 21:30:02 +0000 2018,‘Paul Ryan: No “Knee Jerk” Reactions on Guns. Ever.’: https://t.co/qMweVoqU7A
964523523715862500,Fri Feb 16 15:35:02 +0000 2018,[Sponsor] https://t.co/YsVvZkQpmt: Selling shit you don’t want for so cheap that you buy it anyway: https://t.co/CibomsWQtm
964313387181248500,Fri Feb 16 01:40:02 +0000 2018,Every Member of Congress Who Took Money From the NRA and Tweeted ‘Thoughts and Prayers’ to Parkland: https://t.co/CP7a4Vl8yF
964230343187460100,Thu Feb 15 20:10:03 +0000 2018,Et Tu, Sonos?: https://t.co/x9PBEoovcT
964227824155537400,Thu Feb 15 20:00:02 +0000 2018,Strategy Analytics Claims Apple Took Over Half of Worldwide Phone Revenue Last Quarter: https://t.co/oN5XRktOZC
964226568284491800,Thu Feb 15 19:55:02 +0000 2018,We’ve Reached the Point Where People Are Giving Up on Schools: https://t.co/cQdQ1vGrU3
964221533362229200,Thu Feb 15 19:35:02 +0000 2018,‘No Way to Prevent This’, Says Only Nation Where This Regularly Happens: https://t.co/iRjUsUUoIS
964206432987074600,Thu Feb 15 18:35:02 +0000 2018,‘The Gun Is Our Moloch’: https://t.co/N5MVZOLE8o
963956034099470300,Thu Feb 15 02:00:02 +0000 2018,Facebook Now Spamming Users With Texts if They’ve Enabled Two-Factor Security: https://t.co/wVigwBBqxv
963925833630060500,Thu Feb 15 00:00:02 +0000 2018,★ Sponsoring Daring Fireball, Early 2018 Edition: https://t.co/GH04SZJDdq
963918285925507100,Wed Feb 14 23:30:02 +0000 2018,Nick Heer: ‘Reports of Google’s Newfound Design Prowess Have Been Greatly Exaggerated’: https://t.co/vFgd4p7pHv
963880538804314100,Wed Feb 14 21:00:03 +0000 2018,Facebook Is Pushing Its Data-Tracking Onavo VPN Within Its Main Mobile App: https://t.co/YG3yl9FsdI
963844046421741600,Wed Feb 14 18:35:02 +0000 2018,Kottke on the State of Blogging: https://t.co/mI6sIzlKOL
963835237095657500,Wed Feb 14 18:00:02 +0000 2018,David Pogue Conducts Blind Test of HomePod Against Competitors: https://t.co/a47rx9nFm2
963833980964560900,Wed Feb 14 17:55:02 +0000 2018,HomePod Can Damage Wood Furniture: https://t.co/encBO7SHYN
963563905250447400,Wed Feb 14 00:01:51 +0000 2018,[Update on what I think might be happening with Apple’s OS update strategy: https://t.co/q4HW8ESAz7]
963242582296940500,Tue Feb 13 02:45:02 +0000 2018,There Are No Competitive Smartwatch Chips From Qualcomm: https://t.co/TlwdDXXEbU
963187219048648700,Mon Feb 12 23:05:02 +0000 2018,Claim Chowder on Yours Truly Regarding a June Claim Chowder Regarding Whether the HomePod Has a ‘Touchscreen’: https://t.co/wUu6cniMSK
963184701304463400,Mon Feb 12 22:55:02 +0000 2018,Steven Sinofsky on Apple’s Software Problem: https://t.co/2FvO0YIccD
963158279181520900,Mon Feb 12 21:10:03 +0000 2018,Inside Apple’s HomePod Audio Lab: https://t.co/08OkP696qU
963151986551005200,Mon Feb 12 20:45:02 +0000 2018,Designing Farrago: https://t.co/lfWTMnaE4c
963146951154917400,Mon Feb 12 20:25:02 +0000 2018,An Audiophile’s Review of HomePod: https://t.co/LUvxdfBDrw
963143179045400600,Mon Feb 12 20:10:02 +0000 2018,★ The Threat to the Mac: the Growing Popularity of Non-Native Apps: https://t.co/54qvTdVPGJ
963129336961347600,Mon Feb 12 19:15:02 +0000 2018,IDC: Apple Watch Outsold the Entire Swiss Watch Industry in Holiday Quarter: https://t.co/Ikd88HMoSF
963124302605320200,Mon Feb 12 18:55:02 +0000 2018,Mark Gurman on Apple’s OS Development Strategy: https://t.co/q4HW8ESAz7
962876421046665200,Mon Feb 12 02:30:02 +0000 2018,Oxford Comma Dispute Is Settled as Maine Drivers Get $5 Million: https://t.co/WH84teFUSv
962407079091851300,Sat Feb 10 19:25:02 +0000 2018,Why Paper Jams Persist: https://t.co/cTLM30Togw
962106346693976000,Fri Feb 09 23:30:02 +0000 2018,The Talk Show: ‘Only Wireless. Less Smart Than an Echo. Lame.’: https://t.co/injR1EMZwB
962105086007763000,Fri Feb 09 23:25:02 +0000 2018,Apple Support: ‘How “Hey Siri” Works With Multiple Devices’: https://t.co/PLosHP8PCM
962066079492145200,Fri Feb 09 20:50:02 +0000 2018,NFL Team Logos, Drawn From Memory: https://t.co/v38Hnb414G
962063565413695500,Fri Feb 09 20:40:02 +0000 2018,Jason Kelce’s Speech From Today’s Philadelphia Eagles Super Bowl Victory Parade: https://t.co/2Khho9TvJw
961087130528370700,Wed Feb 07 04:00:02 +0000 2018,★ HomePod: https://t.co/U9zItN2xJy
961043089484865500,Wed Feb 07 01:05:02 +0000 2018,★: https://t.co/U9zItN2xJy
960597656363028500,Mon Feb 05 19:35:02 +0000 2018,‘Philly Special’: https://t.co/FBE20wbQVF
959564595882020900,Fri Feb 02 23:10:02 +0000 2018,Instabug: https://t.co/PakCuNEP2D
959558304333746200,Fri Feb 02 22:45:02 +0000 2018,Google Releases YouTube TV App for Apple TV (and Roku): https://t.co/qhdPAa6bVV
959492875305259000,Fri Feb 02 18:25:02 +0000 2018,Why Alexa Won’t Light Up During Amazon’s Super Bowl Ad: https://t.co/jVpqD5xmUd
959476515498053600,Fri Feb 02 17:20:02 +0000 2018,Actual Headline From NBC News: ‘Can Self-Taught Rocket Scientist Mike Hughes Prove Earth Is Flat?’: https://t.co/e7puvhQjWg
959422412046655500,Fri Feb 02 13:45:02 +0000 2018,Walt Mossberg on the iPad: https://t.co/bgUpMXSHlY
959276449852215300,Fri Feb 02 04:05:02 +0000 2018,Is It a Problem That HomePod Only Works With Apple Products?: https://t.co/85mbyRYxyv
959275190843854800,Fri Feb 02 04:00:02 +0000 2018,The Verge: ‘Surface Pro 4 Owners Are Putting Their Tablets in Freezers to Fix Screen Flickering Issues’: https://t.co/bR6GOABKbQ
959270157725073400,Fri Feb 02 03:40:02 +0000 2018,Rodney Dangerfield in Stanley Kubrick’s ‘The Killing’: https://t.co/YmXtuOSfmD
959192143263871000,Thu Feb 01 22:30:02 +0000 2018,Apple Reports 2017 Holiday Quarter Results: https://t.co/P8Xusmc3Mg
959168233894023200,Thu Feb 01 20:55:02 +0000 2018,Wired: ‘Podcast Listeners Really Are the Holy Grail Advertisers Hoped They’d Be’: https://t.co/1urwhwgSIl
959163201274503200,Thu Feb 01 20:35:02 +0000 2018,Lindy West: ‘I Quit Twitter and It Feels Great’: https://t.co/e87pa3xCTb
959160688009793500,Thu Feb 01 20:25:03 +0000 2018,Instagram Is Turning Into Facebook: https://t.co/QL5MQ0RKnP
959156912897093600,Thu Feb 01 20:10:02 +0000 2018,The Publisher of Newsweek and the International Business Times Has Been Buying Traffic and Engaging in Ad Fraud: https://t.co/d05D8rAwgn
959154395417075700,Thu Feb 01 20:00:02 +0000 2018,BuzzFeed News in Talks for Investment From Laurene Powell Jobs’s Company: https://t.co/z2mwCgz3NF
959151877576327200,Thu Feb 01 19:50:02 +0000 2018,Apple in 2017: The Six Colors Report Card: https://t.co/VSlmTt4WXw
959141813029359600,Thu Feb 01 19:10:02 +0000 2018,Apple Confirms That HomePod Works With iCloud Music Library: https://t.co/Qwtkpa1mEp
958875053793431600,Thu Feb 01 01:30:02 +0000 2018,Ken Case on The Omni Group’s 2018 Roadmap: https://t.co/IAcYZnY3oG
958423329186172900,Tue Jan 30 19:35:02 +0000 2018,Letter of Recommendation: Rodney Dangerfield: https://t.co/qDZP4DyYbK
958415779652829200,Tue Jan 30 19:05:03 +0000 2018,The Sean Flynn Leica M2: https://t.co/HQ0C0dUEnI
958146501397635100,Tue Jan 30 01:15:02 +0000 2018,Orange: https://t.co/hVwZ14v0yR
958145246470303700,Tue Jan 30 01:10:02 +0000 2018,[Sponsor] Instabug: Comprehensive Bug Reporting SDK for Mobile Apps: https://t.co/1jehj7EjHp
958044580024340500,Mon Jan 29 18:30:02 +0000 2018,Apple Released First Four HomePod Commercials: https://t.co/QoZsgfAFTZ
957775309444698100,Mon Jan 29 00:40:03 +0000 2018,Shaker &amp; Spoon: https://t.co/Aiufj75Tk2
957414176074469400,Sun Jan 28 00:45:02 +0000 2018,How HomePod Works With Apple Music, iTunes Match, iCloud Music Library, AirPlay, and FLAC Files: https://t.co/BX2LdFSOtj
957366363051393000,Sat Jan 27 21:35:02 +0000 2018,Logic Pro X 10.4 Release Notes: https://t.co/FnlKOoLKS2
957053046466531300,Sat Jan 27 00:50:02 +0000 2018,What Can HomePod Play Outside Apple Music?: https://t.co/z9RNupNfvB
957045497163931600,Sat Jan 27 00:20:02 +0000 2018,What to Do When Apple Photos Is ‘Unable to Upload Items’ to iCloud: https://t.co/PXR7cIFjwX
957041721631789000,Sat Jan 27 00:05:02 +0000 2018,iCloud Photo Library Re-Uploading: https://t.co/4eR4V7rg7X
957002715779010600,Fri Jan 26 21:30:02 +0000 2018,★ HomePod’s Priorities: https://t.co/AT5z8NZpeY
956977552660287500,Fri Jan 26 19:50:02 +0000 2018,[Sponsor] Shaker &amp; Spoon — Make Great Drinks: https://t.co/Cfm0r9TdkP
956953641545498600,Fri Jan 26 18:15:02 +0000 2018,The 12 Best Bond Watches: https://t.co/PvPwZwSYbU
956722949943451600,Fri Jan 26 02:58:20 +0000 2018,[Updated the item on iCloud  storage limits to reiterate why this is such a problem: https://t.co/F5BURdrtvz]
956715827331551200,Fri Jan 26 02:30:02 +0000 2018,The Talk Show: ‘Arbiter of Finallys’: https://t.co/H7ADxswL5U
956708274832904200,Fri Jan 26 02:00:02 +0000 2018,★ Apple Previews iOS 11.3: https://t.co/52oj4ejiOO
956707019653877800,Fri Jan 26 01:55:02 +0000 2018,Joanna Stern’s Guide to iCloud Storage: https://t.co/F5BURdrtvz
956700728063643600,Fri Jan 26 01:30:02 +0000 2018,FilmGrab: ‘The Empire Strikes Back’: https://t.co/YBjCbdw6Qk
956699468958699500,Fri Jan 26 01:25:02 +0000 2018,iCloud Messages Returns to iOS in First Beta of iOS 11.3: https://t.co/imnXAVlpbd
956670526394699800,Thu Jan 25 23:30:02 +0000 2018,Google Adds Controls to Dial Back Ad Tracking: https://t.co/pONcq3CC6B
956662977528238100,Thu Jan 25 23:00:02 +0000 2018,Farrago 1.0: https://t.co/oYTNjKorxD
956660460107063300,Thu Jan 25 22:50:02 +0000 2018,Three Short Films From Three Emerging LA Filmmakers: https://t.co/gMOCrw3OMp
956644104733118500,Thu Jan 25 21:45:02 +0000 2018,One Hour With HomePod: https://t.co/mJ7PBn4sgs
956611386444013600,Thu Jan 25 19:35:02 +0000 2018,CNN Is Closing Down Beme, Casey Neistat’s Video Company: https://t.co/5pfzxzJNnh
956332047424999400,Thu Jan 25 01:05:02 +0000 2018,How to Write: https://t.co/T3HjGSu82W
956269132999163900,Wed Jan 24 20:55:02 +0000 2018,‘Nobody Is Going to Buy It’: https://t.co/OqChXykl5C
956265357005787100,Wed Jan 24 20:40:02 +0000 2018,YouTube’s Support for Musicians Comes With a Catch: https://t.co/fJovP4GCoN
956250259524673500,Wed Jan 24 19:40:02 +0000 2018,Oxfam’s Excellent Inequality Report: https://t.co/4kxuu57rgo
955920586156527600,Tue Jan 23 21:50:02 +0000 2018,★ The Scourge of Clickbait: https://t.co/dqtA1bjnrK
955895419191615500,Tue Jan 23 20:10:02 +0000 2018,Apple Releases Meltdown and Spectre Kernel Fixes for MacOS High Sierra, Sierra, and El Capitan: https://t.co/rytowucq5P
955874031290474500,Tue Jan 23 18:45:02 +0000 2018,Field Notes Item Numbers: https://t.co/NPllX3sPOZ
955864978669621200,Tue Jan 23 18:09:04 +0000 2018,[Update on Friday’s piece re: BMW and CarPlay. Apple charges no fees, royalties, or ongoing costs to OEMs: https://t.co/4iUji5cfAC]
955841314549006300,Tue Jan 23 16:35:02 +0000 2018,Man Arrested, Accused of Threatening to Kill CNN Employees Over ‘Fake News’: https://t.co/xly91pDAND
955827473211641900,Tue Jan 23 15:40:02 +0000 2018,Inside Amazon’s First No-Cashier, No-Checkout-Line Grocery Store: https://t.co/j6kI4BqB5X
955810728958718000,Tue Jan 23 14:33:30 +0000 2018,HomePod Starts Shipping February 9, Available to Order This Friday, Still a Bit of a Mystery: https://t.co/HmrMFHdgAf
955680251924885500,Tue Jan 23 05:55:02 +0000 2018,No Cutting Corners on the iPhone X: https://t.co/dVozQt8X5f
955662637693591600,Tue Jan 23 04:45:02 +0000 2018,It’s About Priorities: https://t.co/RLt68S3Ffl
955596378239066100,Tue Jan 23 00:21:45 +0000 2018,[Added a footnote to make the argument that, given the history of radically new iPhone form factors, we should have… https://t.co/ks7ynJTvIT
955573296824758300,Mon Jan 22 22:50:02 +0000 2018,Crossing Broad Attire for Super Bowl 52: https://t.co/x3X06E8VIm
955568266579234800,Mon Jan 22 22:30:03 +0000 2018,★ On Rumors of the iPhone X Only Being Produced for One Year: https://t.co/av5RK3P9Uw
954833424287662100,Sat Jan 20 21:50:02 +0000 2018,Aaptiv: https://t.co/Ysu5GwcF0h
954574213121179600,Sat Jan 20 04:40:02 +0000 2018,BMW’s Apple CarPlay Annual Fee Is Next-Level Gouging: https://t.co/4iUji5cfAC
954564150650396700,Sat Jan 20 04:00:03 +0000 2018,The Apple Cash FAQ: https://t.co/952GatYQF6
954547790474108900,Sat Jan 20 02:55:02 +0000 2018,The Ressence Type 2 E-Crown Concept: https://t.co/bbgGsi3zhp
954544013700489200,Sat Jan 20 02:40:02 +0000 2018,Bad Design in Action: The False Hawaiian Ballistic Missile Alert: https://t.co/pvquFk00jw
954472295438921700,Fri Jan 19 21:55:03 +0000 2018,Die With Me: $1 Chat App That Only Works When You Have Less Than 5 Percent Battery Remaining: https://t.co/eN6uNfC0Qg
954454677411778600,Fri Jan 19 20:45:02 +0000 2018,Tim Carmody on the Demise of The Awl and Hairpin: https://t.co/H9T5PHKwHj
954453417669414900,Fri Jan 19 20:40:02 +0000 2018,Open Letters: Dean Allen on His Mother’s Wedding: https://t.co/e2B9dbRKmm
954442093065326600,Fri Jan 19 19:55:02 +0000 2018,Jason Kottke on Dean Allen: https://t.co/QYxkNoKqWD
954189179340165100,Fri Jan 19 03:10:02 +0000 2018,★ Dean Allen: https://t.co/X1lLgfoRwi
953791558960275500,Thu Jan 18 00:50:02 +0000 2018,Apple Shuttle Buses Rerouted Following Attacks: https://t.co/vbj5IM106b
953719835082489900,Wed Jan 17 20:05:02 +0000 2018,Apple to Create New Campus, Hire 20,000 New Employees: https://t.co/ZH5UNl7uhF
953718575742771200,Wed Jan 17 20:00:02 +0000 2018,Gorgeous 50-Megapixel Panoramas Shot on an iPhone at 20,000 Feet: https://t.co/UMeh3n2G1D
953716062318682100,Wed Jan 17 19:50:03 +0000 2018,Farhad Manjoo: ‘It’s Time for Apple to Build a Less Addictive iPhone’: https://t.co/ekSgxfsWBj
953391423335944200,Tue Jan 16 22:20:03 +0000 2018,[Sponsor] Aaptiv: #1 Audio Fitness App: https://t.co/Vp460aOMxl
953381356700041200,Tue Jan 16 21:40:03 +0000 2018,Study: 42 Percent of Republicans Believe Accurate — but Negative — Stories Qualify as ‘fake News’: https://t.co/9XkAHezk9w
953083138758103000,Tue Jan 16 01:55:02 +0000 2018,Alex Roy Reviews the Tesla Model 3 After a Cross-Country Speed Run: https://t.co/Uj5YqkDzwQ
952758501692059600,Mon Jan 15 04:25:02 +0000 2018,Hawaii Missile Alert: How One Employee ‘Pushed the Wrong Button’ and Caused a Wave of Panic: https://t.co/3bYjEdq7FR
952359621360083000,Sun Jan 14 02:00:02 +0000 2018,Jamf Now: https://t.co/ggiPFJtVHQ
952042533084979200,Sat Jan 13 05:00:02 +0000 2018,Uber’s Secret Tool for Keeping the Cops in the Dark: https://t.co/qdPuN4BZn0
951925510342398000,Fri Jan 12 21:15:02 +0000 2018,The iOS Economy, Updated: https://t.co/enAmGqju3P
951915444075679700,Fri Jan 12 20:35:02 +0000 2018,Peter Valdes-Dapena Reviews the Tesla Model 3: https://t.co/rcts7Oiyn0
951909155102740500,Fri Jan 12 20:10:02 +0000 2018,Facebook Purportedly Changes News Feed to Make It ‘Good for People’: https://t.co/phr6tUEtQ2
951597099132571600,Thu Jan 11 23:30:02 +0000 2018,Ben Apple’s Indirect Presence Fades From CES: https://t.co/hL45qRb0bd
951546768663171100,Thu Jan 11 20:10:03 +0000 2018,Confide Popular With Republican Politicians: https://t.co/4z8UlcvIhU
951298884105658400,Thu Jan 11 03:45:02 +0000 2018,★ ScreenShield — a Third-Party SDK That Somehow Allows iOS Apps to Prevent Screenshots: https://t.co/uP13Bh7bfI
951287559438651400,Thu Jan 11 03:00:02 +0000 2018,Wired: ‘How Outlier, the Underground Fashion Label for Nerds, Got Cool’: https://t.co/WKL4eWEa7y
951184377358241800,Wed Jan 10 20:10:02 +0000 2018,Android Central: ‘Essential Phone Review, Four Months Later: The Sun Is Setting on This Experiment’: https://t.co/8XR9bNQ73g
951164247186255900,Wed Jan 10 18:50:02 +0000 2018,‘The Good War’: https://t.co/RSMqerXZXZ
951159213048369200,Wed Jan 10 18:30:02 +0000 2018,MacOS 10.13 High Sierra’s App Store System Prefs Panel Can Be Unlocked With Any Password: https://t.co/VmoXRhh7lT
950918879894786000,Wed Jan 10 02:35:02 +0000 2018,Pop-Up Mobile Ads Surge as Sites Scramble to Stop Them: https://t.co/sJzAjKatIk
950890213781450800,Wed Jan 10 00:41:08 +0000 2018,Google Announces Plan to Improve URLs for AMP Pages, But Even If It Happens, Which Remains Uncertain, AMP Will Stil… https://t.co/flY1eA0Np7
950881130835832800,Wed Jan 10 00:05:02 +0000 2018,North Carolina Congressional Map Ruled Unconstitutionally Gerrymandered: https://t.co/WKVtRRGxOF
950872322889666600,Tue Jan 09 23:30:02 +0000 2018,New Bill Aims to Eliminate Paperless Voting Machines: https://t.co/fXMMgTqeL3
950839607138111500,Tue Jan 09 21:20:02 +0000 2018,Regarding This Open Letter From Two Investor Groups to Apple Regarding Kids’ Use of Devices: https://t.co/BIGNeznRnT
950835831056535600,Tue Jan 09 21:05:02 +0000 2018,AT&amp;T Drops Huawei’s New Smartphone Amid Security Worries: https://t.co/l2AZa8sW1g
950803116320022500,Tue Jan 09 18:55:02 +0000 2018,Ad Tracking Companies Complain About Safari’s Intelligent Tracking Prevention: https://t.co/QHq567Bxaj
950566558870442000,Tue Jan 09 03:15:02 +0000 2018,[Sponsor] Jamf Now: https://t.co/WjqnlundaM
950538876870938600,Tue Jan 09 01:25:03 +0000 2018,What Spectre and Meltdown Mean for WebKit: https://t.co/83RF9rMPEd
950518742995357700,Tue Jan 09 00:05:02 +0000 2018,How Meltdown and Spectre Were Independently Discovered by Four Research Teams at Once: https://t.co/Z5I17nffV1
950516226257760300,Mon Jan 08 23:55:02 +0000 2018,90Fun’s Puppy 1 Auto-Following Suitcase Won’t Stop Falling Over: https://t.co/wvS2CGV1KP
950513708987551700,Mon Jan 08 23:45:02 +0000 2018,Pharmaceutical Ads in the U.S.: https://t.co/IryLS4u1yk
950499867234832400,Mon Jan 08 22:50:02 +0000 2018,Electronic Toymaker VTech Settles for $650,000 With FTC Over Children’s Privacy Suit: https://t.co/lQtTx7fnQr
950468410739249200,Mon Jan 08 20:45:02 +0000 2018,Google Pay: https://t.co/hniJEBSjPy
950464634548518900,Mon Jan 08 20:30:02 +0000 2018,How to Take a Picture of a Stealth Bomber Over the Rose Bowl: https://t.co/19FXQExPvr
949797742733340700,Sun Jan 07 00:20:02 +0000 2018,Aaptiv: https://t.co/Km2UDBq2fA
949406413750751200,Fri Jan 05 22:25:02 +0000 2018,Panic to Suspend Sales of Transmit for iOS: https://t.co/77B6QU8ide
949395089054404600,Fri Jan 05 21:40:02 +0000 2018,Jason Snell on the iMac Pro’s Groundbreaking T2 Chip: https://t.co/dxmxJox8uV
949387538359300100,Fri Jan 05 21:10:02 +0000 2018,App Store Continues to Grow: https://t.co/68XwUybQuC
949333430784987100,Fri Jan 05 17:35:02 +0000 2018,My Next Guest Needs No Introduction With David Letterman: https://t.co/GninCKpfT7
949071708308242400,Fri Jan 05 00:15:02 +0000 2018,Apple: ‘About Speculative Execution Vulnerabilities in ARM-Based and Intel CPUs’: https://t.co/J7bcoA7qvm
949054089089962000,Thu Jan 04 23:05:02 +0000 2018,Correction of the Year: https://t.co/jUjknZaIaR
949025148472123400,Thu Jan 04 21:10:02 +0000 2018,Fans of the Fat Nano Unite: https://t.co/gLwZkTsqUb
948993695549935600,Thu Jan 04 19:05:03 +0000 2018,The Verge: ‘Chrome Is Turning Into the New Internet Explorer 6’: https://t.co/7P7Ojk0uAm
948799917790847000,Thu Jan 04 06:15:02 +0000 2018,Excerpts From Michael Wolff’s ‘Fire and Fury’: Inside Trump’s White House: https://t.co/lFOsKWTLnK
948731967578738700,Thu Jan 04 01:45:02 +0000 2018,Mac Innovation vis-à-vis Microsoft’s Surface Line: https://t.co/ZO0oH5JHl9
948633821141962800,Wed Jan 03 19:15:02 +0000 2018,Trump’s 17-Tweet Bender Yesterday Was Based Entirely on What Was on Fox News: https://t.co/F45GGS2DWC
948613689489395700,Wed Jan 03 17:55:02 +0000 2018,Basecamp Doesn’t Employ Anyone in San Francisco, but Now Pays Everyone as Though They Did: https://t.co/OecF1AEcVW
948609913437212700,Wed Jan 03 17:40:02 +0000 2018,Icicles Falling From Roof of New Chicago Apple Store Blamed on Faulty Heating System: https://t.co/rMZkE2rISK
948350707337482200,Wed Jan 03 00:30:02 +0000 2018,[Sponsor] Aaptiv: #1 Audio Fitness App: https://t.co/1oXeXYSdXq
948348189589073900,Wed Jan 03 00:20:02 +0000 2018,The State of Apple’s Design Mojo: https://t.co/RQQfnQoxpG
948333091969470500,Tue Jan 02 23:20:02 +0000 2018,Games Using Phone Microphones to Track What You’re Watching on TV: https://t.co/JOKKMtgQ14
948331832550084600,Tue Jan 02 23:15:02 +0000 2018,Web Trackers Are Exploiting Browser Login Managers: https://t.co/kRFEcklr7I
947717786050220000,Mon Jan 01 06:35:02 +0000 2018,The Talk Show: ‘Star Wars: The Last Jedi’ Holiday Spectacular: https://t.co/ARc7UExbNj
947345331951415300,Sun Dec 31 05:55:02 +0000 2017,Aaptiv: https://t.co/tInzr4DBWQ
