id,created_at,text
1049461952781721600,Tue Oct 09 00:50:02 +0000 2018,‘Facebook Unveils the Portal, a Video Chat Camera for the People Who Still Trust Facebook’: https://t.co/R0Cedx6Smt
1049435532063846400,Mon Oct 08 23:05:03 +0000 2018,[Sponsor] HyperJuice: World's Most Powerful USB-C Battery Pack: https://t.co/wG5hF9SIuo
1049410363832328200,Mon Oct 08 21:25:02 +0000 2018,Rich Mogull on How the Apple Watch Series 4 Will and Won’t Save Lives: https://t.co/yacIKNrsAo
1049400300585529300,Mon Oct 08 20:45:03 +0000 2018,Apple Tells Congress It Found No Signs of Hacking Attack: https://t.co/v28ipxTven
1049012744916226000,Sun Oct 07 19:05:02 +0000 2018,Statement From DHS Press Secretary on Recent Media Reports of Potential Supply Chain Compromise: https://t.co/6DMBZYk6iE
1048635257635987500,Sat Oct 06 18:05:02 +0000 2018,Skillshare: https://t.co/et7XEUHsAg
1048623931048042500,Sat Oct 06 17:20:02 +0000 2018,Banksy Painting Self-Destructs After Fetching $1.4 Million at Sotheby’s: https://t.co/Q8LWk9UZrb
1048378566822563800,Sat Oct 06 01:05:02 +0000 2018,Buzzfeed: ‘Apple Insiders Say Nobody Internally Knows What’s Going on With Bloomberg’s China Hack Story’: https://t.co/k9RmkioB63
1048212470341521400,Fri Oct 05 14:05:02 +0000 2018,Customizing the Infograph Face on Apple Watch Series 4: https://t.co/xsBx7gKNGw
1047945711868936200,Thu Oct 04 20:25:02 +0000 2018,Apple Newsroom: ‘What Businessweek Got Wrong About Apple’: https://t.co/aDEiNlB90N
1047914254463057900,Thu Oct 04 18:20:02 +0000 2018,★ Bloomberg’s ‘The Big Hack’: https://t.co/hZfEKgzm6n
1047632398484230100,Wed Oct 03 23:40:02 +0000 2018,LG’s New Watch Has Mechanical Hands That Cover the Display: https://t.co/rW7nBuGh5t
1047598424550506500,Wed Oct 03 21:25:02 +0000 2018,Jason Snell: ‘Why Are Apple Watch Faces Such a Mess?’: https://t.co/yCIJGn4I4j
1047565709121933300,Wed Oct 03 19:15:02 +0000 2018,Lego Scale Model of Apple Park: https://t.co/xY3cwEeqgr
1047535512507097100,Wed Oct 03 17:15:03 +0000 2018,Wi-Fi Now Has Version Numbers, and Wi-Fi 6 Comes Out Next Year: https://t.co/VHzCwADuwJ
1047529219620855800,Wed Oct 03 16:50:02 +0000 2018,Nooses, Rotting Teeth, and Neglect: Inspectors Find Dismal Conditions at For-Profit California Immigration Jail: https://t.co/RHLOIC1F95
1047524183952040000,Wed Oct 03 16:30:02 +0000 2018,‘Vice’ — New Film From Adam McCay: https://t.co/OT1As6dsDb
1047271271267012600,Tue Oct 02 23:45:03 +0000 2018,Adding Device Frames to iPhone XS and XS Max Screenshots With Shortcuts: https://t.co/ko1jmxswye
1047259946629435400,Tue Oct 02 23:00:03 +0000 2018,Apple Watch Series 4 Fall Detection Tested by a Hollywood Stunt Double: https://t.co/si9NDPsYKR
1047258686635294700,Tue Oct 02 22:55:02 +0000 2018,iPhone XS: Why It’s a Whole New Camera: https://t.co/mmsHOxt7a9
1047252394088812500,Tue Oct 02 22:30:02 +0000 2018,Microsoft Surface Event 2018: The 5 Biggest Announcements: https://t.co/1ldEEAhkbz
1047229747477061600,Tue Oct 02 21:00:03 +0000 2018,Jason Snell on Apple Watch Series 4: https://t.co/JgaYWqfNxS
1047224713129340900,Tue Oct 02 20:40:02 +0000 2018,[Sponsor] Skillshare -- The Best Way to Learn Online: https://t.co/L7cEU9tipV
1047215903467864000,Tue Oct 02 20:05:02 +0000 2018,Amazon to Raise Minimum Wage to $15 for All U.S. Workers: https://t.co/l1dL9LIwwF
1047186962430476300,Tue Oct 02 18:10:02 +0000 2018,The iPhone Franchise: https://t.co/t9wwE4qnOE
1046123707880616000,Sat Sep 29 19:45:02 +0000 2018,Jamf Now: Streamlined Apple Device Management: https://t.co/6iI3w3oQZS
1045723569613869000,Fri Sep 28 17:15:02 +0000 2018,Facebook Claims Network Breach Affects Up to 50 Million Users: https://t.co/AKGj6MmbrU
1045649331339046900,Fri Sep 28 12:20:02 +0000 2018,Elon Musk Is Sued by S.E.C. in Move That Could Oust Him: https://t.co/NXFvAKOBeQ
1045312109955960800,Thu Sep 27 14:00:02 +0000 2018,Facebook Is Giving Advertisers Access to Your Shadow Contact Information: https://t.co/cSwbnpjw8p
1045302042913394700,Thu Sep 27 13:20:02 +0000 2018,The Inside Story of Trump’s Shambolic Transition Team: https://t.co/nO8aIYkUHA
1045032769670324200,Wed Sep 26 19:30:02 +0000 2018,WSJ Claims iPhone XR’s Delayed Release Is Strategic: https://t.co/emA4RIgJ1x
1045020186024251400,Wed Sep 26 18:40:02 +0000 2018,Ben Brooks: Mobile Safari Content Blocker Evaluations, September 2018: https://t.co/opWhShSNMO
1045017668070383600,Wed Sep 26 18:30:02 +0000 2018,Fun Intro to Siri Shortcuts: https://t.co/zhcoSiMTAn
1045011379575492600,Wed Sep 26 18:05:02 +0000 2018,Dear Young People: “Don’t Vote”: https://t.co/dIGez5sbmz
1045008861583880200,Wed Sep 26 17:55:02 +0000 2018,Slate: ‘Apple News Is Giving the Media Everything It Wants — Except Money’: https://t.co/y3nP2vtIIq
1045007601778470900,Wed Sep 26 17:50:02 +0000 2018,WhatsApp Cofounder Brian Acton on Why He Left $850 Million Behind to Leave Facebook Early: https://t.co/1KaWfwYjMc
1044716939250225200,Tue Sep 25 22:35:02 +0000 2018,Qualcomm Says Apple Gave Its Trade Secrets to Intel: https://t.co/FCkk8nnPfI
1044695547578384400,Tue Sep 25 21:10:02 +0000 2018,Hodinkee Radio: Apple and the Future of Watchmaking: https://t.co/06YSGSsBSa
1044670381850853400,Tue Sep 25 19:30:02 +0000 2018,Instagram’s CEO: https://t.co/thd2Q4gMc2
1044414950452678700,Tue Sep 25 02:35:03 +0000 2018,Instagram’s Co-Founders Said to Step Down From Company: https://t.co/9fuBdyFTyg
1044357066889064400,Mon Sep 24 22:45:02 +0000 2018,The Talk Show: ‘Flabbergasting’: https://t.co/0BfcOXsd6U
1044348257906946000,Mon Sep 24 22:10:02 +0000 2018,Austin Mann’s iPhone XS Camera Review: Zanzibar: https://t.co/32kqEIlmx2
1044343226939920400,Mon Sep 24 21:50:02 +0000 2018,AirPower References iOS 12.1 Code Suggest Continuing Development: https://t.co/9tubYXO5LO
1044339449734352900,Mon Sep 24 21:35:02 +0000 2018,‘By a Captain, He’s No Captain’: https://t.co/mI63fF73Ep
1044335677545095200,Mon Sep 24 21:20:03 +0000 2018,Colin Kaepernick Is Nike’s $6 Billion Man: https://t.co/CHJXejitXM
1044334417915891700,Mon Sep 24 21:15:02 +0000 2018,[Sponsor] Jamf Now: Streamlined Apple Device Management: https://t.co/LGbeI8ClUh
1044324349757595600,Mon Sep 24 20:35:02 +0000 2018,Apple and Salesforce Announce iOS Strategic Partnership: https://t.co/T4rG2ornCG
1044321836014751700,Mon Sep 24 20:25:02 +0000 2018,SiriusXM Is Buying Pandora in $3.5 Billion Deal: https://t.co/u1d7SUBZm8
1044305503097172000,Mon Sep 24 19:20:08 +0000 2018,WSJ: Apple Shying Away From R-Rated Original Content: https://t.co/mgM9RGy0Pd
1044305475796430800,Mon Sep 24 19:20:02 +0000 2018,Ingage Instants: https://t.co/EdTeX1Ezz3
1043248511721062400,Fri Sep 21 21:20:02 +0000 2018,iPhone XS / iPhone X Comparison Shots: https://t.co/5n2g7FtO6v
1043247255833243600,Fri Sep 21 21:15:03 +0000 2018,★ The Great DF Random Slowdown Should Be Over: https://t.co/t86QtE0ARw
1042871024671285200,Thu Sep 20 20:20:02 +0000 2018,Cary Joji Fukunaga to Direct the Next James Bond Movie: https://t.co/FJHGxRe1Un
1042848416265658400,Thu Sep 20 18:50:12 +0000 2018,Short Film by Jon M. Chu Shot Handheld With iPhone XS Max: https://t.co/lvbEcHxllf
1042839598781669400,Thu Sep 20 18:15:10 +0000 2018,Hodinkee: ‘How Apple’s Awesome Motion Watch Faces Are Made’: https://t.co/zNWH8z5MhL
1042838308588593200,Thu Sep 20 18:10:02 +0000 2018,Senator Ron Wyden: U.S. Senate, Staff Targeted by State-Backed Hackers: https://t.co/rH17pswCTo
1042471076373176300,Wed Sep 19 17:50:47 +0000 2018,★ Apple Watch Series 4: https://t.co/NLg90gUFYP
1042298503081467900,Wed Sep 19 06:25:02 +0000 2018,Correction Regarding Editing the Bokeh Depth of Field in iPhone XS Portrait Mode Shots on Other Devices: https://t.co/7YayCqxmd0
1042053135789944800,Tue Sep 18 14:10:02 +0000 2018,★ The iPhones XS: https://t.co/wMGJhf4TAY
1041854327390969900,Tue Sep 18 01:00:03 +0000 2018,Former White House Photographer Pete Souza Releases the First Pictures Taken Using iPhone XS: https://t.co/8AC6BM2nKD
1041829158932893700,Mon Sep 17 23:20:02 +0000 2018,Safari Now Supports Favicons on Both MacOS and iOS: https://t.co/wqZB3VmbLd
1041820353796956200,Mon Sep 17 22:45:03 +0000 2018,iOS 12 Highlights: https://t.co/evaNPHF4XA
1041787634316664800,Mon Sep 17 20:35:02 +0000 2018,Marc Benioff and Wife Buy Time Magazine for $190 Million: https://t.co/3LBllrst1C
1041777571380305900,Mon Sep 17 19:55:02 +0000 2018,An Oral History of Apple’s Infinite Loop: https://t.co/9rbUFeXxq4
1041759953806155800,Mon Sep 17 18:45:02 +0000 2018,Sonny Dickson on What Went Wrong With AirPower: https://t.co/wMO5Nvdgyo
1041753661477716000,Mon Sep 17 18:20:02 +0000 2018,Linus Torvalds: ‘I Need to Change Some of My Behavior, and I Want to Apologize to the People That My Personal… https://t.co/crdOZyMZMf
1041752405686329300,Mon Sep 17 18:15:02 +0000 2018,[Sponsor] Ingage Instants: https://t.co/46KwSPyDlv
1041182397058953200,Sun Sep 16 04:30:02 +0000 2018,★ Thoughts and Observations on Apple’s iPhone XS/XR and Series 4 Apple Watch Introductory Event: https://t.co/3HvtuGfLNB
1041123256407916500,Sun Sep 16 00:35:02 +0000 2018,FEMA to Test ‘Presidential Alert’ System Next Week: https://t.co/DsTWiydP9m
1041108158209577000,Sat Sep 15 23:35:02 +0000 2018,Is the iPhone XS Max 512 GB Expensive?: https://t.co/3g5DhPIaoo
1041064117082251300,Sat Sep 15 20:40:02 +0000 2018,Brilliant: https://t.co/IURId0NAUE
1041045244677107700,Sat Sep 15 19:25:02 +0000 2018,Mary Meeker Is Leaving Kleiner Perkins, Starting New Firm: https://t.co/XwLiSc33Yg
1040694180270493700,Fri Sep 14 20:10:02 +0000 2018,AliveCor CEO Vic Gundotra on Competing With Apple Watch Series 4: https://t.co/JtXdHoI76D
1040657690429677600,Fri Sep 14 17:45:02 +0000 2018,How the Weather Channel Made an Immersive Hurricane Florence Storm Surge Animation: https://t.co/6dfD2ST62y
1040652656245657600,Fri Sep 14 17:25:02 +0000 2018,Larry Page Is a No-Show With Google Under a Harsh Spotlight: https://t.co/nFTQVNaoFE
1039993312894177300,Wed Sep 12 21:45:02 +0000 2018,AirPower Scrubbed From https://t.co/fneCQmUhfe: https://t.co/cW7UGlbeGB
1039980729487245300,Wed Sep 12 20:55:02 +0000 2018,108-Second Recap of Today’s Apple Event: https://t.co/eUQwbnfFHN
1039880067520839700,Wed Sep 12 14:15:02 +0000 2018,iPhone XS, iPhone XS Max, and iPhone XR Names Revealed in Apple Products Sitemap: https://t.co/8InLFKaZrx
1039642248307195900,Tue Sep 11 22:30:02 +0000 2018,Amazon Delivery Drivers Reveal Claims of Disturbing Work Conditions: https://t.co/k5I4uYpQTI
1039580595360333800,Tue Sep 11 18:25:03 +0000 2018,Amazon Is Stuffing Its Search Results Pages With Ads: https://t.co/BZpjE9Ov2l
1039579335320105000,Tue Sep 11 18:20:02 +0000 2018,[Sponsor] Brilliant: https://t.co/jnUfpsx9BQ
1039254696442126300,Mon Sep 10 20:50:02 +0000 2018,Creative Selection: https://t.co/zTK34w3wtS
1039247146619490300,Mon Sep 10 20:20:02 +0000 2018,Kuo: USB-C to Replace Lightning on 2018 iPad Pro: https://t.co/JUMUUzdvq8
1038870917559009300,Sun Sep 09 19:25:02 +0000 2018,[Sponsor] Creative Selection: https://t.co/F8K08UCZ0M
1038538728564772900,Sat Sep 08 21:25:02 +0000 2018,Apple Has Permanently Banned Alex Jones’ Infowars App From the App Store: https://t.co/CeAwRzQ3lZ
1038225412764180500,Sat Sep 08 00:40:02 +0000 2018,The Information Profiles Eddy Cue: https://t.co/R8une4Db51
1038220382707359700,Sat Sep 08 00:20:03 +0000 2018,Shocker: AnandTech Catches Huawei and Honor Cheating on Benchmarks: https://t.co/nWQlg8SRdO
1038215348825276400,Sat Sep 08 00:00:02 +0000 2018,★ The Curious Case of Adware Doctor and the Mac App Store: https://t.co/PR0scv0Aeh
1037787529469153300,Thu Sep 06 19:40:02 +0000 2018,Burt Reynolds Dead at 82: https://t.co/g8JgmnS65w
1037493088330113000,Thu Sep 06 00:10:02 +0000 2018,David Frum on the Trump Administration’s Anonymous Resistance: https://t.co/OSdQXXddlu
1037481764393037800,Wed Sep 05 23:25:02 +0000 2018,Bob Woodward’s New Book Reveals a ‘Nervous Breakdown’ of Trump’s Presidency: https://t.co/3c5IQJClni
1037477988026273800,Wed Sep 05 23:10:02 +0000 2018,Anonymous Senior Administration Official Writes NYT Op-Ed: https://t.co/xgMilUQL75
1037434132740141000,Wed Sep 05 20:15:46 +0000 2018,★ iPhone Naming Rumors, 2018 Edition: https://t.co/20kr5rQUMD
1037427656755761200,Wed Sep 05 19:50:02 +0000 2018,[Sponsor] Creative Selection: https://t.co/If1HSGt2XK
1037417590686212100,Wed Sep 05 19:10:02 +0000 2018,From the Department of Old News: Apple Replaces 29W USB-C Power Adapter With New 30W Version: https://t.co/JCaql3jrCB
1037154607158505500,Wed Sep 05 01:45:02 +0000 2018,The Talk Show: ‘iPhone 🍸’: https://t.co/cVBXcy9Psw
1037119376661594100,Tue Sep 04 23:25:02 +0000 2018,‘Haters to the Side’ Indeed: https://t.co/PbsRTqgwRl
1037105535676559400,Tue Sep 04 22:30:02 +0000 2018,More Layoffs at The Outline, Months After $5M Funding Round: https://t.co/RyBX4gDmap
1037096727118053400,Tue Sep 04 21:55:02 +0000 2018,Evernote Lost Its CTO, CFO, CPO and HR Head in the Last Month as It Eyes Another Fundraise: https://t.co/w86RbWYWmJ
1037090434072367100,Tue Sep 04 21:30:02 +0000 2018,Medium Deprecates Custom Domains Service: https://t.co/rqgklFGdGA
1037086662021537800,Tue Sep 04 21:15:03 +0000 2018,Firefox to Start Blocking Bad Trackers by Default: https://t.co/glpKitiWRE
1037082885298237400,Tue Sep 04 21:00:02 +0000 2018,Nike Re-Signs Colin Kaepernick to Endorsement Deal: https://t.co/Fc0keU4a86
1037079109548093400,Tue Sep 04 20:45:02 +0000 2018,Lenovo’s ARM-Based Yoga C630 Laptop: https://t.co/TVOm9q3tqE
1036715464636948500,Mon Sep 03 20:40:02 +0000 2018,Lyft Driver Finds Pixel 3 XL in Car; No One Cares: https://t.co/3ILHXdBLWL
1036015853983158300,Sat Sep 01 22:20:02 +0000 2018,Jamf Now: https://t.co/aQhHuQ2Zb1
1035599360501973000,Fri Aug 31 18:45:02 +0000 2018,NetNewsWire Comes Home to Brent Simmons: https://t.co/inuTvg5zYr
1035292336689795100,Thu Aug 30 22:25:02 +0000 2018,[Another update regarding how @_inside obtained these images: https://t.co/tknW6wwDMN]
1035273464121319400,Thu Aug 30 21:10:02 +0000 2018,9to5Mac Obtained Product Marketing Photos of ‘iPhone XS’ and Series 4 Apple Watch: https://t.co/tknW6wf2Vf
1035265913417871400,Thu Aug 30 20:40:02 +0000 2018,Apple Event: Wednesday 12 September: https://t.co/zM6nPtYjhI
1034273119949783000,Tue Aug 28 02:55:02 +0000 2018,[Sponsor] Jamf Now: Manage Your Apple Devices in Minutes: https://t.co/ubPkJYQY7C
1033876759714979800,Mon Aug 27 00:40:02 +0000 2018,Brilliant: https://t.co/4jrR8dI2EQ
1033136885063934000,Fri Aug 24 23:40:02 +0000 2018,The Talk Show: ‘Smallen Up the Bezels’: https://t.co/SRQ1VJwi5L
1033106683772522500,Fri Aug 24 21:40:02 +0000 2018,[Sponsor] Brilliant: https://t.co/wzhwi9ZnZC
1033104170113544200,Fri Aug 24 21:30:02 +0000 2018,Apollo: https://t.co/QlOzcRwtq0
1033057610294079500,Fri Aug 24 18:25:02 +0000 2018,Allen Weisselberg, Longtime Trump Organization CFO, Is Granted Immunity in Cohen Probe: https://t.co/iNZMxiv9o3
1033043825516863500,Fri Aug 24 17:30:15 +0000 2018,Color Footage of Johnny Carson's 'Tonight Show' Monologue From 24 August 1964: https://t.co/y7cMZK4bhF
1033019863244202000,Fri Aug 24 15:55:02 +0000 2018,New Logo and Identity for Library of Congress by Pentagram: https://t.co/zdjgurFzXA
1032736750010093600,Thu Aug 23 21:10:03 +0000 2018,★ On ‘Shake to Undo’: https://t.co/FqDT97tsun
1032423433433477100,Thu Aug 23 00:25:02 +0000 2018,★ Let’s Really Think About This ‘New Low-Cost Laptop to Succeed MacBook Air’ Thing: https://t.co/66EEfc4fnx
1032413365824639000,Wed Aug 22 23:45:02 +0000 2018,Facebook Removing Onavo VPN From App Store After Apple Says It Violates Data Collection Policies: https://t.co/qwpgsmnCpb
1032339125217763300,Wed Aug 22 18:50:02 +0000 2018,Redesigned New York Times Homepage Removes Reporters’ Bylines: https://t.co/8w2JybIvkm
1032335353401749500,Wed Aug 22 18:35:02 +0000 2018,Edovia’s Screens as a Replacement for Back to My Mac: https://t.co/luIqhSo2nw
1032312703333937200,Wed Aug 22 17:05:02 +0000 2018,Stephen Hackett’s Aqua Screenshot Library: https://t.co/uFmyaZbcHe
1032000650694074400,Tue Aug 21 20:25:03 +0000 2018,Aston Martin Reproducing Goldfinger DB5s With Gadgets: https://t.co/ziG2YbV5G5
1031994356734062600,Tue Aug 21 20:00:02 +0000 2018,Google Data Collection Research: https://t.co/Tx32trZwSs
1031989323405635600,Tue Aug 21 19:40:02 +0000 2018,Harper’s Weekly Review: https://t.co/nIivzpJzo1
1031980515853836300,Tue Aug 21 19:05:02 +0000 2018,Research Suggests Facebook Fueled Anti-Refugee Attacks in Germany: https://t.co/bIRKoLxK6p
1031977997849583600,Tue Aug 21 18:55:02 +0000 2018,Huawei Caught Passing Off DSLR Pictures as Phone Camera Samples: https://t.co/GZONE8S4Fb
1031975483557195800,Tue Aug 21 18:45:03 +0000 2018,Back to My Mac Is Going Away in Mojave: https://t.co/LhmtFGsOlW
1031974222770384900,Tue Aug 21 18:40:02 +0000 2018,Danny Boyle Out as Director of ‘Bond 25’: https://t.co/vHRI0rPWGS
1031649583514955800,Mon Aug 20 21:10:02 +0000 2018,Gurman: ‘Apple Is Planning a New Low-Cost MacBook, Pro-Focused Mac Mini’: https://t.co/d7OQBMs4J5
1031645807865462800,Mon Aug 20 20:55:02 +0000 2018,PepsiCo to Buy SodaStream for $3.2 Billion: https://t.co/HqhYyi4tVq
1031316138288971800,Sun Aug 19 23:05:02 +0000 2018,UpHabit: https://t.co/NEu4PAjNOC
1030593877785436200,Fri Aug 17 23:15:02 +0000 2018,Predicting the Date of Apple’s September Event: https://t.co/AgBxdZZlAu
1030591360062173200,Fri Aug 17 23:05:02 +0000 2018,Google Employees Are Organizing to Protest ‘Dragonfly’: https://t.co/kno9oWYkJ0
1030577519135739900,Fri Aug 17 22:10:02 +0000 2018,‘Dragonfly’: https://t.co/c0KEVubuu8
1030575001425141800,Fri Aug 17 22:00:02 +0000 2018,Google Plans to Launch Censored Search Engine in China: https://t.co/sit2ZwCLIw
1030566193214701600,Fri Aug 17 21:25:02 +0000 2018,Jonathan Mann’s Song of the Day: ‘Jack Says Fuck You to Tweetbot’: https://t.co/0tkiO6hoJH
1030480631258669000,Fri Aug 17 15:45:02 +0000 2018,[Sponsor] UpHabit: https://t.co/1pEiCAqBYe
1030190587201433600,Thu Aug 16 20:32:30 +0000 2018,[Update: Ironically, Twitter’s @robjohnson uses a third-party email client on his iPhone: https://t.co/x8O6eK6YoD,… https://t.co/BLVK4e5bTT
1030177384580956200,Thu Aug 16 19:40:02 +0000 2018,★ Twitter Addresses Why They’ve Broken Twitter for Third-Party Clients: https://t.co/x8O6eK6YoD
1030138374143791100,Thu Aug 16 17:05:02 +0000 2018,‘The Oldest Trick in the Book’: https://t.co/IEewzYJHmM
1029847712542482400,Wed Aug 15 21:50:02 +0000 2018,S.E.C. Is Said to Subpoena Tesla After Elon Musk’s Take-Private Tweet: https://t.co/qIIjnlekpG
1029838904306950100,Wed Aug 15 21:15:02 +0000 2018,DF Weekly Sponsorship Changes: https://t.co/AtmAy4V3Bq
1029837644900065300,Wed Aug 15 21:10:02 +0000 2018,Motorola P30 Is a Pure iPhone X Rip-Off: https://t.co/D61EGCq67r
1029482806303510500,Tue Aug 14 21:40:02 +0000 2018,Apple Is Privately Pushing Paid App Developers to Move to Subscriptions: https://t.co/TfxhB1YDOe
1029466450195558400,Tue Aug 14 20:35:02 +0000 2018,Penn Jillette, in Conversation: https://t.co/iAsjJ2PV6E
1029406052721336300,Tue Aug 14 16:35:03 +0000 2018,‘Bribes, Backdoor Deals, and Pay to Play: How Bad Rosé Took Over’: https://t.co/nOWeBeuN6J
1029138033516396500,Mon Aug 13 22:50:02 +0000 2018,New Samsung Galaxy Watches Are Still Much Larger Than Apple Watches: https://t.co/BLPAJbdiOg
1029115386351034400,Mon Aug 13 21:20:02 +0000 2018,Funding Not Secured: Musk’s Explanations About Taking Tesla Private Does Not Work: https://t.co/OsGdzVxCpo
1029105320386326500,Mon Aug 13 20:40:02 +0000 2018,Apple Removes Group FaceTime From iOS 12 and MacOS 10.14 Mojave Betas, Says It’ll Launch Later This Year: https://t.co/xO67G1GMui
1029082669404094500,Mon Aug 13 19:10:02 +0000 2018,‘But the Plans Were on Display…’: https://t.co/3c5uJ4Vhgs
1029072602353033200,Mon Aug 13 18:30:02 +0000 2018,‘Vomit Fraud’: https://t.co/rjhXpPlZK6
1029057503584313300,Mon Aug 13 17:30:02 +0000 2018,AP: Google Tracks Your Location Even When You Disable ‘Location HIstory’: https://t.co/3L3dC8ojPf
1028418290824241200,Sat Aug 11 23:10:02 +0000 2018,Honeybadger: https://t.co/exEPzEq5Wq
1027998023908053000,Fri Aug 10 19:20:02 +0000 2018,Joanna Stern Test Drives Magic Leap: https://t.co/x40eB3CQk9
1027957757893378000,Fri Aug 10 16:40:02 +0000 2018,★ Reuters’s Curious Sourcing on Doug Field Joining Project Titan: https://t.co/5BznJzvjPo
1027757688711733200,Fri Aug 10 03:25:02 +0000 2018,★ Doug Field Returns to Apple After Leaving Tesla: https://t.co/yLEglpK3Jn
1027748812054585300,Fri Aug 10 02:49:46 +0000 2018,[Update: I wonder if this is less about Infowars specifically and more about Apple being reluctant to draw attentio… https://t.co/gdmbefPFFF
1027723716753547300,Fri Aug 10 01:10:02 +0000 2018,Kara Swisher: ‘Rules Won’t Save Twitter. Values Will.’: https://t.co/CpN1WzBrCH
1027721198657040400,Fri Aug 10 01:00:02 +0000 2018,Apple Defends Its Decision to Allow Infowars in the App Store: https://t.co/Qz3VRTROdB
1027691001496973300,Thu Aug 09 23:00:02 +0000 2018,Apple Orders New Comedy Series From Charlie Day and Rob McElhenney: https://t.co/plnG6C0f9D
1027275763706417200,Wed Aug 08 19:30:02 +0000 2018,Dylan Byers Reports Tim Cook and Eddy Cue Decided to Remove Alex Jones’s Infowars Podcasts From iTunes, Facebook an… https://t.co/Zmg5ic0TCA
1027268213376204800,Wed Aug 08 19:00:02 +0000 2018,Logitech Introduces $70 ‘Powered’ Charging Stand for iPhones: https://t.co/zeu7hkZXTc
1027226691318497300,Wed Aug 08 16:15:02 +0000 2018,Wired Gets Hands-On With Magic Leap: https://t.co/IvnTNhaqb9
1026573637191721000,Mon Aug 06 21:00:02 +0000 2018,Apple Kicked Alex Jones Off Its Platform, Then YouTube and Facebook Rushed to Do the Same: https://t.co/RbOmeCh7K2
1026572377319239700,Mon Aug 06 20:55:02 +0000 2018,[Sponsor] Honeybadger: https://t.co/K7KFEOerbo
1025788462434271200,Sat Aug 04 17:00:02 +0000 2018,Jamf Now: https://t.co/v1wMAbflen
1025409720159486000,Fri Aug 03 15:55:03 +0000 2018,Adam Engst: ‘Apple’s Termination of App Store Affiliate Payments Is Unnecessary, Mean-Spirited, and Harmful’: https://t.co/07OrX25Jzu
1025408460291297300,Fri Aug 03 15:50:02 +0000 2018,Newsrooms Must Stand Up to Targeted Campaigns of Harassment: https://t.co/4oqzjczILH
1025144216891084800,Thu Aug 02 22:20:02 +0000 2018,Apple Closes With Market Cap Over $1 Trillion: https://t.co/2aDoEWOjQf
1025097662650089500,Thu Aug 02 19:15:02 +0000 2018,Everything Bad About Facebook Is Bad for the Same Reason: https://t.co/k6BKA30UC1
1025086338956251100,Thu Aug 02 18:30:03 +0000 2018,Apple Will Soon Remove iOS and Mac Apps From Affiliate Program: https://t.co/hN2rmrEwgs
1024822097753911300,Thu Aug 02 01:00:03 +0000 2018,The Talk Show: ‘Little Q&amp;A’: https://t.co/0YD9vpuIQQ
1024808256802308100,Thu Aug 02 00:05:03 +0000 2018,Mac Rumors: ‘Apple Sold Fewest Macs in Any Quarter Since 2010 as Nearly Entire Lineup Was Outdated’: https://t.co/rSXGna593x
1024806997252821000,Thu Aug 02 00:00:02 +0000 2018,The Bullshit Web: https://t.co/suP8nafdvM
1024713884572282900,Wed Aug 01 17:50:03 +0000 2018,iPhone X Remains a Hit: https://t.co/QClcuDaKAh
1024386726880522200,Tue Jul 31 20:10:02 +0000 2018,[Sponsor] Jamf Now: Manage Your Apple Devices in Minutes: https://t.co/zGULVEpzS7
1024054537395609600,Mon Jul 30 22:10:02 +0000 2018,Milton Glaser’s Proposed Logo for Trump’s ‘Space Force’: https://t.co/XqUg9vrst7
1024026857363185700,Mon Jul 30 20:20:02 +0000 2018,Samsung’s Anti-iPhone X Ads: https://t.co/sbuMF7wZIH
1024023081742938100,Mon Jul 30 20:05:02 +0000 2018,The Japanese Ghost Characters Haunting Unicode: https://t.co/Ne90ylNmV4
1023364994216456200,Sun Jul 29 00:30:02 +0000 2018,MartianCraft: https://t.co/TfLgxoGLHO
1023005123713351700,Sat Jul 28 00:40:02 +0000 2018,The Talk Show: ‘Cut That Mustache With Scissors’: https://t.co/uw2AvZ2JTV
1022958567899443200,Fri Jul 27 21:35:02 +0000 2018,Ken Kocienda’s ‘Creative Selection: Inside Apple’s Design Process During the Golden Age of Steve Jobs’: https://t.co/t54I5jLbUG
1022956050759209000,Fri Jul 27 21:25:02 +0000 2018,‘How Goop’s Haters Made Gwyneth Paltrow’s Company Worth $250 Million’: https://t.co/fEHOgFNvD3
1022956050759209000,Fri Jul 27 21:25:02 +0000 2018,‘How Goop’s Haters Made Gwyneth Paltrow’s Company Worth $250 Million’: https://t.co/fEHOgFNvD3
1022938436175585300,Fri Jul 27 20:15:03 +0000 2018,Different US Election Maps Tell ‘Different Versions of the Truth’: https://t.co/1whA89JD3M
1022933398959136800,Fri Jul 27 19:55:02 +0000 2018,MoviePass Couldn’t Afford to Pay for Movie Tickets on Thursday: https://t.co/rIa9PYCMr6
1022553398216941600,Thu Jul 26 18:45:02 +0000 2018,[Sponsor] MartianCraft: https://t.co/HzPy3uXPrx
1022542072891560000,Thu Jul 26 18:00:02 +0000 2018,Om Malik on E-Cigarette Darling Juul Labs: https://t.co/BKSL6vSPe2
1022515646888927200,Thu Jul 26 16:15:02 +0000 2018,New iPhone X Ad: ‘Unleash’: https://t.co/dk3fuZhqBO
1022275313781416000,Thu Jul 26 00:20:02 +0000 2018,Facebook Stock Falls 24 Percent in After-Hours Trading on Forecast for Slowing Growth, Rising Expenses: https://t.co/NKg9KUEIzb
1022165845198417900,Wed Jul 25 17:05:03 +0000 2018,‘Free’ Podcasting: https://t.co/Ye1fKgi9g2
1021811006882885600,Tue Jul 24 17:35:03 +0000 2018,Apple Identifies and Fixes Thermal Bug in the New MacBook Pro Models: https://t.co/FZEHLiAgbx
1021797163012173800,Tue Jul 24 16:40:02 +0000 2018,Daring Fireball Weekly Sponsorship Openings: https://t.co/vbIqVpi1kr
1021792128840736800,Tue Jul 24 16:20:02 +0000 2018,iPhone X Sets New Record for Resale Value, Averaging 85 Percent of Retail Price: https://t.co/oxQJecbyNP
1021789615479550000,Tue Jul 24 16:10:02 +0000 2018,Alissa Walker: ‘Don’t Ban Scooters. Redesign Streets.’: https://t.co/EJMN1TH4wM
1021787097559167000,Tue Jul 24 16:00:02 +0000 2018,Motherboard Reviews a Counterfeit iPhone X: https://t.co/tjuTAGknOi
1020813179239182300,Sat Jul 21 23:30:02 +0000 2018,Timing: https://t.co/I4v2EJvGw2
