id,created_at,text
1041427145699086300,Sun Sep 16 20:42:34 +0000 2018,BEHIND THE SCENE GROOMING PAUL MASON | DTK MEN  https://t.co/Krij9f3Cch
1040715554653446100,Fri Sep 14 21:34:58 +0000 2018,Modern Western  One of our stunning beauty editoruals in our fall issue. You can buy your issue with the link in ou… https://t.co/CZipUoVLCK
1040715541491667000,Fri Sep 14 21:34:55 +0000 2018,Modern Western  One of our stunning beauty editoruals in our fall issue. You can buy your issue with the link in ou… https://t.co/EYlwEQTC7g
1040715534130708500,Fri Sep 14 21:34:53 +0000 2018,Modern Western  One of our stunning beauty editoruals in our fall issue. You can buy your issue with the link in ou… https://t.co/CTCUdehtWa
1040653174497894400,Fri Sep 14 17:27:05 +0000 2018,Interview: Amy Shark https://t.co/otuaIj0KEG
1040632882706952200,Fri Sep 14 16:06:27 +0000 2018,Interview: Amy Shark https://t.co/otuaIiJ9N8
1040613968467963900,Fri Sep 14 14:51:18 +0000 2018,The Best of NYFW Hair with Bumble &amp; Bumble https://t.co/94a34NvJTe
1040353116087099400,Thu Sep 13 21:34:46 +0000 2018,Charm of Chanel  Our @chanelofficial feature in our fall issue. You can check it out on our website or buy your iss… https://t.co/1kh1U1x5tE
1040353111112667100,Thu Sep 13 21:34:45 +0000 2018,Charm of Chanel  Our @chanelofficial feature in our fall issue. You can check it out on our website or buy your iss… https://t.co/zMxYD6Yl9l
1040353105039306800,Thu Sep 13 21:34:43 +0000 2018,Charm of Chanel  Our @chanelofficial feature in our fall issue. You can check it out on our website or buy your iss… https://t.co/vXJRqWmAoh
1040347227112255500,Thu Sep 13 21:11:22 +0000 2018,Charm of Chanel https://t.co/6nCu4Es4sy
1039990709250654200,Wed Sep 12 21:34:41 +0000 2018,Flawless Foundation  See @sabrinarinaldimakeup's latest beauty review in our fall issue. You can check it out on ou… https://t.co/arcpzrLRWR
1039990702485188600,Wed Sep 12 21:34:40 +0000 2018,Flawless Foundation  See @sabrinarinaldimakeup's latest beauty review in our fall issue. You can check it out on ou… https://t.co/exD0XY99CF
1039990694729998300,Wed Sep 12 21:34:38 +0000 2018,Flawless Foundation  See @sabrinarinaldimakeup's latest beauty review in our fall issue. You can check it out on ou… https://t.co/NlAtZhwsmm
1039913334018134000,Wed Sep 12 16:27:14 +0000 2018,Zimmermann’s SS19 Brings Back High-Gloss Boho https://t.co/BHVUwk4vZV
1039847929790570500,Wed Sep 12 12:07:20 +0000 2018,Watch the Michael Kors NYFW Show https://t.co/EL4s7OnGZE
1039615619845550100,Tue Sep 11 20:44:13 +0000 2018,Neon Lights https://t.co/r4lrr0WKV4
1039586222648291300,Tue Sep 11 18:47:24 +0000 2018,NEON LIGHTS https://t.co/r4lrr0WKV4
1038479421106270200,Sat Sep 08 17:29:22 +0000 2018,Grey Goose Vodka Celebrates the North American Premiere of Vox Lux During TIFF https://t.co/j5YQ2PSbyn
1038178789493289000,Fri Sep 07 21:34:46 +0000 2018,State of the Art, one of our fashion editorials in our Fall Fashion Issue, featuring @louisvuitton. It's out in pri… https://t.co/nk9kbE3WgP
1038178782606180400,Fri Sep 07 21:34:44 +0000 2018,State of the Art, one of our fashion editorials in our Fall Fashion Issue, featuring @louisvuitton. It's out in pri… https://t.co/zdg9sgsKE5
1038178773387100200,Fri Sep 07 21:34:42 +0000 2018,State of the Art, one of our fashion editorials in our Fall Fashion Issue, featuring @louisvuitton. It's out in pri… https://t.co/RGwWPHaBw5
1038142260028866600,Fri Sep 07 19:09:37 +0000 2018,Flawless Foundations https://t.co/5SU8tgaUeP
1038142258053357600,Fri Sep 07 19:09:36 +0000 2018,Time Capsule: A journey through the history of Louis Vuitton https://t.co/EyFsTnW11c
1037800966618263600,Thu Sep 06 20:33:26 +0000 2018,Aline Weber beautiful Inside &amp; Out https://t.co/hm9reft5up
1037717928031014900,Thu Sep 06 15:03:28 +0000 2018,Meet The Greta Constantine S/S19 Supermodel https://t.co/HiINOCM8DX
1037717924973355000,Thu Sep 06 15:03:27 +0000 2018,Lady of the manor https://t.co/4o7PInO494
1037714147327266800,Thu Sep 06 14:48:27 +0000 2018,Out of the office https://t.co/WX4ka7uc1Y
1037355627482411000,Wed Sep 05 15:03:49 +0000 2018,YSL BEAUTY Builds A Heavenly Beauty Hotel In Toronto https://t.co/4joFQ6Bfce
1037091594984464400,Tue Sep 04 21:34:39 +0000 2018,Buy our Fall Fashion Issue now! Hitting newsstands next week.  In it, you'll find our exclusive article focusing on… https://t.co/3hdN33Ptys
1037091587715752000,Tue Sep 04 21:34:37 +0000 2018,Buy our Fall Fashion Issue now! Hitting newsstands next week.  In it, you'll find our exclusive article focusing on… https://t.co/IIl6e0ijyd
1037091580988084200,Tue Sep 04 21:34:35 +0000 2018,Buy our Fall Fashion Issue now! Hitting newsstands next week.  In it, you'll find our exclusive article focusing on… https://t.co/tVI0hk9LkL
1036962955454304300,Tue Sep 04 13:03:29 +0000 2018,DTK Exclusive: CHANEL unveils A/W18 Eyewear Campaign https://t.co/5sRsajnV94
1035573296010539000,Fri Aug 31 17:01:28 +0000 2018,We are loving punk-inspired looks for fall. See them come to life in our online editorial, New Noise. 🔗Link In Bio.… https://t.co/TN6Jbi91QK
1035521697754046500,Fri Aug 31 13:36:26 +0000 2018,Valmont Presents First NYC Art Exhibition https://t.co/bCARAhMP0I
1035236004884623400,Thu Aug 30 18:41:11 +0000 2018,Meghan Markle’s Wedding Dress is Going On Tour https://t.co/wFjogEFLnF
1035168223304593400,Thu Aug 30 14:11:51 +0000 2018,Serena Williams’ Best On-Court Looks https://t.co/gsMt3gMRh5
1034925192294924300,Wed Aug 29 22:06:08 +0000 2018,Louis Vuitton Adds New Perfume to Established Line https://t.co/Wa5YAZxRYZ
1034874968729956400,Wed Aug 29 18:46:34 +0000 2018,The Sci-Fi Body Modification Trend Taking Over NYC https://t.co/7k4jImsZ5S
1034841808696737800,Wed Aug 29 16:34:48 +0000 2018,A photo from “Life Tracels with Silversea” by @dresstokillmagazine.kw in our Summer 2018 Travel issue.  Link in bio… https://t.co/72JigQgKHk
1034841800748531700,Wed Aug 29 16:34:46 +0000 2018,A photo from “Life Tracels with Silversea” by @dresstokillmagazine.kw in our Summer 2018 Travel issue.  Link in bio… https://t.co/Cc5DTHwa79
1034841793261719600,Wed Aug 29 16:34:44 +0000 2018,A photo from “Life Tracels with Silversea” by @dresstokillmagazine.kw in our Summer 2018 Travel issue.  Link in bio… https://t.co/Y8BX9iVc3L
1034207635917041700,Mon Aug 27 22:34:49 +0000 2018,Richard Bernstein created some of the most iconic covers for #AndyWarhol @interviewmag  The late artist is being ho… https://t.co/RnXc5P4CcY
1034207624982450200,Mon Aug 27 22:34:47 +0000 2018,Richard Bernstein created some of the most iconic covers for #AndyWarhol @interviewmag  The late artist is being ho… https://t.co/0AphLfKAMv
1034178353560006700,Mon Aug 27 20:38:28 +0000 2018,Get Hair Like You’re on Riverdale https://t.co/Fu6MPFNfY6
1034148069082910700,Mon Aug 27 18:38:07 +0000 2018,Andy Warhol’s Cover Artist Honoured in New Book https://t.co/oOZgEmZr2W
1033482849037561900,Sat Aug 25 22:34:47 +0000 2018,Get the glow and sculpt you desire! Our Summer 2018 issue features “The New Nude”, the ultimate guide to contour an… https://t.co/EPXEuoE4vw
1033482841223516200,Sat Aug 25 22:34:45 +0000 2018,Get the glow and sculpt you desire! Our Summer 2018 issue features “The New Nude”, the ultimate guide to contour an… https://t.co/LVwhsP2tW0
1033075213498560500,Fri Aug 24 19:34:59 +0000 2018,Meet TV Star Caroline Dhavernas, one of our Summer 2018 Cover Stars!  Still haven’t got your copy? Link in bio!  St… https://t.co/T7Olaoa9Rg
1033075204791193600,Fri Aug 24 19:34:57 +0000 2018,Meet TV Star Caroline Dhavernas, one of our Summer 2018 Cover Stars!  Still haven’t got your copy? Link in bio!  Ph… https://t.co/2yYfENQiHL
1033060016436207600,Fri Aug 24 18:34:35 +0000 2018,Meet TV Star Caroline Dhavernas, one of our Summer 2018 Cover Stars!  Still haven’t got your copy? Link in bio!  Ph… https://t.co/U6v9tzPEfG
1032721362174050300,Thu Aug 23 20:08:54 +0000 2018,Vincent d’Amérique to Launch Poetic Depth at FMD https://t.co/EzvXSZfBla
1032712867710156800,Thu Aug 23 19:35:09 +0000 2018,#TBT to our Spring 2018 Cover Story with @heriethpaul ! She brings a breath of fresh air and modern energy, ready t… https://t.co/8eCCu0yjGJ
1032712861171236900,Thu Aug 23 19:35:07 +0000 2018,#TBT to a beautiful quote by @heriethpaul from the Spring 2018 10th Anniversary Issue Cover Story!  Find more edito… https://t.co/XR0gF4Kd64
1032712850853306400,Thu Aug 23 19:35:05 +0000 2018,#TBT to our Spring 2018 Cover Story with @heriethpaul ! She brings a breath of fresh air and modern energy, ready t… https://t.co/Ly2jPbpP6E
1032365525223886800,Wed Aug 22 20:34:56 +0000 2018,One of our online-exclusive editorials: La Galleria  Link in bio to see full spread.  Photography: @robinwestfield… https://t.co/dH2TYzganx
1032365513865740300,Wed Aug 22 20:34:53 +0000 2018,One of our online-exclusive editorials: La Galleria  Link in bio to see full spread.  Photography: @robinwestfield… https://t.co/O4z9qLu14f
1032365503962964000,Wed Aug 22 20:34:51 +0000 2018,One of our online-exclusive editorials: La Galleria  Link in bio to see full spread.  Photography: @robinwestfield… https://t.co/ly2v60KoIt
1032332549815713800,Wed Aug 22 18:23:54 +0000 2018,Have you heard? @goop is coming to Vancouver in October https://t.co/lkOjsOZ4zu https://t.co/BVxZIP3kU8
1032332249272860700,Wed Aug 22 18:22:42 +0000 2018,Get TIFF-ready, Celeb-Style! https://t.co/HwPmnsKIyc
1032010796497363000,Tue Aug 21 21:05:22 +0000 2018,LaSalle College Alum &amp; Students Unite at FMD https://t.co/5lOY2MEvay
1031991920954945500,Tue Aug 21 19:50:22 +0000 2018,Luxury Watch Brand Tissot Launches E-Commerce in Canada https://t.co/gRKA2LomIJ
1031971370291392500,Tue Aug 21 18:28:42 +0000 2018,There is power in diversity - which is why we're so hyped about @IamSandraOh 's leading role in #KillingEve https://t.co/XqcYL3mK1h
1031970557158469600,Tue Aug 21 18:25:28 +0000 2018,At a picture-perfect dinner, Toronto's most influential dined for Animal Justice https://t.co/fVJavlV9ec
1031970201506590700,Tue Aug 21 18:24:03 +0000 2018,RT @dkny: .@DressToKillMag photographs the Look 44 Coat from the #DKNY Spring 2017 collection. #DKNYSS17 https://t.co/Ezu5Tble61
1031604280904622100,Mon Aug 20 18:10:01 +0000 2018,Karl Lagerfeld Calls Upon Kaia for New Collaboration https://t.co/lwk3etiiSF
1031585807482675200,Mon Aug 20 16:56:37 +0000 2018,A New Era Arrives at Rebecca Minkoff https://t.co/HnV73EXuDF
1031170450833989600,Sun Aug 19 13:26:08 +0000 2018,What can we say - we love your hotel! RT @HotelXToronto: Thank you @dresstokillmag for the fabulous article!… https://t.co/YX9aZzRJPi
1030973190980468700,Sun Aug 19 00:22:17 +0000 2018,A closer look at the CN Tower's $16 mill renovation https://t.co/cIWl3wBC72
1030818647814676500,Sat Aug 18 14:08:11 +0000 2018,A royal-approved collab comes to @HM https://t.co/w1HN3CY1oz
1030805060626862100,Sat Aug 18 13:14:12 +0000 2018,Move over tartan, Riccardo Tisci has taken over.  https://t.co/YcM18bHbLw
1030607995032543200,Sat Aug 18 00:11:08 +0000 2018,Take care of yourself this weekend https://t.co/idL10Vocn0 https://t.co/L0tlnuQvXO
1030534812124229600,Fri Aug 17 19:20:20 +0000 2018,RT @rudsak: @dresstokillmag says former RUDSAK model Anna Stephenson is one of 10 Canadian models you need to know… https://t.co/9Hp4K8Jx3W
1030534238171537400,Fri Aug 17 19:18:03 +0000 2018,RT @FeatherstoneV: New ediorial out in @dresstokillmag featuring pieces from our collection 🙌 https://t.co/qXgCW4cMsk #womensfashion #fashi…
1030533182217703400,Fri Aug 17 19:13:51 +0000 2018,EXCLUSIVE: First look at @CHANEL 's Fall RTW Campaign https://t.co/wbMCuk0JDK https://t.co/wRvk2S2klQ
1030532876880801800,Fri Aug 17 19:12:38 +0000 2018,From @reformationx to @DIESEL, these are our must-have jeans for fall https://t.co/U2s0TPewuN https://t.co/lTpuMHtFdG
1030532305650163700,Fri Aug 17 19:10:22 +0000 2018,"It’s just so fantastic to have met someone who truly believes in you, who respects your choices" TV Star Caroline… https://t.co/wpnNHv3LtU
1030531979920531500,Fri Aug 17 19:09:05 +0000 2018,Maripier Morin is ready to take on the world https://t.co/QkUVgV5YNf https://t.co/U4m6OjZfJQ
1030531557956759600,Fri Aug 17 19:07:24 +0000 2018,We know where we're going to be on Aug 20th - do you? https://t.co/LG5MB1ICTO https://t.co/fD3oY1S5nw
1030531278725152800,Fri Aug 17 19:06:17 +0000 2018,. The female-founded beauty brand @flawlessbyfri is about to become your new obsession https://t.co/5GcXDnAQKr https://t.co/AefdrRiw37
1030531009564033000,Fri Aug 17 19:05:13 +0000 2018,On Set with Supermodel #CristaCober https://t.co/3jRRrjRG1n https://t.co/L0tlnuQvXO
1030530747260645400,Fri Aug 17 19:04:11 +0000 2018,"The final moments of upward wind before stumbling into the delicate darkness of a visionary’s downfall." Our take… https://t.co/9UjfBfYwca
1030529767198605300,Fri Aug 17 19:00:17 +0000 2018,. @lilyandlilac are all about embracing your sensuality with romantic gowns in our latest editorial https://t.co/hb58Hcwbg7
1030529243497881600,Fri Aug 17 18:58:12 +0000 2018,Anyone else still dying in this humidity? Here's how to upgrade your beauty to survive the heat: https://t.co/DyAPTkMIrW
1030528587970035700,Fri Aug 17 18:55:36 +0000 2018,Canadian transgender model Harlow on her life in Calgary, her career, and advice for young people… https://t.co/GhuHClNPy3
1030527811566673900,Fri Aug 17 18:52:31 +0000 2018,All-American brand Michael Kors announced the launch of a new jewelry collection centered around iconic lock motif… https://t.co/Z5UA4ms4k4
1030527526228111400,Fri Aug 17 18:51:23 +0000 2018,Bursting with colour, floral arrangements, and dreamy sweet scents, the Tel-Aviv-based retailer Laline has entered… https://t.co/wtWshQtQYB
1030527286863450100,Fri Aug 17 18:50:26 +0000 2018,“A big part of my inspiration comes from my childhood." Learn more about Monolo Blahnik and his work, now on at… https://t.co/uJ4e2LkhYs
