id,created_at,text
1088547065687363600,Thu Jan 24 21:20:19 +0000 2019,Van Cleef &amp; Arples newest additions will blow you away https://t.co/Lwf82RVgmL
1088545854703714300,Thu Jan 24 21:15:30 +0000 2019,Plastic https://t.co/TUasEhGboa
1088188372584222700,Wed Jan 23 21:35:00 +0000 2019,#reebokxvictoriabeckham . Blurring the lines between sport &amp; fashion, @victoriabeckham introduces her minimalistic… https://t.co/cDFZ1DsTGy
1087757181712244700,Tue Jan 22 17:01:36 +0000 2019,The Comeback Kid: Interview with Sharon Van Etten https://t.co/iZGE2K3joC
1087463994682683400,Mon Jan 21 21:36:35 +0000 2019,Fashion on Stage: Thierry Mugler https://t.co/kX7x8cVXp1
1086361351671427100,Fri Jan 18 20:35:04 +0000 2019,Get taken away to experience the best in winter fashion. Tap the link in our bio for more. #dtkfashion #dresstokill… https://t.co/VeyFEQ0gyY
1086297337213923300,Fri Jan 18 16:20:42 +0000 2019,The Beauty of Simplicity https://t.co/NgpCOmnasU
1085836729712549900,Thu Jan 17 09:50:24 +0000 2019,FENDI’s Latest Jewelry Collection, Just In Time For Valentine’s Day https://t.co/DWq99y4pSH
1085655677404508200,Wed Jan 16 21:50:58 +0000 2019,Christina Lustenberger: Ski like a Woman https://t.co/trqjyjwi30
1085640492405178400,Wed Jan 16 20:50:38 +0000 2019,Christina Lustenberger: Ski like a Woman https://t.co/trqjyjNTrA
1085625329937465300,Wed Jan 16 19:50:23 +0000 2019,Mette Towley on her debut and rising career as a dancer https://t.co/5QdFRmg6qw
1085295894780612600,Tue Jan 15 22:01:19 +0000 2019,That’s a wrap 👏 @marccain f/w 19 fashion show. Check our stories for all the looks &amp; stay tuned for more collection… https://t.co/32aIgS8zTx
1085289391734616000,Tue Jan 15 21:35:29 +0000 2019,Tress to Kill- A Roundup of our Fave New Hair Products https://t.co/5DSvB3Xhrw
1084882072659996700,Mon Jan 14 18:36:56 +0000 2019,Singapore: A Sustainable City https://t.co/JZU9GvtyeD
1084601330482757600,Mon Jan 14 00:01:22 +0000 2019,The Promised Land - A short fashion film.  #dtkfashion #dresstokill . Photographer: @donatphoto  Fashion Editor:… https://t.co/8xthQOMd1D
1084556043336724500,Sun Jan 13 21:01:25 +0000 2019,The promised land. . A short fashion film #dtkfashion #dresstokill . Photographer: @donatphoto  Fashion Editor:… https://t.co/Hbchs3jDTh
1083818993461399600,Fri Jan 11 20:12:39 +0000 2019,Kaia Gerber for Jimmy Choo SS ’19 https://t.co/arjeO2Z7Pq
1083779285104640000,Fri Jan 11 17:34:51 +0000 2019,Interrupting your feed with the latest in winter fashion.  #dtkfashion #dresstokill . Photographer: @donatphoto  Fa… https://t.co/dD6tb5evuC
1083069604023304200,Wed Jan 09 18:34:50 +0000 2019,Look your best. Luxury skincare reviews out now-link in bio. . #dtkbeauty #dresstokill . Photographer:… https://t.co/LyhbFx9nuL
1082665051608227800,Tue Jan 08 15:47:17 +0000 2019,The Sustainable Sneaker Everyone’s Talking About https://t.co/UVvDl8dU1O
1082356813666943000,Mon Jan 07 19:22:28 +0000 2019,Happening Gourmand 2019: An Affordable Gastronomic Experience https://t.co/Q0Ak9N8MiK
1082329735470956500,Mon Jan 07 17:34:52 +0000 2019,Treat yourself to only the best. Our full luxury skincare review is out.  Tap link in bio for the full edit. .… https://t.co/kkDjP9DTcV
1082151765301178400,Mon Jan 07 05:47:40 +0000 2019,This New Food Trend is About to Replace Wine And Cheese https://t.co/i8E3lTBJRl
1081952181501218800,Sun Jan 06 16:34:36 +0000 2019,There’s no better way to treat yourself during this time of year. Find out everything you need to know in our Luxur… https://t.co/S2CLOPPC8b
1081282971561275400,Fri Jan 04 20:15:24 +0000 2019,The Trendy Guide to Amsterdam https://t.co/P2NhPHwgsU
1081257639185711100,Fri Jan 04 18:34:44 +0000 2019,Greeting 2019 in style. . Photograph @royalgilbert  Creative Direction @ateliervingtquatre  FASHION editor… https://t.co/33FKCniNvg
1081252882584911900,Fri Jan 04 18:15:50 +0000 2019,Take your Chance: Chanel’s latest fragrance https://t.co/iiysZBtb1j
1081252879162376200,Fri Jan 04 18:15:49 +0000 2019,Comme un garçon https://t.co/FMbp8QnF8y
1080951331274321900,Thu Jan 03 22:17:35 +0000 2019,A Weekend in Bath https://t.co/oQW0n3WYch
1080487560047181800,Wed Jan 02 15:34:43 +0000 2019,Beauty secrets are revealed in our Mysterious Ways editorial. Tap the link in our bio for more... . #DTKBEAUTY… https://t.co/28adRyXY3f
1079445672653398000,Sun Dec 30 18:34:38 +0000 2018,She’s a bit of a mystery... . Full beauty editorial in our winter luxe edition, out now. Tap the link in our bio. .… https://t.co/U0aOWUxkPE
1078720942266814500,Fri Dec 28 18:34:48 +0000 2018,Tap the link in our bio for the entire Against the Wind editorial and more... . #DTK FASHION #DRESSTOKILLMAGAZINE .… https://t.co/GC98E37Dio
1077981034040430600,Wed Dec 26 17:34:41 +0000 2018,Brightening up the dreariest of winter days. Full Editorial in the Winter Luxury issue. Tap the link in our bio. .… https://t.co/ZzEF2HWmr3
1077256323396501500,Mon Dec 24 17:34:56 +0000 2018,The silkiest of fabrics in bold bright patterns. Tap the 🔗 in our bio for the full Luxurious edit. . #DTKFASHION… https://t.co/ntCJMvorPe
1076854816108875800,Sun Dec 23 14:59:29 +0000 2018,Dior presents Cara Delevingne https://t.co/77a74s8kEl
1076531530288250900,Sat Dec 22 17:34:52 +0000 2018,Welcoming winter in bold textures. 🔗In bio to see the full Luxury Winter Edition. . DTKFASHION #DRESSTOKILLMAGAZINE… https://t.co/VCNWe5mswC
1076492377555116000,Sat Dec 22 14:59:17 +0000 2018,Anine Bing: From influencer to international businesswoman &amp; mother https://t.co/j2zq9fZyq5
1076223276131803100,Fri Dec 21 21:09:58 +0000 2018,Screen Legends: The Chanel Coromandel High Jewellery Collection https://t.co/kWFDKT75J6
1075859929699901400,Thu Dec 20 21:06:10 +0000 2018,Mysterious Ways https://t.co/tQ5mWfByOM
1075816968941461500,Thu Dec 20 18:15:27 +0000 2018,Caroline Dhavernas behind the scenes fashion shoot  https://t.co/hNY1lxrVJE
1075806742427115500,Thu Dec 20 17:34:49 +0000 2018,This winter is all about daring contrasts, bold prints &amp; striking textures. . 🔗In bio to see the full edit in our L… https://t.co/kjfHWkBPHs
1075806732713189400,Thu Dec 20 17:34:47 +0000 2018,Forever pushing the boundaries of conformity. . 🔗In bio to see the full edit in our Luxury Winter Edition. . DTKFAS… https://t.co/pVUnqAmLPY
1075497700072796200,Wed Dec 19 21:06:48 +0000 2018,Animal Awareness https://t.co/fSbY7zoePk
1074765571852562400,Mon Dec 17 20:37:35 +0000 2018,G-Star: The Game Changer https://t.co/BfEErwAwmZ
1074708996437753900,Mon Dec 17 16:52:46 +0000 2018,Behind the Beauty Scenes of CHANEL’s Métiers d’Art show 2018/19 https://t.co/FZ7J0uQ9xe
1074342084801429500,Sun Dec 16 16:34:47 +0000 2018,Weekend mode. 🔗 in bio #DTKFASHION #DRESSTOKILLMAGAZINE . Photographer: @chrisnichollsphotography  Fashion Editor:… https://t.co/ZDz4kYZIuW
1073341731071033300,Thu Dec 13 22:19:45 +0000 2018,Canada’s Best Beauty Brands https://t.co/EU4nI8PQjy
1073311456182067200,Thu Dec 13 20:19:26 +0000 2018,Puffer Style https://t.co/xmOySJQubn
1073270054748336100,Thu Dec 13 17:34:56 +0000 2018,Brightening up the dreariest of winter days in the silkiest of fabrics.  Full Editorial in the Winter Luxury issue… https://t.co/wUBOkLtrZz
1072936474276974600,Wed Dec 12 19:29:24 +0000 2018,City Life https://t.co/sq0SjILtHd
1072608662219305000,Tue Dec 11 21:46:47 +0000 2018,The Most Coveted Beauty Gifts to Give This Season https://t.co/jJ42Mo2dL2
1072593492625551400,Tue Dec 11 20:46:31 +0000 2018,Protein Power https://t.co/v7C4Jtwj3l
1072545263691153400,Tue Dec 11 17:34:52 +0000 2018,Brightening up the dreariest of winter days in the silkiest of fabrics.  Full Editorial in the Winter Luxury issue… https://t.co/DoHGTqsgW6
1072216002153381900,Mon Dec 10 19:46:30 +0000 2018,Modernizing Class Codes: Salvatore Ferrgamo’s First Holiday Campaign https://t.co/iLoGCFyjfn
1072182029696020500,Mon Dec 10 17:31:30 +0000 2018,DTK’s 2019 Holiday Gift Guide https://t.co/1qT1OijFRO
1072178300980789200,Mon Dec 10 17:16:41 +0000 2018,Mouthpiece: Patricia Rozema’s Masterpiece https://t.co/TeEZdVWOIx
1072173172944986100,Mon Dec 10 16:56:19 +0000 2018,Fall into winter https://t.co/w7ksH2ImvP
1071820444246913000,Sun Dec 09 17:34:42 +0000 2018,Forever pushing the boundaries... See the full story, link in bio. #DTKFASHION #DRESSTOKILLMAGAZINE . Photographer:… https://t.co/z9JM5av0oZ
1071095669891522600,Fri Dec 07 17:34:42 +0000 2018,Pushing the boundaries of conformity. Out now in the Winter Luxury Issue. 🔗 in bio #DTKFASHION #DRESSTOKILLMAGAZINE… https://t.co/ZlsMOenOYd
1070769636038320100,Thu Dec 06 19:59:09 +0000 2018,Luxury Skincare https://t.co/WSBM7ukd0J
1070418630146437100,Wed Dec 05 20:44:23 +0000 2018,A Canadian Hero: Manitobah Mukluks https://t.co/EHfcEFgySa
1070385996699787300,Wed Dec 05 18:34:43 +0000 2018,Daring contrasts, bold prints &amp; striking textures. FALL INTO WINTER. See the full story, link in bio. #DTKFASHION… https://t.co/e3FU8ZZK9k
1070086401595711500,Tue Dec 04 22:44:14 +0000 2018,Abstractions: A Dinner Series in Support of Vegan Living https://t.co/lb85GScBeV
1070071318270361600,Tue Dec 04 21:44:17 +0000 2018,How to be The Perfect Host During The Holidays https://t.co/UuTPSGpdUT
1070021103135965200,Tue Dec 04 18:24:45 +0000 2018,A Taste of Provence with Christophe Dufau https://t.co/VNHthdAenW
1069696463175905300,Mon Dec 03 20:54:45 +0000 2018,The Promised Land  https://t.co/jxRHdmFPow
1069666169584476200,Mon Dec 03 18:54:22 +0000 2018,Golden Girl  https://t.co/02Qd4RlcyZ
1069661218095423500,Mon Dec 03 18:34:42 +0000 2018,Lather up! Everything you need to know about luxurious skincare out now in our Winter issue. 🔗in bio #DTKBEAUTY… https://t.co/98fNWWBYGm
1069630947795116000,Mon Dec 03 16:34:25 +0000 2018,Behind the Camera, at the Heart of Cinema https://t.co/gbmo1hs7Z3
1069335232166486000,Sun Dec 02 20:59:21 +0000 2018,Into the wind https://t.co/Tm8WlhgjdA
1069268651658932200,Sun Dec 02 16:34:47 +0000 2018,All about the skin you’re in.  Check out the luxury skincare edit in our Winter Issue. 🔗in bio #DTKBEAUTY… https://t.co/hpU3WoH0YB
1068606658505527300,Fri Nov 30 20:44:15 +0000 2018,8 Cruelty-Free Beauty Brands to Try this Winter https://t.co/G3BgkV3zku
1068606654911004700,Fri Nov 30 20:44:14 +0000 2018,Fan of the Sixties https://t.co/GfIn9xHl64
1068574138057572400,Fri Nov 30 18:35:02 +0000 2018,Treat your body good. Everything you need to know about luxury skincare out now in our Winter issue. 🔗 in bio.… https://t.co/fnaoRe62Y9
1068485149594140700,Fri Nov 30 12:41:25 +0000 2018,Martin Juneau for Duval-Leroy https://t.co/9585RlUz6X
1067906721459384300,Wed Nov 28 22:22:57 +0000 2018,Luxury Gold: Travel Made Easy https://t.co/mOzQKhYasz
1067895328953827300,Wed Nov 28 21:37:41 +0000 2018,Canadian Designers https://t.co/qE999uUUBg
1067888682055753700,Wed Nov 28 21:11:16 +0000 2018,Canadian Designers  https://t.co/nkcEb1gwyJ
1067864725764083700,Wed Nov 28 19:36:05 +0000 2018,@rachellehrs is in a whole new light for the Winter Luxury Edition. 🔗 in bio  #DTKFASHION #DRESSTOKILLMAGAZINE . Ph… https://t.co/WKO7rSLqhV
1067852514224218100,Wed Nov 28 18:47:33 +0000 2018,Montréal’s Souk @ SAT Celebrates its 15th Edition https://t.co/Kb9rLUEHkn
1067652342458269700,Wed Nov 28 05:32:09 +0000 2018,The Most Instagrammable New Restaurants in Montreal https://t.co/qgakCKNUaP
1067503908354957300,Tue Nov 27 19:42:19 +0000 2018,In a new light https://t.co/XLv5oURirC
1067486881171025900,Tue Nov 27 18:34:40 +0000 2018,@rachellehrs graces the cover of our Winter Luxury Edition.  Link in bio. #DTKFASHION #DRESSTOKILLMAGAZINE . Photog… https://t.co/OhK0MK4XGD
1067400508883779600,Tue Nov 27 12:51:27 +0000 2018,The Exclusive Look at CHANEL’s New CODE COCO Campaign https://t.co/mnRtqYUX2I
1067143750487552000,Mon Nov 26 19:51:11 +0000 2018,Why Maca Is Your New Favourite Superfood https://t.co/7uYSIY0lVF
1067109429752070100,Mon Nov 26 17:34:48 +0000 2018,SNEAK PEAK of the Winter Luxury Edition.  Stay tuned for more... #DTKFASHION #DRESSTOKILLMAGAZINE . Photographer:… https://t.co/oEagWq3iXT
1066826725311553500,Sun Nov 25 22:51:26 +0000 2018,Golden Girl https://t.co/Vqi1j4AcnN
1066069732095332400,Fri Nov 23 20:43:25 +0000 2018,Celebrating 20 Years of Design – BODYBAG by Jude https://t.co/GmAMj1xy0l
1066022563502002200,Fri Nov 23 17:35:59 +0000 2018,In the NEW VISION DESIGNERS editorial, Photographer @alexblackphoto captures @adeezia_adhel - featured in our Fall… https://t.co/tc7d3kq628
1065699770147188700,Thu Nov 22 20:13:19 +0000 2018,A Cold Romance https://t.co/5UmzVbSiTv
1065674982112616400,Thu Nov 22 18:34:49 +0000 2018,@cafawards President @vickymilner6 open’s up about Canadian fashion, to read more check out our extensive Fall Fash… https://t.co/cblyZmcyUr
1065418318159536100,Thu Nov 22 01:34:56 +0000 2018,What needs to be done for Canada to succeed in the fashion industry? Find out what some key players have to say in… https://t.co/WAxP8u71q8
1064954215301296100,Tue Nov 20 18:50:45 +0000 2018,Hard-To-Resist Textures We’re Currently Obsessing Over, and Why https://t.co/W8WV8WPiwt
1064954213208391700,Tue Nov 20 18:50:44 +0000 2018,Ruinart: Patron of Contemporary Art and Design https://t.co/yZ0iW0o5NZ
1063538286868746200,Fri Nov 16 21:04:21 +0000 2018,Dylan by Schatzberg,  by Jerry Schatzberg https://t.co/26STUBa6Rk
1062827075411894300,Wed Nov 14 21:58:15 +0000 2018,How To Get Into The Holiday Spirit https://t.co/qa7fx41njk
1062485116977643500,Tue Nov 13 23:19:26 +0000 2018,Women And Whisky https://t.co/X1JmUlulOJ
1062079768043159600,Mon Nov 12 20:28:43 +0000 2018,Through the Looking Glass: A Life in Fashion https://t.co/9KCeEbz2Cz
1059549513004793900,Mon Nov 05 20:54:24 +0000 2018,Smash-Hit Spirit Company Brings Cottage Season Year-Round https://t.co/y24BdBVJmk
1059527107544531000,Mon Nov 05 19:25:22 +0000 2018,The Smash-Hit Spirit Company Brings Cottage Season Year-Round https://t.co/y24BdBVJmk
1059485612498137100,Mon Nov 05 16:40:28 +0000 2018,The Boots We Are Coveting For Fall https://t.co/YTKk0N7MGt
1058779664691404800,Sat Nov 03 17:55:17 +0000 2018,An Inside Look at the goop Summit in Vancouver https://t.co/XELnTmA7go
1058760817569685500,Sat Nov 03 16:40:24 +0000 2018,Guilty As Charged: The New Faces Of Gucci’s Fragrance https://t.co/QW6fwMtzYT
1058753312458268700,Sat Nov 03 16:10:35 +0000 2018,American Apparel’s Canadian Comeback https://t.co/DfwX0jNxRf
1058462623409283100,Fri Nov 02 20:55:29 +0000 2018,In Memory of Robert Mefford https://t.co/9mroBTTKvt
1058393463937531900,Fri Nov 02 16:20:40 +0000 2018,How to Make Your Home More Stylish This Season https://t.co/0ducgsNBC4
1058110111527383000,Thu Nov 01 21:34:43 +0000 2018,Almost Famous, a rock &amp; roll fashion editorial for our @dtkmen FW Tech &amp; Visionary Issue  Keep your eye out for thi… https://t.co/DwebcrimYs
1057747727700901900,Wed Oct 31 21:34:44 +0000 2018,Space Oddity, our fashion editorial cover story for our @dtkmen FW Tech &amp; Visionary Issue  Keep your eye out for th… https://t.co/nr2th3Mw0H
1057705327951536100,Wed Oct 31 18:46:16 +0000 2018,7 multi-action, anti-aging creams for every budget https://t.co/kA5OAo5Ehx
1057385355874369500,Tue Oct 30 21:34:48 +0000 2018,Forever Young, a special collaborative fashion editorial with @gstarraw for our @dtkmen FW Tech &amp; Visionary Issue… https://t.co/9EU0CW4M8F
1057372185969524700,Tue Oct 30 20:42:28 +0000 2018,Heady scents from head to toe https://t.co/sEtIz9ATVv
1056881435217408000,Mon Oct 29 12:12:24 +0000 2018,Glenfiddich Experimental Series Event https://t.co/rXuw3OsSGk
1056165272636346400,Sat Oct 27 12:46:38 +0000 2018,Everything You Need to Know Before Attending La Grande Dégustation de Montréal https://t.co/TGISKYM2CM
1055833035298480100,Fri Oct 26 14:46:26 +0000 2018,Toronto’s Favourite Skincare Brand Now Offers Facials https://t.co/Iu7ZpigjSI
1055833031787855900,Fri Oct 26 14:46:25 +0000 2018,Grace Coddington Collaborates With Louis Vuitton https://t.co/EloNpnXA3W
1055833029351014400,Fri Oct 26 14:46:25 +0000 2018,Everything You Need to Have A Happy Halloween https://t.co/ZbpCyWeCPD
1055833025953587200,Fri Oct 26 14:46:24 +0000 2018,All the Best Photos from Vancouver Fashion Week https://t.co/q1J6E7SG7l
1053399082780233700,Fri Oct 19 21:34:47 +0000 2018,Act Natural, an online exclusive photoshoot. Check out the full story on our website.  Photographer @lilyandlilac F… https://t.co/32H0pQJDN7
1053036697624170500,Thu Oct 18 21:34:47 +0000 2018,Act Natural, an online exclusive photoshoot. Check out the full story on our website.  Photographer @lilyandlilac F… https://t.co/pmdi5fFm9J
1053018697714028500,Thu Oct 18 20:23:16 +0000 2018,Foundation Review https://t.co/lCzwVvXcBs
1052674294449360900,Wed Oct 17 21:34:44 +0000 2018,Act Natural, an online exclusive photoshoot. Check out the full story on our website.  Photographer @lilyandlilac F… https://t.co/nioQI2T2si
1052599684139769900,Wed Oct 17 16:38:15 +0000 2018,Coach Invests In Youth With New Philanthropic Venture https://t.co/Lz0Ff4icQu
1052569672430874600,Wed Oct 17 14:39:00 +0000 2018,Simon Chang Creates a Capsule Collection For a Canadian Fashion Retailer https://t.co/sh8oIM9eGN
1052311904109174800,Tue Oct 16 21:34:43 +0000 2018,Neon Lights, an online exclusive photoshoot. Check out the full story on our website.  Photographer @brandontitaro… https://t.co/UiRKaZdSmT
1052229781981421600,Tue Oct 16 16:08:24 +0000 2018,Iris Van Herpen: Art of Fashion https://t.co/rkoB9bSr0j
1052229778751873000,Tue Oct 16 16:08:23 +0000 2018,New Vision Designers https://t.co/vL4H8XssNs
1051949529438847000,Mon Oct 15 21:34:46 +0000 2018,Neon Lights, an online exclusive photoshoot. Check out the full story on our website.  Photographer @brandontitaro… https://t.co/oz1zyIbYr1
1051919942667382800,Mon Oct 15 19:37:12 +0000 2018,8 Beauty Products You Need to Make it Through a Stressful Week https://t.co/Ic9erQKt5c
1051916170859860000,Mon Oct 15 19:22:13 +0000 2018,Bermuda: Instagram playground extraordinaire https://t.co/uTBZWJBSEw
1051527929564299300,Sun Oct 14 17:39:29 +0000 2018,Canadian Creatives Take The Spotlight at VFW https://t.co/0P8orJdWSv
1051507295925035000,Sun Oct 14 16:17:30 +0000 2018,Canadian Creatives Take The Spotlight at VFW https://t.co/0P8orIWm0X
1051489718632878100,Sun Oct 14 15:07:39 +0000 2018,Vancouver Fashion Week Attracts Global Talent https://t.co/TXNOrCDMsG
1050137614848802800,Wed Oct 10 21:34:52 +0000 2018,Neon Lights, an online exclusive photoshoot. Check out the full story on our website.  Photographer @brandontitaro… https://t.co/76ETO1cUk8
1050111067270058000,Wed Oct 10 19:49:23 +0000 2018,Animal Instinct https://t.co/u87htVTN6A
1050097281767223300,Wed Oct 10 18:54:36 +0000 2018,Designer UNTTLD: Canada’s Favourite https://t.co/J0F22tFbJq
1049338593519591400,Mon Oct 08 16:39:51 +0000 2018,Get the CHANEL Beach Beauty Look https://t.co/Fz5Emqccwd
1047963248149061600,Thu Oct 04 21:34:43 +0000 2018,The stunning supermodel and eco-warrior, Aline Weber, our fall cover model.  Photographer: @rayanayash Fashion Edit… https://t.co/65F7bf7UYC
1047949854335492100,Thu Oct 04 20:41:29 +0000 2018,Celebs, Space &amp; Ambiguity – Louis Vuitton’s Must-See SS19 Show https://t.co/NVT79Mfm8G
1047923379905470500,Thu Oct 04 18:56:17 +0000 2018,Canadian Fashion Special: Greta Constantine https://t.co/S6fGKJ5caq
1047923376600350700,Thu Oct 04 18:56:17 +0000 2018,Visual Optimism https://t.co/7ut7w21T3D
1047603616033460200,Wed Oct 03 21:45:40 +0000 2018,Ridley Scott For Hennessy https://t.co/yT5ElVpQVP
1047600836610805800,Wed Oct 03 21:34:37 +0000 2018,Our cover story with the inspiring Aline Weber for our Fall Fashion issue  Photographer: @rayanayash Fashion Editor… https://t.co/gjy41SDoUa
1047599882180157400,Wed Oct 03 21:30:50 +0000 2018,Inside CHANEL’s Opening Gala for the Ballet https://t.co/mXXRV78EK9
1047549481464594400,Wed Oct 03 18:10:33 +0000 2018,The Foodie Chronicles: Where to Eat in Montreal This Month https://t.co/3uS9PUz5g4
1046891198873579500,Mon Oct 01 22:34:46 +0000 2018,The stunning supermodel and eco-warrior, Aline Weber, our fall cover model.  Photographer: @rayanayash Fashion Edit… https://t.co/TxE4gXZWAX
1046868716175200300,Mon Oct 01 21:05:26 +0000 2018,Trend Report https://t.co/cHRpGcTEqG
1046865061028016100,Mon Oct 01 20:50:55 +0000 2018,Modern Western https://t.co/pRAUDe1VcM
1046056103874826200,Sat Sep 29 15:16:24 +0000 2018,Chanel’s Enchanting History With Dance https://t.co/qxcdXNNrkc
1045773833238663200,Fri Sep 28 20:34:46 +0000 2018,@denis_gagnon Photoshoot  Part of our big Canadian fashion feature in our fall issue. You can buy your issue with t… https://t.co/JjrJ1m4228
1045773826167111700,Fri Sep 28 20:34:44 +0000 2018,@denis_gagnon Photoshoot  Part of our big Canadian fashion feature in our fall issue. You can buy your issue with t… https://t.co/SVDRqfyMfN
1045773818600542200,Fri Sep 28 20:34:42 +0000 2018,@denis_gagnon Photoshoot  Part of our big Canadian fashion feature in our fall issue. You can buy your issue with t… https://t.co/kMRlRDwFOz
1045756708839198700,Fri Sep 28 19:26:43 +0000 2018,Train Like A Model https://t.co/shyhQvVJxT
1045756705060081700,Fri Sep 28 19:26:42 +0000 2018,Canadian Fashion Special – Denis Gagnon https://t.co/nqCMf0iZo6
1045735388525006800,Fri Sep 28 18:02:00 +0000 2018,A Combination of Creativity and Commerce at Milan Fashion Week https://t.co/CzIijwSzrc
1045727694296690700,Fri Sep 28 17:31:25 +0000 2018,The Standout Shows of London Fashion Week https://t.co/o08FUAWTup
1045419718939684900,Thu Sep 27 21:07:38 +0000 2018,A Look At Music Sensation Rhye https://t.co/K008WxRPdu
1045419717211689000,Thu Sep 27 21:07:38 +0000 2018,Pace of the Jaguar https://t.co/tT2ZDoNaJo
1045409612386717700,Thu Sep 27 20:27:29 +0000 2018,Rhye: A Look At Music Sensation https://t.co/K008WxRPdu
1045061029682704400,Wed Sep 26 21:22:20 +0000 2018,The Canadian Fashion Directory https://t.co/xo3xr01Z8r
1045061026763460600,Wed Sep 26 21:22:19 +0000 2018,Coach’s SPR19 Collection at Pier 94 NYC https://t.co/aV82f5EGq1
1045019511022325800,Wed Sep 26 18:37:21 +0000 2018,Canadian Fashion Special https://t.co/IHeXZ0S8Wr
1044974239420428300,Wed Sep 26 15:37:28 +0000 2018,Pace of the Jaguar https://t.co/tT2ZDoNaJo
1044769144485412900,Wed Sep 26 02:02:29 +0000 2018,Louis Vuitton Launches Your Latest Jewelry Obsession https://t.co/QS4cp0MIOW
1044339367890825200,Mon Sep 24 21:34:42 +0000 2018,New Vision Designers  Part of our big Canadian fashion feature in our fall issue. You can buy your issue with the l… https://t.co/M3wKBxoKm0
1044339361939161100,Mon Sep 24 21:34:41 +0000 2018,New Vision Designers  Part of our big Canadian fashion feature in our fall issue. You can buy your issue with the l… https://t.co/t8A0iKngQg
1044339354691424300,Mon Sep 24 21:34:39 +0000 2018,New Vision Designers  Part of our big Canadian fashion feature in our fall issue. You can buy your issue with the l… https://t.co/wgxmJMGiik
1044301039279722500,Mon Sep 24 19:02:24 +0000 2018,How to Make Your Life Easier This Season https://t.co/G7PPEl1ZoH
1044292226505986000,Mon Sep 24 18:27:23 +0000 2018,When Luxury Unites – SHAN + Marie Saint Pierre https://t.co/b3Xfswhw3b
1044278421570965500,Mon Sep 24 17:32:32 +0000 2018,Toronto’s New Wellness Studio Feels Like Home https://t.co/NIFs8rBbYm
1043523462797697000,Sat Sep 22 15:32:35 +0000 2018,Everything Noteworthy From NYFW https://t.co/70iwHbTHhp
1043320580026654700,Sat Sep 22 02:06:24 +0000 2018,This Prep-School Print Is A Must-Have for Fall https://t.co/2bmdJQHxZz
1042891537577898000,Thu Sep 20 21:41:33 +0000 2018,Stay on top of this year’s hairstyle trends: Colour https://t.co/C9c9ljhN3p
1042889857339666400,Thu Sep 20 21:34:52 +0000 2018,Maximum Overdrive  Part of our big Canadian fashion feature in our fall issue. You can buy your issue with the link… https://t.co/iP34CKSXNj
1042889848498147300,Thu Sep 20 21:34:50 +0000 2018,Maximum Overdrive  Part of our big Canadian fashion feature in our fall issue. You can buy your issue with the link… https://t.co/w0w8HYWaXL
1042889839924994000,Thu Sep 20 21:34:48 +0000 2018,Maximum Overdrive  Part of our big Canadian fashion feature in our fall issue. You can buy your issue with the link… https://t.co/sYnkMfFBql
1042872653667885000,Thu Sep 20 20:26:30 +0000 2018,Acting Natural https://t.co/NDYQlOX5in
1042165044627361800,Tue Sep 18 21:34:43 +0000 2018,UNTTLD @unttld_official  Part of our big Canadian fashion feature in our fall issue. You can buy your issue with th… https://t.co/Jyg5S9ORE4
1042165038663061500,Tue Sep 18 21:34:42 +0000 2018,UNTTLD @unttld_official  Part of our big Canadian fashion feature in our fall issue. You can buy your issue with th… https://t.co/dNH40P3zI5
1042165031360757800,Tue Sep 18 21:34:40 +0000 2018,UNTTLD @unttld_official  Part of our big Canadian fashion feature in our fall issue. You can buy your issue with th… https://t.co/WMKey2Zrto
1042150572118499300,Tue Sep 18 20:37:13 +0000 2018,Birks Flagship Store is Now Re-Opened in Montreal https://t.co/SjdQ5RVWCZ
1042056474711781400,Tue Sep 18 14:23:18 +0000 2018,@sherry_brydson Hi Sherry, I build a modern media brand by myself for the last decade. I do need help and guidance… https://t.co/9GQDWTnTRG
1041802728220123100,Mon Sep 17 21:35:00 +0000 2018,Animal Instinct  One of our stunning editorials in our fall issue. You can buy your issue with the link in our bio… https://t.co/m30ufnyvn2
1041802721433661400,Mon Sep 17 21:34:59 +0000 2018,Animal Instinct  One of our stunning editorials in our fall issue. You can buy your issue with the link in our bio… https://t.co/EolfjsqSA9
1041802713284194300,Mon Sep 17 21:34:57 +0000 2018,Animal Instinct  One of our stunning editorials in our fall issue. You can buy your issue with the link in our bio… https://t.co/nydqqRMiO2
1041427147963936800,Sun Sep 16 20:42:35 +0000 2018,BEHIND THE SCENE GROOMING GABRIEL GENDREAU | DTK MEN  https://t.co/x0JhkSgvzN
