id,created_at,text
1254136732943089700,Sat Apr 25 19:54:32 +0000 2020,Moonlight  https://t.co/pksrImWyNS
1206625624535769000,Mon Dec 16 17:22:21 +0000 2019,Dress to Kill launch party Winter 2019  https://t.co/s2l3T9mlDE
1201954945538445300,Tue Dec 03 20:02:44 +0000 2019,Canadian Boxing Star Lexson Mathieu at Dress to Kill Men's Launch Party  https://t.co/y0edYqxHks
1199753901563617300,Wed Nov 27 18:16:35 +0000 2019,BEHIND THE SCENES: LIFE ON MARS with Top Model Harieth Paul and Stylist Cary Tauben  https://t.co/hqM7BQRdtX
1199753900397600800,Wed Nov 27 18:16:34 +0000 2019,DRESS TO KILL POP-UP LAUNCH PARTY  https://t.co/8BzYsxX3tW
1190322980972322800,Fri Nov 01 17:41:28 +0000 2019,The Modern Man  https://t.co/OZXbhvb69t
1189230027017277400,Tue Oct 29 17:18:27 +0000 2019,Modern Gentlemen  https://t.co/MZvYEFun05
1180163267244806100,Fri Oct 04 16:50:23 +0000 2019,A Long Weekend in Bath https://t.co/5t6qegYkIp
1180163264786907100,Fri Oct 04 16:50:23 +0000 2019,The Sustainable City: Singapore https://t.co/2WfKgcG91z
1179740513144098800,Thu Oct 03 12:50:31 +0000 2019,Virgil Abloh’s OFF-WHITE SS 2020 Collection https://t.co/zwXmhYtBoR
1179740511000842200,Thu Oct 03 12:50:30 +0000 2019,Lupita Nyong’o Joins Michael Kors’ Watch Hunger Stop https://t.co/VNsABe8aiq
1179740508115161000,Thu Oct 03 12:50:30 +0000 2019,FENDI collaborates with Nicki Minaj for FENDI Prints On https://t.co/XqasCAv8nM
1179740506093437000,Thu Oct 03 12:50:29 +0000 2019,Thom Browne drops six unisex fragrances https://t.co/1beW7TatmC
1179740504004665300,Thu Oct 03 12:50:29 +0000 2019,#KNOTONMYPLANET Raises funds for the conservation of elephants https://t.co/ow9WtP3EXz
1179740501551001600,Thu Oct 03 12:50:28 +0000 2019,Getting to Know Victoria Secret Supermodel Maria Borges https://t.co/xXKUiOg8PF
1179740499411902500,Thu Oct 03 12:50:28 +0000 2019,Fashion Editorial: Stolen Identity https://t.co/m6QskxOWbN
1179740497130197000,Thu Oct 03 12:50:27 +0000 2019,Dream Land: Michael Kors’ Boho-Glam Collection https://t.co/FFlZDnPRmQ
1179740495435751400,Thu Oct 03 12:50:27 +0000 2019,New Bourgeoisie: The Chic Suburban It-Girl https://t.co/dbfv9AZ88o
1179740493581869000,Thu Oct 03 12:50:26 +0000 2019,Fashion Editorial: Grand Electric https://t.co/hHTVGYpD0z
1178836313782530000,Tue Oct 01 00:57:33 +0000 2019,Style Round Up https://t.co/cp7lSo5Nc5
1178805998586343400,Mon Sep 30 22:57:05 +0000 2019,STARMAKER – issue with uploading photos https://t.co/JTTIjJrAYJ
1176885177265643500,Wed Sep 25 15:44:26 +0000 2019,Hugo Boss Debuts BOSS Individuals at Milan Fashion Week https://t.co/q17KkHb7u2
1176885175541739500,Wed Sep 25 15:44:25 +0000 2019,The New Breitling Avenger Collection https://t.co/5EMx9F8Krn
1176203218411565000,Mon Sep 23 18:34:34 +0000 2019,HUGO BOSS  launches Yacht https://t.co/n8SEvRXdsk
1176203215211249700,Mon Sep 23 18:34:33 +0000 2019,Marni Women’s Colorful Spring Summer 2020 Collection https://t.co/MUlg7MXBlM
1176196911805730800,Mon Sep 23 18:09:31 +0000 2019,Montreal Designers Fashion Week kicks off on October 9th https://t.co/HCD71ASWeB
1176196907498168300,Mon Sep 23 18:09:30 +0000 2019,New Forms of Subjectification in Gucci’s Spring Summer 2020 Collection https://t.co/1pYOEGbQOl
1176191929635287000,Mon Sep 23 17:49:43 +0000 2019,Fendi Women’s Spring Summer 2020 stuns at Milan Fashion Week https://t.co/HRwwwLF7ky
1175090365164064800,Fri Sep 20 16:52:29 +0000 2019,Making A Statement with Jewelry Designer Rita Tesolin https://t.co/Dh2FCPdEbW
1172232832728666000,Thu Sep 12 19:37:41 +0000 2019,Dream-Land https://t.co/GVDTCPSjiU
1171887941167276000,Wed Sep 11 20:47:12 +0000 2019,A-List Celebs wear Michael Kors’ to Kors’ SS 2020 NYFW Show https://t.co/hOwa6l7UZn
1171822489678295000,Wed Sep 11 16:27:07 +0000 2019,Coach Presents Stuart Vevers’ Spring 2020 Collection In New York https://t.co/G4xh87nZd1
1171440227790942200,Tue Sep 10 15:08:09 +0000 2019,M3 Mode Masculine Montreal https://t.co/KCuRmZHOAe
1171121749058044000,Mon Sep 09 18:02:38 +0000 2019,Christopher Bates Spring/Summer 2020 https://t.co/TvQrxpJQhS
1171097774735147000,Mon Sep 09 16:27:22 +0000 2019,Hugo Boss Tiff Party https://t.co/ioBu6VuAdn
1170073630014890000,Fri Sep 06 20:37:46 +0000 2019,Canadian Franklin Elman relaunches the legendary Maison Trigère https://t.co/0MjFXaHvoB
1170059621609955300,Fri Sep 06 19:42:07 +0000 2019,#KNOTONMYPLANET Raises funds for the conservation of elephants https://t.co/lT3Cbf0yWs
1168961669827039200,Tue Sep 03 18:59:15 +0000 2019,Maria Borges takes over New York city https://t.co/Pst1Mv4gY4
1167871783787094000,Sat Aug 31 18:48:25 +0000 2019,Book recommendation https://t.co/kBCk87bhaS
1167849417547964400,Sat Aug 31 17:19:33 +0000 2019,Book recommendation https://t.co/kBCk86TGjk
1166793771696251000,Wed Aug 28 19:24:47 +0000 2019,Shopping News: Longchamp Presents La Voyageuse https://t.co/i6l246RUou
1164979162995708000,Fri Aug 23 19:14:11 +0000 2019,Buzzworthy Bars and Restaurants https://t.co/FAmT6dX6Z7
1164603089552380000,Thu Aug 22 18:19:48 +0000 2019,LP: a legend to Celebrate https://t.co/7P7Vg6WhXg
1164333712378667000,Thu Aug 22 00:29:23 +0000 2019,Haute Horlogerie: Watches Fit For a Queen https://t.co/UZa0F5j5NC
1163489423415292000,Mon Aug 19 16:34:29 +0000 2019,Travel 5 Private Retreats https://t.co/lXmtd0a4OH
1162768635712221200,Sat Aug 17 16:50:20 +0000 2019,Canadian Shark: Michele Romanow https://t.co/rvZ8zIRQTD
1161403553249976300,Tue Aug 13 22:25:59 +0000 2019,Chris Nicholls: Living for Fashion https://t.co/1GpBwo3Ikg
1158417993141018600,Mon Aug 05 16:42:26 +0000 2019,You Can Now Shop goop in Virtual Reality https://t.co/h08m8ODpcP
1157129188257730600,Fri Aug 02 03:21:11 +0000 2019,Meet the CAFA NOMINATED CALGARY LABEL, HOUSE OF NONIE https://t.co/Rell8XoTSc
1157129184629727200,Fri Aug 02 03:21:10 +0000 2019,DTK Talks: Everything Wellness with Chloe Wilde https://t.co/7HA9BoZUa1
1157129180712251400,Fri Aug 02 03:21:09 +0000 2019,Neophyte, the Fashion Elite’s Best Kept Secret, Launches New Collection https://t.co/NdALwnhuxy
1156631950205030400,Wed Jul 31 18:25:20 +0000 2019,Spotlight On https://t.co/MttB3qLirD
1154852452748943400,Fri Jul 26 20:34:15 +0000 2019,THE FINEST JEWELRY IN THE WORLD https://t.co/bbObviI1M3
1153704970719563800,Tue Jul 23 16:34:34 +0000 2019,Montréal Fashion &amp; Design Festival https://t.co/PikHjw1mBv
1153339125044564000,Mon Jul 22 16:20:50 +0000 2019,Beefeater Pink: The Rise of Non-Traditional Spirits https://t.co/bkQaI91du5
1151162138045681700,Tue Jul 16 16:10:15 +0000 2019,DTK Talks: Can’t get enough of Bleached https://t.co/EJYLFHoaiO
1150767458334232600,Mon Jul 15 14:01:56 +0000 2019,New Exhibition Honours Canadian Fashion Royalty Jean-Claude Poitras https://t.co/CNjj2hBScV
1150763369441431600,Mon Jul 15 13:45:42 +0000 2019,Get Flawless Skin That’s Locally Sourced  https://t.co/LShVKd0zAN
1148968133782360000,Wed Jul 10 14:52:04 +0000 2019,Prada introduces Candy Night Fragrance https://t.co/yIVBwzChh8
1148731123385679900,Tue Jul 09 23:10:16 +0000 2019,events  https://t.co/QdyrZTkkIf
1148670713013968900,Tue Jul 09 19:10:13 +0000 2019,American Crew  https://t.co/eZ0jK9czRE
1148670710195400700,Tue Jul 09 19:10:13 +0000 2019,American Crew Gabriel  https://t.co/xed3qRkxOV
1148640582014816300,Tue Jul 09 17:10:30 +0000 2019,American Crew  https://t.co/ICinf3DDid
1147556146275917800,Sat Jul 06 17:21:20 +0000 2019,GIGI HADID for Michael Kors new Wanderlust fragrance https://t.co/JDT80aYcJx
1147157272805744600,Fri Jul 05 14:56:21 +0000 2019,HUGO x LIAM PAYNE https://t.co/nlcCJJYMtF
1146849725808828400,Thu Jul 04 18:34:16 +0000 2019,Haute Couture A/W 2019-2020 https://t.co/IdjMNfT7cS
1146135363230060500,Tue Jul 02 19:15:39 +0000 2019,Startup Fashion Week https://t.co/3r8NHBgzj4
1146126246985850900,Tue Jul 02 18:39:25 +0000 2019,Bring the rain https://t.co/zxh7iv7Q8t
1144672399717261300,Fri Jun 28 18:22:21 +0000 2019,Louis Vuitton X https://t.co/brj9Ibtuqo
1143972704221089800,Wed Jun 26 20:02:01 +0000 2019,What to do this Summer https://t.co/RUd2RtCcAW
1142109770939359200,Fri Jun 21 16:39:23 +0000 2019,Inspiring Toronto Chef Opens SASH in Summerhill https://t.co/Ce3Wy48UIa
1141012760702181400,Tue Jun 18 16:00:15 +0000 2019,Tailor Talk https://t.co/FbnaGmASkK
1140723137912422400,Mon Jun 17 20:49:24 +0000 2019,A Night at the Mansion https://t.co/if0LofIP9x
1140698001188560900,Mon Jun 17 19:09:31 +0000 2019,LIVE SHOOT https://t.co/if0LofIP9x
1140650159916892200,Mon Jun 17 15:59:25 +0000 2019,All the shades https://t.co/c6sPBi4eda
1140638872663142400,Mon Jun 17 15:14:33 +0000 2019,W Montreal Pit Stop Lounge https://t.co/7EmlcDKIdQ
1139567270013931500,Fri Jun 14 16:16:23 +0000 2019,FENDI Men’s F/W 2019-2020  Ad Campaign https://t.co/MX0hwBTTge
1139205864622104600,Thu Jun 13 16:20:18 +0000 2019,Dress to Kill Magazine’s Grand Prix Fashion Night Party with Top Celebrities  https://t.co/pQh8RZst4Q
1139190805653073900,Thu Jun 13 15:20:27 +0000 2019,SILK LAUNDRY NOW OPEN IN MONTREAL https://t.co/zCGJ7OU2mn
1139181985316921300,Thu Jun 13 14:45:24 +0000 2019,FENDI ROMA in SHANGHAI https://t.co/VRn1eQoZxO
1138556549171961900,Tue Jun 11 21:20:09 +0000 2019,Lacoste Fights Extinction with New Polo Collection https://t.co/pu7oQ6YPNo
1138551699495428100,Tue Jun 11 21:00:53 +0000 2019,Canada’s Mejuri is Redefining Luxury Jewellery https://t.co/J7baTCW1Bj
1138547806938030100,Tue Jun 11 20:45:25 +0000 2019,#FentyFamily https://t.co/4h9lhjyTJF
1138547804127862800,Tue Jun 11 20:45:24 +0000 2019,Man on Top: Alain Gossuin https://t.co/xBRhTO8Kqp
1138182584993759200,Mon Jun 10 20:34:09 +0000 2019,Cast no shadow https://t.co/wWGHDVitNK
1136707112514543600,Thu Jun 06 18:51:09 +0000 2019,THE NIGHT AT THE MANSION https://t.co/tEdnamz2C4
1135934043189645300,Tue Jun 04 15:39:15 +0000 2019,Van Cleef &amp; Arples Launches new pendant https://t.co/6YWJCLbeo6
1135649741650497500,Mon Jun 03 20:49:32 +0000 2019,Born to Drive: DTK Talks with F1 Racer Antonio Giovinazzi https://t.co/K43w2b8hD3
1135564173503619100,Mon Jun 03 15:09:31 +0000 2019,Grand Prix: All the Parties You Need to Attend https://t.co/rMwMEPLz0C
1134538637511725000,Fri May 31 19:14:24 +0000 2019,CAFA 2019 https://t.co/Q6fZBAUTW1
1134181253261987800,Thu May 30 19:34:17 +0000 2019,Alessandro Michele’s Freedom of Choice https://t.co/CETXwgH795
1134125105439789000,Thu May 30 15:51:10 +0000 2019,Christian Louboutin x Grand Prix https://t.co/W5sCrrXRQj
1133800026478719000,Wed May 29 18:19:25 +0000 2019,Free from conventionality: MIKHAEL KALE https://t.co/szLJYLHgR1
1133116739745656800,Mon May 27 21:04:17 +0000 2019,Best of Baselworld for the Better Half https://t.co/f555oww6pD
1132001104550617100,Fri May 24 19:11:09 +0000 2019,Cotton + Corn = Reebok’s newest sneaker https://t.co/hYtDK36CCS
1131670954940215300,Thu May 23 21:19:15 +0000 2019,Soft Romance https://t.co/xunHkBZlBi
1131278324850937900,Wed May 22 19:19:05 +0000 2019,Returning to the Roots of Lalique https://t.co/eG4OWnfsFj
1131226498583736300,Wed May 22 15:53:09 +0000 2019,ROSA HALPERN: Redefining the leather jacket with NAMESAKE https://t.co/itA5Lpaum6
1130885783315988500,Tue May 21 17:19:16 +0000 2019,Beige is better https://t.co/digkx9q4XY
1130864197292572700,Tue May 21 15:53:29 +0000 2019,Beige is better https://t.co/digkx9HFPw
1129890019592888300,Sat May 18 23:22:27 +0000 2019,Montreal’s Spa Diva Celebrates its 20th Year https://t.co/1q1ZN5odRg
1126499335796133900,Thu May 09 14:49:05 +0000 2019,Dior Cruise Collection 2020 https://t.co/VeXF4KA5nY
1126485530210918400,Thu May 09 13:54:14 +0000 2019,Social Notes: What to do in May https://t.co/7uQiO3xV44
1126474209004326900,Thu May 09 13:09:14 +0000 2019,Chanel Cruise Collection 2020 https://t.co/ZbdG8u7LD2
1126470378879164400,Thu May 09 12:54:01 +0000 2019,DIOR CRUISE 2020 https://t.co/VeXF4KA5nY
1126223824062681100,Wed May 08 20:34:18 +0000 2019,Lenny Kravitz: New Passion https://t.co/yJw0XzdICJ
1125746681348276200,Tue May 07 12:58:18 +0000 2019,Top 3 Vintage Luxury Shops https://t.co/N59WJMyzKW
1125742879803158500,Tue May 07 12:43:12 +0000 2019,COS x DIA ART FOUNDATION https://t.co/XNo5RCoBkz
1125454770221854700,Mon May 06 17:38:21 +0000 2019,Nowhere Girl https://t.co/AKJf8z0xdc
1125393112149438500,Mon May 06 13:33:21 +0000 2019,Chanel opens first Canadian fragrance &amp; beauty boutique https://t.co/y4GSiK8Bzn
1124336868676517900,Fri May 03 15:36:13 +0000 2019,Gucci Launches new Lipstick Collections https://t.co/14RzdpeI6D
1124329542200512500,Fri May 03 15:07:06 +0000 2019,Man about town https://t.co/sXgsZJhXnz
1124070339141615600,Thu May 02 21:57:07 +0000 2019,Get Flawless Summer Skin https://t.co/JdHKDJYsVs
1124027307038003200,Thu May 02 19:06:08 +0000 2019,Pattern play https://t.co/BUKemhmqhY
1124001338600370200,Thu May 02 17:22:56 +0000 2019,Randy Smith https://t.co/BUKemhmqhY
1123996512852369400,Thu May 02 17:03:46 +0000 2019,Ruby Rose “Owns It” In Latest G-Star Campaign https://t.co/eVP2rT6L99
1123618730158768100,Wed May 01 16:02:35 +0000 2019,Bare necessities https://t.co/lJZLjm2WPa
1123570838710685700,Wed May 01 12:52:17 +0000 2019,Must-Have Travel Items https://t.co/FJDgkcbu9l
1123570835602722800,Wed May 01 12:52:16 +0000 2019,Exciting Alternatives to Drinking Rosé https://t.co/gB8y0KXaPC
1123241330644324400,Tue Apr 30 15:02:56 +0000 2019,FENDI’S LATEST COLLAB WITH GENTLE MONSTER https://t.co/ElsxCHY47K
1121768490879324200,Fri Apr 26 13:30:24 +0000 2019,COACH LAUNCHES THE “DREAM IT REAL” PODCAST https://t.co/MkDEMCE8sD
1120759384370495500,Tue Apr 23 18:40:34 +0000 2019,Marc Cain’s Confident and Inspiring Women https://t.co/iWsnm2RjxB
1119697589849468900,Sat Apr 20 20:21:23 +0000 2019,Celebrate 4-20 With VerdeVie https://t.co/jP4Pg8IIAn
1118882196780089300,Thu Apr 18 14:21:18 +0000 2019,Mademoiselle Privé Exhibition https://t.co/vU7xRnNok3
1118255672720752600,Tue Apr 16 20:51:43 +0000 2019,Cartier Women’s Initiative Awards 2019 https://t.co/bb4FMtPAba
1116803020430479400,Fri Apr 12 20:39:23 +0000 2019,Spring’s Biggest Collab: Lacoste L!ve x Opening Ceremony https://t.co/euNHIgjLas
1116027852116385800,Wed Apr 10 17:19:09 +0000 2019,YSL BEAUTY STATION https://t.co/KNxuKdUi7e
1116002713676976100,Wed Apr 10 15:39:15 +0000 2019,Say Goodbye to Basic Brunch https://t.co/MwpWhfg4SU
1115651871077797900,Tue Apr 09 16:25:08 +0000 2019,LP: a legend to Celebrate https://t.co/6OqFWfFc9L
1113725196895178800,Thu Apr 04 08:49:13 +0000 2019,Lacoste Aces RTW Luxury for Fall https://t.co/omqb7lcy8r
1113544019055980500,Wed Apr 03 20:49:17 +0000 2019,Video: Chanel Haute Couture Fashion Film https://t.co/2xyURB6jXS
1113539872202141700,Wed Apr 03 20:32:48 +0000 2019,Chef Vanessa Percher on Healthy Cooking https://t.co/cpgY6qC4Ga
1113525877168640000,Wed Apr 03 19:37:12 +0000 2019,Video: Chanel Couture Fashion Film https://t.co/2xyURB6jXS
1113521166998822900,Wed Apr 03 19:18:29 +0000 2019,Video: The Making of Life on Mars https://t.co/6wOKSrugK5
1113519214269169700,Wed Apr 03 19:10:43 +0000 2019,Chanel Couture Editorial Behind the Scenes SS19  https://t.co/qUYqUp2BrH
1113116285565657100,Tue Apr 02 16:29:37 +0000 2019,Valérie Dumaine Celebrates 15 years https://t.co/xDwdxp3m1h
1112825398168113200,Mon Apr 01 21:13:44 +0000 2019,Valérie Dumaine Celebrates 15 years https://t.co/xDwdxp3m1h
1111663018868461600,Fri Mar 29 16:14:52 +0000 2019,Life on Mars https://t.co/kIykiUnIUl
1110584126535544800,Tue Mar 26 16:47:44 +0000 2019,The Full Osheaga Lineup is Here! https://t.co/kZZ5AEwVv1
1110210479283228700,Mon Mar 25 16:02:59 +0000 2019,G Star Innovation Lab Launches Raw Research Collection https://t.co/ddA3f1fFZU
1108816360916897800,Thu Mar 21 19:43:15 +0000 2019,Restaurants and Bars on Our Hot List This Month https://t.co/TaKka1cQKS
1108759374409990100,Thu Mar 21 15:56:49 +0000 2019,Emily Weiss: From Blogger to Billionaire https://t.co/vgTsZ11uQu
1108102429567078400,Tue Mar 19 20:26:21 +0000 2019,The International Festival of Films and Art (FIFA) Kicks off! https://t.co/JLrbTnp0PJ
1108089867685253100,Tue Mar 19 19:36:26 +0000 2019,18th Annual Sainte-Justine Ball https://t.co/o3asaWcGe5
1107709828523274200,Mon Mar 18 18:26:18 +0000 2019,Virtual teleportation will be available sooner that you might think https://t.co/xHoHyc0Yga
1106625041914097700,Fri Mar 15 18:35:44 +0000 2019,VALENTINO OPENS FIRST CANADIAN BOUTIQUE https://t.co/MzmYkSsHrf
1106589452732907500,Fri Mar 15 16:14:19 +0000 2019,MASHAMA’s PFW Show was Layered with Fun…and Meaning https://t.co/okmT5wpjKz
1106256039551397900,Thu Mar 14 18:09:27 +0000 2019,Makeup Maven: Georgi Sandev https://t.co/8OtyYJvNB6
1106245989768331300,Thu Mar 14 17:29:31 +0000 2019,Each x Other Empowers Daring Women for Latest PFW Show https://t.co/CdAXjuUeTe
1105864790357037000,Wed Mar 13 16:14:46 +0000 2019,DISCOVER THE DIOR ÈTOILE SHOES https://t.co/wOuTeCaQ47
1105502100702797800,Tue Mar 12 16:13:34 +0000 2019,Stella Donnelly is taking on the world https://t.co/wKAiWnhE2n
1105498237199360000,Tue Mar 12 15:58:13 +0000 2019,5 Must-Visit Italian Villages https://t.co/uvUW36N55p
1104189343244214300,Sat Mar 09 01:17:08 +0000 2019,The Grande Dame of Veuve Clicquot https://t.co/JMDKgywPFO
1104123231798218800,Fri Mar 08 20:54:26 +0000 2019,Meet Marisa Feil https://t.co/skAGybTXhx
1104116896100745200,Fri Mar 08 20:29:16 +0000 2019,All About Lips: Formulas Worth Splurging On https://t.co/IAE2TRjKLO
1103752205377650700,Thu Mar 07 20:20:07 +0000 2019,Louis Vuitton’s FW19 is an Homage to the Pompidou https://t.co/9h1Ji0otlG
1103744425304428500,Thu Mar 07 19:49:12 +0000 2019,CHANEL Wows with Winter Wonderland https://t.co/osq9QMNlfx
1103380805370421200,Wed Mar 06 19:44:18 +0000 2019,RTW FASHION WEEK REVIEW Fall/Winter 2019 https://t.co/1Z5OTvjATk
1102594888200273900,Mon Mar 04 15:41:21 +0000 2019,DIOR  RTW A/W 19-20 https://t.co/28GL9FImGx
1102584915789529100,Mon Mar 04 15:01:43 +0000 2019,Karl Lagerfeld’s Final interviews on Chanel’s New Podcast https://t.co/SKnArGJTTt
1102461583178059800,Mon Mar 04 06:51:38 +0000 2019,Mulberry Modernizes British Punk Style at PFW https://t.co/NWxcnVT1Nl
1101764719097065500,Sat Mar 02 08:42:33 +0000 2019,Cara Delevigne Stars As Face of Dior’s New Coveted Lipstick https://t.co/T4kR4z6trC
1101203502452404200,Thu Feb 28 19:32:29 +0000 2019,Michèle Boileau-Barmash: Work Hard, Be Kind, &amp; Find Solutions https://t.co/73ALHgeryC
1101173516634914800,Thu Feb 28 17:33:19 +0000 2019,The Ultimate Cold Weather Pampering Sesh https://t.co/FmdYob6JlA
1100010599000485900,Mon Feb 25 12:32:18 +0000 2019,Meet One of The Curators Behind This Year’s Art Souterrain https://t.co/D9FHHLhFDE
1099053317064441900,Fri Feb 22 21:08:24 +0000 2019,Luxe Lounging https://t.co/oeqEwknqI1
1097873612651020300,Tue Feb 19 15:00:41 +0000 2019,The Favourite https://t.co/mPmF8dKBGP
1096152862701379600,Thu Feb 14 21:03:02 +0000 2019,Hugo Boss Reboot https://t.co/BlIiwbyBx1
1096100508601856000,Thu Feb 14 17:35:00 +0000 2019,Oversized outerwear paired with classic chunky knits has us warming up to winter weather. . Photo &amp; makeup… https://t.co/9nZaapW2fh
1095759892688851000,Wed Feb 13 19:01:31 +0000 2019,The ultimate party at the F/W19 @michaelkors show with a performance from @barrymanilowofficial . #dtkfashion… https://t.co/FZXMPdSDlg
1095753267139752000,Wed Feb 13 18:35:11 +0000 2019,Coming soon to the @mbamtl the #beyondcouture exhibition paying tribute to all the @manfredthierrymugler beauties.… https://t.co/3cc0TRfTVB
1095436094680780800,Tue Feb 12 21:34:51 +0000 2019,Winter style on point. Puffer jackets made a huge comeback bigger &amp; better, brightening up this winter season.… https://t.co/LU5MDX5Nat
1095375727258714100,Tue Feb 12 17:34:59 +0000 2019,Sneak peak of our recent shoot with dreamy gowns at @chanelofficial. Stay tuned for our Spring Issue- Coming out so… https://t.co/EV0Q4Vzqrk
1095043547517108200,Mon Feb 11 19:35:01 +0000 2019,Celebrating @hamiltonwatch’s movie year &amp; inspired by @christophernolann’s epic film Interstellar, the brand has re… https://t.co/V9NpUPrJFJ
1095035910272503800,Mon Feb 11 19:04:40 +0000 2019,Hamilton Murph Watch from Interstellar https://t.co/KxeLYbZoRg
1095028845646958600,Mon Feb 11 18:36:36 +0000 2019,That long Monday lunch break... - Link in bio to see more from the “City Life” editorial. . Photographer… https://t.co/5AuJ7HdsxK
1095018312793276400,Mon Feb 11 17:54:44 +0000 2019,Where to Eat For Valentine’s Day https://t.co/1znyMNuiGr
1094288547769663500,Sat Feb 09 17:34:55 +0000 2019,No bit of drama spared, between bold prints, bright colours, a Twiggy-esque eye and, of course, hair that’s larger… https://t.co/wKmfphHfJ2
1093958051483275300,Fri Feb 08 19:41:38 +0000 2019,Cherry Glazerr: The Perfect Mix of Sweet and Salty https://t.co/3sumhNg9gN
1093956363800199200,Fri Feb 08 19:34:56 +0000 2019,Waiting for the clock to strike 5PM... - @tomokoizumi &amp; his colourful ruffled creations at @nyfw… https://t.co/oaJ33iKSCP
1093954850587463700,Fri Feb 08 19:28:55 +0000 2019,Cherry Glazerr: The Perfect Mix of Sweet and Salty https://t.co/3sumhMYxSd
1093669462891470800,Fri Feb 08 00:34:54 +0000 2019,Closing look from @tomford AW19. . #dtkfashion #dresstokill @nyfw . #fashion #style #tomford #nyfw19 #ny #look… https://t.co/4FVf5o7UaD
1093533588014927900,Thu Feb 07 15:34:58 +0000 2019,@gretaconstantine’s stunning F/W19 collection. . #repost &amp; photographed by: @petertamlin  Stylist: @zeinaesmail Mak… https://t.co/T4QfHNOH4H
1093231597128687600,Wed Feb 06 19:34:58 +0000 2019,#wbw to @yunggoldilox in our Winter Luxury issue. Tap link in bio for more. . #dtktalks #dtkmusic #dresstokill .… https://t.co/pt5H1LsJKw
1093171291610325000,Wed Feb 06 15:35:20 +0000 2019,Image inspired by the famous musical “Gentlemen Prefer Blondes”. #GucciShowtime debuts the #gucciss19 campaign by… https://t.co/msugFIs5vl
1092944626904952800,Wed Feb 06 00:34:39 +0000 2019,Having departed from #nyfw sisters @kateandlauramulleavy of @rodarte revealed their stunning f/w 19 collection at t… https://t.co/tvC093MLB6
1092901589172584400,Tue Feb 05 21:43:38 +0000 2019,Trendy Guide to NYC Travel https://t.co/3ulblNl3SK
1092793783966666800,Tue Feb 05 14:35:15 +0000 2019,Tuesday office attire. . . #repost @styleheroine SS19 @the_attico  Photographer: @harisfarsarakis . #dtkfashion… https://t.co/fnkjiNqppN
1092461798924664800,Mon Feb 04 16:36:04 +0000 2019,👋 hey Monday... . From the “Into the Wind” editorial in our Winter Luxury Issue- tap link in bio. . Photographer:… https://t.co/A2aN717Md9
1092159536092319700,Sun Feb 03 20:34:59 +0000 2019,Lazy #sunday  From the “City Life” editorial found in our Winter Luxury issue - link in bio. . Fashion Eidtor:… https://t.co/XYbvxNdpjj
1091721616273358800,Sat Feb 02 15:34:51 +0000 2019,#saturday - Photographer @ellenvonunwerth @naomi . #dtkfashion #dresstokill #photography #naomicampbell… https://t.co/jlwqPO4Ky4
1091411268001513500,Fri Feb 01 19:01:38 +0000 2019,Walking into the weekend like... @alexandrevauthier . #dtkcouture #dtkfashion #dresstokill . #fashion #style #pfw… https://t.co/wZeIGqBzpZ
1091132717108998100,Fri Feb 01 00:34:46 +0000 2019,#tbt - #ICONS . #dtkfashion #dresstokill . #repost from #@herbritts  #gianniversace #versace #cindycrawford… https://t.co/K2ahUxmFld
1090981760689717200,Thu Jan 31 14:34:55 +0000 2019,#OOTD @liubingbing7 #backstage at @azzaro_official during Spring Summer Couture 2019 #pfw. - See the entire finale… https://t.co/Ybpwi6xp0j
1090777009305849900,Thu Jan 31 01:01:19 +0000 2019,Moving into the end of the week like @celinedion - Snapped by our Editor-in-chief @kathia_cambron at the Spring 201… https://t.co/gnWbAJuqbd
1090699481186816000,Wed Jan 30 19:53:15 +0000 2019,DTK Talks with Gucci’s The Alchemist’s Garden Creator https://t.co/jWGeyTBzaH
1090619422350495700,Wed Jan 30 14:35:07 +0000 2019,Christian Dior: Designer of dreams . Opening this Saturday at the Victoria &amp; Albert Museum @vamuseum the exhibition… https://t.co/BPRsljaZJ9
1090392895683735600,Tue Jan 29 23:34:59 +0000 2019,What dreams are made of... Model @vittoceretti with @patmcgrathreal ‘s feather lashes for #valentinocouture by… https://t.co/Nmsmz7eoYt
1090332463124148200,Tue Jan 29 19:34:51 +0000 2019,And it’s only Tuesday... . Catch our entire #couture recap online now including the viral collection “Fashion State… https://t.co/vmfYyxzUBv
1090001884994289700,Mon Jan 28 21:41:15 +0000 2019,DTK Fashion Round-up: Spring Couture 2019 https://t.co/LtfVlbdNZU
1090001884994289700,Mon Jan 28 21:41:15 +0000 2019,DTK Fashion Round-up: Spring Couture 2019 https://t.co/LtfVlbdNZU
1089743929904386000,Mon Jan 28 04:36:14 +0000 2019,Valentine’s Day with VerdeVie https://t.co/She2SbxIyV
1089569113196908500,Sun Jan 27 17:01:34 +0000 2019,DTK celebrating Canadian designers &amp; DTK style. Featuring @lucianmatis @gretaconstantine &amp; @denis_gagnon  in the fi… https://t.co/jfKcTgWSbS
1089557863306088400,Sun Jan 27 16:16:52 +0000 2019,Marketing on the Red Carpet: the most lucrative collaborations https://t.co/yBs1uVBPV0
1089553940033818600,Sun Jan 27 16:01:16 +0000 2019,DTK celebrating Canadian designers &amp; DTK style. Featuring @lucianmatis @gretaconstantine &amp; @denis_gagnon  in the fi… https://t.co/G5cX9Wff5z
1089532552698830800,Sun Jan 27 14:36:17 +0000 2019,DTK Talks with Successful French Auteur Anne Berest https://t.co/ESYK0fChAf
1088891888059469800,Fri Jan 25 20:10:31 +0000 2019,DTK Talks with the inspiring Stacy Martin https://t.co/Yn96xec2t9
1088859409252524000,Fri Jan 25 18:01:27 +0000 2019,Chanel Spring 2019 Couture transported us into an 18th century Italian villa featuring the house’s signature handwo… https://t.co/kalRK68tJn
1088837787430850600,Fri Jan 25 16:35:32 +0000 2019,Canadian Designers https://t.co/7EdccBKeUx
1088578224467128300,Thu Jan 24 23:24:08 +0000 2019,Van Cleef &amp; Arpels newest additions will blow you away https://t.co/Qu9MMMZ9th
