id,created_at,text
453190002244341760,Mon Apr 07 15:18:11 +0000 2014,There's never a better time to order your food than right now! Online http://t.co/gg8D3yP8as or call 044526664. Make it a great evening :)
451295378185265150,Wed Apr 02 09:49:37 +0000 2014,Hey, are you thinking about lunch right now? Simply order online http://t.co/GcR6JOjlpl or call 044526664. At your service, best in town.
445583078820286460,Mon Mar 17 15:30:59 +0000 2014,What a fabulous evening to enjoy a meal at your favourite restaurant. Online http://t.co/GcR6JOjlpl or call 044526664 or come dine in.
444858172553965600,Sat Mar 15 15:30:28 +0000 2014,Hi all, why not join the guests who are closing the weekend with Soul food from Flames. Order http://t.co/GcR6JOjlpl or call 044526664.
442613055260614660,Sun Mar 09 10:49:10 +0000 2014,Congratulations Gerry Brady the winner of the Facebook like and share for the month of February. You win a Flames... http://t.co/4uwd00YMoC
442612529378762750,Sun Mar 09 10:47:05 +0000 2014,We are very pleased to announce Miss Lara Knight as the February winner of our online ordering Promo! Lara wins a... http://t.co/CsGiAOU218
441601686562668540,Thu Mar 06 15:50:21 +0000 2014,How amazing is the weather this evening? Perfect for enjoying our beautiful outdoor seating. Come over and treat yourself.
441595106504609800,Thu Mar 06 15:24:12 +0000 2014,Time soon to randomly pick our winners for the month of February to win the AED 100 Dinner vouchers at... http://t.co/zKGdHyxjgp
441593159844249600,Thu Mar 06 15:16:28 +0000 2014,Why not treat yourself tonight after ending the week. Fabulous food cooked for you! Order online http://t.co/GcR6JOjlpl or call 044526664.
440248715517763600,Sun Mar 02 22:14:07 +0000 2014,This is why we're here to serve you. http://t.co/Lb81nvoz7o
438608298380509200,Wed Feb 26 09:35:41 +0000 2014,What a great time to take a break and have some delicious food. Order online http://t.co/GcR6JOjlpl or call 044526664. Enjoy this great day.
438435593018560500,Tue Feb 25 22:09:25 +0000 2014,Congratulations Sandeep Kumar! You win the last like, comment and share competition. Contact us with your details... http://t.co/7uKYYbwMGR
436516192577007600,Thu Feb 20 15:02:25 +0000 2014,Who likes our logo signage? One lucky winner will be randomly picked from those who like, comment and share to win... http://t.co/3OoCpOuGSW
433245862349652000,Tue Feb 11 14:27:17 +0000 2014,We are very pleased to announce Mr. Kai Bruns as the January winner of our online ordering Promo! Tim wins a... http://t.co/Q2RJrCbY25
433244873194344450,Tue Feb 11 14:23:21 +0000 2014,Congratulations Emma Ewing the winner of the Facebook like and share for the month of January. You win a Flames... http://t.co/3mozsKNNqZ
431446686825578500,Thu Feb 06 15:18:00 +0000 2014,Is it your turn to order next? http://t.co/dY7odPAeNE
431437818313711600,Thu Feb 06 14:42:46 +0000 2014,It's that time again to pick our lucky winners for the month of January. Watch this space. Good luck to all. Have a fantastic evening.
431434978589548540,Thu Feb 06 14:31:29 +0000 2014,End of the week calls for great food and fun. Order your tasty meal online http://t.co/GcR6JO1cbd or call 044526664. Have a great weekend.
430712938337665000,Tue Feb 04 14:42:21 +0000 2014,Hoping the work day is over for you all. Look fwd to a lovely meal from Flames. Order online http://t.co/LgaYS1FhXG its simple or 044526664.
429708713809559550,Sat Feb 01 20:11:55 +0000 2014,@travelndfoodww so sorry too far out of reach for us but hopefully in thw future
429647262424113150,Sat Feb 01 16:07:44 +0000 2014,Perfect end to the week is with a hearty meal from Flames. Order online http://t.co/GcR6JO1cbd or call 044526664. Have a good one all :)
428928860407607300,Thu Jan 30 16:33:04 +0000 2014,There is a buzz and we are busy both Dine In and delivery. Come join the buzz tonight and enjoy with us. Have a great evening all.
428212198687506400,Tue Jan 28 17:05:18 +0000 2014,Nows a perfect time to order from your favourite restaurant, online http://t.co/GcR6JO1cbd or call 044526664.  Have a perfect night.
427840199960178700,Mon Jan 27 16:27:07 +0000 2014,Go ahead and get your order in. Best food in town guaranteed. Online http://t.co/GcR6JO1cbd or call 044526664. We are at your service.
427724187076419600,Mon Jan 27 08:46:07 +0000 2014,A fabulous day to enjoy great lunch here at Flames. busy then we will deliver to you. Online order http://t.co/LgaYS1FhXG or call 044526664
427114124720345100,Sat Jan 25 16:21:57 +0000 2014,Good evening,  end the weekend with a great meal from Flames. Online http://t.co/GcR6JO1cbd or call 044526664.
427006202770227200,Sat Jan 25 09:13:06 +0000 2014,The weather is glorious right now and perfect to come enjoy delicious food, whilst enjoying our setting outdoors... http://t.co/QYNbOVI1YK
426129224550723600,Wed Jan 22 23:08:18 +0000 2014,@CatererME thank you. Hope business is great for you guys? Best wishes always.
426033368287825900,Wed Jan 22 16:47:24 +0000 2014,A very sweet compliment received from a guest of ours who is 6 months pregnant.  She says she craves for Flames food. How cool is that?
426025360262565900,Wed Jan 22 16:15:35 +0000 2014,We are so happy to see a craze for our healthy grills developing in the fitness world. So many fitness fanatics... http://t.co/XqMpNH5GEk
425313167196319740,Mon Jan 20 17:05:35 +0000 2014,@marc_alton apology for such a late reply but thank you. Wish you and your loved ones the very best for 2014. Flames team
425312622003490800,Mon Jan 20 17:03:25 +0000 2014,Perfect way to relax this evening is with fantastic food from Flames. Order yours now online http://t.co/GcR6JO1cbd or call 044526664.
423860503463886850,Thu Jan 16 16:53:13 +0000 2014,Come enjoy our outdoor seating and have a romantic dinner with your loved one. Our music will create the perfect ambiance.
423859711554105340,Thu Jan 16 16:50:04 +0000 2014,Due to popular demand. Flames will continue to randomly select winners for the next few months so like our FB page or register on flames.ae
423858924417056800,Thu Jan 16 16:46:57 +0000 2014,Perfect your evening with a great taste. Order now online http://t.co/GcR6JO1cbd or call 044526664.
420541859757162500,Tue Jan 07 13:06:07 +0000 2014,Congratulations Aamna Shariff  the winner of the Facebook like and share for the month of December. You win a... http://t.co/DXHWKucBaa
420538226730741760,Tue Jan 07 12:51:41 +0000 2014,We are very pleased to announce Mr. Tim Ricketts as the December winner of our online ordering Promo! Tim wins a... http://t.co/DvY3ML4DjW
420531812155129860,Tue Jan 07 12:26:11 +0000 2014,A fantastic start to 2014. It's soon time to announce our random winners for the month of December for the 3... http://t.co/z0VfXR81e2
418426407815893000,Wed Jan 01 17:00:04 +0000 2014,Wish you all a very Happy New Year and all the best for 2014. Flames team
415813822692474900,Wed Dec 25 11:58:35 +0000 2013,@marc_alton Thank you Marc. Wishing you and your loved ones a very Merry Christmas.
415781426756214800,Wed Dec 25 09:49:51 +0000 2013,Flames wishes all a very Merry Christmas.  Very exciting time here at Flames as we are sizzling! Yes folks come... http://t.co/Qb4nAOhD8j
412489296323428350,Mon Dec 16 07:48:06 +0000 2013,Flames runs an online ordering loyalty program for all guests who order food over AED 50 and each 10 orders you... http://t.co/vsOwnjNyf7
412487845924720640,Mon Dec 16 07:42:20 +0000 2013,Congratulations Lelibeth R. Flores, the winner of the Facebook like and share for the month of November. You win... http://t.co/GxxBxiNbRN
412485359268675600,Mon Dec 16 07:32:27 +0000 2013,We are very pleased to announce Mr. Karl Gheewala as the November winner of our online ordering Promo! Karl wins... http://t.co/sgNWQmxIhE
412228908952461300,Sun Dec 15 14:33:25 +0000 2013,Hope you're all well folks. It's soon time to announce our random winners for the month of November for the 3... http://t.co/8kb6qeQqlD
410307890809827300,Tue Dec 10 07:19:58 +0000 2013,Flames would like to announce the much awaited arrival of our new expert Chef Atif. He is from Lucknow India and... http://t.co/veA9Jpnnhg
407525177098911740,Mon Dec 02 15:02:28 +0000 2013,Make it a Flames night folks. Celebrate National Day with a burst of taste. Online http://t.co/GcR6JO1cbd or call 044526664 or Zomato
407110250832351200,Sun Dec 01 11:33:42 +0000 2013,Kindly note that Flames is closed for the day today. Business resumes as normal tomorrow. Have a great day all.
406790975638753300,Sat Nov 30 14:25:01 +0000 2013,Nows a perfect time to get your orders in. Online order on http://t.co/LgaYS1FhXG or via Zomato or call 044526664. Have a pleasant evening!
406722753157275650,Sat Nov 30 09:53:55 +0000 2013,@andygib thanks Andy
406722551390699500,Sat Nov 30 09:53:07 +0000 2013,RT @andygib: @FlamesGrillJLT I tried. ..it works!
406719165966598140,Sat Nov 30 09:39:40 +0000 2013,Greetings all from Flames Grills and Curry JLT  Check out our menu and new online ordering, give us a try:... http://t.co/pjHGZksugW
406714955933954050,Sat Nov 30 09:22:56 +0000 2013,Combination Rugby Sevens + Flames food  = Great day For those watching enjoy! What a magnificent day.
406380035327553540,Fri Nov 29 11:12:05 +0000 2013,@FlamesGrillJLT Also must retweet to enter the competition.  Good luck!
406379374812725250,Fri Nov 29 11:09:27 +0000 2013,Friday competition. Guess which Curry is our best seller so far this year? One random winner get a Flames Dinner Voucher. Only 1 entry pls.
406357339626020860,Fri Nov 29 09:41:54 +0000 2013,Finally one more way to win a dinner voucher worth AED 100. Review our restaurant on either Zomato, Yadig or Time... http://t.co/PTi7LWtFJm
406082371037823000,Thu Nov 28 15:29:16 +0000 2013,Congratulations Dubai for winning the Expo2020. Perfect reason to celebrate with food from Flames and start a fantastic weekend. Go for it.
405617650887565300,Wed Nov 27 08:42:38 +0000 2013,Thinking of what to have for lunch? Make it a Flames lunch and improve your day.
405390029079318500,Tue Nov 26 17:38:09 +0000 2013,The weather is just so perfect right now. What better than to enjoy the best food in Dubai in our romantic... http://t.co/VkWwkLFpi1
405323473867653100,Tue Nov 26 13:13:41 +0000 2013,Last few days this month for your chance to win one of the 3 promotions posted earlier.  What are you waiting for? Good luck!!
404909632742645760,Mon Nov 25 09:49:13 +0000 2013,It's a beautiful afternoon. Still time for a late lunch. We welcome you here at Flames.
404536705061253100,Sun Nov 24 09:07:21 +0000 2013,The weather is brilliant. Come and have lunch in our outdoor dining area. Bring your friends and have a great time. Tasty food guaranteed.
404529987237453800,Sun Nov 24 08:40:39 +0000 2013,Good afternoon, hope the working week has started well for you? Cheer up the day and order now via Zomato or online http://t.co/LgaYS1FhXG.
404280974118092800,Sat Nov 23 16:11:10 +0000 2013,@GeordieArmani @LisaJustice74 @MikeJustice74 Hi Debbie, we were just saying that we have not seen you for so long. Welcome anytime.
404279477955751940,Sat Nov 23 16:05:13 +0000 2013,@LisaJustice74 @MikeJustice74 It's a pleasure to have you and Mike here. Enjoy your meal :)
404273739996491800,Sat Nov 23 15:42:25 +0000 2013,What a beautiful evening with perfect weather. Come enjoy our out door seating over looking the lake and enjoy wonderful food.
403432925171314700,Thu Nov 21 08:01:19 +0000 2013,Finally one more way to win a dinner voucher worth AED 100. Review our restaurant on either Zomato, Yadig or Time... http://t.co/cm63MQ2b2C
403430513064804350,Thu Nov 21 07:51:44 +0000 2013,Another chance to win a dinner voucher worth AED 100 this November is to simply register yourself on our online... http://t.co/JZDid67aff
403429967805304800,Thu Nov 21 07:49:34 +0000 2013,Be a lucky winner this November! To win a dinner voucher worth AED 100 all you have to do is like and share our... http://t.co/lAKeJr5lLB
403420154408620000,Thu Nov 21 07:10:34 +0000 2013,Have you seen the weather today?? It's brilliant! Just perfect for sitting outside at Flames and enjoying some... http://t.co/y7Fmh0MMn2
403226936920772600,Wed Nov 20 18:22:48 +0000 2013,A very good evening fron all od us here at Flames. Remember to have a chance to win this months Dinner Voucher... http://t.co/pCjwvTnGNp
402850252132069400,Tue Nov 19 17:25:59 +0000 2013,Flames welcomes you to order online on http://t.co/GcR6JO1cbd or call via Zomato or direct 044526664. Have a fantastic evening
400299806910083100,Tue Nov 12 16:31:25 +0000 2013,How cool is this! We get a mention on OK Magazine for an interview of Rebecca Roffe of ARTE Madrid who loves our... http://t.co/TFSQ1RFCMz
400003405986680800,Mon Nov 11 20:53:38 +0000 2013,@jjethwa1 hey Jim, how are you?
399932621536649200,Mon Nov 11 16:12:22 +0000 2013,We are very pleased to announce Mr. Shaun Birch as the October winner of our online ordering Promo! Shaun wins a... http://t.co/V26KQ0eUBn
399932118291476500,Mon Nov 11 16:10:22 +0000 2013,Congratulations Mrs. Lisa Justice, the winner of the Facebook like and share for the month of October. You win a... http://t.co/1MKYEZgM1e
399931339748962300,Mon Nov 11 16:07:16 +0000 2013,We are very pleased to announce Mrs. Lisa Justice as the October winner of our online ordering Promo! Lisa wins a... http://t.co/DyHhymi4MU
399929865765269500,Mon Nov 11 16:01:24 +0000 2013,Hey folks its tine to announce last months winners for registering and ordering online as well as the FB like and... http://t.co/9XF6kdJvua
399527208214986750,Sun Nov 10 13:21:23 +0000 2013,Feeling the start of the working week blues? Let the awesome flavours from Flames soothe them away. Online http://t.co/GcR6JO1cbd or call us
398495200311406600,Thu Nov 07 17:00:34 +0000 2013,Weekend cannot start better then with the taste of food from Flames. Kick start the evening and order on 044526664 or http://t.co/GcR6JO1cbd
396618608060944400,Sat Nov 02 12:43:39 +0000 2013,Flames wishes you all a very happy and prosperous Diwali!!!  Why not make the Festival of lights even more... http://t.co/1kb6vo26QX
395954728862879740,Thu Oct 31 16:45:38 +0000 2013,What a buzz here at Flames. Deliveries super busy and out door seating full :) Join in on the buzz it's a perfect night for it.
395943704302600200,Thu Oct 31 16:01:50 +0000 2013,Another fantastic evening, the kitchen is producing what has to be the best food in Dubai. Order yours http://t.co/GcR6JO1cbd or 044526664
395840401044942850,Thu Oct 31 09:11:20 +0000 2013,Good afternoon Flamers! Have you ordered yet? Order online now! http://t.co/7ENWw9atrd http://t.co/u1zVWjau25
395203508540293100,Tue Oct 29 15:00:33 +0000 2013,What a great evening so make it perfect by ordering online http://t.co/LgaYS1FhXG or call 044526664. Better still let us serve U here :)
394881029611077600,Mon Oct 28 17:39:08 +0000 2013,Good evening, we are open for delivery. Order online http://t.co/GcR6JO1cbd or via Zomato or call 044526664. The best food for the Soul :)
394146125026172900,Sat Oct 26 16:58:53 +0000 2013,Do try it and give us your feedback.
394146011935174660,Sat Oct 26 16:58:26 +0000 2013,We are feeling very proud.  Many guests have told us that it is so easy to order online giving us highest compliment as the best website :)
394099345433190400,Sat Oct 26 13:53:00 +0000 2013,What better way to get ready for work tomorrow. A fabulous healthy meal at Flames. Online http://t.co/GcR6JO1cbd or call 044526664
393412550161092600,Thu Oct 24 16:23:55 +0000 2013,Come join the buzz here at Flames tonight.  Weather is superb so enjoy a romantic evening dining outdoors overlooking the lake.
393369340025647100,Thu Oct 24 13:32:13 +0000 2013,Finally the weekend is here for you. Treat yourself to some mouthwatering flavours tonight. Online ordering is easy flames.ae or just call.
392661550118760450,Tue Oct 22 14:39:43 +0000 2013,Get ordering folks online on flames.ae its so easy or call 044526664 or via Zomato. Better still come enjoy a... http://t.co/Bo0WsR1Oty
390392561380360200,Wed Oct 16 08:23:34 +0000 2013,Bernard (Ben) will ensure that our Guests get the best service in town and will supervise the service team to... http://t.co/0bAIrgnzXj
390391261745917950,Wed Oct 16 08:18:24 +0000 2013,Flames welcomes a new addition to the team. Today Lorna our new Waitress has joined and both Lorna and Joby are... http://t.co/nmxM2X474Q
390104629163212800,Tue Oct 15 13:19:26 +0000 2013,Eid mubarak to everyone. We are open to serve you. Order online on http://t.co/GcR6JO1cbd or call for delivery 044526664.
389689460675194900,Mon Oct 14 09:49:42 +0000 2013,Flames wishes everyone a very Happy Eid Adha Mubarak.
389410013489270800,Sun Oct 13 15:19:16 +0000 2013,Good evening.  The weather is perfect for a lovely meal on our outdoor seating or simply order on 044526664 or online http://t.co/GcR6JO1cbd
387952768637730800,Wed Oct 09 14:48:42 +0000 2013,What a beautiful cool evening. Come enjoy the best food in town and sit on our available outdoor seating.
387866779068162050,Wed Oct 09 09:07:01 +0000 2013,Congratulations Alex Walker, the winner of the Facebook like and share for the month. You win a Flames voucher... http://t.co/nQOp14Zuoa
387861078409248800,Wed Oct 09 08:44:21 +0000 2013,We are very pleased to announce Ms. Tracy Ord as the first winner of our online ordering Promo! Tracy wins a... http://t.co/ssYCSSW0Qv
387859007270305800,Wed Oct 09 08:36:08 +0000 2013,Please vote for us thanks. Under the Restaurant category British. Entries close 10th October so your vote is so... http://t.co/OCyg3HcDkd
387523854324604900,Tue Oct 08 10:24:21 +0000 2013,Late lunch, we are open all day so simply order online flames.ae or call 044526664.  We're here to serve you.
387472295305834500,Tue Oct 08 06:59:28 +0000 2013,We are included in a recent review for National Curry Week on... http://t.co/1nsopIFDvb
387471867440664600,Tue Oct 08 06:57:46 +0000 2013,We are included in a recent review for National Curry Week on http://t.co/7zP1RPaycx Please retweet and make the Curry proud :)
387470781824765950,Tue Oct 08 06:53:27 +0000 2013,RT @GeordieArmani: @kebab_shop @FlamesGrillJLT @curryboxme @HungryTigerDXB @LeMeridienDXB http://t.co/0h7jRuSQl8  you all get a mention :)
387468775852740600,Tue Oct 08 06:45:29 +0000 2013,@GeordieArmani @kebab_shop @curryboxme @HungryTigerDXB @LeMeridienDXB thank you Debbie. Happy National Curry Week.
386544108912644100,Sat Oct 05 17:31:11 +0000 2013,Whoa a great energetic evening for deliveries.  Order yours online on http://t.co/GcR6JO1cbd or call 044526664. .
386451865350582300,Sat Oct 05 11:24:39 +0000 2013,Hope the day has been great for everyone. Put the icing to the day by ordering online flames.ae or call 044526664, let us make it special.
385337566729211900,Wed Oct 02 09:36:49 +0000 2013,We're having fun, full restaurant for lunch and atmosphere is great as usual. If you can't make it here just call 044526664 for delivery
384963847842701300,Tue Oct 01 08:51:48 +0000 2013,@desertkiwi of course babe any time
384963381402148860,Tue Oct 01 08:49:57 +0000 2013,What have you planned for lunch? Order from Flames online http://t.co/GcR6JO1cbd or call 044526664. Enjoy your day
384703715912863740,Mon Sep 30 15:38:07 +0000 2013,@BinduRai for sure babe. Take care
384701983606595600,Mon Sep 30 15:31:14 +0000 2013,@BinduRai ahhh so sorry. Also sorry ur unwell :( Wish you a fast recovery. Cya soon.
384699886827880450,Mon Sep 30 15:22:55 +0000 2013,If you have not tried our improved taste of mouth watering Indian food concept with influences from Kenya and UK you're surely missing out.
384692279442956300,Mon Sep 30 14:52:41 +0000 2013,Flames is pleased to introduce our 2 new waitresses Joby and Lorna. This is to ensure we move to the next level... http://t.co/oGMLSRXjZF
384684887040487400,Mon Sep 30 14:23:18 +0000 2013,Enjoy this beautiful evening with amazing food. Order online on http://t.co/GcR6JO1cbd or call 044526664. Or simply visit and dine in.
384359123326091260,Sun Sep 29 16:48:50 +0000 2013,I posted a new photo to Facebook http://t.co/Q3QF6lEFbk
383632669348618240,Fri Sep 27 16:42:10 +0000 2013,Join the buzz at Flames tonight. Great weather for dining out in our romantic setting, order online flames.ae or call 044526664 delivery.
383258784673447940,Thu Sep 26 15:56:29 +0000 2013,So many enjoying our food tonight. Why not join them and order online on http://t.co/GcR6JO1cbd or call us now on 044526664
382854350953275400,Wed Sep 25 13:09:25 +0000 2013,Spread the word folks and get a chance to win a Flames voucher worth AED 100. Register online and be the lucky... http://t.co/Y3LNKBwai9
382853520086409200,Wed Sep 25 13:06:06 +0000 2013,Remove the hassle, time and stress to telephone for your delivery. Simply register and order online on http://t.co/GcR6JO1cbd
382817965864808450,Wed Sep 25 10:44:50 +0000 2013,Thinking of a late lunch? We are open all day. Order online or call 044526664
382772232545529860,Wed Sep 25 07:43:06 +0000 2013,Reduce the time and stress from ordering by phone. Register and order online on our new website http://t.co/GcR6JO1cbd
382759192995835900,Wed Sep 25 06:51:17 +0000 2013,Please share and spread the word. http://t.co/uxfOSEFENM
382133334769676300,Mon Sep 23 13:24:21 +0000 2013,Register on http://t.co/LgaYS1FhXG for a chance to win a Flames meal voucher worth AED 100. Every month we will pick a random winner!
382044722384371700,Mon Sep 23 07:32:14 +0000 2013,Please register to take advantage of our online ordering and 1 lucky person will be picked randomly each month... http://t.co/bqAiDw9WLH
381810115176701950,Sun Sep 22 15:59:59 +0000 2013,We are so proud to announce our new website is officially live as of today. Please register to take advantage of... http://t.co/JmE0h4D0P1
381809295534616600,Sun Sep 22 15:56:44 +0000 2013,Folks its that time for you to unwind enjoy the evening with the best food in Dubai cooked perfectly the way you love it. Call now 044526664
381091616716771300,Fri Sep 20 16:24:56 +0000 2013,Twitter / FlamesGrillJLT: F = Friday L = Lively A = ... http://t.co/6qWx0hg1Os
381046092605169660,Fri Sep 20 13:24:02 +0000 2013,F = Friday L = Lively A = Ambience M = Meals E = Exciting S = Service Call us for your delivery 044526664
380953847927406600,Fri Sep 20 07:17:29 +0000 2013,Please vote for us thanks http://t.co/pit0QNOzRj
380734088573091840,Thu Sep 19 16:44:15 +0000 2013,Hi Everyone,  Great news! Very happy and excited to be nominated for the What's On Awards 2013! (Best restaurant... http://t.co/0EqFWPT0D4
380006042496925700,Tue Sep 17 16:31:15 +0000 2013,Things are heating up for another wonderful evening :) Join in and place your order for the perfect meal. Call us now on 044526664
379275696641564700,Sun Sep 15 16:09:07 +0000 2013,F = Fires   L = Lively   A = And   M = Mouthwatering   E = Experiences   S = Served Call 044526664
379132600461193200,Sun Sep 15 06:40:30 +0000 2013,Come try our new dishes like RaRa Masala or Hara Masala and for bites our Chicken Tikka Pakora or Peshawari Naan. Now I feel hungry :)
379131800011821060,Sun Sep 15 06:37:19 +0000 2013,Yes we have found another way to improve. All our Chicken dishes are now made using soft tenderised chicken breast and wow guests be happier
378965943344717800,Sat Sep 14 19:38:16 +0000 2013,@KirenParmar Thanks and have a great night.
378965550166048800,Sat Sep 14 19:36:42 +0000 2013,@KirenParmar Thanks but what disappointed you? Lol were the kids left hungry :(
378965252081078300,Sat Sep 14 19:35:31 +0000 2013,@KirenParmar ????? Did not receive anything
378964714723606500,Sat Sep 14 19:33:23 +0000 2013,@KirenParmar BTW you never did tell about your disappointment???
378964391221538800,Sat Sep 14 19:32:06 +0000 2013,@KirenParmar @kebabfans @kebab_shop Hi Kiren thank you very much for the mention.
378928183807991800,Sat Sep 14 17:08:13 +0000 2013,Who's still wondering what to eat tonight? Make the right choice and call us on 044526664
378914750312501250,Sat Sep 14 16:14:51 +0000 2013,Our new serving standards are a hit with our guests who have tried. When are you going to try? Further great news... http://t.co/gUP6kMe9js
378483826986479600,Fri Sep 13 11:42:30 +0000 2013,F = Friday  L = Lovely  A = Amazing  M = Meals  E = Excellent  S = Service Call 044526664
377484689130668000,Tue Sep 10 17:32:17 +0000 2013,From tomorrow here at Flames we're doing things different. Come check us out! Both Dine In and Delivery.  Were excited specially for you :)
377466832212336640,Tue Sep 10 16:21:20 +0000 2013,Don't let the weather make you feel down. Uplift the evening with food for the soul. Call 044526664 and we will deliver to you pronto.
377421351017250800,Tue Sep 10 13:20:36 +0000 2013,New improved menu with fantastic new dishes plus change of the way we serve launching real soon. If thats not... http://t.co/sAhqiBYO6w
376019300584529900,Fri Sep 06 16:29:22 +0000 2013,What a great evening. We have Alex and 15 friends enjoying food and a Pictionery battle here at Flames. Great fun!
375326700856291300,Wed Sep 04 18:37:13 +0000 2013,Your chance to win a dinner voucher worth AED 100. Who can guess how many orders we have taken since we opened? Entries to 10th Sept.
373436824553005060,Fri Aug 30 13:27:31 +0000 2013,@SimplySettled very welcome. We're doing fantastic and hope same for you
372347768150310900,Tue Aug 27 13:20:00 +0000 2013,Our new website is very nearly done and looks amazing. Honestly its the best restaurant website in my books and... http://t.co/slIdLMy2le
372102497810145300,Mon Aug 26 21:05:23 +0000 2013,@KirenParmar hello, did not hear back from you. Would appreciate the feedback please.  Thanks
371564400412352500,Sun Aug 25 09:27:11 +0000 2013,@myrapen thank you, we are happy to hear it. Have a great day :)
371564194145239040,Sun Aug 25 09:26:21 +0000 2013,RT @myrapen: Enjoying a yummy veg seekh wrap @FlamesGrillJLT
