id,created_at,text
992344331641065500,Fri May 04 10:05:00 +0000 2018,https://t.co/XNbFWpcZKU
992337266046468100,Fri May 04 09:36:55 +0000 2018,https://t.co/aw8aS6vGkd
992317261540085800,Fri May 04 08:17:26 +0000 2018,https://t.co/X9eNB4XM80
992289965101887500,Fri May 04 06:28:58 +0000 2018,https://t.co/N1eYswV2ix
992264944820219900,Fri May 04 04:49:32 +0000 2018,https://t.co/1ngFlK6bng
992206112492437500,Fri May 04 00:55:46 +0000 2018,https://t.co/Vmn5oGqKGR
992206044691648500,Fri May 04 00:55:30 +0000 2018,https://t.co/L9dMGA9Jak
992158971866693600,Thu May 03 21:48:26 +0000 2018,https://t.co/3Yi8WVnnwU
992158692639322100,Thu May 03 21:47:20 +0000 2018,https://t.co/MvZ7NUvoCP
916994112380948500,Sun Oct 08 11:50:07 +0000 2017,https://t.co/jJdoRLd0FD
815364336399056900,Sun Jan 01 01:09:41 +0000 2017,The entire team here at Flames wish you all a very happy new year and best wishes for 2017. Hope you all had a... https://t.co/trs3rfosdb
806848184161079300,Thu Dec 08 13:09:32 +0000 2016,This is what we work so hard for and it gives us so much motivation and pleasure. Do post a review if not yet... https://t.co/1eNtevlDaG
786320125590958100,Wed Oct 12 21:38:21 +0000 2016,https://t.co/HtAsqlxVJl
786317966711332900,Wed Oct 12 21:29:47 +0000 2016,https://t.co/sOSF3GHrCR
763422395399110700,Wed Aug 10 17:10:57 +0000 2016,RT @FlamesGrillJLT: Fabulous news to improve our delivery services, today we started our expanded delivery capacity with... https://t.co/5H…
763421752995172400,Wed Aug 10 17:08:24 +0000 2016,Fabulous news to improve our delivery services, today we started our expanded delivery capacity with... https://t.co/5HPAznIfMz
763034956801175600,Tue Aug 09 15:31:24 +0000 2016,@Dubaihairdoctor minimum for that area is AED 100 Sir
750642648009023500,Wed Jul 06 10:48:48 +0000 2016,The Flames team and management wish to congratulate all our valued guests and friends who completed a successful... https://t.co/YVe22VE2SL
749998746000392200,Mon Jul 04 16:10:10 +0000 2016,We are pleased to inform that management have approved our summer promotion. Due to popular demand from today we... https://t.co/dyFuyoxigl
749950379488665600,Mon Jul 04 12:57:58 +0000 2016,The team and management would like to wish a happy Independence Day to all our American friends. #independenceday... https://t.co/4FuNc8sI67
740922668514455600,Thu Jun 09 15:05:04 +0000 2016,Flames Grill on Twitter https://t.co/4Ds61Gfpva
740920159980949500,Thu Jun 09 14:55:06 +0000 2016,Enjoy this Ramadan with a 20% discount off your total bill. Check out some new dishes launched this month. #ramadan  #curry #grills #salad
739784969141268500,Mon Jun 06 11:44:15 +0000 2016,The Flames team and management would like to wish everyone Ramadan Kareem and may you all be blessed throughout... https://t.co/kVxaNphJp2
739783815082704900,Mon Jun 06 11:39:40 +0000 2016,The Flames team and management would like to wish everyone Ramadan Kareem and may you all be blessed throughout... https://t.co/mHmQrBbaKq
738041948213219300,Wed Jun 01 16:18:07 +0000 2016,As the summer rolls in and temperature set to rise, our brilliant chefs have added some mouthwatering healthy... https://t.co/ilIjuGQgNp
738025455056474100,Wed Jun 01 15:12:34 +0000 2016,It's our pleasure to offer all our valuable guests a 20% discount on total bill throughout the month of Ramadan,... https://t.co/XFjzYxtuFt
738023193701679100,Wed Jun 01 15:03:35 +0000 2016,Pleased to confirm that we are on the list and operating or normal business hours throughout Ramadan for Dine In,... https://t.co/50Itr0i3H5
734420194798493700,Sun May 22 16:26:33 +0000 2016,Craving? Order online on flames.ae, Zomato, 24h, Talabat and FiodinClick and get 20% discount orders above AED 100 https://t.co/RrtN8AJVt2
734419887251161100,Sun May 22 16:25:20 +0000 2016,:) https://t.co/8rwSrf46qw
734416969500373000,Sun May 22 16:13:44 +0000 2016,Great reason to order! Enjoy 20% discount on all orders over AED 100 when you order online either on... https://t.co/ud0axoeDS4
729418857069330400,Sun May 08 21:13:02 +0000 2016,RT @LFC: Night, Reds. You were superb once again today! https://t.co/XMyscbYQ0H
713013231724396500,Thu Mar 24 14:42:56 +0000 2016,https://t.co/qKKZvNsYzC
713013207238049800,Thu Mar 24 14:42:50 +0000 2016,https://t.co/7sOdDwL5hT
713013002476339200,Thu Mar 24 14:42:01 +0000 2016,Exciting news, our new Tandoor Chef is bringing some new delicious grills for your satisfaction which will be... https://t.co/jZ9YlrAgm9
711162805370691600,Sat Mar 19 12:10:00 +0000 2016,Fire up your BBQ in this perfect weather. We will remove the stress and deliver the best marinated grills. Simply... https://t.co/xQFn6Co5uL
710818682520412200,Fri Mar 18 13:22:34 +0000 2016,F = Friday  L = Lovely  A = Amazing  M = Meals  E = Excellent  S = Service https://t.co/GcR6JOiNzN  Order Online now https://t.co/Hl2CCKgzDn
710397466974113800,Thu Mar 17 09:28:49 +0000 2016,https://t.co/PCh6SZLMwu
709299440658600000,Mon Mar 14 08:45:39 +0000 2016,Enjoy a 20% discount on total bill at Lunch time here at Flames. Sunday to Thursday between 12pm to 3pm #lunchtime #lunch #lovefood #dubai
708990323075248100,Sun Mar 13 12:17:20 +0000 2016,A perfect snack between lunch and dinner. Aloo sagoo tikki and masala chai. Flames does it best. https://t.co/0uNPtK35lb
706099865579708400,Sat Mar 05 12:51:41 +0000 2016,BBQ anyone? Make it a Flames BBQ https://t.co/BPADfK82Tl
706062184237789200,Sat Mar 05 10:21:57 +0000 2016,https://t.co/Vzm9Em1yRs
703209612296765400,Fri Feb 26 13:26:51 +0000 2016,Enjoy a 10% discount when you order online via https://t.co/9yAkqv19Am. Another great reason to order your delicious meal from us. #zomato
703177967929675800,Fri Feb 26 11:21:06 +0000 2016,Wohooo its raining in Dubai. Fear not, we do not let a little rain stop our great food to be delivered to you. So... https://t.co/CHQIsbblIE
702874185303982100,Thu Feb 25 15:13:59 +0000 2016,Enjoy a delicious meal from us tonight. What better way to end your working week. #dubaifoodfestival #currynight... https://t.co/uvtQBNHeBw
702873005836337200,Thu Feb 25 15:09:17 +0000 2016,Enjoy a delicious meal tonight by ordering online with us on https://t.co/GcR6JOiNzN or simply call 044526664. #currynight #bbqdubai
702140081813868500,Tue Feb 23 14:36:55 +0000 2016,We love reading your reviews :) https://t.co/0z4yaOHkLd
701449111971741700,Sun Feb 21 16:51:15 +0000 2016,Just a sample of the excellent food. Feeling hungry call 044526664 #currynight #DubaiFoodFestival https://t.co/fBpKvCD5SG
700341557258420200,Thu Feb 18 15:30:13 +0000 2016,New dish created by our talented Chefs. Order your Crispy Cup Chicken today call 044526664 #yummy #dubai #foodie https://t.co/NwY8p77rTS
697475297038463000,Wed Feb 10 17:40:43 +0000 2016,A very new creation by our talented Chefs. Our Crispy Cup Chicken is so tasty #yummy #dubaifood #lovefood... https://t.co/UH3OyfSPh8
697469250395619300,Wed Feb 10 17:16:42 +0000 2016,We.are pleased to inform you that we have launched online ordering via https://t.co/9yAkqv19Am https://t.co/WsMrG1jyTq
693094180193714200,Fri Jan 29 15:31:44 +0000 2016,We.are pleased to inform you that we have launched online ordering via https://t.co/dEgUxa46ge https://t.co/OpFdQ52HhA
689745715380252700,Wed Jan 20 09:46:08 +0000 2016,Lunch time at Flames has just got more exciting! Our new weekday lunch time promotion starts today. Sunday to... https://t.co/2cyfDhrUFG
687644828579004400,Thu Jan 14 14:37:57 +0000 2016,Perfect weather in Dubai for hosting your BBQ party. Turn your BBQ party into a FLAMES BBQ and make it a day to... https://t.co/DTEiQLifyE
687642952513007600,Thu Jan 14 14:30:30 +0000 2016,Order online https://t.co/GcR6JOiNzN or call 044526664 https://t.co/SMstmiTYzJ
687641960484597800,Thu Jan 14 14:26:33 +0000 2016,https://t.co/Oq1td11dYI
682588599095791600,Thu Dec 31 15:46:18 +0000 2015,Another wonderful year closing for an even brighter 2016. The Flames team and management wish you all a Happy New... https://t.co/ArXMqRUI2D
680553007260536800,Sat Dec 26 00:57:35 +0000 2015,The Flames Team and Management wish everyone a very Merry Christmas.
678152931091357700,Sat Dec 19 10:00:32 +0000 2015,Flames Team are proud to launch our new Lunch Menu. We are offering great value, great selection lunches and... https://t.co/EK11l1k9fs
674254032756609000,Tue Dec 08 15:47:43 +0000 2015,Fancy a nice curry to keep you warm this evening? Call 044526664 or online https://t.co/GcR6JO1cbd #coldindubai #spiceitup #dubaifoodie
673473646040600600,Sun Dec 06 12:06:44 +0000 2015,https://t.co/Z8JfgiiFvO
673471775368462300,Sun Dec 06 11:59:18 +0000 2015,Should hire this fella as our cashier :) https://t.co/8clUaqmao8
673414114144686100,Sun Dec 06 08:10:10 +0000 2015,https://t.co/w4mcrBI3lY
673410843963355100,Sun Dec 06 07:57:11 +0000 2015,Tandoori chicken cooked to perfection. How about it for your lunch today. Call 044526664 or https://t.co/GcR6JO1cbd https://t.co/FMyumfOpjq
672073589735235600,Wed Dec 02 15:23:24 +0000 2015,Great to see a demand building on our new offering of fantastic BBQ marinated uncooked grills. Book yours for a... https://t.co/qGaHYXXjdQ
672036422879191000,Wed Dec 02 12:55:43 +0000 2015,The Flames team and management would like to wish all our valued guests and residents of the UAE a very happy... https://t.co/qriFHsjY44
671700453969670100,Tue Dec 01 14:40:42 +0000 2015,To order call 044526664 or online on https://t.co/GcR6JO1cbd #greatfood #foodie #dubai #curry #grill #Takeaway https://t.co/A0Sy8z0cAq
670219788417937400,Fri Nov 27 12:37:04 +0000 2015,Very proud to announce our full service catering. Pictures from our latest event. Do spread the word that we have... https://t.co/a4iU7gK09z
670180016668348400,Fri Nov 27 09:59:01 +0000 2015,https://t.co/uxhfCj98h6
670179441054642200,Fri Nov 27 09:56:44 +0000 2015,https://t.co/vOYN7E8Xdo
669904231772635100,Thu Nov 26 15:43:09 +0000 2015,Great time to order yours tonight. Call 044526664 or order online on https://t.co/GcR6JOiNzN https://t.co/2uukH0RWG7
669903519290400800,Thu Nov 26 15:40:19 +0000 2015,Great time to order yours tonight. Call 044526664 or order online https://t.co/GcR6JOiNzN https://t.co/igVeS6cZM4
669838838882259000,Thu Nov 26 11:23:18 +0000 2015,The Flames team and management would like to wish a Happy Thanks Giving to all our American friends. Have a fabulous day :)
669813154482749400,Thu Nov 26 09:41:15 +0000 2015,RT @ruchikamble: I reviewed Flames Grills &amp; Curry (@FlamesGrillJLT) and rated it 3.5/5 on @ZomatoUAE #LoveFood https://t.co/efulJQ2pe2
668791639910039600,Mon Nov 23 14:02:07 +0000 2015,Perfect weather in Dubai for hosting your BBQ party. Turn your BBQ party into a FLAMES BBQ and make it a day to... https://t.co/7wNtsYHoQT
665102811261042700,Fri Nov 13 09:44:01 +0000 2015,Feeling hungry? To order call 044526664 or order online https://t.co/GcR6JO1cbd https://t.co/N2dXpfcc2M
664833007048663000,Thu Nov 12 15:51:55 +0000 2015,Feeling hungry? Call 044526664 or order online https://t.co/GcR6JOiNzN Have a fantastic weekend. https://t.co/aBn1D26Os0
664532838063149000,Wed Nov 11 19:59:09 +0000 2015,The Flames team, wishes all our friends, family and valued guests a wonderful and happy Diwali. https://t.co/tx67jrPNWz
654656031365009400,Thu Oct 15 13:52:15 +0000 2015,The entire team and management of Flames wishes all a very Happy Islamic New Year. Make it special and let us... http://t.co/hzi2wY1vWe
651076933300568000,Mon Oct 05 16:50:11 +0000 2015,Craving for the best Butter Chicken in town? Have it your way mild medium or spicy with our delicious rice and bread options. Call 044526664
649592916311167000,Thu Oct 01 14:33:14 +0000 2015,Fantastic end to our September promo Flames Jackpot, congratulations to our final lucky guest Sonia Wilson random... http://t.co/UHHZiSoPRe
649297159662211100,Wed Sep 30 18:58:00 +0000 2015,Uh oh, now you all know who is making your Nan breads :) http://t.co/PANkVoWeYy
648993167879094300,Tue Sep 29 22:50:03 +0000 2015,Almost as good as our Chefs :) http://t.co/Ua5cK1hIcK
648441048725852200,Mon Sep 28 10:16:08 +0000 2015,Final 3 days left for the popular Flames Jackpot! Congratulations Jamie Srench as our lucky guest for yesterdays... http://t.co/vR8Xd9KApj
648058254686339100,Sun Sep 27 08:55:02 +0000 2015,http://t.co/yhsHipsyLh
648058081910386700,Sun Sep 27 08:54:21 +0000 2015,Yesterdays random alarm was 8.37pm, congratulations Jaison Bowman as our lucky guest with order value AED 45.... http://t.co/JfxmtyPSTG
647727197344690200,Sat Sep 26 10:59:32 +0000 2015,Congratulations John Eid as our lucky guest for yesterdays random alarm 6.28pm with order value AED 68. We hope... http://t.co/lFF5q8qxzY
647334995787427800,Fri Sep 25 09:01:04 +0000 2015,Final week of the Flames Jackpot. We have our lucky guest yesterday, congratulations Kamal Almahri to order after... http://t.co/oyjrHSeUIP
646985735787159600,Thu Sep 24 09:53:14 +0000 2015,http://t.co/qyOhsQSVUX
646984735563120600,Thu Sep 24 09:49:16 +0000 2015,Congratulation David Carcnan our lucky guest yesterday with random alarm set at 9.04pm with order value AED 70.... http://t.co/SXvh0sSkGG
646694770459349000,Wed Sep 23 14:37:02 +0000 2015,Who's craving for some really yummy food? Order online http://t.co/GcR6JO1cbd or call directly on 044526664 http://t.co/ex3sNaB5zE
646610104415060000,Wed Sep 23 09:00:36 +0000 2015,Happy Eid Al Adha to all. Our online ordering guests are enjoying the Flames Jackpot as we had another online... http://t.co/1eQR9CnrtC
646261424440934400,Tue Sep 22 09:55:05 +0000 2015,http://t.co/pAYD6Lzs08
646260901675409400,Tue Sep 22 09:53:00 +0000 2015,Yesterdays Jackpot was a lunch time random alarm for 1.23pm. Congratulations Mags Cluley our lucky guest with an... http://t.co/DiZUSisDI7
645951582702538800,Mon Sep 21 13:23:53 +0000 2015,Congratulations Ashley Paro our lucky guest for yesterdays jackpot with order value AED 142 with random alarm set... http://t.co/ulzfuwxTwu
645547295757467600,Sun Sep 20 10:37:23 +0000 2015,Woohoooo what perfect timing on yesterdays jackpot. Another online ordering guest with perfect timing of the... http://t.co/z1WzNudf1p
645172443980673000,Sat Sep 19 09:47:52 +0000 2015,Flames jackpot random alarm was a late one yesterday set at 10.19pm! But orders fly in throughout the day and our... http://t.co/nKr6u0LbmL
644838729161547800,Fri Sep 18 11:41:48 +0000 2015,http://t.co/kKrlBj1UO4
644794352728936400,Fri Sep 18 08:45:28 +0000 2015,WOW what a start to the day yesterday! Our very first guest ordering very soon after we opened for business... http://t.co/jqWt2fAC97
644563137178431500,Thu Sep 17 17:26:41 +0000 2015,RT @DXBFoodFest: #DidYouKnow eating spicy food three times a week can help you live longer? http://t.co/XpJwCh4gTo
644438101209821200,Thu Sep 17 09:09:51 +0000 2015,Yesterday's jackpot time was 7.33pm. Congratulations Romin Rana as our lucky guest with order value AED 35.... http://t.co/1dVpThe97y
644060612620877800,Wed Sep 16 08:09:50 +0000 2015,Flames Jackpot goes into the 2nd half of the months promo. 15 lucky guests have enjoyed it so far!... http://t.co/Yglfm4C9UN
643708528700596200,Tue Sep 15 08:50:47 +0000 2015,Flames Jackpot alarm time for yesterday was 4.48pm, congratulations Omar Qureshi with order value AED 35. We hope... http://t.co/AgLPiNcMJj
643348641466482700,Mon Sep 14 09:00:43 +0000 2015,So cool, our jackpot was won by an online ordering guest yesterday! Congratulations to our lucky guest Robert... http://t.co/KDzX5TCHt2
642989971440336900,Sun Sep 13 09:15:30 +0000 2015,Our lucky guest for yesterday's jackpot alarm time 9.31pm is Vaibhav Kumar with order value AED 70.... http://t.co/2w9Rnnzc4r
642615793235136500,Sat Sep 12 08:28:38 +0000 2015,Congratulations to our lucky guest Tom Rhotes for yesterdays jackpot alarm set 2.54pm with order value AED 145.... http://t.co/yGc829CbXU
642286391305576400,Fri Sep 11 10:39:43 +0000 2015,Great start to our weekend yesterday! Congratulations Lee Hussein as our lucky guest for the day, alarm 7.14pm... http://t.co/6SPVj8ao1z
641914203318689800,Thu Sep 10 10:00:46 +0000 2015,http://t.co/pseRfabcm3
641914121420673000,Thu Sep 10 10:00:27 +0000 2015,Congratulations Pravin Rampaul our lucky guest for yesterday. Alarm set for 12.49pm and his order value AED 46.... http://t.co/TlFC2BB3mb
641528776694829000,Wed Sep 09 08:29:14 +0000 2015,Flames jackpot is in the second week, 7 happy lucky guests already enjoyed the first week! The random alarm for... http://t.co/n37gAfNHqA
641236318954127400,Tue Sep 08 13:07:06 +0000 2015,Scary or what! http://t.co/pZONLn9Cat
641185880552550400,Tue Sep 08 09:46:41 +0000 2015,Have a look at this review of Flames Grills &amp; Curry on @Zomato http://t.co/k0JDqoqOM4
641184879783317500,Tue Sep 08 09:42:42 +0000 2015,http://t.co/ICCfNlSJJq
641184743107743700,Tue Sep 08 09:42:10 +0000 2015,Congratulations Ciarnam Smith our lucky guest for yesterdays jackpot. Alarm time was 8.03pm and order value AED... http://t.co/YhDPCXIdZL
640812485793173500,Mon Sep 07 09:02:56 +0000 2015,Extremely happy to announce our lucky guest for yesterday! Congratulations Salman, random alarm was set for... http://t.co/iDU61iKlUR
640454255132983300,Sun Sep 06 09:19:28 +0000 2015,Another lucky guest collected the Flames Jackpot yesterday. Congratulations Sabi Suleman alarm time 6.50pm and... http://t.co/avp42RchZC
640084112099942400,Sat Sep 05 08:48:39 +0000 2015,http://t.co/kV2CsryUZo
640083769643417600,Sat Sep 05 08:47:17 +0000 2015,Flames Jackpot is heating up folks! Every day your order with us has a chance, could today be your day? Todays... http://t.co/hiZXnqS4Zh
639766698891960300,Fri Sep 04 11:47:21 +0000 2015,Hello, details of our daily Flames Jackpot can be found on http://t.co/GcR6JO1cbd Promos and News page and our Facebook page. Good luck!
639764050717601800,Fri Sep 04 11:36:50 +0000 2015,Another great Flames Jackpot claimed yesterday. Random alarm was set for 5.23pm and congratulations to Alex Birch... http://t.co/wjDRW5WHZV
639477935552884700,Thu Sep 03 16:39:55 +0000 2015,Start your weekend with a perfect meal. Give us a call 044526664 or order online http://t.co/GcR6JO1cbd Have a fantastic weekend! #fooddubai
639336777145286700,Thu Sep 03 07:19:00 +0000 2015,Congratulations Yusouf Naikoo for being our lucky guest for yesterday. Alarm was set for 1.38pm and you ordered... http://t.co/S93nijBJeH
639335326406848500,Thu Sep 03 07:13:14 +0000 2015,http://t.co/vZvcyWDGLC
639091922288685000,Wed Sep 02 15:06:02 +0000 2015,Please keep sharing and encouraging your friends to like our page. Thank you http://t.co/pHQsmhUn2K
638991862359965700,Wed Sep 02 08:28:26 +0000 2015,Pleased to confirm todays FLAMES JACKPOT alarm has been set. Will you be our luck guest to receive your order whatever value totally free!
638976420631420900,Wed Sep 02 07:27:04 +0000 2015,Good morning all, what a great start to our September Flames Jackpot! We are pleased to announce that yesterday... http://t.co/xDEKXnRyCy
638973977189199900,Wed Sep 02 07:17:22 +0000 2015,Have a look at this review of Flames Grills &amp; Curry on @Zomato http://t.co/aaw36P7LyS
638744247236071400,Tue Sep 01 16:04:30 +0000 2015,Will you be our lucky guest for our Flames Jackpot September promo? Details on our website and Facebook page. Good luck!
638692799894917100,Tue Sep 01 12:40:04 +0000 2015,http://t.co/1ug5rR61cS
638658068939731000,Tue Sep 01 10:22:03 +0000 2015,Like our page and share please. Thank you http://t.co/79ihFXtYep
638631997993185300,Tue Sep 01 08:38:28 +0000 2015,Great news FLAMES JACKPOT September promo starts today. Details on website http://t.co/GcR6JO1cbd promo and FB page. Good luck folks!
638618960099962900,Tue Sep 01 07:46:39 +0000 2015,Good morning all, the FLAMES JACKPOT promo for September has officially launched today! The random alarm for the... http://t.co/iYim9VWXHp
638374185807544300,Mon Aug 31 15:34:00 +0000 2015,Hello friends, the team here at Flames are pleased to announce our exciting promo for September. Everyday... http://t.co/qJtENbcr6c
633996357263491100,Wed Aug 19 13:38:05 +0000 2015,Have a look at this review of Flames Grills &amp; Curry on @Zomato http://t.co/X1Bsy3aLvS
632531545048416300,Sat Aug 15 12:37:26 +0000 2015,Flames team wish all a happy independence day. http://t.co/C6CxaJvy7i
632530096201596900,Sat Aug 15 12:31:41 +0000 2015,Flames team wish all a happy Independence day. http://t.co/sF8I7yy7do
632305160061104100,Fri Aug 14 21:37:52 +0000 2015,We only use fresh green chillies :) http://t.co/Sot6QHhGKy
624567272183459800,Fri Jul 24 13:10:16 +0000 2015,This place is a must if you are in London. Best products and services that will make you feel pampered. You will... http://t.co/LHnjrXvFk2
624535073170174000,Fri Jul 24 11:02:19 +0000 2015,Flames Grills &amp; Curry – Dubai http://t.co/OKmq811mFF
624534950461575200,Fri Jul 24 11:01:50 +0000 2015,Have a look at this review of Flames Grills &amp; Curry on @Zomato http://t.co/NaYvoerHoA
623879553128263700,Wed Jul 22 15:37:31 +0000 2015,A lovely review from an expert ;) http://t.co/9nC3KOhlwf
623758889025077200,Wed Jul 22 07:38:02 +0000 2015,http://t.co/QPP5weGeE3
623225137203015700,Mon Jul 20 20:17:06 +0000 2015,Spooky!!! http://t.co/dFOxnBycmt
622784038852366300,Sun Jul 19 15:04:20 +0000 2015,Check out Flames Grills &amp; Curry on TripAdvisor http://t.co/YB6mfUcAUN
622780488554418200,Sun Jul 19 14:50:13 +0000 2015,http://t.co/Ux27ZFiqM3
621982563670691800,Fri Jul 17 09:59:33 +0000 2015,The Flames Team wishes all our Muslim friends and family a blessed and joyous Eid Al Fitr. Eid Mubarak!
621273344009056300,Wed Jul 15 11:01:22 +0000 2015,For a chance to win AED 200 dinner voucher just post a review of us on Zomato and TripAvisor and a random winner will be selected. Good luck
620865282676883500,Tue Jul 14 07:59:53 +0000 2015,Nearing the end of Ramadan. Last chance to enjoy your 20% discount on orders above AED 100 so call now 044526664
619882236842618900,Sat Jul 11 14:53:36 +0000 2015,Flames Grills &amp; Curry – Dubai http://t.co/stLIq7Tv0J
619882127992029200,Sat Jul 11 14:53:10 +0000 2015,Have a look at this review of Flames Grills &amp; Curry on @Zomato http://t.co/95svYa8l1D
619882016251576300,Sat Jul 11 14:52:44 +0000 2015,Flames Grills &amp; Curry – Dubai http://t.co/X69Vwq0XTz
619881882180685800,Sat Jul 11 14:52:12 +0000 2015,Have a look at this review of Flames Grills &amp; Curry on @Zomato http://t.co/BEciqbUqLn
619153985941811200,Thu Jul 09 14:39:48 +0000 2015,Enjoy your 20% discount for orders above AED 100 every day over Ramadan. To order call 044526664 or order online http://t.co/GcR6JO1cbd
619067815845171200,Thu Jul 09 08:57:23 +0000 2015,Enjoy your 20% discount for orders above AED 100 every day over Ramadan. Call 044526664 or order online http://t.co/GcR6JO1cbd
618778834389733400,Wed Jul 08 13:49:05 +0000 2015,Enjoy your 20% discount for orders above AED 100 every day over Ramadan. To order call 044526664 or order online http://t.co/GcR6JO1cbd
618771032782934000,Wed Jul 08 13:18:05 +0000 2015,Enjoy your 20% discount for orders above AED 100 every day over Ramadan. Call 044526664 or order online http://t.co/GcR6JO1cbd
618357305541722100,Tue Jul 07 09:54:04 +0000 2015,Enjoy your 20% discount for orders above AED 100 every day over Ramadan. Call 044526664 or order online http://t.co/GcR6JO1cbd
617983119581319200,Mon Jul 06 09:07:11 +0000 2015,Enjoy your 20% discount for orders above AED 100 every day over Ramadan. Call 044526664 or order online http://t.co/GcR6JO1cbd
613271484694335500,Tue Jun 23 09:04:50 +0000 2015,Flames Grills &amp; Curry – Dubai http://t.co/z4I660J0kj
613271359439794200,Tue Jun 23 09:04:20 +0000 2015,Have a look at this review of Flames Grills &amp; Curry on @Zomato http://t.co/T5voSmCxIO
612195686860243000,Sat Jun 20 09:50:00 +0000 2015,Another happy guest. Love it :) http://t.co/3hN3Utgqkr
612195176807665700,Sat Jun 20 09:47:58 +0000 2015,Have a look at this review of Flames Grills &amp; Curry on @Zomato http://t.co/AtuY1PuZ3H
611467788188696600,Thu Jun 18 09:37:35 +0000 2015,Flames Grills &amp; Curry – Dubai http://t.co/gZQwfG06wE
611467623591641100,Thu Jun 18 09:36:56 +0000 2015,Have a look at this review of Flames Grills &amp; Curry on @Zomato http://t.co/WSb5h6M2gK
611462606809796600,Thu Jun 18 09:17:00 +0000 2015,The Flames team wishes everyone Ramadan Kareem. May you have a blessed month. http://t.co/NDbznfPx54
611181422636699600,Wed Jun 17 14:39:41 +0000 2015,Flames Grills &amp; Curry – Dubai http://t.co/MP7lN5CX7a
611181202918150100,Wed Jun 17 14:38:48 +0000 2015,Flames Grills &amp; Curry – Dubai http://t.co/uP0eXELs0d
611180962299277300,Wed Jun 17 14:37:51 +0000 2015,Have a look at this review of Flames Grills &amp; Curry on @Zomato http://t.co/LvGaZsbGZV
611180019264520200,Wed Jun 17 14:34:06 +0000 2015,Ginger Against Knee Pain http://t.co/pbIyoGYTjE
611153077689684000,Wed Jun 17 12:47:03 +0000 2015,Meet our newest Chef. Quick get your orders in fast as he already has orders backing up. Will try RedBull to... http://t.co/iPZnae7jJw
609977409308209200,Sun Jun 14 06:55:21 +0000 2015,Yes friends we are open normal hours during Ramadan http://t.co/LIdng8CRIo
606098261393313800,Wed Jun 03 14:01:00 +0000 2015,Flames Grills &amp; Curry – Dubai http://t.co/Cml2mxb3q6
606098062147059700,Wed Jun 03 14:00:13 +0000 2015,Have a look at this review of Flames Grills &amp; Curry on @Zomato http://t.co/mHf6djnoF6
603960323037515800,Thu May 28 16:25:36 +0000 2015,@Pit_Dxb thank you sir, we look forward to your order. Also will tell Mr Tom you were asking how he is :)
603959508184928300,Thu May 28 16:22:22 +0000 2015,@Pit_Dxb dear Paul, yes sir we deliver to Victory Heights :)
603946766531100700,Thu May 28 15:31:44 +0000 2015,Retweet if you're hungry now
603946145472061400,Thu May 28 15:29:16 +0000 2015,Happy weekend all. Why not treat yourself to amazing food tonight. Just call 044526664  #dubaifood #hungry #indianfood #Curry #grills #food
601407720843907100,Thu May 21 15:22:28 +0000 2015,Flames Grills &amp; Curry – Dubai http://t.co/1dvmegQCcM
