id,created_at,text
308223523690795000,Sun Mar 03 14:33:09 +0000 2013,RT @idrinklocal: The ruler of #Dubai out for lunch with no security and drinking local water. Fantastic - that's why we love local http: ...
308213976993501200,Sun Mar 03 13:55:13 +0000 2013,Do you like Ugali curry?  #kenya
308209893037453300,Sun Mar 03 13:38:59 +0000 2013,We are open for dining in, take-away, and delivery call us on 04 452 6664   #food #jlt
308183904538468350,Sun Mar 03 11:55:43 +0000 2013,Do you work or live in #JLT, we offer a free delivery service http://t.co/GcR6JO1cbd #food #dubai
308169480721281000,Sun Mar 03 10:58:24 +0000 2013,@idrinklocal we look forward to welcoming you to  Flames :)
308151454445735940,Sun Mar 03 09:46:46 +0000 2013,You can find us on FB too :) http://t.co/4rqc8nRDI3   #flames #jlt #food
308151150505521150,Sun Mar 03 09:45:34 +0000 2013,We have 333 folllowers #cute thanks for following :)
308150961044594700,Sun Mar 03 09:44:48 +0000 2013,@idrinklocal thanks for the follow, we serve local :)
308093186482524160,Sun Mar 03 05:55:14 +0000 2013,@desertkiwi ooh tricky one, the mixed grill is superb, butter chicken popular and the kebabs go down a storm!
308091123149189100,Sun Mar 03 05:47:02 +0000 2013,We are open from 12 Noon today, http://t.co/IgCfooVIOt  #food #jlt
308079986194120700,Sun Mar 03 05:02:47 +0000 2013,We are open from 12 Noon today, check out our brand new menu! http://t.co/IgCfooVIOt   #flames #jlt
308069225350717440,Sun Mar 03 04:20:01 +0000 2013,Morning Flamers :)  loving this image (thanks to google), how planning on spending the first day of a new week? http://t.co/xObQMFMfjN
307910072095367200,Sat Mar 02 17:47:36 +0000 2013,RT @StephNektar: Thank you @nickwatson1411 @delphinewatson @Adventure_HQ for making a little girl's birthday extra special! #kindness ht ...
307877956959739900,Sat Mar 02 15:39:59 +0000 2013,Too tired to cook? Let us deliver 04 452 6664 #food #jlt
307855305742614500,Sat Mar 02 14:09:59 +0000 2013,RT @Dubai_Calendar: A weekend of endless fun for children and families. Don't miss @KidsFestDubai @DFCDubai March 8 &amp; 9. http://t.co ...
307855240437325800,Sat Mar 02 14:09:43 +0000 2013,@flowersmeller lol that is funny!
307855146606542850,Sat Mar 02 14:09:21 +0000 2013,We can deliver, just give us a call on 04 452 6664 #curry #kebab
307852397034745860,Sat Mar 02 13:58:25 +0000 2013,RT @FooDivaWorld: "@mandaloundifc: Honored &amp; blessed by visit of HH Shk Mohamed &amp; HH Shk Mohamed for lunch at Al Mandaloun http: ...
307852000882728960,Sat Mar 02 13:56:51 +0000 2013,RT @Queen_UK: Justin Bieber on the phone. Says he had the worse Birthday ever - no candles, no clown, no magician, no musical chairs, no ...
307836583644655600,Sat Mar 02 12:55:35 +0000 2013,One of our most popular dishes :) http://t.co/zU3bLCfaiQ
307836180425216000,Sat Mar 02 12:53:59 +0000 2013,Our children's menu starts at us 12 dhs, especially for those little ones under the age of 8 #flames
307835730690994200,Sat Mar 02 12:52:12 +0000 2013,What's your favourite dish on our new menu?   http://t.co/GcR6JO1cbd  #food #jlt
307800551150714900,Sat Mar 02 10:32:24 +0000 2013,Our family has travelled four continents to bring you Flames http://t.co/GcR6JO1cbd #curry #kebab #jlt
307782392297451500,Sat Mar 02 09:20:15 +0000 2013,Hope on the Metro, get off at JLT station, we are 5 minutes away :) http://t.co/FCQwfihRkl
307757815810912260,Sat Mar 02 07:42:35 +0000 2013,Welcome to our new followers :) you can find our location and menu information on our website http://t.co/GcR6JO1cbd #jlt #food #dubai
307755460545609700,Sat Mar 02 07:33:14 +0000 2013,Follow us on Twitter :) we will follow you back :) http://t.co/qckTFxDEIb
307751762444550140,Sat Mar 02 07:18:32 +0000 2013,Who went to @80sRewindDubai last night then? bring back many memories?
307499496173080600,Fri Mar 01 14:36:07 +0000 2013,We are open til late this evening, it's the weekend after all :) call us on 04 452 6664 for delivery
307469576407511040,Fri Mar 01 12:37:14 +0000 2013,We are open late this evening, wonder if we will end up feeding some of the @80sRewindDubai revellers :)
307424272316497900,Fri Mar 01 09:37:12 +0000 2013,Afternoon FLAMERS! Why not check out our new improved menu as of today:... http://t.co/dPzmABcHrR
307423596614123500,Fri Mar 01 09:34:31 +0000 2013,Afternoon FLAMERS! Hope all are well? Why not check out our new improved menu as of today: http://t.co/QSn81d3uTD
307383406113726460,Fri Mar 01 06:54:49 +0000 2013,#ff @arminliya @shielarizza @Brayndamage @MunawaraS @callumdxb @andygib @Dubaimark @T_in_DXB
307383021303115800,Fri Mar 01 06:53:17 +0000 2013,@SkydiveDubai thank you :)
307382198921744400,Fri Mar 01 06:50:01 +0000 2013,RT @SkydiveDubai: Thank you for following us #FF @LuciaFlannery @LisaMcLeanSmith @aamirpro @FlamesGrillJLT @DenaBello @MissD5 @Aisha_AlF ...
307369376603062300,Fri Mar 01 05:59:04 +0000 2013,Join us al fresco, you can find our menu and location information on our website http://t.co/GcR6JO1cbd  #food #jlt
307367142246993900,Fri Mar 01 05:50:11 +0000 2013,Good Morning Flamers :) fabulous weather for dining al fresco! :)
307171104303231000,Thu Feb 28 16:51:12 +0000 2013,We are open late this evening, call us on 04 452 6664 #curry #kebab #jlt
307132807480741900,Thu Feb 28 14:19:02 +0000 2013,Evening everyone, it's quite cool outside this evening, you can find our location map on site http://t.co/GcR6JO1cbd
307115439278932000,Thu Feb 28 13:10:01 +0000 2013,I think we can officially say it's the weekend :) http://t.co/SB9DSfiTNX
307105171987636200,Thu Feb 28 12:29:13 +0000 2013,We are located right in the heart of Jumeirah Lake Towers  :) http://t.co/BH1qI8Z0f0   #flames #jlt
307068624265429000,Thu Feb 28 10:03:59 +0000 2013,You can find our menu information on our website http://t.co/GcR6JO1cbd
307023852427436000,Thu Feb 28 07:06:05 +0000 2013,@shielarizza thanks
307014642335625200,Thu Feb 28 06:29:29 +0000 2013,Follow us on Twitter and we will follow you back :) http://t.co/CrW0hnsoC3
306994746260348900,Thu Feb 28 05:10:25 +0000 2013,It's the last day of the week, bring on the weekend!!  who will be visiting us this weekend?   #flames #jlt
306979542231314400,Thu Feb 28 04:10:00 +0000 2013,Good Morning Flamers :)
306807011113332740,Wed Feb 27 16:44:26 +0000 2013,We are still open :) #curry #kebab #flames 04 452 6664
306768150458949600,Wed Feb 27 14:10:01 +0000 2013,Fancy a doner kebab?  04 452 6664 http://t.co/aA1xe6US6P
306721487069532160,Wed Feb 27 11:04:35 +0000 2013,We travelled from India to Dubai via Kenya and the UK to give you the unique flavours of Flames Grill :)
306703487083900900,Wed Feb 27 09:53:04 +0000 2013,Have you had your lunch yet?
306682586204340200,Wed Feb 27 08:30:01 +0000 2013,We are open!! pop in and dine, or call us for take-away and delivery .... 04 452 6664
306676949915402240,Wed Feb 27 08:07:37 +0000 2013,And we are nearly open!!  04 452 664  #food #jlt
306656623395487740,Wed Feb 27 06:46:51 +0000 2013,RT @Dubai_Calendar: Win 2 tix to the men's tennis semi-final this Friday. Simply RT to win. We'll announce the winners today at 5pm.
306653324248240100,Wed Feb 27 06:33:44 +0000 2013,RT @FifthRingDXB: *Big sigh of relief* Meatballs in UAE are safe, Ikea assures (definitely halal and no horse meat!):  http://t.co/FMqVe ...
306637796733501440,Wed Feb 27 05:32:02 +0000 2013,@sandierpastures we have plenty of water on hand :)
306637738780790800,Wed Feb 27 05:31:48 +0000 2013,We are on FB too, don't forget to like our page :) http://t.co/4rqc8nRDI3  #fb #socialmedia
306637397158932500,Wed Feb 27 05:30:27 +0000 2013,Who could resist this? http://t.co/NQxY4JCgPe
306635975474434050,Wed Feb 27 05:24:48 +0000 2013,RT @toshigupta: #Congratulations! RT @Tan_taz AND I just won tickets to the 80s Rewind concert @DFCDubai this #Friday from @MyRadio2UAE! ...
306635790799220740,Wed Feb 27 05:24:04 +0000 2013,How hot do you like your curry?  or do you not like them spicy?
306632258016657400,Wed Feb 27 05:10:01 +0000 2013,We are open from 12.30 pm today :) #jlt #flames
306624707900346400,Wed Feb 27 04:40:01 +0000 2013,Good Morning Flamers :) http://t.co/KoFJy1KgFC
306424618313469950,Tue Feb 26 15:24:56 +0000 2013,We are open 04 452 6664 #curry #dubai
306400128548356100,Tue Feb 26 13:47:37 +0000 2013,We are open for delivery if you fancy a curry, a kebab or a grill :) 04 452 6664  thank you
306389120664608800,Tue Feb 26 13:03:53 +0000 2013,Fancy a mixed grill?  this one is big enough to share :) call us on 04 452 6664 http://t.co/2E81QS1Ip1
306374154326790140,Tue Feb 26 12:04:25 +0000 2013,Do you fancy some Tangadi Kulfi kebab? http://t.co/GcR6JO1cbd
306362224023334900,Tue Feb 26 11:17:00 +0000 2013,@StealthMountain it was early :)
306348676392038400,Tue Feb 26 10:23:10 +0000 2013,Curry a day keeps doc away...??? Read how on our FB page and LIKE us: http://t.co/b8UdEvzPma
306348030746046460,Tue Feb 26 10:20:36 +0000 2013,Curry a day keeps the Doc away!  http://t.co/Nce7HFJcMz  Read more.... http://t.co/kpIp5VEE2r
306302345350901760,Tue Feb 26 07:19:04 +0000 2013,Check out our mixed grill :) http://t.co/5MQtH4Po8r
306294880349610000,Tue Feb 26 06:49:24 +0000 2013,We are open from 12.30 today, for a sneak peak of the menu check the website http://t.co/GcR6JO1cbd   #curry #kebab #dubai
306274641851342850,Tue Feb 26 05:28:59 +0000 2013,You must try one of our lunch time specials :) #curries
306269324887343100,Tue Feb 26 05:07:51 +0000 2013,We are open from 12.30 today :) #flames #jlt #curry #kebab
306257289181024260,Tue Feb 26 04:20:02 +0000 2013,Good Morning Flamers, loving this shot :) http://t.co/VjsWrXEeIY
306116957252501500,Mon Feb 25 19:02:24 +0000 2013,Hmmmmm Mixed Grill.... What are you waiting for? http://t.co/fCb0OHWCfc
306114534567997440,Mon Feb 25 18:52:47 +0000 2013,Hmmmmm Mixed Grill....What are you waiting for? http://t.co/3OqbofzD1z
306103535660048400,Mon Feb 25 18:09:04 +0000 2013,RT @ZeekhanZee: @callumdxb @flamesgrilljlt I'm Not coming for an holiday I'm there to stay but the first weekend I think I'll have a fat ...
306102093482168300,Mon Feb 25 18:03:20 +0000 2013,@danielmarcevans @GeordieArmani @dmd_dxb Hey Daniel, we also do proper desi dishes. If you see menu on http://t.co/GcR6JO1cbd check the flag
306101017769041900,Mon Feb 25 17:59:04 +0000 2013,Hey Flamers! Please take some time and write your review on: http://t.co/mgUpK93Bko
306070019173912600,Mon Feb 25 15:55:53 +0000 2013,RT @HHShkMohd: UAE is a global relief station with a total foreign aid of AED160 bn since 1971 and it is one of the top countries in rat ...
306065746247688200,Mon Feb 25 15:38:54 +0000 2013,@callumdxb @zeekhanzee of course there are the mad nights out followed by a donner!
306064528930656260,Mon Feb 25 15:34:04 +0000 2013,@ZeekhanZee @callumdxb you can't have low cal on your holidays!
306062447683436540,Mon Feb 25 15:25:48 +0000 2013,@callumdxb ha ha ha well funny!!
306059500320878600,Mon Feb 25 15:14:05 +0000 2013,Chicken Vindaloo anyone?  #flames #jlt
306058182734782460,Mon Feb 25 15:08:51 +0000 2013,@callumdxb how cheeky!!  did it say you look daft in pink :)
306055842434781200,Mon Feb 25 14:59:33 +0000 2013,@callumdxb you can anything you like :)
306055779616690200,Mon Feb 25 14:59:18 +0000 2013,We are open, bit windy on the terrace this evening :) #food #jlt
306007979990335500,Mon Feb 25 11:49:22 +0000 2013,Our mixed grill is big enough to share!!  70 dhs :)
306007854018621440,Mon Feb 25 11:48:52 +0000 2013,Fancy a chicken tikka wrap?   15 dhs http://t.co/GcR6JO1cbd
306004535367827460,Mon Feb 25 11:35:41 +0000 2013,Did you know we sell Ugali Kenya special curry? chicken, mutton, fish or vegetable starting at  just 30 dhs :)
306004322662117400,Mon Feb 25 11:34:50 +0000 2013,Fancy a kebab?   curry?  or maybe a grill?  check out menu out http://t.co/GcR6JO1cbd  #food #jlt
306004003156811800,Mon Feb 25 11:33:34 +0000 2013,@TheCurryGuy pleasure :)
306002436131278850,Mon Feb 25 11:27:20 +0000 2013,RT @TheCurryGuy: 266 pages of seafood recipes and accompaniments! All that for just £1.29 in my new ebook. http://t.co/aE491nKHgl
305962776961097700,Mon Feb 25 08:49:45 +0000 2013,Fancy a kebab for lunch?  call us 04 452 6664 #food #jlt
305952777711009800,Mon Feb 25 08:10:01 +0000 2013,Did you know that one out of every four people throughout the world eat chili peppers daily? http://t.co/BbZg1jPJSl
305940001395470340,Mon Feb 25 07:19:15 +0000 2013,If you are following us on here you might want to like our FB page too :) http://t.co/4rqc8nRDI3  #food #jlt
305916975039782900,Mon Feb 25 05:47:45 +0000 2013,Good Morning new followers, you can find our location and menu information at http://t.co/GcR6JO1cbd #curry #kebab #dubai
305914643279409150,Mon Feb 25 05:38:29 +0000 2013,We are open today from 12.30 :)
305899931594539000,Mon Feb 25 04:40:01 +0000 2013,Did you know that out of every four people throughout the world eat chili peppers daily?  Good Morning Flamers :)
305693555119239200,Sun Feb 24 14:59:57 +0000 2013,@desertkiwi just let me know before you go :)
305693090809782300,Sun Feb 24 14:58:07 +0000 2013,@IhabInternetm really easy to find :)
305693002427400200,Sun Feb 24 14:57:45 +0000 2013,@not_moby @mrjlovell look forward to welcoming you :)
305692883292405760,Sun Feb 24 14:57:17 +0000 2013,@desertkiwi lol and thank you. I am pretty sure we can sort out something for you :)
305692638986776600,Sun Feb 24 14:56:19 +0000 2013,@not_moby @LucySBreslin if we could we would :)
305692512151011300,Sun Feb 24 14:55:49 +0000 2013,@foodindubai thanks
305685201969885200,Sun Feb 24 14:26:46 +0000 2013,We only need one more follower to hit the 300 followers mark, pls RT, thank you :)
305683383890092000,Sun Feb 24 14:19:32 +0000 2013,Hop on the Metro, hop off at JLT, we are the building on the right http://t.co/FCQwfihRkl  #jlt #food
305676414777188350,Sun Feb 24 13:51:51 +0000 2013,You can find our menu information on our website http://t.co/GcR6JO1cbd  #food #dubai call us on 04 452 6664 for delivery :)
305673478244282400,Sun Feb 24 13:40:11 +0000 2013,RT @luxury__travel: Insights into the Sheikh Zayed Grand Mosque, Abu Dhabi http://t.co/R1eUKtg883
305673383767580700,Sun Feb 24 13:39:48 +0000 2013,RT @dubaitara: Everyone you will ever met knows something you don't. ~ Bill Nye
305673032087769100,Sun Feb 24 13:38:24 +0000 2013,RT @DaddyBird: Dinner: stir-fried beef with snow peas &amp; quickly-steamed cabbage :-)&gt; http://t.co/R8SgUooGEY
305658171609993200,Sun Feb 24 12:39:21 +0000 2013,Love curry?  http://t.co/GcR6JO1cbd  #food # dubai
305556726596382700,Sun Feb 24 05:56:15 +0000 2013,RT @LimeTonicDUBAI: "In victory you deserve bubbly, in defeat you need it" - Lime&amp;Tonic - Where do you enjoy your bubby after a victory?
305556698490359800,Sun Feb 24 05:56:08 +0000 2013,Wonder if we will hit the 300 followers mark today?  hope so :) pls RT #food #JLT #dubai
305553611688116200,Sun Feb 24 05:43:52 +0000 2013,We are open from 12.30 today, give us a call on 04 452 6664 to arrange delivery :) #jlt #food
305546689698205700,Sun Feb 24 05:16:22 +0000 2013,Fabulous weather again!!
305524964742807550,Sun Feb 24 03:50:02 +0000 2013,Good Morning Flamers!! we will be open for business from 12.30 today, gives us a call if you fancy a deliver 04 452 6664
305397215717904400,Sat Feb 23 19:22:24 +0000 2013,@AaronIFA Thanks Aaron, make us feel proud and a step closer to being known as the best restaurant in Dubai. See you again soon ;)
305397215717904400,Sat Feb 23 19:22:24 +0000 2013,@AaronIFA Thanks Aaron, make us feel proud and a step closer to being known as the best restaurant in Dubai. See you again soon ;)
305396896040615940,Sat Feb 23 19:21:08 +0000 2013,@Kmonsurate Thank you Keith. We look fwd to next time. ;)
305382515525435400,Sat Feb 23 18:24:00 +0000 2013,@Jabeen_H Thank you, it was a pleasure to see U all with army and we look forward to next time. :)
305379125965770750,Sat Feb 23 18:10:31 +0000 2013,@not_moby perfection is having you visit us on a regular basis as you do. Thank you ;)
305349398349639700,Sat Feb 23 16:12:24 +0000 2013,Call us for delivery 04 452 6664 #curry #kebab
305346595573088260,Sat Feb 23 16:01:16 +0000 2013,@Dubaihairdoctor yes she is a big fan :)
305339996783656960,Sat Feb 23 15:35:02 +0000 2013,@Dubaihairdoctor thank you, I can promise that you won't be disappointed :)
305337027119964160,Sat Feb 23 15:23:14 +0000 2013,@Dubaihairdoctor try us next time then, and apologies for the confusion
305328554823004160,Sat Feb 23 14:49:34 +0000 2013,@dreamslatts yes we don't miss that weather that's for sure!
305325574337994750,Sat Feb 23 14:37:44 +0000 2013,Evening Flamers :)
305323162311196700,Sat Feb 23 14:28:09 +0000 2013,We are open for dining-in, takeaway and delivery 04 452 6664 #food #jlt
305322979561197600,Sat Feb 23 14:27:25 +0000 2013,RT @GeordieArmani: If you fancy a good curry or kebab, follow @FlamesGrillJLT :) thank you
305322930437496800,Sat Feb 23 14:27:13 +0000 2013,@Dubaihairdoctor apologies yes we do deliver to Marina!! 04 452 6664
305308473892167700,Sat Feb 23 13:29:47 +0000 2013,@flowersmeller thanks :)
305308448202059800,Sat Feb 23 13:29:41 +0000 2013,@Dubaihairdoctor no sorry we don't but you could ask the guys @mashaweeruae to collect and deliver for you?
305306798922022900,Sat Feb 23 13:23:07 +0000 2013,@Jabeen_H thanks for visiting us, you are welcome back anytime!!
305303041236693000,Sat Feb 23 13:08:11 +0000 2013,The weather is just fabulous today, people have been dining al fresco all afternoon :) we are open til 11 pm this evening, come join us!
305289048736546800,Sat Feb 23 12:12:35 +0000 2013,Our family travelled through four continents, cooking food which has resulted in Flames http://t.co/BH1qI8Z0f0  #food
305287333228458000,Sat Feb 23 12:05:46 +0000 2013,@Kmonsurate enjoy!!!
305281904318488600,Sat Feb 23 11:44:12 +0000 2013,@ratethatcurry thank you :)
305252775380541440,Sat Feb 23 09:48:27 +0000 2013,@AaronIFA glad you enjoyed :)
305252738248359940,Sat Feb 23 09:48:18 +0000 2013,RT @AaronIFA: Went to @FlamesGrillJLT last night.The best curry we've had so far in Dubai by a long way.(Chicken Madras,Mutton Dopiaza)  ...
305252718304432100,Sat Feb 23 09:48:14 +0000 2013,@Jabeen_H should be fine, look forward to seeing you :)
305207512498573300,Sat Feb 23 06:48:36 +0000 2013,RT @arabiaenquirer: BREAKING: Man walking purposefully around gym without touching equipment for about 45 minutes now http://t.co/DGJj3Vrh3M
305201606398451700,Sat Feb 23 06:25:07 +0000 2013,Weather is perfect for curry on the terrace :) #flames #jlt #food
305198160882565100,Sat Feb 23 06:11:26 +0000 2013,@Kmonsurate look forward to seeing you today then :)
305197750339907600,Sat Feb 23 06:09:48 +0000 2013,@uaert thanks :)
305195559038353400,Sat Feb 23 06:01:06 +0000 2013,We are open from 12.30 today, you can find our menu and location information on our site http://t.co/GcR6JO1cbd  #jlt #food
305193052270637060,Sat Feb 23 05:51:08 +0000 2013,@shielarizza Good Morning to you too :)
305192767229919200,Sat Feb 23 05:50:00 +0000 2013,You can find us on FB too :) http://t.co/4rqc8nRDI3  #fb #food #dubai
305192605073960960,Sat Feb 23 05:49:21 +0000 2013,Good Morning, we will be open from 12.30 today :)  http://t.co/gFUdEA7XBf http://t.co/lsiPYcPtZ1
305190391811014660,Sat Feb 23 05:40:34 +0000 2013,Good Morning :)
304984136706306050,Fri Feb 22 16:00:59 +0000 2013,We are open late this evening, find our menu at http://t.co/GcR6JO1cbd #food #jlt
304983949053157400,Fri Feb 22 16:00:14 +0000 2013,RT @DevinaDivecha: @FlamesGrillJLT Thank you :) He enjoyed his birthday lunch!
304917324937449500,Fri Feb 22 11:35:30 +0000 2013,@DevinaDivecha Happy Birthday Karan! Thank you for sharing your day with FlamesGrillJLT
304845900033957900,Fri Feb 22 06:51:40 +0000 2013,We are also on FB, don't forget to like our page :) http://t.co/4rqc8nRDI3  #flames #jlt
304836384894619650,Fri Feb 22 06:13:52 +0000 2013,We open at 12.30 today, dining al fresco will be lovely today :) http://t.co/GcR6JO1cbd  #food #jlt
304820315161235460,Fri Feb 22 05:10:01 +0000 2013,Morning Flamers!! hope you have a flaming hot weekend :)
304603127078875140,Thu Feb 21 14:46:59 +0000 2013,Seems all everyone can talk about is the Stone Roses gig, have a great night everyone :)
304596155822641150,Thu Feb 21 14:19:17 +0000 2013,You can find our contact info, location and menu all on our website http://t.co/GcR6JO1cbd #food #jlt
304596035290923000,Thu Feb 21 14:18:48 +0000 2013,It's the weekend and we shall be open late this evening, serving doners to all you party goers who will going to Stone Roses :)
304585104313950200,Thu Feb 21 13:35:22 +0000 2013,RT @DevinaDivecha: My post on @FlamesGrillJLT was included in @sandierpastures' Blog Carnival! http://t.co/nry6B9li25 #Dubai
304571483718549500,Thu Feb 21 12:41:15 +0000 2013,Flames gets a mention in Sandier Pastures blog today thanks to Devina for this :) http://t.co/506dnkJAnD
304570971241717760,Thu Feb 21 12:39:12 +0000 2013,Menu information can be found on the website http://t.co/GcR6JO1cbd  #food #jlt
304570575580446700,Thu Feb 21 12:37:38 +0000 2013,@DevinaDivecha @sandierpastures wow that's amazing!! thank  you Sandierpastures :)
304558982415142900,Thu Feb 21 11:51:34 +0000 2013,We are open late this evening, it's the weekend after all :) call 04 452 6664 for delivery :) #food #jlt
304528302671028200,Thu Feb 21 09:49:39 +0000 2013,You can find our menu of curries,  kebabs and grills on our website  http://t.co/GcR6JO1cbd
304516476830896100,Thu Feb 21 09:02:40 +0000 2013,Afternoon All :)
304477111815634940,Thu Feb 21 06:26:15 +0000 2013,@amylouskywalker glad you enjoyed, that is one of our favourites too :)
304476021435027460,Thu Feb 21 06:21:55 +0000 2013,Don't forget you can find us on FB too :) http://t.co/4rqc8nRDI3  #flames #jlt #curry #kebab
304465950172917760,Thu Feb 21 05:41:53 +0000 2013,RT @callumdxb: @GeordieArmani @juansalonjlt this is just not good enough :)
304465722757763100,Thu Feb 21 05:40:59 +0000 2013,RT @GeordieArmani: I think a trip to @juansalonjlt followed by @FlamesGrillJLT is in order :) #jlt
304462000589783040,Thu Feb 21 05:26:12 +0000 2013,RT @SheikhDubai1: @FlamesGrillJLT @GeordieArmani @foodindubai def good decision to come over..donor &amp; service was excellent #dubai # ...
304457774350340100,Thu Feb 21 05:09:24 +0000 2013,Another fabulous day for dining al fresco :) http://t.co/GcR6JO1cbd  #food #jlt
304442829055340540,Thu Feb 21 04:10:01 +0000 2013,Good Morning Flamers :) http://t.co/O1PoNxPab0
304313037345677300,Wed Feb 20 19:34:16 +0000 2013,@amylouskywalker hey Amy hope you enjoyed both?? More the food ;) cheers
304310576430059500,Wed Feb 20 19:24:29 +0000 2013,@SheikhDubai1 @geordiearmani @foodindubai hey it was great having U both over tonight :) see you again soon
304258095750737900,Wed Feb 20 15:55:57 +0000 2013,@amylouskywalker enjoy :) thanks for choosing Flames
304257993929797600,Wed Feb 20 15:55:33 +0000 2013,@SheikhDubai1 @GeordieArmani @foodindubai we look forward to seeing you at Flames
304223345895948300,Wed Feb 20 13:37:52 +0000 2013,Gearing up for the dinner time rush! hope to see you soon in Flames Grill JLT http://t.co/RovRbIJN #food #dubai #jlt
304215097977483260,Wed Feb 20 13:05:06 +0000 2013,Our doner kebab :) http://t.co/90EuO0Qv
304207263428653060,Wed Feb 20 12:33:58 +0000 2013,Check out our menu information, we are open until 11.30 this evening http://t.co/GOThaOdb
304124606745284600,Wed Feb 20 07:05:31 +0000 2013,RT @shielarizza: Good Morning... Have a good start ☀
304118189346918400,Wed Feb 20 06:40:01 +0000 2013,We love spices :) http://t.co/v5dbxSSb
304111971530317800,Wed Feb 20 06:15:18 +0000 2013,We are located right next to the JLT Metro, find our map here http://t.co/Qzui8mWR  #jlt #food #dubai
304107934139441150,Wed Feb 20 05:59:16 +0000 2013,Don't forget to check our FB page out :) http://t.co/qctK7TWv  #flames #jlt #food
304080440791281660,Wed Feb 20 04:10:01 +0000 2013,Good Morning Flamers :) what do you fancy today?
303897828097404900,Tue Feb 19 16:04:23 +0000 2013,We are open, you can find our menu at http://t.co/RovRbIJN #food #jlt #curry
303884260438310900,Tue Feb 19 15:10:28 +0000 2013,RT @TheCurryGuy: Mmmm! Slow roasted belly pork with vindaloo style sauce. http://t.co/gbOFFhHg
303884184936648700,Tue Feb 19 15:10:10 +0000 2013,@Khaledtron looks nice :)
303884010248106000,Tue Feb 19 15:09:28 +0000 2013,RT @HotelierME: FIRST LOOK: Crowne Plaza Dubai-Deira Royal Suite: Crowne Plaza hotel reopens its newly-renovated two-storey Royal Suite  ...
303879836533936100,Tue Feb 19 14:52:53 +0000 2013,RT @CinnabonUAE: @shielarizza @Barrio_Fiesta @FlamesGrillJLT @800SOY @ChinaGardenUAE @KitschCupcakes @Iheartoushe @justfalafel  That's o ...
303879788559466500,Tue Feb 19 14:52:42 +0000 2013,RT @T_in_DXB: Lovely little birthday dinner at @FlamesGrillJLT with @KTDubai, @BrianSigafoos @ykafafi and @CandiceHowe. Thanks all xx
303879676621910000,Tue Feb 19 14:52:15 +0000 2013,What's your favourite dish? http://t.co/RovRbIJN  #flames #jlt
303878586115436540,Tue Feb 19 14:47:55 +0000 2013,We are open for dining-in, takeaway and delivery,  just give us a call on 04 452 6664  #flames #jlt
303825682989994000,Tue Feb 19 11:17:42 +0000 2013,Afternoon Flamers, weather is perfect for a kebab on our terrace :) #flames #jlt
303766290429014000,Tue Feb 19 07:21:42 +0000 2013,@SaraInDubai we open in just over an hour :)
303726398936330240,Tue Feb 19 04:43:11 +0000 2013,Don't forget to check out our FB page too :) http://t.co/qctK7TWv  #fb #flames #jlt
303726112876421100,Tue Feb 19 04:42:02 +0000 2013,You can find our menu on our website, we travelled four continents to bring you the unique flavours that is... http://t.co/zi14z7qO
303718051893870600,Tue Feb 19 04:10:01 +0000 2013,Morning Flamers :)
303708866057740300,Tue Feb 19 03:33:30 +0000 2013,RT @shielarizza: @ChinaGardenUAE @barrio_fiesta @flamesgrilljlt @800soy @cinnabonuae @kitschcupcakes @iheartoushe @justfalafel haha u bet!
