id,created_at,text
763153807626866700,Tue Aug 09 23:23:41 +0000 2016,RT @ArtemisFp: @GalbraithforVT Ed Stanak closing the day in #Barre #VT #ElectionResults https://t.co/DvnaKbvhqO
763125327912661000,Tue Aug 09 21:30:31 +0000 2016,On my way back down state. Stopped in Bellows Falls and saw Monte Barnett #vtpoli https://t.co/5sGohG5P0e
763102582562656300,Tue Aug 09 20:00:08 +0000 2016,ICYMI - I wrote an op-ed calling on Vermonters to reject outside spending with their vote on Tuesday. #vtpoli https://t.co/bvSAhIomOh
763075672306745300,Tue Aug 09 18:13:12 +0000 2016,Dropped by Montpelier City Hall with Howard Coffin. #vtpoli https://t.co/4Ev8lAenrL
763075079915835400,Tue Aug 09 18:10:50 +0000 2016,Just five hours left to reject outside spending in VT. Make your voice heard at the ballot box. https://t.co/25W5Q5xJ8X
763060045953196000,Tue Aug 09 17:11:06 +0000 2016,Dunne is not Bernie Sanders. Bernie rejected the billionaires. A billionaire is paying for Dunne ads and Dunne won't reject it. #vtpoli
763042380991782900,Tue Aug 09 16:00:54 +0000 2016,Minter SuperPac funded by wind developers is classic pay to play. Don't want this in Vt.
763029045407785000,Tue Aug 09 15:07:55 +0000 2016,Greeting voters at the polls in Brattleboro #vtpoli https://t.co/O9QPbrO3wU
762992732273074200,Tue Aug 09 12:43:37 +0000 2016,Getting ready to go vote in Townshend #vtpoli https://t.co/eNvlRHxaef
762986846943006700,Tue Aug 09 12:20:14 +0000 2016,It’s primary day. Join me in the fight for economic justice. Look up your polling location #vtpoli &gt;&gt; https://t.co/LHSfFtL8uK #vtpoli
762734097265549300,Mon Aug 08 19:35:54 +0000 2016,RT @ReneeMyNBC5: @GalbraithforVT speaking to #BTV seniors ahead of tomorrow's #vtpoli primary-details @WPTZ https://t.co/5QwIB0FaVd
762727750666977300,Mon Aug 08 19:10:41 +0000 2016,Great to stop by Champlain Senior Center this morning to GOTV. #vtpoli
762053349793341400,Sat Aug 06 22:30:51 +0000 2016,Wind developer Blittersdorf is using VCV SuperPAC to give Minter more money than allowed under campaign finance limits. Corruption VT style.
762048008515153900,Sat Aug 06 22:09:38 +0000 2016,Unbelievable. Minter has two super PACs funded by wind developers. https://t.co/Hu6hraWFYU
762008052035752000,Sat Aug 06 19:30:51 +0000 2016,“Galbraith Challenges the Status Quo.” Check out this LTE by my friend, John Moran #vtpoli https://t.co/imgbAZGNF0
761938066600783900,Sat Aug 06 14:52:45 +0000 2016,The outside $ flooding the final days of the primary is unprecedented. We can send a message. My op-ed &gt;&gt; https://t.co/bvSAhI6LWJ #vtpoli
761655377083654100,Fri Aug 05 20:09:27 +0000 2016,RT @aprilburbank: .@GalbraithforVT picks up support from Sen. John Rodgers &amp; Sen. Robert Starr, who served w/ Galbraith in VT Senate #vtpoli
761570411297529900,Fri Aug 05 14:31:50 +0000 2016,It is the height of hypocrisy to return $20k in corporate money and then do nothing about $100k+ of outside spending on your behalf #vtpoli
761244385342292000,Thu Aug 04 16:56:19 +0000 2016,I’m running for governor to fight inequality. A $15 min wage, 4 yrs free tuition, close $28m spec interest tax breaks #vprdebateweek #vtpoli
761237075903537200,Thu Aug 04 16:27:16 +0000 2016,I was the only elected in VT to propose legislation to pay for single payer. VTers can count on me to move forward with HC for all #vtpoli
761233204842000400,Thu Aug 04 16:11:53 +0000 2016,My position is crystal clear. I’m opposed to all new industrial wind projects. #vprdebateweek #vtpoli
761232189543579600,Thu Aug 04 16:07:51 +0000 2016,RT @vermontedition: Mic check w/ candidates (L-R)  @GalbraithforVT @mattdunnevt &amp; @SueMinterVT in our Montpelier studio #vprdebateweek http…
761186197955760100,Thu Aug 04 13:05:06 +0000 2016,Listen to @vprnet at noon. I’ll be highlighting the differences on the issues with my Democratic competitors #vtpoli https://t.co/dkpqC4DaYM
760992435459719200,Thu Aug 04 00:15:09 +0000 2016,Raising the minimum wage benefits low-wage workers, businesses and our economy. Great day on the trail. #vtpoli  https://t.co/ANNX1wSln1
760640198313115600,Wed Aug 03 00:55:29 +0000 2016,Everything in my platform is based on progressive issues I fought for in the Senate - my positions don’t just change with the wind. #vtpoli
760637724160356400,Wed Aug 03 00:45:40 +0000 2016,ICYMI @WPTZ on my universal healthcare plan, “this is a big idea dividing GOP and Dems for Governor,” #vtpoli https://t.co/3Vdno9OnEJ
760635305905033200,Wed Aug 03 00:36:03 +0000 2016,My budget will end corporate giveaways. In the Senate, I opposed every one. #vtpoli https://t.co/LO7aMM3Aye
760631277062004700,Wed Aug 03 00:20:02 +0000 2016,Vermonters want a governor who will present bold, progressive policies. And level with voters about how to pay for them. #vtpoli
760630036063891500,Wed Aug 03 00:15:07 +0000 2016,My Senate record; against every special interest tax break, corporate giveaway. Only elected to propose leg to pay for single-payer. #vtpoli
760624999573008400,Tue Aug 02 23:55:06 +0000 2016,About to go live at the @VermontPBS debate. Tonight I'll demonstrate the choices that voters will make at the ballot box in 7 days. #vtpoli
760520686423027700,Tue Aug 02 17:00:36 +0000 2016,Tune in to the @VermontPBS debate at 8pm. I’ll make the case for why I’m the progressive choice for gov. #vtpoli https://t.co/Z7yVEkzYot
760481314302722000,Tue Aug 02 14:24:09 +0000 2016,On WDEV with Mike Smith. Tune in now to hear us discuss my vision for Vermont. #vtpoli https://t.co/19bEL9h2b9
760116657511538700,Mon Aug 01 14:15:08 +0000 2016,I'm not running for governor just to be governor. I'm running for governor to do something for Vermont. #vtpoli  https://t.co/ALpzWgLwwL
759479467127541800,Sat Jul 30 20:03:10 +0000 2016,Great day on the trail with my friend John Moran at the Blueberry Parade in Dover #vtpoli https://t.co/dUXwWCbOc0
759434400329240600,Sat Jul 30 17:04:05 +0000 2016,RT @BKeith25: @GalbraithforVT Peter and John Moran in #VT Blueberry Parade https://t.co/ZjM6eae8Ie
759165110363488300,Fri Jul 29 23:14:01 +0000 2016,Thanks @mattdunnevt for standing w VT towns against corporate wind. He hasn't changed position on wind. Made clear what he's said at forums
759131639813333000,Fri Jul 29 21:01:01 +0000 2016,Excited to celebrate blueberry season in Dover tomorrow by marching in the Blueberry Parade. Join us &gt;&gt;  https://t.co/OJh1OLj8ib #vtpoli
759056196108111900,Fri Jul 29 16:01:14 +0000 2016,VTers want a governor who will put forward a bold, progressive agenda. I've leveled with voters about how to accomplish it. #vtpoli
759027258715668500,Fri Jul 29 14:06:15 +0000 2016,At #DNCinPHL @HillaryClinton said she wants to follow the money so corporations &amp; wealthy pay fair share. This is my program for VT #vtpoli
758996337039843300,Fri Jul 29 12:03:22 +0000 2016,Khizir Khan's offered Trump his copy of the constitution. Recommend he read 1st and 14th amendments. Not long, Donald, but important.
758429314849214500,Wed Jul 27 22:30:14 +0000 2016,Tonight on @wcax, I laid out the choice ahead for voters. I’m the most progressive candidate and I'll stand up to special interests. #vtpoli
758412915158290400,Wed Jul 27 21:25:04 +0000 2016,We’re about to go live on @WCAX! #vtpoli  https://t.co/RdhW708Ywz
758388076221755400,Wed Jul 27 19:46:22 +0000 2016,.@billclinton gave a great speech last night. Proud to have been his Ambassador ending Europe’s deadliest wars since 1945. #vtpoli
758387094972665900,Wed Jul 27 19:42:28 +0000 2016,Amazing speeches at #DNCinPHL. Expect to hear @FLOTUS' words again at RNC in 2020 #vtpoli
758376542728704000,Wed Jul 27 19:00:32 +0000 2016,I’ll stand up to special interests by limiting their influence in the legislature and banning corporate campaign contributions. #vtpoli
758342502642364400,Wed Jul 27 16:45:16 +0000 2016,Great turnout at our house party in West Burke last night. Thanks to all who joined. #vtpoli https://t.co/TaWOpV8QRr
756909685878423600,Sat Jul 23 17:51:46 +0000 2016,RT @kevinfreile: Awesome start to our #GOTV weekend in #montpelierVT and #burlingtonVT @GalbraithforVT #VTDEMs #vtgov #vtpoli https://t.co/…
756502488317067300,Fri Jul 22 14:53:43 +0000 2016,In Montpelier, special interests too often win over the public interest. Write up of my plan to fix that &gt;&gt; https://t.co/Zj4ZteIXwP  #vtpoli
756111567771447300,Thu Jul 21 13:00:20 +0000 2016,Too often, powerful special interests win out over the public interest. As Governor, I’ll change that. #vtpoli https://t.co/LzM9ZncNva
755869998149541900,Wed Jul 20 21:00:25 +0000 2016,Join us Saturday to kick off GOTV around Vermont. #vtpoli https://t.co/ELWBnH8hI7
755839892702146600,Wed Jul 20 19:00:47 +0000 2016,We've seen what happens when the governor and corporations get too cozy. It's time to take a stand. https://t.co/2Gc6mJLNnh #vtpoli
755816267987189800,Wed Jul 20 17:26:55 +0000 2016,RT @kevinfreile: Great discussion with @GalbraithforVT and the Bellows Falls Senior Advisory Council #VTDEMs #vtgov #vtpoli https://t.co/cH…
755561348302504000,Wed Jul 20 00:33:57 +0000 2016,RT @vtclimateecon: If you want a #vtgov who will fight for #economicjustice, I'm your choice. -@GalbraithforVT #vtpoli
755552955445588000,Wed Jul 20 00:00:36 +0000 2016,My college affordability plan: 4 yrs free tuition at VSCs. Paid for by closing special interests tax breaks #VTClimateEconomy #vtpoli
755550312711147500,Tue Jul 19 23:50:06 +0000 2016,I was the only elected official in VT to propose legislation to pay for universal health care. I’m committed to that goal #VTClimateEconomy
755543016887103500,Tue Jul 19 23:21:07 +0000 2016,Elections are about choice. I'm the candidate who will stand up to powerful special interests. #VTClimateEconomy #vtpoli
755541423840198700,Tue Jul 19 23:14:47 +0000 2016,RT @vtclimateecon: .@GalbraithforVT says stop corporate tax breaks. @BruceLisman says #nonewtaxes #vtpoli
755536478839550000,Tue Jul 19 22:55:08 +0000 2016,Getting ready to go live on @VermontPBS for @VTRuralDev's #VTClimateEconomy forum. Tune in &gt;&gt; https://t.co/qdQVv3GY8I #vtpoli
755432423521980400,Tue Jul 19 16:01:39 +0000 2016,Looking forward to speaking about my vision on the #VTClimateEconomy tonight. #vtpoli  https://t.co/k2OpmgP6lh
755386818065870800,Tue Jul 19 13:00:26 +0000 2016,When corporations get too cozy with the governor, it hurts working VTers. My ad shows how I’ll fix that. #vtpoli https://t.co/fTocujdqUU
755209831288569900,Tue Jul 19 01:17:09 +0000 2016,Unprecedented intolerance tonight at #RNCinCLE #vtpoli
755209665441632300,Tue Jul 19 01:16:30 +0000 2016,Incredible display of hatred, nativism and extremism at #RNCinCLE. Nothing like this from a major political party before. #vtpoli
755145158996275200,Mon Jul 18 21:00:10 +0000 2016,Vermont needs a governor who stands up for working families - not the corporations. That’s what I’ve always done. #vtpoli
755114990281994200,Mon Jul 18 19:00:17 +0000 2016,New ad is up. Cozying up to special interests has hurt VTers. I’ll fight for you - not the corporations.  #vtpoli https://t.co/2Gc6mJLNnh
755048620311863300,Mon Jul 18 14:36:33 +0000 2016,RT @erin_vt: We are live streaming our interview this morning with @GalbraithforVT. #vtpoli https://t.co/FabPM7kjFe
755039512175059000,Mon Jul 18 14:00:22 +0000 2016,As a Senator I opposed every corporate subsidy. As Governor, I’ll work for you - not the corporations. #vtpoli https://t.co/fTocujdqUU
754677153589895200,Sun Jul 17 14:00:29 +0000 2016,Great energy in the Northeast Kingdom yesterday. Thanks to all who joined #vtpoli https://t.co/cevZvfaNOf
754410357293256700,Sat Jul 16 20:20:20 +0000 2016,#BTV canvass team debriefing. Join our growing team #vtpoli &gt;&gt; https://t.co/eJZcBWsCoP https://t.co/j4SQvkJVBr
754374442772561900,Sat Jul 16 17:57:37 +0000 2016,RT @BKeith25: @GalbraithforVT Peter with the cavalry at Stars and Stripes #lyndonville #VT https://t.co/VglVg2tSdM
754327886560170000,Sat Jul 16 14:52:37 +0000 2016,RT @kevinfreile: And @GalbraithforVT is off!! https://t.co/hQR3qsFKKx
754314795873099800,Sat Jul 16 14:00:36 +0000 2016,Good morning Lyndonville! #vtpoli https://t.co/3jEcbqHp0G
754309741657010200,Sat Jul 16 13:40:31 +0000 2016,US should condemn coup. Wishy washy response undermines democracy and our credibility.
754309592335589400,Sat Jul 16 13:39:55 +0000 2016,I know Erdogan. Once a democrat and peacemaker; now the sultan.
754309413574369300,Sat Jul 16 13:39:13 +0000 2016,Erdogan has become a disaster for Turkey and Syria. Coup makes it worse.
754066241636143100,Fri Jul 15 21:32:56 +0000 2016,In Putney for another great event. Thanks to all who joined us to talk about the issues. #vtpoli https://t.co/6vb69TMT7f
753981835126902800,Fri Jul 15 15:57:32 +0000 2016,Check out my op-ed on my Free College Tuition Plan in @bfp_news. #vtpoli  https://t.co/tTuSiuvg23
753967476770091000,Fri Jul 15 15:00:29 +0000 2016,I believe healthcare is a human right. That’s why I unveiled a plan for universal healthcare this week. #vtpoli https://t.co/47nfSy5utV
753937292146774000,Fri Jul 15 13:00:32 +0000 2016,RT &amp; Like if you agree - any serious health care plan comes with a way to pay for it. https://t.co/f5Gf9yarUI #VTPoli
753574891220115500,Thu Jul 14 13:00:29 +0000 2016,.@WPTZStewart on my universal healthcare plan, “this is a big idea dividing GOP and Dems for Governor,” #vtpoli https://t.co/3Vdnoa5Ywh
753368809805930500,Wed Jul 13 23:21:35 +0000 2016,And it comes with a plan to pay for it. See more from @WPTZ #vtpoli  https://t.co/5QCAf7QwEz
753362849607585800,Wed Jul 13 22:57:54 +0000 2016,Thank you Bruce and Mary for hosting us in Essex Junction #vtpoli https://t.co/3xulJiO3MN
753273564569083900,Wed Jul 13 17:03:07 +0000 2016,Today I announced my plan for universal health care. Including how to pay for it. Read here: https://t.co/VILVhznCqv #vtpoli
752533093701922800,Mon Jul 11 16:00:45 +0000 2016,Check out our next spot on my commitment to universal health care. #vtpoli https://t.co/9fY6YA9D4O
752501519640059900,Mon Jul 11 13:55:17 +0000 2016,Spoke with @nealgoswami about my progressive agenda for Vermont. #vtpoli https://t.co/rHgpF2VhPr
752140463847510000,Sun Jul 10 14:00:35 +0000 2016,Elections are about choice - tax breaks for special interests or 4 yrs tuition free at VSCs? #vtpoli https://t.co/GJdoBzbBEi
751902399137185800,Sat Jul 09 22:14:36 +0000 2016,I'm with @POTUS. When we say black lives matter, we don’t mean blue lives don’t matter. https://t.co/CiM5lO8Mw9
751853177524392000,Sat Jul 09 18:59:00 +0000 2016,Spoke with the @StoweReporter about why we need to get rid of tax breaks for private jets. RT if you agree #vtpoli https://t.co/dMmFgXDfAp
751816612349612000,Sat Jul 09 16:33:43 +0000 2016,Pleased to see Dems add a $15 minimum wage to the platform. As Gov, it will be the first law that I propose #vtpoli https://t.co/acn4v4pKQC
751476058889658400,Fri Jul 08 18:00:28 +0000 2016,The videos of killlings in Baton Rouge, Minnesota and Dallas this week are shocking. Human life is special.
751435940401324000,Fri Jul 08 15:21:03 +0000 2016,Admiring the courage of officers who ran toward the gunmen to save lives. Grateful for the service of law enforcement in VT &amp; elsewhere.
751435722020626400,Fri Jul 08 15:20:11 +0000 2016,Thinking of the families and colleagues of the police officers gunned down in Dallas last night.
751097503936761900,Thu Jul 07 16:56:14 +0000 2016,.@jess_aloe @bfp_news thanks for having me on to talk about my plans as Governor.
751084557261279200,Thu Jul 07 16:04:47 +0000 2016,We're live on @bfp_news' The Table. Tune in. #vtpoli https://t.co/BaaaKnEH3l…/thetablepetergalbraith
751030541625880600,Thu Jul 07 12:30:09 +0000 2016,Had a great time canvassing last night in Montpelier. #vtpoli https://t.co/wpFv79o5Xx
750781456205488100,Wed Jul 06 20:00:22 +0000 2016,Paid for by Galbraith for Vermont. Not the Special Interests. https://t.co/57ReL7bj0c #vtpoli
750688545136840700,Wed Jul 06 13:51:10 +0000 2016,ICYMI: We released our first ad on my plan to fight for bold priorities for Vermonters. #vtpoli https://t.co/32zAl7aFSl
750407722143584300,Tue Jul 05 19:15:17 +0000 2016,My first ad highlights my career standing up to the powerful — That's what I’ll do as Governor. Watch &gt;&gt; https://t.co/57ReL7bj0c #vtpoli
750360465944023000,Tue Jul 05 16:07:30 +0000 2016,"I don’t like people who throw around power. I’ve always sided with the underdogs. That’s been my career” #vtpoli https://t.co/vAOkdzSorF
749316980356751400,Sat Jul 02 19:01:04 +0000 2016,Great start to the 4th of July weekend. Thanks for the support, Brandon. #vtpoli https://t.co/Zz3ijAk9zC
749010886753415200,Fri Jul 01 22:44:46 +0000 2016,Ready for a weekend packed with parades. #VTpoli Walk with our team &gt;&gt;  https://t.co/eJZcBWsCoP https://t.co/vxIzNfxsLO
748524099404595200,Thu Jun 30 14:30:26 +0000 2016,.@OpenMikeWDEV @WDEVRadio thanks for having me on to talk about the issues. #vtpoli
748283103894999000,Wed Jun 29 22:32:49 +0000 2016,RT @vermontedition: Meet The Candidates: Peter Galbraith https://t.co/7akvRPGYYP #VT https://t.co/va2auBdyBM
748263771320238100,Wed Jun 29 21:15:59 +0000 2016,Looking forward to talking about the bold priorities I’ll fight for in VT &amp; NEK tonight. Join us at 6pm in Irasburg  https://t.co/d8qLpfnqfO
748220080039702500,Wed Jun 29 18:22:22 +0000 2016,Spoke with @WCAX_Kyle about how as Governor, I'll move forward on single payer health care. And much more. #vtpoli https://t.co/XpHFMlvty8
748199565380091900,Wed Jun 29 17:00:51 +0000 2016,We have a choice to make — tax breaks for special interests or educating young Vermonters. More &gt;&gt; https://t.co/pxs4skO69F
748183059174817800,Wed Jun 29 15:55:16 +0000 2016,ICYMI: Op-Ed in the @RutlandHerald on my Free Tuition Plan for Vermonters. #vtpoli https://t.co/pxs4skO69F
747952180741668900,Wed Jun 29 00:37:50 +0000 2016,Great to chat with old and new friends at tonight's Brattleboro meet and greet. #vtpoli https://t.co/YhPuIzGLgv
747577864627822600,Mon Jun 27 23:50:26 +0000 2016,RT @ReneeWPTZ: TONIGHT: gov candidates talk community health @mattdunnevt @GalbraithforVT @BruceLisman @SueMinterVT @PhilScott4VT https://t…
746348234877075500,Fri Jun 24 14:24:20 +0000 2016,Today’s the first day of early vote. Learn how to exercise your right &gt;&gt; https://t.co/hx9BcvlxOg #vtpoli
745708598160941000,Wed Jun 22 20:02:39 +0000 2016,RT @PeterWelch: Proud to be a part of the sit-in demanding action on gun violence #HoldTheFloor https://t.co/gkhzo2Wd1P
745347536718807000,Tue Jun 21 20:07:55 +0000 2016,“higher education should be a right, not a burden for young Vermonters.” #vtpoli  https://t.co/5RF2uNrufd
745309256199471100,Tue Jun 21 17:35:48 +0000 2016,VEGI has given millions in tax $ to corporations that thank taxpayers by shipping jobs overseas. Not if I'm Governor #vtpoli
745309159990526000,Tue Jun 21 17:35:25 +0000 2016,$2.6m R&amp;D tax break. There's a federal program already. Redundant and no evidence VT's does anything for VTers. Not if I'm Governor #vtpoli
745309062200320000,Tue Jun 21 17:35:02 +0000 2016,$11.5m in tax breaks for capital gains, benefiting high-income VTers. Not if I'm Governor #vtpoli
745308936102830100,Tue Jun 21 17:34:32 +0000 2016,VT investment tax credit - $600k specifically designed to support coal products. Not if I'm Governor #vtpoli
745308566014222300,Tue Jun 21 17:33:03 +0000 2016,I'm going to tweet some of the most egregious taxpayer giveaways to corps, spec interests and the wealthy that my plan eliminates #vtpoli
745302686036287500,Tue Jun 21 17:09:42 +0000 2016,We reward the well off with tax breaks while depriving young VTers opportunities that could change their life. Not if I'm Governor. #vtpoli
745292479071666200,Tue Jun 21 16:29:08 +0000 2016,Today I'm announcing a $45.4m plan to provide free tuition at VSCs, CCV, VTC for every VT HS grad. More &gt;&gt; https://t.co/aGznAamePI #vtpoli
745002835197190100,Mon Jun 20 21:18:12 +0000 2016,We need to reform Vermont’s gun laws. #vtpoli  https://t.co/mk9LIh91ym https://t.co/vMPKgvheTZ
744931727437594600,Mon Jun 20 16:35:38 +0000 2016,RT @vermontedition: Galbraith adds he has called for ban on military-style assault weapons #vtpoli
744930896181092400,Mon Jun 20 16:32:20 +0000 2016,On @vermontedition: As Governor, I’ll ban military style assault weapons, and mandate background checks for private sales. #vtpoli
744926975102427100,Mon Jun 20 16:16:45 +0000 2016,On @vermontedition talking about my plan to #raisethewage to $15.  Most important anti-poverty program &amp; will save taxpayers money. #vtpoli
744902347319611400,Mon Jun 20 14:38:53 +0000 2016,I'll be on @vermontedition at noon talking about how as Gov, I'll fight for bold priorities for VT families. #vtpoli https://t.co/viJwL3FV45
744899343015100400,Mon Jun 20 14:26:57 +0000 2016,RT @vermontedition: .@GalbraithforVT will be on the show today. Do you have any questions? Let us know &amp; listen live at noon. #vtpoli  http…
744556863736283100,Sun Jun 19 15:46:04 +0000 2016,Today, like every day, I miss my father - but I'm proud to carry on his legacy. Happy Father’s Day. https://t.co/huepxAtYBL
744556627622166500,Sun Jun 19 15:45:07 +0000 2016,My father embodied the values that shaped me—not being afraid to challenge the conventional wisdom, and standing up for the underdog.
743974488182755300,Sat Jun 18 01:11:55 +0000 2016,Great to speak at the @VTdems Curtis Awards Dinner. Let's bring the fight for economic justice. #vtpoli https://t.co/zJTTP5qXLc
743225364189700100,Wed Jun 15 23:35:09 +0000 2016,RT @paulheintz: I bought an AR-15 Monday in a Five Guys parking lot. No background check. No questions asked. Just $500 cash. https://t.co/…
743134736290353200,Wed Jun 15 17:35:02 +0000 2016,About to begin @vprnet's AMA.  Click the link to ask me anything - #vtpoli https://t.co/5aapzmkZpy https://t.co/dchyiu6kkK
743132636361728000,Wed Jun 15 17:26:41 +0000 2016,RT @taylordobbs: Join in the reddit AMA with @GalbraithforVT: https://t.co/kQkkw6ISCd #vtpoli
743090757049929700,Wed Jun 15 14:40:17 +0000 2016,RT @lseconnors: Have a question for @GalbraithforVT? Ask it today during @vprnet first @reddit AMA #vtpoli  https://t.co/mRLtlkSjW6
742841885195128800,Tue Jun 14 22:11:21 +0000 2016,RT @DaveSilberman: .@GalbraithforVT opens the evening with a call for $15 minimum wage
742721078682849300,Tue Jun 14 14:11:18 +0000 2016,RT @taylordobbs: .@vprnet and /r/vermont are holding AMAs with candidates for VT governor. @galbraithforVT is tomorrow. https://t.co/6bu2if…
742433941026680800,Mon Jun 13 19:10:19 +0000 2016,We can’t have the same story repeated over and over again and then do nothing. As Gov I'll ban military style assault weapons. #vtpoli
742075411165773800,Sun Jun 12 19:25:39 +0000 2016,RT @RightsVT: Thanks so much to the candidates at #VTGovPanel who participated in such a great discussion on VT's future. https://t.co/sHj3…
742061235848482800,Sun Jun 12 18:29:20 +0000 2016,RT @WhiteHouse: “We stand with the people of #Orlando who have endured a terrible attack on their city." —@POTUS https://t.co/i7fOS3qhYh
742022674940108800,Sun Jun 12 15:56:06 +0000 2016,Our hearts go out to the families of those killed and injured in Orlando, the LGBT community and victims of gun violence everywhere.
740957797639196700,Thu Jun 09 17:24:39 +0000 2016,Live on @WDEVRadio. The role of government is to side with the underdog. As Governor, I’ll do that. #vtpoli
740948456945164300,Thu Jun 09 16:47:32 +0000 2016,I’ll be going on WDEV at 1 to talk with @TheReluctantPol. Tune in! https://t.co/1LqaLdrTDz
739978026184806400,Tue Jun 07 00:31:24 +0000 2016,Great to be in my home district talking about issues that matter to working Vermonters. Thanks for hosting @WindhamDems &amp; VT-NEA. #vtpoli
739958140293263400,Mon Jun 06 23:12:23 +0000 2016,My parents taught me to stand up for the underdog. It's what I've always done &amp; what I'll do as your Gov #vtpoli https://t.co/u71iSv13jC
739113615576301600,Sat Jun 04 15:16:32 +0000 2016,Lots of moo-mentum after talking to voters at Strolling of the Heifers. Join us &gt;&gt; https://t.co/eJZcBWb10f #vtpoli https://t.co/tg0acJbbOA
739099997183037400,Sat Jun 04 14:22:25 +0000 2016,Good morning, Brattleboro! https://t.co/sG2Zy9IqZ7
738850306889551900,Fri Jun 03 21:50:14 +0000 2016,Join us tomorrow in Brattleboro for the Strolling of the Heifers Parade. https://t.co/wS0UInfpee
738827716594704400,Fri Jun 03 20:20:29 +0000 2016,Last year, VT Govt gave a $4m tax break for products sold on “the cloud." Not my administration. #vtpoli  https://t.co/m1WyMeZe6m
738438622874046500,Thu Jun 02 18:34:21 +0000 2016,38 years ago I met with President Carter. My role model in high stakes peace making. #vtpoli #TBT https://t.co/Cf4L4hf6MK
738128076056338400,Wed Jun 01 22:00:21 +0000 2016,Thank you to our supporters who helped us hit our May goal. Help keep the momentum going &gt;&gt; https://t.co/WR64LS2BAa
738074338377781200,Wed Jun 01 18:26:49 +0000 2016,Great to talk about my platform with @VSEAUnite members at today’s forum. As Gov, I’ll always have our state employees' backs. #vtpoli
737791276637126700,Tue May 31 23:42:02 +0000 2016,RT @RightsVT: On racism, @GalbraithforVT says Vermont must be welcoming to Syrian refugees. #VTGovPanel #VTPoli
737774567016566800,Tue May 31 22:35:38 +0000 2016,Great to be at another @RightsVT Forum, talking about my plan to promote economic justice #vtpoli https://t.co/rJJVBRq3Cc
737769224224018400,Tue May 31 22:14:24 +0000 2016,RT @RightsVT: Montpelier #VTGovPanel kicking off now with opening statements from @mattdunnevt, @GalbraithforVT, and @SueMinterVT. https://…
737378295336034300,Mon May 30 20:21:00 +0000 2016,Grateful for our vets and their families in VT &amp; all over the world. Thanks Middlebury and Vergennes for having us. https://t.co/GxTRGYJUzv
737312292379861000,Mon May 30 15:58:43 +0000 2016,Here we go, Vergennes. https://t.co/LSbEEtRQSX
