id,created_at,text
737283781195878400,Mon May 30 14:05:26 +0000 2016,Had a great time talking to folks at the Middlebury parade. Next stop: Vergennes! https://t.co/2sFzF4gWPn
737267658979192800,Mon May 30 13:01:22 +0000 2016,Ready to march in Middlebury! https://t.co/mTBxPXW03g
737267213925748700,Mon May 30 12:59:36 +0000 2016,On Memorial Day, thinking of our  service members who put themselves in harm’s way to help others escape tyranny and oppression.
735893490047979500,Thu May 26 18:00:54 +0000 2016,100’s of protesters shut down McDonalds HQ yesterday, but Vermont can act now. Time to #RaisetheWage to $15. #vtpoli https://t.co/lRnvY6eGIQ
735610875323764700,Wed May 25 23:17:54 +0000 2016,Had a great chat with business leaders at the VT Chamber Expo about refocusing our economic development policy
735532555445907500,Wed May 25 18:06:41 +0000 2016,It's official. I'm running for governor. Be part of the team &gt;&gt; https://t.co/arHU6NjWjk #vtpoli https://t.co/j7aQmSxMLp
735520707300491300,Wed May 25 17:19:36 +0000 2016,RT @wcax: Our @evamckend talks politics with #Vt gubernatorial candidate Peter @GalbraithforVT https://t.co/4VBSlHySo7 https://t.co/n3SD4q0…
735402298596307000,Wed May 25 09:29:05 +0000 2016,RT @evamckend: Good morning from Townshend Dam Diner! This morning on @wcax, Politics, Policy &amp; Pancakes w/ @GalbraithforVT... https://t.co…
735396965790421000,Wed May 25 09:07:54 +0000 2016,Ready to go on @wcax live from the Townshend Dam Diner. #vtpoli https://t.co/jSkH0XBbUv
735256353820844000,Tue May 24 23:49:09 +0000 2016,Tune in to @WCAX at 5 am on tomorrow. I’ll be on Politics, Policy &amp; Pancakes talking about my plan to promote economic justice. #vtpoli
734847415069605900,Mon May 23 20:44:11 +0000 2016,I spoke with 100’s at #VDPCon16 who are ready to make their voice heard. Help us fight for economic justice &gt;&gt; https://t.co/E1NyJSOcB4
734752399819165700,Mon May 23 14:26:37 +0000 2016,"Let’s elect a governor committed to economic justice and fighting inequality.” https://t.co/DCapPGKJtQ
734409883689308200,Sun May 22 15:45:35 +0000 2016,I’ve never taken corporate campaign contributions and never will. Time for VT to ban them.  #VDPCon16
734408831673962500,Sun May 22 15:41:24 +0000 2016,It’s time to end million dollar taxpayer subsidies to large corporations. Join if you agree https://t.co/r0AiN3N0LW #VDPCon16
734394161634398200,Sun May 22 14:43:07 +0000 2016,Getting ready to speak to 100’s of @VTDems about my plan to promote economic justice as Gov. #vtpoli https://t.co/Z6kMUzJDSg
733703942396207100,Fri May 20 17:00:26 +0000 2016,Campaign promises aren’t enough. We need to ban corporate campaign money now. Help us build grassroots support https://t.co/FNwY0ivZjx
733663624372314100,Fri May 20 14:20:13 +0000 2016,VT officials should be accountable to voters - not corporate special interests &amp; their lobbyists. Sign if you agree https://t.co/FNwY0iNAI7
732563955630153700,Tue May 17 13:30:32 +0000 2016,Great to see old friends at last night's @WindhamDems Social https://t.co/JmDWmqqUJM
732563711169331200,Tue May 17 13:29:33 +0000 2016,RT @WindhamDems: Thanks to @GalbraithforVT, @KeshaRam &amp; @DaveZuckermanVT for being the statewide candidates who joined us for last night's…
731542121166086100,Sat May 14 17:50:07 +0000 2016,Great to chat this am in Swanton about protecting our ridgelines and getting corporate money out of politics. https://t.co/fTUimtrv9v
731240903881412600,Fri May 13 21:53:11 +0000 2016,Proud to stand with Verizon Strikers. https://t.co/8Ndfb6Qp5l
731191267418329100,Fri May 13 18:35:57 +0000 2016,I have never taken corporate money. Kudos to @mattdunnevt and @SueMinterVT for returning theirs. #vtpoli
731187909336928300,Fri May 13 18:22:37 +0000 2016,RT @aprilburbank: .@GalbraithforVT: “I am running on the same issues, to do in Vermont what @BernieSanders wants to do nationally.” Ex. $15…
731183353962090500,Fri May 13 18:04:30 +0000 2016,#Raisethewage is the best anti poverty program for VT. Good for economy &amp; taxpayers who shouldn't subsidize low wage employers.
731177366144340000,Fri May 13 17:40:43 +0000 2016,Getting ready to kick off the AVCU Candidate forum. https://t.co/s1gcykSYoN
730162618334367700,Tue May 10 22:28:28 +0000 2016,Gov Shumlin tells NYT EB-5 fraud is a “bump in the road.” Fraud hurt NEK, fleeced investors and damaged VT brand. Some bump.
730148294807146500,Tue May 10 21:31:33 +0000 2016,NYT on EB-5. So much for Vermont’s reputation for clean gov’t. Ban corporate campaign contributions now. #vtpoli https://t.co/jMdlNOmRw3
729309975625932800,Sun May 08 14:00:22 +0000 2016,On Mother’s Day, thinking of the woman who instilled a love of VT in me &amp; taught me to fight for equality &amp; justice https://t.co/4Le4y2s1a6
728991748362522600,Sat May 07 16:55:51 +0000 2016,Disappointed that Gov Shumlin used veto threat on siting bill to help a single developer rather than standing with Swanton. #vtpoli
728962698017300500,Sat May 07 15:00:25 +0000 2016,I haven’t given up the fight for universal health care. Join me → https://t.co/5VEpxR0GWS
728617563807191000,Fri May 06 16:08:58 +0000 2016,We can’t let lobbyists and special interests run Montpelier. Not on energy siting or anything else.  https://t.co/ujc9fyaouR
722937185867923500,Wed Apr 20 23:57:11 +0000 2016,Listened to folks in Newport. Resilient town determined not to let #VTPonzi hold them back https://t.co/vXcpPXcKdx
722892899411632100,Wed Apr 20 21:01:12 +0000 2016,Stopped by the Newport Daily Express to learn the impact and express solidarity over the alleged NEK fraud. #vtpoli https://t.co/UgAxCp3rse
722853376564834300,Wed Apr 20 18:24:09 +0000 2016,Proud to stand with @VSEAUnite in support labor board decision.
722225553986732000,Tue Apr 19 00:49:25 +0000 2016,ICYMI: I called for an independent commission to investigate the State’s role in #vtponzi. Read more → https://t.co/kcFzIXjuRf
722103694544609300,Mon Apr 18 16:45:11 +0000 2016,NEK fraud is a wake up call. We need to end crony capitalism, get corporate $ out of #vtpoli and restore the public interest in Montpelier
722096140993167400,Mon Apr 18 16:15:10 +0000 2016,Vermonters have lost faith in our govt. We need an independent commission to get to the bottom of who knew what, and when. #vtponzi #vtpoli
722077393129615400,Mon Apr 18 15:00:40 +0000 2016,I’m holding a press conf at the State House at noon calling for an independent commission to investigate the states role in #VTponzi #vtpoli
721076568995545100,Fri Apr 15 20:43:45 +0000 2016,While NEK developers gave corporate $, VT State gov acted as cheerleaders for a project that ought to have raised red flags. #vtpoli (2/2)
721076152702517200,Fri Apr 15 20:42:06 +0000 2016,The NEK Project is a prime example of the need to get corporate $ out of politics. (1/2) #vtpoli
719958532150267900,Tue Apr 12 18:41:04 +0000 2016,Women disproportionally hold low-wage jobs, head households in poverty. Will benefit most if we #RaiseTheWage. #EqualPayDay (2/2) #vtpoli
719958303275507700,Tue Apr 12 18:40:10 +0000 2016,Today is #EqualPayDay. VT can take a key step on pay equity by raising the minimum wage. Will have the biggest impact on women (1/2) #vtpoli
719514722236694500,Mon Apr 11 13:17:32 +0000 2016,At Saturday’s forum, voters agreed - we need to raise the minimum wage. More → https://t.co/3kZWTIT3hU #vtpoli
718900886727168000,Sat Apr 09 20:38:22 +0000 2016,It's simple. More taxpayer giveaways to corporations = less funding for critical services like health care. #VTGovPanel
718890495594860500,Sat Apr 09 19:57:05 +0000 2016,Kicking off the next @RightsVT forum in Bennington. #VTGovPanel https://t.co/4PDEfznqLU
718813974410719200,Sat Apr 09 14:53:01 +0000 2016,Too often in Montpelier, special interests win over the public interest. I'm running to change that -PG #VTGovPanel https://t.co/T56Ojou3nA
718531997061247000,Fri Apr 08 20:12:32 +0000 2016,RT @VTLawSchool: Meet candidates for #VT governor Tuesday night @VTLawSchool #vtpoli #Vermont https://t.co/UD5aaBAoGN https://t.co/JTAQB4tR…
717820145708572700,Wed Apr 06 21:03:53 +0000 2016,NY and CA just passed $15 minimum wage laws. Time for VT to do the same. It's the most effective anti-poverty tool we have. #vtpoli
717142749116555300,Tue Apr 05 00:12:09 +0000 2016,Had a great evening chatting with the Addison County Dems about my campaign for governor. #vtpoli https://t.co/FKHvUBRX9z
715898015286857700,Fri Apr 01 13:46:02 +0000 2016,Why shouldn’t Vermonters know how much noise is generated by giant wind turbines? #vtpoli
715897822416019500,Fri Apr 01 13:45:16 +0000 2016,Disappointed with Senate vote opposing continuous monitoring of giant wind turbines. #vtpoli
714593278247714800,Mon Mar 28 23:21:28 +0000 2016,Elections are about choices. On the issues, I'm going to offer you a very different choice. #vtpoli https://t.co/YtCSxHauj3
714587896989126700,Mon Mar 28 23:00:05 +0000 2016,Chatting with Windsor County Dems before we hit the stage for tonight's forum. #vtpoli https://t.co/YiCGvtgeU9
713407465006698500,Fri Mar 25 16:49:28 +0000 2016,Agreed! Thanks for the support! #vtpoli  https://t.co/xr5c4IvmR0
713394991419297800,Fri Mar 25 15:59:54 +0000 2016,Getting ready to go live on @vermontedition and chat about my plan to promote economic justice in VT #VTpoli https://t.co/jXd4ye6O2e
712772581074595800,Wed Mar 23 22:46:40 +0000 2016,Raising the minimum wage will help working people and boost VT's economy. https://t.co/Ocsz8Zd0Dj #vtpoli https://t.co/Wna4Nx7aeg
712724674950639600,Wed Mar 23 19:36:18 +0000 2016,RT @terrivt: In race for #vt gov, @GalbraithforVT walks careful political line. https://t.co/2cLOS052tW
712724649747095600,Wed Mar 23 19:36:12 +0000 2016,RT @vtpressbureau: .@GalbraithforVT launches Democratic bid for governor https://t.co/5XNEMw4FjB #vtpoli https://t.co/vkehnQHgnJ
712724236633251800,Wed Mar 23 19:34:34 +0000 2016,Read the text of yesterday’s announcement speech here → https://t.co/byv9ba2kIB #vtpoli
712626214834294800,Wed Mar 23 13:05:04 +0000 2016,Yesterday I announced I was running for Governor. Join me in the fight for economic justice #vtpoli → https://t.co/r0AiN44BDu
