id,created_at,text
86496702974009340,Thu Jun 30 18:09:55 +0000 2011,Again the heart feels something of a single/particular/excellent/unique restlessness // the breast is in search of an effective/mortal wound
86496525223604220,Thu Jun 30 18:09:13 +0000 2011,phir kuchh ik dil ko beqaraarii hai // siinah juuyaa-e zakhm-e kaarii hai
86496196276924420,Thu Jun 30 18:07:54 +0000 2011,Ghazal of the day......  "phir kuchh ik dil ko beqaraarii hai"
86494289898643460,Thu Jun 30 18:00:20 +0000 2011,Sallam Duniya.....
86358013518155780,Thu Jun 30 08:58:49 +0000 2011,ہم پر جفا سے ترکِ وفا کا گماں نہیں اک چھیڑ ہے وگرنہ مراد امتحاں نہیں
86357952151306240,Thu Jun 30 08:58:34 +0000 2011,हम पर जफ़ा से तरक-ए वफ़ा का गुमां नहीं // इक छेड़ है वगरनह मुराद इमतिहां नहीं
86357852062629890,Thu Jun 30 08:58:11 +0000 2011,In her oppression there's only the intention of teasing us. She doesn't intend a test of faithfulness.
86357812174786560,Thu Jun 30 08:58:01 +0000 2011,Ghalib says, she does not suspect us of renouncing faithfulness out of fear of oppression.
86357517675921400,Thu Jun 30 08:56:51 +0000 2011,1) we are not under suspicion of renunciation of faith because of oppression 2) it is a mere tease--otherwise, the intention is not a test
86357211114250240,Thu Jun 30 08:55:38 +0000 2011,ham par jafaa se tark-e vafaa kaa gumaan nahi // ik chher hai vagarnah muraad imtihaan nahi. [jafaa=cruelty,gumaan= suspicion,chher=tease]
86283371675791360,Thu Jun 30 04:02:13 +0000 2011,Sallam Duniya !!
86147656946163710,Wed Jun 29 19:02:56 +0000 2011,Good Night Duniya----------Khuda Hafiz.
86147540277403650,Wed Jun 29 19:02:28 +0000 2011,No order, no arrangement; neither pattern nor design. But the King has the right over everything; no one can breathe a word. [King=God] End.
86147344483106820,Wed Jun 29 19:01:42 +0000 2011,Ghalib said, 'The task done out of self-will is usually done in a disorderly way" Look at the stars-- how badly they're scattered around!
86147200974987260,Wed Jun 29 19:01:07 +0000 2011,Story : One time, at night, he was lying on a cot, looking at the sky. Seeing the apparent disorder and lack of arrangement of the stars.
86147078929121280,Wed Jun 29 19:00:38 +0000 2011,Would like to end the day with a story.. #goodolddays.
86146110883766270,Wed Jun 29 18:56:48 +0000 2011,ہوا ہے شہ کا مصاحب پھرے ہے اتراتا وگرنہ شہر میں غالب کی آب رو کیا ہے
86146013789818880,Wed Jun 29 18:56:24 +0000 2011,हुआ है शह का मुसाहिब फिरे है इतराता // वगरनह शहर में ग़ालिब की आब-रू कया है
86145754527309820,Wed Jun 29 18:55:23 +0000 2011,He's become the King's companion he goes around giving himself airs // otherwise, what honor/reputation does Ghalib have in the city?!
86145604564164600,Wed Jun 29 18:54:47 +0000 2011,huaa hai shah kaa mu.saahib phire hai itraataa // vagarnah shahr me Ghalib kii aab-ruu kyaa hai.[ shah kaa mu.saahib = King's companion  ]
86144789107580930,Wed Jun 29 18:51:32 +0000 2011,رہی نہ طاقتِ گفتار اور اگر ہو بھی تو کس امید پہ کہیے کہ آرزو کیا ہے
86144597344006140,Wed Jun 29 18:50:47 +0000 2011,@BilalHYD This may help : @Shayeri4all Though I am not very active on that handle. Love Ghalib more than any other poet.
86144258389712900,Wed Jun 29 18:49:26 +0000 2011,रही न ताक़त-ए गुफ़तार और अगर हो भी // तो किस उमीद पह कहये कि आरज़ू कया है
86143750589513730,Wed Jun 29 18:47:25 +0000 2011,rahii nah taaqat-e guftaar aur agar ho bhii // to kis umiid pah kahye ki aarzuu kyaa hai. [aaqat-e guftaar= strength for/of speech ]
86143054783848450,Wed Jun 29 18:44:39 +0000 2011,جلا ہے جسم جہاں دل بھی جل گیا ہوگا کریدتے ہو جو اب راکھ جستجو کیا ہے
86141996607086600,Wed Jun 29 18:40:27 +0000 2011,@I_am_Rajarshi I would prefer to talk in private. Check DM.
86141620138950660,Wed Jun 29 18:38:57 +0000 2011,जला है जिसम जहां दिल भी जल गया होगा // कुरेदते हो जो अब राख जुसतजू कया है
86141454719795200,Wed Jun 29 18:38:17 +0000 2011,where the body has burned, even/also the heart will have burned // since you now rake/poke the ashes, what is the 'search' [for]?
86141188591202300,Wed Jun 29 18:37:14 +0000 2011,jalaa hai jism jahaaN dil bhii jal gayaa hogaa // kuredte ho jo ab raakh justajuu kyaa hai
86140780179230720,Wed Jun 29 18:35:37 +0000 2011,@I_am_Rajarshi @ignorancecosts @smartrudra I advise all, this is a endless discussion/arguement/talk and yes a very sensitive one. Careful.
86140355153625090,Wed Jun 29 18:33:55 +0000 2011,نہ شعلے میں یہ کرشمہ نہ برق میں یہ ادا کوئی بتاؤ کہ وہ شوخِ تند خو کیا ہے
86140305610514430,Wed Jun 29 18:33:43 +0000 2011,न शु`ले में यह करिशमह न बरक़ में यह अदा // कोई बताओ कि वह शोख़-ए तुनद-ख़ू कया है
86139552993001470,Wed Jun 29 18:30:44 +0000 2011,@BilalHYD What do i say ? I am wondering. I am not clear of what you want to say. ?????? is all what you say.
86138970018291710,Wed Jun 29 18:28:25 +0000 2011,I don't understand what that quick-tempered mischievous one really is. If anyone can tell, then please tell me what she is.
86138790690816000,Wed Jun 29 18:27:42 +0000 2011,And if because of the mischievousness I call her 'lightning', then in lightning where is this grace/style?
86138761729159170,Wed Jun 29 18:27:35 +0000 2011,If because of the quick temper I call her 'flame,' then in flame where is this coquetry?
86138571362283520,Wed Jun 29 18:26:50 +0000 2011,1) neither in flame this coquetry, nor in lightning this grace/style 2) someone tell [me], what is that quick-tempered mischievous one?
86138214980657150,Wed Jun 29 18:25:25 +0000 2011,Na shuole me yih karishmah nah barq me yeh adaa //  koi bataao kih vuh shokh-e tund-khuu kyaa hai. [shuole = flame , barq=lightning ]
86137213070479360,Wed Jun 29 18:21:26 +0000 2011,@BilalHYD Kya.....Kya he. :)
86136771468984320,Wed Jun 29 18:19:41 +0000 2011,ہر ایک بات پہ کہتے ہو تم کہ تو کیا ہے تمہیں کہو کہ یہ اندازِ گفتگو کیا ہے
86136720097148930,Wed Jun 29 18:19:29 +0000 2011,हर एक बात पह कहते हो तुम कि तू कया है //  तुमहीं कहो कि यह अनदाज़-ए गुफ़तगू कया है
86136650916315140,Wed Jun 29 18:19:12 +0000 2011,@hassaninayat No it was a local newspaper in those days.
86136537087086600,Wed Jun 29 18:18:45 +0000 2011,@iamrana Sallam. How was your vacation ? Hope you have a good time. Do look out for the new format and let me know how it is. Welcome back !
86136117170159620,Wed Jun 29 18:17:05 +0000 2011,Fact : From the letter of 19 April 1859 we learn that Mirza Ghalib regularly published his poetry in Shiv Narayan's newspaper.
86135278112219140,Wed Jun 29 18:13:45 +0000 2011,'What are you?'-- that is, what position/power do you have? And here "Kya" is not meant to ask a question, but rather to express a taunt.
86134945982058500,Wed Jun 29 18:12:26 +0000 2011,Har ek baat pah kahte ho tum kih tuu kyaa hai // tumhiiN kaho ki yeh andaaz-e guftaguu kyaa hai.
86052693814157310,Wed Jun 29 12:45:35 +0000 2011,phir jii me hai ki dar pe kisii ke pade rahe // sar zer baar-e-minnat-e-darbaan kiye hue [sar zer baare=bowed head]
86040109769703420,Wed Jun 29 11:55:35 +0000 2011,Banished from my heart is any thought of being in love again // For the net gain in the hopeless game is the longing, not the gain.
86021024625344510,Wed Jun 29 10:39:45 +0000 2011,My blood shall not stain her hands, so let her have no fear // I have shed it all my life, drop by drop with every tear.
86011227066736640,Wed Jun 29 10:00:49 +0000 2011,Us anjuman-e-naaz kii kya baat he 'Ghalib' // hum bhi gaye va aur teri takdiir ko roo aaye. [ anjuman-e-naaz = gathering of love ]
86008635909607420,Wed Jun 29 09:50:31 +0000 2011,Lo hum mariiz-e-ishk ke biimaar-daar he // acchaa agar na ho, to masiihaa kaa kyaa ilaaj ?. [biimaar-daar = nurse, healer ]
85998928058789890,Wed Jun 29 09:11:56 +0000 2011,zakhm gar dab gayaa, lahuu na thamaa, // kaam gar ruk gayaa, ravaa na huaa.
85924835850584060,Wed Jun 29 04:17:31 +0000 2011,محرم نہیں ہے تو ہی نواہاۓ راز کا یاں ورنہ جو حجاب ہے پردہ ہے ساز کا
85924758943830020,Wed Jun 29 04:17:13 +0000 2011,महरम नहीं है तू ही नवाहा-ए राज़ का // यां वरनह जो हिजाब है परदह है साज़ का
85924666614620160,Wed Jun 29 04:16:51 +0000 2011,only you are not intimate with voices/sounds of the secret  / otherwise, that which here is a curtain, is the secret/ tone of an instrument.
85924435420397570,Wed Jun 29 04:15:56 +0000 2011,mahram nahi hai tuu hii navaahaa-e raaz kaa // ya varnah jo hijaab hai pardah hai saaz kaa. [navaa= voice ]
85916080907894780,Wed Jun 29 03:42:44 +0000 2011,Sallam Duniya.
85788700646195200,Tue Jun 28 19:16:34 +0000 2011,Good Night Duniya--------Hope all enjoyed today's ghazal and other info/meaning. Khuda Hafiz.
85788353492029440,Tue Jun 28 19:15:12 +0000 2011,Fact : The poets of Lucknow don't compose verses about the beloved's becoming a lover of anyone else; and such themes are rejected by them.
85786335775957000,Tue Jun 28 19:07:10 +0000 2011,نشو و نما ہے اصل سے غالب فروع کو خاموشی ہی سے نکلے ہے جو بات چاہیے
85786277500297220,Tue Jun 28 19:06:57 +0000 2011,नशव-ओ-नुमा है असल से ग़ालिब फ़ुरू` को // ख़ामोशी ही से निकले है जो बात चाहिये
85786036050993150,Tue Jun 28 19:05:59 +0000 2011,Growth and nurture is from the root, Ghalib, for the branches // from only silence emerges the speech/idea/matter that is needed.
85785816693080060,Tue Jun 28 19:05:07 +0000 2011,nashv-o-numaa hai asl se Ghalib furuu ko // ḳhaamoshii hii se nikle hai jo baat chaahiye. [nashv = drunkenness, numaa=rise, asl=root]
85783754035052540,Tue Jun 28 18:56:55 +0000 2011,مے سے غرض نشاط ہے کس رو سیاہ کو اک گونہ بے خودی مجھے دن رات چاہیے
85783682174029820,Tue Jun 28 18:56:38 +0000 2011,मै से ग़रज़ नशात है किस रू-सियाह को // इक गूनह बे-ख़वुदी मुझे दिन रात चाहिये
85783613865598980,Tue Jun 28 18:56:21 +0000 2011,That is, he keeps causing forgetfulness of grief through unconsciousness and selfless-ness.
85783561361305600,Tue Jun 28 18:56:09 +0000 2011,By drinking my intention is not dat I would obtain joy but so dat I would forget grief n sorrow. Night n day, I need sum small selfless-ness
85782908484325380,Tue Jun 28 18:53:33 +0000 2011,From wine, joy/pleasure is the intention of which {disgraced} one? I need a excellent/unique sort/color of selfless-ness, night and day
85782715139506180,Tue Jun 28 18:52:47 +0000 2011,mai se ġharaẓ nashaat hai kis ruu-siyaah ko // ik guunah be-ḳhvudii mujhe din raat chaahiye.
85781308369944580,Tue Jun 28 18:47:12 +0000 2011,@_rgupta Its okay Sir. It happens. I am trying to make it work for all and also make it informative at the same time. Knowledge and Pleasure
85780981801426940,Tue Jun 28 18:45:54 +0000 2011,سیکھے ہیں مہ رخوں کے لیے ہم مصوّری تقریب کچھ تو بہرِ ملاقات چاہیے
85780913589465090,Tue Jun 28 18:45:38 +0000 2011,सीखे हैं मह-रुख़ों के लिये हम मुसववरी // तक़रीब कुछ तो बहर-ए मुलाक़ात चाहिये
85780766126125060,Tue Jun 28 18:45:03 +0000 2011,We learned poetry only so that it would turn out to be a means for meeting beautiful ones.
85780748052865020,Tue Jun 28 18:44:58 +0000 2011,By painting is meant both poetry and painting. But there's more pleasure in taking painting to mean poetry.
85780500484079620,Tue Jun 28 18:43:59 +0000 2011,1) for the sake of the moon-faced ones, we've learned painting/drawing 2) some recommendation/pretext for a meeting is needed
85780259072507900,Tue Jun 28 18:43:02 +0000 2011,siikhe haiN mah-rukhon ke liye ham muṣavvarii // taqriib kuchh to bahr-e mulaaqaat chaahiye.
85779942608093180,Tue Jun 28 18:41:46 +0000 2011,@_rgupta And this is not called killing. I am trying my level best to spread the info in all ways possible. So that everyone enjoys.
85779624025522180,Tue Jun 28 18:40:30 +0000 2011,@_rgupta I am giving everything. urdu, hindi, roman, meaning, story, etc etc. Choose what you like. Ignore the rest, I am trying my best.
85778353017208830,Tue Jun 28 18:35:27 +0000 2011,عاشق ہوئے ہیں آپ بھی ایک اور شخص پر آخر ستم کی کچھ تو مکافات چاہیے
85778267340152830,Tue Jun 28 18:35:07 +0000 2011,`आशिक़ हुए हैं आप भी एक और शख़स पर // आख़िर सितम की कुछ तो मुकाफ़ात चाहिये
85778035189612540,Tue Jun 28 18:34:11 +0000 2011,You've treated your lovers very cruelly and badly. Finally, some vengeance should be taken for this, by the Lord, upon you too.
85777912808218620,Tue Jun 28 18:33:42 +0000 2011,He says, the way we are your lover,in the same way you too have become a lover of some other person.And this secret has become evident to us
85777609161588740,Tue Jun 28 18:32:30 +0000 2011,Even/also {you / we ourself} have become a lover of one more person // after all, some retaliation/recompense for cruelty is needed
85777426273157120,Tue Jun 28 18:31:46 +0000 2011,aashiq hue hain aap bhii ek aur shaḳhṣ par // aaḳhir sitam kii kuchh to mukaafaat chaahiye. [ mukaafaat = compensation ]
85776478079430660,Tue Jun 28 18:28:00 +0000 2011,مسجد کے زیرِ سایہ خرابات چاہیے بھوں پاس آنکھ قبلۂ حاجات چاہیے
85776404301611000,Tue Jun 28 18:27:43 +0000 2011,मसजिद के ज़ेर-ए सायह ख़राबात चाहिये // भों पास आंख क़िबलह-ए हाजात चाहिये
85776351927341060,Tue Jun 28 18:27:30 +0000 2011,the way God the Most High has created an eye near the brow.
85776298835853310,Tue Jun 28 18:27:17 +0000 2011,He says, oh Supplier of Necessities (this is directed toward the Preacher) a wine-house certainly ought to be built adjacent to the mosque
85775887219441660,Tue Jun 28 18:25:39 +0000 2011,Poets always give the simile of a wine-house for the eye, and the prayer-niche of a mosque for the eyebrow.
85775784131837950,Tue Jun 28 18:25:15 +0000 2011,The similes of the eye as a wine-house, and the eyebrow as the [arched] prayer-niche [miḥraab] of a mosque, are well-known.
85775513674723330,Tue Jun 28 18:24:10 +0000 2011,under the shade/shelter/protection of the mosque, a wine-house is needed // near the brow an eye, supplier/Qiblah of necessities, is needed
85775442866470910,Tue Jun 28 18:23:53 +0000 2011,masjid ke zer-e saayah ḳharaabaat chaahiye // bhoN paas aaNkh qiblah-e ;haajaat chaahiye.
85774505544400900,Tue Jun 28 18:20:10 +0000 2011,ہر چند ہر ایک شے میں تو ہے پر تجھ سی کوئی شے نہیں ہے
85774456068378620,Tue Jun 28 18:19:58 +0000 2011,हर-चनद हर एक शै में तू है // पर तुझ-सी कोई शै नहीं है
85774361361006600,Tue Jun 28 18:19:36 +0000 2011,{although / however much} in every single thing, "You" are // but no thing is like "You"
85773958263218180,Tue Jun 28 18:17:59 +0000 2011,har-chand har ek shai me tuu hai // par tujh-sii koii shai nahi hai. [shai = ( शै ) thing]
85641231048245250,Tue Jun 28 09:30:35 +0000 2011,कयूंकर उस बुत से रखूं जान `अज़ीज़ // कया नहीं है मुझे ईमान `अज़ीज़
85640883311087620,Tue Jun 28 09:29:12 +0000 2011,how/why would I hold my life dearer than that idol? // what-- is faith not dear to me?
85640521434923000,Tue Jun 28 09:27:46 +0000 2011,kyuunkar us buut se rakhuuN jaan aziiz // kyaa nahii hai mujhe iimaan aziiz.  [ buut = idol ]
85588459657494530,Tue Jun 28 06:00:53 +0000 2011,@tusharbhalla3 Hain aur bhii duniyaa me sukhanavar bahut achchhe // kahte hain ki 'Ghalib' kaa hai andaaz-e-bayaan aur. [sukhanavar=poet]
85580342546808830,Tue Jun 28 05:28:38 +0000 2011,نہ تھا کچھ تو خدا تھا کچھ نہ ہوتا تو خدا ہوتا ڈبویا مجھ کو ہونے نے نہ ہوتا میں تو کیا ہوتا
85580311945150460,Tue Jun 28 05:28:31 +0000 2011,न था कुछ तो ख़ुदा था कुछ न होता तो ख़ुदा होता // डुबोया मुझ को होने ने न होता मैं तो कया होता
85580287907594240,Tue Jun 28 05:28:25 +0000 2011,Na thaa kuchh to khudaa thaa kuchh na hotaa to khudaa hotaa // Duboyaa mujh ko hone ne na hotaa mai.N to kyaa hotaa.
85578983747485700,Tue Jun 28 05:23:14 +0000 2011,@stwta So true....I feel his pain a little bit... I just wonder how me might have felt and lived all his life that way. :(
85578770886565890,Tue Jun 28 05:22:23 +0000 2011,@Anuraag_Shukla True !!! I agree and thats what I aim for. Thanks 4 the support.
85577359578759170,Tue Jun 28 05:16:47 +0000 2011,@RumaisaMohani Thanks :) I am trying my best to share as much as i can in the best of ways and would surely like all to enjoy. :)
85576165334581250,Tue Jun 28 05:12:02 +0000 2011,I dont get it... Though I dont care but still Am I doing anything wrong.. ??? Why are the number of followers decreasing every day...????
85565552810143740,Tue Jun 28 04:29:52 +0000 2011,کیا تنگ ہم ستم زدگاں کا جہان ہے جس میں کہ ایک بیضۂ مور آسمان ہے
85565500372951040,Tue Jun 28 04:29:39 +0000 2011,कया तनग हम सितम-ज़दगां का जहान है //  जिस में कि एक बैज़ह-ए मोर आसमान है
85564876474433540,Tue Jun 28 04:27:10 +0000 2011,kyaa tang ham sitam-zadagaaN kaa jahaan hai // jis me kih ek bai.zah-e mor aasmaan hai.
85558289307414530,Tue Jun 28 04:01:00 +0000 2011,@Nomi_Bash Sukhriya Janaab !
85558108797141000,Tue Jun 28 04:00:17 +0000 2011,@soulroute Yes. I am doing well. Thank you. How are you ? Twitter has become so dead.
85557910863749120,Tue Jun 28 03:59:30 +0000 2011,@funjabi_gabru :) Kya kehne.....
85556793656352770,Tue Jun 28 03:55:03 +0000 2011,Sallam Duniya-----------Aadaab.
85423759481241600,Mon Jun 27 19:06:26 +0000 2011,زندگی اپنی جب اس شکل سے گزری غالب ہم بھی کیا یاد کرینگے کہ خدا رکھتے تھے
85423677230952450,Mon Jun 27 19:06:06 +0000 2011,ज़िनदगी अपनी जब इस शकल से गुज़री ग़ालिब // हम भी कया याद करेंगे कि ख़ुदा रखते थे
85423648361545730,Mon Jun 27 19:05:59 +0000 2011,Zindagii apnii jab is shakl se guzrii Ghalib // ham bhii kyaa yaad karenge kih ḳhudaa rakhte the.
85423634486796290,Mon Jun 27 19:05:56 +0000 2011,Good night Duniya----------------------- Khuda Hafiz.
85418538612953090,Mon Jun 27 18:45:41 +0000 2011,شکوے کے نام سے بے مہر خفا ہوتا ہے یہ بھی مت کہہ کہ جو کہیے تو گلا ہوتا ہے
85418475597742080,Mon Jun 27 18:45:26 +0000 2011,शिकवे के नाम से बे-मिहर ख़फ़ा होता है // यह भी मत कह कि जो कहये तो गिला होता है
85418442424987650,Mon Jun 27 18:45:18 +0000 2011,shikve ke naam se be-mihr khafaa hotaa hai // yih bhii mat kah kih jo kahye to gilaa hotaa hai.
85358638931255300,Mon Jun 27 14:47:40 +0000 2011,@Paathani No No. Dont be sorry. Its just that the only thing I dont like being messed with is, God. Respect it and Love it. :)
85357610164949000,Mon Jun 27 14:43:34 +0000 2011,mat puuchh kih kyaa ;haal hai meraa tera piichhe // tuu dekh kih kyaa rang hai teraa mere aage
85356357729001470,Mon Jun 27 14:38:36 +0000 2011,@Paathani You can atleast write GOD properly without using the so called modern slang. spare the Lord from lazyness / style.
85355201376165890,Mon Jun 27 14:34:00 +0000 2011,@Paathani ? Was that for me ?
85354571261685760,Mon Jun 27 14:31:30 +0000 2011,عشرتِ قطرہ ہے دریا میں فنا ہو جانا درد کا حد سے گزرنا ہے دوا ہو جانا
85354541104635900,Mon Jun 27 14:31:23 +0000 2011,`इशरत-ए क़तरह है दरया में फ़ना हो जाना // दरद का हद से गुज़रना है दवा हो जाना
85354518681882620,Mon Jun 27 14:31:17 +0000 2011,1) the joy/mingling of the drop is, to become obliterated in the sea 2) pain's passing beyond the limit is, [for it] to become a medicine
85354224057192450,Mon Jun 27 14:30:07 +0000 2011,ishrat-e qat̤rah hai daryaa me fanaa ho jaanaa // dard kaa ḥad se guzarnaa hai davaa ho jaanaa.
85330836370628600,Mon Jun 27 12:57:11 +0000 2011,عاشقی صبر طلب اور تمنّا بیتاب دل کا کیا رنگ کروں خونِ جگر ہوتے تک
85330772067758080,Mon Jun 27 12:56:56 +0000 2011,`आशिक़ी सबर-तलब और तमनना बेताब // दिल का कया रनग करूं ख़ून-ए जिगर होते तक
85330607084806140,Mon Jun 27 12:56:16 +0000 2011,aashiqi sabr-talab aur tamanna betaab //dil kaa kyaa rang karun ḳhun-e jigar hote tak.
85216352176050180,Mon Jun 27 05:22:16 +0000 2011,بک جاتے ہیں ہم آپ متاعِ سخن کے ساتھ لیکن عیارِ طبعِ خریدار دیکھ کر
85216312166588420,Mon Jun 27 05:22:06 +0000 2011,बिक जाते हैं हम आप मता`-ए सुख़न के साथ // लेकिन `अयार-ए तब`-ए ख़रीदार देख कर
85216253731536900,Mon Jun 27 05:21:52 +0000 2011,We ourself are sold along with the merchandise/goods of poetry but [only after] having seen the measure of quality/temperament of the buyer
85216161633009660,Mon Jun 27 05:21:30 +0000 2011,bik jaate haiN ham aap mataa-e suḳhan ke saath // lekin aayaar-e :taab-e khariidaar dekh kar. [ aayaar : a standard of measure, weight ]
85215310730362880,Mon Jun 27 05:18:07 +0000 2011,آتا ہے میرے قتل کو پر جوشِ رشک سے مرتا ہوں اس کے ہاتھ میں تلوار دیکھ کر
85215254237294600,Mon Jun 27 05:17:54 +0000 2011,आता है मेरे क़तल को पर जोश-ए रशक से // मरता हूं उस के हाथ में तलवार देख कर
85215203196813310,Mon Jun 27 05:17:42 +0000 2011,1) she comes to murder me, but from the tumult/heat of envy/jealousy 2) I die-- having seen the sword in her hand
85215166312099840,Mon Jun 27 05:17:33 +0000 2011,aataa hai mere qatl ko par josh-e rashk se // martaa hu us ke haath me talvaar dekh kar.
85214931393323000,Mon Jun 27 05:16:37 +0000 2011,کیوں جل گیا نہ تابِ رخِ یار دیکھ کر جلتا ہوں اپنی طاقتِ دیدار دیکھ کر
85214892189167620,Mon Jun 27 05:16:28 +0000 2011,कयूं जल गया न ताब-ए रुख़-ए यार देख कर // जलता हूं अपनी ताक़त-ए दीदार देख कर
85214844269248510,Mon Jun 27 05:16:16 +0000 2011,Why did I not burn to ashes, having seen the radiance of the beloved's face? I burn with jealousy, having seen my own strength of sight.
85214608331243520,Mon Jun 27 05:15:20 +0000 2011,kyun jal gayaa nah taab-e ruḳh-e yaar dekh kar // jaltaa huun apnii :taaqat-e diidaar dekh kar.
85196173010403330,Mon Jun 27 04:02:05 +0000 2011,Sallam Duniya----------Aadaab !
85071794482053120,Sun Jun 26 19:47:51 +0000 2011,The object of my worship lies beyond perception's reach; // For men who see, the Ka'aba as a compass, nothing more.
85071780913483780,Sun Jun 26 19:47:47 +0000 2011,Good Night Duniya.
85070182380355580,Sun Jun 26 19:41:26 +0000 2011,Aaye he bekasi-e-ishq pah ronaa Ghalib // kis ke ghar jaaega sailab-e balaa mere baad
85069642720223230,Sun Jun 26 19:39:18 +0000 2011,pilaa de oak se saaqii jo humse nafrat hai // pyaalaa gar nahi detaa na de, sharaab to de [oak=palm of the hand].
85052813746507780,Sun Jun 26 18:32:25 +0000 2011,مہرباں ہو کے بلا لو مجھے چاہو جس وقت میں گیا وقت نہیں ہوں کہ پھر آ بھی نہ سکوں
85052772248072200,Sun Jun 26 18:32:15 +0000 2011,मिहरबां हो के बुला लो मुझे चाहो जिस वक़त // मैं गया वक़त नहीं हूं कि फिर आ भी न सकूं
85052659844915200,Sun Jun 26 18:31:48 +0000 2011,mehrbaaN ho ke bulaa lo mujhe chaaho jis vaqt // maiN gayaa vaqt nahi huuN kih phir aa bhii nah sakuuN.
85041016847073280,Sun Jun 26 17:45:33 +0000 2011,@vipuljain @jagdish @mirpoetry  NO !
84975769889144830,Sun Jun 26 13:26:16 +0000 2011,رونے سے اور عشق میں بے باک ہو گئے دھوئے گئے ہم اتنے کہ بس پاک ہو گئے
