id,created_at,text
1255408619224531000,Wed Apr 29 08:08:33 +0000 2020,haan ay falak-e-peer* javaan tha abhi arif* kya tera bigarta jo nah marta koi din aur  tum kaun-se the aise khare d… https://t.co/Ay6jSOSwX7
1248332749502480400,Thu Apr 09 19:31:35 +0000 2020,Laazim thaa kih dekho miraa rastaa koi din aur Tanhaa gaye kyun ab raho tanhaa koi din aur
1241653026839883800,Sun Mar 22 09:08:45 +0000 2020,Ghalib: I envy the situation of island-dwellers in general, and of the lord of Farrukhabad* in particular, whom the… https://t.co/kvyBY5BdEa
1241648681566134300,Sun Mar 22 08:51:29 +0000 2020,padye gar beemaar to koi nah ho beemaar-daar aur agar mar jaa'iye to nauhah-khvaan koi nah ho  beemaar-daar - sick-… https://t.co/oeGDyQ9Sh6
1241648114341048300,Sun Mar 22 08:49:13 +0000 2020,rahye ab aisee jagah chal kar jahaan koi nah ho ham-sukhan* koi nah ho aur ham-zabaan* koi nah ho  be-dar-o-deevaar… https://t.co/AkmkOE8a22
1232319131849916400,Tue Feb 25 14:59:11 +0000 2020,Four things kept Delhi alive – the fort, the daily crowds at the Jama Masjid, the weekly walk to the Yamuna Bridge,… https://t.co/tJkg8matNM
1232319129664704500,Tue Feb 25 14:59:10 +0000 2020,1861, in a letter to a friend:   “The city has become a desert… by God, Delhi is no more a city, but a camp, a cant… https://t.co/6k3z6WanEx
1232317358368116700,Tue Feb 25 14:52:08 +0000 2020,be-niyaazee had se guzree bandah-parvar kab talak* ham kaheinge haal-e-dil aur aap farmaaveinge kyaa  * inattention… https://t.co/whcb37mptr
1232316484321366000,Tue Feb 25 14:48:39 +0000 2020,hai ab is ma'moore mein qaht-e-gham-e-ulfat asad ham ne yeh maanaa kih dilli mein rahe khaaveinge kyaa  there is no… https://t.co/BIY8Fj3UFK
1232146965514735600,Tue Feb 25 03:35:03 +0000 2020,ne teer kamaan mein hai na sayyaad kameen mein goshe mein qafas ke mujhe aaraam bahut hai  ne - neither  sayyaad -… https://t.co/BNPBT6c3VK
1231925774338416600,Mon Feb 24 12:56:07 +0000 2020,masjid ke zer-e-saaya ik ghar bana liya hai ye banda-e-kameena hum-saaya-e-khuda hai
1231918221269373000,Mon Feb 24 12:26:06 +0000 2020,RT @MirPoetry: dilli jo ek shehr tha aalam mein intikhaab  rehte the muntakhab hi jahaan rozgaar ke   uss ko falak ne loot ke barbaad kar d…
1229649895088218000,Tue Feb 18 06:12:35 +0000 2020,woh baadah-e shabaanah* ki sar-mastiyaan* kahaan uthye bas ab kih lazzat-e-khvaab-e-sahar* ga’ee  maaraa zamaane ne… https://t.co/xhICMlWXAw
1211085399004606500,Sun Dec 29 00:43:54 +0000 2019,hasti ke mat fareb mein aa jaa’iyo ‘asad’ aalam tamaam halqah-e daam-e khayaal* hai  * a link/circle of the net of thought
1167152359014723600,Thu Aug 29 19:09:41 +0000 2019,humare zahn mein uss fikr ka hai naam visaal ki gar na ho toh kahan jaayein ho toh kyunkar ho
1167152199069134800,Thu Aug 29 19:09:03 +0000 2019,gai woh baat ki ho guft-go toh kyunkar ho kahe se kuch na hua phir kaho toh kyunkar ho
1159110983047999500,Wed Aug 07 14:36:08 +0000 2019,RT @FaizPoetry: gar aaj tujh se judaa hain toh kal bahum honge  yeh raat bhar ki judaa'ee toh koi baat nahin gar aaj auj* pe hai taala-e-ra…
1159110964492435500,Wed Aug 07 14:36:03 +0000 2019,RT @FaizPoetry: yoonhi humesha ulajhti rahi hai zulm se ḳhalq*  na un ki rasm na'ee hai na apni reet na'ee yoonhi hamesha khilaaein hain hu…
1159110948021395500,Wed Aug 07 14:35:59 +0000 2019,RT @FaizPoetry: dast-e-bahaana-joo: excuse to perpetuate ahl-e-junoon: passionate people naam-lewa: an heir, a descendent ahl-e-havas: peop…
1159110928081666000,Wed Aug 07 14:35:55 +0000 2019,RT @FaizPoetry: bahot hai zulm ke dast-e-bahaana-joo ke liye  jo chand ahl-e-junoon tere naam-lewa hain  bane hain ahl-e-havas mudda'ee bhi…
1159110901988855800,Wed Aug 07 14:35:48 +0000 2019,RT @FaizPoetry: nisaar main teri galiyon ke aye watan ki jahaan  chali hai rasm ki koi na sar utha ke chale  jo koi chaahne waala tawaaf ko…
1153288783023841300,Mon Jul 22 13:00:47 +0000 2019,@Shaheen33617189 Ghalib ne ik khat mein iss ka zikr kiya tha. Aur logon ne bhi detail mein investigate kiya hai, ye… https://t.co/AYLoPb2m8Z
1152867290683023400,Sun Jul 21 09:05:55 +0000 2019,@iamrana @AbidZaidi1 @ArzKiaHai Poetry in politics, politics in poetry:  https://t.co/xiA4n9XGJ8
1152865986057367600,Sun Jul 21 09:00:44 +0000 2019,@iamrana @AbidZaidi1 @ArzKiaHai @Rekhta wrote a piece on something similar recently where they had a collection of… https://t.co/9HVBEKP7rS
1152858962200420400,Sun Jul 21 08:32:50 +0000 2019,phir mujhe deedah-e tar yaad aayaa  dil jigar-tishnah-e faryaad aayaa  dam liya tha nah qiyaamat ne hanooz* phir te… https://t.co/SIGIpdwaeT
1152853087968645100,Sun Jul 21 08:09:29 +0000 2019,@iamrana Woh bhi achche din the Appa. Twitter alag jagah thi aur ab alag hai. Main yahin hoon sabki baatein sunta h… https://t.co/lTM1Sswg8P
1152851192201920500,Sun Jul 21 08:01:57 +0000 2019,@iamrana Jab @Javedakhtarjadu khud verify kar rahe hain toh phir hum 'banaa kar faqiron ka hum bhes ghalib tamaasha… https://t.co/mGw1uahS0O
1152849691735760900,Sun Jul 21 07:56:00 +0000 2019,@iamrana mehrbaan ho ke bulaa lo mujhe chaaho jis waqt main gaya waqt nahin hoon ki phir aa bhi na sakoon
1078341522565800000,Thu Dec 27 17:27:08 +0000 2018,In short, whatever scoundrel is the author of these verses, curses on his father and his grandfather and his great-… https://t.co/bILb6eTMtX
1078340844183269400,Thu Dec 27 17:24:26 +0000 2018,In short, even if these verses would be found in the text, then consider that some accursed prostituter-of-his-wife… https://t.co/IPvt0LoSwE
1078340780824117200,Thu Dec 27 17:24:11 +0000 2018,The divan has been printed. If these verses are in the text, then they're mine; and if they're in the margins, then they're not mine.
1078340427357581300,Thu Dec 27 17:22:47 +0000 2018,These verses that you've sent-- the Lord knows what son of a bitch [vald al-zanaa] has inserted them!
1078338428025098200,Thu Dec 27 17:14:50 +0000 2018,@nasim_aqib @AsmaAnjumKhan @Muzammil_khann @rahatindori It's not by Ghalib.   "And don't you look also at the style… https://t.co/bNgsCtFGZR
1078296537703346200,Thu Dec 27 14:28:23 +0000 2018,dard minnat-kash-e davaa na hua main na achcha hua buraa nah hua  jam'a karte ho kyun raqeebon ko ik tamaasha hua g… https://t.co/uoX0nNIG95
1078295088185462800,Thu Dec 27 14:22:37 +0000 2018,choda na rashk* ne ki tere ghar ka naam loon har yak* se poochta hoon ki jaoon kidhar ko main  *jealousy *each and everyone
1078293875146539000,Thu Dec 27 14:17:48 +0000 2018,Born in 1797 in Agra, today is Ghalib's 221st birth anniversary.
1078292329998491600,Thu Dec 27 14:11:39 +0000 2018,Ghalib tera ahvaal* sunaa deinge hum un ko woh sun ke bulaa lein yeh ijaaraa* nahin karte  *1 - situation *2 - contract
1027609433390633000,Thu Aug 09 17:35:55 +0000 2018,@IndoIslamicPage @Soofinama @EvolveLeadLove @iamrana @FarooqiMehr @Rekhta @VintagePakistan @HeritageIndia… https://t.co/Pb2xBrwiLv
1027605956862074900,Thu Aug 09 17:22:06 +0000 2018,Ghalib, don't tease/torment us, for again with/through a turmoil of tears we are settled/brooding, having made prep… https://t.co/aN3P3zmP8r
1027605954999844900,Thu Aug 09 17:22:06 +0000 2018,ghalib hamein nah chhed kih phir josh-e ashk se baithe hain ham taheeyah-e toofaan kiye hu'e
1027605404690329600,Thu Aug 09 17:19:55 +0000 2018,jee dhoondhtaa hai phir vuhi fursat kih raat din baithe rahein tasavvur-e jaanaan kiye hu'e
1027604310677442600,Thu Aug 09 17:15:34 +0000 2018,again the heart goes to circumambulate the street of blame/reproach/disgrace having made desolate the idol-house of… https://t.co/YuaQSUmerv
1027604307787571200,Thu Aug 09 17:15:33 +0000 2018,dil phir tavaaf-e kuu-e malaamat ko jaa'e hai pindaar kaa ṣanam-kadah viraan kiye hu'e
1027603415294197800,Thu Aug 09 17:12:00 +0000 2018,again heart and eye have become rivals with each other having gathered the equipment of/for vision and thought
1027603412605722600,Thu Aug 09 17:12:00 +0000 2018,baa-ham-digar hu'e hain dil-o-deedah phir raqeeb nazzaarah-o-khayaal ka saamaan kiye hu'e
1027603219084664800,Thu Aug 09 17:11:14 +0000 2018,again passion has set out to ask about the wounds of the heart having equipped itself with a hundred thousand salt-… https://t.co/1wLaKiwK6r
1027603217285357600,Thu Aug 09 17:11:13 +0000 2018,phir pursish-e jaraahat-e dil ko chalaa hai ishq saamaan-e sad-hazaar namak-daan kiye hu'e
1027602550768455700,Thu Aug 09 17:08:34 +0000 2018,from the situation of caution, again the breath has begun to stop years have gone by having torn the collar
1027602548029632500,Thu Aug 09 17:08:34 +0000 2018,phir vaz'-e ihtiyaat se rukne lagaa hai dam barson hu'e hain chaak-e garebaan kiye hu'e
946749565641691100,Fri Dec 29 14:27:40 +0000 2017,There's one wheel, and it keeps on revolving away. What is to happen keeps happening. If one could have any power,… https://t.co/GwQjY4tDFw
946729809530404900,Fri Dec 29 13:09:10 +0000 2017,Look at me--I'm neither free, nor imprisoned. I'm neither sick, nor healthy. I'm neither happy, nor unhappy. I'm ne… https://t.co/KJzG2y0B5P
946395674886651900,Thu Dec 28 15:01:26 +0000 2017,@iamrana @theabhayk The qita in discussion may be included on @Rekhta https://t.co/gMEXP4fUgS
946394437072044000,Thu Dec 28 14:56:31 +0000 2017,@iamrana @theabhayk The title is mentioned in the repository but unlike his other works this one is not linked to a pdf.
946351982658195500,Thu Dec 28 12:07:49 +0000 2017,May the heart in every thought be strong and may the thought be knowledgeable about what was and was not! May the l… https://t.co/Vo3aQMoO5b
946351191352422400,Thu Dec 28 12:04:41 +0000 2017,May the pain of the heart and the afflictions of your tender memories be considered from the effects of the kindnes… https://t.co/N9lnFJbYA7
946351056799252500,Thu Dec 28 12:04:08 +0000 2017,If the harms of the pen in advice-giving are not useful, put aside the letter and forgive the writer.
946350973756125200,Thu Dec 28 12:03:49 +0000 2017,The simple heart, always pointing in the direction of love, bloodied by the grief of strangers and acquaintances al… https://t.co/rFdZhPKV01
946350831120429000,Thu Dec 28 12:03:15 +0000 2017,He* pushed me to write a letter to you so that I might make manifest the measure of my knowledge in its measure of… https://t.co/9tkQZFNZqZ
946346348550414300,Thu Dec 28 11:45:26 +0000 2017,@shantanub @theabhayk @IAmSudhirMishra @atiyaz @TabeenahAnjum @DalrympleWill @iamrana @Razarumi @RachelMJDwyer… https://t.co/7Fip730tMj
946342652689002500,Thu Dec 28 11:30:45 +0000 2017,@shantanub @theabhayk @IAmSudhirMishra @atiyaz @TabeenahAnjum @DalrympleWill @iamrana @Razarumi @RachelMJDwyer… https://t.co/PqqwgO8SU6
946340430764851200,Thu Dec 28 11:21:55 +0000 2017,@DalrympleWill @theabhayk @IAmSudhirMishra @atiyaz @TabeenahAnjum @iamrana @Razarumi @RachelMJDwyer @Rekhta… https://t.co/QMgZHxWnHt
946337689678233600,Thu Dec 28 11:11:01 +0000 2017,@theabhayk @IAmSudhirMishra @atiyaz @TabeenahAnjum @DalrympleWill @iamrana @Razarumi @RachelMJDwyer @Rekhta… https://t.co/IxY8oWL3iV
946333612512706600,Thu Dec 28 10:54:49 +0000 2017,@theabhayk @IAmSudhirMishra @atiyaz @TabeenahAnjum @DalrympleWill @iamrana @Razarumi @RachelMJDwyer @Rekhta… https://t.co/hFZkyX0YC6
946327766768615400,Thu Dec 28 10:31:36 +0000 2017,@Sumhera1 ghurbat - to become a stranger or foreigner, to go to a foreign country, going abroad; the state or condi… https://t.co/IGBKMvhg6U
946072943028609000,Wed Dec 27 17:39:01 +0000 2017,@iamrana Oh those were the days. It was fun back then. I am keeping up with your work and travels even when I am no… https://t.co/mhpnXcQDAZ
946070510084833300,Wed Dec 27 17:29:21 +0000 2017,@theabhayk @IAmSudhirMishra @atiyaz @TabeenahAnjum @DalrympleWill @iamrana @Razarumi @RachelMJDwyer @Rekhta… https://t.co/rij0YqpsZA
946066159488483300,Wed Dec 27 17:12:04 +0000 2017,@theabhayk @IAmSudhirMishra @atiyaz @TabeenahAnjum @DalrympleWill @iamrana @Razarumi @RachelMJDwyer @Rekhta… https://t.co/ILKV0FU8P3
946062285214122000,Wed Dec 27 16:56:40 +0000 2017,@theabhayk @IAmSudhirMishra @atiyaz @TabeenahAnjum @DalrympleWill @iamrana @Razarumi @RachelMJDwyer @Rekhta… https://t.co/3NXYFryeYW
946037422814478300,Wed Dec 27 15:17:52 +0000 2017,gar museebat thi toh ghurbat* mein utha leta Asad meri Dilli hi mein honi thi yeh khvaaree* haaʾe haaʾe*  [ *1- ग़ु… https://t.co/JhDu3nvkIT
946033468923813900,Wed Dec 27 15:02:10 +0000 2017,Sometimes when I look at my earlier poetry and prose, I know that this is my composition, but I remain astonished--… https://t.co/v3mgBYwaQo
946033429488984000,Wed Dec 27 15:02:00 +0000 2017,Except for a single/particular/unique/excellent mastery [ek malkah] that's the result of fifty or fifty-five years… https://t.co/lYOQNMx09E
946026561018327000,Wed Dec 27 14:34:43 +0000 2017,dekhiyo Ghalib se gar uljhaa ko'ee hai valee* posheedah aur kaafir khulaa  [* saint ]
946026082498515000,Wed Dec 27 14:32:49 +0000 2017,In my early youth, an accomplished master gave me this advice: 'I don't seek asceticism and abstinence. I don't for… https://t.co/hHyEutSAL7
946023447401922600,Wed Dec 27 14:22:20 +0000 2017,sabzah-o-gul kahaan se aaʾe hain abr kya cheez hai havaa kyaa hai  haan bhalaa kar tera bhalaa hoga aur darvesh ki… https://t.co/VUMeiWwRoF
946022103085498400,Wed Dec 27 14:17:00 +0000 2017,It's my 220th birthday today.     "Eat, drink, and be merry, but remember that you should be a fly flitting around… https://t.co/wTydgEbaFt
940200064286310400,Mon Dec 11 12:42:18 +0000 2017,faraaghat (of which faraagh is a variant): Freedom (from business), cessation (from work), leisure, rest,freedom from care or anxiety, ease.
940198713925832700,Mon Dec 11 12:36:56 +0000 2017,dil se teri nigaah jigar tak utar ga'ee donon ko ik adaa mein razaamand kar ga'ee
940198326795886600,Mon Dec 11 12:35:23 +0000 2017,shaq* ho gayaa hai seenah khvushaa lazzat-e-faraagh* takleef-e-pardah-daari-e zakhm-e-jigar ga'ee  [ *1 -- split open, *2 --freedom ]
929200580173746200,Sat Nov 11 04:14:16 +0000 2017,#TheSufiRoute https://t.co/F5WxngfImE
911970201817755600,Sun Sep 24 15:06:54 +0000 2017,Ghalib mere kalaam mein kyunkar mazah nah ho peetaa hoon dho ke Khusrav-e sheereen-sukhan* ke paanv  * sweet-speaking/composing King/Khusrau
911969578837823500,Sun Sep 24 15:04:25 +0000 2017,shab ko kisee ke khvaab mein aayaa nah ho kaheen dukhte hain aaj us but-e naazuk-badan* ke paanv  * delicate-bodied idol
911330520776060900,Fri Sep 22 20:45:02 +0000 2017,Ghalib, I have a longing to embrace that one, the thought of whom is the rose of the neck-opening of the gown of the rose
911329778787024900,Fri Sep 22 20:42:05 +0000 2017,Ghalib mujhe hai us se hum-aagoshi aarzuu jis ka khayal hai gul-e jeb-e qabaa-e gul
911327354630393900,Fri Sep 22 20:32:27 +0000 2017,ग़ालिब मुझे है उस से हम-आग़ोशी आर्ज़ू जिस का ख़याल है गुल-ए जेब-ए क़बा-ए गुल
815491053469900800,Sun Jan 01 09:33:12 +0000 2017,@juneymb Not at all @AliyaNazki @iamrana
813802004577255400,Tue Dec 27 17:41:32 +0000 2016,haan khaa'iyo mat fareb-e-hastee har-chand kahein ke hai nahin hai  hastee hai na kuch 'adam hai Ghalib aakhir tu kya hai ay nahin hai
813801627853340700,Tue Dec 27 17:40:02 +0000 2016,har-chand* har ek shay mein tu hai par tujh-see koi shay nahin hai  [ *although ; shay /شے / शै  = thing ]
813794667254792200,Tue Dec 27 17:12:22 +0000 2016,On this day, in 1797, Ghalib was born in Agra. Today marks his 219th birth anniversary.
813779801865482200,Tue Dec 27 16:13:18 +0000 2016,Ghalib chhuti sharaab par ab bhi kabhi kabhi peeta hoon roz-e-abr-o-shab-e-maah taab* mein  [ * cloudy days and moonlit nights ]
764904583520923600,Sun Aug 14 19:20:38 +0000 2016,khudaya jazb'a-e-dil ki magar taseer ultee hai  ke jitna khenchtaa hoon aur khinchtaa jaye hai mujh se
764539259743264800,Sat Aug 13 19:08:58 +0000 2016,hasrat ay zauq-e kharaabi ki woh taaqat na rahi ishq-e pur-arbadah ki gau'n tan-e ranjoor nahi'n
764539158534684700,Sat Aug 13 19:08:34 +0000 2016,zulm kar zulm agar lutf dareg aata ho tu tagaaful mein kisi rang se maazoor nahi'n
758788069075980300,Thu Jul 28 22:15:47 +0000 2016,zuf mein taana-e-agyaar ka shikva kya hai baat kuch sar toh nahi hai ki utha bhi na sakun
740638012057358300,Wed Jun 08 20:13:57 +0000 2016,larazta hai mera dil zehmat-e-mihar-e darakhshaa'n par main hoon woh qatra-e shabnam ki ho khaar-e bayaabaa'n par
725594213635612700,Thu Apr 28 07:55:16 +0000 2016,giryah* chaahe hai kharaabee mere kaashaane* kee dar-o-deevaar se tapke hai bayaabaan* honaa  [*1= weeping *2= house *3= desert]
698922224313434100,Sun Feb 14 17:30:18 +0000 2016,haal-e dil nahin maloom lekin is qadar yanee hum ne baar-haa* dhoondhaa tum ne baar-haa paayaa  [ *= many times ]
698920906974896100,Sun Feb 14 17:25:04 +0000 2016,ishq se tabee'at ne zeest* kaa mazaa paayaa dard kee davaa paa'ee dard-e-be-davaa paayaa  [ *= life ]
698919654035558400,Sun Feb 14 17:20:05 +0000 2016,kahte ho na deinge hum dil agar padaa* paayaa dil kahaan kih gum* keeje hum ne mudda'aa paayaa  [ *1= پڑا पड़ा *2= گم गुम ]
698917141651673100,Sun Feb 14 17:10:06 +0000 2016,ishq par zor nahin hai yeh woh aatish Ghalib kih lagaa'e na lage aur bujhaa'e na bane
698914810637889500,Sun Feb 14 17:00:50 +0000 2016,kah sake kaun kih yeh jalvah-garee kis kee hai pardah chhoRaa hai woh us ne kih uthaa'e na bane
698913359702335500,Sun Feb 14 16:55:04 +0000 2016,is nazaakat ka buraa ho woh bhale hain to kya haath aavein to unhein haath lagaa'e na bane
698912106746290200,Sun Feb 14 16:50:06 +0000 2016,ghair phirta hai liye yoon tere khat ko kih agar ko'ee pooche kih yeh kya hai to chhupaa'e na bane
698910853651771400,Sun Feb 14 16:45:07 +0000 2016,main bulaataa to hoon us ko magar ay jazbah-e dil us peh ban jaa'e kuch aisee kih bin aa'e na bane
698909598422401000,Sun Feb 14 16:40:08 +0000 2016,nuktah-cheen* hai gum-e-dil us ko sunaa'e na bane kya bane baat jahaan baat banaa'e na bane  [ *= hypercritical, captious, nit-picker ]
698905167542906900,Sun Feb 14 16:22:31 +0000 2016,ishq ne Ghalib nikammaa kar diyaa varnah hum bhee aadmee the kaam ke
698904936474480600,Sun Feb 14 16:21:36 +0000 2016,khat likheinge garchih* matlab kuch nah ho hum to aashiq hain tumhaare naam ke  [ *= although ]
698904808862797800,Sun Feb 14 16:21:06 +0000 2016,ghair lein mehfil mein bose* jaam ke hum rahein yoon tishnah-lab* paigaam ke  [ *1= kisses *2= thirsty-lipped ]
694923158055309300,Wed Feb 03 16:39:26 +0000 2016,yoon hee gar rotaa rahaa Ghalib to ay ahl-e jahaan dekhna in bastiyon ko tum kih veeraan ho ga'een
694922490733133800,Wed Feb 03 16:36:47 +0000 2016,ranj : trouble; sorrow, grief, affliction; sadness; anguish of mind, distress; suffering, pain, hardship; pains, toil, inconvenience, etc.
694921141551390700,Wed Feb 03 16:31:25 +0000 2016,ranj se khoo-gar* hua insaan to mit jaataa hai ranj mushkilein mujh par padheen* itnee kih aasaan ho ga'een  [*1=accustomed *2= पड़ीं پڑیں ]
694918743776825300,Wed Feb 03 16:21:54 +0000 2016,vaan gayaa bhee main to un kee gaaliyon kaa kyaa javaab yaad theen jitnee du'aaien sarf-e darbaan* ho ga'een  [*expended on the doorkeeper]
694918117399527400,Wed Feb 03 16:19:24 +0000 2016,baskih = although pai bah pai =  one after another bakhyah-e-chaak-e-garebaan = the stitching-up of the tearing of the collar
694917701920100400,Wed Feb 03 16:17:45 +0000 2016,baskih rokaa main ne aur seene mein ubhreen pai bah pai meri aahein bakhyah*-e-chaak*-e-garebaan* ho ga'een  [ *stitching *tearing *collar ]
694915005645336600,Wed Feb 03 16:07:02 +0000 2016,joo*-e-khoon aankhon se bahne do kih hai shaam-e firaaq main yih samjhungaa kih sham'en do furozaan* ho ga'een  [*1= stream *2= illuminated]
694913165100863500,Wed Feb 03 15:59:44 +0000 2016,sab kahaan kuch laala-o-gul mein numaayaan* ho ga'een khaak mein kyaa suratein hongee ke pinhaan* ho ga'een  [ *1= apparent *2= concealed ]
694174635852591100,Mon Feb 01 15:05:04 +0000 2016,kuch to parhye* kih log kahte hain  aaj Ghalib ghazal-saraa* na huaa  [ *= पढ़ये , پڑھیے   *= reciter ]
694173326168559600,Mon Feb 01 14:59:52 +0000 2016,kitne sheereen* hain tere lab kih raqeeb* gaaliyaan khaa ke be-mazaa na huaa  [ *1= sweet *2= rival ]
694172512809136100,Mon Feb 01 14:56:38 +0000 2016,dard minnat-kash-e* davaa na huaa main na achchhaa huaa buraa na huaa  [ * = indebted to, favour, obligation ]
693478432777187300,Sat Jan 30 16:58:37 +0000 2016,na gul-e-nagma hoon na parda-e-saaz main hoon apni shikast ki aawaz
679686243005763600,Wed Dec 23 15:33:22 +0000 2015,aaye hai bekasee-e ishq pe rona Ghalib kis ke ghar jayega sailaab-e balaa mere baad
679686154354962400,Wed Dec 23 15:33:01 +0000 2015,gum se marta hoon ke itna nahin duniya mein koi ke kare taaziyat-e mihr-o-vafa mere baad
666586498146443300,Tue Nov 17 11:59:40 +0000 2015,Ghalib: Passion is the enemy of proper possession. Qais, who in life wandered around naked, remained naked even within the veil of a picture
666585964156989400,Tue Nov 17 11:57:33 +0000 2015,shauq har rang raqeeb-e sar-o-saamaan niklaa qais* tasveer ke parde mein bhi uryaan* niklaa  [*1= Majnun's real name *2= naked]
622408194560774100,Sat Jul 18 14:10:52 +0000 2015,Just see my shame! They counted my good deeds and found None but a single fast I kept - and broke with wine.
622407603939868700,Sat Jul 18 14:08:31 +0000 2015,hum muvahhid hain humara kesh hai tark-e rusoom millatein jab mit gayeen ajzaa-e eemaan ho ga'een.
622407392018493400,Sat Jul 18 14:07:40 +0000 2015,My prayer the world cannot divine: it shuns all symbols and shrines. I know the road that leads to Thee while these are at best road-signs.
611825616782929900,Fri Jun 19 09:19:28 +0000 2015,@iamrana Utter rubbish! Do ghoont and more is needed to wash this out my memory. @gulrayys @husainhaqqani @baawraman
611439465664413700,Thu Jun 18 07:45:03 +0000 2015,ham wahaan hain jahaan se ham ko bhee kuch hamaaree khabar naheen aatee  ka'abe kis munh se jaaoge 'Ghalib' sharm tum ko magar naheen aatee
611438677688889300,Thu Jun 18 07:41:55 +0000 2015,jaanta hoon savaab-e-taa'at-o-zuhd* par tabee'at idhar naheen aatee  [*= reward/merit of obedience and abstinence/devotion]  Ramzan Mubharak
611215314018144300,Wed Jun 17 16:54:21 +0000 2015,Bravo! What a merry party! (Out, out: ye evil eye!) That it should turn into a song my each intruding sigh!
611213842190741500,Wed Jun 17 16:48:30 +0000 2015,May the evil eye spare your musical gathering - bravo! My laments, if arrive at that festive court, become songs.
611208753833087000,Wed Jun 17 16:28:17 +0000 2015,door chashm-e-bad* teri bazm-e-tarab* se wah wah nagma ho jaataa hai vaan gar naala mera jaa'e hai  [*1= evil eye *2= festive gathering ]
610831008263487500,Tue Jun 16 15:27:15 +0000 2015,sab kahaan kuch laala-o-gul mein numaayaan* ho ga'een khaak mein kyaa suratein hongee ke pinhaan* ho ga'een  [ *1= apparent *2= concealed ]
604594921308192800,Sat May 30 10:27:16 +0000 2015,@iamrana If not for an official puprose, then its possible that he stayed over at a patrons place for work or in hope for a loan.
604594068522299400,Sat May 30 10:23:53 +0000 2015,@iamrana Banda was connected to major travel routes. Its possible that the British had an adminstritive office there.
604592551841038300,Sat May 30 10:17:51 +0000 2015,@iamrana While going to Calcutta, he stayed there for six months. And while coming back to Delhi for a week. No letters of that time exist.
596987425957630000,Sat May 09 10:37:48 +0000 2015,dil se havaa-e-kisht-e-vafaa* mit ga'ee ke vaan haasil sivaa-e-hasrat-e-haasil nahin rahaa  [* =desire for the cultivation of faithfulness]
596986069482016800,Sat May 09 10:32:25 +0000 2015,go = although  raheen-e-sitamha-e-rozgaar  = mortgaged/pawned/pledged to the cruelties of everyday life  gaafil = heedless/negligent
596985377115615200,Sat May 09 10:29:40 +0000 2015,go* main rahaa raheen-e-sitamha*-e-rozgaar lekin tere khayaal se gaafil* nahin rahaa  [*1=although *2=pledged to the cruelties *3=negligent]
574827306536951800,Mon Mar 09 07:01:24 +0000 2015,tangee-e-dil ka gila kya yeh woh kaafir dil hai  ke agar tang na hota toh pareshaan hota
574635532342317060,Sun Mar 08 18:19:21 +0000 2015,mujh se mat keh tu humein kehta tha apni zindagi zindagi se bhi mera jee in dinon be-zaar hai
574635406945189900,Sun Mar 08 18:18:51 +0000 2015,ek ja haraf-e-wafa likha tha so bhi mit gaya zaahiran kaagaz tere khat ka galat-bardaar hai
560847275371409400,Thu Jan 29 17:09:45 +0000 2015,phir hue hain gavaah-e-ishq talab ashk-baree ka hukm jaree hai  be-khvudee be-sabab nahin Ghalib kuch to hai jis kee pardah-daree hai
560846344022016000,Thu Jan 29 17:06:03 +0000 2015,phir jigar khodne laga naakhun aamad-e-fasl-e-laalah-karee* hai  [ *= tulip-making ]
548894606218117100,Sat Dec 27 17:34:06 +0000 2014,jalaa hai jism jahaan dil bhi jal gaya hoga kuredte ho jo ab raakh justajoo kya hai
548893698100953100,Sat Dec 27 17:30:30 +0000 2014,Born on December 27, 1797. Today is Mirza Ghalib's 217th birth anniversary.
548891511639658500,Sat Dec 27 17:21:48 +0000 2014,zindagi mein toh woh mehfil se utha dete the  dekhun ab mar gaye par kaun uthaata hai mujhe
519165658794168300,Mon Oct 06 16:41:53 +0000 2014,woh firaaq* aur woh visaal* kahaan woh shab-o-roz-o-maah-o-saal kahaan  [ *1= separation *2= union ]
519165403184893950,Mon Oct 06 16:40:52 +0000 2014,aisa aasaan nahin lahoo rona dil mein taaqat jigar mein haal kahaan
519164775373103100,Mon Oct 06 16:38:22 +0000 2014,fursat-e-kaar-o-baar-e-shauq kise zauq*-e-nazzaara-e-jamaal* kahaan  [ *1= relish *2= beauty ]
496356371479023600,Mon Aug 04 18:05:55 +0000 2014,phir diya paarah-e-jigar ne savaal ek faryaad-o-aah-o-zaaree hai  phir hue hain gavaah-e-ishq talab ashk-baari ka hukm jaaree hai
496177450259193860,Mon Aug 04 06:14:57 +0000 2014,main hoon aur afsurdagi ki aarzoo ghalib ke dil dekh kar tarz-e tapaak-e ehl-e duniya jal gaya
