id,created_at,text
187858744737148930,Thu Apr 05 11:06:29 +0000 2012,main bhi muunh mein zabaan rakhtaa hu // kaash puuchho ki muddaa kya hai
187615673294401540,Wed Apr 04 19:00:36 +0000 2012,Hu.n garmi-e-nashaat-e-tasavvur se naghma-sanj // main andalib-e-gulshan na-afrida hu.n
187615441068363780,Wed Apr 04 18:59:41 +0000 2012,I sing away, warmed by the ecstasy of imagination //  I’m the nightingale of a garden not yet created.
187604117546479600,Wed Apr 04 18:14:41 +0000 2012,When somebody asked Ghalib for his postal address, he replied -  "Asadullah Ghalib, Delhi, kafi hoga"
187591499918225400,Wed Apr 04 17:24:33 +0000 2012,RT @MirPoetry: Blog - The Chronicles of Mir Taqi Mir - http://t.co/q75KyHk2  Also checkout the new layout of the blog :-)  RT+ Thanks
187515951086960640,Wed Apr 04 12:24:21 +0000 2012,dil-e-naadaan tujhe huaa kya hai // aakhir is dard kii davaa kya hai
187270721041481730,Tue Apr 03 20:09:53 +0000 2012,maut kaa ek din muayyan hai // neend kyu raat bhar nahiin aati. [muayyan=definite]
187241506787176450,Tue Apr 03 18:13:48 +0000 2012,Tarz-e ‘Bedil’* mein rekhtah likhnaa // Asad Ullaah Khan qayaamat hai. [ *= to write in Bedils style ] - http://t.co/8Mk9LK2k
187237456792395780,Tue Apr 03 17:57:43 +0000 2012,Bedil has been called ‘Ghalib’s Ghalib’ - Read Ghalibs Letter about Poetry and 'Bedil'  - Who inspired Ghalib ?  - http://t.co/8Mk9LK2k
187236449404452860,Tue Apr 03 17:53:42 +0000 2012,First correct Answer is from @ans_ameer and then @airtiza - Answer - 'Abdul-Qādir Bēdil'. Check the Blog for more -  http://t.co/8Mk9LK2k
187216043947728900,Tue Apr 03 16:32:37 +0000 2012,@Dilli16 No, its not Mir Taqi Mir :-) One more hint - Ghalibs writing is similar to that poet in terms of style and complexity.
187213948393758720,Tue Apr 03 16:24:18 +0000 2012,Question - Who inspired Ghalib to write ? - Hint - Ghalib says - I cannot write like him, his style is like Qayamat
187211302496776200,Tue Apr 03 16:13:47 +0000 2012,RT @MirPoetry: Mir was no less proud than Ghalib about his poetry, Mir use to arrogantly called his peers insects.
187197072037003260,Tue Apr 03 15:17:14 +0000 2012,aage aati thi haal-e dil pe hansi // ab kisi baat par nahiin aatii
187128574908698620,Tue Apr 03 10:45:03 +0000 2012,Ghalib was bald, from the time he started sporting a beard, he choose to shave his head.
187116634694103040,Tue Apr 03 09:57:36 +0000 2012,ishq par zor nahiin hai yeh woh aatish 'Ghalib' // ki lagaae na lage aur bujhaae na bane [aatish=fire]
187064568902717440,Tue Apr 03 06:30:43 +0000 2012,Divaan-e-Ghalib has a total of 234 ghazals only.
186861892344610800,Mon Apr 02 17:05:21 +0000 2012,hai bas ki har ik unke ishaare men nishaan aur // karte hain muhabbat to guzartaa hai gumaan aur. [gumaan=doubt]
186830583538786300,Mon Apr 02 15:00:56 +0000 2012,Letters of Mirza Ghalib - 1 -  http://t.co/KBUTE0O5 Letter sent by Ghalib to his friend with 2 famous Ghazals. Checkout Ghalibs Handwriting.
186513075338350600,Sun Apr 01 17:59:17 +0000 2012,khudaa ke vaaste parda na kabah se uthaa zaalim // kahi aisa na ho yaan bhi wohi kaafir sanam nikle- Not by Ghalib -  http://t.co/ie77YT2g
186509444979507200,Sun Apr 01 17:44:51 +0000 2012,Not by Mirza Ghalib –  Couplets which are not written by Ghalib, Please read the post on my blog - http://t.co/ie77YT2g
186497283695706100,Sun Apr 01 16:56:32 +0000 2012,When singers would alter a poet's verses in his lifetime, what would prevent the musicians from jumbling up two dead poets' verses? - Ghalib
186495198447149060,Sun Apr 01 16:48:14 +0000 2012,This is not Ghalib! @muhemmedirfan Khuda kay waastay parda na Ka'abay say utha zaalim // Kahin aisa na ho yahan bhi, wohi kaafir sanam nikle
186440543901978620,Sun Apr 01 13:11:04 +0000 2012,muhabbat mein nahin hai farq jeene aur marne ka // usi ko dekh kar jeete hain jis kaafir pe dum nikle. [kaafir=unfaithful]
186106669967753200,Sat Mar 31 15:04:22 +0000 2012,hazaaron khvaahishen aisi ki har khvaaish pe dum nikle // bahut nikle mere armaan lekin phir bhi kam nikle.
185765877872988160,Fri Mar 30 16:30:11 +0000 2012,#ff Follow some of my other, lesser known efforts - @FaizPoetry @FarazPoetry_ @IqbalPoetry_  @MirPoetry
185765067315347460,Fri Mar 30 16:26:58 +0000 2012,yaa rab vo na samjhe hain na samjhenge meri baat // de aur dil unko jo na de mujhko zubaan aur
185759648685633540,Fri Mar 30 16:05:26 +0000 2012,The ghazal which you see in the pic is an unedited version of Naqsh Faryaadi. Ghalib later edited it. Ex - vehshat was erased from  verse 2
185757678822359040,Fri Mar 30 15:57:36 +0000 2012,The Ghazal in Ghalib's handwriting ( http://t.co/RSd3vxSz )  is 'Naqsh Faryaadi', the first ghazal of the Divan.
185741947208597500,Fri Mar 30 14:55:06 +0000 2012,Ghalib's handwriting - http://t.co/RSd3vxSz
185709873256869900,Fri Mar 30 12:47:39 +0000 2012,Graves of the Taj Mahal - What lies beneath - http://t.co/A42q1yGL
185683100641144830,Fri Mar 30 11:01:15 +0000 2012,There is no place for me in any heart // Melodious is my work, but still unheard.
185387583344353280,Thu Mar 29 15:26:58 +0000 2012,bak raha hu junoon mein kya kya kuch // kuch na samajhe khudaa kare koi.
185363244976832500,Thu Mar 29 13:50:16 +0000 2012,hum ko maaluum hai jannat ki haqiiqat lekin // dil ke khush rakhne ko 'Ghalib' ye khayaal achchha hai
184645280954720260,Tue Mar 27 14:17:20 +0000 2012,jaan tum par nisaar karta hu // main nahi jaantaa dua kya hai
184565621642629120,Tue Mar 27 09:00:47 +0000 2012,"Ghalib" buraa na maan jo waiz buraa kahen // aisa bhi koi hai ke sab achchhaa kahen jise. [ waiz = preacher ]
184311684670828540,Mon Mar 26 16:11:44 +0000 2012,hum ne maanaa ke tagaaful na karoge lekin // khaak ho jaayenge hum tum ko khabar hone tak. [tagaaful=neglect/ignore]
184204439601688580,Mon Mar 26 09:05:35 +0000 2012,Anna Hazare - The Real Story  - http://t.co/XVFUzkug  Justice Sawant (Supreme Court) found Anna to be corrupt and his fast is a gimmick.
183953848627511300,Sun Mar 25 16:29:49 +0000 2012,rahi na taaqat-e-guftaar aur agar ho bhi // to kis ummiid pe kahiye ke aarzoo kyaa hai. [guftaar=speech]
183935895144116220,Sun Mar 25 15:18:29 +0000 2012,baaziichaa-e-atfaal* hai duniyaa mere aage // hotaa hai shab-o-roz tamaashaa mere aage. [ *= child's play/playground]
183879475761655800,Sun Mar 25 11:34:18 +0000 2012,Partition 1947 - Making joint efforts - Its sad that we wait for a catastrophe to show our humanity ~ http://t.co/MGpVPTnm
183214794822787070,Fri Mar 23 15:33:05 +0000 2012,tum apne shikve ki baaten na khod khod ke puuchho // hazar karo mere dil se ki us mein aag dabi hai. [hazar = caution. be wary]
182855709929644030,Thu Mar 22 15:46:13 +0000 2012,milnaa tera agar nahiin aasaan to sahl hai // dushvaar to yehi hai ki dushvaar bhi nahiin. [ sahl = simple ]
182385086908469250,Wed Mar 21 08:36:07 +0000 2012,kehate hai jeete hai ummiid pe log // hum ko jeene ki bhi ummiid nahiin
182087492844011520,Tue Mar 20 12:53:35 +0000 2012,Mushkilein mujh par paDi itni ke aasaan ho gayi
181993601272791040,Tue Mar 20 06:40:30 +0000 2012,Dard ka hadd se guzarnaa hai davaa ho jaana
179156739223060480,Mon Mar 12 10:47:49 +0000 2012,Dard ho dil mein to davaa kijiye // Dil hi jab dard ho to kyaa kijiye // humko fariyaad karni aati hai // aap sunte nahi to kyaa kijiye
178807153241493500,Sun Mar 11 11:38:42 +0000 2012,woh aaye ghar mein humaare khudaa kii kudarat hai // kabhi hum unko kabhi apne ghar ko dekhte hai.
178062410039558140,Fri Mar 09 10:19:21 +0000 2012,dil se teri nigaah jigar tak utar gaii // dono ko ik adaa mein razaamand kar gaii. [ razaamand = willing/consenting ]
177449150495989760,Wed Mar 07 17:42:28 +0000 2012,qaid-e-hayaat-o-band-e-gum* asl mein dono ek hain // maut se pehle aadamii gum se nijaat paaye kyun. [*=prison of life and chains of sorrow]
177448861026103300,Wed Mar 07 17:41:19 +0000 2012,[qaid-e-hayaat=prison of life; band-e-gum=bindings/chains of sorrow; nijaat =freedom/liberation]
177408838528536580,Wed Mar 07 15:02:17 +0000 2012,guncha phir lagaa khilne aaj hum ne apnaa dil // khuun* kiyaa huaa dekhaa guum* kiyaa huaa paayaa [ *1=flower bud *2=ख़ूं   *3=गुम ]
177299386907365380,Wed Mar 07 07:47:22 +0000 2012,qataraa dariyaa mein jo mil jaaye to dariyaa ho jaaye // kaam achchaa hai vo jiskaa ma'aal achchhaa hai. [ma'aal=result]
176989386439798800,Tue Mar 06 11:15:32 +0000 2012,kehte ho na denge hum dil agar paDaa paayaa // dil kahaan ki gum kiije hum ne muddaa paayaa.
176716606796349440,Mon Mar 05 17:11:36 +0000 2012,ishq se tabiiat ne zeest ka mazaa paayaa // dard ki davaa paaii dard-e be-davaa paayaa. [ zeest=life ]
176671397576318980,Mon Mar 05 14:11:58 +0000 2012,hue hai paaon hi pehle nabard-e-ishq* mein zakhmi // naa bhaagaa jaae hai mujh se na thahraa jaae hai mujh se. [*=battle/war of love]
176667882846035970,Mon Mar 05 13:58:00 +0000 2012,udhar wo bad-gumaani* hai idhar ye naa-tavaani* hai // na puuchha jaae hai us se na bolaa jaae hai mujh se. *1=doubt *2=inability; weakness
176656219967197200,Mon Mar 05 13:11:39 +0000 2012,Ghalib's language of Urdu poetry became such an ideal for later poets that the attempt to attain it became a lifelong project for them.
176652578849964030,Mon Mar 05 12:57:11 +0000 2012,mat puchh ke kya haal hai mera tere piichhe // tuu dekh ke kyaa rang hai tera mere aage
176617806161391600,Mon Mar 05 10:39:01 +0000 2012,'Bhai shaairii manii-aafiriinii hai qaafiyah-pemaaii nahi hai' (My friend, poetry is meaning-creation, it's not the measuring-out of rhymes)
176585045333643260,Mon Mar 05 08:28:50 +0000 2012,koi din gar zindagani aur hai // apne jee mein humne thaanii aur hai.
176276072894181380,Sun Mar 04 12:01:05 +0000 2012,daayam padaa huaa tere dar par nahi hu main // khaak aisii zindagii pe ke paththar nahi hu main. [daayam=forever]
175927172228329470,Sat Mar 03 12:54:41 +0000 2012,jab tavaqqo hii uth gayii "Ghalib" // kyun kisii kaa gilaa kare koii. [tavaqqo=expectations; gilaa=complaint]
175907515060588540,Sat Mar 03 11:36:34 +0000 2012,From the day when I began to keep a beard, I shaved my head - Ghalib in a letter to Mirza Hatim Ali Mihr.
175903699808419840,Sat Mar 03 11:21:24 +0000 2012,Masters of poetry request me to compose easy verse. If I say something, it's difficult--if I don't say something, it's difficult.
175863419700916220,Sat Mar 03 08:41:21 +0000 2012,jalaa hai jism jahaà dil bhi jal gayaa hogaa // kuredate ho jo ab raakh justajuu kyaa hai
175619412160811000,Fri Mar 02 16:31:46 +0000 2012,Garden of the Taj Mahal - 1870's - http://t.co/rxoEwf5F
175576431697469440,Fri Mar 02 13:40:58 +0000 2012,Ghalib's imagination was soaring and subtle [aasmaanii aur baariik], Mir's imagination was earthy and unbridled [zamiinii aur be-lagaam].
175571883339690000,Fri Mar 02 13:22:53 +0000 2012,lover-ness is endurance-demanding, and longing is restless
175571845532221440,Fri Mar 02 13:22:44 +0000 2012,aashiqii sabr-talab aur tamannaa betaab.....love...patience....cravings ... desire... restless...
175546132032790530,Fri Mar 02 11:40:34 +0000 2012,In passion there is certainly torment, and I don't have the strength and power to support the delight of torment.
175545763563184130,Fri Mar 02 11:39:06 +0000 2012,Without passion it's difficult to pass one's life
175332252752949250,Thu Mar 01 21:30:41 +0000 2012,rahii na taaqat-e-guftaar aur agar ho bhii // to kis ummiid pe kahiye ke aarzuu kyaa hai  [guftaar=speech]
175126073334439940,Thu Mar 01 07:51:24 +0000 2012,hum bhii dushman to nahi hain apne // gair ko tujh se mohabbat hii sahii
175125996796780540,Thu Mar 01 07:51:05 +0000 2012,qataa kiije na ta'alluq hum se // kuchh nahii.n hai to adaavat hii sahii [ qataa=to break; ta'alluq=relation; adaavat=enmity ]
174917901449564160,Wed Feb 29 18:04:12 +0000 2012,dikhaa ke jumbish*-e lab hii tamaam* kar hum ko // na de jo bosa to munh se kahiin javaab to de. [*1=movement *2=finish *3=kiss ]
174917227559133200,Wed Feb 29 18:01:31 +0000 2012,Having shown only a movement of the lip, finish us off //  if you wouldn't give a kiss, then with your mouth do somehow give an answer!
174917079433097200,Wed Feb 29 18:00:56 +0000 2012,Use only the movement of the lips as a sword. and slay us. If you don't agree to give a kiss, then give a clear refusal and we will be slain
174836390377439230,Wed Feb 29 12:40:18 +0000 2012,guncha-e naa-shigufta ko duur se mat dikhaa kih yuun // bose ko puuchhtaa huun main munh se mujhe bataa ki yuun.
174836160093360130,Wed Feb 29 12:39:23 +0000 2012,Don't show from afar an unopened bud-- 'like this' // I ask about/for a kiss-- tell me with your mouth: 'like this'
174836051565752320,Wed Feb 29 12:38:57 +0000 2012,I asked how people kiss. You fell silent.Although silent lips too are the image of a kiss,I dont want only this much.Tell me with your lips
174751798316371970,Wed Feb 29 07:04:10 +0000 2012,be-aitadaaliyon* se subuk* sab mein hum hue // jitne ziyaadaa ho gaye utne hii kam hue.[*1= intemperatness/immoderation ; *2=embarrassed]
174501255476031500,Tue Feb 28 14:28:36 +0000 2012,hamaare sher hain ab sirf dillagii ke 'Asad' // khulaa ki faaida arz-e hunar mein khaak nahi.
174500712112341000,Tue Feb 28 14:26:26 +0000 2012,Now neither do people value fine composition, nor can they understand the excellence of verses.
174500548387684350,Tue Feb 28 14:25:47 +0000 2012,Oh Asad, now we only compose poetry to divert the heart. It has been confirmed by experience that in the expression of art there's no profit
174486790449795070,Tue Feb 28 13:31:07 +0000 2012,sunte hain jo bihisht* kii tariif sab durust // lekin khudaa kare wo tera jalvah-gaah* ho. [ *1=heaven *2= manifestation place ]
174485643672551420,Tue Feb 28 13:26:33 +0000 2012,When we hear praise of Paradise, it's all very well //  But may the Lord grant that it would be your manifestation place!
174485438118109200,Tue Feb 28 13:25:44 +0000 2012,Praise of Paradise is all appropriate, may the Lord grant that you too would be there! if you're not there, then Paradise is nothing at all.
174392032129847300,Tue Feb 28 07:14:35 +0000 2012,dard ho dil me to dava kijiye // dil hi jab dard ho to kya kijiye.
174122114423599100,Mon Feb 27 13:22:01 +0000 2012,dekhaa 'Asad' ko khalvat-o-jalvat* mein baar-haa* // diivaanaa gar nahi hai to hushyaar bhi nahi. [*1=private and public ; *2=many times]
174121886282825730,Mon Feb 27 13:21:07 +0000 2012,We saw 'Asad' in private and public a number of times // If he's not mad, then he's also not sane.
174121844415279100,Mon Feb 27 13:20:57 +0000 2012,We have seen 'Asad' in solitude, and also in company. In our opinion, if we cannot call him insane, then we also can't call him sane.
173686856737767420,Sun Feb 26 08:32:28 +0000 2012,phuunkaa hai kis ne gosh-e muhabbat me aey khudaa // afsuun*-e intezaar tamannaa kahen jise. [ *=charm, verses used in spells ]
173686590718214140,Sun Feb 26 08:31:24 +0000 2012,who has blown/breathed in the ear of love, oh Lord // the incantation of waiting/expectation, which they would call 'longing'?
173686483163676670,Sun Feb 26 08:30:59 +0000 2012,Oh Lord, who has blown into the ear of love such an incantation of waiting, which they call 'longing'?
173686455049261060,Sun Feb 26 08:30:52 +0000 2012,It is surprising that the moment love appears, longing too is produced.
173262375166820350,Sat Feb 25 04:25:44 +0000 2012,zaraa kar zor siine par kih tiir-e pur-sitam nikle // jo vuh nikle to dil nikle jo dil nikle to dam nikle - http://t.co/NdM1d7zY
173033961382088700,Fri Feb 24 13:18:06 +0000 2012,naachaar bekasii ki bhi hasrat uthaaiye // dushvaarii-e rah-o-sitam-e ham-rahaan na puuch - http://t.co/0xeXjO3y
173031685653413900,Fri Feb 24 13:09:04 +0000 2012,hai sabza-zaar har dar-o-diivaar-e gum-kadaa // jis ki bahaar ye ho phir us ki khizaan na puuch - http://t.co/XIc1bBXr
172261559907782660,Wed Feb 22 10:08:51 +0000 2012,laraztaa hai mera dil zehmat-e mihr-e darakshaan par // main hu wo qatrah-e shabnam ki ho khaar-e bayaabaan par http://t.co/JdOmjgfl
172043800657666050,Tue Feb 21 19:43:33 +0000 2012,pila de oak se saaqi jo humse nafrat hai // pyaala gar nahi deta na de, sharaab to de.[oak=palm of the hand contracted so as to hold fluid]
171841943360389120,Tue Feb 21 06:21:26 +0000 2012,magar likhavaaye koii usko khat to humse likhavaaye // huii subah aur ghar se kaan par rakkhar qalam nikle.
171328371769348100,Sun Feb 19 20:20:41 +0000 2012,karne gaye the us se tagaaful kaa hum gilaa // kii ek hii nigaah ki bas khaak ho gae. [tagaaful=negligence, gilaa=complaint]
170446296648388600,Fri Feb 17 09:55:38 +0000 2012,haal-e dil nahiin maluum lekin is qadar yanii // hum ne baar-haa dhuundhaa tum ne baar-haa paayaa.
170445840496861200,Fri Feb 17 09:53:49 +0000 2012,The state of the heart is not known-- except to this extent, that is // many times we sought it, many times you found it.
170226530365079550,Thu Feb 16 19:22:22 +0000 2012,hum ne maanaa ke tagaaful na karoge lekin // khaak ho jaayenge hum tum ko khabar hone tak. [tagaaful=neglect/ignore]
169775061048365060,Wed Feb 15 13:28:23 +0000 2012,huii muddat ke 'Ghalib' mar gayaa par yaad aataa hai // wo har ek baat pe kehanaa ke yu hotaa to kyaa hotaa. [muddat=duration/period ]
169719834937016320,Wed Feb 15 09:48:56 +0000 2012,jalaa hai jism jahaan dil bhii jal gayaa hogaa // kuredate ho jo ab raakh justajuu kyaa hai
169693966722277380,Wed Feb 15 08:06:09 +0000 2012,maaraa zamaane ne Asadullaah Khan tumhen // vo valvale kahaan vo javaanii kidhar gaii. [ valvale=wailing, crying ]
169685043042721800,Wed Feb 15 07:30:41 +0000 2012,Today marks Ghalib's 143rd Death Anniversary - gum-e-hastii kaa 'Asad' kis se ho juz marg ilaaj. [juz = other than; marg = death]
169669036978880500,Wed Feb 15 06:27:05 +0000 2012,uRdtii phire hai khaak meri kuu*-e yaar mein // baare ab aye havaa havas-e baal-o-par* gaii [*1= street ;*2=feathers and wings]
169668741817311230,Wed Feb 15 06:25:54 +0000 2012,Flying, my dust wanders around in the street of the beloved // finally now, oh wind, the desire for/of feather and wing has gone.
169668652101144580,Wed Feb 15 06:25:33 +0000 2012,I longed to grow wings and feathers. This wish was not fulfilled. But after death, my dust flies around enjoying the street of the beloved.
169659588713512960,Wed Feb 15 05:49:32 +0000 2012,hum vahaan hai jahaan se hum ko bhi // kuch hamaari khabar nahi aatii // marte hain aarzuu me marne kii // maut aatii hai par nahi aatii.
169653911244898300,Wed Feb 15 05:26:59 +0000 2012,jaan tum par nisaar kartaa hu / main nahi jaantaa duaa kyaa hai / main ne maanaa ki kuch nahi 'Ghalib' / muft haath aaye to buraa kyaa hai
169522049876897800,Tue Feb 14 20:43:00 +0000 2012,Death Anniversary - "Ghalib"-e-khastaa ke bagair kaun se kaam band hain // roiie zaar-zaar kyaa, kiijie haaye-haaye kyu.[khastaa=wretched]
169498138623754240,Tue Feb 14 19:08:00 +0000 2012,yeh laash-e be-kafan Asad-e khastah-jaan* kii hai // haq magfirat* kare ajab aazaad mard thaa. [ *1=heartsick *2=forgiveness, pardon. ]
169498020273061900,Tue Feb 14 19:07:31 +0000 2012,This corpse without a shroud is that of heartsick Asad // may God have mercy on him-- he was a strangely free man! -Death Anniversary today.
169492158569652220,Tue Feb 14 18:44:14 +0000 2012,143 years ago on 15 February 1869 Mirza Asadullah Baig Khan ''Ghalib'' breathed his last. Rest in Peace
169484925953773570,Tue Feb 14 18:15:29 +0000 2012,hai bas ki har ik unke ishaare men nishaan aur // karte hain muhabbat to guzartaa hai gumaan aur. [gumaan=doubt]
169479331201032200,Tue Feb 14 17:53:15 +0000 2012,tere vaade par jiye hum to ye jaan jhuuth jaanaa // ke khushii se mar na jaate agar aitabaar hotaa.
169468548996005900,Tue Feb 14 17:10:25 +0000 2012,phir usii bevafaa pe marte hain // phir vahii zindagii hamaarii hai.
169465028578250750,Tue Feb 14 16:56:25 +0000 2012,ishq par zor nahi, hai ye vo aatish 'Ghalib' // ki lagaaye na lage aur bujhaaye na bane.  [aatish=fire ]
169331108809420800,Tue Feb 14 08:04:17 +0000 2012,muhabbat me nahi hai farq jiine aur marne kaa // usii ko dekh kar jiite hain jis kaafir pe dam nikle.
169105137044955140,Mon Feb 13 17:06:21 +0000 2012,RT @FaizPoetry: A timeline of Faiz Ahmed Faiz’s life and some of his pics - http://t.co/HHmpHCyH
168976477524729860,Mon Feb 13 08:35:06 +0000 2012,zindagii yu bhii guzar hii jaatii // kyon tera raah-guzar yaad aayaa // aah wo jurrat-e-fariyaad kahaa // dil se tang aake jigar yaad aayaa.
168948387343892480,Mon Feb 13 06:43:29 +0000 2012,RT @FaizPoetry: Happy Birthday to Faiz Ahmed Faiz. The legend turns 101 today.
168618987733786620,Sun Feb 12 08:54:34 +0000 2012,na gul-e naghma huun na parda-e saaz // main huun apnii shikast kii aavaaz.
168618856473042940,Sun Feb 12 08:54:02 +0000 2012,No song am I, nor harmony complete // I am but the voice of my own defeat.
168611137540194300,Sun Feb 12 08:23:22 +0000 2012,Whitney Houston - 'Rest In Peace' - ''So I'll go, but I know I'll think of you every step of the way. and I will always Love you.
168403459006140400,Sat Feb 11 18:38:08 +0000 2012,dard minnat kashe-davaa na huaa // main na achchaa huaa, buraa na huaa. [minnat kashe-davaa=obliged to medicine]
168350025863282700,Sat Feb 11 15:05:52 +0000 2012,A closer view of the Golden Temple ( Harmandir Sahib ) - Amritsar Punjab - 1880's - http://t.co/raeM1sF8
168347682845364220,Sat Feb 11 14:56:30 +0000 2012,Golden Temple ( Harmandir Sahib ) - Amritsar Punjab - 1880's - http://t.co/UrEtilY7
168336770415599600,Sat Feb 11 14:13:08 +0000 2012,Awesome - Taj Mahal 1874 - http://t.co/nI3schvs
168332114352283650,Sat Feb 11 13:54:38 +0000 2012,No wonder Mirza Ghalib was so impressed by the city - Hoogly River, Calcutta 1900's - http://t.co/LjaVBtiW
168326580291112960,Sat Feb 11 13:32:39 +0000 2012,Calcutta in the early 1900's - 'Calcutte ka jo zikr kiya tu ne hum-nashein // Ek teer mere seene mein mara ke hai hai' http://t.co/REaftNcZ
168320449372094460,Sat Feb 11 13:08:17 +0000 2012,Calcutte ka jo zikr kiya tu ne hum-nashein // Ek teer mere seene mein mara ke hai hai. Video - http://t.co/IbuDAyVX
168313559929987070,Sat Feb 11 12:40:54 +0000 2012,The name ''Bombay'' possibly originated as the old Portuguese phrase bom baim, meaning "good little bay".
168272852104122370,Sat Feb 11 09:59:08 +0000 2012,is saadagii pe kaun na mar jaaye ae khudaa // laDte hain aur haath mein talwaar bhii nahiin.
168027810806513660,Fri Feb 10 17:45:26 +0000 2012,qahar ho ya balaa ho, jo kuchh ho // kaash ke tum mere liye hote // aa hii jaataa vo raah par 'Ghalib'  // koii din aur bhii jiye hote.
167923989996503040,Fri Feb 10 10:52:53 +0000 2012,He gave me heaven and earth, and assumed I'd be satisfied; Actually I was too embarrassed to argue.
167914946913509380,Fri Feb 10 10:16:57 +0000 2012,Oh, Lord, it is not the sins I have committed that I regret, but those which I have had no opportunity to commit.
167914493819621380,Fri Feb 10 10:15:09 +0000 2012,God is one, that is our faith; / All ritual we abjure. /  ‘Tis only when the symbols vanish / That belief is pure.
167692419616354300,Thu Feb 09 19:32:43 +0000 2012,baaziichaa-e-atfaal* hai duniyaa mere aage // hotaa hai shab-o-roz tamaashaa mere aage. [ * = child's play / playground ]
167494973636362240,Thu Feb 09 06:28:08 +0000 2012,koii din gar zindaganii aur hai // apne jii me hamane thaanii aur hai
167486617110577150,Thu Feb 09 05:54:55 +0000 2012,ye zid, ki aaj na aave aur aaye bin na rahe // qazaa se shikavaa hamen kis qadar hai, kyaa kahiye [qazaa=destiny,fate ; shikavaa=complaint]
167334202029785100,Wed Feb 08 19:49:17 +0000 2012,zehar miltaa hii nahi mujhko sitamgar varnaa // kyaa qasam hai tere milne kii ke khaa bhii na saku.
167149131050135550,Wed Feb 08 07:33:52 +0000 2012,Happy Birthday to the Ghazal King - 'Jagjit Singh'  -  @JagjitSinghG
166942396112830460,Tue Feb 07 17:52:23 +0000 2012,be-khudii be-sabab nahiin 'Ghalib' // kuchh to hai jis kii pardaadaarii hai. [be-sabab=without any reason; pardaadaarii=to hide, esp. fault]
166935808723533820,Tue Feb 07 17:26:13 +0000 2012,Bombay ( Mumbai ) University Buildings under construction 1877 - http://t.co/632ADfjW
166920286632017920,Tue Feb 07 16:24:33 +0000 2012,Bombay ( Mumbai ) 1881 - http://t.co/AfCeq5HX
166832622637555700,Tue Feb 07 10:36:12 +0000 2012,Rare Pic - ''Quaid-e-Azam'' - Muhammad Ali Jinnah in what I like to call 'The Gandhi pose' - http://t.co/f8g0P9UX
166827399974101000,Tue Feb 07 10:15:26 +0000 2012,My songs are prompted by delight // In the heat of my ideas; // I am the nightingale // Of the flower garden of the future.
166821831330889730,Tue Feb 07 09:53:19 +0000 2012,'Fathers' of the 'Nations' - During a heated conversion - http://t.co/Z3wLecaz
166799840850882560,Tue Feb 07 08:25:55 +0000 2012,mat puuchh ke kyaa haal hai meraa tere piichhe // tuu dekh ke kyaa rang hai teraa mere aage.
166608727741431800,Mon Feb 06 19:46:30 +0000 2012,phir usii bevafaa pe marte hain // phir vahii zindagii hamaarii hai
166574898402181120,Mon Feb 06 17:32:05 +0000 2012,1857 - The Jama Masjid was eventually desecrated by the British soldiers, the prayer halls were used as stables for cavalry horses.
166574416380166140,Mon Feb 06 17:30:10 +0000 2012,Delhi - Aftermath of the 1857 Uprising , the Jama Masjid was almost destroyed :  Desolate surroundings - http://t.co/eJ0zEjFx
166568131521818620,Mon Feb 06 17:05:11 +0000 2012,hai ab is mamuure* mein qaht*-e-gum-e-ulfat Asad // hum ne yeh maanaa ki Dillii mein rahen khaavenge kyaa. [*1=inhabited ; *2=scarcity ]
166568041180704770,Mon Feb 06 17:04:50 +0000 2012,There is now in this town a scarcity of the grief of love, Asad // We agreed that we would live in Delhi-- what will we eat?
166567984104607740,Mon Feb 06 17:04:36 +0000 2012,The city which has become a stranger to love-- how would we who have given our hearts manage to live in it, how would we survive?
166567880756969470,Mon Feb 06 17:04:12 +0000 2012,In Delhi, there's a famine of the grief of love. Here there are now no such beloveds whom one could love.
