id,created_at,text
1192858586680090600,Fri Nov 08 17:37:03 +0000 2019,Buschel wraps up his questioning. Zelinsky is back up for his final questions to Credico.
1192858097376800800,Fri Nov 08 17:35:07 +0000 2019,Credico says he didn't think Stone was going to steal his dog, that Stone was "riled up."  "I know he would have ne… https://t.co/kFJLoj3G0q
1192857891264442400,Fri Nov 08 17:34:18 +0000 2019,Jackson tells Credico that she knows this is an "intense experience" but asks him to calm down and try not to argue… https://t.co/23EJsS0wnv
1192857662549110800,Fri Nov 08 17:33:23 +0000 2019,Buschel is asking if Credico threatened David Lugo, after Credico told Lugo that he was Stone's WikiLeaks backchann… https://t.co/9Bc0xipeMJ
1192857100126433300,Fri Nov 08 17:31:09 +0000 2019,Things have been tense between Credico and Buschel. Jackson just stepped in because Buschel started off a question… https://t.co/iyH3FhOYQF
1192856100942569500,Fri Nov 08 17:27:11 +0000 2019,Credico says he stayed in touch with Stone after Stone named him as the WikiLeaks backchannel because he "didn't wa… https://t.co/r3edIlxDRB
1192854135483326500,Fri Nov 08 17:19:22 +0000 2019,Credico said he took the 5th even though he knew there were "going to be some kind of repercussions."  "People, the… https://t.co/t5A1TrAGa2
1192852929390268400,Fri Nov 08 17:14:35 +0000 2019,Buschel asks Credico about his decision to plead the 5th to not interview with House Intel. He asks Credico if he c… https://t.co/MyQyJwhjjU
1192852136532619300,Fri Nov 08 17:11:26 +0000 2019,Credico is adamant that he didn't back Hillary Clinton either, that he supported Bernie Sanders.  He says after 201… https://t.co/VriTTC06nd
1192851737566163000,Fri Nov 08 17:09:51 +0000 2019,"It looks like you didn't want to be associated with the Trump campaign," Buschel tells Credico.  "Absolutely, do y… https://t.co/hpNtHsTitP
1192851298372268000,Fri Nov 08 17:08:06 +0000 2019,Looks like Buschel isn't going to show that Melber clip. He drops the Schiff line of questioning, goes back to when… https://t.co/0cT4IBeLSN
1192850020514566100,Fri Nov 08 17:03:01 +0000 2019,Buschel says he has the Ari Melber clip ready to show in court. Jackson has called counsel up to the bench, where they've been for a minute.
1192849343944052700,Fri Nov 08 17:00:20 +0000 2019,Buschel is asking Credico about messages he gave to Schiff's staff, that Assange would be willing to meet with them… https://t.co/ht5j6xC1Xi
1192847642159714300,Fri Nov 08 16:53:34 +0000 2019,Buschel brings up a text from Credico where he told Stone "big news Wednesday."  Credico said he only knew of any p… https://t.co/dZ6Ra5WShc
1192846011934429200,Fri Nov 08 16:47:05 +0000 2019,They're discussing an Sept '16 from Credico to Stone, where Credico says he can't ask for Assange for "favors every… https://t.co/K4vaZ2bTQ1
1192844610466398200,Fri Nov 08 16:41:31 +0000 2019,Credico says that he and Assange had lunch together in the Ecuadorian embassy in London in 2017.  Buschel asks Cred… https://t.co/ChykeTqOXr
1192844062958772200,Fri Nov 08 16:39:21 +0000 2019,Jackson intervenes as Buschel was asking about whether Credico lived with Kuntsler. She says "we're not going to ta… https://t.co/uOkv0h40X5
1192843786826715100,Fri Nov 08 16:38:15 +0000 2019,"I was a spectator in all of this, like I thought Roger Stone was a spectator" of Julian Assange, Credico says.
1192843480072151000,Fri Nov 08 16:37:02 +0000 2019,They're talking about a press club dinner that Credico was at, where Credico says he told Tom Steyer that he was St… https://t.co/l3WPwBRHew
1192843085589500000,Fri Nov 08 16:35:28 +0000 2019,Now Buschel asks Credico if he was trying to "fool" Stone into believing he had stronger ties to WikiLeaks and Assa… https://t.co/75i6W25lio
1192842694449647600,Fri Nov 08 16:33:54 +0000 2019,Buschel asks Credico if he told Stone something to the effect of, "I'm best friends with Julian Assange's lawyer."… https://t.co/gzbk80wSPw
1192842242098118700,Fri Nov 08 16:32:07 +0000 2019,Margaret Kunstler, a close friend of Credico's who has ties to Assange, gets brought up by Buschel. She's been refe… https://t.co/GddLlJftdA
1192840945630400500,Fri Nov 08 16:26:58 +0000 2019,Buschel asks Credico about his Twitter account, and tweets he sent in 2016 about Julian Assange.  Credico notes tha… https://t.co/Px1siPLfwI
1192839967401283600,Fri Nov 08 16:23:04 +0000 2019,Buschel asks if Credico hired attorneys for "the entire process" like interviews with the Mueller investigators.  "… https://t.co/JAgWE6HaRC
1192838791729430500,Fri Nov 08 16:18:24 +0000 2019,You will agree with me that in the past, you have lied to Roger Stone, Buschel asks.  Credico said he has.  "There… https://t.co/WOmZ10Msgp
1192838542910722000,Fri Nov 08 16:17:25 +0000 2019,And Buschel gets started.  You did not deliver any messages from Julian Assange to Roger Stone, or vice versa, he a… https://t.co/yNVILlaCjv
1192835736032206800,Fri Nov 08 16:06:15 +0000 2019,Looks like another one of Stone's attorneys, Robert Buschel, will question Credico. Judge Jackson criticized Stone… https://t.co/pbeihtaOC2
1192832852758544400,Fri Nov 08 15:54:48 +0000 2019,Zelinsky ends his questioning of Credico. The trial takes a quick break, and then cross-examination will begin.
1192832537242026000,Fri Nov 08 15:53:33 +0000 2019,Zelinsky: Were you concerned that Stone would make you his patsy again? Credico: That had already happened.
1192832089135169500,Fri Nov 08 15:51:46 +0000 2019,Zelinsky asks Credico if he is close to his dog. Credico says he is, and acknowledges that he doesn't have a wife o… https://t.co/FfRSMwQLWJ
1192831755557970000,Fri Nov 08 15:50:26 +0000 2019,Stone to Credico, April 2019:  "You are a rat. A stoolie. You backstab your friends, run your mouth. My lawyers are… https://t.co/3J8snC9lCX
1192831082959450000,Fri Nov 08 15:47:46 +0000 2019,We're getting into Stone and Credico's back-and-forth in 2018, as there's more media coverage about their relations… https://t.co/lQihbAX5yQ
1192826631913721900,Fri Nov 08 15:30:05 +0000 2019,One message from Credico to Stone: "You weaseled your way into this story that you aren't part of. Trump can't stand you and you know that."
1192824886521147400,Fri Nov 08 15:23:09 +0000 2019,"You’re going to be the one who gets indicted for perjury if you’re stupid enough to testify," Stone writes in one… https://t.co/7HeKnn6wA4
1192822552462278700,Fri Nov 08 15:13:52 +0000 2019,Credico talks about a subpoena he got from the House Intel committee.  In texts, Stone says people will believe Cre… https://t.co/8ofVQFme1M
1192821004655112200,Fri Nov 08 15:07:43 +0000 2019,Credico reads texts b/w him and Stone, where Credico says he had no inside/prior knowledge about the WikiLeaks rele… https://t.co/7AV7jU70tJ
1192819925389336600,Fri Nov 08 15:03:26 +0000 2019,Credico is much more subdued on the stand this morning, very straightfoward and direct in his answers.  He talks ab… https://t.co/3HIpFnhrBx
1192818622646964200,Fri Nov 08 14:58:15 +0000 2019,Credico said "a lot of people" played a role in his decision to not comply with House Intel's request for an interv… https://t.co/z9Uw97cLQh
1192818335865622500,Fri Nov 08 14:57:07 +0000 2019,Credico reads texts between him and Stone, after House Intel asked Credico to appear for an interview.  "Stonewall… https://t.co/LT2trtQ5YG
1192818064565375000,Fri Nov 08 14:56:02 +0000 2019,Zelinsky asks Credico what he thought Stone meant when he told Credico to "do a Frank Pentangeli."  "To not recall… https://t.co/IMgKLhTWIS
1192815657479487500,Fri Nov 08 14:46:28 +0000 2019,Ex-Mueller prosecutor Aaron Zelinsky asks Credico if Stone ever asked Credico for permission to name him as his int… https://t.co/2efbgvFFzG
1192814977419300900,Fri Nov 08 14:43:46 +0000 2019,Credico is talking about promos he did for Stone's radio show in January 2017. He says he was paid $1K or $2K for those spots.
1192814343408246800,Fri Nov 08 14:41:15 +0000 2019,Credico is now on the stand. He says he's forgotten his glasses in the witness room. DOJ says they'll send someone to get them.
1192814222503301000,Fri Nov 08 14:40:46 +0000 2019,She seems to be referring to reports by InfoWars that has sought to out at least one member of the jury.  Jackson t… https://t.co/qzspusMDFM
1192813818528882700,Fri Nov 08 14:39:10 +0000 2019,Jackson addresses outside reporting about the trial "about the selection and the composition of the jury" that she… https://t.co/fCfCVKKWh4
1192809725420884000,Fri Nov 08 14:22:54 +0000 2019,Credico, a comedian and radio personality, put on quite the show on the stand yesterday. Stone's attorneys have ind… https://t.co/TKmGyNOeFi
1192808791437447200,Fri Nov 08 14:19:11 +0000 2019,Happy Friday, and welcome back to Roger Stone's trial in D.C. federal court. Randy Credico is back on the stand thi… https://t.co/8vqpL12DEc
1192768919628595200,Fri Nov 08 11:40:45 +0000 2019,RT @adamnagourney: A really tough NYT review of the book by Anonymous about Trump WH. @jenszalai review  is thoughtful, understated and ult…
1192560172872487000,Thu Nov 07 21:51:16 +0000 2019,And that's it for the day. Zelinsky says DOJ will likely question Credico for another 45 minutes tomorrow, and then… https://t.co/xEZVbarEmn
1192559934673686500,Thu Nov 07 21:50:19 +0000 2019,Zelinsky tells Jackson that they've reached a good time to break, so looks like Credico will be back on the stand f… https://t.co/rPKaF6HMUW
1192558623957946400,Thu Nov 07 21:45:07 +0000 2019,Zelinsky asks Credico if he ever does an impersonation of Frank Pentangeli from The Godfather Part II. Credico tell… https://t.co/j17BS7nwyu
1192558243626864600,Thu Nov 07 21:43:36 +0000 2019,Jackson says that she understands that Credico is a comedian, but that "this is serious." Credico apologizes.
1192557860326117400,Thu Nov 07 21:42:05 +0000 2019,Credico talks about an email he sent to Stone, post-2016 election, about impressions he can do.  Jackson interrupts… https://t.co/RF3kpNBXUo
1192554195381104600,Thu Nov 07 21:27:31 +0000 2019,In another text, Credico tells Stone "I can't [talk] about it" when asked about WikiLeaks dumps.  Credico says he "… https://t.co/BHxNx05Hfm
1192553711329063000,Thu Nov 07 21:25:36 +0000 2019,Now we're talking to a message that Stone sent to Credico saying "u died 5 years ago." Credico, in a lengthy story,… https://t.co/R6oN8Kebx9
1192552710941421600,Thu Nov 07 21:21:37 +0000 2019,We're getting to Credico's selfies outside the Ecuadorian Embassy in London. He claims that he thought someone foll… https://t.co/2vrfOAWhrX
1192551720834019300,Thu Nov 07 21:17:41 +0000 2019,Credico is repeatedly asserting that he was not Stone's back-channel to WikiLeaks, and that he did not have any pri… https://t.co/ktZB2ird8I
1192549575128748000,Thu Nov 07 21:09:09 +0000 2019,Credico makes a "quid pro quo" crack, as he says he offered a favor to Stone for Stone getting Gary Johnson on his… https://t.co/ZanDjky2c9
1192549573929123800,Thu Nov 07 21:09:09 +0000 2019,Funny moment, when Judge Jackson says Credico is being a bit "mumbly." "I'm thirsty!" Credico says, and gets some w… https://t.co/WaVDN7A5YC
1192548806426079200,Thu Nov 07 21:06:06 +0000 2019,Zelinsky asks Credico about a text he sent to Stone that said Assange has "kryptonite on Hillary." Credico says tha… https://t.co/FC9e2VX7w5
1192547920790401000,Thu Nov 07 21:02:35 +0000 2019,Zelinsky asks Credico why he didn't ask Assange about future WikiLeaks releases.  "Julian Assange is not going to t… https://t.co/UJtUspUmLF
1192547111172264000,Thu Nov 07 20:59:22 +0000 2019,They're going through Assange's appearance on Credico's radio show in August 2016. Credico says that, before he got… https://t.co/EG7bBKBhVj
1192544723304689700,Thu Nov 07 20:49:53 +0000 2019,Credico also says he testified before the Mueller grand jury that he and Stone had not discussed Assange during thi… https://t.co/G3YPamS71O
1192544425639075800,Thu Nov 07 20:48:42 +0000 2019,Credico says that he was trying to "one up" Stone by saying that he was going to have Julian Assange on his radio s… https://t.co/HXEseJHnM5
1192543134212903000,Thu Nov 07 20:43:34 +0000 2019,Credico says that he and Stone didn't discuss WikiLeaks during June/July 2016. Credico says he saw a video of Stone… https://t.co/IX78vS0EFL
1192541270373216300,Thu Nov 07 20:36:09 +0000 2019,When Zelinsky asks Credico what his job is, Credico jokes, "it feels like I'm a professional witness."
1192541162474791000,Thu Nov 07 20:35:44 +0000 2019,Credico does not have his dog, Bianca, with him. He brought her with him when he appeared before the Mueller grand… https://t.co/9AucgyD6M5
1192540962247057400,Thu Nov 07 20:34:56 +0000 2019,Aaron Zelinsky, the former Mueller prosecutor who did the opening statement for the government, will lead this questioning.
1192540735561764900,Thu Nov 07 20:34:02 +0000 2019,DOJ calls up its next witness: Randy Credico.
1192540295503777800,Thu Nov 07 20:32:17 +0000 2019,And we're back after a short break. Jackson asks Stone if he's "fully recovered." He says he is.
1192536086502871000,Thu Nov 07 20:15:33 +0000 2019,And, after sending the jury out of the room, she's pretty critical of Rogow's cross-examination.  "The pacing of th… https://t.co/5NfEaaU3cm
1192535660776870000,Thu Nov 07 20:13:52 +0000 2019,Judge Jackson is clarifying a point on jury instructions before we take a break. And she's asking Stone's lawyers t… https://t.co/lFDUfs0M4z
1192532463542833200,Thu Nov 07 20:01:10 +0000 2019,DOJ's Jonathan Kravis says he has "3 minutes" worth of additional questions, before we take a break. They're going… https://t.co/2aVYmKtppm
1192532094322401300,Thu Nov 07 19:59:42 +0000 2019,Rogow took an uh longer than usual period of time to find the exhibit he's looking for. Jackson asks if he wants to… https://t.co/fgKcNI2GIl
1192531232598438000,Thu Nov 07 19:56:16 +0000 2019,Rogow has Taylor read from the HPSCI majority report on the findings of its Russia probe, which states that Stone m… https://t.co/L9XK0SMnM9
1192528379809091600,Thu Nov 07 19:44:56 +0000 2019,Judge Punts on Ruling Whether Jones Day Has to Hand Over Compensation Data in Bias Case https://t.co/SA7ouLTj7l
1192525008326844400,Thu Nov 07 19:31:32 +0000 2019,What Rogow is trying to get at here is that the committee's criteria was just about Russian election interference,… https://t.co/sGSZl6tsNx
1192524690683826200,Thu Nov 07 19:30:16 +0000 2019,Rogow has Taylor read from Stone's House Intel testimony, when Schiff asks Stone if he has any emails/other documen… https://t.co/roNkPmEqfG
1192521581941207000,Thu Nov 07 19:17:55 +0000 2019,Rogow then has Taylor read aloud the rule on allowing witnesses to review their transcripts with the House committe… https://t.co/4kCyodEdOn
1192521060345942000,Thu Nov 07 19:15:51 +0000 2019,Rogow asks Taylor if a House committee can set the criteria for its investigations. Taylor says she doesn't underst… https://t.co/2xkUaAbQtb
1192519317616771000,Thu Nov 07 19:08:55 +0000 2019,Looks like Rogow is dropping that line of questioning as well, as he moves onto another exhibit. DOJ is winning on… https://t.co/EEg3mAAXd7
1192518610809446400,Thu Nov 07 19:06:07 +0000 2019,They're back at the bench again, after DOJ objected to another question.  "You're asking for hearsay," Jackson said… https://t.co/YvhwijqU3y
1192518353358925800,Thu Nov 07 19:05:06 +0000 2019,Jackson has been cutting in to reask some of Rogow's questions to Taylor. Eg, after Stone emailed Corsi to "get to… https://t.co/PVK9aPhGdM
1192516143212384300,Thu Nov 07 18:56:19 +0000 2019,Rogow asks Taylor if she thought it was illegal for Stone to contact Paul Manafort. Jackson blocks the question, sa… https://t.co/x9DqO0h20x
1192515757336408000,Thu Nov 07 18:54:47 +0000 2019,....and we aren't getting the rest of that sentence, as Rogow has moved on after a conference at Jackson's bench. R… https://t.co/0tFqb5RKMZ
1192515220624887800,Thu Nov 07 18:52:39 +0000 2019,DOJ cuts off Rogow in the middle of a question apparently about Jerry Corsi's character.  "Did you know he wrote a… https://t.co/ixnbb7mtz5
1192514480850247700,Thu Nov 07 18:49:42 +0000 2019,Rogow is asking Taylor about call records, which I believe showed calls between Trump and Stone. Rogow asks her if… https://t.co/pa7TN1AR3n
1192514140788662300,Thu Nov 07 18:48:21 +0000 2019,A bit of back-and-forth between Judge Jackson and Rogow about how he'll run the cross-examination. He's taking Tayl… https://t.co/X3Dkfnb0Nt
1192512625403412500,Thu Nov 07 18:42:20 +0000 2019,And we're back. Jackson calls the jury back in, and Stone's attorney Bruce Rogow prepares for cross-examination of… https://t.co/Q0pdxSLIck
1192506885636837400,Thu Nov 07 18:19:31 +0000 2019,I think the messaging we can expect from Stone supporters, and potentially his lawyers, is that these texts to Cred… https://t.co/UCKXKJKYkd
1192501144318296000,Thu Nov 07 17:56:43 +0000 2019,RT @cryanbarber: 'This Is Not Normal': US Judge Denounces Trump's Attacks on Judiciary https://t.co/mV1vitT5fH
1192500055774826500,Thu Nov 07 17:52:23 +0000 2019,Spotted sitting with Milo today at the court cafeteria: Jacob Wohl.
1192495679135998000,Thu Nov 07 17:35:00 +0000 2019,Jackson calls for an hour-long recess for lunch before we get into the cross-examination of Taylor by Stone's attor… https://t.co/eQvmKnOzD3
1192493603794440200,Thu Nov 07 17:26:45 +0000 2019,And Kravis rests with his questioning of Taylor. Counsel are at the bench with Jackson to discuss scheduling.
1192491683025473500,Thu Nov 07 17:19:07 +0000 2019,More from Stone to Credico  "I have a constitutional right to call you a lightweight....piece of shit....and I just… https://t.co/HdZk7IUHqG
1192491219101921300,Thu Nov 07 17:17:16 +0000 2019,Another....colorful message from Stone to Credico:  "Your breath smells like Ari Melber's cock."
1192486362374721500,Thu Nov 07 16:57:58 +0000 2019,DOJ prosecutor Jonathan Kravis says we're going to get into some "not very nice names" that Credico uses for Stone.… https://t.co/xmLOQXSGHJ
1192486361149956000,Thu Nov 07 16:57:58 +0000 2019,We're getting into the House Intel investigation and its scope, including passages that say the probe did not have… https://t.co/8Pv9oG4IY5
1192482714680737800,Thu Nov 07 16:43:29 +0000 2019,Taylor says that Stone told Credico to plead the 5th seven times and that Stone told Credico to not cooperate with… https://t.co/Z8pJCIA1d8
1192482330859974700,Thu Nov 07 16:41:57 +0000 2019,Also this morning, the Senate Judiciary Committee advanced Trump's pick for the 2nd Circuit Court of Appeals, Steve… https://t.co/b5wPHqoyPK
1192482183941935000,Thu Nov 07 16:41:22 +0000 2019,Credico tells Stone he got a subpoena from Mueller.  Stone tells him it's a "waste of your time" and to "tell him g… https://t.co/GTEwfLJI3F
1192481553676488700,Thu Nov 07 16:38:52 +0000 2019,Another exchange between Stone and Credico:  "You should be honest with FBI, be honest," Credico writes.  "I'm not… https://t.co/vH9KV27N0p
1192480736399507500,Thu Nov 07 16:35:37 +0000 2019,And I'm back, where the FBI case agent is going through messages between Stone and Credico.  Credico has sent Stone… https://t.co/PBadFStP7A
1192473367993036800,Thu Nov 07 16:06:20 +0000 2019,I’ve ducked out of the trial for another hearing in DC court (no such thing as a slow news day!) but it looks like… https://t.co/2ZshvuSimP
1192452778066612200,Thu Nov 07 14:44:31 +0000 2019,We may also hear testimony today from Randy Credico, the Stone associate who Stone claimed was his sole backchannel… https://t.co/wKVUp6QS6L
1192451974140182500,Thu Nov 07 14:41:19 +0000 2019,Yesterday we heard testimony from the former FBI case agent for Stone, Michelle Taylor. She's been walking us throu… https://t.co/G6VAoK1OjD
1192451481347252200,Thu Nov 07 14:39:22 +0000 2019,Happy Thursday, Roger Stone's trial is about to be back in action in DC federal court. Opening statements were yest… https://t.co/9dWCDUzXs5
1192249428566036500,Thu Nov 07 01:16:29 +0000 2019,RT @washingtonpost: Exclusive: Trump wanted Barr to hold news conference saying the president broke no laws in call with Ukrainian leader h…
1192193295264432000,Wed Nov 06 21:33:26 +0000 2019,And after a brief talk at the bench with lawyers and Judge Jackson, court is adjourned for the day.
1192192991596810200,Wed Nov 06 21:32:13 +0000 2019,You can see from the media room that Milo is sitting up by the front of the courtroom. He was also at the courtroom… https://t.co/XD9DTClF2g
1192192160893931500,Wed Nov 06 21:28:55 +0000 2019,After Rogow's opening statements, former FBI agent Michelle Taylor, who handled Stone's case, testified about messa… https://t.co/UK8pDffLYl
1192190968520495000,Wed Nov 06 21:24:11 +0000 2019,Roger Stone’s Lawyers Unveil Their Defense: He Didn’t Mean to Lie https://t.co/O05WLYETeQ via @TheNLJ
1192182992455815200,Wed Nov 06 20:52:29 +0000 2019,RT @cryanbarber: Now: House Democrats have pulled back a subpoena seeking testimony from ex-Trump adviser Charles Kupperman.https://t.co/er…
1192165164394713000,Wed Nov 06 19:41:39 +0000 2019,Rogow's back at it. He says that Credico and Stone had a tumultuous relationship, noting that many of their texts w… https://t.co/dfnXQXqVai
1192164553485893600,Wed Nov 06 19:39:13 +0000 2019,And another objection from DOJ, as Rogow was mid-sentence about what happens when a person other than a lawyer tell… https://t.co/lGtSDmvRUd
1192164312288239600,Wed Nov 06 19:38:16 +0000 2019,Rogow takes a swipe at Credico's credibility, says the jury will "get to judge for yourself what kind of person Cre… https://t.co/bDkf8iZGyM
1192163403080618000,Wed Nov 06 19:34:39 +0000 2019,Unclear what they discussed, but Rogow has continued with his opening statement, reiterating how important words ar… https://t.co/ocTUPyejvo
1192162679802216400,Wed Nov 06 19:31:46 +0000 2019,DOJ objects to a portion of Rogow's opening statement; Jackson calls them to the bench.
1192162406769864700,Wed Nov 06 19:30:41 +0000 2019,And Rogow says that there was no intermediary btwn Stone and WikiLeaks, saying Stone later "renounced" that idea.… https://t.co/sGmMh9qJY8
1192160240478888000,Wed Nov 06 19:22:05 +0000 2019,Rogow links the testimony back to House Intel's Russia probe's criteria, saying it was focused on Russian election… https://t.co/cXEoLdlZXd
1192158172196343800,Wed Nov 06 19:13:52 +0000 2019,Rogow really highlights that Stone appeared at a voluntary interview, and that it was a private interview and not p… https://t.co/ltMVnf7DSM
1192157766779052000,Wed Nov 06 19:12:15 +0000 2019,He says that there's "nothing wrong, there's nothing illegal" about contacting the Trump campaign; says "of course"… https://t.co/ff9HN55HlD
1192157071908786200,Wed Nov 06 19:09:29 +0000 2019,Stone's attorney Bruce Rogow tells the jury that it's important to know Stone's "state of mind" when he made his st… https://t.co/6Ev6Oz3Gdv
1192155516014907400,Wed Nov 06 19:03:18 +0000 2019,And we're back. Stone's opening statement will begin in a minute.
1192153047952179200,Wed Nov 06 18:53:30 +0000 2019,RT @DevlinBarrett: Minutes into the Roger Stone trial, prosecutors link his alleged crimes directly to Trump, saying Stone lied ‘because th…
1192147799300857900,Wed Nov 06 18:32:39 +0000 2019,Basically, the big takeaway from DOJ’s opening statement is that Stone lied, and Stone lied to help Trump.  Will be… https://t.co/0Y8s4aM7uT
1192138792100077600,Wed Nov 06 17:56:51 +0000 2019,Jackson calls a recess; the court will resume at 2 p.m. for Roger Stone's lawyers's opening statements.
1192137792798838800,Wed Nov 06 17:52:53 +0000 2019,Zelinsky confirms that Randy Credico, Steve Bannon and Rick Gates will all be witnesses in the Stone trial.  But he… https://t.co/fjzE91p2go
1192125728852197400,Wed Nov 06 17:04:57 +0000 2019,Zelinsky says that after the DNC announced it was hacked by Russian actors, Stone and Trump had a phone call, altho… https://t.co/dHBsrJNr01
1192125577580425200,Wed Nov 06 17:04:20 +0000 2019,Zelinsky: This case isn't about who hacked the DNC server, this case isn't about whether Roger Stone had any commun… https://t.co/azfSd1DdzB
1192123258600075300,Wed Nov 06 16:55:08 +0000 2019,First up for opening statements: The Justice Department. Former Mueller prosecutor Aaron Zelinsky is delivering the argument.
1192118126445498400,Wed Nov 06 16:34:44 +0000 2019,Jackson has now sworn in the jury, and is explaining the charges against Stone.
1192117808601223200,Wed Nov 06 16:33:28 +0000 2019,But she says that information was "riddled with inaccuracies" and that the jury wasn't sat until this morning. And… https://t.co/eXYDnkUaoC
1192117807363833900,Wed Nov 06 16:33:28 +0000 2019,Judge Jackson is back on the bench. She reminds those in court that there should be no attempts to identify/contact… https://t.co/NQWkvZYr4c
1192109534040535000,Wed Nov 06 16:00:35 +0000 2019,And we have a jury – 11 women and 3 men picked. Two of those are alternates, just not clear which ones.
1192087171110449200,Wed Nov 06 14:31:44 +0000 2019,We’re heading in the room to narrow down the final potential jurors and then get a jury for Stone’s trial. See you… https://t.co/pR61umHIfE
1192087048930365400,Wed Nov 06 14:31:15 +0000 2019,And because there’s no such thing as a quiet day – next door to Stone’s trial, Judge Trevor McFadden is holding a h… https://t.co/6qATNeNhJY
1192081368773267500,Wed Nov 06 14:08:40 +0000 2019,Good morning from day 2 of Roger Stone’s trial, where jury selection continues and opening arguments are expected l… https://t.co/p0IOEKGq3f
1191868597569802200,Wed Nov 06 00:03:12 +0000 2019,RT @jordainc: Ahead of Thursday Judiciary Cmte vote, Graham tells group of us that he believes both Ozerden and Menashi have votes to clear…
