id,created_at,text
1131995004489089000,Fri May 24 18:46:55 +0000 2019,RT @washingtonpost: Trump says pardoning war criminals "a little bit controversial," suggests delay in deliberations https://t.co/SBzfZxKmwZ
1131936078934532100,Fri May 24 14:52:46 +0000 2019,And there it is – Trump's lawyers have officially asked the Second Circuit Court of Appeals to review a judge's rul… https://t.co/OxfI7fSjQy
1131685131255783400,Thu May 23 22:15:35 +0000 2019,RT @kevincollier: News: Despite 17 new charges against Assange, @xychelsea is still jailed for refusing to testify to a grand jury. Prosecu…
1131652506348605400,Thu May 23 20:05:57 +0000 2019,NEW: Julian Assange got hit with a superseding indictment today, charging him with conspiring with Chelsea Manning… https://t.co/Tzf8qFfJXj
1131637226557849600,Thu May 23 19:05:14 +0000 2019,We have a schedule for the next round of legal arguments between @OversightDems and Trump for financial records fro… https://t.co/LSKESzC8Ul
1131373690002772000,Thu May 23 01:38:02 +0000 2019,help https://t.co/Pl0OcpTa6I
1131353795609407500,Thu May 23 00:18:59 +0000 2019,RT @NBCNews: Key congressional cmte. has already gained access to President Trump’s dealings with two major financial institutions, two sou…
1131351382487961600,Thu May 23 00:09:23 +0000 2019,RT @KFaulders: Spotted at the Trump Hotel while Pres is here downstairs —&gt; AG Bill Barr who is currently upstairs at the restaurant.
1131332536272076800,Wed May 22 22:54:30 +0000 2019,And even more news! House Dems and Trump’s lawyers have asked the DC Circuit Court of Appeals to expedite the appea… https://t.co/Dg4Gc0DKy6
1131284677715726300,Wed May 22 19:44:20 +0000 2019,RT @KlasfeldReports: Ramos said that he's going to rule after a brief 10 minute recess.
1131277692882608100,Wed May 22 19:16:34 +0000 2019,Michael Avenatti has had a rough few months – and his latest indictment is for allegedly defrauding Stormy Daniels https://t.co/YIvGL9lqKI
1131236921571782700,Wed May 22 16:34:34 +0000 2019,NEW: Feds say in a court filing that they will let both Senate and House Intel members look at a "minimally redacte… https://t.co/PZ7G0ydyI5
1131221153232687100,Wed May 22 15:31:54 +0000 2019,In November 2017, Mueller knew that Trump was making payments to Cohen – $280K throughout the year, according to ne… https://t.co/M4c11NYWVz
1131176640053170200,Wed May 22 12:35:01 +0000 2019,RT @njagoda: .@jacq_thomsen and I wrote about how Democrats think the judge's ruling in the Mazars case could be a good sign for their effo…
1130578367202377700,Mon May 20 20:57:42 +0000 2019,RT @BConradis: NEW from @jacq_thomsen: A federal judge has ruled Trump cannot block a House panel's subpoena for his financial documents. h…
1129461118706102300,Fri May 17 18:58:09 +0000 2019,Judge: Upload the Mueller report to the court docket DOJ: It's too big of a file, but here's the link to the full r… https://t.co/eiyiiLRbcA
1129389671639916500,Fri May 17 14:14:15 +0000 2019,RT @timothyrhoman: BREAKING: Appeals court rules Trump end of DACA was unlawful https://t.co/zf3wzOSwhn by @jacq_thomsen
1129034490955862000,Thu May 16 14:42:53 +0000 2019,RT @mattdpearce: “Her employer, Cafe Services, disagreed and fired her, accusing her of stealing the $8 lunch tab, according to a letter th…
1129026364286361600,Thu May 16 14:10:36 +0000 2019,RT @scottwongDC: Alabama abortion law sparks fears Supreme Court may overturn Roe v. Wade, by ⁦@jacq_thomsen⁩ ⁦@jessiehellmann⁩  https://t.…
1128802265085685800,Wed May 15 23:20:06 +0000 2019,Lawmakers are pushing to pass election security measures, or at least more funding, after the Mueller report showed… https://t.co/SC4BMluYEz
1128801259836846100,Wed May 15 23:16:07 +0000 2019,Whoa, Senate Rules chair Roy Blunt said at a hearing today that he doesn’t plan on marking up election security bil… https://t.co/pifs1F9HDl
1128781198862540800,Wed May 15 21:56:24 +0000 2019,@hneidig I’m with you on this crusade Harper
1128503671749263400,Wed May 15 03:33:36 +0000 2019,RT @OrinKerr: Starting law school this fall?  You might want to read my short guide on how to read a legal opinion: "How to Read a Legal Op…
1128369643067007000,Tue May 14 18:41:01 +0000 2019,🗣️ all food is breakfast food https://t.co/bNTIzeVTwS
1128362814173847600,Tue May 14 18:13:53 +0000 2019,RT @RebeccaBeitsch: I reached out to AOC's office for comment on this story and they said "Nah" https://t.co/sZUTwURpia
1128338380494913500,Tue May 14 16:36:48 +0000 2019,And that’s a wrap – but parties have until Friday to file their final arguments and evidence in the case. Mehta sai… https://t.co/ayvWnZznHE
1128315283184263200,Tue May 14 15:05:01 +0000 2019,The judge says he will NOT issue a ruling on the case during today's hearing, citing the gravity of the issues presented before him.
1128312879797755900,Tue May 14 14:55:28 +0000 2019,Trump's lawyers are challenging the order, while House Dems welcomed it. Mehta said yesterday that today's hearing… https://t.co/D4htLkZv9u
1128312877855776800,Tue May 14 14:55:27 +0000 2019,Judge Amit Mehta said last week that he planned to consolidate arguments for a preliminary injunction for the subpo… https://t.co/1qm5BNN65D
1128312875557302300,Tue May 14 14:55:27 +0000 2019,good morning from DC federal court, where lawyers for Trump and House Dems are about to square off over a subpoena… https://t.co/8xobeakUCM
1128125913311383600,Tue May 14 02:32:31 +0000 2019,@cjciaramella @brandonetc @SmiloTweets never forget
1128030452382613500,Mon May 13 20:13:12 +0000 2019,NEW: Judge Amy Berman Jackson is now officially one of a handful people with access to unredacted parts of the Muel… https://t.co/xHVXthEaNd
1128029404922359800,Mon May 13 20:09:02 +0000 2019,RT @jordainc: McConnell has filed cloture on Jeffrey Rosen's DAG nomination, setting up a vote for later this week.
1127956993304670200,Mon May 13 15:21:18 +0000 2019,Kavanaugh, who sided with the liberal justices in issuing the stay, defended the ruling – he pointed to Texas chang… https://t.co/QDwtaga9Cq
1127956419637067800,Mon May 13 15:19:01 +0000 2019,And Alito criticized the court for issuing a stay of execution for a Buddhist inmate in Texas, criticizing the last… https://t.co/SVWDJsVvad
1127956417015578600,Mon May 13 15:19:00 +0000 2019,Thomas issued an opinion hitting back at Breyer's accusations that conservatives acted arbitrarily and unfairly in… https://t.co/osO7dKkbQf
1127956025108324400,Mon May 13 15:17:27 +0000 2019,The Supreme Court is fired up over the death penalty this morning, issuing opinions and statements revisiting some… https://t.co/HxAv5PkNfC
1127948272696483800,Mon May 13 14:46:39 +0000 2019,RT @mchalfant16: This is really pretty remarkable. Brett Kavanaugh sides with the liberal justices writes the opinion, too. via @jacq_thoms…
1127930356173295600,Mon May 13 13:35:27 +0000 2019,and no orders from the court on those cases. the justices didn't grant cert to any cases today
1127928133896822800,Mon May 13 13:26:37 +0000 2019,we'll be getting orders from the court in a few minutes – waiting for rulings on cases on abortion, LGBT rights and… https://t.co/E69whCoqf6
1127927866128306200,Mon May 13 13:25:33 +0000 2019,The Supreme Court is back in session today and expected to issue opinions at 10. We'll be watching through the end… https://t.co/lAusXZ8bpL
1126837367191502800,Fri May 10 13:12:18 +0000 2019,RT @SCOTUSblog: #SCOTUSlinkoftheday: @jacq_thomsen reports that protracted consideration by #SCOTUS of cert petitions in abortion and weddi…
1126569323026354200,Thu May 09 19:27:11 +0000 2019,And Rosenstein wraps up his speech: “I leave here confident that justice is in good hands. It’s in your hands.”
1126568284109922300,Thu May 09 19:23:04 +0000 2019,Rosenstein is now speaking, praising the team at DOJ for their work over the years: “We stayed the course and we ac… https://t.co/gVNeDe2Mad
1126560815375630300,Thu May 09 18:53:23 +0000 2019,and Barr jokes about yesterday’s contempt vote, says he “must have set a record” by being the first AG to be voted… https://t.co/bZVNrrl6ma
1126559411600859100,Thu May 09 18:47:48 +0000 2019,Barr takes the podium with Rosenstein, say they have a matter to settle before Rosenstein leaves: Which one does th… https://t.co/IUt1ja8p9h
1126559188430282800,Thu May 09 18:46:55 +0000 2019,Chris Wray presents Rosenstein with a shadow box of different law enforcement badges, praises Rosenstein as a “frie… https://t.co/juwcVyDjCI
1126557613087502300,Thu May 09 18:40:40 +0000 2019,Sessions gets a standing ovation as he ends his remarks.
1126557084592554000,Thu May 09 18:38:34 +0000 2019,Sessions got a big applause as he took the podium. He calls Rosenstein one of DOJ’s “most important leaders in its… https://t.co/PpjwpDOBzC
1126551639865819100,Thu May 09 18:16:55 +0000 2019,Kellyanne Conway and Senate Intel Committee Chair Richard Burr are also here
1126545873213820900,Thu May 09 17:54:01 +0000 2019,also in the room – former White House counsel Don McGahn, who has absolutely not been in the news at all 👀👀
1126543001554182100,Thu May 09 17:42:36 +0000 2019,I’m at DOJ for Rod Rosenstein’s farewell ceremony this afternoon. He, Bill Barr, Chris Wray and Jeff Sessions are a… https://t.co/bmRLOUT1rU
1126510960053645300,Thu May 09 15:35:17 +0000 2019,Story here: https://t.co/DtD0sxiNgH
1126508010304442400,Thu May 09 15:23:33 +0000 2019,NEWS: The judge presiding over Roger Stone's trial has ordered DOJ to give her the redacted portions of the Mueller… https://t.co/QqPyzwIWk0
1126469622511874000,Thu May 09 12:51:01 +0000 2019,RT @timothyrhoman: Suspense builds for Supreme Court moves on abortion, LGBT cases https://t.co/ke21d3wegn by @jacq_thomsen
1126302097211887600,Thu May 09 01:45:20 +0000 2019,@birnbaum_e I am! right now
1126300607273406500,Thu May 09 01:39:25 +0000 2019,The Trump admin has filed its argument against House Dems' request to block Trump's national emergency declaration… https://t.co/cZN3pRYknH
1126247872096292900,Wed May 08 22:09:52 +0000 2019,RT @Brett_Samuels27: .@VP announces plans to challenge lower courts' use of nationwide injunctions, which have stalled a number of Trump ad…
1126211698564698100,Wed May 08 19:46:07 +0000 2019,some non-Mueller report news: Trump's lawyers say that House Dems have agreed to hand over "substantial portions" o… https://t.co/W86ZEetY2I
1126172236904304600,Wed May 08 17:09:19 +0000 2019,@ClickHole h/t @brandonetc
1126172156398854100,Wed May 08 17:09:00 +0000 2019,idk what's going on with @ClickHole but I'm on board https://t.co/AdBmhMbCrr
1126155016610484200,Wed May 08 16:00:53 +0000 2019,RT @iswanTheHill: Follow the Barr contempt debate here with @mchalfant16 @Olivia_Beavers @jacq_thomsen and @Brett_Samuels27 https://t.co/u9…
1126154984301703200,Wed May 08 16:00:45 +0000 2019,@dansolomonza @Olivia_Beavers He can make his case to the court regardless of what the precedent is – Barr has cite… https://t.co/uvAOmQd09W
1126150338929623000,Wed May 08 15:42:18 +0000 2019,This is the court ruling that's been referenced during the House Judiciary hearing about the release of grand jury… https://t.co/4u2mVoT3nL
1126107563723055100,Wed May 08 12:52:19 +0000 2019,RT @rebekahentralgo: Don’t cross the picket line today!!!  Art from @colleentie 💫 https://t.co/KnYm8uJ3YK
1125921671859322900,Wed May 08 00:33:39 +0000 2019,While the panel agreed to issue the stay, not all of them were thrilled with the decision – Judge William Fletcher… https://t.co/p09R4jfOfg
1125866509392281600,Tue May 07 20:54:28 +0000 2019,RT @Olivia_Beavers: A House Intel committee aide says Schiff and Nunes have sent another letter to Barr/Wray/Rosenstein asking for docs rel…
1125866075474812900,Tue May 07 20:52:44 +0000 2019,@b_ck_tt don't drag nathan's good name through the mud, or mud 2
1125814507681480700,Tue May 07 17:27:49 +0000 2019,hell yeah, love to pay $5 a can to "murder" my thirst https://t.co/QK2qDdoohV
1125781281026007000,Tue May 07 15:15:48 +0000 2019,Andrew Miller, the Stone associate who has been held in civil contempt since 2018 for refusing to testify before Mu… https://t.co/VZsrvLLoCr
1125462467272900600,Mon May 06 18:08:56 +0000 2019,Microsoft is rolling out free software to help secure elections – read all about it in @magmill95's first story for… https://t.co/3lNN7jaU2f
1125397234835652600,Mon May 06 13:49:44 +0000 2019,RT @KimberlyRobinsn: Back-Loaded Supreme Court Enters ‘Flood Season’ https://t.co/JRCJirs4Kc
1124362448386052100,Fri May 03 17:17:51 +0000 2019,@NiallStanage @birnbaum_e give 👏them👏their👏clicks👏
1124361501836488700,Fri May 03 17:14:06 +0000 2019,@birnbaum_e how does one SWALLOW an airpod and not notice?????
1124360270833492000,Fri May 03 17:09:12 +0000 2019,adding this story to the list of reasons I'm refusing to get airpods https://t.co/WbAOld5JsV https://t.co/kNd0pqANXv
1123968756055720000,Thu May 02 15:13:28 +0000 2019,An attorney for BuzzFeed News also said the news site was expecting to file new FOIA lawsuits related to Mueller in… https://t.co/3kOrKU7QDz
1123968754524856300,Thu May 02 15:13:28 +0000 2019,Judge Reggie Watson set a series of deadlines stretching into the summer over the suits filed by @EPICprivacy and B… https://t.co/bulypfHSQ0
1123968753245532200,Thu May 02 15:13:27 +0000 2019,Not a lot of news coming from a hearing this am on a pair of FOIA lawsuits seeking the unredacted Mueller report. D… https://t.co/M83F56xuLz
1123967371205414900,Thu May 02 15:07:58 +0000 2019,RT @cimarcos: "He lied to Congress. If anybody else did that it would be considered a crime," Pelosi says of Barr
1123945062298157000,Thu May 02 13:39:19 +0000 2019,@SmiloTweets we will take this recommendation into consideration at our next caucus meeting, held at a steakhouse at 10 am
1123944393541599200,Thu May 02 13:36:39 +0000 2019,Declaring myself and Cohen founding members of the “Any Food Can Be Breakfast Food” caucus https://t.co/0vG5KfwINK
1123684845488627700,Wed May 01 20:25:18 +0000 2019,Dems came out swinging against Bill Barr during their hearing today, attacking his credibility and asking why he di… https://t.co/UrPJR6B2x9
1123055032117661700,Tue Apr 30 02:42:39 +0000 2019,You can read the complaint here: https://t.co/gbxAnOKKQ5
1123053057011531800,Tue Apr 30 02:34:48 +0000 2019,BREAKING: Trump and his businesses are again suing to block a congressional subpoena for financial records. But Deu… https://t.co/OzpZIwsMh1
1122977360721129500,Mon Apr 29 21:34:01 +0000 2019,Rosenstein is officially leaving DOJ. His last day is May 11, via @mchalfant16 https://t.co/1087aPKvp7
1122935140500557800,Mon Apr 29 18:46:15 +0000 2019,A federal judge is allowing the House Oversight and Reform Committee to intervene in the president's lawsuit agains… https://t.co/tDP3tbQUoj
1122930903506985000,Mon Apr 29 18:29:25 +0000 2019,RT @MikeBalsamo1: ALBUQUERQUE, N.M. (AP) — A federal courthouse has been evacuated ahead of a hearing for the leader of an armed group that…
1122487151869009900,Sun Apr 28 13:06:06 +0000 2019,RT @JoanBiskupic: The most mysterious branch, and Supreme Court justices want to keep it that way: https://t.co/lBkguuEDab
1121908838666395600,Fri Apr 26 22:48:05 +0000 2019,RT @JuliaManch: My latest w/ ⁦@mtmarch⁩!   Meet the 2020 spouses who could make history  https://t.co/6MmGlzkC8U
1121796776921460700,Fri Apr 26 15:22:48 +0000 2019,RT @mchalfant16: Federal prosecutors get what they asked for with the sentencing of Maria Butina: 18 months. @jacq_thomsen has the news htt…
1121794650300280800,Fri Apr 26 15:14:21 +0000 2019,Judge orders Butina to 18 months as requested by the government. She’s already served 9 months of that sentence.
1121765747640942600,Fri Apr 26 13:19:30 +0000 2019,One of the biggest revelations from Butina’s case was her being able to get close to members of the NRA – whose con… https://t.co/UAKyUfXtcE
1121764860730191900,Fri Apr 26 13:15:58 +0000 2019,Happy Friday from federal court in DC, where Russian agent Maria Butina is set to be sentenced at 10 am. Feds are a… https://t.co/OMkudHRPfS
1121488727929442300,Thu Apr 25 18:58:43 +0000 2019,NEW: A DOJ official made good on a promise to ignore a subpoena to testify with congressional investigators today a… https://t.co/5eL5bHO3Fz
1121484258680426500,Thu Apr 25 18:40:58 +0000 2019,@JakeWilkns @JuliaManch dream, nightmare, same thing!
1121476581787148300,Thu Apr 25 18:10:27 +0000 2019,@JuliaManch the what did what when??
1121443860750774300,Thu Apr 25 16:00:26 +0000 2019,A judge has denied Maria Butina's request that an ex-FBI official's testimony be excluded from her sentencing heari… https://t.co/pmtvGwFPOb
1121099581327118300,Wed Apr 24 17:12:23 +0000 2019,RT @juliegraceb: DOJ won't comply with Oversight subpoena over census question https://t.co/1DsfMWfXd0 w/ @jacq_thomsen
1121089400778166300,Wed Apr 24 16:31:56 +0000 2019,RT @Evan_Rosenfeld: The Supreme Court on Wednesday ruled 5-4 along ideological lines on behalf of a business seeking to stop a class-action…
1120430430950441000,Mon Apr 22 20:53:25 +0000 2019,ICYMI, my story on the legal battle over the Trump administration’s push to add a citizenship question to the 2020… https://t.co/04UO6ymVta
1118873704195403800,Thu Apr 18 13:47:33 +0000 2019,Barr appears to be defending Trump in his opening remarks, saying the White House's cooperation with Mueller "weigh… https://t.co/XOEi7UmARs
1118868189679628300,Thu Apr 18 13:25:38 +0000 2019,RT @iswanTheHill: Let's try this again since I sent the wrong link last time: Keep up with live news and analysis from @mchalfant16 @Olivia…
1118860556839063600,Thu Apr 18 12:55:18 +0000 2019,RT @Olivia_Beavers: @thehill has got YOU covered on the release of the Mueller report. Follow our live blog here: https://t.co/BXJpnEcRdG a…
1118855875555414000,Thu Apr 18 12:36:42 +0000 2019,please please please do this!!!! https://t.co/NNkH8oTrjz
1118509325012611100,Wed Apr 17 13:39:38 +0000 2019,T-minus one day (!) til the Mueller report drops, but that's not stopping anyone in Washington from setting up thei… https://t.co/tvtDJ4UEE6
1117894398602166300,Mon Apr 15 20:56:08 +0000 2019,The Assange affidavit unsealed today showed that officials were able to identify him from the Manning chat logs par… https://t.co/MqI3OOIUNn
1117887984869625900,Mon Apr 15 20:30:39 +0000 2019,@EddyRobinson we've actually just uploaded them, they're at the bottom of the piece now – sometimes there's a few m… https://t.co/0zJRbqNJYh
1117815258855419900,Mon Apr 15 15:41:40 +0000 2019,this tweet caused @Olivia_Beavers to start serenading me with Cher's greatest hits https://t.co/3LbLIRoh4Q
1117798752046276600,Mon Apr 15 14:36:04 +0000 2019,RT @thehill: JUST IN: Supreme Court won't hear death penalty appeal alleging anti-gay remarks from jurors https://t.co/9brnML7HtY https://t…
1116739704219754500,Fri Apr 12 16:27:48 +0000 2019,RT @ZoeTillman: NEW: In a rare public rebuke of Trump by a sitting federal judge, Judge Carlton Reeves gave a speech yesterday comparing Tr…
1116496365671125000,Fri Apr 12 00:20:51 +0000 2019,RT @AndrewKirell: pls god keep Clickhole safe under the new owners https://t.co/1I7lPPXZYU
1116437264958140400,Thu Apr 11 20:26:01 +0000 2019,RT @juliegraceb: House chairman threatens to find Justice official in contempt of Congress https://t.co/VCEr5GZDgQ w/  @jacq_thomsen
1116346830177087500,Thu Apr 11 14:26:39 +0000 2019,John Gore, a DOJ official in the civil rights division, was supposed to testify this am about the citizenship quest… https://t.co/wKXfyMgS1s
1116113350902022100,Wed Apr 10 22:58:53 +0000 2019,RT @Jordanfabian: Treasury to miss Dem deadline for Trump returns, @njagoda reports   Mnuchin letter does not outright reject demand to rel…
1116072675355578400,Wed Apr 10 20:17:16 +0000 2019,@SmiloTweets @morgGstalt @mtmarch you should see the shrine
1116069858498809900,Wed Apr 10 20:06:04 +0000 2019,@SmiloTweets @morgGstalt @mtmarch elliot
1116069514993598500,Wed Apr 10 20:04:42 +0000 2019,@morgGstalt @mtmarch me too!!!
1115978084593872900,Wed Apr 10 14:01:23 +0000 2019,asking the hard hitting questions over here https://t.co/gvJkDIw9sx
