id,created_at,text
1261013903351394300,Thu May 14 19:21:57 +0000 2020,RT @lhelemNLJ: 'Disappointing Display of Judicial Immodesty': Fourth Circuit's En Banc Bench Brawls Over Trump Claims https://t.co/io4M0X3p…
1260993209800503300,Thu May 14 17:59:43 +0000 2020,President Trump says he’s tapping DOJ attorney Danny Nguyen and DC federal prosecutor John Truong for seats on the… https://t.co/qYtmL32dXN
1260976446924894200,Thu May 14 16:53:07 +0000 2020,RT @Olivia_Gazis: Burr, en route to a vote, tells reporters of the investigation and his decision to step aside: "This is a distraction to…
1260922000643670000,Thu May 14 13:16:46 +0000 2020,En Banc Fourth Circuit Revives Emoluments Lawsuit Against Trump https://t.co/GEpKzCFMvJ
1260908289077936000,Thu May 14 12:22:17 +0000 2020,A three-judge panel on the Fourth Circuit last year struck down the complaint -- but this ruling effectively allows… https://t.co/lJaY4ofN9V
1260907487831691300,Thu May 14 12:19:06 +0000 2020,Breaking: En banc federal appeals court rules against Trump in emoluments clause fight with DC and Maryland over hi… https://t.co/1izmciBQzX
1260904352312680400,Thu May 14 12:06:38 +0000 2020,More on the lawsuit here https://t.co/KJKTJMTzMz
1260904121214926800,Thu May 14 12:05:43 +0000 2020,Reupping that the federal lawsuit on Burr’s stock dumps was voluntarily dismissed last week over any impact it coul… https://t.co/hz1TTzRGcd
1260776712125780000,Thu May 14 03:39:26 +0000 2020,RT @DelWilber: NEWS: FBI serves search warrant on Sen. Richard Burr, Republican chairman of Senate Intel committee, to obtain his cell phon…
1260702849480233000,Wed May 13 22:45:56 +0000 2020,Judge Sullivan taps retired EDNY Judge John Gleeson to argue against DOJ's motion to dismiss criminal info against… https://t.co/ubuMWFj9A8
1260403171807187000,Wed May 13 02:55:07 +0000 2020,RT @cryanbarber: More than a dozen former members of the Watergate Special Prosecution Task Force are seeking to weigh in on the DOJ's move…
1260377035635134500,Wed May 13 01:11:16 +0000 2020,RT @Isikoff: Exclusive: FBI mistakenly reveals identity of Saudi Embassy official linked to support for 9/11 hijackers-- the same info  Bar…
1260296856883597300,Tue May 12 19:52:40 +0000 2020,'We All Know It's About the President': Trump Finds Defenders at Supreme Court in Tax Returns Case https://t.co/JnID5nVmdp from @MarciaCoyle
1260233109339091000,Tue May 12 15:39:21 +0000 2020,And that's it. Up next are arguments in the case Trump v. Vance, about the Manhattan DA's similar subpoena for the… https://t.co/pPmtUSjSvx
1260232817667162000,Tue May 12 15:38:12 +0000 2020,And Letter is done. Strawbridge is up for rebuttal, he says Letter "struggled" to answer hypotheticals about limits… https://t.co/BM9bDFsBDv
1260232432298623000,Tue May 12 15:36:40 +0000 2020,Letter: Courts are going to monitor this, so if contrary to what has happened in the past, over our lengthy history… https://t.co/YSfmeL3Lqd
1260231675344294000,Tue May 12 15:33:40 +0000 2020,Kagan asks when Congress is looking into a topic like foreign influence if there needs to be a higher standard for… https://t.co/QDpNVmiDFl
1260230990934544400,Tue May 12 15:30:56 +0000 2020,Sotomayor piggybacks on that, asks about whether the separation of powers issues raised in seeking a president's pe… https://t.co/eohpo8OBrd
1260230630752882700,Tue May 12 15:29:30 +0000 2020,Alito raises the possibility of subpoenaing a lawmaker's records as "a case study" for future legislation.  Letter… https://t.co/ullkMCxKda
1260230061808124000,Tue May 12 15:27:15 +0000 2020,Ginsburg skips more questions, but Breyer sounds concerns about the breadth of the subpoenas. He also says that if… https://t.co/0jWqFs4Zau
1260229761432981500,Tue May 12 15:26:03 +0000 2020,Letter says if there is a "massive number" of subpoenas and it's preventing the executive from doing its job, then… https://t.co/2HF9wrEEkG
1260229466909016000,Tue May 12 15:24:53 +0000 2020,Thomas: At some point there's a straw that breaks the camel's back &amp; it seems as though you're saying we should loo… https://t.co/h8BqUzNkij
1260228937550123000,Tue May 12 15:22:47 +0000 2020,And we have a second round of questioning. Roberts asks about balancing subpoenas, noting there are multiple reques… https://t.co/XKiuvy8X2q
1260228308958142500,Tue May 12 15:20:17 +0000 2020,Kavanaugh also asks about a president's personal medical records. Letter says they generally would be off limits, b… https://t.co/mo9lw4MS6S
1260228089063313400,Tue May 12 15:19:24 +0000 2020,Kavanaugh and Letter go back and forth on whether a "demonstrably critical" standard could be applied. Letter bring… https://t.co/RuAFeqe6iz
1260227551278125000,Tue May 12 15:17:16 +0000 2020,Kavanaugh says "just about everything can be characterized in terms of a subpoena as pertinent to a legislative pur… https://t.co/wkjBodE5Ez
1260227009634021400,Tue May 12 15:15:07 +0000 2020,Gorsuch asks for a potential limiting principle for future subpoenas, says the first examples Letter gave were too… https://t.co/kjQKaioxEA
1260226144391114800,Tue May 12 15:11:41 +0000 2020,Letter: "History really matters here and it shows that the arguments being made here by President Trump are astonis… https://t.co/Vm0Cwa6bnf
1260225725665284000,Tue May 12 15:10:01 +0000 2020,Kagan goes back to DOJ's claim that the subpoena would "undermine" Trump's ability to do his job.  Letter says, to… https://t.co/ekqLQxkay9
1260224969600118800,Tue May 12 15:07:01 +0000 2020,Sotomayor cites some "troubling" hypotheticals about subpoenas exposing too much personal info. "Tell me what we sa… https://t.co/PdYjdusmvv
1260224467327955000,Tue May 12 15:05:01 +0000 2020,Alito says of the House's argument is there's "no protection" on "the use of congressional subpoenas for the purpos… https://t.co/qvSkgSMsJ3
1260223607260799000,Tue May 12 15:01:36 +0000 2020,Alito says he was "somewhat surprised" by Letter's answer that courts could handle any potentially harassing subpoe… https://t.co/jhFQKqsY0l
1260223272869924900,Tue May 12 15:00:16 +0000 2020,Breyer asks if the House subpoenas were authorized. Letter says they were &amp; these subpoenas were specifically addre… https://t.co/ToaCW6Dcir
1260222628901634000,Tue May 12 14:57:43 +0000 2020,Ginsburg asks what is "the limiting principle" on subpoena beings issued for legitimate legislative purposes and no… https://t.co/Y49eq7Gvte
1260221969775067100,Tue May 12 14:55:06 +0000 2020,Thomas is pressing Letter on the history of congressional subpoenas. "Part of why we're wandering around in the wil… https://t.co/blOEMHFDoz
1260221560620810200,Tue May 12 14:53:28 +0000 2020,Roberts asks Letter for a subject that "is beyond any legislation Congress could write." Letter says the powers are… https://t.co/OrHuj7Vsrx
1260220429232492500,Tue May 12 14:48:58 +0000 2020,DOJ's main argument is that a ruling in the House's favor will "weaponize" lawmakers' subpoena power and undermine… https://t.co/uazp3kooZa
1260219481349148700,Tue May 12 14:45:12 +0000 2020,Kagan asks if DOJ is arguing whether seeking these docs will prevent Trump from carrying out his duties.  "Yes thes… https://t.co/BeXQL7oYz4
1260218698377367600,Tue May 12 14:42:06 +0000 2020,"They're targeting the personal life of the president before he was a candidate for office," Wall replies. "That ra… https://t.co/JgfvKrM6C7
1260218418214645800,Tue May 12 14:40:59 +0000 2020,Sotomayor says DOJ is "asking the court in the guise of a heightened review standard to speculate as to legislation… https://t.co/jeCOmTaz8V
1260217758417109000,Tue May 12 14:38:21 +0000 2020,DOJ: We're not saying the House has no power to get the records of a sitting president, we're saying it needs to sa… https://t.co/vl8ExTdvO9
1260216802954616800,Tue May 12 14:34:34 +0000 2020,Ginsburg: "The purpose of investigation is to frame the legislation," says lawmakers need the info to figure out wh… https://t.co/yXzP0QIEpS
1260216236081909800,Tue May 12 14:32:19 +0000 2020,Wall tells Thomas that the House's arguments for needing the docs are "paper thin." "The House has never really tri… https://t.co/0JkeT2b93a
1260215777845796900,Tue May 12 14:30:29 +0000 2020,Jeff Wall, representing DOJ, is up. "Should a court the probing the mental processes of the legislators should memb… https://t.co/WdXf5hqCfx
1260215056865861600,Tue May 12 14:27:37 +0000 2020,In response to Q from Kavanaugh, Strawbridge says he doesn't think these subpoenas show a "demonstrated need" for t… https://t.co/N8bX3QtJQm
1260214417045807000,Tue May 12 14:25:05 +0000 2020,And Gorsuch asks why the court shouldn't defer to the House's "views about its own legislative purposes."  Strawbri… https://t.co/2ySYBKzab6
1260214028737097700,Tue May 12 14:23:32 +0000 2020,Strawbridge cites the harassment issue again. "There's still a need to ensure that the president is not going to fa… https://t.co/7t6CifO7d6
1260213776915234800,Tue May 12 14:22:32 +0000 2020,Strawbridge disputes that, noting that these records are being held by third-party custodians.  Kagan says the "sub… https://t.co/TQWZnfYepF
1260213415332712400,Tue May 12 14:21:06 +0000 2020,Kagan: "What it seems to me you're asking us to do is to put a kind of 10 ton weight on the scales between the pres… https://t.co/k9yfAGkHOd
1260213221128102000,Tue May 12 14:20:20 +0000 2020,Strawbridge says regardless of past cases, the justices "should not put any finger on the scale of Congress's asser… https://t.co/xx9Uoemi0x
1260212835671556000,Tue May 12 14:18:48 +0000 2020,Sotomayor cites the "long long history of Congress" of subpoenaing &amp; getting president's papers.  "I see a tremendo… https://t.co/C9CToCV4dM
1260212834623000600,Tue May 12 14:18:48 +0000 2020,"Does Congress have any power to regulate the conduct of the president?" Alito asks.  Strawbridge discusses past ca… https://t.co/6mbH32F4Ky
1260211772306477000,Tue May 12 14:14:34 +0000 2020,(Breyer tries to argue back and say those Watergate subpoenas weren't tied to impeachment but Roberts cuts him off, moves onto Alito)
1260211581750784000,Tue May 12 14:13:49 +0000 2020,Breyer asks if past Watergate subpoenas were unlawful, "yes or no." And he adds, "isn't whatever standard applies t… https://t.co/LeqtpOeMef
1260210905243160600,Tue May 12 14:11:08 +0000 2020,And Thomas is up, after being missed earlier. "What's the line between a legislative subpoena and an impeachment-re… https://t.co/nuv3Pa9NNW
1260210482906050600,Tue May 12 14:09:27 +0000 2020,Ginsburg asks how these cases are different than Watergate or Whitewater. Strawbridge says in those cases there was… https://t.co/tKSkuhKdml
1260210077925073000,Tue May 12 14:07:50 +0000 2020,Roberts asks if there's ever a time where the House could subpoena the papers. Strawbridge calls it "difficult to i… https://t.co/cr59PQbv8P
1260209222022766600,Tue May 12 14:04:26 +0000 2020,Patrick Strawbridge, Trump's personal attorney with Consovoy McCarthy, is up first. He says these cases are "unprec… https://t.co/ANiYzq7fwy
1260207690455924700,Tue May 12 13:58:21 +0000 2020,The justices already threw a potential obstacle in the case when they asked for briefing on whether they should dis… https://t.co/0Os6F1hYMw
1260207688694276000,Tue May 12 13:58:21 +0000 2020,It’s Trump tax docs day at the Supreme Court, with arguments in cases that will have broad ramifications for the Ho… https://t.co/QA87rMA21Q
1259957372090552300,Mon May 11 21:23:41 +0000 2020,RT @ndelgadillo07: Latinos have the highest rate of coronavirus infection per capita in D.C. I talked to public health experts about why th…
1259837895344640000,Mon May 11 13:28:55 +0000 2020,Jonathan Kravis, the prosecutor who quit over Roger Stone's sentencing, speaks out after Flynn: "The department und… https://t.co/TB5bWd5Y0H
1259825509292261400,Mon May 11 12:39:42 +0000 2020,New FOIA lawsuit from @weareoversight this morning seeks "records with the potential to shed light on any improper… https://t.co/f8urQ3NNcl
1259238925392109600,Sat May 09 21:48:49 +0000 2020,RT @kpolantz: NEW: On his request to drop the case against Michael Flynn, DC US Attorney Tim Shea signed his name above his ousted predeces…
1258855851269542000,Fri May 08 20:26:38 +0000 2020,RT @MikeScarcella: Chief Justice Roberts won't order transfer of misconduct investigation involving DC Circuit Judge Thomas Griffith to ano…
1258834297743704000,Fri May 08 19:00:59 +0000 2020,In Rare Unity, Trump, DOJ and House All Urge Justices to Resolve Subpoena Fights https://t.co/tnI3ym1wMz
1258807495226777600,Fri May 08 17:14:29 +0000 2020,RT @lawrencehurley: SPECIAL REPORT: Enabled by the Supreme Court, cops are increasingly evading accountability in excessive force cases tha…
1258806794287304700,Fri May 08 17:11:41 +0000 2020,Judges on the Fourth Circuit heard arguments over Trump's public charge rule today and sounded worried about defini… https://t.co/q5jZp1OhiB
1258560246697648000,Fri May 08 00:52:00 +0000 2020,RT @ZekeJMiller: BRUNSWICK, Ga. (AP) — Authorities: Georgia father and son arrested and charged with murder of black man who was killed on…
1258476657767317500,Thu May 07 19:19:51 +0000 2020,RT @KerriKupecDOJ: STATEMENT: USA Jeff Jensen who reviewed Flynn case.   “Through the course of my review of General Flynn’s case, I conclu…
1258475071687049200,Thu May 07 19:13:33 +0000 2020,RT @TMcParlandALM: NY Lawyer Douglas Wigdor Announces Representation of Biden Accuser Tara Reade Ahead of TV Interview https://t.co/CWW9u5X…
1258472455997395000,Thu May 07 19:03:09 +0000 2020,RT @MikeScarcella: Only US Attorney Timothy Shea signed Thursday's filing moving to dismiss Michael Flynn case /// Barr's Justice Dept. Mov…
1258467338481012700,Thu May 07 18:42:49 +0000 2020,RT @ZekeJMiller: WASHINGTON (AP) — Justice Department is dropping criminal case against ex-Trump adviser Flynn, according to court filing o…
1258450376707256300,Thu May 07 17:35:25 +0000 2020,RT @kyledcheney: JUST IN: Prosecutor Brandon VAN GRACK has moved to withdraw from the Flynn case. https://t.co/qoO12enPxL
1258442716603715600,Thu May 07 17:04:59 +0000 2020,DOJ has officially gone to SCOTUS to stay the DC Circuit's ruling to turn over Mueller grand jury materials to the… https://t.co/c2xRUVMXj3
1258394997726077000,Thu May 07 13:55:21 +0000 2020,RT @Tonymauro: Flush With Embarrassment: A Brief History of Awkward Moments at #SCOTUS https://t.co/sU6aGWpfK9 via @TheNLJ
1258125048596050000,Wed May 06 20:02:41 +0000 2020,(I know it's a different danny devito let me have this)
1258125046557683700,Wed May 06 20:02:40 +0000 2020,when SCOTUS manages to make both toilet and Danny DeVito-adjacent news in one day https://t.co/FJ3bm792S2 https://t.co/A1NM5KRNmP
1258101507964141600,Wed May 06 18:29:08 +0000 2020,Trump DC Circuit pick Justin Walker faced angry Dems over comments he made against upholding Obamacare. Dick Durbin… https://t.co/qfw5G3jCOq
1258066340142878700,Wed May 06 16:09:23 +0000 2020,"The ABA's had an epiphany and you're well qualified," Sen. Kennedy tells Walker, after the group initially found h… https://t.co/Pf5UdgpfKz
1258044000881311700,Wed May 06 14:40:37 +0000 2020,Sen. Leahy is appearing at the hearing through videoconference, allowed under rules set during the pandemic. He’s a… https://t.co/83ibhBoj6p
1258039410010009600,Wed May 06 14:22:23 +0000 2020,"It was a long opinion because I believed it was a momentous...thing for a court to enjoin a mayor in the midst of… https://t.co/aHClTFpdxa
1258038843397288000,Wed May 06 14:20:08 +0000 2020,Walker's opening statement is a list of thank yous, to his family, friends, clerks, fellow judges and others. And n… https://t.co/lpoE4wXmiI
1258034906007027700,Wed May 06 14:04:29 +0000 2020,Pandemic or not, the Senate Judiciary Committee is getting back to judicial nominations this morning with Justin Wa… https://t.co/FSefmhKvWH
1257794496445788200,Tue May 05 22:09:11 +0000 2020,ABA Says Justin Walker Is ‘Well Qualified’ for DC Circuit, After Finding Him ‘Not Qualified’ for District Court https://t.co/hsVC7nWwOo
1257767027671957500,Tue May 05 20:20:02 +0000 2020,Judge Says He Faced No Political Pressure From McConnell To Retire https://t.co/k5QQFDOFYO
1257759306532913200,Tue May 05 19:49:21 +0000 2020,When Justin Walker has his second nomination hearing tomorrow, senators will have the option to appear virtually or… https://t.co/uS3DPZ47Zk
1257715880097693700,Tue May 05 16:56:47 +0000 2020,RT @jsmccullou: After an appellate court stopped a federal order for Texas prisons to provide things like hand sanitizer, face masks (the l…
1257707017222979600,Tue May 05 16:21:34 +0000 2020,It’s official: McConnell protégé Justin Walker will appear before the Senate Judiciary Committee tomorrow morning. https://t.co/bD7TsbgxkS
1257690171631440000,Tue May 05 15:14:38 +0000 2020,RT @kaitlancollins: News — Attorney General Barr made a last-minute push yesterday to persuade the administration to modify its position in…
1257684655907709000,Tue May 05 14:52:43 +0000 2020,RT @ZoeTillman: NEW: US citizen children whose parents are undocumented immigrants aren't eligible for coronavirus stimulus checks that oth…
1257333215360155600,Mon May 04 15:36:13 +0000 2020,Federal judge this morning agrees to voluntarily dismiss lawsuit filed over Sen. Burr's stock sell-offs ahead of th… https://t.co/uP99D7PmWJ
1256317545860272000,Fri May 01 20:20:18 +0000 2020,Federal judiciary committees put out a notice today asking for comment on any rule changes that could make it easie… https://t.co/Xfc2x4Ue7D
1256313797087813600,Fri May 01 20:05:25 +0000 2020,This is the same Florida attorney that Mike Huckabee filed a bar complaint against a few months back, over a longst… https://t.co/9gL6G5m4Vq
1256280442082394000,Fri May 01 17:52:52 +0000 2020,And the House filed a brief earlier this week opposing the motion for a stay, claiming the Judiciary Committee and… https://t.co/ec2goq5fip
1256279822839545900,Fri May 01 17:50:24 +0000 2020,DOJ asked to pause the order while it petitioned the Supreme Court to take up the case. Earlier: https://t.co/YZvoy7CAzU
1256279489128075300,Fri May 01 17:49:05 +0000 2020,Now: DC Circuit denies DOJ's motion to stay its order to hand over Mueller grand jury materials to House Judiciary,… https://t.co/Rhf3SFGzsf
1256242370741485600,Fri May 01 15:21:35 +0000 2020,The DC Circuit today sided with the FDA over its rejection of a pharmaceutical manufacturer's drug label for an opi… https://t.co/ospaTAQCBa
1255955483837546500,Thu Apr 30 20:21:36 +0000 2020,RT @seungminkim: Scoop: The White House interviewed former Kavanaugh clerk Justin Walker, now a D.C. circuit pick, for the appeals court ba…
1255923918654890000,Thu Apr 30 18:16:10 +0000 2020,RT @razhael: Weird &amp; unexpected fallout from the WhatsApp v. NSO suit via ⁦@Bing_Chris⁩: We learn that FBI Director Christopher Wray once h…
1255863873564967000,Thu Apr 30 14:17:34 +0000 2020,Roger Stone is appealing his criminal case up to the DC Circuit, as speculation ramps up that Trump could pardon Mi… https://t.co/h50WLYBiTS
1255573144758358000,Wed Apr 29 19:02:19 +0000 2020,Martin Shkreli wants to be released from prison because he thinks he can come up with a cure for COVID-19. Prosecut… https://t.co/4HoDkJkzfK
1255550755097936000,Wed Apr 29 17:33:21 +0000 2020,RT @cryanbarber: Mueller Prosecutor Andrew Weissmann to Join Jenner &amp; Block as Investigations Co-Chairman https://t.co/I1v2kiR8Ah
1255547612914241500,Wed Apr 29 17:20:52 +0000 2020,I forgot to turn off an otter recording and now the end of the transcript is just @davejorgenson's wapo tiktoks https://t.co/dHsfi4RAze
1255317739452973000,Wed Apr 29 02:07:26 +0000 2020,RT @kyledcheney: NEW: Newly posted search warrants show communications between STONE and ASSANGE in early 2017 in which Stone promises he'l…
1255231026638524400,Tue Apr 28 20:22:52 +0000 2020,@my2cnz I wouldn't expect a ruling til weeks from now. Takes a while to write opinions, especially if there's a dissent.
1255226913636974600,Tue Apr 28 20:06:31 +0000 2020,The DC Circuit sounded like they'd rule for the House in the McGahn lawsuit, but the judges were also highly aware… https://t.co/jU9q6cmCXP
1255213042226335700,Tue Apr 28 19:11:24 +0000 2020,RT @cryanbarber: Update in the Michael Flynn case: A judge has given Flynn's former defense team at @CovingtonLLP until May 4 to certify th…
1255154198129389600,Tue Apr 28 15:17:35 +0000 2020,RT @Legal_Times: Local court officials are told to prepare for the possibility of returning to tighter restrictions “if conditions signific…
1255145304241791000,Tue Apr 28 14:42:14 +0000 2020,DC Judge Carl Nichols just shut down a request from immigration lawyers + detained immigrants to pause in-person he… https://t.co/TdhtoSMTKb
1255125729500684300,Tue Apr 28 13:24:27 +0000 2020,The Trump DOJ lost a separate House lawsuit for grand jury materials redacted from the Mueller report at the DC Cir… https://t.co/OhdYTBVpAd
1255122904863441000,Tue Apr 28 13:13:14 +0000 2020,Arguments are being held one day after the Supreme Court asked for briefs on whether they're barred from ruling on… https://t.co/8kxSAV7unS
1255122904016175000,Tue Apr 28 13:13:14 +0000 2020,A 3 judge panel on the circuit ruled 2-1 earlier this year that the House can't go to court to enforce a subpoena a… https://t.co/5IZlMRefqY
1255121723537731600,Tue Apr 28 13:08:32 +0000 2020,The DC Circuit will hear en banc arguments at 9:30 am in the House's McGahn and border wall lawsuits. You can liste… https://t.co/HfZBbzXKNA
1254912317789212700,Mon Apr 27 23:16:26 +0000 2020,RT @samstein: NEW — One of the Senate GOP’s first order of business upon returning will be confirming Justin Walker, the 38-yr-old McConnel…
1254807121511800800,Mon Apr 27 16:18:25 +0000 2020,Justices Ask if They’re Barred From Ruling on Trump Tax Cases in New Hurdle for House https://t.co/DtOOmVfy1I
1254783266231443500,Mon Apr 27 14:43:38 +0000 2020,Listening to DC Circuit's en banc arguments in a separate case this am, attorneys give opening statements, then jud… https://t.co/YpmtYVClQX
1254767336223056000,Mon Apr 27 13:40:20 +0000 2020,RT @MikeScarcella: Now: SCOTUS wants to talk about "political question doctrine" in Trump financial document cases involving US congression…
1254767177070030800,Mon Apr 27 13:39:42 +0000 2020,RT @AndyMcCanse: I spoke to @jacq_thomsen for this story:  Can the House Sue Trump Officials? En Banc DC Circuit Prepares to Answer https:/…
1253764636777857000,Fri Apr 24 19:15:57 +0000 2020,Attorneys for federal inmates ask the DC Circuit to rehear their case en banc after Trump appointees on the circuit… https://t.co/4PKKMOYnVk
1253729868635922400,Fri Apr 24 16:57:48 +0000 2020,Federal judge orders prosecutors to file public and redacted versions of Roger Stone's search warrant materials by… https://t.co/dSVC1UUHLh
1253725312560611300,Fri Apr 24 16:39:42 +0000 2020,A judge signed off on the FTC's record $5B fine against Facebook, but said the case calls "into question the adequa… https://t.co/nyGBMi8hUa
1253722713040072700,Fri Apr 24 16:29:22 +0000 2020,@dkbib unfortunately FLRA isn't exactly my area of expertise, but from my own digging around I haven't been able to… https://t.co/2o4WdPsJA8
1253718585039601700,Fri Apr 24 16:12:58 +0000 2020,Judiciary Dems ask Barr about Trump's emergency legal powers, saying Trump's remarks suggest the admin may have dra… https://t.co/FViIkzmamA
1253717293487534000,Fri Apr 24 16:07:50 +0000 2020,@dkbib there hasn't been a ruling yet. parties/amici had 30 days after arguments wrapped up to file briefs, and the… https://t.co/ewGYlAtJNX
1253705490921595000,Fri Apr 24 15:20:56 +0000 2020,RT @lhelemNLJ: Jacqueline Thomsen reports on how @WilmerHale's Matthew Martens and @1stLiberty successfully fought church service restricti…
1253048837595377700,Wed Apr 22 19:51:38 +0000 2020,I looked at how feds are opposing the release of DC inmates, as the virus spreads in DC's facilities. Both judges a… https://t.co/MSRM3BjwnX
1253040045109457000,Wed Apr 22 19:16:41 +0000 2020,New Arkansas lawsuit targets the state's requirements on in-person signatures for a state constitutional amendment… https://t.co/sahweTtLgk
1252984301240680400,Wed Apr 22 15:35:11 +0000 2020,The House is asking for another delay in its appeal of a court order that required lawmakers to notify Trump if the… https://t.co/JIPNS9AMTu
1252976284583542800,Wed Apr 22 15:03:20 +0000 2020,RT @burgessev: McConnell to @hughhewitt: "As soon as we get back in session, we’ll start confirming judges again. We need to have hearings,…
1252972151541575700,Wed Apr 22 14:46:54 +0000 2020,ACS announces that it will hold its annual convention in June virtually, and will offer free registration for atten… https://t.co/fZhhvqApsB
1252762964727337000,Wed Apr 22 00:55:40 +0000 2020,RT @timkmak: Scoop: The National Rifle Association's legal troubles and infighting have cost the powerful gun rights group $100 million (!!…
1252619707552841700,Tue Apr 21 15:26:25 +0000 2020,The DC Circuit goes after Scott Pruitt policy this am: A new EPA directive blocked scientists who got EPA $ from ad… https://t.co/OxGbfcgGzd
1252615902639673300,Tue Apr 21 15:11:18 +0000 2020,RT @magmill95: The Senate Intelligence Committee just released volume four of an expected five reports on Russian interference in the 2016…
1252332542868566000,Mon Apr 20 20:25:20 +0000 2020,The circuit already has a liberal majority of active judges. Only 2 of the 9 judges hearing the cases are appointed… https://t.co/9a3Hb6rpGg
1252330641921884200,Mon Apr 20 20:17:46 +0000 2020,DC Circuit is set to hear en banc phone arguments in House lawsuits over McGahn's testimony/border wall funds next… https://t.co/AUxe7ChhmX
