id,created_at,text
1217512941479698400,Wed Jan 15 18:24:40 +0000 2020,On a call with reporters about impeachment, a senior administration official says the White House will make an anno… https://t.co/LSQhsf2Lxj
1217489727508680700,Wed Jan 15 16:52:25 +0000 2020,RT @DaveThomas5150: Nearly all of @SpeakerPelosi's impeachment managers have law degrees, and some are former prosecutors themselves. https…
1217258601049399300,Wed Jan 15 01:34:00 +0000 2020,Whether the judge lets Flynn withdraw the plea is another story. But this has been a long time coming, since he fir… https://t.co/TGRw6FvePt
1217257507200041000,Wed Jan 15 01:29:39 +0000 2020,“The prosecution seeks to rewrite history and send Mr. Flynn to prison. This about-face places the government in br… https://t.co/sp3x4vKnId
1217256324146352000,Wed Jan 15 01:24:57 +0000 2020,And there it is: Michael Flynn is withdrawing his guilty plea, days after federal prosecutors said he deserved to b… https://t.co/Kqd3SM7cZB
1217216549766996000,Tue Jan 14 22:46:54 +0000 2020,Looks like Trump personally signed off on John Dowd representing Igor "Furman" Fruman and Lev Parnas, per this Seku… https://t.co/akeJKKSVqr
1217205960428736500,Tue Jan 14 22:04:50 +0000 2020,RT @MikeScarcella: 'Both the McGahn and tax returns lawsuits seek to enforce congressional subpoenas for information relating to the presid…
1217191646682587100,Tue Jan 14 21:07:57 +0000 2020,McFadden scheduled a 3 pm phone conference on this today at 2:54 pm, per court alerts. Why did he suddenly get spoo… https://t.co/2cq70uHg01
1216824301929758700,Mon Jan 13 20:48:15 +0000 2020,.@whca just filed a brief backing Brian Karem in the court fight over his hard pass (yes, that's still happening).… https://t.co/RCt7JLxuzA
1216820515563876400,Mon Jan 13 20:33:12 +0000 2020,RT @chezspence: heyyy maybe we don't have to cover everything this weird fringe group gets mad about like it's news https://t.co/no2je6PepU
1216818039670419500,Mon Jan 13 20:23:22 +0000 2020,The Energy Department says it will turn over nonexempt communications on Ukraine from ex-Sec. Rick Perry to… https://t.co/wyyf05LRbx
1216804917437960200,Mon Jan 13 19:31:14 +0000 2020,A DC Circuit panel this morning sounded ready to block a Trump admin rule that requires drug manufacturers to show… https://t.co/AlrKRNGy1m
1216780776055984000,Mon Jan 13 17:55:18 +0000 2020,RT @kyledcheney: JUST IN: Prosecutors recommend a sentence close to 4.5 years for former Rep Chris COLLINS, say he deserves lengthier jailt…
1216759740002439200,Mon Jan 13 16:31:42 +0000 2020,Circuits Split and Judges Squabble as Courts Confront National Injunctions https://t.co/rodLeEHlIe
1216018188846207000,Sat Jan 11 15:25:03 +0000 2020,RT @samjcharles: Judge orders CPD to turn over 48 years’ worth of misconduct files https://t.co/Q8qMvbliyV
1215741725186064400,Fri Jan 10 21:06:29 +0000 2020,RT @Haleaziz: NEW: BuzzFeed News has obtained documents -- including a draft presidential proclamation -- that show the Trump administratio…
1215705173638754300,Fri Jan 10 18:41:14 +0000 2020,New: Trump + the Senate GOP confirmed a lot of judges in 2019. They went fast, ditched the ABA's warnings and left… https://t.co/oMGRwZ0ScH
1215694352854462500,Fri Jan 10 17:58:14 +0000 2020,RT @MikeScarcella: 'There’s a moment here for Boasberg to seize, and I hope he seizes it.' James Boasberg, new presiding judge of the FISA…
1215692174853058600,Fri Jan 10 17:49:35 +0000 2020,@splcenter Attorneys from @CovingtonLLP and @CBLawyersAZ are also behind the complaint.  The lawsuit seeks damages,… https://t.co/trKMDojOE9
1215690960174231600,Fri Jan 10 17:44:46 +0000 2020,New lawsuit in Arizona from @splcenter alleges trauma suffered by two asylum-seeking families, after their children… https://t.co/zjuUzsbk8x
1215676754079207400,Fri Jan 10 16:48:19 +0000 2020,RT @kyledcheney: BREAKING: Pelosi has asked House Judiciary Committee to prepare a resolution naming impeachment managers for next week. Sh…
1215676676585283600,Fri Jan 10 16:48:00 +0000 2020,The 9th Circuit rejected a request to lift the stay late last month, noting the injunction in Texas and SCOTUS stay… https://t.co/t8CjyR9Eky
1215676675226329000,Fri Jan 10 16:48:00 +0000 2020,The ACLU has filed an emergency motion with the 9th Circuit, asking the court to lift a stay on an injunction on th… https://t.co/V85qO7Evvx
1215658185429848000,Fri Jan 10 15:34:31 +0000 2020,As SCOTUS debates the fate of DACA, attorneys from @jactioncenter and @CovingtonLLP sue in DC federal court to find… https://t.co/BlkiRSdtpX
1215448216189177900,Fri Jan 10 01:40:11 +0000 2020,@Nicole_Cliffe I am healthy, I am whole but I have poor impulse control And I want to go home But I am home
1215408460743004200,Thu Jan 09 23:02:12 +0000 2020,@alibreland a US history podcast, they covered him before the domestic terrorist label. it's uhh pretty fucked up! https://t.co/H8MyRrTac1
1215407862635253800,Thu Jan 09 22:59:50 +0000 2020,@alibreland have you listened to the dollop episode about him
1215372365602984000,Thu Jan 09 20:38:47 +0000 2020,New York City Bar Association Calls for Congressional Probe of US AG William Barr https://t.co/aDOKUhmb64
1215361855264297000,Thu Jan 09 19:57:01 +0000 2020,RT @burgessev: CANCEL THE REST OF JANUARY: McConnell tells Republicans he expect impeachment articles as soon as tomorrow, trial to start n…
1215344443592781800,Thu Jan 09 18:47:50 +0000 2020,@CREWcrew CREW says they got Whitaker's forms, after they were revised 5 times. They say Whitaker certified the ori… https://t.co/Y0fEhUhapd
1215343748290437000,Thu Jan 09 18:45:04 +0000 2020,New @CREWcrew lawsuit in DC asks a judge to order DOJ to turn over Matt Whitaker's financial disclosure forms as or… https://t.co/K24SIbLPqi
1215307720208855000,Thu Jan 09 16:21:54 +0000 2020,Pelosi calls DOJ's Office of Legal Counsel "a tool of the president of the United States."  "That's who that is. So… https://t.co/HDAMdox9ue
1214991097556066300,Wed Jan 08 19:23:45 +0000 2020,The nominee, Cory Wilson, said he wasn't told to rejoin the group and that he didn't recall discussing FedSoc with… https://t.co/sUaOPFA9Nf
1214990300327948300,Wed Jan 08 19:20:35 +0000 2020,Richard Blumenthal asked a judicial nominee today if he was told to rejoin the Federalist Society to better his odd… https://t.co/H64s9wcMCs
1214986735987363800,Wed Jan 08 19:06:25 +0000 2020,that's it I'm moving https://t.co/frDT23SdE7
1214946714051842000,Wed Jan 08 16:27:23 +0000 2020,RT @lawrencehurley: Justice Department has posted a legal opinion pouring cold water on the new push to ratify the Equal Rights Amendment t…
1214942192457932800,Wed Jan 08 16:09:25 +0000 2020,At a Senate Judiciary hearing, @SenMikeLee defends a judicial nominee over questions about his FedSoc affiliation.… https://t.co/arym4JFivL
1214929481300873200,Wed Jan 08 15:18:55 +0000 2020,RT @Legal_Times: DOJ's Rod Rosenstein Lands at King &amp; Spalding https://t.co/MWyM1qDouj
1214915538411040800,Wed Jan 08 14:23:31 +0000 2020,I spoke with Larry Tribe, one of the hundreds of lawyers who signed this letter: He tells me that he's still consul… https://t.co/0Ut8bCsT1n
1214683028821303300,Tue Jan 07 22:59:36 +0000 2020,Inside DC’s Acting School for Lawyers https://t.co/XY6fLtd8GN
1214671926368592000,Tue Jan 07 22:15:29 +0000 2020,'Indefensible': Hundreds of Lawyers Criticize McConnell Over Senate Impeachment Trial https://t.co/JgR4drISpO
1214654590211244000,Tue Jan 07 21:06:36 +0000 2020,Whether the court should even be involved in the two Mueller/impeachment-related lawsuits is a major question hangi… https://t.co/HVWaZEVwRi
1214654587581423600,Tue Jan 07 21:06:35 +0000 2020,Fun fact: Thomas Griffith, the DC Circuit judge who will rule in the McGahn/Mueller grand jury cases, is teaching a… https://t.co/sFVhtqpyKM
1214631678301364200,Tue Jan 07 19:35:33 +0000 2020,Immigration Judges, Joined By Latham &amp; Watkins, Fight DOJ Effort to Decertify Union https://t.co/CbZXlm7tjo
1214602874765877200,Tue Jan 07 17:41:06 +0000 2020,RT @MikeScarcella: Now: US Justice Department recommends 0 to 6 months of incarceration for Michael Flynn based on 'his apparent failure to…
1214589366657568800,Tue Jan 07 16:47:25 +0000 2020,New lawsuit in DC targets Amtrak's arbitration policy for customers. "Congress did not grant Amtrak the authority t… https://t.co/fHBX3h3eJt
1214578527653302300,Tue Jan 07 16:04:21 +0000 2020,New open letter from 300+ lawyers criticizing McConnell over Senate impeachment trial: “All senators have a solemn… https://t.co/d3bJbv3ARO
1214570125493506000,Tue Jan 07 15:30:58 +0000 2020,Leonard Leo stepping back from FedSoc to work on new conservative network https://t.co/iUCeMKwbxy
1214269164136943600,Mon Jan 06 19:35:03 +0000 2020,The coalition of media groups seeking the materials – AP, WaPo, CNN, NYT, Politico – had wanted a 30 day deadline.… https://t.co/dwk47m6TGG
1214265675994325000,Mon Jan 06 19:21:11 +0000 2020,Federal prosecutors just said in court they’re ready to release some of sealed info in warrant applications for Rog… https://t.co/QcaDJTOhDS
1214242267189280800,Mon Jan 06 17:48:10 +0000 2020,RT @Haleaziz: NEW: The Trump administration will now deport Mexican nationals — including families — who come to the US southern border see…
1214238769257291800,Mon Jan 06 17:34:16 +0000 2020,RT @ByronTau: In 1974, the Nixon DOJ studied whether a president could invoke executive privilege a Senate trial. It concluded that a presi…
1214228843193614300,Mon Jan 06 16:54:50 +0000 2020,!! John Bolton: "I have concluded that, if the Senate issues a subpoena for my testimony, I am prepared to testify.… https://t.co/4kePkRzUhv
1214202714940477400,Mon Jan 06 15:11:00 +0000 2020,RT @Tonymauro: New: Elizabeth Prelogar, Mueller Alum and #SCOTUS Advocate, Joins Cooley @CooleyLLP https://t.co/qG6qyiGdpo via @TheNLJ
1214202564792737800,Mon Jan 06 15:10:24 +0000 2020,NY judge denies Avenatti's attempt to get two of the extortion-related charges dropped in the Nike case https://t.co/LB79zonKZ2
1214159295685812200,Mon Jan 06 12:18:28 +0000 2020,RT @janewester: There are already more people than I can count outside the courthouse where Harvey Weinstein’s criminal trial is set to beg…
1213884190422454300,Sun Jan 05 18:05:18 +0000 2020,RT @TheNLJ: Things Got Pretty Weird Between Neomi Rao and Doug Letter During the Mueller Grand Jury Hearing https://t.co/6hQdifGPy3
1213209543209103400,Fri Jan 03 21:24:30 +0000 2020,Donald Verrilli Returns to SCOTUS to Defend Obamacare https://t.co/v6PMJ3q9yM
1213167977991946200,Fri Jan 03 18:39:20 +0000 2020,New: A Democratic coalition of states has filed its petition with the Supreme Court to review the 5th Circuit's dec… https://t.co/FE9MMaUs9d
1213147021143658500,Fri Jan 03 17:16:03 +0000 2020,Letter said the House sergeant-at-arms would "knock on the door" of the Justice Department and say he's authorized… https://t.co/iOrGnhjmR3
1213146370795823000,Fri Jan 03 17:13:28 +0000 2020,Judge Rao keeps offering up the possibility that the grand jury secrecy rule doesn't mean DOJ is compelled to hand… https://t.co/de7WJLJyJq
1213139391444594700,Fri Jan 03 16:45:44 +0000 2020,Lots of talk about the court ruling in Watergate that let the House get grand jury info. Judge Griffith just called… https://t.co/bO4gYILL4v
1213132902961160200,Fri Jan 03 16:19:57 +0000 2020,The DC Circuit is now hearing arguments in the Mueller grand jury materials case. C-SPAN is carrying it live: https://t.co/tb9FdzcFpM
1213131893845233700,Fri Jan 03 16:15:57 +0000 2020,But another judge, Judith Rogers, seemed a bit more wary. She said that those actions might play out in theory, but… https://t.co/lGl5hdKPUM
1213131652605653000,Fri Jan 03 16:14:59 +0000 2020,At least one of the judges, Thomas Griffith, signaled that he could side with the DOJ argument. He highlighted the… https://t.co/2KeAt7HBsP
1213130642160078800,Fri Jan 03 16:10:58 +0000 2020,New: A Justice Department attorney told the DC Circuit this morning that the courts should stay out of the fight ov… https://t.co/mXe1IOAohJ
1213105416776888300,Fri Jan 03 14:30:44 +0000 2020,The judges in the Mueller grand jury info case also asked the House and DOJ to say whether the House can even go to… https://t.co/kS5U7dxYwt
1213104548572737500,Fri Jan 03 14:27:17 +0000 2020,Last month's impeachment vote had an immediate impact on both cases, with each panel of judges asking if impeachmen… https://t.co/n7QLGFqkf2
1213103984183054300,Fri Jan 03 14:25:02 +0000 2020,Arguments will be starting shortly in the McGahn testimony/Mueller grand jury info cases at the DC Circuit. Meet th… https://t.co/VI8088acs4
1212861814637244400,Thu Jan 02 22:22:45 +0000 2020,@Hopes_Soaps well yes, doubt it will get to SCOTUS this term. but even a win at SCOTUS still opens that door
1212859391482978300,Thu Jan 02 22:13:07 +0000 2020,It's a busy morning at the DC Circuit tomorrow: 4 judges, 4 arguing attorneys over 2 cases that, if the House wins,… https://t.co/BAPLHhCiaF
1212854795494723600,Thu Jan 02 21:54:51 +0000 2020,RT @Emma_Dumain: NEW: @TGowdySC confirms once and for all he has no plans to join @realDonaldTrump's legal team: “The president has good la…
1211789195137683500,Mon Dec 30 23:20:32 +0000 2019,'Need Not Strike That Balance': Judge Dismisses Chuck Cooper's Suit Over Impeachment Testimony https://t.co/YNvSjsCjsC
1209516088519725000,Tue Dec 24 16:48:01 +0000 2019,found all the dads in my hometown, they’re gathered around the gift card display at cvs on christmas eve
1209240116226646000,Mon Dec 23 22:31:24 +0000 2019,@brandonetc visit https://t.co/B4XIwqwaOl for more!!
1209239828325421000,Mon Dec 23 22:30:16 +0000 2019,@NateWeixel feat. blown up photos of the Salem witch museum above the 30 racks of BL
1209239377785884700,Mon Dec 23 22:28:28 +0000 2019,the most Salem part of this pic is that I took it at a liquor store
1209239171950370800,Mon Dec 23 22:27:39 +0000 2019,Front page news from Salem, Massachusetts https://t.co/ti4ehZzNwt
1208128545287016400,Fri Dec 20 20:54:25 +0000 2019,NEW: Judge Jackson agrees to move Stone’s sentencing date by two weeks. He is now set to be sentenced on Feb. 20, i… https://t.co/cuNoYEWIZS
1207740990930468900,Thu Dec 19 19:14:25 +0000 2019,The Supreme Court was always the inevitable end for this case. But DC Circuit also seems to be concerned about impe… https://t.co/UrHIkq2KNO
1207740569067425800,Thu Dec 19 19:12:45 +0000 2019,DOJ says in new court filing that it believes the House's subpoena for Don McGahn's testimony "appears to be moot,"… https://t.co/28AHnnyTqa
1207705978189172700,Thu Dec 19 16:55:17 +0000 2019,Stone's sentencing is currently set for Feb. 6, 2020.  Stone is the last Mueller-related sentencing on Judge Jackso… https://t.co/j27No662w0
1207705415443763200,Thu Dec 19 16:53:03 +0000 2019,NEW: Roger Stone's lawyers want to push back his sentencing to after March 9, 2020 because Stone is having trouble… https://t.co/YMFXME84ih
1207679443948445700,Thu Dec 19 15:09:51 +0000 2019,RT @MikeScarcella: 4th Circuit Rules Trump Administration Must Face Claims of Inadequate Preparation for 2020 Census https://t.co/aEdpdk58C…
1207495638012874800,Thu Dec 19 02:59:28 +0000 2019,we stan a local angle https://t.co/GF0oOQNSxs
1207495217877803000,Thu Dec 19 02:57:48 +0000 2019,@trichardpdx As Justice Ginsburg put it the other night, courts are reactive. Generally not this reactive, but it’s… https://t.co/KsuRmJpKAR
1207488812106039300,Thu Dec 19 02:32:21 +0000 2019,Ditto in the McGahn case. Almost identical panel of judges. https://t.co/rNCRnjG2b9
1207486622620700700,Thu Dec 19 02:23:39 +0000 2019,Impeachment has IMMEDIATE effect in the courts: DC Circuit panel in Mueller grand jury jury materials case orders p… https://t.co/pVEEzd6IgE
1207475793267495000,Thu Dec 19 01:40:37 +0000 2019,@chrisfthomsen tysm
1207473342703440000,Thu Dec 19 01:30:53 +0000 2019,And there it is -- 'Enemy to the Rule of Law': House Impeaches Trump, and Senate Braces for Trial https://t.co/9bsa8vgHB0
1207448254255943700,Wed Dec 18 23:51:11 +0000 2019,California AG Becerra says he + other Dem state AGs will petition the Supreme Court to take up the Obamacare case r… https://t.co/EfOZSrIJv5
1207438732992880600,Wed Dec 18 23:13:21 +0000 2019,the microwave is Good and you can rip mine out of my dead, radioactive hands https://t.co/88AttA7zG6
1207424313009299500,Wed Dec 18 22:16:03 +0000 2019,happy impeachment day, Obamacare isn't dead -- yet https://t.co/wt8QBkH5gz
1207402590276870100,Wed Dec 18 20:49:44 +0000 2019,Tribe isn't officially an impeachment adviser. But he did speak with Judiciary Dems as they prepared for their hear… https://t.co/tT1aFgzMus
1207401869779316700,Wed Dec 18 20:46:52 +0000 2019,I recently ran this idea by a constitutional law scholar; he said he doesn't believe there's a requirement that the… https://t.co/nwtmUaWzKf
1207401867791290400,Wed Dec 18 20:46:52 +0000 2019,.@tribelaw's Washington Post op-ed on the House holding onto the articles of impeachment until they can get fair ru… https://t.co/55MpZfsPpC
1207341762848665600,Wed Dec 18 16:48:02 +0000 2019,Spotted on the House floor during this vote, Judiciary Committee counsel Norm Eisen and Barry Berke
1207339773142225000,Wed Dec 18 16:40:07 +0000 2019,Impeachment is happening but the House lawsuits don’t stop: Per newly filed notices, Doug Letter will argue for the… https://t.co/zHkGmq0ZXv
1207318213752692700,Wed Dec 18 15:14:27 +0000 2019,RT @KaraScannell: Judge dismisses NYS case against Paul Manafort saying the law of double jeopardy in NY state provides “very narrow except…
1207313723381211100,Wed Dec 18 14:56:37 +0000 2019,As the House prepares to vote on articles of impeachment today, meet the committee lawyers who have been a constant… https://t.co/R78dEEbNGA
1207089539061289000,Wed Dec 18 00:05:47 +0000 2019,RT @KFaulders: WH counsels office did offer edits to the letter to Speaker Pelosi &amp; reviewed before it was sent, I’m told. https://t.co/Fnj…
1207064389909655600,Tue Dec 17 22:25:51 +0000 2019,House says in new court filing that it's appealing a judge's order over the NY law that lets lawmakers request Trum… https://t.co/TB2lejM2lx
1207025537471930400,Tue Dec 17 19:51:28 +0000 2019,New Lawsuit Seeks to Force Kellyanne Conway to Face Hatch Act Complaint https://t.co/pptu7yyYT3
1206980113256059000,Tue Dec 17 16:50:58 +0000 2019,RT @cryanbarber: Now: Former Trump campaign adviser Rick Gates is sentenced to three years of probation with 45 days of "intermittent confi…
1206949443972538400,Tue Dec 17 14:49:06 +0000 2019,Serial failed California presidential candidate 'Rocky' De La Fuente has filed a RICO lawsuit against Trump, the Tr… https://t.co/WVA8Hgnj4Q
1206717680927092700,Mon Dec 16 23:28:09 +0000 2019,House Wants DC Circuit to Skip Written Opinions, Issue ‘Immediate’ Orders for Impeachment Info https://t.co/sGMU1X7DWR
1206654588264292400,Mon Dec 16 19:17:27 +0000 2019,House lawyers argue time is of the essence, and that the court "should not countenance DOJ’s effort to run out the… https://t.co/5wvg1VRkB2
1206652601615503400,Mon Dec 16 19:09:33 +0000 2019,Now: The House Judiciary Committee says in new court filing that it needs Mueller grand jury materials for the Sena… https://t.co/hoMwF6BC2H
1206598735008030700,Mon Dec 16 15:35:30 +0000 2019,This also raises statute of limitations Qs. The cutoff is generally 5 years for noncapital offenses. If 7/25/19 is… https://t.co/u74wF5e639
1206591320233562000,Mon Dec 16 15:06:02 +0000 2019,The committee has repeatedly maintained that they don’t need criminal conduct to show Trump should be removed from… https://t.co/rsQMxbuU9P
1206590782368563200,Mon Dec 16 15:03:54 +0000 2019,This effectively opens the door for Trump to be criminally investigated for these charges once he leaves office – i… https://t.co/RbEyrOJUWY
1206590449063997400,Mon Dec 16 15:02:35 +0000 2019,Good morning, Judiciary Democrats said late last night that they think Trump committed some crimes, not just impeac… https://t.co/HwHvqSv1UK
1205631568133468200,Fri Dec 13 23:32:20 +0000 2019,@david_j_roth @Lubchansky The owner Sean is a family friend, really nice guy. The wall's got my dad's media credent… https://t.co/G2rBDAmrN8
1205629627672223700,Fri Dec 13 23:24:37 +0000 2019,@david_j_roth @Lubchansky Foley's! My dad has a wall dedicated to him in there
1205628257707667500,Fri Dec 13 23:19:10 +0000 2019,RT @MikeScarcella: New from @jacq_thomsen: DC Circuit Asks House Judiciary to Explain Why It Can Sue for Mueller Grand Jury Info https://t.…
1205623388213002200,Fri Dec 13 22:59:49 +0000 2019,That was fast: Judge Kollar-Kotelly DENIES the motion, saying Trump admin officials only had to turn over info not… https://t.co/uK57iF8IvB
1205621115739148300,Fri Dec 13 22:50:48 +0000 2019,DC Circuit Asks House Judiciary to Explain Why It Can Sue for Mueller Grand Jury Info https://t.co/0pBhkh83qB
1205606255747883000,Fri Dec 13 21:51:45 +0000 2019,"Defendants are surely banking on the wheels of justice grinding just slowly enough for them to avoid accountabilit… https://t.co/YB1iTdHjat
1205606254565040000,Fri Dec 13 21:51:44 +0000 2019,.@publicintegrity has now filed its motion in court, claiming that  the Trump administration is "cynically trying t… https://t.co/vhQAzSa9i4
1205601591501492200,Fri Dec 13 21:33:13 +0000 2019,RT @MikeScarcella: Breaking now: US Supreme Court sets March 2020 arguments for Trump financial records cases. Order: https://t.co/gXVafLTe…
1205594203323015200,Fri Dec 13 21:03:51 +0000 2019,@HelloShirin @blakesmustache They want the committee to explain why this is an issue that should be handled by a co… https://t.co/WNqph1svac
1205582240413094000,Fri Dec 13 20:16:19 +0000 2019,The DC Circuit is asking the House and DOJ to file supplemental briefings on whether the House has the grounds to g… https://t.co/gxCxgWu2xP
1205523918024511500,Fri Dec 13 16:24:34 +0000 2019,As news breaks that Pat Cipollone will argue for Trump during the Senate impeachment trial, Don McGahn said yesterd… https://t.co/Oxtcy8qvHE
1205513810016186400,Fri Dec 13 15:44:24 +0000 2019,Nadler is very brief. Calls it a “solemn day” and that the “House will act expeditiously.” He doesn’t take any ques… https://t.co/jhi9g7RmDO
1205511714252439600,Fri Dec 13 15:36:04 +0000 2019,RT @PeterAlexander: Spotted at the White House: Rudy Giuliani.
1205508204794384400,Fri Dec 13 15:22:07 +0000 2019,Republicans are angry after the vote.   Rep. Mike Johnson says as an attorney, if Trump were his client, he’d recom… https://t.co/F3rRTAvoxg
1205507379342848000,Fri Dec 13 15:18:51 +0000 2019,‘We Do Not Need Permission From the Courts’: House Judiciary Advances Articles of Impeachment https://t.co/crXnZ0HZHt
1205367535421591600,Fri Dec 13 06:03:09 +0000 2019,RT @Jordanfabian: New: WH counsel Pat Cipollone will argue on behalf of President Trump in a Senate impeachment trial, according to a perso…
1205343535802617900,Fri Dec 13 04:27:47 +0000 2019,Dem Judiciary counsel with an explanation for the vote being pushed https://t.co/Yh81enU35t
1205341038312935400,Fri Dec 13 04:17:52 +0000 2019,@publicintegrity Nadler just suddenly recessed. He says he wants each member to consider their vote with the gravit… https://t.co/Lmky8v8vfp
1205339366337454000,Fri Dec 13 04:11:13 +0000 2019,@ZachFB @davpjor @benbwieder @publicintegrity she discussed your FOIA litigation and the result tonight, and entere… https://t.co/mU0aOzP1NF
1205338021643640800,Fri Dec 13 04:05:53 +0000 2019,Rep. Escobar talks about this FOIA litigation update, in which the Trump admin redacted every "substantive exchange… https://t.co/q0f5aDrouY
1205337060850249700,Fri Dec 13 04:02:04 +0000 2019,Jeffries brings up McConnell's Fox News interview from tonight, in which McConnell said he'll coordinate with the W… https://t.co/PEaHCcjn0d
1205318268183031800,Fri Dec 13 02:47:23 +0000 2019,And we're back!  Sensenbrenner is up. He thanks Nadler for "following the rules," says he has been "very even-hande… https://t.co/SCGp55VJ1D
1205309581641109500,Fri Dec 13 02:12:52 +0000 2019,@DaveThomas5150 hard same
1205306987849900000,Fri Dec 13 02:02:34 +0000 2019,The amendment was just voted down.  Nadler just called a 30 minute recess shortly after 9 pm. The hearing started at 9 am.
1205305813499334700,Fri Dec 13 01:57:54 +0000 2019,GOP Rep. McClintock has basically said that if members are just going to repeat the same talking points, they shoul… https://t.co/HkOy857laA
1205289412722122800,Fri Dec 13 00:52:43 +0000 2019,RT @kpolantz: NEW: DOJ published today never-before-seen internal legal opinions that could help Trump block congressional requests of the…
1205287771033747500,Fri Dec 13 00:46:12 +0000 2019,@publicintegrity The other FOIA litigation that's resulted in docs was from @weareoversight, for Giuliani's comms.… https://t.co/TV7KbtRyMq
1205287111684964400,Fri Dec 13 00:43:35 +0000 2019,! @publicintegrity says they got the docs, but no info.  "Every substantive exchange between officials at the agenc… https://t.co/pupQAOyTNx
1205285793587253200,Fri Dec 13 00:38:20 +0000 2019,Remember this? Sounds like those docs are coming out: https://t.co/VT5bWbah9M https://t.co/X6ppk7sfdY
1205280357295235000,Fri Dec 13 00:16:44 +0000 2019,Biggs' amendment fails, along party lines.   And, dashing hopes of the markup ending soon, Jordan introduces an amendment.
1205263717241364500,Thu Dec 12 23:10:37 +0000 2019,Gohmert says that "lawfare" is like "warfare" but you're using "the law as a weapon"  He's also claiming w/o eviden… https://t.co/4cWsNN7VdI
1205261882959057000,Thu Dec 12 23:03:20 +0000 2019,Rep. Johnson says that comms b/w a president and his most senior advisers are covered by executive privilege becaus… https://t.co/Tc9u7g2ED1
