id,created_at,text
966737164582170600,Thu Feb 22 18:11:15 +0000 2018,I greatly admire the courageous Parkland students. Open discussion on how to end mass shootings essential.… https://t.co/CcM9ssyy3D
965960293842071600,Tue Feb 20 14:44:15 +0000 2018,It never ceases to amaze me how successful you have been making yourself so small, petty, and banal with your tweet… https://t.co/xZzhuC4Q7x
964599638916587500,Fri Feb 16 20:37:29 +0000 2018,DOJ statement and indictments reveal the extent and motivations of Russian interference in 2016 election. Claims of… https://t.co/UIipNU1WZt
964352169582489600,Fri Feb 16 04:14:08 +0000 2018,Having worked international counterterrorism for much of my career, it is imperative that we devote equal energy an… https://t.co/dA9Wu2Ocq5
959045265910091800,Thu Feb 01 12:46:24 +0000 2018,I had many fights with Congressional Dems over the years on national security matters. But I never witnessed the ty… https://t.co/DvlOUCwTvf
958021436882370600,Mon Jan 29 16:58:04 +0000 2018,Ample basis exists to enact legislation to protect Special Counsel Mueller from political interference. Irrespectiv… https://t.co/JpJMcbxMOY
956308357283024900,Wed Jan 24 23:30:54 +0000 2018,Former Vice Chairman of the Joint Chiefs Sandy Winnefeld and wife Mary are bringing their campaign to confront the… https://t.co/YjnJjdCJML
953970578200948700,Thu Jan 18 12:41:24 +0000 2018,Common sense needs to guide our approach to securing our borders, not inane campaign pledges. Dreamers help make th… https://t.co/1auzgwelvq
953670385639346200,Wed Jan 17 16:48:32 +0000 2018,Senators McCain and Flake are showing the consistent political courage, integrity, and intestinal fortitude that me… https://t.co/clB3CmQs1T
951602460853928000,Thu Jan 11 23:51:21 +0000 2018,Lady Liberty, our founding fathers, and generations of right-thinking Americans are all weeping tonight over the at… https://t.co/BpS2ZQdxeJ
948311274139586600,Tue Jan 02 21:53:21 +0000 2018,With wholesale condemnation of Iran and nuclear deal over past year, Trump Admin squandered opportunity to bolster… https://t.co/f0PswKqTvB
947161492713082900,Sat Dec 30 17:44:31 +0000 2017,The stars on the Memorial Wall at CIA Headquarters in Langley, Virginia honor American heroes. On this eighth anniv… https://t.co/OY0Ufj3lYw
947084616925622300,Sat Dec 30 12:39:03 +0000 2017,As the son of an immigrant, I hope 2018 will be a year when our diversity is once again celebrated and our inclusiv… https://t.co/UlH6YdcG8l
944751221373587500,Sun Dec 24 02:06:58 +0000 2017,Andy McCabe &amp; Jim Baker epitomize integrity, competence, and respect for rule of law. Not surprised… https://t.co/DnnnuQHAW7
943950252062707700,Thu Dec 21 21:04:12 +0000 2017,Trump Admin threat to retaliate against nations that exercise sovereign right in UN to oppose US position on Jerusa… https://t.co/5AmeuJZ38M
943949951968710700,Thu Dec 21 21:03:00 +0000 2017,May the 270 innocent souls lost in the PanAm 103 bombing 29 years ago today never fade from our national memory....… https://t.co/Wd7b4ln9d9
943949951968710700,Thu Dec 21 21:03:00 +0000 2017,May the 270 innocent souls lost in the PanAm 103 bombing 29 years ago today never fade from our national memory....… https://t.co/Wd7b4ln9d9
