id,created_at,text
1260901611527905300,Thu May 14 11:55:45 +0000 2020,.@realDonaldTrump’s propaganda &amp; disinformation machine, which operates according to a despot’s playbook, is the mo… https://t.co/ICkAyc6mXh
1259191320515616800,Sat May 09 18:39:40 +0000 2020,It is unsurprising @realDonaldTrump enjoys wallowing in his fetid self-indulgence, but I find it surreal that so ma… https://t.co/V15W8WfrWe
1254092144995860500,Sat Apr 25 16:57:21 +0000 2020,Your assertions, denials, allegations, &amp; claims all ring hollow in light of your lifelong record of lies, dishonest… https://t.co/2EtbsnUQNQ
1251249326938079200,Fri Apr 17 20:41:01 +0000 2020,Your dishonesty has no limits. H1N1 was an immediate top priority &amp; handled decisively. FDA quickly approved testin… https://t.co/ADoyIpLwht
1246453715151859700,Sat Apr 04 15:04:58 +0000 2020,One more example of Trump removing those who seek to stop his lawlessness. All Americans fed up with Trump’s incomp… https://t.co/hPtjkwhLNW
1245776151471100000,Thu Apr 02 18:12:34 +0000 2020,MBS is responsible for the murder of Jamal Khashoggi. That you refer to him as a “friend” is telling of your total… https://t.co/ja3Th4V02Q
1241054784817369000,Fri Mar 20 17:31:33 +0000 2020,donald trump’s rant against @PeterAlexander reveals the extent of trump’s incompetence, insecurity, &amp; juvenile petu… https://t.co/N4WtU0SIek
1234552989760675800,Mon Mar 02 18:55:44 +0000 2020,Joe Biden is one of the most honest, decent, practical, &amp; experienced individuals with whom I have ever worked. If… https://t.co/l6jS9V7di6
1230647803254333400,Fri Feb 21 00:17:55 +0000 2020,We are now in a full-blown national security crisis. By trying to prevent the flow of intelligence to Congress, Tru… https://t.co/EXg4yksS3O
1228023856063012900,Thu Feb 13 18:31:17 +0000 2020,While you fabricated bone spurs to avoid military service, John Kelly served as a brave &amp; valiant military officer.… https://t.co/hy98KwIU9O
1227377763910328300,Tue Feb 11 23:43:57 +0000 2020,It is deeply heartening to see DOJ public servants not cower in the face of bullying by donald trump.   Except for… https://t.co/k7EzKOCnNx
1224826532851404800,Tue Feb 04 22:46:16 +0000 2020,Rand Paul is beneath contempt.   He typifies the worst of @realDonaldTrump’s craven enablers.   Any Senator excusin… https://t.co/75NLz9E1L6
1223302772675793000,Fri Jan 31 17:51:23 +0000 2020,Astounding &amp; disgraceful that a Senator of heretofore strong standing says it is okay for a president to use U.S. t… https://t.co/wfLiA9azDt
1222546535038234600,Wed Jan 29 15:46:22 +0000 2020,Despite policy differences &amp; his “fidgets,” I thought Senate Intel Committee Chairman Burr had integrity, was inter… https://t.co/2iydGcvVvu
1221189309748957200,Sat Jan 25 21:53:14 +0000 2020,I have been interviewed many times by @NPRKelly. She is a tough, knowledgeable, &amp; honest reporter with deep experie… https://t.co/DJA4K3DJWg
1219711072233500700,Tue Jan 21 19:59:15 +0000 2020,During more than 33 years in public service, I never heard a government lawyer so misrepresent the facts &amp; deceive… https://t.co/j3CDaSJ82A
1217647463332532200,Thu Jan 16 03:19:12 +0000 2020,*Lev Parnas / not Les
1217644883831332900,Thu Jan 16 03:08:57 +0000 2020,On MSNBC tonight, I mistakenly said Trump wrote note, released by House yesterday, saying “get Zelensky to announce… https://t.co/PFGBdSxfok
1215330805825855500,Thu Jan 09 17:53:38 +0000 2020,Gang of 8 in Congress is entitled to ALL intelligence on Soleimani killing. @realDonaldTrump’s lies, reckless jingo… https://t.co/QnEro1BYX8
1211731394965180400,Mon Dec 30 19:30:52 +0000 2019,Eleven children lost a parent in a devastating terrorist attack that took place 10 years ago today. You can support… https://t.co/dvSfuVOKD5
1207015587660140500,Tue Dec 17 19:11:56 +0000 2019,A profound warning about “the dire threat to the rule of law” as seen by William Webster—a man of unimpeachable int… https://t.co/Ot8sUXx1P6
1205899121887993900,Sat Dec 14 17:15:29 +0000 2019,On this seventh anniversary of the Sandy Hook tragedy, let us not forget the many lives lost &amp; families devastated… https://t.co/d5j2MZILCl
1204176096381538300,Mon Dec 09 23:08:48 +0000 2019,The damage being inflicted by @realDonaldTrump on our national conscience &amp; our government is tragic.  Members of C… https://t.co/sZ624BpfQF
1195368343412379600,Fri Nov 15 15:49:56 +0000 2019,Your comments reflect the despicable nature of your character, hate &amp; fear of our foreign service officers &amp; desper… https://t.co/kw44MHhnTj
1194588884686065700,Wed Nov 13 12:12:39 +0000 2019,The impeachment process will reveal whether Republicans will tolerate corruption, dishonesty, &amp; avarice in our Nati… https://t.co/58iwxeLGW2
1189182527136813000,Tue Oct 29 14:09:43 +0000 2019,As in previous times of National peril, we rely on our military, diplomats, intelligence officials, law enforcement… https://t.co/HNfQ8Wn3CY
1188464746527363000,Sun Oct 27 14:37:30 +0000 2019,Strong praise &amp; deep gratitude to our special forces &amp; intelligence personnel who brought ISIS head Abu Bakr al-Bag… https://t.co/CulK7E0bX8
1185307863192916000,Fri Oct 18 21:33:11 +0000 2019,Read @SamanthajPower’s terrific memoir, The Education of an Idealist, to understand what it takes to be a national… https://t.co/xalpEpga7i
1184566131434111000,Wed Oct 16 20:25:48 +0000 2019,Mitch, Lindsey, Marco, &amp; other Rs:   You own @RealDonaldTrump’s disastrous decision to abandon the Kurds &amp; America’… https://t.co/nLhPe9FrJZ
1182063397006909400,Wed Oct 09 22:40:50 +0000 2019,Betrayal of friends, partners, &amp; allies has always been one of @realDonaldTrump’s most intrinsic qualities. Those w… https://t.co/SrH6J95DKT
1181561324796612600,Tue Oct 08 13:25:46 +0000 2019,For those seeking to understand the complexities of national security policymaking &amp; importance of U.S. global lead… https://t.co/kXgnaOGyWC
1180189913565794300,Fri Oct 04 18:36:16 +0000 2019,How many other Republican Senators are ready to show the courage, integrity, &amp; principled position of Senator Romne… https://t.co/3qszEFSkVO
1179485989854744600,Wed Oct 02 19:59:08 +0000 2019,Press conference with Finnish President shows @realDonaldTrump is a national disgrace who deserves impeachment, con… https://t.co/60hfFUuzO8
1177917399254872000,Sat Sep 28 12:06:07 +0000 2019,A reminder to federal officials:   There is no limit on the number of individuals who can use the whistleblower sta… https://t.co/Z5PwbDkNPb
1177300761522442200,Thu Sep 26 19:15:49 +0000 2019,Whistleblower deserves our praise &amp; gratitude.  Donald Trump getting very sloppy &amp; careless in corrupt practices &amp;… https://t.co/5NFKzKYUzU
1176538695693930500,Tue Sep 24 16:47:38 +0000 2019,Impeachment hearings are essential to determine whether Donald Trump, as alleged, engaged in extortion of a foreign… https://t.co/DrNaX9Uxfj
1174332829355954200,Wed Sep 18 14:42:19 +0000 2019,Iran struck Saudi oil facilities because of sanctions—does he seriously expect more sanctions to deter them?   It s… https://t.co/6SinDRVMOP
1173698473566331000,Mon Sep 16 20:41:37 +0000 2019,There is no doubt that @realDonaldTrump precipitated this crisis by reneging on nuclear deal &amp; declaring economic w… https://t.co/Xmb2p0PQVy
1167163210094583800,Thu Aug 29 19:52:48 +0000 2019,Jim Comey is far more decent, ethical, honest, competent, &amp; patriotic than you could ever hope to be. It is only be… https://t.co/ck5dCu7Gzz
1162751329661587500,Sat Aug 17 15:41:34 +0000 2019,The stain Donald Trump leaves on our Nation’s soul should be a constant reminder that we cannot assume candidates f… https://t.co/FPvnXmYTeS
1159133225849172000,Wed Aug 07 16:04:31 +0000 2019,Dayton &amp; El Paso tragedies underscore the need to:  -ban semiautomatic weapons &amp; high-capacity ammunition magazines… https://t.co/UngOfHpqlB
1156572053794906000,Wed Jul 31 14:27:20 +0000 2019,The sharp increase in hate speech, divisiveness, racism, &amp; anger is the toxic impact of Mr. Trump, who thrives on h… https://t.co/1S6IttXYle
1155797879300210700,Mon Jul 29 11:11:02 +0000 2019,Dan Coats served ably &amp; with deep integrity. Ratcliffe showed abject subservience to Trump in Mueller hearings. The… https://t.co/9vi05QnX6O
1151921540302278700,Thu Jul 18 18:27:51 +0000 2019,Compare the words, tone, &amp; spirit of any previous President with the undignified, divisive, &amp; hate-filled invective… https://t.co/FPeMuEDhpo
1151165421791469600,Tue Jul 16 16:23:18 +0000 2019,Our Nation is at an historic crossroads—whether we will be a divided, racist, &amp; bigoted society as espoused by… https://t.co/tOBAfHkVna
1148295992799879200,Mon Jul 08 18:21:13 +0000 2019,At the barest minimum, “unalienable rights” include the right not to be horrifically butchered on the order of a se… https://t.co/nuRMLQyCOv
1144771387464327200,Sat Jun 29 00:55:42 +0000 2019,It is wonderful as well as inspirational to see that our country, once again, has someone of such great talent, gri… https://t.co/Ws7ZuGqm8k
1138945443105255400,Wed Jun 12 23:05:28 +0000 2019,This is just the latest example of what Vice President Biden meant when he said that Mr. Trump is an existential th… https://t.co/sStcjKfKAj
1133530231254462500,Wed May 29 00:27:21 +0000 2019,You do not have a scintilla of the intellect, decency, &amp; principles of VP Biden. What you do have is #BidenEnvy. https://t.co/Uhc31KGJRb
1132989685121392600,Mon May 27 12:39:25 +0000 2019,🇺🇸 Deep appreciation to the brave men &amp; women who responded to their Nation’s call &amp; who gave their last full measu… https://t.co/uD168vN7ZZ
1132025781721415700,Fri May 24 20:49:13 +0000 2019,Young people everywhere: Please do not emulate Mr. Trump’s very immature behavior. Find others of honesty, integrit… https://t.co/8cI7zj7G8m
1131009686688469000,Wed May 22 01:31:37 +0000 2019,I subsequently learned from the Mueller report that there was a lot more evidence of collusion and obstruction of j… https://t.co/lYP3cC7y0G
1128412186949365800,Tue May 14 21:30:04 +0000 2019,Senator Graham &amp; his ilk bear responsibility for damage being done to our national interests—at home &amp; abroad—by ac… https://t.co/Qt0FnCjxdx
1126138894439866400,Wed May 08 14:56:49 +0000 2019,It is unconscionable that Mr. Trump’s dishonest &amp; unethical self promotion has been able to hoodwink so many good A… https://t.co/eI4LazsPDx
1120736265433907200,Tue Apr 23 17:08:42 +0000 2019,Just imagine if we had a President who did not live in constant fear of being exposed as a fraud, who did not have… https://t.co/a6LZzMZu8d
1119677264214528000,Sat Apr 20 19:00:37 +0000 2019,A more accurate summation: much collusion with Russia yet insufficient evidence to establish criminal conspiracy; e… https://t.co/a4mDEdm7zL
1116821069648879600,Fri Apr 12 21:51:07 +0000 2019,Your unfitness for office has never been more stark, your lack of humanity never more apparent, your politics never… https://t.co/vcZoO19MHK
1111408815818195000,Thu Mar 28 23:24:45 +0000 2019,It doesn’t matter if you are a Republican, a Democrat, an Independent, or an American of any or of no political aff… https://t.co/LPbBl8QjCQ
1110556152616501200,Tue Mar 26 14:56:34 +0000 2019,The obstruction of justice issue, however, is too important to be dismissed by a Trump-appointed AG with a predeter… https://t.co/61bVP1lsJl
1110556150359982100,Tue Mar 26 14:56:34 +0000 2019,While Trump Campaign engagements with  the Russians were highly inappropriate, we need to accept Special Counsel Mu… https://t.co/tPqE476rRl
1108358442069213200,Wed Mar 20 13:23:39 +0000 2019,Hmmm...your bizarre tweets and recent temper tantrums reveal your panic over the likelihood the Special Counsel wil… https://t.co/lcSStFS5RX
1100857981690875900,Wed Feb 27 20:39:30 +0000 2019,Committee Republicans are making no effort to find truth. They are failing their Constitutional responsibilities by… https://t.co/xHkTvUUfrM
1100036490535596000,Mon Feb 25 14:15:11 +0000 2019,You shame yourself &amp; the Office of the Presidency every time you try to smear those who dedicate their lives to pub… https://t.co/Zv1HbOAcg0
1096458352366927900,Fri Feb 15 17:16:57 +0000 2019,Quite unfortunately, and dangerously, Kim Jong-un has schooled Mr. Trump in the “Art of the Dupe.”  https://t.co/tJo41Ye7io
1095505712069988400,Wed Feb 13 02:11:29 +0000 2019,Senate Intel Committee is doing good work, but it does not conduct criminal investigations. It is up to Special Cou… https://t.co/MToaRLMF93
1090627443340308500,Wed Jan 30 15:07:00 +0000 2019,Your refusal to accept the unanimous assessment of U.S. Intelligence on Iran, No. Korea, ISIS, Russia, &amp; so much mo… https://t.co/ficAhIWDJI
1089185744990756900,Sat Jan 26 15:38:12 +0000 2019,Your cabal of unprincipled, unethical, dishonest, and sycophantic cronies is being methodically brought to justice.… https://t.co/zTkUQ5Ft71
1087784757860204500,Tue Jan 22 18:51:10 +0000 2019,Pithy, pointed, &amp; perfect advice to Mr. Trump: “Resign.” https://t.co/YO4B34bINm
1084833440032264200,Mon Jan 14 15:23:41 +0000 2019,Questions Congress should ask the American translator in Helsinki: Were written notes passed between Mr. Trump &amp; Mr… https://t.co/mVuK39W1Zb
1083438800351711200,Thu Jan 10 19:01:53 +0000 2019,Article One of the Constitution, which established the Legislative Branch, does not say Congress is subservient to… https://t.co/gRPztg2Fhn
1079770838038204400,Mon Dec 31 16:06:43 +0000 2018,It is my sincere hope that the forthcoming exposure of your malfeasance &amp; corruption will convince enough Republica… https://t.co/pq9WX1LOJI
1076566962912809000,Sat Dec 22 19:55:40 +0000 2018,Brett worked extremely hard over many years to ensure the US fulfilled its leadership role in a critically importan… https://t.co/PamUyrpz8Q
1075884498955456500,Thu Dec 20 22:43:48 +0000 2018,Okay, Republicans. How much longer are you going to let this farcical “presidency” continue? At a time of such poli… https://t.co/qX6BOdCQ4v
1075752324205867000,Thu Dec 20 13:58:35 +0000 2018,This wrong-headed decision is but one example of how dangerous it is for our national security to be controlled by… https://t.co/EPgCNIZJ0d
1072104844415119400,Mon Dec 10 12:24:48 +0000 2018,Whenever you send out such inane tweets, I take great solace in knowing that you realize how much trouble you are i… https://t.co/HaTRPCD1o1
1069273462760513500,Sun Dec 02 16:53:54 +0000 2018,As a former Director of CIA, President George H.W. Bush is a revered figure among past &amp; present members of CIA’s f… https://t.co/aY8cJ1Lxix
1068850671712170000,Sat Dec 01 12:53:53 +0000 2018,George H.W. Bush led a life of exemplary public service, integrity, and determination—in WWII, in Congress, as UN A… https://t.co/Hw5pRjKV11
1068492587458277400,Fri Nov 30 13:10:59 +0000 2018,The iceberg of lies, deceit, corruption, &amp; criminality is steadily but surely surfacing, despite the efforts of man… https://t.co/WdQHcAJFZt
1067405032755208200,Tue Nov 27 13:09:25 +0000 2018,Your feelings of inferiority, insecurity, vulnerability, and culpability are loud &amp; clear. You remind me of how man… https://t.co/JXNZxY3ImW
1066074208336261100,Fri Nov 23 21:01:12 +0000 2018,Michael Hayden is one of this country’s noblest patriots, dedicating his life to America’s national security. A man… https://t.co/2g3dr4tuxy
1065672140295409700,Thu Nov 22 18:23:32 +0000 2018,On this special day, I give thanks for all Americans who honorably serve and protect our Country as well as those w… https://t.co/NxNplaEp8D
1064949331868954600,Tue Nov 20 18:31:21 +0000 2018,Since Mr. Trump excels in dishonesty, it is now up to members of Congress to obtain &amp; declassify the CIA findings o… https://t.co/tYGlG3iNL8
1064552395294863400,Mon Nov 19 16:14:04 +0000 2018,You constantly remind us how substantively shallow &amp; dishonest you are on so many fronts, which is why we are in su… https://t.co/PN7seiInII
1062029977942679600,Mon Nov 12 17:10:52 +0000 2018,Trudeau, Macron, Merkel...it is so refreshing to see principled leaders saying &amp; doing the right things...for their… https://t.co/UYy6SWuAZl
1059439079526490100,Mon Nov 05 13:35:34 +0000 2018,Opportunity to repudiate @realDonaldTrump &amp; to restore Congressional ability to thwart his recklessness &amp; fear mong… https://t.co/AxaGltraSm
1059131178505199600,Sun Nov 04 17:12:05 +0000 2018,My former CIA colleagues Elissa Slotkin in Michigan’s 8th District &amp; Abagail Spanberger in Virginia’s 7th District… https://t.co/Bzb9QohU5K
1058313835273248800,Fri Nov 02 11:04:15 +0000 2018,As a former resident of Texas and a proud UT-Austin alumnus, I believe Beto O’Rourke is the type of individual Texa… https://t.co/ElOx6lI3J7
1057427114230714400,Wed Oct 31 00:20:44 +0000 2018,As the child of an immigrant, I will vote for candidates who believe in America living up to its values &amp; remaining… https://t.co/6N13RzO63B
1055436953129246700,Thu Oct 25 12:32:33 +0000 2018,Stop blaming others. Look in the mirror. Your inflammatory rhetoric, insults, lies, &amp; encouragement of physical vio… https://t.co/KYLMq2zs8i
1051062727416959000,Sat Oct 13 10:50:56 +0000 2018,Jamal Khashoggi’s apparent death at the Saudi Consulate in Istanbul is an atrocity, and Crown Prince Muhammad bin S… https://t.co/JEHnnBKlw4
1049623323443900400,Tue Oct 09 11:31:16 +0000 2018,It is impossible to overstate @realDonaldTrump’s corrosive impact on our political culture &amp; national character. Re… https://t.co/xc2w9jQRQa
1046129192360915000,Sat Sep 29 20:06:50 +0000 2018,Key takeaways this week: Dr. Ford is a national treasure; Sen. Jeff Flake is an admirable man with a conscience, wh… https://t.co/AIq1DFUllM
1044352292709896200,Mon Sep 24 22:26:04 +0000 2018,Any attempt by the White House to subvert or manipulate law enforcement should be resisted. Rather than resigning,… https://t.co/XSXouf5vpR
1041368801172971500,Sun Sep 16 16:50:44 +0000 2018,It’s neither illegal nor a witch hunt. Thankfully, most Americans have confidence in Bob Mueller &amp; believe in legit… https://t.co/l5bmfCgmW5
1036793382327251000,Tue Sep 04 01:49:39 +0000 2018,Colin Kaepernick drew our collective attention to the problem of continued racial injustice in America. He did so n… https://t.co/OKRaNjbIzz
1036721201501167600,Mon Sep 03 21:02:50 +0000 2018,America is respected when our political leaders make decisions that enhance global peace, security, &amp; prosperity.… https://t.co/aUS1Dn64pV
1033584596644900900,Sun Aug 26 05:19:05 +0000 2018,A man of tremendous courage, patriotism, and integrity, Senator John McCain will be remembered by history as one of… https://t.co/Xrltaa5QgV
1032637365301522400,Thu Aug 23 14:35:08 +0000 2018,I take no delight in seeing the steady collapse of a U.S. Presidency, but I do take strong comfort in knowing that… https://t.co/oooyY4RpIc
1029830514230865900,Wed Aug 15 20:41:42 +0000 2018,This action is part of a broader effort by Mr. Trump to suppress freedom of speech &amp; punish critics.  It should gra… https://t.co/IvJFRB4264
1029369165843517400,Tue Aug 14 14:08:28 +0000 2018,It’s astounding how often you fail to live up to minimum standards of decency, civility, &amp; probity. Seems like you… https://t.co/GynMKAxPa6
1029022419565072400,Mon Aug 13 15:10:37 +0000 2018,You’re absolutely right. If you were “presidential,” you would focus on healing the rifts within our Nation, being… https://t.co/8lEQa9T1Zh
1025708024760029200,Sat Aug 04 11:40:24 +0000 2018,What responsible &amp; right-thinking adult can point to @realDonaldTrump as a role model for our youth? Whenever he sp… https://t.co/udSqZvVlZ5
1024733817410596900,Wed Aug 01 19:09:15 +0000 2018,Individuals of conscience who believe in rule of law should denounce this blatant effort to obstruct justice. As Mr… https://t.co/xCmYJdqtvd
1021773574284165100,Tue Jul 24 15:06:18 +0000 2018,Using tariffs as a blunt force instrument against allies and partners is not only short-sighted but also plays into… https://t.co/u4mp5AwcCs
1018885971104985100,Mon Jul 16 15:52:00 +0000 2018,Donald Trump’s press conference performance in Helsinki rises to &amp; exceeds the threshold of “high crimes &amp; misdemea… https://t.co/dQrKJWpfBV
1018861805639274500,Mon Jul 16 14:15:58 +0000 2018,Why did Trump meet 1 on 1 with Putin? What might he be hiding from Bolton, Pompeo, Kelly, &amp; the American public? Ho… https://t.co/LdskasV4z4
1017621255883821000,Fri Jul 13 04:06:28 +0000 2018,Watching the spectacle of the House “hearing” with Peter Strzok today, I was reminded of the words of Abraham Linco… https://t.co/Khe98Rn6Xe
1017108025054810100,Wed Jul 11 18:07:04 +0000 2018,It is in the interest of America’s security if NATO leaders push back against the reckless behavior of Donald Trump… https://t.co/8Aau2Dtkek
1015047562959745000,Fri Jul 06 01:39:32 +0000 2018,You are to governance &amp; politics what Bernie Madoff was to the stock market &amp; investment advice. The two of you sha… https://t.co/JG6ao7C06P
1014543175644536800,Wed Jul 04 16:15:17 +0000 2018,As we mark the 242nd year of our great Nation’s birth, let us remember the words of our 1st President, George Washi… https://t.co/tngqiWARAw
1011736833666027500,Tue Jun 26 22:23:52 +0000 2018,RT @RepJoeKennedy: President Trump’s hateful rhetoric cannot be separated from his harmful policies. For all of the White House’s efforts t…
1011560772772786200,Tue Jun 26 10:44:16 +0000 2018,When the Special Counsel’s work is done, the Republican Party must have its modern-day equivalents of Watergate her… https://t.co/qBHQrvd4ze
1010500990288695300,Sat Jun 23 12:33:04 +0000 2018,Your fear of exposure is palpable. Your desperation even more so. When will those of conscience among your Cabinet,… https://t.co/uzyTeoswrV
1009452024507838500,Wed Jun 20 15:04:52 +0000 2018,A most important message from two very honorable people.... https://t.co/lqTa5GDL9D
1009241814824562700,Wed Jun 20 01:09:34 +0000 2018,It is the height of irony that the U.S. is withdrawing from UN Human Rights Council when the Trump Administration i… https://t.co/keWhLrJ9Uf
1008025673229840400,Sat Jun 16 16:37:03 +0000 2018,All Americans—not just your supporters—deserve a President who is honest, ethical, selfless, &amp; substantive. Our cou… https://t.co/BLVXt5MdP1
1005778524773417000,Sun Jun 10 11:47:41 +0000 2018,Your wrong-headed protectionist policies &amp; antics are damaging our global standing as well as our national interest… https://t.co/JriNhjJjSw
1002527945112637400,Fri Jun 01 12:31:02 +0000 2018,This is why I speak out against Mr. Trump and will continue to do so.... https://t.co/vzdRNA5YY3
998301133545312300,Sun May 20 20:35:12 +0000 2018,Senator McConnell &amp; Speaker Ryan: If Mr. Trump continues along this disastrous path, you will bear major responsibi… https://t.co/KUAKTNgeWS
998245492864770000,Sun May 20 16:54:06 +0000 2018,“Any man can make mistakes, but only an idiot persists in his error.”  Marcus Tullius Cicero, (106-43 BC)
996176577061892100,Mon May 14 23:52:58 +0000 2018,Deaths in Gaza result of utter disregard of Messers Trump &amp; Netanyahu for Palestinian rights &amp; homeland. By moving… https://t.co/1obyDMIlrH
993969969963634700,Tue May 08 21:44:42 +0000 2018,Today, Donald Trump simultaneously lied about the Iranian nuclear deal, undermined global confidence in US commitme… https://t.co/OWSJQISONt
993628326974709800,Mon May 07 23:07:08 +0000 2018,Senators: Show that you put country above politics. Gina Haspel is a competent, experienced, &amp; highly qualified int… https://t.co/LqQHQYqQ5b
990313751642542100,Sat Apr 28 19:36:12 +0000 2018,Mr. Trump: Your hypocrisy knows no bounds. Jim Clapper is a man of integrity, honesty, ethics, &amp; morality. You are… https://t.co/bXar2q1v35
989889346131161100,Fri Apr 27 15:29:46 +0000 2018,A highly partisan, incomplete, and deeply flawed report by a broken House Committee means nothing. The Special Coun… https://t.co/8GEibqQPWB
986405698811715600,Wed Apr 18 00:46:59 +0000 2018,A woman of great dignity, grace, &amp; humanity. Her love of family &amp; country was second to none, and her work to incre… https://t.co/rw6ZoZRo2z
984803286006952000,Fri Apr 13 14:39:34 +0000 2018,Your kakistocracy is collapsing after its lamentable journey.  As the greatest Nation history has known, we have th… https://t.co/QtviPJRNLi
981740185468702700,Thu Apr 05 03:47:54 +0000 2018,I served 6 Presidents, 3 Rs &amp; 3Ds. I directly supported Clinton, Bush 43, and Obama. While I didn't agree with all… https://t.co/hTTiCbA1O5
979462885742186500,Thu Mar 29 20:58:44 +0000 2018,I personally know and greatly respect Ronny Jackson....as a terrific doctor and Navy officer. However, he has neith… https://t.co/3eeVI4n4kR
974978856997224400,Sat Mar 17 12:00:48 +0000 2018,When the full extent of your venality, moral turpitude, and political corruption becomes known, you will take your… https://t.co/xbl1pcESbL
973534769266004000,Tue Mar 13 12:22:31 +0000 2018,Leadership of House Intel Committee has traded last vestige of integrity for politics. With other investigative sho… https://t.co/Z6dlyCnHPB
971395768220237800,Wed Mar 07 14:42:53 +0000 2018,You show an amazing albeit unsurprising ignorance of how technology, automation, and the attendant evolution of eco… https://t.co/8txqlSpYeR
970693040615534600,Mon Mar 05 16:10:30 +0000 2018,@realDonaldTrump This tweet is a great example of your paranoia, constant misrepresentation of the facts, and incre… https://t.co/sWSRaUYWD1
