id,created_at,text
1261020603781431300,Thu May 14 19:48:35 +0000 2020,RT @JeremyKonyndyk: This is extraordinary https://t.co/IA1O9CxUWz
1261017802305089500,Thu May 14 19:37:27 +0000 2020,@MeetThePress It was my pleasure.
1261016594123276300,Thu May 14 19:32:39 +0000 2020,@MeetThePress https://t.co/pLIjEIwH4P
1261016552503197700,Thu May 14 19:32:29 +0000 2020,@MeetThePress My home set-up consists of my laptop and phone in whatever corner of the house I feel like settling t… https://t.co/1eE22fa8yd
1261014397088075800,Thu May 14 19:23:55 +0000 2020,@MeetThePress More here:   https://t.co/ewELTeWJVg
1261014317811536000,Thu May 14 19:23:36 +0000 2020,@MeetThePress US intel says the virus arose in nature. Spies are investigating two possibilities about how it infec… https://t.co/AXnTV8jUHM
1261013364278472700,Thu May 14 19:19:49 +0000 2020,(2/2) In part because the US is not leading an international response, there is a global race for a vaccine. China… https://t.co/jKoCu5VRSp
1261012589418614800,Thu May 14 19:16:44 +0000 2020,FBI and DHS issued a rare public warning that they have seen China trying to hack government agencies, pharmaceutic… https://t.co/2eEr6SKXv3
1261011629568864300,Thu May 14 19:12:55 +0000 2020,Burr insists his sale of as much as $1.7 million in securities Feb. 13 was based on public information. It might be… https://t.co/jzO6cD4muN
1261011129725259800,Thu May 14 19:10:56 +0000 2020,Sure. Burr has stepped aside as intel chairman after this dramatic escalation of the FBI probe into his February st… https://t.co/5Hgduw0qf6
1261008882140397600,Thu May 14 19:02:00 +0000 2020,Thanks for having me. https://t.co/OuzIrGtGHl
1260967800480333800,Thu May 14 16:18:45 +0000 2020,Burr stepping down as intel chairman.
1260932464203071500,Thu May 14 13:58:21 +0000 2020,RT @Mpolymer: @blakehounshell A line at CIA we used to use, mockingly, when looking at ludicrous behavior by individuals...”Where do we fin…
1260932331159732200,Thu May 14 13:57:49 +0000 2020,This is also interesting.  On the Same Day Sen. Richard Burr Dumped Stock, So Did His Brother-in-Law. Then the Mark… https://t.co/r5im94F9ct
1260930975413883000,Thu May 14 13:52:26 +0000 2020,Interesting analysis from a few weeks ago.  North Carolina Senator Richard Burr's Stock Sales Before Pandemic Were… https://t.co/Ws43mWbUw1
1260911957223395300,Thu May 14 12:36:51 +0000 2020,FBI seizes Sen. Richard Burr's cellphone in probe over stock sales https://t.co/Y87Zu47jeE via @nbcnews
1260592501020393500,Wed May 13 15:27:27 +0000 2020,“Notably absent from the announcement, however, was any indication of what steps the Trump administration plans to… https://t.co/CiHgLe3NCH
1260307326600429600,Tue May 12 20:34:16 +0000 2020,RT @jgeltzer: This 👇 smells bad.  Remember: the Intelligence Community shares classified stuff with DOJ all the time.  So, why declassify t…
1260286208099389400,Tue May 12 19:10:21 +0000 2020,RT @GeoffRBennett: NEWS: A senior intelligence official confirms that DNI Richard Grenell has declassified and handed over to the DOJ a lis…
1260276451888300000,Tue May 12 18:31:35 +0000 2020,RT @NBCNews: Twitter employees can work from home forever, CEO says. https://t.co/18JYVt86qe
1260262643371331600,Tue May 12 17:36:43 +0000 2020,RT @McFaul: The Chinese Communist Party suppressed data about the coronavirus in Wuhan with devastating consequences for the US and the wor…
1260195389426278400,Tue May 12 13:09:28 +0000 2020,RT @NBCNews: Opinion | Frank Figliuzzi: President Trump could be planning something big after Flynn — and Barr's riding shotgun. https://t.…
1260195162694783000,Tue May 12 13:08:34 +0000 2020,RT @NBCNews: Gunmen storm a Doctors Without Borders hospital in Kabul, killing at least four people and injuring five others, Afghanistan's…
1260195147050029000,Tue May 12 13:08:31 +0000 2020,RT @NBCNews: WATCH: Australian Treasurer Frydenberg tested for COVID-19 after coughing repeatedly during a speech in Parliament. https://t.…
1260195106352750600,Tue May 12 13:08:21 +0000 2020,RT @NBCNews: Nearly 40% of China's students are back in classrooms, the country's education ministry said on Tuesday. https://t.co/8h4yQ8Sx…
1260195091802620000,Tue May 12 13:08:17 +0000 2020,RT @NBCNews: Dr. Fauci set to testify at a public Senate hearing about the U.S. coronavirus response and how people can return to work and…
1260195074207559700,Tue May 12 13:08:13 +0000 2020,RT @NBCNews: Italy's bars, restaurants, hairdressers and barbers are set to open on May 18 as the government accelerates its plan to relax…
1259910348984983600,Mon May 11 18:16:49 +0000 2020,From @PeteWilliamsNBC: Nearly 2000 former Justice Department and FBI officials have signed an open letter strongly… https://t.co/jJ4A1MwxGJ
1259819687426363400,Mon May 11 12:16:34 +0000 2020,RT @KenDilanianNBC: Bill Cervenak was a legend on youth baseball fields, and in the CIA https://t.co/tUtTbnwvaI via @nbcnews
1259501626458624000,Sun May 10 15:12:42 +0000 2020,Bill Cervenak was a legend on youth baseball fields, and in the CIA https://t.co/tUtTbnwvaI via @nbcnews
1259195046378852400,Sat May 09 18:54:28 +0000 2020,@DLActionSports Hi, would you grant us permission to use this photo in a web article?
1259141572005892000,Sat May 09 15:21:59 +0000 2020,Because the Wuhan lab is a high-security facility studying dangerous pathogens, it is a collection target for U.S.… https://t.co/INg5EfprEy
1259136656642359300,Sat May 09 15:02:27 +0000 2020,RT @YahooNews: Obama, in exclusive audio obtained by @Isikoff, says that the 'rule of law is at risk' in the Michael Flynn case https://t.c…
1259135145623289900,Sat May 09 14:56:26 +0000 2020,Did the Wuhan lab have a “catastrophic event” in October? A private analysis of cell phone data suggests it did, bu… https://t.co/RebnWpKuej
1259133715231408000,Sat May 09 14:50:45 +0000 2020,Friends and colleagues are mourning the loss of Bill Cervenak, a legendary CIA paramilitary officer and former Mari… https://t.co/rEUOcKeU6y
1259120164131528700,Sat May 09 13:56:55 +0000 2020,China played down the virus, but did the WHO? https://t.co/IaE31zlQVA via @nbcnews
1259119452186128400,Sat May 09 13:54:05 +0000 2020,RT @KenDilanianNBC: Exclusive: Report says data suggests shutdown at China lab, but experts skeptical https://t.co/tiEyWU1XKT via @nbcnews
1258924591902326800,Sat May 09 00:59:47 +0000 2020,We believe we uncovered what the senator was talking about here, but it’s inconclusive: https://t.co/tiEyWU1XKT https://t.co/KNPHCweIgF
1258923573223309300,Sat May 09 00:55:44 +0000 2020,Exclusive: Report says data suggests shutdown at China lab, but experts skeptical https://t.co/tiEyWU1XKT via @nbcnews
1258803916520804400,Fri May 08 17:00:15 +0000 2020,Mueller's investigation of Trump has consumed Barr since day one by @PeteWilliamsNBC   https://t.co/WSt3ZUCaeO via @nbcnews
1258734923332157400,Fri May 08 12:26:06 +0000 2020,RT @jfritze: "I learned a lot from Richard Nixon," President Trump says in Fox interview. "Don't fire people."
1258720795418861600,Fri May 08 11:29:58 +0000 2020,RT @NBCInvestigates: From @strickdc and @SuzyKhimm In April the federal government said it would start counting nursing home deaths from CO…
1258720766734012400,Fri May 08 11:29:51 +0000 2020,RT @shaneharris: “There was always a deeper problem, one that still isn’t resolved. Why was the Trump administration so eager to blunt the…
1258519639140659200,Thu May 07 22:10:38 +0000 2020,RT @KFILE: Here's video we just played on CNN of comments Kayleigh McEnany made criticizing Donald Trump in 2015, calling comments from Tru…
1258519400820256800,Thu May 07 22:09:41 +0000 2020,RT @AliVelshi: After learning one of his valets was infected, Trump became “lava level mad” at his staff and said he doesn’t feel they are…
1258499213182238700,Thu May 07 20:49:28 +0000 2020,RT @MSchwartz3: Fmr FBI Deputy Director Andrew G. McCabe on today's news regarding Mike Flynn: "Today’s move by the Justice Department has…
1258473274616565800,Thu May 07 19:06:24 +0000 2020,William Barr’s Justice Department (but not the prosecutors on the case) told a federal judge it doesn’t believe it… https://t.co/XTEJy1cdRx
1258374940790751200,Thu May 07 12:35:40 +0000 2020,AP Exclusive: Admin shelves CDC guide to reopening country https://t.co/Q9sIYuNrnu
1258371979733860400,Thu May 07 12:23:54 +0000 2020,RT @NBCNews: Black people are over four times as likely to die from the coronavirus than white people, U.K. data shows. https://t.co/4UuDXP…
1258371960519692300,Thu May 07 12:23:49 +0000 2020,RT @NBCNews: Bank of England projects the worst U.K. economic slump since 1706 as it expects U.K. gross domestic product to fall by 14% ove…
1258371919923089400,Thu May 07 12:23:39 +0000 2020,RT @NBCNews: A new memorial project from NBC News:  Read the stories of 60 coronavirus victims from all walks of life and how the lives of…
1258217968082866200,Thu May 07 02:11:54 +0000 2020,RT @NBCNews: In 1847, the Choctaw Nation of Oklahoma sent $170 to Ireland during the Great Famine. More than 170 years later, Ireland has h…
1257721485428494300,Tue May 05 17:19:04 +0000 2020,@john_sipher You may be taking me too literally, John.
1257696513435881500,Tue May 05 15:39:50 +0000 2020,RT @mitchellreports: Coming up on #AMR: Dr. Zeke Emanuel @VinGuptaMD  @kwelkernbc  @VaughnHillyard  @danbalz  @MayorBowser  @PattersonNBC…
1257696249450504200,Tue May 05 15:38:47 +0000 2020,He has not been asked about this, even by Democrats.  It’s curious. https://t.co/K7cosg1GU0
1257695903214944300,Tue May 05 15:37:24 +0000 2020,Updated story: Trump's pick for intel chief says he would back intelligence Trump doesn’t like, even at the risk of… https://t.co/wy7Ks7aXPU
1257681387743842300,Tue May 05 14:39:44 +0000 2020,New reality in the US Capitol. https://t.co/GU03zdC5Vg
1257675929968693200,Tue May 05 14:18:02 +0000 2020,Do you recognize this man?  Trump's intel chief pick vows to 'speak truth to power' https://t.co/CYO8mHDscD via @nbcnews
1257669186857427000,Tue May 05 13:51:15 +0000 2020,"I don’t see what has changed since last summer, when the President decided not to proceed with your nomination ove… https://t.co/tI6sWJvfBf
1257431206838313000,Mon May 04 22:05:36 +0000 2020,RT @MeetThePress: .@KenDilanianNBC says there is a “raft of suspicious things” about the origins of coronavirus.   “There are a number of r…
1257416600619225000,Mon May 04 21:07:33 +0000 2020,Some light reading from last year.  Human error in high-biocontainment labs: a likely pandemic threat - Bulletin of… https://t.co/velCfFYKOB
1257379099443691500,Mon May 04 18:38:32 +0000 2020,Did the coronavirus really escape from a Chinese lab? Here's what we know https://t.co/ewELTeWJVg
1257282426281361400,Mon May 04 12:14:24 +0000 2020,“The C.I.A.’s scientists, doctors and analysts undoubtedly provided sophisticated models of how the pandemic would… https://t.co/1fNSbziTE9
1257146719353086000,Mon May 04 03:15:09 +0000 2020,RT @KasieDC: "After the president said he had seen convincing evidence that gave him a high degree of confidence that the virus came from a…
1257105669175550000,Mon May 04 00:32:02 +0000 2020,RT @PhilipRucker: The Lincoln Memorial is one of the nation’s most hallowed sites. It honors the president who freed slaves and united the…
1257099190448029700,Mon May 04 00:06:17 +0000 2020,RT @KasieDC: Coronavirus cases surge as dozens of states reopen across the country. Joining us tonight: @ChrisVanHollen @RepEspaillat @Mayo…
1257094381506637800,Sun May 03 23:47:10 +0000 2020,The Washington Post reported, and NBC News confirmed, that coronavirus came up at least a dozen times in the PDB in… https://t.co/QO992jddMj
1257010156413616000,Sun May 03 18:12:30 +0000 2020,This is worth a read. https://t.co/vwPa4Zx4B6
1257005780945055700,Sun May 03 17:55:06 +0000 2020,RT @peterbakernyt: Bush 43 calls for national unity. Trump attacks him for it. https://t.co/14VnelsUs3
1256348764396191700,Fri May 01 22:24:21 +0000 2020,RT @benjaminwittes: A lot of people are very excited about some new documents released in the Michael Flynn case. They should calm down.…
1256198413387010000,Fri May 01 12:26:55 +0000 2020,Fantastic job by @morningmika, who asked the tough questions that needed to be posed. https://t.co/p5OkalXQ8a
1256010508349702100,Fri May 01 00:00:15 +0000 2020,RT @NBCInvestigates: From @strickdc Trump said nursing homes had been “a weak spot" in the U.S. coronavirus response, and that FEMA will sh…
1255954711221604400,Thu Apr 30 20:18:32 +0000 2020,RT @NBCNews: Protesters, some carrying firearms, storm Michigan Capitol as state lawmakers debate an extension of Gov. Whitmer’s state of e…
1255844213939409000,Thu Apr 30 12:59:27 +0000 2020,“As part of the tasking, intelligence agencies were asked to determine what the WHO knew about two research labs st… https://t.co/vUjZsZRdpp
1255841417383084000,Thu Apr 30 12:48:20 +0000 2020,Trump officials pressing intel agencies on lab accident theory, NYT reports.   https://t.co/9HMPD8rfm2
1255841067150303200,Thu Apr 30 12:46:57 +0000 2020,“In the revised history of the pandemic that Mr. Trump and his team offered, his actions were not belated and inade… https://t.co/BlbLyAkduU
1255708023315628000,Thu Apr 30 03:58:17 +0000 2020,RT @NBCNewsNow: The White House wants intelligence agencies to investigate if China and the @WHO hid info on the coronavirus.  @KenDilanian…
1255501206065209300,Wed Apr 29 14:16:28 +0000 2020,RT @Mpolymer: @mvhaydencenter Blaming WHO is a political move by an admin under siege for its incompetence. Analysts don’t care. I worked w…
1255481786714513400,Wed Apr 29 12:59:18 +0000 2020,RT @NBCNews: U.S. military band surprises a Holocaust survivor by playing the Israeli national anthem to him via Zoom to mark the 75th anni…
1255481727834828800,Wed Apr 29 12:59:04 +0000 2020,RT @NBCNews: Italy's PM Conte says the risk of a second coronavirus outbreak is "very concrete" as the country emerges from Europe's longes…
1255481667956990000,Wed Apr 29 12:58:50 +0000 2020,RT @NBCNews: NEW: US House oversight panel demands data on testing after study shows high rates of inaccurate coronavirus antibody tests in…
1255481476952526800,Wed Apr 29 12:58:04 +0000 2020,Senior Chinese official challenges Trump over coronavirus response, says U.S. wasted weeks https://t.co/7WT5NHqGYF via @nbcnews
1255478088235987000,Wed Apr 29 12:44:36 +0000 2020,RT @SRuhle: Dear @marcorubio, I see you on tv this morning- as you have been almost every day discussing #PPP. There is NO ONE covering thi…
1255473439588171800,Wed Apr 29 12:26:08 +0000 2020,New: Trump administration asks intelligence agencies to find out whether China, WHO hid COVID-19 information… https://t.co/BWsj3JXZOJ
1254918036328497200,Mon Apr 27 23:39:09 +0000 2020,RT @Mpolymer: Important👇. Everything that is formally written, briefed and presented in any format by the IC to policy makers is documented…
1254905177364222000,Mon Apr 27 22:48:03 +0000 2020,President’s intelligence briefing book repeatedly cited virus threat - The Washington Post https://t.co/sXUmchEQUU
1254841607167381500,Mon Apr 27 18:35:27 +0000 2020,Still true.  Why It's So Hard for U.S. Spies to Figure Out North Korea https://t.co/xxOvLZPEjM
1254814380602130400,Mon Apr 27 16:47:16 +0000 2020,Trump pushes advisers to pull troops from Afghanistan due to COVID-19 https://t.co/4eKEo5gr6A via @nbcnews
1254798283349930000,Mon Apr 27 15:43:18 +0000 2020,RT @KenDilanianNBC: NBC News chief Andy Lack: Journalism is under attack from Trump. But we're winning. The president put the bully in bull…
1254739841042055200,Mon Apr 27 11:51:04 +0000 2020,NBC News chief Andy Lack: Journalism is under attack from Trump. But we're winning. The president put the bully in… https://t.co/BBo360gILe
1254429483400134700,Sun Apr 26 15:17:49 +0000 2020,RT @nbcsnl: Stuck in the House (feat. @AdamSandler) #SNLAtHome https://t.co/wk9Pum0ArL
1254429018218258400,Sun Apr 26 15:15:58 +0000 2020,RT @maggieNYT: USDA let millions of pounds of food rot while food-bank demand soared https://t.co/km8QrBeYjk
1254428843156418600,Sun Apr 26 15:15:17 +0000 2020,RT @NBCNews: Brad Pitt portrays Dr. Anthony Fauci while hosting SNL’s 2nd stay-at-home edition. https://t.co/QcvMd2FhbH
1253736325401976800,Fri Apr 24 17:23:27 +0000 2020,RT @JaneMayerNYer: Interesting: As GOP bashes opponents’ ties to Beijing, Mitch McConnell’s sister-in-law Angela Chao is a non-executive di…
1253414953530212400,Thu Apr 23 20:06:26 +0000 2020,New: Coronavirus and its social effects fueling extremist violence, DHS intel report finds https://t.co/0kRZfymQTV
1253360640003104800,Thu Apr 23 16:30:37 +0000 2020,RT @GarrettHaake: “This is one of the really dumb ideas of all time,” Gov. Cuomo says of @senatemajldr suggestion that states be allowed to…
1253360614434635800,Thu Apr 23 16:30:31 +0000 2020,RT @kylegriffin1: Gov. Cuomo: "New York puts in more money into the federal pot than it takes out. His state takes out more than it puts in…
1253360280219902000,Thu Apr 23 16:29:11 +0000 2020,Many New Yorkers with COVID-19 waited too long to call 911. Why? https://t.co/ZXfl4dht0o via @Tom_Winter
1253343186027675600,Thu Apr 23 15:21:16 +0000 2020,From @GeoffRBennett: A source close to Dr. Bright tells NBC News that Bright felt pressured to rush access to chlor… https://t.co/oEMLYk4heG
1253342605011796000,Thu Apr 23 15:18:57 +0000 2020,Elizabeth Warren’s oldest brother dies of coronavirus in Oklahoma https://t.co/Nws58Yjyg7 via @BostonGlobe
1252944407818653700,Wed Apr 22 12:56:40 +0000 2020,Worth noting: This thorough and accurate article by @FoxNews digital details the Senate intelligence committee’s co… https://t.co/kkh3GGDiHL
1252941508577239000,Wed Apr 22 12:45:08 +0000 2020,There were two labs in Wuhan studying viruses and a lot of suspicious behavior after the outbreak, ⁦@TomCottonAR⁩ p… https://t.co/GlmdIBTYwW
1252673471404019700,Tue Apr 21 19:00:03 +0000 2020,@BillGertz That is a willful misreading of a document that clearly said the dossier wasn’t used to make the assessm… https://t.co/XB4SwweVHG
1252672873199739000,Tue Apr 21 18:57:41 +0000 2020,RT @HeidiNBC: A malaria drug widely touted by Trump for treating coronavirus showed no benefit in a large analysis of its use in U.S. veter…
1252637696213819400,Tue Apr 21 16:37:54 +0000 2020,Does Trump have the authority to suspend immigration? https://t.co/7B2bu690Y1 via @PeteWilliamsNBC
1252625425114808300,Tue Apr 21 15:49:08 +0000 2020,RT @latimes: ⚡️ “U.S. citizens married to immigrants won't get the coronavirus stimulus” by @latimes https://t.co/LJuPkcAspZ
1252625289097724000,Tue Apr 21 15:48:36 +0000 2020,@FredFleitz @RichardGrenell @realDonaldTrump "In all the interviews of those who drafted and prepared the ICA, the… https://t.co/Gu9yOpuNbY
1252625122772635600,Tue Apr 21 15:47:56 +0000 2020,A Trump supporter and former CIA officer who once suggested the 2017 assessment on Russia election interference was… https://t.co/4BppMJwIWw
1252623741269553200,Tue Apr 21 15:42:27 +0000 2020,RT @DavidCornDC: At the end of the new Senate intel. comm. report @RonWyden sums up: "Russian interference in the 2016 election is a fact a…
1252620550553440300,Tue Apr 21 15:29:46 +0000 2020,"In all the interviews of those who drafted and prepared the ICA, the Committee heard consistently that analysts we… https://t.co/NSCCokUxpy
1252619289607241700,Tue Apr 21 15:24:45 +0000 2020,NSA director Admiral Mike Rogers "initial reaction was that the Steele information ought not be in the body of the… https://t.co/hntZso2GhF
1252617321614585900,Tue Apr 21 15:16:56 +0000 2020,“Those in disagreement all stated they had the opportunity to present different points of view...they reached the f… https://t.co/mt9wb0mz6p
1252616886988296200,Tue Apr 21 15:15:13 +0000 2020,On the disagreement between the CIA and the NSA about the level of confidence in the judgment that Russia supported… https://t.co/IHHyjEZoZZ
1252615593997590500,Tue Apr 21 15:10:04 +0000 2020,The Senate report confirms what has long been known: US intelligence agencies did not use information from the Chri… https://t.co/nEF3DBtaCc
1252614636815466500,Tue Apr 21 15:06:16 +0000 2020,Senate: 2017 intel report about Russian meddling, Trump was accurate https://t.co/bbBxYXtRNB via @nbcnews
1252612582608953300,Tue Apr 21 14:58:06 +0000 2020,A bipartisan investigation by the Senate intelligence committee has confirmed the accuracy of the 2017 US intellige… https://t.co/ur41xURHAJ
1252606102115672000,Tue Apr 21 14:32:21 +0000 2020,Here’s what we’ve learned and can report:  Kim Jong Un appears to be incapacitated and may be seriously ill, US off… https://t.co/unhL1vGi2s
1252597059259175000,Tue Apr 21 13:56:25 +0000 2020,I hope I live long enough to read the @RobertACaro  account of this presidency.  Sadly it won't be Caro writing it,… https://t.co/gIWfnNmwhv
1252386684890562600,Tue Apr 21 00:00:28 +0000 2020,RT @byjacobward: Marijuana sales doubled just as shelter-in-place began. Edibles are up more than 25%. Ounces are selling briskly. Grams no…
1252383400133976000,Mon Apr 20 23:47:25 +0000 2020,Don’t miss this amazing reporting. Television journalism at its most powerful.   Coronavirus batters hard-hit Navaj… https://t.co/2oO95256ra
1252269084550578200,Mon Apr 20 16:13:10 +0000 2020,RT @EamonJavers: Goldman Sachs on the virus: “We conclude that there is a significant risk of a second wave if policy or distancing behavio…
1252268861304553500,Mon Apr 20 16:12:17 +0000 2020,RT @HeidiNBC: Fauci warns protesters about dangers of ending lockdowns prematurely:   'It's going to backfire'   https://t.co/nuBltQflyk
1252236721925881900,Mon Apr 20 14:04:34 +0000 2020,RT @McKayMSmith: “To face the coronavirus pandemic, I listen to my grandmother who survived the Holocaust. The current situation is unprece…
1252236313903771600,Mon Apr 20 14:02:57 +0000 2020,RT @BFriedmanDC: This photo by @McclaranAlyson shows healthcare workers blocking protesters in Denver who were demanding the stay-at-home o…
1252233713838153700,Mon Apr 20 13:52:37 +0000 2020,Ranking Democrat on the Senate intelligence committee: The national security cost of Trump’s politicization of U.S.… https://t.co/2bPajm3dwf
1252227414341664800,Mon Apr 20 13:27:35 +0000 2020,Wuhan lab says there's no way coronavirus originated there. Here's the science. | Live Science https://t.co/r2Czrp2Wpx
1252212478194389000,Mon Apr 20 12:28:14 +0000 2020,@LastGreatAct This is a misunderstanding.  Our sources tell us the US intelligence community does not believe the v… https://t.co/oMRmLMZDie
1251882970790662100,Sun Apr 19 14:38:53 +0000 2020,Today is the 25th anniversary of the Oklahoma City boming, which I covered as a rookie reporter with the Fort Worth… https://t.co/IDf8CxYqnV
1251636770896326700,Sat Apr 18 22:20:35 +0000 2020,RT @bencoates1: In case you were wondering how Sweden’s “no lockdown” experiment is going: https://t.co/VRLOvlYrRV
1251636597021384700,Sat Apr 18 22:19:53 +0000 2020,RT @davidaxelrod: .@realDonaldTrump gave the North Koreans a global stage they had craved for generations, and canceled joint military exer…
1251634976237518800,Sat Apr 18 22:13:27 +0000 2020,RT @gregpmiller: Wait what?  Boris Johnson was skipping Covid crisis meetings in UK in February because he was juggling girlfriends pregnan…
1251634372782051300,Sat Apr 18 22:11:03 +0000 2020,Incredible. https://t.co/VEFpuOfGeZ
1251630882999414800,Sat Apr 18 21:57:11 +0000 2020,Trump knows what he’s doing. At each briefing, he repeats the half truth that he saved the day by “closing the coun… https://t.co/r8osJMu4IL
1251626425532199000,Sat Apr 18 21:39:28 +0000 2020,MSNBC cutting away so @mitchellreports and @albamonica can fact check some of these bizarre remarks. https://t.co/Mbocu73y0M
1251572841948086300,Sat Apr 18 18:06:33 +0000 2020,RT @byjacobward: "We could split up, or we could stay together." I got to produce this profile of an amazing Bay Area fishing family that h…
1251568983469416400,Sat Apr 18 17:51:13 +0000 2020,I’ll be on ⁦@MSNBC⁩ shortly to discuss the latest on this reporting, with ⁦@AlexWitt⁩  U.S. intel community examini… https://t.co/2LVF9jlaQw
1251530965626826800,Sat Apr 18 15:20:09 +0000 2020,Important piece from @andymilburn8, a veteran special operations officer.   The Theodore Roosevelt episode was no i… https://t.co/WVp7BcJSce
1251349497151664000,Sat Apr 18 03:19:03 +0000 2020,RT @KenDilanianNBC: Imagine if, two months ago, a competent federal government had led a World War II-level effort to ramp up production of…
1251127528380600300,Fri Apr 17 12:37:02 +0000 2020,Do not miss this brilliant essay by @EdwardGLuce https://t.co/Y2caa0YqYA
1251124657291432000,Fri Apr 17 12:25:37 +0000 2020,RT @NBCNewsNow: U.S. Intelligence begins a new investigation into the origins of COVID-19, and whether it accidentally came from a Chinese…
1251124039931826200,Fri Apr 17 12:23:10 +0000 2020,Imagine if, two months ago, a competent federal government had led a World War II-level effort to ramp up productio… https://t.co/qIQiKi4xck
1251111985548341200,Fri Apr 17 11:35:16 +0000 2020,RT @dandrezner: “No matter how sinuous their civic institutions, nations without leadership lose wars.“ https://t.co/fO2UO9RCLI
1251111577815855000,Fri Apr 17 11:33:39 +0000 2020,RT @rgoodlaw: This took guts to write.  Current senior officer with Office of Director of National Intelligence, writing in his personal ca…
1251111066953830400,Fri Apr 17 11:31:37 +0000 2020,Coronavirus testing must double or triple before U.S. can safely reopen, experts say https://t.co/sSw5xPFF8w
1250820722169184300,Thu Apr 16 16:17:53 +0000 2020,U.S. spies probing if coronavirus emerged accidentally from China lab https://t.co/GzNJmb8BPu via @nbcnews
