id,created_at,text
1261409447735246800,Fri May 15 21:33:42 +0000 2020,Growing friction between the White House and CDC threatens the pandemic response. @LennyMBernstein, @jdawsey1,… https://t.co/L7OSsRjOMF
1261352864070410200,Fri May 15 17:48:52 +0000 2020,NEW: Secret Service signs $179,000 contract to rent golf carts in Bedminster, N.J., this summer via @fahrenthold https://t.co/0HQJIpayvC
1261345577599529000,Fri May 15 17:19:55 +0000 2020,House poised to adopt historic changes allowing remote voting during pandemic Via @mikedebonis https://t.co/BRhwLQoFUk
1261117989694460000,Fri May 15 02:15:33 +0000 2020,NEW: Nonprofit run by Trump nominee to head U.S. media agency is under investigation, senator says Via @seungminkim https://t.co/HZYDvusXux
1261117904080326700,Fri May 15 02:15:13 +0000 2020,Obama’s former aides angry, hurt over Ronny Jackson’s embrace of Trump’s conspiracies Via @ColbyItkowitz https://t.co/Z746XBpdl3
1261117406744895500,Fri May 15 02:13:14 +0000 2020,In Trump’s political orbit, advisers had been quietly readying a renewed political war over the Russia probe for we… https://t.co/bBcKpMthus
1261116854027812900,Fri May 15 02:11:03 +0000 2020,Seven days of ‘Obamagate’: How a Flynn theory became central to the Trump reelection campaign, by @PhilipRucker… https://t.co/VROvO2kQ1C
1261040993887019000,Thu May 14 21:09:36 +0000 2020,Trump’s company has received at least $970,000 from U.S. taxpayers for room rentals by @fahrenthold @partlowj https://t.co/bqJ0NzcKEr
1261040842933973000,Thu May 14 21:09:00 +0000 2020,RT @jdawsey1: During a meeting at the White House about two weeks ago, Trump encouraged Secretary of State Mike Pompeo to reconsider runnin…
1261011641258463200,Thu May 14 19:12:58 +0000 2020,RT @karentravers: So cool - @jabinbotsford is very creative https://t.co/rYsSLczsrO
1261009477144326100,Thu May 14 19:04:22 +0000 2020,RT @DonnaCassata: After Wisconsin court ruling, crowds liberated and thirsty descend on bars. ‘We’re the Wild West,’ Gov. Tony Evers says.…
1261009408244547600,Thu May 14 19:04:06 +0000 2020,RT @Fahrenthold: NEW: In Indonesia, a @realdonaldtrump-branded resort is slowly being built in the jungle. To clear the land, local residen…
1260995522380398600,Thu May 14 18:08:55 +0000 2020,"Social distancing will be enforced" in the Jacuzzi.... https://t.co/makBp8XjFH
1260991259382034400,Thu May 14 17:51:58 +0000 2020,SCOOP: Postal Service is launching a review of package delivery fees for contracts with Amazon, UPS, FedEx and othe… https://t.co/6WniNfCTiu
1260990650826264600,Thu May 14 17:49:33 +0000 2020,RT @AaronBlake: "Deputy Postmaster General Ronald A. Stroman announced his resignation on Friday. Stroman had years of experience working w…
1260970927434739700,Thu May 14 16:31:11 +0000 2020,RT @shaneharris: Your unmasking questions answered. What is it, who does it, and why? https://t.co/Vp6UPNpnxl
1260968994581987300,Thu May 14 16:23:30 +0000 2020,RT @RiegerReport: RICK BRIGHT says people died due to delay in getting N95 masks:  “Doctors and nurses in hospitals today are wearing N95-m…
1260968089879031800,Thu May 14 16:19:54 +0000 2020,RT @pkcapitol: We literally just ran into Risch &amp; Rubio together. Risch no commented. And Rubio literally didn’t know yet that Burr had ste…
1260967307058307000,Thu May 14 16:16:48 +0000 2020,RT @costareports: GRAHAM statement: “As to the Judiciary Committee, both presidents are welcome to come before the committee and share thei…
1260963052981293000,Thu May 14 15:59:54 +0000 2020,RT @pw_cunningham: Here's a new website that rates states and their anti-coronavirus efforts: https://t.co/eTOOqTNKC4 How it got started an…
1260961318108102700,Thu May 14 15:53:00 +0000 2020,RT @seungminkim: Just so good: the face masks of the Senate get the @RobinGivhan treatment https://t.co/Lenay7XUFR
1260950603162927000,Thu May 14 15:10:25 +0000 2020,RT @bylenasun: NEW: I've been covering the covid-19 pandemic since January. After four months, the coronavirus that has killed at least 83,…
1260944675894157300,Thu May 14 14:46:52 +0000 2020,RT @OConnellPostbiz: Find some time in your day today, now or later, to read this startling investigation into Trump’a business partners in…
1260944169989812200,Thu May 14 14:44:51 +0000 2020,One woman, Iyum, said the remains of her two daughters had been disinterred without her permission.  “Who did they… https://t.co/iAIwLmi8YY
1260928380565893000,Thu May 14 13:42:07 +0000 2020,NEW: Court revives lawsuit targeting President Trump’s business dealings at D.C. hotel by @amarimow @OConnellPostBiz https://t.co/9Y1y3HXO3q
1260891263638921200,Thu May 14 11:14:38 +0000 2020,VIDEO: How poor tenant farmers in rural Indonesia are facing off against a large corporation that has connections t… https://t.co/JMYxPxbWkC
1260889810966909000,Thu May 14 11:08:51 +0000 2020,’The land belonged to our ancestors’: Trump’s business partner in Indonesia exhumed graves in West Java to build re… https://t.co/zjTGvCeK8a
1260884408069959700,Thu May 14 10:47:23 +0000 2020,Expect criticism of the Trump administration’s coronavirus response from Rick Bright: "We missed early warning sign… https://t.co/lHKphxxdcZ
1260730358011695000,Thu May 14 00:35:15 +0000 2020,RT @angelafritz: Abbott's rapid coronavirus test (the one used at the White House) missed a large number of positive results — at times mor…
1260727740141047800,Thu May 14 00:24:51 +0000 2020,RT @jpaceDC: Fun fact about unmasking: it's very common. How common, you ask? There were 9,529 unmasking requests in 2017, 16,721 in 2018 a…
1260727065021763600,Thu May 14 00:22:10 +0000 2020,Developing tonight: Court asks retired judge to oppose Justice Dept. effort to drop Michael Flynn case and examine… https://t.co/lLjRHEqYN9
1260663036668530700,Wed May 13 20:07:44 +0000 2020,RT @FenitN: Full story: D.C. extends shutdown through June 8 and imposes new mask requirements. Maryland governor to announce reopening pla…
1260646108767776800,Wed May 13 19:00:28 +0000 2020,RT @JoshWhiteTWP: BREAKING from @nickmiroff -- Under Trump border rules, U.S. has granted refuge to just two people since late March, recor…
1260605842350649300,Wed May 13 16:20:28 +0000 2020,RT @chriscmooney: Infection rates were climbing at Nebraska meatpacking plants. Then health officials stopped reporting the numbers. https:…
1260605318523912200,Wed May 13 16:18:23 +0000 2020,Aspen Institute think tank receives $8 million federal small-business loan by @OConnellPostBiz https://t.co/RPSeYyxI6F
1260602835147899000,Wed May 13 16:08:31 +0000 2020,Jamall Williams spents months unsuccessfully trying to learn from the Leon County court clerk's office if he owed a… https://t.co/wN0nSrGx0J
1260583329910399000,Wed May 13 14:51:01 +0000 2020,RT @myhlee: Most states lifting coronavirus lockdowns haven't met federal guidelines for reopening. @pw_cunningham w/@paulina_milla in The…
1260565454130724900,Wed May 13 13:39:59 +0000 2020,NEW: In Florida, felons must pay court debts before they can vote. But with no system to do so, many have found it… https://t.co/CDXcIBf0bo
1260563080104345600,Wed May 13 13:30:33 +0000 2020,RT @brianstelter: Full-page message in today's @washingtonpost thanks the distributors and carriers who make sure the paper still arrives i…
1260561207871881200,Wed May 13 13:23:06 +0000 2020,RT @ElaheIzadi: As the pandemic forces us to abandon rituals of grief, obituary pages are where we mourn  My latest: https://t.co/da09r7W2xY
1260557992900153300,Wed May 13 13:10:20 +0000 2020,NEWS: Paul Manafort granted home confinement due to coronavirus fears via @rachelweinerwp @hsu_spencer https://t.co/az1rDHbYbw
1260382249310093300,Wed May 13 01:31:59 +0000 2020,RT @tcfrankel: Crazy scene here. @ByMoriah https://t.co/sVgqLYvmnh
1260339913851113500,Tue May 12 22:43:46 +0000 2020,NEW: Trump presses immunity argument in Summer Zervos defamation case by @shaynajacobs @PostRoz https://t.co/oHEwxP0wdt
1260330680262803500,Tue May 12 22:07:04 +0000 2020,Trump adviser Navarro declines invitation to testify before House panel on whistleblower’s complaint Via… https://t.co/eb89PWfzp9
1260327089896636400,Tue May 12 21:52:48 +0000 2020,RT @peterwallsten: In virus response riven by politics, masks are latest Rorschach test, @isaacstanbecker reports. https://t.co/GGkqd221SG
1260318185003286500,Tue May 12 21:17:25 +0000 2020,Trump withdraws Mar-a-Lago dock plan 3 days after @washingtonpost reports his proposal during Covid crisis raised q… https://t.co/TQnBNbIw8Z
1260317503517003800,Tue May 12 21:14:43 +0000 2020,Trump asks board of federal retirement plan to not invest in China, setting up a showdown about who runs the progra… https://t.co/HHcx4rSb6R
1260260331898708000,Tue May 12 17:27:32 +0000 2020,RT @DonnaCassata: House Democrats unveil coronavirus rescue bill that would direct more than $3 trillion to states, individuals, health sys…
1260260308783939600,Tue May 12 17:27:26 +0000 2020,Fauci warns Senate that reopening U.S. too quickly could lead to avoidable ‘suffering and death’ Via @WPJohnWagner… https://t.co/fE4V4Y7CnQ
1260220353500119000,Tue May 12 14:48:40 +0000 2020,RT @washingtonpost: Fauci gives overview of covid-19 vaccine, therapeutic progress in opening statements https://t.co/39oMYSQ9TP
1260209698302832600,Tue May 12 14:06:20 +0000 2020,A listener’s guide to the Supreme Court battle over Trump’s tax returns and business records  by @amarimow… https://t.co/4gZcIpAtm9
1260209122819129300,Tue May 12 14:04:03 +0000 2020,RT @amarimow: Starting soon: #SCOTUS hears arguments on Trump’s efforts to block disclosure of his tax returns, financial records to House…
1260209064375705600,Tue May 12 14:03:49 +0000 2020,RT @washingtonpost: Oklahoma State University's animal health lab, which more typically focuses on tests for rabies and cattle respiratory…
1260036749335556000,Tue May 12 02:39:06 +0000 2020,NEW: Trump narrowly outraised Biden in April, but maintains significant cash lead via @myhlee https://t.co/5NejhXn2Ng
1260031174283391000,Tue May 12 02:16:56 +0000 2020,Here's Pence without any face covering on Thursday, delivering PPE to a Va. nursing home. An administration officia… https://t.co/KvLVMxLybG
1260029667861389300,Tue May 12 02:10:57 +0000 2020,A Rose Garden news conference Monday aimed at announcing new money for testing provided a striking illustration of… https://t.co/RpAFLjo2k3
1260029453792448500,Tue May 12 02:10:06 +0000 2020,White House implements stringent mask policy — but not for Trump, by @AshleyRParker @jdawsey1 @PhilipRucker https://t.co/JR7G0wTySf
1259981157539680300,Mon May 11 22:58:11 +0000 2020,Even a vaccine won’t be enough to end the coronavirus pandemic. For that, past pandemics show, we need the kind of… https://t.co/so8HqfjzLo
1259961717590839300,Mon May 11 21:40:57 +0000 2020,Also, a member of WH advance team asked food industry execs meeting with Pence in Iowa last week to take off masks… https://t.co/hFJxpsGwip
1259951512572375000,Mon May 11 21:00:24 +0000 2020,NEW: Trump visit to Pennsylvania factory that produces PPE materials was scuttled after plant officials expressed c… https://t.co/14jGt74UPD
1259921312077799400,Mon May 11 19:00:23 +0000 2020,RT @jdawsey1: White House employees will soon be asked to wear masks or face coverings in public parts of the complex, per multiple officia…
1259908314416255000,Mon May 11 18:08:44 +0000 2020,RT @DonnaCassata: A Cape Cod ice cream shop reopened — and faced harassment so bad one staffer quit, owner says https://t.co/Een4dLI6ZW
1259903362507645000,Mon May 11 17:49:04 +0000 2020,RT @ELaserDavies: “I tell people this is the best job I have ever had, and I miss it every day.”  My latest on the agonizing choices facing…
1259897391022583800,Mon May 11 17:25:20 +0000 2020,RT @drewharwell: New: There's a big coronavirus gold rush for "fever detector" cameras. Companies and local govts are spending millions to…
1259861767808745500,Mon May 11 15:03:47 +0000 2020,RT @washingtonpost: Sen. Bernie Sanders joins The Post to discuss the state of American politics and his efforts to respond to the coronavi…
1259859146163224600,Mon May 11 14:53:22 +0000 2020,RT @washingtonpost: The Navajo Nation has a devastating coronavirus outbreak, and some on the reservation say U.S. government help has been…
1259838790044131300,Mon May 11 13:32:28 +0000 2020,RT @jdawsey1: Does Florida Gov. Ron DeSantis know what he’s doing? We’re about to find out. Fun to jam w/the singular @bterris on this piec…
1259834294966653000,Mon May 11 13:14:37 +0000 2020,She’s a U.S. citizen. He’s not. Their family can’t get a stimulus check. By Federal Insider @JoeDavidsonWP https://t.co/ZFDz5nKOZT
1259574931777556500,Sun May 10 20:04:00 +0000 2020,In an immigrant community battling coronavirus, ‘essential’ means ‘vulnerable.’ by @jdelreal https://t.co/0pyp82VkdE
1259574745839829000,Sun May 10 20:03:15 +0000 2020,RT @eilperin: A look at what we know so far about the novel coronavirus: It can attack the heart, savage the kidneys and create blood clots…
1259510417560395800,Sun May 10 15:47:38 +0000 2020,RT @MrDanZak: Oh my God.  https://t.co/eNTBnzXV0i
1259510161292644400,Sun May 10 15:46:37 +0000 2020,RT @KellyO: Sign of change at White House, Secret Service agents posted near the president now wear masks. https://t.co/GdQJbX1yfB
1259281172053573600,Sun May 10 00:36:42 +0000 2020,RT @wpjenna: “But several administration officials said... aides who travel with President Trump and Vice President Pence would not stay ou…
1259281132224426000,Sun May 10 00:36:32 +0000 2020,RT @PoliticsReid: Three of the four top scientists on the White House’s #COVID19 task force — NIH’s Fauci, CDC’s Redfield, FDA’s Hahn — are…
1259280704963256300,Sun May 10 00:34:51 +0000 2020,As deaths mount, Trump tries to convince Americans it’s safe to inch back to normal, by @jdawsey1 @AshleyRParker… https://t.co/HqnUCp5fA6
1259280639712473000,Sun May 10 00:34:35 +0000 2020,Trump attacks decision to add in-person voting center in California House race, alleging benefit for Democrats, via… https://t.co/a5CZeYMqey
1259275250015092700,Sun May 10 00:13:10 +0000 2020,White House aides rattled after positive coronavirus tests and officials send mixed messages on how to respond… https://t.co/f7IWzJKK0p
1258916858176118800,Sat May 09 00:29:03 +0000 2020,Secret Service agents on Trump’s protective detail, and officers who are taking the temperatures of all visitors to… https://t.co/VUlcrkJRfi
1258916441778204700,Sat May 09 00:27:23 +0000 2020,NEW: Trump eyes federal retirement plan investments as part of showdown with China over coronavirus by @reinlwapo… https://t.co/D88e3xVpqA
1258915436915232800,Sat May 09 00:23:24 +0000 2020,Trump flouts coronavirus protocols as security experts warn of need to protect president from a lethal threat… https://t.co/kdrtaXMmfD
1258910435362865200,Sat May 09 00:03:31 +0000 2020,RT @damianpaletta: Soaring joblessness caused by coronavirus could shake U.S. economy, politics for years, by @davidjlynch https://t.co/bAe…
1258892510870614000,Fri May 08 22:52:18 +0000 2020,RT @washingtonpost: Office of Special Counsel says "reasonable grounds" to believe vaccine official’s ouster was retaliatory, lawyers say h…
1258889035952672800,Fri May 08 22:38:29 +0000 2020,Redfield’s comments contradict the White House assertion Thursday that it had not yet approved the guidelines becau… https://t.co/QT3cN2LbZA
1258886912313643000,Fri May 08 22:30:03 +0000 2020,RT @jpaceDC: You should read this story. https://t.co/3yDQfmBsNP
1258884178990563300,Fri May 08 22:19:11 +0000 2020,NEW from @michaelscherer &amp; @WaPoSean: Biden campaign launches expansion in the face of Democratic worries — but no… https://t.co/SAZPCMAgWs
1258856178362310700,Fri May 08 20:27:55 +0000 2020,NEW: How George Conway’s super PAC needled Trump with a small-budget ad, helping it go viral by @myhlee https://t.co/lMFMzcceyE
1258775377801076700,Fri May 08 15:06:51 +0000 2020,NEW: White House pandemic supply project swathed in secrecy and exaggerations by @amyjbrittain @isaacstanbecker… https://t.co/51J9mPS70P
1258769042082541600,Fri May 08 14:41:41 +0000 2020,RT @DevlinBarrett: After Flynn reversal, Trump signals his FBI director is on thin ice https://t.co/wzDHPMK7xa
1258768832132534300,Fri May 08 14:40:51 +0000 2020,RT @MrDanZak: This @RoigFranzia story!  Trump, under cover of the pandemic, is trying to build a long-sought dock at Mar-a-Lago, which beca…
1258586553972142000,Fri May 08 02:36:32 +0000 2020,RT @sarahkaplan48: Normal life already seems a distant memory; a return to it still impossible to comprehend.   But amid all this darkness,…
1258576512380481500,Fri May 08 01:56:38 +0000 2020,RT @gregpmiller: In new House Intel transcripts, Hope Hicks testifies that Flynn tried to get aides to lie to @IgnatiusPost about sanctions…
1258561284276174800,Fri May 08 00:56:07 +0000 2020,RT @jdawsey1: Trump valet tests positive for coronavirus, sparking additional tests, anger from those around the president, questions about…
1258560807882961000,Fri May 08 00:54:14 +0000 2020,Barr was largely credited with “shepherding the recommendation” and staying engaged on the Flynn case and matters r… https://t.co/gvp86eDXsm
1258553775536644000,Fri May 08 00:26:17 +0000 2020,NEW: Flynn decision punctuates three years of partisan warfare over Russia probe by @postroz @costareports… https://t.co/yOowrRLm8N
1258549202449084400,Fri May 08 00:08:07 +0000 2020,RT @adegrandpre: Barr, on CBS News, disputed he was doing Trump’s bidding — “No, I’m doing the law’s bidding” — and said he was ready to ta…
1258549193016144000,Fri May 08 00:08:04 +0000 2020,RT @adegrandpre: Latest on Flynn: “Another pillar in the foundation of the Dept of Justice &amp; rule of law has fallen,” said one current fede…
1258511113160810500,Thu May 07 21:36:46 +0000 2020,RT @JoshWhiteTWP: NEW from @nickmiroff -- Illegal border crossings fell dramatically in April, U.S. expels thousands using Trump’s coronavi…
1258506478064828400,Thu May 07 21:18:20 +0000 2020,RT @PhilipRucker: "It is highly unusual for the Justice Department to seek to undo a guilty plea, and comes just months after AG Barr press…
1258501656326688800,Thu May 07 20:59:11 +0000 2020,RT @CBS_Herridge: #FLYNN exclusive w/AG Barr watch tonight @CBSEveningNews “I want to make sure that we restore confidence in the system. T…
1258485756634566700,Thu May 07 19:56:00 +0000 2020,RT @postpolitics: Justice Dept. moves to drop case against Michael Flynn, former Trump adviser who pleaded guilty to lying to the FBI https…
1258448308323917800,Thu May 07 17:27:12 +0000 2020,RT @amarimow: NEW: Trump administration asks Supreme Court to stop release of secret Mueller material to House Democrats.  https://t.co/WT8…
1258436776005337000,Thu May 07 16:41:22 +0000 2020,NEW: Senate committee advances nomination of FEC commissioner by @myhlee https://t.co/brlXQRe8PB
1258411361392046000,Thu May 07 15:00:23 +0000 2020,RT @JStein_WaPo: NEW: A source sends this photo of a local fox who has been stealing his neighbor’s editions of the @washingtonpost each mo…
1258408535634870300,Thu May 07 14:49:09 +0000 2020,RT @myhlee: Senate Rules Committee has voted to move forward to the full Senate the nomination of Trey Trainor to the @FEC, with a vote tha…
1258407795369656300,Thu May 07 14:46:13 +0000 2020,RT @scotusreporter: Supreme Court overturns convictions in ‘Bridgegate’ scandal that had ensnared Christie allies https://t.co/5Ns9ITfpBQ
1258400073655992300,Thu May 07 14:15:32 +0000 2020,RT @JohnWoodrowCox: Thread: Two years ago, I attended a school safety conference in Orlando where, after Parkland, dozens of vendors had co…
1258398532337361000,Thu May 07 14:09:24 +0000 2020,RT @sarahkaplan48: Go to washingtonpost dot com at 3:30 to hear me and @JoelAchenbach talk about what virus mutations really mean and why y…
1258396494782234600,Thu May 07 14:01:18 +0000 2020,RT @myhlee: Senate Rules Committee is meeting today at 10:30am to debate and vote on the nomination of Trey Trainor to the @FEC, which has…
1258396410854203400,Thu May 07 14:00:58 +0000 2020,RT @shaverk: How covid-19 tore through Maryland nursing homes, via deep reporting by ⁦⁦⁦@rebtanhs⁩ ⁦@Rachel_Chason⁩  https://t.co/EbDuoz93Cs
1258394154004099000,Thu May 07 13:52:00 +0000 2020,Louis DeJoy, Trump's pick for postmaster general, has given more than $2 million to Trump &amp; Republican committees s… https://t.co/XdDvjaZZuu
1258391014601117700,Thu May 07 13:39:32 +0000 2020,Day by day, week by week, Cincinnati’s Over-the-Rhine neighborhood had scratched its way into a renaissance. Then t… https://t.co/yfpoXh3rls
1258159377011351600,Wed May 06 22:19:05 +0000 2020,‘We’re disease vectors’: Senators press for rapid coronavirus testing for lawmakers Via @PKCapitol https://t.co/Ff9QFXq0s8
1258084291969417200,Wed May 06 17:20:43 +0000 2020,RT @cspanJeremy: LISTEN: Toilet flush during U.S. Supreme Court oral argument (h/t @nicninh) https://t.co/He3QGMzvJI
1258071180931629000,Wed May 06 16:28:38 +0000 2020,RT @amyjoyce_berg: Moms are working, parenting, dealing with a global pandemic. Here, in their words, is how they're doing it.  https://t.c…
1258065318548852700,Wed May 06 16:05:20 +0000 2020,RT @washingtonpost: The urgent quest for a coronavirus treatment involves door-to-door blood collection and a llama named Winter https://t.…
1258053242665209900,Wed May 06 15:17:21 +0000 2020,RT @FenitN: It’s also striking how we don’t see the worst hotspots in Ward 8, but Ward 8 has had the most deaths. Also, Georgetown only has…
1258048625210462200,Wed May 06 14:59:00 +0000 2020,RT @TonyRomm: NEW: Car sales have dropped dramatically. The auto industry -- manufacturers and suppliers -- are struggling. Some in Congres…
1258046582160851000,Wed May 06 14:50:53 +0000 2020,RT @NickMiroff: SCOOP Trump has told aides to move forward with his plan to paint the border wall black, and costs are projected to be at l…
1257774029844418600,Tue May 05 20:47:51 +0000 2020,NEW: The Trump administration needs to take stronger steps to protect and compensate federal workers in front-line… https://t.co/YmYjDtsY90
1257713754772570000,Tue May 05 16:48:20 +0000 2020,The document alleges that the team responsible for PPE had little success in helping the government secure such equ… https://t.co/8W3ORV4RXZ
1257710357063270400,Tue May 05 16:34:50 +0000 2020,RT @mariasacchetti: This is a must read by @PeterWhoriskey   “While thousands of their workers are filing for unemployment benefits, these…
1257697205969981400,Tue May 05 15:42:35 +0000 2020,RT @nakashimae: What's striking about this confirmation hearing is the amount of time the senators have had to spend just ensuring that the…
1257688696507314200,Tue May 05 15:08:46 +0000 2020,RT @ericawerner: Asked why he wouldn't let Fauci testify in the House this week, Trump says: "Because the House is a setup, the House is a…
1257671683881816000,Tue May 05 14:01:10 +0000 2020,RT @ByMoriah: Hailey McInerney graduated from medical school in mid-April. Within 4 days of the ceremony, she was working in a hospital fil…
1257662833388552200,Tue May 05 13:26:00 +0000 2020,RT @spulliam: The back story to this is: Several weeks ago, I was interviewing  @timkellernyc  about death (for this story: https://t.co/Nd…
1257659535306690600,Tue May 05 13:12:54 +0000 2020,As the country begins to reopen, a major hurdle emerges: Many Americans feel unsafe at what used to be routine. New… https://t.co/xWOX0LlPb4
1257659321288097800,Tue May 05 13:12:03 +0000 2020,Millions of Americans don’t have clean running water. In the age of the coronavirus, that puts the entire populatio… https://t.co/Cby73Ivc1I
1257474813284802600,Tue May 05 00:58:52 +0000 2020,Lawmaking in the time of coronavirus: The Senate returns to work, warily Via @mikedebonis https://t.co/e0Eeezjch7
1257474653494431700,Tue May 05 00:58:14 +0000 2020,States relax coronavirus restrictions as U.S. fitfully gropes for normalcy Via @mattzap   https://t.co/hvltwx0vYt
1257390650208780300,Mon May 04 19:24:26 +0000 2020,RT @suzyji: Hugely proud of Pulitzer prize winning @washingtonpost colleagues @eilperin @StevenMufson @chrismooney @brady_dennis @bydarrylf…
1257389843480555500,Mon May 04 19:21:14 +0000 2020,RT @PhilipRucker: Thrilled for friends &amp; colleagues @eilperin @StevenMufson @brady_dennis @chriscmooney @bydarrylfears &amp; their editor @Tris…
1257354766780375000,Mon May 04 17:01:51 +0000 2020,Trump says he shares his famed uncle’s science genius. A friend says the uncle ‘would have been horrified.’ By… https://t.co/RUdpD1g00o
1257305847991955500,Mon May 04 13:47:28 +0000 2020,RT @myhlee: As Washington stumbled, governors stepped to the forefront. Read @danbalz https://t.co/yAQDYlnct1
1257064409853296600,Sun May 03 21:48:05 +0000 2020,Unexpected outcome in Wisconsin: Tens of thousands of ballots that arrived after Election Day were counted, thanks… https://t.co/V5cEsSIFS1
1256772493207011300,Sun May 03 02:28:06 +0000 2020,RT @AlxThomp: Jared Kushner is a rare on the record interview w/ Wapo: “When history looks back on this, they’ll say, man, the federal gove…
1256772395827892200,Sun May 03 02:27:43 +0000 2020,RT @davecclarke: Two GOP consultants started selling covid-19 medical supplies less than two months ago. Maryland just canceled a $12.5M co…
1256772336520441900,Sun May 03 02:27:29 +0000 2020,RT @jeannasmialek: Monty Bennett's hotel firm, which asked for $126m in PPP loans and got $70m+, will return the money.   https://t.co/3wPm…
