id,created_at,text
1188958134762692600,Mon Oct 28 23:18:03 +0000 2019,RT @adrienneshih: @datagraphics @latimes Update: @latimes has removed the paywall from all fire coverage today. That includes #GettyFire, #…
1188868911825072000,Mon Oct 28 17:23:31 +0000 2019,RT @rachaelmbade: Wowzers. @repgregwalden  is retiring!  REMEMBER: abt 40% of the Rs who were here for Trump's inauguration are gone or lea…
1188864653255958500,Mon Oct 28 17:06:36 +0000 2019,RT @WashPostPR: .@wpmagazine today released a special prison issue completely written, illustrated and photographed by people who have been…
1188864469423800300,Mon Oct 28 17:05:52 +0000 2019,Former senator Kay Hagan has died at age 66. She served one term representing North Carolina. https://t.co/iL1cCYE5wl
1188843320442835000,Mon Oct 28 15:41:49 +0000 2019,*Two million* people are without power in California https://t.co/GOQOXn0wYA
1188831188628246500,Mon Oct 28 14:53:37 +0000 2019,Just terrifying situation in Sonoma County as fire approaches Santa Rosa: https://t.co/YQ9uFvBh0v
1188818545032990700,Mon Oct 28 14:03:22 +0000 2019,RT @nakashimae: Critics say the U.S. has no national strategy to counter foreign influence. A senior administration official counters: We d…
1188818490788077600,Mon Oct 28 14:03:10 +0000 2019,“It feels like a horror movie”: Republicans feel anxious and adrift defending Trump, by @costareports @PhilipRucker https://t.co/UmRkeIHWkg
1188818405421473800,Mon Oct 28 14:02:49 +0000 2019,NEW via @sullivank =&gt; Walking away from wealth and prestige dismayed Andrew Yang's immigrant parents. But it made h… https://t.co/We8Y2OqyL4
1188818357807669200,Mon Oct 28 14:02:38 +0000 2019,In Iowa, Tulsi Gabbard’s supporters see a sign — well, lots of them. Known for her internet backers, she has plaste… https://t.co/Nb14BmMNie
1188817898309066800,Mon Oct 28 14:00:48 +0000 2019,RT @OConnellPostbiz: A hornet's nest of a story: Bezos, the Saudi prince and a billion dollar deal that died.  Alt hed: the global fallout…
1188817867359346700,Mon Oct 28 14:00:41 +0000 2019,As Russia makes 2020 play, Democratic campaigns say they are in the dark, and experts fear U.S. elections are vulne… https://t.co/zOYhMYXTMN
1188817206282469400,Mon Oct 28 13:58:03 +0000 2019,NEW: Bolton’s former deputy fails to show up for Hill deposition as he seeks court ruling to resolve dispute over t… https://t.co/AQkc6Zk6Ha
1188810197923483600,Mon Oct 28 13:30:12 +0000 2019,Sen. Johnson, ally of Trump and Ukraine, surfaces in crucial episodes in the saga Via @eliseviebeck @DDaltonBennett https://t.co/fHw8qiKSoB
1188614035723432000,Mon Oct 28 00:30:44 +0000 2019,RT @AdamKilgoreWP: The Nationals Park crowd is responding to Joe Ross in a fun and unique way. Strange situation, special team. As one Nats…
1188613363376492500,Mon Oct 28 00:28:03 +0000 2019,In creating a spectacle around Baghdadi’s death, Trump departs from Obama’s more measured tone on bin Laden, by… https://t.co/kfF3TBsgqb
1188612872299057200,Mon Oct 28 00:26:06 +0000 2019,RT @jdawsey1: Here are the members of Congress Trump brought w/him to the World Series:  Sens. Lindsey Graham &amp; David Perdue Representative…
1188612833006764000,Mon Oct 28 00:25:57 +0000 2019,RT @MichaelCBender: Trump arrived at Game 5 at 8pm, eight mins before gametime &amp; nine mins after nemesis José Andres tossed the first pitch…
1188612767521104000,Mon Oct 28 00:25:41 +0000 2019,Rep. Katie Hill (D-Calif.) to resign from Congress amid allegations of intimate relationship with staffer Via… https://t.co/FoZ6q5jDoY
1188467187385880600,Sun Oct 27 14:47:12 +0000 2019,Top Stories | They bonded over football years ago. Now President Trump sees Mitt Romney as his harshest GOP foe.  R… https://t.co/8kNQCfyDKB
1188251679281557500,Sun Oct 27 00:30:51 +0000 2019,Giuliani associates claimed to have sway with both foreign billionaires and Trump administration officials Read the… https://t.co/jS7vHEDA3S
1188171386075992000,Sat Oct 26 19:11:48 +0000 2019,EXCLUSIVE via @partlowj: Company with ties to Trump’s brother Robert awarded $33 million government contract https://t.co/QzyxP97Qdk
1188167717251141600,Sat Oct 26 18:57:13 +0000 2019,https://t.co/QzyxP97Qdk
1188087259284889600,Sat Oct 26 13:37:30 +0000 2019,Top Stories | Former top Trump aide asks court to rule on whether he must testify in impeachment inquiry  Read the… https://t.co/FseQUY4gKg
1187900214113423400,Sat Oct 26 01:14:15 +0000 2019,The president’s reconstituted legal team is racing to master details about the administration’s dealings with Ukrai… https://t.co/gUBBkqqZmd
1187880703255629800,Fri Oct 25 23:56:44 +0000 2019,NEW via @CarolLeonnig @jdawsey1: Trump frustrated as White House effort to defy impeachment inquiry fails to halt w… https://t.co/atAMBHq9mK
1187820031226331100,Fri Oct 25 19:55:38 +0000 2019,Trump campaign urges White House to soften proposed flavored vape ban, by @michaelscherer @jdawsey1… https://t.co/m3UD9CQSrv
1187804289852498000,Fri Oct 25 18:53:05 +0000 2019,RT @NBCInvestigates: Rudy Giuliani butt-dialed an NBC News reporter — twice — leaving long voicemail messages in which he's heard  discussi…
1187775886839468000,Fri Oct 25 17:00:13 +0000 2019,BREAKING: The Trump Organization is considering selling its D.C. hotel business, according to people familiar with… https://t.co/fJnztqTBDq
1187773715834126300,Fri Oct 25 16:51:36 +0000 2019,RT @John_Hudson: The local media coverage of Pompeo's trip to Kansas isn't getting any friendlier.   Kansas City Star: "Mike Pompeo, either…
1187773489207488500,Fri Oct 25 16:50:42 +0000 2019,RT @RoigFranzia: Quite the @DRUDGE top-of-the-page headline on Roger Stone breaking silence. If true will be fascinating to see how Judge A…
1187773173716131800,Fri Oct 25 16:49:27 +0000 2019,RT @stevenjay: Trump wages battle against impeachment with a barrage of provocations, contradictions and exhortations https://t.co/j0TQOCuI…
1187742030891487200,Fri Oct 25 14:45:42 +0000 2019,RT @DavidNakamura: REMINDER: @washingtonpost site is free to anyone with .gov, .mil, .edu email address! https://t.co/dkxVs007vu https://t.…
1187541170014044200,Fri Oct 25 01:27:33 +0000 2019,NEW via @amyegardner: Civil rights group challenges rejection of George Mason student voter registrations https://t.co/veNDCnbjzq
1187531169610584000,Fri Oct 25 00:47:48 +0000 2019,ACLU says 1,500 more migrant children were taken from parents by the Trump administration via @mariasacchetti https://t.co/JxWDE5IQuh
1187530352488861700,Fri Oct 25 00:44:33 +0000 2019,RT @mj_lee: Scoop: Rep. Katie Porter of California, one of the highest-profile members of the freshman class, plans to endorse Sen. Elizabe…
1187530127472840700,Fri Oct 25 00:43:40 +0000 2019,Democrats say whistleblower’s testimony is unnecessary as other witnesses come forward Via @mikedebonis @karoun https://t.co/YhPLQSQDG8
1187529873889337300,Fri Oct 25 00:42:39 +0000 2019,Documents show Trump, ‘Apprentice’ contestant at Beverly Hills hotel around the time she says he assaulted her, via… https://t.co/bBcjOPqJe4
1187529488017641500,Fri Oct 25 00:41:07 +0000 2019,Federal employees loved Rep. Elijah Cummings. Here’s why. By Federal Insider @JoeDavidsonWP https://t.co/utyzfWu5P2
1187479461018701800,Thu Oct 24 21:22:20 +0000 2019,NEW: House issues subpoenas for documents related to Trump’s D.C. hotel, which is housed in a federally owned build… https://t.co/1bSjMM8hr6
1187465306073116700,Thu Oct 24 20:26:05 +0000 2019,BREAKING via @davidjlynch @jdawsey1: White House delayed Ukraine trade decision in August, a signal that U.S. suspe… https://t.co/mvtDJ5OGnE
1187454240383471600,Thu Oct 24 19:42:07 +0000 2019,BREAKING: Trump’s heralded whistleblower office at VA has failed its most basic mission, inspector general says. By… https://t.co/WIx1rPSabF
1187451968622604300,Thu Oct 24 19:33:05 +0000 2019,SCOOP: N.J. seeks to revoke liquor license for one of Trump’s golf clubs, triggered by a case in which a customer c… https://t.co/8QstQTeicc
1187387695921860600,Thu Oct 24 15:17:41 +0000 2019,RT @mikedebonis: He's going home. https://t.co/TRCwNj5Jrn
1187386870646395000,Thu Oct 24 15:14:25 +0000 2019,RT @jdawsey1: An early #FF to @ikhurshudyan, a Gamecock extraordinaire, who is becoming a Moscow correspondent for the Post.
1187382190318989300,Thu Oct 24 14:55:49 +0000 2019,RT @rachaelmbade: Confirmed: MCCONNELL &amp; GRAHAM today will do their own impeachment protest of sorts w/a resolution condemning the Dem’s cl…
1187177253706309600,Thu Oct 24 01:21:28 +0000 2019,RT @cathleendecker: Republicans storm closed-door impeachment hearing as escalating Ukraine scandal threatens Trump, by @ToluseO @jdawsey1…
1187176767531995100,Thu Oct 24 01:19:32 +0000 2019,Rep. Louie Gohmert (R-Tex.) — a Trump favorite who regularly defends the president on television — started shouting… https://t.co/5T5sFYZmEt
1187176440875405300,Thu Oct 24 01:18:14 +0000 2019,Trump told Republicans to fight. They took the brawl underground. via @eliseviebeck @rachaelmbade @mikedebonis… https://t.co/oEYg6cmOpv
1187140516670038000,Wed Oct 23 22:55:29 +0000 2019,Giuliani associates Lev Parnas and Igor Fruman plead not guilty in campaign finance case https://t.co/AWZH354gXU
1187140299979722800,Wed Oct 23 22:54:38 +0000 2019,U.S. judge says he will order State Dept. to begin releasing Ukraine records in 30 days via @hsu_spencer https://t.co/dsDSJcNqIt
1187076412592787500,Wed Oct 23 18:40:46 +0000 2019,RT @zachjourno: New York hearing on Trump's financial records:  JUDGE: "So what's your view on the 5th Av. example? Local authorities could…
1187049057757335600,Wed Oct 23 16:52:04 +0000 2019,RT @eilperin: One of Mattis' top aides has written an inside account of serving at DOD under Trump. He quotes Mattis as saying he'd “rather…
1187044191190290400,Wed Oct 23 16:32:44 +0000 2019,NEW via @amarimow @OConnellPostBiz --&gt;  In court hearing, Trump lawyer argues a sitting president would be immune f… https://t.co/NwnUbnBQus
1187035373207203800,Wed Oct 23 15:57:41 +0000 2019,RT @OConnellPostbiz: This was an interesting exchange! https://t.co/DzgZRO3nr8
1187020247112523800,Wed Oct 23 14:57:35 +0000 2019,Pentagon official testifies about Ukraine aid in House impeachment probe via @eliseviebeck https://t.co/O4xhKs7Yb0
1187019990790234000,Wed Oct 23 14:56:34 +0000 2019,Trump administration sought billions of dollars in cuts to programs aimed at fighting corruption in Ukraine and els… https://t.co/ji8QSLTGBb
1187002105799811000,Wed Oct 23 13:45:30 +0000 2019,RT @ShimonPro: Outside Manhattan federal court this morning greeting SDNY prosecutors and two of Giuliani’s associates who are about to app…
1187000895130734600,Wed Oct 23 13:40:41 +0000 2019,Under fire from women who say they were harmed by breast implants, the FDA proposed on Wednesday that manufacturers… https://t.co/d5xAmMFZmP
1186994166133330000,Wed Oct 23 13:13:57 +0000 2019,RT @myhlee: Three businesses controlled by Katie Walsh and Mike Shields have been paid $12.6 million since 2017. https://t.co/6zpAl7ZJpn ht…
1186965780518318000,Wed Oct 23 11:21:09 +0000 2019,RT @thefix: At least 5 House Democrats called Bill Clinton’s impeachment a ‘lynching’ in 1998 https://t.co/eOqOuQ9jxH
1186965614063247400,Wed Oct 23 11:20:29 +0000 2019,"Who else do I trust more than myself? The two people that I saw day after day, saying really smart things to me al… https://t.co/iD02KsM6kB
1186965307795083300,Wed Oct 23 11:19:16 +0000 2019,The dominance of Brad Parscale, Katie Walsh and Mike Shields has alarmed other Republican Party strategists, who sa… https://t.co/wZCZREXgTS
1186963831446220800,Wed Oct 23 11:13:24 +0000 2019,RT @peterwallsten: President Trump has taken his harsh rhetoric and divisive tactics to a new level since impeachment proceedings began a m…
1186961365317103600,Wed Oct 23 11:03:36 +0000 2019,NEW: How a Beltway power couple and a political newcomer learned to thrive in the Trump era by @myhlee… https://t.co/ujkIyVBfzm
1186959504598061000,Wed Oct 23 10:56:13 +0000 2019,Free school meals for nearly a million poor children are in jeopardy under proposed Trump rule change. By Federal I… https://t.co/HzEc1w65B9
1186958394021896200,Wed Oct 23 10:51:48 +0000 2019,Anxiety rises among Democrats worried about party’s prospects in 2020 via @annielinskey @mviser https://t.co/uw03PssaYh
1186957140361207800,Wed Oct 23 10:46:49 +0000 2019,So many stunning details in this piece: https://t.co/MrUGzhPXov
1186837891365900300,Wed Oct 23 02:52:58 +0000 2019,RT @cathleendecker: “It is no longer a question of whether this happened. It is now a question of how the president explains it and how law…
1186834442251313200,Wed Oct 23 02:39:16 +0000 2019,RT @cathleendecker: Trump made Ukraine aid contingent on public pledge to investigate Bidens and 2016 election, U.S. envoy says he was told…
1186805657976086500,Wed Oct 23 00:44:53 +0000 2019,If you buy a MAGA hat, where does your money go? New video explainer by @myhlee @Monica_Akhtar https://t.co/irzBci8nQE
1186803991604281300,Wed Oct 23 00:38:16 +0000 2019,NEW: Just in time for skating season, Trump’s company scrubs his name from N.Y. ice rinks, via @pbump and… https://t.co/XA5Ux8bh9A
1186803630382428200,Wed Oct 23 00:36:49 +0000 2019,Trump’s D.C. hotel abruptly cancels Christian aid group’s Kurdish solidarity event, from @partlowj https://t.co/YMY3jvV6md
1186803331123032000,Wed Oct 23 00:35:38 +0000 2019,After taking on Firtash’s case, Toensing and diGenova secured a rare face-to-face meeting with Attorney General Wil… https://t.co/ewB37zGhfT
1186802976473698300,Wed Oct 23 00:34:13 +0000 2019,NEW: Prosecutors flagged possible ties between Ukrainian gas tycoon and Giuliani associates by @mattzap @postroz… https://t.co/SGTYH9yh9H
1186795234207899600,Wed Oct 23 00:03:28 +0000 2019,MEANWHILE: Trump inauguration donor agrees to plead guilty to previous lobbying, campaign and tax crimes,… https://t.co/SIpZMEhzYv
1186794769332232200,Wed Oct 23 00:01:37 +0000 2019,RT @RiegerReport: NEW  At least five House Democrats called Bill Clinton’s impeachment a ‘lynching’ in 1998, according to a Washington Post…
1186739589190426600,Tue Oct 22 20:22:21 +0000 2019,RT @John_Hudson: Amb. Bill Taylor's testimony is incendiary and you can read it here, courtesy @rachaelmbade https://t.co/FWTF3fwkCC
1186739578113331200,Tue Oct 22 20:22:18 +0000 2019,RT @washingtonpost: Justice Dept. argues that appeals court ruling on Trump’s accounting records has no bearing on case involving his IRS t…
1186714228712976400,Tue Oct 22 18:41:34 +0000 2019,BREAKING: U.S. envoy says he was told release of Ukraine aid was contingent on public declaration to investigate Bi… https://t.co/pAFP4yX7H0
1186642472686047200,Tue Oct 22 13:56:26 +0000 2019,RT @levinecarrie: In a fiery op-ed, FEC Commissioner Caroline Hunter accuses @fec Chair Weintraub of compromising her neutrality in cases t…
1186642271720132600,Tue Oct 22 13:55:38 +0000 2019,RT @DonnaCassata: Live updates: Trump calls impeachment inquiry a ‘lynching’ as a key witness testifies https://t.co/OiotOBcJ8N
1186641282506080300,Tue Oct 22 13:51:43 +0000 2019,NEW via @wesleylowery : Within minutes, the slur was gone, painted over by other students. But a grainy video was s… https://t.co/5KwbnOYV4V
1186639580373667800,Tue Oct 22 13:44:57 +0000 2019,Meet Cy Vance, the Manhattan DA who is trying to get Trump’s tax returns and has tangled with the family before, vi… https://t.co/uh9JZLrIUV
1186639252152639500,Tue Oct 22 13:43:39 +0000 2019,Diplomat who raised alarm about withholding aid to Ukraine testifies in impeachment probe Via @agearan https://t.co/b2al8rzRiR
1186465541680173000,Tue Oct 22 02:13:23 +0000 2019,Facebook takedowns show new Russian activity targeted Biden, praised Trump https://t.co/rCzt17oFM8
1186464910152290300,Tue Oct 22 02:10:52 +0000 2019,Putin and Hungary’s Orban helped sour Trump on Ukraine by @gregpmiller @gregjaffe @john_hudoson @nakashimae https://t.co/838YJkJuxX
1186463596873732000,Tue Oct 22 02:05:39 +0000 2019,RT @costareports: Some major Republican donors have made it clear to party leaders and White House officials that they are unhappy with wha…
1186353628560445400,Mon Oct 21 18:48:41 +0000 2019,How a crumbling bridge in Syracuse is sparking a conversation about reparations by @newsbysamuels: https://t.co/U81HuS4p1x
1186325160074399700,Mon Oct 21 16:55:33 +0000 2019,RT @jdawsey1: "You people with this phony Emoluments Clause," Trump tells assembled media questioning him about attempt to put G-7 at his o…
1186083567752958000,Mon Oct 21 00:55:33 +0000 2019,Trump reversed course on hosting the G-7 at his club after learning that impeachment-weary Republicans were tired o… https://t.co/ANnum37LQQ
1185897190851518500,Sun Oct 20 12:34:57 +0000 2019,Such an illuminating, deeply reported piece by @mviser @PaulSonne on the aftershocks of Biden's efforts in Ukraine  https://t.co/TljO779GVE
1185875694653509600,Sun Oct 20 11:09:32 +0000 2019,RT @RoigFranzia: Important point in this perceptive @PhilipRucker piece —&gt; “The firewall of loyal defenders on which [Trump] has long relie…
1185739934545711000,Sun Oct 20 02:10:05 +0000 2019,https://t.co/Y8lC4oyg8N
1185353004343611400,Sat Oct 19 00:32:33 +0000 2019,RT @ToluseO: Privately, the opinion inside the White House toward Mulvaney’s news conference was almost universally negative, according to…
1185350472812642300,Sat Oct 19 00:22:30 +0000 2019,RT @HotlineJosh: WaPo lead this PM: “A growing number of congressional Rs expressed exasperation Friday over what they view as Trump’s inde…
1185350393771020300,Sat Oct 19 00:22:11 +0000 2019,‘I didn’t take this job to keep it’: GOP Rep. Rooney hints he’s open to impeachment Via @mikedebonis https://t.co/uhjcmdV1u9
1185343172949532700,Fri Oct 18 23:53:29 +0000 2019,Trump says he’ll host G7 summit at cost at his resort — but provides few details via @fahrenthold @michaelbirnbaum… https://t.co/YO3ydijmpm
1185269068812685300,Fri Oct 18 18:59:01 +0000 2019,Must-read about an Emirati princess who sought Giuliani's help and what is says about Trump's DC hotel as a portal… https://t.co/8znHuZHCxi
1185245025866829800,Fri Oct 18 17:23:29 +0000 2019,Trump’s decision to host G-7 at his golf club creates awkwardness for world leaders https://t.co/0C9W7RoITg
1185234818117845000,Fri Oct 18 16:42:55 +0000 2019,RT @PostWorldNews: A second Brexit vote once seemed impossible. Now, perhaps not. https://t.co/eC60dlqSDB
1185230981692833800,Fri Oct 18 16:27:41 +0000 2019,RT @Fahrenthold: LISTEN: We have tape of @realdonaldtrump's hired representative explaining that Trump Doral is "severely underperforming"…
1185220065664393200,Fri Oct 18 15:44:18 +0000 2019,RT @scontorno: BREAKING: We found more photos of Ron DeSantis on election night with the two arrested Giuliani associates. This time, they'…
1185219209518899200,Fri Oct 18 15:40:54 +0000 2019,RT @Fahrenthold: Questions for @Trump Org today, about the huge contract that the president awarded to himself yesterday. I’ll let you know…
1185218041967272000,Fri Oct 18 15:36:16 +0000 2019,RT @AshleyRParker: Initially, many viewed Giuliani’s efforts in Ukraine as something of a personal passion project — the extracurricular sc…
1185215567629865000,Fri Oct 18 15:26:26 +0000 2019,RT @alexi: UPDATE: Mayor Pete is returning a $5600 donation from Steve Patton, the former Chicago attorney tied to Laquan McDonald's murder…
1185188609344921600,Fri Oct 18 13:39:18 +0000 2019,RT @jennaportnoy: .⁦⁦@paulschwartzman⁩ with a powerful dispatch from Cummings’ Baltimore: “This was his city,” one man said. “So many work…
1185188336010498000,Fri Oct 18 13:38:13 +0000 2019,RT @michaelbirnbaum: I asked European Council President Donald Tusk whether it was appropriate to spend EU funds on a Trump business at nex…
1185186284400271400,Fri Oct 18 13:30:04 +0000 2019,RT @wpjenna: Trump insists Texas is not in play — but his campaign’s actions tell a different story, ⁦@PatrickSvitek⁩ reports. One Dem puts…
1185183507368304600,Fri Oct 18 13:19:02 +0000 2019,Former VA chief David Shulkin, who was dismissed by a Trump tweet, settles some old scores in his new book. By… https://t.co/oKOzo48YRm
1185180592050233300,Fri Oct 18 13:07:27 +0000 2019,A growing body of evidence puts Trump at the center of Ukraine efforts against rivals, by @AshleyRParker https://t.co/m9pJ1ftzCd
1185180199685636000,Fri Oct 18 13:05:53 +0000 2019,Diplomat tells investigators he raised alarms in 2015 about Hunter Biden’s Ukraine work but was rebuffed, via… https://t.co/Ps13PwRED8
1185019257622585300,Fri Oct 18 02:26:22 +0000 2019,‘Get over it’: Mulvaney’s twin admissions put Trump at the center of emoluments and Ukraine controversies @ToluseO https://t.co/f11oojqmnZ
1185003466328039400,Fri Oct 18 01:23:37 +0000 2019,‘All roads lead to Putin:’ Pelosi questions Trump’s loyalty in White House clash Via @mikedebonis @seungminkim https://t.co/GXdiTVfVbj
1184993068447162400,Fri Oct 18 00:42:18 +0000 2019,After saying Trump held back aid to pressure Ukraine, Mulvaney tries to walk back comments via @karoun @john_hudson https://t.co/miKYzV6ISi
1184922404369391600,Thu Oct 17 20:01:30 +0000 2019,RT @peterwallsten: Who was in the White House photo of the ‘meltdown’ meeting, annotated https://t.co/yvQ8IM11iM
1184922366759047200,Thu Oct 17 20:01:21 +0000 2019,RT @Fahrenthold: Strongest reaction I've seen from a Republican so far. https://t.co/WtmFAa8WFx
1184922151872352300,Thu Oct 17 20:00:30 +0000 2019,RT @mattzap: DOJ distancing on Mulvaney... "If the White House was withholding aid in regards to the cooperation of any investigation at th…
1184893191415386000,Thu Oct 17 18:05:25 +0000 2019,RT @weijia: Mick Mulvaney just announced Trump’s Doral resort will host the G7 summit in June. So I asked who’s idea it was to put it in th…
1184874500116091000,Thu Oct 17 16:51:09 +0000 2019,RT @jdawsey1: "It's not the only place, it's the best place," Mulvaney says of Trump's golf club, announcing it will host the G7 next year.
1184872956658405400,Thu Oct 17 16:45:01 +0000 2019,BREAKING: Trump has awarded next year’s G-7 summit of world leaders to his Miami-area resort, the White House said https://t.co/haQZEmwKi0
1184636150780178400,Thu Oct 17 01:04:02 +0000 2019,Ex-Pompeo adviser tells impeachment investigators he was ‘disturbed’ by attempts to use foreigners to hurt Trump’s… https://t.co/db3gL26hDo
1184604940704125000,Wed Oct 16 23:00:01 +0000 2019,RT @Reinlwapo: Postmaster general who was the target of Trump's ire over Amazon shipping announces retirement, by @AshleyRParker @jdawsey1…
1184581374667362300,Wed Oct 16 21:26:22 +0000 2019,Democrats walk out of Syria meeting with Trump, saying he was insulting and went on a ‘nasty diatribe’ @seungminkim… https://t.co/JohIxHE5yY
1184572120992538600,Wed Oct 16 20:49:36 +0000 2019,Why do Democrats keep asking you for $1 donations? @myhlee explains in this great @Monica_Akhtar video: https://t.co/oRwCuI98h6
1184565907571515400,Wed Oct 16 20:24:55 +0000 2019,Who’s winning the 2020 money race? https://t.co/f3VvhGyGja
1184563310563418000,Wed Oct 16 20:14:36 +0000 2019,RT @rebeccaballhaus: "Don't be a fool! I will call you later." --Trump in Oct. 9 letter to Erdogan https://t.co/6ZfUvhInGi
1184496039346299000,Wed Oct 16 15:47:17 +0000 2019,RT @seungminkim: Romney’s reaction when I told him about this comment: “Oh my goodness gracious, the Kurds are our friends and our allies .…
1184495977505480700,Wed Oct 16 15:47:02 +0000 2019,RT @feliciasonmez: Trump, when asked why Giuliani wasn't registered as a foreign lobbyist: “You have to ask Rudy those questions. Don’t ask…
1184495946434056200,Wed Oct 16 15:46:55 +0000 2019,RT @capitalweather: We'll post updates on rain projections and amounts around the DMV until it starts to taper off late this afternoon at t…
1184493548839821300,Wed Oct 16 15:37:23 +0000 2019,RT @jdawsey1: "It's not our problem," Trump says in Oval Office of Turkey's invasion into Syria. He adds that the Kurds are "not angels." A…
1184493416161390600,Wed Oct 16 15:36:51 +0000 2019,RT @anniekarni: “'We’re not going to arrest [Gulen] to do a solid for Erdogan.'  However, Trump appeared receptive to the idea."  https://t…
1184490848937005000,Wed Oct 16 15:26:39 +0000 2019,SCOOP: Pompeo adviser to decry politicization of State Dept. in impeachment probe testimony Via @John_Hudson… https://t.co/vjI85ZtwBy
1184441162742075400,Wed Oct 16 12:09:13 +0000 2019,While you were sleeping, @myhlee @anu_naryan pulled together the latest on the money race: Biden entered fourth qua… https://t.co/UDa924pq2q
1184306440288329700,Wed Oct 16 03:13:53 +0000 2019,Powerful read from @DanLamothe: https://t.co/P48YNneK0H
1184283363030515700,Wed Oct 16 01:42:11 +0000 2019,RT @RachelVanD: A lot of really excellent reporting in this piece by my colleagues, includ this gem: One former senior administration offic…
1184278754882916400,Wed Oct 16 01:23:52 +0000 2019,RT @nakashimae: Giuliani privately urged Trump in 2017 to extradite Fethullah Gulen, according to multiple former administration officials.…
1184278003309781000,Wed Oct 16 01:20:53 +0000 2019,RT @jdawsey1: When I asked him later if he remembered senior Trump officials sitting him down in 2017 and asking him to stop talking to POT…
1184275575751491600,Wed Oct 16 01:11:14 +0000 2019,@CarolLeonnig @nakashimae @jdawsey1 @thamburger When told that multiple people described the conversations to The P… https://t.co/syQissQuUT
1184275539554656300,Wed Oct 16 01:11:06 +0000 2019,@CarolLeonnig @nakashimae @jdawsey1 @thamburger In a text exchange Tuesday afternoon, he declined to discuss whethe… https://t.co/8EvwU1aP7k
