id,created_at,text
1259276035226550300,Sun May 10 00:16:17 +0000 2020,RT @newsguild: America’s news is in jeopardy unless Congress takes decisive action to include the local news industry in the next recovery…
1255215199558213600,Tue Apr 28 19:19:59 +0000 2020,RT @kris10voor: My next piece for @ClydeGroup is on protecting and building consumer trust:  https://t.co/9vEBL4Gzcu
1252606036558610400,Tue Apr 21 14:32:06 +0000 2020,RT @ClydeGroup: Going the extra mile for customers during these tough times is something that will pay off in the long run for companies li…
1246129235418382300,Fri Apr 03 17:35:36 +0000 2020,RT @ClydeGroup: As the #COVID19 crisis continues to evolve and the economic impact deepens, corporate responsibilities will change.   Here…
1242848979697766400,Wed Mar 25 16:21:02 +0000 2020,RT @ClydeGroup: COVID-19 has upended the way we live, work, and socialize. In times like these, communication plays a vital role. That is w…
1162698553279602700,Sat Aug 17 12:11:51 +0000 2019,Every once in a while you stumble across something excellent on twitter dot com.   This is worth watching. https://t.co/GiEop8uvEY
1139524504491892700,Fri Jun 14 13:26:27 +0000 2019,Still going. Grateful for everyone who is with me on this journey. https://t.co/f9m1Y0jypg
1138794459339137000,Wed Jun 12 13:05:31 +0000 2019,Pretty hard to find more passionate and ultimately effective celebrity advocate on the hill. https://t.co/iAlNRMu0AI
1133515966065860600,Tue May 28 23:30:40 +0000 2019,Being an uncle is the greatest. With the arrival of Conrad, it’s twice the fun. Congrats @katehouse89 and… https://t.co/5BlFJYyqni
1126873393712681000,Fri May 10 15:35:28 +0000 2019,This isn’t going to be a monthly thing (I swear) but I’m damn proud of this milestone. Today marks six months since… https://t.co/x3gLXUfWE4
1126143326544113700,Wed May 08 15:14:26 +0000 2019,An accurate and fitting tribute to a great reporter, who was always a pleasure to deal with to boot. RIP. https://t.co/vfuWgWsttd
1116823341053222900,Fri Apr 12 22:00:08 +0000 2019,Little life update — this week marked five months since I’ve had anything to drink. I have a long ways to go, but d… https://t.co/5LCVsK2xa6
1061623669066264600,Sun Nov 11 14:16:21 +0000 2018,RT @SherylNYT: Schumer tells @jaketapper he &amp; Pelosi are asking Justice Dept. ethics officials to issue guidance about whether Matt Whitake…
1061622767819391000,Sun Nov 11 14:12:46 +0000 2018,On @CNNSotu, @SenSchumer says Senate Democrats will attempt to add bipartisan legislation to protect the Mueller pr… https://t.co/bBLmKlhC4P
1061615347076341800,Sun Nov 11 13:43:17 +0000 2018,Tune in soon. https://t.co/iaYRdgtDfX
1060268859163320300,Wed Nov 07 20:32:49 +0000 2018,RT @frankthorp: INBOX: Schumer Calls On Acting Attorney General Whitaker To Recuse Himself From Mueller Probe https://t.co/emIB3CreBH
1060243972856135700,Wed Nov 07 18:53:56 +0000 2018,Its true. Senate gallery at 2:30 to talk midterm results. https://t.co/20RxNU4I3d
1055858570040934400,Fri Oct 26 16:27:54 +0000 2018,RT @IanSams: The world lost a great young man last night. @TyroneGayle was the best of us. Boundless joy. Steely drive and determination. E…
1055094839900028900,Wed Oct 24 13:53:07 +0000 2018,RT @seungminkim: -Dems passed Obamacare, which includes protections for preexisting conditions -Nearly all Rs voted to repeal Obamacare (no…
1055079953828667400,Wed Oct 24 12:53:58 +0000 2018,This is exactly backwards. https://t.co/FsK9Tm9ibp
1054691634053562400,Tue Oct 23 11:10:55 +0000 2018,Schumer: Republican leader Mitch McConnell just made the case for a Democratic Senate https://t.co/EaRRr338UA via @usatoday
1053229157159788500,Fri Oct 19 10:19:33 +0000 2018,Sen. Schumer will be discussing @senatemajldr's recent comments on health care &amp; the midterms and other news of the… https://t.co/hsHiZmEfTy
1053086705249632300,Fri Oct 19 00:53:30 +0000 2018,The polls: “Actually, it’s about health care.” https://t.co/BlagkbYjkl
1053010669375762400,Thu Oct 18 19:51:22 +0000 2018,RT @StevenTDennis: Trump has backed a lawsuit to nuke ACA's pre-existing conditions protections and his admin has expanded plans that don't…
1053009502398808000,Thu Oct 18 19:46:43 +0000 2018,Did he drop his lawsuit to eliminate protections for those with pre-existing conditions and just not tell anybody? https://t.co/HkcdqjXTaS
1052666057092149200,Wed Oct 17 21:02:00 +0000 2018,RT @rcohen: Senate Republicans are still coming for your healthcare. https://t.co/Kg6ip4E2dK
1052629228284461000,Wed Oct 17 18:35:39 +0000 2018,🚨🚨🚨 Sen. McConnell is saying the quiet part out loud a lot this week. 🚨🚨🚨 https://t.co/A5rlYYhgay
1052200454174707700,Tue Oct 16 14:11:51 +0000 2018,Maybe instead of cutting earned benefits for the middle class, we should take a second look at those giant tax cuts… https://t.co/59qknf89Zh
1050508187990933500,Thu Oct 11 22:07:24 +0000 2018,Guys, we just ran out of space to point out everything that was wrong. https://t.co/r7MeLR4mA7
1050054189034942500,Wed Oct 10 16:03:22 +0000 2018,RT @SenSchumer: I took a look at your op-ed, @realDonaldTrump. It needs some work.  All of the false and misleading words in the world can’…
1049966440722382800,Wed Oct 10 10:14:41 +0000 2018,Four Pinocchios for @SenTomCotton. Congrats, or something. https://t.co/BkhmFcoUxj
1049759844515938300,Tue Oct 09 20:33:45 +0000 2018,WSJ: Democrats Counter Trump Push for Cheaper, Limited Health Plans https://t.co/RgjGDRsnEh via @WSJ
1048207844913369100,Fri Oct 05 13:46:39 +0000 2018,.@SenSchumer will speak on the senate floor ahead of Judge Kavanaugh's cloture vote at approximately 10 AM. Tune in. https://t.co/MV4f4MB9OC
1047551843289768000,Wed Oct 03 18:19:56 +0000 2018,Presidential alert Twitter is exactly as lit as you'd imagine.
1044943560032899100,Wed Sep 26 13:35:33 +0000 2018,🤔 https://t.co/k4ky1Kdhq2
1042742077019308000,Thu Sep 20 11:47:39 +0000 2018,Wait. I was told Mexico was paying. https://t.co/3ttLLzBg8o
1042093755883511800,Tue Sep 18 16:51:27 +0000 2018,This is the same @realDonaldTrump who directs the DOJ to investigate his political enemies on a near daily basis.… https://t.co/veJmAXkYyl
1042066091466481700,Tue Sep 18 15:01:31 +0000 2018,This is the kind of thing you'd see at a hearing if it was actually designed to get at the truth. Multiple witnesse… https://t.co/z4ix07lN9O
1042064303384354800,Tue Sep 18 14:54:25 +0000 2018,Schumer calls @ChuckGrassley's attempt to limit witnesses at Monday's hearing, "simply inadequate, unfair, wrong an… https://t.co/Kw3V7NBrUz
1042033967162183700,Tue Sep 18 12:53:52 +0000 2018,@shearm @jdawsey1 Same problem.
1041776564717985800,Mon Sep 17 19:51:02 +0000 2018,Sen. Schumer will address the latest revelations regarding Judge Kavanaugh on the #senate floor shortly after 4 pm.
1041774089856319500,Mon Sep 17 19:41:12 +0000 2018,Watching Republicans repeatedly attack Democrats for respecting Professor Ford's request for confidentiality is quite something.
1041767532334600200,Mon Sep 17 19:15:09 +0000 2018,422 days: the amount of time after Justice Scalia's death Republicans held his seat open. 49 days: the number of da… https://t.co/h9sbeOsy0H
1041758374952689700,Mon Sep 17 18:38:46 +0000 2018,RT @lizzishappell: watch @SenSchumer discuss the serious, credible claims against Judge Kavanaugh on @TheView this morning ---&gt; https://t.c…
1041753120756432900,Mon Sep 17 18:17:53 +0000 2018,They 👏 should 👏 reopen 👏 it 👏. https://t.co/Iff6oacYsM
1041714511689003000,Mon Sep 17 15:44:28 +0000 2018,RT @TheView: Senate Minority Leader Chuck Schumer calls allegation against Supreme Court nominee Brett Kavanaugh "extremely credible": "She…
1041698286749581300,Mon Sep 17 14:40:00 +0000 2018,Just a periodic reminder that the Senate Republicans who don't want to slow down for a bit to investigate this are… https://t.co/g0Ei14rsgt
1041691243984683000,Mon Sep 17 14:12:00 +0000 2018,Tune in to see @SenSchumer on @TheView this morning at 11.
1041418098358792200,Sun Sep 16 20:06:37 +0000 2018,RT @NBCPolitics: Senators calling on Supreme Court nominee Kavanaugh's committee vote to be delayed: -Feinstein -Schumer -Harris -Whitehous…
1041408146881880000,Sun Sep 16 19:27:05 +0000 2018,Schumer: To railroad a vote now would be an insult to the women of America and the integrity of the Supreme Court 3/3
1041408058491129900,Sun Sep 16 19:26:44 +0000 2018,Schumer cont'd: Judge Kavanaugh’s credibility has already been seriously questioned because of his answers regardin… https://t.co/5LDOOHhv3L
1041407763300143100,Sun Sep 16 19:25:33 +0000 2018,Schumer: Senator Grassley must postpone the vote until, at a very minimum, these serious and credible allegations a… https://t.co/TWURUQydJ9
1041085247679590400,Sat Sep 15 22:04:00 +0000 2018,RT @DougJones: This morning in 1963, four innocent little girls lost their lives from an act of pure evil. I came to know their incredible…
1040595468890394600,Fri Sep 14 13:37:47 +0000 2018,.@mattfleg the people need to know: in which year were you watched by an annoyed Schumer body guy at a Knicks game?… https://t.co/r6jR1tOJPI
1040249994069127200,Thu Sep 13 14:45:00 +0000 2018,Voting to bury their heads in the sand and prevent the American people from seeing Judge Kavanaugh's full record.… https://t.co/YieWuetchq
1040247704541118500,Thu Sep 13 14:35:54 +0000 2018,No, Trump is fighting with *reality* over Maria. https://t.co/EVR71FgsJC
1040234594124083200,Thu Sep 13 13:43:48 +0000 2018,This headline is surreal. https://t.co/cFfZSQBhSS
1040221953884348400,Thu Sep 13 12:53:34 +0000 2018,@NormOrnstein Fair.
1040221478992658400,Thu Sep 13 12:51:41 +0000 2018,There are no words for this. https://t.co/XznKKXUuMD
1039921690451558400,Wed Sep 12 17:00:26 +0000 2018,This is what happens when you basically refuse to answer anything in the hearing #scotus #StopKavanaugh https://t.co/1FfILb6aUR
1039223541323972600,Mon Sep 10 18:46:14 +0000 2018,The Chairman of the Council of Economic Advisers at the @WhiteHouse just said this tweet isn't true, which is fun https://t.co/qwaWaav55r
1037800393881931800,Thu Sep 06 20:31:09 +0000 2018,This is astonishing. Judge Kavanaugh can't give a straight answer. https://t.co/4c9mCeoT83
1037756804548239400,Thu Sep 06 17:37:57 +0000 2018,The more docs the public sees, the more inconsistencies in Judge Kavanaugh's testimony appear. https://t.co/CVEBYFpQbf
1037756023141015600,Thu Sep 06 17:34:51 +0000 2018,#TBT feels appropriate today:  Mr. McConnell made clear in multiple phone calls with Mr. Trump... that the lengthy… https://t.co/5INsT4lVLF
1037753243269517300,Thu Sep 06 17:23:48 +0000 2018,Welp. https://t.co/fRg1yADMJX
1037740162908864500,Thu Sep 06 16:31:49 +0000 2018,Just going to leave this here.  https://t.co/SUsveGSDVj
1037717077618962400,Thu Sep 06 15:00:05 +0000 2018,This --&gt; https://t.co/rAQsdxxBQQ
1037713260022321200,Thu Sep 06 14:44:55 +0000 2018,What Zac said. https://t.co/DmYF6zXcYi
1037709811809505300,Thu Sep 06 14:31:13 +0000 2018,RT if you stand with Judiciary Committee @SenateDems https://t.co/AHZuU9ydZZ
1037706277307260900,Thu Sep 06 14:17:10 +0000 2018,RT @jbendery: ! "Count me in too," says Mazie Hirono, who says she, too, will release a committee confidential document. She says it's a Ka…
1037703607553085400,Thu Sep 06 14:06:34 +0000 2018,It’s almost like all the reasoning was total BS and designed to hide something.  It also makes you wonder what’s in… https://t.co/hWSmqlK9tM
1037702168873234400,Thu Sep 06 14:00:51 +0000 2018,Republicans seem terrified of whatever is in these documents. What are they hiding? #StopKavanuagh #scotus https://t.co/YosoCI5JMU
1037698222309945300,Thu Sep 06 13:45:10 +0000 2018,🚨🚨 As a White House lawyer in the Bush administration, Judge Brett Kavanaugh challenged the accuracy of deeming the… https://t.co/EFWzjWYGQ7
1037684038100766700,Thu Sep 06 12:48:48 +0000 2018,RT @adamslily: There is a case involving the Mueller investigation in front of the DC Circuit (Kavanaugh's court) right now - why isn't he…
1037515704914899000,Thu Sep 06 01:39:54 +0000 2018,@ahrferrier Judge Kavanaugh was asked if he spoke with anyone at a specific law firm about the Mueller investigation. He didn’t answer.
1037512803312173000,Thu Sep 06 01:28:23 +0000 2018,Which one? https://t.co/btqCcfZrFS
1037512714090934300,Thu Sep 06 01:28:01 +0000 2018,You sit up straight. The judge dodges and refuses to answer the question. https://t.co/2dX2SZWcOP
1037407178418794500,Wed Sep 05 18:28:40 +0000 2018,Health care protections for millions are at risk. #WhatsAtStake #StopKavanuagh #scotus https://t.co/z4GH0NB9eB
1037339427683684400,Wed Sep 05 13:59:27 +0000 2018,RT @ZekeJMiller: Woodward book source notes; Kavanaugh recommended Porter for Staff Sec job: "Foremost among those recommending him was Bre…
1037321065867956200,Wed Sep 05 12:46:29 +0000 2018,RT @SenSchumer: Judge Kavanaugh should affirm the real “Ginsburg Standard” today by standing up for women’s constitutional rights.  But he…
1037038873157795800,Tue Sep 04 18:05:09 +0000 2018,@maxwellcyoung @ChuckGrassley I wonder if he skipped his early morning run.
1036983609893285900,Tue Sep 04 14:25:33 +0000 2018,RT @NBCNews: BREAKING: Democratic senators come out firing, disrupt Senate confirmation hearing for Kavanaugh. https://t.co/nCx66RBQrq
1036974700440764400,Tue Sep 04 13:50:09 +0000 2018,Hats off to @ChuckGrassley, who can apparently read 42,000 pages of documents in a single night. #SCOTUS #WhatAreTheyHiding
1036972254373011500,Tue Sep 04 13:40:26 +0000 2018,Damn right. Other Judiciary Democrats joining in. #SCOTUS https://t.co/hdjXNNCvPx
1036971642617061400,Tue Sep 04 13:38:00 +0000 2018,Right out of the gate, @SenateDems on the Judiciary Committee are pounding the Republicans for starting a hearing w… https://t.co/ysrMLKyQPz
1036770739872034800,Tue Sep 04 00:19:41 +0000 2018,RT @SenSchumer: Republicans know this has been the least transparent SCOTUS process in history and the hearings should be delayed until we…
1036770731047235600,Tue Sep 04 00:19:39 +0000 2018,RT @SenSchumer: 🚨🚨 The Senate was just given an additional 42,000 pages of Kavanaugh documents the NIGHT BEFORE his confirmation hearing. T…
1034494297960267800,Tue Aug 28 17:33:55 +0000 2018,Senate Democrats want the government to say if GDP growth is helping the middle class https://t.co/Hy0Iy7e4Uh via @voxdotcom
1034445162687156200,Tue Aug 28 14:18:40 +0000 2018,RT @MikeDorning: BREAKING Trump hasn't delivered wage gains for American "Forgotten Man"  he promised to help. Trump boasts undercut by wag…
1034213936902459400,Mon Aug 27 22:59:51 +0000 2018,A Democrat proposing to change the name of a building from a Democrat to a Republican is... political? https://t.co/klNnD98AeB
1034176636000919600,Mon Aug 27 20:31:38 +0000 2018,Senator Schumer has submitted Senator McCain’s statement into the Congressional record. https://t.co/eJS5SaiB7M
1034175552696070100,Mon Aug 27 20:27:20 +0000 2018,Let’s turn the makeshift memorial into a timeless one by renaming the building for Senator McCain. https://t.co/92X0lIsScI
1034165820375482400,Mon Aug 27 19:48:40 +0000 2018,As it should be. https://t.co/p43c2Y7W3i
1034148264436813800,Mon Aug 27 18:38:54 +0000 2018,Showing love for his country while sharply sticking it to his opponents - in his own party - with grace, courage, a… https://t.co/sNxAI7SJgv
1034086214956142600,Mon Aug 27 14:32:20 +0000 2018,*Interment. https://t.co/kL2eklPbuD
1034083926384537600,Mon Aug 27 14:23:15 +0000 2018,Senators Schumer &amp; McConnell have requested that the @DeptofDefense provide necessary support so that U.S. flags on… https://t.co/9jWbj40R14
1034068585495388200,Mon Aug 27 13:22:17 +0000 2018,Awful. Just awful. https://t.co/20VLxWwAkR
1033516214054793200,Sun Aug 26 00:47:21 +0000 2018,Sen. Schumer is going to attempt to rename the Russell building for Senator McCain, a true American hero. https://t.co/BZMVOQf1W7
1033049761291620400,Fri Aug 24 17:53:50 +0000 2018,@burgessev @ahrferrier Hey guys!
1033040114665115600,Fri Aug 24 17:15:30 +0000 2018,There's a lot happening here.   Doesn't change the fact that Republicans are hiding Judge Kavanaugh's full record f… https://t.co/iNYIuSn3IA
1033007317418172400,Fri Aug 24 15:05:11 +0000 2018,If you haven't before, do yourself a favor this weekend and watch For Whom the Bell Tolls, or read a book about the… https://t.co/cJeb5foepY
1032307846787067900,Wed Aug 22 16:45:44 +0000 2018,RT @maxwellcyoung: Sen Wicker: "How much can you hide about a judge that has been issuing opinions for 12 years?"  Me: 98% of his records,…
1032303298534170600,Wed Aug 22 16:27:40 +0000 2018,Parliamentary inquiry: Exactly which historical precedent is Sen. Tillis citing that demands the Senate hold a hear… https://t.co/Qq6bzLExND
1032298420353093600,Wed Aug 22 16:08:17 +0000 2018,AP: Schumer wants to delay Kavanaugh confirmation   https://t.co/8nh33tiCAP
1032289501874462700,Wed Aug 22 15:32:50 +0000 2018,RT @SenSchumer: Judge Kavanaugh’s refusal to say a POTUS must comply w a duly issued subpoena &amp; Mr Cohen’s implication of POTUS in a federa…
1032043611918086100,Tue Aug 21 23:15:46 +0000 2018,Schumer after meeting with Kavanaugh: Roe v. Wade is in jeopardy https://t.co/y5A6yAqcW9
1032034587642421200,Tue Aug 21 22:39:54 +0000 2018,@jdawsey1 Nice.
1032034408948219900,Tue Aug 21 22:39:12 +0000 2018,First person to make the "at least its Friday" joke gets blocked.
1032017999706947600,Tue Aug 21 21:33:59 +0000 2018,RT @LACaldwellDC: “He would not say yes” Schumer said of Kavanaugh when he asked him if Roe was decided correctly.   Adds that “settled law…
1032000569114853400,Tue Aug 21 20:24:43 +0000 2018,The swamp is out of control today. https://t.co/JE1Ywa21Wx
1031902171288072200,Tue Aug 21 13:53:44 +0000 2018,.@chuckgrassley, who is hiding Judge Kavanaugh's records, has some jokes this morning:  "Over the course of my publ… https://t.co/kFS228JndW
1031629394341756900,Mon Aug 20 19:49:49 +0000 2018,RT @LisaMascaro: Happening now, Kavanaugh update:  Schumer making the case on the floor that all senators have access, under Senate rules,…
1031616831876948000,Mon Aug 20 18:59:53 +0000 2018,I’ll have what he’s having. https://t.co/VIkqHbVVwx
1030794826990665700,Sat Aug 18 12:33:32 +0000 2018,RT @maxwellcyoung: The NYT editorial board asks a critical question this morning.    Why Are Republicans Covering Up Brett Kavanaugh’s Past…
1030489711998103600,Fri Aug 17 16:21:07 +0000 2018,Senator @chuckgrassley is taking fire back home for the lack of transparency in the Kavanaugh confirmation process… https://t.co/R8lyvcu4oD
1030476598556934100,Fri Aug 17 15:29:01 +0000 2018,This story is troubling, and perfectly illustrates why the full Senate and public deserve access to all of Judge Ka… https://t.co/cpSRd7FJHA
1030184568597426200,Thu Aug 16 20:08:35 +0000 2018,RT @maxwellcyoung: AP: Dems say they’ll sue if they don’t get Kavanaugh documents https://t.co/sFF10JnCX1
1030157758824415200,Thu Aug 16 18:22:03 +0000 2018,RT @burgessev: Sen. Schumer says Democrats will sue Archives for Kavanaugh records if their FOIA request isn’t met
1030157715706994700,Thu Aug 16 18:21:53 +0000 2018,Schumer on Kavanaugh documents: Democrats are ready to sue the National Archives if they don’t turn over the docume… https://t.co/BPkcBQBhUw
1030146947070545900,Thu Aug 16 17:39:06 +0000 2018,RT @JesseCharlesLee: It’s become a core GOP principle: ram through sweeping, profoundly unpopular changes as fast as possible, because the…
1030143507690872800,Thu Aug 16 17:25:26 +0000 2018,The more people learn about Judge Kavanaugh, the less they like him. Maybe that's why @ChuckGrassley is hiding his… https://t.co/vnNOG3ZHKr
1029866375580409900,Wed Aug 15 23:04:12 +0000 2018,RT @maxwellcyoung: Regarding @SenateMajLdr's stmnt just now that dems should make a decision on Judge Kavanaugh based solely on judicial op…
1029813670942068700,Wed Aug 15 19:34:46 +0000 2018,RT @SenMarkey: If @SenateGOP have their way, more people will see this tweet than will have seen Kavanaugh’s full records. My opposition do…
1029796873631133700,Wed Aug 15 18:28:02 +0000 2018,Also, cc @JohnCornyn https://t.co/8utXjK9mOF
1029796400140353500,Wed Aug 15 18:26:09 +0000 2018,Happy to play this game.   “It is unreasonable to schedule the nomination hearing without knowing, when, or if, we… https://t.co/unHU3BZ2vb
1029790978658512900,Wed Aug 15 18:04:36 +0000 2018,This is totally unacceptable, and it’s not hyperbole to say this has become the least transparent #SCOTUS nominatio… https://t.co/97uRWGR01G
1027602702132564000,Thu Aug 09 17:09:10 +0000 2018,Everything about this process is shady and nuts. What on earth are Republicans so afraid of? What are they hiding?… https://t.co/4PstfMuPl4
1027591406787981300,Thu Aug 09 16:24:17 +0000 2018,Just to be crystal clear, Kavanaugh's deputy is deciding which documents get sent to the Judiciary Committee, and i… https://t.co/LjAy4AsSCs
1027538503607967700,Thu Aug 09 12:54:04 +0000 2018,RT @lizzishappell: "This extraordinary step is a last resort -- unprecedented and unfortunate but necessary to fully and fairly review Judg…
1026859261056503800,Tue Aug 07 15:55:00 +0000 2018,A thread in response to @ChuckGrassley's op-ed in the @WSJ https://t.co/9bmUWW2nvT
1025751716329861100,Sat Aug 04 14:34:01 +0000 2018,RT @maxwellcyoung: To be clear here, Judge Kavanaugh's deputy is now in charge of pre-screening Kavanaugh's records before it is turned ove…
1025384533213028400,Fri Aug 03 14:14:58 +0000 2018,@pkcapitol Thanks.
1025093123037442000,Thu Aug 02 18:57:00 +0000 2018,@EricSchultz @brianefallon @AJentleson I'll allow it.
1025091347538227200,Thu Aug 02 18:49:57 +0000 2018,AP: Dems Will Try Forcing Senate Vote Against Trump Health Plan https://t.co/IY8ENezTaM
1024685125546717200,Wed Aug 01 15:55:46 +0000 2018,Republicans just blocked funding to secure our elections.  Seriously. https://t.co/2LvVZaotVu
1024631218523058200,Wed Aug 01 12:21:33 +0000 2018,RT @maxwellcyoung: “He’s the kind of jurist that we were hoping the president would appoint,” said Penny Nance, President of Concerned Wome…
1024416615167918100,Tue Jul 31 22:08:48 +0000 2018,Senate Minority Leader Charles E. Schumer (D-N.Y.) said Tuesday morning, “It is such a break from precedent that yo… https://t.co/gz03fAjRAP
1024397565738070000,Tue Jul 31 20:53:06 +0000 2018,.@ChuckGrassley's definition of unprecedented partisanship is apparently asking that Republican #SCOTUS nominees be… https://t.co/3XQ5co0RXh
1024396599064244200,Tue Jul 31 20:49:16 +0000 2018,LOL https://t.co/xJWeG1d9cV
1024351379048026100,Tue Jul 31 17:49:34 +0000 2018,RT @SenateDems: Judge Kavanaugh said his time as Staff Secretary was “most formative” to him as a judge.  Republicans are seeking to withho…
1024347756670922800,Tue Jul 31 17:35:11 +0000 2018,I'm really unclear on who will be blamed for a shutdown. https://t.co/cARHZoQOC0
1024327229071876100,Tue Jul 31 16:13:37 +0000 2018,cc @maxwellcyoung https://t.co/7RB4NhxfmE
1024286899211526100,Tue Jul 31 13:33:21 +0000 2018,As @realdonaldtrump tells the world he made the Koch brothers richer, don't forget this one:  Trump celebrates tax… https://t.co/930qIIeRfP
1024272069087899600,Tue Jul 31 12:34:25 +0000 2018,RT @SenSchumer: Your administration approved this. What kind of incompetence and dangerous governing is this? And to check with the NRA? Ho…
1024260444314325000,Tue Jul 31 11:48:14 +0000 2018,“I made the Koch brothers richer,” is a hell of a midterm message. https://t.co/zNQhLv4WNB
1024240851847917600,Tue Jul 31 10:30:23 +0000 2018,This is a good question #SCOTUS https://t.co/6Qnx1VQvrM
1023930236801560600,Mon Jul 30 13:56:06 +0000 2018,Oh hello goalposts, I didn't see you there. https://t.co/nfXd1RtpFz
1023577320072929300,Sun Jul 29 14:33:44 +0000 2018,RT @maxwellcyoung: The NYT gets into Judge Kavanaughs’s view of exec power when it comes to torture. Turns out, we have no idea what urged…
1022170216900505600,Wed Jul 25 17:22:25 +0000 2018,This checks out. https://t.co/yVoPa4uj4T
1022161868591390700,Wed Jul 25 16:49:14 +0000 2018,Kavanaugh's nomination is already under water in the latest Q poll. #SCOTUS https://t.co/Wn17SMQszQ
1022148281042960400,Wed Jul 25 15:55:15 +0000 2018,The lengths to which @SenateGOP are going to block Judge Kavanaugh's documents from being released begs the questio… https://t.co/zdipJtd5qo
1022146694249627600,Wed Jul 25 15:48:57 +0000 2018,RT @SenateDems: How should we assess Judge Kavanaugh’s record?  His record as Staff Secretary is a critical component. But Republicans are…
1021805516903927800,Tue Jul 24 17:13:14 +0000 2018,Still waiting for @ChuckGrassley or someone else to explain this to me. https://t.co/dPgGtkWWuv
1021803471308243000,Tue Jul 24 17:05:06 +0000 2018,(2/2) "...But I also do not hesitate to say that my five and a half years in the White House – and especially my th… https://t.co/Y1Y0OmRwCc
1021803152042078200,Tue Jul 24 17:03:50 +0000 2018,Nice try, but here is what Judge Kavanaugh said (1/2)  "When people ask me which of my prior experiences has been m… https://t.co/OcTH1lEA0x
1021785567762235400,Tue Jul 24 15:53:57 +0000 2018,This is not funny. https://t.co/7xCLt1VM3r
1021765107251126300,Tue Jul 24 14:32:39 +0000 2018,RT @maxwellcyoung: About Judge Kagan, Senator @ChuckGrassley said: “In order for the Senate to fulfill its constitutional responsibility...…
1021759024486920200,Tue Jul 24 14:08:29 +0000 2018,Watch this clip of @ChuckGrassley demanding all of Elena Kagan's documents, and then explain to me why we don't des… https://t.co/N14LQjBVPt
