id,created_at,text
890817880421318700,Fri Jul 28 06:15:07 +0000 2017,These two have your back @SenSchumer @SenWarren https://t.co/5ADz1EN1UT
890812435493306400,Fri Jul 28 05:53:29 +0000 2017,Hard to think of a time I've been more proud to work for @SenSchumer than tonight. Time to work together to improve the health care law.
890811803587850200,Fri Jul 28 05:50:59 +0000 2017,Schumer: We can work together. Our country demands it.
890784564318052400,Fri Jul 28 04:02:44 +0000 2017,Tune in to the #Senate floor. Sen. Enzi is giving an impassioned defense of the @SenateGOP health care bill***  **no he's not.
890783393285251100,Fri Jul 28 03:58:05 +0000 2017,Sen. Enzi is telling us how big babies have to be to constitute "live births" in European countries.  Health care vote in minutes
890782806065807400,Fri Jul 28 03:55:45 +0000 2017,Minutes away from a vote to take health care away from 16M people and raise premiums by 20%, Sen. Enzi is holding court on  ... pensions.
890780489149063200,Fri Jul 28 03:46:33 +0000 2017,We JUST got bill text, a CBO score showing premiums going up 20%...  ... and Sen. Enzi is reading some book on the floor.
890779938713940000,Fri Jul 28 03:44:21 +0000 2017,The Republicans are making an absolutely mockery of the World's Greatest Deliberative Body tonight.
890779365444812800,Fri Jul 28 03:42:05 +0000 2017,Sen. Enzi is so proud of the @SenateGOP #TrumpCare bill that he won't answer a single question about it on the Senate floor.
890778580753551400,Fri Jul 28 03:38:58 +0000 2017,Must watch 👇 https://t.co/7cOqSXpCGa
890778470527139800,Fri Jul 28 03:38:31 +0000 2017,RT @clairecmc: So frustrating. No hearings. We were just given the bill. And now Senator Enzi is refusing to answer questions about it on t…
890777196792602600,Fri Jul 28 03:33:28 +0000 2017,RT @AP: BREAKING: Congressional Budget Office says 16 million more uninsured would result from GOP's pared-down health care bill.
890777047181611000,Fri Jul 28 03:32:52 +0000 2017,RT @yokendan: Metaphor for health debate?  Enzi: Dems won't participate Dems: Will you yield for a question?  Enzi: No. You had your chance.
890775428729905200,Fri Jul 28 03:26:26 +0000 2017,"I voted to raise your premiums by 20%" is one hell of a message for next year, @SenateGOP
890771691286265900,Fri Jul 28 03:11:35 +0000 2017,Well, it turns out we and the @USCBO were exactly accurate.  So reporters, learn from this, or whatever. https://t.co/hMovePN8xN
890770538985123800,Fri Jul 28 03:07:00 +0000 2017,Sen. Heller said "I cannot support a piece of legislation that takes insurance away from tens of millions of Americ… https://t.co/xlKjTwHs1R
890769947529556000,Fri Jul 28 03:04:39 +0000 2017,New tonight from @USCBO - the GOP bill will send premiums up 20%.  This is outrageous.
890769475372535800,Fri Jul 28 03:02:47 +0000 2017,See below, new @USCBO on "skinny" repeal bill getting a vote tonight. 16 million Americans would lose their health… https://t.co/EWqMli9CeX
890768349818474500,Fri Jul 28 02:58:18 +0000 2017,BREAKING: Official word from @USCBO - the "skinny" bill we'll vote on in an hour will cause 16M Americans to lose their health insurance
890767162742386700,Fri Jul 28 02:53:35 +0000 2017,Senator Graham literally called this bill a "disaster." https://t.co/oZAFCD0yNh
890760502879584300,Fri Jul 28 02:27:08 +0000 2017,RT @ASlavitt: JUST OUT: AMA calls Senate "Freedom" Act a "toxic prescription that would make matters worse." https://t.co/r4DVZF4xhT
890759880969261000,Fri Jul 28 02:24:39 +0000 2017,Every news director is doing it wrong right now https://t.co/jSgPINs04y
890758145345290200,Fri Jul 28 02:17:45 +0000 2017,RT @chrislhayes: The spectacle in the Senate is an absolute embarrassment and basically every conservative I know feels the same way.
890757678221447200,Fri Jul 28 02:15:54 +0000 2017,RT @daveweigel: "If the people who wrote this bill were proud of it, they wouldn’t be forcing this vote in the dead of night." -- Mitch McC…
890738624462979100,Fri Jul 28 01:00:11 +0000 2017,@adamslily Where's the fun in that?
890737049602535400,Fri Jul 28 00:53:56 +0000 2017,Nah man, you forgot to ask him to go off the record. https://t.co/c5R4pgHozy
890733654032486400,Fri Jul 28 00:40:26 +0000 2017,Or what the bill will be. https://t.co/02WDVPXAix
890731534306693100,Fri Jul 28 00:32:01 +0000 2017,Key line: The House could, according to the rules, still pass the skinny bill if the conference comes up empty https://t.co/8eFP7e9JLn
890724919016906800,Fri Jul 28 00:05:44 +0000 2017,RT @LoopEmma: uhhhh no, he didn’t https://t.co/THUWRGEzdn
890722619913318400,Thu Jul 27 23:56:36 +0000 2017,Which is all that matters https://t.co/XyefUnwQlj
890720781310849000,Thu Jul 27 23:49:17 +0000 2017,The Speaker did not guarantee the Senate bill wouldn't become law, period.  Everything else is fluff, unless you're… https://t.co/SrIWHfCY08
890704791030181900,Thu Jul 27 22:45:45 +0000 2017,@SenateGOP You were completely right then, Mr. Secretary 6/ https://t.co/mLkzSXoFxK
890704655793213400,Thu Jul 27 22:45:13 +0000 2017,@SenateGOP Yes, Congresswoman, I do agree 5/ https://t.co/13iWwmd9hm
890704520073945100,Thu Jul 27 22:44:40 +0000 2017,Remember when the @SenateGOP was upset about bills written in secret? 4/ https://t.co/C9K1dha5ma
890704337978183700,Thu Jul 27 22:43:57 +0000 2017,Ah yes, this one from Sen. McCain 3/ https://t.co/21piFIHJ8Q
890704205824000000,Thu Jul 27 22:43:25 +0000 2017,There is this fun one from the Vice President 2/ https://t.co/Mx0C37o4oo
890703901900644400,Thu Jul 27 22:42:13 +0000 2017,I'm just going to RT a few of these while we wait for the GOP healthcare bill to emerge from... behind closed doors… https://t.co/0g6p9t2vr4
890696458688766000,Thu Jul 27 22:12:38 +0000 2017,Oh cool, did he have the bill text? https://t.co/pOYXoTf9BP
890686021398143000,Thu Jul 27 21:31:10 +0000 2017,We are truly through the looking glass. https://t.co/Y3obfaZfCH
890684984159338500,Thu Jul 27 21:27:03 +0000 2017,Anybody else remember a press conference where senators announced they'll vote yes *only* if the bill doesn't become law?  Ever?
890684594424557600,Thu Jul 27 21:25:30 +0000 2017,RT @jonfavs: Ryan can give Graham all the assurances he wants, but if the conference fails, he can also pass the skinny bill into law. So t…
890683327107256300,Thu Jul 27 21:20:27 +0000 2017,Free idea for these senators:  Vote no. https://t.co/IHTWgAKz05
890679520000389100,Thu Jul 27 21:05:20 +0000 2017,RT @EricSchultz: which is why the GOP Senate "moderates" talking about conference are a few news cycles behind. https://t.co/feKM1pi0p9
890675408714309600,Thu Jul 27 20:49:00 +0000 2017,RT @jim_newell: So McConnell says Ryan has pledged to go to conference, but Ryan's own spox says conference is "one option" https://t.co/vP…
890674704884707300,Thu Jul 27 20:46:12 +0000 2017,This 👇 https://t.co/UphJCpHn8P
890674372150607900,Thu Jul 27 20:44:52 +0000 2017,House Republicans are ensuring that they can just pass the "skinny" repeal bill w/o conference.  CC any wavering… https://t.co/1iov6Fd9mK
890674090494668800,Thu Jul 27 20:43:45 +0000 2017,Time for the @WhiteHouse to get the Kremlin on the phone &amp; get their marching orders on the sanctions bill headed t… https://t.co/g4cS9MKvrD
890665808715669500,Thu Jul 27 20:10:51 +0000 2017,Ok. It's the "Freedom from Heath Care" bill. https://t.co/Ky4AKFjtGO
890664811117162500,Thu Jul 27 20:06:53 +0000 2017,So. Don't. Vote. For. It. https://t.co/UXImUCCDGa
890662154646335500,Thu Jul 27 19:56:20 +0000 2017,This means the House would possibly jam through "skinny" repeal. https://t.co/0vkTWp7KMJ
890646372533325800,Thu Jul 27 18:53:37 +0000 2017,Stop and think about this for a second:  Republicans want assurances that what they pass won't become law. It must… https://t.co/fx52cbMBaA
890645038744559600,Thu Jul 27 18:48:19 +0000 2017,RT @PattyMurray: If this Trumpcare bill goes thru &amp; conference starts w the House, every Senate R who votes for it is OK sending it straigh…
890636151844819000,Thu Jul 27 18:13:00 +0000 2017,RT @AliceOllstein: Daines says "skinny repeal" is "just a means to an end," compared it to a motion to proceed. Didn't answer when told Hou…
890633461639159800,Thu Jul 27 18:02:19 +0000 2017,RT @samstein: Senate GOP aide tells me the expectation is there WILL be a conference with House passing ‘skinny’ if no agreement can be rea…
890632759844020200,Thu Jul 27 17:59:31 +0000 2017,This is a huge deal. Any @SenateGOP who thinks voting for "skinny" repeal just gets them into conference is kidding… https://t.co/YuYT4fJiZz
890631377174921200,Thu Jul 27 17:54:02 +0000 2017,Crazy idea: if you don't want a bill to become a law, don't vote for it. https://t.co/TL3lQ2O7Qm
890628938749182000,Thu Jul 27 17:44:20 +0000 2017,Bingo. This is not just a "vote to get into conference."  The @SenateGOP is playing with live fire. It could become… https://t.co/XXy7J1rDmv
890619364554063900,Thu Jul 27 17:06:18 +0000 2017,RT @ddiamond: GOP bill is shrinking—but don’t confuse “skinny repeal” with no impact. CBO still projects millions more uninsured.  https://…
890614151181201400,Thu Jul 27 16:45:35 +0000 2017,"Pilots like to know where they're going to land when they take off &amp; we should too."  - Sen. Alexander, literally… https://t.co/JQsA3OttH9
890590625871134700,Thu Jul 27 15:12:06 +0000 2017,@emmarieNYT Not that I know of, but this @wuerker cartoon is pretty great. https://t.co/CTsuKk2O15
890590407247188000,Thu Jul 27 15:11:14 +0000 2017,Schumer says of @Scaramucci comments on Russia: I know bull when I hear it. https://t.co/1CJWjGsqa0
890583242109333500,Thu Jul 27 14:42:45 +0000 2017,This "rumor" is really dumb. https://t.co/A80TCTIPcC
890574055086207000,Thu Jul 27 14:06:15 +0000 2017,What, on the back of the napkins they have in there? https://t.co/DSA2KkNcvF
890573087099498500,Thu Jul 27 14:02:24 +0000 2017,On the morning the Senate is set to vote, the new WH communications director did an excellent job selling #TrumpCare on @NewDay.
890535520874491900,Thu Jul 27 11:33:08 +0000 2017,Literally no Republican, including the President, has promised over the past 7 years to pass a bill to increase pre… https://t.co/zgLzGeBaQC
890534636404781000,Thu Jul 27 11:29:37 +0000 2017,Odd choice to have his administration lobby to water them down then. https://t.co/mvyHPFAGUN
890534007800201200,Thu Jul 27 11:27:07 +0000 2017,Scaramucci on @NewDay claiming @realDonaldTrump may veto the Russia sanctions bill because he wants a tougher bill is... rich.
890526530945855500,Thu Jul 27 10:57:24 +0000 2017,RT @samstein: less than 24 hours to go: no one’s seen the bill no hearings on the bill estimates 16m losing coverage 1/6 of economy at stak…
890384245826433000,Thu Jul 27 01:32:01 +0000 2017,CBO: ‘Skinny repeal’ could boost uninsured by 16 million https://t.co/aeZAhJMd7B
890373362194710500,Thu Jul 27 00:48:46 +0000 2017,Maybe if they actually produce a bill, people would believe them? https://t.co/kOylXgyNX1
890373175091056600,Thu Jul 27 00:48:01 +0000 2017,Score is here: https://t.co/Dc5r0n5cor https://t.co/8Io9eQEuEh
890362755198447600,Thu Jul 27 00:06:37 +0000 2017,@burgessev Kasich is on it.
890362111301492700,Thu Jul 27 00:04:04 +0000 2017,Bipartisan governors write to @SenateMajLdr &amp; @SenSchumer urging the Senate to reject "skinny" repeal bill. 👇 https://t.co/hN0B8zPzt0
890354768144728000,Wed Jul 26 23:34:53 +0000 2017,Here is the @USCBO chart showing reported "skinny" bill will result in 16M losing coverage https://t.co/LnSNluPIWA
890350280931409900,Wed Jul 26 23:17:03 +0000 2017,BREAKING: We just got the @USCBO score of the reported "skinny" bill  -16M more uninsured - premiums up by roughly 20%
890309097748299800,Wed Jul 26 20:33:24 +0000 2017,I raise a point of order against the motion. https://t.co/Mq8F4t1mWr
890304186235138000,Wed Jul 26 20:13:53 +0000 2017,The straight repeal vote has failed.  You are NOW free to tweet that fact without drawing the ire of @seungminkim
890270215522615300,Wed Jul 26 17:58:54 +0000 2017,A sure sign that the bill is going to be very, very good for the American people 👇 https://t.co/CuMqmch55B
890265427451969500,Wed Jul 26 17:39:52 +0000 2017,The President needs to read every single word of this story. Every. Single. Word. @realDonaldTrump https://t.co/mY3mvRpwV0
890245819877732400,Wed Jul 26 16:21:58 +0000 2017,Sen. Cornyn lays it out, skinny repeal is path to House bill:  "We use the template of the House bill" https://t.co/OMNHYy4Qck
890208049381691400,Wed Jul 26 13:51:52 +0000 2017,RT @seungminkim: .@SenSchumer: "Skinny repeal is equal to whole repeal."
890207505749602300,Wed Jul 26 13:49:43 +0000 2017,Remember, there is a Trump tweet for everything 👇 https://t.co/pHfd4hVwtg
890207202253955100,Wed Jul 26 13:48:30 +0000 2017,So they're saying @realDonaldTrump made military decisions based on something other than the national security of t… https://t.co/WYfq1p6MsB
890205867320238100,Wed Jul 26 13:43:12 +0000 2017,1) That's disgusting. 2) That political calculus is moronic. https://t.co/eLIYpjkCe9
890195071563436000,Wed Jul 26 13:00:18 +0000 2017,And I think @BenSasse has to RT with "Nickleback" here. https://t.co/20ZIjPyOgh
890194931666616300,Wed Jul 26 12:59:45 +0000 2017,...any more winning. There has been too much winning, and we're all tired of it. Thank you. https://t.co/20ZIjPyOgh
890019851691077600,Wed Jul 26 01:24:03 +0000 2017,RT @rcohen: .@USATODAY: The Senate's health care sham https://t.co/9QmNx2Ysc1
889991413236215800,Tue Jul 25 23:31:02 +0000 2017,"So this morning, I'm watching Fox News..." - @realDonaldTrump   Yeah, we know.
889925001868189700,Tue Jul 25 19:07:09 +0000 2017,RT @jbendery: After this vote to take up some kind of Obamacare repeal bill, Senate Dems heading to the Senate steps, per Schumer's office.
889902215967776800,Tue Jul 25 17:36:36 +0000 2017,RT @JWGOP: Senate GOP: You wlll shortly own bad policy &amp; worse politics, hurting millions. And Trump will drop you in hot grease with Sessi…
889897419735015400,Tue Jul 25 17:17:33 +0000 2017,And trashed the House bill as "mean" after the House GOP voted for it... https://t.co/a61vVXvRJn
889885611762618400,Tue Jul 25 16:30:37 +0000 2017,Sen. Paul has never been about "better than nothing."  He is playing along because this is a path to #TrumpCare, pl… https://t.co/lBNXd7KYRa
889883301015695400,Tue Jul 25 16:21:26 +0000 2017,Because 2017, or maybe to head off a constitutional crisis https://t.co/Ilg3JCes3I
889869743397711900,Tue Jul 25 15:27:34 +0000 2017,Let's be clear. "Skinny repeal" has never been Paul's endgame. If you play along w/this, you're complicit in a path… https://t.co/MRdGwf4gS1
889823572281184300,Tue Jul 25 12:24:06 +0000 2017,As President Truman once said, "The buck stops in Congress." https://t.co/chnFyo7pVx
889794961868193800,Tue Jul 25 10:30:25 +0000 2017,Pay no attention to his last few Tweets, @SenateGOP.  I'm sure he'll have your back after you vote for #TrumpCare https://t.co/1u9RsC5cVX
889595446552907800,Mon Jul 24 21:17:36 +0000 2017,Looks like the @WhiteHouse got a call from Moscow last night. https://t.co/ecHT9e0hAM
889562402777440300,Mon Jul 24 19:06:18 +0000 2017,RT @daveweigel: tfw you've spent seven years attacking Dems for not being transparent about what was in Obamacare https://t.co/JMmE8Forih
889535274698629100,Mon Jul 24 17:18:30 +0000 2017,RT @cspan: Congressional Democrats unveil #ABetterDeal Agenda – LIVE on C-SPAN2 https://t.co/zVkiAVDVqB https://t.co/eCTxLg8GxE
889507169929920500,Mon Jul 24 15:26:50 +0000 2017,RT @RonaldKlain: Great to see @SenateDems leading -- fighting to STOP Trumpcare, and put forward good ideas.  We can do both at the same ti…
889489004508450800,Mon Jul 24 14:14:39 +0000 2017,RT @SenSchumer: Democrats have a clear message: the American people deserve #ABetterDeal. Read more on our plan: https://t.co/nfPfSNtozs
889460274721423400,Mon Jul 24 12:20:29 +0000 2017,RT @sahilkapur: NEW: Democrats Chart Path Back to Power From Electoral Wildnerness  https://t.co/GeFPpp7oUI
889456156179124200,Mon Jul 24 12:04:07 +0000 2017,Correct 👇 https://t.co/tkO4Pouk4z
889444410240495600,Mon Jul 24 11:17:27 +0000 2017,RT @AP_Politics: Democratic party tries to rebrand itself after bruising presidential election, puts focus on jobs: https://t.co/mHgqfmZv0x
889443526509043700,Mon Jul 24 11:13:56 +0000 2017,@seungminkim Sad!
889439154488172500,Mon Jul 24 10:56:34 +0000 2017,Nice try, Mr. President. https://t.co/taVV4S1IMc
889438689817964500,Mon Jul 24 10:54:43 +0000 2017,RT @SenateDems: We believe government should work for you &amp; for the millions of hard working Americans who just need #ABetterDeal. Here's o…
889437924353351700,Mon Jul 24 10:51:40 +0000 2017,WATCH the @SenateDems video unveiling our new economic agenda: A Better Deal #ABetterDeal https://t.co/4fAo0aR494
889426668825313300,Mon Jul 24 10:06:57 +0000 2017,Democrats launch  economic agenda ahead of 2018 campaign #ABetterDeal https://t.co/GluK6tNnYj
889426239320199200,Mon Jul 24 10:05:14 +0000 2017,WSJ: Democrats Pitch Populist Election Agenda #ABetterDeal https://t.co/W3iItLV71u via @WSJ
889425500355080200,Mon Jul 24 10:02:18 +0000 2017,Read Chuck Schumer in the @nytimes: A Better Deal for American Workers #ABetterDeal https://t.co/X2RAJ43bo8
889294394192539600,Mon Jul 24 01:21:20 +0000 2017,Maybe he'll tell Republicans which bill "they're" voting on! https://t.co/7rF2DFbsX1
889286401015128000,Mon Jul 24 00:49:34 +0000 2017,This headline is both completely accurate and insane.  https://t.co/MMIQw3n4eL
889221813645037600,Sun Jul 23 20:32:55 +0000 2017,Is the President upset about the Russia sanctions bill that should soon be on his desk? https://t.co/vRI1n4VyfS
889168517907583000,Sun Jul 23 17:01:09 +0000 2017,RT @JohnJHarwood: brilliant https://t.co/Qj1ML06I5G
889146625934970900,Sun Jul 23 15:34:09 +0000 2017,RT @PoliticoKevin: Schumer says the new Democratic agenda will include going after Rx companies, stepping up antitrust https://t.co/zbXrKqY…
889140854023213000,Sun Jul 23 15:11:13 +0000 2017,The first move of this Republican congress was to put reconciliation on the floor, making clear GOP was only intere… https://t.co/jKpBqXojic
889120959826985000,Sun Jul 23 13:52:10 +0000 2017,RT @ThisWeekABC: .@SenSchumer tells @GStephanopoulos: "The number one thing that we did wrong is we didn't tell people what we stood for."…
888833932363526100,Sat Jul 22 18:51:37 +0000 2017,RT @timkaine: Awesome rally to protect health care today at @RoanokeCollege. Thanks to all who came out. I'm going to do everything I can t…
888413480876998700,Fri Jul 21 15:00:54 +0000 2017,@MattLaslo Consider it refuted
888170253896822800,Thu Jul 20 22:54:24 +0000 2017,RT @ddiamond: Inbox: AARP letter to senators, warning that they’ll tell their 38 million members about every GOP vote on repeal. https://t.…
888163838515961900,Thu Jul 20 22:28:55 +0000 2017,Is this the hill version of @Acosta tweeting his socks from the WH briefing room, PK? https://t.co/dJJmVTzpQ4
888111545724448800,Thu Jul 20 19:01:07 +0000 2017,I half expect @realDonaldTrump to RT this with "No I don't" https://t.co/4ryqkpBtap
888081182872805400,Thu Jul 20 17:00:28 +0000 2017,They're all awful. https://t.co/680dH2Cdlr
888073117423349800,Thu Jul 20 16:28:25 +0000 2017,RT @AP_Politics: BREAKING: Congressional Budget Office: Revised GOP health bill would increase number of uninsured people by 22 million in…
888048659471978500,Thu Jul 20 14:51:14 +0000 2017,This was a good day. https://t.co/abhl8HgKVg
888023581317365800,Thu Jul 20 13:11:35 +0000 2017,RT @jmartNYT: He didn't just hold fast in Hanoi: an 80-year-old man w brain cancer pushed self to exhaustion this year to reassure the worl…
887827454416519200,Thu Jul 20 00:12:14 +0000 2017,Wishing Senator McCain the very best https://t.co/BafFcsHl4Y
887819942107787300,Wed Jul 19 23:42:23 +0000 2017,Read. Every. Word. https://t.co/heJhdfiUiK
887797389628780500,Wed Jul 19 22:12:46 +0000 2017,RT @SenateDems: Sen. Cotton (R-AR) in January: "I don’t think we can just repeal Obamacare and say we’re going to get the answer two years…
887787405142609900,Wed Jul 19 21:33:06 +0000 2017,RT @JohnJHarwood: CBO says GOP's Obamacare repeal-only bill "would destabilize the (individual insurance) market, and the effect would wors…
887786824286031900,Wed Jul 19 21:30:47 +0000 2017,This is what the @SenateGOP and @realDonaldTrump are trying desperately to pass 👇 https://t.co/wqqAeJgRFt
887657588183232500,Wed Jul 19 12:57:15 +0000 2017,You called it "mean." https://t.co/sONEBmLBD0
887458080543453200,Tue Jul 18 23:44:29 +0000 2017,Same White House that, despite Don Jr. emails, clung to the "it was about adoptions" defense of Trump Tower meeting… https://t.co/n35q9cbsWx
887452824350621700,Tue Jul 18 23:23:36 +0000 2017,@jestei If you get on the drink, the first amendment will be from the bottle of bourbon you purchased in 2015.
887452416911822800,Tue Jul 18 23:21:58 +0000 2017,President @realDonaldTrump had 2 more meetings with Putin than he did with @SenateDems during Senate health care debate.  America first?
887450704381608000,Tue Jul 18 23:15:10 +0000 2017,"I'm not going to own this" says the President actively undermining the American health care system https://t.co/YqTrEL63On
887449668367650800,Tue Jul 18 23:11:03 +0000 2017,Has the right started attacking Obama for secret meetings with foreign leaders from countries that didn't meddle in our elections yet?
887447445344596000,Tue Jul 18 23:02:13 +0000 2017,RT @jameshohmann: Trump complains about vacancies, but it was widely reported on MARCH 9 he planned to nominate Jon Huntsman. Only getting…
887446434399879200,Tue Jul 18 22:58:12 +0000 2017,The good news is we'll get lots of truthful answers about what happened from the White House press staff at tomorro… https://t.co/n8trmgQrh4
887374231809511400,Tue Jul 18 18:11:18 +0000 2017,Aged well 👇 https://t.co/JsBaIXwRKf
887371488063610900,Tue Jul 18 18:00:23 +0000 2017,The President would be wise to remember his own Tweet https://t.co/ESXOvbKnmX
887326751248068600,Tue Jul 18 15:02:37 +0000 2017,Put another way, he's not interested in keeping premiums down for millions of Americans. https://t.co/kY2FmRvaQm
887324903954886700,Tue Jul 18 14:55:17 +0000 2017,Schumer: the door to bipartisanship is open right now. Republican leadership only needs to walk through it.
887324025944510500,Tue Jul 18 14:51:48 +0000 2017,Schumer on @SenateGOP repeal effort: It's time to move on. Urges GOP to work with Dems to stabilize markets &amp; improve health care system
887321524797136900,Tue Jul 18 14:41:51 +0000 2017,Heads up - @SenSchumer will speak on the #Senate floor re: health care momentarily.
887318184260513800,Tue Jul 18 14:28:35 +0000 2017,He's right. https://t.co/2BSzPsWB0H
887315980799672300,Tue Jul 18 14:19:50 +0000 2017,RT @EricSchultz: True. Also true: Dems, under @SenSchumer, have shown complete unity. https://t.co/DB8sqWPlD2
887315327318724600,Tue Jul 18 14:17:14 +0000 2017,Nothing about this would be "stable." Experts agree markets would unravel, and @SenateMajLdr rejected this approach… https://t.co/HOCSsKsphC
887312668020940800,Tue Jul 18 14:06:40 +0000 2017,What it would do is raise premiums and throw millions off their coverage.  That door is open now. Republicans just… https://t.co/jD57iSdVuf
887310558038556700,Tue Jul 18 13:58:17 +0000 2017,Well he's right to be skeptical, because @USCBO said premiums wouldn't go down, they'd go up by 100% https://t.co/oWQ6WPRORH
887303248662720500,Tue Jul 18 13:29:14 +0000 2017,To state the obvious, you still would not have had the votes. https://t.co/VFv4FyZmdz
887291246506639400,Tue Jul 18 12:41:32 +0000 2017,Nobody does it better. https://t.co/0e2wwVqPp0
887168329974263800,Tue Jul 18 04:33:07 +0000 2017,RT @jdawsey1: WSJ editorial posted tonight on Trump ain't a good one for the presidency, his aides, his family or his fans.  https://t.co/1…
887148855082594300,Tue Jul 18 03:15:44 +0000 2017,You don't have to imagine it, it already exists.   32 million lose coverage and premiums go up. https://t.co/MiY3fSFoM0
887146304933122000,Tue Jul 18 03:05:36 +0000 2017,RT @mkraju: The next question for GOP senators is will they vote to proceed to the House health care bill, which many of them panned and sa…
887122099130826800,Tue Jul 18 01:29:25 +0000 2017,RT @brianefallon: Numerous polls show public believes Trump owns what happens in healthcare system now. https://t.co/uNXifOsG7O
887107794423476200,Tue Jul 18 00:32:34 +0000 2017,RT @seungminkim: !!!!!!!!!! https://t.co/cZY16iXEQl
887069571454292000,Mon Jul 17 22:00:41 +0000 2017,#MadeInAmerica week is just crushing it https://t.co/wlKuBk4PXa
887067868587753500,Mon Jul 17 21:53:55 +0000 2017,[Googles "boiled owl"] https://t.co/w2d4vqM2QD
886974024429047800,Mon Jul 17 15:41:01 +0000 2017,Democrats demand GOP health care bill hearings @CNNPolitics https://t.co/HwMZQhUELp
886969413072769000,Mon Jul 17 15:22:41 +0000 2017,Senate Dems Welcome Repeal Delay: Now You Can Have Hearings, Mitch! https://t.co/mhsJHAlWqF via @TPM
886967373718335500,Mon Jul 17 15:14:35 +0000 2017,Is one of them The Trump Collection or not so much?   Not #MadeInAmerica https://t.co/dMQrLqSpm0
886961884540403700,Mon Jul 17 14:52:46 +0000 2017,RT @MKhan47: Top Dems are calling on McConnell to hold public hearings on the revised health care bill now that the  vote has been delayed.…
886961241121595400,Mon Jul 17 14:50:13 +0000 2017,RT @LauraLitvan: Senate Democratic leaders urge McConnell to use the pause in health care debate to hold public hearings https://t.co/v2E1j…
886960714182791200,Mon Jul 17 14:48:07 +0000 2017,Dems on health care delay: Maybe have some hearings? via @axios https://t.co/J8fKW8Cm0t
886960616195461100,Mon Jul 17 14:47:44 +0000 2017,In which the @SenateGOP brags about their opioid plan, which @JohnKasich likened to "spitting into the ocean." Pathetic 👇
