id,created_at,text
960554404586848300,Mon Feb 05 16:43:10 +0000 2018,@KristenOrthman @Rmcconaghy This whole thread makes me sad.
960515711528570900,Mon Feb 05 14:09:25 +0000 2018,RT @RepAdamSchiff: Mr. President, I see you’ve had a busy morning of “Executive Time.” Instead of tweeting false smears, the American peopl…
960185350416158700,Sun Feb 04 16:16:41 +0000 2018,Schumer to Trump: Release Democratic memo https://t.co/u2LHn78m8D via @politico
960177109544169500,Sun Feb 04 15:43:56 +0000 2018,RT @SenSchumer: Mr. President, as a matter of fundamental fairness, after the release of the #NunesMemo, the Democratic memo spearheaded by…
960173880773152800,Sun Feb 04 15:31:07 +0000 2018,See @SenSchumer's letter to @realDonaldTrump calling for the president to support releasing the Schiff memo https://t.co/fxyJ45YdSQ
960173482561753100,Sun Feb 04 15:29:32 +0000 2018,In a new letter to @realDonaldTrump, Schumer calls on the president to support the release of @RepAdamSchiff's memo
960160273658204200,Sun Feb 04 14:37:02 +0000 2018,He's not wrong. https://t.co/yi4c8J0Zv3
960159326160719900,Sun Feb 04 14:33:16 +0000 2018,RT @ABCPolitics: Rep. Adam Schiff: "If this was oversight, the committee members would want to read the underlying documents...The interest…
960156596197355500,Sun Feb 04 14:22:26 +0000 2018,Update: They're already accusing the @Patriots of cheating as a coping mechanism. https://t.co/m5I4rEc5vh
960151366348963800,Sun Feb 04 14:01:39 +0000 2018,@JakeSherman @Eagles Must credit
960149435090161700,Sun Feb 04 13:53:58 +0000 2018,Can report that the 9 AM Amtrak from NY to DC is full of soon-to-be disappointed @Eagles fans #SuperBowlLII
959925453917249500,Sat Feb 03 23:03:57 +0000 2018,Paul Ryan Deletes Tweet Lauding a $1.50 Benefit From the New Tax Law via @NYTimes https://t.co/XDq1oOUwC7
959919173018243100,Sat Feb 03 22:38:59 +0000 2018,RT @SenateDems: Why Did Speaker Ryan delete this tweet?  Maybe because the GOP wants you to thank them for $1.50 per week but corporations…
959537684594249700,Fri Feb 02 21:23:06 +0000 2018,You guys remember Trump's first State of the Union a few years back? https://t.co/fNZNCOIFPU
959530010683084800,Fri Feb 02 20:52:36 +0000 2018,[Whispers] There were Republican holds on her nomination... https://t.co/xX32ycrXOu
959523084255531000,Fri Feb 02 20:25:05 +0000 2018,RT @ktumulty: Sentence buried in GOP memo may undercut Trump efforts to discredit Russia probe with @postroz https://t.co/cXwn55dU2h
959505802229964800,Fri Feb 02 19:16:24 +0000 2018,Top Democrats warn Trump not to attempt obstruction of justice https://t.co/tFdvoWtmct
959496844391997400,Fri Feb 02 18:40:48 +0000 2018,In fact it literally says that it was started by the Papadopoulos information. Which we already knew.  The Nunes no… https://t.co/IuAVuAnOO0
959488312951169000,Fri Feb 02 18:06:54 +0000 2018,Schumer &amp; Senate/House Dems just sent a letter to @realDonaldTrump urging him not to fire Mueller, warning it could… https://t.co/d7BxSiSH8s
959474125755617300,Fri Feb 02 17:10:32 +0000 2018,Not a “narrative” that this is a partisan exercise. It’s just a fact. https://t.co/OUtcgPDpxY
959473907265888300,Fri Feb 02 17:09:40 +0000 2018,RT @chucktodd: Not a good look by the House GOP to release cherry picked excerpts through friendly media outlets in order to build a narrat…
959471971753955300,Fri Feb 02 17:01:58 +0000 2018,RT @HeidiPrzybyla: CARTER PAGE WAS UNDER SURVEILLANCE IN 2013.  FOR ANYONE NOT PAYING ATTENTION, THAT WAS WELL BEFORE STEELE DOSSIER. https…
959459541783138300,Fri Feb 02 16:12:35 +0000 2018,RT @BetoORourke: I have read both memos (Nunes &amp; minority report). What POTUS &amp; enablers are doing w selective release of misleading &amp; inco…
959446353410756600,Fri Feb 02 15:20:10 +0000 2018,As retailers herald tax savings, they're still closing stores and laying off workers #GOPTaxScam https://t.co/lL5Ly9MTLn
959189216637964300,Thu Feb 01 22:18:24 +0000 2018,This is a joke, right? https://t.co/mHit6pNW34 via @HuffPostPol
959136381799977000,Thu Feb 01 18:48:27 +0000 2018,This letter is responsive to approximately none of the questions that were raised about these visits. https://t.co/EpNSVFzoFe
959135844102746100,Thu Feb 01 18:46:19 +0000 2018,🤔 https://t.co/eetXTsV5YU
959128393257234400,Thu Feb 01 18:16:43 +0000 2018,What's missing from this letter?  Anything resembling a denial that sanctions were discussed with the Russians, one… https://t.co/oGOuY76oHt
959120303539580900,Thu Feb 01 17:44:34 +0000 2018,Well there is bipartisan opposition to his plan... maybe that's what the media meant? https://t.co/n6xCUFB9Ig
959096626160767000,Thu Feb 01 16:10:29 +0000 2018,Schumer, Pelosi asks Ryan to intervene in memo's release @CNNPolitics https://t.co/CqjKPIPzZ2
959058565414694900,Thu Feb 01 13:39:15 +0000 2018,Top Democrat questions US meeting with Russian spy chiefs (from @AP) https://t.co/bhqPnqTlEo
958918450793123800,Thu Feb 01 04:22:29 +0000 2018,RT @mkraju: Schumer to Ryan on latest controversy: “If Speaker Ryan cares about the integrity of the House or the rule of law, he will put…
958905139649237000,Thu Feb 01 03:29:35 +0000 2018,RT @LauraLitvan: Chuck Schumer calls on Speaker Ryan to end the “charade” after  discovering that the GOP memo transmitted to the White Hou…
958903643809419300,Thu Feb 01 03:23:38 +0000 2018,If Speaker Ryan cares about the integrity of the House or the rule of law, he will put an end to this charade once and for all. 3/3
958903445225865200,Thu Feb 01 03:22:51 +0000 2018,attack our law enforcement and intelligence officials, and now to mislead his House colleagues. 2/
958903225779916800,Thu Feb 01 03:21:59 +0000 2018,Schumer: Its clear that Chairman Nunes will seemingly stop at nothing to undermine the rule of law and interfere wi… https://t.co/jFEHdjrEC0
958900502124736500,Thu Feb 01 03:11:09 +0000 2018,Nunes is an absolute embarrassment as Intel Chairman.  He'll stop at absolutely nothing to undermine this probe. https://t.co/nLfURiH26M
958817891431911400,Wed Jan 31 21:42:53 +0000 2018,Every pillar of the GOP campaign to undermine the FBI and special counsel eventually crumbles under scrutiny. https://t.co/MDvfK756uU
958724541236334600,Wed Jan 31 15:31:57 +0000 2018,If this were really true, that @realDonaldTrump wants "everything out," then he'd support the release of both memos. https://t.co/pApL1UBSq1
958707360557609000,Wed Jan 31 14:23:41 +0000 2018,This should be a very simple yes or no answer. https://t.co/sgHugUqH24
958548572479242200,Wed Jan 31 03:52:43 +0000 2018,Rep. Kennedy brought the unity tonight.  President Trump forgot his. #WeChooseBoth
958547018737246200,Wed Jan 31 03:46:32 +0000 2018,Schumer on #SOTU: After a long and divisive year, many Americans were yearning for the President to present a unify… https://t.co/QDka5vXxzK
958543301195567100,Wed Jan 31 03:31:46 +0000 2018,Good one. https://t.co/5lPRAaKaqe
958528778325626900,Wed Jan 31 02:34:04 +0000 2018,RT @chucktodd: The message tonight would be better received if he practiced what he’s preaching tonight about setting “aside our difference…
958502610201464800,Wed Jan 31 00:50:05 +0000 2018,This is a brutal, effective, and downright patriotic take-down of #ReleaseTheMemo by @amandacarpenter. Bravo.  cc… https://t.co/iYAGVze9uh
958499982084014100,Wed Jan 31 00:39:38 +0000 2018,“This is a serious national security issue,” Schumer told reporters. “Russia hacked our elections. We sanctioned th… https://t.co/ueSOsdF3iW
958499433750069200,Wed Jan 31 00:37:27 +0000 2018,The GOP effort to undermine the Russia probe is unraveling. Now "Chairman" Nunes won't even say if he worked with t… https://t.co/DnlFq6S1Eu
958498524131360800,Wed Jan 31 00:33:50 +0000 2018,Why on earth is the @realDonaldTrump administration taking meetings with top Kremlin spies, who are supposed to be… https://t.co/qLoI7SFdx7
958497230935162900,Wed Jan 31 00:28:42 +0000 2018,His "Russian counterparts" who head the intel agencies that helped hack our elections.   One week before the Trump… https://t.co/fDVMvmtKSj
958487591212417000,Tue Jan 30 23:50:24 +0000 2018,I forgot about that photo. That was a good time. https://t.co/7KQdNuohm6
958442191617253400,Tue Jan 30 20:50:00 +0000 2018,Senate Democrats Ask Why Trump Let Russian Spy Chief Into United States https://t.co/UkQh6YqZLj via @RollCall
958433456777846800,Tue Jan 30 20:15:17 +0000 2018,Democrats blast Trump as soft on Putin with no Russia sanctions https://t.co/LuAx2IdGZU
958427268925263900,Tue Jan 30 19:50:42 +0000 2018,We should get Sen. McConnell a subscription to the failing @nytimes https://t.co/nD6EKDWKHz https://t.co/h3yIjzdlMp
958426443582771200,Tue Jan 30 19:47:25 +0000 2018,RT @ABC: Sen. Chuck Schumer: "Instead of spending all his time attempting to undermine the credibility of the FBI...the president should tr…
958426400356216800,Tue Jan 30 19:47:15 +0000 2018,Schumer presses Trump on report that Russian under sanctions entered U.S. https://t.co/5iOaxKJah6
958423419309174800,Tue Jan 30 19:35:24 +0000 2018,RT @LisaDNews: DEMS POUNDING @realDonaldTrump for not implementing Russia sanctions... here @SenatorShaheen holds up sanction list and says…
958421223423299600,Tue Jan 30 19:26:40 +0000 2018,Hard to argue with the truth #SOTU https://t.co/j7AGk8VA2X
958414132360904700,Tue Jan 30 18:58:30 +0000 2018,And right before he decided not to implement them, @realDonaldTrump officials allowed the head of Russian foreign i… https://t.co/TdwDruPrkt
958402603842457600,Tue Jan 30 18:12:41 +0000 2018,Mr. Naryshkin is banned from entering the United States because of sanctions, but somebody in the @realDonaldTrump… https://t.co/GVBc84LrDH
958366609567109100,Tue Jan 30 15:49:39 +0000 2018,Schumer: The White House and Congressional Republicans' attacks on Mueller and his investigation make you believe i… https://t.co/irdobaaW6c
958366255882305500,Tue Jan 30 15:48:15 +0000 2018,Schumer: I call on @realDonaldTrump tonight to use his #SOTU to tell Americans what he plans to do about Russian at… https://t.co/72x4lH7yFV
958364268986011600,Tue Jan 30 15:40:21 +0000 2018,Schumer - Two words we probably won't hear from @realDonaldTrump on the economy in tonight's #SOTU: #ThanksObama
958345341870510100,Tue Jan 30 14:25:09 +0000 2018,RT @SenSchumer: Doubt Putin’s trolls will retweet this one. They are too busy joining Trump’s allies pushing their #recklessrelease of the…
958332897743732700,Tue Jan 30 13:35:42 +0000 2018,Pfizer's announcement of an $11B tax windfall comes after they announced a $10B stock buyback and laid off 300 empl… https://t.co/lckU2AFGVU
958113181586600000,Mon Jan 29 23:02:38 +0000 2018,Schumer op-ed in the @washingtonpost ahead of the State of the Union: Let's pass a real infrastructure plan, not on… https://t.co/92lWB2zWO9
956601062093459500,Thu Jan 25 18:54:00 +0000 2018,Hard to find Hill reporters better than @seungminkim. Congrats! https://t.co/6YwDoeiVze
956586654214504400,Thu Jan 25 17:56:45 +0000 2018,I presume he's booking another interview with @BretBaier to correct the record after his irresponsible and baseless… https://t.co/tx0dqTRFbj
956340403506118700,Thu Jan 25 01:38:14 +0000 2018,Senator Johnson, for the win. https://t.co/RKAp67MFZ9
956338045682376700,Thu Jan 25 01:28:52 +0000 2018,EXCLUSIVE: Live look at @realDonaldTrump negotiating on immigration https://t.co/2Ni59hjnLz
956324863471480800,Thu Jan 25 00:36:29 +0000 2018,If only this had been on the table on Friday.  Wait... https://t.co/xjCzc7utIH
955919964699062300,Tue Jan 23 21:47:34 +0000 2018,RT @SenatorDurbin: Congratulations to my friend @SenDuckworth! Proud to have her as my Illinois colleague and prouder still that she will m…
955870757875265500,Tue Jan 23 18:32:02 +0000 2018,Oh look, another White House spokesman is lying. https://t.co/hH9OvzGI40
955486684539510800,Mon Jan 22 17:05:52 +0000 2018,Sen. Schumer will speak on the Senate floor momentarily.
955416919301029900,Mon Jan 22 12:28:39 +0000 2018,RT @SenateDems: What caused the #TrumpShutdown? @Peggynoonannyc says @realDonaldTrump is “actually not good at making a deal.” https://t.co…
955263546543300600,Mon Jan 22 02:19:12 +0000 2018,#trumpshutdown https://t.co/Vw1cMwjbf1
955102633819336700,Sun Jan 21 15:39:47 +0000 2018,Well if you needed anymore proof that @realDonaldTrump wanted a #Trumpshutdown, his son has you covered https://t.co/WU3kXdtesk
954926837297115100,Sun Jan 21 04:01:14 +0000 2018,@Phil_Mattingly @nielslesniewski @ahrferrier Not all heroes wear capes.
954923499839205400,Sun Jan 21 03:47:58 +0000 2018,I cannot believe this is a sentence about the president of the United States. #trumpshutdown https://t.co/Nctbyerjsv
954920608340508700,Sun Jan 21 03:36:29 +0000 2018,Let's be honest about this. There is nobody on the other end of the line #trumpshutdown https://t.co/9fcYx73G80
954920338084843500,Sun Jan 21 03:35:24 +0000 2018,@KristenOrthman @mkraju Frankly I'm concerned about a fact check here.
954847688520020000,Sat Jan 20 22:46:43 +0000 2018,Unbelievable.   Turns out GOP operatives and Russian bots are the forces behind the Republican shutdown hashtag. https://t.co/8XT6suI4Eb
954817530379554800,Sat Jan 20 20:46:53 +0000 2018,#TrumpShutdown beats #SchumerShutdown in hashtag battle to assign blame - ABC News - https://t.co/KIqM4lDvuo via @ABC
954814716014186500,Sat Jan 20 20:35:42 +0000 2018,Why are we in the #trumpshutdown? Because negotiating with this president is like negotiating with Jell-O https://t.co/uiMJ0TrjST
954805433935581200,Sat Jan 20 19:58:49 +0000 2018,RT @NancyPelosi: Who wants to tell him? https://t.co/ZIWZvVkMCO
954798903181938700,Sat Jan 20 19:32:52 +0000 2018,Director Mulvaney was not in the lunch, and is not telling the truth.  Period, full stop. https://t.co/n7L00LNErE
954779534531973100,Sat Jan 20 18:15:54 +0000 2018,RT @ThisWeekABC: Sen. Chuck Schumer: "Negotiating with this White House is like negotiating with Jell-O. It's next to impossible." https://…
954765768213848000,Sat Jan 20 17:21:12 +0000 2018,I'll just leave this here. #TrumpShutdown https://t.co/400X8YYBTY
954764069357129700,Sat Jan 20 17:14:27 +0000 2018,He's pointing fingers at the wrong New Yorker #trumpshutdown https://t.co/WlynqfdFcT
954758135637598200,Sat Jan 20 16:50:52 +0000 2018,@JonahCrane @BrendanBuck Jonah.
954745356859920400,Sat Jan 20 16:00:06 +0000 2018,More Republicans admitting the truth, that this is a #TrumpShutdown https://t.co/X91ADYWweV
954743205580419100,Sat Jan 20 15:51:33 +0000 2018,Tough but fair, from another Republican #TrumpShutdown https://t.co/d7oIMN3jXu
954743072948215800,Sat Jan 20 15:51:01 +0000 2018,Even Republicans know this is the #TrumpShutdown https://t.co/JAgLltR7vU
954737021104410600,Sat Jan 20 15:26:58 +0000 2018,Was he in the room? No, he wasn't. https://t.co/jhY78SETdf
954715031786139600,Sat Jan 20 13:59:35 +0000 2018,Analysis | There’s a strong case to make that Trump is a big reason why the government just shut down #trumpshutdown https://t.co/wkZLeDFzrZ
954713004679094300,Sat Jan 20 13:51:32 +0000 2018,There's a tweet for everything. #trumpshutdown https://t.co/UeTf9XxwUs
954712126811144200,Sat Jan 20 13:48:03 +0000 2018,Watch this and RT #trumpshutdown https://t.co/llpsDtgrEW
954617760981676000,Sat Jan 20 07:33:04 +0000 2018,RT @byrdinator: 👀  https://t.co/fQA7inh8wh https://t.co/zbnANJr1P7
954614474807369700,Sat Jan 20 07:20:01 +0000 2018,Look at that #trumpshutdown https://t.co/XZA6OUPJss
954610038227824600,Sat Jan 20 07:02:23 +0000 2018,Today's episode of "there's literally a tweet for everything" #trumpshutdown https://t.co/SP9bX3pa6Y
954599584063508500,Sat Jan 20 06:20:51 +0000 2018,On the Senate floor, @SenateMajLdr just blocked a bill to ensure that military personnel are regularly paid during the #TrumpShutdown
954598222806290400,Sat Jan 20 06:15:26 +0000 2018,Sen. McCaskill is about to ask consent to "start paying our armed forces" as the White House asked for. I'm sure th… https://t.co/kC14NvyV93
954588865972592600,Sat Jan 20 05:38:15 +0000 2018,The @SenateDems website has a new look #TrumpShutdown https://t.co/kHqWRbMEaA https://t.co/wcGXtxq1zt
954587084974587900,Sat Jan 20 05:31:11 +0000 2018,President Trump has decided to ring in the one year anniversary of his inauguration with the #TrumpShutDown  Congrats, or something.
954586901318643700,Sat Jan 20 05:30:27 +0000 2018,Schumer: This will be called the #TrumpShutdown because there is no one who deserves the blame for the position we… https://t.co/XxKAgssQCl
954586536514867200,Sat Jan 20 05:29:00 +0000 2018,This is the #TrumpShutdown   Democrats have been more than reasonable in negotiating with this president. He just c… https://t.co/7grQFFcDpC
954503812198404100,Sat Jan 20 00:00:17 +0000 2018,Brilliant tweet here, judging by the ratio #TrumpShutdown https://t.co/gpQpkHLc9T
954488468431925200,Fri Jan 19 22:59:19 +0000 2018,It’s at the dry cleaners @BrendanBuck! https://t.co/6dmGRshJyh
954445916794183700,Fri Jan 19 20:10:13 +0000 2018,Schumer statement following @realDonaldTrump meeting: "We had a long and detailed meeting. We discussed all of the… https://t.co/B70dOmQ8CO
954432492349608000,Fri Jan 19 19:16:53 +0000 2018,RT @SteveSebelius: So much for calling it the "Schumer Shutdown." https://t.co/5H2jd60kzT
954400001953759200,Fri Jan 19 17:07:47 +0000 2018,RT @rickklein: NEW poll - 48 percent say they’d blame Trump and GOP for shutdown, 28 percent would blame Democrats in Congress https://t.co…
954379502423035900,Fri Jan 19 15:46:19 +0000 2018,"I hear the Democrats are going to be blamed, I hear the Republicans are going to be blamed. I actually think the P… https://t.co/Hd46orosrj
954373404702007300,Fri Jan 19 15:22:05 +0000 2018,What he said 👇 https://t.co/OqH5p2234I
954349000202874900,Fri Jan 19 13:45:07 +0000 2018,Government shutdown threats aren't new — but this standoff is far different https://t.co/tEK3MPAgYb
954209998439174100,Fri Jan 19 04:32:46 +0000 2018,Looming shutdown raises fundamental question: Can GOP govern? https://t.co/rtEIrjR6og
954201369208131600,Fri Jan 19 03:58:29 +0000 2018,RT @mikedebonis: It's true. He spent a lot of time literally facing right. https://t.co/FSGpbGs4jd
954196541593542700,Fri Jan 19 03:39:18 +0000 2018,RT @StevenTDennis: 🔥FLAKE NOT INCLINED TO VOTE FOR GOP CR, PREFERS SCHUMER APPROACH FOR SHORT-TERM BILL
954195730364854300,Fri Jan 19 03:36:04 +0000 2018,This might explain why all of his speeches tonight were addressed to his own members. https://t.co/HJ3Z6rtL0i
954195197222686700,Fri Jan 19 03:33:57 +0000 2018,RT @desiderioDC: FLAKE indicates he won't vote for the House-passed CR and prefers the Schumer pitch for a short-term patch. Wow
954184749312077800,Fri Jan 19 02:52:26 +0000 2018,Sen. McConnell says we're waiting for the President to articulate what he's for, so we can finalize a bipartisan de… https://t.co/ugsowaS0dx
954183367444062200,Fri Jan 19 02:46:57 +0000 2018,Sen. McConnell is on the Senate floor pitching his own caucus on his CR, because he doesn't have close to 50 votes on his side of the aisle.
954182467128356900,Fri Jan 19 02:43:22 +0000 2018,Sen. McConnell is now holding up his own CR.  He didn't dub himself the #GuardianofGridlock for nothing.
954180756053651500,Fri Jan 19 02:36:34 +0000 2018,Sen. McConnell's bill is going to fail on a bipartisan basis. We could have that vote tonight and move on to find a… https://t.co/IzGb0qpEHy
954179442435338200,Fri Jan 19 02:31:21 +0000 2018,The Trump administration DOD spox says the CR that @SenateGOP leader is trying to ram through is "wasteful and dest… https://t.co/n8sbYXySln
954168878124404700,Fri Jan 19 01:49:22 +0000 2018,Schumer: There is no promise and no likelihood that another kicking of the can down the road will get something done.
954168389991325700,Fri Jan 19 01:47:26 +0000 2018,RT @Phil_Mattingly: Now Schumer: “We all know what the problem is. It’s complete disarray on the Republican side.”
954168261989544000,Fri Jan 19 01:46:55 +0000 2018,Sen. Schumer speaking on the #Senate floor now
954112905053659100,Thu Jan 18 22:06:57 +0000 2018,👀 https://t.co/UJ7ZyQNZGq
954107449270833200,Thu Jan 18 21:45:17 +0000 2018,The ratio here is off to a great start, Senator https://t.co/fAZawDcJhR
954105409224273900,Thu Jan 18 21:37:10 +0000 2018,@GarrettHaake Had one already #ShitHoleShutdown
954084137744379900,Thu Jan 18 20:12:39 +0000 2018,If CHIP hadn’t expired on Sen. McConnell’s watch, maybe he would have a modicum of credibility with the press &amp; pub… https://t.co/mZ7yA8zvFp
954082528549367800,Thu Jan 18 20:06:15 +0000 2018,RT @Drew_Hammill: !!!! Republican Leader lays shutdown blame on Freedom Caucus https://t.co/FcTpahNJaB
954074232908144600,Thu Jan 18 19:33:17 +0000 2018,RT @IanSams: “But the Democrats!” they said. “It’s their fault!” they said. https://t.co/1KYNXdOlwU
954062333210431500,Thu Jan 18 18:46:00 +0000 2018,Look at all of these @AP, @WSJ @washingtonpost, and @nytimes headlines blaming Democrats for a potential government… https://t.co/rr9UhODVSP
954056579212628000,Thu Jan 18 18:23:08 +0000 2018,RT @StevenTDennis: Should be noted Cornyn track record on Senate schedule predictions is not spotless.
954047322110996500,Thu Jan 18 17:46:21 +0000 2018,Republicans are flailing to pin the blame on Democrats, as they President upends everything, Freedom Caucus rebels… https://t.co/OzGx1PbxgB
954012789210742800,Thu Jan 18 15:29:08 +0000 2018,Not just @realDonaldTrump governing by tweet. Congressional @gop is joining the act too. https://t.co/OkP7fXpglU
953989806320693200,Thu Jan 18 13:57:48 +0000 2018,“I this, I that.” https://t.co/3WPtKg6V0f
953834293079564300,Thu Jan 18 03:39:51 +0000 2018,RT @brianschatz: I mean ideology aside these folks are not very good at this. There should be active, bipartisan negotiations now, but the…
953797502876241900,Thu Jan 18 01:13:40 +0000 2018,@skrupin @HeyJayJRogers @kyleander2 @Mulhauser @C_DiPasquale @joshualipsky Is #imwithkrupin trending yet?
953795215537696800,Thu Jan 18 01:04:34 +0000 2018,Two days away from a potential shutdown and this is what the President is up to.  An incredible leader. https://t.co/g7dfNdNzIv
