id,created_at,text
855604520155525100,Sat Apr 22 02:09:48 +0000 2017,Tweet aged well https://t.co/RsSCEX6ZD3
855603757840830500,Sat Apr 22 02:06:46 +0000 2017,Alright @Capitals, you're the 1 seed. They're the 8.   Enough messing around.
855529844993650700,Fri Apr 21 21:13:04 +0000 2017,White House making shutdown threats without all of their troops in line is not a recipe for success https://t.co/RHialiYVYs
855515946554990600,Fri Apr 21 20:17:51 +0000 2017,The WH is telling millions of Americans "you don't get your health care until we get our wall"  This plan is as cynical as it is dumb
855512627648352300,Fri Apr 21 20:04:39 +0000 2017,I like this idea. https://t.co/wsnMaEqpka
855509525104873500,Fri Apr 21 19:52:20 +0000 2017,The Trump administration is staking out a position in gov funding talks its own party doesn't even support https://t.co/fFP45DBjit
855508624424226800,Fri Apr 21 19:48:45 +0000 2017,The US government is supposed to take care of its citizens POTUS said Mexico is supposed to pay for the wall.  This… https://t.co/zqMu1pC7iH
855490837718892500,Fri Apr 21 18:38:04 +0000 2017,President Trump didn't always find that "First 100 Days" standard ridiculous...  WATCH: https://t.co/c946OualZV
855419285677760500,Fri Apr 21 13:53:45 +0000 2017,He's also literally 0 for 10 on his 100 day plan https://t.co/4eZMbFqred
855418487807848400,Fri Apr 21 13:50:35 +0000 2017,What a "ridiculous standard"  ... to which the the President once held himself https://t.co/5zm5VghTO7
855166375907688400,Thu Apr 20 21:08:46 +0000 2017,RT @brianschatz: Mr. Attorney General: You voted for that judge. And that island is called Oahu. It's my home. Have some respect. https://t…
854805772563304400,Wed Apr 19 21:15:52 +0000 2017,CC @PressSec   Man I love this. https://t.co/UaHIDSdvPA
854734089336827900,Wed Apr 19 16:31:01 +0000 2017,The @presssec is asked about the WH's proudest legislative accomplishment in first #100days, pivots to executive orders. Rather telling.
854493062474731500,Wed Apr 19 00:33:16 +0000 2017,This Republican won the fight for the soul of the GOP on immigration issues.   Ronald Reagan would be ashamed. https://t.co/y7Otj2seW2
854486276036321300,Wed Apr 19 00:06:18 +0000 2017,Miller, not Bannon, gets the honor of a slot in Trump White House's "Trump Staff Praises Trump" release  👀 https://t.co/39q369qae4
854449211189989400,Tue Apr 18 21:39:01 +0000 2017,Chuck Schumer: Trump’s 'Buy American' Verbiage ‘Doesn’t Match the Reality’ | Politics | US News https://t.co/4v1EcePb9g
854422866795929600,Tue Apr 18 19:54:20 +0000 2017,That's $70B that could go towards things we actually need. Like roads, airports, bridges, broadband, smart grid... https://t.co/SltTsGDe7V
854416768181448700,Tue Apr 18 19:30:06 +0000 2017,Mr. Secretary, take that up with the House Republicans who blocked the bipartisan Gang of Eight bill, S. 744. https://t.co/FsXrhLFLzr
854395061483778000,Tue Apr 18 18:03:51 +0000 2017,This is surreal. https://t.co/QOzafxaiQx
854373089362227200,Tue Apr 18 16:36:32 +0000 2017,We're supposed to believe the President who made shirts &amp; ties in China will "Buy American &amp; Hire American?" https://t.co/6hzloVQm55
854349888947187700,Tue Apr 18 15:04:21 +0000 2017,Is POTUS being soft on China because of North Korea or the family business? Either way its wrong. https://t.co/P1moZVkCzY
854348903755460600,Tue Apr 18 15:00:26 +0000 2017,This is not complicated: 1-POTUS talks tough on China 2-China gives trademarks to POTUS &amp; daughter 3-POTUS backs off https://t.co/N3NR54GRKF
854346062445912000,Tue Apr 18 14:49:08 +0000 2017,Schumer: Buy American and Hire American has been nothing more than a campaign slogan from @realDonaldTrump
854333569791123500,Tue Apr 18 13:59:30 +0000 2017,Everyone else: Yes you have https://t.co/RFBeMmv5Q1
854156662239834100,Tue Apr 18 02:16:32 +0000 2017,It will save you years of misery. Good move. https://t.co/XG9y7gz1P1
854156540965785600,Tue Apr 18 02:16:03 +0000 2017,@jamiedupree POTUS https://t.co/8gCkfC5ut7
854154545852710900,Tue Apr 18 02:08:07 +0000 2017,You might think #Caps playoff disappointments would get easier each year. But they don't.
854145165157597200,Tue Apr 18 01:30:51 +0000 2017,And @PressSec acknowledged international investigations into potential fraud from the podium. But hey, congrats any… https://t.co/uDDPpWhn5d
854143562828709900,Tue Apr 18 01:24:29 +0000 2017,The American people deserve to know how @realDonaldTrump would benefit from any tax reform. No ifs, ands, or buts. https://t.co/KQQ683U9BM
854043306069774300,Mon Apr 17 18:46:06 +0000 2017,Creating straw men is one thing this administration does well. https://t.co/B4wzgOOcLb
854041842698133500,Mon Apr 17 18:40:17 +0000 2017,After POTUS flip-flopped and is treating China with kid gloves on trade, @PressSec can't name 1 thing China has done to help on North Korea
853074037974720500,Sat Apr 15 02:34:34 +0000 2017,RT @SenSchumer: Another glaring ex of Pres Trump saying one thing &amp; doing another. Why aren't White House visitor logs being made public? W…
852628098197704700,Thu Apr 13 21:02:34 +0000 2017,Uh-oh. Now he may Tweet something off message... https://t.co/TpuNWyRDOx
852292902663356400,Wed Apr 12 22:50:37 +0000 2017,"Don't fall in love with the map."  Or the challengers. https://t.co/rUoOAm98Nk
852285810581925900,Wed Apr 12 22:22:26 +0000 2017,The American Academy of Actuaries said President Trump's threat on CSRs would cost millions their health care https://t.co/2Sq9qZ4n4y
852283797177593900,Wed Apr 12 22:14:26 +0000 2017,President Trump looks at millions of Americans benefitting from the #ACA and sees bargaining chips, not lives. https://t.co/4JjBHHpUKf
852283338769543200,Wed Apr 12 22:12:37 +0000 2017,The President is actively threatening the health care of millions to win a political fight. Let's see how that goes… https://t.co/Gvl9aHfbBJ
852255447633596400,Wed Apr 12 20:21:47 +0000 2017,Some deal-maker. Trading away tough trade policy that helps American workers in exchange for vague reassurances fro… https://t.co/xGvwyAE4Te
852252545926000600,Wed Apr 12 20:10:15 +0000 2017,#OneChina. Two Trumps.  On the campaign trail, the President promised to label China a currency manipulator. Today… https://t.co/3Fom99VDLq
852250024096538600,Wed Apr 12 20:00:14 +0000 2017,RT @peterbakernyt: Schumer says Trump decision not to label China a currency manipulator reflects "a lack of real, tough action on trade ag…
852244583450890200,Wed Apr 12 19:38:37 +0000 2017,Candidate Trump's promises have the shortest shelf life of any President in recent memory https://t.co/Gov5tRCUBk
852244255909302300,Wed Apr 12 19:37:19 +0000 2017,Can. Trump - I'll label China a currency manipulator on day 1 China - Here are 38 trademarks Pres. Trump - nevermind https://t.co/BqbTS9uinj
852243351776747500,Wed Apr 12 19:33:43 +0000 2017,I'm old enough to remember when President Trump promised he'd label China a currency manipulator on day one. Yet an… https://t.co/AkreEz3cH8
852170116380971000,Wed Apr 12 14:42:42 +0000 2017,Have to say I agree with Senator Cruz on this one. https://t.co/iUjX1Ffydz
852159327972536300,Wed Apr 12 13:59:50 +0000 2017,"The White House had, as of April 7, put forward just 24 nominations for the 533 key posts"  https://t.co/BuRqjix9Ae
851904167002214400,Tue Apr 11 21:05:55 +0000 2017,Schumer: Trump 'all talk and no action' on China https://t.co/bRL6vrSnx8
851814259357081600,Tue Apr 11 15:08:40 +0000 2017,RT @JamesArkin: “I think talks are going pretty well right now and the WH doesn’t have to throw a monkey wrench into it” Schumer re: gov’t…
851802746365902800,Tue Apr 11 14:22:55 +0000 2017,Yet another example of the President being all talk and no action: China trade. Swung and missed with President Xi https://t.co/j72DmWXHyg
851413065090437100,Mon Apr 10 12:34:27 +0000 2017,Read this. The right-wing billionaires club has been trying to take over the judiciary for years.   Think Gorsuch i… https://t.co/XWdlZsZ10T
851410929434730500,Mon Apr 10 12:25:58 +0000 2017,Want to know why Dems fought so hard on Gorsuch? Read this @jeffreytoobin piece on the right's battle for the courts https://t.co/nxGLJIEFPW
850405761205370900,Fri Apr 07 17:51:47 +0000 2017,Yes it is. https://t.co/gSeypKPBAC
850373770191802400,Fri Apr 07 15:44:40 +0000 2017,Just received a @nytimes alert on a vote that is still open. @seungminkim, its all yours.
850372086703042600,Fri Apr 07 15:37:59 +0000 2017,RT @JDSalant: Some of us already have. https://t.co/fFQ3qcGEdW https://t.co/UUhdLlkdpO
850369577938821100,Fri Apr 07 15:28:01 +0000 2017,The fourth estate should absolutely take Sen. McConnell up on writing a story about the special interest giveaways under the CRA. Endorse.
850368229281333200,Fri Apr 07 15:22:39 +0000 2017,RT @frankthorp: .@hughhewitt McConnell just now told that Schumer spox refutes his comments: "I'm not going to argue about that, I thought…
850366198915182600,Fri Apr 07 15:14:35 +0000 2017,The @SenateGOP agenda beyond spending bills, from Leader McConnell: "There will be other bills."   GOP Congress hard at work
850357751364681700,Fri Apr 07 14:41:01 +0000 2017,RT @frankthorp: McConnell: Schumer is in talks with the WH about government funding.  Schumer Spox: Nope. https://t.co/4ipoPp4abS
850356183839985700,Fri Apr 07 14:34:47 +0000 2017,Except this is not the case. House/Senate Ds &amp; Rs making very good progress. Only White House involvement could der… https://t.co/bL3TFc4IBR
850088641833689100,Thu Apr 06 20:51:40 +0000 2017,That's a fancy setup for the Big-Macs the President said he would serve President Xi, back when he was Candidate Tr… https://t.co/naXzo3jqeK
850069875624116200,Thu Apr 06 19:37:06 +0000 2017,Yep, all the members need is pressure from the 17% of Americans who think #TrumpCare is a good idea. https://t.co/qAGlHMah39
850024105168580600,Thu Apr 06 16:35:14 +0000 2017,And with that, the myth of Sen. McConnell as an institutionalist can be dispensed with. #SCOTUS
850015967644184600,Thu Apr 06 16:02:53 +0000 2017,RT @kristinapet: McConnell is trying to argue that the Democrats' rules change of 2013 appealed to ALL nominees. Chair says it didn't apply…
850013843485020200,Thu Apr 06 15:54:27 +0000 2017,@ahrferrier You should tell that to the presiding officer, who just said it.
850013128792453100,Thu Apr 06 15:51:37 +0000 2017,CC @chucktodd, who asked Sen. McConnell if he would support making this a rule.   Sen. McConnell, unsurprisingly, d… https://t.co/PeRWYNlTmF
850012273469009900,Thu Apr 06 15:48:13 +0000 2017,CC @SenateGOP 👇 https://t.co/HoqLZCRaCi
850011842793664500,Thu Apr 06 15:46:30 +0000 2017,Sen. Schumer will now make a series of parliamentary inquiries. Will show the GOP hypocrisy of this moment #SCOTUS
850005899846529000,Thu Apr 06 15:22:53 +0000 2017,@grantbosse Really mature Grant. They're breaking the rules to change the rules to get their judge confirmed. Wouldn't happen otherwise.
850005264224985100,Thu Apr 06 15:20:21 +0000 2017,@grantbosse Cloture won't be invoked. His nomination can't move forward under standing rules. GOP has to break the… https://t.co/M5pnp4Kyqg
850004442049065000,Thu Apr 06 15:17:05 +0000 2017,Its official, Gorsuch doesn't have votes to pass the Senate.  Every other time this has happened, the nominee changed. GOP will change rules
849996779621941200,Thu Apr 06 14:46:39 +0000 2017,You're going to want to watch this @SenSchumer speech on #SCOTUS. Watch live here https://t.co/XK9wkyatET
849996173251416000,Thu Apr 06 14:44:14 +0000 2017,The GOP obstruction Dems were up against in 2013 was explicitly not about nominees. They would have blocked anyone.… https://t.co/fT4TEwRBPK
849993587379114000,Thu Apr 06 14:33:58 +0000 2017,Sen. McConnell gave a 25 minute history lesson on the judicial wars on the Senate floor.  The words "Merrick Garland" were never mentioned.
849991845690175500,Thu Apr 06 14:27:02 +0000 2017,Reminder: the last time a Republican Senate confirmed a Democratic President's #SCOTUS nominee was 1895.  Grover Cleveland was President.
849991355199782900,Thu Apr 06 14:25:05 +0000 2017,Come on Ben, you know the first Republican rule of the Garland nomination.  You do not talk about the Garland nomin… https://t.co/UO6OKK2dn2
849990466770808800,Thu Apr 06 14:21:33 +0000 2017,Talking about Obama #SCOTUS nominees, Senator McConnell just said "We treated them fairly."  Without a hint of irony.
849989712110637000,Thu Apr 06 14:18:34 +0000 2017,Senator McConnell says no Republican has voted to filibuster a #SCOTUS nom.  That's because he didn't even give Garland a cloture vote.
849988896796680200,Thu Apr 06 14:15:19 +0000 2017,If you're covering GOP complaints of lack of Dem votes for Gorsuch, here is a handy chart with the names of Rs who… https://t.co/4x9UEe5OfD
849974079578927100,Thu Apr 06 13:16:26 +0000 2017,Spoiler alert: they do. You should still read @jbendery's piece though https://t.co/lV1ZqUxoi8
849965486108549100,Thu Apr 06 12:42:18 +0000 2017,Pres. Trump has received trademarks from China but hasn't lifted a finger against them on trade. Dems call him on it https://t.co/bHtIjMJW9Z
849963164708065300,Thu Apr 06 12:33:04 +0000 2017,You should do two things this AM - read Lizzi's #SCOTUS thread and then follow her (she's Schumer's Deputy CD)… https://t.co/xd4cJSKKjN
849926639614033900,Thu Apr 06 10:07:56 +0000 2017,This @EJDionne piece is exactly right. GOP tries to stack courts with hard-right judges. Now Dems are fighting back. https://t.co/LqtTLULrEC
849710576376975400,Wed Apr 05 19:49:22 +0000 2017,@AJentleson @ahrferrier @kelsey_snell Adam, that emoji is horrifying. Kelsey, stop causing trouble. Hi Antonia
849688912138305500,Wed Apr 05 18:23:17 +0000 2017,Bad enough when its staff appointments or the Cabinet. But Gorsuch gets a lifetime gig. https://t.co/DDUhkMjyV5
849685143988179000,Wed Apr 05 18:08:19 +0000 2017,The American people disagree with GOP plan to nuke the filibuster by a whopping 25-67%, according to @QuinnipiacPoll https://t.co/jZZGVIEEee
849655981881610200,Wed Apr 05 16:12:26 +0000 2017,Might accomplish one more: boosting Democratic turnout in #GA06 for @ossoff https://t.co/T7eyQtvJDJ
849653916694437900,Wed Apr 05 16:04:14 +0000 2017,W/chem weapons attack in Syria &amp; ballistic missiles in NK, the Trump admin is asleep at the switch of the @StateDept https://t.co/jBy0zYeevP
849614936594673700,Wed Apr 05 13:29:20 +0000 2017,Sen. McConnell to @pkcapitol seven short years ago, reflecting on GOP push to eliminate the 60 vote threshold: "God… https://t.co/Qk2KRAXPDz
849571093048426500,Wed Apr 05 10:35:07 +0000 2017,RT @burgessev: "I've never seen a college plagiarism code that this would not be in violation of,” https://t.co/5IQrTvn8mK
849414472955568100,Wed Apr 05 00:12:46 +0000 2017,Why even bother with that "statement?"  Q: "Mr. Secretary, your response to North Korea firing a ballistic missile?… https://t.co/IhvxkuXKKA
849315626812416000,Tue Apr 04 17:39:59 +0000 2017,I think Sen. McConnell is trolling the history books.  There were three Obama nominees for the Supreme Court, senat… https://t.co/0fQbO0K8ne
849314021593555000,Tue Apr 04 17:33:36 +0000 2017,Then here is a crazy idea -- Don't do it, &amp; pick a mainstream nominee who can earn 60 votes. Nobody is being forced… https://t.co/wZbbzCdkxx
849270235840614400,Tue Apr 04 14:39:37 +0000 2017,@seungminkim @StewSays We disagree without being disagreeable, mostly. Also share a love of dogs.
849269068167344100,Tue Apr 04 14:34:59 +0000 2017,After you check in with my friend @StewSays, be sure to read this @PolitiFact piece. Spoiler: "Mostly true" rating.… https://t.co/0PeIHPg7qm
849267334044930000,Tue Apr 04 14:28:05 +0000 2017,Amidst all the rules debate, let's not lose sight of this simple, motivating fact: Judge Gorsuch is not mainstream. https://t.co/ywNq3BENw2
849266505267257300,Tue Apr 04 14:24:48 +0000 2017,Schumer quoting @RepAdamSchiff: When McConnell deprived Obama of a vote on Garland, that was a nuclear option. The rest is fallout. #SCOTUS
849266311532294100,Tue Apr 04 14:24:01 +0000 2017,Schumer: What the Majority Leader did to Merrick Garland is even worse than a filibuster. #SCOTUS
849263000943042600,Tue Apr 04 14:10:52 +0000 2017,Sen McConnell clinging to the "unprecedented partisan filibuster" after his Garland blockade takes a jaw-dropping amount of chutzpah #SCOTUS
849242339356946400,Tue Apr 04 12:48:46 +0000 2017,How did Republicans bring the Senate to the brink of the nuclear option on Supreme Court? Read this https://t.co/9Q1xO7zpFw
848985112268202000,Mon Apr 03 19:46:38 +0000 2017,Schumer: Instead of GOP invoking nuclear option, Dems are willing to meet anytime, anywhere with Rs to seek a new #SCOTUS nominee
848982915287482400,Mon Apr 03 19:37:55 +0000 2017,@seungminkim What do you think this is, the House? We're on Senate time.
848982674245124100,Mon Apr 03 19:36:57 +0000 2017,Happening momentarily #SCOTUS https://t.co/JFBdr2tJk1
848979007844560900,Mon Apr 03 19:22:23 +0000 2017,Only $1,599,922,000.00 to go to make up for his proposed budget cut to the @Interior Department. https://t.co/6xM78FIED7
848974712982179800,Mon Apr 03 19:05:19 +0000 2017,Sen. McConnell in 2016: "We'll drop [Trump] like a hot rock."  Sen. McConnell in 2017: Could nuke the Senate for Pr… https://t.co/xy9evLjuCY
848973935681077200,Mon Apr 03 19:02:14 +0000 2017,So don't do it. https://t.co/EOJg7XrXDx
848970237420740600,Mon Apr 03 18:47:32 +0000 2017,Has Merrick Garland been on the Supreme Court this entire time and just didn't tell anybody? https://t.co/r7y5eF0OOj
848965715206037500,Mon Apr 03 18:29:34 +0000 2017,@HolmesJosh @blakehounshell You mean instead of changing the rules, they changed the nominee? What a concept.
848961582558261200,Mon Apr 03 18:13:08 +0000 2017,Literally nobody is forcing him to do this.  Senate Republicans are making a choice. They will own it. https://t.co/unlG5FTVfN
848955494899298300,Mon Apr 03 17:48:57 +0000 2017,At 3pm on Senate floor, @SenSchumer will discuss next steps on #SCOTUS now that Judge Gorsuch doesn't have the votes https://t.co/YGFRv0ExNH
848948683219644400,Mon Apr 03 17:21:53 +0000 2017,That's it, Judge Gorsuch doesn't have the votes to pass the Senate. We need a new #SCOTUS nominee, from within the… https://t.co/EIzfqV4bPI
848924993765421000,Mon Apr 03 15:47:45 +0000 2017,Yes, @JohnCornyn, the Federalist Soc. and Heritage Foundation have the right to speak freely. But they don't get to pick #SCOTUS justices
848913755387961300,Mon Apr 03 15:03:05 +0000 2017,If you haven't read this yet, from @AJentleson, do it 👇 https://t.co/4G6BsGjyYG
848913058445615100,Mon Apr 03 15:00:19 +0000 2017,Some in @SenateGOP refused to meet with Garland.  Now, @GorsuchFacts refuses to meet with some @SenateDems. #SCOTUS https://t.co/69y8KPJNrJ
848912341651513300,Mon Apr 03 14:57:28 +0000 2017,It absolutely was. Refusing to meet with members off committee probably didn't help either. https://t.co/93XSMsnXGT
848910139147026400,Mon Apr 03 14:48:43 +0000 2017,👇 https://t.co/cv6XTU8MbR
848907406063087600,Mon Apr 03 14:37:52 +0000 2017,GOP has a choice. They can pick another nominee who can get 60.  They're not being forced to change the rules, they… https://t.co/M4xIltSqVY
848527410777792500,Sun Apr 02 13:27:54 +0000 2017,Yet he wouldn't entertain the idea making this a Senate rule. Shows the emptiness behind this accusation. Its polit… https://t.co/Snzx0LmZUT
848525618773884900,Sun Apr 02 13:20:47 +0000 2017,Senate Republicans have a choice here. https://t.co/2ZgqU5HhjX
848249630152425500,Sat Apr 01 19:04:06 +0000 2017,RT @SenSchumer: NEVER! #AprilFools
848225922415284200,Sat Apr 01 17:29:53 +0000 2017,@seungminkim You're welcome
848219264091914200,Sat Apr 01 17:03:26 +0000 2017,"The Tweet speaks for itself," every Trump White House aide once said https://t.co/ADt33ReqTC
848217662262042600,Sat Apr 01 16:57:04 +0000 2017,CC @AshleyRParker https://t.co/ryMJLdlxEB https://t.co/CITcf7jsUb
848148628279623700,Sat Apr 01 12:22:45 +0000 2017,On issue after issue, @realDonaldTrump talks like a populist but doesn't back it up. https://t.co/EUSXR4poG3
847776560035881000,Fri Mar 31 11:44:17 +0000 2017,This @WSJopinion needs a correction. Obama and Clinton nominated 5 #SCOTUS judges, not 4. Rs didn't even give Garla… https://t.co/2Sq69UPDCy
847773510051258400,Fri Mar 31 11:32:10 +0000 2017,This @WSJ editorial rewrites history. There were 5 nominees, guys - the last was Merrick Garland. What they did was… https://t.co/AwUtYByK32
847519605602037800,Thu Mar 30 18:43:14 +0000 2017,@ahrferrier @PressSec @Heritage @FedSoc Pretty sure POTUS nominates with advice and consent of the Senate, not the… https://t.co/RND5e0cMv2
847516078041436200,Thu Mar 30 18:29:13 +0000 2017,@ahrferrier @SenateDems @Heritage @FedSoc Guess you forgot about the meeting President Bush hosted w/Sens. Reid, Le… https://t.co/qe7tM45tGy
847512592331325400,Thu Mar 30 18:15:22 +0000 2017,When Clinton wanted Babbitt for #SCOTUS, he sought the opinion of Sen. Hatch, who said how about Breyer or Ginsburg… https://t.co/5BUlsADzr1
847511744457064400,Thu Mar 30 18:12:00 +0000 2017,I don't remember any @SenateDems being in the room with @Heritage &amp; @FedSoc when they wrote the list from which Jud… https://t.co/WINmVHAWPs
847510356327104500,Thu Mar 30 18:06:29 +0000 2017,No, @PressSec, its not advice and consent of the Senate when POTUS picks the nominee off a list written by @Heritage &amp; @FedSoc
847508979865460700,Thu Mar 30 18:01:01 +0000 2017,46 @SenateDems have sent a letter to @realDonaldTrump urging him to veto this bill #broadbandprivacy https://t.co/v5IwLqQFnh
847506566312079400,Thu Mar 30 17:51:25 +0000 2017,Its all up to the President now. Will @realdonaldtrump literally sell the American people out?https://t.co/v5IwLqz4vJ
847474252802437100,Thu Mar 30 15:43:01 +0000 2017,Y'all should turn in to the #Senate floor to watch Senator @PattyMurray defend women's health right now 🔥🔥🔥
847472606030811100,Thu Mar 30 15:36:29 +0000 2017,The @SenateGOP just yielded back all their debate time. They don't want to defend their anti-women's health bill to the public
847467774310015000,Thu Mar 30 15:17:17 +0000 2017,GOP is willing to do whatever it takes to allow states to discriminate against family planning providers. Even brin… https://t.co/DNqKCRSyqK
847464746123018200,Thu Mar 30 15:05:15 +0000 2017,The Senate GOP doesn't have the votes to restrict access to health care for women &amp; families, but the @VP is coming to bail them out
847457550132019200,Thu Mar 30 14:36:39 +0000 2017,Then it was an odd choice to call @maggieNYT after your health care bill failed, Mr. President. https://t.co/uO9rRKaBW7
847457110493323300,Thu Mar 30 14:34:54 +0000 2017,Oh and one more - today the GOP is making it easier for states to restrict access to health care for women and families 9/9
847456535135494100,Thu Mar 30 14:32:37 +0000 2017,These haven't gotten the attention they deserve, but Democrats and the American people won't forget these awful votes 8/8
847456409327407100,Thu Mar 30 14:32:07 +0000 2017,Every single time, Republicans sold out the American people for their special interest backers 7/
847456164321271800,Thu Mar 30 14:31:09 +0000 2017,And of course, Republicans voted to let ISPs sell your browser histories, in a stunning invasion of American privacy 6/
847455761831559200,Thu Mar 30 14:29:33 +0000 2017,There was the one where they made it harder for the federal government to keep guns out of the hands of those who shouldn't have them 5/
847455202735042600,Thu Mar 30 14:27:19 +0000 2017,Next, they made it easier for federal contractors who skimp on worker safety to earn contracts from the U.S. government 4/
847454946580512800,Thu Mar 30 14:26:18 +0000 2017,They started by voting to allow Big Oil companies to keep their bribery payments to foreign governments secret 3/
847454790741184500,Thu Mar 30 14:25:41 +0000 2017,Republicans have repeatedly used the Congressional Review Act to repeal consumer &amp; worker protections for their special interest backers 2/
847454529339572200,Thu Mar 30 14:24:39 +0000 2017,While everyone has (rightly) focused on the health care fight, Supreme Court nomination &amp; FBI investigation into campaign ties to Russia 1/
847437992763379700,Thu Mar 30 13:18:56 +0000 2017,This is definitely how you start bipartisan talks on infrastructure, taxes, the "easy" health care deal https://t.co/P43ym5QWYb
847433775927640000,Thu Mar 30 13:02:11 +0000 2017,Even Republicans think Speaker Ryan's comments were beyond the pale. Dems are ready to improve the law, GOP just ne… https://t.co/jSHhOW3gUG
847430505901338600,Thu Mar 30 12:49:11 +0000 2017,Meanwhile in the U.S. Senate, today the GOP will go after retirement accounts &amp; vote to restrict access to health care for women. #TitleX
847214859490078700,Wed Mar 29 22:32:17 +0000 2017,The Constitution gives POTUS the power 2 appoint #SCOTUS judges w/the advice &amp; consent of the Senate, not right-win… https://t.co/jwKRPE4xHH
847167483333283800,Wed Mar 29 19:24:02 +0000 2017,FACT: Every confirmed #SCOTUS nominee since the Eisenhower administration, except Thomas, has earned 60+ votes https://t.co/4gIRKEmN5M
847148912171532300,Wed Mar 29 18:10:14 +0000 2017,Senate GOP didn't even give Garland the chance to win 60 votes on the floor.  The hypocrisy here is galling, even b… https://t.co/1BzSy5WMp5
847140391505793000,Wed Mar 29 17:36:23 +0000 2017,Keep it classy, Judicial Crisis Network https://t.co/xaCu9zptky
847091437535727600,Wed Mar 29 14:21:51 +0000 2017,@jbendery what are we supposed to do? Build it on our side? Part the Rio Grande? Not build it?
847086797058461700,Wed Mar 29 14:03:25 +0000 2017,These guys... now the wall is going to be IN Mexico, according to @Interior Secretary Zinke. https://t.co/DEWaIQrlQz
