id,created_at,text
1212018067766595600,Tue Dec 31 14:30:00 +0000 2019,Follow these steps to become a New Year's Eve party ninja. https://t.co/6pzWZM6ZDI
1212010518552203300,Tue Dec 31 14:00:00 +0000 2019,This is medical advice we can get behind. https://t.co/cyF1SOj2qB
1212003103748296700,Tue Dec 31 13:30:32 +0000 2019,Which was your favorite? https://t.co/q4WC7b6FGW
1211995423365202000,Tue Dec 31 13:00:01 +0000 2019,The luxury car icon claims the sleek new plane is "the world’s fastest all-electric aircraft." https://t.co/dvqM6T8Uaq
1211859524182626300,Tue Dec 31 04:00:00 +0000 2019,A new study tells us what we already knew. https://t.co/0RD8jazTbn
1211844424004710400,Tue Dec 31 03:00:00 +0000 2019,Make this classic whiskey cocktail anywhere, anytime. https://t.co/p57J1jlF5F
1211829324866711600,Tue Dec 31 02:00:00 +0000 2019,Take your flight to the next level with these impressive luxe airport lounges. https://t.co/YGQbxe02FB
1211814226206974000,Tue Dec 31 01:00:00 +0000 2019,Take your home theater set-up to the next level. https://t.co/KWk5MNCxWb
1211799125668192300,Tue Dec 31 00:00:00 +0000 2019,Pony on up for happy hour, fellas.  https://t.co/HQcbXR7Ruw
1211784026630934500,Mon Dec 30 23:00:00 +0000 2019,A recent survey reveals that it's probably longer than you think. https://t.co/wmEQG1wW3g
1211768928390668300,Mon Dec 30 22:00:00 +0000 2019,With its groundbreaking new 1,400-horsepower EXP 100 GT electric concept and a host of new production models, the c… https://t.co/lIffBRxR6J
1211753826660827100,Mon Dec 30 21:00:00 +0000 2019,A look back at the hilarious crop top-wearing beauties who stole our hearts. https://t.co/DMaM2TxIe4
1211742691932938200,Mon Dec 30 20:15:45 +0000 2019,High Country American Single Malt is a tribute to the finest Scottish spirits. https://t.co/DXKpAVtoo6
1211738730240888800,Mon Dec 30 20:00:00 +0000 2019,Here's why you should take a hit before hitting the gym. https://t.co/Jx8TIw5yJA
1211723629907591200,Mon Dec 30 19:00:00 +0000 2019,If you've ever wanted to snag a truly great timepiece before it becomes invaluable, the time is now. https://t.co/VGWrCZO7rz
1211714821416206300,Mon Dec 30 18:25:00 +0000 2019,Surf's up--literally. https://t.co/tFpk15ZFeP
1211708529674870800,Mon Dec 30 18:00:00 +0000 2019,Rule the kitchen with these easy-to-make beauties. https://t.co/vZN0rlSyPU
1211702239221493800,Mon Dec 30 17:35:00 +0000 2019,Everyone loves "Baby Yoda." https://t.co/s90FTQHroa
1211693430948221000,Mon Dec 30 17:00:00 +0000 2019,Time to get FIRED UP. https://t.co/big6anLzXf
1211683362416595000,Mon Dec 30 16:20:00 +0000 2019,Power and elegance combine in a day boat that evokes the 1950s but has 21st Century capability. https://t.co/FYyWtslXzj
1211678371782037500,Mon Dec 30 16:00:10 +0000 2019,"Don’t shut me out of the hive." https://t.co/by0iVmLe2L
1211663232835969000,Mon Dec 30 15:00:00 +0000 2019,"America's First Cocktail" is about to get even better. https://t.co/6ChN65Ywkz
1211656960061444000,Mon Dec 30 14:35:05 +0000 2019,The affordable, clear 80s classic is back and bigger than ever. https://t.co/voxduuiZDy
1211648134180245500,Mon Dec 30 14:00:01 +0000 2019,Improve your life immediately with these key rules from the guy who virtually invented "biohacking." https://t.co/5bgUuXgK49
1211633034929299500,Mon Dec 30 13:00:01 +0000 2019,Your favorite cheerleader/vampire slayer turns 39 today. https://t.co/yQT9ERBrq7
1211497135952154600,Mon Dec 30 04:00:00 +0000 2019,If it works on the battlefield, it'll work at home. https://t.co/KTwRmsjUEi
1211482035820347400,Mon Dec 30 03:00:00 +0000 2019,Hip hip, hooray. https://t.co/jKkw2pVLQH
1211466936170582000,Mon Dec 30 02:00:00 +0000 2019,The next-gen console will literally be a game changer. https://t.co/8YP2Dhp8Va
1211451838303629300,Mon Dec 30 01:00:00 +0000 2019,Pre-heating vehicles wastes gas and harms your engine. https://t.co/nGW6hswEoa
1211436738251354000,Mon Dec 30 00:00:00 +0000 2019,It's WAY better than cough syrup. https://t.co/NISbVrv8iV
1211421638589206500,Sun Dec 29 23:00:00 +0000 2019,This smartly designed, 28-foot RV is designed for full-time living--not just vacations or weekend getaways. https://t.co/fxUF6ktFD5
1211406538579071000,Sun Dec 29 22:00:00 +0000 2019,It's younger than you think. https://t.co/DUtCxoilrb
1211391439185137700,Sun Dec 29 21:00:00 +0000 2019,Step inside the alluring world of Mairi-Luise Tabbakh. https://t.co/ixgylZcboB
1211376340596715500,Sun Dec 29 20:00:00 +0000 2019,"It's not really supposed to be like a 'flex' as the kids call it." https://t.co/ReXrEOCnRG
1211370049640026000,Sun Dec 29 19:35:00 +0000 2019,With a 1,250 cc engine, this beast cranks out 140 horsepower and 90 pound-feet of torque. https://t.co/IHngTG6TyQ
1211361240984903700,Sun Dec 29 19:00:00 +0000 2019,Which of these brutal clips is your favorite? https://t.co/MLXriVDWg8
1211346141553410000,Sun Dec 29 18:00:00 +0000 2019,This stunning, 12-pistol set of custom 1911-style handguns is a dream come true for luxury gun collectors. https://t.co/kcXhrs9N4N
1211336074011779000,Sun Dec 29 17:20:00 +0000 2019,"Thank you all for regaling me with the true tales of this man’s heroism." https://t.co/bbA6yqFvB6
1211331043917066200,Sun Dec 29 17:00:00 +0000 2019,It's the next best thing to an extraterrestrial vacation. https://t.co/YQXrzCf1US
1211315944447864800,Sun Dec 29 16:00:00 +0000 2019,This simple pasta dish is a can't-miss classic that's perfect for date night. https://t.co/iMZIT7KfcA
1211300845188345900,Sun Dec 29 15:00:01 +0000 2019,They put the lust in wanderlust, one Instagram post at a time. https://t.co/2alzhwUuzv
1211285743257215000,Sun Dec 29 14:00:00 +0000 2019,Here's how you celebrate the holiday in a truly epic way. https://t.co/fP4LaRo4Iy
1211270644110971000,Sun Dec 29 13:00:00 +0000 2019,This gorgeous lady of wrestling is turning 37. https://t.co/t8VpPvvXMj
1211134747231113200,Sun Dec 29 04:00:00 +0000 2019,The breezy bike design is inspired by Dyson house fans that cool by "multiplying" air. https://t.co/dmelU9zPlH
1211119649124958200,Sun Dec 29 03:00:00 +0000 2019,“He starts talking about grabbing the seat in front of him--‘I couldn’t let go of the seat in front of me'--and jus… https://t.co/4ijm1xIoWX
1211104548904939500,Sun Dec 29 02:00:00 +0000 2019,See how Scarlett Johansson, Halle Berry, Gordon Ramsay and others reacted to the show's ridiculously spicy "Da Bomb… https://t.co/KWPCChucUi
1211089449725022200,Sun Dec 29 01:00:00 +0000 2019,Turns out "dry mouth" and cutting carbs go hand-in-hand. https://t.co/R0CrK2fEwe
1211074351287586800,Sun Dec 29 00:00:00 +0000 2019,Here's where to book an awesome getaway right now. https://t.co/xHs4Sra0PA
1211059251344330800,Sat Dec 28 23:00:00 +0000 2019,The answer might surprise you. https://t.co/L0S7KOpslg
1211044151871123500,Sat Dec 28 22:00:00 +0000 2019,It's the perfect way to ring in the New Year. https://t.co/kzCJYe2QnK
1211029052976316400,Sat Dec 28 21:00:00 +0000 2019,The clip has led many to compare the actress to the famously flexible character Gumby. https://t.co/NyLn9AyqEf
1211013951401726000,Sat Dec 28 20:00:00 +0000 2019,Stay in one of the jaw-dropping Utah getaway's 10 canvas-roofed pavilions, and chill out in your own private pool. https://t.co/JrVsdxxaRG
1210998853534716000,Sat Dec 28 19:00:00 +0000 2019,Rain rubber down on your co-workers at 200 shots per minute. https://t.co/xPdR5i0Dux
1210983754648424400,Sat Dec 28 18:00:00 +0000 2019,The three-deck watercraft concept would submerge to depths of 985 feet and offer breathtaking views of deep-sea lif… https://t.co/IICxwSHyqK
1210968654554095600,Sat Dec 28 17:00:00 +0000 2019,Quench your wanderlust in 2020 with a visit to these stylish hideaways. https://t.co/WfRMBBMyWv
1210953555407863800,Sat Dec 28 16:00:00 +0000 2019,For the sake of a good workout, go take a nap. https://t.co/3cSlfhKb65
1210938453950521300,Sat Dec 28 15:00:00 +0000 2019,Here's your chance to own a piece of modern military history. https://t.co/5U3Wg7B3tH
1210930904664666000,Sat Dec 28 14:30:00 +0000 2019,The British bombshell is 38 today—celebrate with her hottest shots. https://t.co/MriNjKlYNb
1210919705265004500,Sat Dec 28 13:45:30 +0000 2019,Each of these stunning Italian supercars is rarer than the last. https://t.co/Am0srmpaSP
1210772360090939400,Sat Dec 28 04:00:00 +0000 2019,The EBIOS Project is essentially a prototype design for a Martian colony. https://t.co/0563LPDmW1
1210757261934633000,Sat Dec 28 03:00:00 +0000 2019,The MPAA doesn't play. https://t.co/6VFw4OWgxl
1210742160883994600,Sat Dec 28 02:00:00 +0000 2019,Baldies rejoice! https://t.co/6ln0HKNsmM
1210727060848676900,Sat Dec 28 01:00:00 +0000 2019,Totally badass. https://t.co/9VDZPfFCEc
1210711961962303500,Sat Dec 28 00:00:00 +0000 2019,Yet another reason to pour yourself a glass. https://t.co/UOlxohWTjk
1210696863520870400,Fri Dec 27 23:00:00 +0000 2019,Who was your favorite? https://t.co/qzvfyCJOrz
1210681763954999300,Fri Dec 27 22:00:00 +0000 2019,These outrageously pricey pads are for extreme ballers only. https://t.co/bWSQIePKmF
1210666664464773000,Fri Dec 27 21:00:00 +0000 2019,Designed by Israeli special forces veterans ,this monstrous multi-tool aims to be "your de-facto essential for ever… https://t.co/EbsAGzjKiu
1210651564253167600,Fri Dec 27 20:00:00 +0000 2019,This historic Raging Bull is reimagined as a menacing hot rod. https://t.co/lV0pGt04jw
1210636465928978400,Fri Dec 27 19:00:00 +0000 2019,These alcohol-free craft beers aimed at sober-curious drinkers are a big upgrade from O'Doul's. https://t.co/WbU8vZfGlk
1210621364513759200,Fri Dec 27 18:00:00 +0000 2019,Battle-ready ruggedness for your wrist. https://t.co/FR3ZnLZjUj
1210606265673621500,Fri Dec 27 17:00:00 +0000 2019,Ditch that Dad Bod with this straightforward plan. https://t.co/Thqoqt5EaA
1210598716542984200,Fri Dec 27 16:30:00 +0000 2019,Off-road awesomeness. https://t.co/RmKKeJ5Efn
1210591166795780000,Fri Dec 27 16:00:00 +0000 2019,Find out where Floyd Mayweather, Cristiano Ronaldo, LeBron James and others rate on Forbes list of the highest-earn… https://t.co/oIIo9JIroR
1210576069528629200,Fri Dec 27 15:00:01 +0000 2019,"If I’m interested in someone, they’ll know." https://t.co/EiDFwteNqQ
1210560966997336000,Fri Dec 27 14:00:00 +0000 2019,Ring in 2020 right with one of these standout stogies. https://t.co/leeLpA6iNK
1210547331696861200,Fri Dec 27 13:05:49 +0000 2019,After eight months in prison, the MTV reality star has moved from the Big House to a VERY big house. https://t.co/alO1bOTYww
1210409972208734200,Fri Dec 27 04:00:00 +0000 2019,Daniella Midenge is a star in front of and behind the lens. https://t.co/C67D36kTof
1210394872068227000,Fri Dec 27 03:00:00 +0000 2019,A badass revolver/bayonet hybrid fit for James Bond himself. https://t.co/gF0i8l5lBw
1210379772792053800,Fri Dec 27 02:00:00 +0000 2019,Turns out cutting carbs could boost your immune system's ability to fight the virus. https://t.co/7KCgvikH8d
1210364674988028000,Fri Dec 27 01:00:00 +0000 2019,Here's how to make your kicks look brand new again. https://t.co/FSpTGlhhal
1210349575535517700,Fri Dec 27 00:00:00 +0000 2019,We track-tested Ducati's glorious new superbike. https://t.co/KtnAQx4oD1
1210334474619281400,Thu Dec 26 23:00:00 +0000 2019,'Tis the season to be really really quiet. https://t.co/9En0B5rcyX
1210319374545907700,Thu Dec 26 22:00:00 +0000 2019,Meet the absurdly tough "Indestructible Puffer" jacket from Vollebak, which can keep you warm at -140 degrees Fahre… https://t.co/RCKcYWLcrD
1210304275836002300,Thu Dec 26 21:00:00 +0000 2019,A stylish and sexy tribute to the female form. https://t.co/Dyr5wEATdr
1210289176593256400,Thu Dec 26 20:00:00 +0000 2019,The luxury car icon claims the sleek new plane is "the world’s fastest all-electric aircraft." https://t.co/dvqM6Tqvz0
1210274077501460500,Thu Dec 26 19:00:00 +0000 2019,Make endless espressos with a handsome green machine that brings coffee shop quality to your home or office. https://t.co/kEtghBF9dz
1210258977570689000,Thu Dec 26 18:00:00 +0000 2019,The hip-hop mogul made a staggering $950 million in the 2010s. https://t.co/zyLab9UF5N
1210243878604828700,Thu Dec 26 17:00:00 +0000 2019,“I think more people would do well married if they didn’t have to live in the same house.” https://t.co/xFFrjA5DNe
1210228779039121400,Thu Dec 26 16:00:00 +0000 2019,It will be the first "Jackass" flick since 2010. https://t.co/63U5s1d4R7
1210213683088908300,Thu Dec 26 15:00:01 +0000 2019,That's one beautiful boat.  https://t.co/W7vLXdwbD9
1210199836672364500,Thu Dec 26 14:05:00 +0000 2019,The Kohala Coast is the ultimate winter escape — free of the crowds of Kona, this coveted idyll on the Big Island’s… https://t.co/nNCueDUcOd
1210047584489951200,Thu Dec 26 04:00:00 +0000 2019,"You're the sexy girl. You're the naked girl. Men are going to idolize your hourglass figure." https://t.co/ZJhCRiRCeQ
1210032484592713700,Thu Dec 26 03:00:00 +0000 2019,The beloved cooler brand's high-end model features a kitchen-grade stainless steel body and next-level insulation. https://t.co/soXxaBm0Qv
1210017386251853800,Thu Dec 26 02:00:00 +0000 2019,Time to get ripped. https://t.co/tYLbBfks8u
1210002285222416400,Thu Dec 26 01:00:00 +0000 2019,Definitely not dad's old fishing boat. https://t.co/fRT0U26cRL
1209987187296460800,Thu Dec 26 00:00:00 +0000 2019,A recent survey reveals that it's probably longer than you think. https://t.co/wmEQG1wW3g
1209972088519438300,Wed Dec 25 23:00:00 +0000 2019,Capture your personal winter wonderlands with this striking minimalist camera. https://t.co/BERexW8e21
1209956986705584000,Wed Dec 25 22:00:00 +0000 2019,"When building your collection, try not to look at artwork as an investment, or else you’ll run the risk of disappo… https://t.co/ddoSCEFe2V
1209941889622986800,Wed Dec 25 21:00:00 +0000 2019,Happy holidays! https://t.co/8VRlkXFumZ
1209926789235130400,Wed Dec 25 20:00:00 +0000 2019,Absolutely stunning. https://t.co/mHRqyckdW5
1209911689312755700,Wed Dec 25 19:00:00 +0000 2019,From IV treatments to hair of the dog, a new book details the best ways to make the morning after bearable. https://t.co/KdK0P4A0vo
1209896591945064400,Wed Dec 25 18:00:00 +0000 2019,Elon Musk's crazy-fast pickup will be used to chase Lamborghinis and Ferraris in the opulent Middle Eastern metropo… https://t.co/xaScPbQlES
1209881491905372200,Wed Dec 25 17:00:00 +0000 2019,Tactical jungle boots that are ready for anything. https://t.co/9X5OWSrJG4
1209866390699511800,Wed Dec 25 16:00:00 +0000 2019,From Springsteen to Madonna, here are the best versions of what would otherwise be the most annoying songs in the w… https://t.co/6MZ9lGpTGh
1209858840771977200,Wed Dec 25 15:30:00 +0000 2019,Behind the scenes of the recording of The Pogues' “Fairytale of New York.” https://t.co/rklkSSW4MV
1209844267738452000,Wed Dec 25 14:32:05 +0000 2019,"If I can please you in any way—even if it's not physical—it makes me feel satisfied and sexy." https://t.co/nlI9eAE5Gi
1209831353707040800,Wed Dec 25 13:40:46 +0000 2019,The bestselling author has some epic advice for conquering life's obstacles. https://t.co/xerjodn4iW
1209685195793805300,Wed Dec 25 04:00:00 +0000 2019,Life just isn't fair. https://t.co/XunQiGN8BS
1209677646323318800,Wed Dec 25 03:30:00 +0000 2019,Happy birthday to Lemmy Kilmister, who would have been 74 today. https://t.co/dau3aREx4A
1209658771632541700,Wed Dec 25 02:15:00 +0000 2019,The ten-part docuseries follows Jordan’s Chicago Bulls through their epic 1997-98 season as they clinch MJ’s sixth… https://t.co/4RMPaLuQjY
1209654996821631000,Wed Dec 25 02:00:00 +0000 2019,The classic rum and coke cocktail gets a tropical upgrade. https://t.co/BaVHlbvtKl
1209639898145144800,Wed Dec 25 01:00:00 +0000 2019,Whiskey Advocate says this bargain bottle is the best whiskey of the year, and https://t.co/TCgOIWnZBs tapped it as… https://t.co/CIzTfM2OQl
1209624798982094800,Wed Dec 25 00:00:00 +0000 2019,These special-edition kicks include multiple "Easter eggs" aimed at Air Max superfans. https://t.co/nFO7CWAYAy
1209609700398043100,Tue Dec 24 23:00:00 +0000 2019,High-end gunmaker Cabot unveiled its "Fire and Ice" pistol package. https://t.co/5OmDH7acow
1209594601264341000,Tue Dec 24 22:00:00 +0000 2019,The future is awesome. https://t.co/eFUXCNYase
1209579499450335200,Tue Dec 24 21:00:00 +0000 2019,Photographer Markus Henttonen captures sensual images of beautiful women for a living. https://t.co/H0KPxFtuz7
1209564402636251100,Tue Dec 24 20:00:00 +0000 2019,Just stick with good, old-fashioned booze. https://t.co/cjldvhdlm6
1209549301422186500,Tue Dec 24 19:00:00 +0000 2019,Trident Adventures, a company owned by two ex-Navy SEALs, teamed up with the Four Seasons Oahu for a VIP dive packa… https://t.co/Btg9Cu92MF
1209534206071709700,Tue Dec 24 18:00:01 +0000 2019,Here are the best ways to keep what you've got. https://t.co/X5Mvm3k9Zx
1209526651177992200,Tue Dec 24 17:30:00 +0000 2019,Elon Musk: "Whoa… the stock is so high lol." https://t.co/qTRaSqYsq1
1209519106828820500,Tue Dec 24 17:00:01 +0000 2019,Merry Yippee-Ki-Yay-mas. https://t.co/1ZVCcwG2tg
1209509035353002000,Tue Dec 24 16:20:00 +0000 2019,We tried everything so you wouldn’t have to. https://t.co/Brc9iyVfsb
1209497849676869600,Tue Dec 24 15:35:33 +0000 2019,Each of these intoxicating tipples are sure to deliver holiday cheer. https://t.co/G2O2xwKpyd
1209477621077233700,Tue Dec 24 14:15:10 +0000 2019,"There's only one rule in this jungle: When the lion's hungry, he eats." https://t.co/1WKOeHMFDI
1209473805862625300,Tue Dec 24 14:00:00 +0000 2019,See how Scarlett Johansson, Halle Berry, Gordon Ramsay and others reacted to the show's ridiculously spicy "Da Bomb… https://t.co/JFQE1N6aUj
1209462490238783500,Tue Dec 24 13:15:03 +0000 2019,Take your flight to the next level with these impressively luxe airport lounges. https://t.co/YGQbxdIrO3
1209322808683032600,Tue Dec 24 04:00:00 +0000 2019,"He has to legitimately enjoy foreplay." https://t.co/baKMNS9VpP
1209307708421099500,Tue Dec 24 03:00:00 +0000 2019,As mob boss Russell Bufalino says, "It's what it is." https://t.co/Nu96sNrlq0
1209292610742947800,Tue Dec 24 02:00:00 +0000 2019,Follow these simple steps to ensure personal privacy when you're using an iPhone, Android or Google Pixel. https://t.co/TX8bTx28RN
1209277511248547800,Tue Dec 24 01:00:00 +0000 2019,This is soooo clucking good. https://t.co/j00kqzULxr
1209262411053752300,Tue Dec 24 00:00:00 +0000 2019,Book the trip you deserve this winter and visit one of these high-end watering holes. https://t.co/OHNcND6bSJ
1209247310535893000,Mon Dec 23 23:00:00 +0000 2019,"If I'm giving a man my time, he should know I am interested." https://t.co/RrdNRMBMBk
1209232213335609300,Mon Dec 23 22:00:00 +0000 2019,This historic Raging Bull is reimagined as a menacing hot rod. https://t.co/lV0pGt04jw
1209217114776563700,Mon Dec 23 21:00:00 +0000 2019,It's the first scratch-resistant yellow sapphire timepiece created by a luxury watchmaker. https://t.co/3V1gdiw2F7
1209194462296989700,Mon Dec 23 19:30:00 +0000 2019,The new Heritage Edition Package salutes Carroll Shelby's iconic 1965 fastback coupe. https://t.co/Ly5UD8iqpJ
1209186912512012300,Mon Dec 23 19:00:00 +0000 2019,Bringing the latest GORE-TEX tech to the iconic white leather tennis sneakers. https://t.co/M3w6lYI8fh
1209186912503816200,Mon Dec 23 19:00:00 +0000 2019,Every time Hans Gruber falls from Nakatomi Plaza, an angel gets its wings. https://t.co/LlwChdLdRV
1209171813265109000,Mon Dec 23 18:00:00 +0000 2019,Celebrate with bottles of bubbly for every damn price point. https://t.co/QoRwRZZI26
1209156718258729000,Mon Dec 23 17:00:01 +0000 2019,The binge-worthy fantasy series has been favorably compared to "Game of Thrones." https://t.co/wtGWBLR1aT
1209149164132552700,Mon Dec 23 16:30:00 +0000 2019,The controversial former NFL quarterback's "True to 7" limited edition Nikes sold out in North America ahead of its… https://t.co/rpW4RHaA65
1209142873070784500,Mon Dec 23 16:05:00 +0000 2019,The enduring frontman and true voice of Grunge is 55 today. https://t.co/GoOXMzOkKI
1209126514572218400,Mon Dec 23 15:00:00 +0000 2019,Clocking in at a strong 8 to 10 percent ABV. these holiday beers are definitely brewed for "Eight Crazy Nights". https://t.co/vIwdPtgD23
1209115191021052000,Mon Dec 23 14:15:00 +0000 2019,"I really like a witty person. Someone who can make me laugh.” https://t.co/f3q1lcqW5w
1209101674385674200,Mon Dec 23 13:21:17 +0000 2019,These eco-friendly bottles offer purer flavors and fewer hangovers. https://t.co/Fo0FxOWUiW
1208960421459189800,Mon Dec 23 04:00:00 +0000 2019,The EBIOS Project is essentially a prototype design for a Martian colony. https://t.co/0563LPDmW1
1208945322224783400,Mon Dec 23 03:00:00 +0000 2019,We'll drink to that. https://t.co/GHAHL6tyw8
1208930221497278500,Mon Dec 23 02:00:00 +0000 2019,"I approach supercars in a way that is going to appeal to 99% of people, instead of the one percent of car experts.” https://t.co/wTEwRPCXp9
1208915123655630800,Mon Dec 23 01:00:00 +0000 2019,"My biggest celebrity crush would most definitely be Elsa Hosk!" https://t.co/8LSwBdcZ6O
1208900023468978200,Mon Dec 23 00:00:00 +0000 2019,If you've ever wanted to snag a truly great timepiece before it becomes invaluable, the time is now. https://t.co/VGWrD05Ij7
1208884923735695400,Sun Dec 22 23:00:00 +0000 2019,The next-gen console will literally be a game changer. https://t.co/8YP2DhGKjK
1208869824564203500,Sun Dec 22 22:00:00 +0000 2019,The award-winning Beatrice Inn chef and cookbook author serves up a roasted rack of lamb that's guaranteed to impre… https://t.co/MsyMop8RWP
1208854725195636700,Sun Dec 22 21:00:00 +0000 2019,The unsung heroes of the holiday movie season. https://t.co/hnBtdGoehe
1208839624358908000,Sun Dec 22 20:00:00 +0000 2019,Ring in the new year with these sharp-looking kicks. https://t.co/UEmoAVY9SE
1208824525426585600,Sun Dec 22 19:00:00 +0000 2019,Your guide to the best bars, restaurants and hotels in the Motor City. https://t.co/TTD92aSCZR
1208809427047862300,Sun Dec 22 18:00:00 +0000 2019,Should you skip it or nah? https://t.co/bNc6T9FKKK
1208790551014838300,Sun Dec 22 16:45:00 +0000 2019,"Bears was popping elves in their mouths like Skittles." https://t.co/9wHN5pKBvD
1208779229124415500,Sun Dec 22 16:00:00 +0000 2019,Fight the Dark Side in style. https://t.co/SdQCCif7UK
1208764130481471500,Sun Dec 22 15:00:01 +0000 2019,Turns out cutting carbs could boost your immune system's ability to fight the virus. https://t.co/7KCgvi35JD
1208752808385810400,Sun Dec 22 14:15:01 +0000 2019,“I think more people would do well married if they didn’t have to live in the same house.” https://t.co/xFFrjzO2VG
1208598033014952000,Sun Dec 22 04:00:00 +0000 2019,WOW. https://t.co/ibltqalNp5
1208582933067419600,Sun Dec 22 03:00:00 +0000 2019,The Forever Floatride Grow is constructed from castor beans, algae, eucalyptus trees and natural rubber. https://t.co/KcMIq6qoj1
1208567833321517000,Sun Dec 22 02:00:00 +0000 2019,These ultra-luxe trains put Amtrak to shame. https://t.co/OBsxPv2Nsn
1208552733877260300,Sun Dec 22 01:00:00 +0000 2019,Meet the absurdly tough "Indestructible Puffer" jacket from Vollebak, which can keep you warm at -140 degrees Fahre… https://t.co/5Iw6PXEsbj
1208537640116641800,Sun Dec 22 00:00:01 +0000 2019,Britain’s deBolex Engineering coachbuilds are one-off masterpieces. https://t.co/MaW27bmvJi
1208522536746700800,Sat Dec 21 23:00:00 +0000 2019,Meat lovers, pay attention. https://t.co/gj0In9svJV
1208507437336137700,Sat Dec 21 22:00:00 +0000 2019,The Italian fashion mogul started from the bottom, and now has an estimated net worth of $10 billion. https://t.co/KFqGxSDq0a
1208492336625242000,Sat Dec 21 21:00:00 +0000 2019,Did your post-coital routine make the list? https://t.co/omi7vykVpW
1208477237948960800,Sat Dec 21 20:00:00 +0000 2019,These outrageously pricey pads are for extreme ballers only. https://t.co/bWSQIey9v7
1208462136814387200,Sat Dec 21 19:00:00 +0000 2019,Simply stunning. https://t.co/MvHzilaxFR
1208447041111810000,Sat Dec 21 18:00:01 +0000 2019,Richly-detailed Italian craftsmanship at its finest.  https://t.co/LcgpG8tObL
1208435712930058200,Sat Dec 21 17:15:00 +0000 2019,Out of this world. https://t.co/Ors4gLSdVq
1208423129988550700,Sat Dec 21 16:25:00 +0000 2019,This Southeast Asian city offers a lifestyle of luxury and opulence found in few other places on Earth. https://t.co/h5rKzWrhvT
1208410564386533400,Sat Dec 21 15:35:04 +0000 2019,These alcohol-free craft beers aimed at sober-curious drinkers are a big upgrade from O'Doul's. https://t.co/WbU8vZxhJU
1208386641536012300,Sat Dec 21 14:00:00 +0000 2019,Her mom Lisa Bonet starred in the 2000 movie version. https://t.co/0CNcsJwdtd
1208376706903552000,Sat Dec 21 13:20:32 +0000 2019,Here's your chance to own a piece of modern military history.  https://t.co/5U3Wg7SESh
1208235645631467500,Sat Dec 21 04:00:00 +0000 2019,If you like s'mores-flavored beer, you'll be one happy camper. https://t.co/jRFkkmZNU5
1208220544895770600,Sat Dec 21 03:00:00 +0000 2019,The Acer Predator Thronos Air boasts a massage function, a triple-monitor mount, footrest, adjustable keyboard and… https://t.co/wrvbrM7vPt
1208205447150407700,Sat Dec 21 02:00:00 +0000 2019,Heat up your cold weather scent with these warm and woodsy fragrances. https://t.co/NidJYTQ2MP
1208190347538382800,Sat Dec 21 01:00:00 +0000 2019,Who was your favorite? https://t.co/qzvfyCsd2Z
1208175246584533000,Sat Dec 21 00:00:00 +0000 2019,Whether you're looking for a casual fling or something more serious, this guide reveals the perfect sign for you. https://t.co/FdFaFa96E9
1208160148482596900,Fri Dec 20 23:00:00 +0000 2019,We track-tested Ducati's glorious new superbike. https://t.co/KtnAQx4oD1
1208145047981445000,Fri Dec 20 22:00:00 +0000 2019,Plus: Rogan and Brendan Schaub discuss why Conor McGregor vs. Cowboy Cerrone will be a "phenomenal fight." https://t.co/kfVli6VfbC
