id,created_at,text
1260600697424433200,Wed May 13 16:00:01 +0000 2020,What you need to know for #TopGunDay.  https://t.co/nBhXmnxaEP
1260585594280743000,Wed May 13 15:00:00 +0000 2020,Get your drink on. https://t.co/fMSdFzlers
1260570491984601000,Wed May 13 14:00:00 +0000 2020,Enter The Birdman's virtual skate world in 4K HD. https://t.co/P9u1VYXnTH
1260559167581978600,Wed May 13 13:15:00 +0000 2020,The timepiece has been made with a stainless-steel case and band and distinctive, laser-carved grid. https://t.co/xAbeqHAA1p
1260404399198920700,Wed May 13 03:00:00 +0000 2020,The athleticwear giant's big leap forward in running shoes is getting a reboot. https://t.co/6tiy1rmxlZ
1260389300199469000,Wed May 13 02:00:00 +0000 2020,A classic Ferrari racer could take flight in the form of a V12-powered tricopter. https://t.co/x1mNUW9wNB
1260359100384198700,Wed May 13 00:00:00 +0000 2020,The James Bond bombshell has a license to thrill when it comes to sexy swimwear. https://t.co/PpkTFYbrh0
1260344000625729500,Tue May 12 23:00:00 +0000 2020,Tinned anchovies take this easy-to-make dish to the next level. https://t.co/X3cqJH9Go8
1260328901403750400,Tue May 12 22:00:00 +0000 2020,Explore the undersea world in this compact two-seat submersible. https://t.co/8mcIlMcfnE
1260317575742816300,Tue May 12 21:15:00 +0000 2020,The eye-catching kicks are paired with an equally stunning custom surfboard. https://t.co/VadJTIC1W5
1260306251071643600,Tue May 12 20:30:00 +0000 2020,Get speedy with a cup of java from this limited-edition beauty. https://t.co/Jo9RyrUb6y
1260292676794056700,Tue May 12 19:36:03 +0000 2020,Lord have mercy. https://t.co/LxwY6VglQl
1260269760891310000,Tue May 12 18:05:00 +0000 2020,Don't fear the Reaper. https://t.co/NJ2OKPNPBD
1260253407220248600,Tue May 12 17:00:01 +0000 2020,The Sandman's latest "quarantune" features raps about life in lockdown, napping with Shaq, and watching ESPN's "The… https://t.co/WizxJMR1DU
1260238308027830300,Tue May 12 16:00:01 +0000 2020,The Mayor of Flavortown faces off with a comedy icon for a great cause. https://t.co/AGlapaghhR
1260226979112124400,Tue May 12 15:15:00 +0000 2020,"I'm back." The 53-year-old boxing legend still looks scary as hell in two new training videos. https://t.co/iIowHsQ8qk
1260208110104244200,Tue May 12 14:00:01 +0000 2020,These sci-fi kicks are out of this world. https://t.co/3IoXkN3iKR
1260196780018294800,Tue May 12 13:15:00 +0000 2020,A lightweight, fitness-oriented timepiece that clocks in at an affordable price. https://t.co/zieSjeAXjy
1260187989982011400,Tue May 12 12:40:04 +0000 2020,A classic muscle car has been transformed into a murdered-out masterpiece. https://t.co/uftVJZxfRL
1260030710800236500,Tue May 12 02:15:06 +0000 2020,Austin BBQ legend Aaron Franklin says his pits are built for "purists who want to take their craft to the next leve… https://t.co/7xSj6ulr4O
1260015586030936000,Tue May 12 01:15:00 +0000 2020,“He always says if you’re going to put yourself on film you’d better give it 110 percent, cause that is going to be… https://t.co/RjIpvvcIxU
1260004261993185300,Tue May 12 00:30:00 +0000 2020,Halle Berry, Cameron Diaz, Drew Barrymore, and Juliette Lewis also take a swing at the "Boss Bitch Fight Challenge." https://t.co/VZkKDPyiqh
1259989413305573400,Mon May 11 23:31:00 +0000 2020,Social distancing could radically change the way we fly. https://t.co/a5uZZQGv7S
1259972803706736600,Mon May 11 22:25:00 +0000 2020,Benchmade updates the Bugout with a carbon fiber handle and stainless steel blade. https://t.co/Gh0mfjHQKS
1259957704212308000,Mon May 11 21:25:00 +0000 2020,Balmuda's "The Toaster" uses steam to lightly toast bread and trap in flavor. https://t.co/6FKzVX4dWv
1259940096305959000,Mon May 11 20:15:02 +0000 2020,The fighter jet-inspired timepiece features three superimposed layers and a green tint that mimic a cockpit's Heads… https://t.co/Xjb1fnAQGf
1259926247229939700,Mon May 11 19:20:00 +0000 2020,We appreciate the dedication to their craft. https://t.co/pG2y7GIymV
1259914922634305500,Mon May 11 18:35:00 +0000 2020,Better grab a tissue.   https://t.co/Ppua6sTClM
1259891018385756200,Mon May 11 17:00:01 +0000 2020,Old Fashioned, Sidecar and Citrus Gimlet-flavored hard seltzers are here. https://t.co/dTcfNlqIDM
1259875920074047500,Mon May 11 16:00:01 +0000 2020,"The Worm" has a hot new take on the MJ vs. LeBron debate--and reveals where Scottie Pippen ranks among the all-tim… https://t.co/W2Je2onziG
1259860821191979000,Mon May 11 15:00:01 +0000 2020,Where to eat, drink, stay and play in the gorgeous Caribbean island. https://t.co/p7KXFjyYlh
1259845718891573200,Mon May 11 14:00:00 +0000 2020,Sales of this bold Mexican whiskey benefit bar and restaurant workers who lost their jobs because of the Coronaviru… https://t.co/o5AyvmtKgi
1259834392525992000,Mon May 11 13:15:00 +0000 2020,The $25,000-per-night getaway is what vacation dreams are made of. https://t.co/xY3UXOcFwZ
1259829512088498200,Mon May 11 12:55:36 +0000 2020,"The events we're currently living through expose the need for Americans to become more educated and active in the… https://t.co/3Ofzjut2AY
1259679622683295700,Mon May 11 03:00:00 +0000 2020,The SuperRep Cycle is made for spin-class warriors and other exercise bikers working out at home. https://t.co/Dkq5TyTdtB
1259656972900548600,Mon May 11 01:30:00 +0000 2020,Check out the stunning nude pics here. https://t.co/U8KwmLNwSH
1259634324220948500,Mon May 11 00:00:00 +0000 2020,"It’s not necessarily about one-upping myself to the next epic… because I think that’s probably a road to certain d… https://t.co/6CGO59VAZz
1259619223917064200,Sun May 10 23:00:00 +0000 2020,High-octane driving gear that puts the pedal to the metal. https://t.co/Z3DhTSBf2P
1259607899392925700,Sun May 10 22:15:00 +0000 2020,The new Kruger Shalati Train Lodge is perfect for a social distancing-friendly getaway. https://t.co/kG8kmvQTUb
1259589026102853600,Sun May 10 21:00:00 +0000 2020,Grab his Airness' original kicks. https://t.co/rC1LdNfdUX
1259573928428699600,Sun May 10 20:00:00 +0000 2020,When you're sleep-deprived, hitting the gym is pretty much pointless. https://t.co/3YlIeU1top
1259558827923472400,Sun May 10 19:00:00 +0000 2020,Step away from the soy sauce. https://t.co/DBRcG6la32
1259548759811219500,Sun May 10 18:20:00 +0000 2020,Follow these essential tips to build a profitable craft brewing business. https://t.co/yixf9KLuL4
1259536473763831800,Sun May 10 17:31:11 +0000 2020,EmRata is heating up Instagram with a racy bikini video and photos. https://t.co/mRPtnep4t0
1259514786271727600,Sun May 10 16:05:00 +0000 2020,All hail the Mayor of Flavortown. https://t.co/bpJhcdcYwx
1259495938743246800,Sun May 10 14:50:06 +0000 2020,Step up your loafer game.  https://t.co/87Jq7ju9fK
1259474520835936300,Sun May 10 13:25:00 +0000 2020,The award-winning Iowa whiskey clocks in at 113 proof.  https://t.co/ETZwSsbUfR
1259353592554815500,Sun May 10 05:24:28 +0000 2020,Bring on Khabib! https://t.co/tz9SRX7iDN
1259350877825097700,Sun May 10 05:13:41 +0000 2020,Congrats to @Justin_Gaethje for a dominant win! https://t.co/kmsWnaqx9r
1259338832820011000,Sun May 10 04:25:49 +0000 2020,It's about to get real. Who you got in #UFC249 ? @Justin_Gaethje or @TonyFergusonXT ?
1259336472626450400,Sun May 10 04:16:27 +0000 2020,RT @ufc: Flyweight title defended ✅ Bantamweight title defended ✅  DON'T. DOUBT. @HenryCejudo! #UFC249 https://t.co/dS4HhehUFZ
1259330657651773400,Sun May 10 03:53:20 +0000 2020,RT @danawhite: Justin Gaethje has arrived! #UFC249 https://t.co/84BPTgLlEn
1259329708065460200,Sun May 10 03:49:34 +0000 2020,Hell yes! https://t.co/fKpjBpfq66
1259329431904161800,Sun May 10 03:48:28 +0000 2020,Whoo boy, this #UFC249 is off to a good start!
1259329231332544500,Sun May 10 03:47:40 +0000 2020,RT @ufc: Ready for his ultimate highlight.  @Justin_Gaethje has his sight set on gold TONIGHT. #UFC249  Get the E+ PPV ➡️ https://t.co/mxpT…
1259327931400294400,Sun May 10 03:42:30 +0000 2020,@ufc @francis_ngannou WOW! Congrats @francis_ngannou !
1259327098877096000,Sun May 10 03:39:12 +0000 2020,RT @ufc: ARE YOU KIDDING?! 🤯🤯  @Francis_Ngannou with his FOURTH consecutive first-round KO! WOW! #UFC249 https://t.co/1M6Fh0GQpi
1259326971051458600,Sun May 10 03:38:41 +0000 2020,RT @ufc: 𝐒𝐂𝐀𝐑𝐘. 𝐏𝐎𝐖𝐄𝐑.  🇨🇲 @Francis_Ngannou #UFC249 https://t.co/2suF1YjW7M
1259317236126199800,Sun May 10 03:00:00 +0000 2020,Only 100 of these limited-edition beauties will be made. https://t.co/FeclqZAyO3
1259302135277031400,Sun May 10 02:00:00 +0000 2020,"Alexa, order more shampoo." https://t.co/KOJjXsu0Tb
1259287035233230800,Sun May 10 01:00:00 +0000 2020,Reopening gyms will have to take social distancing--and cleaning--more seriously than ever before. https://t.co/DGewSVKsHd
1259271937332637700,Sun May 10 00:00:00 +0000 2020,Absolutely stunning. https://t.co/aU5HMYyqL6
1259256838564053000,Sat May 09 23:00:00 +0000 2020,"My guiltiest pleasures are White Russians, gangster movies, Stephen King books, tiramisu, pasta and some things I’… https://t.co/bh21QVCTOZ
1259241739379851300,Sat May 09 22:00:00 +0000 2020,Renters are going crazy for this quirky California cabin. https://t.co/EQ5bSaMZ6f
1259226637717119000,Sat May 09 21:00:00 +0000 2020,These gorgeous globetrotters always make traveling to exotic locales look amazing. https://t.co/2alzhwCTHX
1259211537480204300,Sat May 09 20:00:00 +0000 2020,Traeger's Ironwood 885 is a smartphone-connected supergrill. https://t.co/f7kES5Y7c4
1259196438568788000,Sat May 09 19:00:00 +0000 2020,The ultra luxury vessel won “Best Exterior Design” and “Finest New Superyacht” awards at the Monaco Yacht Show. https://t.co/jP022cA5tK
1259181341398102000,Sat May 09 18:00:00 +0000 2020,Bored at home? Get three months of free ukulele lessons online. https://t.co/02Fhs4nYKd
1259166239416397800,Sat May 09 17:00:00 +0000 2020,The high-end watchmaker will release just 100 pieces of the six new styles. https://t.co/nrf8yDVUFy
1259151140500865000,Sat May 09 16:00:00 +0000 2020,Check out this exclusive look at the German supermodel's stunning cover shoot. https://t.co/XhVplqIlI9
1259136076154916900,Sat May 09 15:00:08 +0000 2020,The ultra-popular Apple laptop is now better than ever. https://t.co/y9mjE0CksE
1259110305214455800,Sat May 09 13:17:44 +0000 2020,An ex-MLB pitcher and former NHL player teamed up to create beam, a groundbreaking new CBD wellness brand. @Beamtlc… https://t.co/fzJZNpEZPe
1258939747780554800,Sat May 09 02:00:00 +0000 2020,The GBDH1000-1A7 features multiple sensors for maximum workout efficiency. https://t.co/8djD5SgABE
1258924647346663400,Sat May 09 01:00:00 +0000 2020,Daniella Midenge is a star in front of and behind the lens. https://t.co/C67D363hZF
1258909547919544300,Sat May 09 00:00:00 +0000 2020,Totally chill. https://t.co/IZRQMouWJu
1258894450425606100,Fri May 08 23:00:00 +0000 2020,Check out this wild sneak peek at the future of commuter travel. https://t.co/YFOIqcmZPJ
1258879348695871500,Fri May 08 22:00:00 +0000 2020,Balmuda's "The Toaster" uses steam to lightly toast breads and trap in flavor. https://t.co/6FKzVX4dWv
1258864251147391000,Fri May 08 21:00:00 +0000 2020,How to properly cut your hair while quarantined at home. https://t.co/BQ0EPS4tST
1258849151455948800,Fri May 08 20:00:00 +0000 2020,Edward O. Thorp is a living legend. https://t.co/QGmv4zVrii
1258834050623565800,Fri May 08 19:00:00 +0000 2020,The "Modern Family" star was always a swimwear stunner. https://t.co/3ROIpaDQtf
1258826502340149200,Fri May 08 18:30:00 +0000 2020,Drop-top decadence. https://t.co/u2qUn1Giqv
1258818952509091800,Fri May 08 18:00:00 +0000 2020,"One band is, unbelievably luckily, still playing in stadiums, and then the other band doesn’t exist." https://t.co/jeGbUvfCLS
1258803853371334700,Fri May 08 17:00:00 +0000 2020,The Swiss Army knife maker's latest model features the brand's largest Damascus steel blade yet. https://t.co/BeypE1vngM
1258796302227378200,Fri May 08 16:30:00 +0000 2020,M&amp;D's latest luxury headphones feature eye-catching colorways in collaboration with the NBA star. https://t.co/J7ektOeCjT
1258788758775754800,Fri May 08 16:00:01 +0000 2020,From the Princess X95 luxury yacht to the stunning Cyrela  residential tower in São Paolo, the storied Italian desi… https://t.co/9kU5THYUWt
1258773655544184800,Fri May 08 15:00:01 +0000 2020,The new Kruger Shalati Train Lodge is perfect for a social distancing-friendly getaway. https://t.co/kG8kmw8uLJ
1258758556855255000,Fri May 08 14:00:01 +0000 2020,The Italian brand's new all-electric, 1,900 horsepower Battista is just the beginning. https://t.co/JH7KM7RgLB
1258743460682559500,Fri May 08 13:00:02 +0000 2020,Dwayne Johnson is serving up his own line of premium tequila. https://t.co/bjQVKUQLxR
1258732128650457000,Fri May 08 12:15:00 +0000 2020,A 1999 Chevrolet Corvette C5 was transformed into a glorious dune destroyer. https://t.co/4Tv0kf5e7L
1258592459107397600,Fri May 08 03:00:00 +0000 2020,Check out the best looks from the Italian shoemaker favored by John Legend, Common and more... https://t.co/7JUONuwjYZ
1258577360816930800,Fri May 08 02:00:00 +0000 2020,These gorgeous globetrotters always make traveling to exotic locales look amazing. https://t.co/2alzhwCTHX
1258562261091786800,Fri May 08 01:00:00 +0000 2020,We'll drink to that. https://t.co/gxXlLCLObv
1258547160414589000,Fri May 08 00:00:00 +0000 2020,This futuristic racing drone takes electric flying cars to the next level. https://t.co/hETNbIDI4W
1258532062488748000,Thu May 07 23:00:00 +0000 2020,The "Black Gold" burger may be the most outrageously over-the-top burger yet. https://t.co/ZLMGHJwdYq
1258516963363442700,Thu May 07 22:00:00 +0000 2020,Slater's wild wave pool anchors a luxury 150-room hotel and resort nestled in California's striking Coachella Valle… https://t.co/An2FT0XHyM
1258509411024138200,Thu May 07 21:30:00 +0000 2020,Will anyone want to vacation on a crowded cruise ship after the pandemic? https://t.co/TAahPgDL8I
1258498688848101400,Thu May 07 20:47:23 +0000 2020,Who you got? https://t.co/JBOm2kXEvE
1258471663647232000,Thu May 07 19:00:00 +0000 2020,High-end whiskeys, tequilas, gins, rums and aperitifs that are definitely worth your time. https://t.co/JaJnhBPXNp
1258456570465312800,Thu May 07 18:00:02 +0000 2020,The athleticwear giant's big leap forward in running shoes is getting a reboot. https://t.co/6tiy1rmxlZ
1258426371564433400,Thu May 07 16:00:02 +0000 2020,The fighter jet-inspired timepiece features three superimposed layers and a green tint that mimic a cockpit's Heads… https://t.co/tH8bL26NOr
1258411269389860900,Thu May 07 15:00:01 +0000 2020,It's the biggest executive payout in U.S. history. https://t.co/OOUTqsvkcy
1258396169551655000,Thu May 07 14:00:01 +0000 2020,The exquisite offerings include an 800-horsepower 1970 Dodge Charger, a pristine Shelby GT500, and Dale Earnhardt's… https://t.co/DMLcDSlhBq
1258381070535295000,Thu May 07 13:00:01 +0000 2020,L.A.-based entrepreneur Victor Garibay has some solid advice for business success during the pandemic.  https://t.co/8dwMMbshH3
1258374220419158000,Thu May 07 12:32:48 +0000 2020,Step up your loafer game.  https://t.co/87Jq7ju9fK
1258230071736914000,Thu May 07 03:00:00 +0000 2020,"It's the most impressive and unique flavor that the ocean gives us." https://t.co/F5ptLjB18K
1258214971202142200,Thu May 07 02:00:00 +0000 2020,Step away from the tub. https://t.co/H23XKeErFr
1258199874283036700,Thu May 07 01:00:00 +0000 2020,"I approach supercars in a way that is going to appeal to 99% of people, instead of the one percent of car experts.” https://t.co/wTEwRPCXp9
1258184773773779000,Thu May 07 00:00:00 +0000 2020,Because your diet can change your life. https://t.co/zh0qnVuDNw
1258169673318793200,Wed May 06 23:00:00 +0000 2020,The 78-foot vessel's A.I. assistant "functions much like a sea-bound Alexa, but with the addition of facial recogni… https://t.co/KNiQwjWD2A
1258154574013255700,Wed May 06 22:00:00 +0000 2020,High-end whiskeys, tequilas, gins, rums and aperitifs that are definitely worth your time. https://t.co/JaJnhBPXNp
1258139476825694200,Wed May 06 21:00:01 +0000 2020,The CRKT Provoke is as useful as it is lethal. https://t.co/Fqm28s61oN
1258124374546227200,Wed May 06 20:00:00 +0000 2020,Here's why you're applying cologne totally wrong... https://t.co/tpFIpyVzV5
1258109277765542000,Wed May 06 19:00:01 +0000 2020,Get speedy with a cup of java from this limited-edition beauty. https://t.co/Jo9RysbMv8
1258094177356787700,Wed May 06 18:00:00 +0000 2020,These sustainable sneakers don't sacrifice classic Converse style. https://t.co/vqyDpxvF7u
1258086626149924900,Wed May 06 17:30:00 +0000 2020,The Audi super SUV boasts insane power and a sinister black and gold paint job. https://t.co/LZ2NOvgVE1
1258063978502041600,Wed May 06 16:00:00 +0000 2020,Bruce Lee, Lance Armstrong, and the Mark McGwire/Sammy Sosa home run rivalry are getting the "30 for 30" treatment. https://t.co/ogXiJvJe7v
1258048877418217500,Wed May 06 15:00:00 +0000 2020,The high-end watchmaker will release just 100 pieces of the six new styles. https://t.co/nrf8yEdw48
1258036293558206500,Wed May 06 14:10:00 +0000 2020,Expert mixologists suggest you add these under-the-radar bottles to your bar cart. https://t.co/DxTsxXTa7M
1258021194223235000,Wed May 06 13:10:00 +0000 2020,The 53-year-old boxing legend still looks scary as hell in a new training video. https://t.co/iIowHsQ8qk
1257870216283000800,Wed May 06 03:10:04 +0000 2020,Each of these six stunning finalists is destined for greatness. https://t.co/WhEjiiB5zg
1257841258351014000,Wed May 06 01:15:00 +0000 2020,Take a day off and chill. https://t.co/ABDbWrCAHw
1257827437905350700,Wed May 06 00:20:05 +0000 2020,WOW. https://t.co/ibltqalNp5
1257807286833012700,Tue May 05 23:00:00 +0000 2020,With its futuristic blended wing body, the Stealth Bomber-style plane could boast big improvements in fuel efficien… https://t.co/WoNCwIiQoE
1257792188295061500,Tue May 05 22:00:00 +0000 2020,Traeger's Ironwood 885 is a smartphone-connected supergrill. https://t.co/f7kES5Gwkw
1257777086590103600,Tue May 05 21:00:00 +0000 2020,This limited-edition 100-proof Kentucky whiskey celebrates  Buffalo Trace distillery's first owner. https://t.co/KNdwrXq28k
1257761987380957200,Tue May 05 20:00:00 +0000 2020,For the car collector who has absolutely everything. https://t.co/10AJZYa2Xe
1257746889119690800,Tue May 05 19:00:00 +0000 2020,EmRata is heating up Instagram with a racy bikini video and photos. https://t.co/mRPtneGFky
1257731788891357200,Tue May 05 18:00:00 +0000 2020,Enjoy this #CincodeMayo with these killer tequilas. https://t.co/VwJL9SAki4
1257716691850551300,Tue May 05 17:00:01 +0000 2020,Halle Berry, Cameron Diaz, Drew Barrymore, and Juliette Lewis also take a swing at the "Boss Bitch Fight Challenge." https://t.co/VZkKDPyiqh
1257706621343608800,Tue May 05 16:20:00 +0000 2020,The "Top Gun: Maverick" star would be the first actor to film outer space stunts. https://t.co/WeWobyK9UN
1257692780299722800,Tue May 05 15:25:00 +0000 2020,Ad-Rock, Adam Scott, Nick Offerman, Sarah Silverman, Rosie Perez, A$AP Rocky, Nick Kroll and Ben Stiller recall the… https://t.co/kzTEi5Kq1c
1257672647795552300,Tue May 05 14:05:00 +0000 2020,The new Kruger Shalati Train Lodge is perfect for a social distancing-friendly getaway. https://t.co/kG8kmw8uLJ
1257660064829227000,Tue May 05 13:15:00 +0000 2020,Celebrate #CincoDeMayo with tasty canned tequila drinks. https://t.co/Hah1DR5mqd
1257650572129382400,Tue May 05 12:37:17 +0000 2020,Meet the highest-end member of Indian's 1,203cc FTR lineup.  https://t.co/JDhxO5hnKr
1257505296022470700,Tue May 05 03:00:00 +0000 2020,It's about damn time. https://t.co/ARhk91bn69
1257490196225917000,Tue May 05 02:00:00 +0000 2020,Michelin-starred chefs served up fine food and drink at the decadent annual gourmet fest. https://t.co/hEgIqjA4cg
1257475095603232800,Tue May 05 01:00:00 +0000 2020,Absolutely stunning. https://t.co/kQ54NvI1Wn
1257459996830417000,Tue May 05 00:00:00 +0000 2020,“You don’t have a second to let your mind wander, or disaster will strike like a scorpion." https://t.co/LLNdr23erT
1257444899030397000,Mon May 04 23:00:00 +0000 2020,With face masks in high demand due to coronavirus, one manufacturer moves away from fabric and paper. https://t.co/VxrOZGQijZ
1257429799502590000,Mon May 04 22:00:00 +0000 2020,Go deep with a Sharkhunter timepiece from the luxury Swiss watchmaker.  https://t.co/SdxRUUEMli
1257418472759451600,Mon May 04 21:15:00 +0000 2020,Sly's gorgeous 23-year-old daughter is a rising star. https://t.co/WOqvnSvPyR
1257407284151562200,Mon May 04 20:30:32 +0000 2020,Social distancing could radically change the way we fly. https://t.co/a5uZZQY6ws
1257389532066074600,Mon May 04 19:20:00 +0000 2020,Bored at home? Get three months of free ukulele lessons online. https://t.co/02Fhs46nSF
1257377075725578200,Mon May 04 18:30:30 +0000 2020,The ultra-popular Apple laptop is now better than ever. https://t.co/y9mjE0CksE
1257359458965041200,Mon May 04 17:20:30 +0000 2020,Go behind the scenes to see why the action hit's battle sequences are so realistic. https://t.co/AkXWCyGpYw
1257339201630228500,Mon May 04 16:00:00 +0000 2020,The SuperRep Cycle is tailored to spin-class warriors and other exercise bikers. https://t.co/Dkq5TyTdtB
1257324101036884000,Mon May 04 15:00:00 +0000 2020,"Nike made this big pitch. My father said, 'You got to be a fool to not take this deal.'" https://t.co/6orPbgtPb3
1257297676703498200,Mon May 04 13:15:00 +0000 2020,Italian stallions. https://t.co/BuyFlX9eQY
1257289030238118000,Mon May 04 12:40:38 +0000 2020,Balmuda's "The Toaster" uses steam to lightly toast breads and trap in flavor. https://t.co/6FKzVX4dWv
1257142907045326800,Mon May 04 03:00:00 +0000 2020,The upscale e-bike package has everything you need to rule the road. https://t.co/h9ajzHJO6P
1257127808704356400,Mon May 04 02:00:00 +0000 2020,"From now on, there's gonna be nothing but short, short skirts around the house." https://t.co/txtadoQof4
1257112708773789700,Mon May 04 01:00:00 +0000 2020,Stunning ski slopes, incredible views and a mountain-top automotive museum make this Austrian destination a must-vi… https://t.co/quP7JfQC1W
1257097610671906800,Mon May 04 00:00:00 +0000 2020,SWEET. https://t.co/4Z6mheYciV
1257082509566922800,Sun May 03 23:00:00 +0000 2020,Follow these essential tips to build a profitable craft brewing business. https://t.co/yixf9KtTTw
1257067411452448800,Sun May 03 22:00:00 +0000 2020,“He always says if you’re going to put yourself on film you’d better give it 110 percent, cause that is going to be… https://t.co/o0rG6BO61K
1257052310645211100,Sun May 03 21:00:00 +0000 2020,This awesomely armored SUV concept is made for the end of the world. https://t.co/POnbxTtcOT
1257037210311897000,Sun May 03 20:00:00 +0000 2020,Who you got? https://t.co/JBOm2kXEvE
1257022113526894600,Sun May 03 19:00:00 +0000 2020,These special editions of iconic divers incorporate killer modern upgrades. https://t.co/BwEYOQHduy
1257007014108106800,Sun May 03 18:00:00 +0000 2020,Here's why intermittent fasting could be a good move in 2020. https://t.co/bUiPpKQPaP
1256991914408083500,Sun May 03 17:00:00 +0000 2020,Level up with new DualSense features like adaptive triggers, haptic response and headset-free gameplay. https://t.co/wzhXpKtFUc
1256976813689102300,Sun May 03 16:00:00 +0000 2020,These blacked-out high-tops are built to pull double duty on the court and the street. https://t.co/QaHT2H3zct
1256961716425912300,Sun May 03 15:00:01 +0000 2020,It's a breath of fresh air. https://t.co/mlgW827lcH
1256946616705134600,Sun May 03 14:00:01 +0000 2020,All prequels, the original trilogy, and the final three movies ending with "The Rise of Skywalker" will be availabl… https://t.co/IC536NLu3k
1256935504118976500,Sun May 03 13:15:51 +0000 2020,Check out this wild sneak peek at the future of commuter travel. https://t.co/YFOIqc5oYb
1256780520370757600,Sun May 03 03:00:00 +0000 2020,Channel your inner bike builder with a 646-piece Lego model of the glorious Italian superbike. https://t.co/sWDHJkJ3mS
1256765419412586500,Sun May 03 02:00:00 +0000 2020,"St. Tropez Soleil" is a photo-filled ode to the French Riviera. https://t.co/6UCnwixfaA
1256750321918832600,Sun May 03 01:00:00 +0000 2020,Find out why it's never been a better time to enjoy mezcal. https://t.co/JRIAJm4Oyy
1256735221954891800,Sun May 03 00:00:00 +0000 2020,Reopening gyms will have to take social distancing--and cleaning--more seriously than ever before. https://t.co/DGewSVsRPF
1256720122451984400,Sat May 02 23:00:00 +0000 2020,Follow these simple steps to ensure personal privacy when you're using an iPhone, Android or Google Pixel. https://t.co/TX8bTx28RN
1256705022898974700,Sat May 02 22:00:00 +0000 2020,From Fleetwood Mac to The Fugees, these iconic album covers have been altered for the six-foot rule. https://t.co/kii9Z6RTz0
1256689923530223600,Sat May 02 21:00:00 +0000 2020,"I like stylish guys with beautiful smiles." https://t.co/uVmrgasPIu
