id,created_at,text
1229441626155688000,Mon Feb 17 16:25:00 +0000 2020,Drizzy's Astronomia Casino is the height of sophisticated luxury watchmaking. https://t.co/gV8rUuoJo0
1229420240208941000,Mon Feb 17 15:00:01 +0000 2020,New technology allows both patient and physician to immediately know a medication's cost when it is prescribed. https://t.co/gWiPAdyl5B
1229405366297006000,Mon Feb 17 14:00:55 +0000 2020,Fans of Lamborghini,  Ferrari, Porsche, McLaren and the Ford GT are in for a treat. https://t.co/SkXknaoLK8
1229392631878312000,Mon Feb 17 13:10:19 +0000 2020,These standout bottles are required drinking for fans of All-American whiskey. https://t.co/hT2mHUz9S9
1229239041952026600,Mon Feb 17 03:00:00 +0000 2020,A psychologist reveals exactly how this mind-expanding combo can augment creativity. https://t.co/zjoyU5DqDt
1229223941866172400,Mon Feb 17 02:00:00 +0000 2020,The eye-popping kicks were first teased in Scott's "Jackboys" video. https://t.co/zgwCYWOm6e
1229208843453898800,Mon Feb 17 01:00:00 +0000 2020,"We all fear, but fear can be a gift." https://t.co/mY5G840Hxt
1229193744286535700,Mon Feb 17 00:00:00 +0000 2020,Venture underground into this astonishing geological wonder. https://t.co/IJQzWrTXOU
1229178643961639000,Sun Feb 16 23:00:00 +0000 2020,"I approach supercars in a way that is going to appeal to 99% of people, instead of the one percent of car experts.” https://t.co/wTEwRPCXp9
1229163544631005200,Sun Feb 16 22:00:00 +0000 2020,The Nebia Moen just might be the future of getting clean. https://t.co/Ez0oQxTplw
1229148445367095300,Sun Feb 16 21:00:00 +0000 2020,It's a totally unique way to make whiskey. https://t.co/vWRO2C82Gk
1229133345315049500,Sun Feb 16 20:00:00 +0000 2020,From the high seas to the Great Pyramids, these historic timepieces have been everywhere. https://t.co/3MueHO0Y24
1229127053275955200,Sun Feb 16 19:35:00 +0000 2020,With 2,700 horsepower it's like a supercar on the open water.  https://t.co/CfWvngK6Ll
1229118247297044500,Sun Feb 16 19:00:00 +0000 2020,The singer rocks bikini pics of her "raw, real" self as rumors swirl that she's dating "Bachelorette" star Mike Joh… https://t.co/fxoz3zuh6r
1229103147207024600,Sun Feb 16 18:00:00 +0000 2020,The PS5 will feature high-tech controllers that can mimic the sensation of crashing a car or drawing back a bow and… https://t.co/Vvm0qsb9RM
1229088047385456600,Sun Feb 16 17:00:00 +0000 2020,Make endless espressos with a handsome green machine that brings coffee shop quality to your home or office. https://t.co/kEtghBF9dz
1229072946951409700,Sun Feb 16 16:00:00 +0000 2020,Take your flight to the next level with these impressively luxe airport lounges. https://t.co/YGQbxe02FB
1229057850267381800,Sun Feb 16 15:00:00 +0000 2020,These murdered-out limited-editions are back in black. https://t.co/xKhEx3ewsz
1229044006492893200,Sun Feb 16 14:05:00 +0000 2020,Here's an exclusive look at the Canadian supermodel's stunning cover shoot.  https://t.co/jN1Dd13zgA
1228891753840881700,Sun Feb 16 04:00:00 +0000 2020,Strap one on and go deep. https://t.co/Y0nSKXWPOk
1228876655264923600,Sun Feb 16 03:00:00 +0000 2020,Britain’s deBolex Engineering coachbuilds are one-off masterpieces. https://t.co/MaW27bmvJi
1228861553706856400,Sun Feb 16 02:00:00 +0000 2020,Don't spill on the good sheets. https://t.co/FkcYGYl4ZM
1228846454698991600,Sun Feb 16 01:00:00 +0000 2020,The Austrian marketing genius behind the world's most popular energy drink has transformed the beverage industry. https://t.co/iBfOTZynRF
1228831356223811600,Sun Feb 16 00:00:00 +0000 2020,Build your own beast of a hypercar for just $350. https://t.co/dXajLFhlDD
1228816256947478500,Sat Feb 15 23:00:00 +0000 2020,With proceeds going to Gold Star military families, it might be the most patriotic pistol set ever made. https://t.co/8wZMm7eEW0
1228801156476031000,Sat Feb 15 22:00:00 +0000 2020,Take the plunge. https://t.co/v33Q43Lbse
1228786056905908200,Sat Feb 15 21:00:00 +0000 2020,Turns out it can be a heart attack on a plate. https://t.co/D2Fte5IPnO
1228770958279753700,Sat Feb 15 20:00:00 +0000 2020,It's surprisingly easy. https://t.co/67XNYVlZGD
1228755859536138200,Sat Feb 15 19:00:00 +0000 2020,Whether you're looking for a casual fling or something more serious, this guide reveals the perfect sign for you. https://t.co/FdFaF9Rvfz
1228740759899144200,Sat Feb 15 18:00:00 +0000 2020,"I give zero f–ks. I have three children. They’ve exploded my body, and I’m cool with it." https://t.co/1QaQXNgX5R
1228725662925512700,Sat Feb 15 17:00:01 +0000 2020,The all-new Weber Connect uses temperature probes to send smartphone notifications that say exactly when to flip yo… https://t.co/lhbx6qPftt
1228710563494101000,Sat Feb 15 16:00:01 +0000 2020,These 19-tool beauties come with walnut or carbon fiber handles, and are ready for practically anything. https://t.co/wJ2sV9rJDB
1228701750913192000,Sat Feb 15 15:25:00 +0000 2020,From private submarine rides to rare wildlife experiences, these unique vacations are absolutely unforgettable. https://t.co/peJP5dTTm2
1228680295488069600,Sat Feb 15 13:59:44 +0000 2020,Score killer deals on tech, household goods, menswear and more. https://t.co/WvwEsoapYP
1228514265700585500,Sat Feb 15 03:00:00 +0000 2020,France's 'Normal' magazine is back with another NSFW delight. https://t.co/qLThQv3Mzk
1228499166373929000,Sat Feb 15 02:00:00 +0000 2020,Cancel that Valentine's Day date immediately. https://t.co/N0G4HMPkGZ
1228484066980192300,Sat Feb 15 01:00:00 +0000 2020,The Acer Predator Thronos Air boasts a massage function, a triple-monitor mount, footrest, adjustable keyboard and… https://t.co/YE5SLCMRN0
1228476516666945500,Sat Feb 15 00:30:00 +0000 2020,Ready for battle. https://t.co/XHks0QxXZt
1228470103819399200,Sat Feb 15 00:04:31 +0000 2020,Congratulations to @katebock ! Check out an exclusive first look at the Canadian supermodel's stunning Maxim cover… https://t.co/SKctOw4Szv
1228468969545269200,Sat Feb 15 00:00:00 +0000 2020,No electricity needed. https://t.co/GuuZK416PC
1228453867895042000,Fri Feb 14 23:00:00 +0000 2020,A classic Ferrari racer could take flight in the form of a V12-powered tricopter. https://t.co/BQ1eXcphD1
1228443476016214000,Fri Feb 14 22:18:42 +0000 2020,The iconic streetwear brand is lending its logo to the classic @Nike sneaker. https://t.co/sPYtqtyKjT
1228438769423900700,Fri Feb 14 22:00:00 +0000 2020,Champion sailor Alex Thomson risks his life on the high seas, then comes back to land in style https://t.co/mjkADj9WxW
1228431218225496000,Fri Feb 14 21:30:00 +0000 2020,The latest version of the Japanese sports car can hit 60 mph in under four seconds. https://t.co/Hh0umKysYG
1228423668407120000,Fri Feb 14 21:00:00 +0000 2020,"I find that the more my health prospers – the more I’m in the gym, meditating, and caring for myself – the better… https://t.co/i1LLb1JRGG
1228408572033159200,Fri Feb 14 20:00:00 +0000 2020,Who was your favorite? https://t.co/qzvfyCsd2Z
1228393472748478500,Fri Feb 14 19:00:01 +0000 2020,These stunning suites take luxury vacations to a whole new level. https://t.co/Utg8tnmMAJ
1228378371001901000,Fri Feb 14 18:00:00 +0000 2020,The Instagram star's new spirit is the latest addition to his Ignite CBD and cannabis brand. https://t.co/jWmxYHIsHX
1228363275152187400,Fri Feb 14 17:00:01 +0000 2020,Benchmade updates the Bugout with a carbon fiber handle and stainless steel blade. https://t.co/Gh0mfjZrCq
1228352189023838200,Fri Feb 14 16:15:58 +0000 2020,Here's your first look at Batman's new costume. https://t.co/kyXA1XFs7v
1228348176387625000,Fri Feb 14 16:00:01 +0000 2020,The "Black Gold" burger may be the most outrageously over-the-top burger yet. https://t.co/ZLMGHJwdYq
1228336846695997400,Fri Feb 14 15:15:00 +0000 2020,She's the youngest artist to ever sing a 007 theme song. https://t.co/8n3TooauTD
1228333073483255800,Fri Feb 14 15:00:00 +0000 2020,The gamer-friendly hotels will feature virtual reality experiences, e-sports venues and geeked-out guest rooms with… https://t.co/EBbvLINHiU
1228325522880548900,Fri Feb 14 14:30:00 +0000 2020,Alpine essentials. https://t.co/Of6qjjxcZ7
1228317978568974300,Fri Feb 14 14:00:01 +0000 2020,"If you have a positive energy, are kind to others, and love to laugh like I do, I will pick up on it right away." https://t.co/s7vV8C5BC4
1228166977039896600,Fri Feb 14 04:00:00 +0000 2020,That's what she said. https://t.co/aurAfYOgd3
1228151878858338300,Fri Feb 14 03:00:00 +0000 2020,The James Bond bombshell has a license to thrill when it comes to sexy swimwear. https://t.co/PpkTFYbrh0
1228136779867250700,Fri Feb 14 02:00:00 +0000 2020,Get your Irish up with this bold new single pot whiskey.  https://t.co/vtpm0WhyLK
1228121680381431800,Fri Feb 14 01:00:00 +0000 2020,Here's how to get the most benefit out of Apple's bluetooth earbuds. https://t.co/BKVJ0JvPy8
1228106579507019800,Fri Feb 14 00:00:00 +0000 2020,The NBA All-Star Weekend kicks are the latest salute to old-school Air Jordans. https://t.co/xQiwC98ezG
1228091481082167300,Thu Feb 13 23:00:00 +0000 2020,Here's everything you need to know. https://t.co/WxK7cHuMKV
1228076381403091000,Thu Feb 13 22:00:00 +0000 2020,This eye-catching coupe is the first of only 31 911-based racers ever produced. https://t.co/0JhvPyLJSK
1228061283636801500,Thu Feb 13 21:00:00 +0000 2020,"We all fear, but fear can be a gift." https://t.co/mY5G84iip1
1228046180958912500,Thu Feb 13 20:00:00 +0000 2020,Surf's up--literally.  https://t.co/tFpk16hg6n
1228031083456929800,Thu Feb 13 19:00:00 +0000 2020,This righteous red sauce recipe comes from two of America's top Italian chefs. https://t.co/WmVfNlyEvw
1228015983878537200,Thu Feb 13 18:00:00 +0000 2020,"I was so into the story, so into what happens to Jesse, I absolutely forgot that I, Walter White, was in this movi… https://t.co/cSmEhLy9Gi
1228005916001349600,Thu Feb 13 17:20:00 +0000 2020,Look for this Maxim-branded Camaro to race at the Xfinity NASCAR Experience 300 on Saturday, February 15. https://t.co/fNkxA5dhhF
1228000886909091800,Thu Feb 13 17:00:01 +0000 2020,The fashion house would not reveal what it paid for the carbon-coated gem, which could yield millions in profit if… https://t.co/KhwmvPvPKb
1227990817073193000,Thu Feb 13 16:20:00 +0000 2020,Artist Mister Enthusiast teamed up with engraver King Nerd to turn regular Rollies into wearable art. https://t.co/DhwCt7MIVb
1227985787083321300,Thu Feb 13 16:00:01 +0000 2020,It's way better than riding a camel. https://t.co/ZOfwTSiews
1227970686787801000,Thu Feb 13 15:00:00 +0000 2020,Whoah. https://t.co/aXUznaFZs8
1227789492355915800,Thu Feb 13 03:00:00 +0000 2020,The automaker hopes to give "enjoyment to customers everywhere, on land, and now, in the sky." https://t.co/Zh7LY9qR0T
1227774391234240500,Thu Feb 13 02:00:00 +0000 2020,With input from a professional colorist and booming Dolby sound, you may never go to a real theater again. https://t.co/GYfGFQ4C7i
1227759290863145000,Thu Feb 13 01:00:00 +0000 2020,Dream boat alert! https://t.co/ru1kjzdD7n
1227744191918198800,Thu Feb 13 00:00:00 +0000 2020,The revitalized DTLA district features world-class bars, restaurants and attractions. https://t.co/3f5ENWb83Z
1227729091778031600,Wed Feb 12 23:00:00 +0000 2020,Listen up. https://t.co/pYDZOLvAFW
1227713994275872800,Wed Feb 12 22:00:00 +0000 2020,SWEET. https://t.co/4Z6mheYciV
1227698893778911200,Wed Feb 12 21:00:00 +0000 2020,The bold runners were re-imagined with a dramatic redesign. https://t.co/ew6WlzvIiq
1227686309822484500,Wed Feb 12 20:10:00 +0000 2020,Everyone from Wes Anderson favorite Bill Murray to James Bond beauty Lea Seydoux appears in the first official trai… https://t.co/RY0XyPUbt0
1227668696425828400,Wed Feb 12 19:00:00 +0000 2020,Rising artist Alexander Mijares, who has created gorgeous custom pieces for the likes of Justin Bieber and Pharrell… https://t.co/uS3I6magui
1227653597770461200,Wed Feb 12 18:00:01 +0000 2020,The model, author and TV host is "feelin’ fine at 49." https://t.co/t1BBdTynLV
1227648561170567200,Wed Feb 12 17:40:00 +0000 2020,The V8-powered sports car can lose its roof in just 6.7 seconds. https://t.co/p5hy1LT6yv
1227643528060264400,Wed Feb 12 17:20:00 +0000 2020,The foldable smartphone wars have truly begun. https://t.co/yzpT8qYBti
1227638499081408500,Wed Feb 12 17:00:01 +0000 2020,Dune destroyer. https://t.co/ql9uA1epTV
1227623397498216400,Wed Feb 12 16:00:00 +0000 2020,This smartly designed, 28-foot RV is designed for full-time living--not just vacations or weekend getaways.  https://t.co/fxUF6kLh1F
1227608299203375000,Wed Feb 12 15:00:01 +0000 2020,The six-watch capsule collection features stylish cues from iconic 007 title sequences and movie posters. https://t.co/2goche9CFi
1227600746335686700,Wed Feb 12 14:30:00 +0000 2020,Take your EDC game to the next level with this blinged-out blade. https://t.co/LHsh6MtWau
1227593199771885600,Wed Feb 12 14:00:01 +0000 2020,Cybertruck slayer? https://t.co/I9Q6fauv57
1227583130141413400,Wed Feb 12 13:20:00 +0000 2020,Awesomely '80s shades. https://t.co/ZuwOZZWE3g
1227442201434742800,Wed Feb 12 04:00:00 +0000 2020,That's what she said. https://t.co/aurAfYwFlv
1227427103835975700,Wed Feb 12 03:00:00 +0000 2020,Ready for takeoff. https://t.co/mBWxAe0KlY
1227412002512859100,Wed Feb 12 02:00:00 +0000 2020,WOW. https://t.co/ibltqaDogD
1227396905459691500,Wed Feb 12 01:00:00 +0000 2020,"It is a triumph of simplicity, an icy cold balance between spirit and vermouth and a perfect way to showcase a top… https://t.co/QnjCka7XW1
1227381803247227000,Wed Feb 12 00:00:00 +0000 2020,Renters are going crazy for this quirky California cabin. https://t.co/EQ5bSaMZ6f
1227366703794798600,Tue Feb 11 23:00:00 +0000 2020,Absolutely stunning. https://t.co/2ELM56pOQm
1227351606745862100,Tue Feb 11 22:00:00 +0000 2020,The "Birds of Prey" actress has literally never been hotter. https://t.co/FymTgAfwZ2
1227336504990675000,Tue Feb 11 21:00:00 +0000 2020,Dream boat alert. https://t.co/kKgVLcb3hg
1227328956916998100,Tue Feb 11 20:30:00 +0000 2020,With its futuristic blended wing body, the Stealth Bomber-style plane could boast big improvements in fuel efficien… https://t.co/AlDbyDooLa
1227321409266782200,Tue Feb 11 20:00:01 +0000 2020,The Nebia Moen just might be the future of getting clean. https://t.co/Ez0oQxBNWW
1227306310686867500,Tue Feb 11 19:00:01 +0000 2020,The 649-style frames were made famous in the 1961 movie "Divorce, Italian Style." https://t.co/R4BNsJ5NJo
1227291206738157600,Tue Feb 11 18:00:00 +0000 2020,Here's why intermittent fasting could be a good move in 2020. https://t.co/bUiPpKQPaP
1227286173363658800,Tue Feb 11 17:40:00 +0000 2020,Absolutely insane. https://t.co/W2K7DHRff6
1227276108275626000,Tue Feb 11 17:00:00 +0000 2020,"It takes a lot for me to be interested in a man. But if I’m really interested, I'll start making him dinner." https://t.co/z1MinFCzhx
1227268557110677500,Tue Feb 11 16:30:00 +0000 2020,The world's richest man offers advice on how to seize your financial destiny. https://t.co/brsMsLdps3
1227261012660965400,Tue Feb 11 16:00:01 +0000 2020,The rocker helped design three new bottles and more for the famed French champagne house. https://t.co/2GFLNkUsUt
1227253457721208800,Tue Feb 11 15:30:00 +0000 2020,It sold for 59 cents in 1968.  https://t.co/dJzvywplxb
1227252088742318000,Tue Feb 11 15:24:33 +0000 2020,Turns out he had more than "one shot" to perform the 2002 hit at the Academy Awards. https://t.co/tPhiU6bhAf
1227245912239460400,Tue Feb 11 15:00:01 +0000 2020,The UFC commentator, comedian and "Joe Rogan Experience" host is absolutely raking it in. https://t.co/hjQMVjw0ct
1227238358541312000,Tue Feb 11 14:30:00 +0000 2020,Indian's latest bike is equally suited for urban riding and off-road exploring. https://t.co/4O5H1zQd6g
1227230853945843700,Tue Feb 11 14:00:11 +0000 2020,Lovers of fine whisky and scotch can now place their bids. https://t.co/F3VH7DBCwz
1227079815276245000,Tue Feb 11 04:00:00 +0000 2020,Should you skip it or nah? https://t.co/bNc6T9Xm9k
1227064715593035800,Tue Feb 11 03:00:00 +0000 2020,From a Special Forces-approved moisturizer to bourbon lip balm, we've got you covered. https://t.co/3d0NUnvuyK
1227049614374629400,Tue Feb 11 02:00:00 +0000 2020,Helpful insight for your liquor cabinet—and your wallet. https://t.co/cytGMOeDSj
1227034515790598100,Tue Feb 11 01:00:00 +0000 2020,Celebrate with a steak today. https://t.co/fNjPYQ0b0O
1227019417483141000,Tue Feb 11 00:00:00 +0000 2020,Sail the seven seas in the lap of luxury with these opulent cabins. https://t.co/sRQXy1swng
1227004319024676900,Mon Feb 10 23:00:00 +0000 2020,From hanging with a horse whisperer in Barcelona to chilling with puppies in Chernobyl, Airbnb's latest package has… https://t.co/FToOO92umK
1226989218431488000,Mon Feb 10 22:00:00 +0000 2020,Greatest job ever? https://t.co/Ih8qQGdot8
1226974120698617900,Mon Feb 10 21:00:01 +0000 2020,With an estimated net worth of $7.2 billion, Malone is now the largest private landowner in the United States, with… https://t.co/913Kz2h1hF
1226966567990288400,Mon Feb 10 20:30:00 +0000 2020,The eye-popping kicks were first teased in Scott's "Jackboys" video. https://t.co/zgwCYWOm6e
1226959017492136000,Mon Feb 10 20:00:00 +0000 2020,You can't go wrong with this deliciously decadent dish. https://t.co/bMnDDhLvhS
1226951469515014100,Mon Feb 10 19:30:00 +0000 2020,Woman's health company Pink Lotus offers a one-stop marketplace for breast cancer recovery. https://t.co/uG1Z6XuFOW
1226943920766161000,Mon Feb 10 19:00:00 +0000 2020,High-end comfort and speed combine with blacked-out elegance. https://t.co/5lH3oPx6gV
1226936369769046000,Mon Feb 10 18:30:00 +0000 2020,These murdered-out limited-editions are back in black. https://t.co/xKhEx3ewsz
1226928822827679700,Mon Feb 10 18:00:01 +0000 2020,Double your pleasure. https://t.co/c7BpPUOPjp
1226913721303392300,Mon Feb 10 17:00:00 +0000 2020,Moon surface prints for space-obsessed sneaker collectors. https://t.co/3NJHzqN2wB
1226909944189878300,Mon Feb 10 16:45:00 +0000 2020,"Everybody has a plan until they get punched in the mouth." https://t.co/ERcb3ctXxL
1226906171375702000,Mon Feb 10 16:30:00 +0000 2020,Whoah. https://t.co/aXUznaFZs8
1226898622228373500,Mon Feb 10 16:00:00 +0000 2020,"My biggest celebrity crush would most definitely be Elsa Hosk!" https://t.co/8LSwBdcZ6O
1226883522662584300,Mon Feb 10 15:00:00 +0000 2020,This fun-loving fridge makes the same kind of ice you get at craft cocktail bars. https://t.co/Xz6mwr2ciX
1226875970918834200,Mon Feb 10 14:30:00 +0000 2020,From factory to legendary in 0 seconds flat. https://t.co/lfbC2QK9mu
1226868425479331800,Mon Feb 10 14:00:01 +0000 2020,From the high seas to the Great Pyramids, these historic timepieces have been everywhere. https://t.co/3MueHO0Y24
1226853324210626600,Mon Feb 10 13:00:00 +0000 2020,Korean comedy-thriller "Parasite" pulled off the shocker of the year. https://t.co/LS4dTOCz0X
1226702326108508200,Mon Feb 10 03:00:00 +0000 2020,Watch this behind-the-scenes video revealing how director Sam Mendes filmed the battlefield chaos in one of tonight… https://t.co/moc5a1zaMb
1226672127325220900,Mon Feb 10 01:00:00 +0000 2020,The storied American knifemaker is unleashing a variety of EDC blades. https://t.co/cfmWz1AV2j
1226657029026189300,Mon Feb 10 00:00:00 +0000 2020,This "Retro-Futuristic" ride is made for classic car lovers.  https://t.co/lVJh59b44F
1226641930030895000,Sun Feb 09 23:00:00 +0000 2020,Improve your life immediately with these key rules from the guy who virtually invented "biohacking." https://t.co/5bgUuXylsJ
1226633164036169700,Sun Feb 09 22:25:10 +0000 2020,"Tonight as I look around this room I realize that the Independent Spirit Awards are the ‘best personality’ awards… https://t.co/Bbte6ICioG
1226626828934275000,Sun Feb 09 22:00:00 +0000 2020,"My biggest turn-on is when someone kisses my neck and then bites the back of it." https://t.co/v0UtGwnbaG
1226611730408591400,Sun Feb 09 21:00:00 +0000 2020,No electricity needed. https://t.co/GuuZK4iHHa
1226596629530075100,Sun Feb 09 20:00:00 +0000 2020,These in-ear stunners now come with triple the battery life. https://t.co/9AcoCFh9ZX
1226581532179038200,Sun Feb 09 19:00:00 +0000 2020,High-octane driving gear that puts the pedal to the metal. https://t.co/Z3DhTSSQrp
1226566432223355000,Sun Feb 09 18:00:00 +0000 2020,Make your fine wine-fueled dreams a reality. https://t.co/eHbbDZybn3
1226556364262002700,Sun Feb 09 17:20:00 +0000 2020,"Brie our guest." https://t.co/sECvyUNcAS
1226546645942272000,Sun Feb 09 16:41:23 +0000 2020,This will be the first-ever metal bezel version of this classic timepiece. https://t.co/yHsJwaHFZ7
1226533237113213000,Sun Feb 09 15:48:06 +0000 2020,"Dominick did a tremendous job. You have totally deserved my respect, man." https://t.co/dJBFgVUBDP
1226502654563639300,Sun Feb 09 13:46:34 +0000 2020,See exclusive photos and video from the stunning model's Maxim Mexico cover shoot. https://t.co/8FqLrbPJ4S
1226355037607100400,Sun Feb 09 04:00:00 +0000 2020,Here are the best ways to keep what you've got. https://t.co/X5Mvm3BKR5
1226339940008632300,Sun Feb 09 03:00:00 +0000 2020,These are the best damn pies in the Windy City. https://t.co/KKRYAzxRHj
1226324839998226400,Sun Feb 09 02:00:00 +0000 2020,These go to 11. https://t.co/wS8I6yYbSO
1226309740411674600,Sun Feb 09 01:00:00 +0000 2020,Absolutely incredible. https://t.co/SAJpCLYUL0
1226294639663018000,Sun Feb 09 00:00:00 +0000 2020,Party down at these elite members-only hot spots. https://t.co/uLDzpzVHpK
1226279540919390200,Sat Feb 08 23:00:00 +0000 2020,Breast look ever? https://t.co/ZVUh0ZEi7E
1226264442683494400,Sat Feb 08 22:00:00 +0000 2020,Build your own beast of a hypercar for just $350. https://t.co/dXajLEZKM5
1226249341288972300,Sat Feb 08 21:00:00 +0000 2020,Agent 007 had great taste. https://t.co/LT1nYOdjYD
1226234242247557000,Sat Feb 08 20:00:00 +0000 2020,What's got into Bernadette? https://t.co/ICcCgVRs37
1226219145500381200,Sat Feb 08 19:00:00 +0000 2020,Here's why you're applying cologne totally wrong... https://t.co/tpFIpzdaMD
1226204044034625500,Sat Feb 08 18:00:00 +0000 2020,With proceeds going to Gold Star military families, it might be the most patriotic pistol set ever made. https://t.co/8wZMm7eEW0
1226188944385233000,Sat Feb 08 17:00:00 +0000 2020,It's the ultimate party yacht. https://t.co/iqkP0nI1Ny
1226173848233676800,Sat Feb 08 16:00:01 +0000 2020,An 18-month scientific study revealed the top diet to banish that gut. https://t.co/hdn0vqxuCq
1226162519221428200,Sat Feb 08 15:15:00 +0000 2020,These ladies are telling it like it is. https://t.co/vi7nE0RNyY
1226153711283536000,Sat Feb 08 14:40:00 +0000 2020,They feel the need—the need for speed. https://t.co/1bnBQJlJfr
1226133726192656400,Sat Feb 08 13:20:35 +0000 2020,This Italian stallion has the highest power-to-weight ratio of any street-legal bike in the world. https://t.co/erpbSm9fCR
1225992650920099800,Sat Feb 08 04:00:00 +0000 2020,"I've been a dancer my entire life, so I'm used to little clothing." https://t.co/emrUFmfIj0
1225977551962755000,Sat Feb 08 03:00:00 +0000 2020,Step-by-step guidelines on how to watch LG, Sony, Samsung, Amazon Fire, TCL/Roku and Vizio smart TVs worry-free. https://t.co/kQv4C7afWB
1225962451587305500,Sat Feb 08 02:00:00 +0000 2020,The massive luxury SUV is available in GMC’s off-road oriented AT4 trim for the first time. https://t.co/gnONPoA4Fg
1225947352982311000,Sat Feb 08 01:00:00 +0000 2020,It really makes all the difference. https://t.co/42RQDBy8k8
1225932253630328800,Sat Feb 08 00:00:00 +0000 2020,Check out the best looks from the Italian shoemaker favored by John Legend, Common and more... https://t.co/7JUONuwjYZ
1225917152504381400,Fri Feb 07 23:00:00 +0000 2020,Ashley Longshore's latest creation is a life-sized portrait of OBJ. https://t.co/LjTmASFMdS
1225902055866323000,Fri Feb 07 22:00:00 +0000 2020,A devilishly cool custom handgun inspired by blues legend Robert Johnson. https://t.co/yIHPi0mfBD
1225886954249523200,Fri Feb 07 21:00:00 +0000 2020,"Gimme fuel, gimme fire, gimme that which I desire..." https://t.co/anplBR5L6F
1225871856520970200,Fri Feb 07 20:00:00 +0000 2020,Ice cream and chill. https://t.co/DjpLFNx9aS
1225856754329751600,Fri Feb 07 19:00:00 +0000 2020,"I'm gonna let you in on a little secret: I'm actually the first to get a lot of sneakers." https://t.co/aWs5kxGLYn
1225852556565504000,Fri Feb 07 18:43:19 +0000 2020,"Cardio feels great. I’m lighter than I normally am, and I just feel perfect." #UFC247 https://t.co/t5Yd9JU3SR
1225841657309872000,Fri Feb 07 18:00:00 +0000 2020,Skip that "Sideways"-inspired schedule and fill your next Napa trip with these expert tips. https://t.co/3ct3YOv4nN
1225831588770046000,Fri Feb 07 17:20:00 +0000 2020,The six-watch capsule collection features stylish cues from iconic 007 title sequences and movie posters. https://t.co/2goche9CFi
1225826556179812400,Fri Feb 07 17:00:00 +0000 2020,Celebrate with a steak today. https://t.co/fNjPYQ0b0O
1225819006830923800,Fri Feb 07 16:30:00 +0000 2020,This blacked-out beauty is one heavenly hog. https://t.co/kLVIvtKHnm
1225811457335382000,Fri Feb 07 16:00:00 +0000 2020,Check out these graphics of the ideal female body. https://t.co/LBaJzDoagb
1225803908469051400,Fri Feb 07 15:30:00 +0000 2020,The 649-style frames were made famous in the 1961 movie "Divorce, Italian Style." https://t.co/R4BNsIOckO
1225796358621151200,Fri Feb 07 15:00:00 +0000 2020,Imagine yourself in the driver's seat of one of these 36 beautifully restored 'Vettes. https://t.co/bPxGVZsfn6
1225781262004080600,Fri Feb 07 14:00:01 +0000 2020,"My biggest turn-on is when someone kisses my neck and then bites the back of it." https://t.co/v0UtGw5zM6
1225773708155015200,Fri Feb 07 13:30:00 +0000 2020,Get your Irish up with this bold new single pot whiskey. https://t.co/vtpm0VZXUc
