id,created_at,text
1244338538755149800,Sun Mar 29 19:00:00 +0000 2020,This simple pasta dish is a can't-miss classic that's perfect for date night. https://t.co/iMZIT7KfcA
1244328469137223700,Sun Mar 29 18:20:00 +0000 2020,Combining the legendary sound of Marshall with the helpfulness of Amazon Alexa. https://t.co/Bmm1iUvgDf
1244315886284083200,Sun Mar 29 17:30:00 +0000 2020,This will be the "Deadpool" star's third project with Netflix. https://t.co/Sz0Gp8YluZ
1244293272027172900,Sun Mar 29 16:00:08 +0000 2020,"They did Joe so dirty over and over again." https://t.co/nXuN67KdYW
1244280314022813700,Sun Mar 29 15:08:39 +0000 2020,“I feel sexiest when I am in my favorite outfit or lingerie set, accompanied by stiletto heels.” https://t.co/cYs458HM6M
1244259996147290000,Sun Mar 29 13:47:54 +0000 2020,"Has anyone seen Tiger King on Netflix?!?! It is crazy!!!!"  https://t.co/6QtFp51c34
1244096944701616000,Sun Mar 29 03:00:00 +0000 2020,Wanna know if someone is legit crazy? Just take this simple scientific test. https://t.co/2kaBdzFITz
1244081844389154800,Sun Mar 29 02:00:00 +0000 2020,Meet the mind behind the multibillion dollar workplace messaging technology. https://t.co/YVgRSuonDQ
1244066746245345300,Sun Mar 29 01:00:00 +0000 2020,Good Lord. https://t.co/2Welhr4s5B
1244051646084264000,Sun Mar 29 00:00:00 +0000 2020,These standout bottles are required drinking for fans of All-American whiskey. https://t.co/hT2mHUz9S9
1244036548162617300,Sat Mar 28 23:00:00 +0000 2020,With its futuristic blended wing body, the Stealth Bomber-style plane could boast big improvements in fuel efficien… https://t.co/pT0U6rJYZb
1244021447766331400,Sat Mar 28 22:00:00 +0000 2020,"There is nothing sexier than when a guy is proud to have me by his side. Hold my hand, grab my hips, and don't be… https://t.co/hnquniKp34
1244006346632003600,Sat Mar 28 21:00:00 +0000 2020,See the northern lights from this stunning location. https://t.co/4QRSR6igUZ
1243991247217295400,Sat Mar 28 20:00:00 +0000 2020,The service delivers tools, solar power banks, sustainable food, face masks, sterile rubber gloves, canteens, and m… https://t.co/soWUgURKXf
1243976148297678800,Sat Mar 28 19:00:00 +0000 2020,Just 23 of these limited-edition bikes will be built. https://t.co/bqu0dS1tUs
1243961048819884000,Sat Mar 28 18:00:00 +0000 2020,The "Black Gold" burger may be the most outrageously over-the-top burger yet. https://t.co/ZLMGHJwdYq
1243945950118363100,Sat Mar 28 17:00:00 +0000 2020,"St. Tropez Soleil" is a photo-filled ode to the French Riviera. https://t.co/6UCnwifEj2
1243937140859383800,Sat Mar 28 16:25:00 +0000 2020,Trident Adventures, a company owned by two ex-Navy SEALs, teamed up with the Four Seasons Oahu for a VIP dive packa… https://t.co/A7p16eqs3I
1243919681741824000,Sat Mar 28 15:15:37 +0000 2020,From five-star stays and fine dining in the kingly city of Marrakesh to glamping amid Saharan sand dunes in Erg Che… https://t.co/dp1MVY0Wge
1243912043717165000,Sat Mar 28 14:45:16 +0000 2020,The electrified take on the iconic hippie van is available now. https://t.co/gw9s8qx8y7
1243888067389374500,Sat Mar 28 13:10:00 +0000 2020,Get ready to rumble.  https://t.co/iLtUiLAVra
1243719457165521000,Sat Mar 28 02:00:00 +0000 2020,For the first time ever, the iPad boasts an upgraded keyboard and mouse support. https://t.co/nOrp58DAoj
1243704357553610800,Sat Mar 28 01:00:00 +0000 2020,Time to get ripped. https://t.co/tYLbBfks8u
1243689258524827600,Sat Mar 28 00:00:00 +0000 2020,These 19-tool beauties come with walnut or carbon fiber handles, and are ready for practically anything. https://t.co/wJ2sV9rJDB
1243680952477343700,Fri Mar 27 23:27:00 +0000 2020,These rising stunners are shaking up the fashion industry. https://t.co/Q8CbI6hIEj
1243674160355774500,Fri Mar 27 23:00:00 +0000 2020,These highly-coveted timepieces are favored by the likes of Jay-Z and LeBron James. https://t.co/qcNOEgZsWy
1243666608528162800,Fri Mar 27 22:30:00 +0000 2020,Marty McFly would approve. https://t.co/oiAu0JwFXC
1243659061062598700,Fri Mar 27 22:00:00 +0000 2020,The first-person-shooter battle royale is now available to download for free--here's everything you need to know. https://t.co/P7RpoIOrcN
1243628859276304400,Fri Mar 27 20:00:00 +0000 2020,Celebrate #Internationalwhiskeyday with these standout bottles. https://t.co/G5BTCgzRGF
1243613763762147300,Fri Mar 27 19:00:01 +0000 2020,Here's an exclusive look at the Canadian supermodel's stunning cover shoot. https://t.co/jN1Dd13zgA
1243598660472115200,Fri Mar 27 18:00:00 +0000 2020,Dream boat alert. https://t.co/kKgVLcb3hg
1243591111148535800,Fri Mar 27 17:30:00 +0000 2020,Yo, Adrian! https://t.co/I1VEJJqdQ4
1243583564307890200,Fri Mar 27 17:00:01 +0000 2020,It's a great way to watch with pals during the #Coronavirus lockdown. https://t.co/0ZVLizd3Z2
1243574752876232700,Fri Mar 27 16:25:00 +0000 2020,Fans have reportedly received Venmo payments ranging from $500 to $1,500. https://t.co/dGoLfKEP9L
1243568461940510700,Fri Mar 27 16:00:00 +0000 2020,Top bar owners are dealing with state-mandated closures by delivering cocktails to your door. https://t.co/KzFG3xa0On
1243553367332356000,Fri Mar 27 15:00:01 +0000 2020,The Austin-based vodka brand is making 26 tons of sanitizer and donating $2 million to charities fighting the pande… https://t.co/8WzzDgfCqQ
1243538263383724000,Fri Mar 27 14:00:00 +0000 2020,Bond-worthy watch vibes. https://t.co/A8IlCKZQYJ
1243523163972972500,Fri Mar 27 13:00:00 +0000 2020,These supermodel stunners are staying cool in quarantine. https://t.co/5C30x6wft8
1243511838442217500,Fri Mar 27 12:15:00 +0000 2020,"You should always buy wines which are produced in tiny amounts." https://t.co/XALRgM7ZyN
1243372168358101000,Fri Mar 27 03:00:00 +0000 2020,Be warned, they're very NSFW. https://t.co/U5dVLrYvn6
1243357069601910800,Fri Mar 27 02:00:00 +0000 2020,The rocker helped design three new bottles and more for the famed French champagne house. https://t.co/2GFLNkUsUt
1243341969742495700,Fri Mar 27 01:00:00 +0000 2020,Upgraded straps for Apple Watch wearers. https://t.co/aLD4D5QFm6
1243326869371588600,Fri Mar 27 00:00:00 +0000 2020,Take a digital trip to world-class museums from home. https://t.co/OAzOU2dXqG
1243311771126870000,Thu Mar 26 23:00:00 +0000 2020,Here's why intermittent fasting could be a good move in 2020. https://t.co/bUiPpKzdMf
1243296670407778300,Thu Mar 26 22:00:00 +0000 2020,“This is only the second time in my 61 years of business that we’ve seen anything like this,” said one gun shop own… https://t.co/M7fpy0EUv1
1243281572695912400,Thu Mar 26 21:00:00 +0000 2020,High-octane driving gear that puts the pedal to the metal. https://t.co/Z3DhTSBf2P
1243266471628857300,Thu Mar 26 20:00:00 +0000 2020,A new Lightweight Package sheds 66 pounds off the German sports car. https://t.co/VX5jFsseVZ
1243251372583268400,Thu Mar 26 19:00:00 +0000 2020,Get it while you can. https://t.co/ecp4JFvsrj
1243236275567702000,Thu Mar 26 18:00:00 +0000 2020,This menacing multitool can be used as a shovel or a hoe, and has a saw concealed in the removable handle. https://t.co/kWVzzjgDYE
1243221174752075800,Thu Mar 26 17:00:00 +0000 2020,It was just too dangerous for real-life pilot Cruise to fly himself. https://t.co/gpESgfVlF9
1243206077828735000,Thu Mar 26 16:00:01 +0000 2020,Rugged watches from the makers of the Swiss Army Knife. https://t.co/Xn2kNZGamE
1243190976887341000,Thu Mar 26 15:00:00 +0000 2020,The apocalyptic off-roader is made for at-risk VIPs. https://t.co/PJHattJGTC
1243175874649665500,Thu Mar 26 14:00:00 +0000 2020,The 160-foot luxury catamaran boasts twin 3,400-horsepower engines and a range of more than 57,000 miles. https://t.co/ZnUsuNFqAR
1243148440802123800,Thu Mar 26 12:10:59 +0000 2020,"I do think that golf is a relatively easy sport to socially distance while playing." https://t.co/c0VhWXnxO7
1243011134925537300,Thu Mar 26 03:05:23 +0000 2020,The bestselling author has some epic advice for conquering life's obstacles. https://t.co/xerjodn4iW
1242979582363435000,Thu Mar 26 01:00:00 +0000 2020,There’s more to the Cleveland Cavaliers star than elite basketball skills, movie star looks and his Maxim cover mod… https://t.co/K4Wj3jWMR6
1242964481983955000,Thu Mar 26 00:00:00 +0000 2020,Take 50% off headphones, speakers and earbuds through Sunday, March 29. https://t.co/WorUzU5M4Q
1242949383672549400,Wed Mar 25 23:00:00 +0000 2020,We were shocked. https://t.co/eHA1wlBtA4
1242934283611840500,Wed Mar 25 22:00:00 +0000 2020,Saddle up for a ride in this horse racing-inspired luxury roadster. https://t.co/nrIRlRrHnq
1242919184536875000,Wed Mar 25 21:00:00 +0000 2020,But this is no video game. https://t.co/9mCKnC88ZL
1242904087017840600,Wed Mar 25 20:00:01 +0000 2020,"Has anyone seen Tiger King on Netflix?!?! It is crazy!!!!" https://t.co/6QtFp4JAEu
1242888985531293700,Wed Mar 25 19:00:00 +0000 2020,Stream new hours from Tom Segura, Bert Kreischer, Marc Maron and more. https://t.co/iycJihntHj
1242873887857102800,Wed Mar 25 18:00:01 +0000 2020,High-tops with classic hoops heritage style. https://t.co/a2vuMWuzCA
1242858787624517600,Wed Mar 25 17:00:00 +0000 2020,Find out why it's never been a better time to enjoy mezcal. https://t.co/JRIAJm4Oyy
1242843689816191000,Wed Mar 25 16:00:01 +0000 2020,The ultra-extravagant Beverly House was also the site of JFK's honeymoon. https://t.co/luVwKCexRW
1242836135807680500,Wed Mar 25 15:30:00 +0000 2020,Combining the legendary sound of Marshall with the helpfulness of Amazon Alexa. https://t.co/Bmm1iUdFLH
1242828587914481700,Wed Mar 25 15:00:00 +0000 2020,A top urologist breaks down his biggest rules for male sexual wellness. https://t.co/uEKvtWgnNh
1242821037563072500,Wed Mar 25 14:30:00 +0000 2020,From Fleetwood Mac to The Fugees, these iconic album covers have been altered for the six-foot rule. https://t.co/kii9Z79uqy
1242813487677669400,Wed Mar 25 14:00:00 +0000 2020,Yamaha's "Masters of Torque" lineup now offers what's arguably the best bargain bike on the market. https://t.co/W2TtfE5ChB
1242798391312121900,Wed Mar 25 13:00:01 +0000 2020,Double trouble. https://t.co/7nxEERKFUO
1242783291008262100,Wed Mar 25 12:00:01 +0000 2020,Yet another affordable eye-catcher. https://t.co/OqHdI9WhM0
1242647392324849700,Wed Mar 25 03:00:00 +0000 2020,The new gaming console has a far more powerful graphics processor, a 3D audio engine, and more upgrades. https://t.co/13uqoZYjik
1242632293035851800,Wed Mar 25 02:00:00 +0000 2020,Salty ocean and citrus scents to upgrade your spring cologne game. https://t.co/zaFFtlacNk
1242617194225127400,Wed Mar 25 01:00:00 +0000 2020,"My biggest turn-on is when someone kisses my neck and then bites the back of it." https://t.co/v0UtGw5zM6
1242602093581447200,Wed Mar 25 00:00:00 +0000 2020,The trippy new video also features a tribute to late rapper Juice Wrld. https://t.co/D1aCa9lyV1
1242586997769801700,Tue Mar 24 23:00:01 +0000 2020,"The world will see that I am still the best fighter in the history of the UFC." https://t.co/Qcblsza0gd
1242571894768853000,Tue Mar 24 22:00:00 +0000 2020,The service delivers tools, solar power banks, sustainable food, face masks, sterile rubber gloves, canteens, and m… https://t.co/x1U91BtOKF
1242556796532854800,Tue Mar 24 21:00:00 +0000 2020,Want to be more successful in life? Here's how. https://t.co/SgJ2GD3S3N
1242541698154205200,Tue Mar 24 20:00:00 +0000 2020,Keep in shape with the best Instagram Live fitness feeds and workout apps. https://t.co/Jh4OJK6v4M
1242526598974201900,Tue Mar 24 19:00:00 +0000 2020,Best use of a burrito in a topless selfie ever? https://t.co/OmVtdoTChz
1242511498905374700,Tue Mar 24 18:00:00 +0000 2020,You picked a fine time to leave us, Kenny. https://t.co/od3Gm10pd6
1242503986202148900,Tue Mar 24 17:30:09 +0000 2020,The V8-powered sports car boasts impressive power, handling and style. https://t.co/VvKJmH8gTP
1242496400044232700,Tue Mar 24 17:00:00 +0000 2020,From Margot Robbie's "Birds of Prey" to Matthew McConaughey's "The Gentleman", these 2020 movies will stream much e… https://t.co/hfQXBKr9BB
1242481300650340400,Tue Mar 24 16:00:00 +0000 2020,The tennis legend's striking "Lefty Project" is a beautifully bespoke Rollie. https://t.co/Sw3GhtuAU1
1242466202397573000,Tue Mar 24 15:00:01 +0000 2020,Much like high-end watches, vintage vehicles are greatly appreciating in value. https://t.co/3gleaiyCcN
1242451100440989700,Tue Mar 24 14:00:00 +0000 2020,Go ahead and grab that morning slice. https://t.co/ao1PVdcuvM
1242436003094319000,Tue Mar 24 13:00:01 +0000 2020,The decorated athlete recently rode his third championship-winning run at the annual Red Bull Rampage freeride even… https://t.co/HAFg6DwIhD
1242422158342553600,Tue Mar 24 12:05:00 +0000 2020,Come Sail Away. https://t.co/5k3QEJksRh
1242285006283837400,Tue Mar 24 03:00:00 +0000 2020,"Real modeling is dying, and it’s all about social media. It's cool because it gives you so much more control." https://t.co/mTQGZCHl3J
1242269904738361300,Tue Mar 24 02:00:00 +0000 2020,The luxury car icon claims the sleek new plane is "the world’s fastest all-electric aircraft." https://t.co/dvqM6Tqvz0
1242254805994631200,Tue Mar 24 01:00:00 +0000 2020,Because meatballs equal happiness. https://t.co/4tRjFDaxPr
1242239706953220000,Tue Mar 24 00:00:00 +0000 2020,Rock a Rolex Daytona vibe without breaking the bank. https://t.co/wW1pzjkqql
1242224608998084600,Mon Mar 23 23:00:00 +0000 2020,Take your next African vacation to ferocious new heights. https://t.co/DJjoNz2Dmy
1242209506727166000,Mon Mar 23 22:00:00 +0000 2020,Three classic Converse silhouettes get an innovative upgrade. https://t.co/52A4LkqU52
1242194407522062300,Mon Mar 23 21:00:00 +0000 2020,Here's how to get the most benefit out of Apple's bluetooth earbuds. https://t.co/BKVJ0Jee9y
1242179311219638300,Mon Mar 23 20:00:01 +0000 2020,This unmanned EV would drastically reduce pollution and transportation costs. https://t.co/mJf3KmAA84
1242164211553370000,Mon Mar 23 19:00:00 +0000 2020,How to stay sane waiting for the pandemic to end. https://t.co/VAGccGWNyA
1242149110985003000,Mon Mar 23 18:00:00 +0000 2020,"The Dark Knight Rises" helmer believes theaters are "a vital part of social life, providing jobs for many and ente… https://t.co/FrlKfKXPt1
1242141579541983200,Mon Mar 23 17:30:05 +0000 2020,The Austin-based vodka brand is making 26 tons of sanitizer and donating $2 million to charities fighting the pande… https://t.co/UEUkaTGxjH
1242134010018570200,Mon Mar 23 17:00:00 +0000 2020,The 1970s-era timepiece was worn by everyone from Jack Nicholson to Keith Richards. https://t.co/xf2PRDJiAQ
1242123943433076700,Mon Mar 23 16:20:00 +0000 2020,The electrified take on the iconic hippie van is available now. https://t.co/gw9s8qx8y7
1242118914529779700,Mon Mar 23 16:00:01 +0000 2020,Make your fine wine-fueled dreams a reality. https://t.co/eHbbDZybn3
1242103813156130800,Mon Mar 23 15:00:00 +0000 2020,An American-made hiker inspired by combat boots worn by U.S. troops. https://t.co/EGnt32uBo7
1242096305612054500,Mon Mar 23 14:30:10 +0000 2020,It's the only way to see live concerts these days... https://t.co/jEnO0xNC3i
1242088712332177400,Mon Mar 23 14:00:00 +0000 2020,"Listen to the experts, ignore the morons." https://t.co/xJMzdX5S0L
1242081162761097200,Mon Mar 23 13:30:00 +0000 2020,The supercar's graded paint job alone took 430 hours to complete. https://t.co/MaVIgj1Q4l
1242073611596378000,Mon Mar 23 13:00:00 +0000 2020,"St. Tropez Soleil" is a photo-filled ode to the French Riviera. https://t.co/6UCnwifEj2
1242058514710892500,Mon Mar 23 12:00:00 +0000 2020,Those stuck at home can save big on sneakers, sweats and other gear. https://t.co/cTZvYPowDr
1241922618459959300,Mon Mar 23 03:00:00 +0000 2020,Sounds crazy but apparently it's true. https://t.co/m4KJcNiG6Q
1241907517749371000,Mon Mar 23 02:00:00 +0000 2020,LVMH Chairman &amp; CEO Bernard Arnault made his fortune with luxury brands like Dom Pérignon, Louis Vuitton, TAG Heuer… https://t.co/CJUDlIeyOP
1241892418909167600,Mon Mar 23 01:00:00 +0000 2020,"You're the sexy girl. You're the naked girl. Men are going to idolize your hourglass figure." https://t.co/ZJhCRiA0Qg
1241877318940975000,Mon Mar 23 00:00:00 +0000 2020,Analog or digital, this stylish retro turntable can handle anything. https://t.co/YMM9R1e6iU
1241862218943062000,Sun Mar 22 23:00:00 +0000 2020,It's a great way to watch with pals during the #Coronavirus lockdown. https://t.co/0ZVLizuEQA
1241847120275165200,Sun Mar 22 22:00:00 +0000 2020,A classic Ferrari racer could take flight in the form of a V12-powered tricopter. https://t.co/BQ1eXcphD1
1241832022366027800,Sun Mar 22 21:00:00 +0000 2020,This righteous red sauce recipe comes from two of America's top Italian chefs. https://t.co/WmVfNlh36W
1241821953176088600,Sun Mar 22 20:20:00 +0000 2020,"We hope people who’ve been laid off will come work with us until they’re able to go back to the jobs they had." https://t.co/WuZIGEU5Aa
1241816920451461000,Sun Mar 22 20:00:00 +0000 2020,"Just introduce yourself and have confidence." https://t.co/71Oebj2VBK
1241794271750967300,Sun Mar 22 18:30:00 +0000 2020,Top bar owners are dealing with state-mandated closures by delivering cocktails to your door. https://t.co/KzFG3wSppN
1241780623083257900,Sun Mar 22 17:35:46 +0000 2020,Just 23 of these limited-edition bikes will be built. https://t.co/bqu0dS1tUs
1241767908394532900,Sun Mar 22 16:45:14 +0000 2020,Companies like LVMH and celebs such as Rihanna are pitching in to help during the Coronavirus Pandemic. https://t.co/SWBqkSeH9n
1241745197731627000,Sun Mar 22 15:15:00 +0000 2020,Only 250 of the Spitfire "Longest Flight" were made. https://t.co/DCWcUBeC2e
1241728839727714300,Sun Mar 22 14:10:00 +0000 2020,The tech giant made some surprising changes to their recommendations.  https://t.co/gBD6pFqBeL
1241707770363228200,Sun Mar 22 12:46:16 +0000 2020,The NBA GOAT brutally motivates his fellow Bulls in this throwback video.  https://t.co/0HTAIRM967
1241560228509806600,Sun Mar 22 03:00:00 +0000 2020,You can't go wrong with this deliciously decadent dish. https://t.co/bMnDDhLvhS
1241545130517115000,Sun Mar 22 02:00:00 +0000 2020,We appreciate the dedication to their craft. https://t.co/pG2y7GqXvn
1241530029982519300,Sun Mar 22 01:00:00 +0000 2020,You're applying cologne totally wrong... https://t.co/tpFIpyVzV5
1241514931289075700,Sun Mar 22 00:00:00 +0000 2020,"Alexa, order more shampoo." https://t.co/KOJjXsu0Tb
1241499830624624600,Sat Mar 21 23:00:00 +0000 2020,How to live the high life in Europe's hottest travel paradise. https://t.co/EaHxIuIYu3
1241484731893477400,Sat Mar 21 22:00:00 +0000 2020,The acoustic/electric guitar is the latest offering in Fender's Acoustasonic series. https://t.co/Rti7yBhuLq
1241469632239804400,Sat Mar 21 21:00:00 +0000 2020,Find out why bigger isn't always better... https://t.co/6O7jclD8Bu
1241454533441728500,Sat Mar 21 20:00:00 +0000 2020,Sinister street bike. https://t.co/YxfOyteUzN
1241439435440509000,Sat Mar 21 19:00:00 +0000 2020,Turns out 80-proof alcohol "does not meet the current recommendation of the CDC." https://t.co/d9waN7JvYt
1241429711957438500,Sat Mar 21 18:21:22 +0000 2020,It's an ingenious way to pose with a burrito. https://t.co/OmVtdpbdG9
1241424335522484200,Sat Mar 21 18:00:00 +0000 2020,It's way better than riding a camel. https://t.co/ZOfwTS0DEU
1241409235528724500,Sat Mar 21 17:00:00 +0000 2020,Baldies rejoice. https://t.co/6ln0HKNsmM
1241394137670140000,Sat Mar 21 16:00:01 +0000 2020,Totally badass. https://t.co/9VDZPfo1fC
1241379034652536800,Sat Mar 21 15:00:00 +0000 2020,“I think more people would do well married if they didn’t have to live in the same house.” https://t.co/xFFrjA5DNe
1241368968369062000,Sat Mar 21 14:20:00 +0000 2020,McLaren Special Operations decked out the windowless supercar with a classic racing livery. https://t.co/AIuLG6CrXn
1241353309870600200,Sat Mar 21 13:17:46 +0000 2020,Less than 200 of these gorgeous sports cars were produced.  https://t.co/O87axvDHuX
1241182742575890400,Sat Mar 21 02:00:00 +0000 2020,The James Bond bombshell has a license to thrill when it comes to sexy swimwear. https://t.co/PpkTFYbrh0
1241167641659629600,Sat Mar 21 01:00:00 +0000 2020,Take your EDC game to the next level with this blinged-out blade. https://t.co/LHsh6MckLU
1241152543461269500,Sat Mar 21 00:00:00 +0000 2020,Celebrities are collecting his poppy paintings--a blend of "iconic figures, vintage media and street style." https://t.co/2ztV8tWoW6
1241137444281618400,Fri Mar 20 23:00:00 +0000 2020,The 54-year-old stunner dropped yet another bodacious bikini photo. https://t.co/dkRksCpmnf
1241122345965596700,Fri Mar 20 22:00:00 +0000 2020,The classic rum and coke cocktail gets a tropical upgrade. https://t.co/BaVHlbvtKl
1241107246441873400,Fri Mar 20 21:00:00 +0000 2020,The light-filled Hara house is designed to blend with nature. https://t.co/PDdTQSIL8G
1241092145055850500,Fri Mar 20 20:00:00 +0000 2020,The MMA powerhouse says his branded java delivers an "energy kick almost as strong as mine." https://t.co/b6KF2FXimj
1241077045477736400,Fri Mar 20 19:00:00 +0000 2020,Saddle up for a ride in this horse racing-inspired luxury roadster. https://t.co/nrIRlRrHnq
1241061948235497500,Fri Mar 20 18:00:00 +0000 2020,The Swiss watchmaker blends luxury craftsmanship and cutting edge tech in a new, performance-focused timepiece. https://t.co/0XCBf1TM7S
1241046848766275600,Fri Mar 20 17:00:00 +0000 2020,Absolutely stunning.  https://t.co/aU5HMYyqL6
1241039297026850800,Fri Mar 20 16:30:00 +0000 2020,Take a digital trip to world-class museums from home. https://t.co/OAzOU2dXqG
1241031746235379700,Fri Mar 20 16:00:00 +0000 2020,There's no better time to sample this iconic Mexican spirit. https://t.co/8qTaT0zntk
1241016649475453000,Fri Mar 20 15:00:00 +0000 2020,The company behind Louis Vuitton and Moet &amp; Chandon will provide the sought-after gel for free to the French govern… https://t.co/2NWQR9ladj
1241001547967807500,Fri Mar 20 14:00:00 +0000 2020,Take 50% off headphones, speakers and earbuds through Sunday, March 22. https://t.co/WorUzU5M4Q
1240986452424446000,Fri Mar 20 13:00:01 +0000 2020,These gorgeous globe trotters always make traveling to exotic locales look amazing. https://t.co/2alzhwUuzv
1240977784668905500,Fri Mar 20 12:25:34 +0000 2020,Users trapped at home by the Coronavirus pandemic are straining bandwidth everywhere. https://t.co/E4GezMaJoN
1240820353456386000,Fri Mar 20 02:00:00 +0000 2020,Bubbly for ballers. https://t.co/e86f8ejEEl
1240805255505252400,Fri Mar 20 01:00:00 +0000 2020,Stunning ski slopes, incredible views and a mountain-top automotive museum make this Austrian destination a must-vi… https://t.co/rPEjBVIH3Q
1240790155600035800,Fri Mar 20 00:00:00 +0000 2020,Ready for takeoff. https://t.co/mBWxAeilKy
1240775057879769000,Thu Mar 19 23:00:00 +0000 2020,An 18-month scientific study revealed the top diet to banish that gut. https://t.co/hdn0vqxuCq
1240763730368942000,Thu Mar 19 22:15:00 +0000 2020,Get yourself a shawty. https://t.co/wmv2DDhMTx
1240748630950252500,Thu Mar 19 21:15:00 +0000 2020,Forget about #Coronavirus and strap in for an all-day gaming binge. https://t.co/G0K1zEhUP4
1240737306560139300,Thu Mar 19 20:30:00 +0000 2020,This smartly designed, 28-foot RV is designed for full-time living--not just vacations or weekend getaways.  https://t.co/fxUF6kLh1F
1240720948552237000,Thu Mar 19 19:25:00 +0000 2020,"Friendly reminder I can post whatever I want on my page." https://t.co/vPLYFVUaa8
1240699562542518300,Thu Mar 19 18:00:01 +0000 2020,"Tesla makes cars with sophisticated hvac systems. SpaceX makes spacecraft with life support systems. Ventilators a… https://t.co/oytUAGfmJv
1240684458040123400,Thu Mar 19 17:00:00 +0000 2020,“We need to get Kylie Jenner and social media influencers out there in helping folks understand that this is absolu… https://t.co/3GQwNGraxS
1240669359854542800,Thu Mar 19 16:00:00 +0000 2020,The celebrity-packed cover of John Lennon's classic ballad has been widely roasted for missing the mark. https://t.co/xE536T5ab0
1240654260158771200,Thu Mar 19 15:00:00 +0000 2020,Meanwhile, Brady might bring troubled receiver Antonio Brown to Tampa Bay. https://t.co/S65x265Vth
1240642935055503400,Thu Mar 19 14:15:00 +0000 2020,Yamaha's "Masters of Torque" lineup now offers what's arguably the best bargain bike on the market. https://t.co/W2TtfEnd99
1240631609545687000,Thu Mar 19 13:30:00 +0000 2020,A street-legal beast unleashed. https://t.co/FgicHvJjdp
1240621554494509000,Thu Mar 19 12:50:02 +0000 2020,The 1970s-era timepiece was worn by everyone from Jack Nicholson to Keith Richards.  https://t.co/xf2PRDJiAQ
1240473068017004500,Thu Mar 19 03:00:00 +0000 2020,His drop-dead-sexy portraits captivate with their striking simplicity. https://t.co/LG2ma5U2fp
1240457966542782500,Thu Mar 19 02:00:00 +0000 2020,These standout bottles are required drinking for fans of All-American whiskey. https://t.co/hT2mHUz9S9
1240442870026231800,Thu Mar 19 01:00:01 +0000 2020,Black on black. https://t.co/xElagIhQjH
1240427769210650600,Thu Mar 19 00:00:00 +0000 2020,Yet another reason to pour yourself a glass. https://t.co/UOlxohWTjk
1240397568951169000,Wed Mar 18 22:00:00 +0000 2020,It's about damn time. https://t.co/ARhk91bn69
1240382468185821200,Wed Mar 18 21:00:00 +0000 2020,"A man should never come first in the bedroom." https://t.co/NJU9MwvEoZ
1240367371728158700,Wed Mar 18 20:00:00 +0000 2020,Turns out sex is nature's best medicine. https://t.co/NuxQNXNwc5
1240353527651684400,Wed Mar 18 19:05:00 +0000 2020,The new gaming console has a far more powerful graphics processor, a 3D audio engine, and more upgrades. https://t.co/13uqoZGHTK
1240337169945936000,Wed Mar 18 18:00:00 +0000 2020,For the first time ever, the iPad boasts an upgraded keyboard and mouse support. https://t.co/nOrp58DAoj
