id,created_at,text
1141430410787901400,Wed Jun 19 19:39:51 +0000 2019,RT @Melissa_Nepton: Concours gagner 200$ sur place!!
1140714386975350800,Mon Jun 17 20:14:37 +0000 2019,Concours gagner 200$ sur place!!
1140713990844289000,Mon Jun 17 20:13:03 +0000 2019,Vente d’atelier! Dès demain. #aubureau 9250 avenue du parc, suite 611!!! De 10hà 6h mardi et mercredi@ de10hà 8h je… https://t.co/vZDeGh23Fo
1116376871967629300,Thu Apr 11 16:26:02 +0000 2019,Braderie aujourd’hui et ce soir! Au Marché Bonsecours/ Vieux Port!# Petit prix et exclusivités! https://t.co/Bar3tcBWTi
1091434354323177500,Fri Feb 01 20:33:22 +0000 2019,Vente!!!! Dernière journée!! 30 à 80 ..et plein de surprises:) Soyez au rendez-vous. 9250 avenue du parc, suite 611
1090998149370531800,Thu Jan 31 15:40:03 +0000 2019,RT @Melissa_Nepton: Vente! 30 (10h/18h) 31 janvier (10h /21h)et 1 février (10h/21h) 9250 avenue du parc, 611 ! https://t.co/N8ZtUJ7eIq
1088264610053009400,Thu Jan 24 02:37:56 +0000 2019,Vente! 30 (10h/18h) 31 janvier (10h /21h)et 1 février (10h/21h) 9250 avenue du parc, 611 ! https://t.co/N8ZtUJ7eIq
957010801122074600,Fri Jan 26 22:02:10 +0000 2018,vente d'Atelier 30 janvier au 2 février mardi et mercredi de 10am-6pm jeudi et vendredi de 10am-8pm 9250 av du parc… https://t.co/exI5b2J6OO
881902287131742200,Mon Jul 03 15:47:44 +0000 2017,Notre équipe s’agrandit : poste d’assistant(e) administratif(ve) à combler!  → https://t.co/v9fQii9HP1
872912721502765000,Thu Jun 08 20:26:25 +0000 2017,VENTE D’ATELIER / WAREHOUSE SALE  #melissanepton #mn #warehousesale #ventedatelier https://t.co/gNZrVRNh9w
836651343309844500,Tue Feb 28 18:56:39 +0000 2017,Arlet, the perfect blouse to layer under a jacket ! / Notre style Arlet, la blouse parfaite pour… https://t.co/oDnH1CpHCF
836243591924170800,Mon Feb 27 15:56:23 +0000 2017,We are at the Coterie show in NYC !!! Starting today ! #coterie #coterienyc #fashion #nyc #fw17… https://t.co/hMNmM6ZD2o
834105540733235200,Tue Feb 21 18:20:32 +0000 2017,Our Spring collection has arrived ! Check it out ! /// Notre collection printemps est arrivée!… https://t.co/Wa68x8MSBz
831591386273157100,Tue Feb 14 19:50:11 +0000 2017,Happy Valentines Day ❤️Get an extra 20% off all sales with promo code ''valentin20''. Your gift… https://t.co/u7HwuRZu8n
829329288834977800,Wed Feb 08 14:01:25 +0000 2017,The perfect cape - ADA ❤️! #melissanepton #winterstyle #nowonsale #mtldesigner #comfort… https://t.co/Omc4m6F5vF
827160206048186400,Thu Feb 02 14:22:15 +0000 2017,Be one with winter in our cozy furry vest - Jana! /// Notre veste toute douce - Jana - vous… https://t.co/YR0vLUk61v
822481373730586600,Fri Jan 20 16:30:15 +0000 2017,Must have basic ! /// Le basic indispensable ! '' On n'est jamais trop habillé avec une petite… https://t.co/nJhr7H4jzR
822183184041439200,Thu Jan 19 20:45:21 +0000 2017,Notre vente d'atelier se déroule jusqu'à 20h ce soir ! / Our warehouse sale is open until 8PM tonight ! https://t.co/GxBFliWWmo
821427321802489900,Tue Jan 17 18:41:49 +0000 2017,Lumière sur l'hiver! Notre robe Robin illumine vos journées ! Maintenant à 40% de rabais !!!… https://t.co/SEfWOoxC59
821387522571960300,Tue Jan 17 16:03:40 +0000 2017,Ça commence aujourd'hui !!! Notre GRANDE VENTE D'ATELIER !!!! https://t.co/xKyRuXEYBn
819539544391434200,Thu Jan 12 13:40:28 +0000 2017,RT @lesventes: Vente d'atelier @Melissa_Nepton - Rabais de 40% à 80% sur toutes les collections #Mtl  https://t.co/GZbMzIzk6Z
818934766661763100,Tue Jan 10 21:37:18 +0000 2017,Don't miss our huge warehouse sale next week ! https://t.co/f9sUCJExqf
818934692510625800,Tue Jan 10 21:37:00 +0000 2017,Ne manquez pas notre MEGA vente d'atelier la semaine prochaine ! https://t.co/f9sUCJExqf
817400018520997900,Fri Jan 06 15:58:45 +0000 2017,Winter sales are here! Everything starting at 40% off! ///Nos soldes d'hiver sont arrivés, tout est à 40% de rabais… https://t.co/P1q9Qb0GWD
810893264060616700,Mon Dec 19 17:03:14 +0000 2016,Our week of Christmas giveaways is here !!!!  https://t.co/viqhCXh11N
809438277589758000,Thu Dec 15 16:41:38 +0000 2016,Shop our holiday collection today and get your outfit in time for Christmas ! /// Magasinez… https://t.co/9gyvGT6HSD
808744939614048300,Tue Dec 13 18:46:34 +0000 2016,When you need a cozy knit for such a winter day ! /// Un joli tricot confortable à souhait pour… https://t.co/ilrfe1xdOE
806499580967788500,Wed Dec 07 14:04:18 +0000 2016,Make your winter more trendy with the Vinnie jacket ! /// Pour rendre l'hiver plus chic, voici… https://t.co/hZA1VBX0YW
803351664405135400,Mon Nov 28 21:35:37 +0000 2016,Only a few hours left! Last chance to grab a hold of great styles at 30% off! /// Il ne reste… https://t.co/dCwbCVd4k5
802519535001669600,Sat Nov 26 14:29:01 +0000 2016,Our Black Friday weekend sales continue! Get 30% off on our online store with promo code :… https://t.co/AgorWuOivc
802175738464112600,Fri Nov 25 15:42:54 +0000 2016,BLACK FRIDAY SALE!!! Promo code : blackfriday30. Get 30% off everything on our online store.… https://t.co/VN5fkbGbPn
801806466722177000,Thu Nov 24 15:15:33 +0000 2016,Sneak Peek! Our Black Friday sale starts tomorrow!!! Get 30% off everything on our online store… https://t.co/yyGcGFofGG
792104123374141400,Fri Oct 28 20:41:54 +0000 2016,La grande braderie de mode québécoise débute ce soir à Sherbrooke! Venez nous voir au centre de foires! #mtldesigner #sale #braderie
791298570985017300,Wed Oct 26 15:20:55 +0000 2016,Our Deann poncho, perfectly cozy for the fall days ahead! Today only - all knits are 15% off!… https://t.co/HGe0oMebAc
789090536938405900,Thu Oct 20 13:06:59 +0000 2016,Les choix pour l'automne de @SophieCôté https://t.co/RJ76M0cgr6
781846537911533600,Fri Sep 30 13:21:55 +0000 2016,Shop our fall collection ! Now in stores ! https://t.co/gY5h19ehKZ
775707238778466300,Tue Sep 13 14:46:32 +0000 2016,Nous sommes présentement à la recherche d'une assistante administrative ! https://t.co/PMu9AdGdiu
775438587315753000,Mon Sep 12 20:59:00 +0000 2016,L'ensemble préféré du lundi ! // Monday's favorite outfit ! #FW2016 #melissanepton #mtldesigner… https://t.co/l2j0Uml5Ol
774262739632058400,Fri Sep 09 15:06:36 +0000 2016,FRI-YAY !! La blouse Danela maintenant dispo sur notre boutique en ligne ! // The Danela blouse,… https://t.co/2oJiKLwhwA
771074427274559500,Wed Aug 31 19:57:23 +0000 2016,Abigail, le haut parfait pour toutes vos occasions ! // The perfect top for all your occasions !… https://t.co/VXkrD6vixA
768935590985359400,Thu Aug 25 22:18:25 +0000 2016,Venez nous voir jusqu'à 20h ce soir pour la vente d'atelier!!!! De nombreux rabais à découvrir !!! 9250 av. du Parc, suite 610.
768430099725189100,Wed Aug 24 12:49:47 +0000 2016,Notre vente d'atelier débute ce matin à 10H!!!! https://t.co/6MbCVSaF0D
768151946159132700,Tue Aug 23 18:24:30 +0000 2016,La nouvelle collection automne/hiver 2016 est arrivée !! // The new Fall/Winter 2016 collection… https://t.co/Qppo5XqWXw
758715131983429600,Thu Jul 28 17:25:58 +0000 2016,RT @PicoumBoutique: C'est l'heure de magasiner la collection @Melissa_Nepton ! Obtenez 30% à 50% : https://t.co/saNLNaXYYX https://t.co/DJR…
757664173501317100,Mon Jul 25 19:49:50 +0000 2016,SOLDES !! Rendez-vous sur notre boutique en ligne ! // It's time for sales !! Visit our online… https://t.co/cqQGH64MwO
756144142879715300,Thu Jul 21 15:09:46 +0000 2016,New fall styles coming in, can't wait to show you the collection !! // Les nouveaux styles… https://t.co/NeZsdB9sYs
753722682416521200,Thu Jul 14 22:47:45 +0000 2016,Having fun @boutiqueUNICORN ! 50% !!! #boutiqueunicorn #melissanepton #mtldesigner #sales #popupshop https://t.co/HB0bvVge35
752841424257843200,Tue Jul 12 12:25:57 +0000 2016,RT @_Allsales: Pop-up shop @Melissa_Nepton at Unicorn boutique #Montreal - save up to 50% off https://t.co/lU3PATVQz4
751521326423281700,Fri Jul 08 21:00:21 +0000 2016,EVENEMENT SPECIAL! 14 Juillet 17h à 20h - Rencontrez la designer. POP-UP SHOP @boutiqueunicorn 🦄… https://t.co/qr4FInq5El
751520825296257000,Fri Jul 08 20:58:21 +0000 2016,SPECIAL EVENT - July 14th 5-8pm - Meet the designer. POP-UP SHOP - @boutiqueunicorn🦄 50% 50% 50%… https://t.co/d8ghRm4Hic
748534764802555900,Thu Jun 30 15:12:49 +0000 2016,A daily look in the life of @karinevanasse. From day to night !  /// Un look jour et soir,… https://t.co/UXikxANe6y
748180360484229100,Wed Jun 29 15:44:33 +0000 2016,Summer SALES are here! /// Les SOLDES d'été sont arrivés! https://t.co/bDL1AOpK3M https://t.co/TpAWRtJvFK
747439856612159500,Mon Jun 27 14:42:03 +0000 2016,Great article about the brand @hereandtheremag ! https://t.co/pw1qwnzqlR
747429255177474000,Mon Jun 27 13:59:55 +0000 2016,RT @aleyahs: Montreal-based designer, @melissa_nepton in @hereandtheremag #melissanepton #traveljournal @ MAC… https://t.co/uUB3s05yBX
743887710276948000,Fri Jun 17 19:27:05 +0000 2016,Après-midi création pour Mélissa ! https://t.co/wulRm7RVHV
743165390814126100,Wed Jun 15 19:36:51 +0000 2016,Shoe game on point ▪️◼️ #mtldesigner #kendrapants #mirrormirror https://t.co/Qtj5Z8ETNg
742807927648555000,Tue Jun 14 19:56:25 +0000 2016,Tuesday essential : the Mona top, available online ! // Le haut Mona, disponible sur notre… https://t.co/bwzQBQRnts
742399445191528400,Mon Jun 13 16:53:15 +0000 2016,RT @boutiqueUNICORN: Tout le @melissa_nepton est maintenant à 40%! https://t.co/cK7gpU9iZ8
740559871590989800,Wed Jun 08 15:03:26 +0000 2016,@patapoirepaquin sur le plateau de @Lesechangistes hier soir portant notre tunique Irina ! #mtldesigner #ss2016 https://t.co/Hj7gap1yoi
738732662622433300,Fri Jun 03 14:02:46 +0000 2016,WEEKEND SALE ! 30% off our skirts untill sunday ! // 30% de rabais sur toutes nos jupes jusqu'à… https://t.co/hbQyi9hgTe
738431381462786000,Thu Jun 02 18:05:35 +0000 2016,Black suits us the best ▪️◾️ #twins #allblack #thursdaymood https://t.co/4HkKr1pcNF
738359069942161400,Thu Jun 02 13:18:14 +0000 2016,Retrouvez Myriam Leblanc @@lagrand_parche dans le magasine La Semaine ! https://t.co/wkG3rhpQOQ
737703968055386100,Tue May 31 17:55:06 +0000 2016,Notre robe Ness se retrouve dans l'edito tribal du @Mag_clindoeil du mois de juillet! #melissanepton #summerstyles https://t.co/xdFBb9dn7L
737430135004074000,Mon May 30 23:46:59 +0000 2016,@TheBodyShopIND 🐎🐈🐁🌺🌸🌼🌷
735903818588782600,Thu May 26 18:41:57 +0000 2016,It's iced-tea-O'clock !! 🍋🍋 #summerdays #icedtea https://t.co/ONisdouuGO
731182362374049800,Fri May 13 18:00:34 +0000 2016,Dernière journée de notre vente d'atelier!!! Venez en profiter, jusqu'à 20h ce soir !!! Au 9250 av. Du Parc, suite 610!
730849716062158800,Thu May 12 19:58:45 +0000 2016,Crazy about our warehouse sales ! /// On raffole des ventes d'atelier ! #sales #crazyfun… https://t.co/xXPHoHmVxy
730752033825914900,Thu May 12 13:30:36 +0000 2016,Notre vente d'atelier se poursuit aujourd'hui et demain jusqu'à 20h! /Warehouse sale today and tomorrow until 8pm! https://t.co/YXFokG8euK
730430424686678000,Wed May 11 16:12:38 +0000 2016,RT @_Allsales: REMINDER - STARTS TODAY Find your favorite styles @Melissa_Nepton &amp; Save up to 80% on previous collections #Montreal https:/…
730430395523731500,Wed May 11 16:12:31 +0000 2016,RT @lesventes: RAPPEL - DEBUT DE VENTE Vente d'atelier @Melissa_Nepton rabais jusqu'à 80% sur collections antérieures! #Montréal https://t.…
728653220655059000,Fri May 06 18:30:40 +0000 2016,Pause Chic! Inspirations printanières d'ici ! À lire dans LaPresse+ aujourd'hui. https://t.co/F69IZfxOgf
727932661092761600,Wed May 04 18:47:25 +0000 2016,Notre vente d'atelier débute dans une semaine !!! /// Our warehouse sale begins next week !!!  https://t.co/TIkDXqhfPo
725057335836704800,Tue Apr 26 20:21:54 +0000 2016,Casual Tuesday, perfect pairing of our Kendra pant with a classic jacket! /// Pour une journée… https://t.co/uvCKm8UNnk
720964717578100700,Fri Apr 15 13:19:18 +0000 2016,Beautiful Friday morning, great start to the weekend! /// Un beau vendredi matin qui annonce une… https://t.co/xrMC5IrNHu
720961846740652000,Fri Apr 15 13:07:53 +0000 2016,La grande braderie de mode de Montréal se déroule jusqu'à dimanche ! Venez nous voir au rez-de-chaussez! À découvrir!https://t.co/eAI6878iqb
718444559898906600,Fri Apr 08 14:25:05 +0000 2016,@KateLalic porte merveilleusement notre pantalon Kendra, pour ce look de la semaine ! #comfyfriday #ss2016collection https://t.co/JM9Yr4gk4n
718060066042155000,Thu Apr 07 12:57:15 +0000 2016,La belle @GabriellaLab portant notre haut Krystal et pantalon Kendra ! #mtldesigner #quebec #summerstyle #TheVoice  https://t.co/4K4U16tbdV
715954392579575800,Fri Apr 01 17:30:03 +0000 2016,A Melissa Nepton icon thevoice_tf1 @gabriellalab  /// Une icône de Melissa Nepton thevoice_tf1… https://t.co/2lBb0MoD5u
713383283237765100,Fri Mar 25 15:13:23 +0000 2016,The Gatineau designer fashion sale begins today at noon! /// La Braderie de Gatineau débute… https://t.co/0b1Ji1RkHM
713115510486016000,Thu Mar 24 21:29:21 +0000 2016,We are in Toronto for the One of a Kind Spring show ! Discover our Spring collection booth P40… https://t.co/8ZVQr7wfXe
713057859504832500,Thu Mar 24 17:40:16 +0000 2016,We're in Toronto for the One of a Kind Spring Show ! Come and see our Spring collection booth P-40! https://t.co/jhbooa6Im1
712269950560374800,Tue Mar 22 13:29:24 +0000 2016,@GabriellaLab était de passage à Salut Bonjour portant notre haut Krystal et pantalon Kendra! https://t.co/oR1HZHsOv3
711912840014241800,Mon Mar 21 13:50:22 +0000 2016,Sunny Monday, spring is in the air ! /// Lundi ensoleillé, le printemps est dans l'air ! Style :… https://t.co/lUAdDrxpq1
710495143904804900,Thu Mar 17 15:56:57 +0000 2016,Happy St-Patrick's day ! Means spring is just around the corner!!! /// Une touche de vert, le… https://t.co/9HGHFJBkPr
710141245906145300,Wed Mar 16 16:30:41 +0000 2016,Alix, a twist on the classic little black dress! /// Notre robe Alix, pour faire changement de… https://t.co/bdyTD8HK2n
710133750915534800,Wed Mar 16 16:00:54 +0000 2016,RT @mp_arthur: Hâte à ce soir. Le lancement de Fred Fortin... Ça risque de ne pas être tranquille https://t.co/4jGnghtVU2
708395372704604200,Fri Mar 11 20:53:12 +0000 2016,This stunning long graphic dress Anita is now available online ! /// Cette magnifique robe… https://t.co/QkR57LdIax
707604221256925200,Wed Mar 09 16:29:27 +0000 2016,Black &amp; white, always a classic, for any season! /// Le blanc et noir, toujours en saison! Style… https://t.co/Zn31uUItK4
707328262452727800,Tue Mar 08 22:12:53 +0000 2016,It's all about the perfect striped jacket for spring! /// Le veston rayé parfait pour le… https://t.co/NFWRdBZeLA
707226572160442400,Tue Mar 08 15:28:49 +0000 2016,Our Emilia top, coming soon ! /// Notre haut Emilia, bientôt disponible en magasins et sur notre… https://t.co/Pzr5DoGoU8
707225909812699100,Tue Mar 08 15:26:11 +0000 2016,Mixing prints, always fun ! /// Mélanger les imprimés, c'est toujours amusant ! Maeva top and… https://t.co/07TR6fI6v1
706937773639471100,Mon Mar 07 20:21:14 +0000 2016,Discover our Betsy tunic ! The perfect top for those white pants you can't wait to pull out of… https://t.co/wAH0xtITCh
706887146439905300,Mon Mar 07 17:00:03 +0000 2016,Perfect outfit for spring days ahead !  https://t.co/Sh5IkCYkDe
706879093002932200,Mon Mar 07 16:28:03 +0000 2016,❤️ Ness dress ! Available online ! /// La robe Ness, maintenant disponible sur notre boutique en… https://t.co/7KrzOFrHAW
706878353073172500,Mon Mar 07 16:25:07 +0000 2016,Smells like spring is around the corner ! /// Ça sent le printemps ! #ss2016collection… https://t.co/XhwKBfFkCA
705147722878287900,Wed Mar 02 21:48:12 +0000 2016,Découvrez les tendances printemps/été 2016 de 5 designers québécois !  https://t.co/oQHIXSrUDu
704743123923116000,Tue Mar 01 19:00:28 +0000 2016,Afternoon sunshine, making us think of the spring days coming shortly ! Le beau soleil nous fait… https://t.co/VL67prey27
701839825540788200,Mon Feb 22 18:43:48 +0000 2016,We are in New York city for the Coterie Show ! Discover our Fall 2016 collection booth#4729.… https://t.co/gGGeHREoDB
701831358323228700,Mon Feb 22 18:10:09 +0000 2016,We are at the Coterie Show in NYC! Come by our booth #4729! #mtldesigner #fw2016collection #NYC
701796251969302500,Mon Feb 22 15:50:39 +0000 2016,The perfect casual chic summer dress, Matilde!  /// La robe parfaite pour vos journées d'été,… https://t.co/w1j2VUobmE
701794105420939300,Mon Feb 22 15:42:08 +0000 2016,A touch of color, our Helen top is now available online, get your hands on one today ! Le haut… https://t.co/0ZMEAT27Nn
701783893477724200,Mon Feb 22 15:01:33 +0000 2016,Our Spring collection is now available ! Get  your hands on these styles today. Visit… https://t.co/F4gUdxvJjt
700758599337791500,Fri Feb 19 19:07:24 +0000 2016,Our Spring/Summer 2016 collection has arrived ! /// Notre collection printemps/été 2016 est… https://t.co/zkYn5v74ST
699719830107066400,Tue Feb 16 22:19:42 +0000 2016,One of those evenings you just want to get home and cuddle under blankets with a good book ! ///… https://t.co/smRDV1GUe8
697470815512584200,Wed Feb 10 17:22:55 +0000 2016,Perfect winter day to wrap up in a wool vest ! / Journée d'hiver parfaite pour s'emmitoufler… https://t.co/SY3PuYofwC
697172916820164600,Tue Feb 09 21:39:10 +0000 2016,Merci @sarahjlabrosse d'avoir porté notre cape Charlene!  on adore ❤️ https://t.co/LX0RGZASyE
697153976643428400,Tue Feb 09 20:23:55 +0000 2016,You &amp; I /// Toi &amp; moi #valentinesweek https://t.co/5BfVgwzsmO
694614958634459100,Tue Feb 02 20:14:46 +0000 2016,Have you enjoyed the sun today ? /// Avez-vous profitez du beau soleil aujourd'hui? #mtldesigner… https://t.co/ovEJGkNi2f
693105671106105300,Fri Jan 29 16:17:23 +0000 2016,Light and snowy Friday, perfect to take out our wool socks and favorite tea cup ! /// Un… https://t.co/Xw0hSsw5EF
692758191336063000,Thu Jan 28 17:16:38 +0000 2016,TBT to our runway fall collection. We love cozy knits ! #wmcfw #winterfashion #mtldesigner #tbt https://t.co/bC4Arhkoi3
690650055179567100,Fri Jan 22 21:39:39 +0000 2016,Nous sommes très choyées d'avoir reçu Madame Tifo lors de notre vente d'atelier aujourd'hui !! https://t.co/d4OvaKU3kn
690627858511859700,Fri Jan 22 20:11:27 +0000 2016,Les soldes d'atelier à courir ! https://t.co/ItdIUb46mk
690533017031413800,Fri Jan 22 13:54:35 +0000 2016,Dernière journée de notre vente d'atelier ! / Last day of our warehouse sale ! https://t.co/GxBFliWWmo
689875161890193400,Wed Jan 20 18:20:30 +0000 2016,Our warehouse sale is on today until Friday. Come visit us at 9250 park av. Suite 611, to… https://t.co/frG21pVSq5
689817947930497000,Wed Jan 20 14:33:09 +0000 2016,Our warehouse sale starts today !  https://t.co/KaQ1lIQQUr
689817851683868700,Wed Jan 20 14:32:46 +0000 2016,Notre vente d'atelier débute ce matin !  https://t.co/QsT17Tprxz
688021127000670200,Fri Jan 15 15:33:14 +0000 2016,#itsfriday #haveagoodweekend https://t.co/bMrhzgjtBA
687330659291926500,Wed Jan 13 17:49:33 +0000 2016,Cozy sweater, fun print ! Perfect for winter ! Now on sale. /// Chandail chaud et amusant pour… https://t.co/oV5RbVXAif
687007263714709500,Tue Jan 12 20:24:30 +0000 2016,Our warehouse sale will take place next week! Come discover our spring2016 collection and get up… https://t.co/IfooM7accm
686649544386318300,Mon Jan 11 20:43:03 +0000 2016,Keep you neck warm on this windy day with our Malia scarf ! //// Gardez votre cou au chaud pour… https://t.co/r4beeciUzJ
686589825235853300,Mon Jan 11 16:45:45 +0000 2016,RIP #davidbowie #icon https://t.co/tWi110L2gM
686581216150171600,Mon Jan 11 16:11:32 +0000 2016,Our favorite looks from the Golden Globe red carpet ! photo credit : getty images https://t.co/MK8QAOsPTC
686545672208781300,Mon Jan 11 13:50:18 +0000 2016,RT @ShopgirlsGB: Feeling Foxy? @melissa_nepton #shopyourshape #circle #rectangle #invertedtriangle #classic https://t.co/y6MlwKYwR1
685538464280883200,Fri Jan 08 19:08:01 +0000 2016,That's a wrap! The Spring/Summer 2016 collection will be available in stores and online soon :)… https://t.co/BuIrXO3vL5
685104326851706900,Thu Jan 07 14:22:54 +0000 2016,Warehouse Sale !!!! Discover our Spring/Summer 2016 collection and get up to 80%off previous… https://t.co/5Z1hDGSwFP
684490144016015400,Tue Jan 05 21:42:22 +0000 2016,Sneak Peek at our Spring/Summer 2016 collection ;) /// Un avant gout de notre collection… https://t.co/05d1Y0Qh9L
684092441343860700,Mon Jan 04 19:22:02 +0000 2016,Winter has arrived! Time to warm up with coffee and our comfy Carly sweater. /// L'hiver est… https://t.co/ywfO0chRDJ
680494947158507500,Fri Dec 25 21:06:53 +0000 2015,Hope everyone is having a Merry Christmas! Our last giveaway, a Becca cape !!! //// En espérant… https://t.co/tGOq4YhZF5
680168886566715400,Thu Dec 24 23:31:14 +0000 2015,ONE DAY BEFORE CHRISTMAS!!! Our giveaway today, a 75$ gift card. //// dernière journée avant… https://t.co/vljQ0pHA6F
679691840912638000,Wed Dec 23 15:55:37 +0000 2015,2 DAYS BEFORE CHRISTMAS! Our daily giveaways continue with a Julia scarf! Who will be our lucky… https://t.co/jcpfWey8tw
679339902157258800,Tue Dec 22 16:37:08 +0000 2015,3DAYS TILL CHRISTMAS!!! Simply like our picture for a chance to win a beautiful Malia scarf ! ///… https://t.co/Ob8NheRcU5
679044710569148400,Mon Dec 21 21:04:09 +0000 2015,Don't let the rainy weather get you down! FALL SALES ARE HERE!!!! Everything is on sale starting… https://t.co/H4ZvQEAHWC
678974526495952900,Mon Dec 21 16:25:16 +0000 2015,ONLY 4 DAYS until Christmas !!! Our treat for you today.... follow us on instagram for a chance… https://t.co/ZGmGuNJsGr
677949072393678800,Fri Dec 18 20:30:29 +0000 2015,Still looking for gift ideas or the perfect outfit for the holidays ? Last day to place your… https://t.co/amuPMDyT0o
677606413133217800,Thu Dec 17 21:48:52 +0000 2015,For a cozy holiday look @cbriardneves, indulge in one of our Becca capes, now at 50% off /// Un… https://t.co/ESn9ixTRlx
677205373334499300,Wed Dec 16 19:15:17 +0000 2015,RT @mariesoleildion: Tellement heureuse de ma visite chez @melissa_nepton !! 😍😍😍 https://t.co/0YM8bqS3vq
677204919565221900,Wed Dec 16 19:13:29 +0000 2015,Petite visite de @mariesoleildion cet après-midi ! #nicemeeting #fallfashion #afternoonatwork https://t.co/TxoC8SNNT8
676863965025067000,Tue Dec 15 20:38:39 +0000 2015,''Quoi porter pour la St-Sylvestre?'' Quelques idées d'@odile_ab à découvrir ici !  https://t.co/BvWRawplYr
676833129118625800,Tue Dec 15 18:36:07 +0000 2015,FREE SHIPPING !!! On all orders, anywhere in Canada and the US ! /// LIVRAISON GRATUITE !!! Sur… https://t.co/fl4thnIzef
675383567292174300,Fri Dec 11 18:36:05 +0000 2015,Fitting time ! /// C'est l'heure de l'essayage ! #fridayafternoon #workandfun https://t.co/fHCSCz8ZYg
674955971798544400,Thu Dec 10 14:16:58 +0000 2015,Nous agrandissons! Nouveau local en construction !!! /// Our new space is under construction !!!… https://t.co/OtOp6SXbmv
674697198848761900,Wed Dec 09 21:08:42 +0000 2015,Nous aggrandissons! Nouveau local en construction ;)) /// Our new space is under construction!!!… https://t.co/Bl7VSH13AM
674259625001095200,Tue Dec 08 16:09:56 +0000 2015,Cozy sweaters for the cold days up ahead ! All at 20% off! /// Des chandails confortables pour… https://t.co/NBsTUpIYsn
673965432097800200,Mon Dec 07 20:40:55 +0000 2015,Happy to start a collaboration with Cassidy @cbriardneves. More to come !!! Stay tuned! Our… https://t.co/wW4e5Jd776
673162025279873000,Sat Dec 05 15:28:28 +0000 2015,Last weekend at the One of a Kind Christmas show! Stop by our booth #O-54 for great finds ! #OOAKX15 #Toronto
672880861268672500,Fri Dec 04 20:51:13 +0000 2015,Wishing everyone a great weekend! /// Bonne fin de semaine à tous! #itsfriday #almosttheweekend https://t.co/LpSkNXsno1
672463745545736200,Thu Dec 03 17:13:45 +0000 2015,Twins Natasha and Melissa #tbt to 30 years ago ! /// Natasha et Mélissa il y a 30 ans !… https://t.co/VXz7f3bZdn
672160047066050600,Wed Dec 02 21:06:58 +0000 2015,Creation of the fall/winter 2016 collection is underway! Stay tuned for more sneak peeks! ///… https://t.co/zYtpbYM13n
671351949539696600,Mon Nov 30 15:35:52 +0000 2015,CYBER MONDAY!!! Get an additional 20% off the fall/winter collection ! /// CYBER LUNDI!!!! Obtenez… https://t.co/tG7HEmK9vD
670753960504922100,Sat Nov 28 23:59:40 +0000 2015,Mother daughter shopping spree ooak_toronto ! Come see us booth O-54 / Soirée magasinage mère fille… https://t.co/otqhfefRJE
670262723461017600,Fri Nov 27 15:27:40 +0000 2015,BLACK FRIDAY !!! Get 20% off all collections with promo code ''blackfridaysale''. Online only. ///… https://t.co/0SrsJkyy12
670237427064287200,Fri Nov 27 13:47:09 +0000 2015,RT @SofyM: Une belle gang aujourd'hui! Merci @melissa_nepton pour cette belle rencontre qui débute la saison du… https://t.co/9FdFnTEmYL
669970719804035100,Thu Nov 26 20:07:21 +0000 2015,Beaux moments avec les filles @salutbonjour @valchevalier @genhd #evemarielortie #mariechristineproulx https://t.co/skGao3BFpE
669967762895331300,Thu Nov 26 19:55:36 +0000 2015,@ValChevalier @salutbonjour nous adorons vous recevoir ! Cela fait plaisir!
669964418252324900,Thu Nov 26 19:42:19 +0000 2015,La gang de @salutbonjour nous a rendu visite ce matin pour une dejeuner/shopping ! @valchevalier… https://t.co/dMtyoZR3xV
669958122547585000,Thu Nov 26 19:17:18 +0000 2015,Merci d'être passé nous rendre visite !  https://t.co/BbfZqaAHT4
669957817407832000,Thu Nov 26 19:16:05 +0000 2015,Toujours contentes de vous recevoir !  https://t.co/fQGJBsxCT5
669956857142878200,Thu Nov 26 19:12:16 +0000 2015,La belle @ValChevalier à déniché une magnifique veste de laine de notre collection runway! https://t.co/hUNRm52SVW
