id,created_at,text
784015768094597100,Thu Oct 06 13:01:40 +0000 2016,@mandybedi Thank you Mandira! Although of course you've heard me many times before but I'm sure never Rabindra Sangeet ☺️
783909629113671700,Thu Oct 06 05:59:54 +0000 2016,GREAT NEWS - Amar Bela Je Jaye my first Rabindra Sangeet album is up online. Click the link to listen &amp; buy.  https://t.co/slqFs853WS
783909008503509000,Thu Oct 06 05:57:26 +0000 2016,GREAT NEWS-Amar Bela Je Jaye my 1st Rabindra Sangeet album is up online. Click the link to listen and buy on @gaana  https://t.co/LLYv1VXTkh
783908282150768600,Thu Oct 06 05:54:33 +0000 2016,GREAT NEWS-Amar Bela Je Jaye my 1st Rabindra Sangeet album is up online. Click the link to listen and buy on @Saavn https://t.co/mCyRlaqOOw
783903962642518000,Thu Oct 06 05:37:23 +0000 2016,Superb initiative, this. Let's give our support! https://t.co/q8VrdeZ9fE
783849570857984000,Thu Oct 06 02:01:15 +0000 2016,Economy rates of bowlers &amp; strike rates of batsmen in 50 overs cricket, resembling T20 cricket. 😔#SAvAUS
783581921158627300,Wed Oct 05 08:17:42 +0000 2016,RT @thepeoplepost1: Former India batsman @sanjaymanjrekar comes out with #RabindraSangeet album. Read more https://t.co/yEim1zn1Uj https://…
783559956448411600,Wed Oct 05 06:50:26 +0000 2016,Would not have been possible without you. https://t.co/gYTv6zfPso
783556597599440900,Wed Oct 05 06:37:05 +0000 2016,You know me. Smiling does not come easy to me.😊 https://t.co/x6Mk4QPnLG
783356617727184900,Tue Oct 04 17:22:26 +0000 2016,It's about feeling a connection. Felt it with Rabindra Sangeet. Language was a small barrier. 😊 https://t.co/8nARWaMjaH
783355340049948700,Tue Oct 04 17:17:21 +0000 2016,Nuggets from my Rabindra Sangeet album release this afternoon.  https://t.co/Vwlm9MCSAh
783339409672380400,Tue Oct 04 16:14:03 +0000 2016,At the release of my Rabindra Sangeet album Amar bela je jaye. https://t.co/Mxfs5lw2J8
783275737872756700,Tue Oct 04 12:01:03 +0000 2016,The universe conspired to make this happen. My Rabindra Sangeet CD 'Amar bela je jaye' is out. Thank you team Picas… https://t.co/wZvLVFE8wN
783274466772222000,Tue Oct 04 11:56:00 +0000 2016,I promise you 'sukoon'. No noise in this one. Only 🎶 https://t.co/eLCqcyIXTq
783237738992513000,Tue Oct 04 09:30:03 +0000 2016,Thankyou to Sourav Ganguly &amp; Sraboni Sen for releasing my Rabindra Sangeet album Amar bela je jaye' this afternoon. https://t.co/b7T1BtxxIK
783196852141383700,Tue Oct 04 06:47:35 +0000 2016,We are now LIVE on Facebook. https://t.co/wuFOmXIUlo
783162665829036000,Tue Oct 04 04:31:44 +0000 2016,TODAY. 12 NOON.  https://t.co/Tu36mLE5TT https://t.co/hhBLamoKOI
783161749155504100,Tue Oct 04 04:28:06 +0000 2016,@Schenell_Dcosta Thank you ☺️
782957016092385300,Mon Oct 03 14:54:33 +0000 2016,Two great guys to read after a game. They shed light better than most on the day's play. https://t.co/Inm9NGXDiN
782955408931557400,Mon Oct 03 14:48:10 +0000 2016,Excellent rotation of the 4 bowlers. Keeping seamers involved. Especially in last session. Right balance of attacki… https://t.co/vgDFvojmGe
782916045229088800,Mon Oct 03 12:11:45 +0000 2016,You could be right. Is that so @mohanstatsman ? https://t.co/VAOSqH6skb
782906000131096600,Mon Oct 03 11:31:50 +0000 2016,I know captains say you are as good as the team but Virat Kohli was outstanding as captain in this test! Especially in the final innings.👏👏👏
782841301410644000,Mon Oct 03 07:14:45 +0000 2016,Well said. https://t.co/Ff9sLP37Ns
782810762590900200,Mon Oct 03 05:13:24 +0000 2016,Tomorrow's the big day! Checkout the FB page for more details https://t.co/Tu36mLVGLr https://t.co/ej1thU1uGL
782809840792047600,Mon Oct 03 05:09:44 +0000 2016,You have always been a very modest man Harsha 😉 https://t.co/9wMR38HdNB
782562987236216800,Sun Oct 02 12:48:50 +0000 2016,Arrey it's damn confusing 😥.Some spell and pronounce it Bhetki &amp; others Bhekti. Will call Bhetki from now on. https://t.co/mUzUafnYEZ
782562192348491800,Sun Oct 02 12:45:40 +0000 2016,Panesar has more of a copy book action than Santner Gave the ball more rip when on song. Also a bit quicker. https://t.co/0KdH68eeLF
782499267822968800,Sun Oct 02 08:35:38 +0000 2016,Superb innings by Virat. Demonstrating what he meant, when he said 'There is nothing like form, it's how you feel on a particular day.'
782471072625012700,Sun Oct 02 06:43:35 +0000 2016,Here's a little teaser of the new album. For more details, checkout the FB page https://t.co/Tu36mLVGLr https://t.co/e37SRRIGXc
782256445039444000,Sat Oct 01 16:30:44 +0000 2016,Must sit down one day and do a count.👍 https://t.co/dODNiB6g5U
782208434036846600,Sat Oct 01 13:19:58 +0000 2016,RT @sanjaymanjrekar: Here's the Facebook page for my Rabindra Sangeet album 'Amar Bela Je Jaye' https://t.co/Tu36mLVGLr
782099001235480600,Sat Oct 01 06:05:07 +0000 2016,Here's the Facebook page for my Rabindra Sangeet album 'Amar Bela Je Jaye' https://t.co/Tu36mLVGLr
782091707898880000,Sat Oct 01 05:36:08 +0000 2016,Very well done this! Step in the right direction. Toughest format must have high rewards for players. https://t.co/KbdAPgd2bW
782090919709409300,Sat Oct 01 05:33:00 +0000 2016,What a great start to day 2. Some incisive &amp; at times hostile bowling from NZ. India showing grit though Saha. Vintage test match stuff!
781737714613903400,Fri Sep 30 06:09:29 +0000 2016,https://t.co/QhfNk1SHWt A little preview of my Rabindra Sangeet album - Amar bela je jaye
781547624121962500,Thu Sep 29 17:34:08 +0000 2016,Well, I represented IES once in an inter school singing competition, but forgot my lines in the final round 😩 https://t.co/dKUYoMQMGK
781514986535292900,Thu Sep 29 15:24:27 +0000 2016,So, what are the benefits I get now as adopted Bengali? :) https://t.co/hozgf1caRC
781460383500501000,Thu Sep 29 11:47:28 +0000 2016,Can only sing Bangla. Can't talk Bangla. 😉 https://t.co/XMnQnvP6rI
781381765810098200,Thu Sep 29 06:35:04 +0000 2016,Was guided by none other than Srabani Sen, renowned exponent of Rabindra Sangeet. She approved the takes :) https://t.co/Yx8ngwO1KM
781379034542329900,Thu Sep 29 06:24:13 +0000 2016,Thanks mate. I put the 10,000 hours theory into practice on this one :) https://t.co/e24263oxsx
781373492285419500,Thu Sep 29 06:02:12 +0000 2016,Shukriya sir! https://t.co/qqaYPH1Qb6
781372833649811500,Thu Sep 29 05:59:35 +0000 2016,@gauravkalra75 Thanks my friend. Will let you know when it's out.
781367296845426700,Thu Sep 29 05:37:35 +0000 2016,One of the happiest day of my life. A dream fulfilled. To sing Rabindrasangeet in bengali. Put in the hours ( years… https://t.co/dja9X6pSE1
781163548860751900,Wed Sep 28 16:07:58 +0000 2016,Behind every good commentator there is a good tutor. https://t.co/oX36PQBjD4
781160439002439700,Wed Sep 28 15:55:36 +0000 2016,I would play Shikhar. After that 84 in the 1st test against WI, think he deserves more opportunities. GG is great a… https://t.co/3CG1AQskz1
781000752462430200,Wed Sep 28 05:21:04 +0000 2016,@Nair_OnFire @Kmittal255 No gym during playing days. But now, regularly. Should have been the other way round right?
780805524841386000,Tue Sep 27 16:25:18 +0000 2016,Yes. That's it, one bite. That's my life these days 😔 https://t.co/6Z5RSih4WE
780804277375762400,Tue Sep 27 16:20:21 +0000 2016,Thank you #OberoiGrand Kolkata. Great to be here. https://t.co/l2Tnw4NJBq
780428195757633500,Mon Sep 26 15:25:56 +0000 2016,Will depend on the pitch. But very unlikely. https://t.co/RfKOKhbl91
780334864352489500,Mon Sep 26 09:15:04 +0000 2016,Well, your 6 wickets helped get the perfect result in the 400th. 👍 https://t.co/8yBDMxIe0V
780328674457288700,Mon Sep 26 08:50:28 +0000 2016,Classic case of faux pas. That's called jumping the gun. Would have been disqualified if I was a sprinter 😊 https://t.co/zPyYUH7bGI
780323724696236000,Mon Sep 26 08:30:48 +0000 2016,So India now has won its 300th, 400th &amp; 500th test match. #500thTest
780321251109670900,Mon Sep 26 08:20:58 +0000 2016,Really good test match! There was the much talked about balance between bat &amp; ball. Good crowds added to the drama. Well done Kanpur!
780276651309473800,Mon Sep 26 05:23:45 +0000 2016,Stephen Fleming suggesting 4 day tests. Starting Thursday climaxing on Sunday. 98 over per day. Get weekend crowd for  50 % of the game.
780275858908979200,Mon Sep 26 05:20:36 +0000 2016,RT @TheCriclife: Vijay Manjrekar: 20 facts about the former India batting great https://t.co/RkqRStT8GV https://t.co/3MMFOE5FbX
780275780731277300,Mon Sep 26 05:20:17 +0000 2016,RT @ICC: #OnThisDay in 1931, Vijay Manjrekar was born. A great batsman with 3,208 Test runs, his son Sanjay also went on to play for India.…
780034778946863100,Sun Sep 25 13:22:38 +0000 2016,Hello Atin! Thank you :) https://t.co/I6TB314aFY
780015073716686800,Sun Sep 25 12:04:20 +0000 2016,Well done R. Ashwin! Second fastest to 200 wickets in tests. His skills are such a great commercial for test cricket.  #IndvNZ
779983546697986000,Sun Sep 25 09:59:03 +0000 2016,Doesn't matter, as long as it creates a nice ambience. In WI, I thought paying people to come &amp; watch would have be… https://t.co/f10dAGEiG1
779965106385846300,Sun Sep 25 08:45:47 +0000 2016,Had this feeling that Rohit Sharma will get runs in the 2nd innings.😉
779944783095615500,Sun Sep 25 07:25:01 +0000 2016,Let's show our commitment to tests by ensuring that 2 days of it are played over the weekend. Great Sunday crowd. https://t.co/e1V5J25knj
779881709680468000,Sun Sep 25 03:14:23 +0000 2016,Yes I had, good that this has been an extension of Duleep trophy, mostly spin. So that helped. But loved his focus… https://t.co/Rxfoqg9IYc
779880628946776000,Sun Sep 25 03:10:06 +0000 2016,It's another murder mystery serial but yet so different. The quiet landscape, I guess, sets it apart. https://t.co/l1vELydfyN
779879575660617700,Sun Sep 25 03:05:54 +0000 2016,RT @Amber_Banerjee: @sanjaymanjrekar My team was: Gavaskar, Sehwag,  Dravid, Sachin, Vishwanath, V Mankad , DHONI, Kapil, Kumble, Zaheer an…
779879286811398100,Sun Sep 25 03:04:46 +0000 2016,Okay Sir, your wish is my command. https://t.co/BdKl4duP7v
779584921136304100,Sat Sep 24 07:35:03 +0000 2016,With a disclaimer - Post 70s.  Regrets - VVS, Kumble, Srinath. https://t.co/UZvQQxnw0s
779583639508049900,Sat Sep 24 07:29:58 +0000 2016,As I said 😉 https://t.co/j3WN7FizoK
779539136269000700,Sat Sep 24 04:33:07 +0000 2016,Indian spinners have put some more green chillies in their brew today.  #INDvNZ
779523508762058800,Sat Sep 24 03:31:01 +0000 2016,So, he wasn't looking to hit the ball in the air. Thus no risk involved. Hence average 99.94 #ForeverAnalysing https://t.co/XUD2JB9mLf
779518672867950600,Sat Sep 24 03:11:49 +0000 2016,Yes, Indian cricket gave you a raw deal 😉 https://t.co/cDlX4O2Jb5
779328403509956600,Fri Sep 23 14:35:45 +0000 2016,@prafullm22 @alanwilkins22 It's not change. Sweep shot has never been that deeply ingrained in Indian batsmen.
779324064892452900,Fri Sep 23 14:18:30 +0000 2016,Chalo, at least in this regard I did better than my old man. I had one! https://t.co/Z0XsbCL60q
779207589791866900,Fri Sep 23 06:35:41 +0000 2016,John Inverarity as selector dropped Ponting from ODIs on bad form &amp; gave no guarantee of his test future then. Inverarity played 6 tests.
779178236735393800,Fri Sep 23 04:39:02 +0000 2016,Spotted 12 eye catching elements in the get up today 😉 https://t.co/suO15kPkU4
779159887972409300,Fri Sep 23 03:26:08 +0000 2016,Like it's with commentators, with selectors too, it does not matter how many matches you have played. It's about being good at your job.
778926861015355400,Thu Sep 22 12:00:10 +0000 2016,Good spot! Also Impact may have been outside off. But who watched that in those days! https://t.co/POnu8yAscz
778924922022178800,Thu Sep 22 11:52:27 +0000 2016,Absolutely impressed with NZ. Didn't make the typical mistakes that foreign teams make start of an Ind tour. Especially their spinners.
778781961582022700,Thu Sep 22 02:24:23 +0000 2016,A landmark Test to start a landmark season https://t.co/oiSwnPLBxa I guess that's why we are staying at the Landmark Hotel in Kanpur 😉
778779686637744100,Thu Sep 22 02:15:20 +0000 2016,Quickest umpiring decision ever too! https://t.co/7OJZkFvPEY
778194658115530800,Tue Sep 20 11:30:39 +0000 2016,Hope he does in the actual playing eleven 😊 But then must look more convincing than he has lately in tests. https://t.co/fI4x00pqoa
778076778069790700,Tue Sep 20 03:42:14 +0000 2016,Mumbai rains now behaving like a 'chipku' guest.
778065978655551500,Tue Sep 20 02:59:19 +0000 2016,Got a crucial &amp; a fine 84 in Antigua, couple of test matches back. Hence in my playing 11. Pujara unfortunate to mi… https://t.co/fitvjxbXBd
778064382446084100,Tue Sep 20 02:52:59 +0000 2016,Assuming it's a dry pitch here is my playing XI for first test -Vijay,Shikhar,Rahul,Virat,Rahane,Saha,Ashwin,Jadeja,Mishra,Shami,Ishant.
777896772005834800,Mon Sep 19 15:46:57 +0000 2016,And still tweeting 😏 https://t.co/bHhAY1Srlj
777879462528503800,Mon Sep 19 14:38:10 +0000 2016,Ans 1 - All for it. Ans 2 - The one who has the most interesting story to tell. https://t.co/NEqYG46vbR
777674533796839400,Mon Sep 19 01:03:52 +0000 2016,RT @sardesairajdeep: The best way to deal with Pak based terror is to speak softly, act tough. We have done just the opposite for years.
777530416588689400,Sun Sep 18 15:31:11 +0000 2016,RT @seemagoswami: Dear Indian TV news channels, 17 brave soldiers are dead. Nobody gives a damn about which one of you was the first to rep…
777530097129496600,Sun Sep 18 15:29:55 +0000 2016,RT @mukhiasudeep: Some anchors have started their war mongering from inside studios. Because they wont lose family members at the borders.…
777529906292928500,Sun Sep 18 15:29:10 +0000 2016,Let me have a listen &amp; get back 😊 https://t.co/nNQqvqVbIN
777029555341099000,Sat Sep 17 06:20:57 +0000 2016,Players don't necessarily know what's best for the game. I know this because I was a player once. https://t.co/j1kSV5aS4u
777015058026995700,Sat Sep 17 05:23:20 +0000 2016,Reality of today is that you are in the minority. https://t.co/B13iEXihPw
776999674032959500,Sat Sep 17 04:22:12 +0000 2016,The most fun guy to interview. Happy birthday Ravichandran Ashwin.
776998442392367100,Sat Sep 17 04:17:19 +0000 2016,Till then let's keep playing to no audience.  https://t.co/0o2JL2btfu
776698702685614100,Fri Sep 16 08:26:15 +0000 2016,My dear friend Arvinder's son @ashoosingh1234 has so easily stepped into his father's shoes.Beautiful rendition this https://t.co/NNnT0sOtmP
776674445737984000,Fri Sep 16 06:49:52 +0000 2016,When asked in Pak, why do people like you so much here. Balaji cutely replied may be because I am black. No it's the smile Balaji!
776385772891111400,Thu Sep 15 11:42:47 +0000 2016,Very dependant on the kind of pitches we get. https://t.co/MB50c0Nyg2
776384397041922000,Thu Sep 15 11:37:19 +0000 2016,So sorry about that 😔 https://t.co/MTwB1cDIvk
776308516340412400,Thu Sep 15 06:35:48 +0000 2016,Not a single sponsor hoarding. Ganeshotsav wasn't a commercial enterprise then.😌 https://t.co/56yCmVFkT8
775977849605894100,Wed Sep 14 08:41:50 +0000 2016,RT @BCCI: #TeamIndia to play their #500thTest (Sept 22) against #NZ at the Green Park Stadium in Kanpur #INDvNZ https://t.co/bYxQ6rwCRI
775969405171662800,Wed Sep 14 08:08:17 +0000 2016,@tejha001 Happy Onam my friend
775964958458642400,Wed Sep 14 07:50:37 +0000 2016,Security is just an excuse to not travel to Bangladesh. I think the main reason is traffic 😉
775906798725365800,Wed Sep 14 03:59:31 +0000 2016,Didn't see this one coming. Coach's are such soft targets.  https://t.co/2lFChUjAMO
775694492292751400,Tue Sep 13 13:55:53 +0000 2016,Retweeting this more for people to see how good Imran still looks.🙏 https://t.co/XVi5NHG5Du
775606143129378800,Tue Sep 13 08:04:49 +0000 2016,@MalhotraSaurabh @bhogleharsha he is very accurate over long spells &amp; can get quick turn. Has 2 basic variations that are hard to pick.
775575507710586900,Tue Sep 13 06:03:05 +0000 2016,@suneerchowdhary fair point. His best bowling figures came overseas by the way 😉
775566873291132900,Tue Sep 13 05:28:46 +0000 2016,Another star tweet from the one and only! 👍👍👏👏 https://t.co/0nLW9YamLW
775566178022330400,Tue Sep 13 05:26:00 +0000 2016,Have always felt Ravindra Jadeja is underrated as a test bowler. Adds greatest value in longest format. https://t.co/hTR6tu5XSQ
775342523975802900,Mon Sep 12 14:37:17 +0000 2016,My wife &amp; her 3 girl friends take a walk every evening. It's for an hour. They return home well informed. #ForeverAnalysing
775294241442455600,Mon Sep 12 11:25:26 +0000 2016,It's like when the coach would tell us as players that practice is optional today. We all turned up anyway.  https://t.co/vVUS1SS6HM
775243158556860400,Mon Sep 12 08:02:26 +0000 2016,You can actually sense the disappointment in the media when a sensible selection is made.😊
775178949487792100,Mon Sep 12 03:47:18 +0000 2016,Clint Eastwood started directing at the age of 41 &amp; still making class films at the age of 85. My hero!! 🙏🙏🙏 https://t.co/afbbvwb9pZ
774998520457592800,Sun Sep 11 15:50:20 +0000 2016,And it tasted as good as it looks here. How lucky am I! https://t.co/IxKvVcRzpK
774929617492869100,Sun Sep 11 11:16:32 +0000 2016,Hope he can keep the same mindset/approach  in tests too. Such people deserve all the success. https://t.co/OscnE0W5oi
774849483758678000,Sun Sep 11 05:58:07 +0000 2016,Haha. Loved writing that piece. Wasn't on cricket for a change. For Namak Gosht, wait for a trip to Peshawar. https://t.co/5WjHPbVVwe
774839925183164400,Sun Sep 11 05:20:08 +0000 2016,You're so right. He reminds me of me :) https://t.co/BFt1xjA3sd
774839167410802700,Sun Sep 11 05:17:07 +0000 2016,@milapthakrar @bhogleharsha my opinion is based on how Pujara has looked in the last few tests. Till he finds test form, I remain concerned.
774827240211124200,Sun Sep 11 04:29:44 +0000 2016,First class form does not count for much when you are playing international cricket. I remain concerned about Pujara in tests.
774618160439840800,Sat Sep 10 14:38:55 +0000 2016,@TiwariProf Agree. We should judge new leaders/govts by how they act against corruption.
774565079018635300,Sat Sep 10 11:08:00 +0000 2016,This is the problem. We have unrealistic expectations from new leaders/govts. Rampant corruption won't suddenly become zero corruption.
774094849301545000,Fri Sep 09 03:59:28 +0000 2016,Player feed back is imp but we must realise that day night tests &amp; pink ball is not an option but an imperative. https://t.co/PFTefFXhlQ
773744450392633300,Thu Sep 08 04:47:07 +0000 2016,Bingo! https://t.co/54gNFdjrPs
773724311043641300,Thu Sep 08 03:27:05 +0000 2016,Unlike a coach, selectors can actually change the course of Indian cricket. So this is a good step. https://t.co/knWdM5LNix
773719526051450900,Thu Sep 08 03:08:04 +0000 2016,Yes when Douglas Marilliar of Zim played it against Ind at Faridabad in 2002. Dilshan's was much later.  https://t.co/RBC6jYCaSB
773546276629516300,Wed Sep 07 15:39:38 +0000 2016,RT @ShirishKunder: If you delete your tweets after posting, you're not ready for a tattoo yet.
773467762031202300,Wed Sep 07 10:27:39 +0000 2016,@ashwinravi99 @bhogleharsha ha ha.
773394067887644700,Wed Sep 07 05:34:49 +0000 2016,Must respect intelligence of fans. They too are evolving. They don't come to watch just 4s &amp; 6s. Melodrama in entertainment is outdated.
773392702364844000,Wed Sep 07 05:29:23 +0000 2016,@shahsa2003 we can start with less bulky bats, something in pitches for bowlers &amp; longer boundaries.
773389866684080100,Wed Sep 07 05:18:07 +0000 2016,@bhargav_kaka @ESPNcricinfo we are all pure products of our environment
773385995832139800,Wed Sep 07 05:02:44 +0000 2016,Yeah, gotta be careful or people will stop coming to the park https://t.co/8duF6rJlPO
773380733935030300,Wed Sep 07 04:41:50 +0000 2016,@ashwinravi99 @bhogleharsha nothing stopping the bowlers from going on strike - Unfavourable working conditions. 😉
773362304146481200,Wed Sep 07 03:28:36 +0000 2016,The lopsided balance between bat &amp; ball in T20s must be monitored. Must not let it reach ridiculous proportions. https://t.co/XyYpwXJ61d
773031737177747500,Tue Sep 06 05:35:03 +0000 2016,@sameer_sayyad What is bread without butter, though?
773030990587441200,Tue Sep 06 05:32:05 +0000 2016,@abin_daya @vasudevan_k Into Keto, are we?
773012548555710500,Tue Sep 06 04:18:48 +0000 2016,@pankajp64005298 @devikambing I meant when you are applying butter on it.
772994471201878000,Tue Sep 06 03:06:58 +0000 2016,Brown bread is more porous than white bread hence takes in more butter, thus neutralising the health effect. #ForeverAnalysing
772670767502766100,Mon Sep 05 05:40:41 +0000 2016,RT @Pranav_Dangi: @sanjaymanjrekar @cricketaakash  Bappa Is Seeming To Make room for himself, so the ball Might be air-borne and expect a s…
772663275234263000,Mon Sep 05 05:10:54 +0000 2016,Ha ha. Yes.👏👏 https://t.co/19WplHFMK4
772662170970501100,Mon Sep 05 05:06:31 +0000 2016,@bhogleharsha but he will get more power in the shot with top hand tight 😉
772660183080153100,Mon Sep 05 04:58:37 +0000 2016,The top hand on the bat needs to be tighter &amp; the keeper needs to be lower in his stance. #ForeverAnalysing https://t.co/oPzSYTdW33
772639355122819100,Mon Sep 05 03:35:51 +0000 2016,@AhsanTanoli thanks for the heads up 👍
772404454960222200,Sun Sep 04 12:02:27 +0000 2016,@chintskap Happy Birthday sir!  Especially loved how Kishore Kumar sounded when he was your voice :)
772400009367040000,Sun Sep 04 11:44:47 +0000 2016,@cnu_madhu Hahah quite right :)
772273735860572200,Sun Sep 04 03:23:01 +0000 2016,Shouldn't #Worldbeard day give us at least two weeks notice?
771898206204547100,Sat Sep 03 02:30:48 +0000 2016,My uncle keeps telling me one thing "People don't change". Watching Sidhu's political moves recently, realised my uncle is so right.
770450566711435300,Tue Aug 30 02:38:24 +0000 2016,RT @iamsrk: “My quiet exterior used to be a mask for hysteria.” RIP Gene Wilder. My growing up inspiration. Ur tender yet ‘wilder’ eyes wil…
770428523961954300,Tue Aug 30 01:10:48 +0000 2016,Last week, this time, was getting ready for the pre show with Viv &amp; Sunny. Today getting ready to drop son to school. Both jobs equally fun!
770288609891004400,Mon Aug 29 15:54:50 +0000 2016,Measured reaction to both successes &amp; failures in sports is a sign of a true sporting nation.
770215309890363400,Mon Aug 29 11:03:34 +0000 2016,Don't miss 'Tenzing Norway' too. Hee hee. https://t.co/kjb7pLmEhf
770148310397046800,Mon Aug 29 06:37:20 +0000 2016,#ChefsTable by #Netflix is epic!
769371591666835500,Sat Aug 27 03:10:56 +0000 2016,Love the West Indian people but not sure about their test cricket. My piece in Cricinfo. https://t.co/OeDnUzq3ym
769182765178728400,Fri Aug 26 14:40:36 +0000 2016,@SARVESHSuccess Wish you a happy birthday Sarvesh!
768994313984352300,Fri Aug 26 02:11:46 +0000 2016,Instead of lashing back at those who take a dig at our olympic performance, introspection is a better response.Improvement is then possible.
768525941463257100,Wed Aug 24 19:10:37 +0000 2016,RT @manishbatavia: Urgently need 6 bottles of AB-ve blood for a friend's uncle at H'nandani Hosp, M'bai. To donate, pls call 02225763355. P…
767693216992727000,Mon Aug 22 12:01:40 +0000 2016,Olympics is an exhibition of sporting &amp; administrative excellence.11000 athletes, 306 events, all done in 16 days. Well done all!
767489321012039700,Sun Aug 21 22:31:28 +0000 2016,RT @hemantbuch: Hey world, this is how you cover cricket grounds cc: #WIvIND #SAvNZ #IREvPAK  https://t.co/w5gNhCpDab
767448489118675000,Sun Aug 21 19:49:12 +0000 2016,@MikeHaysman @bhogleharsha #ICC must insist that all test grounds must have covers that cover entire ground. That would be a start.
767163769210363900,Sun Aug 21 00:57:50 +0000 2016,The Ethiopians, like a pack of wolves, were out to get him. Mo Farah keeps them away &amp; keeps the Gold. Fantastic stuff!  #Rio2016
767152894780903400,Sun Aug 21 00:14:37 +0000 2016,Matt Centrowitz becomes the 1st American to win 1500m gold since 1908. Led the field from the start to the end. Incredible!  #Rio2016
767139038985801700,Sat Aug 20 23:19:34 +0000 2016,Scores the first goal, hits the final penalty kick to win gold for Brazil. The Gods were smiling on Neymar tonight.  #Rio2016
767051609297694700,Sat Aug 20 17:32:09 +0000 2016,What to do...too much a 'Fan' of this man.😌 https://t.co/AFJ9nAIwok
766995160060137500,Sat Aug 20 13:47:50 +0000 2016,It was daylight between Sir Don &amp; the other greats in his time. It's the same with Bolt.  #BOLTUnlimited #TrueGreats
766818816663826400,Sat Aug 20 02:07:07 +0000 2016,Other people's fantasy is Bolt's reality. Another gold in the bag. Another phenomenal run. Incredible Bolt!
766659221542678500,Fri Aug 19 15:32:56 +0000 2016,Yeh badminton bahut tension wala mamla hain, apna cricket hi achha hain. 😔 #welldoneSindhu
766648162060673000,Fri Aug 19 14:49:00 +0000 2016,At a Cricket match on a Cricket ground with Cricketers all around, watching badminton.  #Sindhu
766631721261420500,Fri Aug 19 13:43:40 +0000 2016,RT @neerajkjha: Sanjay in great singing mood at Queen's park oval @sanjaymanjrekar #WIvIND https://t.co/mFcAgBUyP7
766630775387066400,Fri Aug 19 13:39:54 +0000 2016,Well Mazhar has the voice for it &amp; passion for the game, so he is almost there. 😊 https://t.co/UgQ1VMYhCR
766450224499859500,Fri Aug 19 01:42:28 +0000 2016,Bolt again in the 200m. Didn't look ecstatic after the win coz he wanted to beat the clock. But beat the field easily once again.
766080867089330200,Thu Aug 18 01:14:46 +0000 2016,Incredible moment in the 200m 2nd semis. Bolt &amp; Andre de Grasse exchanging smiles as they approached the finish line.  #Rio2016
