id,created_at,text
1259364585771012000,Sun May 10 06:08:09 +0000 2020,I alone would have given this video a 1000 views.😍😍😍😍😍😍😍😍 https://t.co/TbNzYKzSgJ
1258979762703384600,Sat May 09 04:39:00 +0000 2020,I would have had Manoj Prabhakar in there. 😁 https://t.co/yeX4k0ia0U
1258746212200693800,Fri May 08 13:10:58 +0000 2020,Hey thanks Niall. Hope you and the family is safe and healthy. 🙄 https://t.co/UPAvWij76W
1258745673526259700,Fri May 08 13:08:49 +0000 2020,Thanks Vasista. 😊👍 https://t.co/jSuexXTOn8
1258745461730676700,Fri May 08 13:07:59 +0000 2020,Thanks. Glad you liked it. https://t.co/Zun2rX9mkD
1258586828455710700,Fri May 08 02:37:37 +0000 2020,Waqar must preserve Naseem, Shaheen, Hasnain - Ramiz Raja - via ESPNCricinfo app https://t.co/tOxRZoNK0x
1258026524072181800,Wed May 06 13:31:10 +0000 2020,This one on ESPNcricinfo Videocast is about cricketing stories told by a very good story teller.  https://t.co/0Uf533PzH0
1256809075616219100,Sun May 03 04:53:28 +0000 2020,Short review of #Thappad - WOW
1256538444572041200,Sat May 02 10:58:05 +0000 2020,Part 2 of the Ashwin interview.  'As a spinner in T20s, you even need to be ready to bowl bouncers' - via ESPNCrici… https://t.co/M0siK0tOBj
1256429823980863500,Sat May 02 03:46:28 +0000 2020,May 2nd &amp; temperatures in Mumbai are a high of 33 low of 28!
1256069894594072600,Fri May 01 03:56:14 +0000 2020,RT @iqbaltheba: I am getting emotional watching this show go viral. I’ve seen days when I arrived here in the early 90s &amp; desis were nowher…
1255835306693189600,Thu Apr 30 12:24:04 +0000 2020,Horrid couple of days😔 #RIPRishiKapoor
1255456440162140200,Wed Apr 29 11:18:35 +0000 2020,RT @RaunakRK: Dravid ✅ Holding ✅  Time to present Ian Chappell with his InstaLive debut cap. Tomorrow (Thu Apr 30) 2pm IST on #BeyondTheFie…
1255410442375237600,Wed Apr 29 08:15:48 +0000 2020,Like Om Puri, Irrfan Khan too was a global star with stardom &amp; success achieved only through their brilliant acting… https://t.co/EHsWK0rFBa
1255408721003450400,Wed Apr 29 08:08:58 +0000 2020,Thanks Keshav https://t.co/KtobWS1Vpq
1255110582182674400,Tue Apr 28 12:24:16 +0000 2020,RT @sambitbal: Rarely would you watch as captivating a cricket interview. Amazimg candour and insights from @ashwinravi99 in this conversat…
1254974182858858500,Tue Apr 28 03:22:16 +0000 2020,Here it is guys!   'I consider every game I play my last opportunity' - via ESPNCricinfo app https://t.co/3XwNN01yts
1254711145316995000,Mon Apr 27 09:57:03 +0000 2020,Do watch this, when it’s up. One of the most fascinating chats I have had. Here is a little sneak peek. Full thing… https://t.co/H8IyqX0F6s
1254653040893755400,Mon Apr 27 06:06:09 +0000 2020,Just got message from a media agency. Can we do Insta love with you? #Typo
1254619728678719500,Mon Apr 27 03:53:47 +0000 2020,RT @kartikmurali: Where @RaunakRK will be the talker and I shall be the listener 😄
1254619568254967800,Mon Apr 27 03:53:09 +0000 2020,Thanks Nayan. 😊 https://t.co/lCLVQe3nWb
1254619446997659600,Mon Apr 27 03:52:40 +0000 2020,Thanks Amol. Almost as good entertainment in the slip cordon playing for Mumbai right?😉 https://t.co/BWPgKCdvWC
1254292105163419600,Sun Apr 26 06:11:56 +0000 2020,Thanks. It was also approved by @Sanjog_G 😉 https://t.co/QzdwpwciUX
1254265301526548500,Sun Apr 26 04:25:25 +0000 2020,Yes. Credit to the batsman, so also to helmet that came into the game in the late 70s. These shots were unthinkable… https://t.co/9hmCsdrm6G
1254261103292448800,Sun Apr 26 04:08:44 +0000 2020,Guys, please watch this. It’s fun! https://t.co/mPO6yN1LDv
1253989014266413000,Sat Apr 25 10:07:33 +0000 2020,RT @RaunakRK: Just a couple of hours more before I put @sanjaymanjrekar on the spot. I can reveal now that there will be a rapid-fire, a qu…
1253540439040417800,Fri Apr 24 04:25:04 +0000 2020,Many happy returns my friend! Have a great year! @sachin_rt @ Mumbai, Maharashtra https://t.co/BWMtn1fqKd
1253526957616246800,Fri Apr 24 03:31:30 +0000 2020,Thanks. Glad you liked it. 👍 https://t.co/u3zWSVD89j
1253293397420490800,Thu Apr 23 12:03:25 +0000 2020,'The Australian team of the 2000s played every game like it was their last' - Michael Hussey - via ESPNCricinfo app https://t.co/m4JNKRVluh
1253188389194653700,Thu Apr 23 05:06:09 +0000 2020,Received this message on my phone. So proud of the way our Governments are handling this crisis.  #WellDoneIndia… https://t.co/soaWx6o2lh
1253183225112998000,Thu Apr 23 04:45:38 +0000 2020,RT @RaunakRK: Just a few hours to go! Join the chat with Rahul Dravid on insta and send your Qs with #RaunakRetorts Preference given to tho…
1252514933918531600,Tue Apr 21 08:30:05 +0000 2020,Love this look Paaji! Keep it! @therealkapildev https://t.co/zWKZ4HVvrx
1251782506854023200,Sun Apr 19 07:59:41 +0000 2020,And here’s another short story around Islam Gymkhana’s cutlet starring the one &amp; only Vasu Paranjape. @jats72 Get y… https://t.co/6VFu39OYNR
1251781801275580400,Sun Apr 19 07:56:53 +0000 2020,Can’t thank my wife enough for this nostalgic lunch. The Islam Gymkhana Kheema Cutlet by Qadar bhai. See video for… https://t.co/lA9KLGLj0B
1251152977118650400,Fri Apr 17 14:18:09 +0000 2020,Would you like the dal in a bowl? Me: No #QuarantineAdjustments
1250043257901461500,Tue Apr 14 12:48:32 +0000 2020,One of the best I have done. Thanks entirely to my guest. https://t.co/jmZJJiQJmC
1250042345774395400,Tue Apr 14 12:44:54 +0000 2020,Thanks ⁦@mhussey393⁩ for allowing me to get inside your fantastic cricket brain.   you can keep your cool longer th… https://t.co/wc0mTVUtme
1249922369663033300,Tue Apr 14 04:48:10 +0000 2020,Didn’t work, they waited.  #FlopTactic https://t.co/MpQwTuYo4i https://t.co/4PP6CFc1ke
1249314637776117800,Sun Apr 12 12:33:15 +0000 2020,Now celebrate that with a cup of tea Polly! Extra milk!😊 https://t.co/1B0m2yP2nj
1249313708381110300,Sun Apr 12 12:29:33 +0000 2020,Nice message Pratik. See @KrisSrikkanth was good judge of potential. 😊 https://t.co/4LqCeS1D43
1249217074661961700,Sun Apr 12 06:05:34 +0000 2020,Tip on peeling garlic - When asked to do this, pretend you haven’t heard &amp; run into the toilet &amp; don’t come out for an hour. #QuarantineLife
1249189490708660200,Sun Apr 12 04:15:58 +0000 2020,No curfew on birds for another two weeks. 😌 #LockdownExtended
1249187168259620900,Sun Apr 12 04:06:44 +0000 2020,It’s true. Didn’t see the seam rotation &amp; because of that I could not whack it &amp; just nudged it away. Hello, Dr Deo… https://t.co/r5IbUEeirq
1248859559948505000,Sat Apr 11 06:24:56 +0000 2020,Sir aap hamein sharminda kar rahe hai. ☺️ https://t.co/Dw3OyejAHc
1248858900209619000,Sat Apr 11 06:22:19 +0000 2020,Shit! I may get used to this. 😧  #lockdown
1248579953450340400,Fri Apr 10 11:53:53 +0000 2020,@devikambing using this lockdown period to finalise the menu at ‘her soon to open’ cafe. Which means I have to tast… https://t.co/cLgQsBlvsn
1248088741425471500,Thu Apr 09 03:21:58 +0000 2020,Past, present and future of WI cricket here. Do watch.  Hosting after quite a while.😊 https://t.co/YufONmo2EA
1248087555284832300,Thu Apr 09 03:17:16 +0000 2020,RT @StarSportsIndia: @DharmpreetJang1 @msdhoni @sanjaymanjrekar @harbhajan_singh @jatinsapru Send in your kid's videos commentating or mimi…
1247893644503179300,Wed Apr 08 14:26:44 +0000 2020,That’s me on the left. Who’s that next to me? #archive https://t.co/lsAELwqUAY
1247729561443295200,Wed Apr 08 03:34:43 +0000 2020,I have one already. Top quality. https://t.co/H6Hg9q7d3H https://t.co/tCxyvF2Llk
1247024077170065400,Mon Apr 06 04:51:23 +0000 2020,Made an unsuccessful attempt at convincing my wife that the floor loses its sheen when swept &amp; cleaned daily.  🧹 🧽  #QuarantineDiaries
1247013600276836400,Mon Apr 06 04:09:45 +0000 2020,Yup. He was the match winning difference. https://t.co/HzFexwdYae
1247012522416169000,Mon Apr 06 04:05:28 +0000 2020,Glad you liked it. 😌 https://t.co/KqXmTGawpz
1246815251716288500,Sun Apr 05 15:01:35 +0000 2020,How dare I attempt this song?#KishoreCovers #SwipeLeft @ Mumbai, Maharashtra https://t.co/YttTsTwDBw
1246652241643102200,Sun Apr 05 04:13:50 +0000 2020,Suck in the abdomen so that there is less strain on your lower back...while sweeping floors. #QuarantineDuties
1246327567973380000,Sat Apr 04 06:43:42 +0000 2020,That’s TONIGHT 4th April, at these times 👇 https://t.co/OWpZcBsawl
1246325997122867200,Sat Apr 04 06:37:27 +0000 2020,What’s really noteworthy is how quickly nature bounces back the moment we take a little bit of a back seat. Air see… https://t.co/EZxDu9sA9y
1246324448145420300,Sat Apr 04 06:31:18 +0000 2020,The cricket may have been brought to a temporary standstill, but there's plenty to 🗣️ about!  Join me and some fell… https://t.co/aHoL4mKwVg
1246320453213474800,Sat Apr 04 06:15:26 +0000 2020,RT @Sanjog_G: Felt like having Delhi street food so decided to make Aloo Tikki with Hari chutney #LockdownLife #NewSkills  Look forward to…
1246073915077582800,Fri Apr 03 13:55:46 +0000 2020,RT @Sanjog_G: Connect with @KP24 @harbhajan_singh @sanjaymanjrekar @jatinsapru @scottbstyris #Nehraji in its first week as they chat about…
1245691277133348900,Thu Apr 02 12:35:18 +0000 2020,Just checking on the grip before today’s innings. #QuarantineDuties @ Prabhadevi https://t.co/mJEi9uQMjE
1245556384051019800,Thu Apr 02 03:39:17 +0000 2020,Got to keep it down though with floors. 😁 https://t.co/brwYvC7Qds
1245297711550582800,Wed Apr 01 10:31:25 +0000 2020,This is Wow! Just Wow! In the heart of Mumbai city😌 https://t.co/pyAANuinMT
1245221468675477500,Wed Apr 01 05:28:27 +0000 2020,Same technique. Sweeping a cricket ball &amp; sweeping the floor. #QuarantineDiscoveries
1244861782134415400,Tue Mar 31 05:39:11 +0000 2020,Wish our house was smaller.  #QuarantineDuties
1244145302501638100,Sun Mar 29 06:12:09 +0000 2020,Today is Sunday guys. Just saying.😊
1244144842919137300,Sun Mar 29 06:10:20 +0000 2020,It’s really about the technique, you know.                            #Quarantine https://t.co/zzpe13iSxv
1243916885818654700,Sat Mar 28 15:04:31 +0000 2020,Yup. Day Night Ranji final. One of the best first class matches I played. Thanks to the concept.  👍 https://t.co/cd2Rry7wA3
1243780632389406700,Sat Mar 28 06:03:05 +0000 2020,Guess, the pertinent question now is - Who are you stuck with? #QuarantineLife
1243507348351713300,Fri Mar 27 11:57:09 +0000 2020,Terrible technique, I agree with you. 😀 https://t.co/VaWX3VBXua
1243193657353572400,Thu Mar 26 15:10:39 +0000 2020,Stumbled on this great channel! Some really talented, intelligent artists who will help take your singing to the ne… https://t.co/ecvXXbmwb7
1243128810330919000,Thu Mar 26 10:52:59 +0000 2020,She must lead with the elbow, tell her. 😁 https://t.co/wqIVXWc6dI
1243081760281227300,Thu Mar 26 07:46:01 +0000 2020,Corona situation throwing up some rare footage. This is Barbados, my next innings after being hit on the face in th… https://t.co/OrKWJwwuxq
1242786208377266200,Wed Mar 25 12:11:36 +0000 2020,RT @mark_jetson2005: My partner purchased a world map.... gave me a dart and said "throw this and wherever it lands I'm taking you for a ho…
1242679577572298800,Wed Mar 25 05:07:53 +0000 2020,RT @CMOMaharashtra: CM Uddhav Balasaheb Thackeray today in his @Facebook live launched the “Government of Maharashtra’s interactive WhatsAp…
1242467657535742000,Tue Mar 24 15:05:48 +0000 2020,Excellent address by the Honourable PM. The #lockdownindia and the threat had to be conveyed with passion, looking… https://t.co/RPD0qR6oMn
1241976915159736300,Mon Mar 23 06:35:46 +0000 2020,Mumbai Ranji cricket’s issue is simple. Lack of exceptional leadership. And I don’t mean only the captain of the te… https://t.co/nnPTbxRqbj
1241966300907225000,Mon Mar 23 05:53:35 +0000 2020,Bring it on! But may be four teams max. https://t.co/I55v8ZwdFw
1241965895364173800,Mon Mar 23 05:51:58 +0000 2020,Kohli’s team. With due respect  to my colleagues of the 1996 team. https://t.co/J70MnAU711
1241965599338553300,Mon Mar 23 05:50:48 +0000 2020,Shreyas and Hardik respectively. https://t.co/kvYrC6nTv0
1241965433067942000,Mon Mar 23 05:50:08 +0000 2020,Can’t be day night then. Hence not feasible. Viewership is crucial for game to survive and flourish. https://t.co/xBX21YQriJ
1241965108319768600,Mon Mar 23 05:48:51 +0000 2020,No sir was just watching the ball. Especially with Wasim and Waqar.😊 https://t.co/hqQgVRwTvj
1241964867315101700,Mon Mar 23 05:47:53 +0000 2020,Good point Ravi. NZ shwowed certain areas of Indian seam bowling unit that needs to be addressed. Like getting two… https://t.co/f2cDcchvrR
1241964123308445700,Mon Mar 23 05:44:56 +0000 2020,For the moment he is the right fit. But we must keep looking for a Raina and Yuvi kind of batsman when Rahul eventu… https://t.co/fRylZhk7pS
1241963529021735000,Mon Mar 23 05:42:34 +0000 2020,We need to be most creative with Test cricket to make it viable today. Fans and broadcasters key players in this. A… https://t.co/fze75qSAEN
1241962931283083300,Mon Mar 23 05:40:12 +0000 2020,Absolutely Milind! Fitness and skills above age any day. https://t.co/ZfbUofmLfd
1241962677833875500,Mon Mar 23 05:39:11 +0000 2020,Absolutely no idea! Wait and watch and err on the side of safety should be the motto for now. https://t.co/y5B96vbquS
1241962463911751700,Mon Mar 23 05:38:20 +0000 2020,Like most people I have short term memory loss. Don’t remember what happened last week as well as I do what happene… https://t.co/OiLwUCfPjm
1241962112101929000,Mon Mar 23 05:36:56 +0000 2020,Playing county cricket is a good idea. But playing IPL is another professional commitment he can’t miss. So there y… https://t.co/zv3Io4s7o1
1241946506459893800,Mon Mar 23 04:34:56 +0000 2020,Changing the caption to #TalkCricketWithSanjay so I get more chat with you rather than just questions. Topic - On g… https://t.co/WBcHVTSau9
1241943043579601000,Mon Mar 23 04:21:10 +0000 2020,Wow! https://t.co/PmSmNydQFT
1241625570170953700,Sun Mar 22 07:19:38 +0000 2020,My job gets me to travel the length &amp; breadth of our country. Offers me great insight of our country. Last few year… https://t.co/wQhKkoiPIp
1241385010952679400,Sat Mar 21 15:23:45 +0000 2020,Sorry about the ‘a’ before Netflix. Don’t know how that sneaked in. 🤔😊 https://t.co/O9mOfaeRO3
1241328026199003100,Sat Mar 21 11:37:18 +0000 2020,Blown away by ‘Caliphate’ on a Netflix!
1241286508046319600,Sat Mar 21 08:52:20 +0000 2020,Stay safe guys. Use this time to get healthier. Eat right, sleep well, exercise indoors. Let’s build up that immune… https://t.co/CqY8Gh9yUr
1239163465391952000,Sun Mar 15 12:16:07 +0000 2020,I have always considered commentary as a great privilege, but never an entitlement. It is up to my employers whethe… https://t.co/cahjBYoWcw
1238900109506568200,Sat Mar 14 18:49:38 +0000 2020,Lovely dinner @shailesh288 place. Best veg burger I had in my life! Loving your new passion for cooking, fits nicel… https://t.co/yRe8dl2DiP
1238493028966252500,Fri Mar 13 15:52:02 +0000 2020,Wish I had met this coach earlier in my life. 😔https://t.co/MWYGHkAx9t
1238001324915998700,Thu Mar 12 07:18:11 +0000 2020,My playing XI for today. https://t.co/8cItVn6Omq
1238001150143516700,Thu Mar 12 07:17:29 +0000 2020,What I want to see from Bumrah and Bhuvi. https://t.co/Ylk8ejJmNc
1238000875919949800,Thu Mar 12 07:16:24 +0000 2020,What to expect from SA. https://t.co/ZhUJRgEz1Y
1237731171305316400,Wed Mar 11 13:24:41 +0000 2020,My vegan diet regime lasted 14 hours.
1237362356163940400,Tue Mar 10 12:59:09 +0000 2020,#HappyHoli https://t.co/8k1Ur1eQOm
1236856428666605600,Mon Mar 09 03:28:46 +0000 2020,Good to see you put your gifted, stereophonic voice to use at last.😉 https://t.co/aPBveWSK2E
1236847860106145800,Mon Mar 09 02:54:44 +0000 2020,Brilliant! https://t.co/wo8FDHlzqy
1236489520402411500,Sun Mar 08 03:10:49 +0000 2020,@joybhattacharj @neerubhatia3 Wow! Two super humans in one frame. Wow! 🙏
1236488027947454500,Sun Mar 08 03:04:53 +0000 2020,A 19 year old Wasim Jaffer was reprimanded by a senior in the field for not bucking up the bowlers enough as the op… https://t.co/Aufuw0ltlI
1236484834010083300,Sun Mar 08 02:52:11 +0000 2020,Was fun going back in time last night.Sachin still desperately wants to get runs. Lara’s high back lift, ability to… https://t.co/FAUwJXm862
1236205755948134400,Sat Mar 07 08:23:14 +0000 2020,Was in my old barber shop today. When I enter they naturally start talking about cricket. Buzz today was of the upc… https://t.co/yx8xLpuG48
1236204100292735000,Sat Mar 07 08:16:39 +0000 2020,Just loving the bonding between my kids on how their parents suck.😂 #Parenthood
1234343532342759400,Mon Mar 02 05:03:25 +0000 2020,And that’s a wrap on #AskSanjay  Next time guys, although it says ask Sanjay,  feel free to also share your views a… https://t.co/ab5m1ww6mm
1234340263448981500,Mon Mar 02 04:50:26 +0000 2020,Have been rooting for this for a while. Team that loses first match in a series gets the option to decide what they… https://t.co/TzvHNL4oZN
1234339541596725200,Mon Mar 02 04:47:34 +0000 2020,Trying too hard to get the tail out? Best to stick with normal plans that you have for top order. Tail Enders now a… https://t.co/WpxHseDhrl
1234339133595713500,Mon Mar 02 04:45:57 +0000 2020,Just a random thought off the cuff... may be a test series between 2 countries where you play equal tests at home a… https://t.co/tFXlrXaRFH
1234338401115103200,Mon Mar 02 04:43:02 +0000 2020,Case with most batsmen around the world Kartikeya. Also the other formats which have become more mainstream do not… https://t.co/whJCKHc7rX
1234337891851128800,Mon Mar 02 04:41:00 +0000 2020,Modern day batsmen do not have the best defences because of changing cricket landscape. So they attack as a method… https://t.co/abOHktUCPg
1234337282599084000,Mon Mar 02 04:38:35 +0000 2020,Virat’s brilliance is his ability to manage his weaknesses and achieve greatness. We saw that in England. So it’s n… https://t.co/DlCX6hNBwf
1234336628430295000,Mon Mar 02 04:35:59 +0000 2020,It’s not just about planning. It’s about making the best with what you have. Indian conditions throw up certain kin… https://t.co/bmFt1SHwIJ
1234336196245041200,Mon Mar 02 04:34:16 +0000 2020,Bhuvi and Chahar’s bowling styles were more suited to the conditions we had for the Tests. Look at DeGrandhomme’s e… https://t.co/dNw3YVmvx7
1234335753867493400,Mon Mar 02 04:32:31 +0000 2020,Rahane issue addressed in an earlier response. Finally it’s about runs. Pant just has not got enough of those. Make… https://t.co/xyCSluZnaU
1234335308671484000,Mon Mar 02 04:30:45 +0000 2020,Hard to dispute your thinking Akshay. But India had to make a compromise because the batting was failing so badly.… https://t.co/GvcTtsZfDa
1234334722760880000,Mon Mar 02 04:28:25 +0000 2020,Mayank Agarwal - has the grit needed to carve out a long test career. Shaw- is no wild basher. There is an X factor… https://t.co/x6svpEdGrV
1234334087013445600,Mon Mar 02 04:25:53 +0000 2020,Saini and Gill already being groomed. Rahane has the runs behind him off late. But has his batting ability grown in… https://t.co/YlFAfeFDre
1234321792900223000,Mon Mar 02 03:37:02 +0000 2020,Was hoping it would be much later. But it’s come before time. The series end #AskSanjay session. Let’s have a freew… https://t.co/gfctF0KSJK
1234314860814573600,Mon Mar 02 03:09:29 +0000 2020,Learnings for India - Need swing bowlers who pitch the ball up more than seam bowlers who hit the deck in NZ &amp; the… https://t.co/rTmwGo9wG0
1234023964873298000,Sun Mar 01 07:53:34 +0000 2020,Simple...be fit as a fiddle and enjoy fielding. Jadeja has both these attributes.👍😊 https://t.co/RSf4Rz1veJ
1234023633489670100,Sun Mar 01 07:52:15 +0000 2020,Another Test match that reaffirms the fact that attacking batsmanship in the sport has steadily improved, while def… https://t.co/F1CQxv2dMh
1233080234603425800,Thu Feb 27 17:23:32 +0000 2020,Narcos Mexico season 2 is killing it! On episode 5. “ Life is a long journey with a  map written by a fool” Wow! #NarcosMexico2Quote
1232908527150207000,Thu Feb 27 06:01:13 +0000 2020,And that’s a wrap on #AskSanjay  Thanks so much for your company. 👍
1232898253282316300,Thu Feb 27 05:20:24 +0000 2020,Boy some tough questions here. 😊. Okay, Pandya as batsman at 6 in NZ conditions? Not so sure. https://t.co/mi85kBMoo5
1232896797045149700,Thu Feb 27 05:14:37 +0000 2020,Fair call with Jadeja , considering more his batting. He also has a strong claim as pure left arm spinner in Tests.… https://t.co/pOiBNyWPQT
1232895399519752200,Thu Feb 27 05:09:03 +0000 2020,My son is Sidhharth too by the way. 😊Rishabh at this stage for me remains an enigma. Don’t know what to make of him… https://t.co/Fs2jpURCbA
1232894957251387400,Thu Feb 27 05:07:18 +0000 2020,In conditions like these is when boys become men. Let’s see how quick a learner Shaw is. His opening partner has se… https://t.co/tkTTzQax8c
1232894476147921000,Thu Feb 27 05:05:23 +0000 2020,NZ not a place for spinners. So two would be too much. India will have to address their ultra defensive batting in… https://t.co/QrfRfEXArs
1232893876534378500,Thu Feb 27 05:03:00 +0000 2020,Ashwin’s dip in batting returns may open up a spot for Jadeja whose Test batting has seen a surge. If Saini was an… https://t.co/Vgsgyz21qa
1232893339013394400,Thu Feb 27 05:00:52 +0000 2020,Shweta, the issue is this is two match series so you can’t be too patient also. I will support selectors if for thi… https://t.co/w862HpZwEB
1232892911756468200,Thu Feb 27 04:59:10 +0000 2020,Pujara should continue to play the way he does. That’s his game and got him great success. But India can’t have 3 P… https://t.co/lt5KdyRx8j
1232892476123484200,Thu Feb 27 04:57:26 +0000 2020,I don’t know. Good question. But he could may be release the ball more instead of hitting the deck in NZ. You get m… https://t.co/wJvwBmPcUq
1232892113970516000,Thu Feb 27 04:56:00 +0000 2020,Only natural and inevitable to have dips in form even for the true great ones. Barring the Don. You are right Vigne… https://t.co/3GfVDtGRdF
1232891492676575200,Thu Feb 27 04:53:32 +0000 2020,Already answered this in last Q&amp;A. Test match form of Rahul was a question mark. So I support that decision made by… https://t.co/Q7cfVx4bAM
1232891159078490000,Thu Feb 27 04:52:12 +0000 2020,Thanks. Well, listeners have their favourite teams and players. And if anyone is opinionated like me they dislike s… https://t.co/Nw0MWsn3zW
1232890461376917500,Thu Feb 27 04:49:26 +0000 2020,Tough call Shashank. May be down the order, yes. Hearing Virat’s comments after last Test he may give Shaw another… https://t.co/0sViXGPF85
1232873789245022200,Thu Feb 27 03:43:11 +0000 2020,Right guys, let’s do another session of #AskSanjay. So much to talk, with India 1/0 down. Can they bounce back? Any… https://t.co/I14eADHtAo
1232573080796426200,Wed Feb 26 07:48:17 +0000 2020,Bombay Times shoot. Pic by photuwala_teja @ Seaface https://t.co/lyadm61HYH
1232523023913279500,Wed Feb 26 04:29:22 +0000 2020,Or our current seamers could try and release and float the ball a bit more. And yes our batsmen could get more runs. https://t.co/qOTPYMjL9x
1232522641333944300,Wed Feb 26 04:27:51 +0000 2020,RT @cricketncricket: @sanjaymanjrekar In this case it wasnt the batsman's fault. It was an unplayable ball. I think the pitches have a majo…
1232348433933127700,Tue Feb 25 16:55:37 +0000 2020,Hmm... https://t.co/tpG5aP69Yg
1232185773790826500,Tue Feb 25 06:09:16 +0000 2020,Yaar guys, tell me after you watch this. The ball does not do as much these days, does it? Is it the ball used then… https://t.co/ducP3gBe1u
1231894917972136000,Mon Feb 24 10:53:30 +0000 2020,Star Sports Match Point: Styris and Manjrekar on where India went wrong - via ESPNCricinfo app https://t.co/XnVfc04N7i
1231752259895091200,Mon Feb 24 01:26:38 +0000 2020,Why could NZ seamers get the ball to swing and deviate more than Indian seamers? Because on this surface wrist at a… https://t.co/g3br8Yyapw
1231751316512239600,Mon Feb 24 01:22:53 +0000 2020,In trying to not push at balls &amp; play with a still bat Indian batsmen struggled to find ways to hit boundaries. Str… https://t.co/4x5n29J9B3
1231405803757654000,Sun Feb 23 02:29:56 +0000 2020,Fascinating Test match on guys! India will have to bat out of their skins. Catch all the action on @StarSportsIndia #INDvsNZ
1231362698631204900,Sat Feb 22 23:38:39 +0000 2020,Keep it simple India. Trying too hard to get a wicket.  NZ- 271/7.
1231351314228994000,Sat Feb 22 22:53:25 +0000 2020,2 wickets in 20 minutes this morning for India. Superb delivery from Bumrah to get crucial wicket of Watling first… https://t.co/A9ZlcGGtwT
1231112652539207700,Sat Feb 22 07:05:03 +0000 2020,India didn’t bat too well, their bowling hasn’t looked as potent but one of their great strengths of never letting… https://t.co/BO1CEbh8WC
1230960285478985700,Fri Feb 21 20:59:36 +0000 2020,RT @rjanmol: @Sid71083 @sanjaymanjrekar @shoaib100mph @therealkapildev @jatinsapru You shld hv tagged the Photographer also- जिसकी जगह पे…
1230870661930848300,Fri Feb 21 15:03:28 +0000 2020,Thank you sir! 🙏 https://t.co/suWf163g8q
1230835409216852000,Fri Feb 21 12:43:24 +0000 2020,Star Sports Match Point: Manjrekar says India in 'slightly weaker position' - via ESPNCricinfo app https://t.co/p85CNnCJnN
1230739569504469000,Fri Feb 21 06:22:34 +0000 2020,Ajinkya Rahane was a revelation today. Dead defensive bat not pushing at the ball. Complete clarity of mind, focuse… https://t.co/5vZ8x3nY1B
1230719697873563600,Fri Feb 21 05:03:36 +0000 2020,Thanks. Glad you enjoyed it. 😊 https://t.co/1kD5eJQQAR
