id,created_at,text
940228979050647600,Mon Dec 11 14:37:11 +0000 2017,Ha ha...working on being happy in an imperfect atmosphere.😉 https://t.co/MAimXSeT5H
940221289884631000,Mon Dec 11 14:06:38 +0000 2017,Lovely drive from Dharamsala to Chandigarh. Stopped at the ‘Services’ on the way. https://t.co/MKka5gvxbk
939843961899896800,Sun Dec 10 13:07:16 +0000 2017,Younger the batsman, shoddier the technique today. #DharamshalaODI
939764387912364000,Sun Dec 10 07:51:04 +0000 2017,SL seamers forcing Indian batsmen to play virtually every delivery is also one reason why India is in dire straits.… https://t.co/HC9ICxMaC9
939750613063057400,Sun Dec 10 06:56:20 +0000 2017,This might take you by surprise, but the batsman best equipped to handle these conditions in this batting group is… https://t.co/t29tUCSgg4
939492027837718500,Sat Dec 09 13:48:49 +0000 2017,@imAagarkar Thanks Ajit. There is a lot of Mumbai cricket in there. Decoding the  ‘Khadoos’ concept that we grew up with. 😊
939426153198055400,Sat Dec 09 09:27:03 +0000 2017,#Dharamsala https://t.co/WmHLWVqQj9
939065239794016300,Fri Dec 08 09:32:54 +0000 2017,@MalayD @HarperCollinsIN Thanks Malay. Out in bookstores on the 25th!
939065095908360200,Fri Dec 08 09:32:20 +0000 2017,@vipulsri96 @HarperCollinsIN Thank you Vipul. Hope the book proves to be an enjoyable read ☺️
939064703321550800,Fri Dec 08 09:30:46 +0000 2017,@Ramans77 Haha thank you Raman! Of course! Until then you’ll have to make do with Amazon ☺️
939063940377731100,Fri Dec 08 09:27:45 +0000 2017,@chopraanjum @HarperCollinsIN Thank you Anjum! It’s out on the 25th of December.
939063785259765800,Fri Dec 08 09:27:08 +0000 2017,@cricketwallah Look forward to you reading it as well, Ayaz! Thanks.
939063656360431600,Fri Dec 08 09:26:37 +0000 2017,@alanwilkins22 @HarperCollinsIN @StDavidsPress Thank you my friend! Means a lot ☺️
939062988014870500,Fri Dec 08 09:23:57 +0000 2017,@cricketaakash Thank you Mr. Chopra, look forward to hear your thoughts.
939062836466155500,Fri Dec 08 09:23:21 +0000 2017,@VenkyMysore @HarperCollinsIN Thanks Venky! You’re too kind ☺️
939062739611390000,Fri Dec 08 09:22:58 +0000 2017,@gauravkapur Thank you buddy! Out in bookstores on the 25th of December ☺️
939062363411636200,Fri Dec 08 09:21:29 +0000 2017,@bhogleharsha @HarperCollinsIN Thank you Harsha, attempting my best pensive writer look 😉
939062088483434500,Fri Dec 08 09:20:23 +0000 2017,@gauravkalra75 Haha thank you Gaurav, I’ve definitely tried my best!
938629440820494300,Thu Dec 07 04:41:12 +0000 2017,It’s a 2 innings game isn’t it? 😉 https://t.co/EkPss5bGJe
937959388945494000,Tue Dec 05 08:18:39 +0000 2017,Whatsapp slowly becoming a platform for spreading lies.
937889630086713300,Tue Dec 05 03:41:27 +0000 2017,Great to see Bumrah in the Test squad.  I would have had Kuldeep in the squad &amp; a keeper who is more a keeper than a batsman.  #INDvSA
937317723863883800,Sun Dec 03 13:48:54 +0000 2017,Two good boys of Indian sport doing some good work.👏👏👍 https://t.co/S3liZOZnPw
937199081105035300,Sun Dec 03 05:57:27 +0000 2017,Yet again a Virat double hundred without a single 6. Strike rate still 85. A modern day batsmen, who prefers to get… https://t.co/4oLy8OPua0
937197509725835300,Sun Dec 03 05:51:13 +0000 2017,Seen batsmen churning out hundreds, Virat is churning out double hundreds!  6 in 17 months now. Incredible! 👏👏👏🙏🙏 #INDvsSL
936975934988488700,Sat Dec 02 15:10:45 +0000 2017,You know cricket is not in good health when you are only praising batting.
936601666605875200,Fri Dec 01 14:23:33 +0000 2017,Said, I wanted to have a light, fish meal &amp; this is what I get. Thanks @devikambing  #ChefAtHome https://t.co/9GXiYbBe7E
936257742909603800,Thu Nov 30 15:36:55 +0000 2017,One thing I don’t ever want to become, is one of those who have no interest in listening, but just want to say thei… https://t.co/8egBzwvpyD
935511880038195200,Tue Nov 28 14:13:07 +0000 2017,Ha ha. https://t.co/FhU8Y6NKW4
935020298226761700,Mon Nov 27 05:39:45 +0000 2017,SriLanka is half the size of Tamil Nadu &amp; it has 23 first class teams. Right there you see the problem with Sri Lan… https://t.co/h3eNFjCqx5
934958328588877800,Mon Nov 27 01:33:30 +0000 2017,Openers have a distinct advantage there, don’t they? But agree with @Edged_and_taken. His could come in a run chase… https://t.co/qI4bMMkIUO
934720452232204300,Sun Nov 26 09:48:16 +0000 2017,5th double hundred already, from Virat. Doing what greats do, but quicker. 🙏
934702678403440600,Sun Nov 26 08:37:39 +0000 2017,Prediction : If Rohit gets a chance to bat in SA in the middle order, he will be a success story with the bat for India.
934656350965071900,Sun Nov 26 05:33:33 +0000 2017,100 for Virat Kohli! But you get the feeling he is just settling in to get a big one.  #indvsl
934351064941375500,Sat Nov 25 09:20:27 +0000 2017,Vijay gets a 100, so selection headaches for India. One more Test to go against the same opposition so even more se… https://t.co/ku3EFOHy2Y
934282547772776400,Sat Nov 25 04:48:12 +0000 2017,Great ball sense. That’s what Steve Smith has. He would have got the same amount of runs with any other technique b… https://t.co/zCUoaD9Xc6
934011407347175400,Fri Nov 24 10:50:47 +0000 2017,Pujara comes out to bat with 4.1 overs to go. Again no night watchman for India. Like this trend. Sends a clear mes… https://t.co/u3RP95R2Yp
934009648700633100,Fri Nov 24 10:43:47 +0000 2017,That you are now the captain of #GTUforever. What’s your team? Your other 10 GTUs. https://t.co/izrHy0wWvL
934008852135252000,Fri Nov 24 10:40:38 +0000 2017,Yes, where pair of socks is the accessory to show off, rather than pants.😉 https://t.co/wPzM2EWSwS
934007823612239900,Fri Nov 24 10:36:32 +0000 2017,SL batting review - Tch,tch!
933928558338232300,Fri Nov 24 05:21:34 +0000 2017,Many wondering what’s GTU. It’s a Mumbai cricket term -‘Gire to bhi tangdi upar‘. Used for people like Sapru who never concede defeat.😉
933925471007510500,Fri Nov 24 05:09:18 +0000 2017,😂😂😂. Once again good comeback from the Captain of the GTU team eleven. https://t.co/DoKIlRjvFr
933905704607293400,Fri Nov 24 03:50:45 +0000 2017,India bowling first. Important on this pitch to not bowl like @jatinsapru ’s  pants...short. https://t.co/udx2pOlvj6
933559501617320000,Thu Nov 23 04:55:04 +0000 2017,I know who I am not going to vote for next election.
933522812232351700,Thu Nov 23 02:29:17 +0000 2017,Nice to see someone fascinated by Indian bowlers for a change. Had fun at the release of Anindya Dutta’s book ‘Spel… https://t.co/DQLC9s9u3s
933172210834882600,Wed Nov 22 03:16:07 +0000 2017,Bhansali, Deepika equally responsible; they deserve punishment: Yogi Adityanath on Padmavati row… https://t.co/N2JaMG3Fwu
932811959744987100,Tue Nov 21 03:24:36 +0000 2017,Wow this! https://t.co/Jk9OmjvhNY
932776268893790200,Tue Nov 21 01:02:47 +0000 2017,RT @sagarikaghose: Gangs of unoccupied males, with nothing to do, clearly without day jobs, yell, shriek and burn protesting against a film…
932585312672399400,Mon Nov 20 12:23:59 +0000 2017,Bhuvi has put his hand up as seamer to be considered for all surfaces in Tests.👏👏 #Indvsl
932525358712098800,Mon Nov 20 08:25:45 +0000 2017,Change of situation that brought about change in gears in Virat Kohli’s batting, was just great to see! Batsman in… https://t.co/DJlHYNrKbq
932214672299778000,Sun Nov 19 11:51:12 +0000 2017,No night watchman with a probable 15 minutes to go. Well done Pujara, Virat &amp; Indian team!👏👏👏 #INDvSL
932212465076539400,Sun Nov 19 11:42:26 +0000 2017,Other rows. https://t.co/xQ0XRf5czF
932153244989644800,Sun Nov 19 07:47:06 +0000 2017,Idea is to arrive at the right decision. Have no issue with players seeking hints from dressing room on DRS call wi… https://t.co/fVfbO1cppv
932152935596802000,Sun Nov 19 07:45:53 +0000 2017,I got the impression that Dilruwan Perrera changed his mind when he looked towards the dressing room. Hard to prove… https://t.co/DLQB4HYVnR
932084942615429100,Sun Nov 19 03:15:42 +0000 2017,My piece in Cricinfo - https://t.co/mB7DrNr39g
932057488446197800,Sun Nov 19 01:26:36 +0000 2017,We must do something about their power over us. https://t.co/hMZGiQISFf
931496883192598500,Fri Nov 17 12:18:57 +0000 2017,@shailesh288 Will do 😉
931496548206239700,Fri Nov 17 12:17:38 +0000 2017,@abshktweets Ha ha yes.
931434439178989600,Fri Nov 17 08:10:50 +0000 2017,When you want to eat Rosogolla &amp; not carry the guilt. https://t.co/si7QIetNTi
931088591584759800,Thu Nov 16 09:16:33 +0000 2017,Time to bring out the least used shot from the dusty closet. The ‘leave alone’ shot. No chance of getting runs on t… https://t.co/Fr8bQ5MRWs
931064687873028100,Thu Nov 16 07:41:34 +0000 2017,Ashish Nehra may have set the record for the quickest transition from player to commentator. 15 days to be precise.
930851016097939500,Wed Nov 15 17:32:31 +0000 2017,Chalo kal se Test match...yaane early to bed &amp; early to rise. Not sure about health of Test cricket, but it’s certa… https://t.co/bXvqOyRoVH
930636949659848700,Wed Nov 15 03:21:53 +0000 2017,Indigo is a world class airline. That was an unfortunate incident. Airlines taking potshots at them better off focu… https://t.co/5n4ZKTde0J
930395693973356500,Tue Nov 14 11:23:14 +0000 2017,@IndiGo6E is a world class airline. That was an unfortunate incident. Airlines taking potshots at them better off f… https://t.co/1Zu9n2Ehmv
930286901545840600,Tue Nov 14 04:10:55 +0000 2017,Couple of great days in Pench! We had fun, didn’t we?😉 https://t.co/jQ1UanWKaP
928818392009646100,Fri Nov 10 02:55:35 +0000 2017,One of my aims was to play with the Duncan Fearnley bat. Why? Because my idol Sunny Gavaskar played with it. https://t.co/V3WrJ9lCxw
928471023594348500,Thu Nov 09 03:55:16 +0000 2017,Thank you Mumbai cricket. After I lost my father at 18, you were the guardian for this young cricketer with dreams… https://t.co/t2S2iW3hCL
927975089710153700,Tue Nov 07 19:04:36 +0000 2017,Loved the crowd here in Thiruvananthapuram. Each &amp; everyone clapped for the losing captain. Listened in rapt attention to all interviews. 👍👏
927973719414153200,Tue Nov 07 18:59:10 +0000 2017,One the best bowlers in the world in white ball cricket. That’s what Bumrah has become now.👏👏👏🙏
927973455789621200,Tue Nov 07 18:58:07 +0000 2017,One of the best days for Virat Kohli as captain. He was tactically brilliant!👏👏👏 #INDvsNZ
927503472970424300,Mon Nov 06 11:50:34 +0000 2017,In this case, this disease will ease your life a bit. https://t.co/6CIJwdLHyH
926879650550345700,Sat Nov 04 18:31:43 +0000 2017,Virat was playing another potentially match winning great innings. Lack of support seemed to suck the life out of the innings. #indvnz
926825864217505800,Sat Nov 04 14:58:00 +0000 2017,It won’t get a standing ovation, there won’t be too much fan fare but that performance from Bumrah was a great performance, nothing less.👏👏👏
926802091955314700,Sat Nov 04 13:23:32 +0000 2017,In the land of the excitable. #Rajkot
926667066853044200,Sat Nov 04 04:27:00 +0000 2017,Gives a whole new meaning to driving in cricket. https://t.co/60zbJShYfh
926413636091949000,Fri Nov 03 11:39:57 +0000 2017,Flying ‘late’ Airways again. #jetairways
925913289229443100,Thu Nov 02 02:31:45 +0000 2017,It was just for the day. Easy Pradeep.😊 https://t.co/smj6ctrL38
925790864298905600,Wed Nov 01 18:25:17 +0000 2017,I know it’s was Nehra’s last game. I know India won by a huge margin. But it was Hardik Pandya’s catch the big takeaway for me.👏👏👏🙏 #IndvNZ
925740709306437600,Wed Nov 01 15:05:59 +0000 2017,202 looks a big score but in these conditions may be just over par. Good things India is playing 6 bowlers. #INDvNZT20
925429729510826000,Tue Oct 31 18:30:15 +0000 2017,Will miss you MV.  RIP.
924681394302808000,Sun Oct 29 16:56:38 +0000 2017,Rohit &amp; Virat with the bat &amp; Bumrah &amp; Chahal with the ball. It’s not just batsmen winning matches for Ind these days. Congrats team India!
924680726880010200,Sun Oct 29 16:53:59 +0000 2017,Bumrah’s 3/47 off 10 overs was no less valuable than Rohit Sharma’s 147. Me thinks. 👏👏👏
924635512886870000,Sun Oct 29 13:54:19 +0000 2017,Massive wicket that for India of Colin Munro. Thanks to the bravery of Chahal to toss that ball up to a power hitter. Brilliant 👏👏👏
924606890901774300,Sun Oct 29 12:00:35 +0000 2017,Many shots played in tht score of 337 were out of character for the Indians. NZ as a rule don’t bowl where you like it. Excellent from Ind!
924530950779760600,Sun Oct 29 06:58:50 +0000 2017,I’ve seen nothing to suggest that Bumrah cannot be a game changer in Tests too. It’s just a matter of when he gets the chance.
924262149941112800,Sat Oct 28 13:10:43 +0000 2017,Kar means do. We do things. Like shopping every time at airports.😉 https://t.co/WHPZixi3hS
924157626325323800,Sat Oct 28 06:15:22 +0000 2017,I tried @bhogleharsha ...really tried. But...😔 #AirportShoppingAddict https://t.co/GRoEiUN2oQ
924121352256262100,Sat Oct 28 03:51:14 +0000 2017,You got it! https://t.co/nmdpcdjVTS
923929944970981400,Fri Oct 27 15:10:39 +0000 2017,Will give this a shot. Thanks👍 https://t.co/201ox5YTFO
923928304255676400,Fri Oct 27 15:04:08 +0000 2017,Watched. Big fan of Spacey, since LA Confidential &amp; American beauty.👍 https://t.co/uGZz3lOuFo
923926152619708400,Fri Oct 27 14:55:35 +0000 2017,Done and dusted. Brilliant! https://t.co/jqbdevMr7c
923926020968894500,Fri Oct 27 14:55:03 +0000 2017,Sairaat made me cry. No Marathi films for a while. 😊 https://t.co/4A08u1sdNN
923925871790116900,Fri Oct 27 14:54:28 +0000 2017,Watched it. Liked it. 👍 https://t.co/lQ0jcaH3EI
923923699874521100,Fri Oct 27 14:45:50 +0000 2017,So guys, what’s good to watch on Netflix?
923561747675603000,Thu Oct 26 14:47:34 +0000 2017,Nice to see an Indian film with an Indian theme, Indian music. This ain’t Bollywood, this is Indian cinema.👏👏👏👍 https://t.co/bKKZsXQ7Lk
923176146333663200,Wed Oct 25 13:15:19 +0000 2017,Virat could add the classical square drive to his repertoire. It’s a safer attacking option than the cover drive to balls wide on off stump.
923097764443054100,Wed Oct 25 08:03:52 +0000 2017,Good that India is chasing. So Virat can just go and chase the target to make it 1-1.😉
923075133966815200,Wed Oct 25 06:33:56 +0000 2017,Beauty and the beast. https://t.co/E2U0XymjIi
922653909948047400,Tue Oct 24 02:40:08 +0000 2017,Needed the senior voice of Sunny to remind fans it was Kapil, not Dhoni, who inspired small town kids to become heroes in Indian cricket.
922140690485784600,Sun Oct 22 16:40:47 +0000 2017,The qualities shown by Virat were shown by two Kiwi batsmen tonight. That was the main difference between the two sides. 👏👏👏🙏🙏
922069726997635100,Sun Oct 22 11:58:48 +0000 2017,That innings of Virat Kohli was about exemplary fitness. Mental and physical!👏👏👏🙏🙏🙏 #ViratKohli
921656866257686500,Sat Oct 21 08:38:15 +0000 2017,After a string of one word replies on whatsapp, told my son you have limited vocabulary. He replied saying “K”.
920849399151870000,Thu Oct 19 03:09:39 +0000 2017,Wish you a very happy Diwali!
920307859635753000,Tue Oct 17 15:17:46 +0000 2017,Yes, that what I start with...always.😘 https://t.co/7qzg4Cpo7O
920188483867525100,Tue Oct 17 07:23:25 +0000 2017,I know it’s the thought that counts. But can’t stand these slides on Whatsapp.. https://t.co/RmEsmirVVZ
920187721917677600,Tue Oct 17 07:20:23 +0000 2017,RT @KJezerMorton: once a dude interrupted me, and a second dude said, "wait, she is saying something." anyway i married the second dude.
920166563541524500,Tue Oct 17 05:56:19 +0000 2017,Rajdeep’s latest book #democracysXI hit stores today. Look forward to reading it. Here’s a video trailer of it. https://t.co/Vmx9YIEE2s…
919881501180923900,Mon Oct 16 11:03:35 +0000 2017,#SwatiSnacks at Tardeo is one of the greatest restaurants in the world. Each dish a star!  They just can’t make bad food even if they tried🙏
918741636569448400,Fri Oct 13 07:34:10 +0000 2017,Just bumped into Suresh Raina in the hotel gym. Looks in great shape! Haven’t seen him in better physical condition. Good luck to him. 👍
918071474057023500,Wed Oct 11 11:11:11 +0000 2017,This is brilliant! https://t.co/FtyVNwYyTC
917781469581287400,Tue Oct 10 15:58:48 +0000 2017,Drooping shoulders is a thing of the past in Indian cricket. Thanks to Virat Kohli. #IndvAus
917725657454411800,Tue Oct 10 12:17:01 +0000 2017,Shocking results in Test cricket all over the world. Sign of mediocrity all over in Tests.
916897454238380000,Sun Oct 08 05:26:02 +0000 2017,What’s happening to these domestic flights??? It’s back to the 90s. Every flight I have taken this season, delayed.  #goair #jetairways
916682593608667100,Sat Oct 07 15:12:16 +0000 2017,Shades of English batsmanship in Australian batting. Especially against spin. Sweep thy spinner!😔 #IndvAus
916630461354352600,Sat Oct 07 11:45:06 +0000 2017,‘Saif’ to say you must be thrilled.  Tried doing a Batavia 😉 https://t.co/74rQm2umdU
916629973535834100,Sat Oct 07 11:43:10 +0000 2017,RT @rameshsrivats: Am very pleased that the #GSTCouncil has reduced the tax on Khakhra. Shows that this government can deliver in crunch si…
916181478807162900,Fri Oct 06 06:01:01 +0000 2017,“I have a dream, yes, I have a dream, that one day we will able to form a queue.” https://t.co/Noxf7KaF0R
915758643320045600,Thu Oct 05 02:00:49 +0000 2017,RT @DG_Doordarshan: Friends our humble tribute to a multifaceted legend. Please watch tomorrow. https://t.co/BcYJpR8moK
915449636537622500,Wed Oct 04 05:32:56 +0000 2017,And seeing amount of both friends and family, seems like you have balanced it well.😊 https://t.co/dBAA57pOKz
915449338150535200,Wed Oct 04 05:31:45 +0000 2017,Ha ha. https://t.co/XThwo0WNwv
915417994775339000,Wed Oct 04 03:27:12 +0000 2017,Along with my little rant on twitter, have also written to the ICC to reconsider penalising fake fielding. It opens up a Pandora’s box.
915416797997711400,Wed Oct 04 03:22:26 +0000 2017,Cheating??? No it’s called tricking. Like Dhoni pretending to collect a throw &amp; lets it go to hit the stumps. Appla… https://t.co/TTtmfzIqSo
915412361250574300,Wed Oct 04 03:04:49 +0000 2017,RT @jaavedjaaferi: Low budget geniuses :-)))) https://t.co/nd4UGKyyYu
915400321144254500,Wed Oct 04 02:16:58 +0000 2017,How about penalising batting side 5 runs when b’man fakes a step out &amp; does not? Does he not put the bowler off? Fake fielding law must go.
915399418987155500,Wed Oct 04 02:13:23 +0000 2017,Five penalty runs for ‘fake fielding’ is the most ridiculous law that’s been brought in, in recent times. Urge ICC to reconsider it.
915396672338878500,Wed Oct 04 02:02:28 +0000 2017,@sambitbal thanks for having me on your 50th. Did you take this picture @RaunakRK ? https://t.co/8nJp0dEfbP
915045141903056900,Tue Oct 03 02:45:37 +0000 2017,Animals kill for food &amp; to protect their territory. Humans kill for no reason. We are the worst living beings on this planet.
914538771227357200,Sun Oct 01 17:13:29 +0000 2017,Two top class death bowlers bowling in tandem has been rare in Indian cricket. But we see that today in Bumrah &amp; Bhuvi. #INDvAUS
914538304619429900,Sun Oct 01 17:11:37 +0000 2017,I think captaincy of MI in the IPL, has gone a long way in making Rohit Sharma the more mature cricketer that we see today. #INDvAUS
914398563945156600,Sun Oct 01 07:56:21 +0000 2017,Excellent comment by Virat Kohli at the toss. "There are many incentives when you are playing any match"  #INDvAUS
914387040959045600,Sun Oct 01 07:10:33 +0000 2017,People in power want to leave a dazzling legacy. So despite having money, the simple, boring stuff gets ignored. Like basic infrastructure.
914329049551401000,Sun Oct 01 03:20:07 +0000 2017,RT @jamie_alterTOI: “Zindagi ek safar hai suhaana ... yahaan kal kya ho kisne jaana ...?” https://t.co/YoZYsnsNLO
914328426227556400,Sun Oct 01 03:17:38 +0000 2017,Gave up his US passport to earn acceptability in India. Tom Alter was an exceptional Indian that we were proud to call our own. RIP Tom.
913731422556348400,Fri Sep 29 11:45:22 +0000 2017,RT @manishbatavia: Hahahaha! What yaar, @goairlinesindia?! https://t.co/2zBLShG6VM
913426239645376500,Thu Sep 28 15:32:40 +0000 2017,We had 20 minutes of stoppage in play because of ghost rain.
913413688987488300,Thu Sep 28 14:42:48 +0000 2017,Pandya at 4 ? I guess India wants to make most use of his terrific form as batsman. Can't argue with that. #INDVsAUS2017
913352143859441700,Thu Sep 28 10:38:15 +0000 2017,What a bowling maestro Kedar Jadhav is...he stays over the wicket but ensures ball comes to the batman from round the wicket.😉
913330287693533200,Thu Sep 28 09:11:24 +0000 2017,😂😂😂😂 https://t.co/Z78dwbxYGq
913291673974710300,Thu Sep 28 06:37:57 +0000 2017,Twitter going the opposite of cricket. #280characters
912937364405620700,Wed Sep 27 07:10:03 +0000 2017,Yes sir. He was 53 when he passed away. https://t.co/r9lUrAU3rk
912881831544082400,Wed Sep 27 03:29:23 +0000 2017,Twice the characters, half the fun. Please Twitter, don't do it. #280characters
912528990593617900,Tue Sep 26 04:07:19 +0000 2017,Ha ha...another superb cover drive from the one and only Ramesh Srivats. https://t.co/4afr4FXAJM
912522850233327600,Tue Sep 26 03:42:56 +0000 2017,Cricket was his life. But he kept telling me not to do the same. "Play it as a game, nothing more" https://t.co/VHrONyFZdG
911995346263326700,Sun Sep 24 16:46:49 +0000 2017,A power hitter with control over mind is a precious commodity to have. India have found another one in Hardik Pandya. 🙏👏👏 #INDvsAUS
911843394028150800,Sun Sep 24 06:43:01 +0000 2017,Just to clarify, although the match is in Indore it will be played outdoor. Sorry, could not resist it.😜
910928178360705000,Thu Sep 21 18:06:16 +0000 2017,Ha ha. https://t.co/PAccQoqgme
910920280788238300,Thu Sep 21 17:34:53 +0000 2017,In 2014, in the under 19 WC, two players caught my eye. Kagiso Rabada &amp; Kuldeep Yadav. Today both have ODI hatricks to their name.👍👏👏
910885603666833400,Thu Sep 21 15:17:06 +0000 2017,You won't see a better hat trick ball than that from Kuldeep Yadav! So happy for the young man.👏👏👏 #HatTrick
910881402551337000,Thu Sep 21 15:00:24 +0000 2017,Wrist spinners in demand these days because  captains can bowl them unhesitatingly against both left handed &amp; right handed batsmen.
910873512851652600,Thu Sep 21 14:29:03 +0000 2017,In IPL &amp; T20 internationals his temperament impresses you. In 50 overs cricket his skills are coming to the fore. Champion Chahal! 👏👏👏
910859111624872000,Thu Sep 21 13:31:49 +0000 2017,Good with the new ball &amp; good at the death too. India so fortunate to have two in Bhuvi &amp; Bumrah. #INDvAUS
910773094586839000,Thu Sep 21 07:50:01 +0000 2017,Wow! Frame this up and hang it on the wall. Well done Sanjay Leela Bhansali! https://t.co/tGZxBz8pUw
910540420966441000,Wed Sep 20 16:25:28 +0000 2017,The time lapse between gate open &amp; final call these days is 5 minutes. Pretty ridiculous! #AirTravel
909740884618567700,Mon Sep 18 11:28:23 +0000 2017,Ha ha https://t.co/5LXvnHz4um
909474710169063400,Sun Sep 17 17:50:42 +0000 2017,Tonight's win especially satisfying for India. They won a fusion game of 50 overs &amp; T20 cricket.👏👏👏 #IndvAus
909391211227619300,Sun Sep 17 12:18:55 +0000 2017,Is it possible for Dhoni to give any more reasons for Chennai to love him so much?😌 #INDvAUS
909373957270159400,Sun Sep 17 11:10:21 +0000 2017,Hardik Pandya has made it a habit of playing the big impact innings. Seeing one currently. Amazing stuff! #INDvAUS
909324184186110000,Sun Sep 17 07:52:34 +0000 2017,Welcome back Harsha.
909312371222384600,Sun Sep 17 07:05:38 +0000 2017,https://t.co/Bt7UPeAXjV A must read. Have always admired Uday Shankar's honesty &amp; his ability to simplify complexities.
908173731968593900,Thu Sep 14 03:41:05 +0000 2017,Virat not better than just Steve Smith in limited overs cricket today but better then everyone.
907948840170356700,Wed Sep 13 12:47:27 +0000 2017,Narcos season 3 still a crackerjack without Pablo Escobar 👌🏾🔥 #Netflix
907220016919203800,Mon Sep 11 12:31:22 +0000 2017,Tough morning today. Was really restless, had difficulty breathing too. Am okay now, WiFi is back.  #IamWiFiDependant
906708445121757200,Sun Sep 10 02:38:33 +0000 2017,Kapil Dev suggests BCCI buy their own plane to reduce player fatigue. I have a cheaper idea. Players take rest when they feel fatigued.😉
906487440457687000,Sat Sep 09 12:00:22 +0000 2017,Have always wanted to see them &amp; their world, the #AmishOfPennsylvania https://t.co/iv3APYi4IH
905512047143784400,Wed Sep 06 19:24:30 +0000 2017,With some captains you get a bit of leniency but with Virat Kohli you get none. Poor Sri Lanka.😔 Well done India!
905072709931065300,Tue Sep 05 14:18:44 +0000 2017,Good time to thank &amp; show gratitude to the fans, who gave unconditional love &amp; support to the IPL, through thick &amp; thin. 🙏🙏🙏 #IPLrights
904733658501832700,Mon Sep 04 15:51:27 +0000 2017,And they don't have as much viewership as the 8pm starts. https://t.co/CBVueoY7Sj
904733466436268000,Mon Sep 04 15:50:42 +0000 2017,Shorter the format tighter the contests. https://t.co/7NKxy8yeX8
904701073398665200,Mon Sep 04 13:41:59 +0000 2017,Amongst other things, that it begins at 8pm, has a lot to do with IPL's great success. Day Test matches please note. #IPLrights
904462545704157200,Sun Sep 03 21:54:09 +0000 2017,Once again Virat achieves SR of almost 95 without hitting a 6. A fascinating aspect of his batting &amp; the secret of his consistency.👏👏👏
