id,created_at,text
1096390601413668900,Fri Feb 15 12:47:43 +0000 2019,Proud to have presented the #sportstar award to Bajrang Punia last night. @ Hotel: Taj Mahal Palace and Tower (Mumb… https://t.co/jdsD01QDrv
1096319012181442600,Fri Feb 15 08:03:15 +0000 2019,RT @DarenGanga: Shannon Gabriel, very interesting indeed🤔, does this warrant a 4 ODI or 2 Test suspension? @irbishi @sanjaymanjrekar @Steel…
1095542414247219200,Wed Feb 13 04:37:20 +0000 2019,Saw this last night. 😊 https://t.co/DoVPWSZSgB
1095532969375064000,Wed Feb 13 03:59:48 +0000 2019,44 wickets in the last 8 Tests now for Moeen. 👏👏👏 #ENGvWI
1095531715643101200,Wed Feb 13 03:54:49 +0000 2019,8 wicket haul and a hundred too, both in the same series. What a talent Roston Chase is! #ProperAllrounde #ENGvWI
1095365705497665500,Tue Feb 12 16:55:09 +0000 2019,It should be a given that there is no room in our sport for bigotry or racial/ homophobic slurs but my issue on the… https://t.co/k7pdds8IJk
1095154335648907300,Tue Feb 12 02:55:15 +0000 2019,Slowly Eng getting close to a sensible batting order. Buttler as pure batsman batting in a batsman’s position. Stok… https://t.co/1LGXifkMCg
1095150289118625800,Tue Feb 12 02:39:10 +0000 2019,After Sarfraz it’s Shannon Gabriel now who could be in trouble thanks to the stump mics. #ICC must brainstorm and d… https://t.co/LhuTLFwXfT
1094785398549622800,Mon Feb 11 02:29:13 +0000 2019,Moeen at it again.. picks up 4! Hope England are not looking at his batting contribution &amp; feeling disappointed. Mo… https://t.co/a3KU4u5hS4
1094783605220364300,Mon Feb 11 02:22:06 +0000 2019,Eng slowly learning an important lesson. If batting is weak make your bowling stronger. Wood replaces Curran &amp; gets 5!👏👏👏 #ENGvWI
1094590582196858900,Sun Feb 10 13:35:05 +0000 2019,Agree 100%. https://t.co/IdB6vs6oHD
1094543653597438000,Sun Feb 10 10:28:37 +0000 2019,Love DK’s rare gift of being able to hit big shots crisply from the middle of the bat from ball no 1. One of the mo… https://t.co/Rp5qO92Qdx
1094543111672422400,Sun Feb 10 10:26:28 +0000 2019,Brilliant hitting by DK but small mistakes have a big effect on the result in T20s. Was a mistake to not take that… https://t.co/N3b6yYEVuu
1094511704749162500,Sun Feb 10 08:21:40 +0000 2019,If not today, the realisation will come soon enough that the Pandya brothers are your 2 overs bowlers &amp; only a good… https://t.co/0dPe3afORT
1094494245241548800,Sun Feb 10 07:12:17 +0000 2019,RT @PrakashG_CB: Amarnath to Holding. The final ball of the 1983 World Cup. https://t.co/r91fQj4pgb
1094426018117341200,Sun Feb 10 02:41:10 +0000 2019,After having done well at no 3, Bairstow is now given the wicket keeping gloves &amp; being batted down the order at no… https://t.co/SMho843mXq
1094423538432262100,Sun Feb 10 02:31:19 +0000 2019,What a great opportunity WI lost by not playing Oshane Thomas. Would have been the perfect game to introduce him to Test cricket. #WIvsENG
1094098826221150200,Sat Feb 09 05:01:02 +0000 2019,One of the only teams where you can say the coach makes a big  impact on the team is Vidarbha. Why? Because Pandit… https://t.co/tJbt9fLPpg
1093757166916272100,Fri Feb 08 06:23:24 +0000 2019,Paperback edition of IMPERFECT is out now. 😊 https://t.co/TxtshHmdlD
1093746196206645200,Fri Feb 08 05:39:48 +0000 2019,If no fitness issues, my Eng playing XI for the 3rd Test in batting order - Denly, Burns, Root, Bairstow, Buttler,… https://t.co/Vl8W4wkHxB
1093743619159121900,Fri Feb 08 05:29:34 +0000 2019,Seeing how India are slipping in the middle, there is definitely a place for Mithali in the middle in T20s. After t… https://t.co/0ysnfkj76N
1093386207982104600,Thu Feb 07 05:49:20 +0000 2019,Well said Nathan!  'Analysis is easy. The trick is turning it into info players can use' | The Cricket Monthly | ES… https://t.co/nPOiyYVYbl
1093385290868092900,Thu Feb 07 05:45:42 +0000 2019,Well done Vidarbha! What a success story this has been...Vidarbha cricket. 👏👏👏🙏🙏🙏 #RanjiTrophy
1093354516294955000,Thu Feb 07 03:43:24 +0000 2019,More I watch cricket and learn from it, it’s becoming clear that you need specialists to become a champion side, wh… https://t.co/8Vcmxizi2M
1092629221887795200,Tue Feb 05 03:41:21 +0000 2019,There wasn’t a more genuine cricket fan than Ramesh Bhatkar. If there were 20 people in the Garware pavilion watchi… https://t.co/WxYgBmWXdF
1092006734976020500,Sun Feb 03 10:27:48 +0000 2019,Walks in at 12-2, leaves at the score of 190-6. The kind of contribution that a no 4 should be able to make..Well done Rayudu!👏👏🙏 #INDvsNZ
1091921611500875800,Sun Feb 03 04:49:33 +0000 2019,As for England, may be they could reset their cricket in factory settings mode. #RevampThinking
1091920215313547300,Sun Feb 03 04:44:00 +0000 2019,Well done WI! Keep up the good work! Test cricket’s brand value goes up when you are a champion side.👏👏👏🙏 #WIvsENG
1091529103403044900,Sat Feb 02 02:49:52 +0000 2019,The most exceptional ball I faced in my career...#throwback https://t.co/diwXRfQTKT
1091297281339359200,Fri Feb 01 11:28:41 +0000 2019,Nice to see SL do their bit for world cricket.👍 #AUSvsSL
1091188480950992900,Fri Feb 01 04:16:21 +0000 2019,What a talent Deepti Sharma is!  Bats at no 3, just top scored with 52 in a score of 149...Later in the match she w… https://t.co/2QYWhvyiA1
1091186063597432800,Fri Feb 01 04:06:45 +0000 2019,Slightly better selection this time from England but I would have played Mark Wood the bowler instead of Curran the… https://t.co/19Gld7SMsz
1090858947442028500,Thu Jan 31 06:26:54 +0000 2019,Just looked at the team for the finals of all World Cup Champions so far. Not one bits &amp; pieces player barring may… https://t.co/0T5h6Od2Yk
1090808551637807100,Thu Jan 31 03:06:39 +0000 2019,Note boss on phone, second from right. 🤨 https://t.co/f3sX9kmLt2
1090807719932485600,Thu Jan 31 03:03:21 +0000 2019,Do read my piece, Michael. It’s more than the odd selection mistake that all teams make. https://t.co/vio8UVcaKq
1090550126332923900,Wed Jan 30 09:59:46 +0000 2019,Never too late to try the Virat thing while batting. 👍 https://t.co/HM9aQESJce
1090524156024635400,Wed Jan 30 08:16:34 +0000 2019,A more elaborate piece on English cricket after a few rants here on Twitter. Manjrekar: what's going on with Englis… https://t.co/YDDyP2OdaH
1090522209141981200,Wed Jan 30 08:08:50 +0000 2019,That you are reacting this way further highlights the flawed mindset. I rest my case. https://t.co/0kRCC83kpW
1090207052344029200,Tue Jan 29 11:16:31 +0000 2019,Well done Indian women too, as NZ get another pasting from India in their own back yard. Bowlers setting up the win… https://t.co/6ZVcqMftqh
1090116155958747100,Tue Jan 29 05:15:19 +0000 2019,Trevor Bayliss said that Sam Curran has endured the first bad game of his career. Curran has 15 wickets in 15 innin… https://t.co/uhjm6Yfhdi
1089881557760802800,Mon Jan 28 13:43:07 +0000 2019,RT @akashbanerjee: This is beyond a 'misquote by media' Beyond an 'accidental utterance' once. Beyond spin being created to 'manufacture co…
1089877317881495600,Mon Jan 28 13:26:16 +0000 2019,I am seeing an Indian team now that I fantasised about as a player.  #IndianCricket
1089876148203413500,Mon Jan 28 13:21:37 +0000 2019,Tough one for India - Fitting in Hardik in a full strength Indian team with Bumrah available. Shami, Bhuvi, Bumrah,… https://t.co/sjELTcU7Fj
1089742918015803400,Mon Jan 28 04:32:12 +0000 2019,SL won the toss and batted first &amp; lost by an innings proving that its really down to ability &amp; suitability of cond… https://t.co/WAFkJKm01b
1089739755749699600,Mon Jan 28 04:19:38 +0000 2019,Sarfraz,Hardik matter ke upar charcha 😊  https://t.co/FmBW8sNpBN
1089417709341700100,Sun Jan 27 06:59:56 +0000 2019,So happy for WI cricket and Jason Holder. They have two good leaders now in Carlos Brathwaite and Jason Holder. Fin… https://t.co/49UXRgM8wt
1088792115973214200,Fri Jan 25 13:34:03 +0000 2019,Shami’s resurgence as a one day bowler makes India even stronger contenders for the WC.  Manjrekar: Shami gives a n… https://t.co/yLIQSsO0rL
1088762919204999200,Fri Jan 25 11:38:02 +0000 2019,Preview in Hindi. Also watch my sensational performance in the quiz!  https://t.co/Sn3DwDtZl4
1088706977897734100,Fri Jan 25 07:55:45 +0000 2019,Preview of the 2nd odi.  https://t.co/jqm8FvXvRl
1088618732920787000,Fri Jan 25 02:05:06 +0000 2019,Ben Stokes’ greatest value-add to England is as a Test bowler. If England push him down the order a little, he may… https://t.co/REiv5nP4Xm
1088617911873228800,Fri Jan 25 02:01:50 +0000 2019,Good to see Pandya and Rahul back and when the ombudsman gets appointed hopefully he will take no further action. T… https://t.co/ex9V2tCkqB
1088381312648372200,Thu Jan 24 10:21:40 +0000 2019,Well done Jhye Richardson! Got 3 off the top 6 batsmen out on debut at less than 2 runs an over. 👏👏👏 #AUSvsSL
1088318471191101400,Thu Jan 24 06:11:58 +0000 2019,Let’s have player wearing lapel mics so that we can hear what they mutter under their breath in all corners of the… https://t.co/NTPEKDQ6vA
1088310034260467700,Thu Jan 24 05:38:26 +0000 2019,Also SL that England faced in SL was the weakest its ever been, and India, well, 4-1 was a flattering score line fo… https://t.co/Ri4exjYJhj
1088307986756526100,Thu Jan 24 05:30:18 +0000 2019,Not forgetting at all. It’s despite their strange selections that they won. Short term success is never a good indi… https://t.co/HLgeCNtJ6p
1088271681960005600,Thu Jan 24 03:06:02 +0000 2019,Curran plays ahead of Broad. England at it again - Bizarre selections. #ENGvWI
1087935019635626000,Wed Jan 23 04:48:16 +0000 2019,When you have ‘KULCHA’ why would you want anything else? #INDvsNZ
1087934759098028000,Wed Jan 23 04:47:14 +0000 2019,I rest my case.😉 https://t.co/1IvZGXJTwc
1087194959365558300,Mon Jan 21 03:47:32 +0000 2019,Really happy to see Jhye Richardson in the Australian squad. One of those bowlers who show potential of being succe… https://t.co/6OeqN99idD
1086250215148007400,Fri Jan 18 13:13:27 +0000 2019,Loved the way India was nonchalant after the win. Signs that they are setting themselves high standards. 👏👏👏🙏🙏 #INDvsAUS
1086200711635963900,Fri Jan 18 09:56:44 +0000 2019,But can’t beat you. https://t.co/hPNjDTxQr4
1086125185995063300,Fri Jan 18 04:56:38 +0000 2019,Big supporter of Jadeja as a Test spinner but cringe every time he plays ahead of Chahal and Kuldeep in white ball cricket. #AUSvIND
1086059873282986000,Fri Jan 18 00:37:06 +0000 2019,Superb review of today’s Dhoni by Aakash. Must read.  Chopra: What is Dhoni's role in India's ODI side? - via ESPNC… https://t.co/xJnlJMVXAW
1086056049042436100,Fri Jan 18 00:21:54 +0000 2019,Well it’s a great composition, thats why. Well done bro! 👏👏🙏 https://t.co/fOgoR8itMD
1085861898053050400,Thu Jan 17 11:30:25 +0000 2019,When you guys are on commercial break...: https://t.co/zILHJrsFNu via @YouTube
1085540247448899600,Wed Jan 16 14:12:18 +0000 2019,In his 2nd Ranji Game, a senior Mumbai player urged an 18 year old Wasim Jaffer to keep encouraging the bowlers as… https://t.co/bGsTVJ73Lt
1085162583685034000,Tue Jan 15 13:11:35 +0000 2019,Bhuvi ensured Aus didn’t get 325 or more, then Virat did the Virat thing, Dhoni made us nostalgic and Karthik again… https://t.co/sWjwmSx2Tv
1085081837033218000,Tue Jan 15 07:50:44 +0000 2019,Woefully out of form Test batsman, Shaun Marsh, finds instant form in ODIs. Shows how much easier it is to get runs… https://t.co/z9rXfaElVW
1084805931135688700,Mon Jan 14 13:34:23 +0000 2019,Absolutely! They were immature, let us be mature. https://t.co/bkUeFuJHD3
1084774548095017000,Mon Jan 14 11:29:41 +0000 2019,The innings after extraainnings         #alibaug https://t.co/0gh5ZU5h3E
1084288707991990300,Sun Jan 13 03:19:07 +0000 2019,Only solution to Pakistan’s overseas batting woes is more A tours overseas.  #PakCricket
1084135831915229200,Sat Jan 12 17:11:39 +0000 2019,Watched a lovely Marathi film last night ‘ Take Care Goodnight’ directed by Girish Joshi on #AmazonPrime. Do watch!
1084016460048097300,Sat Jan 12 09:17:18 +0000 2019,Whole heartedly agree with you Raunak. Unlike in Tests, easiest thing to do in ODIS is stemming collapses while let… https://t.co/yh8kuunmO6
1084015673708298200,Sat Jan 12 09:14:11 +0000 2019,WinWiz obviously has not taken into account Dhoni’s recent form and ability. Highlights the hazards of analysing cr… https://t.co/XPuyBWSMQJ
1083923428455915500,Sat Jan 12 03:07:38 +0000 2019,In cricket, it’s not compulsory to play an all rounder. Chahal out for Jadeja dilutes India’s bowling which has bee… https://t.co/HZO4KzHzkb
1083727652496728000,Fri Jan 11 14:09:41 +0000 2019,Kal ke one day match ka preview. Hindi mein.#MatchDay #espncricinfo  https://t.co/6Lda3PyvW2
1083565888924725200,Fri Jan 11 03:26:54 +0000 2019,Let’s get this Hardik thing done with quickly so we can get back to focusing on Pujara &amp; Bumrah &amp; cherishing the in… https://t.co/RVeOgMVa18
1083237358231638000,Thu Jan 10 05:41:26 +0000 2019,What will India's future Test XI look like? Video - via ESPNCricinfo app https://t.co/LFcftbaDFH
1083001611687874600,Wed Jan 09 14:04:40 +0000 2019,Such a great series for India, that’s why so much to talk and review.😌  'One of India's greatest ever touring sides… https://t.co/y55nHCDF1N
1082844714041204700,Wed Jan 09 03:41:12 +0000 2019,Temperamentally and attitude-wise this is the best Indian team I have seen. https://t.co/J3cc3J3nFF
1082840323234000900,Wed Jan 09 03:23:45 +0000 2019,Yeh Jeet mere top 5 mein aati hain...#MatchdayHindi https://t.co/gDDYFWKjVu
1082581072783659000,Tue Jan 08 10:13:35 +0000 2019,RT @Sid71083: Total fan segment! Very interesting @sanjaymanjrekar https://t.co/GSofbyBq5H via ESPNCricinfo app https://t.co/yoGlH5VZtX
1082580654594748400,Tue Jan 08 10:11:56 +0000 2019,My report card on every Indian player. #MatchDay #espncricinfo  https://t.co/l44phrKx0C
1082524885413355500,Tue Jan 08 06:30:19 +0000 2019,Just because it’s the latest we must not make it the greatest. Watch to see where I rank this win in my top 5 great… https://t.co/InLQ5s9MYF
1082518497144406000,Tue Jan 08 06:04:56 +0000 2019,@RaunakRK Do you think Dhoni should be in the World Cup squad? 😁
1082501116791709700,Tue Jan 08 04:55:52 +0000 2019,@imAagarkar made a very good observation about Pant’s still bat while defending. This will be his great ally along… https://t.co/6A1xNgqGuR
1082500150998618100,Tue Jan 08 04:52:02 +0000 2019,With attacking batsmen hitting through the line getting exposed on pitches with some life, the stock of the defensi… https://t.co/Qj0yA8cfTx
1082499143497437200,Tue Jan 08 04:48:02 +0000 2019,During the course of the series, the penny dropped for Virat too. That defensive batsmen are a great asset to the t… https://t.co/F6pRoxujZq
1082210845063434200,Mon Jan 07 09:42:26 +0000 2019,Series review in English. #MatchDay   Agarkar: India outplayed Australia in both batting and bowling https://t.co/jmYOYV6MQx via @YouTube
1082210625663557600,Mon Jan 07 09:41:34 +0000 2019,Series review in Hindi.#MatchDay   विराट कोहली ने कहा करियर की सबसे बड़ी जीत https://t.co/ERZeZHzp4y via @YouTube
1082210098884206600,Mon Jan 07 09:39:28 +0000 2019,Where this Indian team has been unique &amp; different from Indian teams of the past is that even when it was losing in… https://t.co/ts0EKbIjfy
1082208458944831500,Mon Jan 07 09:32:57 +0000 2019,Agree completely with Virat Kohli no current team has competed better overseas than his team after losing tosses. #WellDoneIndia #MATCHDAY
1082160468792270800,Mon Jan 07 06:22:15 +0000 2019,A simple series review - India’s bowling rise coincided with Australia’s batting plunge...and of course Pujara.  #IndiaOnTop #MatchDay
1082084865116459000,Mon Jan 07 01:21:50 +0000 2019,Pujara has got even Ian Chappell to rave about defensive batting. Wow!  Pujara is the world's most effective blunte… https://t.co/fMs9KdeqR1
1082072461355544600,Mon Jan 07 00:32:33 +0000 2019,Look at FC averages of Eng batsmen during Ind/Eng series, it pales in comparison to Indian batsmen. But Eng won the… https://t.co/mJ5jOKSg5f
1081833824344989700,Sun Jan 06 08:44:17 +0000 2019,Mere Hindi doston ke liye. https://t.co/SQdruiadjr
1081792809835814900,Sun Jan 06 06:01:19 +0000 2019,Ponting spot on with this. https://t.co/24UG1hSbJf
1081768152176910300,Sun Jan 06 04:23:20 +0000 2019,So that one little differentiating fact explains India’s batting dominance? 🤔 https://t.co/O8ZBO29tHA
1081766603669172200,Sun Jan 06 04:17:11 +0000 2019,Oh dear!  Selection headaches with spinners for India. Kuldeep has thrown his hat in the ring as a wicket taking sp… https://t.co/GU1CVvd9x7
1081752488817045500,Sun Jan 06 03:21:05 +0000 2019,Great start for India. Getting Australia’s Pujara (Cummins)out early.👍 #AusvInd
1081703202330796000,Sun Jan 06 00:05:15 +0000 2019,When Australia was thrashing India even then FC averages of Indian batsmen were better than Australian batsman. So… https://t.co/Qg3zpwLKJG
1081432655709651000,Sat Jan 05 06:10:11 +0000 2019,It’s still a pitch that’s not producing wicket taking deliveries but then this Australian batting line up has the a… https://t.co/281tKf8VH4
1081151189008318500,Fri Jan 04 11:31:44 +0000 2019,While lauding Pant’s efforts with the bat, important to not forget the invaluable contribution of another young bat… https://t.co/xS8eFRJrw0
1081054178313556000,Fri Jan 04 05:06:15 +0000 2019,Got to feel for Wridhiman Saha. 😔
1081048232635985900,Fri Jan 04 04:42:38 +0000 2019,Pant looks such a good player &amp; dependable when he is batting in 3rd gear. Going forward he could try &amp; perfect his… https://t.co/ORNY6tEMGu
1081017900100534300,Fri Jan 04 02:42:06 +0000 2019,Why unlucky Harsha? There was a clear movement on snicko at the exact moment the ball passed the bat. https://t.co/SmjNsQHH7P
1080996089279332400,Fri Jan 04 01:15:26 +0000 2019,Quite amazed that Duracell haven’t approached Pujara yet for a tie up.
1080881838577528800,Thu Jan 03 17:41:26 +0000 2019,RT @ESPNcricinfo: "Not out of form, but not at his best"  @sanjaymanjrekar on the curious case of Ajinkya Rahane #AUSvIND https://t.co/SVhY…
1080819496011481100,Thu Jan 03 13:33:43 +0000 2019,Steyn + Philander + Rabada + Olivier = Pakistan all out 177. Cant blame Pak too much, can you? #QualityAttack #SAvsPAK
1080705762102370300,Thu Jan 03 06:01:46 +0000 2019,Calmness while batting, calmness in celebration. Pujara stands out in today’s frenetic world as he has done in this series.👏👏👏🙏🙏🙏 #AusvIndia
1080684094520930300,Thu Jan 03 04:35:40 +0000 2019,RT @ESPNcricinfo: Sanjay Manjrekar recounts a funny episode involving Vinod Kambli and the late Ramakant Achrekar https://t.co/lmYZbF7H04 h…
1080655062760706000,Thu Jan 03 02:40:19 +0000 2019,Okay, we have another brilliant cover driver in the team now: Mayank Agarwal.
1080626081369968600,Thu Jan 03 00:45:09 +0000 2019,Took Australia 12 overs to realise it’s worthwhile exploring Mayank Agarwal’s back foot play on this pitch. 🤔
1080579342910947300,Wed Jan 02 21:39:26 +0000 2019,If Acharekar Sir saw talent while riding his Lambretta scooter around the city he stopped. In a few weeks’ time the… https://t.co/Xfj1UFQe9X
1080346171871096800,Wed Jan 02 06:12:53 +0000 2019,New year resolution- To be less greedy...about food, I mean.
1080345435636588500,Wed Jan 02 06:09:58 +0000 2019,Excellent read this.  Bumrah: a wise, autonomous freak https://t.co/TMoaQJbaiv
1080302701886537700,Wed Jan 02 03:20:09 +0000 2019,Rahul or M.Vijay for Rohit, the only change India should make for the  Sydney Test.  #AUSVIND
1079965423590957000,Tue Jan 01 04:59:56 +0000 2019,Happy New Year guys! Have a great 2019!
1079250349863649300,Sun Dec 30 05:38:29 +0000 2018,Bumrah here Olivier there. Bowlers ruling the roost in Tests. Nice! #SAvsPak
1079248459679649800,Sun Dec 30 05:30:58 +0000 2018,Please note, India have won two Tests here with a supposedly long tail. When India loses looking at the long tail a… https://t.co/N1m28QFKP8
1079212287993499600,Sun Dec 30 03:07:14 +0000 2018,Four world class bowlers in the playing XI &amp; two world class bowlers ( Bhuvi &amp; Ash) in the reserves. Indian cricket… https://t.co/b1HTr5FwBS
1079211257532743700,Sun Dec 30 03:03:09 +0000 2018,2,3,3,2. Second inngs wickets once again shared between four Indian bowlers. Sign of a very good bowling attack. FA… https://t.co/69AdfXGC7L
1079209547259093000,Sun Dec 30 02:56:21 +0000 2018,Well done India! Yeh hui na baat..ise kehte hai asli jeet! 👏👏👏🙏🙏 #OverseasWins
1078667260384825300,Fri Dec 28 15:01:30 +0000 2018,Delighted and not surprised by his success.😊 https://t.co/8iQgMWLb22
1078514872088813600,Fri Dec 28 04:55:58 +0000 2018,And one of the quickest to get there.👍 https://t.co/75lyPoErJW
1078479398536429600,Fri Dec 28 02:35:00 +0000 2018,Bumrah is the bowling equivalent of the 360 degrees batsman.  #AUDvIND #MatchDay
1078179947565305900,Thu Dec 27 06:45:05 +0000 2018,Strange declaration from India. With Rohit there India could have got 50/75 runs or even more runs, runs which woul… https://t.co/ptmtBQ13wT
1077915980729221100,Wed Dec 26 13:16:11 +0000 2018,Typical Test match grind from India. Rare and hence precious in today’s cricket. If India go onto dominate this Tes… https://t.co/KGEZiB7J2U
1077915190497181700,Wed Dec 26 13:13:02 +0000 2018,What a day Tim Southee has had! Top scores with 68 in a total of 178 and then picks 3 off the 4 SL wickets to fall. 👏👏👏 #NZvsSL
1077503907163762700,Tue Dec 25 09:58:45 +0000 2018,https://t.co/bViqHBgNQr
1077430063052869600,Tue Dec 25 05:05:19 +0000 2018,When it comes to performance in SENA countries, Jadeja is not far behind Ashwin &amp; has played much less.  Ashwin- 48… https://t.co/HfZXzyJJJt
1076308407727075300,Sat Dec 22 02:48:15 +0000 2018,My piece in Cricinfo previewing the third Test.  https://t.co/ONSgWq1abO
1076285083961749500,Sat Dec 22 01:15:35 +0000 2018,Why the tail wags against India. https://t.co/wxZpbaGwWt
1075941435042553900,Fri Dec 21 02:30:02 +0000 2018,Very happy with this decision.👍 https://t.co/ecLwdcIV8F
1075814899631120400,Thu Dec 20 18:07:14 +0000 2018,Can’t be deadly serious all the time. It’s a game after all. Some fun here with @RaunakRK   ‘कप्तान’ कोहली का बर्ता… https://t.co/eUgrwz3ov9
1075669776461193200,Thu Dec 20 08:30:34 +0000 2018,Time will tell if Shivam Dubey becomes an IPL star or not, but he is already one of the most handsome players in the IPL. 👍
1075224643374465000,Wed Dec 19 03:01:46 +0000 2018,Amazed that players haven’t objected to the excessive use of stump mics. Especially when it’s purpose is to create… https://t.co/isoySrNyFw
1075035719205302300,Tue Dec 18 14:31:03 +0000 2018,How will he be against spin on dry March April Indian pitches? https://t.co/igAQjSkSa3
1074946548075716600,Tue Dec 18 08:36:43 +0000 2018,Brilliant fighting innings from Angelo and Kusal Mendis. 👏👏👏Good to see Angelo back and getting runs after he was r… https://t.co/9ssgPrhdZP
1074940701987598300,Tue Dec 18 08:13:29 +0000 2018,Well, as we said... https://t.co/vyKRPpGhhJ
1074582504030523400,Mon Dec 17 08:30:08 +0000 2018,Nathan Lyon is a great bowler...period.
1074542903752581100,Mon Dec 17 05:52:46 +0000 2018,Great to see the ‘blow hot, blow cold’ bowler being red hot this year. Well done Mohd Shami! So happy for him.👏👏👏🙏
1074455207910633500,Mon Dec 17 00:04:18 +0000 2018,Important to note, when it comes to low catches even if umpires are pretty confident that the catch has been taken… https://t.co/gMQ9fXxRYg
1074185028039516200,Sun Dec 16 06:10:42 +0000 2018,10 years back you would have said ‘No chance’ for India. But with this current Australian batting lineup, despite t… https://t.co/eAwc0VFfOt
1074154927394562000,Sun Dec 16 04:11:06 +0000 2018,What’s the difference between Virat of today and Virat of 4 years back. It’s the mind. His mind is a lot greater to… https://t.co/dhuuLPzXXh
1073898474834399200,Sat Dec 15 11:12:03 +0000 2018,When you are going through a rut as a team imperative that you have players like Niroshan Dickwella. Player with so… https://t.co/3YJuhdH2ou
1073897130929070100,Sat Dec 15 11:06:42 +0000 2018,After Anderson’s acid test in England, Virat must find everything so much easier, like even today’s Australian bowl… https://t.co/G5xBKIiYVv
1073807588133879800,Sat Dec 15 05:10:54 +0000 2018,Indian openers carrying too much baggage of the past. If mind is affected there is not much technical tweaks can do.  #AUSvIND
1073805798663434200,Sat Dec 15 05:03:47 +0000 2018,RT @harbhajan_singh: Backing team India s batting to come good in Perth #INDvAUS 2nd test @sanjaymanjrekar @DeepDasgupta7 #nehraji https://…
1073786414347771900,Sat Dec 15 03:46:45 +0000 2018,Considering that the tail is wagging consistently, nowadays, Indian bowlers must try and have more concentration of… https://t.co/f0mTY856tr
1073756470477492200,Sat Dec 15 01:47:46 +0000 2018,Disturbing trend in Test cricket. Senior, more accomplished batsmen batting down the order while poor, inexperience… https://t.co/Jg7xmPXaUU
1073752668546457600,Sat Dec 15 01:32:40 +0000 2018,RT @fwildecricket: Before the Test all the talk about the pitch was about pace, big bounce and seam but in reality its major characteristic…
1073571631333658600,Fri Dec 14 13:33:17 +0000 2018,Sorry could not make it. Best wishes to you both. 🙏🙏 https://t.co/ChKiyEwvv9
1073571106387185700,Fri Dec 14 13:31:12 +0000 2018,The pitch was bipolar today. If it continues to be this way. Australia in a very good position at end of day 1. #AusvIndia
