id,created_at,text
1118879278383489000,Thu Apr 18 14:09:42 +0000 2019,RT @Blisscartoons: Cartoonist Harry Bliss Collaborates With Comedian Steve Martin https://t.co/ngYzifXbuz
1118868853319262200,Thu Apr 18 13:28:16 +0000 2019,We are in Omaha tonight! https://t.co/7tpOyRs5eq
1118652898697728000,Wed Apr 17 23:10:09 +0000 2019,RT @NewsHour: Comedians @SteveMartinToGo and Martin Short give us their #BriefButSpectacular take on, as they put it, "our fabulously popul…
1118538742850043900,Wed Apr 17 15:36:32 +0000 2019,Another collaborative cartoon from me and Harry Bliss. ⁦@Blisscartoons⁩ https://t.co/lshb9LNvEl
1118537819390206000,Wed Apr 17 15:32:52 +0000 2019,I’m one. https://t.co/YA94i7YkzQ
1118527286821699600,Wed Apr 17 14:51:01 +0000 2019,See you this weekend, Omaha, Milwaukee, and Peoria! We’re already pressing our shirts! https://t.co/kpBM412GmY
1118526482098290700,Wed Apr 17 14:47:49 +0000 2019,Marty and I really enjoyed this interview. https://t.co/BRa7M1S9W1
1118180402227757000,Tue Apr 16 15:52:37 +0000 2019,The great cartoonist Harry Bliss and I are working on a series of cartoons for a book at some point in the future.… https://t.co/MbKBecxMB2
1118122324903985200,Tue Apr 16 12:01:50 +0000 2019,Omaha, Milwaukee, Peoria! We’re on our way. https://t.co/DaaJQ5NJh2
1117241376242978800,Sun Apr 14 01:41:16 +0000 2019,When the audience stays the whole show, we know we’ve killed. https://t.co/cnXbTwdCUg
1117143066077536300,Sat Apr 13 19:10:37 +0000 2019,Great audience last night makes us even more inspired for tonight! https://t.co/ye7fJQGTlJ
1116759949520957400,Fri Apr 12 17:48:15 +0000 2019,Yep. We’ll be starting shortly. https://t.co/OZLGLabpob
1044267778499383300,Mon Sep 24 16:50:14 +0000 2018,Congratulations to Kristin Scott Benson on being awarded the SM Prize for Excellence in Banjo and Bluegrass. https://t.co/ulsV7Js8lL
