id,created_at,text
1179803849608982500,Thu Oct 03 17:02:12 +0000 2019,Here’s Marty Short’s and my official dates for Australia! We think of it as going “up over.” https://t.co/YreAihbiAT
1179517314317860900,Wed Oct 02 22:03:36 +0000 2019,Preorder now! Though I have nothing for sale, it’s always good to preorder.
1179418970551701500,Wed Oct 02 15:32:49 +0000 2019,Another cartoon from @Blisscartoons and me. https://t.co/DRRcsEOcvC
1179004192289120300,Tue Oct 01 12:04:38 +0000 2019,Today’s cartoon! @Blisscartoons https://t.co/KfX65uqACg
1178792571994280000,Mon Sep 30 22:03:44 +0000 2019,... After the shows, he said “Please call me.” About a month later, I did. He didn’t recognize my voice, and he sai… https://t.co/G76vax3jnR
1178792310693335000,Mon Sep 30 22:02:42 +0000 2019,The brilliant Ken Burns’ documentary, “Country Music,” reminds me, among other things, of the charm and artistry of… https://t.co/bMZwWUIbtH
1178744901959405600,Mon Sep 30 18:54:19 +0000 2019,RT @MyTicketUK: ICYMI: Last week, comedy legends @SteveMartinToGo and #MartinShort announced “The Funniest Show in Town at the Moment” tour…
1178698658818207700,Mon Sep 30 15:50:34 +0000 2019,Here’s yet another cartoon from ⁦@Blisscartoons⁩ and me. https://t.co/6XOUBbBud0
1178361676166570000,Sun Sep 29 17:31:31 +0000 2019,@AlexWesaw We loved the Four Winds! And the audience seemed to enjoy me and sometimes Marty.
1178361337287778300,Sun Sep 29 17:30:10 +0000 2019,@PBBTC Unfortunately, I won’t get there in time, but if the video speaks for the talent, I’M IMPRESSED!  Have a great run.
1177930256369492000,Sat Sep 28 12:57:12 +0000 2019,We loved our show at the Colosseum last night. The part with the lions was especially entertaining. https://t.co/KZ9juNRozb
1177812238478037000,Sat Sep 28 05:08:15 +0000 2019,Here’s a tune from a few years ago from Edie Brickell and me.  https://t.co/biZWfdR6op
1177263581349519400,Thu Sep 26 16:48:04 +0000 2019,Marty (I think of him as Martyr because of his whining) and I are coming to the UK in March! https://t.co/XrPxLDjPHS
1177215292243611600,Thu Sep 26 13:36:11 +0000 2019,Today’s cartoon! https://t.co/qp6eKcP2rj
1176618639610589200,Tue Sep 24 22:05:18 +0000 2019,It’s an online pledge. https://t.co/MhbbLYGKVJ
1175491575713083400,Sat Sep 21 19:26:45 +0000 2019,Yup! https://t.co/bQdfIzvHlr
1175456201372569600,Sat Sep 21 17:06:11 +0000 2019,See you tonight at the show! https://t.co/CiCOj9ru2F
1175196002023870500,Fri Sep 20 23:52:15 +0000 2019,It’s a masterpiece, but not very funny. https://t.co/wwjjdovdo8
1174718843068960800,Thu Sep 19 16:16:12 +0000 2019,Ha! https://t.co/VS7jsVP43G
1174474430329680000,Thu Sep 19 00:04:59 +0000 2019,Nice review of Marty and me! Interestingly, the reviewer is absolutely correct. https://t.co/OxqNOyT1Cc
1174290526193033200,Wed Sep 18 11:54:13 +0000 2019,Cartoon time! From ⁦@Blisscartoons⁩ and me. https://t.co/HI84coG948
1174156345253204000,Wed Sep 18 03:01:02 +0000 2019,Yes, we’re all headed for Australia in November.  Exciting to think of the Steep Canyon Rangers doing a solo show t… https://t.co/5acz5a60tF
1173983541681692700,Tue Sep 17 15:34:22 +0000 2019,Another cartoon from ⁦@Blisscartoons⁩ and me. https://t.co/BGTVtKofs8
1173574490195935200,Mon Sep 16 12:28:57 +0000 2019,Today’s cartoon! From ⁦@Blisscartoons⁩ and yours truly. https://t.co/uiTvk1iyfq
1173064852639748000,Sun Sep 15 02:43:50 +0000 2019,We loved our show in Bangor tonight! https://t.co/dg544F9Ors
1172865672898105300,Sat Sep 14 13:32:21 +0000 2019,Congrats to Victor Furtado on winning the Banjo Prize! https://t.co/IX0SxgAgvU
1171817120201695200,Wed Sep 11 16:05:47 +0000 2019,Never too late to sign this charity autograph request from 2013. https://t.co/fVMXHTYh98
1171511000547221500,Tue Sep 10 19:49:22 +0000 2019,This weekend, Springfield, Saratoga Springs, Bangor! Marty will have his head on my shoulder the entire show! https://t.co/dXU7Xdmt3f
1169692062595387400,Thu Sep 05 19:21:34 +0000 2019,RT @cl_tampabay: The trick to enjoying Theatre of the Absurd is that you should never, ever think too much, because the point is there is n…
1168533478905766000,Mon Sep 02 14:37:46 +0000 2019,Our cartoon for today from ⁦@Blisscartoons⁩ and me. https://t.co/kmsHHGpXpJ
1168347890172870700,Mon Sep 02 02:20:18 +0000 2019,This beautiful “carpet” by Xu Bing at LACMA is made entirely of cigarettes. https://t.co/lbVFHGEMi8
1168283538933743600,Sun Sep 01 22:04:35 +0000 2019,Great cast; great production! https://t.co/NlzwsOkXyX
1167470917942796300,Fri Aug 30 16:15:32 +0000 2019,Today’s cartoon from ⁦@Blisscartoons⁩ and Steve https://t.co/3v6n0aZabu
1167279803063394300,Fri Aug 30 03:36:06 +0000 2019,Comedian, banjoist second. https://t.co/SVSase74Yv
1167258391330181000,Fri Aug 30 02:11:01 +0000 2019,You should not, currently, be laughing at this. https://t.co/0veLey19J6
1167257301725540400,Fri Aug 30 02:06:41 +0000 2019,Please, no more “comedy” answers. Straight answers only. I’m so angry right now. I’m sure you’ll comply. https://t.co/rV7O06wCQC
1167255137536004000,Fri Aug 30 01:58:05 +0000 2019,I knew something like this would happen. https://t.co/gPAIWsDIPn
1167254160330281000,Fri Aug 30 01:54:13 +0000 2019,Can any of you experts tell me where this rug is from? And don’t say Carpet City. https://t.co/a7fCPrS9oF
1167138189804310500,Thu Aug 29 18:13:23 +0000 2019,Today’s cartoon from Harry and Steve. ⁦@Blisscartoons⁩ https://t.co/qNIMkRTo4I
1166824157096472600,Wed Aug 28 21:25:32 +0000 2019,Here is Marty’s and my touring schedule for the next two months. Dallas; Carmel, IN;Windsor, ON; New Buffalo, MI; V… https://t.co/P5T6iE7dkX
1166354992615366700,Tue Aug 27 14:21:14 +0000 2019,Today’s cartoon! From ⁦@Blisscartoons⁩ and my little self. https://t.co/5VwRGkw5Up
1164569993243009000,Thu Aug 22 16:08:17 +0000 2019,Today’s cartoon! From ⁦@Blisscartoons⁩ and me. https://t.co/DAaxnQgztn
1163475767755329500,Mon Aug 19 15:40:14 +0000 2019,Gagosian's 'Desert Painters of Australia' bursts with beauty - Los Angeles Times https://t.co/wBnzLPA9gQ
1162393993268744200,Fri Aug 16 16:01:38 +0000 2019,RT @AusintheUS: You know @SteveMartinToGo as a comedian, actor &amp; musician, but #DYK he's also an 🇦🇺#IndigenousArt collector? You can see a…
1162383439745564700,Fri Aug 16 15:19:42 +0000 2019,RT @Blisscartoons: And the rest is lame pizza history... https://t.co/MIGdhZCqvp
1161723687852056600,Wed Aug 14 19:38:05 +0000 2019,Thanks, guys. Our collaboration has been extraordinary for me. https://t.co/B5x60YVsr0
1161699668251693000,Wed Aug 14 18:02:38 +0000 2019,Yep, and thanks for all your help and advice through the years. https://t.co/Tte9zPEKQW
1161699041853358000,Wed Aug 14 18:00:09 +0000 2019,@bdgrabinski I modestly retweet.
1161697059755323400,Wed Aug 14 17:52:16 +0000 2019,Latest cartoon from @Blisscartoons and me. https://t.co/vLwLiXnwpT
1161043079559647200,Mon Aug 12 22:33:35 +0000 2019,We’re getting closer to “A Night to Rememeber” in Dallas. If we remember. https://t.co/GKWegEqdaJ
1160758075030036500,Mon Aug 12 03:41:05 +0000 2019,Just bought it. Can’t wait to hear the wonderful things you say about me. https://t.co/9KSW3DXEQX
1159819626466992000,Fri Aug 09 13:32:02 +0000 2019,Today’s cartoon from ⁦@Blisscartoons⁩ and me. https://t.co/kKUvrBpi3X
1159543425215025200,Thu Aug 08 19:14:30 +0000 2019,Today’s cartoon! https://t.co/5oXkpiGjrz
1158037047950491600,Sun Aug 04 15:28:42 +0000 2019,Here is a great discussion of Western Desert painting by three luminaries in the field: https://t.co/87nkyOGJOd
1156245591392829400,Tue Jul 30 16:50:05 +0000 2019,My nightmare last night. https://t.co/Z8THG2DKQJ
1156028833302061000,Tue Jul 30 02:28:46 +0000 2019,Wonderful to be back at the Old Globe -as a writer-and to play the beautiful circle in the round oval shaped theatr… https://t.co/803sgbGCxY
1154838019179860000,Fri Jul 26 19:36:54 +0000 2019,Today’s cartoon from ⁦@Blisscartoons⁩ and me. https://t.co/j7W9cXf8Og
1154627437260501000,Fri Jul 26 05:40:07 +0000 2019,This is a very bad situation to be in. https://t.co/RaLaI94uPT
1154459442131292200,Thu Jul 25 18:32:34 +0000 2019,Another view of the Australian Western Desert painters at Gagosian in L. A. Opens Friday evening. https://t.co/WFgT8ihdEy
1154459167849009200,Thu Jul 25 18:31:29 +0000 2019,A beautiful show of modern Australian Western Desert painters is opening tomorrow at Gagosian L.A. 6-8. Many of the… https://t.co/APv1NS52uV
1153131855547207700,Mon Jul 22 02:37:13 +0000 2019,We had a ball with this interview. https://t.co/ZVLSbdAuQd
1152003500341022700,Thu Jul 18 23:53:32 +0000 2019,Reno tomorrow, Eugene Saturday. Airway Heights-? Sunday. https://t.co/hN69nsOnNl
1151519282515206100,Wed Jul 17 15:49:25 +0000 2019,And another cartoon from ⁦@Blisscartoons⁩ and me. https://t.co/NRAcxjFWm0
1151250000581496800,Tue Jul 16 21:59:23 +0000 2019,I’m so excited for this show. https://t.co/yUFN5QQlfO
1151244418210418700,Tue Jul 16 21:37:13 +0000 2019,Curious about your reaction to this section of our new single. ⁦@SteepCanyon⁩ https://t.co/QNL8Gl7tdu
1150851320070332400,Mon Jul 15 19:35:11 +0000 2019,Yes, Harry and I keep on keepin’ on. https://t.co/bbDu7ENewC
1150840432516952000,Mon Jul 15 18:51:55 +0000 2019,I’m recording a new single today with @SteepCanyon. First single since King Tut! Very different though.
1150110123286835200,Sat Jul 13 18:29:56 +0000 2019,Tonight in Colorado Springs (that’s in Colorado). https://t.co/K4Gfnto59A
1149770901111504900,Fri Jul 12 20:01:59 +0000 2019,I know, bleak. ⁦@Blisscartoons⁩ and me. https://t.co/kGUcqSfl1b
1149768332637114400,Fri Jul 12 19:51:46 +0000 2019,Every minute of every day. https://t.co/gTxQlTSUH6
1149340620122492900,Thu Jul 11 15:32:12 +0000 2019,Colorado, see you this weekend. Loveland, Colorado Springs, Vail. We can’t wait. https://t.co/PIa31AleA3
1149340096866336800,Thu Jul 11 15:30:07 +0000 2019,Thursday’s cartoon! From ⁦@Blisscartoons⁩ and me. https://t.co/Lpj6HbzopJ
1148966668086829000,Wed Jul 10 14:46:15 +0000 2019,It’s cartoon time! ⁦@Blisscartoons⁩ https://t.co/LmSw5hwPn7
1148618656311459800,Tue Jul 09 15:43:22 +0000 2019,And yet another cartoon from me and ⁦@Blisscartoons⁩ https://t.co/PLeDVwlAP0
1148307318053826600,Mon Jul 08 19:06:13 +0000 2019,I’m definitely going! https://t.co/5ilMj45GFI
1148222617767202800,Mon Jul 08 13:29:39 +0000 2019,Today’s cartoon from ⁦@Blisscartoons⁩ and me.... https://t.co/bOSeca34yP
1147698784043851800,Sun Jul 07 02:48:07 +0000 2019,RT @BookOfBENAIAH: 🌟 ...a few stills from Bright Star. The experience was priceless, but SEEING what the audience saw brings tears to my ey…
1147520055254507500,Sat Jul 06 14:57:55 +0000 2019,Hey Jeff, have a great time. So glad you’re doing it. https://t.co/hPsGTewgZR
1146794539002155000,Thu Jul 04 14:54:59 +0000 2019,Today’s fun from ⁦@Blisscartoons⁩ and me. https://t.co/mrn5cU6Qer
1146507812706500600,Wed Jul 03 19:55:38 +0000 2019,Marty and I are excited about our Colorado tour, beginning in about ten days.... https://t.co/xxxMvtltIC
1146099674123649000,Tue Jul 02 16:53:50 +0000 2019,Today’s cartoon! https://t.co/aeFGm9nhZf
1145117159942529000,Sat Jun 29 23:49:40 +0000 2019,Barry Flanagan. https://t.co/67th3UvT9m
1144323368738365400,Thu Jun 27 19:15:26 +0000 2019,Nice toilet. Privacy was an issue. https://t.co/LgnU5YfQME
1143890522781581300,Wed Jun 26 14:35:27 +0000 2019,Today’s cartoon from ⁦@Blisscartoons⁩ and me. https://t.co/FsM5xVNBVz
1143691422308040700,Wed Jun 26 01:24:18 +0000 2019,@Variety No magazine has ever fact-checked the false statement that I am a member of Mensa. Never have been, never applied.
1143341608072409100,Tue Jun 25 02:14:16 +0000 2019,And if my life depended on it, if I was asked “Who is Henry Clark?,” I would have died. https://t.co/maVtO3VTm4
1143341278068764700,Tue Jun 25 02:12:57 +0000 2019,Took me a minute. https://t.co/maVtO3VTm4
1143341060803854300,Tue Jun 25 02:12:05 +0000 2019,You got it, (may I call you) dude! https://t.co/hcJudJxzfg
1141730714464817200,Thu Jun 20 15:33:09 +0000 2019,Today’s cartoon from Steve and ⁦@Blisscartoons⁩ https://t.co/7ySQcw07fJ
1140748295960010800,Mon Jun 17 22:29:22 +0000 2019,Surprises at my eye exam. https://t.co/3uuRspoY6L
1139174911539204100,Thu Jun 13 14:17:18 +0000 2019,A dog cartoon today from @Blisscartoons and me. https://t.co/sPcnCRV700
1138919309630156800,Wed Jun 12 21:21:38 +0000 2019,Have a great run! https://t.co/NQjer4Pw1I
1138415209314496500,Tue Jun 11 11:58:31 +0000 2019,Today’s cartoon! ⁦@Blisscartoons⁩ https://t.co/sWRgJx2UeG
1138111004691316700,Mon Jun 10 15:49:43 +0000 2019,Yup. https://t.co/UGjooJNi5p
1137406805368279000,Sat Jun 08 17:11:29 +0000 2019,FYI, the star on my hat is the from the California flag. https://t.co/837bb4vdyq
1137371185765920800,Sat Jun 08 14:49:56 +0000 2019,Now tweeting from an undisclosed location. https://t.co/f6gjMyDfsn
1137231559248031700,Sat Jun 08 05:35:07 +0000 2019,Just when you think you know it all, here’s a photo from Venus.  https://t.co/j4baEHTbez
1137230256602046500,Sat Jun 08 05:29:56 +0000 2019,Somehow, these are not the most exhilarating photos. https://t.co/P07QXsKecP
1137229798936404000,Sat Jun 08 05:28:07 +0000 2019,Full house tonight, except when I was playing and people went to get beers. https://t.co/0pgUPQXhv4
1137229366918864900,Sat Jun 08 05:26:24 +0000 2019,Unbelievable. We played Moorhead tonight and did not make one Moorhead joke.
1137002483472109600,Fri Jun 07 14:24:51 +0000 2019,It’s cartoon time! From ⁦@Blisscartoons⁩ and me. https://t.co/ZQ4ebGUZjm
1136390909904478200,Wed Jun 05 21:54:40 +0000 2019,Only problem with visiting the American Banjo Museum in Oklahoma City: not enough banjos. Har. https://t.co/RvLFtgVOYZ
1136289702208782300,Wed Jun 05 15:12:30 +0000 2019,A cartoon from Harry Bliss and me...⁦@Blisscartoons⁩ https://t.co/c3DfdJRgZk
1135670191621324800,Mon Jun 03 22:10:48 +0000 2019,Moorhead, Sioux Falls, and Davenport, IA coming up next weekend. https://t.co/GlIYq3riwr
1135390439534735400,Mon Jun 03 03:39:09 +0000 2019,All I can see is my button. https://t.co/DotycjEdY9
1135055950187028500,Sun Jun 02 05:30:01 +0000 2019,This is actually the theatre we played tonight in San Antonio. The blue sky is an illusion. We are indoors. https://t.co/G1B5HPecAR
1134896376045850600,Sat Jun 01 18:55:56 +0000 2019,Sorry, earlier tweet turns out not to be the Alamo. Here is correct photo of the Alamo. https://t.co/VBRhoc2oSf
1134873385585057800,Sat Jun 01 17:24:34 +0000 2019,In San Antonio, just saw the Alamo. So fantastic! https://t.co/0wkQpVrNoC
1134859579286872000,Sat Jun 01 16:29:43 +0000 2019,Today’s retro cartoon from Harry and me. @Blisscartoons https://t.co/rqhYT7dkfZ
1134725720662581200,Sat Jun 01 07:37:48 +0000 2019,A perfect correction. https://t.co/EYpDDmAhys
1134725498746089500,Sat Jun 01 07:36:55 +0000 2019,El Paso rocked. And I even think I know what that means. San Antonio today, then Oklahoma City Sunday. https://t.co/33b3t7ulwv
1134723874761977900,Sat Jun 01 07:30:28 +0000 2019,One of the great banjo photos ever. https://t.co/PbET0Wn6LS
1134611516190265300,Sat Jun 01 00:04:00 +0000 2019,Congrats to The Firehouse Theatre!  https://t.co/nPUwnIpS9L
1134608397196824600,Fri May 31 23:51:36 +0000 2019,We are there! https://t.co/rFJ7Cwhmff
1134411480357625900,Fri May 31 10:49:07 +0000 2019,Today’s cartoon from Steve and Harry. ⁦@Blisscartoons⁩ https://t.co/ZQXTu1A9mA
1133858704091164700,Wed May 29 22:12:35 +0000 2019,See you in El Paso. This Friday. https://t.co/cTztG37IQW
1133838829062955000,Wed May 29 20:53:37 +0000 2019,Marty and I are in El Paso on Friday! Saturday, San Antonio!. https://t.co/CPgJwRcaaN
1132492658167955500,Sun May 26 03:44:25 +0000 2019,@HistoryToLearn This man, Vermeer, paints better than I do. At this point.
1132161893781725200,Sat May 25 05:50:04 +0000 2019,But why would you put your hands down? https://t.co/0LUWXDnexH
1132161799736954900,Sat May 25 05:49:42 +0000 2019,Yup. Loved coming to the town of Jack Benny, a comedian I admire, steal from, but, alas, never met. https://t.co/wodrgRgVVO
1132148530171273200,Sat May 25 04:56:58 +0000 2019,This can’t be true. And yet it is. https://t.co/0LUWXDnexH
1131917384049205200,Fri May 24 13:38:29 +0000 2019,Yes, it’s true. https://t.co/lV7nUZdLqb
1131658945993629700,Thu May 23 20:31:32 +0000 2019,Marty and I were expecting more people for our show in Rochester tonight. https://t.co/5AQUoBmdnQ
1131581636313849900,Thu May 23 15:24:20 +0000 2019,See you in Rochester, MN in a few hours! https://t.co/eLarpE8REQ
1131208073882873900,Wed May 22 14:39:56 +0000 2019,See you tomorrow in Rochester, MN, then on to Waukegan an Hammond. Marty and I haven’t seen each other in TWO WEEKS… https://t.co/hWcspJzpMS
1131187747190919200,Wed May 22 13:19:10 +0000 2019,Today’s cartoon from Steve and Harry ⁦@Blisscartoons⁩ https://t.co/2TJSScGcHQ
1130665640644235300,Tue May 21 02:44:30 +0000 2019,This, either, is not something I expected in my life. https://t.co/BjCCc5ZHkI
1130665507538051100,Tue May 21 02:43:58 +0000 2019,This is not something I expected in my life. https://t.co/mTFWrKBw4e
1130529312468275200,Mon May 20 17:42:46 +0000 2019,A laugh a minute from @Blisscartoons and me https://t.co/NrV2E6963c
1130461526572372000,Mon May 20 13:13:25 +0000 2019,Here we come, Rochester MN, Waukegan, and Hammond! https://t.co/UHpW7XUqSx
1130441133799223300,Mon May 20 11:52:23 +0000 2019,Another George  Tjungurrayi work. https://t.co/79tzBrtkjZ
1130441016161591300,Mon May 20 11:51:55 +0000 2019,Love this image of a George  Tjungurrayi painting. Accompanied by a great article by Sebastian Smee https://t.co/mC0i8u6XsB
1129877070752997400,Sat May 18 22:31:00 +0000 2019,I already knew that. https://t.co/7fiYPhrSq9
1129749461322883100,Sat May 18 14:03:55 +0000 2019,I deeply enjoyed this well thought out piece by Jason Farago about Indigenous Australian art...  https://t.co/sJ3OKzJuby via @NYTimes
1129515259247697900,Fri May 17 22:33:17 +0000 2019,Today’s cartoon post, from ⁦@Blisscartoons⁩ and me. https://t.co/fXRratHPRz
1129062263724417000,Thu May 16 16:33:15 +0000 2019,I can’t wait to see myself! In Rochester, among other places. https://t.co/OLkRYFLlOJ
1129046147333533700,Thu May 16 15:29:12 +0000 2019,Agreed. And I got my name mentioned! https://t.co/rbXWpMckWj
1129014547183001600,Thu May 16 13:23:38 +0000 2019,Today’s cartoon. ⁦@Blisscartoons⁩ https://t.co/Pe2MJdvwmB
1129013406248386600,Thu May 16 13:19:06 +0000 2019,RT @SebastianSmee: I enjoyed doing this piece about @SteveMartinToGo 's passion for Aboriginal art, and hope good things continue to come f…
1129004009233236000,Thu May 16 12:41:46 +0000 2019,I don’t know if this is behind a paywall, but I’m posting it anyway.  https://t.co/BZjFmLo60U
1128678130707779600,Wed May 15 15:06:50 +0000 2019,It’s cartoon time from me and ⁦@Blisscartoons⁩. https://t.co/23U78ZCDGr
1128355165445283800,Tue May 14 17:43:29 +0000 2019,Love this side-by-side of these two remarkable works. https://t.co/SFVSOjhpb9
1128333602062774300,Tue May 14 16:17:48 +0000 2019,We loved doing this interview in advance of our AUSTRALIAN TOUR in November. Thanks, Andrew Denton’s! https://t.co/NKaZ2UNqpG
1127957146015023100,Mon May 13 15:21:54 +0000 2019,Today’s cartoon from Harry and me. @Blisscartoons https://t.co/Df17r8jxih
1127748697595547600,Mon May 13 01:33:36 +0000 2019,RT @marshall_steven: The spectacular artwork from leading Indigenous Australian desert painters are on display at the @Gagosian in New York…
1126974111702552600,Fri May 10 22:15:41 +0000 2019,RT @johncarty77: Tjumpo Tjapanangka was an epic artist. His navigation of art, abstraction and the Dreaming was sublime and grounded in dee…
1126490761002987500,Thu May 09 14:15:01 +0000 2019,A cartoon for the day from Harry Bliss and me. ⁦@Blisscartoons⁩ https://t.co/6XadWfKb0A
1126477751396048900,Thu May 09 13:23:19 +0000 2019,Thanks, Wichita (if a city can be thankable), for a great evening and riotous, rockin’ audience. Tonight Kansas Cit… https://t.co/lnhEiVqbll
1126185737324507100,Wed May 08 18:02:57 +0000 2019,Marty and I - in better days - doing Stan and Ollie. Wichita tonight! Kansas City tomorrow! https://t.co/dB0yNa9vok
1125892418002399200,Tue May 07 22:37:25 +0000 2019,Now, this has five retweets. https://t.co/OaZZJ55HSU
1125508666592038900,Mon May 06 21:12:31 +0000 2019,I save it for the latter part of the show. Excitement builds for the audience. https://t.co/TA16BfKFls
1125490294038855700,Mon May 06 19:59:31 +0000 2019,You are correct. I’m going to Kansas City on Thursday. Sorry to excite a town prematurely. https://t.co/aCW7ITY4kk
1125488756906180600,Mon May 06 19:53:24 +0000 2019,Oops. Kansas City. https://t.co/dDvuMi3lH1
1125391185642700800,Mon May 06 13:25:42 +0000 2019,Marty and I are coming to Wichita on Wednesday, Oklahoma City on Thursday. Yes, I will be doing the pointing gestur… https://t.co/ILCRsbm7UP
1124709598282354700,Sat May 04 16:17:18 +0000 2019,Today’s cartoon from Harry and Steve. @Blisscartoons https://t.co/INpNnQuSRp
1124348474462494700,Fri May 03 16:22:20 +0000 2019,Actor Steve Martin Amassed a Stellar Collection of Australian Aboriginal Art at Warp Speed—and Now You Can See It a… https://t.co/56xZ70O1fO
1124321809489330200,Fri May 03 14:36:22 +0000 2019,Another cartoon from Harry and me. @Blisscartoons https://t.co/TctEOY6uPE
1124305568695574500,Fri May 03 13:31:50 +0000 2019,You can see our collection of Indigenous Australian desert artists opening today at Gagosian Bookstore Gallery.… https://t.co/f3UyfoOHpw
1123920594364444700,Thu May 02 12:02:05 +0000 2019,Here is today’s cartoon from Harry Bliss and me. @Blisscartoons https://t.co/xECebBBZ7x
1123709034446643200,Wed May 01 22:01:25 +0000 2019,Look out, Wichita and Kansas City. 8 &amp; 9th. https://t.co/MWU9uZQAql
1123698208243376100,Wed May 01 21:18:24 +0000 2019,Our Australian tour is now announced! Starts in November in Perth. Look how cute we are. https://t.co/kfE7601Yf4
1123345449241468900,Tue Apr 30 21:56:40 +0000 2019,Marty and I are now preparing for Wichita and Kansas City.  Concerned over packing for unknown temperature. Could b… https://t.co/YeFH3dM1Zh
1121831116359503900,Fri Apr 26 17:39:15 +0000 2019,We are so excited! Which means we have to be excited for five months. https://t.co/WLECH1d1E4
1121800669520977900,Fri Apr 26 15:38:16 +0000 2019,Another cartoon from Harry Bliss and me. ⁦@Blisscartoons⁩ https://t.co/giOGq9VtDM
1121606499405586400,Fri Apr 26 02:46:42 +0000 2019,“T” Just finishing the “far.” https://t.co/OmIWmKprHy
1121605652139343900,Fri Apr 26 02:43:20 +0000 2019,Ugh. Not complaining, just finishing the “tho.” Working on it! https://t.co/vdr2ZHyFDB
1121595606198304800,Fri Apr 26 02:03:25 +0000 2019,Busy night for Steve even though I’m just sitting here. https://t.co/ZfBKHW85Pe
1121593072478036000,Fri Apr 26 01:53:21 +0000 2019,I’m moving to Australia just so I can watch it! https://t.co/D2SG1BEy1R
1121004381128810500,Wed Apr 24 10:54:06 +0000 2019,Today’s cartoon from Harry Bliss and me. ⁦@Blisscartoons⁩ https://t.co/NqlPqUHQA5
1120670275086037000,Tue Apr 23 12:46:29 +0000 2019,I have realized that on this tour, Marty and I are only playing cities that are fun to say. Rochester is certainly… https://t.co/pLXp2Qavw4
1120465151327645700,Mon Apr 22 23:11:23 +0000 2019,Retweet, lose comma after first Wichita. https://t.co/OTHOzB9RQL
1120464671331500000,Mon Apr 22 23:09:29 +0000 2019,Coming to Wichita, and Kansas City soon. “Wichita” very fun to say; “Kansas City” less fun to say, but very self-ex… https://t.co/Yubz7SHeQc
1120461370691084300,Mon Apr 22 22:56:22 +0000 2019,You might enjoy this painting by the American 19th Century painter Frederic Church. 5.6 by 9.5 feet. Argh. So hard… https://t.co/E8bh4IvKq2
1120454865430503400,Mon Apr 22 22:30:31 +0000 2019,Be sure to see Marty and me in Wichita on May 8th! https://t.co/xXHC9WAAEP
1120345631959257100,Mon Apr 22 15:16:28 +0000 2019,Next stop, Wichita! May 8, Kansas City, May 9th. https://t.co/fTuBWR14t0
1120080969300574200,Sun Apr 21 21:44:47 +0000 2019,Any of you solvers get this? ⁦@Blisscartoons⁩ https://t.co/axhc1l4Ytp
1119795707223924700,Sun Apr 21 02:51:16 +0000 2019,Achieved by overcharging! https://t.co/42OTXuuxxq
1119791752548896800,Sun Apr 21 02:35:33 +0000 2019,Thank you, Peoria, for a great night! And thanks, too, for having such a fun name to say!
1119755188502433800,Sun Apr 21 00:10:15 +0000 2019,Unfortunately, that’s the show. Thanks for coming! https://t.co/Upatjx7vak
1119698933893206000,Sat Apr 20 20:26:43 +0000 2019,By the way, I’ve become an exclamation point person!
1119698735305457700,Sat Apr 20 20:25:56 +0000 2019,Marty and I are happy to be playing the gorgeous Peoria Civic Center theater tonight! The nation has beautiful thea… https://t.co/g5bzk93IzJ
1119594401028812800,Sat Apr 20 13:31:20 +0000 2019,Tonight, Peoria! Sensational audience last night in Milwaukee gave me confidence to have an egg-white frittata for… https://t.co/H13UkAdO4O
1119343464389460000,Fri Apr 19 20:54:12 +0000 2019,I‘m stymied by  the paywall, but the headlines are fantastic. Tonight, Milwaukee, tomorrow, Peoria! https://t.co/xxD0s2juRD
1119343115515629600,Fri Apr 19 20:52:49 +0000 2019,RT @AustraliaGreat: Hollywood actor Steve Martin 'completely taken' with Indigenous Australian art https://t.co/z5k4sDZnGe #indigenous
1119247871113670700,Fri Apr 19 14:34:21 +0000 2019,Today’s cartoon from Harry Bliss and me. ⁦@Blisscartoons⁩ https://t.co/E57mhp7GF8
1119228760392380400,Fri Apr 19 13:18:25 +0000 2019,Tonight, Milwaukee! https://t.co/Wr17EAKXcL
1119126161953476600,Fri Apr 19 06:30:44 +0000 2019,Despite its extra vowels, Marty and I are playing Milwaukee today, Friday. https://t.co/xPxR5AsvEl
