id,created_at,text
1259849176558559200,Mon May 11 14:13:45 +0000 2020,@Blisscartoons Today’s cartoon from Harry and me.
1259250557757190100,Sat May 09 22:35:03 +0000 2020,RT @sierrahull: Tune in tomorrow to #TheRoundup with @RounderRecords! I play songs from my new album and a surprise cover. Special guest ap…
1258932525805662200,Sat May 09 01:31:18 +0000 2020,I especially like my part. https://t.co/CNsXDAQ5Ly
1257305845399863300,Mon May 04 13:47:27 +0000 2020,Our latest cartoon! https://t.co/aSxrXgTExs
1256040131259031600,Fri May 01 01:57:58 +0000 2020,@SquidyUK Yes, George Gipe wrote with Carl Reiner and me. He was a talented but very quiet person. Once we had lunc… https://t.co/1N0N12uAN5
1255980271842689000,Thu Apr 30 22:00:06 +0000 2020,I never wanted a mullet, but now I’ve got one.
1255139414293930000,Tue Apr 28 14:18:50 +0000 2020,Banjo finale/The Great Remember https://t.co/am424ScrPa
1254075129409097700,Sat Apr 25 15:49:45 +0000 2020,Today’s cartoon from ⁦@Blisscartoons⁩ and me. https://t.co/GJaAyfLXkW
1252819320704389000,Wed Apr 22 04:39:36 +0000 2020,Night owl banjo. https://t.co/4B6HeeljIl
1252795049785479200,Wed Apr 22 03:03:10 +0000 2020,Here’s what we’ve seen so far in our driveway in California: the Fed-Ex guy, the UPS guy, a bobcat, and the air conditioning mechanic.
1252354162286710800,Mon Apr 20 21:51:14 +0000 2020,Wow! Exciting. I’m always the last to know! https://t.co/lOmjNJqg5J
1251892878567043000,Sun Apr 19 15:18:15 +0000 2020,Wow. https://t.co/3T4bJYpxM5
1251551464050188300,Sat Apr 18 16:41:36 +0000 2020,The odds that a person is standing in the exact spot you want to go to in the kitchen is now 80%.
1250979288670601200,Fri Apr 17 02:47:59 +0000 2020,@belafleckbanjo Thank you, Bela!
1250855357238272000,Thu Apr 16 18:35:31 +0000 2020,Banjo sky https://t.co/Na52pFi8Jk
1250782494862921700,Thu Apr 16 13:45:59 +0000 2020,Today’s cartoon from ⁦@Blisscartoons⁩ and me. https://t.co/CDjuPVO89D
1250227951196463000,Wed Apr 15 01:02:26 +0000 2020,It’s the little things. https://t.co/XSUqvmadTM
1248063318733910000,Thu Apr 09 01:40:57 +0000 2020,I’ve munched there many times. https://t.co/bJSMZ4T5vj
1247894906149855200,Wed Apr 08 14:31:45 +0000 2020,Today’ cartoon from ⁦@Blisscartoons⁩ and me. https://t.co/PZviducaVG
1245564928682942500,Thu Apr 02 04:13:15 +0000 2020,@TerryTeachout1 @hekasia So sorry to hear.
1245455571668463600,Wed Apr 01 20:58:42 +0000 2020,@ThePublicSA @ebnewbohemians @TRWMusicals @TheActorsFund @ActorsEquity @SethRudetsky @TheEllenShow @lianamariehunt… https://t.co/pJ6r6UfUfR
1244825391107158000,Tue Mar 31 03:14:35 +0000 2020,Ireland and Scotland do melancholy very well.  https://t.co/9nDXEXuPIV
1243329747125297200,Fri Mar 27 00:11:26 +0000 2020,Banjo calm. https://t.co/kAhRbMyfUp
1241449753696583700,Sat Mar 21 19:41:00 +0000 2020,Love your playing, too! https://t.co/atvKStBBtn
1241408095579857000,Sat Mar 21 16:55:28 +0000 2020,Banjo balm. https://t.co/eQ6jUkHSHm
1241361164329578500,Sat Mar 21 13:48:59 +0000 2020,Today’s cartoon from @Blisscartoons and me: https://t.co/wU3yMwJTs0
1241046204504404000,Fri Mar 20 16:57:27 +0000 2020,Through the years, I’ve loved bluegrass and folk music, and I’ve collected some of my favorites here: https://t.co/HwSLxLZ2Jo
1240689083791229000,Thu Mar 19 17:18:23 +0000 2020,Isolation has led me to discover something about myself: I don’t throw away old magazines. https://t.co/40HmfHfn2Z
1239689337031311400,Mon Mar 16 23:05:44 +0000 2020,RT @SteepCanyon: #Steepcanyonrangers https://t.co/Vg9pQksldM
1239584144205766700,Mon Mar 16 16:07:44 +0000 2020,A tiny light for today.... https://t.co/4uKo2lBFdM
1238953920703103000,Sat Mar 14 22:23:28 +0000 2020,You mean, continue on? https://t.co/VFmYgDXyNd
1238629283993718800,Sat Mar 14 00:53:28 +0000 2020,Glorious. https://t.co/RT8aKUk2G8
1238611013764776000,Fri Mar 13 23:40:52 +0000 2020,The latest from Harry and me. https://t.co/JxW8vQ96I8
1238606147013283800,Fri Mar 13 23:21:32 +0000 2020,Good for the sole, as in self-isolators. https://t.co/0Mas9bUsWb
1238488555598553000,Fri Mar 13 15:34:16 +0000 2020,This is on the Royal Albert Hall website: We are sorry to announce that the Steve Martin and Martin Short shows on… https://t.co/z1rQ1PqKMK
1238459363016224800,Fri Mar 13 13:38:16 +0000 2020,Dear London Royal Albert Hall tickets holders...we will have an announcement soon about our shows Saturday and Sunday. Stay tuned.
1238058396236071000,Thu Mar 12 11:04:58 +0000 2020,Refunds addressed at point of sale.
1238058251876479000,Thu Mar 12 11:04:23 +0000 2020,Dear Belfast ticket-holders, in light of the ever-evolving global situation, Marty and I have decided to postpone o… https://t.co/7zzFovtyIi
1238051148193509400,Thu Mar 12 10:36:10 +0000 2020,Announcement shortly about tonight’s Belfast show....stay tuned.
1237691361735966700,Wed Mar 11 10:46:30 +0000 2020,Yee Haw! Yes, a cartoon collection from Harry and me. https://t.co/Vn4pILmPre
1237340851996700700,Tue Mar 10 11:33:42 +0000 2020,We’ll be there, all dressed up! https://t.co/9EqMJYClj9
1237101388452241400,Mon Mar 09 19:42:09 +0000 2020,We are excited to get started in Glasgow! https://t.co/EX9uxo8rJR
1236380179179737000,Sat Mar 07 19:56:20 +0000 2020,As soon as the audience is seated, usually ten minutes after show time. NO OPENING ACT! https://t.co/8p8wFs7pRI
1236378867977371600,Sat Mar 07 19:51:07 +0000 2020,We are on! We start mostly on time, and there is no opening act. WE BEGIN! https://t.co/6xAat6cDep
1235717414806904800,Fri Mar 06 00:02:44 +0000 2020,Isn’t that immoral? https://t.co/HTYnaeZFdO
1232117577457062000,Tue Feb 25 01:38:16 +0000 2020,This is so obvious. https://t.co/2iVRbRxLqP
1232115990470840300,Tue Feb 25 01:31:58 +0000 2020,Name tags are pointless unless worn on the forehead.
1230265427122704400,Wed Feb 19 22:58:29 +0000 2020,Is that good? https://t.co/Rn4h00PmqJ
1230159864070131700,Wed Feb 19 15:59:01 +0000 2020,This is how I find out? You tell me?  https://t.co/mlAdiVrIPu
1229881484019933200,Tue Feb 18 21:32:50 +0000 2020,RT @NorthwellJBT: JUST ANNOUNCED: @SteveMartinToGo &amp; Martin Short: The Funniest Show in Town at The Moment live from the Beach on Friday, J…
1229881450582900700,Tue Feb 18 21:32:42 +0000 2020,RT @Sunny102_3: Just Announced! @SteveMartinToGo and Martin Short will be coming to @cmacevents on August 29th! Tickets go on-sale on Frida…
1229881403359350800,Tue Feb 18 21:32:31 +0000 2020,RT @cmacevents: JUST ANNOUNCED: @SteveMartinToGo &amp; Martin Short: The Funniest Show in Town at The Moment live from CMAC on Saturday, August…
1229030117663559700,Sun Feb 16 13:09:48 +0000 2020,This cartoon by @Blisscartoons and me is up for auction for the benefit of the Cartoon Art Museum! Yay us! https://t.co/a4iOuJkISu
1228092565985124400,Thu Feb 13 23:04:19 +0000 2020,I just had an incredible idea: Buy low, sell high.
1227742147119665200,Wed Feb 12 23:51:52 +0000 2020,I didn’t spot a thing! I thought I was making a joke. https://t.co/kwewYq94aJ
1227726901122392000,Wed Feb 12 22:51:17 +0000 2020,I love grammar and usage, but feel I’ve gotten worse at it as time grows on. https://t.co/V2lNBUsX86
1227725831419592700,Wed Feb 12 22:47:02 +0000 2020,I was drunk. https://t.co/O8dEnFysv6
1227031620915540000,Tue Feb 11 00:48:30 +0000 2020,Just asking: When did the word “mocks” replace “kids about” or “satirizes?” Since clickbait?
1226675753913217000,Mon Feb 10 01:14:24 +0000 2020,Make that Erivo!
1224833572865036300,Tue Feb 04 23:14:14 +0000 2020,Go team! https://t.co/RnJgBHORwD
1224808157043724300,Tue Feb 04 21:33:15 +0000 2020,Yep. I blew it. https://t.co/jehFyFIv6J
1224801897841938400,Tue Feb 04 21:08:22 +0000 2020,Love these rare birds I saw today at MOMA: Lee Bontecou, Kaspar Malevich, and John Covert https://t.co/8zTKVdYeEf
1223927153282232300,Sun Feb 02 11:12:27 +0000 2020,A cartoon from Harry Bliss and me. https://t.co/DevMu3LlhT
1223258344716230700,Fri Jan 31 14:54:51 +0000 2020,So, daily Spelling Bee, “Clickbait” is not a word? You’ve got to get out more. https://t.co/xH15rCpWqk
1222872474037244000,Thu Jan 30 13:21:32 +0000 2020,Here we are on Colbert last night: https://t.co/8NmK6FLP0Z
1222870216767570000,Thu Jan 30 13:12:34 +0000 2020,Had a great time on The Late Show last night, doing the banjo thang with @SteepCanyon! https://t.co/pOmfF1B04q
1222688891909656600,Thu Jan 30 01:12:02 +0000 2020,This is not in error. https://t.co/9GGZsD08OL
1222606709623066600,Wed Jan 29 19:45:29 +0000 2020,Preparing for our appearance tonight on Colbert; great shot of me frowning. https://t.co/HUeLhEUTJA
1222587742678286300,Wed Jan 29 18:30:07 +0000 2020,@TinaLynn64 @Blisscartoons It was a perfect retweet.
1222579573163995100,Wed Jan 29 17:57:39 +0000 2020,Tonight on Colbert @SteepCanyon and myself playing our new hit single, California! .. https://t.co/Q4Ud4WWGTQ via… https://t.co/L9zfVsvWBO
1222305647208935400,Tue Jan 28 23:49:10 +0000 2020,Yes, tomorrow night (That’s Wednesday night. https://t.co/aUvuBCzmh9
1222122293935198200,Tue Jan 28 11:40:35 +0000 2020,Yesterday’s cartoon from ⁦@Blisscartoons⁩ and me. https://t.co/g08EgHFJck
1221810283859017700,Mon Jan 27 15:00:46 +0000 2020,Yes, our new single will have its TV premier on Colbert on Wednesday. No exclamation point needed, as the news is e… https://t.co/aSdKVw3jKw
1221809315784396800,Mon Jan 27 14:56:55 +0000 2020,Mr. Fancy Pants. https://t.co/PMCdASg8Zu
1221779488247308300,Mon Jan 27 12:58:24 +0000 2020,A great weekend in Florida with master musicians! Next stop, the UK with @steepcanyon https://t.co/qd43aVcKp9
1221445322347569200,Sun Jan 26 14:50:32 +0000 2020,Going out on a limb here, but doorbells and phone rings should be banned in TV commercials.
1221109257640214500,Sat Jan 25 16:35:08 +0000 2020,I was hoping someone would catgut us! https://t.co/roCLTESPRe
1221109113045897200,Sat Jan 25 16:34:34 +0000 2020,Great show last night with the First Ladies of Bluegrass! And the guy on the right. https://t.co/V4MIEwYVNm
1220330939382976500,Thu Jan 23 13:02:23 +0000 2020,Weird phenomenon: Everytime I tweet this link, the view of my new song/video increase. Correlation? https://t.co/Q4Ud4WWGTQ via @YouTube
1220122188189241300,Wed Jan 22 23:12:53 +0000 2020,I deleted the last tweet because our performance on Colbert is on JANUARY 29TH, not February. @SteepCanyon
1220024915618861000,Wed Jan 22 16:46:21 +0000 2020,OMG (Oh my God), so funny. Salute to Terry Jones. https://t.co/1SK3dRwspf
1219472589770367000,Tue Jan 21 04:11:36 +0000 2020,See you soon, Becky! https://t.co/EjUoF1C3K4
1218906515672916000,Sun Jan 19 14:42:14 +0000 2020,Very nice! https://t.co/MtluEKhmJQ
1218250397061722000,Fri Jan 17 19:15:03 +0000 2020,So great to have written and recorded a song that fits into no known genre! https://t.co/Q4Ud4WWGTQ
1218249894131044400,Fri Jan 17 19:13:03 +0000 2020,I’m starting to look like my caricature. https://t.co/rJGSifbj3N
1218249528580747300,Fri Jan 17 19:11:36 +0000 2020,This is actually quite true. https://t.co/DqRnckFvma
1217431168402018300,Wed Jan 15 12:59:43 +0000 2020,First post was too blurry. Trying again. ⁦@Blisscartoons⁩ https://t.co/BBoMHRWYtP
1217135139085586400,Tue Jan 14 17:23:25 +0000 2020,“Catchy + infections!” https://t.co/YZ28naap9z
1216744846024749000,Mon Jan 13 15:32:31 +0000 2020,New song/video “California” flirting with number 1 in the arctic charts! @SteepCanyon https://t.co/Q4Ud4WWGTQ via @YouTube
1216505579600011300,Sun Jan 12 23:41:46 +0000 2020,Here’s our new song on the Rounder site with no ads! @SteepCanyon https://t.co/rmcWyP0quZ
1216096221993021400,Sat Jan 11 20:35:07 +0000 2020,We must be a hit! Our YouTube video now has ads. https://t.co/Q4Ud4WWGTQ
1216008882742538200,Sat Jan 11 14:48:04 +0000 2020,Our new single continues to climb the charts that are in my head! Go “California!” @SteepCanyon Produced by the mas… https://t.co/qZn2xczP27
1215717527482925000,Fri Jan 10 19:30:20 +0000 2020,Final tweet of the day regarding our new single and video, “California.”  It’s turning into a monster hit! (Remembe… https://t.co/3B3YP7e1Nu
1215708249367945200,Fri Jan 10 18:53:28 +0000 2020,Thank you Rolling Stone. I will continue to send you compromising information about my friends.  https://t.co/RQu61P9eZP
1215684892257857500,Fri Jan 10 17:20:39 +0000 2020,Think Robert Preston in the Music Man. Wait, you’re too young. https://t.co/O2U0rluQVi
1215682219387342800,Fri Jan 10 17:10:02 +0000 2020,My whole new idea of using Twitter for promotion is catching on. I see others copying.... https://t.co/SGpn6WjQTe
1215665251116572700,Fri Jan 10 16:02:36 +0000 2020,So California is stirring, thus, here is my new single with @SteepCanyon, produced by Peter Asher, “California.”… https://t.co/7TWvmhC57X
1215664374804861000,Fri Jan 10 15:59:07 +0000 2020,And I love We Banjo 3! Missed you at Merlefest one year and I’ve rued it ever since. https://t.co/JDXejth8j1
1215632001228734500,Fri Jan 10 13:50:29 +0000 2020,Just had a revelation! I can tweet the video now for those awake, and tweet it later for California! Here’s our new… https://t.co/KZC3Ecl3yv
1215621207057404000,Fri Jan 10 13:07:35 +0000 2020,I’ll link to our new song today, but since its title is “California,” I’ll wait till California is awake to do it.… https://t.co/oylfPjP8fH
1215589755150372900,Fri Jan 10 11:02:36 +0000 2020,Even though it’s “single release day,” here’s a new cartoon from @Blisscartoons and me. https://t.co/1j1mdqurrC
1215417464005255200,Thu Jan 09 23:37:59 +0000 2020,Here’s a momentous teaser for our new single, “California,” coming out tomorrow. ⁦@SteepCanyon⁩  https://t.co/KgUVcs1LDj
1215341916792987600,Thu Jan 09 18:37:47 +0000 2020,Vlog and flow both failed, and yet, genius. https://t.co/FCht9s5c9g
1215312157686096000,Thu Jan 09 16:39:32 +0000 2020,I’m just learning that Twitter can be used for promotion! https://t.co/JQkid8fAlx
1215286472711995400,Thu Jan 09 14:57:28 +0000 2020,Yes, tomorrow is release day for our new hit single. @SteepCanyon. Take heed as this is probably the only promotion… https://t.co/MzXHlEhtiY
1215006311617892400,Wed Jan 08 20:24:13 +0000 2020,@mortgerberg Yeah, man. Love it.
1214674962738491400,Tue Jan 07 22:27:33 +0000 2020,Today’s cartoon. https://t.co/F9cgY6j6Qg
1214633474885378000,Tue Jan 07 19:42:41 +0000 2020,My new single with @SteepCanyon drops on January 10, just in time for the holidays! https://t.co/MtvUh4Y55u
1214167296857575400,Mon Jan 06 12:50:16 +0000 2020,Today’s cartoon from @Blisscartoons and Steve (Martin). https://t.co/64z1Ukmfc2
1212877253815746600,Thu Jan 02 23:24:06 +0000 2020,Oops on the second semicolon. https://t.co/4KFO6BQMcu
1212876210885288000,Thu Jan 02 23:19:57 +0000 2020,@BanjoMuseum The Mark Twain award made this remarkable Gibson banjo for me; yes, that’s the Kennedy Center inlaid o… https://t.co/LZfg1aZPOu
1212814041682522000,Thu Jan 02 19:12:55 +0000 2020,The light on the stone thingy has pros reeling. https://t.co/zDchSrmxbk
1212801378885808000,Thu Jan 02 18:22:36 +0000 2020,News for my bluegrass followers. @SteepCanyon and I will have a new single on January 10th, “California.” Less details to follow!
1212403095457714200,Wed Jan 01 15:59:57 +0000 2020,A little piece of my teen years. Thanks, Daveland!  https://t.co/0XS8z3rTJI
1211711426043269000,Mon Dec 30 18:11:31 +0000 2019,Indeed! https://t.co/YuJxQ00hiN
1211405091925835800,Sun Dec 29 21:54:15 +0000 2019,This is absolutely true. People in California should book their flights early. Probably best through Toronto, drive… https://t.co/sNnk4jicbJ
1209986837177131000,Wed Dec 25 23:58:37 +0000 2019,A laughing dumpling is problematic for me. https://t.co/kUFrBDDGqz
1209985423029801000,Wed Dec 25 23:52:59 +0000 2019,It’s called anarchy. https://t.co/SbViBDJz6G
1209984556046209000,Wed Dec 25 23:49:33 +0000 2019,OMG. https://t.co/a1fAXx6pWv
1209982469224718300,Wed Dec 25 23:41:15 +0000 2019,When I describe our family’s traditional Christmas Day dinner, I always hear an envious *sigh.* https://t.co/oivNkegOd5
1209968628118016000,Wed Dec 25 22:46:15 +0000 2019,This is actually the case. https://t.co/CsySEjAJsw
1209497398990561300,Tue Dec 24 15:33:45 +0000 2019,A holiday cartoon from @Blisscartoons and me. https://t.co/cRuMHh09pY
1207821116489773000,Fri Dec 20 00:32:49 +0000 2019,Yup. https://t.co/m6IynGGg5S
1207083975874879500,Tue Dec 17 23:43:41 +0000 2019,Question. “Which” or “that?” https://t.co/ugox4Kls48
1207075322237198300,Tue Dec 17 23:09:17 +0000 2019,When I took my driver’s license photo this morning, the clerk said, “Do you want to go into the restroom and fix yo… https://t.co/iuZblDpsft
1207071021972500500,Tue Dec 17 22:52:12 +0000 2019,@deborahsolo @museodelprado An important essay by Deborah Solomon about my newest favorite painting, which, to me,… https://t.co/UCQ2Cup6tl
1204862745650376700,Wed Dec 11 20:37:18 +0000 2019,Free tickets! Wait, hold on there.... https://t.co/MbmPxl593V
1204169899465158700,Mon Dec 09 22:44:11 +0000 2019,I love that the Grammy Award winning group I’ve worked with for ten years is making huge waves, again, on the chart… https://t.co/phktZulSOg
1204122240478040000,Mon Dec 09 19:34:48 +0000 2019,It’s true. From the 70s. https://t.co/0Aqei1XG6g
1203181739268423700,Sat Dec 07 05:17:35 +0000 2019,I so get it. https://t.co/L59sMJ3C2D
1203181660268662800,Sat Dec 07 05:17:16 +0000 2019,And this is me when I was young. https://t.co/Kkn3MhDxjh
1202315498307887000,Wed Dec 04 19:55:27 +0000 2019,Listen and learn! https://t.co/aEycRcCJMo
1200514279729963000,Fri Nov 29 20:38:03 +0000 2019,My favorite boy band has a new record! https://t.co/lXiegdx8KX
1200182507389542400,Thu Nov 28 22:39:42 +0000 2019,I so wish I could send John candy this review. https://t.co/Q1t6cg9aKL
1199842467228651500,Thu Nov 28 00:08:30 +0000 2019,The radius is so obvious. But, nevermind, I’m just a comedian. https://t.co/8iIsjp9AB1
1199840846675402800,Thu Nov 28 00:02:04 +0000 2019,OMG. Donald Trump, Fred Armisen and a guy. https://t.co/Ex6Xopoqhr
1199838653582913500,Wed Nov 27 23:53:21 +0000 2019,I’m featured! https://t.co/6c2UxTWV4n
1199838345251229700,Wed Nov 27 23:52:08 +0000 2019,I’m pretty sure I said that tomorrow. https://t.co/lB7cp5xKuU
1199510085610954800,Wed Nov 27 02:07:44 +0000 2019,RT @TWiT: No joke. @SteveMartinToGo now knows what USB-C is and how to pick the right cable because he Ask(ed) The Tech Guy. You don't have…
1198775132090704000,Mon Nov 25 01:27:18 +0000 2019,Hey, hang on there, wait just a second.... https://t.co/U7I4juWFk3
1198056923997855700,Sat Nov 23 01:53:24 +0000 2019,Now tweeting from an unknown location. https://t.co/UHWJSM1qBi
1197256760865636400,Wed Nov 20 20:53:50 +0000 2019,Today’s cartoon! https://t.co/Fp0J0uJPA3
1196400841067913200,Mon Nov 18 12:12:43 +0000 2019,Masterpiece. https://t.co/inMobVUqlR
1196304229100486700,Mon Nov 18 05:48:49 +0000 2019,So interesting to have become a major photographer with only one photo. https://t.co/mq4xT4QG1c
1196218615822815200,Mon Nov 18 00:08:37 +0000 2019,We LOVED our whole tour of Australia! Audiences great, food great, art great, weather great. And our sold-out show… https://t.co/Y9juhZFkAB
1195891008065556500,Sun Nov 17 02:26:49 +0000 2019,It is fabulous. Thanks so much. https://t.co/y9grLgnEKX
1195886904153034800,Sun Nov 17 02:10:31 +0000 2019,'Bright Star' shines with bluegrass and a little magic | Arts and Entertainment | Your Observer https://t.co/RtIi49toAn
1195835226968203300,Sat Nov 16 22:45:10 +0000 2019,Yep, our cartoon for the day. https://t.co/6oZ3u5nFtY
1195549510434353200,Sat Nov 16 03:49:50 +0000 2019,now tweeting from a secret location. https://t.co/9FF4H6H5Xl
1194556353966002200,Wed Nov 13 10:03:23 +0000 2019,I loved my visit to this beautiful and very active museum. I learned a lot that I didn’t know...wait, that’s redund… https://t.co/ha3dAlFuTa
1194503457891160000,Wed Nov 13 06:33:11 +0000 2019,Uh, we were in Perth four days ago. https://t.co/ap5SfrBH3o
1194479118311575600,Wed Nov 13 04:56:28 +0000 2019,A new bit keeps performers alive. https://t.co/iAU4oqb21t
1194477950885757000,Wed Nov 13 04:51:50 +0000 2019,I could have drawn it in a snap. https://t.co/amqMt5Helz
1194411842908504000,Wed Nov 13 00:29:09 +0000 2019,I never tweet laudatory reviews.Oops. Finger slip. Steve Martin and Martin Short in Adelaide review: A masterclass… https://t.co/B6CWvmm3LN
1194230888617238500,Tue Nov 12 12:30:06 +0000 2019,Already evil things are happening. https://t.co/cPketV11tx
1194230611923193900,Tue Nov 12 12:29:00 +0000 2019,The hat is the star on the California flag. FYI. https://t.co/zHzA4frmcy
1194223113719828500,Tue Nov 12 11:59:12 +0000 2019,Can you read this in a hotel shower without glasses? Is it body lotion, or is it poison? https://t.co/TuW1IN0YVb
1194194742147313700,Tue Nov 12 10:06:28 +0000 2019,A few empty seats tonight at our show in Brisbane. Okay, maybe it was U2. https://t.co/CJYfK0KJp6
1194106711021379600,Tue Nov 12 04:16:39 +0000 2019,Australian audiences are very affectionate! https://t.co/WzBjZ5dYdx
1193773931888611300,Mon Nov 11 06:14:19 +0000 2019,Guess what country I’m in. https://t.co/ZiGQunbGax
1193437075795656700,Sun Nov 10 07:55:46 +0000 2019,This photo is what comedy is all about. https://t.co/mzxeAA2SDL
1193137747961110500,Sat Nov 09 12:06:21 +0000 2019,Marty and I are loving our Australian tour! https://t.co/vkRVgqWOhP
1192701380693115000,Fri Nov 08 07:12:23 +0000 2019,If you like paywalls, you’ll love this interview!  We’re in Perth TONIGHT. https://t.co/unUt7WCcxF
1192673623439396900,Fri Nov 08 05:22:05 +0000 2019,Congrats on what is evidently a wonderful production: BWW Review: Hatty Ryan King's Star Shines Brightly in Lipscom… https://t.co/jHKmj81kmi
1192197075275935700,Wed Nov 06 21:48:27 +0000 2019,Our latest.... https://t.co/WAIUg3OrBq
1191473211063488500,Mon Nov 04 21:52:04 +0000 2019,Our latest.... https://t.co/Jsop9vD1Ux
1190606501683060700,Sat Nov 02 12:28:05 +0000 2019,The latest cartoon from us two guys. https://t.co/BaYcyBWx1x
1188460214330318800,Sun Oct 27 14:19:30 +0000 2019,Go to a nail salon and ask for acrylic nails. You only need one or two depending on your playing style. The nail wi… https://t.co/vbEUIAY28e
1187910537222541300,Sat Oct 26 01:55:17 +0000 2019,We all love Tim! https://t.co/FOQzUGCfJA
1187910373237768200,Sat Oct 26 01:54:37 +0000 2019,“I retweet, I retweet, I retweet,”is the new “location, location, location.” https://t.co/Lb0JJ45muL
1187890094180589600,Sat Oct 26 00:34:03 +0000 2019,I love the work of Allegheny. https://t.co/Bw3osWGxYP
1187888764082888700,Sat Oct 26 00:28:45 +0000 2019,I confess I have rhymed “sauna” with “marijuana.” And also, “amigos” with “Speedos.” https://t.co/LC9n9NzZ90
1186056411089965000,Sun Oct 20 23:07:38 +0000 2019,I never retweet good reviews. OOPS. https://t.co/ncGkeYEyzQ
1186033059138850800,Sun Oct 20 21:34:51 +0000 2019,Clearly they are actors. https://t.co/pGsdB4yAy6
1185791297589862400,Sun Oct 20 05:34:10 +0000 2019,Just found this photo of Emmylou Harris and me. Great memories. Of being thin. https://t.co/W56ZGAe9ew
1185646749588873200,Sat Oct 19 19:59:48 +0000 2019,Tonight, in Atlantic City! https://t.co/O80zIVjo38
1185646640037875700,Sat Oct 19 19:59:21 +0000 2019,That’s a great compliment considering I was saddled with Marty Short. https://t.co/28WNPonbcH
1185646507191623700,Sat Oct 19 19:58:50 +0000 2019,I’m sure I was with @SteepCanyon. Have a great show with those dang banjos. https://t.co/9QsBo5wxW9
1184525933832790000,Wed Oct 16 17:46:04 +0000 2019,RT @BBCSounds: Actor and comedian Steve Martin searches the extraordinary collection of the @MuseumModernArt and finds two works that speak…
1184525882381213700,Wed Oct 16 17:45:52 +0000 2019,Very enjoyable for me to do! https://t.co/x6rSGKGgUY
1184108855283732500,Tue Oct 15 14:08:45 +0000 2019,Today’s cartoon from ⁦@Blisscartoons⁩ and me.  https://t.co/SCr9MW4ExP
1183877187524366300,Mon Oct 14 22:48:11 +0000 2019,This is accurate. I love accuracy. https://t.co/LmV2URTBao
1183054273447374800,Sat Oct 12 16:18:13 +0000 2019,RT @deborahsolo: I wrote about the new MoMA, and what to do when the Modern is no longer modern, for the ⁦@NYTmag⁩.  https://t.co/zQ9B2PAVOW
1182790727660687400,Fri Oct 11 22:50:59 +0000 2019,Congrats! https://t.co/63sRDknVLl
1182627806272016400,Fri Oct 11 12:03:35 +0000 2019,I’m enjoying my collaboration with ⁦@Blisscartoons⁩! https://t.co/dCLSKj1ud2
1182115967712862200,Thu Oct 10 02:09:44 +0000 2019,Hopper may be the master of isolation, but he’s also the master of windows. https://t.co/kehNvbFxyP
1182023013916708900,Wed Oct 09 20:00:22 +0000 2019,Today’s cartoon! https://t.co/wwdTREI0H4
1181322385909325800,Mon Oct 07 21:36:19 +0000 2019,Isn’t the multipack, though, for cowards? https://t.co/pilWOCO5vx
1181321774572740600,Mon Oct 07 21:33:53 +0000 2019,FYI, this was in my Amazon recommendations. https://t.co/xMq9tGoZKB
1181311730128949200,Mon Oct 07 20:53:58 +0000 2019,We are simply a catalyst. https://t.co/Af2Ij6DcBT
1181310964723064800,Mon Oct 07 20:50:56 +0000 2019,I knew about them last year but who the hell is going to listen to me? https://t.co/75eB1K3qk7
1181108100759031800,Mon Oct 07 07:24:49 +0000 2019,How dare you insult us in this way. Wait, let me re-read. https://t.co/AFVeHw9ChB
1180189413080367000,Fri Oct 04 18:34:17 +0000 2019,And what about this vase, given to me over 40 years ago? https://t.co/ojyWfUixm2 https://t.co/vS3zRlR1nM
1179927904622276600,Fri Oct 04 01:15:09 +0000 2019,Here’s the cartoon that started it all between ⁦@Blisscartoons⁩ and me. https://t.co/BtkO9A8N3L
1179910583119794200,Fri Oct 04 00:06:19 +0000 2019,I guess I’m doing better than I thought: “Steve Martin and Lauren Yee are among America's most popular playwrights… https://t.co/rIKVo9WgFh
