id,created_at,text
1259081622927954000,Sat May 09 11:23:46 +0000 2020,I had a few people comment after last week that 21km is not a half marathon (I had no idea) so I completed my 21.10… https://t.co/swqt7rf7JT
1257260663883194400,Mon May 04 10:47:55 +0000 2020,I am excited to start my partnership with @Trade360_LTD, this technology is truly amazing https://t.co/gf11Blv6qn
1254689573512282000,Mon Apr 27 08:31:19 +0000 2020,DreamLab has refocused its efforts to help fight COVID-19. We can all help while we sleep. All you have to do is do… https://t.co/HZFrrzxI6q
1252836088739061800,Wed Apr 22 05:46:14 +0000 2020,Just a little bit of #isobatting to keep up the hand-eye coordination #cricketdrill #stayhome #stayactive https://t.co/DuB2lw6zzt
1250355110057631700,Wed Apr 15 09:27:43 +0000 2020,Very sad to say goodbye to our little family member. Charlie was so loving, loyal and just an all round legend. I m… https://t.co/cBjwAre5hy
1242658183635767300,Wed Mar 25 03:42:53 +0000 2020,Stay safe everyone @newbalance #wegotnow https://t.co/qsyRwsBYbQ
1238014901274194000,Thu Mar 12 08:12:08 +0000 2020,Great night on Tuesday with dani_willis at thetest_amazon Premiere https://t.co/bSdlkWRStG
1236620116575555600,Sun Mar 08 11:49:45 +0000 2020,Congratulations @southernstars team for another amazing World Cup win. You set the standard for the women’s game ag… https://t.co/hztMg3OZuw
1229705557734387700,Tue Feb 18 09:53:46 +0000 2020,Humbling experience visiting Pumla school for learners with special educational needs. Lovely people that didn’t st… https://t.co/gcsjixXds7
1228340825702195200,Fri Feb 14 15:30:48 +0000 2020,Happy Valentine’s Day dani_willis I hope you’ve had a great day. I love you 😍 💓 https://t.co/E0Cgjq4sEu
1227010076642291700,Mon Feb 10 23:22:53 +0000 2020,Fantastic night at the Australian cricket awards last night.   Thank you to harroldsaus for this beautiful Tom Ford… https://t.co/CxtQAjXsal
1226743170244980700,Mon Feb 10 05:42:18 +0000 2020,Off to the Australian cricket awards with dani_willis who is looking stunning https://t.co/QXfvMtdjgW
1226326179742773200,Sun Feb 09 02:05:19 +0000 2020,Have loved playing for the @sixersbbl the last couple of weeks. It has been such great fun and Brilliant to win las… https://t.co/PEBWk2LgBe
1223056810317357000,Fri Jan 31 01:34:01 +0000 2020,Date night at the tennis with dani_willis watching an amazing match between Nadal and Thiem 🎾 https://t.co/8W11Kr8aCY
1221318664806289400,Sun Jan 26 06:27:15 +0000 2020,Happy Australia Day 🇦🇺 🎉 https://t.co/6pyr89hv7W
1220215827384995800,Thu Jan 23 05:24:58 +0000 2020,Looking forward to wearing the @sixersbbl magenta tonight. It’s been a while... https://t.co/aN24HTfKyY
1218027648816963600,Fri Jan 17 04:29:55 +0000 2020,Happy birthday dani_willis I hope you have a great day. I love you 💓 🥳 🎉 https://t.co/DCILw9V78U
1215653842165096400,Fri Jan 10 15:17:16 +0000 2020,The Australian Test summer comes to an end. Loved every minute of it. Looking forward to the next few weeks in Indi… https://t.co/8hcrwn0tOh
1215652592199635000,Fri Jan 10 15:12:18 +0000 2020,Celebrating the end of the Test summer with dani_willis thanks for your support ❤️ https://t.co/KBHBHek1AU
1212330172822773800,Wed Jan 01 11:10:11 +0000 2020,New Year’s Day with the wife https://t.co/NfbpWvFMeR
1212258474354077700,Wed Jan 01 06:25:17 +0000 2020,Thanks for having us @scottmorrisonmp dani_willis https://t.co/VUh86E7C2l
1212202437911531500,Wed Jan 01 02:42:37 +0000 2020,Happy new year from dani_willis and I. Can’t wait to see what 2020 has in store for us! https://t.co/ZNHNyjcpI7
1211432690538471400,Sun Dec 29 23:43:55 +0000 2019,Congratulations @petersiddle403 on an amazing international career. A consummate professional and one of the great… https://t.co/EVhEMb0qKZ
1209765507773214700,Wed Dec 25 09:19:08 +0000 2019,When you can’t get enough of cricket @Lca490 I’ll see you for a game soon! #notsosecretsanta https://t.co/R9bAbw3RDc
1209693749514821600,Wed Dec 25 04:33:59 +0000 2019,Merry Christmas everyone! dani_willis 🎅🎄 https://t.co/v10iqL07rR
1209426194720006100,Tue Dec 24 10:50:49 +0000 2019,Throwback to this time last year watching the Ice Hockey in New York with dani_willis 🏒 https://t.co/Fzma0ROs8H
1207566003292512300,Thu Dec 19 07:39:05 +0000 2019,Great day out at @KoalaMattress headquarters checking out all the new products https://t.co/4Wtsabb9MQ
1207176798167019500,Wed Dec 18 05:52:31 +0000 2019,Thanks for the hit @13dsmith 360_cricketacademy https://t.co/HeTX5Y50N0
1206837951025614800,Tue Dec 17 07:26:04 +0000 2019,I’m proud to be a part of Team NB and support the incredible work the NB Foundation has done impacting children and… https://t.co/SG5YNXirnM
1206545212782321700,Mon Dec 16 12:02:49 +0000 2019,Great start to the series in Perth. Can’t wait for Boxing Day! @ryanpierse https://t.co/6grMlvswM1
1201673208400756700,Tue Dec 03 01:23:13 +0000 2019,Great series win https://t.co/1Yn4ONkaUg
1200942038297919500,Sun Dec 01 00:57:49 +0000 2019,The great ‘nugget’ very happy with his new shoes. Thanks newbalanceaustralia https://t.co/2xWIROjGUM
1199447786460041200,Tue Nov 26 22:00:11 +0000 2019,Miss you bro #408 https://t.co/2ScN53azCp
1197009303514824700,Wed Nov 20 04:30:31 +0000 2019,All smiles ahead of the first Test of the summer https://t.co/FGYryJ9isl
1196698213597810700,Tue Nov 19 07:54:22 +0000 2019,Privileged to be at the opening of Brisbane’s first #YouCan centre. The work that the @sonyfoundation do is simply… https://t.co/x9ZANfhGVR
1195435015481413600,Fri Nov 15 20:14:52 +0000 2019,RT @rajasthanroyals: Fans: Announce the retained players!   RR: Why don't you do it? 👀 👇🏾  #HallaBol | #IPLRetention | #RoyalsFamily | #Viv…
1195192610014425000,Fri Nov 15 04:11:38 +0000 2019,Excited to be back in the magenta for the @sixersbbl in this years big bash! https://t.co/o9DXpQqQnj
1193404047451144200,Sun Nov 10 05:44:31 +0000 2019,Great day at Pitt street meeting all of the #vodasuperfans vodafoneau #sponsored https://t.co/ELL1bYKR8q
1192894615734509600,Fri Nov 08 20:00:13 +0000 2019,Great fun the last couple of weeks with this bunch of blokes. Terrific series wins vs Sri Lankan and Pakistan.… https://t.co/2WS7eh0ID1
1192279080483217400,Thu Nov 07 03:14:18 +0000 2019,If you’re in Sydney this Sunday, I’ll be hanging out at Pitt Street Mall outside the Vodafone store, from 2pm thank… https://t.co/d6ANHu9RkZ
1192278388565786600,Thu Nov 07 03:11:33 +0000 2019,Nice morning chilling with lionelandpablo @g_donaldson @DanielRootes29 https://t.co/RCEbP3O5om
1190396435600224300,Fri Nov 01 22:33:21 +0000 2019,Great series win. On to Sydney for Pakistan now https://t.co/NxHFvvbJb1
1188258229169672200,Sun Oct 27 00:56:53 +0000 2019,Happy Diwali to all of my Indian friends out there https://t.co/JQMvDX2hMj
1186450723820712000,Tue Oct 22 01:14:30 +0000 2019,Good shield win with the Blues! Looking forward to our one day game tomorrow at north sydney 🏏 https://t.co/gaPmHqJArO
1186003822881263600,Sun Oct 20 19:38:40 +0000 2019,Excited to be joining the welshfire in #TheHundred next year. Can’t wait! https://t.co/3lDVfPWVPm
1174421219816263700,Wed Sep 18 20:33:33 +0000 2019,What a great ashes series! Thank you everyone for all the support, it’s been an fantastic couple of months. Whilst… https://t.co/Z0UFrBM1sB
1173140453551681500,Sun Sep 15 07:44:14 +0000 2019,Happy 1st wedding anniversary dani_willis thanks for all of your support, guidance and love. I love you! 💖 https://t.co/558mvsnjhd
1170998740397809700,Mon Sep 09 09:53:50 +0000 2019,Ashes! 👋👌🙏 https://t.co/Ygg0R6rbPP
1166690938636255200,Wed Aug 28 12:36:10 +0000 2019,I’ll be back in time for the finals @sydneyroosters 😂😂😂 https://t.co/P3SWmfm97m
1161211043260977200,Tue Aug 13 09:41:01 +0000 2019,Great night at the Australian High Commission function with dani_willis  🇦🇺 https://t.co/VaBNgmk6Kk
1160883668216238000,Mon Aug 12 12:00:09 +0000 2019,Lords Ashes week 👍🙌🏻 https://t.co/Q18JuLIrLC
1159744886679097300,Fri Aug 09 08:35:02 +0000 2019,After a couple of days of reflection, that was a pretty special way to start the Ashes 🇦🇺 https://t.co/W9ZSFg0eVn
1156527633695498200,Wed Jul 31 11:30:49 +0000 2019,All smiles! Can’t wait to walk out and compete in The Ashes for 🇦🇺 https://t.co/zOavKPz9HO
1154745352588857300,Fri Jul 26 13:28:40 +0000 2019,Take a look at these new #FreshFoam ROAV Australia editions from newbalanceaustralia these shall not be taken off m… https://t.co/kDcfFwugpt
1149776260685602800,Fri Jul 12 20:23:17 +0000 2019,Disappointing finish to our World Cup campaign. We were outplayed by a quality England side but it’s been a great c… https://t.co/DIHTW7Bv41
1143862819106017300,Wed Jun 26 12:45:22 +0000 2019,Great to get some new gear at newbalanceuk flagship store. Thanks for having me #NB https://t.co/YC5nK00pQP
1138549384105332700,Tue Jun 11 20:51:41 +0000 2019,We didn’t get the result we were after a few days ago against 🇮🇳 but we are ready to bounce back against 🇵🇰 tomorrow https://t.co/aPt3LBL4hW
1138367733714837500,Tue Jun 11 08:49:52 +0000 2019,Attempting to get out and about in Bristol but not having much luck with the weather!  But at least I can share thi… https://t.co/0ohCj82GnA
1136940305670971400,Fri Jun 07 10:17:46 +0000 2019,Great win yesterday! Onwards and upwards #cwc19 https://t.co/J3onTYjewN
1136342198822297600,Wed Jun 05 18:41:07 +0000 2019,Last hit before tomorrow’s game vs West Indies. Can’t wait #cwc19 https://t.co/ZnTFoUvcCS
1135455484956368900,Mon Jun 03 07:57:38 +0000 2019,Arrived at basecamp in Nottingham, excited to get out and about to explore and meet some of the locals vodafoneau… https://t.co/2QYu4yrcWp
1135149293885677600,Sun Jun 02 11:40:56 +0000 2019,Great start to the World Cup campaign yesterday. Terrific team performance #cwc19 https://t.co/h92bb64yWJ
1134555241435631600,Fri May 31 20:20:23 +0000 2019,Bring it on #cwc19 https://t.co/8XuQegmW8F
1128545649836920800,Wed May 15 06:20:24 +0000 2019,Gallipoli you’ve been a humbling experience 🙏 https://t.co/WZZMjW9YIW
1128189211482492900,Tue May 14 06:44:03 +0000 2019,As a proud Sony Foundation ambassador I wanted to bring your awareness to the incredible Heather Hawkins and the fa… https://t.co/PIN6qKIu9z
1123322663412195300,Tue Apr 30 20:26:07 +0000 2019,Thank you @rajasthanroyals for the last 7 weeks. I’ve enjoyed every minute of this ipl and I’m glad to be involved… https://t.co/k32qbJ4ARX
1121263045202722800,Thu Apr 25 04:01:56 +0000 2019,Lest We Forget https://t.co/9KsgcOKYac
1118773773090598900,Thu Apr 18 07:10:27 +0000 2019,Working hard with the boys @ImPchopra stuartbinny84 good gym session fellas https://t.co/Ug1da911xA
1115947550467604500,Wed Apr 10 12:00:03 +0000 2019,Day of shooting with @benstokes38 and ajinkyarahane very funny 😂 #jiojiojio https://t.co/3pG1XOyMAN
1110098353801580500,Mon Mar 25 08:37:26 +0000 2019,So excited to put on the pink and represent @rajasthanroyals tonight in Jaipur https://t.co/167ZTxmqxf
1107198875226591200,Sun Mar 17 08:35:57 +0000 2019,Great to be back with the @rajasthanroyals here in Jaipur. Very excited for this years IPL https://t.co/Az9tfB3WhC
1105335257979646000,Tue Mar 12 05:10:36 +0000 2019,Gotcha4Life are powering 'The Cliffside Festival' at the iconic Long Reef Headland. Get down there for the Open air… https://t.co/ySgymuV2ri
1102786129802285000,Tue Mar 05 04:21:16 +0000 2019,So good to catch up with Sutherland’s newest supporter Barry ‘Nugget’ Reese at the NPT20 champs. What a legend! @ A… https://t.co/hTYZnz5MOy
1101088082328281100,Thu Feb 28 11:53:50 +0000 2019,Great to have my first hit back today. The elbow is feeling good! 😀 https://t.co/MjNfb0RYc3
1085861754595409900,Thu Jan 17 11:29:51 +0000 2019,Happy birthday to my amazing wife dani_willis I hope you’ve had a great day! I love you ❤️🎉 https://t.co/5AYfoLP5Fc
1069928266407051300,Tue Dec 04 12:15:51 +0000 2018,Great night out with dani_willis at the charlieteofoundation Christmas party. Charlie is an incredible man and the… https://t.co/deD8ctzcv2
1068322606892425200,Fri Nov 30 01:55:32 +0000 2018,Nice day out at sutherlanddcc golf day 🏌️‍♂️ ⛳️ 👍 https://t.co/EU1ShaZXSe
1067232774086631400,Tue Nov 27 01:44:56 +0000 2018,Thinking of you today Hugh. #408 https://t.co/LCQ3HlJSyc
1050377238384762900,Thu Oct 11 13:27:03 +0000 2018,Great fight Lads! @Uz_Khawaja and @tdpaine36 outstanding
1050358496141574100,Thu Oct 11 12:12:34 +0000 2018,Terrific article https://t.co/qkgcDr7cmP
1047441042444890100,Wed Oct 03 10:59:39 +0000 2018,A few humpback 🐋 having some fun today #dji #drone #dronephotography https://t.co/2zFFcZBKp9
1046373008082796500,Sun Sep 30 12:15:40 +0000 2018,What a win by @sydneyroosters so proud of the team. Luke Keary took total control and played the game of his life.… https://t.co/LcaYnUXGY5
1043469144841023500,Sat Sep 22 11:56:45 +0000 2018,That was a seriously tough performance from Cooper Cronk! Can’t wait to watch the Roosters in the GF next week
1043067192135364600,Fri Sep 21 09:19:32 +0000 2018,Thanks @newbalance for the delivery. I look forward to my first game back with sutherlanddcc sharks tomorrow 😀🦈 https://t.co/6LFHVdN450
1040889669427363800,Sat Sep 15 09:06:50 +0000 2018,Today I got to Marry my best friend. What an absolutely incredible day. dani_willis looked unbelievably beautiful https://t.co/jp0523UBtw
1036815552432357400,Tue Sep 04 03:17:45 +0000 2018,Congratulations Alistair Cook on an outstanding career. A man with a unique technique, incredible mental strength a… https://t.co/A3w9vrVeyt
1036069031265095700,Sun Sep 02 01:51:20 +0000 2018,Happy Father’s Day to my old man peternatwax good times and bad he’s always there for me. Thanks dad. I hope you ha… https://t.co/tuF5uw8RP9
1034793229571555300,Wed Aug 29 13:21:46 +0000 2018,@Wriddhipops 😂😂😂👏👏👏
1034628734698045400,Wed Aug 29 02:28:07 +0000 2018,Nice team dinner with the @bimtridents boys before tomorrow’s game https://t.co/MioEYrgrmU
1032969507877400600,Fri Aug 24 12:34:56 +0000 2018,Great win in Florida the other night for the @bimtridents we now look forward to 5 home games in Barbados. I hope w… https://t.co/6jfPjduOCY
1026390935419011100,Mon Aug 06 08:54:03 +0000 2018,Off to Barbados for me now. I look forward to joining my @BIMTridents teammates and I can’t wait to get back playing some cricket @CPL
1026381752862949400,Mon Aug 06 08:17:33 +0000 2018,Congratulations to my sister and her husband on a beautiful wedding. dani_willis and I were honoured to share in yo… https://t.co/CSvigzltY3
1012704600711835600,Fri Jun 29 14:29:26 +0000 2018,It was great being back on the field yesterday and helping Toronto to a first up win. Thanks everyone for your supp… https://t.co/w5VcERXkiy
995594106767335400,Sun May 13 09:18:26 +0000 2018,Happy Mother’s Day to my incredible mum. Thank you for your endless… https://t.co/Pt5xFYwY66
992245075294998500,Fri May 04 03:30:35 +0000 2018,It’s great to be back home in Australia. I have had some time away to come to… https://t.co/J9qIajPfzM
981407491752853500,Wed Apr 04 05:45:54 +0000 2018,I would give anything to have this behind me and be back representing my country. But I meant what I said about tak… https://t.co/CDGtoVpwUm
976454117802389500,Wed Mar 21 13:42:57 +0000 2018,Excited to play at this beautiful ground tomorrow. It’s in my top 3 grounds in the world. Can… https://t.co/7gaKa55Hnr
975721881251622900,Mon Mar 19 13:13:19 +0000 2018,Came across a playful pod of dolphins in Cape Town 🐬😁 https://t.co/3K4dzoJQUM
975707133915385900,Mon Mar 19 12:14:43 +0000 2018,Out and about in Cape Town with dani_willis ☀️👌 https://t.co/VqfBaZdIxZ
975367969722249200,Sun Mar 18 13:47:00 +0000 2018,Nice couple of days chilling at the One&amp;Only Hotel in Cape Town @oocapetown. Now time to get… https://t.co/8Y1rRucgG7
975043702921089000,Sat Mar 17 16:18:28 +0000 2018,Smitswinkel Bay Cape Town👌🏼 https://t.co/z6XBFDsI54
973181094974533600,Mon Mar 12 12:57:08 +0000 2018,Unfortunate result in this Test match, We were outplayed by South Africa but we will fight back hard in Cape Town
971426529728254000,Wed Mar 07 16:45:07 +0000 2018,Gorgeous sunset here in PE https://t.co/2xfj44VrLE
970981841254613000,Tue Mar 06 11:18:05 +0000 2018,What a morning! https://t.co/I7lMfDBiSN
970975110457954300,Tue Mar 06 10:51:20 +0000 2018,A little treat to see a pod of dolphins come past in Port Elizabeth 🐬 📸 https://t.co/Ktn3Y0znla
970616193190068200,Mon Mar 05 11:05:08 +0000 2018,Great win by Australia today, terrific way to start the series! Plenty of hard work in front of… https://t.co/68BuDXCWbC
969629776402006000,Fri Mar 02 17:45:28 +0000 2018,Great day today! @mitchmarsh235 was outstanding, really deserved 100! All the bowlers were magnificent, @mstarc56 t… https://t.co/64Lyk6cPzu
969613381819879400,Fri Mar 02 16:40:19 +0000 2018,Happy Holi 🌈 👍🎉 https://t.co/1kuOe1HVuq
968865706044547100,Wed Feb 28 15:09:19 +0000 2018,Excited to get started tomorrow against South Africa. It's going to be a cracking series! 🏏👍 https://t.co/3CkYju7DuA
968128992426393600,Mon Feb 26 14:21:53 +0000 2018,Just a little shot over the ocean here in Durban 🌊 ☀️ https://t.co/I9f6WQyJO8
968128102957240300,Mon Feb 26 14:18:21 +0000 2018,Kingsmead cricket ground. Can't wait for the 1st Test! https://t.co/7tyPVCiCGH
967783199580540900,Sun Feb 25 15:27:49 +0000 2018,Dark and gloomy skies in Durban https://t.co/YEWk73X2ZE
966241080860708900,Wed Feb 21 09:20:00 +0000 2018,Benoni cricket ground where we will play our tour match tomorrow. Looking forward to getting… https://t.co/Bniqsb3Cc4
965595345685303300,Mon Feb 19 14:34:04 +0000 2018,The beautiful wanderers cricket ground #altitude #getitintheatmosphere https://t.co/Ovb6KGNDwd
965525236945903600,Mon Feb 19 09:55:29 +0000 2018,Congrats to @AlexBlackwell2 on a stellar cricketing career with Australia and NSW. I hope you enjoy retirement!
965515765859409900,Mon Feb 19 09:17:51 +0000 2018,It was an absolute pleasure to visit the smilefoundationsa and see the wonderful work these guys… https://t.co/dFRFFSr59M
964908335823769600,Sat Feb 17 17:04:09 +0000 2018,Nice to see the Australian high commissioner and his lovely family here in South Africa. Ella is… https://t.co/iJ4gJFiroa
964777245284843500,Sat Feb 17 08:23:14 +0000 2018,How good is it to see @rogerfederer back at #1 at the ripe age of 36! #goat
963628089912807400,Wed Feb 14 04:16:54 +0000 2018,Enjoyed this morning with CommBank. First time I've had a net in an office building before! 😂😂 https://t.co/SNv4ZKcMbJ
963345773218975700,Tue Feb 13 09:35:05 +0000 2018,Thanks everyone for the messages. I had a great time last night. I'm very humbled to receive the… https://t.co/PrGbIh38Yc
963193862457000000,Mon Feb 12 23:31:26 +0000 2018,Great weekend at crownhotels always love staying here and enjoying the hospitality! #crowntowers https://t.co/el0Uc9f3uO
962976752426520600,Mon Feb 12 09:08:43 +0000 2018,AB medal night and isn't dani_willis looking absolutely stunning. https://t.co/wsFiCtf6Tw
962819102590079000,Sun Feb 11 22:42:17 +0000 2018,I look forward to dressing up this evening to celebrate what's been a Terrific summer of cricket… https://t.co/hYOPcrn8dE
961751705812701200,Fri Feb 09 00:00:49 +0000 2018,I declare my independence by leaving no stone unturned in my preparation newbalanceaustralia… https://t.co/1dldjpqsLN
961736408280064000,Thu Feb 08 23:00:02 +0000 2018,Nice to pop into the @KoalaMattress offices yesterday to Test out some new product. Some really… https://t.co/zqlxPVmN3b
961208978523897900,Wed Feb 07 12:04:13 +0000 2018,Great win Australia. Well played @Gmaxi_32 top drawer!
960461976823504900,Mon Feb 05 10:35:54 +0000 2018,Congrats Dougy! One of the most skilful bowlers I've ever come across. Enjoy retirement champion 🍾👍👋 https://t.co/OrEqKMb77K
960403811557957600,Mon Feb 05 06:44:46 +0000 2018,What a stunning day in Manly 📸☀️ https://t.co/67Mxybe7aW
960403327853973500,Mon Feb 05 06:42:51 +0000 2018,Day trip to Shelly beach ☀️🌊👌 https://t.co/ZZ2LAccOeg
960303616664850400,Mon Feb 05 00:06:38 +0000 2018,Is Vince Papale playing? What a film! #invincible #eaglefight https://t.co/M1gVefj8h0
960068878226276400,Sun Feb 04 08:33:52 +0000 2018,Well done @StrikersBBL deserving BBL winners. The atmosphere at Adelaide oval looked spectacular as always
960045773063782400,Sun Feb 04 07:02:03 +0000 2018,Great batting by Jake Weatherald 💯 Looks a belter of a wicket. I look forward to watching this chase
959994321104760800,Sun Feb 04 03:37:36 +0000 2018,Lovely lunch date with dani_willis at @chiswicksydney delightful food👌🍴 https://t.co/JhZJKKXrvB
957619001735004200,Sun Jan 28 14:18:56 +0000 2018,Congratulations to @DylanAlcott on winning his 4th straight Australian open. What an amazing achievement 🎾
957610166328832000,Sun Jan 28 13:43:49 +0000 2018,Great to see @rogerfederer go back to back Australian opens. What an absolute legend! 🎾👍
957403273786482700,Sun Jan 28 00:01:42 +0000 2018,I look forward to playing at this beautiful new stadium for the first time today https://t.co/7Rx3WwA4Vk
956879636897546200,Fri Jan 26 13:20:58 +0000 2018,Great to see @rogerfederer in another @AustralianOpen final. It's going to be a belter of a match!
956879277143699500,Fri Jan 26 13:19:32 +0000 2018,Nice to get over the line today. Bowlers were great and as was Heady
956672419191603200,Thu Jan 25 23:37:33 +0000 2018,Happy Australia Day everyone! What a country we live in #proudaussie https://t.co/F9bKamCZtr
956116711874314200,Wed Jan 24 10:49:22 +0000 2018,Well played @rogerfederer #clinical 👍
956097454906097700,Wed Jan 24 09:32:51 +0000 2018,Roger just needed 3 games to warm up. He's certainly hit his straps now @AustralianOpen
956092595351863300,Wed Jan 24 09:13:32 +0000 2018,#goat 🎾👌
956062120759701500,Wed Jan 24 07:12:27 +0000 2018,Can't wait to watch @rogerfederer put on a clinic vs Berdych tonight @AustralianOpen
955679222881644500,Tue Jan 23 05:50:57 +0000 2018,Well done @RyanPierse you have played 📸👌👍 https://t.co/rkA8avYKwA
955589585068634100,Mon Jan 22 23:54:45 +0000 2018,#NewProfilePic https://t.co/AgPVVQp0eJ
955434496228118500,Mon Jan 22 13:38:29 +0000 2018,Great night out at the @AustralianOpen with @dani_willis we both absolutely love our tennis! Thanks @CraigTiley for… https://t.co/3BO4oGt9uC
955381407227945000,Mon Jan 22 10:07:32 +0000 2018,Great to see @rogerfederer again. Good luck for the remainder of the @AustralianOpen #champion https://t.co/cId0hCpGzM
954686564839309300,Sat Jan 20 12:06:28 +0000 2018,Yes @rogerfederer what an absolute clinic! @AustralianOpen
954659116764487700,Sat Jan 20 10:17:24 +0000 2018,Love watching both of these delightful one hand backhands @AustralianOpen #7sport
953955331851264000,Thu Jan 18 11:40:49 +0000 2018,Thanks @davidwarner31 well done to u also! https://t.co/Udkj6X7WfL
953941084748394500,Thu Jan 18 10:44:12 +0000 2018,Sandra bullock was in Titanic was she?  😂😂 https://t.co/nJw5SfNQJj
953940231543238700,Thu Jan 18 10:40:49 +0000 2018,My night tonight. What's the movie? https://t.co/HQDkzrSbVJ
953891147746693100,Thu Jan 18 07:25:46 +0000 2018,Thanks King! @ShaneWarne https://t.co/sWi7PNIK72
953890849472958500,Thu Jan 18 07:24:35 +0000 2018,Thanks @darren_lehmann 👍 https://t.co/cik8AFGeN2
953143432893091800,Tue Jan 16 05:54:37 +0000 2018,Getting a bit of recovery in before Fridays ODI @recoverypumpaus https://t.co/crVgnqV2az
952791536156098600,Mon Jan 15 06:36:18 +0000 2018,Love that the @AustralianOpen has started again. Best time of the year! I'm backing @rogerfederer to go back2back
952068404835442700,Sat Jan 13 06:42:50 +0000 2018,I look forward to competing for this trophy in the Gillette One Day series starting tomorrow at… https://t.co/C8Wzu9LVnO
951750072789753900,Fri Jan 12 09:37:54 +0000 2018,@CWhitakerSport @TennisPodcast @AustralianOpen @CricketAus 😂😂😂
951244777999224800,Thu Jan 11 00:10:03 +0000 2018,Great to share a special summer with dani_willis ❤️ thanks for all of the support! https://t.co/49e6jWxCvZ
950871144223064000,Tue Jan 09 23:25:21 +0000 2018,What an amazing way to end the Test summer. I've loved every minute of the series and am so… https://t.co/fbcrsRyjzA
950499210067001300,Mon Jan 08 22:47:25 +0000 2018,I am proud to be associated with Commonwealth Bank and their Cricket Club Sponsorship Program https://t.co/Ld3NMQhbQy
949216722979995600,Fri Jan 05 09:51:17 +0000 2018,Cheers Bull @davidwarner31 https://t.co/JknuYCIOtQ
949022501589282800,Thu Jan 04 20:59:31 +0000 2018,Delighted to be retained by the @rajasthanroyals for IPL 2018! Looking forward to marching with the Royals again. H… https://t.co/A8B4Ijq3Y4
948327006227324900,Tue Jan 02 22:55:52 +0000 2018,Proud to be part of #nbgivesback by donating my @newbalance trainers to the Sony Foundation.… https://t.co/yNec62IZ11
947666137541574700,Mon Jan 01 03:09:48 +0000 2018,Glad u liked it 👍 https://t.co/mN3m3A1dTd
947393511128694800,Sun Dec 31 09:06:29 +0000 2017,It's been a great 2017 with so many fantastic memories. I can't wait to see what 2018 brings!… https://t.co/bCgRb6nPF3
945174077890793500,Mon Dec 25 06:07:15 +0000 2017,A bit of Christmas fun at lunch in the photo booth https://t.co/ZllS9jAOdE
945169574097547300,Mon Dec 25 05:49:21 +0000 2017,Merry Christmas everyone! Just finished a great day at our team lunch dani_willis 🎄 #christmas https://t.co/rMX7licrW2
943818631401455600,Thu Dec 21 12:21:11 +0000 2017,Great fun having a hit with @milosraonic today. I think he's got me covered on the court next time we might head to… https://t.co/gDYkFRnhZP
