id,created_at,text
1209141398261379000,Mon Dec 23 15:59:08 +0000 2019,Ismael Zambada-Imperial — the 35-year-old son of Sinaloa cartel kingpin Ismael “El Mayo” Zambada-Garcia — was shipp… https://t.co/9Aqr9ko13g
1209114145032999000,Mon Dec 23 14:10:51 +0000 2019,Individuals such as  fugitives, sex offenders, anti-government supporters and the homeless are known to reside in t… https://t.co/XeuAI6n1ki
1209114144361898000,Mon Dec 23 14:10:50 +0000 2019,This area is commonly referred to “Slab City” because it is a deconstructed military base, where only the slabs of buildings remain.
1209114142919078000,Mon Dec 23 14:10:50 +0000 2019,On Dec 18 - Dec 20, 2019 Mobile Command Vehicle (MCV) West, supported the S/CA during “Operation Grinch” in El Cent… https://t.co/jeJ3HiA9FV
1208120358907318300,Fri Dec 20 20:21:54 +0000 2019,U.S. marshals have arrested Tierre Tyrell Williams for charges including murder and aggravated assault: https://t.co/kzKGuoVu01
1208104188397412400,Fri Dec 20 19:17:38 +0000 2019,RT @NorfolkPD: #ArrestMade. Hank L. Smith Jr., 40, was arrested today in @HarrisonburgVA . Special thanks to the U.S. Marshals Fugitive Tas…
1208100612262510600,Fri Dec 20 19:03:26 +0000 2019,Wilmington police have charged Isaiah Lecompte in connection with a Saturday shooting in the city's Hilltop neighbo… https://t.co/fhQn4pV2zs
1208085697657278500,Fri Dec 20 18:04:10 +0000 2019,Richard Lundy, previously convicted of assaulting his then-4-month-old son, now faces murder charges after the chil… https://t.co/7QvsR9xyID
1208069465533010000,Fri Dec 20 16:59:40 +0000 2019,Schuyler Hardy was arrested for a shooting last month in Norfolk: https://t.co/c70L16hAXK
1208057501297598500,Fri Dec 20 16:12:07 +0000 2019,RT @PfChiefRobledo: Thank you @USMarshalsHQ Fugitive Taskforce San Antonio @TxDPS @Austin_Police for their assistance. #RegionalPartners ht…
1208053689375690800,Fri Dec 20 15:56:58 +0000 2019,U.S. Marshals need help tracking down Darryl Fernald, most recently convicted for a 2017 home invasion, believed to… https://t.co/D68dUiedxp
1208041875736858600,Fri Dec 20 15:10:02 +0000 2019,U.S. Marshals arrested Branden Howell, 33, for allegedly raping two minors: https://t.co/PVUGUMLMk3
1208027097610047500,Fri Dec 20 14:11:18 +0000 2019,U.S. Marshals arrest murder and rape suspect after nearly 7 years on the run: https://t.co/0dkl66un77
1207766395041329200,Thu Dec 19 20:55:22 +0000 2019,Deputy U.S. marshals arrested Anu-Malik Johnson wanted in a Pennsylvania movie theater shooting that killed a man a… https://t.co/TMoQU6slHi
1207754726034616300,Thu Dec 19 20:09:00 +0000 2019,Last year, 804 individuals known as "the state’s most violent and dangerous criminals" were arrested in Utah: https://t.co/jxuRyw4EKR
1207743714157879300,Thu Dec 19 19:25:14 +0000 2019,RT @ATFBaltimore: UPDATE: Following investigative efforts by @USMarshalsHQ @ATFBaltimore @CCSOMD, Deante Duckett was arrested and taken int…
1207740411327979500,Thu Dec 19 19:12:07 +0000 2019,"A deficit of respect for the men and women in blue who daily put their lives on the line for the rest of us is hur… https://t.co/T2lZAhqzwr
1207719814086705200,Thu Dec 19 17:50:16 +0000 2019,The U.S. Marshals Gulf Coast Regional Fugitive Task Force are now searching for ‘armed and dangerous’ suspect in th… https://t.co/JGqFXjXMBA
1207704762394783700,Thu Dec 19 16:50:28 +0000 2019,U.S. Marshals Gulf Coast Regional Fugitive Task Force arrested Kewauntee Deshon Rembert for the shooting death of U… https://t.co/RKfOXjbgwe
1207690435847708700,Thu Dec 19 15:53:32 +0000 2019,Donald Trump has nominated Mike Hagar to be U.S. Marshal for the Eastern District of Arkansas in Little Rock: https://t.co/Swg9NSYQXR
1207677252751806500,Thu Dec 19 15:01:09 +0000 2019,Time’s up for 15 year Vermont fugitive: https://t.co/jFTEmJWPFm
1207663973849538600,Thu Dec 19 14:08:23 +0000 2019,Attorney General William P. Barr announces launch of Operation Relentless Pursuit: https://t.co/wtjFtEqpIo
1207395286328512500,Wed Dec 18 20:20:43 +0000 2019,U.S. Marshals Fugitive Task Force arrests York Movie Theater homicide suspect in New Jersey: https://t.co/XnKxBF4szb
1207385027065110500,Wed Dec 18 19:39:57 +0000 2019,Attorney General Barr is live now in Detroit, MI announcing the latest violent crimes deterrence program: https://t.co/xaDKO39gz6
1207368251195433000,Wed Dec 18 18:33:17 +0000 2019,RT @USAttyHerdman: @NDOHnews will be live-streaming the AG's remarks from Detroit at 2:30 p.m. Eastern, to be immediately followed by a liv…
1207364923245957000,Wed Dec 18 18:20:04 +0000 2019,'Fugitive of the Week' program leads to the arrest of 43 fugitives in 2019: https://t.co/t4HRUBPnq1
1207351846664364000,Wed Dec 18 17:28:06 +0000 2019,Former Mexican Government law official remains with U.S. Marshals in Dallas until trial after being denied bail: https://t.co/L12Xpw3F6C
1207324912299528200,Wed Dec 18 15:41:04 +0000 2019,Tune into the live press conference AG Barr will be holding at 2:30pm EST in Detroit, MI with the directors of @ATF… https://t.co/mKtcegIvQp
1207310858327658500,Wed Dec 18 14:45:14 +0000 2019,The Rhode Island Violent Fugitive Task Force arrests violent predator after years on the run: https://t.co/BJA0hzW3qm
1207036343232143400,Tue Dec 17 20:34:24 +0000 2019,RT @USAO_RI: @USMarshalsHQ @RIStatePolice report that Omar Enrique Pagan, 29, wanted on charges of child molestation, attempted breaking &amp;…
1207029403017982000,Tue Dec 17 20:06:49 +0000 2019,CRIPS gang member arrested in Colchester: https://t.co/tqqlr3DtR2
1206985776472440800,Tue Dec 17 17:13:28 +0000 2019,Arrest made in La Mesa cold case murder from 1983 https://t.co/7u6nCD5URp via @CBS8
1206984916405227500,Tue Dec 17 17:10:03 +0000 2019,Gunman found and arrested for Friday the 13th triple shooting in Cleveland https://t.co/W4rdrNrGN1
1206984535721881600,Tue Dec 17 17:08:32 +0000 2019,Third man arrested in exchange of gunfire in Richmond park that killed 9-year-old, wounded 2 others https://t.co/4ZAxZFKbqj via @rtdnews
1206983255657996300,Tue Dec 17 17:03:27 +0000 2019,https://t.co/8VA2VKp1RO
1206980938418266000,Tue Dec 17 16:54:14 +0000 2019,Don't miss your chance to participate in the next USMS Public Online Auction of Seized Assets. Bidding has already… https://t.co/21UOoTnxf0
1206665382733516800,Mon Dec 16 20:00:20 +0000 2019,U.S. Attorney takes fire from violent suspect during ride-along: https://t.co/CGlqxsY1Km
1206624034550620200,Mon Dec 16 17:16:02 +0000 2019,https://t.co/kYT9rDvTLg
1206615309827952600,Mon Dec 16 16:41:22 +0000 2019,Getting bombarded by scam calls?  You’re not alone. https://t.co/tuPumvnVut
1206588571391549400,Mon Dec 16 14:55:07 +0000 2019,https://t.co/TXfIxWw4kp
1206582598480355300,Mon Dec 16 14:31:23 +0000 2019,Under “Operation RAAVEN” federal, state and local law enforcement officers joined together to account for registere… https://t.co/VwPGcdSooB
1206566224982945800,Mon Dec 16 13:26:19 +0000 2019,The fiercest federal lawman you never knew — and he was African American https://t.co/tqRivyzktW
1206193865214091300,Sun Dec 15 12:46:42 +0000 2019,https://t.co/qNrVkN6ubS
1205850659184136200,Sat Dec 14 14:02:55 +0000 2019,https://t.co/lXm7jvnMQV
1205835507026055200,Sat Dec 14 13:02:42 +0000 2019,RT @FBI: You can fall victim to gift card #scams as easily as you can buy gift cards. Remain cautious if a boss or a friend asks you via em…
1205584381479473200,Fri Dec 13 20:24:49 +0000 2019,https://t.co/ajVqRnRTrV
1205581540949921800,Fri Dec 13 20:13:32 +0000 2019,Seattle police and US Marshals arrested 19 people in downtown Seattle on Monday for warrants and narcotics violatio… https://t.co/EAY2Rj9TPZ
1205556169160495000,Fri Dec 13 18:32:43 +0000 2019,Michael Greco, United States Marshal for the Southern District of New York, donated several items to the United Sta… https://t.co/lSJlnzzn1T
1205543619832225800,Fri Dec 13 17:42:51 +0000 2019,The suspect in the death of a Nassau Bay police sergeant was arrested Thursday afternoon Source: https://t.co/D6QT0G6Cbo
1205523997628219400,Fri Dec 13 16:24:53 +0000 2019,Authorities in Tennessee have recaptured a 17-year-old suspect, who is accused of armed robbery, who escaped a Nash… https://t.co/vEH1HDlu0Q
1205508097432866800,Fri Dec 13 15:21:42 +0000 2019,The U.S. Marshals Gulf Coast Regional Fugitive Task Force remains on the look out for Melvin Tyler, who is wanted f… https://t.co/wlt1B7w11r
1205471200299962400,Fri Dec 13 12:55:05 +0000 2019,U.S. Marshals issue alert after woman, children never return from vacation https://t.co/kqA1Lr6iYf via @fox43
1205222386649489400,Thu Dec 12 20:26:23 +0000 2019,CBP and U.S. Marshals Service K9s Honor Brady Snakovsky, Founder of Brady’s K9 Fund https://t.co/7Y1xa89yuT
1205189778217586700,Thu Dec 12 18:16:49 +0000 2019,The U.S. Marshals Fugitive Task Force in Jacksonville, Florida were able to locate and arrest Douglas Collins, Jr.,… https://t.co/0KqM3gnSPS
1205183909203513300,Thu Dec 12 17:53:29 +0000 2019,A man was arrested on suspicion of robbery after a standoff in a Billings trailer park that lasted about four hours: https://t.co/NI1fBw5DoA
1205166327398359000,Thu Dec 12 16:43:38 +0000 2019,RT @ATFMiami: HAPPENING NOW: @stluciesheriff @KenJMascara &amp; @ATFMiami ASAC Eric Mercer and other law enforcement partners from @Ft_Pierce a…
1205163274347720700,Thu Dec 12 16:31:30 +0000 2019,Suspects that shot 12 people in New Orleans arrested by law enforcement: https://t.co/d15OcBAsdg
1205143391815815200,Thu Dec 12 15:12:29 +0000 2019,RT @houstonpolice: HPD casket guard honor their fallen brother Sergeant Christopher Brewster before services begin in an hour. https://t.co…
1205140248415613000,Thu Dec 12 15:00:00 +0000 2019,U.S. Marshals Task Force arrests halfway house walkaways: https://t.co/2Tf0iyYRdV
1204868396476747800,Wed Dec 11 20:59:45 +0000 2019,"Most of the dogs used by the defendants were recovered by the U.S. Marshals and have been placed with appropriate… https://t.co/PUa1IKhE1u
1204847243905446000,Wed Dec 11 19:35:42 +0000 2019,U.S. Marshals arrest homicide suspect wanted out of Illinois: https://t.co/3wWkZD42ij
1204829881139388400,Wed Dec 11 18:26:42 +0000 2019,'Fugitive of the Week' surrenders to U.S. Marshals after feature: https://t.co/lIb3BWbKKx
1204805302744502300,Wed Dec 11 16:49:03 +0000 2019,South Carolina Law Enforcement Division agents and U.S. Marshals, are searching for Jamel Lamont Higgs, wanted for… https://t.co/bOaFInmk5N
1204798780622753800,Wed Dec 11 16:23:08 +0000 2019,Our thoughts &amp; prayers go out to the family &amp; friends of Jersey City Detective Joseph Seals, who was killed Tuesday… https://t.co/xRl1HZHLKS
1204797005945614300,Wed Dec 11 16:16:04 +0000 2019,Our thoughts and prayers go out to Nassau bay Police Sgt. Sullivan's family and coworkers.  Texas police sergeant m… https://t.co/myLJaicZp0
1204789299444621300,Wed Dec 11 15:45:27 +0000 2019,RT @ATFHQ: Our thoughts are with the Jersey City Police Department, N.J., and the family of Detective Joseph Seals, who was shot and killed…
1204785699435765800,Wed Dec 11 15:31:09 +0000 2019,Arkansas murder suspect arrested by U.S. Marshals Task Force and Multi Agency Gang Unit: https://t.co/4UfEyOuM9e
1204768250757861400,Wed Dec 11 14:21:49 +0000 2019,U.S. Marshals ‘tickled to death’ about Blair E. Batson toy drive https://t.co/3j4QTuwSOT
1204510331898343400,Tue Dec 10 21:16:56 +0000 2019,RT @houstonpolice: Chief @ArtAcevedo joins @USMarshalsHQ @CrimeStopHOU to speak on results of “Operation Triple Beam https://t.co/JWWWVHEjs…
1204494654328193000,Tue Dec 10 20:14:38 +0000 2019,Jonathan Rosso is wanted for possession and intent to distribute large amounts of heroin: https://t.co/GjaGqzRAyF
1204473442747273200,Tue Dec 10 18:50:21 +0000 2019,@FBI https://t.co/gj2ozg5BFX
1204470702675546000,Tue Dec 10 18:39:28 +0000 2019,The United States Marshals and @FBI don’t want you to forget about Bitcoin BTC scammers pretending to be people the… https://t.co/0otGYI1ORV
1204442911850532900,Tue Dec 10 16:49:02 +0000 2019,Husband and wife murder suspects, who escaped from a prisoner transport van -- denied venue change for trial: https://t.co/p02BFHFfMr
1204407988439699500,Tue Dec 10 14:30:15 +0000 2019,RT @USMarshalsFund: We extend our deepest condolences to the family, friends, and colleagues of Sergeant Christopher Brewster of the Housto…
1204143580048240600,Mon Dec 09 20:59:36 +0000 2019,U.S. Marshals Fugitive Task Force arrests Scranton, PA shooting suspect: https://t.co/v2V2tcgUJi
1204133275545096200,Mon Dec 09 20:18:39 +0000 2019,U.S. Marshals arrested a 41-year-old man in connection with the shooting death of a University of Arkansas Pine Blu… https://t.co/1z7phY4JWL
1204117958617948200,Mon Dec 09 19:17:47 +0000 2019,A new list of the most wanted fugitives in central Ohio has just been announced: https://t.co/aOn0FBGJCX
1204040078470852600,Mon Dec 09 14:08:19 +0000 2019,A 24-year-old Detroit man has been arraigned on federal child pornography charges. Nathanal Pace has been turned ov… https://t.co/svalv3Uxa9
1203046797217861600,Fri Dec 06 20:21:22 +0000 2019,U.S. Marshals Task Force arrests one of the Tennessee Bureau of Investigation's (TBI) Most Wanted fugitives: https://t.co/wDAZxkeFBC
1203031168096059400,Fri Dec 06 19:19:16 +0000 2019,RT @WDPAnews: “SCO” gang associate admits trafficking heroin: Justin Law evaded capture for nearly 4 months before his arrest by @USMarshal…
1203013258569035800,Fri Dec 06 18:08:06 +0000 2019,UPDATED FRAUD ADVISORY - Spoofers using government phone numbers, government employees’ names, demanding payment vi… https://t.co/mQ2EgwNSvq
1202995127322644500,Fri Dec 06 16:56:03 +0000 2019,The clerk’s office for the federal district court in Spokane alerted U.S. Marshals that it had received 2 letters s… https://t.co/G2LHXTufKa
1202697253670006800,Thu Dec 05 21:12:24 +0000 2019,'Fugitive of the Week' Found and Bitten by Police K9: https://t.co/3yvHL4Xse3
1202682017852334000,Thu Dec 05 20:11:52 +0000 2019,Don't miss your chance to participate in the U.S. Marshals' nationwide online auction. Auction closes 11am EST 12/9: https://t.co/4NuamdhFF4
1202664309446369300,Thu Dec 05 19:01:30 +0000 2019,U.S. Marshals arrested fugitive Henry Haas on an outstanding escape warrant from Cincinnati, OH: https://t.co/N9jmJ6Wdeo
1202616132143857700,Thu Dec 05 15:50:04 +0000 2019,Help us catch this fugitive wanted for a Nov. double-murder in Gwinnett Co., GA. Anyone with information on Karlton… https://t.co/fREDncrF4v
1202604296216436700,Thu Dec 05 15:03:02 +0000 2019,@FBIJobs Good story.   https://t.co/OyFa4Xo0t0
1202325662549381000,Wed Dec 04 20:35:50 +0000 2019,U.S. Marshals Fugitive Task Force arrests Georgia sex assault suspect: https://t.co/3tbwQYdBLF
1202309275261046800,Wed Dec 04 19:30:43 +0000 2019,The U.S. Marshals held an auction for the former U.S. Coast Guard ship, the Bramble, today on the steps of the fede… https://t.co/qnRfp9y7EE
1202293662425714700,Wed Dec 04 18:28:41 +0000 2019,West TX @usmarshals rolled out the Mobile Command Vehicle for the 31st Annual @chuys Chuy's Children Giving to Chil… https://t.co/CmBLcgDb33
1202258713211523000,Wed Dec 04 16:09:48 +0000 2019,RT @USAttyNealyCox: .@DallasMayor proclaims Nov. 19 as Dallas #ProjectSafeNeighborhoods Recognition Day! What a great symbol of the hard wo…
1202228949809533000,Wed Dec 04 14:11:32 +0000 2019,Members of the U.S. Marshal’s Fugitive Task Force arrested Khadir Blue, 27, for murder and Pennsylvania State Parol… https://t.co/m1ihEmBMaP
1201935552381100000,Tue Dec 03 18:45:41 +0000 2019,RT @WDKYnews: A pleasure spending the morning in Grayson County hosted by Jailer Jason Woosley and County Judge/Exec Kevin Henderson at a b…
1201889676036104200,Tue Dec 03 15:43:23 +0000 2019,RT @BoloProgram: We congratulate @HomicideTeam for arrest of fugitive Brandon Teixeira in Oroville, Cali. on Dec. 1, 2019.  We thank everyo…
1201874130552918000,Tue Dec 03 14:41:37 +0000 2019,RT @ATFWashington: A Norfolk man and 13-time convicted felon was sentenced to seven years in prison for possession with intent to distribut…
1201834241102876700,Tue Dec 03 12:03:06 +0000 2019,British Columbia's Most Wanted Fugitive Arrested In Oroville https://t.co/HPlPS7jPru
1201578478946132000,Mon Dec 02 19:06:48 +0000 2019,U.S. Marshal Martin J. Pane announced the arrest of John Curtis Anderson Jr. – a 22-year old Harrisburg man for cri… https://t.co/5NSQDrdgsZ
1201556847003656200,Mon Dec 02 17:40:50 +0000 2019,RT @DEALOSANGELES: #WantedWednesday Have you seen this man? Do you have information that can help us catch Nemesio Ruben Oseguera Cervantes…
1201512801497419800,Mon Dec 02 14:45:49 +0000 2019,United States Marshals Service Director Donald Washington administered the oath of office to 6 newly appointed Unit… https://t.co/C3deLK9Jfn
1199751098099208200,Wed Nov 27 18:05:26 +0000 2019,After more than two weeks on the run, Marine Michael Brown was arrested without incident Wednesday at approximately… https://t.co/rHO2vzNEXm
1199750367157862400,Wed Nov 27 18:02:32 +0000 2019,RT @FBIRichmond: A joint press conference occurred today announcing the arrest of fugitive subject Michael Alexander Brown, wanted for a ho…
1199722091471347700,Wed Nov 27 16:10:11 +0000 2019,The press conference regarding the arrest of Michael Brown is about to begin shortly: https://t.co/zbLgz6xcTm
1199713212209516500,Wed Nov 27 15:34:54 +0000 2019,Michael Alexander Brown was taken into custody in Franklin County, VA without incident. The Franklin County Sheriff… https://t.co/JXPphJ4KXI
1199701647167041500,Wed Nov 27 14:48:56 +0000 2019,RT @ATF_Chicago: Project Guardian coordinated law enforcement operation in @ATF_Chicago Merrillville Field Office resulting in 9 arrests to…
1199687673721606100,Wed Nov 27 13:53:25 +0000 2019,https://t.co/o4oWKtqEr2 https://t.co/O1WkUpraqu
1199651133020627000,Wed Nov 27 11:28:13 +0000 2019,https://t.co/EBpR82Qgj9
1199391321284317200,Tue Nov 26 18:15:49 +0000 2019,RT @StateDeptDSS: Happy #NationalCakeDay!  Nothing says "celebrate" like a cake! That is why we celebrated the opening of the branding new…
1199385525255364600,Tue Nov 26 17:52:47 +0000 2019,RT @USAO_MT: And last Friday, Attorney General William P. Barr announced in Montana the DOJ's nationwide Missing and Murdered Indigenous Pe…
1199383713370521600,Tue Nov 26 17:45:35 +0000 2019,UPDATE: 15 vehicles and 1 boat.
1199382727725928400,Tue Nov 26 17:41:40 +0000 2019,Don’t miss your opportunity to bid on 11 vehicles in the latest U.S. Marshals nationwide online auction. Bidding be… https://t.co/gJwdo3gKwq
1198965161027154000,Mon Nov 25 14:02:24 +0000 2019,See something say something. Take a look at our Top 15 Most Wanted. If you think you have some information, don't h… https://t.co/HJsaOsDYRD
1198963751342481400,Mon Nov 25 13:56:48 +0000 2019,New rural Alaska law enforcement initiative helps nab Napakiak sexual assault suspect https://t.co/FmMGzlfFNo via @AKPublicNews
1197639785126473700,Thu Nov 21 22:15:50 +0000 2019,https://t.co/GKQNS8pIJF
1197626075867684900,Thu Nov 21 21:21:21 +0000 2019,Historic U.S. Coast Guard ship to be sold on steps of Mobile courthouse after bills not paid https://t.co/BtmyGViCth
1197625295488065500,Thu Nov 21 21:18:15 +0000 2019,https://t.co/p6V80eetoN
1197207128337002500,Wed Nov 20 17:36:37 +0000 2019,RT @USAO_RI: Former New York City resident convicted and imprisoned for 1st degree sexual assault pleads guilty to violating the Sex Offend…
1196944770276495400,Wed Nov 20 00:14:06 +0000 2019,https://t.co/eI3KJwN7ag
1196828262829318100,Tue Nov 19 16:31:08 +0000 2019,$25K REWARD FOR WANTED FUGITIVE: LEROY HEADLEY US Marshal's Add "Modern-day Casanova" Charged With Murder to 15 Mos… https://t.co/dybghZql8D
1195502629469802500,Sat Nov 16 00:43:32 +0000 2019,Authorities involved in the fugitive investigation for Michael Brown have recently cleared an area near a stretch o… https://t.co/ar06wuys0B
1195413653106937900,Fri Nov 15 18:49:59 +0000 2019,The investigation to locate and apprehend Michael Alexander Brown is active and ongoing by US Marshals, FBI, ATF an… https://t.co/sPjAtcWUjT
1195383785740734500,Fri Nov 15 16:51:18 +0000 2019,RT @FBIRichmond: Continue being vigilant &amp; those extra set of eyes for us as we search for homicide suspect-Michael Brown. Considered armed…
1195074651216646100,Thu Nov 14 20:22:54 +0000 2019,RT @_elizabethrusso: Check out the #1 True Crime podcast! Join the real-time nationwide manhunt for notorious murderer Lester Eubanks, on t…
1194971528452022300,Thu Nov 14 13:33:08 +0000 2019,WANTED FOR HOMICIDE: Michael Alexander Brown The U.S. Marshals are offering a $10,000 reward for information leadin… https://t.co/NT9FSncaut
1194708858972848000,Wed Nov 13 20:09:23 +0000 2019,Before US Marshals launched a manhunt for child murderer Lester Eubanks, there was 'The Fugitive' - ABC News -… https://t.co/sK0zG36v2g
1194394426115862500,Tue Nov 12 23:19:56 +0000 2019,The USMS-led, 90-day Operation Triple Beam (OTB) Albuquerque, concluded on Oct. 31, 2019, with the arrests of 327 a… https://t.co/k3N3n8Ki1o
1194380286987030500,Tue Nov 12 22:23:45 +0000 2019,USMS-Led Operation Triple Beam Results in 327 Felony Arrests in Central and Northern New Mexico https://t.co/U5KRn2pz50
1194379137936449500,Tue Nov 12 22:19:11 +0000 2019,Attorney General William Barr &amp; US Marshals Service Director Donald Washington, on hand with representatives from 1… https://t.co/ZJRbYawfHf
1194213213749026800,Tue Nov 12 11:19:52 +0000 2019,If you can’t get enough of @usmarshalshq, check out this new podcast from @WolfEnt and @EndeavorAudio starring… https://t.co/N40tcjXA4h
1193522692898603000,Sun Nov 10 13:35:59 +0000 2019,Mobile Command Center Gives U.S. Marshals High-Tech Advantage https://t.co/pJ06dUgXwY
1193234403864002600,Sat Nov 09 18:30:25 +0000 2019,The U.S. Marshals: How deputies capture fugitives - KYMA https://t.co/tfJ54yAxMw
1192812641644875800,Fri Nov 08 14:34:29 +0000 2019,U.S Marshals arrest 11 sex offenders, several fugitives in the Ozarks https://t.co/jiKpbEH3wL via @springfieldNL
1192812219987382300,Fri Nov 08 14:32:49 +0000 2019,Over 2 dozen arrested in Operation ‘Clean Sweep’ https://t.co/XB8OnoGCgR
1192599757681766400,Fri Nov 08 00:28:34 +0000 2019,Deputy U.S. Marshal Gets Bogus Sex Offender Addresses Corrected After Seeing CBS 2 Report https://t.co/6fXamxVHuR
1192216679595597800,Wed Nov 06 23:06:21 +0000 2019,Muskogee to Host World Premiere Of Film Based On U.S. Marshal Bass Reeves https://t.co/hUcSQjlcEl
1192050270592815000,Wed Nov 06 12:05:06 +0000 2019,Ep. 4 of 'Have You  Seen This Man?' dropped today. Help @usmarshalshq find Lester Eubanks, one of our 15 most wante… https://t.co/j9KFSAgu6b
1192048879916728300,Wed Nov 06 11:59:34 +0000 2019,Inside the Cold Case Squad: Meet the US Marshals who take over when the trail runs cold - ABC News - https://t.co/QLiMssQVOm via @ABC
1191762768212439000,Tue Nov 05 17:02:40 +0000 2019,RT @DEANEWYORKDiv: Last night- at the Annual Federal Drug Agents Foundation #FDAF True American Hero Award: Congratulations to United State…
1191377544538398700,Mon Nov 04 15:31:55 +0000 2019,https://t.co/e4wTAckSsI
1190248888520892400,Fri Nov 01 12:47:03 +0000 2019,https://t.co/NkHjYCPMc7
1189890575329304600,Thu Oct 31 13:03:14 +0000 2019,Christopher Bowlin:  Wanted child molester believed to be homeless in Eastern Washington https://t.co/OTwUDaHdbx via @Q13FOX
1189872790582812700,Thu Oct 31 11:52:34 +0000 2019,Rapist released from Georgia prison in error is apprehended in Kentucky https://t.co/7EZQlvL7u8 via @nbcnews
1189759496853360600,Thu Oct 31 04:22:23 +0000 2019,RT @GA_Corrections: #BREAKING .@GA_Corrections Escapee/Release in Error Tony Maycon Munoz-Mendez captured in Ft. Thomas, Kentucky at 10:30p…
1189516582218797000,Wed Oct 30 12:17:08 +0000 2019,The third episode of the ABC News podcast on US Marshals 15 Most Wanted fugitive Lester Eubanks dropped today. https://t.co/p6V80eetoN
1189183674169753600,Tue Oct 29 14:14:16 +0000 2019,Cleveland man wanted in shooting death of sister arrested by U.S. Marshals https://t.co/3uMZU43tpX
1189183309621780500,Tue Oct 29 14:12:49 +0000 2019,Convicted Rapist and Child Molester Released 'In Error' from Georgia Prison https://t.co/79tl1foTaI
1189183030960615400,Tue Oct 29 14:11:43 +0000 2019,https://t.co/vCeaXySN34
1188274220343541800,Sun Oct 27 02:00:25 +0000 2019,The U.S. Marshals held a live/online auction in Woodland, Calif., today for 148 classic, luxury, and performance ve… https://t.co/j3Ty7LuWAz
1188224493803757600,Sat Oct 26 22:42:50 +0000 2019,https://t.co/qtL8QdHITg
1188179148176380000,Sat Oct 26 19:42:38 +0000 2019,Assistant Chief Jennifer Crane from Asset Forfeiture Division explains the auction of 149 cars in Woodland, Califor… https://t.co/hsL6PSxNI5
1188139517603004400,Sat Oct 26 17:05:10 +0000 2019,Live at a  US Marshals car auction ... https://t.co/5IS2xmln6y
1188101408383365000,Sat Oct 26 14:33:44 +0000 2019,Live/online car auction is happening today  https://t.co/N54IOLsed8
1187843218098008000,Fri Oct 25 21:27:46 +0000 2019,RT @USAttyHerdman: Deputy US Marshal Dave Siler is the best in the business &amp; @NDOHnews is proud to work with him every day. Can't wait to…
1187829144253542400,Fri Oct 25 20:31:51 +0000 2019,You can watch our biggest car auction ever (classic, muscle and luxury cars) from a single owner LIVE at this link.… https://t.co/Frn52wy5ia
1187776871301353500,Fri Oct 25 17:04:08 +0000 2019,149 rare classic cars, performance vehicles up for sale in largest US Marshals auction https://t.co/4EsZ4xnJc4
1187774432003215400,Fri Oct 25 16:54:27 +0000 2019,RT @DEAOmahaDiv: #FugitiveFriday:  Gabriel Mata-Becerra, 26 y/o , Hispanic, 5-11, 230 lbs, bl hair/br eyes. Wanted for conspiracy to posses…
