id,created_at,text
1240699563154886700,Thu Mar 19 18:00:01 +0000 2020,The U.S. Marshals assisted in the recapturing of both inmates who escaped from the Wilkinson County Community Work… https://t.co/5tk9UJRnhs
1240684457830387700,Thu Mar 19 17:00:00 +0000 2020,A Monroe County teen accused of killing her special-needs brother and mother is headed back to Georgia by the U.S.… https://t.co/xc1vvlHsKJ
1240669362283044900,Thu Mar 19 16:00:01 +0000 2020,The USMS established the 15 Most Wanted Fugitive Program in 1983 to prioritize investigation &amp; apprehension of some… https://t.co/wvpT8HJgZp
1240654259030499300,Thu Mar 19 15:00:00 +0000 2020,Local and federal law enforcement authorities are seeking two men wanted in connection with one of two Saturday mor… https://t.co/taiPQ2d2Hk
1240639163885650000,Thu Mar 19 14:00:01 +0000 2020,Two men were arrested by members of the U.S. Marshals Service Florida Regional Fugitive Task Force for robbing and… https://t.co/zQT8SjkDLE
1240626800990081000,Thu Mar 19 13:10:53 +0000 2020,RT @ODMP: Join ODMP in remembering Deputy Sheriff Thomas L. Reuter of the Grant County Sheriff's Department (WI) on the 30th anniversary of…
1240624160658915300,Thu Mar 19 13:00:24 +0000 2020,California Department of Insurance took Yeghishe Msryan into custody after he was arrested in Poland and extradited… https://t.co/6AgWXCe2Br
1240622005071863800,Thu Mar 19 12:51:50 +0000 2020,RT @JaneHoodless: Wyatt Earp–born #OTD 1848–lived a restless life. He was at different times a constable, city policeman, county sheriff, d…
1240382468148134000,Wed Mar 18 21:00:00 +0000 2020,U.S. Marshals assisted in the rescue of a 25-year-old Palatka woman who was kidnapped by Carl L. Oxendine. He was a… https://t.co/O2kWQxP0x0
1240367370557886500,Wed Mar 18 20:00:00 +0000 2020,A Montgomery restaurant owner and her husband have been indicted on federal charges that include money laundering.… https://t.co/MXxJGUYVDj
1240352271873052700,Wed Mar 18 19:00:00 +0000 2020,The U.S. Marshals NY/NJ Regional Fugitive Task Force in Utica arrested a Brooklyn man on March 12 on two warrants,… https://t.co/hwV6TBUSfR
1240348619858940000,Wed Mar 18 18:45:30 +0000 2020,RT @ATFColumbus: Cleveland man and convicted felon pleads guilty to possessing firearms and ammunition following standoff with US Marshals…
1240348381534396400,Wed Mar 18 18:44:33 +0000 2020,RT @JacksonMSPolice: UPDATE: Suspect, John Greer, Jr. was apprehended in TX with assistance from @USMarshalsHQ and local authorities. He is…
1240337173217493000,Wed Mar 18 18:00:01 +0000 2020,The U.S. Marshals Service in South Carolina took Reedsburg natives Gunnar Tempest and Logan Owen into custody in co… https://t.co/538ooZ4XsH
1240322072858857500,Wed Mar 18 17:00:00 +0000 2020,15-year-old Daiveon Allison turned himself in after being sought by the Antioch Police Department and the U.S. Mars… https://t.co/oa8xrcQBSY
1240306972588572700,Wed Mar 18 16:00:00 +0000 2020,The DeKalb County Sheriff’s Office Fugitive Unit, with the assistance of U.S. Marshals, arrested 25-year-old Atlant… https://t.co/ZBFn9tqMEI
1240291874239373300,Wed Mar 18 15:00:00 +0000 2020,US Marshals with the assistance of the Monett Police Department took Jacob Eubanks, 19, into custody for multiple F… https://t.co/K2ceU3mxwv
1240276774262456300,Wed Mar 18 14:00:00 +0000 2020,A wanted fugitive is now in custody following an arrest made Thursday, March 12, by the Holmes County Sheriff’s Off… https://t.co/7VSABcu8XZ
1240261674877272000,Wed Mar 18 13:00:00 +0000 2020,The U.S. Marshals assisted in the manhunt for Robert Johnson Jr. who was linked to a July homicide by a bloody palm… https://t.co/VizyGuQXdb
1240020082593415200,Tue Mar 17 21:00:00 +0000 2020,U.S. Marshals are searching for a man wanted for failing to register as a sex offender: https://t.co/QQJetLyhbg
1240004983652782000,Tue Mar 17 20:00:00 +0000 2020,The U.S. Marshals assisted in the arrest of Jason Nesmith, accused of domestic violence in the city of Watervliet.… https://t.co/rP4JyUYeHa
1239989884699529200,Tue Mar 17 19:00:01 +0000 2020,Steven Hoffman is wanted by the Woodbury County Sheriff's Office for Failure to Appear on charges of Aggravated Ass… https://t.co/Qomix1gH0r
1239974784433184800,Tue Mar 17 18:00:00 +0000 2020,Leroy Stotelmyer detained twice in same week for falsely claiming he was a U.S. Marshal: https://t.co/nyCyNtLzBL
1239959684146024400,Tue Mar 17 17:00:00 +0000 2020,The USMS established the 15 Most Wanted Fugitive Program in 1983 to prioritize investigation &amp; apprehension of some… https://t.co/3K4CjBazEQ
1239944586564436000,Tue Mar 17 16:00:01 +0000 2020,On March 17, 2006, John F. Clark was appointed the Director of the USMS. He was in acting capacity since August 1,… https://t.co/3rLi9EMKeV
1239929485165650000,Tue Mar 17 15:00:00 +0000 2020,On March 17, 1877, Frederick Douglass—noted scholar, author, abolitionist and statesman –was appointed U.S. Marshal… https://t.co/U9kABWxJve
1239914388125036500,Tue Mar 17 14:00:01 +0000 2020,U.S. Marshals Fugitive Task Force arrests Wilkes-Barre homicide suspect in Queens, NY: https://t.co/PilXIm1ZjY
1239899285153435600,Tue Mar 17 13:00:00 +0000 2020,New Hampshire 'Fugitive of the Week' arrested in Merrimack by Merrimack PD: https://t.co/AInvtJ6MnY
1239657693087821800,Mon Mar 16 21:00:00 +0000 2020,Deputies and U.S. Marshals arrested Kenneth Jacob Adkins, 20, without incident for homicide charges in Mercer Count… https://t.co/IkyzPiIirf
1239642592947482600,Mon Mar 16 20:00:00 +0000 2020,The Walker County Sheriff's Office recently kicked off an effort dubbed "Operation March Madness" that has resulted… https://t.co/NUagdSzFzI
1239631670304702500,Mon Mar 16 19:16:36 +0000 2020,RT @FBI: Watch out for emails claiming to be from the @CDCgov or others saying they have information about the virus, and don't click on li…
1239627495831261200,Mon Mar 16 19:00:00 +0000 2020,A new list of the most wanted fugitives in central Ohio has just been announced by the United States Marshals Servi… https://t.co/yc44JBO9tR
1239612397226053600,Mon Mar 16 18:00:01 +0000 2020,The U.S. Marshals have arrested six people in the Fort Gay, WV area for multiple break-ins and drug possession charges.
1239597297316573200,Mon Mar 16 17:00:00 +0000 2020,A Dayton man wanted by U.S. Marshals in connection to a deadly shooting at Eagle Ridge Apartments earlier this mont… https://t.co/zTAraqyg4Q
1239582198681886700,Mon Mar 16 16:00:01 +0000 2020,As we celebrate #WomensHistoryMonth, we look back to April 1975, when ten female deputies graduated from the USMS T… https://t.co/P9WFhcsOUU
1239567096373227500,Mon Mar 16 15:00:00 +0000 2020,3 new Marshals were sworn in to respective districts the at U.S. Marshals HQ. Taking the oath were: Ralph I. Sozio,… https://t.co/QlwmjIKQ6R
1239551997512048600,Mon Mar 16 14:00:00 +0000 2020,Former Grayson County Sheriff, and U.S. Marshal, Keith Gary died on Friday morning. He was 84: https://t.co/mhSCLdSsCq
1239537668033306600,Mon Mar 16 13:03:04 +0000 2020,President Donald Trump has nominated Gregory S. Tabor as U.S. Marshal for the Western District of Arkansas: https://t.co/UB7hJz6SGV
1238570529717616600,Fri Mar 13 21:00:00 +0000 2020,U.S. Marshals Greater Idaho Fugitive Task Force assisted the Boise Police Department Violent Crimes Unit arrest Mar… https://t.co/YwHQWJue2u
1238555430420439000,Fri Mar 13 20:00:00 +0000 2020,Alcides Lucas Ordonez-Cruz, 27, of Kenosha, Wisconsin was arrested by U.S. Marshals in Kentucky on Tuesday on the c… https://t.co/yHgrQXMRDo
1238540331672428500,Fri Mar 13 19:00:00 +0000 2020,US Marshal’s Violent Fugitive Task Force in Chattahoochee, along with the Tallahassee Police Department's Career Cr… https://t.co/H91z4Csyjy
1238525233943982000,Fri Mar 13 18:00:01 +0000 2020,With the assistance of the U.S. Marshals, Danbury Police were able to arrest Andrew Fermin, 29, for carrying out a… https://t.co/QbdNRNlq7x
1238510132314525700,Fri Mar 13 17:00:00 +0000 2020,U.S. Marshals arrested Lateaka Madison, 28, in Youngstown, Ohio, for an aggravated burglary warrant. Originally, Ma… https://t.co/3AnzO0G1I6
1238495037362561000,Fri Mar 13 16:00:01 +0000 2020,A man sought by Selma police in a 2019 drive-by shooting was apprehended in Arizona with the help of U.S. Marshals: https://t.co/dDbGfwHTL2
1238479937272758300,Fri Mar 13 15:00:01 +0000 2020,Eugene police and the U.S. Marshals Service arrested a sex offender trying to flee the country at the Eugene Airpor… https://t.co/AkTGgkOSSG
1238464835035201500,Fri Mar 13 14:00:00 +0000 2020,Wednesday's “Fugitive of the Week,” Benjamin Bergeron, 30, was arrested yesterday afternoon without incident by the… https://t.co/noFB2rM4Et
1238450640482951200,Fri Mar 13 13:03:36 +0000 2020,She passed away in Cheyenne in May 1996. #WomensHistoryMonth #USMS
1238450639644082200,Fri Mar 13 13:03:36 +0000 2020,The key witness in the case was a 14-year-old girl, who the impersonator had threatened.  She safeguarded the youth… https://t.co/pQSfAC00mQ
1238450638893310000,Fri Mar 13 13:03:36 +0000 2020,She joined the Cheyenne, Wyoming office, and had a number of interesting cases. One involved a man from Rawlins, Wy… https://t.co/6eCWqasaFb
1238450637907640300,Fri Mar 13 13:03:36 +0000 2020,One of the most noted female deputies in history was Esther A. Duerkson, who was in that position from December 16,… https://t.co/H3J3Ix95bj
1238208144200708000,Thu Mar 12 21:00:01 +0000 2020,Deaven Raeshawn Cherry, wanted since September 2016 for multiple crimes related to his role in a violent drug distr… https://t.co/N3r5KAgnEm
1238177942800175000,Thu Mar 12 19:00:00 +0000 2020,The New Hampshire Joint Fugitive Task Force is attempting to find Benjamin Andre Bergeron, 30, convicted of assault… https://t.co/kMQrrjhZQ2
1238162844602044400,Thu Mar 12 18:00:00 +0000 2020,Thanks to a tip from the public most wanted suspect, David Thomas, was arrested by the U.S. Marshals, with the help… https://t.co/86GozxujZ4
1238147743312470000,Thu Mar 12 17:00:00 +0000 2020,The U.S. Marshals are searching for a man who is wanted in connection to child sex crimes in Chester, VA: https://t.co/Sz9LoJPDxC
1238132648968503300,Thu Mar 12 16:00:01 +0000 2020,A Baltimore man who had been running away from the @ATFHQ for four years is in custody Wednesday, thanks to U.S. Ma… https://t.co/Dt7SUrfMzp
1238117548979150800,Thu Mar 12 15:00:01 +0000 2020,A man awaiting resentencing for an armed standoff with U.S. Marshals who surrounded his fortress-like home in 2007… https://t.co/heLblTmv9c
1238102446951395300,Thu Mar 12 14:00:00 +0000 2020,The USMS established the 15 Most Wanted Fugitive Program in 1983 to prioritize investigation &amp; apprehension of some… https://t.co/i1Y0z1JH5j
1238088997286613000,Thu Mar 12 13:06:34 +0000 2020,U.S. Marshals Fugitive Task Force arrests Scranton shooting suspect in Allentown: https://t.co/Qp5wcW8XWI
1237830657599922200,Wed Mar 11 20:00:01 +0000 2020,Members of the U.S. Marshals Fugitive Task Force arrested 19-year-old Demetrius Aponcedeleon Hardy Jr. for the Gain… https://t.co/WoQP5APMic
1237815558306812000,Wed Mar 11 19:00:01 +0000 2020,Katherine Battle Gordy made history in 1949 when she became the first woman ever to be appointed, although temporar… https://t.co/XR7d79ptGK
1237803301816721400,Wed Mar 11 18:11:19 +0000 2020,https://t.co/Gqs1nltEbt
1237800458946842600,Wed Mar 11 18:00:01 +0000 2020,The U.S. Marshals arrested Jonathan Wesley Wright for writing counterfeit checks to purchase horses in Texas and Lo… https://t.co/7Ucn6vbLzx
1237785359968129000,Wed Mar 11 17:00:01 +0000 2020,Investigators with the Nebraska State Patrol and the U.S. Marshals arrested Trampus Schultz, 45, on a Colorado warr… https://t.co/I7dpZBiY5k
1237780973665816600,Wed Mar 11 16:42:35 +0000 2020,RT @ATFBaltimore: CAPTURED: @USMarshalsHQ arrested Deaven Cherry in Baltimore County this morning, an ATF fugitive since 2016. He is federa…
1237770257781137400,Wed Mar 11 16:00:00 +0000 2020,The U.S. Marshals assisted Lamberton, MN police officers arrest Austin David Svejda found in a Seattle airport afte… https://t.co/eCjDASgK54
1237748687759163400,Wed Mar 11 14:34:18 +0000 2020,In March 1953, U.S. Marshals participated in standardized law enforcement training for the first time. The curricul… https://t.co/qiqF20c1s3
1237740060281376800,Wed Mar 11 14:00:01 +0000 2020,David Gilmore, 20, was arrested, by the U.S. Marshals Great Lakes Regional Fugitive Task Force, as the fourth man i… https://t.co/dnZ8kWy6gh
1237725356494225400,Wed Mar 11 13:01:35 +0000 2020,The Lone Star Fugitive Task Force is searching for a man wanted on two counts of aggravated sexual assault of a chi… https://t.co/c9rXhR06v3
1237483364979900400,Tue Mar 10 21:00:00 +0000 2020,The U.S. Marshals Violent Fugitives Task Force has arrested the parents of a child they are accused of killing: https://t.co/vjHuNnDzzk
1237468269038231600,Tue Mar 10 20:00:01 +0000 2020,The U.S. Marshals Southern Ohio Fugitive Apprehension Strike Team assisted Hocking County Sheriff’s Office in captu… https://t.co/j1iEKP89Nk
1237453170286235600,Tue Mar 10 19:00:01 +0000 2020,The Washington County Sheriff's Office in Virginia and the U.S. Marshals Service are looking for Steven Brian Corde… https://t.co/4tqjDJaq8b
1237438071605309400,Tue Mar 10 18:00:01 +0000 2020,U.S. Marshals are searching for a man wanted on federal charges for being a felon with a gun: https://t.co/s9Xl2ezumu
1237436264107970600,Tue Mar 10 17:52:50 +0000 2020,RT @USAO_MDGA: #ProjectSafeNeighborhoods “Creating safer communities is a joint effort &amp; we are fortunate to have the dedicated partnership…
1237422969854382000,Tue Mar 10 17:00:00 +0000 2020,The Lake County Sheriff's office Warrants Team and the U.S. Marshals Service Great Lakes Regional Fugitive Task For… https://t.co/ovFMbso27W
1237407872432124000,Tue Mar 10 16:00:01 +0000 2020,Lawmen for more than a dozen agencies, including the U.S. Marshals, fanned out over Etowah County, AL. in a massive… https://t.co/gVL72u9bAw
1237401947138928600,Tue Mar 10 15:36:28 +0000 2020,RT @DEALOSANGELES: Great #LawEnforcement team work with @FBILosAngeles, @USAO_LosAngeles, @ICEgov #HSI, @IRSnews Criminal Investigation, @U…
1237392770068893700,Tue Mar 10 15:00:00 +0000 2020,The USMS established the 15 Most Wanted Fugitive Program in 1983 to prioritize investigation &amp; apprehension of some… https://t.co/iqFEw3vzRS
1237377669223927800,Tue Mar 10 14:00:00 +0000 2020,The U.S. Marshals and Little Rock Police need your help to find Edgar Leonardo Mejia Lopez, 34, who has active warr… https://t.co/qsyF6FCQS7
1237372859678367700,Tue Mar 10 13:40:53 +0000 2020,RT @USAO_MDGA: @USAO_MDGA Media Advisory: USA Charlie Peeler, @MaconCrime Chair Warren Selby are holding a joint press conference today at…
1237362572455641000,Tue Mar 10 13:00:01 +0000 2020,On September 13, 1929, the Daily Times, Chicago, published an article on the women of the U.S. Marshals. On the rig… https://t.co/cZSU4SliE2
1237120978926178300,Mon Mar 09 21:00:00 +0000 2020,The Burlington Police Department, with the help of the U.S. Marshals, arrested three people in connection to illega… https://t.co/76gw5xi6SD
1237105877678567400,Mon Mar 09 20:00:00 +0000 2020,Travis Simon, 30, of Manhattan, NY was arrested in Milford, CT and was ordered held in lieu of a $500,000 bond. Sim… https://t.co/GuHgDuIKIn
1237090780113776600,Mon Mar 09 19:00:00 +0000 2020,Kareem Demetrius Hamilton was arrested by U.S. Marshals in Columbia on Friday and charged with murder and possessio… https://t.co/LvMvYlZc45
1237088094421233700,Mon Mar 09 18:49:20 +0000 2020,RT @TheJusticeDept: #DidYouKnow? Katherine Battle Gordy became the first woman to be appointed as a U.S. Marshal in 1949. Though it was a t…
1237075682393456600,Mon Mar 09 18:00:01 +0000 2020,A new list of the most wanted fugitives in Central Ohio has just been announced by the United States Marshals Servi… https://t.co/1KHkaKhUlA
1237060580168609800,Mon Mar 09 17:00:00 +0000 2020,A Tulsa man already convicted of threatening to kill a Tulsa police officer is now charged with threatening to kill… https://t.co/XDomLTTq9g
1237045480611360800,Mon Mar 09 16:00:00 +0000 2020,After being given multiple chances to come forward, U.S. Marshals are now asking the public for any information lea… https://t.co/3vw94xLwqF
1237030381280346000,Mon Mar 09 15:00:00 +0000 2020,The Senior Executive Service Installation Ceremony was held at USMS headquarters last Friday. Director Donald Washi… https://t.co/DfXqtoxNX3
1237029473909956600,Mon Mar 09 14:56:24 +0000 2020,RT @NDILnews: It was a privilege to join the U.S. Marshals and other law enforcement partners in Chicago for the annual USMS Fallen Heroes…
1237015281685258200,Mon Mar 09 14:00:00 +0000 2020,Ada Carnutt was one of the first women to wear a Deputy U.S. Marshal's badge.  In 1893, she single-handedly arreste… https://t.co/ruXliI6qbv
1237000653790163000,Mon Mar 09 13:01:52 +0000 2020,Deputy Marshal Steve Linder from the Northern District of Illinois is showing children how to properly defend thems… https://t.co/j2i6YBDzfp
1236290507841519600,Sat Mar 07 14:00:00 +0000 2020,On March 1, 1790, Congress passed the Act establishing the first national census.  The Act made the U.S. Marshals r… https://t.co/eGZ6cwTvbD
1236048916510118000,Fri Mar 06 22:00:01 +0000 2020,Darius Anthony Williams, 23, was arrested Tuesday after U.S. Marshals located him at the Oyo Hotel in Jackson, Miss… https://t.co/tFhqGr5KKc
1236047395672281000,Fri Mar 06 21:53:58 +0000 2020,Southern Alabama, Oregon and South Texas. Keep it coming. https://t.co/kVMWUT9Et8
1236039532891562000,Fri Mar 06 21:22:43 +0000 2020,RT @Chicago_Police: Members of the #ChicagoPolice Department spent the early morning hours today, supporting our federal partners with the…
1236033816361238500,Fri Mar 06 21:00:00 +0000 2020,A 38-year-old convicted sex offender was charged with resisting arrest after he sped away from U.S. Marshals. He le… https://t.co/HujSBfBml5
1236032586352341000,Fri Mar 06 20:55:07 +0000 2020,RT @ATFMiami: ARRESTED! With the tireless assistance of @USMarshalsHQ &amp; @PRPDNoticias Heriberto Torres Díaz was identified as the second sh…
1236032533298663400,Fri Mar 06 20:54:54 +0000 2020,RT @ATFMiami: ARRESTADO! Con la incansable asistencia de @USMarshalsHQ y @PRPDNoticias Heriberto Torres Díaz fue identificado como el segun…
1236030319352066000,Fri Mar 06 20:46:07 +0000 2020,Southern Illinois and South Carolina. Coming together for the fallen. https://t.co/Ha6Nk08Tzo
1236018717366128600,Fri Mar 06 20:00:00 +0000 2020,The U.S. Marshals Service located and arrested a 17-year-old boy who is now awaiting extradition in Oregon in conne… https://t.co/saQPyJ0HcT
1236009175764869000,Fri Mar 06 19:22:06 +0000 2020,MD, Middle TN, NV and Puerto Rico. Fantastic work!!! https://t.co/itHybLu8MM
1236003618236465200,Fri Mar 06 19:00:01 +0000 2020,A fugitive wanted for the forcible rape and aggravated assault of a 5-year-old child in Watertown, S.D., was captur… https://t.co/B5j3OQJz03
1235988519648018400,Fri Mar 06 18:00:01 +0000 2020,In the first of three talks hosted by the U.S. Marshals Museum, Lara Schwartz, director of the Project on Civil Dis… https://t.co/mX4mPRXcam
1235973416089354200,Fri Mar 06 17:00:00 +0000 2020,Cody Murphree, 26, and Derek Pederson, 29, were arrested by U.S. Marshals and Iowa law enforcement officers in Coun… https://t.co/xJzxZhU8mP
1235971591508459500,Fri Mar 06 16:52:45 +0000 2020,Another round of USMS staff running to honor the fallen. Middle FL, South IN and Western VA.  Keep it up. https://t.co/QzY9NTLdq7
1235969972788215800,Fri Mar 06 16:46:19 +0000 2020,RT @DEAHQ: #FugitiveFriday @DEAATLANTADiv is looking for Kimberly Deanne Page. She is wanted for conspiracy to possess with intent to distr…
1235960249888239600,Fri Mar 06 16:07:41 +0000 2020,Here are some additional districts, South FL, West TX and North GA; including a couple deputies from Marquette, MI… https://t.co/IYSCvoqxjW
1235958321699422200,Fri Mar 06 16:00:01 +0000 2020,Early this morning, officers and staff members from the U.S. Marshals, across the country, participated in the annu… https://t.co/ZuFk7VByE5
1235943455261634600,Fri Mar 06 15:00:57 +0000 2020,The U.S. Marshals recaptured two escaped prison inmates who fled from an eastern Nebraska jail to western Iowa. Bot… https://t.co/L9hQmMbDVy
1235928122010341400,Fri Mar 06 14:00:01 +0000 2020,Franklin County sexual assault fugitive returned to U.S. from Canada: https://t.co/qupEaKuR7I
1235886545644556300,Fri Mar 06 11:14:48 +0000 2020,RT @BrocktonPolice: #Onelessgun There are fewer guns&amp;drugs on the street today thx to @BrocktonPolice &amp; their partners.We seized an AK-47,…
1235686528648544300,Thu Mar 05 22:00:01 +0000 2020,The District of New Hampshire - New Hampshire Joint Fugitive Task Force has been brought in to assist finding a car… https://t.co/lNhaMZ9MZD
1235671427279392800,Thu Mar 05 21:00:00 +0000 2020,A two-day operation in Killeen, TX resulted in the arrest of nearly 50 people on drug and weapons charges. The oper… https://t.co/Jm5iAQgmYA
1235656328455975000,Thu Mar 05 20:00:00 +0000 2020,Orangeburg County Sheriff’s investigators and U.S. Marshals arrested a man for kidnapping a couple, shooting the ma… https://t.co/RwdhrERW14
1235641227162329000,Thu Mar 05 19:00:00 +0000 2020,The Lafayette Police Department and U.S. Marshals Service Violent Offender Task Force arrested 27-year-old Cody Wil… https://t.co/QVByq1h1yc
1235626128301109200,Thu Mar 05 18:00:00 +0000 2020,Glynn County Police Department arrested Allen Parker wanted for allegedly robbing two banks in Brunswick, Ga. U.S.… https://t.co/9zUYRLi2H8
1235611031302361000,Thu Mar 05 17:00:01 +0000 2020,The U.S. Marshals Service Fugitive Taskforce ended their search for Juan Carlos Alcantara-Rivas, 36, after he was a… https://t.co/YTPEchPfKM
1235595932420526000,Thu Mar 05 16:00:01 +0000 2020,The USMS established the 15 Most Wanted Fugitive Program in 1983 to prioritize investigation &amp; apprehension of some… https://t.co/IvftFCNCCC
1235586091522166800,Thu Mar 05 15:20:54 +0000 2020,We have met the goal of 100 applicants and the announcement is now closed. Thanks to all who applied; stay tuned fo… https://t.co/edXytoTIz1
1235580830417903600,Thu Mar 05 15:00:00 +0000 2020,U.S. Marshals arrest South Carolina fugitive in Delaware County: https://t.co/HEyGfWnYHj
1235565733150519300,Thu Mar 05 14:00:01 +0000 2020,On March 5, 1969, Carl Turner was appointed Chief, Executive Office for United States Marshals. His was the last ap… https://t.co/5Eh0xawSzj
1235333579351232500,Wed Mar 04 22:37:31 +0000 2020,We can confirm that Kenneth Petty self-surrendered to the U.S. Marshals in Los Angeles today. We do not disclose an… https://t.co/McYdytTGOD
1235324139994583000,Wed Mar 04 22:00:00 +0000 2020,Akron police and members of the U.S. Marshals Northern Ohio Violent Fugitive Task Force have arrested a man accused… https://t.co/W778KgceNT
1235309042085417000,Wed Mar 04 21:00:01 +0000 2020,U.S. Marshals and @ATFHQ assisted Mesa County Sheriff's Office arrest seven people in the area who had active felon… https://t.co/16CuZtbjLD
1235293940884156400,Wed Mar 04 20:00:00 +0000 2020,Tijuan Lamar Phillips, 19, and Markel Trevon Smith, 20, were arrested Monday in Petersburg by agents from the U.S.… https://t.co/LPwA4RDIMM
1235284860878626800,Wed Mar 04 19:23:55 +0000 2020,RT @ATFMiami: Thanks to the #collaborative work from Homestead PD @MiamiDadePD @USMarshalsHQ @ATFMiami Thomas Edward Daniels has been arres…
1235278839325941800,Wed Mar 04 19:00:00 +0000 2020,A man wanted for vehicular homicide in North Charleston was captured by U.S. Marshals in Philadelphia on Tuesday mo… https://t.co/kDsTOqaJVT
1235263743073935400,Wed Mar 04 18:00:01 +0000 2020,The North Texas Fugitive Task Force assisted the Lubbock Police Department Major Crash Investigation Unit in the ar… https://t.co/1wii41IsVQ
1235248643403182000,Wed Mar 04 17:00:01 +0000 2020,U.S. Marshals assisted local law enforcement capture the last of 3 escaped prisoners from a Montana jail. Andrew Pa… https://t.co/YncUlKxA1t
1235233540427501600,Wed Mar 04 16:00:00 +0000 2020,The Carolina Regional Fugitive Task Force apprehended Jennifer Sahr in North Myrtle Beach wanted in the 2008 Baby B… https://t.co/ox4MIGagn0
1235218445278556200,Wed Mar 04 15:00:01 +0000 2020,The U.S. Marshals arrested two fugitives wanted for the murder of an Oklahoma City man: https://t.co/70azJAVPtW
1235206155808518100,Wed Mar 04 14:11:11 +0000 2020,The U.S. Marshals assisted in the successful reunification a 4-year-old child, who was abducted from her preschool… https://t.co/QUBM6FZEgM
1234961752527229000,Tue Mar 03 22:00:00 +0000 2020,On March 3, 1817, the Territory of Alabama was created.  It was effective upon the admission of Mississippi as a st… https://t.co/8FwcZNPCVe
1234946649916657700,Tue Mar 03 21:00:00 +0000 2020,U.S. Marshals and Washington County Sheriff's Office in Virginia are searching for Carrie Lynn Bordwine for probati… https://t.co/htaXCPZMfu
1234931551109968000,Tue Mar 03 20:00:00 +0000 2020,McCracken County deputies and U.S. Marshals were searching for 36-year-old Nicholas Roesner for multiple outstandin… https://t.co/LjfkRphZIF
1234916451192131600,Tue Mar 03 19:00:00 +0000 2020,McCracken County Sheriff’s Office and deputy U.S. Marshals arrested a Georgia 16-year-old  in McCracken County, Ken… https://t.co/v3O2Py7IF1
1234914962616832000,Tue Mar 03 18:54:05 +0000 2020,The USMS established the 15 Most Wanted Fugitive Program in 1983 to prioritize investigation &amp; apprehension of some… https://t.co/PgNgiLsY09
