id,created_at,text
1222640563079598000,Wed Jan 29 22:00:00 +0000 2020,A corrections officer is in the hospital after he was attacked by an inmate Tuesday in Elk River, Minnesota: https://t.co/zFt2iQILbn
1222625463862026200,Wed Jan 29 21:00:00 +0000 2020,U.S. Border Patrol agents arrested an MS-13 gang member in Toledo: https://t.co/MhSKa6KELi
1222610363197223000,Wed Jan 29 20:00:00 +0000 2020,Charles M. Lieber, the chair of the chemistry and chemical biology department at Harvard University, was arrested o… https://t.co/jwb2g2PXcu
1222600028495261700,Wed Jan 29 19:18:56 +0000 2020,Man accused of faking suicide to avoid jail for child rape added to U.S. Marshals 15 Most Wanted Fugitive List: https://t.co/4AZ0EbChjb
1222595264453709800,Wed Jan 29 19:00:00 +0000 2020,Embattled Southland attorney Michael Avenatti Tuesday appealed a federal judge’s order to jail him as he awaits tri… https://t.co/XGVUS67sUv
1222580165743497200,Wed Jan 29 18:00:00 +0000 2020,A federal office building in Anchorage was partially evacuated after security officers detected a suspicious packag… https://t.co/PycsqjokJt
1222565068438528000,Wed Jan 29 17:00:01 +0000 2020,A Coker University student has died from wounds sustained in the weekend shooting at a Hartsville nightclub; The So… https://t.co/m4MnYGwN59
1222562663701590000,Wed Jan 29 16:50:27 +0000 2020,RT @AmerSecToday: @USMarshalsHQ &amp; @FBI Urge Public to #ReportPhoneScams (Multi-Video) #Fraudspoofers using govt employees names and numbers…
1222549970433106000,Wed Jan 29 16:00:01 +0000 2020,The good news for an alleged federal fugitive who splashed a snowplow into the Platte River on Tuesday was that peo… https://t.co/LPloNZChD3
1222545530330415000,Wed Jan 29 15:42:22 +0000 2020,Last week members of the Business Executives for National Security (@BENS_org) visited with USMS leadership to lear… https://t.co/pIgG3sAsUc
1222540514249015300,Wed Jan 29 15:22:26 +0000 2020,RT @FBIWFO: #FBIWFO is assisting @DCPoliceDept  &amp; @USMarshalsHQ in locating Juvon Julian Searles, #wanted for July 24, 2018, murder of indi…
1222534869655355400,Wed Jan 29 15:00:01 +0000 2020,On January 29, 1813, U.S. Marshal James Prince of the District of Connecticut, while trying to support the governme… https://t.co/vv2BY9zWQZ
1222519766096568300,Wed Jan 29 14:00:00 +0000 2020,On January 29, 1861, when Kansas was admitted as a state. The Territory of Kansas was created almost seven years ea… https://t.co/J5hg8j0ua6
1222497633320800300,Wed Jan 29 12:32:03 +0000 2020,Out of the drink and into the clink: Fugitive drives snowplow into river, cops reel him in https://t.co/hP2lT31YLv via @owhnews
1222278177004777500,Tue Jan 28 22:00:00 +0000 2020,Wilmington Police arrested a man in connection with a 2019 murder in the city: https://t.co/pYil9fhwfZ
1222263078311682000,Tue Jan 28 21:00:01 +0000 2020,U.S. Marshal Martin J. Pane said the arrest of Christopher Ray Lamont, 46, of Philadelphia happened Monday without… https://t.co/N9UmekWpDv
1222259539745091600,Tue Jan 28 20:45:57 +0000 2020,Investigation Discovery to feature Mansfield fugitive Lester Eubanks on Jan. 29 https://t.co/WDeLm4Q9p5 via @ashlandsource
1222259406848561200,Tue Jan 28 20:45:25 +0000 2020,Lester Eubanks case to be featured on Investigation Discovery https://t.co/EPvT1HtW2U via @MansfieldNJ
1222247976426360800,Tue Jan 28 20:00:00 +0000 2020,U.S. Marshals on Monday captured a borough man wanted in connection with a home-invasion robbery that took place la… https://t.co/JxtEgxdbkI
1222232877015789600,Tue Jan 28 19:00:00 +0000 2020,17-year-old Kurt Sova died in 1981 after leaving a house party in Newburgh Heights. His body was found in a ravine… https://t.co/i2BwwsY7i6
1222217778473529300,Tue Jan 28 18:00:00 +0000 2020,The 16-year-old male suspect has been charged in the shooting of Birmingham narcotics detective John Finke. Finke w… https://t.co/gVT3OAgrJa
1222202681386774500,Tue Jan 28 17:00:01 +0000 2020,A suspected West Texas drug lord was recently extradited to Midland from Mexico earlier this month. Benjamin Valeri… https://t.co/iRkq76JjAg
1222187579258179600,Tue Jan 28 16:00:00 +0000 2020,Citing safety concerns, South Bend’s Common Council Monday night unanimously approved a bill authorizing “ride shar… https://t.co/1F8oGH8J2q
1222172479394865200,Tue Jan 28 15:00:00 +0000 2020,A capital murder suspect who as a fugitive engaged in a shootout with officers who were trying to arrest him in 201… https://t.co/xxm2N3xbgf
1222166938295722000,Tue Jan 28 14:37:59 +0000 2020,RT @DEAWashingtonDC: Taking down a local man distributing killer opioid doses in the DC area  With @LeesburgPolice @LoudounSheriff @Fairfax…
1222160870039597000,Tue Jan 28 14:13:52 +0000 2020,Cooperation between local, federal and Mexican authorities coupled with tips from area residents led to the arrest… https://t.co/12rgHzNWYH
1221915787004301300,Mon Jan 27 22:00:00 +0000 2020,A Georgia man is being held without bail at the Lake County jail after local authorities arrested him on a warrant… https://t.co/5IjEQgVVkt
1221900688667447300,Mon Jan 27 21:00:00 +0000 2020,A Dominican Republic man was sentenced Friday in Miami, Fla., to 65 months in prison for multiple criminal charges… https://t.co/XAbGYiBh8R
1221885588648931300,Mon Jan 27 20:00:00 +0000 2020,Gerald “Jerry” Gosmire, who runs a salvage yard in Hartford, a northwest suburb of Sioux Falls, was sentenced this… https://t.co/dNGOXJNZ5T
1221870490634993700,Mon Jan 27 19:00:00 +0000 2020,The investigation has resulted in the largest criminal forfeiture in the history of the District with over $120 mil… https://t.co/u2hAgN5imy
1221855389664280600,Mon Jan 27 18:00:00 +0000 2020,Coming from a family of first responders, Coby Wasicek said he joined the Victoria Police Department’s Explorer Pro… https://t.co/QxM64FJT0p
1221840293076570000,Mon Jan 27 17:00:01 +0000 2020,A former Southern California doctor is back in the US from Israel to serve his sentence for a $50 million plastic s… https://t.co/1Th3MQY7rG
1221825189274620000,Mon Jan 27 16:00:00 +0000 2020,One of Rockland County's most storied detectives, former Special Deputy Marshal, faced his last lineup Thursday: https://t.co/JIZlgJFVF3
1221810090656895000,Mon Jan 27 15:00:00 +0000 2020,Authorities are asking for the public's help to find an "armed and dangerous" suspect released from the Richmond Ci… https://t.co/JOjEWoccgg
1221797044685361200,Mon Jan 27 14:08:10 +0000 2020,Narcotics Detective, John Finke, was shot three times, twice in the abdomen and once under the arm while responding… https://t.co/WEGBujcZ3s
1221768478983630800,Mon Jan 27 12:14:39 +0000 2020,'Armed and dangerous' suspect wanted for clerk's murder released from Richmond City Jail https://t.co/xpHy8SuA9m via @cbs6
1221432604509032400,Sun Jan 26 14:00:00 +0000 2020,On January 26, 1825, U.S. Marshal Tench Ringgold of the District of Columbia informed the Secretary of State of dis… https://t.co/AFD8Z6cUeQ
1221432604366340000,Sun Jan 26 14:00:00 +0000 2020,...Immunity laws required U.S. Marshals and their deputies to deal with any “misbehavior” by or against foreign diplomats. #DOJ150
1220828623499923500,Fri Jan 24 22:00:00 +0000 2020,Ryan Chandler, 33, is charged with two counts of aggravated assault and one count of shooting into an occupied vehi… https://t.co/WaWo7a1TSn
1220813524215033900,Fri Jan 24 21:00:00 +0000 2020,Noah Bingham was arrested on multiple warrants including failing to appear at a January 2nd preliminary hearing on… https://t.co/acyWg3C1Q4
1220806145146790000,Fri Jan 24 20:30:41 +0000 2020,RT @DEAHQ: #FugitiveFriday Have you seen this fugitive? Yiyun Fu is wanted by  @DEADALLASDiv. Wanted for conspiracy. Know her? Call the @US…
1220799156236714000,Fri Jan 24 20:02:54 +0000 2020,RT @ATFDetroit: ATF Detroit will continue to work along side @USMarshalsHQ and our local law enforcement partners to get violent offenders…
1220798426092273700,Fri Jan 24 20:00:00 +0000 2020,Pietta USA/EMF manufacturers of the finest historical and modern firearms, known for its craftsmanship, quality and… https://t.co/RjdO6MYqJC
1220783324303462400,Fri Jan 24 19:00:00 +0000 2020,The mysterious death of Newburgh Heights teenager Kurt Sova is the subject of an upcoming event in Chicago designed… https://t.co/KyGeGRcHZn
1220768224939147300,Fri Jan 24 18:00:00 +0000 2020,A bill to create specialty Virginia license plates in honor of Tommie the pit bull is moving forward. Jyahshua A. H… https://t.co/rOzpUTOUwS
1220753650747945000,Fri Jan 24 17:02:05 +0000 2020,Our heartfelt condolences go out to @NewportNewsPD, and to the family &amp; friends Officer Thyne who was lost in the l… https://t.co/qQOJElsokj
1220753126094884900,Fri Jan 24 17:00:00 +0000 2020,The man accused of killing a woman near Marlow in 2016 is back in Stephens County after he was found in his home co… https://t.co/ONEEZFZuY5
1220745575890468900,Fri Jan 24 16:30:00 +0000 2020,Newport News Police Chief Steve Drew identified the officer who died in the line of duty Thursday night as Officer… https://t.co/XjWDfY3GCl
1220738027213009000,Fri Jan 24 16:00:00 +0000 2020,A 91-year-old man has been arrested for allegedly sexually assaulting a juvenile: https://t.co/JVkGBbCk3j
1220722930000322600,Fri Jan 24 15:00:01 +0000 2020,U.S. Marshals Fugitive Task Force arrests sexual assault suspect in Williamsport: https://t.co/7zL6AKD6Jo
1220712935426789400,Fri Jan 24 14:20:18 +0000 2020,Charleston murder suspect captured in Newport News, Virginia: https://t.co/wvtpWjVcCj
1220681085245325300,Fri Jan 24 12:13:44 +0000 2020,Task force arrests 50 felons on outstanding Warren warrants https://t.co/szc3DGR29v
1220466237794181000,Thu Jan 23 22:00:00 +0000 2020,The United States Marshal’s Service announced Wednesday that a man from Virginia has been charged for his involveme… https://t.co/hajHDSvpbE
1220451138798964700,Thu Jan 23 21:00:01 +0000 2020,Schools in Little Falls were placed on lockdown as the U.S. Marshals North Star Fugitive Task Force attempted to ar… https://t.co/d8Wl7Ob3AS
1220436037937266700,Thu Jan 23 20:00:00 +0000 2020,Marcus Henderson and two other former county corrections officers were arrested by the U.S. Marshals Service in Aug… https://t.co/KZ55PNzYwF
1220425294097666000,Thu Jan 23 19:17:19 +0000 2020,Don't miss your chance to bid in our latest Public Online Auction. Final bids end 1/27 at 11am EST:… https://t.co/154x03Vdrv
1220420938010964000,Thu Jan 23 19:00:00 +0000 2020,United States Marshals captured more than 600 fugitives and seized nearly 200 weapons in Southern Illinois during 2… https://t.co/EIiizdyx27
1220405840185716700,Thu Jan 23 18:00:01 +0000 2020,After nearly four decades fighting for justice, John Walsh is still moved by the "power of TV" when it comes to tra… https://t.co/Hrn0L9AwVH
1220390741232341000,Thu Jan 23 17:00:01 +0000 2020,@DHSgov has published its first Strategy to Combat Human Trafficking, the Importation of Goods Produced with Forced… https://t.co/EaQpfsnkCi
1220376800557138000,Thu Jan 23 16:04:37 +0000 2020,@G_Mac35 https://t.co/q2S25yoNsx
1220375979106934800,Thu Jan 23 16:01:21 +0000 2020,@G_Mac35 The US Marshals called off the search due to heavy rainfall. Deputy Hammons is refusing to give up the hun… https://t.co/6WFB5nXkNN
1220375639649222700,Thu Jan 23 16:00:00 +0000 2020,The Hon. Kirk Tabbey was recently honored with an award and Certificate of Appreciation from the Detroit Fugitive A… https://t.co/zoenVYqifp
1220372552582934500,Thu Jan 23 15:47:44 +0000 2020,Last week, U.S. Marshals, along with the assistance of state and local law enforcement, initiated “Operation Backtr… https://t.co/nC4uJO8Rg5
1220360543640309800,Thu Jan 23 15:00:01 +0000 2020,U.S. Marshals Fugitive Task Force arrests Monroe County homicide suspect in the Bronx: https://t.co/A9r44tyq3k
1220345439708299300,Thu Jan 23 14:00:00 +0000 2020,United States Marshals Service Director Donald W. Washington appointed by United States Attorney General William P.… https://t.co/QvATvHvhEA
1220103848376832000,Wed Jan 22 22:00:00 +0000 2020,The Gwinnett County Sheriff’s Office is searching for six suspects with outstanding warrants, including two men cha… https://t.co/fPbqunlR4c
1220088749616287700,Wed Jan 22 21:00:00 +0000 2020,The U.S. Marshals Service arrested two Billings men last Friday after criminal warrants by the Carbon County Distri… https://t.co/G4IaLiWcUk
1220073652265332700,Wed Jan 22 20:00:01 +0000 2020,Two people have been arrested in connection with a shooting at a convenience store in Hendersonville: https://t.co/SSZC53ko69
1220058550635987000,Wed Jan 22 19:00:00 +0000 2020,A man wanted for allegedly robbing a San Antonio pawn shop at gunpoint was arrested in Waco by the U.S. Marshals Se… https://t.co/cltNqsJlPT
1220043449690292200,Wed Jan 22 18:00:00 +0000 2020,A 19-year-old man has been arrested and charged with home invasion robbery and attempted felony murder following a… https://t.co/3S8VxvjSKQ
1220038148194996200,Wed Jan 22 17:38:56 +0000 2020,The Director of the United States Marshals Service, Donald W. Washington, was one of 16 individuals sworn in as com… https://t.co/JNenmte99e
1220028350074220500,Wed Jan 22 17:00:00 +0000 2020,A 14-year-old Dover male was arrested in connection with a Jan. 12 home invasion: https://t.co/pcPQdz64y2
1220024050250109000,Wed Jan 22 16:42:55 +0000 2020,RT @TheJusticeDept: AG Barr swears in commissioners of the President’s Commission on Law Enforcement and the Administration of Justice, mad…
1220013252526080000,Wed Jan 22 16:00:00 +0000 2020,An Oregon man was sentenced on Tuesday to 149 months and 12 days in prison to be followed by a lifetime of supervis… https://t.co/YTb0jwb6un
1220011083747995600,Wed Jan 22 15:51:23 +0000 2020,RT @TheJusticeDept: Watch LIVE at 9:30 am Eastern: Attorney General Barr to announce the establishment of the Presidential Commission on La…
1219998152633176000,Wed Jan 22 15:00:00 +0000 2020,US Marshals and police across Arkansas and the country have spent months trying to find Jory Worthen, wanted on two… https://t.co/Y4hp9UOJwk
1219990717591847000,Wed Jan 22 14:30:28 +0000 2020,Pawn shop gunman arrested in Waco: https://t.co/igAsx6Chk3
1219741459286577200,Tue Jan 21 22:00:00 +0000 2020,The Placer County Sheriff’s Office issued an important reminder Thursday to alert the community of the ongoing scam… https://t.co/Tf1y6ZpHEu
1219726361557778400,Tue Jan 21 21:00:00 +0000 2020,Overall, violent crime in the Memphis area has decreased by 8.2% since 2018 and 13.1% since 2017: https://t.co/RBmR3rbS8k
1219711263313293300,Tue Jan 21 20:00:00 +0000 2020,Charles Pennington Jr., 89, passed away at his home on Thursday, Jan. 16 after a brief illness. Pennington had a st… https://t.co/dyz90wrgkM
1219696163000963000,Tue Jan 21 19:00:00 +0000 2020,Federal authorities moved Los Angeles attorney Michael Avenatti to New York on Friday ahead of a trial later this m… https://t.co/MBs2XPqlEB
1219681063028416500,Tue Jan 21 18:00:00 +0000 2020,Daspit Elementary was placed on temporary lock down Thursday morning as a precaution during a nearby arrest. US Mar… https://t.co/AgFAFRVQTa
1219665963093778400,Tue Jan 21 17:00:00 +0000 2020,Saying she is “ashamed and embarrassed” by her actions during a 2007 armed standoff with federal authorities, a 78-… https://t.co/U9oVnWVsCW
1219650866761871400,Tue Jan 21 16:00:01 +0000 2020,U.S. Marshals Director Donald W. Washington delivers keynote address at the Department of Justice Annual Commemorat… https://t.co/ISPiiXX0c4
1219635767607058400,Tue Jan 21 15:00:01 +0000 2020,The search continues for two of the three inmates that escaped out of the Covington County Jail last week: https://t.co/0UZyLfLGyS
1219632558465527800,Tue Jan 21 14:47:16 +0000 2020,U.S. Marshals Fugitive Task Force arrests Monroe County homicide suspect: https://t.co/RspvVCbCtK
1219578376870076400,Tue Jan 21 11:11:58 +0000 2020,RT @DEAWashingtonDC: 2 Virginia men, trafficking meth, heroin, oxy, coke, and other drugs from GA to SW VA - sentenced!  Thanks the great w…
1218895890628448300,Sun Jan 19 14:00:00 +0000 2020,On January 19, 1931, Deputy U.S. Marshals arrested Al Capone for violations of income tax laws. #DOJ150
1218291909350707200,Fri Jan 17 22:00:00 +0000 2020,@TCSO, with assistance from US Marshals, were able to locate and arrest 39-year-old Billy Shawn Griffith as a fifth… https://t.co/NorxQWQiNo
1218276810682699800,Fri Jan 17 21:00:00 +0000 2020,The U.S. Marshals Southern Ohio Fugitive Apprehension Strike Team (SOFAST) arrested Rafael Johnston Wednesday on an… https://t.co/fai9HEKgoF
1218261710798082000,Fri Jan 17 20:00:00 +0000 2020,A DNA sample taken from a man arrested last October may be the key police needed to solve two Algiers rape investig… https://t.co/tAT88HA0YB
1218246609164652500,Fri Jan 17 19:00:00 +0000 2020,Cordarius Jaquon Dorsey, 30, was arrested at the LaQuinta Inn in College Park. He was booked into the DeKalb County… https://t.co/QXjlA02Rj8
1218231514262982700,Fri Jan 17 18:00:01 +0000 2020,Justin Brown, 20, Dontavious Harvey, 20, and Terwon Matthews, 20, have been indicted on charges of two counts of ag… https://t.co/d1qRQQ4iMg
1218216413824897000,Fri Jan 17 17:00:01 +0000 2020,U.S. Marshals and the @ATFHQ are searching for a fugitive accused of getting illegal gun conversion kits from China: https://t.co/x5kH5g8q7C
1218201312682225700,Fri Jan 17 16:00:00 +0000 2020,Phoenix police announced Thursday that 32-year-old Kevin Ellis Billinger was taken into custody Wednesday night sus… https://t.co/cEE5wu9P2o
1218195755850260500,Fri Jan 17 15:37:55 +0000 2020,RT @DEAOmahaDiv: #FugitiveFriday: Jose Guadalupe Angulo-40 y/o Hispanic male, 5-9, 205 lbs. Wanted for possession w/ intent to distribute #…
1218186214857232400,Fri Jan 17 15:00:01 +0000 2020,The US Marshals called off the search in the small Texas town of Royse City for the remains of Brian Keith Freeman,… https://t.co/MSPfNdSrdl
1218182829231804400,Fri Jan 17 14:46:33 +0000 2020,Less than three weeks into the new year, newly assigned federal agents have already joined Memphis' regional U.S. M… https://t.co/ij2q0AOypb
1218158138483970000,Fri Jan 17 13:08:27 +0000 2020,RT @TheJusticeDept: .@USMarshalsHQ Director Donald W. Washington delivers keynote address at the Department of Justice annual commemorative…
1218134767352340500,Fri Jan 17 11:35:35 +0000 2020,Teen murderer Lester Eubanks escaped police in 1973. The hunt for him may lead to Detroit area https://t.co/kMNanSWOWt
1217929520117928000,Thu Jan 16 22:00:00 +0000 2020,Just over three weeks after a security guard was fatally shot in the back at a south Alabama lounge, investigators… https://t.co/wJJPIpKgqC
1217914423328813000,Thu Jan 16 21:00:00 +0000 2020,Federal and local officials arrested a 50-year-old Joseph George Terrone, Jr. on charges of receiving child pornogr… https://t.co/B0n5DogtuV
1217899321775050800,Thu Jan 16 20:00:00 +0000 2020,Agents with the @FBI and the U.S. Marshals arrested Ronald Brouillard, 71, after an investigation showed he had pro… https://t.co/bUBqPYrq1l
1217884223018799000,Thu Jan 16 19:00:00 +0000 2020,35-year-old Vicki Hunley of Fries, Virginia was stopped for reckless driving and was ultimately arrested for posses… https://t.co/IwvX89PaGM
1217876453238460400,Thu Jan 16 18:29:08 +0000 2020,RT @TheJusticeDept: PDAAG Claire Murray, @USMarshalsHQ Director Donald Washington and Civil Rights Division AAG Eric Dreiband deliver remar…
1217869122471481300,Thu Jan 16 18:00:00 +0000 2020,Kansas City police have begun conducting weekly shooting reviews, a process that has been credited with reducing gu… https://t.co/dEmylc4cfW
1217854023576903700,Thu Jan 16 17:00:00 +0000 2020,U.S. District Court Judge James V. Selna ordered that Michael Avenatti remain in federal custody for possible viola… https://t.co/OAoIXP1Cig
1217838923092779000,Thu Jan 16 16:00:00 +0000 2020,An attorney for Steven Downs, 45, said it took 82 days to transport him to Alaska, making it impossible for Downs t… https://t.co/xKNyxhgfza
1217831373588664300,Thu Jan 16 15:30:00 +0000 2020,U.S. Marshals arrest Colerain Township shooting suspect in Cincinnati: https://t.co/D3kXYbPWyE
1217823825930395600,Thu Jan 16 15:00:00 +0000 2020,U.S. Marshals director to speak at Eunice MLK event: https://t.co/IlvOKxgGHg
1217817826934902800,Thu Jan 16 14:36:10 +0000 2020,RT @DiscoveryID: It's possible @USMarshalsHQ fugitive Jeffrey Forrest is known to bite his fingernails to the stub and investigators say he…
1217814085519249400,Thu Jan 16 14:21:18 +0000 2020,...During his directorate, which lasted until early 1976, he oversaw the initial stages of the Witness Security Pro… https://t.co/lPhiOgh9bM
1217814084734869500,Thu Jan 16 14:21:18 +0000 2020,On January 16, 1970, Wayne B. Colburn became the Director of the U.S. Marshals Service. He previously served as the… https://t.co/ZFnPFUetn5
1217567133552349200,Wed Jan 15 22:00:00 +0000 2020,U.S. Marshals arrested Justin David Lopez, 39, on Friday. He is accused of fatally shooting Isaac Ybarra, 34, in Ed… https://t.co/yRaoev8Uqp
1217552032531239000,Wed Jan 15 21:00:00 +0000 2020,Authorities say three Hopewell men are in custody following a string of convenience store robberies last December: https://t.co/dvFFJ612Al
1217544483941650400,Wed Jan 15 20:30:00 +0000 2020,Students from the "ACE" program recently completed fufilling internships with the United States Marshals, gaining v… https://t.co/vC5OlDHwiu
1217536935125770200,Wed Jan 15 20:00:00 +0000 2020,The search for a 14-year-old Ohio boy who went missing last month has ended after his body was found this week in t… https://t.co/Z9azGzWGEZ
1217521837115986000,Wed Jan 15 19:00:01 +0000 2020,Courtney Gainey, 23, accused of striking and killing 14-year-old Allana Staiano on Saturday, surrendered to the U.S… https://t.co/u8UVdVybNT
1217506735729987600,Wed Jan 15 18:00:00 +0000 2020,A standoff on Milwaukee’s north side ends in the arrest of sex offender 25-year-old Lee Bennett: https://t.co/ZvP3Mrwt1m
1217491636889907200,Wed Jan 15 17:00:00 +0000 2020,U.S. Marshals are searching for one of Arkansas Most Wanted fugitives, Brian Keith Freeman, accused of killing his… https://t.co/6qYTqG0wW2
1217486156696375300,Wed Jan 15 16:38:14 +0000 2020,RT @DiscoveryID: We are gearing up for tonight's, "In Pursuit with John Walsh." Join the hunt to find fugitives and missing children at 10…
1217476538104459300,Wed Jan 15 16:00:00 +0000 2020,A Volusia County K-9 tracked down a fugitive, wanted for armed robberies in Kentucky, hiding off a bike trail in De… https://t.co/1240BTy0YD
1217461438949707800,Wed Jan 15 15:00:01 +0000 2020,An escapee from the state prison in Springfield was apprehended in Pierre Tuesday by the Central South Dakota SWAT… https://t.co/iPoIdtcyjj
1217447521049612300,Wed Jan 15 14:04:42 +0000 2020,RT @USAttorneys: #ProjectSafeChildhood is implemented via partnerships with @USAttorneys, @TheJusticeDept’s Criminal Division, @ICACTASKFOR…
1217445327005012000,Wed Jan 15 13:55:59 +0000 2020,RT @Nextgov: The @USMarshalsHQ are looking for experts who can think like the enemy when it comes to #biometrics, @Federal_IT reports https…
1217204744080576500,Tue Jan 14 22:00:00 +0000 2020,Dothan police and U.S. Marshals early Friday made an arrest in the year-old murder of Andrew Jones, killed while wa… https://t.co/a3kSdQAe2h
1217189644594376700,Tue Jan 14 21:00:00 +0000 2020,A new list of the most wanted fugitives in central Ohio has just been announced by the United States Marshals Servi… https://t.co/TWcQFjQ3AJ
1217174548031758300,Tue Jan 14 20:00:00 +0000 2020,Deandre Michael Johnson faces felonious assault plus potential additional charges for allegedly shooting at a femal… https://t.co/m2RdvMIkvo
1217169645209301000,Tue Jan 14 19:40:31 +0000 2020,RT @TheJusticeDept: The year 2020 marks the 150th anniversary of the Department of Justice! Follow #DOJ150 and #DOJHistory to learn more ab…
1217159447509758000,Tue Jan 14 19:00:00 +0000 2020,A woman led U.S. Marshals on a high-speed chase that ended in a crash -- but it's what she did next that landed her… https://t.co/dy3KldzneY
1217144351786033200,Tue Jan 14 18:00:01 +0000 2020,Anthony Joe “AJ” Starks, 29, and Glenn Cleveland Callahan, 39, two purported gang members, were arrested and $20,00… https://t.co/LDjpje2VjL
1217142891476332500,Tue Jan 14 17:54:13 +0000 2020,RT @CallahanWalsh: Season 2 of In Pursuit kicks off tomorrow night on @DiscoveryID at 10pm. Help us catch more fugitives and get the justic…
1217141419497881600,Tue Jan 14 17:48:22 +0000 2020,RT @NDILnews: Chicago Man Charged With Stalking Federal Probation Officer @USMarshalsHQ @FBIChicago https://t.co/EybTcIYRmr
1217129249007530000,Tue Jan 14 17:00:00 +0000 2020,...As to the “unprofitable” reference, this may have been an allusion to the resignation of the first U.S. Marshal… https://t.co/nepAHYqnVN
1217129248185553000,Tue Jan 14 17:00:00 +0000 2020,On January 14, 1795, Secretary of State Alexander Hamilton, in a letter to President George Washington, mistakenly… https://t.co/Oix58AtaAh
1217129248076587000,Tue Jan 14 17:00:00 +0000 2020,...What prompted the communication, which came on the heels of the Whisky Rebellion, may have been political in nat… https://t.co/fuGIUVMZxQ
1217116504954757000,Tue Jan 14 16:09:22 +0000 2020,For more information about the case, please visit the “Justice for Lori” Facebook page at: https://t.co/iKpi0YSCoO
1217116503755108400,Tue Jan 14 16:09:22 +0000 2020,The fugitive investigation has indicated that Freeman’s last telephone call originated in Texas, near his abandoned… https://t.co/BWtdrEJGzA
1217116502710726700,Tue Jan 14 16:09:21 +0000 2020,Authorities will be searching a rural area in Royse City Jan. 14 -16 in pursuit of Freeman to bring closure to the… https://t.co/ESWoETsBbx
