id,created_at,text
1260978180707561500,Thu May 14 17:00:00 +0000 2020,36-year-old Marshal Lacy Hobbs has been turned over to the custody of the U.S. Marshals after he was convicted of s… https://t.co/2RbySsSDP4
1260963086376173600,Thu May 14 16:00:02 +0000 2020,U.S. Marshals assisted Topeka, KS. Police locate Vincent Gonzalez-Rook in California. He was charged with first deg… https://t.co/73LFx64iVD
1260947984642191400,Thu May 14 15:00:01 +0000 2020,Centralia Police and U.S. Marshals have arrested 29-year-old Darius Love on the charge of armed robbery and an Illi… https://t.co/hClc3p1qLC
1260932888893124600,Thu May 14 14:00:02 +0000 2020,U.S. Marshals Fugitive Task Force arrests Scranton shooting suspect: https://t.co/ScgtWaLKfo
1260923768203088000,Thu May 14 13:23:47 +0000 2020,RT @USMarshalsHQ: The USMS established the 15 Most Wanted Fugitive Program in 1983 to prioritize investigation &amp; apprehension of some of th…
1260917782364844000,Thu May 14 13:00:00 +0000 2020,We are extremely grateful for the sacrifice of the brave men &amp; women in #LawEnforcement who have endured injury or… https://t.co/lIlzA4bWlS
1260676190890676200,Wed May 13 21:00:00 +0000 2020,U.S. Marshals arrested Chad Credeur after an active warrant had been issued for him on a charge of Attempted Second… https://t.co/BEniNFQOJm
1260661091572449300,Wed May 13 20:00:00 +0000 2020,U.S. Marshals arrested Quentin Hymon, 17, for allegedly shooting a man during a cannabis deal: https://t.co/aFds5NrFkJ
1260645993185284000,Wed May 13 19:00:01 +0000 2020,A fugitive wanted for firing a gun during a domestic dispute was arrested in Akron, OH. by the U.S. Marshals Northe… https://t.co/NDqY9KdLK2
1260630894269788200,Wed May 13 18:00:01 +0000 2020,The US Marshals Southern Ohio Fugitive Task Force arrested Antonio Hendrix on the charges of aggravated robbery and… https://t.co/2P76LEsWLK
1260615792305082400,Wed May 13 17:00:00 +0000 2020,U.S. Marshals assisted Dothan, AL. Police Officers arrest Alfonza Walker, charged with Attempted Murder and Receivi… https://t.co/96En4Y7AgV
1260603677909438500,Wed May 13 16:11:52 +0000 2020,RT @DiscoveryID: Forrest was on the In Pursuit S2 premiere. He's charged w/ 2 counts of aggravated sexual assault of a child, bail jumping,…
1260600692189749200,Wed May 13 16:00:00 +0000 2020,Join us in solidarity as we come together to honor fallen U.S. law enforcement officers through the @NLEOMF virtual… https://t.co/ppg4Q5GWWG
1260585593920123000,Wed May 13 15:00:00 +0000 2020,The U.S. Marshals Service captured a man accused of shooting at a Pearl police officer multiple times during a high… https://t.co/ehxUrUsgv1
1260570494270607400,Wed May 13 14:00:00 +0000 2020,U.S. Marshals arrest suspect who fled courtroom in 2011: https://t.co/KOOY3gaRLi
1260555396227440600,Wed May 13 13:00:01 +0000 2020,"We can never repay our debt to these officers and their families, but we must do what we can, with all that we hav… https://t.co/0qWwDsIrA9
1260313800592420900,Tue May 12 21:00:00 +0000 2020,Serving as a law enforcement officer is the toughest job in America. This was true in the past and it is especially… https://t.co/Teeotzw2lw
1260298702788255700,Tue May 12 20:00:00 +0000 2020,Members of the U.S. Marshals Lone Star Fugitive Task Force Trevor Senior, 21, wanted for aggravated sexual assault… https://t.co/XlbRrrO2wO
1260283602383888400,Tue May 12 19:00:00 +0000 2020,A man dubbed as one of 'Greenville's Most Wanted' by Greenville County, S.C. Crimestoppers is back in custody after… https://t.co/oiAEAWNIu1
1260268506307866600,Tue May 12 18:00:01 +0000 2020,U.S. Marshals arrested an Essex, MD. teen in North Carolina and charged him for the December fatal shooting of anot… https://t.co/GNWCIy9lIq
1260253402724028400,Tue May 12 17:00:00 +0000 2020,A Providence man who escaped from police at Rhode Island Hospital in January was arrested Monday in Puerto Rico by… https://t.co/X1AfgKSs8G
1260240170139431000,Tue May 12 16:07:25 +0000 2020,RT @USMarshalsHQ: Frederick McLean is accused of multiple counts of child molestation. He is considered Armed and Dangerous. Anyone with in…
1260238306006184000,Tue May 12 16:00:00 +0000 2020,The man accused in an April 4 Topeka, KS. homicide made his first court appearance Monday following his capture by… https://t.co/Bh7S2Q0JUB
1260223205496590300,Tue May 12 15:00:00 +0000 2020,U.S. Marshals assisted Cobb Sheriff's deputies locate and capture Moises Bernal Ramirez. He was extradited from Mex… https://t.co/lxSWs2vmoB
1260212198426792000,Tue May 12 14:16:16 +0000 2020,RT @CallahanWalsh: Jeffery Forest - CAPTURED‼️ A direct tip to the In Pursuit hotline has resulted in the arrest of child predator, Jeffery…
1260208105117282300,Tue May 12 14:00:00 +0000 2020,The United States Marshals announced Monday that after a lengthy investigation, a pair of fugitives were arrested b… https://t.co/ScG9ZvEjcC
1260193009544528000,Tue May 12 13:00:01 +0000 2020,As law enforcement officers continue risking their lives to keep us safe during the #COVID19 pandemic, we remember… https://t.co/ME4e3ND34I
1259951414786224000,Mon May 11 21:00:00 +0000 2020,Thank you to the brave men and women in uniform who put everything on the line to protect us. During… https://t.co/CA6iBDULkR
1259936315988160500,Mon May 11 20:00:00 +0000 2020,The Landrum Police Department, the U.S. Marshals Service, the Spartanburg County Sheriff’s office, Campobello Polic… https://t.co/k3yu8pE3uF
1259921215172554800,Mon May 11 19:00:00 +0000 2020,Berry Davis, 41, was taken into custody in Illinois last week by the U.S. Marshals Service, working under the reque… https://t.co/torpiWCgkR
1259906115166507000,Mon May 11 18:00:00 +0000 2020,39-year-old Erich West was turned over to U.S. Marshals after local deputies pursued him through Lindley, NY. West… https://t.co/pAXtUTC0K2
1259891014665371600,Mon May 11 17:00:00 +0000 2020,The U.S. Marshals assisted in the arrest of two men who were charged with 2nd degree murder after deputies found a… https://t.co/Gmh3zyUpen
1259875918241300500,Mon May 11 16:00:00 +0000 2020,Today begins the start of #PoliceWeek2020 where we pay tribute to the local, state, and federal peace officers who… https://t.co/khwXVAmdJn
1259860819770105900,Mon May 11 15:00:01 +0000 2020,On May 11, 1902, the Southern District of Texas was created. The original appointment was William M. Hanson on May… https://t.co/j7GkiUdj7G
1259845719566938000,Mon May 11 14:00:01 +0000 2020,The U.S. Marshal Mountain State Fugitive Task Force has arrested a man on sexual assault charges involving a minor: https://t.co/KNJrMZbTPv
1259830619783065600,Mon May 11 13:00:00 +0000 2020,Attorney General William P. Barr honors nation’s law enforcement during National Police Week: https://t.co/2LpSfYgvwA
1259533284004049000,Sun May 10 17:18:30 +0000 2020,Most Wanted Fugitive Captured in Mexico, Brought Back to Texas https://t.co/lnKRfcJV6x
1258895720893100000,Fri May 08 23:05:03 +0000 2020,Suspects in deadly shooting over Flint store face mask policy in custody https://t.co/XVxCcCj4iE
1258895171598667800,Fri May 08 23:02:52 +0000 2020,Suspects arrested for murder of Michigan security guard after asking shopper to wear a mask https://t.co/FchfsKbSj3
1258864252288303000,Fri May 08 21:00:00 +0000 2020,Members of the U.S. Marshals Mountain State Fugitive Task Force arrested a Maryland man Wednesday at a Martinsburg… https://t.co/2GfjobWS6X
1258849152919908400,Fri May 08 20:00:00 +0000 2020,The U.S. Marshals Fugitive Task Force assisted Lycoming County, PA. police arrest three people charged with attempt… https://t.co/KuhjlYlPYS
1258834053484118000,Fri May 08 19:00:01 +0000 2020,The U.S. Marshals Service High Plains Fugitive Task Force assisted Moorhead, MN. police arrest Steven Latee Ward, w… https://t.co/CxMxsPMRYj
1258818954270658600,Fri May 08 18:00:01 +0000 2020,U.S. Marshals assisted Salinas, CA. police investigators arrest John Barriga Macias, 18, who was wanted for the mur… https://t.co/kBxekmSzYM
1258803851152539600,Fri May 08 17:00:00 +0000 2020,U.S. Marshals took 41-year-old Andrew Barker into custody, Thursday, who was wanted for the shooting death of a Cle… https://t.co/j94dO6dAQt
1258793433466114000,Fri May 08 16:18:36 +0000 2020,RT @DEAHQ: #FugitiveFriday We are searching for David Eliceo Haro-Arriaga. Wanted for Conspiracy to possess with intent to Distribute Cocai…
1258788756414324700,Fri May 08 16:00:01 +0000 2020,The U.S. Marshals Gulf Coast Regional Fugitive Task Force is searching for Timothy Jabbar Wyatt, who has warrants f… https://t.co/9kW110hQ9f
1258773652192911400,Fri May 08 15:00:00 +0000 2020,U.S. Marshals assisted Holmes County Sheriff's Department along with several other law enforcement agencies arrest… https://t.co/pSmQrkF6w1
1258758556070711300,Fri May 08 14:00:01 +0000 2020,On May 8, 1973, the takeover of Wounded Knee, S.D. ended when members of the American Indian Movement surrendered t… https://t.co/JJNI5l4aPK
1258743458338156500,Fri May 08 13:00:01 +0000 2020,U.S. Marshals arrest two New Hampshire fugitives and recover three missing children: https://t.co/Wk9DVUl7DG
1258741401401032700,Fri May 08 12:51:51 +0000 2020,RT @DEAPHILADELPHIA: Tomorrow morning at 10:30, members of the DEA &amp; @USMarshalsHQ pipe band will join other pipe bands across the region t…
1258486763686936600,Thu May 07 20:00:00 +0000 2020,VR7 is a national violence reduction operation based in seven core cities throughout the United States; the Marshal… https://t.co/EqHQFA0Cy8
1258471665073176600,Thu May 07 19:00:00 +0000 2020,An inmate who escaped from Butler County Jail has been recaptured in Montgomery, AL. by U.S. Marshals and Butler Co… https://t.co/3bcNox33Ce
1258456567298625500,Thu May 07 18:00:01 +0000 2020,The U.S. Marshals Service arrested Jashon R. Robinson on a warrant for the murder of Tyler Fullen: https://t.co/SjREAtqc7j
1258441468852809700,Thu May 07 17:00:01 +0000 2020,U.S. Marshals with the Gulf Coast Regional Task Force tracked a murder suspect from Minnesota to Arkansas: https://t.co/0P9zTR6AF1
1258427408115478500,Thu May 07 16:04:09 +0000 2020,RT @USMarshalsHQ: The USMS established the 15 Most Wanted Fugitive Program in 1983 to prioritize investigation &amp; apprehension of some of th…
1258426364186812400,Thu May 07 16:00:00 +0000 2020,U.S. Marshals are assisting with the search for Jahquez Scott who was mistakenly released from Cook County, IL. Jai… https://t.co/DvwDC6M70w
1258411264939659300,Thu May 07 15:00:00 +0000 2020,On May 7, 1800, the Territory of Indiana was created.  The jurisdiction became effective July 4, 1800, but authorit… https://t.co/x85zIqGiza
1258396166879957000,Thu May 07 14:00:00 +0000 2020,U.S. Marshals Task Force arrests Minnesota murder suspect: https://t.co/UVWuw97mZh
1258381069331476500,Thu May 07 13:00:01 +0000 2020,U.S. Marshals arrest West Virginia and Maryland fugitive Ronald Wilson: https://t.co/s1iUeFHwaW
1258139476217327600,Wed May 06 21:00:00 +0000 2020,The U.S. Gulf Coast Regional Fugitive Task Force has arrested three men wanted by the Oxford Police Department and… https://t.co/kOFKRvCsoh
1258124377641619500,Wed May 06 20:00:01 +0000 2020,The suspect accused of fatally shooting a pregnant woman in Northeast Ohio is now in custody following a manhunt ac… https://t.co/u58w1JPD3l
1258109278524706800,Wed May 06 19:00:01 +0000 2020,A man who allegedly fled to Mexico after fatally shooting another man two years ago outside a gym in San Diego, CA.… https://t.co/NNBylxrJxq
1258094180393349000,Wed May 06 18:00:01 +0000 2020,The U.S. Marshals have joined the search for Jerome Sharp, 32, who escaped Monday from the Butler County Jail in Oh… https://t.co/zHzITolTRW
1258086625122250800,Wed May 06 17:30:00 +0000 2020,U.S. Marshals offer $5k Reward for information leading to capture of father, son wanted for murder of security guar… https://t.co/rULkqOHUMA
1258079077027778600,Wed May 06 17:00:00 +0000 2020,The U.S. Marshals Service arrested Gianni Gray, 37. He is charged with a double homicide from two years ago: https://t.co/2vh4UMqcgS
1258063978183393300,Wed May 06 16:00:00 +0000 2020,The U.S. Marshals North Star Fugitive Task Force needs your help in finding fugitive Jeremiah Lee Bonilla. Bonilla… https://t.co/OK3ou4sZoh
1258055726280425500,Wed May 06 15:27:13 +0000 2020,RT @WDNYnews: 17 defendants arrested &amp; drug ring dismantled: multiple kilos of deadly fentanyl, illegal guns, &amp; nearly 1-million cash seize…
1258048880308105200,Wed May 06 15:00:01 +0000 2020,During this time of pandemic lock-down, we here at the U.S. Marshals would like to take a moment to thank our IT pe… https://t.co/kZADWz1xbO
1258033777101738000,Wed May 06 14:00:00 +0000 2020,Escaped inmate from federal prison arrested: https://t.co/fnCq4S1lXJ
1258018680845131800,Wed May 06 13:00:01 +0000 2020,On 5/4/20, Algernon Perkins was arrested by U.S. Marshals in Chicago, IL. on a Federal Arrest warrant for Failure t… https://t.co/L6EqBEj9Pj
1257777086535778300,Tue May 05 21:00:00 +0000 2020,The U.S. Marshals Service Northern Iowa Fugitive Task Force is seeking the public's assistance in locating Miguel V… https://t.co/x41jK0i0E0
1257761989977243600,Tue May 05 20:00:01 +0000 2020,Steven Christopher Baltz was apprehended by the U.S. Marshals Service and booked into the Missoula County, MT. Dete… https://t.co/kmGeYUZPrS
1257746890021646300,Tue May 05 19:00:01 +0000 2020,Agents with the U.S. Marshals Violent Fugitive Task Force arrested Ernest Dukes III, 34, of Canton, OH. for alleged… https://t.co/m8cRfZPXva
1257731787003883500,Tue May 05 18:00:00 +0000 2020,U.S. Marshals assisted the @FBI in the arrest of a Bristol, VA. man accused of messaging someone he thought was a 1… https://t.co/hHCq2bP0oR
1257716689497583600,Tue May 05 17:00:00 +0000 2020,A man who escaped from the Federal Correctional Institution in Three Rivers, TX more than a month ago was captured… https://t.co/eizaffwpCD
1257701589004902400,Tue May 05 16:00:00 +0000 2020,On May 4th, 2020, 52 year-old Christopher Lovrien was arrested by the U.S. Marshals and charged with the 1999 murde… https://t.co/S1ZwbfFeOw
1257686493058957300,Tue May 05 15:00:01 +0000 2020,A Talladega County, AL. Jail inmate who escaped Thursday morning has been captured by U.S. Marshals in the Ohatchee… https://t.co/Iz213vxKLe
1257675836020469800,Tue May 05 14:17:40 +0000 2020,RT @USMarshalsHQ: The USMS established the 15 Most Wanted Fugitive Program in 1983 to prioritize investigation &amp; apprehension of some of th…
1257671393421914000,Tue May 05 14:00:01 +0000 2020,The U.S. Marshals Gulf Coast Regional Fugitive Task Force was able to apprehend 19-year-old Tekoa Kohn at his mothe… https://t.co/GOSpJYMfYX
1257656293462102000,Tue May 05 13:00:01 +0000 2020,The U.S. Marshals’ First State Fugitive Task Force apprehended a wanted Milford, Del. man earlier this week for a r… https://t.co/SFxS8Dczck
1257414699194425300,Mon May 04 21:00:00 +0000 2020,U.S. Marshals assisted the Fort Myers, FL. Police Department arrest two men charged with sexual battery of a juvenile.
1257399598051557400,Mon May 04 20:00:00 +0000 2020,U.S. Marshals assisted the Holmes County, MS. Sheriff’s Office recapture an escaped inmate from the Holmes County J… https://t.co/7VM8lUA2yu
1257384628052283400,Mon May 04 19:00:31 +0000 2020,The U.S. Marshals Pacific Northwest Violent Offender Task Force is asking for your help to track down a fugitive ac… https://t.co/x8O5H2JWpM
1257369403349500000,Mon May 04 18:00:01 +0000 2020,U.S. Marshals assisted Charles County, MD. Sheriff's Office locating two suspects wanted for murdering a Waldorf ma… https://t.co/0USXxSP6UD
1257354426228097000,Mon May 04 17:00:30 +0000 2020,The Robeson County Sheriff’s Office and the U.S. Marshals Service arrested Cody Rienks and Kelly Hill, both of Wayc… https://t.co/PdvDinpwfe
1257339326209409000,Mon May 04 16:00:30 +0000 2020,The U.S. Marshals Southeast Regional Fugitive Task Force assisted Bibb County, GA. Sheriff's Office arrest three me… https://t.co/HjtxHjSNrN
1257324103700185000,Mon May 04 15:00:00 +0000 2020,U.S. Marshals assisted the NYPD Regional Fugitive Task Force arrest Richard Lugo, 36, charged with the murder of Pa… https://t.co/pdwLANLxVP
1257309002033062000,Mon May 04 14:00:00 +0000 2020,Operation Triple Beam in the San Antonio area ended with a total of 212 confirmed gang members arrested and numerou… https://t.co/CQfUDTdmXs
1257293904988139500,Mon May 04 13:00:00 +0000 2020,On May 4, 1978, the Marshals Service, for the first time, opened a full-time office in Dodge City, KS. During front… https://t.co/VeO9LcgSQB
1256327535354212400,Fri May 01 21:00:00 +0000 2020,On May 2, 1792, Congress bestowed on the U.S. Marshals the same powers in their districts that sheriffs enjoyed in their counties.
1256312435885080600,Fri May 01 20:00:00 +0000 2020,The U.S. Marshals Service’s Great Lakes Regional Fugitive Task Force assisted Lake County, IL. Sheriff’s Office arr… https://t.co/0ZfYBAevW6
1256297337980203000,Fri May 01 19:00:00 +0000 2020,The U.S. Marshals assisted the Kingsport, TN. Police Department in the arrest of a Kodak man who is suspected of sh… https://t.co/A5bwbeOWFV
1256282239727399000,Fri May 01 18:00:01 +0000 2020,U.S. Marshals and Toledo, Ohio, police arrested a fugitive wanted in connection with a South Toledo shooting after… https://t.co/MmZd1v2ma8
1256267137749926000,Fri May 01 17:00:00 +0000 2020,The U.S. Marshal Florida Regional Fugitive Task-force arrested two men who now face sexual battery charges and are… https://t.co/2x8vvrDty6
1256252042072387600,Fri May 01 16:00:01 +0000 2020,Fresno County, CA. Sheriff's deputies and U.S. Marshals arrested two people Thursday morning after the driver of a… https://t.co/BAT7ayB6uD
1256240576070066200,Fri May 01 15:14:27 +0000 2020,RT @NYPDDetectives: Richard Lugo was wanted by the Boston Police Department for a double shooting/homicide from October 2019. Yesterday, NY…
1256236937058238500,Fri May 01 15:00:00 +0000 2020,A U.S. Marshal’s task force found a weapons cache with over a dozen guns, thousands of rounds of ammunition, and bo… https://t.co/pHIbfxvzV4
1256221840525099000,Fri May 01 14:00:00 +0000 2020,Federal inmate who burned and cut his way out of an Alabama jail recaptured by U.S. Marshals: https://t.co/cWqgMx1MV8
1256206740812517400,Fri May 01 13:00:00 +0000 2020,U.S. Marshals arrest Federal escapee in New York: https://t.co/NVdf66cBsF
1255965148059259000,Thu Apr 30 21:00:00 +0000 2020,A Tampa, Florida man wanted for aggravated battery has been taken into custody in Rochester: https://t.co/4vioNEbuTC
1255950049684717600,Thu Apr 30 20:00:00 +0000 2020,Crime Stoppers is offering an award of up to $2,500 for information leading to the arrest of James Maskal: https://t.co/43h6iTCqdI
1255934947245715500,Thu Apr 30 19:00:00 +0000 2020,U.S. Marshals assisted Hagerstown, MD. Police arrest Eric Steven Crockett, 44. He is charged with armed robbery, ro… https://t.co/sHT7lpJnY5
1255919852059066400,Thu Apr 30 18:00:01 +0000 2020,U.S. Marshals Service Carolinas Fugitive Task Force helped to make the arrests of Cody Rienks, 27, and Kelly Hill,… https://t.co/rcyOz2lrbv
1255912299962880000,Thu Apr 30 17:30:00 +0000 2020,U.S. Marshals Task Force arrests two murder suspects in nine hours: https://t.co/SUXMHNtBk5
1255904751218315300,Thu Apr 30 17:00:00 +0000 2020,U.S. Marshals and @FBI urge public to report phone scams: https://t.co/ZMBG3hNJmj
1255889649064489000,Thu Apr 30 16:00:00 +0000 2020,A fugitive wanted for kidnapping and raping a woman at knifepoint in New Bedford, MA. two years ago was taken into… https://t.co/4BUU0u7gi1
1255874549943591000,Thu Apr 30 15:00:00 +0000 2020,U.S. Marshals arrested a man from Leetonia, Ohio, and is facing child pornography charges after images of young gir… https://t.co/JSimQ3izzZ
1255859454303584300,Thu Apr 30 14:00:01 +0000 2020,Operation Triple Beam Houston resulted in 341 warrants cleared through arrest, 220 of which were gang affiliated. 6… https://t.co/RwSJQasKRY
1255844351344664600,Thu Apr 30 13:00:00 +0000 2020,On April 30, 1900, the Territory of Hawaii was created. It was effective June 14, 1900. The first U.S. Marshal was… https://t.co/LHZFJY9LBp
1255587658836979700,Wed Apr 29 20:00:00 +0000 2020,U.S. Marshals arrested Derrell L. Boston, 23, Dolton, IL. He is accused of firing gunshots at a 27-year-old man who… https://t.co/aQcOA5SiWM
1255572561540157400,Wed Apr 29 19:00:00 +0000 2020,U.S. Marshals assisted in the arrest of three men charged with shooting a New Jersey State Trooper: https://t.co/IZsNiqB8aa
1255557462360391700,Wed Apr 29 18:00:00 +0000 2020,A Rapid City, S.D. real estate agent must serve more than a year in prison and pay $124,645 in restitution after pl… https://t.co/jJTXEqTtch
1255542363264553000,Wed Apr 29 17:00:00 +0000 2020,Three women, one of whom was found to be wanted by the U.S. Marshals, were apprehended and charged with Reckless En… https://t.co/FSUtHe23SG
1255527265879888000,Wed Apr 29 16:00:01 +0000 2020,The U.S. Marshals assisted Goldsboro, N.C. Police arrest 31-year-old Willie Darden, IV. He is accused of shooting T… https://t.co/Vr87QFSVk9
1255512166955978800,Wed Apr 29 15:00:01 +0000 2020,41-year-old Michael Dudas was arrested by the U.S. Marshals Northern Ohio Violent Fugitive Task Force and has been… https://t.co/RICu1L1jut
1255497187892527000,Wed Apr 29 14:00:30 +0000 2020,Police are searching for 43-year-old Carlos Thompson. He is wanted out of Marion County, Ind. on a warrant. Thompso… https://t.co/ealNpTjStQ
1255481964229996500,Wed Apr 29 13:00:00 +0000 2020,U.S. Marshals and Norfolk Police Arrest Gotti Gang Member “Tinkman": https://t.co/2wUnn38G44
1255240496533983200,Tue Apr 28 21:00:30 +0000 2020,U.S. Marshals, Texas Department of Public Safety and Alice police  took Joseph Gonzalez, 17, and Jesse Munoz, 18, i… https://t.co/SCr50SFjjx
1255225271747088400,Tue Apr 28 20:00:00 +0000 2020,The U.S. Marshals Fugitive Task Force assisted Montgomery, AL. Police arrest Dontavious Nelson on the charges of fi… https://t.co/yKNeZEycnt
1255210175801233400,Tue Apr 28 19:00:01 +0000 2020,U.S. Marshals assisted in the arrest of Gavin Tyriq Ivey in Albany, GA. He is charged with felony murder, aggravate… https://t.co/wZZWxZCdB9
1255208872538771500,Tue Apr 28 18:54:50 +0000 2020,RT @marshalsmuseum: With everything else going on, you may have missed that April is #NationalChildAbusePreventionMonth.   The @USMarshalsH…
1255195075329622000,Tue Apr 28 18:00:01 +0000 2020,Pacifica Police are collaborating with the U.S. Marshals to locate the ex-boyfriend of a pregnant woman suspected f… https://t.co/OjksCXFNEL
1255179975759667200,Tue Apr 28 17:00:00 +0000 2020,A manhunt that began in San Antonio, TX. on Saturday ended Monday in Kerrville, TX. when multiple agencies, includi… https://t.co/9uyYqQkvzY
1255164878597369900,Tue Apr 28 16:00:01 +0000 2020,A man accused of murdering a couple in West Jordan, Utah, was arrested in Stockton, CA. last Wednesday by the U.S.… https://t.co/VjVIhHlmJ0
1255149773939761200,Tue Apr 28 15:00:00 +0000 2020,U.S. Marshals assisted the Thomas County, GA. Sheriff's Office arrest four teenagers who allegedly committed a gun… https://t.co/UTOrjfyWju
1255140321039577000,Tue Apr 28 14:22:26 +0000 2020,RT @USMarshalsHQ: The USMS established the 15 Most Wanted Fugitive Program in 1983 to prioritize investigation &amp; apprehension of some of th…
1255134682267521000,Tue Apr 28 14:00:02 +0000 2020,The U.S. Marshals Fugitive Task Force arrested a man in Wilkes-Barre Monday who was a suspect in a shooting from ea… https://t.co/50AK7vgH0j
1255123777056374800,Tue Apr 28 13:16:42 +0000 2020,RT @BlueWalkPoconos: Prayers sent for our #WWII #Veteran and Dep Tedford (ret), @USMarshalsHQ, his family, friends and Blue family. Natural…
1255118736954187800,Tue Apr 28 12:56:40 +0000 2020,United States Marshals Service Deputy Director Derrick Driscoll serves as a member of the NCMEC Law Enforcement Advisory Council.
1255118736106893300,Tue Apr 28 12:56:40 +0000 2020,On Friday, the Board of Directors for the National Center for Missing and Exploited Children (NCMEC) adopted a reso… https://t.co/ekad7eIANY
1254877982742720500,Mon Apr 27 21:00:00 +0000 2020,The U.S. Marshals Service is asking for the public’s help in locating Erland Eric Injerd, an Air Force airman who i… https://t.co/7Hl86y89cZ
1254862885249060900,Mon Apr 27 20:00:00 +0000 2020,On Friday, the Ashland Police, Shenandoah Police, State Police from Frackville, and U.S. Marshals took a man with a… https://t.co/C2VJUBSgQN
1254847784622018600,Mon Apr 27 19:00:00 +0000 2020,A U.S. judge certified Brandon Teixeira’s extradition back in February, and U.S. Marshals handed him to over to Can… https://t.co/Jk8QsRAP19
1254832687560286200,Mon Apr 27 18:00:01 +0000 2020,The Lake County Sheriff’s Office and U.S. Marshals took three people into custody, including one who was wanted by… https://t.co/NLYmCRg04w
1254817585796911000,Mon Apr 27 17:00:00 +0000 2020,The Northern Ohio Violent Fugitive Task Force apprehended James Grimes, 26, Thursday in Youngstown for the alleged… https://t.co/DxPhBt9aSq
1254802489242579000,Mon Apr 27 16:00:01 +0000 2020,U.S. Marshals Task Force captures Hakeem Zeb, on charges of First Degree Murder, Attempted First Degree Murder and… https://t.co/E7I7ODCu0e
1254787386615062500,Mon Apr 27 15:00:00 +0000 2020,U.S. Marshals assisted Decatur Police in the capture of Darrell Keith Hubbard, 24, for allegedly shooting a man in… https://t.co/MAjbCVRDvs
1254772288165200000,Mon Apr 27 14:00:00 +0000 2020,Joint East Fugitive Task Force arrests Fugitive Bryce Cayde Holmes. Holmes allegedly assaulted his spouse and share… https://t.co/UxjiqpyJ8m
