id,created_at,text
1259830689136087000,Mon May 11 13:00:17 +0000 2020,The new class of CEOs at Verizon, AT&amp;T and T-Mobile https://t.co/jtOYK93J5g https://t.co/0HVM2Oajlf
1259797593267277800,Mon May 11 10:48:46 +0000 2020,Microsoft’s Outlook on the web is getting Gmail-like text prediction feature https://t.co/XzoNQdCnSi https://t.co/vS05b9d8M7
1259793409864335400,Mon May 11 10:32:09 +0000 2020,Thunderbolt flaw allows access to a PC’s data in minutes https://t.co/uWQZ7FSBak https://t.co/lTxLKN1xRq
1259785349804458000,Mon May 11 10:00:07 +0000 2020,Newton Mail will be saved by fans after it was saved, and shut down again, by Essential https://t.co/IyvevFSaZm https://t.co/JI6PTapMbc
1259785205889581000,Mon May 11 09:59:33 +0000 2020,Shanghai Disneyland reopens with mandatory face masks and social distancing https://t.co/XVixu5JctW https://t.co/L6bYaUH6Aw
1259732483291177000,Mon May 11 06:30:03 +0000 2020,Qualcomm announces new Snapdragon 768G 5G processor https://t.co/jl1Gkih0J4 https://t.co/GOyoNbSIu8
1259691723929858000,Mon May 11 03:48:05 +0000 2020,Alamo Drafthouse launches "Alamo on Demand" VOD service https://t.co/a9R1XdVWNT https://t.co/U4KI3B4bRK
1259676625500856300,Mon May 11 02:48:05 +0000 2020,HBO Max will use anime from Crunchyroll to compete with Netflix’s growing empire https://t.co/cAvzAB65Zd https://t.co/KalpkNWuMP
1259646174698647600,Mon May 11 00:47:05 +0000 2020,Spotify is testing video podcasts with two YouTube stars https://t.co/hE86sxV1dk https://t.co/3Kq6CP7sdc
1259645920444133400,Mon May 11 00:46:05 +0000 2020,Alphabet’s Sidewalk Labs shuts down Toronto smart city project https://t.co/orH7TcwzKk https://t.co/see401Xwrx
1259630816247918600,Sun May 10 23:46:04 +0000 2020,Lenovo’s newest ThinkPads have AMD Ryzen 4000 processors https://t.co/d8DRnSmmrF https://t.co/5la7mCeZvu
1259615725834195000,Sun May 10 22:46:06 +0000 2020,Sonos CEO discusses the Arc and customer backlash over leaving old products behind https://t.co/dOJbReZThZ https://t.co/ptJV2p4swu
1259600361050030000,Sun May 10 21:45:02 +0000 2020,The new Sonos Five looks and sounds identical to the Play:5 it’s replacing https://t.co/VCrUPoiwdg https://t.co/UviCNesAWB
1259599070462697500,Sun May 10 21:39:55 +0000 2020,Trump and Intel are reportedly pushing for new processor factories in the US https://t.co/ssoZ9PZNP8 https://t.co/GhiaJu8TlD
1259585289779130400,Sun May 10 20:45:09 +0000 2020,AMD launches Ryzen Pro 4000 series to take on Intel’s vPro https://t.co/YDBDoOqNFw https://t.co/KW3fZVoVkn
1259570164741308400,Sun May 10 19:45:03 +0000 2020,Major CBS All Access changes coming this summer as company speeds up relaunch https://t.co/ABXNGML139 https://t.co/rdlhdSNeQo
1259555065112801300,Sun May 10 18:45:03 +0000 2020,iFixit’s Magic Keyboard X-rays confirm the death of the butterfly keyboard switches https://t.co/gnvJltzGxO https://t.co/zaKAE4luJ3
1259539972610232300,Sun May 10 17:45:05 +0000 2020,The disappointing truth about antibody testing https://t.co/jHLB00vl57 https://t.co/ZWqSLtL9Ne
1259524609977827300,Sun May 10 16:44:02 +0000 2020,Pittsburgh’s airport is the first in the US to use UV-cleaning robots https://t.co/8nLa52b7ub https://t.co/8T4wMBxS7x
1259523864821932000,Sun May 10 16:41:04 +0000 2020,The Verge’s Graduation Gift Guide 2020 https://t.co/GS5tBts6Ew https://t.co/9K96J9nZWO
1259514647763394600,Sun May 10 16:04:27 +0000 2020,Twitch roulette helps you find the loneliest streamers https://t.co/YBrngJ3s5e https://t.co/BX7JCzPJjn
1259509522466562000,Sun May 10 15:44:05 +0000 2020,The Overwatch League’s troubles continue as top team drops entire roster https://t.co/JD7T1qk7mr https://t.co/NAPk2bvVer
1259494419818057700,Sun May 10 14:44:04 +0000 2020,How to be a Rick and Morty fan https://t.co/qEt1wJuJIJ https://t.co/Anw9fgePDT
1259493394889371600,Sun May 10 14:40:00 +0000 2020,The Magic Keyboard for the iPad Pro is the best way to turn an iPad into a laptop https://t.co/4obdtvHeDt
1259463968248270800,Sun May 10 12:43:04 +0000 2020,Sonos will launch its new app and big S2 software update on June 8th https://t.co/72DmFCFIuo https://t.co/3qkb6hKnAs
1259459720177496000,Sun May 10 12:26:11 +0000 2020,Microsoft now blocks reply-all email storms to end our inbox nightmares https://t.co/7HvQ4abHKb https://t.co/NhDMa6LS0Q
1259438059915038700,Sun May 10 11:00:07 +0000 2020,Our 16 favorite gadgets to help care for and entertain kids https://t.co/tT4m7VBKp5 https://t.co/acK1lyXvuW
1259433770459021300,Sun May 10 10:43:04 +0000 2020,These 11 new games will get free upgrades for the Xbox Series X https://t.co/aYFpZxB82E https://t.co/PVllGKeaDI
1259418671082070000,Sun May 10 09:43:04 +0000 2020,Madden 21 shows that cross-gen gaming on Xbox Series X and PS5 could be messy https://t.co/hf0qJ0TsKE https://t.co/y9X0KChHFV
1259403566013460500,Sun May 10 08:43:03 +0000 2020,These 1,000-piece jigsaws are a game, a story, and a puzzle all in one https://t.co/lDsgCf7Juk https://t.co/bxfFX45R9I
1259388233999421400,Sun May 10 07:42:07 +0000 2020,MacBook Pro 13-inch: come for the keyboard, stay for the performance https://t.co/DtUKq4dJxT https://t.co/KaKO1pPt0R
1259373112015159300,Sun May 10 06:42:02 +0000 2020,Google unifies all of its messaging and communication apps into a single team https://t.co/1BX4fawGlh https://t.co/j1vavDg9wQ
1259357859722207200,Sun May 10 05:41:26 +0000 2020,Get answers to your questions about antibody tests, contact tracing apps, and drug development in our guide to the… https://t.co/5bXyRe0gL7
1259342659103187000,Sun May 10 04:41:02 +0000 2020,So that’s how you pronounce X Æ A-12 https://t.co/MV8jqQjL1R https://t.co/QftKyCSxmU
1259324293378461700,Sun May 10 03:28:03 +0000 2020,Eight great sites that offer online classes https://t.co/Fc0QjxuCvv https://t.co/pxVP7bbiLg
1259308948957601800,Sun May 10 02:27:04 +0000 2020,Amazon’s Crucible is a free-to-play multiplayer game launching May 20th https://t.co/gUWlrfnUnB https://t.co/HQjzK4EDwe
1259293860733374500,Sun May 10 01:27:07 +0000 2020,How the space industry is weathering the coronavirus pandemic https://t.co/WWmZkRaWXT https://t.co/yk0LVjZKaa
1259284043847413800,Sun May 10 00:48:07 +0000 2020,The Verge’s Mother’s Day Gift Guide 2020 https://t.co/3tjVFSC6Zo https://t.co/hcA72C84pZ
1259278754783821800,Sun May 10 00:27:06 +0000 2020,How the Surface Book 3 compares to the new MacBook Pro and other top laptops https://t.co/4HtWm2KFnj https://t.co/0fvNqVdJY4
1259248298894000000,Sat May 09 22:26:04 +0000 2020,How the Surface Go 2 compares to other low-cost tablets https://t.co/yvSMgV8yDq https://t.co/Vt6VcwPse8
1259240990025670700,Sat May 09 21:57:02 +0000 2020,UPDATED: Tesla has filed suit against Alameda County https://t.co/f15g71rkM3
1259233104406941700,Sat May 09 21:25:42 +0000 2020,RT @sokane1: NEW: Alameda County Health Dept. says it’s “working closely with the Tesla team on the ground in Fremont” &amp; that it’s “been a…
1259217854924284000,Sat May 09 20:25:06 +0000 2020,These 1,000-piece jigsaws are a game, a story, and a puzzle all in one https://t.co/TvaPB9k044 https://t.co/tOLtKN8zS4
1259202496771350500,Sat May 09 19:24:04 +0000 2020,Google Podcasts will give podcasters more data about their listeners https://t.co/o9RU5LAsQX https://t.co/3hbCbB8U4v
1259190053563256800,Sat May 09 18:34:38 +0000 2020,Elon Musk threatens to move Tesla out of California https://t.co/6arsa1hxfy https://t.co/P6G872Ejyw
1259187406777000000,Sat May 09 18:24:07 +0000 2020,HyperX and Ducky collaborated on a limited edition version of the One 2 Mini keyboard https://t.co/VV9neqUtWi https://t.co/5ISndoh2Ws
1259173313370296300,Sat May 09 17:28:06 +0000 2020,FDA authorizes rapid COVID 19 antigen test https://t.co/TN2JD9EZm5 https://t.co/SvUCtBXaSi
1259172292967440400,Sat May 09 17:24:03 +0000 2020,Halo 2: Anniversary arrives on PC May 12th https://t.co/S6E7weYRkH https://t.co/e9rgm2kX81
1259156951642013700,Sat May 09 16:23:05 +0000 2020,The hand-painted beauty of indie game Dordogne https://t.co/XZ1kF5DV5T https://t.co/EELJKuHWX0
1259152398284710000,Sat May 09 16:05:00 +0000 2020,Motorola Edge Plus hands-on: back in the game https://t.co/OkMmOUpG7I
1259136083083907000,Sat May 09 15:00:10 +0000 2020,How one professional soccer player is adapting to life as a FIFA pro https://t.co/1cuT07MnJE https://t.co/IgwMhTghU3
1259126492849676300,Sat May 09 14:22:03 +0000 2020,Space Force trailer finds Steve Carell leading the charge to colonize space https://t.co/qB6eyQMmMk https://t.co/XB4vBwX3gn
1259120981429432300,Sat May 09 14:00:09 +0000 2020,Save on DJI’s Osmo Mobile 3, the latest iPad, and more for Mother’s Day https://t.co/vH5xpChBy4 https://t.co/iOoJhGg8bi
1259111392554123300,Sat May 09 13:22:03 +0000 2020,Astronomers say they’ve found the closest black hole to Earth https://t.co/OwpGwxVRvD https://t.co/2bVSNn3hy4
1259105899236536300,Sat May 09 13:00:14 +0000 2020,9 new trailers you should watch this week https://t.co/OQQjMkYl76 https://t.co/K8ZLNFeLJe
1259096303008710700,Sat May 09 12:22:06 +0000 2020,Daniel Radcliffe and other stars are reading chapters of the first Harry Potter book on video with the audio availa… https://t.co/iVW2nNBheS
1259090815768502300,Sat May 09 12:00:17 +0000 2020,HP Elite Dragonfly (2020) review: recycled in the right ways https://t.co/eUG6glqWdM https://t.co/puYEpGmcXO
1259090777092825000,Sat May 09 12:00:08 +0000 2020,Razer’s excellent Viper gaming mouse is free when you buy the Huntsman TE keyboard https://t.co/ZxJMhU1zeO https://t.co/D7VJ9xEkmk
1259081184677630000,Sat May 09 11:22:01 +0000 2020,The saga of Apple’s bad butterfly MacBook keyboards is finally over https://t.co/CLKDBlp7ls https://t.co/vwQ3Nh3poG
1259020036385235000,Sat May 09 07:19:02 +0000 2020,Facebook’s redesigned desktop site with dark mode is now available everywhere https://t.co/u3MVZaI8GQ https://t.co/TUjRwE1foG
1259003955012604000,Sat May 09 06:15:08 +0000 2020,Google Duo will soon let you make group calls in Chrome https://t.co/m56PEMbbqs https://t.co/XmxB8qQyLa
1259002669911466000,Sat May 09 06:10:02 +0000 2020,Google says that the majority of its employees will work from home until 2021 https://t.co/d47z2fYiid https://t.co/Bh1nL0kEAu
1259000176498352000,Sat May 09 06:00:07 +0000 2020,It’s already getting too hot and humid in some places for humans to survive https://t.co/Ao3y6HV4py https://t.co/LPEAr6rh9Q
1258999904371912700,Sat May 09 05:59:02 +0000 2020,Detroit Lions reveal schedule through Animal Crossing: New Horizons https://t.co/F57fdd7oaZ https://t.co/gzmGonBjCx
1258998142688780300,Sat May 09 05:52:02 +0000 2020,Footage from MTV’s classic 1980s era is streaming online, and it’s a trip https://t.co/n1kCGDQRpu https://t.co/UJ56H7I13K
1258995627817664500,Sat May 09 05:42:03 +0000 2020,Google Lens can now copy and paste handwritten notes to your computer https://t.co/NAu8MFVSDU https://t.co/KLtc2p4EEV
1258972745498529800,Sat May 09 04:11:07 +0000 2020,Andy Serkis is reading The Hobbit in a 12-hour marathon for COVID-19 relief https://t.co/Pagcn1NcBT https://t.co/5xj3qqYKkA
1258960644226912300,Sat May 09 03:23:02 +0000 2020,First looks at Surface Go 2, Apple’s new 13-inch MacBook Pro, and Xbox Series X gameplay footage… https://t.co/tbfNsegKDD
1258955883930955800,Sat May 09 03:04:07 +0000 2020,The best laptop you can buy  https://t.co/DI5W37qOHc https://t.co/ole36wsCqc
1258954887729201200,Sat May 09 03:00:10 +0000 2020,This year’s graduates have one thing in common: disappointing online ceremonies https://t.co/P1RKYcauEZ https://t.co/rjp4SpHW6f
1258934235680964600,Sat May 09 01:38:06 +0000 2020,Samsung’s Galaxy A51 has two good things going for it: the screen and the price https://t.co/aqKgOgMMxs https://t.co/SSxYaBoYAs
1258930714155929600,Sat May 09 01:24:06 +0000 2020,Spot the robot is reminding parkgoers in Singapore to keep their distance from one another https://t.co/CBTyhdTNN1 https://t.co/RzRsZIRUj3
1258924709200175000,Sat May 09 01:00:15 +0000 2020,Record-breaking astronaut Christina Koch on making space history and surviving lengthy isolation… https://t.co/x2D0kbqhZF
1258894725286936600,Fri May 08 23:01:06 +0000 2020,Microsoft offering free repairs for mysterious Surface Laptop 3 screen cracks https://t.co/qBbhAhDN00 https://t.co/lU6igBqyMh
1258877300059275300,Fri May 08 21:51:51 +0000 2020,Go read this @WSJ story about Elon Musk’s personal finances by @timkhiggins https://t.co/1JUm0XB0ZS
1258865598358003700,Fri May 08 21:05:21 +0000 2020,On-demand food delivery apps are letting minors order alcohol, regulators say https://t.co/Pcjnj0gMIO https://t.co/aVUVdKLSDz
1258862207317794800,Fri May 08 20:51:53 +0000 2020,Tenet is now Hollywood’s litmus test for what happens next https://t.co/R5Ly7E8RCu https://t.co/LkzlDyetkv
1258856552146047000,Fri May 08 20:29:25 +0000 2020,RT @VergeDeals: The Apple Watch Series 3 (GPS, 38mm) is $179 at Best Buy. This isn't the lowest price we've seen, but stock has been scarce…
1258854025363144700,Fri May 08 20:19:22 +0000 2020,Get answers to your questions about antibody tests, contact tracing apps, and drug development in our guide to the… https://t.co/0cDXDB0isx
1258845596544307200,Fri May 08 19:45:53 +0000 2020,Apple will reopen a handful of US stores next week https://t.co/267cZhoN6E https://t.co/jDsHu6TG5M
1258826231044333600,Fri May 08 18:28:55 +0000 2020,Facebook’s redesigned desktop site with dark mode is now available everywhere https://t.co/FS9l8Zf8eC https://t.co/x33rcNLCue
1258822457512931300,Fri May 08 18:13:56 +0000 2020,Google Duo will soon let you make group calls in Chrome https://t.co/83EH487Ahv https://t.co/LJEQlNDvkI
1258821547495653400,Fri May 08 18:10:19 +0000 2020,Google says that the majority of its employees will work from home until 2021 https://t.co/fhLQfX0A4W https://t.co/5VUMY1b9mF
1258820819700023300,Fri May 08 18:07:25 +0000 2020,A hacker is trying to break Ohio’s tool for reporting workers who quit during the pandemic https://t.co/4bdCmB5Wcy https://t.co/OtMcj3EGBv
1258818971131838500,Fri May 08 18:00:05 +0000 2020,It’s already getting too hot and humid in some places for humans to survive https://t.co/u1kh5vHepX https://t.co/4mUcxk3gmC
1258818876546187300,Fri May 08 17:59:42 +0000 2020,Detroit Lions reveal schedule through Animal Crossing: New Horizons https://t.co/RJBkD5Td2v https://t.co/umpHP9OjQi
1258817025826308000,Fri May 08 17:52:21 +0000 2020,RT @VergeDeals: You can get the Apple Watch Series 3 smartwatch for $179 at Best Buy https://t.co/8Zqj9fqx6u https://t.co/ORkgfINxPh
1258816769562685400,Fri May 08 17:51:20 +0000 2020,Footage from MTV’s classic 1980s era is streaming online, and it’s a trip https://t.co/VkZkP7ezvZ https://t.co/eXKz1yhKNh
1258792712280723500,Fri May 08 16:15:44 +0000 2020,Samsung Galaxy A51 review: underachiever https://t.co/AXHqHXi3Lm
1258791361224085500,Fri May 08 16:10:22 +0000 2020,Andy Serkis is reading The Hobbit in a 12-hour marathon for COVID-19 relief https://t.co/m7jtrTvt90 https://t.co/7mLyNJEtFQ
1258790876467339300,Fri May 08 16:08:26 +0000 2020,You can get the Apple Watch Series 3 smartwatch for $179 at Best Buy https://t.co/87CYTYlKB3 https://t.co/VHKTI27olJ
1258781395830345700,Fri May 08 15:30:46 +0000 2020,First looks at Surface Go 2, Apple’s new 13-inch MacBook Pro, and Xbox Series X gameplay footage… https://t.co/9euiyty2oe
1258773862264815600,Fri May 08 15:00:50 +0000 2020,This year’s graduates have one thing in common: disappointing online ceremonies https://t.co/7PepjyA1jz https://t.co/Bom8cztS12
1258773725501063200,Fri May 08 15:00:17 +0000 2020,The best laptop you can buy  https://t.co/3nUDCgKN8g https://t.co/nLXtEys0JR
1258769220424405000,Fri May 08 14:42:23 +0000 2020,The Verge’s Graduation Gift Guide 2020 https://t.co/gCLFh6HWIu https://t.co/YNexo5avw3
1258753012165730300,Fri May 08 13:37:59 +0000 2020,RT @lorengrush: I spoke with the epic Christina Koch, who is back on Earth after spending nearly a year on the International Space Station…
1258751016935268400,Fri May 08 13:30:03 +0000 2020,Samsung’s Galaxy A51 has two good things going for it: the screen and the price https://t.co/SMZolmeMOG https://t.co/oJX1S9BIdk
1258749336869011500,Fri May 08 13:23:22 +0000 2020,Spot the robot is reminding parkgoers in Singapore to keep their distance from one another https://t.co/UeZ1ubv8lz https://t.co/8FM45iboYH
1258743495029854200,Fri May 08 13:00:10 +0000 2020,Record-breaking astronaut Christina Koch on making space history and surviving lengthy isolation… https://t.co/TB9Mhyp4kn
1258726043613114400,Fri May 08 11:50:49 +0000 2020,Office for iPad is getting mouse and trackpad support later this year https://t.co/pOfSEbQrSV https://t.co/tKZ6nyPoKY
1258723298051076000,Fri May 08 11:39:54 +0000 2020,Tesla plans to partially reopen Fremont factory Friday despite county’s continued lockdown order… https://t.co/qkBKRN4aFR
1258698189282201600,Fri May 08 10:00:08 +0000 2020,Why countries keep bowing to Apple and Google’s contact tracing app requirements  https://t.co/s40XM3ej2j https://t.co/GFZHHbXNYI
1258684326717333500,Fri May 08 09:05:03 +0000 2020,So that’s how you pronounce X Æ A-12 https://t.co/Htt0rN46HN https://t.co/L6rnKhwWp1
1258676787934122000,Fri May 08 08:35:05 +0000 2020,Uber reports $2.9 billion quarterly loss during pandemic https://t.co/IfWMkelFPI https://t.co/Hc4sRR8kV8
1258673767489908700,Fri May 08 08:23:05 +0000 2020,HBO Max will use anime from Crunchyroll to compete with Netflix’s growing empire https://t.co/ou89Rikp2E https://t.co/jQA96HqcRF
1258668007297036300,Fri May 08 08:00:12 +0000 2020,Lyft will require drivers and passengers to wear face masks https://t.co/zAipuMH0JM https://t.co/Xsu7oiZrf7
1258665700627034000,Fri May 08 07:51:02 +0000 2020,iFixit’s Magic Keyboard X-rays confirm the death of the butterfly keyboard switches https://t.co/mJkDhxyjmy https://t.co/FXhX0hyQU9
1258662941139796000,Fri May 08 07:40:04 +0000 2020,Sonos CEO discusses the Arc and customer backlash over leaving old products behind https://t.co/oGyHzL6I2G https://t.co/wdOQOI1Wvo
1258660436007927800,Fri May 08 07:30:07 +0000 2020,Uber and Lyft’s fragmented future can be glimpsed in California’s driver classification lawsuit… https://t.co/SvRt6wRtcK
1258658663797084200,Fri May 08 07:23:04 +0000 2020,Facebook to let employees work remotely through the end of 2020 https://t.co/xaRY0od261 https://t.co/xKNan5lAQk
1258649857595670500,Fri May 08 06:48:05 +0000 2020,Destiny 2 is coming to PlayStation 5 and Xbox Series X https://t.co/jHsqi0Xm3y https://t.co/kJcAYU9A9g
1258646582234361900,Fri May 08 06:35:04 +0000 2020,Madden 21 shows that cross-gen gaming on Xbox Series X and PS5 could be messy https://t.co/a2pzuigWYT https://t.co/b2bCdJqUIZ
1258645342234476500,Fri May 08 06:30:08 +0000 2020,Google unifies all of its messaging and communication apps into a single team https://t.co/HOS7StIuEz https://t.co/tZDVP2ZXYp
1258632483622523000,Fri May 08 05:39:03 +0000 2020,Elizabeth Warren and Bernie Sanders demand Amazon explain whistleblower firings https://t.co/r975gP3Ehs https://t.co/1OgfWjhFrF
1258631220348489700,Fri May 08 05:34:01 +0000 2020,Sen. Ed Markey wants the FCC to rethink its broadband deployment plans https://t.co/VmAtPQ8GYW https://t.co/zJc40iQUwY
1258628220322304000,Fri May 08 05:22:06 +0000 2020,How Valorant is luring top esports talent despite being months from release https://t.co/q4FiJKAN5M https://t.co/hVUq1qGU59
1258624698616885200,Fri May 08 05:08:06 +0000 2020,Why a small Facebook bug wreaked havoc on some of the most popular iOS apps https://t.co/n7hHl1iqhh https://t.co/8eU1dcnYvD
1258613627487223800,Fri May 08 04:24:07 +0000 2020,Twitch is going to fund new reality programming https://t.co/lkQwuNgy49 https://t.co/CEfR3LxXZX
1258611613386657800,Fri May 08 04:16:07 +0000 2020,Pittsburgh’s airport is the first in the US to use UV-cleaning robots https://t.co/bPrjABmBYS https://t.co/CLXtfauL9q
1258609344020652000,Fri May 08 04:07:06 +0000 2020,Alamo Drafthouse launches "Alamo on Demand" VOD service https://t.co/ufs5Pj85l2 https://t.co/YeMA0z77pc
1258608830260359200,Fri May 08 04:05:03 +0000 2020,These 11 new games will get free upgrades for the Xbox Series X https://t.co/PAEMUC2x2V https://t.co/sxxvGQnu8f
1258607614734348300,Fri May 08 04:00:13 +0000 2020,Here are the first 13 games optimized for the Xbox Series X https://t.co/RyhY18ukT2 https://t.co/w68qknPfuM
1258605805877764000,Fri May 08 03:53:02 +0000 2020,Alphabet’s Sidewalk Labs shuts down Toronto smart city project https://t.co/Na0BYyN0Cb https://t.co/LmHTTrhFWS
1258603546053935000,Fri May 08 03:44:03 +0000 2020,Watch the first Xbox Series X gameplay footage, showing off ray-tracing and graphics of the next-gen console… https://t.co/icTyFmNoTb
1258602287473320000,Fri May 08 03:39:03 +0000 2020,Apple is giving $10 million to COVID-19 testing kit company https://t.co/TRpvxb4liG https://t.co/DgY9OmXasf
1258598784189247500,Fri May 08 03:25:08 +0000 2020,Google Lens can now copy and paste handwritten notes to your computer https://t.co/t1bImTk8KU https://t.co/uTUqc3F3EN
1258597249392808000,Fri May 08 03:19:02 +0000 2020,FDA authorizes CRISPR-based test for COVID-19 https://t.co/33nNwtoDbX https://t.co/kFtWMYDkYz
1258595239541067800,Fri May 08 03:11:03 +0000 2020,Xbox Series X Optimized games promise 4K up to 120fps, ray tracing, and fast load times https://t.co/RljrdrpotD https://t.co/lwflA9yAmJ
1258589959520485400,Fri May 08 02:50:04 +0000 2020,Tile announces partnership with Intel to track missing PCs https://t.co/CGrPU5EN0b https://t.co/E2jlibQKXb
1258587201056759800,Fri May 08 02:39:06 +0000 2020,France is using AI to check whether people are wearing masks on public transport https://t.co/Rz6rTO8GBa https://t.co/hyHqKvkOUy
1258585621720858600,Fri May 08 02:32:50 +0000 2020,Tokyo Game Show 2020 canceled due to COVID-19 pandemic https://t.co/d0svpJv0SL https://t.co/oJ04hBtaDt
1258580394619875300,Fri May 08 02:12:04 +0000 2020,Lime squeezes $170 million from Uber and Alphabet as scooter-sharing plummets under COVID-19 https://t.co/WhXMUAQC2B https://t.co/YcRQkTn5uW
1258579135779274800,Fri May 08 02:07:03 +0000 2020,Major CBS All Access changes coming this summer as company speeds up relaunch https://t.co/AvE9tnWpG7 https://t.co/f7o5sr6tmg
1258574603183685600,Fri May 08 01:49:03 +0000 2020,How to be a Rick and Morty fan https://t.co/EerrGitzB3 https://t.co/1s4CXk9mEO
1258572843132076000,Fri May 08 01:42:03 +0000 2020,We’ve known how to make healthier buildings for decades https://t.co/T6k4pHZqDq https://t.co/d1x4rpAD3v
1258567056053678000,Fri May 08 01:19:03 +0000 2020,Zoom buys the identity service Keybase as part of 90-day security push https://t.co/uT8JcoE51R https://t.co/IzoDFiW8El
1258564284851896300,Fri May 08 01:08:03 +0000 2020,AMD launches Ryzen Pro 4000 series to take on Intel’s vPro https://t.co/8uQdOVJ2qE https://t.co/81HXY1B1mx
1258563748379402200,Fri May 08 01:05:55 +0000 2020,A National Treasure Disney Plus series is in development https://t.co/ccuQ8bsUG1 https://t.co/j6PJJB13ag
1258563276847399000,Fri May 08 01:04:02 +0000 2020,Lenovo’s newest ThinkPads have AMD Ryzen 4000 processors https://t.co/OV7zEpBXEF https://t.co/nwtE4KzFYl
1258562311318618000,Fri May 08 01:00:12 +0000 2020,Sony’s new noise-canceling earbuds are for the fitness crowd https://t.co/8mjZJfQmr6 https://t.co/TKUhbr3Jfb
1258556488471187500,Fri May 08 00:37:04 +0000 2020,TiVo’s streaming-focused Stream 4K releases with $50 introductory price https://t.co/cvPpGgIn7W https://t.co/4Ojsa4Ynia
1258554760405364700,Fri May 08 00:30:12 +0000 2020,MacBook Pro 13-inch: come for the keyboard, stay for the performance https://t.co/zHFdyFvUpB https://t.co/X94PRswN4w
1258554680847851500,Fri May 08 00:29:53 +0000 2020,Clearview AI to stop selling controversial facial recognition app to private companies https://t.co/UguoKteQlq https://t.co/oh7MkottMl
1258553919485161500,Fri May 08 00:26:51 +0000 2020,Community’s cast is reuniting for a virtual table read to benefit COVID-19 relief https://t.co/zqsGfKAb25 https://t.co/BIsJGiurRQ
1258547186515603500,Fri May 08 00:00:06 +0000 2020,The disappointing truth about antibody testing https://t.co/EHe2JdaX5O https://t.co/kNR5uq9qLS
1258533165993349000,Thu May 07 23:04:23 +0000 2020,Samsung to launch a Samsung Pay debit card this summer https://t.co/88FtOy2zuc https://t.co/A9yOhivzyq
1258516088137998300,Thu May 07 21:56:32 +0000 2020,As Waymo resumes self-driving tests, backup drivers are still worried about the virus https://t.co/U5PYvd0b07 https://t.co/isXvKZxBp8
1258513950410301400,Thu May 07 21:48:02 +0000 2020,The Verge’s Mother’s Day Gift Guide 2020 https://t.co/UF6qcDt7Yk https://t.co/qUQH7YlaLf
1258512896444608500,Thu May 07 21:43:51 +0000 2020,RT @justcalma: "Humanity’s waste pile is in the atmosphere" Ralph Keeling tells me, and that's not going away because of the coronavirus ht…
1258511056000831500,Thu May 07 21:36:32 +0000 2020,Google’s app for helping kids improve reading skills is now available in 180 countries https://t.co/3eR78U5Cxe https://t.co/xjtoR52nL3
1258510971913429000,Thu May 07 21:36:12 +0000 2020,Zoom and New York’s attorney general agree on security improvements https://t.co/1zAePHnwep https://t.co/8X5Tc4mUgl
1258510689724850200,Thu May 07 21:35:05 +0000 2020,Even with people staying in, carbon dioxide is breaking records https://t.co/c4HsLrFbku https://t.co/iyFjX8n0Mw
1258501998569111600,Thu May 07 21:00:32 +0000 2020,So that’s how you pronounce X Æ A-12 https://t.co/tLg7P74v1Q https://t.co/T6c9m5v8Kx
1258495481057075200,Thu May 07 20:34:39 +0000 2020,Uber reports $2.9 billion quarterly loss during pandemic https://t.co/xvTooLZRY9 https://t.co/ArwdFFXZFN
1258495108258939000,Thu May 07 20:33:10 +0000 2020,RT @TayNixster: Last month, Nikon offered its entire library of free online courses for the month of April. Today, I found out that access…
