id,created_at,text
1254779189795803100,Mon Apr 27 14:27:26 +0000 2020,Twitter turns off its original SMS service in most countries https://t.co/OaWLhfZa2Q https://t.co/S2iShrO4Nc
1254776144735297500,Mon Apr 27 14:15:20 +0000 2020,These makers are fighting coronavirus with 3D printers. Meet @repkord, @formlabs, @joeltelling, @jennysabin, Tim We… https://t.co/liOU5OjyZ8
1254773140288270300,Mon Apr 27 14:03:23 +0000 2020,Watch 3D printers churn out medical supplies to fight COVID-19 https://t.co/CvojvCf7O2 https://t.co/rXkD3gsrXm
1254767322604036000,Mon Apr 27 13:40:16 +0000 2020,Star Wars: The Rise of Skywalker will be available to stream on Disney Plus on May 4th https://t.co/RJ2F41uQwG https://t.co/4ENYn6No5W
1254765025631391700,Mon Apr 27 13:31:09 +0000 2020,A vintage Apple-themed racecar is listed for sale at $499,999 https://t.co/U4J6jpJz21 https://t.co/WJgUc8xBdm
1254761996332994600,Mon Apr 27 13:19:06 +0000 2020,SpaceX’s future deep-space rocket passes key test, paving the way for short flight https://t.co/RLY6MsNy8p https://t.co/0Lu4X0nwgq
1254749207300366300,Mon Apr 27 12:28:17 +0000 2020,WhatsApp says its forwarding limits have cut the spread of viral messages by 70 percent https://t.co/9eU5J1rngD https://t.co/uRb96gLcXC
1254737177092784000,Mon Apr 27 11:40:29 +0000 2020,Apple reportedly delays iPhone 12 mass production by a month https://t.co/xTHWBeQt6d https://t.co/LZtLlSFXX5
1254693688808296400,Mon Apr 27 08:47:41 +0000 2020,Amazon pilots using video calls to verify third-party sellers https://t.co/hsnDKqdnFM https://t.co/t9tGy8HM1f
1254657045900529700,Mon Apr 27 06:22:04 +0000 2020,Vivo overtakes Samsung in Indian smartphone sales https://t.co/H0zsaskQXn https://t.co/RJpHHWkCjk
1254606460690071600,Mon Apr 27 03:01:04 +0000 2020,Leverage is getting rebooted as IMDb TV’s first major original series https://t.co/aQGDgKbdR7 https://t.co/maSiUaXqvU
1254591362525286400,Mon Apr 27 02:01:04 +0000 2020,Netflix nabs exclusive Pokémon episodes in latest move to dominate children’s television https://t.co/nJto8xjhA1 https://t.co/ndTsL4tcMO
1254576047074553900,Mon Apr 27 01:00:13 +0000 2020,AT&amp;T adds 5G to 90 new markets, nearly doubling its coverage https://t.co/NsSMcuDh6j https://t.co/C4WwR0Ks14
1254560950889468000,Mon Apr 27 00:00:13 +0000 2020,Samsung smart TVs are getting an Apple Music app https://t.co/0Ep66imvVT https://t.co/k1B5ZEqQpL
1254545564890534000,Sun Apr 26 22:59:05 +0000 2020,Porsche unveils CarPlay-compatible radios for its classic cars https://t.co/znw0DLwrwq https://t.co/O22luY875D
1254530465433870300,Sun Apr 26 21:59:05 +0000 2020,Samsung’s Galaxy Z Flip gets a new split-screen YouTube experience https://t.co/VpwPia4X6C https://t.co/t0UD3Zq20Z
1254515369211035600,Sun Apr 26 20:59:06 +0000 2020,Call of Duty: Mobile is getting an esports tournament with $1 million in prizes https://t.co/OIUQWTyNGf https://t.co/eT8WH6KcNB
1254500262863044600,Sun Apr 26 19:59:04 +0000 2020,The auto industry is picking a fight with the FCC over "vehicle-to-everything" communication https://t.co/335P2I61Hd https://t.co/3oi3LKa7LP
1254484901694447600,Sun Apr 26 18:58:02 +0000 2020,Apple’s new Magic Keyboard for the iPad Pro is covered under AppleCare Plus https://t.co/MOdK6n1vHi https://t.co/USqo7BYVYN
1254482819792994300,Sun Apr 26 18:49:46 +0000 2020,The coronavirus pandemic is getting the "total attention" of the Gates Foundation https://t.co/o9505G0GhP https://t.co/vqmM72V2Qm
1254471554940850200,Sun Apr 26 18:05:00 +0000 2020,How to step up your video calls from home https://t.co/lVl2KoiTKd
1254469808369827800,Sun Apr 26 17:58:03 +0000 2020,After mass layoffs at electric scooter company Bird, interviews with 16 former employees point to brash and careles… https://t.co/SBb4GJB5kp
1254454459381551000,Sun Apr 26 16:57:04 +0000 2020,Deck out your Switch with (not) an Animal Crossing skin that is (not) copyright infringement https://t.co/6actg1NeOM https://t.co/ZF0cgbIv8d
1254439369529835500,Sun Apr 26 15:57:06 +0000 2020,The electric Polestar 2 with native Android will start at $59,900 in the US https://t.co/VlCMZkl6gv https://t.co/Kyxx8Hs4vA
1254426256428331000,Sun Apr 26 15:05:00 +0000 2020,Tesla reportedly plans to recall some workers to its California plant this week https://t.co/2Vb3dskXoX
1254424757803647000,Sun Apr 26 14:59:03 +0000 2020,Motorola returns to flagship phones with the Edge Plus https://t.co/UlQ9u6zPqm https://t.co/6srLI5ZaDa
1254409918951633000,Sun Apr 26 14:00:05 +0000 2020,A Fold Apart turns working through anxiety into puzzle solving https://t.co/f1P5YzMRUn https://t.co/WK8K9f2J0m
1254408911052046300,Sun Apr 26 13:56:04 +0000 2020,Logitech’s Combo Touch is the Magic Keyboard for everyone else https://t.co/ug1uVXQMoR https://t.co/s6NrrddMCT
1254393815651229700,Sun Apr 26 12:56:05 +0000 2020,Sennheiser Momentum True Wireless 2 review: great sound, now with noise cancellation https://t.co/uXp3VcwrCp https://t.co/rNVtYJLNGm
1254363347622989800,Sun Apr 26 10:55:01 +0000 2020,This tool automatically transcribes your Zoom meetings as they happen https://t.co/6dz7rm4kGE https://t.co/LZpf13ajvv
1254348267485347800,Sun Apr 26 09:55:06 +0000 2020,Netflix promises subscribers it won’t run out of new content while people are stuck at home https://t.co/N2LIVAQ89A https://t.co/u9wrrb3uTh
1254333155689062400,Sun Apr 26 08:55:03 +0000 2020,The joy of spying on celebrity homes over Zoom and Instagram Live https://t.co/2eiotb9ebP https://t.co/nK5nkWXhFd
1254318067225702400,Sun Apr 26 07:55:05 +0000 2020,Netflix makes reality shows exclusively for the extremely online https://t.co/YaCuSQdl8Q https://t.co/pVzu6aX3T5
1254287615953711000,Sun Apr 26 05:54:05 +0000 2020,I’m obsessed with this Times Square live stream https://t.co/Gj01h5Nbh9 https://t.co/pyHyHAH74o
1254272506866917400,Sun Apr 26 04:54:03 +0000 2020,Wi-Fi is getting its biggest upgrade in 20 years https://t.co/bnccNRmR2J https://t.co/AERk94Jbii
1254244094706098200,Sun Apr 26 03:01:09 +0000 2020,Sewer systems are a window into the coronavirus pandemic https://t.co/0scbYixeTz https://t.co/Bf7T6j1EP5
1254228970939318300,Sun Apr 26 02:01:03 +0000 2020,Snapchat use is, predictably, way up with everyone home and staring at screens https://t.co/D42rvFYBzc https://t.co/y1U997pRGK
1254213680193048600,Sun Apr 26 01:00:18 +0000 2020,Researchers want social media companies to preserve coronavirus misinformation data https://t.co/xFJpMX5QNl https://t.co/QpmNk293iC
1254198581218640000,Sun Apr 26 00:00:18 +0000 2020,A new map shows that you can’t maintain social distancing on many New York City sidewalks https://t.co/rFDRt8wZoO https://t.co/8DcqccNC54
1254183440938872800,Sat Apr 25 23:00:08 +0000 2020,Sennheiser Momentum True Wireless 2 review: great sound, now with noise cancellation https://t.co/EGb8SLsBla https://t.co/8j6v1OGIVk
1254183175837843500,Sat Apr 25 22:59:05 +0000 2020,Inside the Overwatch League’s remote production studio https://t.co/WhPwsZdssB https://t.co/wJy0tb7YZo
1254168072002429000,Sat Apr 25 21:59:04 +0000 2020,How The Folio Society designs its gorgeous collector’s editions of Game of Thrones https://t.co/QnSYLTezBz https://t.co/CZfc35LyfC
1254167193622917000,Sat Apr 25 21:55:34 +0000 2020,Coursera to give unemployed workers free access to 3,800 online courses https://t.co/kwh6l8tU9H https://t.co/7avfSBLvfJ
1254152717586641000,Sat Apr 25 20:58:03 +0000 2020,How Microsoft tackles the 30,000 bugs its 47,000 developers generate each month https://t.co/gp3Ebgm02s https://t.co/E9g4o7P352
1254137627479101400,Sat Apr 25 19:58:05 +0000 2020,Browser maker Vivaldi now has a built-in tracker blocker that uses DuckDuckGo tech https://t.co/UBR0ayAQdv https://t.co/4skMBpypi3
1254122278725525500,Sat Apr 25 18:57:06 +0000 2020,VanMoof S3 e-bike review: better than the best https://t.co/hrSYKNbZWJ https://t.co/r3uY78Xd9Z
1254106907402473500,Sat Apr 25 17:56:01 +0000 2020,Motorola returns to flagship phones with the Edge Plus https://t.co/qWAZFSM6xL https://t.co/UK1AtupcXi
1254091810651148300,Sat Apr 25 16:56:02 +0000 2020,Netflix promises subscribers it won’t run out of new content while people are stuck at home https://t.co/GCx3dejoYN https://t.co/0uM2XCOawx
1254078967939657700,Sat Apr 25 16:05:00 +0000 2020,How urban coyotes took over North America https://t.co/Rzy1O50lQ3
1254076729972404200,Sat Apr 25 15:56:06 +0000 2020,How to use your Nvidia graphics card to improve the quality of your calls https://t.co/65oFLajwzD https://t.co/MSVf4lVTMN
1254062629649342500,Sat Apr 25 15:00:04 +0000 2020,Play Mackerelmedia Fish, a strangely adorable ode to dying websites https://t.co/k23dr8bSjX https://t.co/PtCpPqowUK
1254061375086829600,Sat Apr 25 14:55:05 +0000 2020,Apple iPhone SE review: everything you need https://t.co/9MI8FrIaEK https://t.co/XkMRGnSLSu
1254047536966484000,Sat Apr 25 14:00:06 +0000 2020,This weekend, save on Google Nest’s Hello video doorbell and the 15-inch MacBook Pro https://t.co/Zq3bENTcAa https://t.co/SUpk9Y3WGH
1254046265001816000,Sat Apr 25 13:55:03 +0000 2020,This website deletes itself if people stop posting https://t.co/o8MywifHkj https://t.co/0R3C94j1xM
1254042885680439300,Sat Apr 25 13:41:37 +0000 2020,Amazon restricted from selling non-essential items in France after it loses court appeal https://t.co/vR3kRXSGhS https://t.co/JVzifbwv4S
1254032440437416000,Sat Apr 25 13:00:07 +0000 2020,9 new trailers you should watch this week https://t.co/WkcpMbM2vA https://t.co/16IYQPfJUA
1254030923055665200,Sat Apr 25 12:54:05 +0000 2020,The iPad is still an iPad, even with a Magic Keyboard https://t.co/RhbDpm90tl https://t.co/WNmoOicHDc
1254015832621027300,Sat Apr 25 11:54:07 +0000 2020,Deck out your Switch with (not) an Animal Crossing skin that is (not) copyright infringement https://t.co/2bcPj9TGbv https://t.co/wYiWS2qqW1
1253920693693173800,Sat Apr 25 05:36:04 +0000 2020,This electric skate shop owner wound up with (almost) all of Boosted’s inventory https://t.co/gKG2qQ0A5O https://t.co/QcfTFVN9uj
1253904848715726800,Sat Apr 25 04:33:07 +0000 2020,Samsung and Google are offering free phone repairs to health care workers through June 30th https://t.co/wuQ3VADlfy https://t.co/2tek5L3X7n
1253901808134692900,Sat Apr 25 04:21:02 +0000 2020,Apple and Google pledge to shut down coronavirus tracker when pandemic ends https://t.co/uLNEqqpJeu https://t.co/TEaDCAWt1n
1253898541099073500,Sat Apr 25 04:08:03 +0000 2020,Democrats want to know if Amazon ‘lied’ about using platform data to create products https://t.co/WKQtkMPNB4 https://t.co/z79wRUBdVt
1253889493154910200,Sat Apr 25 03:32:05 +0000 2020,How to set up a Houseparty account https://t.co/3EdxYxHRJC https://t.co/7Z0Xs6FPnm
1253887721489268700,Sat Apr 25 03:25:03 +0000 2020,Intel NUC 9 Extreme review: small size, big potential https://t.co/n181dTQwZD https://t.co/R1dHvzNh07
1253877398011097000,Sat Apr 25 02:44:02 +0000 2020,Along with health and safety experts, we would like to remind you that Lysol is poison https://t.co/gQjsUMS0rO https://t.co/20FwP44kZq
1253856531772248000,Sat Apr 25 01:21:07 +0000 2020,Amazon tech workers are calling out sick in protest over COVID-19 response https://t.co/UwYlOFjFzQ https://t.co/jpWD3EQP5z
1253851281040474000,Sat Apr 25 01:00:15 +0000 2020,Telegram adding secure group video calls this year https://t.co/u22kjQ39rM https://t.co/JOSzYw2dee
1253847867548188700,Sat Apr 25 00:46:41 +0000 2020,Uber faces criticism for stopping food deliveries to low-income neighborhood in San Francisco… https://t.co/1NSZXaDrmt
1253847204332265500,Sat Apr 25 00:44:03 +0000 2020,Travis Scott’s first Fortnite concert was surreal and spectacular https://t.co/hth43TqsAR https://t.co/3hamJmdyTT
1253843435280371700,Sat Apr 25 00:29:04 +0000 2020,The Netflix button is an advertisement masquerading as a product https://t.co/2Lb57WkD8R https://t.co/9fmGr2nnNt
1253836155554062300,Sat Apr 25 00:00:09 +0000 2020,Microsoft Word now flags double spaces as errors, ending the great space debate https://t.co/sU1uNlG4mw https://t.co/Us0dCbyoig
1253834670099366000,Fri Apr 24 23:54:15 +0000 2020,Amazon will require warehouse workers request leave to stay home starting May 1st https://t.co/7QowLsh4hm https://t.co/kauYpQilSY
1253816502987489300,Fri Apr 24 22:42:03 +0000 2020,Sony delays Spider-Man films, forcing Marvel to move Doctor Strange and Thor sequels again https://t.co/9NHXqZER3q https://t.co/aDlbv7kda1
1253809877719400400,Fri Apr 24 22:15:44 +0000 2020,OnePlus lays off Europe employees less than two weeks after OnePlus 8 launch https://t.co/Ighhz4hrAA https://t.co/k8SEAVVq65
1253808207287517200,Fri Apr 24 22:09:05 +0000 2020,One of the Apple Watch’s original designers tweeted a behind-the-scenes look at its development… https://t.co/aDAj0MpGol
1253806261407305700,Fri Apr 24 22:01:21 +0000 2020,John Legere abruptly resigns from T-Mobile board of directors "to pursue other options" https://t.co/bF28rwrmLs https://t.co/iMC6zDu4dI
1253782222118805500,Fri Apr 24 20:25:50 +0000 2020,Amazon extends hourly wage increase for warehouse workers through May 16th https://t.co/tRtUaQF2Bu https://t.co/mhObd84fUl
1253773878700257300,Fri Apr 24 19:52:41 +0000 2020,RT @VergeDeals: Dreams, the build-your-own-game toolkit from the makers of LittleBigPlanet, is down to $25 at Amazon. This PS4-exclusive ga…
1253751467632181200,Fri Apr 24 18:23:38 +0000 2020,Mark Zuckerberg on how video chat needs to evolve for the pandemic https://t.co/9uQTioasn1 https://t.co/14vjGZsf98
1253749325458530300,Fri Apr 24 18:15:07 +0000 2020,Messenger Rooms are Facebook’s answer to Zoom and Houseparty for the pandemic https://t.co/slCoBkX7gd https://t.co/qGQVuaZ8cd
1253739715318239200,Fri Apr 24 17:36:56 +0000 2020,This electric skate shop owner wound up with (almost) all of Boosted’s inventory https://t.co/GDvS2R85Bh https://t.co/FraRPcwXI9
1253737043416559600,Fri Apr 24 17:26:19 +0000 2020,Samsung and Google are offering free phone repairs to health care workers through June 30th https://t.co/fFZ6pgHnlj https://t.co/1S2BL5e1bb
1253719314802323500,Fri Apr 24 16:15:52 +0000 2020,Hubble celebrates 30 years in space with a gorgeous landscape of stars https://t.co/6uDYshRhmY https://t.co/ASmSHCftTp
1253719131834253300,Fri Apr 24 16:15:08 +0000 2020,Apple and Google pledge to shut down coronavirus tracker when pandemic ends https://t.co/74PivGCQjZ https://t.co/Rsm1C1X3th
1253716035313827800,Fri Apr 24 16:02:50 +0000 2020,Democrats want to know if Amazon ‘lied’ about using platform data to create products https://t.co/PDJPHuSUpx https://t.co/FqWwpfwXLa
1253713626046791700,Fri Apr 24 15:53:15 +0000 2020,RT @VergeDeals: Dreams, the game creation sandbox for PS4, is discounted at several retailers https://t.co/VnTA2oaDGr https://t.co/uFmBKS7y…
1253709279179288600,Fri Apr 24 15:35:59 +0000 2020,How to set up a Houseparty account https://t.co/h8Te1z57aa https://t.co/v2s04gS5f8
1253707792541790200,Fri Apr 24 15:30:05 +0000 2020,Intel NUC 9 Extreme review: small size, big potential https://t.co/BlRxblQKad https://t.co/6QwckxP1Kx
1253698242208022500,Fri Apr 24 14:52:08 +0000 2020,Vergecast: reviews of Apple’s iPhone SE, Magic Keyboard, and Logitech’s Combo Touch https://t.co/sw3qOrcZPo https://t.co/D62QG2HTSA
1253697328386642000,Fri Apr 24 14:48:30 +0000 2020,Dreams, the game creation sandbox for PS4, is discounted at several retailers https://t.co/YXK5xQfDq3 https://t.co/oWpPEpuMU4
1253694085602390000,Fri Apr 24 14:35:37 +0000 2020,AT&amp;T CEO Randall Stephenson is stepping down, John Stankey to serve as new CEO https://t.co/GiimACiBfI https://t.co/w3Fbz3CKHF
1253693732832063500,Fri Apr 24 14:34:13 +0000 2020,Along with health and safety experts, we would like to remind you that Lysol is poison https://t.co/bGFWM5vO6p https://t.co/ZYQaSsDSy7
1253671519877816300,Fri Apr 24 13:05:57 +0000 2020,Amazon tech workers are calling out sick in protest over COVID-19 response https://t.co/FHTkd4q5ZX https://t.co/jBu7sgOFDP
1253670220780179500,Fri Apr 24 13:00:47 +0000 2020,Telegram adding secure group video calls this year https://t.co/9He4GfQrZr https://t.co/ErAuKWcTI0
1253667352543182800,Fri Apr 24 12:49:23 +0000 2020,Travis Scott’s first Fortnite concert was surreal and spectacular https://t.co/mLhTbcC3qd https://t.co/Cath3oY8fs
1253662487129591800,Fri Apr 24 12:30:03 +0000 2020,The Netflix button is an advertisement masquerading as a product https://t.co/dbphKHb9Ha https://t.co/PWVG5FSSh7
1253654957699498000,Fri Apr 24 12:00:08 +0000 2020,Microsoft Word now flags double spaces as errors, ending the great space debate https://t.co/ENwUzVopWO https://t.co/jLM5FZJLdN
1253644716337397800,Fri Apr 24 11:19:26 +0000 2020,Nintendo confirms 160,000 Nintendo Accounts accessed in hacking attempts https://t.co/rbt31w4Ysg https://t.co/tmTTZIhCTO
1253639868581916700,Fri Apr 24 11:00:10 +0000 2020,Making macOS run well on ARM processors isn’t the hard part https://t.co/dfBxIU0tKq https://t.co/bTayxabHhQ
1253633256903389200,Fri Apr 24 10:33:54 +0000 2020,A new iOS text bug is again crashing iPhones https://t.co/Pk8YosdX5v https://t.co/2Kia4IbeNz
1253624770870087700,Fri Apr 24 10:00:11 +0000 2020,Amazon’s white-collar workers are starting to stand up for their blue-collar colleagues https://t.co/MhhxCLsWNr https://t.co/RDnIM4K45V
1253602234136514600,Fri Apr 24 08:30:38 +0000 2020,Apple downplays iOS Mail app security flaw, says ‘no evidence’ of exploits https://t.co/UB3biupNw0 https://t.co/kYLcIMan2P
1253588752565403600,Fri Apr 24 07:37:03 +0000 2020,The auto industry is picking a fight with the FCC over "vehicle-to-everything" communication https://t.co/2ZGaeSDDCa https://t.co/D6HaW5VmmM
1253575661337350100,Fri Apr 24 06:45:02 +0000 2020,Bill Gates says countries will probably use interviews and databases to track the coronavirus… https://t.co/extInMTCFU
1253564373865500700,Fri Apr 24 06:00:11 +0000 2020,Apps aren’t a reliable way to measure blood oxygen levels https://t.co/NgUpiYc7vm https://t.co/JP6dIVHZJJ
1253559064375832600,Fri Apr 24 05:39:05 +0000 2020,The electric Polestar 2 with native Android will start at $59,900 in the US https://t.co/aeMQWroQ6F https://t.co/wj8P5pBrfK
1253556045353562000,Fri Apr 24 05:27:05 +0000 2020,Netflix nabs exclusive Pokémon episodes in latest move to dominate children’s television https://t.co/m4BoxwF23J https://t.co/KisDqAhJVa
1253552761586757600,Fri Apr 24 05:14:02 +0000 2020,Apple’s new Magic Keyboard for the iPad Pro is covered under AppleCare Plus https://t.co/HS8uNwpteK https://t.co/jP2iCW6oO6
1253549276132774000,Fri Apr 24 05:00:11 +0000 2020,Porsche unveils CarPlay-compatible radios for its classic cars https://t.co/ALsF1gYzPp https://t.co/jknsncgdpe
1253544715280175000,Fri Apr 24 04:42:04 +0000 2020,I’m obsessed with this Times Square live stream https://t.co/TIcfHtunB7 https://t.co/cddMFi7vT2
1253542644023734300,Fri Apr 24 04:33:50 +0000 2020,LG’s Velvet phone is coming on May 7th https://t.co/fwjxQss91E https://t.co/k9EclDwS0O
1253541188088586200,Fri Apr 24 04:28:03 +0000 2020,Netflix makes reality shows exclusively for the extremely online https://t.co/sGgxXUI3ot https://t.co/ToXWrp1Hx3
1253539441571922000,Fri Apr 24 04:21:07 +0000 2020,After mass layoffs at electric scooter company Bird, interviews with 16 former employees point to brash and careles… https://t.co/o0A14SfwZL
1253537669650489300,Fri Apr 24 04:14:04 +0000 2020,Fallout 76’s Wastelanders update almost makes it feel like a proper Fallout game https://t.co/JMdYyLmkeZ https://t.co/ka7HPqaZLr
1253534902215151600,Fri Apr 24 04:03:04 +0000 2020,How to watch Travis Scott’s Fortnite concerts https://t.co/vJ2109M0wz https://t.co/7abzMZMtrA
1253529517668384800,Fri Apr 24 03:41:41 +0000 2020,More than 12 million people attended Travis Scott’s Fortnite concert https://t.co/lPKf7o0imP https://t.co/oofOU6CsLB
1253524584441294800,Fri Apr 24 03:22:04 +0000 2020,Facebook just killed its "pseudoscience" category for ad targeting https://t.co/Js0uYQFgve https://t.co/hfNiTtc5n6
1253521058067632000,Fri Apr 24 03:08:04 +0000 2020,Wi-Fi is getting its biggest upgrade in 20 years https://t.co/wn6pLduDzL https://t.co/AmEaoF7b4r
1253518787804004400,Fri Apr 24 02:59:02 +0000 2020,Connecticut suburb deploys "pandemic drones" to try to enforce social distancing https://t.co/YAIphXqLgv https://t.co/YerWQEsBaK
1253514754922086400,Fri Apr 24 02:43:01 +0000 2020,The Mandalorian’s stunning set and technology get explored in first trailer for Disney Plus docuseries… https://t.co/pqqmvGqnPf
1253509728967315500,Fri Apr 24 02:23:03 +0000 2020,Google will make all of its advertisers verify their identities https://t.co/VjfbtIvvzt https://t.co/PRlKzBCIyZ
1253503987229372400,Fri Apr 24 02:00:14 +0000 2020,Samsung smart TVs are getting an Apple Music app https://t.co/YAK9i0xpq2 https://t.co/K8qCMHFXuu
1253502446862827500,Fri Apr 24 01:54:06 +0000 2020,Red Dead Redemption 2 is coming to Xbox Game Pass in May https://t.co/oHf7Iq8FYK https://t.co/6JuzJwFuZJ
1253495883892756500,Fri Apr 24 01:28:02 +0000 2020,Leverage is getting rebooted as IMDb TV’s first major original series https://t.co/08gLPJviWL https://t.co/VC46LycopL
1253491113148776400,Fri Apr 24 01:09:04 +0000 2020,Boston Dynamics’ Spot robot is helping hospitals remotely treat coronavirus patients https://t.co/kZh1RC5Rtr https://t.co/ZWd52Wplfl
1253490106398318600,Fri Apr 24 01:05:04 +0000 2020,Google will tell you when it thinks its search results aren’t good https://t.co/F25MihHIFJ https://t.co/FUcHfgNJBg
1253485084033892400,Fri Apr 24 00:45:07 +0000 2020,This tool automatically transcribes your Zoom meetings as they happen https://t.co/MA5cPMlPlI https://t.co/8x5oFDdlVn
1253478056594989000,Fri Apr 24 00:17:11 +0000 2020,Travis Scott’s first Fortnite concert was surreal and spectacular https://t.co/0iSeoWpwpI https://t.co/bIeZLb7ZFf
1253477773055836200,Fri Apr 24 00:16:04 +0000 2020,Apple will reportedly use 12-core 5nm ARM processor in a 2021 Mac https://t.co/UEvNLbJfb0 https://t.co/UH1sxVCljw
1253475200211062800,Fri Apr 24 00:05:50 +0000 2020,Parks and Recreation is returning next week for a half-hour charity special on NBC https://t.co/dmivtONioY https://t.co/GUz9HJG2OB
1253473998106747000,Fri Apr 24 00:01:04 +0000 2020,Logitech’s Combo Touch is the Magic Keyboard for everyone else https://t.co/uwYHX2gOdv https://t.co/PlyJiGclPl
1253460560416510000,Thu Apr 23 23:07:40 +0000 2020,Avatar: The Last Airbender is hitting Netflix on May 15th https://t.co/7we0jIISGQ https://t.co/GYiEZLVlHh
1253455956886851600,Thu Apr 23 22:49:22 +0000 2020,NASA administrator urges people not to travel to Florida to watch historic SpaceX launch https://t.co/oQI2qJjHMq https://t.co/IPVUE4K5A7
1253442263276978200,Thu Apr 23 21:54:58 +0000 2020,Even Elijah Wood needs Twitter’s help to sell his Animal Crossing turnips https://t.co/go8TFZO3XS https://t.co/HHhalRA6jl
1253441888771870700,Thu Apr 23 21:53:28 +0000 2020,Instacart is hiring even more shoppers and adding "wellness checks" to its shopper app https://t.co/krntnUZtE2 https://t.co/DbLsb95xCo
1253430044438835200,Thu Apr 23 21:06:24 +0000 2020,Amazon reportedly accessed third-party seller data to develop private-label products https://t.co/CX4voMMI2Z https://t.co/uXDNRt97qM
1253429122530865200,Thu Apr 23 21:02:45 +0000 2020,RT @kellymakena: There's a false Biden ad going around Twitter and in pro-Trump circles. The Biden campaign confirmed to me earlier today t…
1253426904389976000,Thu Apr 23 20:53:56 +0000 2020,RT @VergeDeals: It's your last chance to preorder Apple's new iPhone SE 2. Until later tonight, Best Buy is offering a $50 gift card with p…
1253408803309023200,Thu Apr 23 19:42:00 +0000 2020,The auto industry is picking a fight with the FCC over "vehicle-to-everything" communication https://t.co/dlmwH1W0Yd https://t.co/J3JvhRCqdZ
1253399647974031400,Thu Apr 23 19:05:37 +0000 2020,A fake Joe Biden ad is being amplified on Twitter by Trump campaign staffers https://t.co/sUholLCaoZ https://t.co/sl5TMcnO2D
1253398176306008000,Thu Apr 23 18:59:46 +0000 2020,Bill Gates says countries will probably use interviews and databases to track the coronavirus… https://t.co/NY7UKoSNlj
1253383529532141600,Thu Apr 23 18:01:34 +0000 2020,Apps aren’t a reliable way to measure blood oxygen levels https://t.co/QOBNyuBH8G https://t.co/DEvQKkZCMC
1253373510489190400,Thu Apr 23 17:21:46 +0000 2020,The electric Polestar 2 with native Android will start at $59,900 in the US https://t.co/hAFb53GK6h https://t.co/xPKNYjoTOm
1253372837647319000,Thu Apr 23 17:19:05 +0000 2020,Netflix nabs exclusive Pokémon episodes in latest move to dominate children’s television https://t.co/BrH3tM9GS0 https://t.co/9nNbnjxv2c
1253370771285688300,Thu Apr 23 17:10:53 +0000 2020,Apple’s new Magic Keyboard for the iPad Pro is covered under AppleCare Plus https://t.co/AoJ0ubP5Ka https://t.co/3PEfSDHi4R
1253368037929091000,Thu Apr 23 17:00:01 +0000 2020,Porsche unveils CarPlay-compatible radios for its classic cars https://t.co/10L0vicv17 https://t.co/SENpV2gaxT
1253363281357652000,Thu Apr 23 16:41:07 +0000 2020,I’m obsessed with this Times Square live stream https://t.co/sHwF565cJA https://t.co/MsEsemToGt
1253359385578836000,Thu Apr 23 16:25:38 +0000 2020,Netflix makes reality shows exclusively for the extremely online https://t.co/NbCpDJxfDU https://t.co/qSIQ4VD8LK
1253356743813410800,Thu Apr 23 16:15:08 +0000 2020,Fallout 76’s Wastelanders update almost makes it feel like a proper Fallout game https://t.co/UJmmYlsSoG https://t.co/PgT6uxwto2
1253353234149847000,Thu Apr 23 16:01:11 +0000 2020,After mass layoffs at electric scooter company Bird, interviews with 16 former employees point to brash and careles… https://t.co/xrP9z778tl
1253353218102431700,Thu Apr 23 16:01:08 +0000 2020,How to watch Travis Scott’s Fortnite concerts https://t.co/0BnYKkzxBt https://t.co/r3ljWjsCnO
