id,created_at,text
1243895191934730200,Sat Mar 28 13:38:18 +0000 2020,OneWeb files for Chapter 11 bankruptcy protection https://t.co/LPhH9qfTJo https://t.co/xxVOLp2Wdg
1243881288756539400,Sat Mar 28 12:43:04 +0000 2020,The creators of Plague Inc. are adding a new game mode that lets you stop an outbreak https://t.co/upJiiIMOtd https://t.co/FMBH5pi1RS
1243866191015411700,Sat Mar 28 11:43:04 +0000 2020,YouTube is reducing its default video quality to standard definition for the next month https://t.co/4eN5KaBmkv https://t.co/icmJE4kHwD
1243808051519459300,Sat Mar 28 07:52:02 +0000 2020,Nvidia adds Control to GeForce Now and promises new games every week https://t.co/Qt7cueoxMC https://t.co/fEo4VPIEck
1243807794807083000,Sat Mar 28 07:51:01 +0000 2020,Bird lays off nearly a third of its staff during coronavirus pandemic https://t.co/LNRg8ofPrv https://t.co/1E6fiZnf6Y
1243805045357006800,Sat Mar 28 07:40:06 +0000 2020,How to stop trolls from taking over your Zoom  call https://t.co/EgdKiEkLjm https://t.co/BsOKiMhzbg
1243803279865319400,Sat Mar 28 07:33:05 +0000 2020,Nursing home residents tested positive for the coronavirus before showing symptoms https://t.co/9WRrxgU3gf https://t.co/O3l6I2BIPo
1243797742461337600,Sat Mar 28 07:11:05 +0000 2020,Instacart workers will walk out on Monday for better sick leave and virus protections https://t.co/nXcMupsf5E https://t.co/df0y04JpQN
1243790690464784400,Sat Mar 28 06:43:03 +0000 2020,A viral text warns taking Advil could make COVID-19 symptoms worse, but experts say it’s unfounded… https://t.co/Fl9uZzhHzF
1243788424349433900,Sat Mar 28 06:34:03 +0000 2020,Google cancels its infamous April Fools’ jokes this year https://t.co/hmelFKBQrE https://t.co/Cebklajqjd
1243784160004771800,Sat Mar 28 06:17:06 +0000 2020,Facebook launches accessibility and creator tools to make live-streaming available to more people… https://t.co/yz7YjsnyUm
1243782635186540500,Sat Mar 28 06:11:03 +0000 2020,Half-Life: Alyx gives us a big hint about Gordon Freeman’s future https://t.co/OSq5oLP4NN https://t.co/0Mi6bsdqnW
1243779895550980000,Sat Mar 28 06:00:10 +0000 2020,8 new anime to check out this spring  https://t.co/ajg9o4Vywh https://t.co/v7W944F3Es
1243778103593312300,Sat Mar 28 05:53:02 +0000 2020,Crip Camp reminds us that, in America, nothing improves without massive sacrifice https://t.co/AQJWkCAMnQ https://t.co/fLutxpQ15e
1243777360727625700,Sat Mar 28 05:50:05 +0000 2020,Games Done Quick is holding a speedrunning marathon to raise money for coronavirus relief https://t.co/ZVJ3KD8LyS https://t.co/dPBLsXX311
1243774334281363500,Sat Mar 28 05:38:04 +0000 2020,The entire world is streaming more than ever — and it’s straining the internet https://t.co/lcqmXGbd8a https://t.co/QhB9qBJQLY
1243771314529280000,Sat Mar 28 05:26:04 +0000 2020,Dyson developed and is producing ventilators to help treat COVID-19 patients https://t.co/IVSAv0heyN https://t.co/E1vGwtSf3q
1243770315072778200,Sat Mar 28 05:22:05 +0000 2020,General Motors will make ventilators to help fight the worst cases of COVID-19 https://t.co/SJQK182G8x https://t.co/aeK3eDHDE9
1243769041237553200,Sat Mar 28 05:17:02 +0000 2020,We’re still waiting for Trump’s coronavirus testing system https://t.co/lfWgSsW17A https://t.co/7XmtIXRse9
1243766288897450000,Sat Mar 28 05:06:05 +0000 2020,Google aims to donate more than 2 million face masks to the CDC https://t.co/mT9fydwyFT https://t.co/0lkxxmubgo
1243761500688351200,Sat Mar 28 04:47:04 +0000 2020,Apple launches COVID-19 screening app and website https://t.co/XVsG6kr545 https://t.co/5llWa5zJPU
1243759236435280000,Sat Mar 28 04:38:04 +0000 2020,Slack is working on Microsoft Teams integration for calls https://t.co/syb8YcVfi9 https://t.co/cMycX8lPFo
1243749456115359700,Sat Mar 28 03:59:12 +0000 2020,Vergecast: MacBook Air and iPad Pro reviews and how COVID-19 is affecting tech companies and culture… https://t.co/1JFsP62T6Y
1243747156403552300,Sat Mar 28 03:50:04 +0000 2020,OnePlus phones are finally getting always-on displays https://t.co/Zui8IVzgQE https://t.co/EN868jWXhV
1243743887258239000,Sat Mar 28 03:37:05 +0000 2020,Med students are graduating early to join the fight against COVID-19 https://t.co/D6oUHnPUgh https://t.co/O72PlZb9da
1243734835824296000,Sat Mar 28 03:01:06 +0000 2020,Instagram therapists, and their DMs, are open for business https://t.co/msRW9C4enI https://t.co/hJZRMG3gRq
1243724261212201000,Sat Mar 28 02:19:05 +0000 2020,Now is a great time to buy an e-bike https://t.co/llUvE8guyU https://t.co/2Bs32HkIDu
1243716951999996000,Sat Mar 28 01:50:03 +0000 2020,Sony is now slowing down PlayStation downloads in the US https://t.co/nnZyc7AsnY https://t.co/OlZw53JWFM
1243712942094385200,Sat Mar 28 01:34:07 +0000 2020,How the biggest gaming leagues are adapting to an online-only world https://t.co/uHyetwIuoc https://t.co/vlP6VCHYDD
1243706387525492700,Sat Mar 28 01:08:04 +0000 2020,Electronics companies are getting gridlocked by coronavirus lockdown https://t.co/UCon2lsL4b https://t.co/48yiKtIoOH
1243704452030312400,Sat Mar 28 01:00:22 +0000 2020,Bloodshot never had a chance of starting a new cinematic universe https://t.co/H7rbB7Sp3u https://t.co/ymAw09GPex
1243701598334996500,Sat Mar 28 00:49:02 +0000 2020,Google has banned the Infowars Android app over false coronavirus claims https://t.co/zHqP3yhh2E https://t.co/28VAGTDZoW
1243701347393982500,Sat Mar 28 00:48:02 +0000 2020,Google ups Duo group calling limit from eight to twelve https://t.co/SrQuPFP9Mn https://t.co/VeIxEPrE5g
1243694869736030200,Sat Mar 28 00:22:18 +0000 2020,Lyft is referring drivers to jobs at Amazon after massive ridership decline https://t.co/sEsfjGL4JQ https://t.co/IeDDwO9G6r
1243693544482787300,Sat Mar 28 00:17:02 +0000 2020,Migrants aren’t to blame for COVID-19 https://t.co/0tPsG7KX95 https://t.co/SMe8xkDsji
1243690681949970400,Sat Mar 28 00:05:39 +0000 2020,"With me" videos on YouTube are seeing huge spikes in viewership as people stay home https://t.co/L98X1HH3jU https://t.co/lAJkOkRSJs
1243689359561437200,Sat Mar 28 00:00:24 +0000 2020,Movies Anywhere is bringing its digital film locker to LG’s TVs https://t.co/CYnhf5fMnn https://t.co/opPUW3aCoF
1243676109092409300,Fri Mar 27 23:07:45 +0000 2020,Postmates couriers are eligible for unemployment benefits, rules New York appeals court https://t.co/FH3estqr0o https://t.co/6ygpw8tYbG
1243660110204997600,Fri Mar 27 22:04:11 +0000 2020,Microsoft to end investments in facial recognition firms after AnyVision controversy https://t.co/ZR1qfWgOFR https://t.co/PSzn5TJA8y
1243651408068518000,Fri Mar 27 21:29:36 +0000 2020,Amazon is giving workers a letter to prove they are doing an "essential" job https://t.co/XvYvPzk7qZ https://t.co/kCMPqbR1Gt
1243649634695884800,Fri Mar 27 21:22:33 +0000 2020,Tesla’s shrinking its workforce at the Gigafactory in Nevada because of the coronavirus https://t.co/QvFrxA4uT2 https://t.co/kkYz4pYWss
1243644395150246000,Fri Mar 27 21:01:44 +0000 2020,What happens when extreme heat collides with a pandemic? https://t.co/dI0o5ghIa6 https://t.co/bMEPSDNcMt
1243641259580969000,Fri Mar 27 20:49:16 +0000 2020,House approves $2 trillion coronavirus bill as members struggle with infection https://t.co/gXaREQUSOP https://t.co/ojtQiWBsbn
1243637585236426800,Fri Mar 27 20:34:40 +0000 2020,In an unprecedented move, Disney parks will remain closed until further notice https://t.co/0IqrKLMVOg https://t.co/oKGF9FZfnK
1243636307500437500,Fri Mar 27 20:29:36 +0000 2020,NASA tasks SpaceX with sending cargo and supplies to future lunar space station https://t.co/CHLUYOSXmz https://t.co/fOojrWmedo
1243635880553742300,Fri Mar 27 20:27:54 +0000 2020,Here’s how hospitals are keeping up emergency services during COVID-19 https://t.co/Sdlm3fegSt https://t.co/PqbPykOv59
1243627007474389000,Fri Mar 27 19:52:38 +0000 2020,Nvidia adds Control to GeForce Now and promises new games every week https://t.co/YiodBqNBTK https://t.co/5wBC6GEI9F
1243626593731465200,Fri Mar 27 19:51:00 +0000 2020,Bird lays off nearly a third of its staff during coronavirus pandemic https://t.co/RIrHsawkPv https://t.co/E3GJZS3HqT
1243623308207235000,Fri Mar 27 19:37:56 +0000 2020,How to stop trolls from taking over your Zoom  call https://t.co/svoB5rjEPi https://t.co/DihWryk5Nq
1243621134903451600,Fri Mar 27 19:29:18 +0000 2020,Nursing home residents tested positive for the coronavirus before showing symptoms https://t.co/dU2h5TtjEI https://t.co/p1oT8NVbow
1243611900409151500,Fri Mar 27 18:52:36 +0000 2020,Instacart workers will walk out on Monday for better sick leave and virus protections https://t.co/hsDzufdYoq https://t.co/aw0RnKKXCG
1243611868926824400,Fri Mar 27 18:52:29 +0000 2020,A viral text warns taking Advil could make COVID-19 symptoms worse, but experts say it’s unfounded… https://t.co/nWbR73PRap
1243608971027591200,Fri Mar 27 18:40:58 +0000 2020,Apple reportedly says coating on the MacBook Air’s display can smudge https://t.co/zt3sMPyHKD https://t.co/abDjQhSUas
1243604258999734300,Fri Mar 27 18:22:15 +0000 2020,Google cancels its infamous April Fools’ jokes this year https://t.co/yEbk5mKvR5 https://t.co/3pxwDX99RL
1243603066089279500,Fri Mar 27 18:17:30 +0000 2020,Facebook launches accessibility and creator tools to make live-streaming available to more people… https://t.co/OCiPaYsv8D
1243602260422283300,Fri Mar 27 18:14:18 +0000 2020,Half-Life: Alyx gives us a big hint about Gordon Freeman’s future https://t.co/uAJNtiZ0GZ https://t.co/I1ZXxVPpK5
1243598721583063000,Fri Mar 27 18:00:14 +0000 2020,8 new anime to check out this spring  https://t.co/02A0h6JvOw https://t.co/JCOrgnMB3r
1243596358000533500,Fri Mar 27 17:50:51 +0000 2020,Games Done Quick is holding a speedrunning marathon to raise money for coronavirus relief https://t.co/QQAiEaNl0g https://t.co/ob1iM5lqxo
1243596242992664600,Fri Mar 27 17:50:23 +0000 2020,Crip Camp reminds us that, in America, nothing improves without massive sacrifice https://t.co/C9Ja2E9dmT https://t.co/CdAp5gDw81
1243595866163871700,Fri Mar 27 17:48:54 +0000 2020,Go read this Texas Monthly piece on how HEB prepped for the coronavirus outbreak https://t.co/6jFU2MNlqG https://t.co/3if62Ojuzq
1243594991441711000,Fri Mar 27 17:45:25 +0000 2020,The entire world is streaming more than ever — and it’s straining the internet https://t.co/uui17mcRwP https://t.co/ZdPNIQaxrw
1243589503723454500,Fri Mar 27 17:23:37 +0000 2020,General Motors will make ventilators to help fight the worst cases of COVID-19 https://t.co/X6VOOcf3yY https://t.co/5gUr5H779o
1243585547010035700,Fri Mar 27 17:07:53 +0000 2020,We’re still waiting for Trump’s coronavirus testing system https://t.co/eaI3CXXhAu https://t.co/rIfCJENjmM
1243584162759671800,Fri Mar 27 17:02:23 +0000 2020,Google aims to donate more than 2 million face masks to the CDC https://t.co/vbFkqo9pEj https://t.co/sdO9L2tEDJ
1243580966116958200,Fri Mar 27 16:49:41 +0000 2020,Apple launches COVID-19 screening app and website https://t.co/R70DirQLJZ https://t.co/fnYvJGjL8q
1243578842314412000,Fri Mar 27 16:41:15 +0000 2020,Slack is working on Microsoft Teams integration for calls https://t.co/QPQPYBqISB https://t.co/VFW5tEmvgg
1243571336775164000,Fri Mar 27 16:11:25 +0000 2020,MacBook Air 2020 review: the best Mac for most people https://t.co/xa1ffJ22DI
1243568393942454300,Fri Mar 27 15:59:44 +0000 2020,Vergecast: MacBook Air and iPad Pro reviews and how COVID-19 is affecting tech companies and culture… https://t.co/8MUAG2hPm1
1243566988481396700,Fri Mar 27 15:54:09 +0000 2020,OnePlus phones are finally getting always-on displays https://t.co/gJzxuxaDTC https://t.co/CkTbGHh4HN
1243562558512140300,Fri Mar 27 15:36:32 +0000 2020,Med students are graduating early to join the fight against COVID-19 https://t.co/1HeJ6pQ4e9 https://t.co/yEgcv6Exsr
1243558259333763000,Fri Mar 27 15:19:27 +0000 2020,RT @danideahl: Updated with more freebies from Apple, Ableton, Music Maker JAM, and Berklee College of Music ❤️🎶  https://t.co/Gw8Cvfug2Q
1243553661722255400,Fri Mar 27 15:01:11 +0000 2020,Instagram therapists, and their DMs, are open for business https://t.co/t2zjLvEK8e https://t.co/pvzEU137ZA
1243542768137486300,Fri Mar 27 14:17:54 +0000 2020,Now is a great time to buy an e-bike https://t.co/rHlD4sw0GS https://t.co/4KYJiEoUfT
1243537488993489000,Fri Mar 27 13:56:55 +0000 2020,Sony is now slowing down PlayStation downloads in the US https://t.co/eSDzD7tnya https://t.co/9Dvf4BPeAf
1243530517942800400,Fri Mar 27 13:29:13 +0000 2020,How the biggest gaming leagues are adapting to an online-only world https://t.co/da3i0s6fkq https://t.co/WAQhMtxwT8
1243524688862679000,Fri Mar 27 13:06:04 +0000 2020,Fitbit Charge 4 leak reveals built-in GPS and new fitness tracking features https://t.co/FMWUpb0eJu https://t.co/XMHMYpOj2n
1243523470522269700,Fri Mar 27 13:01:13 +0000 2020,Electronics companies are getting gridlocked by coronavirus lockdown https://t.co/EosVwyP8XG https://t.co/E3wayYOhLu
1243523460233597000,Fri Mar 27 13:01:11 +0000 2020,Bloodshot never had a chance of starting a new cinematic universe https://t.co/PgUCVmuFuL https://t.co/ZocG0UeSkm
1243522837698281500,Fri Mar 27 12:58:42 +0000 2020,Google ups Duo group calling limit from eight to twelve https://t.co/K6HSNmlMPb https://t.co/cK1p7PVVej
1243511866334347300,Fri Mar 27 12:15:06 +0000 2020,Migrants aren’t to blame for COVID-19 https://t.co/C87JtZv2FM https://t.co/eWai033i3f
1243508096036724700,Fri Mar 27 12:00:08 +0000 2020,Movies Anywhere is bringing its digital film locker to LG’s TVs https://t.co/08kDpdCUDL https://t.co/cfCqxD3jJH
1243500536164487200,Fri Mar 27 11:30:05 +0000 2020,Chan Zuckerberg Initiative commits $25 million to a fund researching COVID-19 treatments https://t.co/leve6bkpbg https://t.co/9HTtc5twP7
1243498235777421300,Fri Mar 27 11:20:57 +0000 2020,Amazon’s Alexa voice assistant can now help you diagnose COVID-19 https://t.co/QxOLVZjgsP https://t.co/YBtfHNFaNx
1243493040788029400,Fri Mar 27 11:00:18 +0000 2020,The MacBook Air: restore default https://t.co/Wtj07vJFb7 https://t.co/aOzD1TmcJe
1243486228026208300,Fri Mar 27 10:33:14 +0000 2020,Google to resume regular Chrome updates after brief pause https://t.co/12ngZimlFs https://t.co/FzJcaHFfVd
1243478157203837000,Fri Mar 27 10:01:10 +0000 2020,The worst Amazon shipping delays could still be ahead of us https://t.co/oexhxsnztO https://t.co/BxEnpnia4B
1243459011971887000,Fri Mar 27 08:45:05 +0000 2020,Airbnb asks its hosts to provide 100,000 free rentals to first responders https://t.co/9MeIPS9kUt https://t.co/vi5aY5Ls9Q
1243453976466645000,Fri Mar 27 08:25:04 +0000 2020,Verily details drive-through COVID-19 testing in new video https://t.co/Q8ae3cF2Iq https://t.co/MMBHzbGciv
1243449937142128600,Fri Mar 27 08:09:01 +0000 2020,Google’s new Pixel Buds could hit spring release date, as they may have just hit the FCC https://t.co/W0ovHGHFn8 https://t.co/FPRzFg9qjk
1243447420282974200,Fri Mar 27 07:59:01 +0000 2020,Here are a bunch of free music apps and sample packs while we’re all stuck inside https://t.co/ICMiHISS2Y https://t.co/sVwFmElLk9
1243440628731711500,Fri Mar 27 07:32:02 +0000 2020,Twitch’s Stream Aid 2020 plans to raise money for COVID-19 relief this weekend with a bunch of celebs… https://t.co/aGYSPSv8Fx
1243429557820162000,Fri Mar 27 06:48:03 +0000 2020,The FCC should let itself do more to keep Americans connected through the pandemic https://t.co/xqa3AwfN3h https://t.co/eFhz0RUego
1243427792273850400,Fri Mar 27 06:41:02 +0000 2020,CarPlay dashboard gets third-party maps support in iOS 13.4 https://t.co/iGNOst4FoS https://t.co/95qCSMTFhO
1243414972148768800,Fri Mar 27 05:50:05 +0000 2020,Half-Life’s Alyx Vance, explained https://t.co/0Ew3M3BXfe https://t.co/Rj7qb3uMc7
1243408926508322800,Fri Mar 27 05:26:04 +0000 2020,Patreon says more creators are signing up for accounts than usual https://t.co/NFLNyv4MTB https://t.co/s5Yz09DY7p
1243406160012566500,Fri Mar 27 05:15:04 +0000 2020,During a public health crisis in the US, distancing power rests with the states https://t.co/25UU3qo2da https://t.co/XzXqNkti7n
1243404902409236500,Fri Mar 27 05:10:04 +0000 2020,OnePlus 8 Pro may come in a slick seafoam green and finally have wireless charging https://t.co/WxGtEEi80G https://t.co/XymVupshFd
1243397779021389800,Fri Mar 27 04:41:46 +0000 2020,‘Several’ ARM-based Mac laptops and desktops coming next year, says report https://t.co/0vMB9HEqTs https://t.co/NC79367Cfc
1243395587073925000,Fri Mar 27 04:33:03 +0000 2020,Zoom is 2020’s hottest yoga studio https://t.co/cYYPjHoGdK https://t.co/EVbuKYxFrS
1243394587294490600,Fri Mar 27 04:29:05 +0000 2020,Dyson developed and is producing ventilators to help treat COVID-19 patients https://t.co/AB5KKCG9Ni https://t.co/aTlhNKMiYz
1243391069191995400,Fri Mar 27 04:15:06 +0000 2020,Huawei’s Watch GT 2E is a sporty redesign of its last smartwatch https://t.co/5uWXTGnjcz https://t.co/nhOm75eAFI
1243390810667634700,Fri Mar 27 04:14:05 +0000 2020,Samsung’s Galaxy S10 Plus is discounted for a limited time https://t.co/af0JKLGL6R https://t.co/qDPGYDsGcV
1243387801200017400,Fri Mar 27 04:02:07 +0000 2020,Rad Power Bikes releases an upgraded version of its best electric bike https://t.co/PYpJbdjakQ https://t.co/HkOsaRL37S
1243380247229161500,Fri Mar 27 03:32:06 +0000 2020,The Nintendo Switch is getting ports of BioShock, Borderlands, Burnout, and lots more https://t.co/qYrmoUs4H5 https://t.co/XIc1xWym3H
1243373941751713800,Fri Mar 27 03:07:03 +0000 2020,YouTube creators figure out how to film during a pandemic https://t.co/b4NFbOh6Jf https://t.co/NDXui35WaK
1243370172355879000,Fri Mar 27 02:52:04 +0000 2020,Ring Fit Adventure gets a new rhythm mode while everyone’s stuck at home https://t.co/SNZV41t1eA https://t.co/tsNStcIoNb
1243367149374070800,Fri Mar 27 02:40:03 +0000 2020,Nine Inch Nails just released two new albums for free https://t.co/MId9zjofuw https://t.co/zdt387b9v6
1243365399036457000,Fri Mar 27 02:33:06 +0000 2020,FBI arrests man for hawking fake "coronavirus prevention pill" https://t.co/VKkntLdU2D https://t.co/gGZ3oow7xe
1243364672792748000,Fri Mar 27 02:30:13 +0000 2020,Apple MacBook Air (2020) review: the best Mac for most people https://t.co/y2AjxTg7OZ https://t.co/sxmmHpZaaz
1243357135137673200,Fri Mar 27 02:00:16 +0000 2020,Epic launches publishing label, signs creators behind Control, Inside, and The Last Guardian https://t.co/5aHWM8NryY https://t.co/LFI8nMCPyU
1243355825608876000,Fri Mar 27 01:55:03 +0000 2020,Duolingo is launching an iOS app to teach young kids how to read https://t.co/MqJQ31BvWQ https://t.co/81pbqlH1uU
1243354058620113000,Fri Mar 27 01:48:02 +0000 2020,The COVID-19 pandemic is generating tons of medical waste https://t.co/LLfdD8PYTJ https://t.co/Ks34PtSGs4
1243351792219537400,Fri Mar 27 01:39:02 +0000 2020,Huawei hopes the P40 Pro’s powerful hardware can lure you away from Google https://t.co/vjVEk9EDgF https://t.co/FIjw8nFfBW
1243342110230810600,Fri Mar 27 01:00:33 +0000 2020,Yelp to stop auto-creating fundraisers after outrage from business owners https://t.co/B0VOHuv7gZ https://t.co/wT912ztYij
1243342018073563100,Fri Mar 27 01:00:11 +0000 2020,Polaroid’s new Now instant film camera delivers a classic, punishing experience https://t.co/i5drYLQJbT https://t.co/izOjMUXOrq
1243321374854107100,Thu Mar 26 23:38:10 +0000 2020,Apple’s Final Cut Pro and Logic Pro X are getting 90-day free trials https://t.co/RTIcmL2PmB https://t.co/eX3NXzwncz
1243301939615617000,Thu Mar 26 22:20:56 +0000 2020,Google says disabling an online business website due to coronavirus should be a last resort https://t.co/kG1eyjSK7l https://t.co/Tbq9TW0d0n
1243298661947379700,Thu Mar 26 22:07:55 +0000 2020,The coronavirus is now the American virus https://t.co/eZnspOld9f https://t.co/KRxC2KgOcg
1243288754384777200,Thu Mar 26 21:28:32 +0000 2020,RT @danideahl: Since we're all stuck at home I compiled a list of currently free music apps, plug-ins, sample packs, lessons, and even digi…
1243282462496764000,Thu Mar 26 21:03:32 +0000 2020,Some Tesla factory employees still had to work after the production shutdown https://t.co/WvVfhghNVg https://t.co/E3c9ZLhd8c
1243275930010779600,Thu Mar 26 20:37:35 +0000 2020,Airbnb asks its hosts to provide 100,000 free rentals to first responders https://t.co/VUrajtZ1jD https://t.co/yYODlkxAhp
1243274022097313800,Thu Mar 26 20:30:00 +0000 2020,How robots will repair or destroy satellites in orbit https://t.co/Yh2UJuMVLn
1243272494527721500,Thu Mar 26 20:23:56 +0000 2020,Verily details drive-through COVID-19 testing in new video https://t.co/pxdhSKNqlK https://t.co/osrB8xLklL
1243266965638205400,Thu Mar 26 20:01:58 +0000 2020,Google’s new Pixel Buds could hit spring release date, as they may have just hit the FCC https://t.co/VJYRxgrLGU https://t.co/BUk0EYmiFR
1243266244754710500,Thu Mar 26 19:59:06 +0000 2020,Here are a bunch of free music apps and sample packs while we’re all stuck inside https://t.co/6xK1J5wFG8 https://t.co/0mUECRHwNe
1243259827683504000,Thu Mar 26 19:33:36 +0000 2020,Twitch’s Stream Aid 2020 plans to raise money for COVID-19 relief this weekend with a bunch of celebs… https://t.co/v8M7H0bASB
1243248441813336000,Thu Mar 26 18:48:21 +0000 2020,The FCC should let itself do more to keep Americans connected through the pandemic https://t.co/leJ3uyaR4f https://t.co/cxTsLgTrJ3
1243246680566313000,Thu Mar 26 18:41:21 +0000 2020,ULA targeting first launch for the US Space Force this afternoon during pandemic https://t.co/DkbDilD4UB https://t.co/vyq3OteujW
1243246503751229400,Thu Mar 26 18:40:39 +0000 2020,CarPlay dashboard gets third-party maps support in iOS 13.4 https://t.co/0s4SjrogKg https://t.co/Xiq0pjfSZG
1243246445987315700,Thu Mar 26 18:40:25 +0000 2020,RT @TayNixster: Epic Games launches a publishing label and inks publishing deals   with the creators behind Control, Inside, and The Last G…
1243234780168237000,Thu Mar 26 17:54:04 +0000 2020,Half-Life’s Alyx Vance, explained https://t.co/CxCyEChLLs https://t.co/usBPYKHJeX
1243228366460903400,Thu Mar 26 17:28:35 +0000 2020,Patreon says more creators are signing up for accounts than usual https://t.co/xMUP4AXLRd https://t.co/ZOGliO5jvu
1243225129418702800,Thu Mar 26 17:15:43 +0000 2020,During a public health crisis in the US, distancing power rests with the states https://t.co/9UwCPWbcCX https://t.co/G7z8aLpNza
1243223398869803000,Thu Mar 26 17:08:50 +0000 2020,OnePlus 8 Pro may come in a slick seafoam green and finally have wireless charging https://t.co/FBYhr9RKLA https://t.co/Lvv2bZzEjr
1243212616434098200,Thu Mar 26 16:26:00 +0000 2020,Zoom is 2020’s hottest yoga studio https://t.co/duS7OB4QPO https://t.co/zGmpgs4Tai
1243212457750995000,Thu Mar 26 16:25:22 +0000 2020,Dyson developed and is producing ventilators to help treat COVID-19 patients https://t.co/CwTpjp4bMx https://t.co/mFvlMwFlbV
1243210108911444000,Thu Mar 26 16:16:02 +0000 2020,Huawei’s Watch GT 2E is a sporty redesign of its last smartwatch https://t.co/LczKGxC4H7 https://t.co/Pjoin1ddmQ
1243208456674443300,Thu Mar 26 16:09:28 +0000 2020,Samsung’s Galaxy S10 Plus is discounted for a limited time https://t.co/9nKnJplS1H https://t.co/PLjmdHu7b6
1243206400429494300,Thu Mar 26 16:01:18 +0000 2020,Rad Power Bikes releases an upgraded version of its best electric bike https://t.co/1r9iw8O0Gt https://t.co/t9Kq4HT1hK
1243199835198623700,Thu Mar 26 15:35:12 +0000 2020,The Nintendo Switch is getting ports of BioShock, Borderlands, Burnout, and lots more https://t.co/sd8LRGLXA2 https://t.co/u7w9WJgDhm
1243196947265183700,Thu Mar 26 15:23:44 +0000 2020,YouTube creators figure out how to film during a pandemic https://t.co/xXdjPhxJFH https://t.co/m9P0iKj4j4
1243189882824077300,Thu Mar 26 14:55:40 +0000 2020,Ring Fit Adventure gets a new rhythm mode while everyone’s stuck at home https://t.co/MyouhLvmhs https://t.co/I2pFdN7sxv
1243187699898560500,Thu Mar 26 14:46:59 +0000 2020,Nine Inch Nails just released two new albums for free https://t.co/GDVIPgqQUU https://t.co/GJeEQEyzE8
1243187300290330600,Thu Mar 26 14:45:24 +0000 2020,RT @lorengrush: We’ve got another launch today — this time ULA is launching its first mission for the new US Space Force, with a two-hour w…
1243187049525579800,Thu Mar 26 14:44:24 +0000 2020,FBI arrests man for hawking fake "coronavirus prevention pill" https://t.co/T2xdahks3w https://t.co/Z7ylM0OTPZ
1243178883920400400,Thu Mar 26 14:11:57 +0000 2020,Apple MacBook Air (2020) review: the best Mac for most people (by @reckless) https://t.co/YOHuqaYAub https://t.co/5SqreT2iHz
1243178391525666800,Thu Mar 26 14:10:00 +0000 2020,Meet @taehatypes, Twitch’s top mechanical keyboard builder (Presented by @Twitch) https://t.co/aiD6eEASX9
1243175979637448700,Thu Mar 26 14:00:25 +0000 2020,Epic launches publishing label, signs creators behind Control, Inside, and The Last Guardian https://t.co/6Q4uc1bLDj https://t.co/uHEGYZWSpj
1243175971190198300,Thu Mar 26 14:00:23 +0000 2020,Duolingo is launching an iOS app to teach young kids how to read https://t.co/sGFzHv5emv https://t.co/cvXTEdkLPN
1243172413556306000,Thu Mar 26 13:46:15 +0000 2020,The COVID-19 pandemic is generating tons of medical waste https://t.co/kJdN9sP31m https://t.co/6C5m39ESIB
1243172110362607600,Thu Mar 26 13:45:02 +0000 2020,RT @danideahl: With musicians at home, this is a GREAT time to revisit this audio processing app I discovered bc people were using it to au…
1243171932046065700,Thu Mar 26 13:44:20 +0000 2020,ULA targeting first launch for the US Space Force this afternoon during pandemic https://t.co/9DCrfdxhBo https://t.co/SPwWf94Ydr
1243168348118175700,Thu Mar 26 13:30:05 +0000 2020,Huawei hopes the P40 Pro’s powerful hardware can lure you away from Google https://t.co/ryIJrrHn55 https://t.co/jxBhTIGubq
1243160828297326600,Thu Mar 26 13:00:12 +0000 2020,Polaroid’s new Now instant film camera delivers a classic, punishing experience https://t.co/qA2P8AzcNO https://t.co/IKqkWMmIQU
