id,created_at,text
1249100692221874200,Sat Apr 11 22:23:06 +0000 2020,Microsoft thinks coronavirus will forever change the way we work and learn https://t.co/L5xbdIa3ai https://t.co/MkoANTXRSu
1249085586863992800,Sat Apr 11 21:23:05 +0000 2020,WhatsApp puts new limits on the forwarding of viral messages https://t.co/BS7DN6yrQi https://t.co/rRNlOoBECp
1249070496177627100,Sat Apr 11 20:23:07 +0000 2020,These photos and videos of baby clouded leopards and cheetahs are a gift https://t.co/fTxP6qS7YB https://t.co/swtb15qJmQ
1249055124498067500,Sat Apr 11 19:22:02 +0000 2020,A smart toilet could identify you by your ‘analprint’ and detect diseases https://t.co/M8Uvf6KNzm https://t.co/FSJk6TUiTa
1249040026924658700,Sat Apr 11 18:22:03 +0000 2020,It’s time to stop debating whether a hot dog is a sandwich https://t.co/zXwmOJPPFt https://t.co/kd429bBJjY
1249024924154552300,Sat Apr 11 17:22:02 +0000 2020,Redesigning Midgar, Final Fantasy VII Remake’s gritty cyberpunk metropolis https://t.co/APfyBw0mnE https://t.co/SBlgpuB7GX
1249011555955605500,Sat Apr 11 16:28:55 +0000 2020,RT @lorengrush: Today is the 50th anniversary of the launch of Apollo 13! You can follow along in real time thanks to @BenFeist and a group…
1249009578148270000,Sat Apr 11 16:21:03 +0000 2020,Apple may let you try apps without installing them in iOS 14 https://t.co/EpLPQxi3EJ https://t.co/eJeTo6AW3M
1249005537943081000,Sat Apr 11 16:05:00 +0000 2020,iPad Pro (2020) review: beyond the trackpad https://t.co/ShgZDRm2VV
1248999219425411000,Sat Apr 11 15:39:53 +0000 2020,RT @russellbrandom: I dug into the specs for Apple and Google’s new coronavirus tracking app.   Mostly it does what it promises, but there…
1248994481074057200,Sat Apr 11 15:21:04 +0000 2020,All Microsoft events will be digital-only until July 2021 https://t.co/aFSHZxSyM5 https://t.co/iLAbMC5I1K
1248988634813956000,Sat Apr 11 14:57:50 +0000 2020,Answering the 12 biggest questions about Apple and Google’s new coronavirus tracking project https://t.co/nnizoKV5tR
1248976238867361800,Sat Apr 11 14:08:34 +0000 2020,NASA marking the 50th anniversary of ‘successful failure’ Apollo 13 mission https://t.co/gClj24Y0NI https://t.co/fghcmCJ5EP
1248948942550818800,Sat Apr 11 12:20:06 +0000 2020,Apple is giving away free original TV shows https://t.co/EPEiAFdVTf https://t.co/0GVrt5nSxi
1248933839373820000,Sat Apr 11 11:20:06 +0000 2020,Death Stranding and Zelda offer the clarity of hiking without the exhaustion https://t.co/zWSRXfUZAF https://t.co/2jOry3n2MC
1248878209015386000,Sat Apr 11 07:39:02 +0000 2020,Call of Duty: Warzone now has more than 50 million players one month after launch https://t.co/g713VHuoOq https://t.co/eDgaVYzric
1248875197370896400,Sat Apr 11 07:27:04 +0000 2020,Taika Waititi gives updates on next Thor movie during Thor: Ragnarok watch party live stream https://t.co/CNRBiLbzjG https://t.co/pXuu9Vr8qS
1248859594295775200,Sat Apr 11 06:25:04 +0000 2020,Why the 5G coronavirus conspiracy theories don’t make sense https://t.co/9c7gs785il https://t.co/59bpvA6LCp
1248855320425873400,Sat Apr 11 06:08:05 +0000 2020,You can now buy refurbished Mac Pros from Apple https://t.co/aaADw7pIOR https://t.co/kUPW5nA2KR
1248850288787755000,Sat Apr 11 05:48:06 +0000 2020,What is contact tracing? https://t.co/rRLkRnrKBX https://t.co/ZxqME6ksPO
1248848276700479500,Sat Apr 11 05:40:06 +0000 2020,Google is showing virtual care options more prominently in search results https://t.co/NT4WqGXbCC https://t.co/D2Ax056qH9
1248846518225944600,Sat Apr 11 05:33:07 +0000 2020,Discord introduces background noise suppression in beta https://t.co/tvfdml3Z8y https://t.co/us0d3oEQgj
1248844495413751800,Sat Apr 11 05:25:04 +0000 2020,The OnePlus 8 Pro will have super fast, 30W wireless charging https://t.co/GMtQ9Z6DEB https://t.co/wV6aSw5Vmf
1248842737501208600,Sat Apr 11 05:18:05 +0000 2020,YouTube’s desktop site is now more touchscreen-friendly https://t.co/C8xzxFpYzC https://t.co/LmYD6jM8fL
1248841234992562200,Sat Apr 11 05:12:07 +0000 2020,All I need in life is this Facebook group where everyone pretends to be ants https://t.co/1pImIdgonW https://t.co/IhG9QoKdAa
1248834932069326800,Sat Apr 11 04:47:04 +0000 2020,Apple and Google launch a joint contact-tracing system for iOS and Android https://t.co/smbdVugMa4 https://t.co/L02b56ffHM
1248831654707245000,Sat Apr 11 04:34:03 +0000 2020,HBO extends support for old Apple TV devices during pandemic https://t.co/eBIChWt8Of https://t.co/6mU0TsGgH7
1248829906517217300,Sat Apr 11 04:27:06 +0000 2020,Vergecast: Quibi’s launch week, Asus laptop reviews, and Sony’s PS5 controller https://t.co/lOKJHFSSZ6 https://t.co/66qSznuL2u
1248827624077607000,Sat Apr 11 04:18:02 +0000 2020,People are baiting Instacart workers with huge tips then slashing them to zero https://t.co/3k71jpyHmX https://t.co/ekDt6hJrAn
1248823101523198000,Sat Apr 11 04:00:04 +0000 2020,Microsoft Store employees are training schools, businesses in remote working https://t.co/PbE412hfdd https://t.co/GjA51xy5c7
1248820583678259200,Sat Apr 11 03:50:03 +0000 2020,The Good Fight can and will do anything to get your attention, and it’s damn good at it https://t.co/nzGPdvnguw https://t.co/A4jB7NNuXr
1248812793626845200,Sat Apr 11 03:19:06 +0000 2020,Warehouse workers are forcing Amazon to take COVID-19 seriously https://t.co/D29TtmWC4e https://t.co/B3EXgPbbjJ
1248806236583313400,Sat Apr 11 02:53:03 +0000 2020,Facebook is promising UK health facilities 2,000 Portal devices https://t.co/tpVCZ77PPd https://t.co/ea5LirwLqw
1248800199025266700,Sat Apr 11 02:29:03 +0000 2020,To prevent the next pandemic, scientists search for animal zero https://t.co/BqSF7ymeTk https://t.co/xGClz67EQw
1248795681634082800,Sat Apr 11 02:11:06 +0000 2020,How to use your own controllers to play Google Stadia https://t.co/czpbg5uGr5 https://t.co/zqAG2F9Mmf
1248792908054122500,Sat Apr 11 02:00:05 +0000 2020,Everyone can now access their Instagram DMs on the web https://t.co/pOYZVYVpRR https://t.co/i5Pt9XtWhe
1248790391064838100,Sat Apr 11 01:50:05 +0000 2020,How to use Snapchat’s new AR lens to donate to the COVID-19 Solidarity Response Fund https://t.co/S3zyVyl0Md https://t.co/sBnyRLkqAM
1248776288980082700,Sat Apr 11 00:54:03 +0000 2020,Final Fantasy VII Remake is a thrilling, thoughtful take on a classic https://t.co/F4xoGbz1Hs https://t.co/TJF7LvtDGL
1248772556846518300,Sat Apr 11 00:39:13 +0000 2020,Square’s Cash App details how to use its direct deposit feature to access stimulus funds https://t.co/UWdxLTOmFl https://t.co/TkBNL1QvaN
1248765475628224500,Sat Apr 11 00:11:04 +0000 2020,Samsung Rising goes deep on corruption, chaebols, and corporate chaos https://t.co/nAJQ7zPFqZ https://t.co/s9u8YQvrlv
1248758254068469800,Fri Apr 10 23:42:23 +0000 2020,Leica and Olympus are offering free virtual courses and talks for photographers https://t.co/XPXdUIamyM https://t.co/2AfnFDZiMh
1248744624220516400,Fri Apr 10 22:48:13 +0000 2020,How you’ll use Apple and Google’s coronavirus tracking tool https://t.co/aemntO32X3 https://t.co/e6YDxN0stj
1248732741719462000,Fri Apr 10 22:01:00 +0000 2020,How to set up WhatsApp on your Mac or PC https://t.co/FedmezD4PS https://t.co/FlhWdIZCzJ
1248722497832390700,Fri Apr 10 21:20:18 +0000 2020,Verizon’s new tracking tool tells advertisers when you’re looking at your email inbox https://t.co/HaoGkSBveW https://t.co/D08FXhqqJh
1248706220032172000,Fri Apr 10 20:15:37 +0000 2020,Disney is remaking its classic 1973 Robin Hood film as a CGI Disney Plus exclusive https://t.co/NkQ3fVzCdg https://t.co/8OpB3V68OB
1248706146673844200,Fri Apr 10 20:15:19 +0000 2020,RT @VergeDeals: Samsung's Galaxy Active smartwatch is down to $150 ($50 off) at Best Buy, matching the lowest price yet. You'll even get a…
1248702331866230800,Fri Apr 10 20:00:10 +0000 2020,You can watch Quibi’s reboot of Punk’d in Fortnite https://t.co/AatiAZkQxv https://t.co/b25YXAEll2
1248697366867255300,Fri Apr 10 19:40:26 +0000 2020,Xbox Live is experiencing issues for the third time in a month https://t.co/OFZ7xaUcgi https://t.co/E3lQPAX1cr
1248695097589411800,Fri Apr 10 19:31:25 +0000 2020,Call of Duty: Warzone now has more than 50 million players one month after launch https://t.co/OKYTNn96wW https://t.co/SKNifQQV8C
1248690320373579800,Fri Apr 10 19:12:26 +0000 2020,Taika Waititi gives updates on next Thor movie during Thor: Ragnarok watch party live stream https://t.co/5J96vCqnp1 https://t.co/XGKaYO6w2u
1248683041188429800,Fri Apr 10 18:43:31 +0000 2020,RT @mcsquared96: I know what you're thinking and no, I don't know why I wrote this either https://t.co/3QJibcoE9h
1248671619465306000,Fri Apr 10 17:58:07 +0000 2020,You can now buy refurbished Mac Pros from Apple https://t.co/OK3aGtDn8n https://t.co/8azHCHjdzR
1248670106906919000,Fri Apr 10 17:52:07 +0000 2020,What is contact tracing? https://t.co/x9PGP5IglE https://t.co/tGc3zlcgXc
1248669027964203000,Fri Apr 10 17:47:50 +0000 2020,Discord introduces background noise suppression in beta https://t.co/g3tjrLhvQ3 https://t.co/APXaGmhXKZ
1248668347056754700,Fri Apr 10 17:45:07 +0000 2020,Google is showing virtual care options more prominently in search results https://t.co/P1DRToZed8 https://t.co/LR594JOGAg
1248666529031389200,Fri Apr 10 17:37:54 +0000 2020,YouTube’s desktop site is now more touchscreen-friendly https://t.co/npBZFivCpo https://t.co/qsn8hr9N24
1248659409817014300,Fri Apr 10 17:09:36 +0000 2020,All I need in life is this Facebook group where everyone pretends to be ants https://t.co/b9PIGu12Uv https://t.co/hTTZ50VjjL
1248656731711905800,Fri Apr 10 16:58:58 +0000 2020,Apple and Google launch a joint contact-tracing system for iOS and Android https://t.co/j5U5ROfirk https://t.co/x22Z92Ihct
1248650468609458200,Fri Apr 10 16:34:05 +0000 2020,HBO extends support for old Apple TV devices during pandemic https://t.co/SQ86KbzCjI https://t.co/pVhYG7EwWj
1248648454060073000,Fri Apr 10 16:26:04 +0000 2020,Vergecast: Quibi’s launch week, Asus laptop reviews, and Sony’s PS5 controller https://t.co/AjK6nW0vHG https://t.co/SJgooeyWrL
1248646813680369700,Fri Apr 10 16:19:33 +0000 2020,People are baiting Instacart workers with huge tips then slashing them to zero https://t.co/TkqVUDvVXE https://t.co/JYcevd9TBL
1248643402327109600,Fri Apr 10 16:06:00 +0000 2020,Microsoft Store employees are training schools, businesses in remote working https://t.co/cj7lxzRBYP https://t.co/OJSf7oaFAp
1248641095124365300,Fri Apr 10 15:56:50 +0000 2020,The Good Fight can and will do anything to get your attention, and it’s damn good at it https://t.co/4ZtjSKnQTF https://t.co/tjCWcKQgrv
1248631690970443800,Fri Apr 10 15:19:28 +0000 2020,Warehouse workers are forcing Amazon to take COVID-19 seriously https://t.co/nlXMoxAvhy https://t.co/ZXkS0pYRgk
1248624909623775200,Fri Apr 10 14:52:31 +0000 2020,Facebook is promising UK health facilities 2,000 Portal devices https://t.co/4GgFmKiJlQ https://t.co/iSJy2lJ8vf
1248622879677100000,Fri Apr 10 14:44:27 +0000 2020,Samsung’s Galaxy Active smartwatch is back down to $150, its lowest price https://t.co/kBzAqKM0Vb https://t.co/VvbjEIf9nl
1248622406379253800,Fri Apr 10 14:42:34 +0000 2020,To prevent the next pandemic, scientists search for animal zero https://t.co/23vp85OYHv https://t.co/sz7kxO6DWC
1248613969557766100,Fri Apr 10 14:09:03 +0000 2020,How to use your own controllers to play Google Stadia https://t.co/z7yfWY5YT3 https://t.co/MdPOdyBdb7
1248611710086180900,Fri Apr 10 14:00:04 +0000 2020,Everyone can now access their Instagram DMs on the web https://t.co/4kjNlcv9YM https://t.co/2bilpzed0X
1248611070874275800,Fri Apr 10 13:57:32 +0000 2020,How to use Snapchat’s new AR lens to donate to the COVID-19 Solidarity Response Fund https://t.co/hQ8KsAAZhU https://t.co/N9QfQ1MCnx
1248595877607944200,Fri Apr 10 12:57:09 +0000 2020,Final Fantasy VII Remake is a thrilling, thoughtful take on a classic https://t.co/qaj5JA1kww https://t.co/yf9yp6T3VT
1248581530341040000,Fri Apr 10 12:00:09 +0000 2020,Samsung Rising goes deep on corruption, chaebols, and corporate chaos https://t.co/YSENClFUF9 https://t.co/yMcqoiJwhe
1248551329418612700,Fri Apr 10 10:00:08 +0000 2020,Why Bluetooth apps are bad at discovering new cases of COVID-19  https://t.co/3cLAazV2Pt https://t.co/AeN8lBCGMJ
1248545932527972400,Fri Apr 10 09:38:41 +0000 2020,Apple is giving away free original TV shows https://t.co/SxJEDMNvAc https://t.co/f8ZRBFo4xk
1248523433337651200,Fri Apr 10 08:09:17 +0000 2020,Amazon building COVID-19 test lab for workers https://t.co/VVvjS2WaZq https://t.co/oRaiK7YNJB
1248518087881744400,Fri Apr 10 07:48:03 +0000 2020,A smart toilet could identify you by your ‘analprint’ and detect diseases https://t.co/BGHzlfDTDF https://t.co/DRyEO7Z43K
1248512807919894500,Fri Apr 10 07:27:04 +0000 2020,Saturday Night Live is returning this weekend with remote sketches https://t.co/A6Sn8tJNyP https://t.co/ZfgMpMqLLQ
1248503748961292300,Fri Apr 10 06:51:04 +0000 2020,Ring’s new Alarm system is smaller, sleeker, and comes with one-touch access to emergency services… https://t.co/66U4zsgFF7
1248499732130848800,Fri Apr 10 06:35:06 +0000 2020,Trump’s chloroquine hype is a misinformation problem bigger than social media https://t.co/tStRw5NhJe https://t.co/c8K5goo2fo
1248494434045444000,Fri Apr 10 06:14:03 +0000 2020,Blizzard is making changes to Overwatch’s hero pools https://t.co/HUQmNAMlIy https://t.co/HWKDeaY8J7
1248491666438152200,Fri Apr 10 06:03:03 +0000 2020,Uber to start shipping face masks to drivers and delivery workers https://t.co/GLYsO1G6R9 https://t.co/51NUmUCrr7
1248487634688606200,Fri Apr 10 05:47:02 +0000 2020,Google now offers a Braille keyboard for Android https://t.co/AGP70FdEgp https://t.co/iLcoSyYXIu
1248486379475972000,Fri Apr 10 05:42:03 +0000 2020,It’s time to stop debating whether a hot dog is a sandwich https://t.co/HmCg44myyi https://t.co/7UbOVFCTWD
1248485124137574400,Fri Apr 10 05:37:03 +0000 2020,New Simpsons short that debuted before Pixar’s Onward is now heading to Disney Plus https://t.co/1PlyNtFU1E https://t.co/YF9GcBIOsq
1248484868855488500,Fri Apr 10 05:36:03 +0000 2020,Apple may let you try apps without installing them in iOS 14 https://t.co/cvVVTqIqB9 https://t.co/acE7KyQ309
1248481847970910200,Fri Apr 10 05:24:02 +0000 2020,Lawsuit fights new Baltimore aerial surveillance program https://t.co/y17fMryVPM https://t.co/AkeHaEnQxQ
1248473296573612000,Fri Apr 10 04:50:04 +0000 2020,I opened my Animal Crossing island to strangers on Twitter, and it wasn’t a complete disaster… https://t.co/J5T0weo9Zm
1248461985034801200,Fri Apr 10 04:05:07 +0000 2020,These photos and videos of baby clouded leopards and cheetahs are a gift https://t.co/8sy0jzLRLQ https://t.co/LpkFuJrVol
1248457694215733200,Fri Apr 10 03:48:04 +0000 2020,No one’s getting new emoji in 2021 because of the pandemic https://t.co/n5a6UFuNBM https://t.co/0tM2QMn4VN
1248451406211637200,Fri Apr 10 03:23:05 +0000 2020,Yelp lays off 1,000 employees as restaurants struggle https://t.co/ITHfZ5nT7m https://t.co/u4b1tg5hqN
1248448377647497200,Fri Apr 10 03:11:02 +0000 2020,VENN wants to re-create the magic of G4TV but with YouTube and Twitch stars https://t.co/m83O3YeTS3 https://t.co/zx9FVEaV97
1248443109236670500,Fri Apr 10 02:50:06 +0000 2020,Airbnb now offers virtual "travel" experiences to keep you entertained at home https://t.co/fjUB2p7e9d https://t.co/YJohZtwubL
1248440590901092400,Fri Apr 10 02:40:06 +0000 2020,Why the 5G coronavirus conspiracy theories don’t make sense https://t.co/tVA9dWXRgl https://t.co/oLBjS7vbym
1248436311830270000,Fri Apr 10 02:23:06 +0000 2020,COVID-19 clinicians wrestle with false negative results https://t.co/FgW26zuQqr https://t.co/LLyKnPKfJP
1248432017747792000,Fri Apr 10 02:06:02 +0000 2020,Redesigning Midgar, Final Fantasy VII Remake’s gritty cyberpunk metropolis https://t.co/Q33ZFsNKNT https://t.co/PmUjOI25Gp
1248425990625218600,Fri Apr 10 01:42:05 +0000 2020,Webcams have become impossible to find, and prices are skyrocketing https://t.co/TWNoZE0pBL https://t.co/eTWrIBT6JQ
1248419442876276700,Fri Apr 10 01:16:04 +0000 2020,Elizabeth Warren demands info on children’s privacy policies in letter to Zoom CEO https://t.co/iIRY6YgjfU https://t.co/eCNap06787
1248415464100749300,Fri Apr 10 01:00:15 +0000 2020,Microsoft thinks coronavirus will forever change the way we work and learn https://t.co/wumBhvHQTL https://t.co/pGDaFyz3pW
1248407924193423400,Fri Apr 10 00:30:18 +0000 2020,TikTok pledges $375M in support of COVID-19 relief efforts https://t.co/qUwImaEdf6 https://t.co/ARHjp9ER7H
1248402073692991500,Fri Apr 10 00:07:03 +0000 2020,The ancient computers in the Boeing 737 Max are holding up a fix https://t.co/oMvArt6GZh https://t.co/8yTey2OwuZ
1248400920494235600,Fri Apr 10 00:02:28 +0000 2020,This website replicates the sounds of being in the office again https://t.co/ujz3InfKyr https://t.co/qbEZTaXoeH
1248395302106611700,Thu Apr 09 23:40:08 +0000 2020,Gocycle GXi e-bike review: fancy folder https://t.co/yAIgEZZjID https://t.co/CJ3dUNZz4U
1248390391704907800,Thu Apr 09 23:20:38 +0000 2020,DoorDash will cut commissions by 50 percent for local restaurants through the end of May https://t.co/4ixmepRCd1 https://t.co/ny5CkeLFq3
1248370141521490000,Thu Apr 09 22:00:09 +0000 2020,Facebook is adding a Quiet Mode that silences push notifications on mobile https://t.co/kri1rW7CzM https://t.co/DuFovhlJ06
1248368574978240500,Thu Apr 09 21:53:56 +0000 2020,Motorola’s $1,499 flipping Razr now comes in gold https://t.co/hWMHEpJQp8 https://t.co/nrnISwwxpW
1248358463639556000,Thu Apr 09 21:13:45 +0000 2020,Google is rebranding Hangouts Chat as just Google Chat https://t.co/XpzswGBKvL https://t.co/2ZIblGszK0
1248354104109338600,Thu Apr 09 20:56:26 +0000 2020,A spacecraft is about to swing by Earth to get a gravity assist on its way to Mercury https://t.co/U4AytcT9Yz https://t.co/3bOCbLal9p
1248350366984474600,Thu Apr 09 20:41:35 +0000 2020,RT @VergeDeals: A three-month subscription to Xbox Game Pass Ultimate costs $45 at Amazon, and buying one will get you another three months…
1248347467730636800,Thu Apr 09 20:30:04 +0000 2020,Twitch is expanding Watch Parties beta to all partners, then all US creators after https://t.co/aHhiUDKWZ8 https://t.co/FK9SXlDyuZ
1248343992116355000,Thu Apr 09 20:16:15 +0000 2020,Google extends free access to advanced teleconferencing features to September 30th https://t.co/kqANJgJz1c https://t.co/32Kep3kxzh
1248338862511919000,Thu Apr 09 19:55:52 +0000 2020,How to make group calls on WhatsApp https://t.co/jcetQ0ti36 https://t.co/hz8ZERpEDT
1248335873206366200,Thu Apr 09 19:43:59 +0000 2020,A smart toilet could identify you by your ‘analprint’ and detect diseases https://t.co/AA4isLb00k https://t.co/YaJRWI9fss
1248327326062043100,Thu Apr 09 19:10:01 +0000 2020,Saturday Night Live is returning this weekend with remote sketches https://t.co/qkMqeaM2Vi https://t.co/pGdZCao4wL
1248316186091192300,Thu Apr 09 18:25:46 +0000 2020,Ring’s new Alarm system is smaller, sleeker, and comes with one-touch access to emergency services… https://t.co/knZm0CT6Cz
1248315371083436000,Thu Apr 09 18:22:31 +0000 2020,Trump’s chloroquine hype is a misinformation problem bigger than social media https://t.co/SEZsXWJwfG https://t.co/ss6RHnT2sZ
1248311242290323500,Thu Apr 09 18:06:07 +0000 2020,Blizzard is making changes to Overwatch’s hero pools https://t.co/BQrfllMS1J https://t.co/X1DCZxPzEC
1248309779350671400,Thu Apr 09 18:00:18 +0000 2020,Uber to start shipping face masks to drivers and delivery workers https://t.co/PlImEvBRFr https://t.co/iVu9Eusor3
1248306381318434800,Thu Apr 09 17:46:48 +0000 2020,Google now offers a Braille keyboard for Android https://t.co/EKky6b2CBb https://t.co/w87zSCz2yI
1248305348362068000,Thu Apr 09 17:42:42 +0000 2020,RT @VergeDeals: Verge readers can save $60 on the Nest Learning Thermostat https://t.co/wH1C7iJFBX https://t.co/vEkPy31pGc
1248305231219261400,Thu Apr 09 17:42:14 +0000 2020,It’s time to stop debating whether a hot dog is a sandwich https://t.co/uXGcPTnFcf https://t.co/Xq7z2ItxXN
1248303756669747200,Thu Apr 09 17:36:22 +0000 2020,New Simpsons short that debuted before Pixar’s Onward is now heading to Disney Plus https://t.co/ZLCNIEyKeB https://t.co/gCbSLHJ9Hy
1248302696697905200,Thu Apr 09 17:32:09 +0000 2020,Apple may let you try apps without installing them in iOS 14 https://t.co/fom1SqyA8x https://t.co/sGpBcnDCtA
1248301348166254600,Thu Apr 09 17:26:48 +0000 2020,Lawsuit fights new Baltimore aerial surveillance program https://t.co/40OaaMgv5n https://t.co/ZxbQNCH6uD
1248287106432106500,Thu Apr 09 16:30:12 +0000 2020,Verge readers can save $60 on the Nest Learning Thermostat https://t.co/NCi7Rs3uZ1 https://t.co/WKqsOIkIX2
1248284194595274800,Thu Apr 09 16:18:38 +0000 2020,I opened my Animal Crossing island to strangers on Twitter, and it wasn’t a complete disaster… https://t.co/AFH3CljCMg
1248280262426923000,Thu Apr 09 16:03:01 +0000 2020,These photos and videos of baby clouded leopards and cheetahs are a gift https://t.co/yYP2dtz84H https://t.co/xmH2XGEgBu
1248272973506793500,Thu Apr 09 15:34:03 +0000 2020,No one’s getting new emoji in 2021 because of the pandemic https://t.co/5onaM2vnyo https://t.co/L8sDMAiRNc
1248269102952722400,Thu Apr 09 15:18:40 +0000 2020,Google’s midrange Pixel 4A could launch soon, and there may not be an XL version https://t.co/BiQFZaA278 https://t.co/qYrxveHIqz
1248267054962151400,Thu Apr 09 15:10:32 +0000 2020,Yelp lays off 1,000 employees as restaurants struggle https://t.co/p3zPbzu0J1 https://t.co/i2NyrirYaq
1248266852574400500,Thu Apr 09 15:09:43 +0000 2020,VENN wants to re-create the magic of G4TV but with YouTube and Twitch stars https://t.co/e7xaW3k3Dj https://t.co/TYKb2D6bJ4
1248262149585207300,Thu Apr 09 14:51:02 +0000 2020,Airbnb now offers virtual "travel" experiences to keep you entertained at home https://t.co/Mqqvq0dbzg https://t.co/iVk4M5bCev
1248261908823670800,Thu Apr 09 14:50:05 +0000 2020,Why the 5G coronavirus conspiracy theories don’t make sense https://t.co/WIgwZc6y0q https://t.co/iyk5ozRmb1
1248255953000071200,Thu Apr 09 14:26:25 +0000 2020,COVID-19 clinicians wrestle with false negative results https://t.co/quROv7gJot https://t.co/JeTYJJxFhe
1248251764173930500,Thu Apr 09 14:09:46 +0000 2020,Redesigning Midgar, Final Fantasy VII Remake’s gritty cyberpunk metropolis https://t.co/qAwQhyQBnd https://t.co/ufrRgJfQ9D
1248245111235809300,Thu Apr 09 13:43:20 +0000 2020,Webcams have become impossible to find, and prices are skyrocketing https://t.co/9FpWU69PlV https://t.co/mFXdMuQSr8
1248234311007993900,Thu Apr 09 13:00:25 +0000 2020,Elizabeth Warren demands info on children’s privacy policies in letter to Zoom CEO https://t.co/GdUYrVDiTg https://t.co/sQ4PfkfvgT
1248234238408884200,Thu Apr 09 13:00:08 +0000 2020,Microsoft thinks coronavirus will forever change the way we work and learn https://t.co/HCeAi1Iv3o https://t.co/0xFfBhfoGf
1248219149760893000,Thu Apr 09 12:00:10 +0000 2020,TikTok pledges $375M in support of COVID-19 relief efforts https://t.co/dsAL0ZsWLt https://t.co/RUbml8qw3I
1248219138365014000,Thu Apr 09 12:00:08 +0000 2020,The ancient computers in the Boeing 737 Max are holding up a fix https://t.co/3mkLSu6DPG https://t.co/7TKZSLcgNZ
1248212257026257000,Thu Apr 09 11:32:47 +0000 2020,Gocycle GXi e-bike review: fancy folder https://t.co/TmILxF3PzD https://t.co/uryD070rEk
1248211953086009300,Thu Apr 09 11:31:34 +0000 2020,Alphabet’s nascent drone delivery service is booming https://t.co/nFjnVOnHcS https://t.co/x0kFRTZgGl
1248188936461090800,Thu Apr 09 10:00:07 +0000 2020,There’s no consensus on technology’s role in the COVID-19 response  https://t.co/gOc6Q3IZA5 https://t.co/exRtYOYIM0
1248161239366320000,Thu Apr 09 08:10:03 +0000 2020,Rocket Lab catches dummy rocket in midair with helicopter in ongoing quest to make its vehicles reusable… https://t.co/IZMRiBtneT
1248156208999129000,Thu Apr 09 07:50:04 +0000 2020,Google bans its employees from using Zoom over security concerns https://t.co/TJDDDaaFfq https://t.co/PoN4arUnf2
1248149912082137000,Thu Apr 09 07:25:03 +0000 2020,Riot’s Valorant isn’t even out yet, but it’s already looking like an esports sensation https://t.co/HOIEhQlhgD https://t.co/9N6NYrVo1S
1248149168390115300,Thu Apr 09 07:22:05 +0000 2020,How Thao &amp; The Get Down Stay Down made a music video on Zoom https://t.co/YLIIJ0rgO7 https://t.co/cu0kH0cN8E
1248142122869555200,Thu Apr 09 06:54:06 +0000 2020,Fiat Chrysler is recalling 365,000 vehicles for backup camera issue https://t.co/bhpPuH2pq5 https://t.co/VTIEYHvPX1
1248131302756319200,Thu Apr 09 06:11:06 +0000 2020,ESPN becomes the official broadcast home for League of Legends’ Spring Split Playoffs https://t.co/GgfMfHJB5Y https://t.co/T5gqhP8A2R
1248126618561896400,Thu Apr 09 05:52:29 +0000 2020,Microsoft reportedly delays Surface Neo beyond 2020 https://t.co/vYHqQVgMxK https://t.co/r9xy647Shw
1248125000453939200,Thu Apr 09 05:46:03 +0000 2020,Windows 10 is getting Linux files integration in File Explorer https://t.co/UBBr6USaL4 https://t.co/qIEoZTXAAv
1248121473019060200,Thu Apr 09 05:32:02 +0000 2020,How to protect your Netflix profile with a PIN https://t.co/vV68TOQTzM https://t.co/52vOYWIo4T
1248117951292678100,Thu Apr 09 05:18:03 +0000 2020,Amazon is temporarily extending its return policy due to the pandemic https://t.co/BDStJvkNDt https://t.co/dDid1TQ65g
1248115699924508700,Thu Apr 09 05:09:06 +0000 2020,The Verge’s best and worst coronavirus masks https://t.co/c0uuI0qCQY https://t.co/ZhR95edSAa
1248109644184199200,Thu Apr 09 04:45:02 +0000 2020,Twitter notifies users that it’s now sharing more data with advertisers https://t.co/pqEdDGwDod https://t.co/6wynJ5KzDo
1248079688196636700,Thu Apr 09 02:46:00 +0000 2020,LG reveals new design language for next phone https://t.co/Q4P2DBwQXe https://t.co/CwexTI7j1A
