id,created_at,text
1180098020328771600,Fri Oct 04 12:31:07 +0000 2019,An issue of Wake Up To Politics for the ages: recapping the many developments in the impeachment probe on Thursday,… https://t.co/U8Ykmk4hNV
1179960453952344000,Fri Oct 04 03:24:29 +0000 2019,Lots of *very interesting* quotes from the text messages handed to Congress by former Trump envoy Kurt Volker today… https://t.co/hVxuvXvZGM
1179959828904579000,Fri Oct 04 03:22:00 +0000 2019,"Assuming President Z convinces trump he will investigate...2016, we will nail down date for visit to Washington"… https://t.co/he60oO3ZtH
1179907686281949200,Thu Oct 03 23:54:48 +0000 2019,Politico: Energy Secretary Rick Perry plans to resign next month, for reasons “unrelated” to the Ukraine scandal. (… https://t.co/Tp1qhGI2XG
1179904611966165000,Thu Oct 03 23:42:35 +0000 2019,@coachtraveling Here's more information on the White House computer systems: https://t.co/r928NUT5ym
1179904492759859200,Thu Oct 03 23:42:07 +0000 2019,That's not quite accurate. While steps were taken to limit access to such records after the 2017 leaks, most foreig… https://t.co/sp52SybiKW
1179896115623338000,Thu Oct 03 23:08:50 +0000 2019,Wow. "Two of President Trump’s top envoys to Ukraine drafted a statement for the country’s new president in August… https://t.co/2FGnOJg2Sm
1179890778820268000,Thu Oct 03 22:47:37 +0000 2019,*Xi
1179890026047529000,Thu Oct 03 22:44:38 +0000 2019,Per CNN, records of the Trump-Xi call were kept in the same secret server as records of Trump’s July call with the… https://t.co/1kk7kTL2J2
1179889740390244400,Thu Oct 03 22:43:30 +0000 2019,CNN: In a June call with Chinese President Xu Jinping, President Trump brought up Joe Biden and Elizabeth Warren, a… https://t.co/9I5kpEDGGr
1179858252986601500,Thu Oct 03 20:38:22 +0000 2019,RT @rachaelmbade: SCOOP: Volker WARNED Giuliani that the Ukrainians' dirt on the Bidens was NOT credible &amp; his sources were unreliable, he…
1179857968667353000,Thu Oct 03 20:37:15 +0000 2019,cc @daveweigel https://t.co/3QX62DyzLI
1179792084296859600,Thu Oct 03 16:15:27 +0000 2019,China, if you're listening... https://t.co/PQSv29GSwe
1179738801175965700,Thu Oct 03 12:43:43 +0000 2019,Wake Up To Politics - October 3, 2019 - https://t.co/TyJLxtNHTz
1179736548419522600,Thu Oct 03 12:34:46 +0000 2019,@ChrisBastianBkl Thanks, Chris!
1179736518929375200,Thu Oct 03 12:34:39 +0000 2019,RT @ChrisBastianBkl: As we wade through Impeachment and the 2020 Election, I'd like to remind everyone of the excellent news aggregation pr…
1179479915722395600,Wed Oct 02 19:35:00 +0000 2019,RT @julianbarnes: NEW: The whistle-blower alerted a House Intel Committee staffer to the outlines of his accusations against Trump before f…
1179478684559986700,Wed Oct 02 19:30:06 +0000 2019,@misscrf I'm relying on @ZachMontellaro and @POLITICO_Steve's spreadsheet tracking if candidates have met the DNC's… https://t.co/jVVV3OCAd5
1179478314219688000,Wed Oct 02 19:28:38 +0000 2019,Of note: Tulsi Gabbard's appearance on the October debate stage will mark the first time a candidate will return to… https://t.co/2nv04lnbuI
1179477823637135400,Wed Oct 02 19:26:41 +0000 2019,Here's a look at which candidates have qualified for each Democratic primary debate so far this cycle:… https://t.co/8yPmrY47VR
1179477371793084400,Wed Oct 02 19:24:53 +0000 2019,@JaredHalpern Good catch, thanks. Reposting!
1179425368681439200,Wed Oct 02 15:58:15 +0000 2019,A research group invited a representative sample of 526 American voters to spend a weekend together and discuss pol… https://t.co/NfaZsWHyz4
1179422485009309700,Wed Oct 02 15:46:47 +0000 2019,RT @rubycramer: Doctors discovered Bernie Sanders had an artery blockage after he came in to have some chest discomfort checked out. Two st…
1179387055182401500,Wed Oct 02 13:26:00 +0000 2019,Wake Up To Politics - October 2, 2019 - https://t.co/Wx82otY0IM
1179367251658580000,Wed Oct 02 12:07:19 +0000 2019,@davelevinthal @publicintegrity Congratulations, Dave!
1179214404522582000,Wed Oct 02 01:59:57 +0000 2019,RT @JoshNBCNews: Holy cow. The Republican National Committee @GOP and Trump re-elect campaign raised a combined $125 million between July a…
1179166620196966400,Tue Oct 01 22:50:04 +0000 2019,RT @frankthorp: Multiple congressional sources confirm to @haleytalbotnbc &amp; myself that the State Dept OIG has reached out to Congressional…
1179071533190279200,Tue Oct 01 16:32:14 +0000 2019,House GOP Conference Chair Liz Cheney on the 70th anniversary of the People's Republic of China (left): "This is no… https://t.co/0JAFQe0rMU
1179013658183176200,Tue Oct 01 12:42:15 +0000 2019,For the latest on the House impeachment inquiry and President Trump's contacts with foreign leaders, read today's e… https://t.co/reyEKqnUQW
1178868090630803500,Tue Oct 01 03:03:49 +0000 2019,President Trump just retweeted this message from Laura Ingraham, who urges him to focus on his agenda and let the D… https://t.co/HJZx2NZUca
1178784452299935700,Mon Sep 30 21:31:28 +0000 2019,More news via @DevlinBarrett, @shaneharris &amp; @mattzap: Attorney General Barr has personally met with foreign intell… https://t.co/nJXApOhgfS
1178771761384624000,Mon Sep 30 20:41:03 +0000 2019,@pbump Was just thinking this exactly. Recent drip-drip-drip of reports reminds me of that week
1178770714758918100,Mon Sep 30 20:36:53 +0000 2019,@n22nz Day off for Rosh Hashanah. Back tomorrow!
1178769644058022000,Mon Sep 30 20:32:38 +0000 2019,Access to records of all three conversations was reportedly restricted to a smaller circle of White House aides tha… https://t.co/UcOFGPRlFh
1178769257166971000,Mon Sep 30 20:31:06 +0000 2019,Trump convos with foreign officials that have come to light in past 10 days:  — Call pressuring Ukrainian pres to p… https://t.co/heKN3Rhph9
1178767658369589200,Mon Sep 30 20:24:44 +0000 2019,Breaking via @MarkMazzettiNYT &amp; @ktbenner: President Trump pushed the Australian prime minister in a recent telepho… https://t.co/AWqnywGg5M
1178749492327268400,Mon Sep 30 19:12:33 +0000 2019,RT @kathrynw5: In the last 24 hours the president has:  — Raised arresting a political opponent for treason — Retweeted someone suggesting…
1178749130212032500,Mon Sep 30 19:11:07 +0000 2019,@aedwardslevy Amen
1178734136976121900,Mon Sep 30 18:11:32 +0000 2019,Collins, one of Trump’s earliest congressional endorsers, was re-elected last year while under indictment. He’s now… https://t.co/GyZWxKyU0I
1178404974251913200,Sun Sep 29 20:23:34 +0000 2019,L’Shana Tova to everyone celebrating Rosh Hashanah! Here’s to a happy 5780. https://t.co/OAIhhq2RfX
1178152778948075500,Sun Sep 29 03:41:26 +0000 2019,I know we say this every month, but... what a month. https://t.co/5fBw3AeWkS
1178047584310628400,Sat Sep 28 20:43:25 +0000 2019,“When Trump’s Envoy for Ukraine Resigned, a College Journalist Had the Scoop” #studentjournalism  https://t.co/SNEVGZZxcj
1177765168295682000,Sat Sep 28 02:01:12 +0000 2019,RT @jdawsey1: NEW: Trump told Russian officials in 2017 oval meeting that he wasn’t concerned about their 2016 election interference becaus…
1177718892694773800,Fri Sep 27 22:57:19 +0000 2019,RT @RebeccaBuck: A college newspaper broke this story and that is so awesome 👏🏻 https://t.co/OzRvN0XuAJ
1177620386231439400,Fri Sep 27 16:25:53 +0000 2019,RT @kellyfincham: I am new to @WakeUp2Politics (h/t @yolanypeace11) but what a great resource. And still in high school? Up goes the bar fo…
1177620047168041000,Fri Sep 27 16:24:33 +0000 2019,RT @BrodyLevesque: Fellow journalists, editors, &amp; folks. There's a young reporter from St. Louis, who is as good as seasoned journalists 2X…
1177550444358512600,Fri Sep 27 11:47:58 +0000 2019,Wake Up To Politics - September 27, 2019 - https://t.co/FDFvfXxVlg
1177311856123424800,Thu Sep 26 19:59:54 +0000 2019,RT @elainaplott: Rudy Giuliani was nearly shouting in my phone call with him. “It is impossible that the whistle-blower is a hero and I’m n…
1177206978457809000,Thu Sep 26 13:03:09 +0000 2019,RT @shaneharris: The whistleblower complaint has been released. Unclassified version. https://t.co/7TtURH5LbZ
1177205537114603500,Thu Sep 26 12:57:26 +0000 2019,JUST SENT: This morning's edition of Wake Up To Politics, updated with all the latest on the Trump/Ukraine saga...  https://t.co/jod7DoHG9G
1177027816145248300,Thu Sep 26 01:11:14 +0000 2019,New: President Trump also urged Ukrainian President Volodymyr Zelensky to coordinate with Rudy Giuliani, his person… https://t.co/HS3cDKqLch
1176999836434030600,Wed Sep 25 23:20:03 +0000 2019,RT @dsamuelsohn: BREAKING: There’s now a majority in the House backing at least an impeachment inquiry of President Donald Trump, with 217…
1176961910765314000,Wed Sep 25 20:49:21 +0000 2019,RT @charlie_savage: Takeaway: 1. Trump asked for investigation into Bidens, along w/ one to undermine fact that Russia hacked DNC 2. Immedi…
1176846189259456500,Wed Sep 25 13:09:30 +0000 2019,Polls this week have shown Warren edging ahead of Biden in Iowa and New Hampshire (the first two primary contests),… https://t.co/kFabAi156G
1176838012451328000,Wed Sep 25 12:37:01 +0000 2019,Read this morning's edition of Wake Up To Politics to get caught up on all the latest developemnts surrounding Pres… https://t.co/h7NSv7An13
1176686644428202000,Wed Sep 25 02:35:32 +0000 2019,Two items of note on President Trump’s schedule tomorrow:  — 2:15PM: THE PRESIDENT participates in a bilateral meet… https://t.co/AqZWYGuy04
1176654983988744200,Wed Sep 25 00:29:44 +0000 2019,House Democrats' impeachment push already seems to have accelerated White House document production: the Trump admi… https://t.co/4zvAGKoudO
1176627773538013200,Tue Sep 24 22:41:36 +0000 2019,RT @mviser: Add to this day's eye-popping news: The Republican-controlled Senate, led by Mitch McConnell, is unanimously calling on the whi…
1176610621074354200,Tue Sep 24 21:33:27 +0000 2019,~Subscribe at https://t.co/EjPg0NR0rG if you want to see my attempts at summarizing the day’s political news in a n… https://t.co/r06ixH2NFU
1176609034566340600,Tue Sep 24 21:27:08 +0000 2019,Me, every morning for the past three years: https://t.co/yq5R7aEMFM
1176608149043908600,Tue Sep 24 21:23:37 +0000 2019,While Pelosi’s statement represents a significant change in her rhetoric on impeachment, it doesn’t seem to signal… https://t.co/FsGAsfMwRH
1176605660357759000,Tue Sep 24 21:13:44 +0000 2019,Breaking: House Democrats have formally launched an impeachment inquiry into President Trump.  “The president must… https://t.co/4lPVnaZ5AV
1176532496042741800,Tue Sep 24 16:23:00 +0000 2019,RT @SteveKornacki: Fair to wonder if Warren might be peaking too early. That said, she now leads in the most recent IA and NH polls. In the…
1176530598258569200,Tue Sep 24 16:15:28 +0000 2019,Big news: Lewis was one of the last remaining House Democrats undecided on impeachment who has the power to sway ot… https://t.co/YIpYASE1mM
1176472899517067300,Tue Sep 24 12:26:11 +0000 2019,Leading Wake Up To Politics this morning: "Whistleblower complaint pushes Pelosi, House Democrats toward impeachmen… https://t.co/In5Qq39cuQ
1176331640160866300,Tue Sep 24 03:04:52 +0000 2019,@JMilesColeman @Center4Politics @LarrySabato @kkondik This is awesome! Congratulations!
1175847790611783700,Sun Sep 22 19:02:14 +0000 2019,RT @jaketapper: First GOP official I’ve seen to even stray in the general direction of possibly thinking of approaching condemnation — http…
1175564192147005400,Sun Sep 22 00:15:18 +0000 2019,RT @AlxThomp: Warren in the DMR/CNN polls this cycle: December 2018: 8% March 2019: 9% June 2019: 15% September 2019: 22% And per DMR: “the…
1175563904023507000,Sun Sep 22 00:14:10 +0000 2019,Warren takes the lead in new Des Moines Register/CNN/Mediacom Iowa Poll:  Elizabeth Warren 22% Joe Biden 20% Bernie… https://t.co/u3LcTrbJt2
1175533810055897000,Sat Sep 21 22:14:35 +0000 2019,News: @JoeBiden will be in St. Louis for a fundraiser tomorrow, per his campaign, becoming the second 2020 candidat… https://t.co/Cr7WgIYxx8
1175232700292173800,Sat Sep 21 02:18:05 +0000 2019,RT @vmsalama: Australian journalist turns to me after Oval Office press avail: “Is it always like this?”
1175134883619967000,Fri Sep 20 19:49:23 +0000 2019,WSJ: In a July phone call, President Trump urged Ukrainian President Volodymyr Zelensky “about eight times” to work… https://t.co/42HvOOPb4d
1175071430754615300,Fri Sep 20 15:37:15 +0000 2019,RT @douglasemhoff: "We are going to take it to the next level these next couple months, and Kamala is going to be in Iowa each week," the s…
1175058736332910600,Fri Sep 20 14:46:48 +0000 2019,Some intriguing ideas in this package from @POLITICOMag... https://t.co/wqvwj6GaSc
1175022814006599700,Fri Sep 20 12:24:04 +0000 2019,“It is a very open race," @RobSandIA told me about the Iowa caucuses. “We still have four months to go: I expect a… https://t.co/NW4rmRqB6b
1175022167731449900,Fri Sep 20 12:21:30 +0000 2019,In Wake Up To Politics this morning: as 18 Democratic presidential candidates flock to Iowa, analysis from… https://t.co/T8X3Yn7lSG
1175021786800500700,Fri Sep 20 12:19:59 +0000 2019,@olapeyrolerie Thanks for helping coordinate our interview, Olivia! Wishing you all the best.
1175017521717661700,Fri Sep 20 12:03:02 +0000 2019,@daveweigel @aseitzwald This is Joe Sestak erasure
1175016596634574800,Fri Sep 20 11:59:22 +0000 2019,We’ll always have our memories, Mr. Mayor... https://t.co/ewv7sbhr9C
1175010533638099000,Fri Sep 20 11:35:16 +0000 2019,BREAKING: New York City Mayor @BilldeBlasio is ending his 2020 presidential bid. https://t.co/nhWUggANZD
1174884251961036800,Fri Sep 20 03:13:28 +0000 2019,RT @NPRKelly: Among the details worth noting about this meticulously reported story: eight reporters share credit. Eight. Proud to belong t…
1174871425976602600,Fri Sep 20 02:22:30 +0000 2019,RT @CuomoPrimeTime: .@ChrisCuomo: "So you did ask Ukraine to look into Joe Biden?"  @RudyGiuliani: "Of course I did"  President Trump's att…
1174843120263057400,Fri Sep 20 00:30:02 +0000 2019,RT @washingtonpost: Exclusive: A whistleblower complaint about President Trump’s communications with a foreign leader centers on Ukraine, a…
1174780104813080600,Thu Sep 19 20:19:38 +0000 2019,RT @npfandos: NEW: IC IG told lawmakers today that the complaint involved multiple acts, not a single one, per two sources.  Separately, ot…
1174668210609762300,Thu Sep 19 12:55:00 +0000 2019,In WUTP this morning: Intel official's whistleblower complaint centers around Trump call to foreign leader, Joe Ken… https://t.co/xPclOx430F
1174522447204364300,Thu Sep 19 03:15:47 +0000 2019,Quite a news day... — IC whistleblower complaint reportedly due to Trump promise to foreign leader — Trump announce… https://t.co/OsxvbRSgs0
1174501373167186000,Thu Sep 19 01:52:03 +0000 2019,@AaronBlake “All negative polls are fake!”
1174490527934365700,Thu Sep 19 01:08:57 +0000 2019,RT @PostRoz: Trump’s communications with foreign leader—including a potentially troubling promise by the president—are part of whistleblowe…
1174437958629433300,Wed Sep 18 21:40:03 +0000 2019,NEWS: Rep. Joe Kennedy III will formally announce his plans to launch a primary challenge against Sen. Ed Markey in… https://t.co/fLmSgwJ3CX
1174433933011890200,Wed Sep 18 21:24:04 +0000 2019,RT @jdawsey1: there is no construct on twitter i hate more than "stand by for news." when ya got the news, post the news!
1174298521329111000,Wed Sep 18 12:25:59 +0000 2019,Wake Up To Politics - September 18, 2019 - https://t.co/SN8GO6BfBj
1174091743656063000,Tue Sep 17 22:44:19 +0000 2019,@ploge Seems like Lewandowski would make for some interesting answers on how he views ethics in political communication!
1174090402430902300,Tue Sep 17 22:39:00 +0000 2019,A revealing admission from the president’s former campaign manager and a prospective candidate for U.S. Senate &gt; https://t.co/G18Y3nnaiK
1174078297300459500,Tue Sep 17 21:50:54 +0000 2019,Recent trend among Democratic presidential candidates: declaring that the primary race has reached a “new phase.”… https://t.co/74wDgVHWxq
1174068096493113300,Tue Sep 17 21:10:21 +0000 2019,RT @mmurraypolitics: National NBC/WSJ poll on 2020 Dem race  Biden 31% (+5 from July) Warren 25% (+6) Sanders 14% (+1) Buttigieg 7% (even)…
1174051913400238000,Tue Sep 17 20:06:03 +0000 2019,Trump’s five finalists for National Security Advisor: — Robert O’Brien, hostage envoy — Maj. Gen. Ricky Waddell, fo… https://t.co/dM6ELEfCAI
1174003916372996000,Tue Sep 17 16:55:20 +0000 2019,De Blasio at 0% in NYC! https://t.co/FD4kjHaUwf
1173936846000271400,Tue Sep 17 12:28:49 +0000 2019,Wake Up To Politics - September 17, 2019 - https://t.co/Z8DiYPCbmg
1173757512060932000,Tue Sep 17 00:36:12 +0000 2019,RT @KFaulders: Story - White House blocks former top Trump aides, Rob Porter &amp; Rick Dearborn from testifying. Says Lewandowski’s convos w/…
1173571714841817000,Mon Sep 16 12:17:55 +0000 2019,Wake Up To Politics - September 16, 2019 - https://t.co/Sy6k9XMkOz
1173421224409669600,Mon Sep 16 02:19:55 +0000 2019,Tomorrow, Joe Biden and other top Democratic presidential candidates will speak at *actual stumps* as part of the G… https://t.co/E5zCoOBykb
1173379545459810300,Sun Sep 15 23:34:18 +0000 2019,RT @JDiamond1: 5 days ago: US Treasury Secretary @stevenmnuchin1: "He is happy to take a meeting with no preconditions." US Secretary of St…
1173305850783387600,Sun Sep 15 18:41:28 +0000 2019,Three Democratic presidential candidates have now announced their support for Brett Kavanaugh’s impeachment, in lig… https://t.co/fNePC0ZOEY
1173289312479273000,Sun Sep 15 17:35:45 +0000 2019,News: Pelosi and Schumer say they discussed gun control with POTUS by phone this morning, insisting that any propos… https://t.co/6cvFkTkkHL
1172673459815624700,Sat Sep 14 00:48:34 +0000 2019,RT @kyledcheney: HMMM: SCHIFF has issued a cryptic subpoena, claiming an intel community whistleblower's complaint has been withheld from C…
1172600311082414000,Fri Sep 13 19:57:54 +0000 2019,RT @maggieNYT: Amazing story. https://t.co/sFM7vhLFRH
1172491151498256400,Fri Sep 13 12:44:09 +0000 2019,JUST SENT: My synposis and analysis of last night's Democratic debate, leading this morning's edition of Wake Up To… https://t.co/yUMCVKgUCA
1172347927555170300,Fri Sep 13 03:15:01 +0000 2019,Here are the candidates' total speaking times from tonight's debate, per WaPo. Pretty closely follows polling order… https://t.co/GwG4Q46aQF
1172342054346580000,Fri Sep 13 02:51:41 +0000 2019,And three hours later, the third Democratic presidential debate has come to a close. Unclear that the night has don… https://t.co/VliSkNPOK2
1172340571064504300,Fri Sep 13 02:45:47 +0000 2019,Most significant professional setback you've faced? (contd.)  Yang: finding career path Booker: failed mayoral camp… https://t.co/06R3Rfn3Wj
1172340570187944000,Fri Sep 13 02:45:47 +0000 2019,Most significant professional setback you've faced?  Biden: deaths of wife and children Warren: losing job because… https://t.co/t9lBlq56y1
1172336804852142000,Fri Sep 13 02:30:49 +0000 2019,@BeverlyAdams56 🤷‍♂️
1172336288080351200,Fri Sep 13 02:28:46 +0000 2019,And chose to interrupt right when Biden was about to talk about the deaths of his wife and children? https://t.co/7osdpI8okS
1172333355125239800,Fri Sep 13 02:17:07 +0000 2019,Biden: "Make sure you have the record player on at night" ???   One of a few rambling answers from the former vice… https://t.co/sdRGrdqI9f
1172331272540057600,Fri Sep 13 02:08:50 +0000 2019,Buttigieg takes a shot at Besty DeVos: "Step one is appointing a Secretary of Education who actually believes in pu… https://t.co/SImQvc8lS5
1172328921938841600,Fri Sep 13 01:59:30 +0000 2019,Booker, asked if Americans should adopt his vegan diet: "No. And let me translate that into Spanish: No." #DemDebate
1172328456689836000,Fri Sep 13 01:57:39 +0000 2019,Sanders: "In terms of democratic socialism, to equate what goes on in Venezuela to what I believe is incredibly unf… https://t.co/b6fqekJ7YT
1172327244909277200,Fri Sep 13 01:52:50 +0000 2019,RT @alivitali: Bernie then proceeds to hit Biden on that Iraq vote, calling their vote in that moment a difference between them. #DemDebate…
1172324987748810800,Fri Sep 13 01:43:52 +0000 2019,Warren, asked if she'd bring troops home from Afghanistan before striking deal with Taliban: "Yes." #DemDebate
1172323803495456800,Fri Sep 13 01:39:10 +0000 2019,RT @TalKopan: Harris: “He reminds me of that guy in the Wizard of Oz, you know when you pull back the curtain it’s a really small dude.” St…
1172322802793234400,Fri Sep 13 01:35:11 +0000 2019,*Correction: Buttigieg said April, not January.* Mea culpa.
1172321864632291300,Fri Sep 13 01:31:27 +0000 2019,Buttigieg on trade: "When I got into this race, President Trump said he'd like to see me make a deal with Xi Jinpin… https://t.co/ec547F24HE
1172320912001007600,Fri Sep 13 01:27:40 +0000 2019,Was not expecting to see Sean Spicer on screen during the #DemDebate.
1172319513884258300,Fri Sep 13 01:22:07 +0000 2019,Watching this debate should count as doing my AP Spanish homework. #DemDebate
1172318065687593000,Fri Sep 13 01:16:22 +0000 2019,Castro blasts Biden for embracing Obama when it's convenient and distancing himself it's not. "He wants to take cre… https://t.co/zrkFDe7N7H
1172317590250590200,Fri Sep 13 01:14:28 +0000 2019,After being pressed by Jorge Ramos on Obama-era deportations, Biden refuses to say 44 made a mistake: "The presiden… https://t.co/KfQlx6Dzdr
1172317198771052500,Fri Sep 13 01:12:55 +0000 2019,Biden defends Obama's immigration record: "Comparing this president to the president we had is outrageous. We didn'… https://t.co/AAWjbhE7OB
1172316528697430000,Fri Sep 13 01:10:15 +0000 2019,Some daylight between the two progressives at the center of the stage: Warren calls for elimination of the filibust… https://t.co/KmUHLmabq7
1172315928484147200,Fri Sep 13 01:07:52 +0000 2019,Booker: "We've had more people die from gun violence in my lifetime than in every war we've had... This is a centra… https://t.co/Hq2DeCjVjT
1172314888057680000,Fri Sep 13 01:03:44 +0000 2019,Where is Elizabeth Warren? #DemDebate
1172314665805705200,Fri Sep 13 01:02:51 +0000 2019,This. https://t.co/B0mkmzdfDE
1172314603188961300,Fri Sep 13 01:02:36 +0000 2019,O'Rourke distinguishes himself from rivals by calling for taking away people's guns (and breaks ABC's moratorium on… https://t.co/r3Dht95Wob
1172314111054467000,Fri Sep 13 01:00:39 +0000 2019,Harris continues to go after Trump, says on El Paso shooting: "He may not have pulled the trigger, but he was tweet… https://t.co/nCJNBWpq11
1172313730886946800,Fri Sep 13 00:59:08 +0000 2019,Harris on taking executive action: "Instead of saying 'no, we can't,' how about saying 'yes we can?'"  Biden: "We've got a constitution."
1172312607602045000,Fri Sep 13 00:54:40 +0000 2019,BIDEN on criminal justice reform, after being challenged that his plan doesn't go far enough: "Nobody should be in… https://t.co/jNOGBTHUyc
1172311244822302700,Fri Sep 13 00:49:15 +0000 2019,RT @abbydphillip: Linsey Davis with a tough question for Harris about her criminal justice record. This could be a big opportunity for Harr…
1172308864873578500,Fri Sep 13 00:39:48 +0000 2019,RT @evanmcmurry: Julián Castro goes after Joe Biden on health care: "I'm fulfilling the legacy of Barack Obama, and you're not."  "That'll…
1172308244519256000,Fri Sep 13 00:37:20 +0000 2019,Castro to Biden: "Are you forgetting what you said just two minutes ago?" !!! #DemDebate
1172307389195804700,Fri Sep 13 00:33:56 +0000 2019,Biden to Sanders: “For a socialist, you’ve got a lot more confidence in corporate America than I do.”
1172307045548052500,Fri Sep 13 00:32:34 +0000 2019,Kamala Harris refocuses health care discussion on Donald Trump, picking up from her anti-Trump opening statement, a… https://t.co/Klky9VhbHf
1172306460316815400,Fri Sep 13 00:30:15 +0000 2019,Buttigieg also references Sanders’s “damn bill,” saying it “doesn’t trust the American people.” Joins Biden and Klo… https://t.co/ExADhrpWUO
1172305883482620000,Fri Sep 13 00:27:57 +0000 2019,KLOBUCHAR on Medicare For All: "While Bernie wrote the bill, I read the bill." Speaks against the bill's eliminatio… https://t.co/tWuQye6H4m
1172304550717358000,Fri Sep 13 00:22:39 +0000 2019,Sanders reprises a familiar line on Medicare For All: "I wrote the damn bill!" #DemDebate
1172304450045612000,Fri Sep 13 00:22:15 +0000 2019,Warren responds by praising Obama and saying her health care plan will be paid for be raising costs for wealthy ind… https://t.co/4ZVwFOVfsE
1172303868509618200,Fri Sep 13 00:19:57 +0000 2019,Biden sidesteps when asked whether Sanders and Warren are pushing too far with their policies: "That'll be for vote… https://t.co/jOv6mMLunn
1172301942338375700,Fri Sep 13 00:12:18 +0000 2019,@ABC @UnivisionNews Andrew Yang gets laughter from other candidates after announcing in his opening statement that… https://t.co/2rulv21kin
1172299446975004700,Fri Sep 13 00:02:23 +0000 2019,STARTING NOW: The 10 top Democratic presidential candidates face off in an @ABC/@UnivisionNews debate in Houston. F… https://t.co/Gt6GATxP3t
1172281572189528000,Thu Sep 12 22:51:21 +0000 2019,President Trump tweets a photo from Baltimore, where he is speaking today at the House Republican retreat. Just six… https://t.co/EvIuD9w0mT
1172244631519748000,Thu Sep 12 20:24:34 +0000 2019,RT @ShaneGoldmacher: A perfect snapshot of how much Trump now thoroughly dominates the GOP: Liz Cheney and Rand Paul are jostling over who…
