id,created_at,text
1094696101234569200,Sun Feb 10 20:34:23 +0000 2019,Just now: In the cold Minnesota outdoors, @AmyKlobuchar announces her presidential campaign, becoming the third fem… https://t.co/331mPcP3v9
1094673985047093200,Sun Feb 10 19:06:30 +0000 2019,Every paper I turn in at school is submitted to a plagiarism-detected database. If I committed the pretty egregious… https://t.co/FKdviXxq2y
1094668578270396400,Sun Feb 10 18:45:01 +0000 2019,THE FIXER: Read @paulschwartzman's deep dive into Michael Cohen and his political aspirations (part of a great WaPo… https://t.co/Q3NfuDlXRr
1094641103511453700,Sun Feb 10 16:55:51 +0000 2019,RT @AsteadWesley: when u haven't finished the readings https://t.co/iKtwDDGXpG
1094014228896329700,Fri Feb 08 23:24:52 +0000 2019,In politics, nothing is permanent. https://t.co/xcuPdVxtQ3
1094006583997149200,Fri Feb 08 22:54:29 +0000 2019,President Trump's physician after his physical today: "While the reports and recommendations are being finalized, I… https://t.co/tTcuYyJBlE
1094003303090925600,Fri Feb 08 22:41:27 +0000 2019,@clbickerton Thanks for reading, Cathy!
1093996218622062600,Fri Feb 08 22:13:18 +0000 2019,This comes after Fairfax was accused of rape by a second woman earlier today. https://t.co/pUAWhz827Y
1093996034823540700,Fri Feb 08 22:12:34 +0000 2019,McAuliffe, who preceded Northam as governor of Virginia, becomes one of the first prominent Democrats to call for F… https://t.co/5P3HnZ9FHQ
1093992654151528400,Fri Feb 08 21:59:08 +0000 2019,If you read Wake Up To Politics, you know one of the most common phrases I write is “according to.” Does it make th… https://t.co/bg9WIzCk1T
1093705047203037200,Fri Feb 08 02:56:17 +0000 2019,Thread https://t.co/hqGIVFkoQn
1093697021385551900,Fri Feb 08 02:24:24 +0000 2019,Very sad news. ⁦@JohnDingell⁩ served in Congress for 60 years, from Eisenhower to Obama, spending 20 years as Dean… https://t.co/5jMzdbyhOy
1093519450911977500,Thu Feb 07 14:38:48 +0000 2019,Included in this morning’s newsletter: VA insight from @kkondik. “When it was just Northam who was under fire, it s… https://t.co/0LwqZpx164
1093505940412878800,Thu Feb 07 13:45:07 +0000 2019,Virgnia Democrats in crisis, border talks continue, House Democrats launch oversight efforts, and more in Wake Up T… https://t.co/MStrA30jVr
1093275755474227200,Wed Feb 06 22:30:26 +0000 2019,He’s 11 years old and the speech went late. This is not news, and shouldn’t be printed by a major news organization… https://t.co/RU2NhanZ5F
1093206924429008900,Wed Feb 06 17:56:56 +0000 2019,Two of Virgnia's top three elected officials have now admitted to using blackface in the past. The third has been a… https://t.co/TIYsZqSshQ
1093143396695375900,Wed Feb 06 13:44:30 +0000 2019,Included in my report: reactions from 3 former WH aides. Ex-Trump aide @BorisEP tells me: "President Trump absolute… https://t.co/WBOb4SIJyt
1093141707611402200,Wed Feb 06 13:37:47 +0000 2019,SOTU RECAP: Read up on the most important points from the president's speech last night in this morning's edition o… https://t.co/mJoXK0lnCd
1093000409097138200,Wed Feb 06 04:16:19 +0000 2019,RT @WardDPatrick: One day after Elizabeth Warren’s announcement https://t.co/azPM4Y2AwY
1092993417154625500,Wed Feb 06 03:48:32 +0000 2019,RT @markknoller: Delivering the Democratic response, former Georgia State House Minority Leader Stacey Abrams, said "I stand here tonight b…
1092989236612157400,Wed Feb 06 03:31:55 +0000 2019,After just less than 90 minutes, @POTUS has concluded his second State of the Union address, a speech that mixed a… https://t.co/5DIYxl4m2N
1092988461513089000,Wed Feb 06 03:28:50 +0000 2019,A very optimistic ending for President Trump's second State of the Union: "Look at the opportunities before us! Our… https://t.co/sJpHUomfOL
1092987952391749600,Wed Feb 06 03:26:49 +0000 2019,Trump to members of Congress as he comes to a close: "Think of this Capitol -- think of this very chamber, where la… https://t.co/nF4HWjQWZr
1092986780498960400,Wed Feb 06 03:22:09 +0000 2019,Is it just me or is the House chamber much more raucous than usual today, between the groaning, cheering, chanting,… https://t.co/exqpWIxlSu
1092986526705877000,Wed Feb 06 03:21:09 +0000 2019,Definitely a State of the Union first: lawmakers sing "Happy Birthday" to Judah Samet, a survivor of the Holocaust… https://t.co/ZXsvPQdE5Q
1092985942237999100,Wed Feb 06 03:18:49 +0000 2019,"We must never ignore the vile poison of anti-Semitism, or those who spread its venomous creed": Trump speaks at le… https://t.co/1HmEwjpAIA
1092984951958655000,Wed Feb 06 03:14:53 +0000 2019,Pivoting to foreign policy, Trump provides update on his efforts to withdraw troops from the Middle East, stating:… https://t.co/1ChLYYqKBQ
1092983998027128800,Wed Feb 06 03:11:06 +0000 2019,Self-described “democratic socialist” @BernieSanders’ face as Trump declares, “America will never be a socialist co… https://t.co/tetyIeM21E
1092983319837503500,Wed Feb 06 03:08:24 +0000 2019,President Trump makes some news in his State of the Union: announces a second summit with North Korean leader Kim J… https://t.co/d3yKtPaw8p
1092982414266253300,Wed Feb 06 03:04:48 +0000 2019,RT @WhiteHouse: Grace Eline, cancer survivor. https://t.co/KCxjHKmtE0
1092982132023140400,Wed Feb 06 03:03:41 +0000 2019,"And then, we had the case of the Governor of Virginia where he basically stated he would execute a baby after birt… https://t.co/NA2gXLkniG
1092980883064279000,Wed Feb 06 02:58:43 +0000 2019,Trump: "Together we will defeat AIDS in America and beyond." Calls for a commitment to ending the HIV epidemic in the U.S. within 10 years.
1092980038457274400,Wed Feb 06 02:55:22 +0000 2019,Infrastructure Week redux? Trump says he is "eager" to work with lawmakers on an infrastructure package. "Both part… https://t.co/IFJ8tJDtUz
1092979402642808800,Wed Feb 06 02:52:50 +0000 2019,Bipartisanship. 🇺🇸 https://t.co/6o9XUlPxyt
1092979006759190500,Wed Feb 06 02:51:16 +0000 2019,Bipartisanship at the State of the Union! Chants of "USA!" from BOTH sides of the aisle after @POTUS mentions 100th… https://t.co/mBKKEUJmCf
1092978501676908500,Wed Feb 06 02:49:16 +0000 2019,"You weren't supposed to do that!" Trump says to laughter as House Democrats stand in celebration. https://t.co/pkY0j5a9gw
1092978056925466600,Wed Feb 06 02:47:29 +0000 2019,Trump tonight: "So let's work together, compromise, and reach a deal that will truly make America safe."  Trump on… https://t.co/CxawbLJW89
1092977385052557300,Wed Feb 06 02:44:49 +0000 2019,No emergency declaration, but Trump does promise on the border wall, "I will get it built." #SOTU
1092976627569565700,Wed Feb 06 02:41:49 +0000 2019,Looking over Trump's 2018 speech while watching this one is actually really interesting. The guests he is pointing… https://t.co/sbxOhQumQ8
1092975644676444200,Wed Feb 06 02:37:54 +0000 2019,As he continues to press for immigration fix, Trump repeats a line of attack from his Oval Office address a few wee… https://t.co/ADccw9sBWu
1092974617906610200,Wed Feb 06 02:33:50 +0000 2019,Trump now turning to immigration, calling on Congress to "pass a bill that will fund our Government, protect our ho… https://t.co/OTEN5zG1Do
1092973970406690800,Wed Feb 06 02:31:15 +0000 2019,"They said it couldn't be done": Trump praises passage of bipartisan criminal justice reform, pointing to Alice Joh… https://t.co/7HsfjO4QnR
1092973222516142100,Wed Feb 06 02:28:17 +0000 2019,"Last year, I heard through friends the story of Alice Johnson." https://t.co/uN3MGuY8yQ
1092972650043985900,Wed Feb 06 02:26:00 +0000 2019,Very interesting: Trump takes aim at "ridiculous partisan investigations" in #SOTU. "If there is going to be peace… https://t.co/DS0j2CfiaJ
1092972505533501400,Wed Feb 06 02:25:26 +0000 2019,Almost all of the accomplishments Trump just ticked through — tax cuts, child tax credit, individual mandate repeal… https://t.co/OSlop2e46A
1092972228117966800,Wed Feb 06 02:24:20 +0000 2019,There it is: "Members of Congress, the state of our union is strong," @POTUS declares. Democratic members remain se… https://t.co/xbX985zp3Q
1092970366698283000,Wed Feb 06 02:16:56 +0000 2019,Continuing unity theme, Trump calls for an end to the "politics of revenge, resistance, and retribution" and embrac… https://t.co/kp7Ufyxnsc
1092969320903204900,Wed Feb 06 02:12:47 +0000 2019,Trump points out three D-Day veterans in the gallery, who stand up and receive sustained applause. "Gentleman, we salute you."
1092968511708643300,Wed Feb 06 02:09:34 +0000 2019,As promised, @POTUS is opening with promises of bipartisanship. "The agenda I have this evening is not a Republican… https://t.co/i6EUnH5HRS
1092967341510426600,Wed Feb 06 02:04:55 +0000 2019,After being formally announced by the Clerk of the House ("Madam Speaker, the president of the United States!"),… https://t.co/WYXs4uSODo
1092966779448582100,Wed Feb 06 02:02:41 +0000 2019,Full list of @FLOTUS guests: https://t.co/AWqwx2jEeY https://t.co/iD4JFEXZKg
1092966286298992600,Wed Feb 06 02:00:43 +0000 2019,.@FLOTUS has arrived in the House chamber for her husband's second #SOTU address. She is joined in her box by 13 gu… https://t.co/KkrYxTkSpa
1092963636010569700,Wed Feb 06 01:50:11 +0000 2019,In addition to being a television show starring Kiefer Sutherland, the “designated survivor” is the Cabinet member… https://t.co/tzqUDu1ltE
1092962514856366100,Wed Feb 06 01:45:44 +0000 2019,SOTU news: the "designated survivor" tonight will be Energy Secretary Rick Perry, the former Texas governor and one… https://t.co/4m6B9AGpmd
1092947994805190700,Wed Feb 06 00:48:02 +0000 2019,RT @AmyEGardner: SCOOP with @AnnieLinskey — Elizabeth Warren filled out a form for the State Bar of Texas claiming Indian heritage. https:/…
1092910977325121500,Tue Feb 05 22:20:56 +0000 2019,An (entirely true) 2019 Mad Libs via @SchreckReports: Steve Bannon, Kris Kobach, Curt Schilling, and David Clarke c… https://t.co/aRxzh51h2G
1092889976923217900,Tue Feb 05 20:57:30 +0000 2019,@TheTobster111 Thanks!
1092808349723385900,Tue Feb 05 15:33:08 +0000 2019,Kellyanne Conway on the SOTU yesterday: “The president is going to call for an end to the politics of resistance, r… https://t.co/BwP8jettQI
1092808034005467100,Tue Feb 05 15:31:53 +0000 2019,Feels like this might step on the message of bipartisanship tonight, no? https://t.co/5TOAg8LoS7
1092780192324558800,Tue Feb 05 13:41:15 +0000 2019,State of the Union preview, Trump inaugural committee subpoena, Virginia controversies, new Interior Secretary nomi… https://t.co/qu7hLe3Yoq
1092607456344186900,Tue Feb 05 02:14:51 +0000 2019,For comparison, in the same poll, 45% of Americans said they had never heard of @staceyabrams, 16% had never heard… https://t.co/ty3Ec8l0YH
1092607455614435300,Tue Feb 05 02:14:51 +0000 2019,This must be unprecedented for a House freshman/woman: 59% of Americans have heard of @AOC and have an opinion on h… https://t.co/iS4uUyYSU9
1092597865023791100,Tue Feb 05 01:36:45 +0000 2019,RT @Ranger_Liz: I don't get political on here but if you would like a digest of it's news for the day you need to follow this guy. Things l…
1092595016281792500,Tue Feb 05 01:25:25 +0000 2019,@MauraInKaty I’m so glad! Thanks so much for telling me this, and please thank your daughter for reading!
1092594737150873600,Tue Feb 05 01:24:19 +0000 2019,I love hearing this! Do you also want to be “in the know”? Sign up to receive Wake Up To Politics in your inbox eac… https://t.co/AZ1m73lp9g
1092585623603552300,Tue Feb 05 00:48:06 +0000 2019,The sixth grader, by the way, is a Delawarean named Joshua Trump, who was invited because he has been “bullied in s… https://t.co/c4ImbAt0r6
1092584188304339000,Tue Feb 05 00:42:24 +0000 2019,These guests will sit in the First Lady’s box during the address. They are often mentioned in the speech, and can g… https://t.co/c7itfOxRkS
1092583826424021000,Tue Feb 05 00:40:58 +0000 2019,More:  — child cancer patient — DHS human trafficking agent — sawmiller worker helped by Tax Cuts &amp; Jobs Act — 6th… https://t.co/4x8x134rgO
1092583195223183400,Tue Feb 05 00:38:27 +0000 2019,White House announces @POTUS’ guests for #SOTU tomorrow. List includes:  — relatives of victims of murder by illega… https://t.co/7yQDd3mzuP
1092413607634178000,Mon Feb 04 13:24:34 +0000 2019,Wake Up To Politics - February 4, 2019 - https://t.co/6mHG54cfrL
1092153701186310100,Sun Feb 03 20:11:48 +0000 2019,@Rob_Flaherty But didn't Trump hold a press conference that day?
1092147262413852700,Sun Feb 03 19:46:13 +0000 2019,The story also includes this very cool interactive graphic that allows you to click through and see how the preside… https://t.co/LDfRLRkjnr
1092147058868396000,Sun Feb 03 19:45:24 +0000 2019,President Trump has spent about 60% of his scheduled time over the past three months in unstructured "Executive Tim… https://t.co/O6xAu3kSzA
1091852806867296300,Sun Feb 03 00:16:09 +0000 2019,RT @mviser: Senators Mark Warner and Tim Kaine (both former Virginia governors) and Congressman Bobby Scott called Ralph Northam: “He must…
1091785470026174500,Sat Feb 02 19:48:35 +0000 2019,Also, this https://t.co/HUJW3Gd83X
1091785168409509900,Sat Feb 02 19:47:23 +0000 2019,NEW: After apologizing for KKK/blackface yearbook photo last night, Northam now says he was not one of the people i… https://t.co/9EF6scZvTL
1091739198061768700,Sat Feb 02 16:44:43 +0000 2019,RT @markberman: The photograph on his yearbook page, about which he said - less than 24 hours ago - “I am deeply sorry for the decision I m…
1091490505295315000,Sat Feb 02 00:16:30 +0000 2019,RT @jaketapper: 1st 2020 Dem to call for Northam resignation. For that matter, 1st Dem official I’ve seen — https://t.co/6RME0uSrOL
1091490505295315000,Sat Feb 02 00:16:30 +0000 2019,RT @jaketapper: 1st 2020 Dem to call for Northam resignation. For that matter, 1st Dem official I’ve seen — https://t.co/6RME0uSrOL
1091480777999769600,Fri Feb 01 23:37:50 +0000 2019,RT @washingtonpost: Virginia Gov. Ralph Northam's page in a 1984 yearbook features a photo of people in blackface and Ku Klux Klan apparel…
1091391647554945000,Fri Feb 01 17:43:40 +0000 2019,ANNOUNCED — Delaney — Yang — Gabbard — Castro — Harris — Williamson — Booker  EXPLORING — Warren — Gillibrand — But… https://t.co/kLMqeMPsho
1091329076764307500,Fri Feb 01 13:35:02 +0000 2019,Booker is running, Trump's NYT interview, Russia probe latest, and more in this morning's edition of Wake Up To Pol… https://t.co/QT1HU6Q9dY
1091309131095523300,Fri Feb 01 12:15:47 +0000 2019,Breaking: New Jersey Sen. @CoryBooker joins 2020 presidential race https://t.co/aMpuWX1ZfY
1091164919834267600,Fri Feb 01 02:42:44 +0000 2019,Booker is in, he tells lawmakers: https://t.co/ssII8RruDC
1091156797564612600,Fri Feb 01 02:10:27 +0000 2019,By my count, this was President Trump's 171st on-the-record interview since taking office. His 8th with the New Yor… https://t.co/yke4Yr9tTK
1091155459501903900,Fri Feb 01 02:05:08 +0000 2019,New: POTUS calls congressional border talks "a waste of time" in interview with @maggieNYT &amp; @peterbakernyt. He wou… https://t.co/ywH0I2Tbn8
1091154113482707000,Fri Feb 01 01:59:47 +0000 2019,President Trump will be spending the weekend at Mar-a-Lago, per White House, for his first trip to the resort since Thanksgiving.
1091139790265819100,Fri Feb 01 01:02:53 +0000 2019,WARREN announcement coming on February 9 https://t.co/taKsyPizJB
1091114917023879200,Thu Jan 31 23:24:02 +0000 2019,RT @shaneharris: Their testimony was public. It was carried on television. You can read transcripts of it. https://t.co/6WpBUC5lT2
1091099110189514800,Thu Jan 31 22:21:14 +0000 2019,"Roy Blunt’s secret weapon in border security talks: Democrats love him": Good piece by @lindsaywise &amp; @BryanLowry3… https://t.co/JutWGR2lGK
1091086443810877400,Thu Jan 31 21:30:54 +0000 2019,CNN: Senate investigators have obtained new information showing Donald Trump Jr.'s mysterious phone calls ahead of… https://t.co/9zaaeP5BPT
1090966900346105900,Thu Jan 31 13:35:52 +0000 2019,Wake Up To Politics - January 31, 2019 - https://t.co/V7UhkGCCrZ
1090742741351448600,Wed Jan 30 22:45:09 +0000 2019,RT @anitakumar01: The steady loss of local newspapers and journalists across the country contributes to the nation’s political polarization…
1090609170116694000,Wed Jan 30 13:54:23 +0000 2019,“The intelligence people” = the intel chiefs Trump himself appointed   More on how they contradicted his past state… https://t.co/jjwbJQ2mIF
1090607989566906400,Wed Jan 30 13:49:41 +0000 2019,Border security conference committee to hold first meeting, 2020 no-goes, Intel chiefs split with Trump, and more i… https://t.co/QSl6U552fb
1090403525719441400,Wed Jan 30 00:17:13 +0000 2019,And only three other major-party presidential nominees were mayors: DeWitt Clinton (1812), Horatio Seymour (1868),… https://t.co/uTFT4DbYcs
1090399414286512100,Wed Jan 30 00:00:53 +0000 2019,Didn’t realize how many former mayors were in the potential 2020 Democratic field. Interesting considering only thr… https://t.co/LFmxS28VnC
1090381390976335900,Tue Jan 29 22:49:16 +0000 2019,Three bills have now been introduced to put an end to future government shutdowns (Portman, Warner, House freshman)… https://t.co/Z2CVINsYK9
1090376400891269100,Tue Jan 29 22:29:26 +0000 2019,@NewsPolitics Sure, once they’re hired as reporters they are expected to remain non-partisan and not showcase whate… https://t.co/fcMhiCHCzd
1090375767253545000,Tue Jan 29 22:26:55 +0000 2019,@realmyiq2xu2 @weeklystandard @theblaze @leighmunsil @DailyCaller @kaitlancollins @dcexaminer @sarahcwestwood… https://t.co/viqFwk62VH
1090370249382420500,Tue Jan 29 22:05:00 +0000 2019,Wow, this is an epic subtweet by legislation title https://t.co/JrqL1gFNDw
1090369077179285500,Tue Jan 29 22:00:20 +0000 2019,RT @sarahdwire: Stacey Abrams, former Democratic Leader in the Georgia House of Representatives, will give the Democratic Response to Presi…
1090368332916609000,Tue Jan 29 21:57:23 +0000 2019,@DJJudd @LaurenDezenski This Cardi B interview from last year when she talks about her love for presidents and “how… https://t.co/YZ3hX7DwtA
1090365454789546000,Tue Jan 29 21:45:57 +0000 2019,Something critics of CNN don't often mention: they've hired a lot of great reporters from conservative outlets like… https://t.co/8ZcfEBN0R9
1090356958094393300,Tue Jan 29 21:12:11 +0000 2019,@ericbradner @CNNPolitics Congratulations, Eric. Welcome to the Midwest!
1090318863022080000,Tue Jan 29 18:40:48 +0000 2019,@leadinglatte Missed that, thanks!
1090318818143031300,Tue Jan 29 18:40:38 +0000 2019,RT @leadinglatte: @WakeUp2Politics + Heidi to CNBC! https://t.co/j4xCU0nOE1
1090278183147061200,Tue Jan 29 15:59:09 +0000 2019,RT @davidshepardson: Revolving door https://t.co/UXLcLoi0bu
1090277849741905900,Tue Jan 29 15:57:50 +0000 2019,Former members of the 115th Congress with TV contributor deals:  — @JeffFlake ➡️ @CBSNews  — @clairecmc ➡️ @NBCNews… https://t.co/3v8EW0VTKm
1090271317759189000,Tue Jan 29 15:31:53 +0000 2019,Pres Trump last month: "We have defeated ISIS in Syria" VP Pence earlier this month: "ISIS has been defeated"  Dire… https://t.co/FZbTAoLTfs
1090238244304883700,Tue Jan 29 13:20:27 +0000 2019,Read today’s newsletter here: https://t.co/yvLgACVy0e https://t.co/lXbW17OPPv
1090236023014084600,Tue Jan 29 13:11:38 +0000 2019,Wake Up To Politics - January 29, 2019 - https://t.co/yvLgACVy0e
1090018800538476500,Mon Jan 28 22:48:28 +0000 2019,RT @DevlinBarrett: folks: this has been guessed at, hinted at, and suggested before, but it has not been said by any senior official before…
1090000765970718700,Mon Jan 28 21:36:48 +0000 2019,New Pelosi letter to Trump invites him to deliver State of the Union address on February 5 (had originally been sch… https://t.co/VvKvEx1aEa
1089945653546025000,Mon Jan 28 17:57:48 +0000 2019,@byrdinator Congratulations!!
1089880993304100900,Mon Jan 28 13:40:52 +0000 2019,I’m back from Qatar and Wake Up To Politics is back in your inbox! For a look at where I was last week, watch this… https://t.co/EvY2wCkIsG
1089879402807210000,Mon Jan 28 13:34:33 +0000 2019,Wake Up To Politics - January 29, 2019 - https://t.co/GbxWQoXW1U
1089275277102993400,Sat Jan 26 21:33:58 +0000 2019,@GilADSantos @JBSchool @DohaDeclaration @UNODC @munimpact Great to meet you too!
1089242700983857200,Sat Jan 26 19:24:31 +0000 2019,RT @GilADSantos: Happy to have met students from @JBSchool while attending #TQ19 in Doha this week. Great to be inspired by our future lead…
1088007057125621800,Wed Jan 23 09:34:31 +0000 2019,For those of you missing Wake Up To Politics this week, here's a glimpse of what I'm doing in amazing Doha, Qatar!… https://t.co/y5Onnk2N80
1086252278804344800,Fri Jan 18 13:21:39 +0000 2019,@archarin Yes! Can’t wait!
1086252247258972200,Fri Jan 18 13:21:31 +0000 2019,@khalywally See you there!
1086243218092634100,Fri Jan 18 12:45:39 +0000 2019,@KorvaColemanNPR Thanks so much, Korva!
1086091891945410600,Fri Jan 18 02:44:20 +0000 2019,@Daroff Thanks so much, @Daroff!
1086091773867372500,Fri Jan 18 02:43:52 +0000 2019,@RyanConwayMO Thanks, Ryan!
1086030023201562600,Thu Jan 17 22:38:29 +0000 2019,I probably won’t be on Twitter much either, but might tweet some photos and such from the conference!
1086030013542076400,Thu Jan 17 22:38:27 +0000 2019,Heads-up: I’m headed to Doha, Qatar (!) tomorrow for a Model UN conference with a group from my school. I’ll be a m… https://t.co/dhakedqNJo
1085887693882646500,Thu Jan 17 13:12:55 +0000 2019,Wake Up To Politics - January 17, 2019 - https://t.co/zbgGpCbKpO
1085733686807576600,Thu Jan 17 03:00:57 +0000 2019,The party of AOC. https://t.co/OJLvmv9xjd
1085726847697064000,Thu Jan 17 02:33:46 +0000 2019,RT @mkraju: We’ve gone from Trump saying in January 2017 there were “no” contacts between anyone associated with him and his campaign to Ru…
1085725907069866000,Thu Jan 17 02:30:02 +0000 2019,In which the president’s lawyer opens the door to members of the president’s campaign having colluded with Russia... https://t.co/VrTc5p36tf
1085718390348513300,Thu Jan 17 02:00:10 +0000 2019,"Mr. Trump has adamantly insisted there was 'no collusion' with Russia during his 2016 presidential campaign. But e… https://t.co/qR0bqDcLb6
1085528372946653200,Wed Jan 16 13:25:06 +0000 2019,Wake Up To Politics - January 16, 2019 - https://t.co/dP4sCEcBO0
1085527690722115600,Wed Jan 16 13:22:24 +0000 2019,Looks like @ChrisChristie can kiss goodbye his chances of becoming White House chief of staff any time soon.… https://t.co/mRhBWxedQw
1085397629553520600,Wed Jan 16 04:45:35 +0000 2019,@heatherscope @POTUS True -- maybe it's the White House staff's way of preventing POTUS from bringing cameras into… https://t.co/dQLP2Q58JJ
1085389748955480000,Wed Jan 16 04:14:16 +0000 2019,The trend of @POTUS holding shutdown negotiations in the Situation Room continues: he'll meet there tomorrow with t… https://t.co/2vGTaAUBya
1085325090412261400,Tue Jan 15 23:57:20 +0000 2019,@FuMikechu Should work better on desktop or with the Google Docs app.
1085322625767915500,Tue Jan 15 23:47:32 +0000 2019,ANNOUNCED: Castro, Delaney, Gabbard, Ojeda EXPLORING: Gillibrand, Warren https://t.co/MWvOcauAAK https://t.co/3BDi2K5gPf
1085317764129148900,Tue Jan 15 23:28:13 +0000 2019,New York Sen. Kirsten Gillibrand tells Colbert: "I'm filing an exploratory committee for President of the United St… https://t.co/ZkcjQNCEqI
1085294121361834000,Tue Jan 15 21:54:16 +0000 2019,RT @rachaelmbade: NEW: Embattled Acting AG Matt Whitaker will testify before Congress on Feb. 8, courtesy of Judiciary Chair @RepJerryNadle…
1085294068320620500,Tue Jan 15 21:54:04 +0000 2019,Interesting: @SecondLady Karen Pence is now teaching art classes twice a week at an elementary school in Northern V… https://t.co/fD2lZAKzga
1085293503419203600,Tue Jan 15 21:51:49 +0000 2019,Interesting insight into what goes into crafting a presidential campaign logo (if this really was created by Klobuc… https://t.co/zMqhkVzuHa
1085169552869281800,Tue Jan 15 13:39:17 +0000 2019,One of those days when it's hard to know what to make your lead story... Lots of news in today's Wake Up To Politic… https://t.co/9CS76T3bGC
1085045825963724800,Tue Jan 15 05:27:38 +0000 2019,Amazing piece of history I did not know: at William Saxbe's confirmation hearing to become Attorney General during… https://t.co/JBvawGiLIo
1085025181507166200,Tue Jan 15 04:05:36 +0000 2019,@brianstelter @tvnewser I loved reading this! So cool to see what you were able to accomplish while still a student… https://t.co/rXsD45OWGK
1084981552096788500,Tue Jan 15 01:12:14 +0000 2019,RT @mikedebonis: NEW: @GOPLeader to reporters -- "We will not be seating Steve King on any committees in the 116th Congress."
1084803293535240200,Mon Jan 14 13:23:54 +0000 2019,Wake Up To Politics - January 14, 2019 - https://t.co/dpx4Yo1mv4
1084656860278517800,Mon Jan 14 03:42:02 +0000 2019,RT @markberman: “I just went to bed and hoped I’d wake up.” What an utter nightmare. https://t.co/XitNcefjLK
1084146261475889200,Sat Jan 12 17:53:05 +0000 2019,His campaign will be chaired by his brother, Rep. @JoaquinCastrotx, and top aides include former Obama Iowa state d… https://t.co/HBJD7hHJI8
1084146260427374600,Sat Jan 12 17:53:05 +0000 2019,Breaking -- Former HUD Secretary @JulianCastro just now: "I am a candidate for President of the United States of Am… https://t.co/i7ikx7hhXu
1083954019687690200,Sat Jan 12 05:09:11 +0000 2019,DAY 22: The U.S. government is now in the midst of its longest shutdown in history. https://t.co/Yu2r2Ekni9
