id,created_at,text
1227423357324464000,Wed Feb 12 02:45:07 +0000 2020,RT @Grace_Segers: Amy Klobuchar is addressing a very enthusiastic crowd of supporters.  "Hello, America. I'm Amy Klobuchar and I will beat…
1227411100989304800,Wed Feb 12 01:56:25 +0000 2020,Reminder: In the modern era, no one has ever won a presidential nomination without finishing in the top two in Iowa or New Hampshire.
1227406930089521200,Wed Feb 12 01:39:50 +0000 2020,Bennet’s exit will probably have more reverberations inside the New York Times — where his brother James can now re… https://t.co/3N9TTSE64l
1227405692836905000,Wed Feb 12 01:34:55 +0000 2020,Breaking: Colorado Sen. Michael Bennet is expected to become the second 2020 contender to end his campaign tonight.… https://t.co/8qRjDHtp5A
1227404836066537500,Wed Feb 12 01:31:31 +0000 2020,Only Sanders, Buttigieg, and Klobuchar are poised to cross the 15% threshold to get statewide delegates — and it’s… https://t.co/0EPiKLVRZe
1227400855525220400,Wed Feb 12 01:15:42 +0000 2020,RT @Redistrict: The three major center/left candidates so far (Buttigieg, Klobuchar, Biden): 53%  Sanders/Warren: 36%  But, the first group…
1227400365685039000,Wed Feb 12 01:13:45 +0000 2020,And Cory Booker and Kamala Harris for dropping out. Both had pinned their hopes on Biden cratering -- but couldn't… https://t.co/tdrsQzmf9z
1227398550184702000,Wed Feb 12 01:06:32 +0000 2020,And the 2020 field is finally beginning to winnow, as entrepreneur Andrew Yang reportedly prepares to end his presi… https://t.co/PsfhdaVXEb
1227398283917656000,Wed Feb 12 01:05:29 +0000 2020,Polls are now closed across New Hampshire. With 14% of precincts reporting, Sanders is in the lead at 28.3%. Buttig… https://t.co/Ugax52W2YC
1227360842456367000,Tue Feb 11 22:36:42 +0000 2020,RT @nycsouthpaw: All four line prosecutors who signed the original Roger Stone sentencing recommendation for 7-9 years incarceration have w…
1227352129318334500,Tue Feb 11 22:02:05 +0000 2020,RT @brianstelter: To see the DOJ reversing course on a sentencing recommendation after the president publicly protested the rec: "I've been…
1227263104431657000,Tue Feb 11 16:08:20 +0000 2020,On the eve of his expected New Hampshire victory, Bernie Sanders has moved into the lead in the RealClearPolitics n… https://t.co/f4RM6TmWNu
1227224276408860700,Tue Feb 11 13:34:02 +0000 2020,Wake Up To Politics: New Hampshire primary guide - https://t.co/XXp7mxxGdI
1226998290505400300,Mon Feb 10 22:36:03 +0000 2020,RT @DavidWright_7: In the first Quinnipiac University poll that included Michael Bloomberg, he was at 3%. In the Quinn. poll out today, Blo…
1226991646572777500,Mon Feb 10 22:09:39 +0000 2020,Kinda feels like MSNBC is throwing some shade at Iowa with the “first big night of 2020” line https://t.co/wtaBSsJxmW
1226865670064922600,Mon Feb 10 13:49:04 +0000 2020,Wake Up To Politics: Dem campaigning turn negative in New Hampshire - https://t.co/jpFfMXmvFS
1226864220853227500,Mon Feb 10 13:43:18 +0000 2020,Thread. The layers of blunders cataloged here are mind-boggling. https://t.co/7Ito9uQtvT
1226732555313000400,Mon Feb 10 05:00:07 +0000 2020,24 hours until voting begins in Hart’s Location and Dixville Notch! #FITN https://t.co/iLPswQ4HJE
1226670173400240000,Mon Feb 10 00:52:14 +0000 2020,@LaviniaHilltopp @PeteButtigieg @BernieSanders @ewarren @JoeBiden @amyklobuchar https://t.co/TfiNM7VgZG
1226670037412597800,Mon Feb 10 00:51:42 +0000 2020,@Rys0nburger @PeteButtigieg @BernieSanders @ewarren @JoeBiden @amyklobuchar Here is the formulas Democrats use for… https://t.co/mr2YeSbs8h
1226649463579693000,Sun Feb 09 23:29:56 +0000 2020,@PeteButtigieg @BernieSanders @ewarren @JoeBiden @amyklobuchar Clarification: The IDP *reviewed* 95 precincts, but… https://t.co/7yhj2BV6AA
1226648885965271000,Sun Feb 09 23:27:39 +0000 2020,@PeteButtigieg @BernieSanders @ewarren @JoeBiden @amyklobuchar Here are the updated SDE totals after the correction… https://t.co/BbFKJpRQnO
1226647794422866000,Sun Feb 09 23:23:18 +0000 2020,After correcting the results in 95 precincts, the Iowa Democratic Party has announced the national delegate allocat… https://t.co/QDdf8zJjnT
1226570190814695400,Sun Feb 09 18:14:56 +0000 2020,RT @gdebenedetti: was just thinking back to the Sanders team's analysis of how 2020 would likely look, from 2+ years ago, and, yeah... (fro…
1226198101054120000,Sat Feb 08 17:36:23 +0000 2020,RT @jeneps: brutal Biden video comparing his and the Obama administration’s accomplishments to Pete Buttigieg’s work in South Bend
1226180895985541000,Sat Feb 08 16:28:01 +0000 2020,RT @Redistrict: If this race ever were to come down to Sanders vs. Bloomberg, count me skeptical Biden/Buttigieg/Klobuchar voters would coa…
1225842260295573500,Fri Feb 07 18:02:24 +0000 2020,@manytreadles Thanks, Barb! The latest episode (on gerrymandering) just dropped today -- new episodes will be comin… https://t.co/GQpTJIaNgr
1225842001163063300,Fri Feb 07 18:01:22 +0000 2020,@Pat_Hirigoyen @1a Thanks for listening!
1225840663050064000,Fri Feb 07 17:56:03 +0000 2020,RT @SamWangPhD: Great fun talking with Gabe Fleisher! Tune in to Wake Up To Politics: https://t.co/rNrVf8beRN
1225826227275128800,Fri Feb 07 16:58:41 +0000 2020,RT @scottdetrow: 5,000 more than 2016 is not what any Iowa Democrat was hoping for, to put it mildly.
1225795631589011500,Fri Feb 07 14:57:07 +0000 2020,It’s been quite a week in politics. Looking forward to breaking it down with @katierogers, @JessicaTaylor, and… https://t.co/Rj76IP2pkw
1225781134270791700,Fri Feb 07 13:59:30 +0000 2020,Looking for something to listen to this morning? How about the latest episode of the Wake Up To Politics Podcast!… https://t.co/EcaSZYPcoW
1225778260358856700,Fri Feb 07 13:48:05 +0000 2020,2020 Democrats face off in New Hampshire as the chaos in Iowa drags on. President Trump celebrates his acquittal by… https://t.co/HPy8vZ0g92
1225413941905502200,Thu Feb 06 13:40:25 +0000 2020,Wake Up To Politics: Senate acquits Trump, Sanders gaining on Buttigieg in Iowa https://t.co/NzCJsgjToY
1225286146445496300,Thu Feb 06 05:12:36 +0000 2020,RT @SteveKornacki: So with that update, there is now 96.8% reporting and: - Sanders leads the first preference vote by 5,954 (3.4%) - Sande…
1225237042906456000,Thu Feb 06 01:57:29 +0000 2020,RT @jeneps: With 92% of precincts reporting, the state delegate equivalent race between Buttigieg and Sanders remains within 1 percentage p…
1225188321829310500,Wed Feb 05 22:43:53 +0000 2020,@benrileysmith Romney told @mckaycoppins that he won't vote for Trump in 2020, hinting that he would instead cast a… https://t.co/TkdN13DJWA
1225180857050321000,Wed Feb 05 22:14:13 +0000 2020,Updated results from Iowa, with 86.1% of precincts reporting:  State delegate equivalents — Buttigieg 26.7% — Sande… https://t.co/pY0NaCo59Y
1225175406728315000,Wed Feb 05 21:52:34 +0000 2020,@Patriot_Pat1 It appears not. Just deleted and will re-post when the corrected results come in. My bad.
1225173001278312400,Wed Feb 05 21:43:00 +0000 2020,The Senate has adjourned as a Court of Impeachment. The trial is officially over.
1225171588452143000,Wed Feb 05 21:37:23 +0000 2020,RT @JessicaTaylor: RATINGS CHANGE at @CookPolitical: #ALSen @SenDougJones moves from Toss-Up to Lean Republican, making it the first to mov…
1225170619639238700,Wed Feb 05 21:33:32 +0000 2020,Breaking: The Senate has voted to acquit President Donald Trump on the second article of impeachment, over obstruct… https://t.co/AorCKP3SaL
1225167049145704400,Wed Feb 05 21:19:21 +0000 2020,Breaking: The Senate has voted to acquit President Donald Trump on the first article of impeachment, over abuse of… https://t.co/R2UVlKq60P
1225142711247917000,Wed Feb 05 19:42:39 +0000 2020,RT @Bencjacobs: The two biggest rebukes that Trump has received from Capitol Hill Republicans have come from his party’s presidential nomin…
1225136508165939200,Wed Feb 05 19:18:00 +0000 2020,Mitt Romney will be the first senator in U.S. history to vote to convict a president of his own political party. https://t.co/vSzJKDr4HJ
1225135506943565800,Wed Feb 05 19:14:01 +0000 2020,Romney will vote to convict Trump on the first article of impeachment (abuse of power) but to acquit on the second… https://t.co/OfPC8YJYQp
1225134137524269000,Wed Feb 05 19:08:34 +0000 2020,ROMNEY: "The president is guilty of an appalling abuse of public trust." He called Trump's actions a "flagrant assa… https://t.co/QSbhxh3sOn
1225133523495018500,Wed Feb 05 19:06:08 +0000 2020,Breaking: @SenatorRomney will vote to convict President Trump on abuse of power, @mckaycoppins reports. Romney is s… https://t.co/8459ZYVtLX
1225129483482599400,Wed Feb 05 18:50:05 +0000 2020,The often-petty nature of the relationship between the two most powerful politicians in America has been something… https://t.co/5RsvKcGQkY
1225129221678424000,Wed Feb 05 18:49:02 +0000 2020,In the past year of divided government, Trump and/or Pelosi have: — traded insults — stormed out of meetings — bloc… https://t.co/oDZJU9k52l
1225120286208643000,Wed Feb 05 18:13:32 +0000 2020,RT @GovernorTomWolf: https://t.co/QM9COehNfI
1225113939295592400,Wed Feb 05 17:48:19 +0000 2020,Here is more of what Biden said, going after Sanders and Buttigieg in his starkest terms yet. He also doubled down… https://t.co/LXer8VLhcp
1225113028267561000,Wed Feb 05 17:44:42 +0000 2020,It is always fascinating to see how defeat changes politicians, often unshackling them and making them more authent… https://t.co/3UnZJXv1MP
1225106294534746000,Wed Feb 05 17:17:56 +0000 2020,RT @Nate_Cohn: Is there a worse outcome for the future of the Iowa caucus than this? --failure to report the vote  --a second alignment-SDE…
1225053543440298000,Wed Feb 05 13:48:19 +0000 2020,State of the Union, Iowa, impeachment: oh my! https://t.co/JouZAum4Rw
1224879717305766000,Wed Feb 05 02:17:36 +0000 2020,RT @JakeSherman: the back and forth in the chamber — Dems hissing, and Republicans  screaming quite loud to applause the president seemingl…
1224877166275498000,Wed Feb 05 02:07:28 +0000 2020,Speaker Pelosi just introduced President Trump for his #SOTU address. When he handed her a copy of the speech, Pelo… https://t.co/Z8PUUT91O9
1224873441435816000,Wed Feb 05 01:52:40 +0000 2020,One question heading into Trump’s #SOTU address tonight: how will he and Pelosi interact on the dais? They haven’t… https://t.co/7HdPAHJP4V
1224860046745645000,Wed Feb 05 00:59:26 +0000 2020,RT @geoffreyvs: In case you're wondering about congressional district delegate projections, here's what those look like based on the precin…
1224856353983860700,Wed Feb 05 00:44:46 +0000 2020,In a sign of the times, probably the most impactful endorser in the caucus race was a first-term out-of-state celeb… https://t.co/H9m8B8lVVo
1224855554163642400,Wed Feb 05 00:41:35 +0000 2020,How much weight do endorsements hold in 2020?  Bernie Sanders, leading popular vote in IA, didn't have any support… https://t.co/SrrUV66bMl
1224836702331703300,Tue Feb 04 23:26:40 +0000 2020,RT @adamwren: If Iowa results hold, what Pete Buttigieg did in 12 months is one of the wildest stories in American political history.
1224819352542859300,Tue Feb 04 22:17:44 +0000 2020,First alignment numbers from the Iowa caucuses (with 62% reporting):   @BernieSanders - 27,088 @PeteButtigieg - 23,… https://t.co/2nC9M1sxuV
1224818403124400000,Tue Feb 04 22:13:57 +0000 2020,And here is the popular vote tally from the final alignments (with 62% reporting):   @BernieSanders - 28,220… https://t.co/VlpWHPIABX
1224817345757094000,Tue Feb 04 22:09:45 +0000 2020,With 62% of precincts reporting, here are the first results from Iowa, as percentage of state delegates equivalents… https://t.co/jAgwgwLnkQ
1224803436048158700,Tue Feb 04 21:14:29 +0000 2020,RT @JakeSherman: SEN. SUSAN COLLINS will vote to acquit the president on both counts.
1224786965821821000,Tue Feb 04 20:09:02 +0000 2020,@mrobert42 This solution makes sense to me, especially with rotation among the regions each cycle
1224772796661796900,Tue Feb 04 19:12:44 +0000 2020,I understand a lot of these counter arguments, but IMO most of them — it would favor candidates with most $/name ID… https://t.co/SqbwaH9vAW
1224770724323381200,Tue Feb 04 19:04:30 +0000 2020,RT @TimSLloyd: Yes, the Iowa Caucuses are officially over. But as questions mount over how, or if, the process should move forward...the fi…
1224749038823755800,Tue Feb 04 17:38:20 +0000 2020,The Iowa caucuses are gonna go on forever, aren’t they? https://t.co/9OMtOHil6V
1224747396120416300,Tue Feb 04 17:31:48 +0000 2020,RT @MauraBarrettNBC: The Iowa Democrats will release a “majority” of the results tonight by 4pCT/5pET
1224729119042261000,Tue Feb 04 16:19:11 +0000 2020,@gabemschneider @swin24 @lachlan The power of Gabes knows no limits
1224703758933860400,Tue Feb 04 14:38:24 +0000 2020,@clarkstopppp Doesn’t the current system do that too?
1224703048020373500,Tue Feb 04 14:35:35 +0000 2020,What are the arguments against a national primary day? Go.
1224697317267267600,Tue Feb 04 14:12:48 +0000 2020,RT @natashakorecki: “This fiasco means the end of the caucuses as a significant American political event." the legendary former Des Moines…
1224691128399691800,Tue Feb 04 13:48:13 +0000 2020,RT @daveweigel: A completely sincere thought: Thousands of totally well-meaning people spent a year of their lives working for candidates a…
1224690731413012500,Tue Feb 04 13:46:38 +0000 2020,What in the world happened in Iowa last night? Read Wake Up To Politics to catch up on the caucus chaos: https://t.co/ZN2JFLSrO0
1224565544252321800,Tue Feb 04 05:29:11 +0000 2020,So if a mistake in collecting the votes undermines the entire data set... does that mean Ann Selzer correctly predi… https://t.co/SP7vE1WNbI
1224558018668515300,Tue Feb 04 04:59:17 +0000 2020,RT @MariannaNBCNews: NEW: @JoeBiden's campaign general counsel slams the Iowa Democratic Party, claiming that caucus chairs "are attempting…
1224555610487869400,Tue Feb 04 04:49:43 +0000 2020,Anyone else noticing a trend? https://t.co/nyLz7VFRJx
1224551380184182800,Tue Feb 04 04:32:54 +0000 2020,It's 2024. How does Iowa pick presidential nominees?
1224550831355310000,Tue Feb 04 04:30:43 +0000 2020,RT @MollyNagle3: NEW:  @iowademocrats say they found “inconsistencies in the reporting of three sets of results” and are using tech, photos…
1224549452674949000,Tue Feb 04 04:25:15 +0000 2020,Reminder...  2016 Iowa caucus voter turnout: 16% 2016 New Hampshire primary voter turnout: 52% https://t.co/pDIv54ttbY
1224546921462845400,Tue Feb 04 04:15:11 +0000 2020,(The state party promptly hung up on the precinct secretary.)
1224546456251641900,Tue Feb 04 04:13:20 +0000 2020,A precinct secretary just confirmed on CNN that they are being asked to individually phone in results to a party ho… https://t.co/XAtwW65tiU
1224546105461026800,Tue Feb 04 04:11:57 +0000 2020,RT @benpershing: "If the app doesn't work, either because a denial of service attack clogs the system or for any other reason, then there c…
1224545536210018300,Tue Feb 04 04:09:41 +0000 2020,Gen Z has spoken. https://t.co/0SbgTFTbuU
1224544665631887400,Tue Feb 04 04:06:13 +0000 2020,NPR first reported on the IDP reporting app last month, noting the wide range of vulnerabilities it posed, from cyb… https://t.co/BeFaOxxpum
1224540452923302000,Tue Feb 04 03:49:29 +0000 2020,RT @rubycramer: There is technical issue with Iowa results reporting. Hearing from multiple campaigns that the Iowa Democratic Party is sen…
1224537999775539200,Tue Feb 04 03:39:44 +0000 2020,At this point on caucus night four years ago, returns were in from 85% of Iowa precincts. (We currently have final… https://t.co/x68HNLKdnV
1224535102979498000,Tue Feb 04 03:28:13 +0000 2020,One guess at what Iowa Dems might mean by “quality control”... and a reminder of the manifold flaws in the caucus s… https://t.co/rrA2RSyTLZ
1224530991219454000,Tue Feb 04 03:11:53 +0000 2020,RT @laurenpeikoff: .@SteveKornacki just read a statement from the Iowa State Democratic Party on @MSNBC -- the party says it's doing "quali…
1224498169200947200,Tue Feb 04 01:01:28 +0000 2020,It’s 7pm here in the Central Time Zone, and the 2020 Iowa presidential caucuses are now underway.   Iowans will be… https://t.co/2dwzGjBg9L
1224474080293900300,Mon Feb 03 23:25:45 +0000 2020,@sarahfenske @STLonAir Thanks, Sarah! It was great talking to you this morning. I’m so happy to be part of the @stlpublicradio team!
1224442048398291000,Mon Feb 03 21:18:28 +0000 2020,@ArjavRawal Thanks, Arjav!
1224422121532686300,Mon Feb 03 19:59:17 +0000 2020,@HowardMortman Thanks so much for reading, Howard!
1224421865088831500,Mon Feb 03 19:58:15 +0000 2020,RT @HowardMortman: ... a quick final day appreciation to @WakeUp2Politics for covering the weeks/months/years leading to today's Iowa presi…
1224421843089678300,Mon Feb 03 19:58:10 +0000 2020,RT @JStein_WaPo: Ahead of Iowa, please read @washingtonpost's extensive series of policy questionnaires for all the Democratic presidential…
1224371879907156000,Mon Feb 03 16:39:38 +0000 2020,Which reminds me: I've been reading Theodore White's "Making of the President 1960" &amp; apparently IBM created a pre-… https://t.co/IZXankZltW
1224369626647355400,Mon Feb 03 16:30:41 +0000 2020,Four times the election results, four times the needles https://t.co/v4B14WApf4
1224346190113841200,Mon Feb 03 14:57:33 +0000 2020,Looking forward to talking about the new podcast and the Iowa caucuses on @STLonAir in a few minutes. St. Louis fri… https://t.co/HqjCpCZBwt
1224328397129703400,Mon Feb 03 13:46:51 +0000 2020,The Iowa Caucus edition of Wake Up To Politics is in inboxes now. Happy Caucus Day! https://t.co/A3QVyPwVZO
1224084970668544000,Sun Feb 02 21:39:34 +0000 2020,RT @daveweigel: Random fact: All five of the leading Dems in Iowa are married to educators.   Jane Sanders (former college president), Bruc…
1224001171465146400,Sun Feb 02 16:06:34 +0000 2020,As an aside, one of the funnier moments from the trip: Taking a seat on the tram in The Hague one day and realizing… https://t.co/a1M8er4C4T
1224000729947476000,Sun Feb 02 16:04:49 +0000 2020,And if you’re still looking for help navigating exactly how Monday’s complicated caucuses will work, consider liste… https://t.co/bygtmUvA2a
1224000012415389700,Sun Feb 02 16:01:58 +0000 2020,Wake Up To Politics will be back in your inboxes on Monday, ready to cover the Iowa caucuses (!) and the close of t… https://t.co/dx5UcjwoOT
1224000010775339000,Sun Feb 02 16:01:58 +0000 2020,Just got back from The Hague after an amazing trip participating in an international Model UN conference.  I spent… https://t.co/rxbeDqca7m
1220732759934754800,Fri Jan 24 15:39:04 +0000 2020,I hope my @washingtonpost friends note the “Democracy Dies in Darkness” t-shirt! @danbalz @ktumulty @RuthMarcus https://t.co/xJP6c6EUh9
1220732409714565000,Fri Jan 24 15:37:41 +0000 2020,@Clay_Masters Thanks again for joining our first episode, Clay!
1220731373503369200,Fri Jan 24 15:33:34 +0000 2020,RT @stlpublicradio: In the first episode of the Wake Up To Politics podcast, Gabe talks w/ reporter @Clay_Masters &amp; Iowa State Auditor @Rob…
1220730869599625200,Fri Jan 24 15:31:34 +0000 2020,@TimSLloyd @welivehereSTL So proud to be part of the @stlpublicradio pod squad!
1220709570768724000,Fri Jan 24 14:06:56 +0000 2020,@EveryFreyday @stlpublicradio @Clay_Masters @RobSandIA Thanks for reading and listening!
1220709038863868000,Fri Jan 24 14:04:49 +0000 2020,RT @wayneradio: We've rolled out a new podcast today @stlpublicradio. Wake Up to Politics examines the inner workings of American politics.…
1220701849570943000,Fri Jan 24 13:36:15 +0000 2020,The first episode of the Wake Up To Politics Podcast, a partnership with @stlpublicradio, is here.   In the episode… https://t.co/Dgz9XHxt1I
1220579643209719800,Fri Jan 24 05:30:38 +0000 2020,RT @HotlineJosh: Jim Lehrer's rules of journalism: https://t.co/c1NYYxBQxP
1220571946997469200,Fri Jan 24 05:00:03 +0000 2020,RT @Clay_Masters: By way of full disclosure: I am NOT in a deer stand with @RobSandIA in THIS podcast.
1220517353768865800,Fri Jan 24 01:23:07 +0000 2020,Kamala Harris is considering an endorsement of Joe Biden, per ⁦@jmartNYT⁩, a move that could position her for a spo… https://t.co/WHkdiaJAZf
1220516743468200000,Fri Jan 24 01:20:42 +0000 2020,RT @kasie: The Senate Press Gallery is literally the only way Americans are able to know what’s going on on the floor of their US Senate wi…
1220511129753018400,Fri Jan 24 00:58:23 +0000 2020,Hey, the first episode of my podcast will also be dropping tomorrow!  It will be about the Iowa caucuses, ft.… https://t.co/WWnqelXKLg
1220510491707150300,Fri Jan 24 00:55:51 +0000 2020,RT @burgessev: New with @BresPolitico   Three Republicans seem possible votes for new witnesses. The swing vote everyone is watching? Retir…
1220493076159959000,Thu Jan 23 23:46:39 +0000 2020,RT @ryanjreilly: Senators are getting pretty lax on attendance as the impeachment trial drags on. At one point I counted 14 empty seats on…
1220475883208761300,Thu Jan 23 22:38:20 +0000 2020,@kathleenlenihan Nah, kids used to use them in classes when they were popular a few years ago
1220475196446072800,Thu Jan 23 22:35:36 +0000 2020,Everyone is stuck at their desks, not allowed to use their phones, and required to stay silent while someone lectur… https://t.co/VaRSzgZdGF
1220473295860064300,Thu Jan 23 22:28:03 +0000 2020,Richard Burr and Tom Cotton have been seen using fidget spinners on the Senate floor to pass time during the impeac… https://t.co/6MuMifDU8h
1220324434550186000,Thu Jan 23 12:36:32 +0000 2020,Wake Up To Politics: House Democrats make their case to the Senate https://t.co/HPZtm7r9Hc
1220213042979451000,Thu Jan 23 05:13:54 +0000 2020,@emmavpetite 🔥🔥🔥
1220161976044834800,Thu Jan 23 01:50:59 +0000 2020,I can neither confirm nor deny that I am the “Gabe” in question. From the new book by @swin24 &amp; @lachlan: https://t.co/umtvLPKCpd
1220138689784950800,Thu Jan 23 00:18:27 +0000 2020,Only three sitting presidents have ever testified before Congress: Abraham Lincoln (leak investigation), Woodrow Wi… https://t.co/iBXrnPClFL
1220135601976103000,Thu Jan 23 00:06:11 +0000 2020,RT @AndrewDesiderio: Chuck Grassley is currently the highest-ranking American on U.S. soil. https://t.co/1KD55wIeb0
1219978922739323000,Wed Jan 22 13:43:35 +0000 2020,Wake Up To Politics: Senate approves impeachment trial rules after bitter debate, Sanders-Biden feud continues https://t.co/CMhhons3YH
1219787858288029700,Wed Jan 22 01:04:22 +0000 2020,My favorite anecdote: "Sanders struggled to take a plastic wrapper off a box of mints or something similar. He even… https://t.co/Jy0xxCVXV3
1219787598283124700,Wed Jan 22 01:03:20 +0000 2020,Lots of great color in this piece by @ktullymcmanus on the gallery view of the members of the Senate — unaccustomed… https://t.co/l6cBhQyz46
1219784751206293500,Wed Jan 22 00:52:01 +0000 2020,RT @elainaplott: “Risch was the first lawmaker seen by Washington Post reporters to clearly have fallen asleep, about four hours after the…
1219690742781825000,Tue Jan 21 18:38:28 +0000 2020,RT @burgessev: Two big changes to McConnell resolution:  - two additional calendar days of open arguments  - House evidence automatically e…
1219614661911421000,Tue Jan 21 13:36:09 +0000 2020,Wake Up To Politics: Impeachment trial viewing guide, new Trump book - https://t.co/xIteHBJx6d
1219438759999045600,Tue Jan 21 01:57:11 +0000 2020,“On the one hand, every individual candidate has some flaw. On the other hand, in the aggregate, the candidates are… https://t.co/Jfmbiq3xHW
1219420001419120600,Tue Jan 21 00:42:38 +0000 2020,@Tony94556 @jaselzer Thank you!
1219340478686077000,Mon Jan 20 19:26:39 +0000 2020,RT @GeoffRBennett: I asked White House senior adviser Kellyanne Conway how Trump is observing King Day. Conway said, "Well, I can tell you…
1219336437524463600,Mon Jan 20 19:10:35 +0000 2020,@hischoolscotus @jaselzer Thanks, Anna! Hope your senior year is going well too.
1219329417018847200,Mon Jan 20 18:42:41 +0000 2020,RT @mlesemann: Good interview about #IowaCaucus
1219296803406958600,Mon Jan 20 16:33:06 +0000 2020,Today in Wake Up To Politics: I sit down with legendary Iowa pollster @jaselzer to discuss her "polling forward" ap… https://t.co/SGHs7FedKa
1218302986570563600,Fri Jan 17 22:44:01 +0000 2020,RT @ZachMontellaro: We have the thresholds for the Feb. 7 debate, per @kendallkarson  Option A: Get at least 1 delegate out of Iowa  Option…
1218204669585100800,Fri Jan 17 16:13:21 +0000 2020,RT @ABC: JUST IN: Former independent counsels Ken Starr and Robert Ray expected to join Pres. Trump's Senate impeachment trial legal team,…
1218164370422796300,Fri Jan 17 13:33:12 +0000 2020,Wake Up To Politics: Senators take their oaths as Ukraine scandal continues to unfold, USMCA approved by Congress https://t.co/GSz9gyN3aU
1217889002101059600,Thu Jan 16 19:19:00 +0000 2020,RT @dsamuelsohn: There’s an incredible thread on the Chief Justice front. Here’s a copy of William Rehnquist’s 1992 book “Grand Inquest” th…
1217801273912766500,Thu Jan 16 13:30:24 +0000 2020,Wake Up To Politics: Senate to open impeachment trial amid new Parnas revelations, CNN finds audio of Sanders-Warre… https://t.co/gMdRRUQfEW
1217655230831132700,Thu Jan 16 03:50:04 +0000 2020,RT @jdawsey1: “I certainly am not going to disavow them. I have no reason to doubt them. Everything I’ve known about them says they would n…
1217628319082074000,Thu Jan 16 02:03:08 +0000 2020,@alweaver22 cc @RAYGUNshirts
