id,created_at,text
1261054294876438500,Thu May 14 22:02:27 +0000 2020,AND in the mean time, catch up on some of the great shows we've done in the past few weeks...  Talking vote-by-mail… https://t.co/gPxW855z2j
1261053612337377300,Thu May 14 21:59:45 +0000 2020,Very excited to share the next episode of the WUTP podcast with you all tomorrow!  The episode explores the past &amp;… https://t.co/zqMIer7V9X
1260978000704741400,Thu May 14 16:59:17 +0000 2020,RT @seungminkim: BREAKING -- McConnell says Burr has agreed to step down as Intel chair "during the pendency of the investigation."   "We a…
1260941995511558100,Thu May 14 14:36:13 +0000 2020,Three million new jobless claims. Trump criticizes Fauci. Burr's cellphone seized. Biden unmasked Flynn. GOP wins s… https://t.co/rrhUXDzzwM
1260756790154854400,Thu May 14 02:20:17 +0000 2020,RT @timkmak: There have also been a number of other senators with suspicious stock market transactions.   I laid out here why Sen. Burr's t…
1260752199254188000,Thu May 14 02:02:02 +0000 2020,FBI agents seized a cellphone belonging to @SenatorBurr today as part of an investigation into stock trades he made… https://t.co/VDGupM995a
1260750316133388300,Thu May 14 01:54:33 +0000 2020,This is exactly the type of journalism I was proud to contribute to as editor of our school paper this past year.… https://t.co/KLWOFszVaM
1260748010969014300,Thu May 14 01:45:24 +0000 2020,Hard-hitting investigative piece from my school newspaper on the school’s decision to accept — and then return — a… https://t.co/Wj0mqUgQSt
1260747053023613000,Thu May 14 01:41:35 +0000 2020,@Subvet722 @clairecmc @AP “There were 9,217 unmasking requests in the 12-month period between September 2015 and Au… https://t.co/q8sxoeX78J
1260741057505083400,Thu May 14 01:17:46 +0000 2020,“While Trump casts unmasking as sinister, his administration has used the process more frequently than Obama’s.”  H… https://t.co/0kovzOWGED
1260715572540706800,Wed May 13 23:36:30 +0000 2020,RT @charlie_savage: Judge Sullivan appoints a former mafia prosecutor and retired EDNY district court judge as amicus to argue against Barr…
1260681104018804700,Wed May 13 21:19:32 +0000 2020,A group of Trump allies have urged WH chief of staff Mark Meadows to launch a task force aimed at reopening college… https://t.co/JRBsz4BO8q
1260674961259159600,Wed May 13 20:55:07 +0000 2020,RT @daveweigel: Some election trivia inspired by @Bencjacobs...  In the last 10 years, Rs have flipped D House seats in four special electi…
1260674267513045000,Wed May 13 20:52:22 +0000 2020,Breaking: Republican businessman Mike Garcia has won the #CA25 special election to succeed Kate Hill, as Democrat C… https://t.co/JtWq2o6HB1
1260651376838709200,Wed May 13 19:21:24 +0000 2020,RT @AndrewDesiderio: NEWS: Grenell has sent a list to Sens. Johnson/Grassley of former Obama administration officials who may have been inv…
1260592404492685300,Wed May 13 15:27:04 +0000 2020,RT @ZachMontellaro: Happening now: The Supreme Court is hearing two cases on faithless electors. The question posed is kinda interesting: C…
1260417105406689300,Wed May 13 03:50:30 +0000 2020,RT @Redistrict: If Mike Garcia (R)'s lead over Christy Smith (D) in #CA25 holds, and chances look pretty good it will, he'll become the onl…
1260384191826591700,Wed May 13 01:39:42 +0000 2020,RT @MariannaNBCNews: In an interview with @8NewsNow, @JoeBiden announces that @AOC is serving on the joint policy task force between his ca…
1260377554520866800,Wed May 13 01:13:20 +0000 2020,Some previous examples of Cheney rebuking Trump. She’s staked out an interesting spot in the party, criticizing the… https://t.co/tCMpcxtPto
1260375953668288500,Wed May 13 01:06:58 +0000 2020,Wyoming Rep. Liz Cheney, a member of House GOP leadership and certainly not a moderate, has consistently been one o… https://t.co/V0IsgNzukG
1260359733850112000,Wed May 13 00:02:31 +0000 2020,Wow: A new study suggests that more than 100,000 small businesses in the U.S. have permanently shut down since the… https://t.co/FMW1uarYDq
1260359156013424600,Wed May 13 00:00:13 +0000 2020,RT @ddale8: “...two television news hosts, a comedian, at least five former officials from the FBI and Justice Department, the state of Cal…
1260348278853513200,Tue May 12 23:17:00 +0000 2020,RT @jrosenbaum: There are many “what ifs” in Missouri politics but many believe Litton could have become Missouri’s second president had he…
1260348248314777600,Tue May 12 23:16:53 +0000 2020,RT @Brianontheair: Gabe's point is well-taken. The biggest difference between the two tragedies was that Congressman Litton died on the Aug…
1260333270551744500,Tue May 12 22:17:22 +0000 2020,@Brianontheair Pretty remarkable that in 25 years, two Missouri Senate nominees died in tragic plane crashes ahead of the elections.
1260332112848314400,Tue May 12 22:12:46 +0000 2020,@realcpaz @TheAtlantic Congratulations, Christian!!
1260316590358302700,Tue May 12 21:11:05 +0000 2020,This is one part of the reopening debate that I am watching especially closely, for obvious reasons...  After finis… https://t.co/The06Hta8S
1260315554902151200,Tue May 12 21:06:58 +0000 2020,California State University, the nation's largest four-year public university system, is canceling in-person classe… https://t.co/bwdEDAvtB2
1260300380119928800,Tue May 12 20:06:40 +0000 2020,@Coinbagger1 @brad_polumbo Not what I’m saying at all. I’m glad the daily briefings are back. That doesn’t mean the… https://t.co/fP3xbLsh45
1260299070582788000,Tue May 12 20:01:28 +0000 2020,@brad_polumbo I don't understand when airing press briefings in their entirety became the standard. Most outlets st… https://t.co/oke7cLRvSa
1260213655406338000,Tue May 12 14:22:03 +0000 2020,RT @PhilipRucker: A day after Trump proclaimed in the Rose Garden, “We have met the moment and we have prevailed,” Republican Lamar Alexand…
1260042145962041300,Tue May 12 03:00:32 +0000 2020,RT @HotlineJosh: Trump + RNC (April fundraising) = $61.7M Biden + DNC (April fundraising) = $60.5M  https://t.co/I9WTnmrxyS
1260041128142950400,Tue May 12 02:56:30 +0000 2020,This story by @clairemcneill perfectly captures what it's like to be a high school newspaper writer and editor — es… https://t.co/IGK8HA3k47
1260034345521168400,Tue May 12 02:29:32 +0000 2020,@jamepdx Thanks so much for sending them in, James!
1260026955975417900,Tue May 12 02:00:11 +0000 2020,When President Trump met with two dozen House Republicans on Friday — before the new White House guidance was issue… https://t.co/ulWJuF866E
1260026553238384600,Tue May 12 01:58:35 +0000 2020,New White House directive requires staffers to wear masks when entering the West Wing. Will that apply at President… https://t.co/rZ41HAo1sv
1259963973203644400,Mon May 11 21:49:54 +0000 2020,What is “this” referring to? The president is accusing his predecessor of committing “the biggest political crime i… https://t.co/CTf2iTuPIG
1259941355184414700,Mon May 11 20:20:02 +0000 2020,RT @meridithmcgraw: President Trump announced that $1 billion in funds have been approved and will be sent to state and tribal regions to i…
1259940870075420700,Mon May 11 20:18:06 +0000 2020,Here are charts showing which countries have conducted the most coronavirus tests, total and per 1,000 people, via… https://t.co/1iecdVvVBk
1259939615693320200,Mon May 11 20:13:07 +0000 2020,“America leads the world in testing,” signs behind podium proclaim.  (The United States has conducted more coronavi… https://t.co/68W78J6mVB
1259928324857528300,Mon May 11 19:28:15 +0000 2020,@elizabethcrisp @Newsweek Congratulations, Elizabeth!
1259925789748977700,Mon May 11 19:18:11 +0000 2020,Big change for the Trump White House, where almost no staffers have been wearing masks up until this point (despite… https://t.co/INlbgF2UMZ
1259852428012290000,Mon May 11 14:26:40 +0000 2020,Coronavirus has arrived in President Trump's orbit.But he is continuing his push to reopen the country anyways.   R… https://t.co/eoPZZHXZ5B
1259690550103588900,Mon May 11 03:43:25 +0000 2020,Per @ccadelago and @natashakorecki, the Biden campaign has begun vetting about a dozen women for the VP slot.  One… https://t.co/yWJFSHaRx4
1259678854647632000,Mon May 11 02:56:57 +0000 2020,@NilesGApol .@Anthony_Bergen wrote a whole book about presidents criticizing each other! https://t.co/tdU7IDc0XL https://t.co/WM0bboi91R
1259673567043694600,Mon May 11 02:35:56 +0000 2020,If my student body president says it, it must be true. Subscribe now! https://t.co/q9fOF19jof https://t.co/65Zt4T5D5A
1259652065283977200,Mon May 11 01:10:30 +0000 2020,RT @maggieNYT: People at WH are trying to maintain a face of calm, but a number are freaked out by the cases of COVID discovered in two aid…
1259641104909119500,Mon May 11 00:26:57 +0000 2020,The heads of the FDA and CDC, plus Fauci, have all said they are self-quarantining after being exposed to VP Pence’… https://t.co/E819M1VHS2
1259639456543527000,Mon May 11 00:20:24 +0000 2020,The Senate HELP Committee is holding a hearing on coronavirus Tuesday.  All four witnesses — FDA Commissioner, CDC… https://t.co/trIK7lTnVc
1259606789097697300,Sun May 10 22:10:35 +0000 2020,News: Vice President Mike Pence is self-isolating at home after his press secretary tested positive for coronavirus… https://t.co/zeVWOMWCY6
1258946166869328000,Sat May 09 02:25:30 +0000 2020,RT @megynkelly: MK EXCLUSIVE: The Tara Reade interview:  https://t.co/DyleHdwf3n
1258940007869550600,Sat May 09 02:01:02 +0000 2020,Two remarkable @nytimes front pages reflecting the unprecedented economic toll of the coronavirus.  Left: 3/27, sho… https://t.co/0p1cCpgk19
1258937424874520600,Sat May 09 01:50:46 +0000 2020,This is the third confirmed White House coronavirus case: President Trump’s valet, Vice President Pence’s press sec… https://t.co/exOq1cwFpZ
1258915044483530800,Sat May 09 00:21:50 +0000 2020,RT @jameshohmann: Katie Miller, who tested positive today, has attended nearly all of the White House coronavirus task force meetings, led…
1258914959574143000,Sat May 09 00:21:30 +0000 2020,Quite a dispatch from the coronavirus era, via ⁦@mckaycoppins⁩: https://t.co/Lr0Q7NUJ9Z
1258884938939732000,Fri May 08 22:22:13 +0000 2020,RT @ddale8: Trump: "We may be talking about 95,000 people, ultimately. We may be talking about something more than that."  Previous Trump e…
1258882443102294000,Fri May 08 22:12:17 +0000 2020,RT @ashleyfeinberg: after extensive research and analysis, i believe i have determined who did The Flush https://t.co/QoOyeQ0J37
1258831439120027600,Fri May 08 18:49:37 +0000 2020,Katie Miller, Vice President Mile Pence’s press Secretary and Stephen Miller’s wife, has tested positive for the co… https://t.co/qRxVdNaC0S
1258815912767099000,Fri May 08 17:47:55 +0000 2020,As you wait for Caro’s fifth and final Johnson time, I highly reccomend his recent memoir “Working,” which is packe… https://t.co/h6nIfiEAcP
1258807718560874500,Fri May 08 17:15:22 +0000 2020,RT @kaitlancollins: Per reporters traveling with Vice President Pence, the staffer with coronavirus wasn't on the trip today. Six who were…
1258807274463801300,Fri May 08 17:13:36 +0000 2020,It’s kind of crazy to read this list of stories in @playbookplus from THIS YEAR that, as @JakeSherman and… https://t.co/m3UprZJPPs
1258759093331902500,Fri May 08 14:02:09 +0000 2020,RT @byHeatherLong: BREAKING: The US unemployment rate is now 14.7%, the worst since the Great Depression and a massive spike from 3.5% in F…
1258752269128011800,Fri May 08 13:35:02 +0000 2020,Jobs report released. Michael Flynn charges dropped. Tara Reade speaks out.   Tons of ground to cover in Wake Up To… https://t.co/0pIaeftXsN
1258544422121136000,Thu May 07 23:49:07 +0000 2020,@richard_sheerr @ccadelago That is true, Biden isn’t named as the harraser. But the document does name Biden; it is… https://t.co/nb4IdGey2Y
1258543624335134700,Thu May 07 23:45:57 +0000 2020,@richard_sheerr @ccadelago https://t.co/3mxl5UGyPA
1258541837989511200,Thu May 07 23:38:51 +0000 2020,Noteworthy: @JoeBiden has said he’s not “going to attack” his accuser @ReadeAlexandra and emphasized that she has t… https://t.co/4CPCV2PE0S
1258538867302396000,Thu May 07 23:27:03 +0000 2020,RT @ccadelago: https://t.co/aya32fvFgO
1258534316012826600,Thu May 07 23:08:58 +0000 2020,Reporters are trained not to believe *anyone* without corroboration ("if your mother says she loves you, check it o… https://t.co/F51XuIuNaJ
1258533605560610800,Thu May 07 23:06:08 +0000 2020,That being said, as she writes, the standard that the media holds itself to is different than the standard many Dem… https://t.co/0rhPzfIj79
1258532430736064500,Thu May 07 23:01:28 +0000 2020,One thing @lkmcgann demonstrates here that critics of the media miss: reporting is not as simple as hearing an alle… https://t.co/rHokCN8Dek
1258508500793098200,Thu May 07 21:26:23 +0000 2020,RT @PhilipRucker: "It is highly unusual for the Justice Department to seek to undo a guilty plea, and comes just months after AG Barr press…
1258474042639736800,Thu May 07 19:09:27 +0000 2020,Since his guilty plea, Flynn and his conservative allies have long argued that he was entrapped into lying to the F… https://t.co/z0RIiyBl7Y
1258470653226877000,Thu May 07 18:55:59 +0000 2020,In one of his few public appearances since pleading guilty,  Flynn visited St. Louis last year. He delivered an agg… https://t.co/XECi6LctKn
1258469212001050600,Thu May 07 18:50:16 +0000 2020,Breaking: The Justice Department is dropping the criminal case against Michael Flynn, President Trump’s former nati… https://t.co/ygV0CVR7yV
1258446929085771800,Thu May 07 17:21:43 +0000 2020,RT @YAppelbaum: Senator, this is an Arby’s...
1258445128890495000,Thu May 07 17:14:34 +0000 2020,"Sen. Joe Manchin thought he was on mute when he swung through an Arby’s drive-through in Charleston, WV... Instead… https://t.co/wPW6MM5plw
1258440516301197300,Thu May 07 16:56:14 +0000 2020,@Jakejds3rd Kelly is no longer at Fox.
1258439165320081400,Thu May 07 16:50:52 +0000 2020,Biden accuser Tara Reade grants her first on-camera interview to Megyn Kelly —&gt; https://t.co/HiAgQa56TB
1258437296518574000,Thu May 07 16:43:26 +0000 2020,“Margaret — named for a character on the TV series ‘The West Wing’ who can forge the president’s signature...” cc @BradleyWhitford
1258436885535481900,Thu May 07 16:41:48 +0000 2020,Great piece by ⁦@Noahbierman⁩ on a bot that has analyzed every one of President Trump’s utterances.   Unlike most p… https://t.co/FCLuvWdUqS
1258428219658821600,Thu May 07 16:07:22 +0000 2020,Repeatedly in 2020, Biden has been dismissed and then made strategic moves that paid off — focusing on Super Tuesda… https://t.co/XzmS9aHFTy
1258427590928486400,Thu May 07 16:04:52 +0000 2020,As @jon_rauch wrote recently: “Amid the chatter about Joe Biden’s having lost a step or two, has anyone paused to n… https://t.co/8NxSsmfxY0
1258408970299019300,Thu May 07 14:50:53 +0000 2020,**move
1258406870018130000,Thu May 07 14:42:32 +0000 2020,RT @ElizLanders: This @MSNBC graphic is astounding https://t.co/Ix1uGABTDS
1258403071937446000,Thu May 07 14:27:27 +0000 2020,RT @nprpolitics: NEW: In a unanimous decision, the Supreme Court has overturned the convictions of key aides to New Jersey Gov. Chris Chris…
1258402512199200800,Thu May 07 14:25:13 +0000 2020,“The White House has continued to follow [the president’s] lead in referring to the coronavirus crisis in the past… https://t.co/na7PWp5mhM
1258402299908628500,Thu May 07 14:24:22 +0000 2020,ANALYSIS: Projecting victory, White House seeks to most past outbreak   Read more in this morning's edition of Wake… https://t.co/87ex3EgbFQ
1258203098113355800,Thu May 07 01:12:49 +0000 2020,(And if you're looking for more insight into how members of Gen Z view politics, check out my recent podcast episod… https://t.co/WKXcjqwqoX
1258202269679526000,Thu May 07 01:09:32 +0000 2020,A lot of interesting interviews with Generation Z Republicans in this @MaggieAstor piece. Many of them are not ideo… https://t.co/J9JYiK8xSl
1258199296006066200,Thu May 07 00:57:43 +0000 2020,Today I learned: Stacey Abrams' sister, Leslie Abrams Gardner, is a U.S. district judge in Georgia. Per @sahilkapur… https://t.co/1MiWfWjLBB
1258037588637646800,Wed May 06 14:15:08 +0000 2020,Wake Up To Politics: Two whistleblower memos detail haphazard coronavirus response - https://t.co/jOjDxDxlMI
1257834513859858400,Wed May 06 00:48:12 +0000 2020,Nancy Pelosi's governing philosophy, as reported by @mollyesque in her new book: “Does the president not understand… https://t.co/Ib5TTtianN
1257816308017741800,Tue May 05 23:35:51 +0000 2020,New: A federal judge has ordered the New York Democratic Party to reinstate its June 23 primary after a lawsuit by… https://t.co/JDdH5Bw23d
1257771179970003000,Tue May 05 20:36:32 +0000 2020,This will be Trump’s first interview with a broadcast network since doing @MeetThePress on June 23, 2019. He’s been… https://t.co/wBhf2HuZs8
1257762889756225500,Tue May 05 20:03:35 +0000 2020,RT @hannah_natanson: There are 6 summer intern bylines in this story package that was a @PulitzerPrizes finalist for Breaking News. I'm hon…
1257747175875981300,Tue May 05 19:01:09 +0000 2020,RT @dmccabe: The John Burroughs School near St. Louis has changed course and will not accept money it got through the PPP program, per its…
1257742846834155500,Tue May 05 18:43:57 +0000 2020,A scoop on the homefront. Many private high schools have come under pressure to return PPP loans, including from… https://t.co/txhhN754cJ
1257733357250711600,Tue May 05 18:06:14 +0000 2020,RT @noahweiland: News w/@maggieNYT @SangerNYT The White House's coronavirus task force is being wound down in the coming weeks without a cl…
1257691770441347000,Tue May 05 15:20:59 +0000 2020,RT @jmartNYT: The durability of the govs' bounce - even after a sustained death toll, their own missteps - is remarkable.  @CharlieBakerMA…
1257677270476640300,Tue May 05 14:23:22 +0000 2020,Models predict surge in U.S. virus deaths. Trump travels outside of D.C. bubble. Senate committees to grill key nom… https://t.co/zDxojmLYl2
1257502029913653200,Tue May 05 02:47:01 +0000 2020,"In the end, these moments highlight the hypocrisy of both parties," @maureendowd writes. "Each case has to stand o… https://t.co/hclRN5c5dp
1257485944560783400,Tue May 05 01:43:06 +0000 2020,@BrodyLevesque Took the words right out of my mouth! Thanks for listening and for sharing the podcast, Brody!
1257485750892888000,Tue May 05 01:42:20 +0000 2020,RT @BrodyLevesque: Also find @WakeUp2Politics on your Podcast App! Listen in as Gabe presents interesting guests, insightful commentary, an…
1257483186524819500,Tue May 05 01:32:09 +0000 2020,Having trouble navigating the coronavirus news cycle?  Sign up for Wake Up To Politics to recieve a “comprehensive… https://t.co/swVdOOQukU
1257481928137195500,Tue May 05 01:27:09 +0000 2020,Few states have seen the 14-day drop in coronavirus cases recommended by the CDC. But Trump is encouraging them to… https://t.co/6xxqHEtC55
1257433748506923000,Mon May 04 22:15:42 +0000 2020,RT @bites_media: LOVE this podcast episode from @WakeUp2Politics author (+H.S. senior) Gabe Fleisher w/ @CharlotteAlter. G&amp;C discuss how th…
1257376315889647600,Mon May 04 18:27:29 +0000 2020,Did lead to an early @KellyannePolls interaction tho https://t.co/84iAHhXiqF https://t.co/cQZKgltCnW
1257376050197278700,Mon May 04 18:26:25 +0000 2020,So much Cruz-Carly gear, so little time https://t.co/ncUQTIzjbh https://t.co/iyL9uR8WoW
1257374849112117200,Mon May 04 18:21:39 +0000 2020,Throwback to the six days of the Cruz-Fiorina ticket... https://t.co/G7r4s6RdLc
1257369345250013200,Mon May 04 17:59:47 +0000 2020,RT @mattholt33: What's interesting about Rice is that she cuts the same profile of the candidates who flipped a handful of swing districts…
1257368324238958600,Mon May 04 17:55:43 +0000 2020,RT @LauraLitvan: Office of the Secretary of the Senate says it has been advised it doesn't have the authority to release any Joe Biden reco…
1257368237148340200,Mon May 04 17:55:23 +0000 2020,One name mentioned in this story who hasn’t gotten as much #veepstakes attention as others: Susan Rice, an African-… https://t.co/kd5ze6FlrS
1257318504908259300,Mon May 04 14:37:46 +0000 2020,Today in Wake Up To Politics: An aging Senate returns to Washington, Trump increases his estimated death toll, insi… https://t.co/WE3Tb362pm
1257003234486620200,Sun May 03 17:44:59 +0000 2020,@timjeby @stlpublicradio Thanks for listening, Tim!
1257003202731540500,Sun May 03 17:44:52 +0000 2020,RT @timjeby: I’m listening to the @WakeUp2Politics podcast from @stlpublicradio: Generation Pandemic on my St. Louis Public Radio App! http…
1256677776448524300,Sat May 02 20:11:44 +0000 2020,RT @llerer: Tara Reade tells me she canceled the interview with Fox News because death threats received by her and her child made her nervo…
1256647687556010000,Sat May 02 18:12:10 +0000 2020,Tara Reade tells @AP that the complaint she filed with the Senate personnel office did not explicitly mention sexua… https://t.co/k4CgmZynGB
1256340646375207000,Fri May 01 21:52:06 +0000 2020,RT @Acosta: WH spox Judd Deere confirms WH blocking Fauci from testifying before House Appropriations next week: “it is counter-productive…
1256338075728244700,Fri May 01 21:41:53 +0000 2020,RT @JTHVerhovek: NEW: @JoeBiden sends letter to the Secretary of the Senate asking them to locate any record of Tara Reade's alleged compla…
1256337699591483400,Fri May 01 21:40:23 +0000 2020,Kim Jong Un made a public appearance today after a 20-day absence and rumors about his health, according to North K… https://t.co/X2ZWqPhnM5
1256324154401251300,Fri May 01 20:46:34 +0000 2020,@shiraberk @CharlotteAlter I’m glad you liked it, Shira! Thanks so much for sharing your voice memo!
1256324062801879000,Fri May 01 20:46:12 +0000 2020,@annecollier Thanks for sharing, Anne!
1256324016610005000,Fri May 01 20:46:01 +0000 2020,RT @annecollier: “Generation Pandemic,” the latest episode of Wake Up To Politics podcast, with Gen Z host Gabe Fleisher (@WakeUp2Politics)…
1256287898720239600,Fri May 01 18:22:30 +0000 2020,The White House plans to resume holding regular press briefings, @PressSec says in her podium debut.  And: “I will… https://t.co/wvso2XB6M4
1256255861351219200,Fri May 01 16:15:12 +0000 2020,“No complaint found,” the chairwoman of a pro-Biden super PAC says. But they haven’t looked for the complaint yet... https://t.co/Dnebo5v98L
1256240851614937000,Fri May 01 15:15:33 +0000 2020,RT @CharlotteAlter: Check it out! https://t.co/rEj8usBX89
1256232697179123700,Fri May 01 14:43:09 +0000 2020,RT @NicoleEinbinder: Joe Biden said that Tara Reade's complaint could only be at the National Archives, at what was then called the Office…
1256228395245097000,Fri May 01 14:26:03 +0000 2020,NEW POD: @CharlotteAlter and I discuss how the coronavirus pandemic has impacted young people and their political i… https://t.co/X4kvvCeIKx
1256223828721709000,Fri May 01 14:07:54 +0000 2020,Joe Biden breaks his silence and denies sexual assault allegation + more... catch up on the latest news in Wake Up… https://t.co/9zQDFbpwKo
1256072402825609200,Fri May 01 04:06:12 +0000 2020,The last time a White House press secretary held a briefing was March 11, 2019 — 417 days ago. https://t.co/PMOwWnLHbu
1256069500937568300,Fri May 01 03:54:40 +0000 2020,New: @PressSec Kayleigh McEnany will make her briefing room debut at 2pm Eastern Time tomorrow.  Her predecessor,… https://t.co/hJuoAy5U0A
1255997620037845000,Thu Apr 30 23:09:02 +0000 2020,RT @mattfleg: Deeply unsettled by the realization that Amy Klobuchar and Pete Buttigieg ended their 2020 bids *last month* and not 14 years…
1255944145597862000,Thu Apr 30 19:36:33 +0000 2020,"A lullaby for the soul during the coronavirus pandemic." So proud of my dad for everything he does to lift up his… https://t.co/RGbanOrAAC
1255921067979419600,Thu Apr 30 18:04:51 +0000 2020,“A state official...said New York entered into the contract with Oren-Pines at the direct recommendation of the Whi… https://t.co/oXRr8V2cyN
1255918396027351000,Thu Apr 30 17:54:14 +0000 2020,RT @markknoller: Wearing a face mask today, VP Pence tours GM plant manufacturing ventilators in Kokomo, IN. https://t.co/kCfw6S82Yp
1255899864115957800,Thu Apr 30 16:40:35 +0000 2020,@ecoesthy @benyt Reade said she had hoped to give an interview on a different network, but none reached out to her.
1255897676094341000,Thu Apr 30 16:31:54 +0000 2020,Tara Reade will do her first TV interview on Fox News this weekend. CNN and MSNBC haven’t contacted her about an on… https://t.co/dT167Ac5aC
1255867823898976300,Thu Apr 30 14:33:16 +0000 2020,Biden, Sanders camps just released joint memo announcing statewide delegates would be allocated to supporters of th… https://t.co/zDzArrMfg2
1255864917606961200,Thu Apr 30 14:21:43 +0000 2020,The latest on the unemployment figures, a new coronavirus treatment, Biden's VP search, and more — all in Wake Up T… https://t.co/S2KE0NopcN
1255710144136126500,Thu Apr 30 04:06:42 +0000 2020,Klobuchar and Buttigieg are currently squabbling over their comparative Scrabble skills on Colbert. The great feud… https://t.co/v0ANiuh3Bb
1255681057816490000,Thu Apr 30 02:11:08 +0000 2020,As far as I can tell, it may also be Trump’s first print interview of 2020. @HughHewitt urged the president to hold… https://t.co/C55Wk6EkYJ
1255679577759809500,Thu Apr 30 02:05:15 +0000 2020,Trump's first non-Fox interview since March 2, I believe https://t.co/8kWqnJhhFi
