id,created_at,text
1052184311192010800,Tue Oct 16 13:07:43 +0000 2018,Heading to LA to do "The Jump" for the week. Drank the last beer in the fridge last night. I guess the season is he… https://t.co/Mk9Es4eTUU
1052183035037343700,Tue Oct 16 13:02:38 +0000 2018,Last annual preview column: 37 Random, Crazy, Weird, and Some Not-So-Crazy Predictions for the 2018-19 NBA season: https://t.co/tumHM32XgW
1052176220962590700,Tue Oct 16 12:35:34 +0000 2018,Mike Greenberg (@Espngreeny) was kind enough to have me on his podcast, I'm Interested, to talk all things NBA. Rea… https://t.co/JhjH2No5zW
1052003016616935400,Tue Oct 16 01:07:19 +0000 2018,This is what you do when you really, really, really want to make sure someone is trade-able. Aaron Gordon's deal go… https://t.co/LiHBQK3nYu
1051941132538667000,Mon Oct 15 21:01:24 +0000 2018,Big number for Larry Nance, but I as wrote Friday, agents are almost never doing rookie scale extensions unless the… https://t.co/fxKt1oZqzC
1051926420488884200,Mon Oct 15 20:02:57 +0000 2018,Plot twist! Like the reported parameters fine for both sides. Optimistic Turner takes the step this season we expec… https://t.co/ClcE2DOfA1
1051881271683616800,Mon Oct 15 17:03:32 +0000 2018,ICYMI last week: Lowe Post podcast with Jeff Van Gundy previewing the season, and the Jimmy Butler situation (don't… https://t.co/K86nZ7BqUc
1051585447351279600,Sun Oct 14 21:28:02 +0000 2018,@KCJHoop Decent band name
1051546503603458000,Sun Oct 14 18:53:17 +0000 2018,Can't recall any situation like this, with everything out in the open. MIN w/ Butler healthy is a 50-ish-win team.… https://t.co/JNaoOxCYpR
1051111902426918900,Sat Oct 13 14:06:20 +0000 2018,Lowe Post podcast: Jeff Van Gundy on Jimmy Butler, and big questions for the NBA season: Who can challenge GSW? Did… https://t.co/X35RB0Kj6f
1050910702028947500,Sat Oct 13 00:46:50 +0000 2018,Experimented with it late last season, and it worked kinda well. Got a 10 Things mention. As exciting as Doncic is,… https://t.co/JGUuMaQe60
1050903988143628300,Sat Oct 13 00:20:10 +0000 2018,Also noted here: Delon Wright's agent is heading to Toronto for weekend meetings: https://t.co/VvEmbP5ijm
1050903863384006700,Sat Oct 13 00:19:40 +0000 2018,Extensions given leaning "yes" and "no" votes in this column: Winslow (check), Wright, Portis, Nance, Rozier, Turne… https://t.co/2ccCPigHVb
1050902686684594200,Sat Oct 13 00:14:59 +0000 2018,In light of Winslow news, this just went up: we decided to hold my annual 35 Crazy/Random/Weird Predictions column… https://t.co/8FxnTH3REX
1050822595426349000,Fri Oct 12 18:56:44 +0000 2018,@steventurous I am purely by accident wearing a Luka Modric jersey b/c I am a bandwagon fan.
1050818308348489700,Fri Oct 12 18:39:42 +0000 2018,Really enjoyed this from Tom https://t.co/KnLcXPYr2u
1050814105148448800,Fri Oct 12 18:23:00 +0000 2018,Lowe Post podcast: JVG returns to talk Jimmy Butler, and big questions for the upcoming season: Can anyone challeng… https://t.co/nz8zOogAqx
1050778667511664600,Fri Oct 12 16:02:11 +0000 2018,Quick note on JVG pod -- we recorded this a.m. before the Derrick White injury news broke. (We discuss him briefly). https://t.co/l2QSBTuiBc
1050775300483809300,Fri Oct 12 15:48:48 +0000 2018,Lowe Post podcast: Jeff Van Gundy and I on the Jimmy Butler situation, and big questions for the 2018-19 season: Wh… https://t.co/84Xu9qWrwQ
1050569411566989300,Fri Oct 12 02:10:41 +0000 2018,RT @sam_amick: My first long-form piece, at @TheAthleticInk... Landing LeBron: How Jeanie Buss became the ‘Mother of Dragons’ and spawned a…
1050406161776894000,Thu Oct 11 15:21:59 +0000 2018,ICYMI: Lowe Post podcast w/ @ikebarinholtz of "The Oath" (his new movie), Mad TV, Mindy Project, Blockers, much mor… https://t.co/qnQav0jw9T
1050219025333149700,Thu Oct 11 02:58:22 +0000 2018,What Up Beck on Kyrie: https://t.co/UM8dZvR4x8
1050175229358735400,Thu Oct 11 00:04:20 +0000 2018,This Butler practice is going to become an urban legend. "Remember when Butler, three guys from the sales office, a… https://t.co/wsBaofSsti
1050102889002295300,Wed Oct 10 19:16:53 +0000 2018,Is this like a Bansky public art installation or something? This is incredible even by NBA standards https://t.co/3CQdSiWfSA
1050101316264050700,Wed Oct 10 19:10:38 +0000 2018,What is even happening anymore? https://t.co/SaP0LqGwhh
1050083879435083800,Wed Oct 10 18:01:21 +0000 2018,I can't co-sign that last thing, but this show is indeed on television right now https://t.co/oVieguVXSo
1050079887577555000,Wed Oct 10 17:45:29 +0000 2018,Lowe Post podcast: @ikebarinholtz on his new movie "The Oath," undercutting a young Barack Obama, his comedy inspir… https://t.co/wumswoT9Um
1050058916351172600,Wed Oct 10 16:22:09 +0000 2018,@samesfandiari Love the late-career Kidd comparison. He was like a quarterback picking teams apart from 30 feet out… https://t.co/D7tdHL0X3u
1050057756361846800,Wed Oct 10 16:17:32 +0000 2018,Random thing from my column today -- every couple of weeks I think about this and triple-check to make sure it's tr… https://t.co/IEZeepLMRn
1050029140945064000,Wed Oct 10 14:23:50 +0000 2018,Subbing for one of the legends today https://t.co/T2wO2FALSS
1050018248194973700,Wed Oct 10 13:40:33 +0000 2018,Basketball gods bless the Wiz. Every year, like clockwork https://t.co/3sdFHFD6de
1050017003103080400,Wed Oct 10 13:35:36 +0000 2018,RT @WindhorstESPN: What would Kevin Love say if a star free agent called next summer to ask what it’s really like to play with LeBron James…
1050015290120114200,Wed Oct 10 13:28:48 +0000 2018,Next in my annual series of season preview pieces: the 9th Annual Tiers of the NBA -- my version of preseason power… https://t.co/qUelexzBEM
1050012136196501500,Wed Oct 10 13:16:16 +0000 2018,Lowe Post podcast: the very funny @ikebarinholtz on his new movie "The Oath," lifelong Bulls fandom, comedy heroes… https://t.co/6HU3aa4gpo
1049864964511592400,Wed Oct 10 03:31:27 +0000 2018,Now I remember why baseball is terrible -- you have all this time between pitches to think about the terrible thing… https://t.co/Z4lLpwOMKI
1049863979777105900,Wed Oct 10 03:27:32 +0000 2018,Getting flashbacks to when I cared way too much about what John Franco and Armando Benitez did in 9th innings.
1049819996954787800,Wed Oct 10 00:32:46 +0000 2018,@kpelton @olskool888 Big fan of his work.
1049790183095365600,Tue Oct 09 22:34:18 +0000 2018,Also involved: Marko Jaric somehow, plus John Paxson crashing a high school quiz bowl. https://t.co/Lwmu9exihY
1049782099207745500,Tue Oct 09 22:02:11 +0000 2018,Lowe Post podcast: @ikebarinholtz on his new movie "The Oath," his beloved Bulls, Mark Aguirre's ass (yup), comedy… https://t.co/9CjOZskkJi
1049774163186122800,Tue Oct 09 21:30:39 +0000 2018,Just recorded a super-fun podcast with @ikebarinholtz on his new movie "The Oath," comedy inspirations, being a lif… https://t.co/xFEzEnGvZt
1049405770247401500,Mon Oct 08 21:06:47 +0000 2018,Clear already this goes beyond McDonough. At least 3 members of PHX front office and scouting staff have also been… https://t.co/fGi4ZCN1JT
1049376114324459500,Mon Oct 08 19:08:56 +0000 2018,@paulscheer So wild to see this tweet. Thank you so much. My guest tomorrow comes from the comedy world, as it turns out.
1048963672054423600,Sun Oct 07 15:50:02 +0000 2018,RT @ZachLowe_NBA: Five Most Confusing Teams podcast w/ @kevinarnovitz: https://t.co/Y5MIBelUW8
1048310086748311600,Fri Oct 05 20:32:55 +0000 2018,Five Most Confusing Teams podcast w/ @kevinarnovitz: https://t.co/Y5MIBelUW8
1048224460732596200,Fri Oct 05 14:52:41 +0000 2018,@treykerby Wouldn't say that really. Gordon has a huge size advantage, and they played with rules that benefited hi… https://t.co/o13dymNikT
1048200926295707600,Fri Oct 05 13:19:10 +0000 2018,ICYMI: Lowe Post podcast: @kevinarnovitz and I pick our 5 Most Confusing Teams of the upcoming season. Also: which… https://t.co/Y8Afxgp2JR
1048199227187388400,Fri Oct 05 13:12:25 +0000 2018,@ikebarinholtz @washingtonpost I hope they didn't ask you for your take on Lauri Markkanen
1048198124655796200,Fri Oct 05 13:08:02 +0000 2018,Also in here: Gordon's Grand Gauntlet, an unfortunate lost football, and the Celtics king of ping-pong: https://t.co/9Fv7SOs9kA
1048196611002839000,Fri Oct 05 13:02:01 +0000 2018,"What I'm going through now is what I wanted to do in the summer, but it didn't work out that way." -- Gordon Haywa… https://t.co/0fzK8Lslql
1048195633184690200,Fri Oct 05 12:58:08 +0000 2018,The moment Gordon Hayward knew he was ready, how he passed the time during an arduous year to arrive there, and the… https://t.co/O651vV8Udc
1048028645292433400,Fri Oct 05 01:54:35 +0000 2018,RT @wojespn: ESPN reporting with @Zachlowe_NBA: In another example of the league's changing attitudes on gambling, the Dallas Mavericks are…
1047965504802046000,Thu Oct 04 21:43:41 +0000 2018,Lowe Post podcast: @kevinarnovitz and I continue our annual tradition of picking our 5 Most Confusing Teams for the… https://t.co/iyivCltuJa
1047929559692263400,Thu Oct 04 19:20:51 +0000 2018,On today's Lowe Post podcast, @kevinarnovitz and I independently picked our 5 Most Confusing Teams of the Season. W… https://t.co/Qf4wZT6kh0
1047914489520246800,Thu Oct 04 18:20:58 +0000 2018,Lowe Post podcast: The NBA is almost back, and in an annual tradition, @kevinarnovitz and I pick our Five Most Conf… https://t.co/VY0FmC4VmE
1047868385743261700,Thu Oct 04 15:17:46 +0000 2018,Coming today: @kevinarnovitz and I do our annual 5 Most Confusing Teams Lowe Post podcast.
1047648182807789600,Thu Oct 04 00:42:45 +0000 2018,About the see if I remember how to work the old DVR and see how Giannis looks in Bud's system.
1047591147919560700,Wed Oct 03 20:56:07 +0000 2018,Oh no, not again. https://t.co/X1afCTUkEC
1047494374739890200,Wed Oct 03 14:31:35 +0000 2018,@espn_macmahon Good use of take note. Hashtag Take Note
1047478892116811800,Wed Oct 03 13:30:03 +0000 2018,ICYMI: The 7th Annual League Pass Rankings, Part 1 (No. 30-16): https://t.co/Rhbg4q6LRw And Part II (top 15, includ… https://t.co/QLy0WuwnMG
1047215287588798500,Tue Oct 02 20:02:35 +0000 2018,The 2018-19 League Pass Rankings, Part II: https://t.co/spSe6geTwi
1047111088112898000,Tue Oct 02 13:08:32 +0000 2018,The 7th Annual League Pass Rankings, Part II, where I am drunk with power: https://t.co/spSe6geTwi
1046845594575286300,Mon Oct 01 19:33:33 +0000 2018,The 2018-19 League Pass Rankings,  Part 1 https://t.co/Rhbg4q6LRw
1046845594575286300,Mon Oct 01 19:33:33 +0000 2018,The 2018-19 League Pass Rankings,  Part 1 https://t.co/Rhbg4q6LRw
1046804551662272500,Mon Oct 01 16:50:28 +0000 2018,@Timberwolves I'm just glad your spirits are up!
1046776543299682300,Mon Oct 01 14:59:10 +0000 2018,@HPbasketball I contemplated introducing the Breen-Clyde corollary as I once did with Eagle, but I opted against it.
1046770660549316600,Mon Oct 01 14:35:48 +0000 2018,If you don't like your team's League Pass ranking, please blame the algorithm @BillSimmons and I discovered. I am b… https://t.co/9rxz7rOvb1
1046769446390501400,Mon Oct 01 14:30:58 +0000 2018,@ejmaroun Sorry.
1046767346226991100,Mon Oct 01 14:22:37 +0000 2018,The 7th Annual League Pass Rankings, Part I: https://t.co/Rhbg4q6LRw
1045798039741517800,Fri Sep 28 22:10:57 +0000 2018,@ByJayKing We can do better
1045753688231432200,Fri Sep 28 19:14:43 +0000 2018,RT @ZachLowe_NBA: ICYMI: Lowe Post podcast from Philly: Elton Brand on his new role as Sixers GM, the interview process, Fultz's jumper, Em…
1045677781223379000,Fri Sep 28 14:13:05 +0000 2018,Great news for a great guy. https://t.co/ONUmkC4Uem
1045409942256128000,Thu Sep 27 20:28:47 +0000 2018,@NickFriedell Also, you just got there.
1045327554406731800,Thu Sep 27 15:01:24 +0000 2018,I asked Elton about this on the podcast yesterday. He obviously can't get into it, but certainly didn't indicate ot… https://t.co/ftRWelWEvA
1045319916289699800,Thu Sep 27 14:31:03 +0000 2018,ICYMI: Lowe Post podcast from Philly: Elton Brand on his new role as Sixers GM, the interview process, Fultz's jump… https://t.co/wufovMEW2A
1045303195029917700,Thu Sep 27 13:24:37 +0000 2018,This is the situation as of this morning. It could of course change on a dime. Not sure it's possible to exaggerate… https://t.co/b3WgCUWxZR
1045059372521541600,Wed Sep 26 21:15:45 +0000 2018,Lowe Post podcast: Elton Brand on his rise to Sixers GM, Markelle Fultz's jumper, Philly's power structure, and ton… https://t.co/9w9wAIOQf8
1045057446019035100,Wed Sep 26 21:08:06 +0000 2018,This should be the conference's new slogan. "The East: Very Respectable!" https://t.co/n9p6G8M2xF
1045009999678902300,Wed Sep 26 17:59:33 +0000 2018,Lowe Post podcast: Elton Brand on his rise to GM in Philly, the challenges ahead, getting dunked on by Embiid, his… https://t.co/93KwHZo5nn
1044917023501881300,Wed Sep 26 11:50:06 +0000 2018,I appreciate this ice cold Amtrak announcer: "We need every seat open. If you are sleeping under a blanket, we can… https://t.co/IX7wbO4XUc
1044578335714619400,Tue Sep 25 13:24:17 +0000 2018,Have another Lowe Post podcast coming tomorrow, but ICYMI, I really enjoyed last week's with Jackie Mac and Grantla… https://t.co/On9IXl2tpc
1044571108219998200,Tue Sep 25 12:55:34 +0000 2018,Oh, I get that the ship has sailed. I'm just saying I can understand why Thibs, given who he is, how he operates, a… https://t.co/rHpAibrUTY
1044568777336258600,Tue Sep 25 12:46:18 +0000 2018,On the other hand, I feel some empathy for Thibs in this situation -- at least from the outside. He was brought in… https://t.co/lIuWQv1XCr
1044558644916949000,Tue Sep 25 12:06:02 +0000 2018,Pitched in on this @wojespn Wolves/Butler report late last night -- I can't remember teams trying to engage in trad… https://t.co/vbxObKNnNO
1044423919749550100,Tue Sep 25 03:10:41 +0000 2018,@theshrillest I watched that game, and weirdly remember exactly where I was (my sister-in-law's in Philly, at her k… https://t.co/caRpbaZyxy
1044422848780136400,Tue Sep 25 03:06:26 +0000 2018,Doing League Pass Rankings (and reading last year's) led me to this -- is this the meanest non-dunk thing any playe… https://t.co/NB7fFEz5ik
1044281779513897000,Mon Sep 24 17:45:52 +0000 2018,@writers_blvck They're not even that old LOL
1044259706234183700,Mon Sep 24 16:18:10 +0000 2018,this laugh might have to go in the Absurdity Wing https://t.co/sEEwXqg1UW
1044225592151998500,Mon Sep 24 14:02:36 +0000 2018,This is becoming like the 2015 trade deadline, when all the point guards got traded in a span of like 30 seconds. I… https://t.co/jU24Ucc1ZR
1044218362174296000,Mon Sep 24 13:33:52 +0000 2018,Before media day sets in: The first of my season preview pieces -- my Six Most Intriguing Players of the Season: tw… https://t.co/Md8d3fbDab
1043922790196432900,Sun Sep 23 17:59:22 +0000 2018,Obligatory reminder Cavs cannot trade Love until 6 months after the date he signed his extension. They owe a first-… https://t.co/Z7yZlvjcbr
1043662427878039600,Sun Sep 23 00:44:47 +0000 2018,RT @wojespn: In a deal that cements him as the franchise’s long-term cornerstone, Minnesota Timberwolves All-Star center Karl-Anthony Towns…
1043293140986286100,Sat Sep 22 00:17:22 +0000 2018,RT @wojespn: ESPN story on Minnesota’s organizational dysfunction surrounding how to proceed on Jimmy Butler’s trade request. https://t.co/…
1043287652609474600,Fri Sep 21 23:55:34 +0000 2018,I've written and said on podcasts repeatedly that Boston is confident Kyrie is staying -- and that I think he will… https://t.co/XWMqgogql1
1043216237726195700,Fri Sep 21 19:11:47 +0000 2018,I can't believe it took them so long to simplify the clear-path rule, but at least they did it. Somewhere, JVG is s… https://t.co/kNeYIW5Evv
1043209464625745900,Fri Sep 21 18:44:52 +0000 2018,@Unsilent Sorry, I kinda like that Wiz one. And in my defense, one GM (not involved in any Butler talks) called it… https://t.co/ne4n9PgZ8V
1043204233846128600,Fri Sep 21 18:24:05 +0000 2018,Trying to suss out the early Jimmy Butler trade market -- complicating factors, fake trades galore, reflections on… https://t.co/HmHk3yKD9r
1043199658842054700,Fri Sep 21 18:05:55 +0000 2018,Annual NBA season preview piece No. 1: My Six Most Intriguing Players for the season: https://t.co/QjvJKb0Xog
1043177485091971100,Fri Sep 21 16:37:48 +0000 2018,@HPbasketball If anyone knows anything about me, it's that I hate Toronto and never go there or write about the tea… https://t.co/hzluEftKOX
1043176020562636800,Fri Sep 21 16:31:59 +0000 2018,I once ate dinner one table away from Pek at his favorite Minny restaurant. I spent half the dinner marveling at ho… https://t.co/XBt5r00fzj
1043123618669101000,Fri Sep 21 13:03:45 +0000 2018,First of my annual NBA season preview pieces: My six most intriguing players for the upcoming season: https://t.co/QjvJKb0Xog
1042816462795157500,Thu Sep 20 16:43:13 +0000 2018,Update: Our LA studio is having technical difficulties, so the podcast is unfortunately off. Tune into The Jump tod… https://t.co/rPsP3R1bpk
1042793889009213400,Thu Sep 20 15:13:31 +0000 2018,Small Butler subplot: NBA's Board Governors (i.e. all the owners) is meeting in NYC today and tomorrow. Glen Taylor… https://t.co/McEOFlP1Ea
1042785960302272500,Thu Sep 20 14:42:01 +0000 2018,Seriously, people, get on the Lauri bandwagon now -- it's almost full. https://t.co/prNxDntXUb
1042781565586006000,Thu Sep 20 14:24:33 +0000 2018,Got @JonKrawczynski on the Lowe Post this a.m. in LA to talk all things Wolves/Butler, then onto The Jump to do the… https://t.co/DlTTWAWNDx
1042568966831398900,Thu Sep 20 00:19:46 +0000 2018,Clips can also provide the best "win-now" package of the three listed suitors, assuming a) Thibs will prioritize ma… https://t.co/yDNboY7nnX
1042488622895652900,Wed Sep 19 19:00:30 +0000 2018,Also, for coverage on the Mavs report you won't see anywhere else, I would recommend tuning into The Jump now. https://t.co/k7Jgo0MRoZ
1042472378515710000,Wed Sep 19 17:55:57 +0000 2018,We will be talking all things Jimmy Butler on The Jump today!
1042440096086089700,Wed Sep 19 15:47:41 +0000 2018,@katienolan are you ok?
1042429343882833900,Wed Sep 19 15:04:57 +0000 2018,RT @ZachLowe_NBA: Lowe Post podcast: Jackie MacMullan and @Rafeboogs on their fantastic new oral history of basketball -- stories galore: h…
1042182911087263700,Tue Sep 18 22:45:43 +0000 2018,RT @wojespn: Philadelphia has hired Elton Brand as general manager, league sources tell ESPN. Brand will be elevated from VP of Basketball…
1042117271592755200,Tue Sep 18 18:24:53 +0000 2018,Lowe Post podcast: Jackie MacMullan and @Rafeboogs on their fantastic new oral history of basketball -- stories gal… https://t.co/zKzmc4D7cV
1042116512935501800,Tue Sep 18 18:21:52 +0000 2018,Freaking finally, courtesy of @Rafeboogs https://t.co/500lxz3Kq7
1042071120852082700,Tue Sep 18 15:21:30 +0000 2018,I mean, if the Clippers are going to tank, they can at least be subtle about it! (Just kidding, Lee is the best, an… https://t.co/aW7hB9BnRu
1042039313452560400,Tue Sep 18 13:15:07 +0000 2018,This is what I like to hear -- I'm telling you guys, if you like hoops, you will love this pod/book https://t.co/8bebZf0CKV
1042038144344850400,Tue Sep 18 13:10:28 +0000 2018,Here's the @JackieMacB and @Rafeboogs book: https://t.co/OVzsyM8g8i Link to our pod: https://t.co/6FARZXFQLk Even i… https://t.co/eL7aN85DIy
1042037744099131400,Tue Sep 18 13:08:52 +0000 2018,We go through some riveting stories in here on everything from Connie Hawkins being black-balled, Don Nelson being… https://t.co/SbyNxWurpW
1042037434630860800,Tue Sep 18 13:07:39 +0000 2018,Lowe Post podcast: the legend @JackieMacB and @Rafeboogs on their hilarious, moving, impossible to put down oral hi… https://t.co/lCnd4ltuiB
1041084825673900000,Sat Sep 15 22:02:19 +0000 2018,Mentioned it on several podcasts, but things haven't been great w/in the Wolves for a year-plus now. Whatever happe… https://t.co/sJM5penKla
1040660053005688800,Fri Sep 14 17:54:25 +0000 2018,For those asking this: I'm told Google listeners can now find the pod is the Google Podcasts app. https://t.co/DggomfJaQU
1040655508561117200,Fri Sep 14 17:36:22 +0000 2018,ICYMI: Lowe Post podcast: J.J. Redick on ditching social media, Fultz, Colangelo, Simmons/Embiid dynamic, almost le… https://t.co/05rRElLBtc
1040374633613217800,Thu Sep 13 23:00:16 +0000 2018,Lowe Post podcasts from this week: @IanThomsen on his book about LeBron, Dirk, and the 2010-11 season:… https://t.co/JRpkDtzsh6
1040354332682715100,Thu Sep 13 21:39:36 +0000 2018,RT @ZachLowe_NBA: Lowe Post podcast: J.J. Redick in studio on almost leaving Philly, Fultz and Colangelo sagas, abandoning social media, Em…
1040291394315866100,Thu Sep 13 17:29:30 +0000 2018,Lowe Post podcast: J.J. Redick in studio on almost leaving Philly, Fultz and Colangelo sagas, abandoning social med… https://t.co/ZQ4MYN2N6l
1040280192101638100,Thu Sep 13 16:44:59 +0000 2018,In the NBA season, news stories tend to rush by. Thank you @JonKrawczynski for taking the time to remember R.J. Ade… https://t.co/MijoiyWcC6
1040254223567544300,Thu Sep 13 15:01:48 +0000 2018,Tyson-Douglas is one of the rare "you remember exactly where you were, who you were with, etc" sports moments of my… https://t.co/UbTMLyg19z
1040251924719775700,Thu Sep 13 14:52:40 +0000 2018,ICYMI: Lowe Post podcast: @IanThomsen on his new book on the 2010-11 season -- great stories on LeBron, The Decisio… https://t.co/f88fDWEFCB
1040057144333221900,Thu Sep 13 01:58:41 +0000 2018,Sue to Stewie backdoor, congrats to the Storm! You are a legend @S10Bird
1039983823092625400,Wed Sep 12 21:07:20 +0000 2018,@sam_amick @usatodaysports @JeffZillgitt @ByMaryByrne @kevin_spain @msinger @tweetAJNK My man!!!!
1039980858155954200,Wed Sep 12 20:55:33 +0000 2018,From earlier: They asked me to start building my imaginary NBA Absurdity Wing in the Hall of Fame:  https://t.co/NBLFggAvog
1039974674627788800,Wed Sep 12 20:30:58 +0000 2018,There are stories on all these legends you haven't heard before. Podcast w/ @IanThomsen: https://t.co/cmodameJiX Hi… https://t.co/9AivMFvboO
1039974483162017800,Wed Sep 12 20:30:13 +0000 2018,Lowe Post podcast: @IanThomsen on his new book on the 2010-11 NBA season -- original tales about Pat Riley, LeBron,… https://t.co/2clsvlZvc5
1039887253298978800,Wed Sep 12 14:43:36 +0000 2018,In studio on the Lowe Post today: the great @ianthomsen on his book about LeBron, The Decision, Dirk, and the 2010-… https://t.co/SkZLMOYT5h
1039872370960412700,Wed Sep 12 13:44:27 +0000 2018,Has to be in. https://t.co/vrXPsFNur6
1039872257907220500,Wed Sep 12 13:44:00 +0000 2018,Huge omission. Was actually in my notes, just blanked on including it. https://t.co/vGZWa2V3Mb
1039857700966985700,Wed Sep 12 12:46:10 +0000 2018,I've joked on the Lowe Post about the Hall of Fame creating a wing devoted to NBA absurdities. ESPN asked me to act… https://t.co/G5C8O6u7wc
1039159364320473100,Mon Sep 10 14:31:13 +0000 2018,Congrats to a legend! https://t.co/d2s53MlUWZ
1038060660880498700,Fri Sep 07 13:45:22 +0000 2018,RT @wojespn: On Naismith Basketball Hall of Fame Weekend, several of us wrote on those who aren't in Springfield but ought to be. I made th…
1038054472185012200,Fri Sep 07 13:20:46 +0000 2018,I wrote big on Webber's case in 2013: https://t.co/lIKJolFlHy and discussed him (and a dozen other borderline guys)… https://t.co/P5pNSVjp5u
1038054153875021800,Fri Sep 07 13:19:31 +0000 2018,It's Hall of Fame day, so ESPN had a bunch of his pick eligible candidates who aren't in but we think should be. Th… https://t.co/kvsa2jomwY
1037787584599089200,Thu Sep 06 19:40:15 +0000 2018,RT @ZachLowe_NBA: Hall of Fame week Lowe Post podcast: @HowardBeck and I bat around a bunch of present and future Hall of Fame candidates:…
1037772529509826600,Thu Sep 06 18:40:26 +0000 2018,A true original. One of my favorite Lowe Post guests ever: https://t.co/KYuRqecCLn https://t.co/mavOmRkEms
1037684125354930200,Thu Sep 06 12:49:09 +0000 2018,ICYMI: Morning commute listening: Lowe Post podcast: @HowardBeck and I debate the Hall of Fame -- what it should me… https://t.co/V7d2YLsRLx
1037500910220570600,Thu Sep 06 00:41:07 +0000 2018,@DougESPN Congrats buddy.
1037495706838331400,Thu Sep 06 00:20:26 +0000 2018,Hall of Fame week Lowe Post podcast: @HowardBeck and I bat around a bunch of present and future Hall of Fame candid… https://t.co/1QeFBkInnJ
1037470592264548400,Wed Sep 05 22:40:39 +0000 2018,Lowe Post podcast: @HowardBeck and I talk borderline Hall of Famers, future candidates, much more: https://t.co/twBKtt4saZ
1037407572272341000,Wed Sep 05 18:30:13 +0000 2018,RT @minakimes: earnest tweet alert: the brilliant + funny @katienolan is launching her new show, @AlwaysLateESPN, tonight. get thee an ESPN…
1037373602482581500,Wed Sep 05 16:15:14 +0000 2018,Thrilled for you @ChrisBHaynes, but bummed to lose you at ESPN. Congrats, bud! https://t.co/IvSxwZPFgg
1036975396112228400,Tue Sep 04 13:52:55 +0000 2018,Iain is a huge Raps fan and a really interesting writer. Really enjoyed this book. https://t.co/Em327zyYDL
1036951744352272400,Tue Sep 04 12:18:56 +0000 2018,Come on, young The Raptor totally cut dinosaur school to work on his craft and dance moves. https://t.co/gGLCcZkncX
1036665305341329400,Mon Sep 03 17:20:43 +0000 2018,Like this move for NOP. Wallace really helped the Clips last season. Smart player (see item No. 2):… https://t.co/5iKZdmPm2Q
1036418680333234200,Mon Sep 03 01:00:43 +0000 2018,Incredible story, beautifully told https://t.co/31H7KQx9qI
1035976595301953500,Sat Sep 01 19:44:02 +0000 2018,RT @AlbertNahmad: A $7.5M buyout for Luol Deng would mean Lakers’ decision to waive-and-stretch him this early saved an extra $1.3M on his…
