id,created_at,text
1260203748124696600,Tue May 12 13:42:41 +0000 2020,Lowe Post podcast: @jadande on all things "Last Dance": shock of MJ's '93 retirement, Pippen's '94 season, the dunk… https://t.co/zTPxUsIHkF
1259923535931244500,Mon May 11 19:09:13 +0000 2020,RT @kpelton: Over the weekend, I took a look at projecting what the 1998-99 Bulls might have done had they kept their dynasty core together…
1259923178773676000,Mon May 11 19:07:48 +0000 2020,Lowe Post podcast: @jadande on MJ's retirement in '93, Pippen's '94 season, MJ's practice trash-talk (Scott Burrell… https://t.co/xpYmMMhOKe
1259896834933379000,Mon May 11 17:23:07 +0000 2020,Only time in Lowe Post history the guest got more excited than the host to talk about mascots. https://t.co/WkAu7TApzV
1259892383707287600,Mon May 11 17:05:26 +0000 2020,Lowe Post "Last Dance" Monday podcast: @jadande on MJ's '93 retirement, Pippen's '94 season, "Space Jam" pick-up, a… https://t.co/kshrckhGP9
1259861814684323800,Mon May 11 15:03:58 +0000 2020,Holy cow did @jadande bring his A-plus game today on the Lowe Post. Incredible stories. Look for it later today. https://t.co/fq8dIY6ZwK
1259683436824006700,Mon May 11 03:15:09 +0000 2020,Tomorrow's Lowe Post Monday "Last Dance" recap/riffing guest -- the one and only @jadande, one of the more prolific… https://t.co/EyVfliH2qT
1259682058437382100,Mon May 11 03:09:41 +0000 2020,Excited for Pacers-Bulls to get some spotlight next week. ICYMI (apologies in advance for this not being the last t… https://t.co/AjJ5ffM30p
1259681322630623200,Mon May 11 03:06:45 +0000 2020,'96 Finals talk almost always goes back to Payton/Jordan, but Shawn Kemp was a monster in that series.
1259529446182260700,Sun May 10 17:03:15 +0000 2020,RT @ZachLowe_NBA: Happy "Last Dance" day! This week's 90s-themed Lowe Post podcasts below: https://t.co/ZmfHyqqKEh
1259467124894044200,Sun May 10 12:55:36 +0000 2020,Happy "Last Dance" day! This week's 90s-themed Lowe Post podcasts below: https://t.co/ZmfHyqqKEh
1259188195826315300,Sat May 09 18:27:15 +0000 2020,RT @wojespn: ESPN’s @Rachel__Nichols and @BobbyMarks42 join The Woj Pod to go inside Adam Silver’s call w/ players, testing, playoff struct…
1259170857928327200,Sat May 09 17:18:21 +0000 2020,Lowe Post podcast 90s month continued this week:  @Espngreeny on "Last Dance," covering Bulls first 3-peat, the rea… https://t.co/wK5IXeBEPs
1259139222885335000,Sat May 09 15:12:39 +0000 2020,RT @ZachLowe_NBA: Friday = 5 Things I Like + Don't Like, starring a Jordan Education Campaign and some cool rebounding stuff: https://t.co/…
1258945891140022300,Sat May 09 02:24:25 +0000 2020,RT @mcten: New story: Kevin Love described his first day back at the practice facility, complete with assistant coaches wearing masks and g…
1258930952279031800,Sat May 09 01:25:03 +0000 2020,RT @wojespn: Filed updated story on Adam Silver call with players, including the commissioner preparing players for realization that there…
1258900857942356000,Fri May 08 23:25:28 +0000 2020,RT @wojespn: Sources: On call with players today, Adam Silver told NBPA membership: 1) "It would be safer to be in a single location, or tw…
1258857415820357600,Fri May 08 20:32:51 +0000 2020,RT @espnpodcasts: New #LowePost!   @ZachLowe_NBA talks with Hall of Famer @McCallum12 about his new podcast series "The Dream Team Tapes" a…
1258815813726941200,Fri May 08 17:47:32 +0000 2020,RT @ZachLowe_NBA: Lowe Post podcast: Hall of Famer @McCallum12 on his new podcast series "The Dream Team Tapes," Isiah Thomas being left of…
1258785455417458700,Fri May 08 15:46:54 +0000 2020,RT @ramonashelburne: NBPA Executive Director Michele Roberts explains why the idea of a strict bubble has never been popular with players.…
1258749388232556500,Fri May 08 13:23:35 +0000 2020,Lowe Post podcast: Hall of Famer @McCallum12 on his new podcast series "The Dream Team Tapes," Isiah Thomas being l… https://t.co/K9tyqTILNJ
1258748821435269000,Fri May 08 13:21:20 +0000 2020,Friday = 5 Things I Like + Don't Like, starring a Jordan Education Campaign and some cool rebounding stuff: https://t.co/uibrqkhgjw
1258536275339964400,Thu May 07 23:16:45 +0000 2020,And it's my answer! https://t.co/N5gjoar7I3
1258483504616276000,Thu May 07 19:47:03 +0000 2020,Some really good Barkley stories as well. https://t.co/p05Paa6xMK
1258482527108464600,Thu May 07 19:43:10 +0000 2020,Jack has MJ on tape addressing the Isiah/Dream Team thing juuuuuuussst a bit differently than in "Last Dance" -- mu… https://t.co/EQl91pvpEr
1258481309174902800,Thu May 07 19:38:20 +0000 2020,Lowe Post podcast: the legend @McCallum12 on his new "Dream Team Tapes" podcast series, all things MJ/"Last Dance",… https://t.co/nOng5DtR6T
1258458064052719600,Thu May 07 18:05:58 +0000 2020,Lowe Post podcast: the legend @McCallum12 talks about his new podcast series "The Dream Team Tapes" and "The Last D… https://t.co/d0ELkKFUQu
1258434078510133200,Thu May 07 16:30:39 +0000 2020,Just recorded a super fun Lowe Post podcast with the legend @McCallum12, who has his own 8-episode podcast series -… https://t.co/FOFqd5wo5S
1258433668869226500,Thu May 07 16:29:01 +0000 2020,Oh no. https://t.co/YHMMdDmWdi
1258088663684190200,Wed May 06 17:38:06 +0000 2020,ICYMI, some recent Jordan-themed Lowe Post podcasts with ESPN heavyweights who had front row seats:… https://t.co/AohdbzhEjT
1258053688758882300,Wed May 06 15:19:07 +0000 2020,RT @ZachLowe_NBA: And if you want more on the Bulls-Knicks 1990s rivalry, Mike Breen came on the Lowe Post last month to talk about that an…
1258053504100335600,Wed May 06 15:18:23 +0000 2020,RT @ZachLowe_NBA: Lowe Post podcast: Mike Greenberg (@Espngreeny) on covering the Bulls first three-peat; '92 vs '96 for best MJ team ever;…
1257796244866564000,Tue May 05 22:16:08 +0000 2020,RT @espnpodcasts: #LowePost!   @ZachLowe_NBA talks to @Espngreeny about covering the Bulls first three-peat, #TheLastDance, the 1992 vs 199…
1257696201266344000,Tue May 05 15:38:35 +0000 2020,RT @Espngreeny: Really enjoyed this conversation with the great @ZachLowe_NBA. If you loved Michael Jordan era basketball, I think you will…
1257682009096323000,Tue May 05 14:42:12 +0000 2020,Lowe Post podcast: Mike Greenberg (@Espngreeny) on covering the Bulls first three-peat; '92 vs '96 for best MJ team… https://t.co/ARkoygJ9fe
1257438657277018000,Mon May 04 22:35:12 +0000 2020,Spotify/Apple links to today's Lowe Post "Last Dance" podcast with @Espngreeny, who was there for the first three-p… https://t.co/Vxu9Xrnwv9
1257424579112419300,Mon May 04 21:39:16 +0000 2020,And if you want more on the Bulls-Knicks 1990s rivalry, Mike Breen came on the Lowe Post last month to talk about t… https://t.co/TwLZFp9Ybq
1257400031537238000,Mon May 04 20:01:43 +0000 2020,Greeny has some thoughts on Isiah Thomas too. https://t.co/9kWHvUKmv6
1257399406447509500,Mon May 04 19:59:14 +0000 2020,Lowe Post podcast: @Espngreeny on '92 Bulls vs '96 Bulls, covering MJ when the gambling allegations surfaced, Phil… https://t.co/5TrJIykjSL
1257121937505095700,Mon May 04 01:36:40 +0000 2020,RT @ZachLowe_NBA: "Toni was just himself, and that was his salvation." Kukoc and several old Bulls spoke to ESPN on how Kukoc started as "J…
1256959197931061200,Sun May 03 14:50:00 +0000 2020,Happy "Last Dance" Day, Part II:  Lowe Post podcasts last week:  @BobbyMarks42 and I on the Bad Boys/Rodman:… https://t.co/pWDo0PPVB9
1256958831613096000,Sun May 03 14:48:33 +0000 2020,Happy "Last Dance" Day, Part I:  Columns this week:  On Toni Kukoc, starting as "Jerry's boy" and evolving into som… https://t.co/Fk9tDbrCyH
1256665080613286000,Sat May 02 19:21:17 +0000 2020,RT @ZachLowe_NBA: Lowe Post podcasts this week:  @BobbyMarks42 and I react to "Last Dance" eps 3/4 -- Rodman, Bad Boys legacy, walk-off: ht…
1256663883596607500,Sat May 02 19:16:32 +0000 2020,More than one team official has described this to me as "the elephant in the room" in league meetings about restart… https://t.co/I82t4tTdZb
1256638639037169700,Sat May 02 17:36:13 +0000 2020,I respect donating a sidewalk square outside an elementary school as part of a grudge https://t.co/K0l9z5AQbE
1256587269584142300,Sat May 02 14:12:05 +0000 2020,RT @JalenRose: 'The scariest game we ever faced' - The Chicago Bulls talk about their toughest Game 7 ⁦@ZachLowe_NBA⁩ #LastDance  https://t…
1256356539797028900,Fri May 01 22:55:15 +0000 2020,RT @ZachLowe_NBA: "We had confidence their run was over. We had answers to every question." Inside the day one rival pushed a Michael Jorda…
1256272903043195000,Fri May 01 17:22:55 +0000 2020,This week's Lowe Post podcasts below: https://t.co/K6wmouat07
1256208404336521200,Fri May 01 13:06:37 +0000 2020,Bob Costas -- who called the game --  on the first quarter of Game 7 in 1998: "There was a sense right then that ma… https://t.co/b9XCaYHHvK
1256207635168276500,Fri May 01 13:03:34 +0000 2020,"We had confidence their run was over. We had answers to every question." Inside the day one rival pushed a Michael… https://t.co/EPCQhArVWF
1255961393834180600,Thu Apr 30 20:45:05 +0000 2020,Maybe the next Vegas drinking podcast with @Rachel__Nichols (whenever that is possible again) can take place on a g… https://t.co/Idfo0ZMG39
1255937122219024400,Thu Apr 30 19:08:38 +0000 2020,RT @mutsackcraig: Fun fact: @ZachLowe_NBA's boat in the scene is tied to a low post.
1255935385399701500,Thu Apr 30 19:01:44 +0000 2020,All downhill from here for me and my pondcast https://t.co/CSavPi64V0
1255921687301894100,Thu Apr 30 18:07:18 +0000 2020,Lowe Post podcasts this week:  @BobbyMarks42 and I react to "Last Dance" eps 3/4 -- Rodman, Bad Boys legacy, walk-o… https://t.co/5bLHMRExRW
1255858664260415500,Thu Apr 30 13:56:52 +0000 2020,RT @wojespn: The Woj Pod with @AdamSchefter and @JeffPassan:   Spotify: https://t.co/IEC1CayRcE Apple: https://t.co/gAzHVE4k5a
1255850058140061700,Thu Apr 30 13:22:41 +0000 2020,RT @espnpodcasts: ICYMI New #LowePost!  @ZachLowe_NBA talks to ESPN's @RealMikeWilbon about all things Michael Jordan and "The Last Dance."…
1255622891762339800,Wed Apr 29 22:20:00 +0000 2020,The @RealMikeWilbon has some opinions on that theoretical Bulls-Warriors matchup. Full Lowe Post podcast:… https://t.co/5Rfu1FwvRL
1255595100031369200,Wed Apr 29 20:29:34 +0000 2020,RT @espnpodcasts: New #LowePost!  @ZachLowe_NBA talks to ESPN's @RealMikeWilbon about all things Michael Jordan and "The Last Dance."  LIST…
1255517221285175300,Wed Apr 29 15:20:06 +0000 2020,Lowe Post podcast: Michael Wilbon (@RealMikeWilbon) on his relationship with MJ, his favorite Jordan games, some Pi… https://t.co/lpItsOIwbF
1255502987599978500,Wed Apr 29 14:23:33 +0000 2020,RT @wojespn: If you're able, please consider giving to a Boys and Girls Club of your choice (https://t.co/hsS7BmHdBE). I'm matching donatio…
1255501228135547000,Wed Apr 29 14:16:33 +0000 2020,RT @wojespn: Doors to Boys and Girls Clubs of America may be closed for now, but @BGCA_Clubs are still reaching out to kids in our communit…
1255482095557902300,Wed Apr 29 13:00:31 +0000 2020,Lowe Post podcast: the legend @RealMikeWilbon tells stories about Michael Jordan and "The Last Dance":  https://t.co/A3tqRYWgeR
1255187438416339000,Tue Apr 28 17:29:40 +0000 2020,RT @ZachLowe_NBA: ICYMI: Lowe Post podcast w/ @BobbyMarks42 (who has a Rodman/Jack Haley tale!) react to "Last Dance" eps 3/4 -- Bad Boys l…
1255159465818685400,Tue Apr 28 15:38:31 +0000 2020,@HowardBeck @SHAQ @LexisNexis Holy cow, @LexisNexis gets a shout-out in my podcast with @RealMikeWilbon coming out… https://t.co/CJQvXfuie1
1255159230295834600,Tue Apr 28 15:37:34 +0000 2020,@michaelgrange Wait, am I supposed to be impressed by this?
1255132905929609200,Tue Apr 28 13:52:58 +0000 2020,ICYMI: Lowe Post podcast w/ @BobbyMarks42 (who has a Rodman/Jack Haley tale!) react to "Last Dance" eps 3/4 -- Bad… https://t.co/CjmqtrPhbh
1254909790184243200,Mon Apr 27 23:06:23 +0000 2020,RT @ZachLowe_NBA: Lowe Post podcast: @BobbyMarks42 has a Rodman story, plus thoughts all things Bad Boys:  the walk-off, the Bulls taking t…
1254873927291109400,Mon Apr 27 20:43:53 +0000 2020,I have conflicted thoughts on the walk-off, but I take issue with one comparison Isiah made last night -- listen fo… https://t.co/B0RXfvgbg8
1254872014629765000,Mon Apr 27 20:36:17 +0000 2020,"I was coming to the best team in the world. You have to put aside all your accolades and pride. I was OK with that… https://t.co/86PBwL1dip
1254870318235213800,Mon Apr 27 20:29:32 +0000 2020,Lowe Post podcast: @BobbyMarks42 has a Rodman story, plus thoughts all things Bad Boys:  the walk-off, the Bulls ta… https://t.co/mE3YUXx2tg
1254846937993486300,Mon Apr 27 18:56:38 +0000 2020,RT @ZachLowe_NBA: Lowe Post podcast: @BobbyMarks42 has a good Rodman story, so he came on to tell it -- plus: the Bad Boys place in history…
1254816539867570200,Mon Apr 27 16:55:51 +0000 2020,Mild spoiler: I've always had a bit of a soft spot for the Bad Boys. I have a lot of thoughts on the walk-off. https://t.co/8ft5ghr43O
1254806397134520300,Mon Apr 27 16:15:32 +0000 2020,Lowe Post podcast: @BobbyMarks42 has a good Rodman story, so he came on to tell it -- plus: the Bad Boys place in h… https://t.co/cKQsDCqYwq
1254753571440132000,Mon Apr 27 12:45:38 +0000 2020,I'm very confident this will be the only "Last Dance" story featuring a blueberry getting stuck up someone's nose. https://t.co/8uVLbnu6EK
1254750355793027000,Mon Apr 27 12:32:51 +0000 2020,Kukoc talked at great length to ESPN on all things "Last Dance," Dream Team, his relationship with Scottie and Mich… https://t.co/bBOFb6tQs7
1254750170870358000,Mon Apr 27 12:32:07 +0000 2020,"Toni was just himself, and that was his salvation." Kukoc and several old Bulls spoke to ESPN on how Kukoc started… https://t.co/3mLjZMzzQi
1254537561617371100,Sun Apr 26 22:27:17 +0000 2020,RT @Vasu: One of the GOAT podcasts  - @SteveKerr and @ZachLowe_NBA making me emotional, re-living my childhood. #LastDance https://t.co/ut3…
1254505008722251800,Sun Apr 26 20:17:56 +0000 2020,RT @ZachLowe_NBA: Happy "Last Dance" Day! Here's a Lowe Post podcast w/ Steve Kerr going behind the scenes of the '98 Bulls: https://t.co/y…
1254476640001962000,Sun Apr 26 18:25:12 +0000 2020,RT @Mike_Schmitz: ESPN Virtual Film Sessions so far:   James Wiseman: https://t.co/46W5Yvpkki  Tyrese Haliburton: https://t.co/CoQ61i73t3…
1254465035222515700,Sun Apr 26 17:39:05 +0000 2020,RT @katieledecky: Grabbing my popcorn for tonight's episodes of #TheLastDance. I can tell you one thing about Michael Jordan: he's a tough…
1254406925799825400,Sun Apr 26 13:48:11 +0000 2020,Happy "Last Dance" Day! Here's a Lowe Post podcast w/ Steve Kerr going behind the scenes of the '98 Bulls:… https://t.co/UtHB4wYqbQ
1254137462827282400,Sat Apr 25 19:57:26 +0000 2020,RT @ZachLowe_NBA: Lowe Post podcasts this week:  Steve Kerr takes us behind the scenes of "The Last Dance" Bulls:   https://t.co/yc9Hto5PIZ…
1254054399581794300,Sat Apr 25 14:27:22 +0000 2020,Lowe Post podcasts this week:  Steve Kerr takes us behind the scenes of "The Last Dance" Bulls:… https://t.co/KNXGTCkGIZ
1253767256242258000,Fri Apr 24 19:26:22 +0000 2020,RT @espnpodcasts: New #LowePost!  @ZachLowe_NBA and @Herring_NBA of 538 pick their NBA All-Rookie teams.  LISTEN: https://t.co/ybSEfSLGO8 h…
1253704157510459400,Fri Apr 24 15:15:38 +0000 2020,Lowe Post podcast: @Herring_NBA and I pick our tentative All-Rookie first and second teams. Always really enjoy tal… https://t.co/i9vbzWRfL8
1253689887703924700,Fri Apr 24 14:18:56 +0000 2020,Friday = 5 Things I Like + Don't Like, starring A VERY IMPORTANT takeaway from "The Last Dance" -- plus a bunch of… https://t.co/x0pHm0a9tG
1253679510945509400,Fri Apr 24 13:37:42 +0000 2020,ICYMI yesterday amid the NFL draft -- Chris and I picked our tentative All-Rookie teams in the NBA https://t.co/LBKJ30BjeD
1253673182042697700,Fri Apr 24 13:12:33 +0000 2020,Friday = 5 Things I Like + Don't Like, including a VERY IMPORTANT takeaway from "The Last Dance": https://t.co/Zag66mlPrD
1253431002606694400,Thu Apr 23 21:10:13 +0000 2020,Lowe Post podcast: Normal NBA talk with @Herring_NBA, as we pick our tentative All-Rookie 1st and 2nd teams for 201… https://t.co/chZWBNJkNz
1253314381154304000,Thu Apr 23 13:26:48 +0000 2020,RT @espn: Check out Lowe’s full podcast with @SteveKerr below ⤵️  Spotify: https://t.co/2zqXePCnDa  Apple: https://t.co/U9kk85X9KT
1253151954143936500,Thu Apr 23 02:41:22 +0000 2020,RT @espn: Losing Game 7 of the 1998 Eastern Conference Finals never crossed MJ's mind 🐐  (via @ZachLowe_NBA) https://t.co/xTGyCLpD6D
1253127728074764300,Thu Apr 23 01:05:07 +0000 2020,RT @ZachLowe_NBA: Spotify/Apple links to today's Lowe Post podcast with @SteveKerr on "The Last Dance," Chicago's second three-peat, and mu…
1253051980022505500,Wed Apr 22 20:04:07 +0000 2020,RT @ZachLowe_NBA: ICYMI: Lowe Post podcast: @SteveKerr takes us behind the scenes of the Last Dance Bulls -- inside big games, big shots, a…
1253034328545788000,Wed Apr 22 18:53:58 +0000 2020,Great stuff, but I need the outtakes of the players singing. Rip's first appearance is a highlight. https://t.co/ADcsPmBHcB
1252964993353613300,Wed Apr 22 14:18:28 +0000 2020,ICYMI: Lowe Post podcast: @SteveKerr takes us behind the scenes of the Last Dance Bulls -- inside big games, big sh… https://t.co/IPdxZLMiTf
1252665018199478300,Tue Apr 21 18:26:28 +0000 2020,RT @ZachLowe_NBA: Really enjoyed this chat with Steve. The last story he tells is really vivid and (I felt) moving. Lots of memories in her…
1252638527399104500,Tue Apr 21 16:41:12 +0000 2020,RT @ZachLowe_NBA: Lowe Post podcast: @SteveKerr takes us behind the scenes of the "Last Dance" Bulls and shares some thoughts on the first…
1252596977159811000,Tue Apr 21 13:56:06 +0000 2020,Really enjoyed this chat with Steve. The last story he tells is really vivid and (I felt) moving. Lots of memories… https://t.co/BwtQ23JBGc
1252595955548983300,Tue Apr 21 13:52:02 +0000 2020,Lowe Post podcast: @SteveKerr takes us behind the scenes of the "Last Dance" Bulls and shares some thoughts on the… https://t.co/NwA4CwkPCA
1252369074278895600,Mon Apr 20 22:50:29 +0000 2020,Spotify/Apple links to today's Lowe Post podcast with @SteveKerr on "The Last Dance," Chicago's second three-peat,… https://t.co/AXAzHx0Y62
1252325003246346200,Mon Apr 20 19:55:22 +0000 2020,Plus, of course, thoughts on the first two episodes of "The Last Dance" -- Pippen's surgery, Krause-vs-the players,… https://t.co/tXmy4pvM8e
1252321125729742800,Mon Apr 20 19:39:58 +0000 2020,Lowe Post podcast: @SteveKerr on the Last Dance Bulls: pivotal games from both Utah Finals, big shots made and miss… https://t.co/0P1tN6xTxU
1252072316617601000,Mon Apr 20 03:11:17 +0000 2020,Honestly if you come up to me in the grocery store and say in the just right cadence and volume, "FROM NORTH CAROLI… https://t.co/wP5xijQsoJ
1252070147910766600,Mon Apr 20 03:02:40 +0000 2020,I like that we can't binge this. Something to look forward to.  Let's reconvene next Sunday. In the meantime, we ha… https://t.co/hYYOnuES1G
1252069840946376700,Mon Apr 20 03:01:27 +0000 2020,Cold https://t.co/QefrdJL8WC
1252065798492954600,Mon Apr 20 02:45:23 +0000 2020,"God disguised as Michael Jordan." One of the all-time best sports quotes.
1252037203406061600,Mon Apr 20 00:51:45 +0000 2020,LETS GO
1252000600616841200,Sun Apr 19 22:26:18 +0000 2020,RT @ZachLowe_NBA: If you're looking for last-minute "Last Dance" listening material, here are Lowe Post podcasts from last week:  Mike Bree…
1251952032115839000,Sun Apr 19 19:13:19 +0000 2020,RT @wojespn: The week in The Woj Pod:   Patrick Ewing and Jeff Van Gundy on Knicks-Bulls battles in the ‘90’s: https://t.co/hGtz0wsHtx  Jon…
1251921666827001900,Sun Apr 19 17:12:39 +0000 2020,If you're looking for last-minute "Last Dance" listening material, here are Lowe Post podcasts from last week:  Mik… https://t.co/OUMidEmyzb
1251888558098563000,Sun Apr 19 15:01:05 +0000 2020,RT @espnpodcasts: ICYMI #LowePost!  @ZachLowe_NBA and Jackie MacMullan talk about Michael Jordan on the eve of "The Last Dance" to discuss:…
1251580884114968600,Sat Apr 18 18:38:30 +0000 2020,RT @ramonashelburne: How did Adam Silver, then the head of NBA Entertainment, convince MJ to film the 97-98 season? He gave him the one thi…
1251545686748823600,Sat Apr 18 16:18:38 +0000 2020,Lowe Post podcasts this week -- with a heavy "Last Dance"/Jordan theme:  Mike Breen on 1990s Knicks vs MJ, much mor… https://t.co/picYQKR4rt
1251539770070753300,Sat Apr 18 15:55:08 +0000 2020,Columns this week:  9th Annual Luke Walton All-Stars: https://t.co/ONjjISO8gK  5 Things I Like + Don't Like, starri… https://t.co/e4Ph6cmbKW
1251513666836537300,Sat Apr 18 14:11:24 +0000 2020,Stories galore https://t.co/UGYpD6zbqR
1251306432579940400,Sat Apr 18 00:27:56 +0000 2020,Really interesting watching this remote WNBA draft. @RyanRuocco and @RebeccaLobo doing their usual great work QB-in… https://t.co/DupHPp8xu8
1251249669742747600,Fri Apr 17 20:42:23 +0000 2020,RT @espnpodcasts: New #LowePost!  @ZachLowe_NBA and Jackie MacMullan talk about Michael Jordan on the eve of "The Last Dance" to discuss:…
1251226098760847400,Fri Apr 17 19:08:43 +0000 2020,RT @wojespn: ESPN Sources: The NBA and NBPA have agreed on the withholding of 25 percent of each player paycheck beginning on May 15. Deal…
1251196142454521900,Fri Apr 17 17:09:41 +0000 2020,RT @ZachLowe_NBA: Felt like talking some ball. Friday = 5 Things I Like + Don't Like, starring the present-day Bulls -- and the biggest iss…
1251194620677062700,Fri Apr 17 17:03:38 +0000 2020,RT @ZachLowe_NBA: Lowe Post podcast with Jackie MacMullan re-living several iconic MJ moments from The Shot until the last shot. Jackie was…
1251170263833751600,Fri Apr 17 15:26:51 +0000 2020,Currently wearing sweatpants and am once again approaching 2 weeks without shaving, how u https://t.co/m3stnbdstm
1251165912809574400,Fri Apr 17 15:09:33 +0000 2020,Lowe Post podcast with Jackie MacMullan re-living several iconic MJ moments from The Shot until the last shot. Jack… https://t.co/W3wul9njaP
1251164283599229000,Fri Apr 17 15:03:05 +0000 2020,Here is Jackie MacMullan's personal look back at covering Michael Jordan that we discuss on the Lowe Post podcast t… https://t.co/uDtzPXB8yD
1251163436513255400,Fri Apr 17 14:59:43 +0000 2020,Meanwhile I just re-watched Game 1 of the '98 Finals to prep for a Monday podcast, and I'm tired just from watching… https://t.co/UqpycqxdpA
1251139225099083800,Fri Apr 17 13:23:30 +0000 2020,Lowe Post podcast: Two days from the start of "The Last Dance," the legend Jackie MacMullan -- who worked several i… https://t.co/is4FEnzEAp
1251138910543061000,Fri Apr 17 13:22:15 +0000 2020,Felt like talking some ball. Friday = 5 Things I Like + Don't Like, starring the present-day Bulls -- and the bigge… https://t.co/VvghuCOIiK
1251125343198601200,Fri Apr 17 12:28:21 +0000 2020,@SeanFennessey Thanks buddy. Stay safe out there
1250949022485033000,Fri Apr 17 00:47:43 +0000 2020,Come for the Jordan stories, say for an epic 15-year free throw contest against a current NBA head coach. https://t.co/Y4APawSh3v
1250840643171242000,Thu Apr 16 17:37:03 +0000 2020,Really important move -- and really interesting execution. https://t.co/VeYsRpMUil
1250789954063655000,Thu Apr 16 14:15:38 +0000 2020,With "The Last Dance" set for Sunday, here's Mike Breen on the Lowe Post podcast on all things Jordan-vs-1990s Knic… https://t.co/HojjO8HI7X
1250573228491321300,Wed Apr 15 23:54:26 +0000 2020,RT @espnpodcasts: New #LowePost:  @ZachLowe_NBA talks to Mike Breen about prime Michael Jordan breaking the Knicks' hearts, Linsanity and t…
1250505108049342500,Wed Apr 15 19:23:45 +0000 2020,RT @espnpodcasts: New #LowePost:  @ZachLowe_NBA talks to Mike Breen about prime Michael Jordan breaking the Knicks' hearts, Linsanity and t…
1250481511096254500,Wed Apr 15 17:49:59 +0000 2020,RT @ZachLowe_NBA: Lowe Post podcast: Mike Breen on witnessing peak Jordan vs the Knicks, '94 Finals, Knicks-Pacers, Linsanity, and one epic…
1250423968479076400,Wed Apr 15 14:01:20 +0000 2020,Lowe Post podcast: Mike Breen on witnessing peak Jordan vs the Knicks, '94 Finals, Knicks-Pacers, Linsanity, and on… https://t.co/5gG7i9kpSb
1250191108463890400,Tue Apr 14 22:36:02 +0000 2020,Spotify/Apple links to Lowe Post podcast with Mike Breen on Jordan/Knicks, '94 Finals/O.J. Game, Pacers-Knicks glor… https://t.co/u2Tit0VuE6
1250160974218301400,Tue Apr 14 20:36:17 +0000 2020,Lowe Post podcast: the one and only Mike Breen on peak Jordan vs the Knicks, the double-nickel game, '94 Finals/O.J… https://t.co/bZltGmyMqJ
1250097831777616000,Tue Apr 14 16:25:23 +0000 2020,We need minimum 5 minutes on JVG figuring out the technology. Also today's Lowe Post podcast will make for a perfec… https://t.co/62py2EcX3A
1250053434679734300,Tue Apr 14 13:28:58 +0000 2020,ICYMI: The 9th Annual Luke Walton All-Stars -- a bunch of guys with jagged, unlikely journeys to very happy 2019-20… https://t.co/IaBGWoF86A
1250052488289542100,Tue Apr 14 13:25:12 +0000 2020,RT @ZachLowe_NBA: ICYM any Lowe Post podcasts from last week:  Sue Bird and Megan Rapinoe on everything from COVID-19 to "Ace Ventura": htt…
1249770152239026200,Mon Apr 13 18:43:18 +0000 2020,RT @ZachLowe_NBA: The 9th Annual Luke Walton All-Stars -- probably my favorite edition ever. https://t.co/OTyyw1WzX2
1249769844884545500,Mon Apr 13 18:42:05 +0000 2020,Really enjoyed all three of these, and they are all very different. We have a fun first-time Lowe Post guest -- som… https://t.co/SXdAMW9VGY
1249768770442272800,Mon Apr 13 18:37:49 +0000 2020,ICYM any Lowe Post podcasts from last week:  Sue Bird and Megan Rapinoe on everything from COVID-19 to "Ace Ventura… https://t.co/CYTaaMCxXy
