id,created_at,text
1125788331802005500,Tue May 07 15:43:49 +0000 2019,"My job is over when the whole thing is won." Giannis Antetokounmpo to ESPN -- how the Bucks rebounded from Game 1… https://t.co/OmQ8DRrltf
1125787471512518700,Tue May 07 15:40:23 +0000 2019,@MZavagno11 In 45 minutes. That seems pretty good.
1125786836255768600,Tue May 07 15:37:52 +0000 2019,Houston is plus-21 in 45 minutes with P.J. Tucker at center against the Warriors. That (very small) lineup has rebo… https://t.co/3aCkMDoAwg
1125766777382821900,Tue May 07 14:18:10 +0000 2019,RT @ZachLowe_NBA: Other recent Lowe Post podcasts: @kirkgoldsberry https://t.co/2nQJBJLKGq Stan Van Gundy: https://t.co/JtlR89oQM5
1125766722076721200,Tue May 07 14:17:56 +0000 2019,RT @ZachLowe_NBA: Lowe Post podcast recorded right after Raps-Sixers Sunday: @TimBontemps, @malika_andrews, and I gather at Tim's house to…
1125755593212481500,Tue May 07 13:33:43 +0000 2019,23 observations, trends, Xs-and-Os, potential adjustments, and random reasons to flat-out love the wild Nuggets-Bla… https://t.co/5dPVi3N1VE
1125737063788236800,Tue May 07 12:20:05 +0000 2019,From overnight in Boston: Skeptics pounced on the Bucks after Game 1. How a core that had never won a playoff serie… https://t.co/zIXPUUMvP8
1125467286301749200,Mon May 06 18:28:05 +0000 2019,Other recent Lowe Post podcasts: @kirkgoldsberry https://t.co/2nQJBJLKGq Stan Van Gundy: https://t.co/JtlR89oQM5
1125401651660116000,Mon May 06 14:07:17 +0000 2019,Lowe Post podcast recorded right after Raps-Sixers Sunday: @TimBontemps, @malika_andrews, and I gather at Tim's hou… https://t.co/GaKgp6gZSN
1125217814921588700,Mon May 06 01:56:47 +0000 2019,We were not drinking, sadly. https://t.co/dybPScK4D4
1125217314322960400,Mon May 06 01:54:47 +0000 2019,Sunday night Lowe Post podcast: @TimBontemps, @malika_andrews and I gather at Tim's house right after Raps-Sixers t… https://t.co/WoO7U6jOAB
1125013584327708700,Sun May 05 12:25:14 +0000 2019,Three of the four conference semifinals are being played at a pace slower than any team averaged this season. Exception is MIL-BOS.
1124875399362687000,Sun May 05 03:16:09 +0000 2019,What
1124830519202648000,Sun May 05 00:17:48 +0000 2019,RT @HowardBeck: NBA's L2M report -- actually, a last *22-minute* report -- for the 4OT game between DEN and POR was fairly clean. Details:…
1124772759731617800,Sat May 04 20:28:17 +0000 2019,RT @Vasu: NBA shooters get fouled on 1.66% of their 3-point tries. For Harden that number is 11.5%. That gap can't be explained solely thro…
1124736688855638000,Sat May 04 18:04:57 +0000 2019,RT @ZachLowe_NBA: For analysis of every series -- Lowe Post podcast w/ @kirkgoldsberry on Raps-Sixers and Nuggets Blazers (plus his new boo…
1124709817120108500,Sat May 04 16:18:11 +0000 2019,Oh https://t.co/4GCkGPU9VI
1124694224551710700,Sat May 04 15:16:13 +0000 2019,Update from Boston: I woke up a long time ago and started watching Denver-Portland from opening tip. I am still wat… https://t.co/2N6ccCc6dN
1124504619902750700,Sat May 04 02:42:48 +0000 2019,We have reached that moment: teams with two of the premier free agents this summer are down 2-1, and facing potentially defining Game 4s.
1124399162907340800,Fri May 03 19:43:45 +0000 2019,Random stat that may or may not be important: Marc Gasol elbow touches: 8.7 per game in Memphis; 6.0 per game in To… https://t.co/v25POQimbJ
1124322619073990700,Fri May 03 14:39:35 +0000 2019,@KevinOConnorNBA Thinking you guys, Kevin.
1124305001227202600,Fri May 03 13:29:35 +0000 2019,RT @wojespn: Brooklyn Nets guard Allen Crabbe has exercised his $18.5M player option for the 2019-20 season, league sources tell ESPN.
1124293473639727100,Fri May 03 12:43:47 +0000 2019,RT @TimBontemps: Lowry also told ESPN Ben Simmons apologized at halftime for his low blow, and said he didn’t mean to do it. "It's not like…
1124292594761183200,Fri May 03 12:40:17 +0000 2019,@AProskauer I get the sentiment, but he attempted more shots than Harris or Redick last night and 2 fewer than Butl… https://t.co/8nNf2A1q8x
1124291407781478400,Fri May 03 12:35:34 +0000 2019,Stat that kinda represents this: Simmons' usage rate is down from 22.1% of PHI possessions in the regular-season to… https://t.co/KxSz3uGtfO
1124142285313196000,Fri May 03 02:43:01 +0000 2019,It's a little thing on a team with tons of star power, but James Ennis has provided a consistent boost for Philly o… https://t.co/2ejI0vwATL
1124141185713496000,Fri May 03 02:38:38 +0000 2019,Sixers looked like a team developing a coherent identity tonight. Fast, huge, good mix of how they played pre-Butle… https://t.co/QP9hdElz4r
1124063657904812000,Thu May 02 21:30:34 +0000 2019,The Cleveland Cavaliers have requested permission to interview Denver assistant Jordi Fernandez for their head-coac… https://t.co/TRlw8xAea9
1124017241358512100,Thu May 02 18:26:08 +0000 2019,@raymanjr @GetUpESPN Nice!
1124015253883445200,Thu May 02 18:18:14 +0000 2019,Moving story here. Wishing a healthy, speedy recovery to @CoachYim. https://t.co/FR6DJgsrN8
1124014822079848400,Thu May 02 18:16:31 +0000 2019,For analysis of every series -- Lowe Post podcast w/ @kirkgoldsberry on Raps-Sixers and Nuggets Blazers (plus his n… https://t.co/b5VmWjXVi8
1124005371931189200,Thu May 02 17:38:58 +0000 2019,RT @wojespn: Cleveland has been granted permission to interview Denver assistant Wes Unseld Jr., for franchise's head coaching job, league…
1124005239659561000,Thu May 02 17:38:26 +0000 2019,RT @TimBontemps: After the four Eastern Conference  powers waited all season to face one another, the start of these East semifinal series…
1124004981609246700,Thu May 02 17:37:25 +0000 2019,How the officiating debate in Rockets-Warriors is rooted in ideological differences - and not quite in the way you… https://t.co/cS4Hr8ytvK
1123970998175457300,Thu May 02 15:22:22 +0000 2019,RT @WindhorstESPN: Pleased that LeBron Inc. will debut on the New York Times Best Seller list this week. Thanks much to all the readers, th…
1123942043343044600,Thu May 02 13:27:19 +0000 2019,Lowe Post podcast: Stan Van Gundy in studio on Bucks-Celtics, Warriors-Rockets, the challenges of coaching in the p… https://t.co/3cu5adgErZ
1123936720905539600,Thu May 02 13:06:10 +0000 2019,Congrats man!!! They are lucky to have you https://t.co/9m7TmFGtVV
1123686847018876900,Wed May 01 20:33:16 +0000 2019,Lowe Post podcast: Stan Van Gundy in studio on Warriors-Rockets, Bucks-Celtics, the challenges of playoff coaching,… https://t.co/0Qj9HRPf1l
1123642759078928400,Wed May 01 17:38:04 +0000 2019,@MichelleDBeadle Oh my god
1123594630384312300,Wed May 01 14:26:49 +0000 2019,@HPbasketball I think it's foul trouble, the standards thing, the fact that G1/G2 of Clips series were probably his… https://t.co/U5pdUL5ODq
1123592023624355800,Wed May 01 14:16:28 +0000 2019,@HPbasketball It's really strange. I checked his #s today thinking, "Man, Steph hasn't been that good this playoffs… https://t.co/RU5ycDz0cv
1123587129249017900,Wed May 01 13:57:01 +0000 2019,If you're curious to learn about Khris Middleton's rise to Celtics post-season destroyer, I profiled him earlier th… https://t.co/yMs0uyO2wk
1123585367087702000,Wed May 01 13:50:01 +0000 2019,Here's a link to @kirkgoldsberry's book, which is very good and fun and also has fantastic illustrations: https://t.co/DWPJls3T3J
1123585184174096400,Wed May 01 13:49:17 +0000 2019,ICYMI: Lowe Post podcast with @kirkgoldsberry on his new book, "Sprawlball," analysis of all four conference semifi… https://t.co/fNCfpnGsXI
1123579272306876400,Wed May 01 13:25:48 +0000 2019,@MZavagno11 And I honestly don't think he's playing badly really. His switch out and denial on Klay and Steph has b… https://t.co/pGbcqVTu59
1123572175783571500,Wed May 01 12:57:36 +0000 2019,Draymond Green is the best 1-on-2 defender I've ever seen. Absolutely uncanny how he tricks guys into throwing lob… https://t.co/MSpnAsylcy
1123420464402006000,Wed May 01 02:54:45 +0000 2019,Would enjoy a normal Warriors-Rockets game of the ol' basketball, if such a thing exists anymore
1123401056174649300,Wed May 01 01:37:38 +0000 2019,Bucks had a few possessions this Q where Lopez ended up on Morris after a MIL miss -- and Giannis on Horford -- and… https://t.co/AE5mufyYmT
1123397046189350900,Wed May 01 01:21:42 +0000 2019,Giannis with ~20 1st-half minutes, MIL switching a ton -- leaving gaps here + there Boston hasn't really exploited,… https://t.co/RuYaUI6Lqz
1123376863307550700,Wed May 01 00:01:30 +0000 2019,Admitted "dweeb in a suit" @kirkgoldsberry and I talked about Milwaukee's need to make adjustments tonight. I may h… https://t.co/1lxPHLTzUG
1123348951158140900,Tue Apr 30 22:10:35 +0000 2019,RT @malika_andrews: A year of self-reflection, yoga and deep breathing exercises has led Bucks’ Eric Bledsoe to this: the ultimate mental t…
1123311834361151500,Tue Apr 30 19:43:06 +0000 2019,RT @ZachLowe_NBA: Lowe Post podcast: @kirkgoldsberry on his new book, "Sprawlball," how to bring back post-up play, Raps-Sixers, Nuggets-Bl…
1123287546232963100,Tue Apr 30 18:06:35 +0000 2019,Lowe Post podcast: @kirkgoldsberry on his new book, "Sprawlball," how to bring back post-up play, Raps-Sixers, Nugg… https://t.co/gwqSansLDs
1123239149295816700,Tue Apr 30 14:54:16 +0000 2019,Sorry -- first four games. https://t.co/EBij7GA2Qw
1123237994947842000,Tue Apr 30 14:49:41 +0000 2019,@BillSimmons Hey if you come to Boston this weekend are you going to wear a Kyrie jersey?
1123236950478151700,Tue Apr 30 14:45:32 +0000 2019,To be clear, the league assigns the officials for the first two games of each series before said series begins. https://t.co/Tmq7rGmUnb
1123234092710023200,Tue Apr 30 14:34:11 +0000 2019,RT @outsidethenba: still in awe of this https://t.co/5B68zI3pur
1123068881369796600,Tue Apr 30 03:37:41 +0000 2019,DEN-POR is gonna be fun. Jokic's pick-and-pop 3 will be something of a bellwether. DEN already got a Harris corner… https://t.co/Vw4GLZ6ajq
1123053959650791400,Tue Apr 30 02:38:23 +0000 2019,Classic Jimmy game -- super physical, a little ugly, made enough open shots, did well running point late.
1123053617035055100,Tue Apr 30 02:37:02 +0000 2019,I'm tired from watching that game. That Embiid driving score with 25 seconds left was an absolutely incredible play… https://t.co/YkRKqAthqF
1123034698161303600,Tue Apr 30 01:21:51 +0000 2019,Really nice first half minutes for Greg Monroe. Sixers adjustment of putting their centers on Siakam has worked so… https://t.co/oDt3bzYMSu
1123000302028894200,Mon Apr 29 23:05:10 +0000 2019,RT @wojespn: Rising Brooklyn star @CarisLeVert on Nets/Sixers, playing for John Beilein at Michigan, working out with Kevin Durant, returni…
1122954998718050300,Mon Apr 29 20:05:09 +0000 2019,RT @ramonashelburne: Joel Embiid was shooting 3-pointers in slippers for a “scientific “ reason. That and so much more in this great featur…
1122944324839383000,Mon Apr 29 19:22:44 +0000 2019,Brogdon returning in Boston and looking like himself would obviously be huge. He might be MIL's best driver against… https://t.co/i8ny6kesqW
1122942358616776700,Mon Apr 29 19:14:56 +0000 2019,"As we told the Rockets, we do not agree with their methodology," a league spokesman tells @Rachel__Nichols and I.… https://t.co/8anwKIVf2s
1122942104659951600,Mon Apr 29 19:13:55 +0000 2019,Reporting with @Rachel__Nichols: ESPN has obtained Houston's audit of last season's Game 7 against Golden State and… https://t.co/SGxZut8oRE
1122875910477230100,Mon Apr 29 14:50:53 +0000 2019,@onlxn This is an interesting take. I think I like it.
1122851249517416400,Mon Apr 29 13:12:54 +0000 2019,@nick_korth @stevejones20 @lockedonbucks @BehindTheBucks I didn't recommended switching.
1122849737961553900,Mon Apr 29 13:06:53 +0000 2019,Kyrie hit a 3 with like 5:20 left in the game on a Kyrie/Horford PNR when Giannis was on Horford. And Giannis was f… https://t.co/QrmopV7TeH
1122848988527566800,Mon Apr 29 13:03:55 +0000 2019,@stevejones20 Kyrie hit a 3 with like 5:20 left in the game on a Kyrie/Horford PNR when Giannis was on Horford. And… https://t.co/aYbDUaASF3
1122835446684430300,Mon Apr 29 12:10:06 +0000 2019,Last point here is key. PHI over the last month or so have tried to move Simmons a little further toward the corner… https://t.co/efc9SL0v9z
1122547402387394600,Sun Apr 28 17:05:31 +0000 2019,They should in stretches. Wrote in my preview that I think Giannis is going to have to defend Horford more in this… https://t.co/cpmQeiCPNX
1122546836932386800,Sun Apr 28 17:03:16 +0000 2019,I get the reasoning here -- Morris can either guard Lopez, or take Giannis here and there so Horford doesn't have t… https://t.co/IAAHwYB1eC
1122546088492318700,Sun Apr 28 17:00:18 +0000 2019,RT @malika_andrews: Late night workouts and skirting “lock out” days. @espn story on the Bucks‘ odd couple, Pat Connaughton and Giannis Ant…
1122540748967227400,Sun Apr 28 16:39:05 +0000 2019,ICYMI: My preview of Bucks-Celtics: Xs-and-Os, key matchups, possible adjustments, and a prediction: https://t.co/dPnvMH1bhk
1122540308800114700,Sun Apr 28 16:37:20 +0000 2019,Klay is an ironman. If he doesn't play, you know it's bad. Also might be GSW's best defensive option at this point… https://t.co/3Tu9XUhcaT
1122484548732956700,Sun Apr 28 12:55:45 +0000 2019,I'm still in shock at the Spurs mismanaging the end of that game. One of the most bizarre sequences I can remember.… https://t.co/TYNWxXjcJo
1122337605272707100,Sun Apr 28 03:11:51 +0000 2019,Jokic is kinda good at the "be a large human and get vaguely in the way" defense around the basket.
1122336753275293700,Sun Apr 28 03:08:28 +0000 2019,Millsap always seems to do the stuff Denver needs when they need it
1122323918126239700,Sun Apr 28 02:17:28 +0000 2019,League should dock the Nuggets one point for blowing those passing sequences with an airball and a pass bobbled out of bounds.
1122322184289038300,Sun Apr 28 02:10:35 +0000 2019,Wait, wait. Wait. Wait. Wait. The Raptors won Game 1.
1122320458219753500,Sun Apr 28 02:03:43 +0000 2019,@BillSimmons Seems both low and high honestly
1122319928336560100,Sun Apr 28 02:01:37 +0000 2019,This was first round in '17. Go back and watch his performance in Game 4 -- an OT loss for the Spurs. He did everyt… https://t.co/jfci821onM
1122318724948811800,Sun Apr 28 01:56:50 +0000 2019,In '17, for instance, before the Zaza thing: 28-8-4.5 on 52.5/45.5/93 shooting and peak "I'll be taking the ball fr… https://t.co/P6QK5STiIp
1122318109988261900,Sun Apr 28 01:54:23 +0000 2019,Might have gotten a little forgotten  after Zaza stepped on his foot in G1 vs GSW in '17 and then last year's thing… https://t.co/YSi7u4WMUI
1122311149276545000,Sun Apr 28 01:26:44 +0000 2019,Interesting -- don't think Embiid got a single post touch in that late 3Q stretch vs Ibaka. Maybe some fatigue afte… https://t.co/bMnWX5EtMm
1122126393503035400,Sat Apr 27 13:12:34 +0000 2019,And here is a Raptors-Sixers preview in Lowe Post podcast form with @coachthorpe: https://t.co/noc0DKiHQD
1122126210300108800,Sat Apr 27 13:11:51 +0000 2019,Bucks-Celtics preview: Matchups, adjustments, X-factors, a prediction, and more: https://t.co/dPnvMH1bhk
1121977214202011600,Sat Apr 27 03:19:47 +0000 2019,Talked w/ @NickFriedell on the pod today about how Curry needed more pick-and-rolls in GSW's good lineups. Love the… https://t.co/DXt3tIlNpH
1121976779030323200,Sat Apr 27 03:18:04 +0000 2019,If KD enjoys scoring half his team's points, I can think of some places he might like playing! /shows self out
1121953007070064600,Sat Apr 27 01:43:36 +0000 2019,Talked with @NickFriedell on the Lowe Post podcast today about who GSW might start tonight, and Livington's decline… https://t.co/Jn1vQBDbUd
1121952039985086500,Sat Apr 27 01:39:45 +0000 2019,So the Clippers PR account -- a protected account only media can follow -- just tweeted these starting lineups. https://t.co/CQ90cjFSSk
1121883288275181600,Fri Apr 26 21:06:34 +0000 2019,Lowe Post podcasts this week: @arnovitz on Dame's shot, OKC fallout, East playoffs: https://t.co/7RUJ3p3C0u Two-par… https://t.co/JBEg5Z0iVc
1121855407729840100,Fri Apr 26 19:15:46 +0000 2019,Lowe Post podcast: @coachthorpe returns to preview Raps-Sixers, and talk a little Nugget-Spurs Game 7. Then… https://t.co/w433mVj9Lq
1121842399330938900,Fri Apr 26 18:24:05 +0000 2019,That's it? https://t.co/Oq8zZWwUdU
1121804969924022300,Fri Apr 26 15:55:21 +0000 2019,Lowe Post podcast: @coachthorpe returns to preview Raps-Sixers, plus some Nuggets-Spurs G7 talk. Then @NickFriedell… https://t.co/HLhQlwaKX8
1121775844551163900,Fri Apr 26 13:59:37 +0000 2019,@HPbasketball The Spurs.
1121775647808983000,Fri Apr 26 13:58:50 +0000 2019,@HPbasketball Also Poeltl/Jake Puddle has been quite good for them in this series
1121597497934319600,Fri Apr 26 02:10:56 +0000 2019,Spurs are shooting 58%, 9/20 on 3s, and have 6 turnovers. I'm no analytic but that seems good.
1121594682050584600,Fri Apr 26 01:59:45 +0000 2019,This is an awesome game. Not sure if that 3Q was the best Q of Jokic's career, but there can't have been that many… https://t.co/cnXP72prKW
1121545817159086100,Thu Apr 25 22:45:34 +0000 2019,RT @ZachLowe_NBA: Lowe Post podcast: @kevinarnovitz and I talk Dame's shot, Portland's resiliency, the fallout for OKC, the East semis, Pho…
1121521698799484900,Thu Apr 25 21:09:44 +0000 2019,The inflatable Raptor making it into Game of Zones is an all-timer. "And Jake Puddle!" https://t.co/tS3cYmTQ0x
1121521214080602100,Thu Apr 25 21:07:48 +0000 2019,Green has changed that entire series. https://t.co/GX1lV7lp4H
1121416702238044200,Thu Apr 25 14:12:31 +0000 2019,Winners and Losers of the first round so far: https://t.co/nIbFSyY2nW
1121407673948307500,Thu Apr 25 13:36:38 +0000 2019,RT @ZachLowe_NBA: Lowe Post podcast: @kevinarnovitz and I chat Dame's shot, Portland's resurgence, the fallout for OKC, East powerhouses, P…
1121238193196732400,Thu Apr 25 02:23:11 +0000 2019,Rubio and O'Neale have been great tonight keeping Utah in this -- O'Neale all series really. Rubio more up and down… https://t.co/Fe4qHGgQw0
1121122181289635800,Wed Apr 24 18:42:12 +0000 2019,Lowe Post podcast: @kevinarnovitz and I chat Dame's shot, Portland's resurgence, the fallout for OKC, East powerhou… https://t.co/W8khnYvxEK
1121080794662023200,Wed Apr 24 15:57:44 +0000 2019,Lowe Post podcast: @kevinarnovitz and I talk Dame's shot, Portland's resiliency, the fallout for OKC, the East semi… https://t.co/8ps4WpF2Xk
1121033063100764200,Wed Apr 24 12:48:04 +0000 2019,LOL Lamar literally couldn't move for like an hour-plus after the Dame shot. PS: Lamar is a joy, and super sharp, o… https://t.co/FB8tHti5VH
1120904951763492900,Wed Apr 24 04:19:00 +0000 2019,This is the first round: went to Raps-Magic in Toronto, got back to hotel and watched Nuggets-Spurs from tip till g… https://t.co/a5G5jqh0LN
1120904500577960000,Wed Apr 24 04:17:12 +0000 2019,Damian Lillard is a bad, bad, bad, bad, bad, bad baaaaaaaaaaaaaaadddddd man
1120841725029826600,Wed Apr 24 00:07:46 +0000 2019,Time to put Lowry on some sort of charge management program.
1120692129704005600,Tue Apr 23 14:13:19 +0000 2019,Also we will have an @kevinarnovitz Lowe Post podcast tomorrow from Toronto (we are both here). Recall that Kevin w… https://t.co/e53FMKCpIU
1120691889135444000,Tue Apr 23 14:12:22 +0000 2019,Have been watching a lot of Bucks-Celtics film the last couple of days (sorry Pistons fans) with an eye on writing… https://t.co/ML3xq8GTG7
1120337623262933000,Mon Apr 22 14:44:38 +0000 2019,Obvious future NBA star right here https://t.co/x54pgCFtCi
1120135708612624400,Mon Apr 22 01:22:18 +0000 2019,Toronto help and recover rotations since Game 1 have been scary good. Kawhi with a few of those "where exactly did… https://t.co/LfEaRKj9o8
1120007718432124900,Sun Apr 21 16:53:43 +0000 2019,Whoa https://t.co/mrzassBFJS
1119961356566970400,Sun Apr 21 13:49:29 +0000 2019,Our @TimBontemps with an update on what was one of my Six Most Intriguing Questions for the season back in October:… https://t.co/Bum7t5Q6Wa
1119715397325008900,Sat Apr 20 21:32:08 +0000 2019,Last with the ball wins?
1119698438625607700,Sat Apr 20 20:24:45 +0000 2019,A FRACAS!!!
1119621777263661000,Sat Apr 20 15:20:07 +0000 2019,RT @ZachLowe_NBA: Lowe Post podcast: @YourManDevine and I dig into two of the series that resume tonight: Celtics-Pacers, Thunder-Blazers -…
1119603800384446500,Sat Apr 20 14:08:41 +0000 2019,Harden column goes into a specific alignment Houston is using more to combat the Bucks "force him right, stay at th… https://t.co/ZNU1EQxyKk
1119603372443746300,Sat Apr 20 14:06:59 +0000 2019,How James Harden is destroying Utah any way he wants, and how he built out his game after his greatest humiliation… https://t.co/DrLUNn7CQ8
1119405966448037900,Sat Apr 20 01:02:34 +0000 2019,@SedanoESPN READ THE TWEET SEDANO.
1119240656763936800,Fri Apr 19 14:05:41 +0000 2019,RT @mcten: New story: With Joel Embiid out, Ben Simmons more than made up for his absence in a dominant Game 3 win in Brooklyn https://t.co…
1119228293721612300,Fri Apr 19 13:16:34 +0000 2019,Lowe Post podcast: @YourManDevine and I dig into two of the series that resume tonight: Celtics-Pacers, Thunder-Bla… https://t.co/aRQ9QjHOJT
1119087669353390100,Fri Apr 19 03:57:46 +0000 2019,See, about that... https://t.co/KOQi66xOD6
1119084206565412900,Fri Apr 19 03:44:01 +0000 2019,Derrick White very nearly played a perfect basketball game.
1119052938033487900,Fri Apr 19 01:39:46 +0000 2019,Not a shocker obviously, but Dwight Howard has opted into his $5.6 million deal for next season (player option) wit… https://t.co/LsdSFUTMfJ
1119004805278650400,Thu Apr 18 22:28:30 +0000 2019,RT @ZachLowe_NBA: Lowe Post podcast: @YourManDevine in studio to hop around Thunder-Blazers, Westbrook's nightmare series so far, Dame, Har…
1118970106552442900,Thu Apr 18 20:10:37 +0000 2019,Lowe Post podcast: @YourManDevine in studio to hop around Thunder-Blazers, Westbrook's nightmare series so far, Dam… https://t.co/JgI0lI1PAs
1118909827923808300,Thu Apr 18 16:11:05 +0000 2019,@AllTheBucks Bucks aren't exactly coaching this/adjusting like they are in a high-stakes playoff series at this point.
1118885156729831400,Thu Apr 18 14:33:03 +0000 2019,@danclayt0n Yeah -- I just can't take the CTG #s as evidence half-court D is working. Even last night, HOU's half-c… https://t.co/BpzFtVqwSS
1118884237862740000,Thu Apr 18 14:29:24 +0000 2019,@danclayt0n https://t.co/zOTgD444JP
1118883504857722900,Thu Apr 18 14:26:30 +0000 2019,@danclayt0n Thanks. Interesting. The Inpredictable #s -- which perhaps aren't as sophisticated distinguishing every… https://t.co/ZMfmG18kCB
1118882476372504600,Thu Apr 18 14:22:24 +0000 2019,@danclayt0n Where are you seeing these numbers? On Inpredictable I'm seeing very different PPP #s based on situation
1118688040015290400,Thu Apr 18 01:29:47 +0000 2019,Also cool to see Boston closing with the lineup that started their season before things got wacky -- Kyrie/Brown/Ta… https://t.co/O564UTWVjC
1118687718240866300,Thu Apr 18 01:28:30 +0000 2019,Absolute crusher for the Pacers. Thought BOS waited a little too long to milk the Kyrie/wing PNRs targeting Bogdano… https://t.co/qh8HV5jRGS
1118652027599503400,Wed Apr 17 23:06:41 +0000 2019,This is such bummer after an All-NBA-caliber season for Blake https://t.co/w9hcbgRdjP
1118573474329563100,Wed Apr 17 17:54:33 +0000 2019,RT @breannastewart: https://t.co/0HpgWmM8w5
1118546326604734500,Wed Apr 17 16:06:40 +0000 2019,RT @ZachLowe_NBA: Quickie Lowe Post podcast this morning with Richard Jefferson (@Rjeff24) in studio breaking down Clippers comeback, Cousi…
1118544270820921300,Wed Apr 17 15:58:30 +0000 2019,RT @malika_andrews: Brook Lopez honed his shooting touch against his twin and refined it once injuries left him with a “bionic foot.” Now,…
1118360363572109300,Wed Apr 17 03:47:43 +0000 2019,Denver doesn't win that game without Malik Beasley. Big minutes before Jamal Murray went bananas. Overall, still an… https://t.co/uuIYQFHCPt
1118282203857920000,Tue Apr 16 22:37:08 +0000 2019,KEGGY! @rembert https://t.co/BNpDsfuHhX
1118274588641775600,Tue Apr 16 22:06:53 +0000 2019,RT @ZachLowe_NBA: What to watch for in Raptors-Magic and Nuggets-Spurs as two No. 2 seeds look to right themselves: Xs-and-Os, trends, adju…
1118274154942406700,Tue Apr 16 22:05:09 +0000 2019,Mother-in-law Raptors fan in Toronto as Game 2 approaches: "They must win today." She may have threatened to storm the court if they do not.
1118245373150154800,Tue Apr 16 20:10:47 +0000 2019,Quickie Lowe Post podcast this morning with Richard Jefferson (@Rjeff24) in studio breaking down Clippers comeback,… https://t.co/2F4QOhXOdy
1118185452232740900,Tue Apr 16 16:12:41 +0000 2019,Lowe Post podcast: Richard Jefferson (@Rjeff24) in studio this morning on GSW-Clippers comeback, Boogie's injury, s… https://t.co/1OtViI8Z3O
1118162242401390600,Tue Apr 16 14:40:27 +0000 2019,What to watch for in Raptors-Magic and Nuggets-Spurs as two No. 2 seeds look to right themselves: Xs-and-Os, trends… https://t.co/GKAmv3snHI
1118161993192673300,Tue Apr 16 14:39:28 +0000 2019,Update: I was already clowned for this tweet in person on Get Up this morning, and I deserve it fully. Give me all… https://t.co/XRw9xHesci
1118000882950471700,Tue Apr 16 03:59:16 +0000 2019,(This is about the inevitability of the respective 1-8 series, nothing more) https://t.co/hxDVIt0EAC
1118000527449759700,Tue Apr 16 03:57:51 +0000 2019,Clippers are playing hard, and kinda well, and there's just nothing they can do. Can we set up a couple of Bucks-Wa… https://t.co/L2BsTRlbbc
1117572463272054800,Sun Apr 14 23:36:53 +0000 2019,RT @CJMcCollum: 🤣😂 I almost forgot you JENNIFER 😂 you a legend https://t.co/KnZ85zwqYG
