id,created_at,text
1196576819513708500,Mon Nov 18 23:51:59 +0000 2019,1. Thanks to Mike, Jen, and Joe, who made this happen; 2. I was also at the Pratt game. 3. Oh my god Biscotti Pippe… https://t.co/RmyTi1HfNa
1196513678729695200,Mon Nov 18 19:41:05 +0000 2019,Lowe Post podcast: @KenTremendous, @JoeMande, and @jenstatsky on their NBA fandom; the origin of BORTLES and tons o… https://t.co/fGcGgVGV7d
1196478240828747800,Mon Nov 18 17:20:16 +0000 2019,Recording shortly in LA: NBA/Good Place crossover Lowe Post podcast with @KenTremendous (Celtics fan) and writers… https://t.co/kzty1OEtTs
1195697901382643700,Sat Nov 16 13:39:29 +0000 2019,RT @wojespn: Full Woj Pod with Bradley Beal: https://t.co/9OHR1RyVLQ https://t.co/zFO1GeT5KZ
1195693971026174000,Sat Nov 16 13:23:52 +0000 2019,The Wizards rank 3rd in offensive efficiency and Moe Wagner leads the league in true shooting percentage. This is a tweet about the NBA.
1195444488065433600,Fri Nov 15 20:52:30 +0000 2019,This week's 10 Things: https://t.co/6wsXI5xz3I  Lowe Post podcast with @HowardBeck on Knicks/Wiggins/Lakers:… https://t.co/vzRvde6WrI
1195352629188157400,Fri Nov 15 14:47:30 +0000 2019,Lowe Post podcast w/ @HowardBeck: the Knicks crazy week, the renewed Andrew Wiggins, and a check-in on the LeBron/A… https://t.co/EqlU2RfpEc
1195340667574194200,Fri Nov 15 13:59:58 +0000 2019,Friday = 10 Things I Like + Don't Like, starring a rude dunker, the Celtics flying around, an all-time contract yea… https://t.co/IPAnbyGUN8
1195098569629417500,Thu Nov 14 21:57:57 +0000 2019,Lowe Post podcast: @HowardBeck and I talk Knicks chaos, the new Andrew Wiggins, the 9-2 Lakers, more: https://t.co/qPhsgZnwKz
1195027952356012000,Thu Nov 14 17:17:21 +0000 2019,RT @DavidZenon1: @ricohinesbball has a HUGE hand in his development in the offseason. Phil Handy is a miracle worker and he got Spicy right…
1194998712319303700,Thu Nov 14 15:21:09 +0000 2019,ICYMI: Rick Carlisle hopped on the Lowe Post podcast ahead of tonight's Porzingis Bowl to talk Luka/KP, 2011 title,… https://t.co/wG7OG08Lp8
1194992666087510000,Thu Nov 14 14:57:08 +0000 2019,I mean, like, this just doesn't happen. https://t.co/O3IK0zuEZc
1194992334410309600,Thu Nov 14 14:55:49 +0000 2019,Pascal Siakam last season: 29% of  3-point attempts came from above the he break. He shot 27% on those.   Pascal Si… https://t.co/CSkMj4ZKr6
1194830516043878400,Thu Nov 14 04:12:48 +0000 2019,Whoa boy https://t.co/Zv0jrscjtL
1194821377611702300,Thu Nov 14 03:36:29 +0000 2019,Looks where this Anfernee Simons floater hit the backboard. (It went in). https://t.co/Sfd2n1rEwP
1194697964603822000,Wed Nov 13 19:26:05 +0000 2019,And ICYMI on Friday, @Herring_NBA I talked more Luka/KP, surprising Suns, Russ/Harden fit so far, and why the Spurs… https://t.co/14kHGwa3mo
1194673913097343000,Wed Nov 13 17:50:31 +0000 2019,Lowe Post podcast: Mavs coach Rick Carlisle on Luka and Porzingis, the atmosphere awaiting at MSG tomorrow, Mountai… https://t.co/ogXwDOUV5Y
1194640819401216000,Wed Nov 13 15:39:01 +0000 2019,Wonderful stuff from KA https://t.co/Vc8hjMx9iG
1194411736604000300,Wed Nov 13 00:28:43 +0000 2019,RT @ZachLowe_NBA: Lowe Post podcast: Mavs coach Rick Carlisle on Luka and Porzingis, the atmosphere at MSG Thursday, the Malice at the Pala…
1194343059883999200,Tue Nov 12 19:55:49 +0000 2019,Lowe Post podcast: Mavs coach Rick Carlisle on Luka and Porzingis, the atmosphere at MSG Thursday, the Malice at th… https://t.co/q34cRwITKA
1194238430689009700,Tue Nov 12 13:00:04 +0000 2019,Early-season sample size alert: Through 9 games, the 8-1 Celtics have what would be the lowest turnover rate in NBA… https://t.co/aeaq6kKPQx
1194063258682089500,Tue Nov 12 01:24:00 +0000 2019,A teammate stepped on Fox's foot during practice, sources say.
1194062657634078700,Tue Nov 12 01:21:36 +0000 2019,Update: Fox has been diagnosed with a left ankle sprain and will be re-evaluated in 3-4 weeks, team says. https://t.co/q3lN9uhLl9
1194022752967168000,Mon Nov 11 22:43:02 +0000 2019,Sacramento's De'Aaron Fox suffered an apparent ankle sprain at practice today, sources tell @wojespn and me. Kings… https://t.co/myTNTq60qG
1193940921164931000,Mon Nov 11 17:17:52 +0000 2019,RT @wojespn: Even before Sunday news conference, Knicks president Steve Mills had started to lay internal groundwork for the eventual ouste…
1193883482965119000,Mon Nov 11 13:29:38 +0000 2019,The Cavs starting five -- having played 2nd-most minutes of any five-man lineup so far -- outscoring opponents by 1… https://t.co/nJ0jGtNE98
1193587019479425000,Sun Nov 10 17:51:35 +0000 2019,Uh oh https://t.co/brEnc8kNh7
1193225765464281000,Sat Nov 09 17:56:06 +0000 2019,RT @ZachLowe_NBA: Lowe Post podcast: @Herring_NBA and I talk load management, then bounce around some of the interesting non-LA teams in th…
1192895540570329000,Fri Nov 08 20:03:54 +0000 2019,RT @ZachLowe_NBA: Lowe Post podcast: @Herring_NBA and I on load management, plus deep dives on Suns, Mavs, Rockets and Spurs: https://t.co/…
1192880165556293600,Fri Nov 08 19:02:48 +0000 2019,Excerpt from yesterday's Lowe Post podcast with @herring_nba (full podcast here https://t.co/FXOd1Qar3k) https://t.co/xW31wWkt7C
1192818986205012000,Fri Nov 08 14:59:42 +0000 2019,RT @wojespn: An illuminating Jackie MacMullan story on Cleveland Cavaliers assistant coach Lindsay Gottlieb. https://t.co/c45FPOd9MD
1192806880445378600,Fri Nov 08 14:11:36 +0000 2019,Lowe Post podcast: @Herring_NBA and I on load management, plus deep dives on Suns, Mavs, Rockets and Spurs:… https://t.co/AtN0oyrXMz
1192806407923482600,Fri Nov 08 14:09:43 +0000 2019,Friday = 10 Things I Like + Don't Like, starring Luka magic, some under-performing centers, Booker-Rubio, the leagu… https://t.co/s6Z9Qd6j4b
1192534887208804400,Thu Nov 07 20:10:47 +0000 2019,Suns talk on the Lowe Post with @Herring_NBA starts around 11:00 in. We switch to Houston around 30:00, San Antonio… https://t.co/JdqeZ4gzit
1192534529535357000,Thu Nov 07 20:09:22 +0000 2019,Lowe Post podcast: @Herring_NBA and I talk load management, then bounce around some of the interesting non-LA teams… https://t.co/NLGfPBbrkK
1192444650931527700,Thu Nov 07 14:12:13 +0000 2019,Giannis is averaging 29-14.3-7.6 and shooting 68% on 2s. Feels like he's entered the territory where that sort of p… https://t.co/Q8GKcV5kH3
1192252516102262800,Thu Nov 07 01:28:45 +0000 2019,He was in 10 Things last week, but it bears repeating: OG Anunoby has been fantastic this season on both ends. Pass… https://t.co/UycPl3ky2e
1192178304528343000,Wed Nov 06 20:33:52 +0000 2019,@Cosmis You may enjoy 10 Things this week.
1192165751727304700,Wed Nov 06 19:43:59 +0000 2019,RT @ZachLowe_NBA: With Golden State in Houston tonight, lamenting the missed chance to see Stephen Curry play like he did before Kevin Dura…
1192121640492163000,Wed Nov 06 16:48:42 +0000 2019,I have a very important update: I just walked out of the house to get coffee wearing slippers.
1192099972126322700,Wed Nov 06 15:22:36 +0000 2019,The Orlando Magic offense through seven games https://t.co/VnzgrMLlOg
1192089368300834800,Wed Nov 06 14:40:28 +0000 2019,Thanks to @kpelton for providing some research here. Read his piece on the value of roster continuity today:… https://t.co/rIcO3wlnUR
1192087429869645800,Wed Nov 06 14:32:45 +0000 2019,With Golden State in Houston tonight, lamenting the missed chance to see Stephen Curry play like he did before Kevi… https://t.co/kSfkHByFLq
1191743582505492500,Tue Nov 05 15:46:26 +0000 2019,@johnhollinger @minakimes @KevinColePFF At least I don't watch the games on my TI-85, nerd boy
1191740002193031200,Tue Nov 05 15:32:12 +0000 2019,Yikes https://t.co/6leRaEJRMZ
1191728876856184800,Tue Nov 05 14:48:00 +0000 2019,@KevinOConnorNBA Are you pumped and jacked though?
1191573363497590800,Tue Nov 05 04:30:02 +0000 2019,Ariza for Oubre was a sneaky good trade by the Suns -- preying on Wiz desperation. Devin Booker is better this seas… https://t.co/n2FbjjGlBm
1191535853258100700,Tue Nov 05 02:00:59 +0000 2019,Rim mics are constantly catching @moritz_weasley (Moe Wagner) shouting encouraging things at teammates, and now I k… https://t.co/2ifFyCReup
1191388663386640400,Mon Nov 04 16:16:06 +0000 2019,RT @ZachLowe_NBA: And ICYM either Lowe Post podcast this week:  A candid @ZachLaVine on all things Bulls: https://t.co/AN6DgmTKtl  Jay Will…
1191146561859989500,Mon Nov 04 00:14:05 +0000 2019,If you're not watching Rockets-Heat, yes, Houston's defense has been as bad as the score suggests. Miami is playing… https://t.co/eoHZKJLGt6
1191134337623888000,Sun Nov 03 23:25:30 +0000 2019,@vesnajaksic In my defense (and this is real), I was very excited to dig into the second half of Saturday night's Memphis-Phoenix game.
1191035164970889200,Sun Nov 03 16:51:26 +0000 2019,Proud to have been the guest on one of these episodes. Gonna be a really fun series https://t.co/95uBjBSPwo
1190680120568287200,Sat Nov 02 17:20:37 +0000 2019,Excerpt from recent Lowe Post podcast with Jay Williams https://t.co/Y1BuFU3lBi https://t.co/QJzTX23rcv
1190625288016801800,Sat Nov 02 13:42:44 +0000 2019,Some good Goga minutes last night for the Pacers. Gonna be interesting to see how they negotiate Turner's absence.… https://t.co/DOWDemgFv2
1190327239637962800,Fri Nov 01 17:58:23 +0000 2019,10 Things: https://t.co/VtwvuFMhWt  Lowe Post podcast: Jay Williams on Steph's injury/GSW tanking, early-season sur… https://t.co/tUWpsbLJyu
1190276729648103400,Fri Nov 01 14:37:41 +0000 2019,Mentioned on podcast yesterday that MIL in early going is last in % of shots at rim after ranking 2nd last season.… https://t.co/bXDBRpfoY3
1190276125630578700,Fri Nov 01 14:35:17 +0000 2019,@BillSimmons Be careful. It's very hard to escape the Thybulle Archipelago.
1190258939813933000,Fri Nov 01 13:26:59 +0000 2019,And ICYM either Lowe Post podcast this week:  A candid @ZachLaVine on all things Bulls: https://t.co/AN6DgmTKtl  Ja… https://t.co/JvQUkbmebx
1190258262131847200,Fri Nov 01 13:24:18 +0000 2019,Friday = 10 (11 this week!) Things I Like + Don't Like starring another Heat find, KAT, another young Raptor rising… https://t.co/TmMmPuA6MQ
1190113267072540700,Fri Nov 01 03:48:08 +0000 2019,Talked for a bit about things in Denver looking just a little off on the Lowe Post with Jay Williams today. DEFCON… https://t.co/6Klgtje7th
1189995470099296300,Thu Oct 31 20:00:03 +0000 2019,RT @ZachLowe_NBA: Lowe Post podcast: Jay Williams (@RealJayWilliams) and I talk Steph Curry's injury/GSW tank potential + Embiid-KAT, and r…
1189955134379450400,Thu Oct 31 17:19:46 +0000 2019,Lowe Post podcast: Jay Williams (@RealJayWilliams) and I talk Steph Curry's injury/GSW tank potential + Embiid-KAT,… https://t.co/NOWWqxXd9B
1189940692338053000,Thu Oct 31 16:22:23 +0000 2019,I am really enjoying PJ Washington. Hit one of the softest half hooks you will see all season last night vs SAC. Re… https://t.co/CQIgqu43H7
1189885216015470600,Thu Oct 31 12:41:57 +0000 2019,For the record, here's the Lowe Post podcast from last month where Joel Embiid vowed to stop talking trash. I begge… https://t.co/5DChdMa8py
1189292562265399300,Tue Oct 29 21:26:57 +0000 2019,You got it backwards @HowardBeck https://t.co/RHp5s2DCRm
1189277686314782700,Tue Oct 29 20:27:50 +0000 2019,RT @ZachLowe_NBA: ICYMI: Lowe Post podcast with @ZachLaVine on Jim Boylen and the Bulls' future, the dunk contest, his Vontae Mack story, K…
1189210777368105000,Tue Oct 29 16:01:58 +0000 2019,ICYMI: Lowe Post podcast with @ZachLaVine on Jim Boylen and the Bulls' future, the dunk contest, his Vontae Mack st… https://t.co/Ht1hIvAKBE
1189003433145241600,Tue Oct 29 02:18:03 +0000 2019,Liked Kerr starting Draymond at C tonight. Cutting/passing lanes were  open, reads were easier in more space. Also… https://t.co/C6PvHzQkpO
1188992882927198200,Tue Oct 29 01:36:08 +0000 2019,Love the adjustment NYK made tonight using Randle as the roll/dive man with Portis spacing. Helped get the offense… https://t.co/Tln9D1vzq5
1188906439315808300,Mon Oct 28 19:52:38 +0000 2019,RT @ZachLowe_NBA: Lowe Post podcast: Zach LaVine on Jim Boylen and the future of the Bulls, his Vontae Mack story, the dunk contest, learni…
1188836167917211600,Mon Oct 28 15:13:24 +0000 2019,Really enjoyed this conversation with LaVine. https://t.co/XtI905dxRt
1188833049359847400,Mon Oct 28 15:01:01 +0000 2019,Legitimately great moment seeing the Wolves bench mob Wiggins after his third straight crunch-time three last night… https://t.co/McXiZ9774e
1188814997947850800,Mon Oct 28 13:49:17 +0000 2019,Lowe Post podcast: Zach LaVine on Jim Boylen and the future of the Bulls, his Vontae Mack story, the dunk contest,… https://t.co/AaDCLu7sNh
1188245856195092500,Sun Oct 27 00:07:43 +0000 2019,The Bam Adebayo Experience is going to be really fun this season.
1188108512267776000,Sat Oct 26 15:01:57 +0000 2019,@TommyBeer Yeah I liked that one a bit less from a home favorite with no foul issues, but Kyrie got a decent look
1188104485467512800,Sat Oct 26 14:45:57 +0000 2019,Really interesting decision by the Suns last night to play for the win down by 1 -- i.e. to shoot nearly at the buz… https://t.co/Ch9nRq03h6
1187785788114821000,Fri Oct 25 17:39:34 +0000 2019,RT @ZachLowe_NBA: Lowe Post podcast with @WindhorstESPN (extensions, trade and free agency markets) and @minakimes (opening week, cat peopl…
1187738850329796600,Fri Oct 25 14:33:03 +0000 2019,@feltbot I mean Steph got 28 ball screens last night per @SecondSpectrum, which is a good chunk by his standards, b… https://t.co/qoV0EByEhX
1187731425598021600,Fri Oct 25 14:03:33 +0000 2019,I realize it's not rocket science for a player at his level, but Kawhi has already shown high-level pick-and-roll c… https://t.co/M8Fk596Ftr
1187535292875661300,Fri Oct 25 01:04:11 +0000 2019,Discussed on yesterday's Lowe Post with @WindhorstESPN how the rush of extensions (https://t.co/ratLLZoiZj) made an… https://t.co/1JpYQJEpTc
1187532846308712400,Fri Oct 25 00:54:28 +0000 2019,RT @wojespn: Suns center Deandre Ayton is facing a 25-game suspension for violating NBA’s Anti-Drug policy with a positive test for a diure…
1187467984983515100,Thu Oct 24 20:36:44 +0000 2019,Lowe Post podcast with @WindhorstESPN (extensions, trade and free agency markets) and @minakimes (opening week, cat… https://t.co/E8ryOIDiOU
1187398234953531400,Thu Oct 24 15:59:34 +0000 2019,Also: a Lou Williams revelation that had me reeling in the Clippers locker-room Tuesday and wondering if I am the v… https://t.co/fWZMUzBRIC
1187380481165123600,Thu Oct 24 14:49:01 +0000 2019,Also THYBULLE @BillSimmons https://t.co/Vx3YEvH2ih
1187369416813510700,Thu Oct 24 14:05:03 +0000 2019,Lowe Post podcast: @WindhorstESPN and I talk this week's extensions, and what comes next in the trade and free agen… https://t.co/CzL8fe9rl7
1187150930648563700,Wed Oct 23 23:36:52 +0000 2019,The one and only @minakimes just made her first Lowe Post appearance and called me a cat person and honestly I'm no… https://t.co/2TfgJneD2J
1187109904873476000,Wed Oct 23 20:53:51 +0000 2019,RT @jeskeets: The @ringer gotta give @KevinOConnorNBA his own podcast called Pumped &amp; Jacked.
1187096718132646000,Wed Oct 23 20:01:27 +0000 2019,RT @TimBontemps: New ESPN story: Few things have been talked about more, and happen less, than Ben Simmons jump shots. But don't expect tha…
1187067822418980900,Wed Oct 23 18:06:38 +0000 2019,Hit this on the post-game pod last night, will elaborate a bit today. @SecondSpectrum has the # of AD post-ups even… https://t.co/2BBihiqQcj
1187053601010569200,Wed Oct 23 17:10:07 +0000 2019,RT @ZachLowe_NBA: Lowe Post/Hoop Collective crossover podcast from overnight: @windhorst and I talk Lakers-Clippers, Game 1, from the court…
1187021367423553500,Wed Oct 23 15:02:02 +0000 2019,Lowe Post/Hoop Collective crossover podcast from overnight: @windhorst and I talk Lakers-Clippers, Game 1, from the… https://t.co/VKbOEv43FW
1186714071695085600,Tue Oct 22 18:40:57 +0000 2019,RT @IanBegley: Mitchell Robinson will donate $100 per block this year - and NYK will donate $50 per block - to the platform they’ve created…
1186646832715305000,Tue Oct 22 14:13:46 +0000 2019,RT @ZachLowe_NBA: Annual preview columns:   6 Most Intriguing Players:  https://t.co/5TTVvIam2S  Tiers of the NBA: https://t.co/yMf0NEGmrL…
1186646758916530200,Tue Oct 22 14:13:28 +0000 2019,RT @ZachLowe_NBA: ICYMI  Lowe Post podcast: I talk LeBron/China, then JVG and I preview the season: https://t.co/EW7ovkL1z5  Lowe Post podc…
1186383086243799000,Mon Oct 21 20:45:44 +0000 2019,RT @wojespn: Zion Williamson has surgery today to repair torn meniscus in right knee and is expected to miss six to eight weeks, Pels say.
1186354434718105600,Mon Oct 21 18:51:53 +0000 2019,RT @Sedano: Sitting in for @Rachel__Nichols on #TheJump. Joined by @RealMikeWilbon &amp; @ZachLowe_NBA.  Topics: Siakam, Hield &amp; Quinn Snyder e…
1186312247435354000,Mon Oct 21 16:04:15 +0000 2019,MINA FOR THE WIN https://t.co/Epis8x6y5v
1186287946741108700,Mon Oct 21 14:27:41 +0000 2019,@vesnajaksic I did. But I know more Croatian than that!!!
1186285706257162200,Mon Oct 21 14:18:47 +0000 2019,Meanwhile, in non-NBA news, it's a little dusty in my downtown LA hotel room right now. https://t.co/z2JERaOKfp
1186284529893306400,Mon Oct 21 14:14:06 +0000 2019,Annual preview columns:   6 Most Intriguing Players:  https://t.co/5TTVvIam2S  Tiers of the NBA:… https://t.co/p7iZcq7TYF
1186283793658736600,Mon Oct 21 14:11:11 +0000 2019,ICYMI  Lowe Post podcast: I talk LeBron/China, then JVG and I preview the season: https://t.co/EW7ovkL1z5  Lowe Pos… https://t.co/FdkOltCSlT
1185679679279243300,Sat Oct 19 22:10:39 +0000 2019,https://t.co/GDv7jpRsb2
1185632584698601500,Sat Oct 19 19:03:30 +0000 2019,RT @wojespn: Toronto Raptors forward Pascal Siakam has agreed to a four-year, max contract extension, agents @TRamasar and @choufani_lsme t…
1185282792701288400,Fri Oct 18 19:53:33 +0000 2019,@Ben_Dowsett Yeah I mention RoCo as a sensible Jazz target later in the column
1185208045195927600,Fri Oct 18 14:56:32 +0000 2019,RT @ZachLowe_NBA: Lowe Post podcast: Thoughts on LeBron's China comments, plus JVG and I bounce around the big questions of the 2019-20 NBA…
1185207985427144700,Fri Oct 18 14:56:18 +0000 2019,RT @ZachLowe_NBA: Lowe Post podcast: @Baxter takes us behind the scenes of his feature on Carmelo Anthony being out of the league -- plus s…
1185201154692702200,Fri Oct 18 14:29:09 +0000 2019,Last annual preseason column: 35 weird, random, bold, some not-so-bold, and wild predictions for the 2019-20 NBA se… https://t.co/gQMXnPTVIV
1185177680674742300,Fri Oct 18 12:55:53 +0000 2019,@TasMelas Not that I have much occasion these days, but I will always, always type "Jose Calderson" on first attemp… https://t.co/QkxlT09FpW
1184989451111534600,Fri Oct 18 00:27:55 +0000 2019,@SmoothsHoops @Baxter Means a lot coming from you! Thanks for listening
1184898614327468000,Thu Oct 17 18:26:58 +0000 2019,RT @JohnGonzalez: Ever wonder how non-superstars carve out long careers in the NBA? @YourManDevine explains and absolutely kills it in HIS…
1184874612309532700,Thu Oct 17 16:51:36 +0000 2019,Yesterday's Melo-centric Lowe Post podcast with @baxter also gets into the recent mid-range jumper kerfuffle center… https://t.co/VEtbofqgyq
1184872713875312600,Thu Oct 17 16:44:03 +0000 2019,Read @kevinarnovitz on how the  Clippers might look on the floor: https://t.co/pZAJ3FNQRR
1184833888474075100,Thu Oct 17 14:09:46 +0000 2019,NEEERRRRRDDDDSSSSSSSSSS (but this will be a good podcast) https://t.co/4xb0aFWTgx
1184832813243293700,Thu Oct 17 14:05:30 +0000 2019,And ICYMI Excerpt from Tuesday's Lowe Post podcast season preview with JVG (Full pod https://t.co/EOY1i6gheG) https://t.co/pQvoRdjuLB
1184816294958391300,Thu Oct 17 12:59:52 +0000 2019,Here is @Baxter's piece on Melo from yesterday: https://t.co/R72dsRzZ8S
1184816168755978200,Thu Oct 17 12:59:22 +0000 2019,Lowe Post podcast: @Baxter takes us behind the scenes of his feature on Carmelo Anthony being out of the league --… https://t.co/OyibCizl0t
1184802714691297300,Thu Oct 17 12:05:54 +0000 2019,This was the draft of my Beal prediction section. He faced a really interesting choice and found a middle ground. H… https://t.co/sREL9AONvJ
1184801461483593700,Thu Oct 17 12:00:55 +0000 2019,RT @wojespn: Jumping on @GetUpESPN at 8 AM ET to report out all the implications for Bradley Beal's remarkable commitment to stay the cours…
1184800956749353000,Thu Oct 17 11:58:55 +0000 2019,One of my 30 random/crazy/weird/bold predictions came true before the column publish date (tentatively tomorrow)! I… https://t.co/YxcHdvwHWE
1184454569687949300,Wed Oct 16 13:02:30 +0000 2019,Lowe Post podcast: Thoughts on LeBron's China comments, plus JVG and I bounce around the big questions of the 2019-… https://t.co/7o7F79s0oU
1184289859080466400,Wed Oct 16 02:08:00 +0000 2019,RT @mcten: New story: Six days, two games and whole lot of uncertainty caused by one deleted tweet. A trip to China with LeBron, the Lakers…
1184165171155165200,Tue Oct 15 17:52:32 +0000 2019,Lowe Post podcast: Talking LeBron's comments on China, and then the Notorious JVG and I preview the 2019-20 season… https://t.co/ySsvnKBtUJ
1183906464131367000,Tue Oct 15 00:44:31 +0000 2019,RT @Rachel__Nichols: A tense meeting between the Lakers, Nets and Adam Silver. Players questioning Silver about Daryl Morey. Banners ripped…
1183866072300081200,Mon Oct 14 22:04:01 +0000 2019,RT @ZachLowe_NBA: Also ICYMI: Joint Lowe Post/Woj Podcast version of our TV special from Thursday: On the NBA's fraught China issue -- whic…
1183866026871677000,Mon Oct 14 22:03:50 +0000 2019,RT @ZachLowe_NBA: The 8th Annual League Pass Rankings:  Part 1 (Nos. 30-16): https://t.co/QrsWN2BQAw  Part 2 (top 15): https://t.co/WzZkgJg…
1183865989714382800,Mon Oct 14 22:03:41 +0000 2019,RT @Baxter: One NBA GM calls this a “very big issue.” Another GM adds, “We have a large population of vampires as it is -- add in the trave…
1183752008291012600,Mon Oct 14 14:30:46 +0000 2019,Organizing and executing something like this is not easy. Congrats to Chris on this tour so far. https://t.co/OPrZDzxBol
1183746615737311200,Mon Oct 14 14:09:20 +0000 2019,Also ICYMI: Joint Lowe Post/Woj Podcast version of our TV special from Thursday: On the NBA's fraught China issue -… https://t.co/5sJ5UjIqqh
1183745934674616300,Mon Oct 14 14:06:38 +0000 2019,The 8th Annual League Pass Rankings:  Part 1 (Nos. 30-16): https://t.co/QrsWN2BQAw  Part 2 (top 15): https://t.co/WzZkgJgO18
1183026558052831200,Sat Oct 12 14:28:05 +0000 2019,@bbstats I am merely a vessel for the algorithm.
1183026382873546800,Sat Oct 12 14:27:23 +0000 2019,@TreyToupee I included playoffs, in which case @SecondSpectrum tracking #s indicate Giannis squeaked past Rudy. I w… https://t.co/vwhVlGgdVp
1183024317816344600,Sat Oct 12 14:19:11 +0000 2019,@tomhaberstroh On a bike or some sort of vehicle?
1183013878889959400,Sat Oct 12 13:37:42 +0000 2019,The 8th Annual League Pass Rankings, Part 2 -- the top 15, including the 2019-20 League Pass Champions: https://t.co/WzZkgJgO18
1182796042632335400,Fri Oct 11 23:12:06 +0000 2019,RT @ZachLowe_NBA: ICYMI: The 8th Annual League Pass Rankings, Part 1: https://t.co/QrsWN2BQAw  Lowe Post podcast version of Woj/Lowe TV spe…
1182738116991426600,Fri Oct 11 19:21:55 +0000 2019,This clip is featured in the Indiana section of the 8th Annual League Pass Rankings, but it deserves to live its be… https://t.co/gdbCoYi1yw
1182735941414330400,Fri Oct 11 19:13:17 +0000 2019,ICYMI: The 8th Annual League Pass Rankings, Part 1: https://t.co/QrsWN2BQAw  Lowe Post podcast version of Woj/Lowe… https://t.co/tnZoFxmUY0
1182655079117131800,Fri Oct 11 13:51:58 +0000 2019,@HerringtonNBA That means even more than you know, Chris. See you soon. Enjoy the Ja and JJJ show
1182647793636302800,Fri Oct 11 13:23:01 +0000 2019,RT @ZachLowe_NBA: Lowe Post podcast: Audio version of last night's Woj/Lowe TV special -- @wojespn and I discuss the NBA's fraught China is…
1182644737158930400,Fri Oct 11 13:10:52 +0000 2019,The 8th Annual League Pass Rankings, Part 1 (hi, @BillSimmons): https://t.co/QrsWN2BQAw
1182628849663856600,Fri Oct 11 12:07:44 +0000 2019,Lowe Post podcast: Audio version of last night's Woj/Lowe TV special -- @wojespn and I discuss the NBA's fraught Ch… https://t.co/H46TBZ8FOC
1182469150461046800,Fri Oct 11 01:33:09 +0000 2019,ESPN 2 NOW https://t.co/I2okb7lheM
1182397061280534500,Thu Oct 10 20:46:41 +0000 2019,RT @wojespn: Hey guys — we will be there. Tonight, ESPN2 https://t.co/iFIexO4d5N
1182321849767792600,Thu Oct 10 15:47:50 +0000 2019,@minakimes Congrats, Mina!!
1182238194005368800,Thu Oct 10 10:15:25 +0000 2019,RT @Rachel__Nichols: The Lakers-Nets game is still on for tonight, but the Chinese government has stipulated there will be no media availab…
1181938594262536200,Wed Oct 09 14:24:54 +0000 2019,RT @Rachel__Nichols: The latest from Shanghai - players are getting frustrated, and no one knows if Thursday's Lakers-Nets game is really g…
1181934943217373200,Wed Oct 09 14:10:24 +0000 2019,RT @ZachLowe_NBA: Lowe Post podcast: @mcten takes us inside his story of how the Anthony Davis trade happened, what's at stake for AD in L.…
1181887032144121900,Wed Oct 09 11:00:01 +0000 2019,RT @mcten: An NBA spokesman just announced that given the fluidity of the situation, today’s media availability has been postponed
1181886948861980700,Wed Oct 09 10:59:41 +0000 2019,RT @Rachel__Nichols: All over Shanghai, they’re taking down banners and signs for the NBA in general, and for Thursday’s Lakers-Nets game s…
1181837882262204400,Wed Oct 09 07:44:43 +0000 2019,RT @Rachel__Nichols: Just like with the Nets yesterday, the Lakers have now had their NBA Cares event canceled here in Shanghai today. The…
